  1   0.000000 192.168.42.196 -> 192.150.16.117 TCP 74 49009 > http [SYN] Seq=0 Win=14600 Len=0 MSS=1460 SACK_PERM=1 TSval=44591891 TSecr=0 WS=128  tcp.stream == 0
  2   0.207581 192.168.42.196 -> 192.150.16.117 TCP 74 49010 > http [SYN] Seq=0 Win=14600 Len=0 MSS=1460 SACK_PERM=1 TSval=44591943 TSecr=0 WS=128  tcp.stream == 1
  3   1.819825 192.150.16.117 -> 192.168.42.196 TCP 66 http > 49009 [SYN, ACK] Seq=0 Ack=1 Win=65535 Len=0 MSS=1260 WS=4 SACK_PERM=1  tcp.stream == 0
  4   1.819855 192.168.42.196 -> 192.150.16.117 TCP 54 49009 > http [ACK] Seq=1 Ack=1 Win=14720 Len=0  tcp.stream == 0
  5   1.827876 192.168.42.196 -> 192.150.16.117 HTTP 449 GET / HTTP/1.1   tcp.stream == 0
  6   1.959811 192.150.16.117 -> 192.168.42.196 TCP 54 [TCP Window Update] http > 49009 [ACK] Seq=1 Ack=1 Win=200000 Len=0  tcp.stream == 0
  7   1.959827 192.150.16.117 -> 192.168.42.196 TCP 66 http > 49010 [SYN, ACK] Seq=0 Ack=1 Win=65535 Len=0 MSS=1260 WS=4 SACK_PERM=1  tcp.stream == 1
  8   1.959840 192.168.42.196 -> 192.150.16.117 TCP 54 49010 > http [ACK] Seq=1 Ack=1 Win=14720 Len=0  tcp.stream == 1
  9   2.069683 192.150.16.117 -> 192.168.42.196 TCP 54 [TCP Window Update] http > 49010 [ACK] Seq=1 Ack=1 Win=200000 Len=0  tcp.stream == 1
 10   2.089546 192.150.16.117 -> 192.168.42.196 TCP 54 http > 49009 [ACK] Seq=1 Ack=396 Win=200000 Len=0  tcp.stream == 0
 11   2.219556 192.150.16.117 -> 192.168.42.196 HTTP 491 HTTP/1.1 301 Moved Permanently  (text/html)  tcp.stream == 0
 12   2.219576 192.168.42.196 -> 192.150.16.117 TCP 54 49009 > http [ACK] Seq=396 Ack=438 Win=15744 Len=0  tcp.stream == 0
 13   2.238567 192.168.42.196 -> 192.150.16.117 TCP 54 49009 > http [FIN, ACK] Seq=396 Ack=438 Win=15744 Len=0  tcp.stream == 0
 15   2.349839 192.150.16.117 -> 192.168.42.196 TCP 54 http > 49009 [ACK] Seq=438 Ack=397 Win=200000 Len=0  tcp.stream == 0
 16   2.349855 192.150.16.117 -> 192.168.42.196 TCP 54 http > 49009 [FIN, ACK] Seq=438 Ack=397 Win=200000 Len=0  tcp.stream == 0
 17   2.349862 192.168.42.196 -> 192.150.16.117 TCP 54 49009 > http [ACK] Seq=397 Ack=439 Win=15744 Len=0  tcp.stream == 0
 23   2.864736 192.168.42.196 -> 192.150.16.64 TCP 74 41180 > http [SYN] Seq=0 Win=14600 Len=0 MSS=1460 SACK_PERM=1 TSval=44592607 TSecr=0 WS=128  tcp.stream == 2
 24   2.979797 192.150.16.64 -> 192.168.42.196 TCP 66 http > 41180 [SYN, ACK] Seq=0 Ack=1 Win=65535 Len=0 MSS=1260 WS=4 SACK_PERM=1  tcp.stream == 2
 25   2.979829 192.168.42.196 -> 192.150.16.64 TCP 54 41180 > http [ACK] Seq=1 Ack=1 Win=14720 Len=0  tcp.stream == 2
 26   2.981968 192.168.42.196 -> 192.150.16.64 HTTP 453 GET / HTTP/1.1   tcp.stream == 2
 27   3.091916 192.150.16.64 -> 192.168.42.196 TCP 54 [TCP Window Update] http > 41180 [ACK] Seq=1 Ack=1 Win=200000 Len=0  tcp.stream == 2
 28   3.239691 192.150.16.64 -> 192.168.42.196 TCP 54 http > 41180 [ACK] Seq=1 Ack=400 Win=200000 Len=0  tcp.stream == 2
 29   3.340920 192.150.16.64 -> 192.168.42.196 TCP 1314 [TCP segment of a reassembled PDU]  tcp.stream == 2
 30   3.340939 192.168.42.196 -> 192.150.16.64 TCP 54 41180 > http [ACK] Seq=400 Ack=1261 Win=17152 Len=0  tcp.stream == 2
 31   3.340946 192.150.16.64 -> 192.168.42.196 TCP 1314 [TCP segment of a reassembled PDU]  tcp.stream == 2
 32   3.340948 192.168.42.196 -> 192.150.16.64 TCP 54 41180 > http [ACK] Seq=400 Ack=2521 Win=19712 Len=0  tcp.stream == 2
 33   3.350664 192.150.16.64 -> 192.168.42.196 TCP 1314 [TCP segment of a reassembled PDU]  tcp.stream == 2
 34   3.350684 192.168.42.196 -> 192.150.16.64 TCP 54 41180 > http [ACK] Seq=400 Ack=3781 Win=22272 Len=0  tcp.stream == 2
 35   3.350691 192.150.16.64 -> 192.168.42.196 TCP 1314 [TCP segment of a reassembled PDU]  tcp.stream == 2
 36   3.350694 192.168.42.196 -> 192.150.16.64 TCP 54 41180 > http [ACK] Seq=400 Ack=5041 Win=24704 Len=0  tcp.stream == 2
 37   3.359784 192.150.16.64 -> 192.168.42.196 TCP 1314 [TCP segment of a reassembled PDU]  tcp.stream == 2
 38   3.359804 192.168.42.196 -> 192.150.16.64 TCP 54 41180 > http [ACK] Seq=400 Ack=6301 Win=27264 Len=0  tcp.stream == 2
 39   3.369910 192.150.16.64 -> 192.168.42.196 TCP 1314 [TCP segment of a reassembled PDU]  tcp.stream == 2
 40   3.369928 192.168.42.196 -> 192.150.16.64 TCP 54 41180 > http [ACK] Seq=400 Ack=7561 Win=29824 Len=0  tcp.stream == 2
 41   3.370022 192.150.16.64 -> 192.168.42.196 TCP 686 [TCP segment of a reassembled PDU]  tcp.stream == 2
 42   3.370027 192.168.42.196 -> 192.150.16.64 TCP 54 41180 > http [ACK] Seq=400 Ack=8193 Win=32256 Len=0  tcp.stream == 2
 43   3.379786 192.150.16.64 -> 192.168.42.196 TCP 1314 [TCP segment of a reassembled PDU]  tcp.stream == 2
 44   3.379811 192.168.42.196 -> 192.150.16.64 TCP 54 41180 > http [ACK] Seq=400 Ack=9453 Win=34816 Len=0  tcp.stream == 2
 45   3.379898 192.150.16.64 -> 192.168.42.196 HTTP 1130 HTTP/1.1 200 OK  (text/html)  tcp.stream == 2
 46   3.379903 192.168.42.196 -> 192.150.16.64 TCP 54 41180 > http [ACK] Seq=400 Ack=10529 Win=37376 Len=0  tcp.stream == 2
 47   3.389374 192.168.42.196 -> 192.150.16.64 TCP 54 41180 > http [FIN, ACK] Seq=400 Ack=10529 Win=37376 Len=0  tcp.stream == 2
 48   3.499540 192.150.16.64 -> 192.168.42.196 TCP 54 http > 41180 [ACK] Seq=10529 Ack=401 Win=200000 Len=0  tcp.stream == 2
 49   3.499559 192.150.16.64 -> 192.168.42.196 TCP 54 http > 41180 [FIN, ACK] Seq=10529 Ack=401 Win=200000 Len=0  tcp.stream == 2
 50   3.499566 192.168.42.196 -> 192.150.16.64 TCP 54 41180 > http [ACK] Seq=401 Ack=10530 Win=37376 Len=0  tcp.stream == 2
 51   3.690178 192.168.42.196 -> 192.150.16.64 TCP 74 41181 > http [SYN] Seq=0 Win=14600 Len=0 MSS=1460 SACK_PERM=1 TSval=44592813 TSecr=0 WS=128  tcp.stream == 3
 53   3.762184 192.168.42.196 -> 192.150.16.64 TCP 74 41182 > http [SYN] Seq=0 Win=14600 Len=0 MSS=1460 SACK_PERM=1 TSval=44592831 TSecr=0 WS=128  tcp.stream == 4
 54   3.796092 192.168.42.196 -> 192.150.16.64 TCP 74 41183 > http [SYN] Seq=0 Win=14600 Len=0 MSS=1460 SACK_PERM=1 TSval=44592840 TSecr=0 WS=128  tcp.stream == 5
 55   3.799656 192.150.16.64 -> 192.168.42.196 TCP 66 http > 41181 [SYN, ACK] Seq=0 Ack=1 Win=65535 Len=0 MSS=1260 WS=4 SACK_PERM=1  tcp.stream == 3
 56   3.799678 192.168.42.196 -> 192.150.16.64 TCP 54 41181 > http [ACK] Seq=1 Ack=1 Win=14720 Len=0  tcp.stream == 3
 57   3.807105 192.168.42.196 -> 192.150.16.64 HTTP 512 GET /homepage/include/style/homepage-120911-touch-challenger3-light-short.css HTTP/1.1   tcp.stream == 3
 58   3.879663 192.150.16.64 -> 192.168.42.196 TCP 66 http > 41182 [SYN, ACK] Seq=0 Ack=1 Win=65535 Len=0 MSS=1260 WS=4 SACK_PERM=1  tcp.stream == 4
 59   3.879688 192.168.42.196 -> 192.150.16.64 TCP 54 41182 > http [ACK] Seq=1 Ack=1 Win=14720 Len=0  tcp.stream == 4
 60   3.885659 192.168.42.196 -> 192.150.16.64 HTTP 476 GET /etc/pagetables/reflowtypes/adobe.css HTTP/1.1   tcp.stream == 4
 63   3.929661 192.150.16.64 -> 192.168.42.196 TCP 54 [TCP Window Update] http > 41181 [ACK] Seq=1 Ack=1 Win=200000 Len=0  tcp.stream == 3
 64   3.929679 192.150.16.64 -> 192.168.42.196 TCP 66 http > 41183 [SYN, ACK] Seq=0 Ack=1 Win=65535 Len=0 MSS=1260 WS=4 SACK_PERM=1  tcp.stream == 5
 65   3.929691 192.168.42.196 -> 192.150.16.64 TCP 54 41183 > http [ACK] Seq=1 Ack=1 Win=14720 Len=0  tcp.stream == 5
 66   3.934289 192.168.42.196 -> 192.150.16.64 HTTP 449 GET /uber/js/omniture/mbox.js HTTP/1.1   tcp.stream == 5
 67   3.999659 192.150.16.64 -> 192.168.42.196 TCP 54 [TCP Window Update] http > 41182 [ACK] Seq=1 Ack=1 Win=200000 Len=0  tcp.stream == 4
 68   4.039408 192.150.16.64 -> 192.168.42.196 TCP 54 [TCP Window Update] http > 41183 [ACK] Seq=1 Ack=1 Win=200000 Len=0  tcp.stream == 5
 69   4.089409 192.150.16.64 -> 192.168.42.196 TCP 54 http > 41181 [ACK] Seq=1 Ack=459 Win=200000 Len=0  tcp.stream == 3
 70   4.099682 192.150.16.64 -> 192.168.42.196 HTTP 426 HTTP/1.1 200 OK  (text/css)  tcp.stream == 4
 71   4.099727 192.168.42.196 -> 192.150.16.64 TCP 54 41182 > http [ACK] Seq=423 Ack=373 Win=15744 Len=0  tcp.stream == 4
 72   4.105203 192.168.42.196 -> 192.150.16.64 TCP 54 41182 > http [FIN, ACK] Seq=423 Ack=373 Win=15744 Len=0  tcp.stream == 4
 75   4.118356 192.168.42.196 -> 192.150.16.64 TCP 74 41184 > http [SYN] Seq=0 Win=14600 Len=0 MSS=1460 SACK_PERM=1 TSval=44592920 TSecr=0 WS=128  tcp.stream == 6
 76   4.169911 192.150.16.64 -> 192.168.42.196 TCP 1314 [TCP segment of a reassembled PDU]  tcp.stream == 3
 77   4.169933 192.168.42.196 -> 192.150.16.64 TCP 54 41181 > http [ACK] Seq=459 Ack=1261 Win=17152 Len=0  tcp.stream == 3
 78   4.180281 192.150.16.64 -> 192.168.42.196 TCP 1314 [TCP segment of a reassembled PDU]  tcp.stream == 3
 79   4.180303 192.168.42.196 -> 192.150.16.64 TCP 54 41181 > http [ACK] Seq=459 Ack=2521 Win=19712 Len=0  tcp.stream == 3
 80   4.180309 192.150.16.64 -> 192.168.42.196 TCP 1314 [TCP segment of a reassembled PDU]  tcp.stream == 3
 81   4.180312 192.168.42.196 -> 192.150.16.64 TCP 54 41181 > http [ACK] Seq=459 Ack=3781 Win=22272 Len=0  tcp.stream == 3
 82   4.190032 192.150.16.64 -> 192.168.42.196 TCP 1314 [TCP segment of a reassembled PDU]  tcp.stream == 3
 83   4.190053 192.168.42.196 -> 192.150.16.64 TCP 54 41181 > http [ACK] Seq=459 Ack=5041 Win=24704 Len=0  tcp.stream == 3
 84   4.190059 192.150.16.64 -> 192.168.42.196 TCP 1314 [TCP segment of a reassembled PDU]  tcp.stream == 3
 85   4.190061 192.168.42.196 -> 192.150.16.64 TCP 54 41181 > http [ACK] Seq=459 Ack=6301 Win=27264 Len=0  tcp.stream == 3
 86   4.202781 192.150.16.64 -> 192.168.42.196 TCP 1314 [TCP segment of a reassembled PDU]  tcp.stream == 3
 87   4.202802 192.168.42.196 -> 192.150.16.64 TCP 54 41181 > http [ACK] Seq=459 Ack=7561 Win=29824 Len=0  tcp.stream == 3
 88   4.202893 192.150.16.64 -> 192.168.42.196 TCP 954 [TCP segment of a reassembled PDU]  tcp.stream == 3
 89   4.202899 192.168.42.196 -> 192.150.16.64 TCP 54 41181 > http [ACK] Seq=459 Ack=8461 Win=32256 Len=0  tcp.stream == 3
 90   4.212153 192.150.16.64 -> 192.168.42.196 TCP 1314 [TCP segment of a reassembled PDU]  tcp.stream == 3
 91   4.212173 192.168.42.196 -> 192.150.16.64 TCP 54 41181 > http [ACK] Seq=459 Ack=9721 Win=34816 Len=0  tcp.stream == 3
 92   4.212272 192.150.16.64 -> 192.168.42.196 TCP 542 [TCP segment of a reassembled PDU]  tcp.stream == 3
 93   4.212278 192.168.42.196 -> 192.150.16.64 TCP 54 41181 > http [ACK] Seq=459 Ack=10209 Win=37376 Len=0  tcp.stream == 3
 94   4.212281 192.150.16.64 -> 192.168.42.196 TCP 54 http > 41183 [ACK] Seq=1 Ack=396 Win=200000 Len=0  tcp.stream == 5
 95   4.212287 192.150.16.64 -> 192.168.42.196 TCP 1314 [TCP segment of a reassembled PDU]  tcp.stream == 3
 96   4.212294 192.168.42.196 -> 192.150.16.64 TCP 54 41181 > http [ACK] Seq=459 Ack=11469 Win=39808 Len=0  tcp.stream == 3
 97   4.212392 192.150.16.64 -> 192.168.42.196 TCP 1314 [TCP segment of a reassembled PDU]  tcp.stream == 3
 98   4.212397 192.168.42.196 -> 192.150.16.64 TCP 54 41181 > http [ACK] Seq=459 Ack=12729 Win=42368 Len=0  tcp.stream == 3
 99   4.230780 192.150.16.64 -> 192.168.42.196 TCP 1314 [TCP segment of a reassembled PDU]  tcp.stream == 3
100   4.230800 192.168.42.196 -> 192.150.16.64 TCP 54 41181 > http [ACK] Seq=459 Ack=13989 Win=44928 Len=0  tcp.stream == 3
101   4.230807 192.150.16.64 -> 192.168.42.196 TCP 1314 [TCP segment of a reassembled PDU]  tcp.stream == 5
102   4.230810 192.168.42.196 -> 192.150.16.64 TCP 54 41183 > http [ACK] Seq=396 Ack=1261 Win=17152 Len=0  tcp.stream == 5
103   4.230892 192.150.16.64 -> 192.168.42.196 TCP 1314 [TCP segment of a reassembled PDU]  tcp.stream == 5
104   4.230898 192.168.42.196 -> 192.150.16.64 TCP 54 41183 > http [ACK] Seq=396 Ack=2521 Win=19712 Len=0  tcp.stream == 5
105   4.241656 192.150.16.64 -> 192.168.42.196 TCP 1314 [TCP segment of a reassembled PDU]  tcp.stream == 5
106   4.241675 192.168.42.196 -> 192.150.16.64 TCP 54 41183 > http [ACK] Seq=396 Ack=3781 Win=22272 Len=0  tcp.stream == 5
107   4.241682 192.150.16.64 -> 192.168.42.196 TCP 1314 [TCP segment of a reassembled PDU]  tcp.stream == 5
108   4.241686 192.168.42.196 -> 192.150.16.64 TCP 54 41183 > http [ACK] Seq=396 Ack=5041 Win=24704 Len=0  tcp.stream == 5
109   4.250781 192.150.16.64 -> 192.168.42.196 TCP 1314 [TCP segment of a reassembled PDU]  tcp.stream == 5
110   4.250801 192.168.42.196 -> 192.150.16.64 TCP 54 41183 > http [ACK] Seq=396 Ack=6301 Win=27264 Len=0  tcp.stream == 5
111   4.261656 192.150.16.64 -> 192.168.42.196 TCP 1314 [TCP segment of a reassembled PDU]  tcp.stream == 5
112   4.261677 192.168.42.196 -> 192.150.16.64 TCP 54 41183 > http [ACK] Seq=396 Ack=7561 Win=29824 Len=0  tcp.stream == 5
113   4.261685 192.150.16.64 -> 192.168.42.196 TCP 1314 [TCP segment of a reassembled PDU]  tcp.stream == 5
114   4.261689 192.168.42.196 -> 192.150.16.64 TCP 54 41183 > http [ACK] Seq=396 Ack=8821 Win=32256 Len=0  tcp.stream == 5
115   4.269785 192.150.16.64 -> 192.168.42.196 HTTP 405 HTTP/1.1 200 OK  (application/x-javascript)  tcp.stream == 5
116   4.269805 192.168.42.196 -> 192.150.16.64 TCP 54 41183 > http [ACK] Seq=396 Ack=9172 Win=34816 Len=0  tcp.stream == 5
117   4.269812 192.150.16.64 -> 192.168.42.196 TCP 54 http > 41182 [ACK] Seq=373 Ack=424 Win=200000 Len=0  tcp.stream == 4
118   4.269819 192.150.16.64 -> 192.168.42.196 TCP 54 http > 41182 [FIN, ACK] Seq=373 Ack=424 Win=200000 Len=0  tcp.stream == 4
119   4.269822 192.168.42.196 -> 192.150.16.64 TCP 54 41182 > http [ACK] Seq=424 Ack=374 Win=15744 Len=0  tcp.stream == 4
120   4.269828 192.150.16.64 -> 192.168.42.196 TCP 66 http > 41184 [SYN, ACK] Seq=0 Ack=1 Win=65535 Len=0 MSS=1260 WS=4 SACK_PERM=1  tcp.stream == 6
121   4.269835 192.168.42.196 -> 192.150.16.64 TCP 54 41184 > http [ACK] Seq=1 Ack=1 Win=14720 Len=0  tcp.stream == 6
122   4.277112 192.168.42.196 -> 192.150.16.64 TCP 54 41183 > http [FIN, ACK] Seq=396 Ack=9172 Win=34816 Len=0  tcp.stream == 5
123   4.280301 192.168.42.196 -> 192.150.16.64 HTTP 480 GET /include/style/grid-narrow-compressed.css HTTP/1.1   tcp.stream == 6
124   4.290030 192.150.16.64 -> 192.168.42.196 TCP 1314 [TCP segment of a reassembled PDU]  tcp.stream == 3
125   4.290050 192.168.42.196 -> 192.150.16.64 TCP 54 41181 > http [ACK] Seq=459 Ack=15249 Win=47360 Len=0  tcp.stream == 3
126   4.302031 192.150.16.64 -> 192.168.42.196 TCP 1314 [TCP segment of a reassembled PDU]  tcp.stream == 3
127   4.302051 192.168.42.196 -> 192.150.16.64 TCP 54 41181 > http [ACK] Seq=459 Ack=16509 Win=49920 Len=0  tcp.stream == 3
128   4.302058 192.150.16.64 -> 192.168.42.196 TCP 1314 [TCP segment of a reassembled PDU]  tcp.stream == 3
129   4.302061 192.168.42.196 -> 192.150.16.64 TCP 54 41181 > http [ACK] Seq=459 Ack=17769 Win=52480 Len=0  tcp.stream == 3
130   4.309903 192.150.16.64 -> 192.168.42.196 TCP 1314 [TCP segment of a reassembled PDU]  tcp.stream == 3
131   4.309925 192.168.42.196 -> 192.150.16.64 TCP 54 41181 > http [ACK] Seq=459 Ack=19029 Win=55040 Len=0  tcp.stream == 3
132   4.310016 192.150.16.64 -> 192.168.42.196 TCP 1314 [TCP segment of a reassembled PDU]  tcp.stream == 3
133   4.310022 192.168.42.196 -> 192.150.16.64 TCP 54 41181 > http [ACK] Seq=459 Ack=20289 Win=57472 Len=0  tcp.stream == 3
134   4.319654 192.150.16.64 -> 192.168.42.196 TCP 1314 [TCP segment of a reassembled PDU]  tcp.stream == 3
135   4.319674 192.168.42.196 -> 192.150.16.64 TCP 54 41181 > http [ACK] Seq=459 Ack=21549 Win=60032 Len=0  tcp.stream == 3
136   4.319681 192.150.16.64 -> 192.168.42.196 HTTP 283 HTTP/1.1 200 OK  (text/css)  tcp.stream == 3
137   4.319683 192.168.42.196 -> 192.150.16.64 TCP 54 41181 > http [ACK] Seq=459 Ack=21778 Win=62592 Len=0  tcp.stream == 3
138   4.321973 192.168.42.196 -> 192.150.16.64 TCP 54 41181 > http [FIN, ACK] Seq=459 Ack=21778 Win=62592 Len=0  tcp.stream == 3
140   4.374279 192.168.42.196 -> 18.7.20.71   TCP 74 50630 > http [SYN] Seq=0 Win=14600 Len=0 MSS=1460 SACK_PERM=1 TSval=44592984 TSecr=0 WS=128  tcp.stream == 7
141   4.374770 192.168.42.196 -> 18.7.20.71   TCP 74 50631 > http [SYN] Seq=0 Win=14600 Len=0 MSS=1460 SACK_PERM=1 TSval=44592984 TSecr=0 WS=128  tcp.stream == 8
142   4.375194 192.168.42.196 -> 18.7.20.71   TCP 74 50632 > http [SYN] Seq=0 Win=14600 Len=0 MSS=1460 SACK_PERM=1 TSval=44592984 TSecr=0 WS=128  tcp.stream == 9
143   4.375565 192.168.42.196 -> 18.7.20.71   TCP 74 50633 > http [SYN] Seq=0 Win=14600 Len=0 MSS=1460 SACK_PERM=1 TSval=44592985 TSecr=0 WS=128  tcp.stream == 10
144   4.376066 192.168.42.196 -> 18.7.20.71   TCP 74 50634 > http [SYN] Seq=0 Win=14600 Len=0 MSS=1460 SACK_PERM=1 TSval=44592985 TSecr=0 WS=128  tcp.stream == 11
145   4.376466 192.168.42.196 -> 18.7.20.71   TCP 74 50635 > http [SYN] Seq=0 Win=14600 Len=0 MSS=1460 SACK_PERM=1 TSval=44592985 TSecr=0 WS=128  tcp.stream == 12
146   4.389780 192.150.16.64 -> 192.168.42.196 TCP 54 [TCP Window Update] http > 41184 [ACK] Seq=1 Ack=1 Win=200000 Len=0  tcp.stream == 6
147   4.389800 192.150.16.64 -> 192.168.42.196 TCP 54 http > 41183 [ACK] Seq=9172 Ack=397 Win=200000 Len=0  tcp.stream == 5
148   4.389806 192.150.16.64 -> 192.168.42.196 TCP 54 http > 41183 [FIN, ACK] Seq=9172 Ack=397 Win=200000 Len=0  tcp.stream == 5
149   4.389813 192.168.42.196 -> 192.150.16.64 TCP 54 41183 > http [ACK] Seq=397 Ack=9173 Win=34816 Len=0  tcp.stream == 5
150   4.439531 192.150.16.64 -> 192.168.42.196 TCP 54 http > 41181 [ACK] Seq=21778 Ack=460 Win=200000 Len=0  tcp.stream == 3
151   4.439548 192.150.16.64 -> 192.168.42.196 TCP 54 http > 41181 [FIN, ACK] Seq=21778 Ack=460 Win=200000 Len=0  tcp.stream == 3
152   4.439555 192.168.42.196 -> 192.150.16.64 TCP 54 41181 > http [ACK] Seq=460 Ack=21779 Win=62592 Len=0  tcp.stream == 3
153   4.499781   18.7.20.71 -> 192.168.42.196 TCP 66 http > 50630 [SYN, ACK] Seq=0 Ack=1 Win=65535 Len=0 MSS=1260 WS=4 SACK_PERM=1  tcp.stream == 7
154   4.499811 192.168.42.196 -> 18.7.20.71   TCP 54 50630 > http [ACK] Seq=1 Ack=1 Win=14720 Len=0  tcp.stream == 7
155   4.499839 192.150.16.64 -> 192.168.42.196 HTTP 646 HTTP/1.1 200 OK  (text/css)  tcp.stream == 6
156   4.499848 192.168.42.196 -> 192.150.16.64 TCP 54 41184 > http [ACK] Seq=427 Ack=593 Win=15872 Len=0  tcp.stream == 6
157   4.505944 192.168.42.196 -> 18.7.20.71   HTTP 488 GET /www.adobe.com/include/style/compressed.css HTTP/1.1   tcp.stream == 7
158   4.509283 192.168.42.196 -> 192.150.16.64 TCP 54 41184 > http [FIN, ACK] Seq=427 Ack=593 Win=15872 Len=0  tcp.stream == 6
159   4.509646   18.7.20.71 -> 192.168.42.196 TCP 66 http > 50631 [SYN, ACK] Seq=0 Ack=1 Win=65535 Len=0 MSS=1260 WS=4 SACK_PERM=1  tcp.stream == 8
160   4.509672 192.168.42.196 -> 18.7.20.71   TCP 54 50631 > http [ACK] Seq=1 Ack=1 Win=14720 Len=0  tcp.stream == 8
161   4.513327 192.168.42.196 -> 18.7.20.71   HTTP 503 GET /www.adobe.com/homepage/include/style/default/Mnemonic.css HTTP/1.1   tcp.stream == 8
162   4.520537   18.7.20.71 -> 192.168.42.196 TCP 66 http > 50632 [SYN, ACK] Seq=0 Ack=1 Win=65535 Len=0 MSS=1260 WS=4 SACK_PERM=1  tcp.stream == 9
163   4.520561 192.168.42.196 -> 18.7.20.71   TCP 54 50632 > http [ACK] Seq=1 Ack=1 Win=14720 Len=0  tcp.stream == 9
164   4.520568   18.7.20.71 -> 192.168.42.196 TCP 66 http > 50633 [SYN, ACK] Seq=0 Ack=1 Win=65535 Len=0 MSS=1260 WS=4 SACK_PERM=1  tcp.stream == 10
165   4.520573 192.168.42.196 -> 18.7.20.71   TCP 54 50633 > http [ACK] Seq=1 Ack=1 Win=14720 Len=0  tcp.stream == 10
166   4.520582   18.7.20.71 -> 192.168.42.196 TCP 66 http > 50635 [SYN, ACK] Seq=0 Ack=1 Win=65535 Len=0 MSS=1260 WS=4 SACK_PERM=1  tcp.stream == 12
167   4.520587 192.168.42.196 -> 18.7.20.71   TCP 54 50635 > http [ACK] Seq=1 Ack=1 Win=14720 Len=0  tcp.stream == 12
168   4.520592   18.7.20.71 -> 192.168.42.196 TCP 66 http > 50634 [SYN, ACK] Seq=0 Ack=1 Win=65535 Len=0 MSS=1260 WS=4 SACK_PERM=1  tcp.stream == 11
169   4.520596 192.168.42.196 -> 18.7.20.71   TCP 54 50634 > http [ACK] Seq=1 Ack=1 Win=14720 Len=0  tcp.stream == 11
170   4.525002 192.168.42.196 -> 18.7.20.71   HTTP 502 GET /www.adobe.com/homepage/include/style/grid/LayoutGrid.css HTTP/1.1   tcp.stream == 12
171   4.526160 192.168.42.196 -> 18.7.20.71   HTTP 503 GET /www.adobe.com/homepage/include/style/grid/ThreeColumn.css HTTP/1.1   tcp.stream == 11
172   4.527151 192.168.42.196 -> 18.7.20.71   HTTP 497 GET /www.adobe.com/include/style/default/SearchBuddy.css HTTP/1.1   tcp.stream == 10
173   4.528119 192.168.42.196 -> 18.7.20.71   HTTP 511 GET /www.adobe.com/include/style/theme/adobe-light/jquery-ui-1.8.1.css HTTP/1.1   tcp.stream == 9
174   4.669791   18.7.20.71 -> 192.168.42.196 TCP 54 [TCP Window Update] http > 50630 [ACK] Seq=1 Ack=1 Win=200000 Len=0  tcp.stream == 7
175   4.669808 192.150.16.64 -> 192.168.42.196 TCP 54 http > 41184 [ACK] Seq=593 Ack=428 Win=200000 Len=0  tcp.stream == 6
176   4.669813   18.7.20.71 -> 192.168.42.196 TCP 54 [TCP Window Update] http > 50631 [ACK] Seq=1 Ack=1 Win=200000 Len=0  tcp.stream == 8
177   4.669815 192.150.16.64 -> 192.168.42.196 TCP 54 http > 41184 [FIN, ACK] Seq=593 Ack=428 Win=200000 Len=0  tcp.stream == 6
178   4.669821 192.168.42.196 -> 192.150.16.64 TCP 54 41184 > http [ACK] Seq=428 Ack=594 Win=15872 Len=0  tcp.stream == 6
179   4.692525   18.7.20.71 -> 192.168.42.196 TCP 1314 [TCP segment of a reassembled PDU]  tcp.stream == 7
180   4.692548 192.168.42.196 -> 18.7.20.71   TCP 54 50630 > http [ACK] Seq=435 Ack=1261 Win=17152 Len=0  tcp.stream == 7
181   4.692643   18.7.20.71 -> 192.168.42.196 TCP 1314 [TCP segment of a reassembled PDU]  tcp.stream == 7
182   4.692649 192.168.42.196 -> 18.7.20.71   TCP 54 50630 > http [ACK] Seq=435 Ack=2521 Win=19712 Len=0  tcp.stream == 7
183   4.692652   18.7.20.71 -> 192.168.42.196 TCP 1314 [TCP segment of a reassembled PDU]  tcp.stream == 7
184   4.692656 192.168.42.196 -> 18.7.20.71   TCP 54 50630 > http [ACK] Seq=435 Ack=3781 Win=22272 Len=0  tcp.stream == 7
185   4.692768   18.7.20.71 -> 192.168.42.196 TCP 1314 [TCP segment of a reassembled PDU]  tcp.stream == 7
186   4.692775 192.168.42.196 -> 18.7.20.71   TCP 54 50630 > http [ACK] Seq=435 Ack=5041 Win=24704 Len=0  tcp.stream == 7
187   4.692778   18.7.20.71 -> 192.168.42.196 TCP 1314 [TCP segment of a reassembled PDU]  tcp.stream == 7
188   4.692782 192.168.42.196 -> 18.7.20.71   TCP 54 50630 > http [ACK] Seq=435 Ack=6301 Win=27264 Len=0  tcp.stream == 7
189   4.700906   18.7.20.71 -> 192.168.42.196 TCP 1314 [TCP segment of a reassembled PDU]  tcp.stream == 7
190   4.700928 192.168.42.196 -> 18.7.20.71   TCP 54 50630 > http [ACK] Seq=435 Ack=7561 Win=29824 Len=0  tcp.stream == 7
191   4.700934   18.7.20.71 -> 192.168.42.196 TCP 956 [TCP segment of a reassembled PDU]  tcp.stream == 7
192   4.700937 192.168.42.196 -> 18.7.20.71   TCP 54 50630 > http [ACK] Seq=435 Ack=8463 Win=32256 Len=0  tcp.stream == 7
193   4.711523   18.7.20.71 -> 192.168.42.196 TCP 1314 [TCP segment of a reassembled PDU]  tcp.stream == 7
194   4.711544 192.168.42.196 -> 18.7.20.71   TCP 54 50630 > http [ACK] Seq=435 Ack=9723 Win=34816 Len=0  tcp.stream == 7
195   4.711551   18.7.20.71 -> 192.168.42.196 TCP 1314 [TCP segment of a reassembled PDU]  tcp.stream == 7
196   4.711553 192.168.42.196 -> 18.7.20.71   TCP 54 50630 > http [ACK] Seq=435 Ack=10983 Win=37376 Len=0  tcp.stream == 7
197   4.722165   18.7.20.71 -> 192.168.42.196 TCP 1314 [TCP segment of a reassembled PDU]  tcp.stream == 7
198   4.722186 192.168.42.196 -> 18.7.20.71   TCP 54 50630 > http [ACK] Seq=435 Ack=12243 Win=39808 Len=0  tcp.stream == 7
199   4.722193   18.7.20.71 -> 192.168.42.196 TCP 1314 [TCP segment of a reassembled PDU]  tcp.stream == 7
200   4.722196 192.168.42.196 -> 18.7.20.71   TCP 54 50630 > http [ACK] Seq=435 Ack=13503 Win=42368 Len=0  tcp.stream == 7
201   4.722198   18.7.20.71 -> 192.168.42.196 TCP 54 [TCP Window Update] http > 50632 [ACK] Seq=1 Ack=1 Win=200000 Len=0  tcp.stream == 9
202   4.722203   18.7.20.71 -> 192.168.42.196 TCP 54 [TCP Window Update] http > 50635 [ACK] Seq=1 Ack=1 Win=200000 Len=0  tcp.stream == 12
203   4.722205   18.7.20.71 -> 192.168.42.196 TCP 54 [TCP Window Update] http > 50634 [ACK] Seq=1 Ack=1 Win=200000 Len=0  tcp.stream == 11
204   4.722208   18.7.20.71 -> 192.168.42.196 TCP 54 [TCP Window Update] http > 50633 [ACK] Seq=1 Ack=1 Win=200000 Len=0  tcp.stream == 10
205   4.730157   18.7.20.71 -> 192.168.42.196 TCP 1314 [TCP segment of a reassembled PDU]  tcp.stream == 8
206   4.730179 192.168.42.196 -> 18.7.20.71   TCP 54 50631 > http [ACK] Seq=450 Ack=1261 Win=17152 Len=0  tcp.stream == 8
207   4.730184   18.7.20.71 -> 192.168.42.196 HTTP 368 HTTP/1.1 200 OK  (text/css)  tcp.stream == 8
208   4.730188 192.168.42.196 -> 18.7.20.71   TCP 54 50631 > http [ACK] Seq=450 Ack=1575 Win=19712 Len=0  tcp.stream == 8
209   4.730191   18.7.20.71 -> 192.168.42.196 HTTP 933 HTTP/1.1 200 OK  (text/css)  tcp.stream == 12
210   4.730196 192.168.42.196 -> 18.7.20.71   TCP 54 50635 > http [ACK] Seq=449 Ack=880 Win=16384 Len=0  tcp.stream == 12
211   4.730199   18.7.20.71 -> 192.168.42.196 HTTP 616 HTTP/1.1 200 OK  (text/css)  tcp.stream == 11
212   4.730202 192.168.42.196 -> 18.7.20.71   TCP 54 50634 > http [ACK] Seq=450 Ack=563 Win=15744 Len=0  tcp.stream == 11
213   4.739648   18.7.20.71 -> 192.168.42.196 HTTP 1156 HTTP/1.1 200 OK  (text/css)  tcp.stream == 10
214   4.739672 192.168.42.196 -> 18.7.20.71   TCP 54 50633 > http [ACK] Seq=444 Ack=1103 Win=16896 Len=0  tcp.stream == 10
215   4.761650   18.7.20.71 -> 192.168.42.196 TCP 1314 [TCP segment of a reassembled PDU]  tcp.stream == 9
216   4.761674 192.168.42.196 -> 18.7.20.71   TCP 54 50632 > http [ACK] Seq=458 Ack=1261 Win=17152 Len=0  tcp.stream == 9
217   4.761768   18.7.20.71 -> 192.168.42.196 TCP 1314 [TCP segment of a reassembled PDU]  tcp.stream == 9
218   4.761774 192.168.42.196 -> 18.7.20.71   TCP 54 50632 > http [ACK] Seq=458 Ack=2521 Win=19712 Len=0  tcp.stream == 9
219   4.761777   18.7.20.71 -> 192.168.42.196 TCP 1314 [TCP segment of a reassembled PDU]  tcp.stream == 9
220   4.761782 192.168.42.196 -> 18.7.20.71   TCP 54 50632 > http [ACK] Seq=458 Ack=3781 Win=22272 Len=0  tcp.stream == 9
221   4.761785   18.7.20.71 -> 192.168.42.196 TCP 1314 [TCP segment of a reassembled PDU]  tcp.stream == 9
222   4.761787 192.168.42.196 -> 18.7.20.71   TCP 54 50632 > http [ACK] Seq=458 Ack=5041 Win=24704 Len=0  tcp.stream == 9
223   4.770030   18.7.20.71 -> 192.168.42.196 TCP 1314 [TCP segment of a reassembled PDU]  tcp.stream == 9
224   4.770052 192.168.42.196 -> 18.7.20.71   TCP 54 50632 > http [ACK] Seq=458 Ack=6301 Win=27264 Len=0  tcp.stream == 9
225   4.770058   18.7.20.71 -> 192.168.42.196 HTTP 425 HTTP/1.1 200 OK  (text/css)  tcp.stream == 9
226   4.770062 192.168.42.196 -> 18.7.20.71   TCP 54 50632 > http [ACK] Seq=458 Ack=6672 Win=29824 Len=0  tcp.stream == 9
227   4.800713 192.168.42.196 -> 18.7.20.71   TCP 54 50635 > http [FIN, ACK] Seq=449 Ack=880 Win=16384 Len=0  tcp.stream == 12
228   4.801769 192.168.42.196 -> 18.7.20.71   TCP 74 50636 > http [SYN] Seq=0 Win=14600 Len=0 MSS=1460 SACK_PERM=1 TSval=44593091 TSecr=0 WS=128  tcp.stream == 13
229   4.802678 192.168.42.196 -> 18.7.20.71   TCP 54 50634 > http [FIN, ACK] Seq=450 Ack=563 Win=15744 Len=0  tcp.stream == 11
230   4.803396 192.168.42.196 -> 18.7.20.71   TCP 74 50637 > http [SYN] Seq=0 Win=14600 Len=0 MSS=1460 SACK_PERM=1 TSval=44593092 TSecr=0 WS=128  tcp.stream == 14
231   4.804572 192.168.42.196 -> 18.7.20.71   TCP 54 50631 > http [FIN, ACK] Seq=450 Ack=1575 Win=19712 Len=0  tcp.stream == 8
232   4.805275 192.168.42.196 -> 18.7.20.71   TCP 74 50638 > http [SYN] Seq=0 Win=14600 Len=0 MSS=1460 SACK_PERM=1 TSval=44593092 TSecr=0 WS=128  tcp.stream == 15
233   4.811026   18.7.20.71 -> 192.168.42.196 TCP 1314 [TCP segment of a reassembled PDU]  tcp.stream == 7
234   4.811045 192.168.42.196 -> 18.7.20.71   TCP 54 50630 > http [ACK] Seq=435 Ack=14763 Win=44928 Len=0  tcp.stream == 7
235   4.820901   18.7.20.71 -> 192.168.42.196 TCP 1314 [TCP segment of a reassembled PDU]  tcp.stream == 7
236   4.820923 192.168.42.196 -> 18.7.20.71   TCP 54 50630 > http [ACK] Seq=435 Ack=16023 Win=47360 Len=0  tcp.stream == 7
237   4.821015   18.7.20.71 -> 192.168.42.196 TCP 1314 [TCP segment of a reassembled PDU]  tcp.stream == 7
238   4.821021 192.168.42.196 -> 18.7.20.71   TCP 54 50630 > http [ACK] Seq=435 Ack=17283 Win=49920 Len=0  tcp.stream == 7
239   4.839774 192.168.42.196 -> 18.7.20.71   TCP 54 50633 > http [FIN, ACK] Seq=444 Ack=1103 Win=16896 Len=0  tcp.stream == 10
240   4.839897   18.7.20.71 -> 192.168.42.196 TCP 1314 [TCP segment of a reassembled PDU]  tcp.stream == 7
241   4.839908 192.168.42.196 -> 18.7.20.71   TCP 54 50630 > http [ACK] Seq=435 Ack=18543 Win=52480 Len=0  tcp.stream == 7
242   4.840605 192.168.42.196 -> 18.7.20.71   TCP 74 50639 > http [SYN] Seq=0 Win=14600 Len=0 MSS=1460 SACK_PERM=1 TSval=44593101 TSecr=0 WS=128  tcp.stream == 16
243   4.845109 192.168.42.196 -> 18.7.20.71   TCP 54 50632 > http [FIN, ACK] Seq=458 Ack=6672 Win=29824 Len=0  tcp.stream == 9
244   4.850901   18.7.20.71 -> 192.168.42.196 TCP 1314 [TCP segment of a reassembled PDU]  tcp.stream == 7
245   4.850919 192.168.42.196 -> 18.7.20.71   TCP 54 50630 > http [ACK] Seq=435 Ack=19803 Win=55040 Len=0  tcp.stream == 7
246   4.851013   18.7.20.71 -> 192.168.42.196 TCP 1314 [TCP segment of a reassembled PDU]  tcp.stream == 7
247   4.851019 192.168.42.196 -> 18.7.20.71   TCP 54 50630 > http [ACK] Seq=435 Ack=21063 Win=57472 Len=0  tcp.stream == 7
248   4.856391 192.168.42.196 -> 18.7.20.71   TCP 74 50640 > http [SYN] Seq=0 Win=14600 Len=0 MSS=1460 SACK_PERM=1 TSval=44593105 TSecr=0 WS=128  tcp.stream == 17
249   4.862525   18.7.20.71 -> 192.168.42.196 TCP 1314 [TCP segment of a reassembled PDU]  tcp.stream == 7
250   4.862548 192.168.42.196 -> 18.7.20.71   TCP 54 50630 > http [ACK] Seq=435 Ack=22323 Win=60032 Len=0  tcp.stream == 7
251   4.862642   18.7.20.71 -> 192.168.42.196 TCP 1314 [TCP segment of a reassembled PDU]  tcp.stream == 7
252   4.862647 192.168.42.196 -> 18.7.20.71   TCP 54 50630 > http [ACK] Seq=435 Ack=23583 Win=62592 Len=0  tcp.stream == 7
253   4.862650   18.7.20.71 -> 192.168.42.196 TCP 1314 [TCP segment of a reassembled PDU]  tcp.stream == 7
254   4.862653 192.168.42.196 -> 18.7.20.71   TCP 54 50630 > http [ACK] Seq=435 Ack=24843 Win=61568 Len=0  tcp.stream == 7
255   4.862656   18.7.20.71 -> 192.168.42.196 TCP 1314 [TCP segment of a reassembled PDU]  tcp.stream == 7
256   4.862658 192.168.42.196 -> 18.7.20.71   TCP 54 50630 > http [ACK] Seq=435 Ack=26103 Win=60416 Len=0  tcp.stream == 7
257   4.862762   18.7.20.71 -> 192.168.42.196 TCP 1314 [TCP segment of a reassembled PDU]  tcp.stream == 7
258   4.862768 192.168.42.196 -> 18.7.20.71   TCP 54 50630 > http [ACK] Seq=435 Ack=27363 Win=59264 Len=0  tcp.stream == 7
259   4.871153   18.7.20.71 -> 192.168.42.196 TCP 1314 [TCP segment of a reassembled PDU]  tcp.stream == 7
260   4.871172 192.168.42.196 -> 18.7.20.71   TCP 54 50630 > http [ACK] Seq=435 Ack=28623 Win=64128 Len=0  tcp.stream == 7
261   4.871180   18.7.20.71 -> 192.168.42.196 TCP 1314 [TCP segment of a reassembled PDU]  tcp.stream == 7
262   4.879776   18.7.20.71 -> 192.168.42.196 TCP 1314 [TCP segment of a reassembled PDU]  tcp.stream == 7
263   4.879797 192.168.42.196 -> 18.7.20.71   TCP 54 50630 > http [ACK] Seq=435 Ack=31143 Win=64128 Len=0  tcp.stream == 7
264   4.890156   18.7.20.71 -> 192.168.42.196 TCP 1314 [TCP segment of a reassembled PDU]  tcp.stream == 7
265   4.890172   18.7.20.71 -> 192.168.42.196 TCP 1314 [TCP segment of a reassembled PDU]  tcp.stream == 7
266   4.892334 192.168.42.196 -> 18.7.20.71   TCP 54 50630 > http [ACK] Seq=435 Ack=33663 Win=64128 Len=0  tcp.stream == 7
267   4.900030   18.7.20.71 -> 192.168.42.196 TCP 1314 [TCP segment of a reassembled PDU]  tcp.stream == 7
268   4.900046   18.7.20.71 -> 192.168.42.196 HTTP 840 HTTP/1.1 200 OK  (text/css)  tcp.stream == 7
269   4.902318 192.168.42.196 -> 18.7.20.71   TCP 54 50630 > http [ACK] Seq=435 Ack=35709 Win=64128 Len=0  tcp.stream == 7
270   4.903950 192.168.42.196 -> 18.7.20.71   TCP 54 50630 > http [FIN, ACK] Seq=435 Ack=35709 Win=64128 Len=0  tcp.stream == 7
271   4.919529   18.7.20.71 -> 192.168.42.196 TCP 54 http > 50635 [ACK] Seq=880 Ack=450 Win=200000 Len=0  tcp.stream == 12
272   4.919546   18.7.20.71 -> 192.168.42.196 TCP 54 http > 50635 [FIN, ACK] Seq=880 Ack=450 Win=200000 Len=0  tcp.stream == 12
273   4.919553 192.168.42.196 -> 18.7.20.71   TCP 54 50635 > http [ACK] Seq=450 Ack=881 Win=16384 Len=0  tcp.stream == 12
274   4.919564   18.7.20.71 -> 192.168.42.196 TCP 66 http > 50636 [SYN, ACK] Seq=0 Ack=1 Win=65535 Len=0 MSS=1260 WS=4 SACK_PERM=1  tcp.stream == 13
275   4.919583 192.168.42.196 -> 18.7.20.71   TCP 54 50636 > http [ACK] Seq=1 Ack=1 Win=14720 Len=0  tcp.stream == 13
276   4.923978 192.168.42.196 -> 18.7.20.71   HTTP 471 GET /www.adobe.com/include/script/homepage.js HTTP/1.1   tcp.stream == 13
277   4.932407   18.7.20.71 -> 192.168.42.196 TCP 54 http > 50634 [ACK] Seq=563 Ack=451 Win=200000 Len=0  tcp.stream == 11
278   4.932425   18.7.20.71 -> 192.168.42.196 TCP 66 http > 50637 [SYN, ACK] Seq=0 Ack=1 Win=65535 Len=0 MSS=1260 WS=4 SACK_PERM=1  tcp.stream == 14
279   4.932436 192.168.42.196 -> 18.7.20.71   TCP 54 50637 > http [ACK] Seq=1 Ack=1 Win=14720 Len=0  tcp.stream == 14
280   4.932449   18.7.20.71 -> 192.168.42.196 TCP 54 http > 50634 [FIN, ACK] Seq=563 Ack=451 Win=200000 Len=0  tcp.stream == 11
281   4.932455 192.168.42.196 -> 18.7.20.71   TCP 54 50634 > http [ACK] Seq=451 Ack=564 Win=15744 Len=0  tcp.stream == 11
282   4.932463   18.7.20.71 -> 192.168.42.196 TCP 66 http > 50638 [SYN, ACK] Seq=0 Ack=1 Win=65535 Len=0 MSS=1260 WS=4 SACK_PERM=1  tcp.stream == 15
283   4.932469 192.168.42.196 -> 18.7.20.71   TCP 54 50638 > http [ACK] Seq=1 Ack=1 Win=14720 Len=0  tcp.stream == 15
284   4.932472   18.7.20.71 -> 192.168.42.196 TCP 54 http > 50631 [ACK] Seq=1575 Ack=451 Win=200000 Len=0  tcp.stream == 8
285   4.932475   18.7.20.71 -> 192.168.42.196 TCP 54 http > 50631 [FIN, ACK] Seq=1575 Ack=451 Win=200000 Len=0  tcp.stream == 8
286   4.932480 192.168.42.196 -> 18.7.20.71   TCP 54 50631 > http [ACK] Seq=451 Ack=1576 Win=19712 Len=0  tcp.stream == 8
287   4.937215 192.168.42.196 -> 18.7.20.71   HTTP 477 GET /www.adobe.com/homepage/include/script/store.js HTTP/1.1   tcp.stream == 15
288   4.938297 192.168.42.196 -> 18.7.20.71   HTTP 480 GET /www.adobe.com/include/script/adobe/SearchBuddy.js HTTP/1.1   tcp.stream == 14
289   4.949777   18.7.20.71 -> 192.168.42.196 TCP 54 http > 50633 [ACK] Seq=1103 Ack=445 Win=200000 Len=0  tcp.stream == 10
290   4.949796   18.7.20.71 -> 192.168.42.196 TCP 54 http > 50633 [FIN, ACK] Seq=1103 Ack=445 Win=200000 Len=0  tcp.stream == 10
291   4.949803 192.168.42.196 -> 18.7.20.71   TCP 54 50633 > http [ACK] Seq=445 Ack=1104 Win=16896 Len=0  tcp.stream == 10
292   4.949813   18.7.20.71 -> 192.168.42.196 TCP 66 http > 50639 [SYN, ACK] Seq=0 Ack=1 Win=65535 Len=0 MSS=1260 WS=4 SACK_PERM=1  tcp.stream == 16
293   4.949825 192.168.42.196 -> 18.7.20.71   TCP 54 50639 > http [ACK] Seq=1 Ack=1 Win=14720 Len=0  tcp.stream == 16
294   4.952770 192.168.42.196 -> 18.7.20.71   HTTP 490 GET /www.adobe.com/homepage/include/script/adobe/GlobalFooter.js HTTP/1.1   tcp.stream == 16
295   4.960152   18.7.20.71 -> 192.168.42.196 TCP 54 http > 50632 [ACK] Seq=6672 Ack=459 Win=200000 Len=0  tcp.stream == 9
296   4.960169   18.7.20.71 -> 192.168.42.196 TCP 54 http > 50632 [FIN, ACK] Seq=6672 Ack=459 Win=200000 Len=0  tcp.stream == 9
297   4.960177 192.168.42.196 -> 18.7.20.71   TCP 54 50632 > http [ACK] Seq=459 Ack=6673 Win=29824 Len=0  tcp.stream == 9
298   4.969399   18.7.20.71 -> 192.168.42.196 TCP 66 http > 50640 [SYN, ACK] Seq=0 Ack=1 Win=65535 Len=0 MSS=1260 WS=4 SACK_PERM=1  tcp.stream == 17
299   4.969422 192.168.42.196 -> 18.7.20.71   TCP 54 50640 > http [ACK] Seq=1 Ack=1 Win=14720 Len=0  tcp.stream == 17
300   4.972653 192.168.42.196 -> 18.7.20.71   HTTP 474 GET /www.adobe.com/js/foresee/foresee-trigger.js HTTP/1.1   tcp.stream == 17
301   5.009526   18.7.20.71 -> 192.168.42.196 TCP 54 http > 50630 [ACK] Seq=35709 Ack=436 Win=200000 Len=0  tcp.stream == 7
302   5.031529   18.7.20.71 -> 192.168.42.196 TCP 54 http > 50630 [FIN, ACK] Seq=35709 Ack=436 Win=200000 Len=0  tcp.stream == 7
303   5.031547 192.168.42.196 -> 18.7.20.71   TCP 54 50630 > http [ACK] Seq=436 Ack=35710 Win=64128 Len=0  tcp.stream == 7
304   5.031558   18.7.20.71 -> 192.168.42.196 TCP 54 [TCP Window Update] http > 50636 [ACK] Seq=1 Ack=1 Win=200000 Len=0  tcp.stream == 13
305   5.040025   18.7.20.71 -> 192.168.42.196 TCP 54 [TCP Window Update] http > 50637 [ACK] Seq=1 Ack=1 Win=200000 Len=0  tcp.stream == 14
306   5.049525   18.7.20.71 -> 192.168.42.196 TCP 54 [TCP Window Update] http > 50638 [ACK] Seq=1 Ack=1 Win=200000 Len=0  tcp.stream == 15
307   5.061650   18.7.20.71 -> 192.168.42.196 TCP 1314 [TCP segment of a reassembled PDU]  tcp.stream == 13
308   5.061672 192.168.42.196 -> 18.7.20.71   TCP 54 50636 > http [ACK] Seq=418 Ack=1261 Win=17152 Len=0  tcp.stream == 13
309   5.080902   18.7.20.71 -> 192.168.42.196 TCP 1314 [TCP segment of a reassembled PDU]  tcp.stream == 13
310   5.080922 192.168.42.196 -> 18.7.20.71   TCP 54 50636 > http [ACK] Seq=418 Ack=2521 Win=19712 Len=0  tcp.stream == 13
311   5.080929   18.7.20.71 -> 192.168.42.196 TCP 1314 [TCP segment of a reassembled PDU]  tcp.stream == 13
312   5.080931 192.168.42.196 -> 18.7.20.71   TCP 54 50636 > http [ACK] Seq=418 Ack=3781 Win=22272 Len=0  tcp.stream == 13
313   5.102275   18.7.20.71 -> 192.168.42.196 TCP 1314 [TCP segment of a reassembled PDU]  tcp.stream == 13
314   5.102297 192.168.42.196 -> 18.7.20.71   TCP 54 50636 > http [ACK] Seq=418 Ack=5041 Win=24704 Len=0  tcp.stream == 13
315   5.102304   18.7.20.71 -> 192.168.42.196 TCP 1314 [TCP segment of a reassembled PDU]  tcp.stream == 13
316   5.102306 192.168.42.196 -> 18.7.20.71   TCP 54 50636 > http [ACK] Seq=418 Ack=6301 Win=27264 Len=0  tcp.stream == 13
317   5.102389   18.7.20.71 -> 192.168.42.196 TCP 1314 [TCP segment of a reassembled PDU]  tcp.stream == 13
318   5.102397 192.168.42.196 -> 18.7.20.71   TCP 54 50636 > http [ACK] Seq=418 Ack=7561 Win=29824 Len=0  tcp.stream == 13
319   5.102400   18.7.20.71 -> 192.168.42.196 TCP 933 [TCP segment of a reassembled PDU]  tcp.stream == 13
320   5.102402 192.168.42.196 -> 18.7.20.71   TCP 54 50636 > http [ACK] Seq=418 Ack=8440 Win=32256 Len=0  tcp.stream == 13
321   5.111152   18.7.20.71 -> 192.168.42.196 TCP 1314 [TCP segment of a reassembled PDU]  tcp.stream == 13
322   5.111173 192.168.42.196 -> 18.7.20.71   TCP 54 50636 > http [ACK] Seq=418 Ack=9700 Win=34816 Len=0  tcp.stream == 13
323   5.111180   18.7.20.71 -> 192.168.42.196 TCP 1314 [TCP segment of a reassembled PDU]  tcp.stream == 13
324   5.111182 192.168.42.196 -> 18.7.20.71   TCP 54 50636 > http [ACK] Seq=418 Ack=10960 Win=37376 Len=0  tcp.stream == 13
325   5.121652   18.7.20.71 -> 192.168.42.196 TCP 1314 [TCP segment of a reassembled PDU]  tcp.stream == 13
326   5.121673 192.168.42.196 -> 18.7.20.71   TCP 54 50636 > http [ACK] Seq=418 Ack=12220 Win=39808 Len=0  tcp.stream == 13
327   5.121766   18.7.20.71 -> 192.168.42.196 TCP 1314 [TCP segment of a reassembled PDU]  tcp.stream == 13
328   5.121772 192.168.42.196 -> 18.7.20.71   TCP 54 50636 > http [ACK] Seq=418 Ack=13480 Win=42368 Len=0  tcp.stream == 13
329   5.121775   18.7.20.71 -> 192.168.42.196 TCP 1314 [TCP segment of a reassembled PDU]  tcp.stream == 15
330   5.121781 192.168.42.196 -> 18.7.20.71   TCP 54 50638 > http [ACK] Seq=424 Ack=1261 Win=17152 Len=0  tcp.stream == 15
331   5.121783   18.7.20.71 -> 192.168.42.196 HTTP 419 HTTP/1.1 200 OK  (application/x-javascript)  tcp.stream == 15
332   5.121785 192.168.42.196 -> 18.7.20.71   TCP 54 50638 > http [ACK] Seq=424 Ack=1626 Win=19712 Len=0  tcp.stream == 15
333   5.121787   18.7.20.71 -> 192.168.42.196 TCP 54 [TCP Window Update] http > 50639 [ACK] Seq=1 Ack=1 Win=200000 Len=0  tcp.stream == 16
334   5.130654 192.168.42.196 -> 18.7.20.71   TCP 54 50638 > http [FIN, ACK] Seq=424 Ack=1626 Win=19712 Len=0  tcp.stream == 15
335   5.131015   18.7.20.71 -> 192.168.42.196 TCP 1314 [TCP segment of a reassembled PDU]  tcp.stream == 14
