  1   0.000000 192.168.42.196 -> 205.188.101.58 TCP 74 41147 > http [SYN] Seq=0 Win=14600 Len=0 MSS=1460 SACK_PERM=1 TSval=44518421 TSecr=0 WS=128  tcp.stream == 0
  2   0.214285 192.168.42.196 -> 205.188.101.58 TCP 74 41148 > http [SYN] Seq=0 Win=14600 Len=0 MSS=1460 SACK_PERM=1 TSval=44518475 TSecr=0 WS=128  tcp.stream == 1
  3   2.023621 205.188.101.58 -> 192.168.42.196 TCP 66 http > 41147 [SYN, ACK] Seq=0 Ack=1 Win=65535 Len=0 MSS=1260 WS=4 SACK_PERM=1  tcp.stream == 0
  4   2.023649 192.168.42.196 -> 205.188.101.58 TCP 54 41147 > http [ACK] Seq=1 Ack=1 Win=14720 Len=0  tcp.stream == 0
  5   2.029694 192.168.42.196 -> 205.188.101.58 HTTP 447 GET / HTTP/1.1   tcp.stream == 0
  6   2.134464 205.188.101.58 -> 192.168.42.196 TCP 66 http > 41148 [SYN, ACK] Seq=0 Ack=1 Win=65535 Len=0 MSS=1260 WS=4 SACK_PERM=1  tcp.stream == 1
  7   2.134486 192.168.42.196 -> 205.188.101.58 TCP 54 41148 > http [ACK] Seq=1 Ack=1 Win=14720 Len=0  tcp.stream == 1
  8   2.173585 205.188.101.58 -> 192.168.42.196 TCP 54 [TCP Window Update] http > 41147 [ACK] Seq=1 Ack=1 Win=200000 Len=0  tcp.stream == 0
  9   2.283591 205.188.101.58 -> 192.168.42.196 HTTP 486 HTTP/1.1 301 Moved Permanently  (text/html)  tcp.stream == 0
 10   2.283611 192.168.42.196 -> 205.188.101.58 TCP 54 41147 > http [ACK] Seq=394 Ack=433 Win=15744 Len=0  tcp.stream == 0
 11   2.293320 205.188.101.58 -> 192.168.42.196 TCP 54 [TCP Window Update] http > 41148 [ACK] Seq=1 Ack=1 Win=200000 Len=0  tcp.stream == 1
 12   2.295411 192.168.42.196 -> 205.188.101.58 TCP 54 41147 > http [FIN, ACK] Seq=394 Ack=433 Win=15744 Len=0  tcp.stream == 0
 14   2.423340 205.188.101.58 -> 192.168.42.196 TCP 54 http > 41147 [ACK] Seq=433 Ack=395 Win=200000 Len=0  tcp.stream == 0
 15   2.423355 205.188.101.58 -> 192.168.42.196 TCP 54 http > 41147 [FIN, ACK] Seq=433 Ack=395 Win=200000 Len=0  tcp.stream == 0
 16   2.423362 192.168.42.196 -> 205.188.101.58 TCP 54 41147 > http [ACK] Seq=395 Ack=434 Win=15744 Len=0  tcp.stream == 0
 22   2.967805 192.168.42.196 -> 205.188.14.163 TCP 74 36526 > http [SYN] Seq=0 Win=14600 Len=0 MSS=1460 SACK_PERM=1 TSval=44519163 TSecr=0 WS=128  tcp.stream == 2
 23   3.113962 205.188.14.163 -> 192.168.42.196 TCP 66 http > 36526 [SYN, ACK] Seq=0 Ack=1 Win=65535 Len=0 MSS=1260 WS=4 SACK_PERM=1  tcp.stream == 2
 24   3.113994 192.168.42.196 -> 205.188.14.163 TCP 54 36526 > http [ACK] Seq=1 Ack=1 Win=14720 Len=0  tcp.stream == 2
 25   3.116087 192.168.42.196 -> 205.188.14.163 HTTP 451 GET / HTTP/1.1   tcp.stream == 2
 26   3.263336 205.188.14.163 -> 192.168.42.196 TCP 54 [TCP Window Update] http > 36526 [ACK] Seq=1 Ack=1 Win=200000 Len=0  tcp.stream == 2
 27   3.373327 205.188.14.163 -> 192.168.42.196 HTTP 482 HTTP/1.1 302 Found  (text/html)  tcp.stream == 2
 28   3.373346 192.168.42.196 -> 205.188.14.163 TCP 54 36526 > http [ACK] Seq=398 Ack=429 Win=15744 Len=0  tcp.stream == 2
 29   3.379784 192.168.42.196 -> 205.188.14.163 TCP 54 36526 > http [FIN, ACK] Seq=398 Ack=429 Win=15744 Len=0  tcp.stream == 2
 31   3.503966 205.188.14.163 -> 192.168.42.196 TCP 54 http > 36526 [ACK] Seq=429 Ack=399 Win=200000 Len=0  tcp.stream == 2
 32   3.503983 205.188.14.163 -> 192.168.42.196 TCP 54 http > 36526 [FIN, ACK] Seq=429 Ack=399 Win=200000 Len=0  tcp.stream == 2
 33   3.503990 192.168.42.196 -> 205.188.14.163 TCP 54 36526 > http [ACK] Seq=399 Ack=430 Win=15744 Len=0  tcp.stream == 2
 39   4.078635 192.168.42.196 -> 205.188.27.3 TCP 74 50023 > http [SYN] Seq=0 Win=14600 Len=0 MSS=1460 SACK_PERM=1 TSval=44519441 TSecr=0 WS=128  tcp.stream == 3
 40   4.213343 205.188.27.3 -> 192.168.42.196 TCP 66 http > 50023 [SYN, ACK] Seq=0 Ack=1 Win=65535 Len=0 MSS=1260 WS=4 SACK_PERM=1  tcp.stream == 3
 41   4.213368 192.168.42.196 -> 205.188.27.3 TCP 54 50023 > http [ACK] Seq=1 Ack=1 Win=14720 Len=0  tcp.stream == 3
 42   4.215145 192.168.42.196 -> 205.188.27.3 HTTP 460 GET /portal/home HTTP/1.1   tcp.stream == 3
 43   4.353333 205.188.27.3 -> 192.168.42.196 TCP 54 [TCP Window Update] http > 50023 [ACK] Seq=1 Ack=1 Win=200000 Len=0  tcp.stream == 3
 44   4.533466 205.188.27.3 -> 192.168.42.196 TCP 54 http > 50023 [ACK] Seq=1 Ack=407 Win=200000 Len=0  tcp.stream == 3
 45   7.414812 205.188.27.3 -> 192.168.42.196 TCP 1314 [TCP segment of a reassembled PDU]  tcp.stream == 3
 46   7.414835 192.168.42.196 -> 205.188.27.3 TCP 54 50023 > http [ACK] Seq=407 Ack=1261 Win=17152 Len=0  tcp.stream == 3
 47   7.423931 205.188.27.3 -> 192.168.42.196 TCP 1314 [TCP segment of a reassembled PDU]  tcp.stream == 3
 48   7.423950 192.168.42.196 -> 205.188.27.3 TCP 54 50023 > http [ACK] Seq=407 Ack=2521 Win=19712 Len=0  tcp.stream == 3
 49   7.433547 205.188.27.3 -> 192.168.42.196 TCP 1314 [TCP segment of a reassembled PDU]  tcp.stream == 3
 50   7.433562 192.168.42.196 -> 205.188.27.3 TCP 54 50023 > http [ACK] Seq=407 Ack=3781 Win=22272 Len=0  tcp.stream == 3
 51   7.443932 205.188.27.3 -> 192.168.42.196 TCP 1314 [TCP segment of a reassembled PDU]  tcp.stream == 3
 52   7.443950 192.168.42.196 -> 205.188.27.3 TCP 54 50023 > http [ACK] Seq=407 Ack=5041 Win=24704 Len=0  tcp.stream == 3
 53   7.443957 205.188.27.3 -> 192.168.42.196 TCP 1314 [TCP segment of a reassembled PDU]  tcp.stream == 3
 54   7.443959 192.168.42.196 -> 205.188.27.3 TCP 54 50023 > http [ACK] Seq=407 Ack=6301 Win=27264 Len=0  tcp.stream == 3
 55   7.453547 205.188.27.3 -> 192.168.42.196 TCP 1279 [TCP segment of a reassembled PDU]  tcp.stream == 3
 56   7.453566 192.168.42.196 -> 205.188.27.3 TCP 54 50023 > http [ACK] Seq=407 Ack=7526 Win=29824 Len=0  tcp.stream == 3
 57   7.463932 205.188.27.3 -> 192.168.42.196 TCP 1314 [TCP segment of a reassembled PDU]  tcp.stream == 3
 58   7.463953 192.168.42.196 -> 205.188.27.3 TCP 54 50023 > http [ACK] Seq=407 Ack=8786 Win=32256 Len=0  tcp.stream == 3
 59   7.463959 205.188.27.3 -> 192.168.42.196 TCP 472 [TCP segment of a reassembled PDU]  tcp.stream == 3
 60   7.463961 192.168.42.196 -> 205.188.27.3 TCP 54 50023 > http [ACK] Seq=407 Ack=9204 Win=34816 Len=0  tcp.stream == 3
 61   7.473806 205.188.27.3 -> 192.168.42.196 TCP 768 [TCP segment of a reassembled PDU]  tcp.stream == 3
 62   7.473825 192.168.42.196 -> 205.188.27.3 TCP 54 50023 > http [ACK] Seq=407 Ack=9918 Win=37376 Len=0  tcp.stream == 3
 63   7.473832 205.188.27.3 -> 192.168.42.196 TCP 588 [TCP segment of a reassembled PDU]  tcp.stream == 3
 64   7.473834 192.168.42.196 -> 205.188.27.3 TCP 54 50023 > http [ACK] Seq=407 Ack=10452 Win=39808 Len=0  tcp.stream == 3
 65   7.473836 205.188.27.3 -> 192.168.42.196 TCP 708 [TCP segment of a reassembled PDU]  tcp.stream == 3
 66   7.473840 192.168.42.196 -> 205.188.27.3 TCP 54 50023 > http [ACK] Seq=407 Ack=11106 Win=42368 Len=0  tcp.stream == 3
 67   7.493929 205.188.27.3 -> 192.168.42.196 TCP 649 [TCP segment of a reassembled PDU]  tcp.stream == 3
 68   7.493956 192.168.42.196 -> 205.188.27.3 TCP 54 50023 > http [ACK] Seq=407 Ack=11701 Win=44928 Len=0  tcp.stream == 3
 69   7.494042 205.188.27.3 -> 192.168.42.196 TCP 1025 [TCP segment of a reassembled PDU]  tcp.stream == 3
 70   7.494047 192.168.42.196 -> 205.188.27.3 TCP 54 50023 > http [ACK] Seq=407 Ack=12672 Win=47360 Len=0  tcp.stream == 3
 71   7.494050 205.188.27.3 -> 192.168.42.196 TCP 736 [TCP segment of a reassembled PDU]  tcp.stream == 3
 72   7.494052 192.168.42.196 -> 205.188.27.3 TCP 54 50023 > http [ACK] Seq=407 Ack=13354 Win=49920 Len=0  tcp.stream == 3
 73   7.503303 205.188.27.3 -> 192.168.42.196 TCP 1233 [TCP segment of a reassembled PDU]  tcp.stream == 3
 74   7.503323 192.168.42.196 -> 205.188.27.3 TCP 54 50023 > http [ACK] Seq=407 Ack=14533 Win=52480 Len=0  tcp.stream == 3
 75   7.606058 205.188.27.3 -> 192.168.42.196 TCP 1314 [TCP segment of a reassembled PDU]  tcp.stream == 3
 76   7.606077 192.168.42.196 -> 205.188.27.3 TCP 54 50023 > http [ACK] Seq=407 Ack=15793 Win=55040 Len=0  tcp.stream == 3
 77   7.606164 205.188.27.3 -> 192.168.42.196 TCP 1314 [TCP segment of a reassembled PDU]  tcp.stream == 3
 78   7.606169 192.168.42.196 -> 205.188.27.3 TCP 54 50023 > http [ACK] Seq=407 Ack=17053 Win=57472 Len=0  tcp.stream == 3
 79   7.613926 205.188.27.3 -> 192.168.42.196 TCP 1314 [TCP segment of a reassembled PDU]  tcp.stream == 3
 80   7.613945 192.168.42.196 -> 205.188.27.3 TCP 54 50023 > http [ACK] Seq=407 Ack=18313 Win=60032 Len=0  tcp.stream == 3
 81   7.623803 205.188.27.3 -> 192.168.42.196 TCP 1314 [TCP segment of a reassembled PDU]  tcp.stream == 3
 82   7.623828 192.168.42.196 -> 205.188.27.3 TCP 54 50023 > http [ACK] Seq=407 Ack=19573 Win=62592 Len=0  tcp.stream == 3
 83   7.633546 205.188.27.3 -> 192.168.42.196 TCP 1314 [TCP segment of a reassembled PDU]  tcp.stream == 3
 84   7.633565 192.168.42.196 -> 205.188.27.3 TCP 54 50023 > http [ACK] Seq=407 Ack=20833 Win=64128 Len=0  tcp.stream == 3
 85   7.644181 205.188.27.3 -> 192.168.42.196 TCP 1314 [TCP segment of a reassembled PDU]  tcp.stream == 3
 86   7.644202 192.168.42.196 -> 205.188.27.3 TCP 54 50023 > http [ACK] Seq=407 Ack=22093 Win=64128 Len=0  tcp.stream == 3
 87   7.644208 205.188.27.3 -> 192.168.42.196 TCP 1314 [TCP segment of a reassembled PDU]  tcp.stream == 3
 88   7.644210 192.168.42.196 -> 205.188.27.3 TCP 54 50023 > http [ACK] Seq=407 Ack=23353 Win=62976 Len=0  tcp.stream == 3
 89   7.654051 205.188.27.3 -> 192.168.42.196 TCP 1314 [TCP segment of a reassembled PDU]  tcp.stream == 3
 90   7.654069 192.168.42.196 -> 205.188.27.3 TCP 54 50023 > http [ACK] Seq=407 Ack=24613 Win=64128 Len=0  tcp.stream == 3
 91   7.663677 205.188.27.3 -> 192.168.42.196 TCP 1314 [TCP segment of a reassembled PDU]  tcp.stream == 3
 92   7.663695 192.168.42.196 -> 205.188.27.3 TCP 54 50023 > http [ACK] Seq=407 Ack=25873 Win=64128 Len=0  tcp.stream == 3
 93   7.674558 205.188.27.3 -> 192.168.42.196 TCP 1314 [TCP segment of a reassembled PDU]  tcp.stream == 3
 94   7.674576 205.188.27.3 -> 192.168.42.196 HTTP 86 HTTP/1.1 200 OK  (text/html)  tcp.stream == 3
 95   7.675803 192.168.42.196 -> 205.188.27.3 TCP 54 50023 > http [ACK] Seq=407 Ack=27165 Win=62976 Len=0  tcp.stream == 3
 96   7.680468 192.168.42.196 -> 205.188.27.3 TCP 54 50023 > http [FIN, ACK] Seq=407 Ack=27165 Win=64128 Len=0  tcp.stream == 3
 97   7.803310 205.188.27.3 -> 192.168.42.196 TCP 54 http > 50023 [ACK] Seq=27165 Ack=408 Win=200000 Len=0  tcp.stream == 3
 98   7.813307 205.188.27.3 -> 192.168.42.196 TCP 54 http > 50023 [FIN, ACK] Seq=27165 Ack=408 Win=200000 Len=0  tcp.stream == 3
 99   7.813326 192.168.42.196 -> 205.188.27.3 TCP 54 50023 > http [ACK] Seq=408 Ack=27166 Win=64128 Len=0  tcp.stream == 3
100   7.882280 192.168.42.196 -> 205.188.27.3 TCP 74 50024 > http [SYN] Seq=0 Win=14600 Len=0 MSS=1460 SACK_PERM=1 TSval=44520392 TSecr=0 WS=128  tcp.stream == 4
101   7.894534 192.168.42.196 -> 205.188.27.3 TCP 74 50025 > http [SYN] Seq=0 Win=14600 Len=0 MSS=1460 SACK_PERM=1 TSval=44520395 TSecr=0 WS=128  tcp.stream == 5
102   7.904215 192.168.42.196 -> 205.188.27.3 TCP 74 50026 > http [SYN] Seq=0 Win=14600 Len=0 MSS=1460 SACK_PERM=1 TSval=44520397 TSecr=0 WS=128  tcp.stream == 6
103   7.915104 192.168.42.196 -> 205.188.27.3 TCP 74 50027 > http [SYN] Seq=0 Win=14600 Len=0 MSS=1460 SACK_PERM=1 TSval=44520400 TSecr=0 WS=128  tcp.stream == 7
104   8.003311 205.188.27.3 -> 192.168.42.196 TCP 66 http > 50024 [SYN, ACK] Seq=0 Ack=1 Win=65535 Len=0 MSS=1260 WS=4 SACK_PERM=1  tcp.stream == 4
105   8.003335 192.168.42.196 -> 205.188.27.3 TCP 54 50024 > http [ACK] Seq=1 Ack=1 Win=14720 Len=0  tcp.stream == 4
106   8.005235 192.168.42.196 -> 205.188.27.3 HTTP 926 GET /css/portal/en/US/smartphone.css HTTP/1.1   tcp.stream == 4
107   8.013176 205.188.27.3 -> 192.168.42.196 TCP 66 http > 50025 [SYN, ACK] Seq=0 Ack=1 Win=65535 Len=0 MSS=1260 WS=4 SACK_PERM=1  tcp.stream == 5
108   8.013198 192.168.42.196 -> 205.188.27.3 TCP 54 50025 > http [ACK] Seq=1 Ack=1 Win=14720 Len=0  tcp.stream == 5
109   8.015620 192.168.42.196 -> 205.188.27.3 HTTP 896 GET /js/smartphone.js HTTP/1.1   tcp.stream == 5
110   8.024677 205.188.27.3 -> 192.168.42.196 TCP 66 http > 50026 [SYN, ACK] Seq=0 Ack=1 Win=65535 Len=0 MSS=1260 WS=4 SACK_PERM=1  tcp.stream == 6
111   8.024700 192.168.42.196 -> 205.188.27.3 TCP 54 50026 > http [ACK] Seq=1 Ack=1 Win=14720 Len=0  tcp.stream == 6
112   8.031412 192.168.42.196 -> 205.188.27.3 HTTP 893 GET /js/geo_3.2.js HTTP/1.1   tcp.stream == 6
113   8.053302 205.188.27.3 -> 192.168.42.196 TCP 66 http > 50027 [SYN, ACK] Seq=0 Ack=1 Win=65535 Len=0 MSS=1260 WS=4 SACK_PERM=1  tcp.stream == 7
114   8.053326 192.168.42.196 -> 205.188.27.3 TCP 54 50027 > http [ACK] Seq=1 Ack=1 Win=14720 Len=0  tcp.stream == 7
115   8.054846 192.168.42.196 -> 205.188.27.3 HTTP 897 GET /js/iscroll-min.js HTTP/1.1   tcp.stream == 7
116   8.123557 205.188.27.3 -> 192.168.42.196 TCP 54 [TCP Window Update] http > 50024 [ACK] Seq=1 Ack=1 Win=200000 Len=0  tcp.stream == 4
117   8.203431 205.188.27.3 -> 192.168.42.196 TCP 54 [TCP Window Update] http > 50025 [ACK] Seq=1 Ack=1 Win=200000 Len=0  tcp.stream == 5
118   8.223556 205.188.27.3 -> 192.168.42.196 TCP 54 [TCP Window Update] http > 50026 [ACK] Seq=1 Ack=1 Win=200000 Len=0  tcp.stream == 6
119   8.223572 205.188.27.3 -> 192.168.42.196 TCP 54 [TCP Window Update] http > 50027 [ACK] Seq=1 Ack=1 Win=200000 Len=0  tcp.stream == 7
120   8.333313 205.188.27.3 -> 192.168.42.196 TCP 54 http > 50025 [ACK] Seq=1 Ack=843 Win=200000 Len=0  tcp.stream == 5
121   8.333329 205.188.27.3 -> 192.168.42.196 TCP 54 http > 50026 [ACK] Seq=1 Ack=840 Win=200000 Len=0  tcp.stream == 6
122   8.333332 205.188.27.3 -> 192.168.42.196 TCP 54 http > 50024 [ACK] Seq=1 Ack=873 Win=200000 Len=0  tcp.stream == 4
123   8.384181 205.188.27.3 -> 192.168.42.196 TCP 54 http > 50027 [ACK] Seq=1 Ack=844 Win=200000 Len=0  tcp.stream == 7
124   8.384197 205.188.27.3 -> 192.168.42.196 TCP 1314 [TCP segment of a reassembled PDU]  tcp.stream == 6
125   8.384205 192.168.42.196 -> 205.188.27.3 TCP 54 50026 > http [ACK] Seq=840 Ack=1261 Win=17152 Len=0  tcp.stream == 6
126   8.394300 205.188.27.3 -> 192.168.42.196 TCP 1314 [TCP segment of a reassembled PDU]  tcp.stream == 6
127   8.394319 192.168.42.196 -> 205.188.27.3 TCP 54 50026 > http [ACK] Seq=840 Ack=2521 Win=19712 Len=0  tcp.stream == 6
128   8.394325 205.188.27.3 -> 192.168.42.196 HTTP 259 HTTP/1.1 200 OK  (application/javascript)  tcp.stream == 6
129   8.394327 192.168.42.196 -> 205.188.27.3 TCP 54 50026 > http [ACK] Seq=840 Ack=2726 Win=22272 Len=0  tcp.stream == 6
130   8.396839 192.168.42.196 -> 205.188.27.3 TCP 54 50026 > http [FIN, ACK] Seq=840 Ack=2726 Win=22272 Len=0  tcp.stream == 6
131   8.523311 205.188.27.3 -> 192.168.42.196 TCP 54 http > 50026 [ACK] Seq=2726 Ack=841 Win=200000 Len=0  tcp.stream == 6
132   8.523331 205.188.27.3 -> 192.168.42.196 TCP 54 http > 50026 [FIN, ACK] Seq=2726 Ack=841 Win=200000 Len=0  tcp.stream == 6
133   8.523338 192.168.42.196 -> 205.188.27.3 TCP 54 50026 > http [ACK] Seq=841 Ack=2727 Win=22272 Len=0  tcp.stream == 6
134   8.623682 205.188.27.3 -> 192.168.42.196 TCP 1314 [TCP segment of a reassembled PDU]  tcp.stream == 5
135   8.623703 192.168.42.196 -> 205.188.27.3 TCP 54 50025 > http [ACK] Seq=843 Ack=1261 Win=17152 Len=0  tcp.stream == 5
136   8.633418 205.188.27.3 -> 192.168.42.196 TCP 1314 [TCP segment of a reassembled PDU]  tcp.stream == 5
137   8.633436 192.168.42.196 -> 205.188.27.3 TCP 54 50025 > http [ACK] Seq=843 Ack=2521 Win=19712 Len=0  tcp.stream == 5
138   8.643552 205.188.27.3 -> 192.168.42.196 TCP 1314 [TCP segment of a reassembled PDU]  tcp.stream == 5
139   8.643571 192.168.42.196 -> 205.188.27.3 TCP 54 50025 > http [ACK] Seq=843 Ack=3781 Win=22272 Len=0  tcp.stream == 5
140   8.663429 205.188.27.3 -> 192.168.42.196 TCP 1314 [TCP segment of a reassembled PDU]  tcp.stream == 5
141   8.663447 192.168.42.196 -> 205.188.27.3 TCP 54 50025 > http [ACK] Seq=843 Ack=5041 Win=24704 Len=0  tcp.stream == 5
142   8.663453 205.188.27.3 -> 192.168.42.196 HTTP 81 HTTP/1.1 200 OK  (application/javascript)  tcp.stream == 5
143   8.663456 192.168.42.196 -> 205.188.27.3 TCP 54 50025 > http [ACK] Seq=843 Ack=5068 Win=24704 Len=0  tcp.stream == 5
144   8.665474 192.168.42.196 -> 205.188.27.3 TCP 54 50025 > http [FIN, ACK] Seq=843 Ack=5068 Win=24704 Len=0  tcp.stream == 5
145   8.673672 205.188.27.3 -> 192.168.42.196 TCP 1314 [TCP segment of a reassembled PDU]  tcp.stream == 4
146   8.673690 192.168.42.196 -> 205.188.27.3 TCP 54 50024 > http [ACK] Seq=873 Ack=1261 Win=17152 Len=0  tcp.stream == 4
147   8.693547 205.188.27.3 -> 192.168.42.196 TCP 1314 [TCP segment of a reassembled PDU]  tcp.stream == 4
148   8.693568 192.168.42.196 -> 205.188.27.3 TCP 54 50024 > http [ACK] Seq=873 Ack=2521 Win=19712 Len=0  tcp.stream == 4
149   8.703548 205.188.27.3 -> 192.168.42.196 TCP 1314 [TCP segment of a reassembled PDU]  tcp.stream == 4
150   8.703567 192.168.42.196 -> 205.188.27.3 TCP 54 50024 > http [ACK] Seq=873 Ack=3781 Win=22272 Len=0  tcp.stream == 4
151   8.713539 205.188.27.3 -> 192.168.42.196 TCP 1314 [TCP segment of a reassembled PDU]  tcp.stream == 4
152   8.713558 192.168.42.196 -> 205.188.27.3 TCP 54 50024 > http [ACK] Seq=873 Ack=5041 Win=24704 Len=0  tcp.stream == 4
153   8.713659 205.188.27.3 -> 192.168.42.196 HTTP 903 HTTP/1.1 200 OK  (text/css)  tcp.stream == 4
154   8.713663 192.168.42.196 -> 205.188.27.3 TCP 54 50024 > http [ACK] Seq=873 Ack=5890 Win=27264 Len=0  tcp.stream == 4
155   8.715617 192.168.42.196 -> 205.188.27.3 TCP 54 50024 > http [FIN, ACK] Seq=873 Ack=5890 Win=27264 Len=0  tcp.stream == 4
156   8.734547 205.188.27.3 -> 192.168.42.196 TCP 1314 [TCP segment of a reassembled PDU]  tcp.stream == 7
157   8.734566 192.168.42.196 -> 205.188.27.3 TCP 54 50027 > http [ACK] Seq=844 Ack=1261 Win=17152 Len=0  tcp.stream == 7
158   8.734658 205.188.27.3 -> 192.168.42.196 TCP 1314 [TCP segment of a reassembled PDU]  tcp.stream == 7
159   8.734662 192.168.42.196 -> 205.188.27.3 TCP 54 50027 > http [ACK] Seq=844 Ack=2521 Win=19712 Len=0  tcp.stream == 7
160   8.754049 205.188.27.3 -> 192.168.42.196 TCP 1314 [TCP segment of a reassembled PDU]  tcp.stream == 7
161   8.754068 192.168.42.196 -> 205.188.27.3 TCP 54 50027 > http [ACK] Seq=844 Ack=3781 Win=22272 Len=0  tcp.stream == 7
162   8.754159 205.188.27.3 -> 192.168.42.196 TCP 1314 [TCP segment of a reassembled PDU]  tcp.stream == 7
163   8.754164 192.168.42.196 -> 205.188.27.3 TCP 54 50027 > http [ACK] Seq=844 Ack=5041 Win=24704 Len=0  tcp.stream == 7
164   8.754167 205.188.27.3 -> 192.168.42.196 HTTP 1146 HTTP/1.1 200 OK  (application/javascript)  tcp.stream == 7
165   8.754170 192.168.42.196 -> 205.188.27.3 TCP 54 50027 > http [ACK] Seq=844 Ack=6133 Win=27264 Len=0  tcp.stream == 7
166   8.759802 192.168.42.196 -> 205.188.27.3 TCP 54 50027 > http [FIN, ACK] Seq=844 Ack=6133 Win=27264 Len=0  tcp.stream == 7
167   8.823304 205.188.27.3 -> 192.168.42.196 TCP 54 http > 50025 [ACK] Seq=5068 Ack=844 Win=200000 Len=0  tcp.stream == 5
168   8.823322 205.188.27.3 -> 192.168.42.196 TCP 54 http > 50025 [FIN, ACK] Seq=5068 Ack=844 Win=200000 Len=0  tcp.stream == 5
169   8.823329 192.168.42.196 -> 205.188.27.3 TCP 54 50025 > http [ACK] Seq=844 Ack=5069 Win=24704 Len=0  tcp.stream == 5
170   8.883433 205.188.27.3 -> 192.168.42.196 TCP 54 http > 50024 [ACK] Seq=5890 Ack=874 Win=200000 Len=0  tcp.stream == 4
171   8.883452 205.188.27.3 -> 192.168.42.196 TCP 54 http > 50024 [FIN, ACK] Seq=5890 Ack=874 Win=200000 Len=0  tcp.stream == 4
172   8.883459 192.168.42.196 -> 205.188.27.3 TCP 54 50024 > http [ACK] Seq=874 Ack=5891 Win=27264 Len=0  tcp.stream == 4
173   8.883468 205.188.27.3 -> 192.168.42.196 TCP 54 http > 50027 [ACK] Seq=6133 Ack=845 Win=200000 Len=0  tcp.stream == 7
174   8.883471 205.188.27.3 -> 192.168.42.196 TCP 54 http > 50027 [FIN, ACK] Seq=6133 Ack=845 Win=200000 Len=0  tcp.stream == 7
175   8.883473 192.168.42.196 -> 205.188.27.3 TCP 54 50027 > http [ACK] Seq=845 Ack=6134 Win=27264 Len=0  tcp.stream == 7
176   9.121390 192.168.42.196 -> 64.12.152.5  TCP 74 42556 > http [SYN] Seq=0 Win=14600 Len=0 MSS=1460 SACK_PERM=1 TSval=44520702 TSecr=0 WS=128  tcp.stream == 8
180   9.345021 192.168.42.196 -> 64.12.152.5  TCP 74 42557 > http [SYN] Seq=0 Win=14600 Len=0 MSS=1460 SACK_PERM=1 TSval=44520757 TSecr=0 WS=128  tcp.stream == 9
181   9.503307  64.12.152.5 -> 192.168.42.196 TCP 66 http > 42556 [SYN, ACK] Seq=0 Ack=1 Win=65535 Len=0 MSS=1260 WS=4 SACK_PERM=1  tcp.stream == 8
182   9.503339 192.168.42.196 -> 64.12.152.5  TCP 54 42556 > http [ACK] Seq=1 Ack=1 Win=14720 Len=0  tcp.stream == 8
183   9.505729 192.168.42.196 -> 64.12.152.5  HTTP 489 GET /mads/exmet.php?appid=10000053&nid=networkid&type=24&appver=250&client=3 HTTP/1.1   tcp.stream == 8
184   9.533164  64.12.152.5 -> 192.168.42.196 TCP 66 http > 42557 [SYN, ACK] Seq=0 Ack=1 Win=65535 Len=0 MSS=1260 WS=4 SACK_PERM=1  tcp.stream == 9
185   9.533185 192.168.42.196 -> 64.12.152.5  TCP 54 42557 > http [ACK] Seq=1 Ack=1 Win=14720 Len=0  tcp.stream == 9
192   9.643418  64.12.152.5 -> 192.168.42.196 TCP 54 [TCP Window Update] http > 42556 [ACK] Seq=1 Ack=1 Win=200000 Len=0  tcp.stream == 8
193   9.713418  64.12.152.5 -> 192.168.42.196 TCP 54 [TCP Window Update] http > 42557 [ACK] Seq=1 Ack=1 Win=200000 Len=0  tcp.stream == 9
197   9.834425  64.12.152.5 -> 192.168.42.196 TCP 54 http > 42556 [ACK] Seq=1 Ack=436 Win=200000 Len=0  tcp.stream == 8
201   9.863293  64.12.152.5 -> 192.168.42.196 HTTP 265 HTTP/1.1 200 OK   tcp.stream == 8
202   9.863312 192.168.42.196 -> 64.12.152.5  TCP 54 42556 > http [ACK] Seq=436 Ack=212 Win=15744 Len=0  tcp.stream == 8
203   9.868777 192.168.42.196 -> 64.12.152.5  TCP 54 42556 > http [FIN, ACK] Seq=436 Ack=212 Win=15744 Len=0  tcp.stream == 8
205   9.993551  64.12.152.5 -> 192.168.42.196 TCP 54 http > 42556 [ACK] Seq=212 Ack=437 Win=200000 Len=0  tcp.stream == 8
206   9.993566  64.12.152.5 -> 192.168.42.196 TCP 54 http > 42556 [FIN, ACK] Seq=212 Ack=437 Win=200000 Len=0  tcp.stream == 8
207   9.993573 192.168.42.196 -> 64.12.152.5  TCP 54 42556 > http [ACK] Seq=437 Ack=213 Win=15744 Len=0  tcp.stream == 8
209  10.060259 192.168.42.196 -> 18.7.20.78   TCP 74 44530 > http [SYN] Seq=0 Win=14600 Len=0 MSS=1460 SACK_PERM=1 TSval=44520936 TSecr=0 WS=128  tcp.stream == 10
211  10.067905 192.168.42.196 -> 18.7.20.78   TCP 74 44531 > http [SYN] Seq=0 Win=14600 Len=0 MSS=1460 SACK_PERM=1 TSval=44520938 TSecr=0 WS=128  tcp.stream == 11
213  10.085987 192.168.42.196 -> 64.236.144.246 TCP 74 36985 > http [SYN] Seq=0 Win=14600 Len=0 MSS=1460 SACK_PERM=1 TSval=44520943 TSecr=0 WS=128  tcp.stream == 12
216  10.186042   18.7.20.78 -> 192.168.42.196 TCP 66 http > 44530 [SYN, ACK] Seq=0 Ack=1 Win=65535 Len=0 MSS=1260 WS=4 SACK_PERM=1  tcp.stream == 10
217  10.186069 192.168.42.196 -> 18.7.20.78   TCP 54 44530 > http [ACK] Seq=1 Ack=1 Win=14720 Len=0  tcp.stream == 10
218  10.189797 192.168.42.196 -> 18.7.20.78   HTTP 533 GET /dims-global/dims3/MWAP/resize/320x180/format/jpg/http://i.huffpost.com/gen/502392/thumbs/a-FASHION640AZ-386x217.jpg HTTP/1.1   tcp.stream == 10
219  10.193162   18.7.20.78 -> 192.168.42.196 TCP 66 http > 44531 [SYN, ACK] Seq=0 Ack=1 Win=65535 Len=0 MSS=1260 WS=4 SACK_PERM=1  tcp.stream == 11
220  10.193186 192.168.42.196 -> 18.7.20.78   TCP 54 44531 > http [ACK] Seq=1 Ack=1 Win=14720 Len=0  tcp.stream == 11
221  10.194631 192.168.42.196 -> 18.7.20.78   HTTP 494 GET /apps/1/Ad0St10Sz3055Sq0V1Id20860929/WLGS_AOLJAN_STD_320x50_V9.jpg HTTP/1.1   tcp.stream == 11
222  10.213286 64.236.144.246 -> 192.168.42.196 TCP 66 http > 36985 [SYN, ACK] Seq=0 Ack=1 Win=65535 Len=0 MSS=1260 WS=4 SACK_PERM=1  tcp.stream == 12
223  10.213318 192.168.42.196 -> 64.236.144.246 TCP 54 36985 > http [ACK] Seq=1 Ack=1 Win=14720 Len=0  tcp.stream == 12
224  10.218707 192.168.42.196 -> 64.236.144.246 HTTP 599 GET /adcount/3.0/5113/2196806/0/3055/AdId=2386377;BnId=6;ct=1776203314;st=1185;adcid=1;itime=414412370;reqtype=25;;kvmn=93317680;kvdvm=android_sdk;kr14513=124552;kvmos=android;kp=130708 HTTP/1.1   tcp.stream == 12
225  10.282215 192.168.42.196 -> 205.188.27.3 TCP 74 50033 > http [SYN] Seq=0 Win=14600 Len=0 MSS=1460 SACK_PERM=1 TSval=44520992 TSecr=0 WS=128  tcp.stream == 13
229  10.313158   18.7.20.78 -> 192.168.42.196 TCP 54 [TCP Window Update] http > 44530 [ACK] Seq=1 Ack=1 Win=200000 Len=0  tcp.stream == 10
230  10.337381 192.168.42.196 -> 205.188.27.3 TCP 74 50034 > http [SYN] Seq=0 Win=14600 Len=0 MSS=1460 SACK_PERM=1 TSval=44521006 TSecr=0 WS=128  tcp.stream == 14
231  10.338851 192.168.42.196 -> 205.188.27.3 TCP 74 50035 > http [SYN] Seq=0 Win=14600 Len=0 MSS=1460 SACK_PERM=1 TSval=44521006 TSecr=0 WS=128  tcp.stream == 15
232  10.353913   18.7.20.78 -> 192.168.42.196 TCP 1314 [TCP segment of a reassembled PDU]  tcp.stream == 10
233  10.353937 192.168.42.196 -> 18.7.20.78   TCP 54 44530 > http [ACK] Seq=480 Ack=1261 Win=17152 Len=0  tcp.stream == 10
234  10.353943   18.7.20.78 -> 192.168.42.196 TCP 1314 [TCP segment of a reassembled PDU]  tcp.stream == 10
235  10.353946 192.168.42.196 -> 18.7.20.78   TCP 54 44530 > http [ACK] Seq=480 Ack=2521 Win=19712 Len=0  tcp.stream == 10
236  10.367559 192.168.42.196 -> 205.188.27.3 TCP 74 50036 > http [SYN] Seq=0 Win=14600 Len=0 MSS=1460 SACK_PERM=1 TSval=44521013 TSecr=0 WS=128  tcp.stream == 16
237  10.374663   18.7.20.78 -> 192.168.42.196 TCP 1314 [TCP segment of a reassembled PDU]  tcp.stream == 10
238  10.374681 192.168.42.196 -> 18.7.20.78   TCP 54 44530 > http [ACK] Seq=480 Ack=3781 Win=22272 Len=0  tcp.stream == 10
239  10.374771   18.7.20.78 -> 192.168.42.196 TCP 1314 [TCP segment of a reassembled PDU]  tcp.stream == 10
240  10.374775 192.168.42.196 -> 18.7.20.78   TCP 54 44530 > http [ACK] Seq=480 Ack=5041 Win=24704 Len=0  tcp.stream == 10
241  10.381666 192.168.42.196 -> 205.188.27.3 TCP 74 50037 > http [SYN] Seq=0 Win=14600 Len=0 MSS=1460 SACK_PERM=1 TSval=44521017 TSecr=0 WS=128  tcp.stream == 17
242  10.382964 192.168.42.196 -> 205.188.27.3 TCP 74 50038 > http [SYN] Seq=0 Win=14600 Len=0 MSS=1460 SACK_PERM=1 TSval=44521017 TSecr=0 WS=128  tcp.stream == 18
243  10.383533   18.7.20.78 -> 192.168.42.196 TCP 1314 [TCP segment of a reassembled PDU]  tcp.stream == 10
244  10.383551 192.168.42.196 -> 18.7.20.78   TCP 54 44530 > http [ACK] Seq=480 Ack=6301 Win=27264 Len=0  tcp.stream == 10
245  10.383646   18.7.20.78 -> 192.168.42.196 TCP 1314 [TCP segment of a reassembled PDU]  tcp.stream == 10
246  10.383650 192.168.42.196 -> 18.7.20.78   TCP 54 44530 > http [ACK] Seq=480 Ack=7561 Win=29824 Len=0  tcp.stream == 10
247  10.393532   18.7.20.78 -> 192.168.42.196 HTTP 818 HTTP/1.1 200 OK  (JPEG JFIF image)  tcp.stream == 10
248  10.393549 192.168.42.196 -> 18.7.20.78   TCP 54 44530 > http [ACK] Seq=480 Ack=8325 Win=32256 Len=0  tcp.stream == 10
249  10.393555   18.7.20.78 -> 192.168.42.196 TCP 54 [TCP Window Update] http > 44531 [ACK] Seq=1 Ack=1 Win=200000 Len=0  tcp.stream == 11
250  10.393560 64.236.144.246 -> 192.168.42.196 TCP 54 [TCP Window Update] http > 36985 [ACK] Seq=1 Ack=1 Win=200000 Len=0  tcp.stream == 12
251  10.414156   18.7.20.78 -> 192.168.42.196 TCP 1314 [TCP segment of a reassembled PDU]  tcp.stream == 11
252  10.414176 192.168.42.196 -> 18.7.20.78   TCP 54 44531 > http [ACK] Seq=441 Ack=1261 Win=17152 Len=0  tcp.stream == 11
253  10.414273   18.7.20.78 -> 192.168.42.196 TCP 1314 [TCP segment of a reassembled PDU]  tcp.stream == 11
254  10.414278 192.168.42.196 -> 18.7.20.78   TCP 54 44531 > http [ACK] Seq=441 Ack=2521 Win=19712 Len=0  tcp.stream == 11
255  10.414281   18.7.20.78 -> 192.168.42.196 TCP 1314 [TCP segment of a reassembled PDU]  tcp.stream == 11
256  10.414284 192.168.42.196 -> 18.7.20.78   TCP 54 44531 > http [ACK] Seq=441 Ack=3781 Win=22272 Len=0  tcp.stream == 11
257  10.433788   18.7.20.78 -> 192.168.42.196 HTTP 1265 HTTP/1.1 200 OK  (JPEG JFIF image)  tcp.stream == 11
258  10.433807 192.168.42.196 -> 18.7.20.78   TCP 54 44531 > http [ACK] Seq=441 Ack=4992 Win=24704 Len=0  tcp.stream == 11
259  10.433812 205.188.27.3 -> 192.168.42.196 TCP 66 http > 50033 [SYN, ACK] Seq=0 Ack=1 Win=65535 Len=0 MSS=1260 WS=4 SACK_PERM=1  tcp.stream == 13
260  10.433820 192.168.42.196 -> 205.188.27.3 TCP 54 50033 > http [ACK] Seq=1 Ack=1 Win=14720 Len=0  tcp.stream == 13
261  10.433824 64.236.144.246 -> 192.168.42.196 HTTP 209 HTTP/1.1 200 OK  (application/x-javascript)  tcp.stream == 12
262  10.433828 192.168.42.196 -> 64.236.144.246 TCP 54 36985 > http [ACK] Seq=546 Ack=156 Win=15744 Len=0  tcp.stream == 12
263  10.463288 205.188.27.3 -> 192.168.42.196 TCP 66 http > 50035 [SYN, ACK] Seq=0 Ack=1 Win=65535 Len=0 MSS=1260 WS=4 SACK_PERM=1  tcp.stream == 15
264  10.463311 192.168.42.196 -> 205.188.27.3 TCP 54 50035 > http [ACK] Seq=1 Ack=1 Win=14720 Len=0  tcp.stream == 15
265  10.463317 205.188.27.3 -> 192.168.42.196 TCP 66 http > 50034 [SYN, ACK] Seq=0 Ack=1 Win=65535 Len=0 MSS=1260 WS=4 SACK_PERM=1  tcp.stream == 14
266  10.463321 192.168.42.196 -> 205.188.27.3 TCP 54 50034 > http [ACK] Seq=1 Ack=1 Win=14720 Len=0  tcp.stream == 14
267  10.493410 205.188.27.3 -> 192.168.42.196 TCP 66 http > 50036 [SYN, ACK] Seq=0 Ack=1 Win=65535 Len=0 MSS=1260 WS=4 SACK_PERM=1  tcp.stream == 16
268  10.493431 192.168.42.196 -> 205.188.27.3 TCP 54 50036 > http [ACK] Seq=1 Ack=1 Win=14720 Len=0  tcp.stream == 16
271  10.503415 205.188.27.3 -> 192.168.42.196 TCP 66 http > 50038 [SYN, ACK] Seq=0 Ack=1 Win=65535 Len=0 MSS=1260 WS=4 SACK_PERM=1  tcp.stream == 18
272  10.503439 192.168.42.196 -> 205.188.27.3 TCP 54 50038 > http [ACK] Seq=1 Ack=1 Win=14720 Len=0  tcp.stream == 18
273  10.503445 205.188.27.3 -> 192.168.42.196 TCP 66 http > 50037 [SYN, ACK] Seq=0 Ack=1 Win=65535 Len=0 MSS=1260 WS=4 SACK_PERM=1  tcp.stream == 17
274  10.503449 192.168.42.196 -> 205.188.27.3 TCP 54 50037 > http [ACK] Seq=1 Ack=1 Win=14720 Len=0  tcp.stream == 17
276  10.553411 205.188.27.3 -> 192.168.42.196 TCP 54 [TCP Window Update] http > 50033 [ACK] Seq=1 Ack=1 Win=200000 Len=0  tcp.stream == 13
277  10.571239 192.168.42.196 -> 18.7.20.76   TCP 74 56194 > http [SYN] Seq=0 Win=14600 Len=0 MSS=1460 SACK_PERM=1 TSval=44521064 TSecr=0 WS=128  tcp.stream == 19
278  10.583159 205.188.27.3 -> 192.168.42.196 TCP 54 [TCP Window Update] http > 50035 [ACK] Seq=1 Ack=1 Win=200000 Len=0  tcp.stream == 15
279  10.583174 205.188.27.3 -> 192.168.42.196 TCP 54 [TCP Window Update] http > 50034 [ACK] Seq=1 Ack=1 Win=200000 Len=0  tcp.stream == 14
280  10.608590 192.168.42.196 -> 18.7.20.76   TCP 74 56195 > http [SYN] Seq=0 Win=14600 Len=0 MSS=1460 SACK_PERM=1 TSval=44521073 TSecr=0 WS=128  tcp.stream == 20
281  10.609771 192.168.42.196 -> 18.7.20.76   TCP 74 56196 > http [SYN] Seq=0 Win=14600 Len=0 MSS=1460 SACK_PERM=1 TSval=44521074 TSecr=0 WS=128  tcp.stream == 21
282  10.611115 192.168.42.196 -> 18.7.20.76   TCP 74 56197 > http [SYN] Seq=0 Win=14600 Len=0 MSS=1460 SACK_PERM=1 TSval=44521074 TSecr=0 WS=128  tcp.stream == 22
283  10.612387 192.168.42.196 -> 18.7.20.76   TCP 74 56198 > http [SYN] Seq=0 Win=14600 Len=0 MSS=1460 SACK_PERM=1 TSval=44521074 TSecr=0 WS=128  tcp.stream == 23
284  10.613530 205.188.27.3 -> 192.168.42.196 TCP 54 [TCP Window Update] http > 50036 [ACK] Seq=1 Ack=1 Win=200000 Len=0  tcp.stream == 16
285  10.623165 205.188.27.3 -> 192.168.42.196 TCP 54 [TCP Window Update] http > 50038 [ACK] Seq=1 Ack=1 Win=200000 Len=0  tcp.stream == 18
286  10.623181 205.188.27.3 -> 192.168.42.196 TCP 54 [TCP Window Update] http > 50037 [ACK] Seq=1 Ack=1 Win=200000 Len=0  tcp.stream == 17
287  10.626092 192.168.42.196 -> 18.7.20.76   TCP 74 56199 > http [SYN] Seq=0 Win=14600 Len=0 MSS=1460 SACK_PERM=1 TSval=44521078 TSecr=0 WS=128  tcp.stream == 24
288  10.635552 192.168.42.196 -> 18.7.20.78   TCP 74 44545 > http [SYN] Seq=0 Win=14600 Len=0 MSS=1460 SACK_PERM=1 TSval=44521080 TSecr=0 WS=128  tcp.stream == 25
289  10.636911 192.168.42.196 -> 18.7.20.78   TCP 74 44546 > http [SYN] Seq=0 Win=14600 Len=0 MSS=1460 SACK_PERM=1 TSval=44521080 TSecr=0 WS=128  tcp.stream == 26
290  10.640065 192.168.42.196 -> 18.7.20.78   TCP 74 44547 > http [SYN] Seq=0 Win=14600 Len=0 MSS=1460 SACK_PERM=1 TSval=44521081 TSecr=0 WS=128  tcp.stream == 27
291  10.641463 192.168.42.196 -> 18.7.20.78   TCP 74 44548 > http [SYN] Seq=0 Win=14600 Len=0 MSS=1460 SACK_PERM=1 TSval=44521082 TSecr=0 WS=128  tcp.stream == 28
292  10.643577 192.168.42.196 -> 18.7.20.78   TCP 74 44549 > http [SYN] Seq=0 Win=14600 Len=0 MSS=1460 SACK_PERM=1 TSval=44521082 TSecr=0 WS=128  tcp.stream == 29
293  10.693534   18.7.20.76 -> 192.168.42.196 TCP 66 http > 56194 [SYN, ACK] Seq=0 Ack=1 Win=65535 Len=0 MSS=1260 WS=4 SACK_PERM=1  tcp.stream == 19
294  10.693558 192.168.42.196 -> 18.7.20.76   TCP 54 56194 > http [ACK] Seq=1 Ack=1 Win=14720 Len=0  tcp.stream == 19
297  10.738688 192.168.42.196 -> 205.188.27.3 HTTP 878 GET /portal/home HTTP/1.1   tcp.stream == 13
298  10.740067 192.168.42.196 -> 205.188.27.3 HTTP 915 GET /images/portal/en/US/smartphone/portal_sprite.png HTTP/1.1   tcp.stream == 15
299  10.741122 192.168.42.196 -> 205.188.27.3 HTTP 915 GET /images/portal/en/US/smartphone/icon_Location.png HTTP/1.1   tcp.stream == 14
300  10.742277 192.168.42.196 -> 205.188.27.3 HTTP 909 GET /images/portal/en/US/smartphone/buzz_bg.png HTTP/1.1   tcp.stream == 16
301  10.743289   18.7.20.76 -> 192.168.42.196 TCP 66 http > 56195 [SYN, ACK] Seq=0 Ack=1 Win=65535 Len=0 MSS=1260 WS=4 SACK_PERM=1  tcp.stream == 20
302  10.743313 192.168.42.196 -> 18.7.20.76   TCP 54 56195 > http [ACK] Seq=1 Ack=1 Win=14720 Len=0  tcp.stream == 20
303  10.743319   18.7.20.76 -> 192.168.42.196 TCP 66 http > 56198 [SYN, ACK] Seq=0 Ack=1 Win=65535 Len=0 MSS=1260 WS=4 SACK_PERM=1  tcp.stream == 23
304  10.743323 192.168.42.196 -> 18.7.20.76   TCP 54 56198 > http [ACK] Seq=1 Ack=1 Win=14720 Len=0  tcp.stream == 23
305  10.743326   18.7.20.76 -> 192.168.42.196 TCP 66 http > 56196 [SYN, ACK] Seq=0 Ack=1 Win=65535 Len=0 MSS=1260 WS=4 SACK_PERM=1  tcp.stream == 21
306  10.743329 192.168.42.196 -> 18.7.20.76   TCP 54 56196 > http [ACK] Seq=1 Ack=1 Win=14720 Len=0  tcp.stream == 21
307  10.743332 192.168.42.196 -> 205.188.27.3 HTTP 911 GET /images/portal/en/US/smartphone/dailybuzz.png HTTP/1.1   tcp.stream == 18
308  10.743334   18.7.20.76 -> 192.168.42.196 TCP 66 http > 56197 [SYN, ACK] Seq=0 Ack=1 Win=65535 Len=0 MSS=1260 WS=4 SACK_PERM=1  tcp.stream == 22
309  10.743337 192.168.42.196 -> 18.7.20.76   TCP 54 56197 > http [ACK] Seq=1 Ack=1 Win=14720 Len=0  tcp.stream == 22
310  10.753159   18.7.20.76 -> 192.168.42.196 TCP 66 http > 56199 [SYN, ACK] Seq=0 Ack=1 Win=65535 Len=0 MSS=1260 WS=4 SACK_PERM=1  tcp.stream == 24
311  10.753182 192.168.42.196 -> 18.7.20.76   TCP 54 56199 > http [ACK] Seq=1 Ack=1 Win=14720 Len=0  tcp.stream == 24
312  10.754952 192.168.42.196 -> 205.188.27.3 HTTP 909 GET /images/portal/en/US/smartphone/popular.png HTTP/1.1   tcp.stream == 17
313  10.756008 192.168.42.196 -> 18.7.20.76   HTTP 464 GET /10345470/517273484_c_embedStandard.jpg HTTP/1.1   tcp.stream == 19
314  10.763416   18.7.20.78 -> 192.168.42.196 TCP 66 http > 44549 [SYN, ACK] Seq=0 Ack=1 Win=65535 Len=0 MSS=1260 WS=4 SACK_PERM=1  tcp.stream == 29
315  10.763438 192.168.42.196 -> 18.7.20.78   TCP 54 44549 > http [ACK] Seq=1 Ack=1 Win=14720 Len=0  tcp.stream == 29
316  10.763444   18.7.20.78 -> 192.168.42.196 TCP 66 http > 44548 [SYN, ACK] Seq=0 Ack=1 Win=65535 Len=0 MSS=1260 WS=4 SACK_PERM=1  tcp.stream == 28
317  10.763447 192.168.42.196 -> 18.7.20.78   TCP 54 44548 > http [ACK] Seq=1 Ack=1 Win=14720 Len=0  tcp.stream == 28
318  10.763450   18.7.20.78 -> 192.168.42.196 TCP 66 http > 44547 [SYN, ACK] Seq=0 Ack=1 Win=65535 Len=0 MSS=1260 WS=4 SACK_PERM=1  tcp.stream == 27
319  10.763453 192.168.42.196 -> 18.7.20.78   TCP 54 44547 > http [ACK] Seq=1 Ack=1 Win=14720 Len=0  tcp.stream == 27
320  10.763456   18.7.20.78 -> 192.168.42.196 TCP 66 http > 44545 [SYN, ACK] Seq=0 Ack=1 Win=65535 Len=0 MSS=1260 WS=4 SACK_PERM=1  tcp.stream == 25
321  10.763459 192.168.42.196 -> 18.7.20.78   TCP 54 44545 > http [ACK] Seq=1 Ack=1 Win=14720 Len=0  tcp.stream == 25
322  10.763518   18.7.20.78 -> 192.168.42.196 TCP 66 http > 44546 [SYN, ACK] Seq=0 Ack=1 Win=65535 Len=0 MSS=1260 WS=4 SACK_PERM=1  tcp.stream == 26
323  10.763524 192.168.42.196 -> 18.7.20.78   TCP 54 44546 > http [ACK] Seq=1 Ack=1 Win=14720 Len=0  tcp.stream == 26
324  10.778487 192.168.42.196 -> 64.236.144.246 TCP 54 36985 > http [FIN, ACK] Seq=546 Ack=156 Win=15744 Len=0  tcp.stream == 12
325  10.781690 192.168.42.196 -> 18.7.20.78   TCP 54 44530 > http [FIN, ACK] Seq=480 Ack=8325 Win=32256 Len=0  tcp.stream == 10
326  10.782604 192.168.42.196 -> 18.7.20.78   TCP 74 44550 > http [SYN] Seq=0 Win=14600 Len=0 MSS=1460 SACK_PERM=1 TSval=44521117 TSecr=0 WS=128  tcp.stream == 30
327  10.783355 192.168.42.196 -> 18.7.20.78   TCP 54 44531 > http [FIN, ACK] Seq=441 Ack=4992 Win=24704 Len=0  tcp.stream == 11
328  10.819696 192.168.42.196 -> 18.7.20.76   HTTP 464 GET /10345473/517273643_1_embedStandard.jpg HTTP/1.1   tcp.stream == 23
329  10.820600 192.168.42.196 -> 18.7.20.76   HTTP 464 GET /10345474/517273677_c_embedStandard.jpg HTTP/1.1   tcp.stream == 22
330  10.821595 192.168.42.196 -> 18.7.20.76   HTTP 464 GET /10345469/517273448_3_embedStandard.jpg HTTP/1.1   tcp.stream == 21
331  10.822481 192.168.42.196 -> 18.7.20.76   HTTP 464 GET /10345471/517273514_c_embedStandard.jpg HTTP/1.1   tcp.stream == 20
332  10.823278   18.7.20.76 -> 192.168.42.196 TCP 54 [TCP Window Update] http > 56194 [ACK] Seq=1 Ack=1 Win=200000 Len=0  tcp.stream == 19
333  10.823400 192.168.42.196 -> 18.7.20.76   HTTP 464 GET /10345470/517273486_3_embedStandard.jpg HTTP/1.1   tcp.stream == 24
334  10.845272 192.168.42.196 -> 18.7.20.78   HTTP 531 GET /dims-global/dims3/MWAP/resize/320x180/format/jpg/http://i.huffpost.com/gen/502649/thumbs/a-PRISONFIRE-386x217.jpg HTTP/1.1   tcp.stream == 29
335  10.846333 192.168.42.196 -> 18.7.20.78   HTTP 534 GET /dims-global/dims3/MWAP/resize/320x180/format/jpg/http://i.huffpost.com/gen/502385/thumbs/a-SANTORUM640AZ-386x217.jpg HTTP/1.1   tcp.stream == 28
336  10.847230 192.168.42.196 -> 18.7.20.78   HTTP 526 GET /dims-global/dims3/MWAP/resize/320x180/format/jpg/http://i.huffpost.com/gen/501795/thumbs/a-BUSEY-386x217.jpg HTTP/1.1   tcp.stream == 27
337  10.848197 192.168.42.196 -> 18.7.20.78   HTTP 540 GET /dims-global/dims3/MWAP/resize/320x180/format/jpg/http://i.huffpost.com/gen/502034/thumbs/a-CHRISTINE-SZYMANSKI-386x217.jpg HTTP/1.1   tcp.stream == 26
338  10.849157 192.168.42.196 -> 18.7.20.78   HTTP 535 GET /dims-global/dims3/MWAP/resize/320x180/format/jpg/http://i.huffpost.com/gen/502690/thumbs/a-DOOMEDMARRIAGE-386x217.jpg HTTP/1.1   tcp.stream == 25
340  10.923807   18.7.20.76 -> 192.168.42.196 TCP 54 [TCP Window Update] http > 56195 [ACK] Seq=1 Ack=1 Win=200000 Len=0  tcp.stream == 20
341  10.923814   18.7.20.76 -> 192.168.42.196 TCP 54 [TCP Window Update] http > 56198 [ACK] Seq=1 Ack=1 Win=200000 Len=0  tcp.stream == 23
342  10.923817   18.7.20.76 -> 192.168.42.196 TCP 54 [TCP Window Update] http > 56196 [ACK] Seq=1 Ack=1 Win=200000 Len=0  tcp.stream == 21
343  10.923819   18.7.20.76 -> 192.168.42.196 TCP 54 [TCP Window Update] http > 56197 [ACK] Seq=1 Ack=1 Win=200000 Len=0  tcp.stream == 22
344  10.927831 192.168.42.196 -> 18.7.20.68   TCP 74 51321 > http [SYN] Seq=0 Win=14600 Len=0 MSS=1460 SACK_PERM=1 TSval=44521153 TSecr=0 WS=128  tcp.stream == 31
345  10.934405   18.7.20.76 -> 192.168.42.196 TCP 54 [TCP Window Update] http > 56199 [ACK] Seq=1 Ack=1 Win=200000 Len=0  tcp.stream == 24
346  10.954042   18.7.20.78 -> 192.168.42.196 TCP 54 [TCP Window Update] http > 44549 [ACK] Seq=1 Ack=1 Win=200000 Len=0  tcp.stream == 29
347  10.954058   18.7.20.78 -> 192.168.42.196 TCP 54 [TCP Window Update] http > 44548 [ACK] Seq=1 Ack=1 Win=200000 Len=0  tcp.stream == 28
348  10.954060   18.7.20.78 -> 192.168.42.196 TCP 54 [TCP Window Update] http > 44546 [ACK] Seq=1 Ack=1 Win=200000 Len=0  tcp.stream == 26
349  10.954062 64.236.144.246 -> 192.168.42.196 TCP 54 http > 36985 [ACK] Seq=156 Ack=547 Win=200000 Len=0  tcp.stream == 12
350  10.954067   18.7.20.78 -> 192.168.42.196 TCP 54 [TCP Window Update] http > 44545 [ACK] Seq=1 Ack=1 Win=200000 Len=0  tcp.stream == 25
