  3   0.339793 192.168.42.196 -> 115.238.23.241 TCP 74 58525 > http [SYN] Seq=0 Win=14600 Len=0 MSS=1460 SACK_PERM=1 TSval=43224855 TSecr=0 WS=128  tcp.stream == 0
  6   0.590555 192.168.42.196 -> 121.14.24.241 TCP 74 50541 > http [SYN] Seq=0 Win=14600 Len=0 MSS=1460 SACK_PERM=1 TSval=43224918 TSecr=0 WS=128  tcp.stream == 1
  7   2.163478 115.238.23.241 -> 192.168.42.196 TCP 66 http > 58525 [SYN, ACK] Seq=0 Ack=1 Win=65535 Len=0 MSS=1260 WS=4 SACK_PERM=1  tcp.stream == 0
  8   2.163507 192.168.42.196 -> 115.238.23.241 TCP 54 58525 > http [ACK] Seq=1 Ack=1 Win=14720 Len=0  tcp.stream == 0
  9   2.163578 192.168.42.196 -> 115.238.23.241 HTTP 346 GET / HTTP/1.1   tcp.stream == 0
 10   2.195467 121.14.24.241 -> 192.168.42.196 TCP 66 http > 50541 [SYN, ACK] Seq=0 Ack=1 Win=65535 Len=0 MSS=1260 WS=4 SACK_PERM=1  tcp.stream == 1
 11   2.195496 192.168.42.196 -> 121.14.24.241 TCP 54 50541 > http [ACK] Seq=1 Ack=1 Win=14720 Len=0  tcp.stream == 1
 12   2.272718 115.238.23.241 -> 192.168.42.196 TCP 54 [TCP Window Update] http > 58525 [ACK] Seq=1 Ack=1 Win=200000 Len=0  tcp.stream == 0
 13   2.312966 121.14.24.241 -> 192.168.42.196 TCP 54 [TCP Window Update] http > 50541 [ACK] Seq=1 Ack=1 Win=200000 Len=0  tcp.stream == 1
 14   2.412969 115.238.23.241 -> 192.168.42.196 TCP 54 http > 58525 [ACK] Seq=1 Ack=293 Win=200000 Len=0  tcp.stream == 0
 15   2.742853 115.238.23.241 -> 192.168.42.196 HTTP 537 HTTP/1.1 302 Moved Temporarily  (text/html)  tcp.stream == 0
 16   2.742873 192.168.42.196 -> 115.238.23.241 TCP 54 58525 > http [ACK] Seq=293 Ack=484 Win=15744 Len=0  tcp.stream == 0
 19   2.873152 192.168.42.196 -> 119.167.201.251 TCP 74 36918 > http [SYN] Seq=0 Win=14600 Len=0 MSS=1460 SACK_PERM=1 TSval=43225489 TSecr=0 WS=128  tcp.stream == 2
 20   2.982940 119.167.201.251 -> 192.168.42.196 TCP 66 http > 36918 [SYN, ACK] Seq=0 Ack=1 Win=65535 Len=0 MSS=1260 WS=4 SACK_PERM=1  tcp.stream == 2
 21   2.982967 192.168.42.196 -> 119.167.201.251 TCP 54 36918 > http [ACK] Seq=1 Ack=1 Win=14720 Len=0  tcp.stream == 2
 22   2.983054 192.168.42.196 -> 119.167.201.251 HTTP 375 GET / HTTP/1.1   tcp.stream == 2
 23   3.112839 119.167.201.251 -> 192.168.42.196 TCP 54 [TCP Window Update] http > 36918 [ACK] Seq=1 Ack=1 Win=200000 Len=0  tcp.stream == 2
 24   3.264712 119.167.201.251 -> 192.168.42.196 TCP 54 http > 36918 [ACK] Seq=1 Ack=322 Win=200000 Len=0  tcp.stream == 2
 25   3.773203 119.167.201.251 -> 192.168.42.196 HTTP 467 HTTP/1.1 302 Found  (text/html)  tcp.stream == 2
 26   3.773222 192.168.42.196 -> 119.167.201.251 TCP 54 36918 > http [ACK] Seq=322 Ack=414 Win=15744 Len=0  tcp.stream == 2
 27   3.776200 192.168.42.196 -> 119.167.201.251 HTTP 391 GET /index_global.php HTTP/1.1   tcp.stream == 2
 28   3.913458 119.167.201.251 -> 192.168.42.196 TCP 1314 [TCP segment of a reassembled PDU]  tcp.stream == 2
 31   3.923167 119.167.201.251 -> 192.168.42.196 TCP 1314 [TCP segment of a reassembled PDU]  tcp.stream == 2
 32   3.923184 192.168.42.196 -> 119.167.201.251 TCP 54 36918 > http [ACK] Seq=659 Ack=2934 Win=20736 Len=0  tcp.stream == 2
 33   3.924352 192.168.42.196 -> 119.167.201.251 TCP 74 36919 > http [SYN] Seq=0 Win=14600 Len=0 MSS=1460 SACK_PERM=1 TSval=43225751 TSecr=0 WS=128  tcp.stream == 3
 36   3.932919 192.168.42.196 -> 119.167.201.251 TCP 74 36920 > http [SYN] Seq=0 Win=14600 Len=0 MSS=1460 SACK_PERM=1 TSval=43225753 TSecr=0 WS=128  tcp.stream == 4
 37   3.932964 192.168.42.196 -> 119.167.201.251 TCP 74 36921 > http [SYN] Seq=0 Win=14600 Len=0 MSS=1460 SACK_PERM=1 TSval=43225753 TSecr=0 WS=128  tcp.stream == 5
 38   3.933018 192.168.42.196 -> 110.75.5.51  TCP 74 35989 > http [SYN] Seq=0 Win=14600 Len=0 MSS=1460 SACK_PERM=1 TSval=43225754 TSecr=0 WS=128  tcp.stream == 6
 39   3.933164 119.167.201.251 -> 192.168.42.196 TCP 1314 [TCP segment of a reassembled PDU]  tcp.stream == 2
 40   3.943315 119.167.201.251 -> 192.168.42.196 TCP 1314 [TCP segment of a reassembled PDU]  tcp.stream == 2
 41   3.943342 192.168.42.196 -> 119.167.201.251 TCP 54 36918 > http [ACK] Seq=659 Ack=5454 Win=25856 Len=0  tcp.stream == 2
 42   3.943351 119.167.201.251 -> 192.168.42.196 TCP 1314 [TCP segment of a reassembled PDU]  tcp.stream == 2
 43   3.953073 119.167.201.251 -> 192.168.42.196 TCP 1314 [TCP segment of a reassembled PDU]  tcp.stream == 2
 44   3.953089 192.168.42.196 -> 119.167.201.251 TCP 54 36918 > http [ACK] Seq=659 Ack=7974 Win=30848 Len=0  tcp.stream == 2
 48   3.965420 119.167.201.251 -> 192.168.42.196 TCP 1314 [TCP segment of a reassembled PDU]  tcp.stream == 2
 49   3.973332 119.167.201.251 -> 192.168.42.196 TCP 1314 [TCP segment of a reassembled PDU]  tcp.stream == 2
 50   3.973349 192.168.42.196 -> 119.167.201.251 TCP 54 36918 > http [ACK] Seq=659 Ack=10494 Win=35840 Len=0  tcp.stream == 2
 51   3.973356 119.167.201.251 -> 192.168.42.196 TCP 1314 [TCP segment of a reassembled PDU]  tcp.stream == 2
 52   3.984172 119.167.201.251 -> 192.168.42.196 TCP 1314 [TCP segment of a reassembled PDU]  tcp.stream == 2
 53   3.984191 192.168.42.196 -> 119.167.201.251 TCP 54 36918 > http [ACK] Seq=659 Ack=13014 Win=40960 Len=0  tcp.stream == 2
 54   3.992802 119.167.201.251 -> 192.168.42.196 TCP 1314 [TCP segment of a reassembled PDU]  tcp.stream == 2
 59   4.008509 192.168.42.196 -> 125.76.247.250 TCP 74 57486 > http [SYN] Seq=0 Win=14600 Len=0 MSS=1460 SACK_PERM=1 TSval=43225772 TSecr=0 WS=128  tcp.stream == 7
 60   4.008634 192.168.42.196 -> 125.76.247.250 TCP 74 57487 > http [SYN] Seq=0 Win=14600 Len=0 MSS=1460 SACK_PERM=1 TSval=43225772 TSecr=0 WS=128  tcp.stream == 8
 61   4.029005 192.168.42.196 -> 119.167.201.251 TCP 54 36918 > http [ACK] Seq=659 Ack=14274 Win=43392 Len=0  tcp.stream == 2
 62   4.043297 119.167.201.251 -> 192.168.42.196 TCP 1314 [TCP segment of a reassembled PDU]  tcp.stream == 2
 63   4.043314 192.168.42.196 -> 119.167.201.251 TCP 54 36918 > http [ACK] Seq=659 Ack=15534 Win=45952 Len=0  tcp.stream == 2
 64   4.049201 192.168.42.196 -> 125.76.247.250 TCP 74 57488 > http [SYN] Seq=0 Win=14600 Len=0 MSS=1460 SACK_PERM=1 TSval=43225783 TSecr=0 WS=128  tcp.stream == 9
 65   4.052920 119.167.201.251 -> 192.168.42.196 TCP 1314 [TCP segment of a reassembled PDU]  tcp.stream == 2
 66   4.052941 192.168.42.196 -> 119.167.201.251 TCP 54 36918 > http [ACK] Seq=659 Ack=16794 Win=48512 Len=0  tcp.stream == 2
 67   4.064174 119.167.201.251 -> 192.168.42.196 TCP 1314 [TCP segment of a reassembled PDU]  tcp.stream == 2
 68   4.064192 192.168.42.196 -> 119.167.201.251 TCP 54 36918 > http [ACK] Seq=659 Ack=18054 Win=51072 Len=0  tcp.stream == 2
 69   4.064197 119.167.201.251 -> 192.168.42.196 TCP 66 http > 36919 [SYN, ACK] Seq=0 Ack=1 Win=65535 Len=0 MSS=1260 WS=4 SACK_PERM=1  tcp.stream == 3
 70   4.064206 192.168.42.196 -> 119.167.201.251 TCP 54 36919 > http [ACK] Seq=1 Ack=1 Win=14720 Len=0  tcp.stream == 3
 71   4.064285 119.167.201.251 -> 192.168.42.196 TCP 66 http > 36920 [SYN, ACK] Seq=0 Ack=1 Win=65535 Len=0 MSS=1260 WS=4 SACK_PERM=1  tcp.stream == 4
 72   4.064292 192.168.42.196 -> 119.167.201.251 TCP 54 36920 > http [ACK] Seq=1 Ack=1 Win=14720 Len=0  tcp.stream == 4
 73   4.064296 119.167.201.251 -> 192.168.42.196 TCP 66 http > 36921 [SYN, ACK] Seq=0 Ack=1 Win=65535 Len=0 MSS=1260 WS=4 SACK_PERM=1  tcp.stream == 5
 74   4.064300 192.168.42.196 -> 119.167.201.251 TCP 54 36921 > http [ACK] Seq=1 Ack=1 Win=14720 Len=0  tcp.stream == 5
 75   4.064308  110.75.5.51 -> 192.168.42.196 TCP 66 http > 35989 [SYN, ACK] Seq=0 Ack=1 Win=65535 Len=0 MSS=1260 WS=4 SACK_PERM=1  tcp.stream == 6
 76   4.064312 192.168.42.196 -> 110.75.5.51  TCP 54 35989 > http [ACK] Seq=1 Ack=1 Win=14720 Len=0  tcp.stream == 6
 77   4.064377 192.168.42.196 -> 119.167.201.251 HTTP 402 GET /??p/global/1.0/global-min.css?t=2012011120110301.css HTTP/1.1   tcp.stream == 3
 78   4.064437 192.168.42.196 -> 119.167.201.251 HTTP 783 GET /p/fp/2011hk/??html5-reset.css,global.css,header/header.css,attraction/attraction.css,bottom-gg/bottom-gg.css,category/category.css,category-sub-recom/category-sub-recom.css,footer/footer.css,header/header.css,header/header-logo-info.css,help/help.css,most-popular/most-popular.css,pavilion/pavilion.css,sell-top/sell-top.css,site-nav/site-nav.css,sub-promotion/sub-promotion.css,top10/top10.css,subfooter/subfooter.css?t=20111110.css HTTP/1.1   tcp.stream == 4
 79   4.064451 192.168.42.196 -> 119.167.201.251 HTTP 412 GET /??s/kissy/1.1.6/kissy-min.js,p/global/1.0/global-min.js?t=2012011120110301.js HTTP/1.1   tcp.stream == 5
 80   4.064461 192.168.42.196 -> 110.75.5.51  HTTP 348 GET /tbk_inf.js HTTP/1.1   tcp.stream == 6
 81   4.071916 192.168.42.196 -> 125.76.247.250 TCP 74 57489 > http [SYN] Seq=0 Win=14600 Len=0 MSS=1460 SACK_PERM=1 TSval=43225788 TSecr=0 WS=128  tcp.stream == 10
 82   4.072004 192.168.42.196 -> 125.76.247.250 TCP 74 57490 > http [SYN] Seq=0 Win=14600 Len=0 MSS=1460 SACK_PERM=1 TSval=43225788 TSecr=0 WS=128  tcp.stream == 11
 83   4.073420 119.167.201.251 -> 192.168.42.196 TCP 1314 [TCP segment of a reassembled PDU]  tcp.stream == 2
 84   4.073438 192.168.42.196 -> 119.167.201.251 TCP 54 36918 > http [ACK] Seq=659 Ack=19314 Win=53504 Len=0  tcp.stream == 2
 85   4.073445 119.167.201.251 -> 192.168.42.196 TCP 1314 [TCP segment of a reassembled PDU]  tcp.stream == 2
 86   4.073447 192.168.42.196 -> 119.167.201.251 TCP 54 36918 > http [ACK] Seq=659 Ack=20574 Win=56064 Len=0  tcp.stream == 2
 87   4.084047 119.167.201.251 -> 192.168.42.196 TCP 1314 [TCP segment of a reassembled PDU]  tcp.stream == 2
 88   4.084066 192.168.42.196 -> 119.167.201.251 TCP 54 36918 > http [ACK] Seq=659 Ack=21834 Win=58624 Len=0  tcp.stream == 2
 89   4.084160 119.167.201.251 -> 192.168.42.196 TCP 1314 [TCP segment of a reassembled PDU]  tcp.stream == 2
 90   4.084165 192.168.42.196 -> 119.167.201.251 TCP 54 36918 > http [ACK] Seq=659 Ack=23094 Win=61056 Len=0  tcp.stream == 2
 91   4.088770 192.168.42.196 -> 125.76.247.250 TCP 74 57491 > http [SYN] Seq=0 Win=14600 Len=0 MSS=1460 SACK_PERM=1 TSval=43225792 TSecr=0 WS=128  tcp.stream == 12
 92   4.093045 119.167.201.251 -> 192.168.42.196 TCP 1314 [TCP segment of a reassembled PDU]  tcp.stream == 2
 93   4.093065 192.168.42.196 -> 119.167.201.251 TCP 54 36918 > http [ACK] Seq=659 Ack=24354 Win=63616 Len=0  tcp.stream == 2
 94   4.102921 119.167.201.251 -> 192.168.42.196 TCP 1314 [TCP segment of a reassembled PDU]  tcp.stream == 2
 95   4.102937 192.168.42.196 -> 119.167.201.251 TCP 54 36918 > http [ACK] Seq=659 Ack=25614 Win=64128 Len=0  tcp.stream == 2
103   4.114219 192.168.42.196 -> 125.76.247.240 TCP 74 35599 > http [SYN] Seq=0 Win=14600 Len=0 MSS=1460 SACK_PERM=1 TSval=43225799 TSecr=0 WS=128  tcp.stream == 13
104   4.114258 192.168.42.196 -> 125.76.247.240 TCP 74 35600 > http [SYN] Seq=0 Win=14600 Len=0 MSS=1460 SACK_PERM=1 TSval=43225799 TSecr=0 WS=128  tcp.stream == 14
105   4.114284 192.168.42.196 -> 125.76.247.240 TCP 74 35601 > http [SYN] Seq=0 Win=14600 Len=0 MSS=1460 SACK_PERM=1 TSval=43225799 TSecr=0 WS=128  tcp.stream == 15
106   4.114310 192.168.42.196 -> 125.76.247.240 TCP 74 35602 > http [SYN] Seq=0 Win=14600 Len=0 MSS=1460 SACK_PERM=1 TSval=43225799 TSecr=0 WS=128  tcp.stream == 16
107   4.114333 192.168.42.196 -> 125.76.247.240 TCP 74 35603 > http [SYN] Seq=0 Win=14600 Len=0 MSS=1460 SACK_PERM=1 TSval=43225799 TSecr=0 WS=128  tcp.stream == 17
108   4.114358 192.168.42.196 -> 125.76.247.240 TCP 74 35604 > http [SYN] Seq=0 Win=14600 Len=0 MSS=1460 SACK_PERM=1 TSval=43225799 TSecr=0 WS=128  tcp.stream == 18
109   4.125819 119.167.201.251 -> 192.168.42.196 TCP 1314 [TCP segment of a reassembled PDU]  tcp.stream == 2
110   4.125841 192.168.42.196 -> 119.167.201.251 TCP 54 36918 > http [ACK] Seq=659 Ack=26874 Win=64128 Len=0  tcp.stream == 2
111   4.125851 119.167.201.251 -> 192.168.42.196 TCP 1314 [TCP segment of a reassembled PDU]  tcp.stream == 2
112   4.125854 192.168.42.196 -> 119.167.201.251 TCP 54 36918 > http [ACK] Seq=659 Ack=28134 Win=62976 Len=0  tcp.stream == 2
113   4.133047 119.167.201.251 -> 192.168.42.196 TCP 1314 [TCP segment of a reassembled PDU]  tcp.stream == 2
114   4.133065 192.168.42.196 -> 119.167.201.251 TCP 54 36918 > http [ACK] Seq=659 Ack=29394 Win=64128 Len=0  tcp.stream == 2
115   4.143034 192.168.42.196 -> 119.167.201.251 TCP 74 36935 > http [SYN] Seq=0 Win=14600 Len=0 MSS=1460 SACK_PERM=1 TSval=43225806 TSecr=0 WS=128  tcp.stream == 19
116   4.143053 119.167.201.251 -> 192.168.42.196 TCP 1314 [TCP segment of a reassembled PDU]  tcp.stream == 2
117   4.143063 192.168.42.196 -> 119.167.201.251 TCP 54 36918 > http [ACK] Seq=659 Ack=30654 Win=64128 Len=0  tcp.stream == 2
118   4.143069 119.167.201.251 -> 192.168.42.196 HTTP 374 HTTP/1.1 200 OK  (text/html)  tcp.stream == 2
119   4.143072 192.168.42.196 -> 119.167.201.251 TCP 54 36918 > http [ACK] Seq=659 Ack=30974 Win=63872 Len=0  tcp.stream == 2
120   4.143074 125.76.247.250 -> 192.168.42.196 TCP 66 http > 57486 [SYN, ACK] Seq=0 Ack=1 Win=65535 Len=0 MSS=1260 WS=4 SACK_PERM=1  tcp.stream == 7
121   4.143084 192.168.42.196 -> 125.76.247.250 TCP 54 57486 > http [ACK] Seq=1 Ack=1 Win=14720 Len=0  tcp.stream == 7
122   4.143088 125.76.247.250 -> 192.168.42.196 TCP 66 http > 57487 [SYN, ACK] Seq=0 Ack=1 Win=65535 Len=0 MSS=1260 WS=4 SACK_PERM=1  tcp.stream == 8
123   4.143092 192.168.42.196 -> 125.76.247.250 TCP 54 57487 > http [ACK] Seq=1 Ack=1 Win=14720 Len=0  tcp.stream == 8
124   4.143176 192.168.42.196 -> 125.76.247.250 HTTP 411 GET /tps/i4/T1hIqwXoldXXXXXXXX-110-135.png HTTP/1.1   tcp.stream == 7
125   4.143190 192.168.42.196 -> 125.76.247.250 HTTP 428 GET /imgextra/i4/91106030/T2_ud7Xh4aXXXXXXXX_!!91106030.png HTTP/1.1   tcp.stream == 8
126   4.162824 125.76.247.250 -> 192.168.42.196 TCP 66 http > 57488 [SYN, ACK] Seq=0 Ack=1 Win=65535 Len=0 MSS=1260 WS=4 SACK_PERM=1  tcp.stream == 9
127   4.162850 192.168.42.196 -> 125.76.247.250 TCP 54 57488 > http [ACK] Seq=1 Ack=1 Win=14720 Len=0  tcp.stream == 9
128   4.162953 192.168.42.196 -> 125.76.247.250 HTTP 411 GET /tps/i4/T1TL5SXcXbXXXXXXXX-163-160.jpg HTTP/1.1   tcp.stream == 9
129   4.182801 119.167.201.251 -> 192.168.42.196 TCP 54 [TCP Window Update] http > 36919 [ACK] Seq=1 Ack=1 Win=200000 Len=0  tcp.stream == 3
130   4.182815 119.167.201.251 -> 192.168.42.196 TCP 54 [TCP Window Update] http > 36920 [ACK] Seq=1 Ack=1 Win=200000 Len=0  tcp.stream == 4
131   4.182816 119.167.201.251 -> 192.168.42.196 TCP 54 [TCP Window Update] http > 36921 [ACK] Seq=1 Ack=1 Win=200000 Len=0  tcp.stream == 5
132   4.182817  110.75.5.51 -> 192.168.42.196 TCP 54 [TCP Window Update] http > 35989 [ACK] Seq=1 Ack=1 Win=200000 Len=0  tcp.stream == 6
133   4.213075 119.167.201.251 -> 192.168.42.196 TCP 1314 [TCP segment of a reassembled PDU]  tcp.stream == 3
134   4.213098 192.168.42.196 -> 119.167.201.251 TCP 54 36919 > http [ACK] Seq=349 Ack=1261 Win=17152 Len=0  tcp.stream == 3
135   4.225170 119.167.201.251 -> 192.168.42.196 TCP 1314 [TCP segment of a reassembled PDU]  tcp.stream == 3
136   4.225189 192.168.42.196 -> 119.167.201.251 TCP 54 36919 > http [ACK] Seq=349 Ack=2521 Win=19712 Len=0  tcp.stream == 3
137   4.233201 119.167.201.251 -> 192.168.42.196 TCP 1314 [TCP segment of a reassembled PDU]  tcp.stream == 3
138   4.233220 192.168.42.196 -> 119.167.201.251 TCP 54 36919 > http [ACK] Seq=349 Ack=3781 Win=22272 Len=0  tcp.stream == 3
139   4.233227 119.167.201.251 -> 192.168.42.196 HTTP 69 HTTP/1.1 200 OK  (text/css)  tcp.stream == 3
140   4.233230 192.168.42.196 -> 119.167.201.251 TCP 54 36919 > http [ACK] Seq=349 Ack=3796 Win=22272 Len=0  tcp.stream == 3
141   4.233348 192.168.42.196 -> 119.167.201.251 HTTP 392 GET /p/fp/2011a/assets/space.gif HTTP/1.1   tcp.stream == 3
142   4.243419 119.167.201.251 -> 192.168.42.196 TCP 1314 [TCP segment of a reassembled PDU]  tcp.stream == 4
143   4.243439 192.168.42.196 -> 119.167.201.251 TCP 54 36920 > http [ACK] Seq=730 Ack=1261 Win=17152 Len=0  tcp.stream == 4
144   4.243450 119.167.201.251 -> 192.168.42.196 TCP 1314 [TCP segment of a reassembled PDU]  tcp.stream == 4
145   4.243461 192.168.42.196 -> 119.167.201.251 TCP 54 36920 > http [ACK] Seq=730 Ack=2521 Win=19712 Len=0  tcp.stream == 4
146   4.252921 119.167.201.251 -> 192.168.42.196 TCP 1314 [TCP segment of a reassembled PDU]  tcp.stream == 4
147   4.252936 192.168.42.196 -> 119.167.201.251 TCP 54 36920 > http [ACK] Seq=730 Ack=3781 Win=22272 Len=0  tcp.stream == 4
148   4.262939 119.167.201.251 -> 192.168.42.196 TCP 1314 [TCP segment of a reassembled PDU]  tcp.stream == 4
149   4.262958 192.168.42.196 -> 119.167.201.251 TCP 54 36920 > http [ACK] Seq=730 Ack=5041 Win=24704 Len=0  tcp.stream == 4
150   4.273167 119.167.201.251 -> 192.168.42.196 TCP 1314 [TCP segment of a reassembled PDU]  tcp.stream == 4
151   4.273183 192.168.42.196 -> 119.167.201.251 TCP 54 36920 > http [ACK] Seq=730 Ack=6301 Win=27264 Len=0  tcp.stream == 4
152   4.273189 119.167.201.251 -> 192.168.42.196 TCP 1314 [TCP segment of a reassembled PDU]  tcp.stream == 4
153   4.273191 192.168.42.196 -> 119.167.201.251 TCP 54 36920 > http [ACK] Seq=730 Ack=7561 Win=29824 Len=0  tcp.stream == 4
154   4.273285 125.76.247.250 -> 192.168.42.196 TCP 66 http > 57489 [SYN, ACK] Seq=0 Ack=1 Win=65535 Len=0 MSS=1260 WS=4 SACK_PERM=1  tcp.stream == 10
155   4.273296 192.168.42.196 -> 125.76.247.250 TCP 54 57489 > http [ACK] Seq=1 Ack=1 Win=14720 Len=0  tcp.stream == 10
156   4.273299 125.76.247.250 -> 192.168.42.196 TCP 66 http > 57490 [SYN, ACK] Seq=0 Ack=1 Win=65535 Len=0 MSS=1260 WS=4 SACK_PERM=1  tcp.stream == 11
157   4.273303 192.168.42.196 -> 125.76.247.250 TCP 54 57490 > http [ACK] Seq=1 Ack=1 Win=14720 Len=0  tcp.stream == 11
158   4.273358 192.168.42.196 -> 125.76.247.250 HTTP 411 GET /tps/i4/T1nBeRXe0dXXXXXXXX-250-125.jpg HTTP/1.1   tcp.stream == 10
159   4.273372 192.168.42.196 -> 125.76.247.250 HTTP 411 GET /tps/i4/T1mwSRXlhpXXXXXXXX-250-125.jpg HTTP/1.1   tcp.stream == 11
160   4.283450 119.167.201.251 -> 192.168.42.196 TCP 1314 [TCP segment of a reassembled PDU]  tcp.stream == 4
161   4.283471 192.168.42.196 -> 119.167.201.251 TCP 54 36920 > http [ACK] Seq=730 Ack=8821 Win=32256 Len=0  tcp.stream == 4
162   4.292809 119.167.201.251 -> 192.168.42.196 TCP 1314 [TCP segment of a reassembled PDU]  tcp.stream == 5
163   4.292843 192.168.42.196 -> 119.167.201.251 TCP 54 36921 > http [ACK] Seq=359 Ack=1261 Win=17152 Len=0  tcp.stream == 5
164   4.304330 119.167.201.251 -> 192.168.42.196 TCP 1314 [TCP segment of a reassembled PDU]  tcp.stream == 5
165   4.304352 192.168.42.196 -> 119.167.201.251 TCP 54 36921 > http [ACK] Seq=359 Ack=2521 Win=19712 Len=0  tcp.stream == 5
166   4.304359 119.167.201.251 -> 192.168.42.196 HTTP 852 HTTP/1.1 200 OK  (text/css)  tcp.stream == 4
167   4.304362 192.168.42.196 -> 119.167.201.251 TCP 54 36920 > http [ACK] Seq=730 Ack=9619 Win=34816 Len=0  tcp.stream == 4
168   4.304365 119.167.201.251 -> 192.168.42.196 TCP 1314 [TCP segment of a reassembled PDU]  tcp.stream == 5
169   4.304366 192.168.42.196 -> 119.167.201.251 TCP 54 36921 > http [ACK] Seq=359 Ack=3781 Win=22272 Len=0  tcp.stream == 5
170   4.333081 125.76.247.240 -> 192.168.42.196 TCP 66 http > 35602 [SYN, ACK] Seq=0 Ack=1 Win=65535 Len=0 MSS=1260 WS=4 SACK_PERM=1  tcp.stream == 16
171   4.333105 192.168.42.196 -> 125.76.247.240 TCP 54 35602 > http [ACK] Seq=1 Ack=1 Win=14720 Len=0  tcp.stream == 16
172   4.333112 125.76.247.240 -> 192.168.42.196 TCP 66 http > 35603 [SYN, ACK] Seq=0 Ack=1 Win=65535 Len=0 MSS=1260 WS=4 SACK_PERM=1  tcp.stream == 17
173   4.333116 192.168.42.196 -> 125.76.247.240 TCP 54 35603 > http [ACK] Seq=1 Ack=1 Win=14720 Len=0  tcp.stream == 17
174   4.333118 125.76.247.240 -> 192.168.42.196 TCP 66 http > 35600 [SYN, ACK] Seq=0 Ack=1 Win=65535 Len=0 MSS=1260 WS=4 SACK_PERM=1  tcp.stream == 14
175   4.333120 192.168.42.196 -> 125.76.247.240 TCP 54 35600 > http [ACK] Seq=1 Ack=1 Win=14720 Len=0  tcp.stream == 14
176   4.333122 125.76.247.240 -> 192.168.42.196 TCP 66 http > 35604 [SYN, ACK] Seq=0 Ack=1 Win=65535 Len=0 MSS=1260 WS=4 SACK_PERM=1  tcp.stream == 18
177   4.333125 192.168.42.196 -> 125.76.247.240 TCP 54 35604 > http [ACK] Seq=1 Ack=1 Win=14720 Len=0  tcp.stream == 18
178   4.333126 125.76.247.240 -> 192.168.42.196 TCP 66 http > 35601 [SYN, ACK] Seq=0 Ack=1 Win=65535 Len=0 MSS=1260 WS=4 SACK_PERM=1  tcp.stream == 15
179   4.333129 192.168.42.196 -> 125.76.247.240 TCP 54 35601 > http [ACK] Seq=1 Ack=1 Win=14720 Len=0  tcp.stream == 15
180   4.333131 125.76.247.250 -> 192.168.42.196 TCP 66 http > 57491 [SYN, ACK] Seq=0 Ack=1 Win=65535 Len=0 MSS=1260 WS=4 SACK_PERM=1  tcp.stream == 12
181   4.333134 192.168.42.196 -> 125.76.247.250 TCP 54 57491 > http [ACK] Seq=1 Ack=1 Win=14720 Len=0  tcp.stream == 12
182   4.333259 192.168.42.196 -> 125.76.247.250 HTTP 411 GET /tps/i4/T1B4KRXbpoXXXXXXXX-250-125.jpg HTTP/1.1   tcp.stream == 12
183   4.333293 192.168.42.196 -> 125.76.247.240 HTTP 411 GET /tps/i1/T1p_yRXflfXXXXXXXX-440-135.jpg HTTP/1.1   tcp.stream == 14
184   4.333304 192.168.42.196 -> 125.76.247.240 HTTP 411 GET /tps/i1/T1rZiwXgtfXXXXXXXX-110-135.png HTTP/1.1   tcp.stream == 15
185   4.333333 192.168.42.196 -> 125.76.247.240 HTTP 411 GET /tps/i1/T1FfyRXm0oXXXXXXXX-110-135.png HTTP/1.1   tcp.stream == 16
186   4.333347 192.168.42.196 -> 125.76.247.240 HTTP 409 GET /tps/i1/T1cc9cXcdcXXXXXXXX-70-30.png HTTP/1.1   tcp.stream == 17
187   4.333357 192.168.42.196 -> 125.76.247.240 HTTP 409 GET /tps/i1/T1j5qGXcVuXXXXXXXX-70-30.png HTTP/1.1   tcp.stream == 18
189   4.333578 192.168.42.196 -> 125.76.247.240 TCP 74 35606 > http [SYN] Seq=0 Win=14600 Len=0 MSS=1460 SACK_PERM=1 TSval=43225854 TSecr=0 WS=128  tcp.stream == 20
190   4.333609 192.168.42.196 -> 125.76.247.240 TCP 74 35607 > http [SYN] Seq=0 Win=14600 Len=0 MSS=1460 SACK_PERM=1 TSval=43225854 TSecr=0 WS=128  tcp.stream == 21
191   4.333634 192.168.42.196 -> 125.76.247.240 TCP 74 35608 > http [SYN] Seq=0 Win=14600 Len=0 MSS=1460 SACK_PERM=1 TSval=43225854 TSecr=0 WS=128  tcp.stream == 22
192   4.333668 192.168.42.196 -> 125.76.247.240 TCP 74 35609 > http [SYN] Seq=0 Win=14600 Len=0 MSS=1460 SACK_PERM=1 TSval=43225854 TSecr=0 WS=128  tcp.stream == 23
193   4.333692 192.168.42.196 -> 125.76.247.240 TCP 74 35610 > http [SYN] Seq=0 Win=14600 Len=0 MSS=1460 SACK_PERM=1 TSval=43225854 TSecr=0 WS=128  tcp.stream == 24
194   4.333716 192.168.42.196 -> 125.76.247.240 TCP 74 35611 > http [SYN] Seq=0 Win=14600 Len=0 MSS=1460 SACK_PERM=1 TSval=43225854 TSecr=0 WS=128  tcp.stream == 25
195   4.345947 119.167.201.251 -> 192.168.42.196 TCP 1314 [TCP segment of a reassembled PDU]  tcp.stream == 5
196   4.345966 192.168.42.196 -> 119.167.201.251 TCP 54 36921 > http [ACK] Seq=359 Ack=5041 Win=24704 Len=0  tcp.stream == 5
197   4.346033 119.167.201.251 -> 192.168.42.196 TCP 1314 [TCP segment of a reassembled PDU]  tcp.stream == 5
198   4.346038 192.168.42.196 -> 119.167.201.251 TCP 54 36921 > http [ACK] Seq=359 Ack=6301 Win=27264 Len=0  tcp.stream == 5
199   4.346041 119.167.201.251 -> 192.168.42.196 TCP 1314 [TCP segment of a reassembled PDU]  tcp.stream == 5
200   4.346046 192.168.42.196 -> 119.167.201.251 TCP 54 36921 > http [ACK] Seq=359 Ack=7561 Win=29824 Len=0  tcp.stream == 5
201   4.346161 119.167.201.251 -> 192.168.42.196 TCP 1314 [TCP segment of a reassembled PDU]  tcp.stream == 5
202   4.346168 192.168.42.196 -> 119.167.201.251 TCP 54 36921 > http [ACK] Seq=359 Ack=8821 Win=32256 Len=0  tcp.stream == 5
203   4.346172 125.76.247.240 -> 192.168.42.196 TCP 66 http > 35599 [SYN, ACK] Seq=0 Ack=1 Win=65535 Len=0 MSS=1260 WS=4 SACK_PERM=1  tcp.stream == 13
204   4.346180 192.168.42.196 -> 125.76.247.240 TCP 54 35599 > http [ACK] Seq=1 Ack=1 Win=14720 Len=0  tcp.stream == 13
205   4.346279 192.168.42.196 -> 125.76.247.240 HTTP 409 GET /tps/i1/T1bfGRXgXsXXXXXXXX-70-40.gif HTTP/1.1   tcp.stream == 13
206   4.353328 119.167.201.251 -> 192.168.42.196 TCP 66 http > 36935 [SYN, ACK] Seq=0 Ack=1 Win=65535 Len=0 MSS=1260 WS=4 SACK_PERM=1  tcp.stream == 19
207   4.353352 192.168.42.196 -> 119.167.201.251 TCP 54 36935 > http [ACK] Seq=1 Ack=1 Win=14720 Len=0  tcp.stream == 19
208   4.353358 125.76.247.250 -> 192.168.42.196 TCP 54 http > 57486 [ACK] Seq=1 Ack=358 Win=200000 Len=0  tcp.stream == 7
209   4.353363 125.76.247.250 -> 192.168.42.196 TCP 54 http > 57488 [ACK] Seq=1 Ack=358 Win=200000 Len=0  tcp.stream == 9
210   4.353365 125.76.247.250 -> 192.168.42.196 TCP 1314 [TCP segment of a reassembled PDU]  tcp.stream == 9
211   4.353368 192.168.42.196 -> 125.76.247.250 TCP 54 57488 > http [ACK] Seq=358 Ack=1261 Win=17152 Len=0  tcp.stream == 9
212   4.353370 125.76.247.250 -> 192.168.42.196 TCP 54 http > 57487 [ACK] Seq=1 Ack=375 Win=200000 Len=0  tcp.stream == 8
214   4.353768 192.168.42.196 -> 125.76.224.250 TCP 74 46415 > http [SYN] Seq=0 Win=14600 Len=0 MSS=1460 SACK_PERM=1 TSval=43225859 TSecr=0 WS=128  tcp.stream == 26
215   4.353811 192.168.42.196 -> 125.76.224.250 TCP 74 46416 > http [SYN] Seq=0 Win=14600 Len=0 MSS=1460 SACK_PERM=1 TSval=43225859 TSecr=0 WS=128  tcp.stream == 27
216   4.353846 192.168.42.196 -> 125.76.224.250 TCP 74 46417 > http [SYN] Seq=0 Win=14600 Len=0 MSS=1460 SACK_PERM=1 TSval=43225859 TSecr=0 WS=128  tcp.stream == 28
217   4.353877 192.168.42.196 -> 125.76.224.250 TCP 74 46418 > http [SYN] Seq=0 Win=14600 Len=0 MSS=1460 SACK_PERM=1 TSval=43225859 TSecr=0 WS=128  tcp.stream == 29
218   4.353924 192.168.42.196 -> 125.76.224.250 TCP 74 46419 > http [SYN] Seq=0 Win=14600 Len=0 MSS=1460 SACK_PERM=1 TSval=43225859 TSecr=0 WS=128  tcp.stream == 30
219   4.353957 192.168.42.196 -> 125.76.224.250 TCP 74 46420 > http [SYN] Seq=0 Win=14600 Len=0 MSS=1460 SACK_PERM=1 TSval=43225859 TSecr=0 WS=128  tcp.stream == 31
220   4.362822 119.167.201.251 -> 192.168.42.196 TCP 1314 [TCP segment of a reassembled PDU]  tcp.stream == 5
221   4.362840 192.168.42.196 -> 119.167.201.251 TCP 54 36921 > http [ACK] Seq=359 Ack=10081 Win=34816 Len=0  tcp.stream == 5
222   4.372952 119.167.201.251 -> 192.168.42.196 TCP 1314 [TCP segment of a reassembled PDU]  tcp.stream == 5
223   4.372971 192.168.42.196 -> 119.167.201.251 TCP 54 36921 > http [ACK] Seq=359 Ack=11341 Win=37376 Len=0  tcp.stream == 5
224   4.372978 125.76.247.250 -> 192.168.42.196 TCP 1314 [TCP segment of a reassembled PDU]  tcp.stream == 9
225   4.372989 192.168.42.196 -> 125.76.247.250 TCP 54 57488 > http [ACK] Seq=358 Ack=2521 Win=19712 Len=0  tcp.stream == 9
226   4.382824 125.76.247.250 -> 192.168.42.196 TCP 1314 [TCP segment of a reassembled PDU]  tcp.stream == 8
227   4.382843 192.168.42.196 -> 125.76.247.250 TCP 54 57487 > http [ACK] Seq=375 Ack=1261 Win=17152 Len=0  tcp.stream == 8
228   4.392967 125.76.247.250 -> 192.168.42.196 TCP 1314 [TCP segment of a reassembled PDU]  tcp.stream == 8
229   4.393013 192.168.42.196 -> 125.76.247.250 TCP 54 57487 > http [ACK] Seq=375 Ack=2521 Win=19712 Len=0  tcp.stream == 8
230   4.402950 125.76.247.250 -> 192.168.42.196 TCP 1314 [TCP segment of a reassembled PDU]  tcp.stream == 7
231   4.402969 192.168.42.196 -> 125.76.247.250 TCP 54 57486 > http [ACK] Seq=358 Ack=1261 Win=17152 Len=0  tcp.stream == 7
232   4.402976 125.76.247.250 -> 192.168.42.196 TCP 1314 [TCP segment of a reassembled PDU]  tcp.stream == 7
233   4.402979 192.168.42.196 -> 125.76.247.250 TCP 54 57486 > http [ACK] Seq=358 Ack=2521 Win=19712 Len=0  tcp.stream == 7
234   4.424452 119.167.201.251 -> 192.168.42.196 TCP 1314 [TCP segment of a reassembled PDU]  tcp.stream == 5
235   4.424471 192.168.42.196 -> 119.167.201.251 TCP 54 36921 > http [ACK] Seq=359 Ack=12601 Win=39808 Len=0  tcp.stream == 5
236   4.424479 119.167.201.251 -> 192.168.42.196 TCP 1314 [TCP segment of a reassembled PDU]  tcp.stream == 5
237   4.424482 192.168.42.196 -> 119.167.201.251 TCP 54 36921 > http [ACK] Seq=359 Ack=13861 Win=42368 Len=0  tcp.stream == 5
238   4.433318 125.76.247.250 -> 192.168.42.196 TCP 1314 [TCP segment of a reassembled PDU]  tcp.stream == 9
239   4.433337 192.168.42.196 -> 125.76.247.250 TCP 54 57488 > http [ACK] Seq=358 Ack=3781 Win=22272 Len=0  tcp.stream == 9
240   4.433345 125.76.247.250 -> 192.168.42.196 TCP 1314 [TCP segment of a reassembled PDU]  tcp.stream == 9
241   4.433348 192.168.42.196 -> 125.76.247.250 TCP 54 57488 > http [ACK] Seq=358 Ack=5041 Win=24704 Len=0  tcp.stream == 9
242   4.453204 125.76.247.250 -> 192.168.42.196 TCP 1314 [TCP segment of a reassembled PDU]  tcp.stream == 7
243   4.453223 192.168.42.196 -> 125.76.247.250 TCP 54 57486 > http [ACK] Seq=358 Ack=3781 Win=22272 Len=0  tcp.stream == 7
244   4.453230 125.76.247.250 -> 192.168.42.196 HTTP 135 HTTP/1.1 200 OK  (JPEG JFIF image)  tcp.stream == 9
245   4.453233 192.168.42.196 -> 125.76.247.250 TCP 54 57488 > http [ACK] Seq=358 Ack=5122 Win=24704 Len=0  tcp.stream == 9
246   4.453236 125.76.247.250 -> 192.168.42.196 TCP 1314 [TCP segment of a reassembled PDU]  tcp.stream == 7
247   4.453238 192.168.42.196 -> 125.76.247.250 TCP 54 57486 > http [ACK] Seq=358 Ack=5041 Win=24704 Len=0  tcp.stream == 7
248   4.453387 192.168.42.196 -> 125.76.247.250 HTTP 411 GET /tps/i4/T1Wz5RXlJhXXXXXXXX-250-125.jpg HTTP/1.1   tcp.stream == 9
249   4.463200 125.76.247.250 -> 192.168.42.196 HTTP 134 HTTP/1.1 200 OK  (PNG)  tcp.stream == 7
250   4.463220 192.168.42.196 -> 125.76.247.250 TCP 54 57486 > http [ACK] Seq=358 Ack=5121 Win=24704 Len=0  tcp.stream == 7
251   4.463228 125.76.247.250 -> 192.168.42.196 TCP 1314 [TCP segment of a reassembled PDU]  tcp.stream == 8
252   4.463230 192.168.42.196 -> 125.76.247.250 TCP 54 57487 > http [ACK] Seq=375 Ack=3781 Win=22272 Len=0  tcp.stream == 8
253   4.463362 192.168.42.196 -> 125.76.247.250 HTTP 411 GET /tps/i4/T1.eyRXiXuXXXXXXXX-190-250.jpg HTTP/1.1   tcp.stream == 7
254   4.474451 125.76.247.250 -> 192.168.42.196 HTTP 1012 HTTP/1.1 200 OK  (PNG)  tcp.stream == 8
255   4.474470 192.168.42.196 -> 125.76.247.250 TCP 54 57487 > http [ACK] Seq=375 Ack=4739 Win=24704 Len=0  tcp.stream == 8
256   4.474478  110.75.5.51 -> 192.168.42.196 TCP 54 http > 35989 [ACK] Seq=1 Ack=295 Win=200000 Len=0  tcp.stream == 6
257   4.474484 119.167.201.251 -> 192.168.42.196 HTTP 366 HTTP/1.1 200 OK  (GIF89a)  tcp.stream == 3
258   4.474488 125.76.247.250 -> 192.168.42.196 TCP 54 [TCP Window Update] http > 57490 [ACK] Seq=1 Ack=1 Win=200000 Len=0  tcp.stream == 11
259   4.474491 125.76.247.250 -> 192.168.42.196 TCP 54 [TCP Window Update] http > 57489 [ACK] Seq=1 Ack=1 Win=200000 Len=0  tcp.stream == 10
260   4.474700 192.168.42.196 -> 125.76.247.250 HTTP 411 GET /tps/i4/T1aJuRXhlwXXXXXXXX-250-125.jpg HTTP/1.1   tcp.stream == 8
261   4.483922 125.76.247.250 -> 192.168.42.196 TCP 1314 [TCP segment of a reassembled PDU]  tcp.stream == 11
262   4.483943 192.168.42.196 -> 125.76.247.250 TCP 54 57490 > http [ACK] Seq=358 Ack=1261 Win=17152 Len=0  tcp.stream == 11
263   4.483952 125.76.247.250 -> 192.168.42.196 TCP 1314 [TCP segment of a reassembled PDU]  tcp.stream == 11
264   4.483955 192.168.42.196 -> 125.76.247.250 TCP 54 57490 > http [ACK] Seq=358 Ack=2521 Win=19712 Len=0  tcp.stream == 11
265   4.493165 125.76.247.250 -> 192.168.42.196 TCP 1314 [TCP segment of a reassembled PDU]  tcp.stream == 10
266   4.493188 192.168.42.196 -> 125.76.247.250 TCP 54 57489 > http [ACK] Seq=358 Ack=1261 Win=17152 Len=0  tcp.stream == 10
267   4.502823 125.76.247.250 -> 192.168.42.196 TCP 1314 [TCP segment of a reassembled PDU]  tcp.stream == 10
268   4.502841 192.168.42.196 -> 125.76.247.250 TCP 54 57489 > http [ACK] Seq=358 Ack=2521 Win=19712 Len=0  tcp.stream == 10
269   4.512949 125.76.247.250 -> 192.168.42.196 TCP 1314 [TCP segment of a reassembled PDU]  tcp.stream == 10
270   4.512968 192.168.42.196 -> 125.76.247.250 TCP 54 57489 > http [ACK] Seq=358 Ack=3781 Win=22272 Len=0  tcp.stream == 10
271   4.512989 192.168.42.196 -> 119.167.201.251 TCP 54 36919 > http [ACK] Seq=687 Ack=4108 Win=24704 Len=0  tcp.stream == 3
272   4.523326 125.76.247.250 -> 192.168.42.196 TCP 1314 [TCP segment of a reassembled PDU]  tcp.stream == 10
273   4.523347 192.168.42.196 -> 125.76.247.250 TCP 54 57489 > http [ACK] Seq=358 Ack=5041 Win=24704 Len=0  tcp.stream == 10
274   4.523354 125.76.247.250 -> 192.168.42.196 HTTP 317 HTTP/1.1 200 OK  (JPEG JFIF image)  tcp.stream == 10
275   4.523357 192.168.42.196 -> 125.76.247.250 TCP 54 57489 > http [ACK] Seq=358 Ack=5304 Win=27264 Len=0  tcp.stream == 10
276   4.523487 192.168.42.196 -> 125.76.247.250 HTTP 410 GET /tps/i4/T1IFmPXf8rXXXXXXXX-296-65.png HTTP/1.1   tcp.stream == 10
277   4.535191 125.76.247.250 -> 192.168.42.196 TCP 1314 [TCP segment of a reassembled PDU]  tcp.stream == 11
278   4.535211 192.168.42.196 -> 125.76.247.250 TCP 54 57490 > http [ACK] Seq=358 Ack=3781 Win=22272 Len=0  tcp.stream == 11
279   4.535218 125.76.247.250 -> 192.168.42.196 HTTP 185 HTTP/1.1 200 OK  (JPEG JFIF image)  tcp.stream == 11
280   4.535222 192.168.42.196 -> 125.76.247.250 TCP 54 57490 > http [ACK] Seq=358 Ack=3912 Win=24704 Len=0  tcp.stream == 11
281   4.535348 192.168.42.196 -> 125.76.247.250 HTTP 411 GET /tps/i4/T1w9COXdRvXXXXXXXX-270-270.jpg HTTP/1.1   tcp.stream == 11
282   4.543441 119.167.201.251 -> 192.168.42.196 TCP 1314 [TCP segment of a reassembled PDU]  tcp.stream == 5
283   4.543472 192.168.42.196 -> 119.167.201.251 TCP 54 36921 > http [ACK] Seq=359 Ack=15121 Win=44928 Len=0  tcp.stream == 5
284   4.543481 119.167.201.251 -> 192.168.42.196 TCP 1314 [TCP segment of a reassembled PDU]  tcp.stream == 5
285   4.543483 192.168.42.196 -> 119.167.201.251 TCP 54 36921 > http [ACK] Seq=359 Ack=16381 Win=47360 Len=0  tcp.stream == 5
286   4.554814 119.167.201.251 -> 192.168.42.196 TCP 1314 [TCP segment of a reassembled PDU]  tcp.stream == 5
287   4.554833 192.168.42.196 -> 119.167.201.251 TCP 54 36921 > http [ACK] Seq=359 Ack=17641 Win=49920 Len=0  tcp.stream == 5
288   4.579419 119.167.201.251 -> 192.168.42.196 TCP 1314 [TCP segment of a reassembled PDU]  tcp.stream == 5
289   4.579438 192.168.42.196 -> 119.167.201.251 TCP 54 36921 > http [ACK] Seq=359 Ack=18901 Win=52480 Len=0  tcp.stream == 5
290   4.579449 119.167.201.251 -> 192.168.42.196 TCP 1314 [TCP segment of a reassembled PDU]  tcp.stream == 5
291   4.579453 192.168.42.196 -> 119.167.201.251 TCP 54 36921 > http [ACK] Seq=359 Ack=20161 Win=55040 Len=0  tcp.stream == 5
292   4.579537 119.167.201.251 -> 192.168.42.196 TCP 1314 [TCP segment of a reassembled PDU]  tcp.stream == 5
293   4.579543 192.168.42.196 -> 119.167.201.251 TCP 54 36921 > http [ACK] Seq=359 Ack=21421 Win=57472 Len=0  tcp.stream == 5
294   4.579551 119.167.201.251 -> 192.168.42.196 TCP 1314 [TCP segment of a reassembled PDU]  tcp.stream == 5
295   4.579554 192.168.42.196 -> 119.167.201.251 TCP 54 36921 > http [ACK] Seq=359 Ack=22681 Win=60032 Len=0  tcp.stream == 5
296   4.593446 119.167.201.251 -> 192.168.42.196 TCP 1314 [TCP segment of a reassembled PDU]  tcp.stream == 5
297   4.593465 192.168.42.196 -> 119.167.201.251 TCP 54 36921 > http [ACK] Seq=359 Ack=23941 Win=62592 Len=0  tcp.stream == 5
298   4.604305 119.167.201.251 -> 192.168.42.196 TCP 1314 [TCP segment of a reassembled PDU]  tcp.stream == 5
299   4.604329 192.168.42.196 -> 119.167.201.251 TCP 54 36921 > http [ACK] Seq=359 Ack=25201 Win=64128 Len=0  tcp.stream == 5
300   4.604336 119.167.201.251 -> 192.168.42.196 HTTP 708 HTTP/1.1 200 OK  (application/x-javascript)  tcp.stream == 5
301   4.604338 192.168.42.196 -> 119.167.201.251 TCP 54 36921 > http [ACK] Seq=359 Ack=25855 Win=63488 Len=0  tcp.stream == 5
302   4.604340 125.76.247.240 -> 192.168.42.196 TCP 54 [TCP Window Update] http > 35602 [ACK] Seq=1 Ack=1 Win=200000 Len=0  tcp.stream == 16
303   4.604344 125.76.247.240 -> 192.168.42.196 TCP 54 [TCP Window Update] http > 35603 [ACK] Seq=1 Ack=1 Win=200000 Len=0  tcp.stream == 17
304   4.604345 125.76.247.240 -> 192.168.42.196 TCP 54 [TCP Window Update] http > 35601 [ACK] Seq=1 Ack=1 Win=200000 Len=0  tcp.stream == 15
305   4.604346 125.76.247.240 -> 192.168.42.196 TCP 54 [TCP Window Update] http > 35604 [ACK] Seq=1 Ack=1 Win=200000 Len=0  tcp.stream == 18
306   4.604347 125.76.247.240 -> 192.168.42.196 TCP 54 [TCP Window Update] http > 35600 [ACK] Seq=1 Ack=1 Win=200000 Len=0  tcp.stream == 14
307   4.604405 125.76.247.250 -> 192.168.42.196 TCP 54 [TCP Window Update] http > 57491 [ACK] Seq=1 Ack=1 Win=200000 Len=0  tcp.stream == 12
308   4.612919 125.76.247.250 -> 192.168.42.196 TCP 1314 [TCP segment of a reassembled PDU]  tcp.stream == 12
309   4.612943 192.168.42.196 -> 125.76.247.250 TCP 54 57491 > http [ACK] Seq=358 Ack=1261 Win=17152 Len=0  tcp.stream == 12
310   4.623297 125.76.247.250 -> 192.168.42.196 TCP 1314 [TCP segment of a reassembled PDU]  tcp.stream == 12
311   4.623316 192.168.42.196 -> 125.76.247.250 TCP 54 57491 > http [ACK] Seq=358 Ack=2521 Win=19712 Len=0  tcp.stream == 12
312   4.624433 192.168.42.196 -> 119.167.201.251 HTTP 385 GET /p/fp/2010c/js/fp-direct-promo-min.js?t=20110601.js HTTP/1.1   tcp.stream == 5
313   4.634951 125.76.247.250 -> 192.168.42.196 TCP 1314 [TCP segment of a reassembled PDU]  tcp.stream == 12
314   4.634972 192.168.42.196 -> 125.76.247.250 TCP 54 57491 > http [ACK] Seq=358 Ack=3781 Win=22272 Len=0  tcp.stream == 12
315   4.634979 125.76.247.250 -> 192.168.42.196 TCP 1314 [TCP segment of a reassembled PDU]  tcp.stream == 12
316   4.634983 192.168.42.196 -> 125.76.247.250 TCP 54 57491 > http [ACK] Seq=358 Ack=5041 Win=24704 Len=0  tcp.stream == 12
317   4.634985 125.76.247.250 -> 192.168.42.196 HTTP 904 HTTP/1.1 200 OK  (JPEG JFIF image)  tcp.stream == 12
318   4.634989 192.168.42.196 -> 125.76.247.250 TCP 54 57491 > http [ACK] Seq=358 Ack=5891 Win=27264 Len=0  tcp.stream == 12
319   4.635161 192.168.42.196 -> 125.76.247.250 HTTP 411 GET /tps/i4/T1_9ijXhNxXXXXXXXX-135-135.png HTTP/1.1   tcp.stream == 12
320   4.652948 125.76.247.240 -> 192.168.42.196 TCP 1314 [TCP segment of a reassembled PDU]  tcp.stream == 16
321   4.652972 192.168.42.196 -> 125.76.247.240 TCP 54 35602 > http [ACK] Seq=358 Ack=1261 Win=17152 Len=0  tcp.stream == 16
322   4.663458 125.76.247.240 -> 192.168.42.196 TCP 1314 [TCP segment of a reassembled PDU]  tcp.stream == 16
323   4.663475 192.168.42.196 -> 125.76.247.240 TCP 54 35602 > http [ACK] Seq=358 Ack=2521 Win=19712 Len=0  tcp.stream == 16
324   4.663482 125.76.247.240 -> 192.168.42.196 TCP 66 http > 35606 [SYN, ACK] Seq=0 Ack=1 Win=65535 Len=0 MSS=1260 WS=4 SACK_PERM=1  tcp.stream == 20
325   4.663491 192.168.42.196 -> 125.76.247.240 TCP 54 35606 > http [ACK] Seq=1 Ack=1 Win=14720 Len=0  tcp.stream == 20
326   4.663493 125.76.247.240 -> 192.168.42.196 TCP 66 http > 35607 [SYN, ACK] Seq=0 Ack=1 Win=65535 Len=0 MSS=1260 WS=4 SACK_PERM=1  tcp.stream == 21
327   4.663496 192.168.42.196 -> 125.76.247.240 TCP 54 35607 > http [ACK] Seq=1 Ack=1 Win=14720 Len=0  tcp.stream == 21
328   4.663498 125.76.247.240 -> 192.168.42.196 TCP 66 http > 35609 [SYN, ACK] Seq=0 Ack=1 Win=65535 Len=0 MSS=1260 WS=4 SACK_PERM=1  tcp.stream == 23
329   4.663501 192.168.42.196 -> 125.76.247.240 TCP 54 35609 > http [ACK] Seq=1 Ack=1 Win=14720 Len=0  tcp.stream == 23
330   4.663503 125.76.247.240 -> 192.168.42.196 TCP 66 http > 35608 [SYN, ACK] Seq=0 Ack=1 Win=65535 Len=0 MSS=1260 WS=4 SACK_PERM=1  tcp.stream == 22
331   4.663506 192.168.42.196 -> 125.76.247.240 TCP 54 35608 > http [ACK] Seq=1 Ack=1 Win=14720 Len=0  tcp.stream == 22
332   4.663508 125.76.247.240 -> 192.168.42.196 TCP 66 http > 35610 [SYN, ACK] Seq=0 Ack=1 Win=65535 Len=0 MSS=1260 WS=4 SACK_PERM=1  tcp.stream == 24
333   4.663510 192.168.42.196 -> 125.76.247.240 TCP 54 35610 > http [ACK] Seq=1 Ack=1 Win=14720 Len=0  tcp.stream == 24
334   4.663512 125.76.247.240 -> 192.168.42.196 TCP 66 http > 35611 [SYN, ACK] Seq=0 Ack=1 Win=65535 Len=0 MSS=1260 WS=4 SACK_PERM=1  tcp.stream == 25
335   4.663524 192.168.42.196 -> 125.76.247.240 TCP 54 35611 > http [ACK] Seq=1 Ack=1 Win=14720 Len=0  tcp.stream == 25
336   4.663670 192.168.42.196 -> 125.76.247.240 HTTP 410 GET /tps/i3/T1ogqgXfXeXXXXXXXX-168-42.png HTTP/1.1   tcp.stream == 20
337   4.663688 192.168.42.196 -> 125.76.247.240 HTTP 408 GET /tps/i3/T1gq9zXlXGXXXXXXXX-15-8.png HTTP/1.1   tcp.stream == 21
