  9   8.054843 192.168.42.196 -> 115.238.23.241 TCP 74 58354 > http [SYN] Seq=0 Win=14600 Len=0 MSS=1460 SACK_PERM=1 TSval=43204417 TSecr=0 WS=128  tcp.stream == 0
 10   8.199055 115.238.23.241 -> 192.168.42.196 TCP 66 http > 58354 [SYN, ACK] Seq=0 Ack=1 Win=65535 Len=0 MSS=1260 WS=4 SACK_PERM=1  tcp.stream == 0
 11   8.199089 192.168.42.196 -> 115.238.23.241 TCP 54 58354 > http [ACK] Seq=1 Ack=1 Win=14720 Len=0  tcp.stream == 0
 12   8.203150 192.168.42.196 -> 115.238.23.241 HTTP 450 GET / HTTP/1.1   tcp.stream == 0
 13   8.349301 115.238.23.241 -> 192.168.42.196 TCP 54 [TCP Window Update] http > 58354 [ACK] Seq=1 Ack=1 Win=200000 Len=0  tcp.stream == 0
 14   8.529305 115.238.23.241 -> 192.168.42.196 TCP 54 http > 58354 [ACK] Seq=1 Ack=397 Win=200000 Len=0  tcp.stream == 0
 15   9.099456 115.238.23.241 -> 192.168.42.196 HTTP 537 HTTP/1.1 302 Moved Temporarily  (text/html)  tcp.stream == 0
 16   9.099473 192.168.42.196 -> 115.238.23.241 TCP 54 58354 > http [ACK] Seq=397 Ack=484 Win=15744 Len=0  tcp.stream == 0
 17   9.115129 192.168.42.196 -> 115.238.23.241 TCP 54 58354 > http [FIN, ACK] Seq=397 Ack=484 Win=15744 Len=0  tcp.stream == 0
 19   9.279419 115.238.23.241 -> 192.168.42.196 TCP 54 http > 58354 [ACK] Seq=484 Ack=398 Win=200000 Len=0  tcp.stream == 0
 20   9.279437 115.238.23.241 -> 192.168.42.196 TCP 54 http > 58354 [FIN, ACK] Seq=484 Ack=398 Win=200000 Len=0  tcp.stream == 0
 21   9.279443 192.168.42.196 -> 115.238.23.241 TCP 54 58354 > http [ACK] Seq=398 Ack=485 Win=15744 Len=0  tcp.stream == 0
 27   9.812540 192.168.42.196 -> 119.167.201.241 TCP 74 36016 > http [SYN] Seq=0 Win=14600 Len=0 MSS=1460 SACK_PERM=1 TSval=43204856 TSecr=0 WS=128  tcp.stream == 1
 28   9.979444 119.167.201.241 -> 192.168.42.196 TCP 66 http > 36016 [SYN, ACK] Seq=0 Ack=1 Win=65535 Len=0 MSS=1260 WS=4 SACK_PERM=1  tcp.stream == 1
 29   9.979476 192.168.42.196 -> 119.167.201.241 TCP 54 36016 > http [ACK] Seq=1 Ack=1 Win=14720 Len=0  tcp.stream == 1
 30   9.981723 192.168.42.196 -> 119.167.201.241 HTTP 479 GET / HTTP/1.1   tcp.stream == 1
 31  10.119563 119.167.201.241 -> 192.168.42.196 TCP 54 [TCP Window Update] http > 36016 [ACK] Seq=1 Ack=1 Win=200000 Len=0  tcp.stream == 1
 32  10.328945 119.167.201.241 -> 192.168.42.196 TCP 54 http > 36016 [ACK] Seq=1 Ack=426 Win=200000 Len=0  tcp.stream == 1
 33  14.813547 119.167.201.241 -> 192.168.42.196 HTTP 534 HTTP/1.1 302 Found  (text/html)  tcp.stream == 1
 34  14.813571 192.168.42.196 -> 119.167.201.241 TCP 54 36016 > http [ACK] Seq=426 Ack=481 Win=15744 Len=0  tcp.stream == 1
 35  14.821277 192.168.42.196 -> 119.167.201.241 TCP 54 36016 > http [FIN, ACK] Seq=426 Ack=481 Win=15744 Len=0  tcp.stream == 1
 37  15.187011 119.167.201.241 -> 192.168.42.196 HTTP 534 [TCP Retransmission] HTTP/1.1 302 Found  (text/html)  tcp.stream == 1
 38  15.187033 192.168.42.196 -> 119.167.201.241 TCP 66 [TCP Dup ACK 35#1] 36016 > http [ACK] Seq=427 Ack=481 Win=15744 Len=0 SLE=1 SRE=481  tcp.stream == 1
 39  15.336906 119.167.201.241 -> 192.168.42.196 TCP 54 http > 36016 [ACK] Seq=481 Ack=427 Win=200000 Len=0  tcp.stream == 1
 40  15.336927 119.167.201.241 -> 192.168.42.196 TCP 54 http > 36016 [FIN, ACK] Seq=481 Ack=427 Win=200000 Len=0  tcp.stream == 1
 41  15.336934 192.168.42.196 -> 119.167.201.241 TCP 54 36016 > http [ACK] Seq=427 Ack=482 Win=15744 Len=0  tcp.stream == 1
 47  16.730549 192.168.42.196 -> 110.75.24.26 TCP 74 47764 > http [SYN] Seq=0 Win=14600 Len=0 MSS=1460 SACK_PERM=1 TSval=43206586 TSecr=0 WS=128  tcp.stream == 2
 48  16.917511 110.75.24.26 -> 192.168.42.196 TCP 66 http > 47764 [SYN, ACK] Seq=0 Ack=1 Win=65535 Len=0 MSS=1260 WS=4 SACK_PERM=1  tcp.stream == 2
 49  16.917542 192.168.42.196 -> 110.75.24.26 TCP 54 47764 > http [ACK] Seq=1 Ack=1 Win=14720 Len=0  tcp.stream == 2
 50  16.919783 192.168.42.196 -> 110.75.24.26 HTTP 492 GET /?sprefer=sypc00 HTTP/1.1   tcp.stream == 2
 51  17.027138 110.75.24.26 -> 192.168.42.196 TCP 54 [TCP Window Update] http > 47764 [ACK] Seq=1 Ack=1 Win=200000 Len=0  tcp.stream == 2
 52  17.186747 110.75.24.26 -> 192.168.42.196 TCP 54 http > 47764 [ACK] Seq=1 Ack=439 Win=200000 Len=0  tcp.stream == 2
 53  21.674965 110.75.24.26 -> 192.168.42.196 TCP 1314 [TCP segment of a reassembled PDU]  tcp.stream == 2
 54  21.674986 192.168.42.196 -> 110.75.24.26 TCP 54 47764 > http [ACK] Seq=439 Ack=1261 Win=17152 Len=0  tcp.stream == 2
 55  21.674993 110.75.24.26 -> 192.168.42.196 TCP 1314 [TCP segment of a reassembled PDU]  tcp.stream == 2
 56  21.674997 192.168.42.196 -> 110.75.24.26 TCP 54 47764 > http [ACK] Seq=439 Ack=2521 Win=19712 Len=0  tcp.stream == 2
 57  21.684958 110.75.24.26 -> 192.168.42.196 TCP 1314 [TCP segment of a reassembled PDU]  tcp.stream == 2
 58  21.684981 192.168.42.196 -> 110.75.24.26 TCP 54 47764 > http [ACK] Seq=439 Ack=3781 Win=22272 Len=0  tcp.stream == 2
 59  21.694452 110.75.24.26 -> 192.168.42.196 TCP 1314 [TCP segment of a reassembled PDU]  tcp.stream == 2
 60  21.694472 192.168.42.196 -> 110.75.24.26 TCP 54 47764 > http [ACK] Seq=439 Ack=5041 Win=24704 Len=0  tcp.stream == 2
 61  21.704833 110.75.24.26 -> 192.168.42.196 TCP 1314 [TCP segment of a reassembled PDU]  tcp.stream == 2
 62  21.704855 192.168.42.196 -> 110.75.24.26 TCP 54 47764 > http [ACK] Seq=439 Ack=6301 Win=27264 Len=0  tcp.stream == 2
 63  21.725712 110.75.24.26 -> 192.168.42.196 TCP 1314 [TCP segment of a reassembled PDU]  tcp.stream == 2
 64  21.725733 192.168.42.196 -> 110.75.24.26 TCP 54 47764 > http [ACK] Seq=439 Ack=7561 Win=29824 Len=0  tcp.stream == 2
 65  21.725741 110.75.24.26 -> 192.168.42.196 TCP 686 [TCP segment of a reassembled PDU]  tcp.stream == 2
 66  21.725744 192.168.42.196 -> 110.75.24.26 TCP 54 47764 > http [ACK] Seq=439 Ack=8193 Win=32256 Len=0  tcp.stream == 2
 67  21.725747 110.75.24.26 -> 192.168.42.196 TCP 1314 [TCP segment of a reassembled PDU]  tcp.stream == 2
 68  21.725751 192.168.42.196 -> 110.75.24.26 TCP 54 47764 > http [ACK] Seq=439 Ack=9453 Win=34816 Len=0  tcp.stream == 2
 69  21.734832 110.75.24.26 -> 192.168.42.196 TCP 1314 [TCP segment of a reassembled PDU]  tcp.stream == 2
 70  21.734854 192.168.42.196 -> 110.75.24.26 TCP 54 47764 > http [ACK] Seq=439 Ack=10713 Win=37376 Len=0  tcp.stream == 2
 71  21.734861 110.75.24.26 -> 192.168.42.196 TCP 1314 [TCP segment of a reassembled PDU]  tcp.stream == 2
 72  21.734864 192.168.42.196 -> 110.75.24.26 TCP 54 47764 > http [ACK] Seq=439 Ack=11973 Win=39808 Len=0  tcp.stream == 2
 73  21.744958 110.75.24.26 -> 192.168.42.196 TCP 1314 [TCP segment of a reassembled PDU]  tcp.stream == 2
 74  21.744980 192.168.42.196 -> 110.75.24.26 TCP 54 47764 > http [ACK] Seq=439 Ack=13233 Win=42368 Len=0  tcp.stream == 2
 75  21.755828 110.75.24.26 -> 192.168.42.196 TCP 1314 [TCP segment of a reassembled PDU]  tcp.stream == 2
 76  21.755849 192.168.42.196 -> 110.75.24.26 TCP 54 47764 > http [ACK] Seq=439 Ack=14493 Win=44928 Len=0  tcp.stream == 2
 77  21.764585 110.75.24.26 -> 192.168.42.196 TCP 1314 [TCP Retransmission] http > 47764 [ACK] Seq=1 Ack=439 Win=200000 Len=1260  tcp.stream == 2
 78  21.764607 192.168.42.196 -> 110.75.24.26 TCP 66 [TCP Dup ACK 76#1] 47764 > http [ACK] Seq=439 Ack=14493 Win=44928 Len=0 SLE=1 SRE=1261  tcp.stream == 2
 79  21.814833 110.75.24.26 -> 192.168.42.196 TCP 1314 [TCP Retransmission] [TCP segment of a reassembled PDU]  tcp.stream == 2
 80  21.814853 192.168.42.196 -> 110.75.24.26 TCP 66 [TCP Dup ACK 76#2] 47764 > http [ACK] Seq=439 Ack=14493 Win=44928 Len=0 SLE=1261 SRE=2521  tcp.stream == 2
 81  21.824831 110.75.24.26 -> 192.168.42.196 HTTP 1314 [TCP Retransmission] Continuation or non-HTTP traffic  tcp.stream == 2
 82  21.824852 192.168.42.196 -> 110.75.24.26 TCP 66 [TCP Dup ACK 76#3] 47764 > http [ACK] Seq=439 Ack=14493 Win=44928 Len=0 SLE=2521 SRE=3781  tcp.stream == 2
 83  21.835956 110.75.24.26 -> 192.168.42.196 HTTP 1314 [TCP Retransmission] Continuation or non-HTTP traffic  tcp.stream == 2
 84  21.835977 192.168.42.196 -> 110.75.24.26 TCP 66 [TCP Dup ACK 76#4] 47764 > http [ACK] Seq=439 Ack=14493 Win=44928 Len=0 SLE=3781 SRE=5041  tcp.stream == 2
 85  21.845582 110.75.24.26 -> 192.168.42.196 HTTP 1314 [TCP Retransmission] Continuation or non-HTTP traffic  tcp.stream == 2
 86  21.845605 192.168.42.196 -> 110.75.24.26 TCP 66 [TCP Dup ACK 76#5] 47764 > http [ACK] Seq=439 Ack=14493 Win=44928 Len=0 SLE=5041 SRE=6301  tcp.stream == 2
 87  21.854832 110.75.24.26 -> 192.168.42.196 HTTP 1314 [TCP Retransmission] Continuation or non-HTTP traffic  tcp.stream == 2
 88  21.854854 192.168.42.196 -> 110.75.24.26 TCP 66 [TCP Dup ACK 76#6] 47764 > http [ACK] Seq=439 Ack=14493 Win=44928 Len=0 SLE=6301 SRE=7561  tcp.stream == 2
 89  21.854862 110.75.24.26 -> 192.168.42.196 HTTP 474 [TCP Retransmission] Continuation or non-HTTP traffic  tcp.stream == 2
 90  21.854865 192.168.42.196 -> 110.75.24.26 TCP 66 [TCP Dup ACK 76#7] 47764 > http [ACK] Seq=439 Ack=14493 Win=44928 Len=0 SLE=7561 SRE=7981  tcp.stream == 2
 91  21.864710 110.75.24.26 -> 192.168.42.196 HTTP 1314 [TCP Retransmission] Continuation or non-HTTP traffic  tcp.stream == 2
 92  21.864731 192.168.42.196 -> 110.75.24.26 TCP 66 [TCP Dup ACK 76#8] 47764 > http [ACK] Seq=439 Ack=14493 Win=44928 Len=0 SLE=7981 SRE=9241  tcp.stream == 2
 93  21.864739 110.75.24.26 -> 192.168.42.196 HTTP 432 [TCP Retransmission] Continuation or non-HTTP traffic  tcp.stream == 2
 94  21.864742 192.168.42.196 -> 110.75.24.26 TCP 66 [TCP Dup ACK 76#9] 47764 > http [ACK] Seq=439 Ack=14493 Win=44928 Len=0 SLE=9241 SRE=9619  tcp.stream == 2
 95  21.877583 110.75.24.26 -> 192.168.42.196 HTTP 1314 [TCP Retransmission] Continuation or non-HTTP traffic  tcp.stream == 2
 96  21.877605 192.168.42.196 -> 110.75.24.26 TCP 66 [TCP Dup ACK 76#10] 47764 > http [ACK] Seq=439 Ack=14493 Win=44928 Len=0 SLE=9619 SRE=10879  tcp.stream == 2
 97  21.877613 110.75.24.26 -> 192.168.42.196 HTTP 400 [TCP Retransmission] Continuation or non-HTTP traffic  tcp.stream == 2
 98  21.877616 192.168.42.196 -> 110.75.24.26 TCP 66 [TCP Dup ACK 76#11] 47764 > http [ACK] Seq=439 Ack=14493 Win=44928 Len=0 SLE=10879 SRE=11225  tcp.stream == 2
 99  21.884957 110.75.24.26 -> 192.168.42.196 HTTP 1314 [TCP Retransmission] Continuation or non-HTTP traffic  tcp.stream == 2
100  21.884978 192.168.42.196 -> 110.75.24.26 TCP 66 [TCP Dup ACK 76#12] 47764 > http [ACK] Seq=439 Ack=14493 Win=44928 Len=0 SLE=11225 SRE=12485  tcp.stream == 2
101  21.895833 110.75.24.26 -> 192.168.42.196 HTTP 376 [TCP Retransmission] Continuation or non-HTTP traffic  tcp.stream == 2
102  21.895853 192.168.42.196 -> 110.75.24.26 TCP 66 [TCP Dup ACK 76#13] 47764 > http [ACK] Seq=439 Ack=14493 Win=44928 Len=0 SLE=12485 SRE=12807  tcp.stream == 2
103  21.895861 110.75.24.26 -> 192.168.42.196 HTTP 988 [TCP Retransmission] Continuation or non-HTTP traffic  tcp.stream == 2
104  21.895864 192.168.42.196 -> 110.75.24.26 TCP 66 [TCP Dup ACK 76#14] 47764 > http [ACK] Seq=439 Ack=14493 Win=44928 Len=0 SLE=12807 SRE=13741  tcp.stream == 2
105  21.895941 110.75.24.26 -> 192.168.42.196 HTTP 1314 [TCP Retransmission] Continuation or non-HTTP traffic  tcp.stream == 2
106  21.895949 192.168.42.196 -> 110.75.24.26 TCP 66 [TCP ACKed unseen segment] 47764 > http [ACK] Seq=439 Ack=15001 Win=47360 Len=0 SLE=13741 SRE=14493  tcp.stream == 2
107  21.914460 110.75.24.26 -> 192.168.42.196 HTTP 1314 Continuation or non-HTTP traffic  tcp.stream == 2
108  21.914483 192.168.42.196 -> 110.75.24.26 TCP 54 47764 > http [ACK] Seq=439 Ack=16261 Win=49920 Len=0  tcp.stream == 2
109  21.914490 110.75.24.26 -> 192.168.42.196 HTTP 230 Continuation or non-HTTP traffic  tcp.stream == 2
110  21.914493 192.168.42.196 -> 110.75.24.26 TCP 54 47764 > http [ACK] Seq=439 Ack=16437 Win=52480 Len=0  tcp.stream == 2
111  21.919100 192.168.42.196 -> 110.75.24.26 TCP 54 47764 > http [FIN, ACK] Seq=439 Ack=16437 Win=52480 Len=0  tcp.stream == 2
113  22.034332 110.75.24.26 -> 192.168.42.196 TCP 54 http > 47764 [ACK] Seq=16437 Ack=440 Win=200000 Len=0  tcp.stream == 2
114  22.034352 110.75.24.26 -> 192.168.42.196 TCP 54 http > 47764 [FIN, ACK] Seq=16437 Ack=440 Win=200000 Len=0  tcp.stream == 2
115  22.034359 192.168.42.196 -> 110.75.24.26 TCP 54 47764 > http [ACK] Seq=440 Ack=16438 Win=52480 Len=0  tcp.stream == 2
121  22.599307 192.168.42.196 -> 119.167.201.241 TCP 74 36018 > http [SYN] Seq=0 Win=14600 Len=0 MSS=1460 SACK_PERM=1 TSval=43208053 TSecr=0 WS=128  tcp.stream == 3
122  22.599852 192.168.42.196 -> 119.167.201.241 TCP 74 36019 > http [SYN] Seq=0 Win=14600 Len=0 MSS=1460 SACK_PERM=1 TSval=43208053 TSecr=0 WS=128  tcp.stream == 4
123  22.600314 192.168.42.196 -> 119.167.201.241 TCP 74 36020 > http [SYN] Seq=0 Win=14600 Len=0 MSS=1460 SACK_PERM=1 TSval=43208053 TSecr=0 WS=128  tcp.stream == 5
124  22.714339 119.167.201.241 -> 192.168.42.196 TCP 66 http > 36018 [SYN, ACK] Seq=0 Ack=1 Win=65535 Len=0 MSS=1260 WS=4 SACK_PERM=1  tcp.stream == 3
125  22.714385 192.168.42.196 -> 119.167.201.241 TCP 54 36018 > http [ACK] Seq=1 Ack=1 Win=14720 Len=0  tcp.stream == 3
126  22.717532 192.168.42.196 -> 119.167.201.241 HTTP 471 GET /mw/s/lib/jquery/jquery.1.3.2.min.js HTTP/1.1   tcp.stream == 3
127  22.734324 119.167.201.241 -> 192.168.42.196 TCP 66 http > 36019 [SYN, ACK] Seq=0 Ack=1 Win=65535 Len=0 MSS=1260 WS=4 SACK_PERM=1  tcp.stream == 4
128  22.734348 192.168.42.196 -> 119.167.201.241 TCP 54 36019 > http [ACK] Seq=1 Ack=1 Win=14720 Len=0  tcp.stream == 4
129  22.734356 119.167.201.241 -> 192.168.42.196 TCP 66 http > 36020 [SYN, ACK] Seq=0 Ack=1 Win=65535 Len=0 MSS=1260 WS=4 SACK_PERM=1  tcp.stream == 5
130  22.734375 192.168.42.196 -> 119.167.201.241 TCP 54 36020 > http [ACK] Seq=1 Ack=1 Win=14720 Len=0  tcp.stream == 5
131  22.736425 192.168.42.196 -> 119.167.201.241 HTTP 462 GET /mw/s/hi/tbtouch/tbtouch.js HTTP/1.1   tcp.stream == 5
132  22.737612 192.168.42.196 -> 119.167.201.241 HTTP 458 GET /mw/s/hi/tbtouch/tms.js HTTP/1.1   tcp.stream == 4
133  22.824580 119.167.201.241 -> 192.168.42.196 TCP 54 [TCP Window Update] http > 36018 [ACK] Seq=1 Ack=1 Win=200000 Len=0  tcp.stream == 3
134  22.854572 119.167.201.241 -> 192.168.42.196 TCP 54 [TCP Window Update] http > 36019 [ACK] Seq=1 Ack=1 Win=200000 Len=0  tcp.stream == 4
135  22.854589 119.167.201.241 -> 192.168.42.196 TCP 54 [TCP Window Update] http > 36020 [ACK] Seq=1 Ack=1 Win=200000 Len=0  tcp.stream == 5
136  22.875444 119.167.201.241 -> 192.168.42.196 TCP 1314 [TCP segment of a reassembled PDU]  tcp.stream == 3
137  22.875467 192.168.42.196 -> 119.167.201.241 TCP 54 36018 > http [ACK] Seq=418 Ack=1261 Win=17152 Len=0  tcp.stream == 3
138  22.885570 119.167.201.241 -> 192.168.42.196 TCP 1314 [TCP segment of a reassembled PDU]  tcp.stream == 3
139  22.885592 192.168.42.196 -> 119.167.201.241 TCP 54 36018 > http [ACK] Seq=418 Ack=2521 Win=19712 Len=0  tcp.stream == 3
140  22.885599 119.167.201.241 -> 192.168.42.196 TCP 1314 [TCP segment of a reassembled PDU]  tcp.stream == 3
141  22.885602 192.168.42.196 -> 119.167.201.241 TCP 54 36018 > http [ACK] Seq=418 Ack=3781 Win=22272 Len=0  tcp.stream == 3
142  22.895691 119.167.201.241 -> 192.168.42.196 TCP 1314 [TCP segment of a reassembled PDU]  tcp.stream == 3
143  22.895713 192.168.42.196 -> 119.167.201.241 TCP 54 36018 > http [ACK] Seq=418 Ack=5041 Win=24704 Len=0  tcp.stream == 3
144  22.904319 119.167.201.241 -> 192.168.42.196 TCP 1314 [TCP segment of a reassembled PDU]  tcp.stream == 3
145  22.904341 192.168.42.196 -> 119.167.201.241 TCP 54 36018 > http [ACK] Seq=418 Ack=6301 Win=27264 Len=0  tcp.stream == 3
146  22.915566 119.167.201.241 -> 192.168.42.196 TCP 1314 [TCP segment of a reassembled PDU]  tcp.stream == 3
147  22.915587 192.168.42.196 -> 119.167.201.241 TCP 54 36018 > http [ACK] Seq=418 Ack=7561 Win=29824 Len=0  tcp.stream == 3
148  22.924444 119.167.201.241 -> 192.168.42.196 TCP 1314 [TCP segment of a reassembled PDU]  tcp.stream == 3
149  22.924470 192.168.42.196 -> 119.167.201.241 TCP 54 36018 > http [ACK] Seq=418 Ack=8821 Win=32256 Len=0  tcp.stream == 3
150  22.935820 119.167.201.241 -> 192.168.42.196 TCP 1314 [TCP segment of a reassembled PDU]  tcp.stream == 3
151  22.935840 192.168.42.196 -> 119.167.201.241 TCP 54 36018 > http [ACK] Seq=418 Ack=10081 Win=34816 Len=0  tcp.stream == 3
152  22.935847 119.167.201.241 -> 192.168.42.196 TCP 1314 [TCP segment of a reassembled PDU]  tcp.stream == 3
153  22.935850 192.168.42.196 -> 119.167.201.241 TCP 54 36018 > http [ACK] Seq=418 Ack=11341 Win=37376 Len=0  tcp.stream == 3
154  22.944568 119.167.201.241 -> 192.168.42.196 TCP 1314 [TCP segment of a reassembled PDU]  tcp.stream == 3
155  22.944588 192.168.42.196 -> 119.167.201.241 TCP 54 36018 > http [ACK] Seq=418 Ack=12601 Win=39808 Len=0  tcp.stream == 3
156  22.954942 119.167.201.241 -> 192.168.42.196 TCP 1314 [TCP segment of a reassembled PDU]  tcp.stream == 3
157  22.954963 192.168.42.196 -> 119.167.201.241 TCP 54 36018 > http [ACK] Seq=418 Ack=13861 Win=42368 Len=0  tcp.stream == 3
158  22.964568 119.167.201.241 -> 192.168.42.196 TCP 1314 [TCP segment of a reassembled PDU]  tcp.stream == 5
159  22.964593 192.168.42.196 -> 119.167.201.241 TCP 54 36020 > http [ACK] Seq=409 Ack=1261 Win=17152 Len=0  tcp.stream == 5
160  22.975692 119.167.201.241 -> 192.168.42.196 TCP 1314 [TCP segment of a reassembled PDU]  tcp.stream == 5
161  22.975713 192.168.42.196 -> 119.167.201.241 TCP 54 36020 > http [ACK] Seq=409 Ack=2521 Win=19712 Len=0  tcp.stream == 5
162  22.975805 119.167.201.241 -> 192.168.42.196 TCP 1314 [TCP segment of a reassembled PDU]  tcp.stream == 5
163  22.975811 192.168.42.196 -> 119.167.201.241 TCP 54 36020 > http [ACK] Seq=409 Ack=3781 Win=22272 Len=0  tcp.stream == 5
164  22.984319 119.167.201.241 -> 192.168.42.196 TCP 1314 [TCP segment of a reassembled PDU]  tcp.stream == 5
165  22.984344 192.168.42.196 -> 119.167.201.241 TCP 54 36020 > http [ACK] Seq=409 Ack=5041 Win=24704 Len=0  tcp.stream == 5
166  22.995440 119.167.201.241 -> 192.168.42.196 HTTP 832 HTTP/1.1 200 OK  (application/x-javascript)  tcp.stream == 5
167  22.995459 192.168.42.196 -> 119.167.201.241 TCP 54 36020 > http [ACK] Seq=409 Ack=5819 Win=27264 Len=0  tcp.stream == 5
168  22.999104 192.168.42.196 -> 119.167.201.241 TCP 54 36020 > http [FIN, ACK] Seq=409 Ack=5819 Win=27264 Len=0  tcp.stream == 5
169  23.005696 119.167.201.241 -> 192.168.42.196 TCP 1314 [TCP segment of a reassembled PDU]  tcp.stream == 4
170  23.005721 192.168.42.196 -> 119.167.201.241 TCP 54 36019 > http [ACK] Seq=405 Ack=1261 Win=17152 Len=0  tcp.stream == 4
171  23.005728 119.167.201.241 -> 192.168.42.196 TCP 1314 [TCP segment of a reassembled PDU]  tcp.stream == 4
172  23.005739 192.168.42.196 -> 119.167.201.241 TCP 54 36019 > http [ACK] Seq=405 Ack=2521 Win=19712 Len=0  tcp.stream == 4
173  23.016319 119.167.201.241 -> 192.168.42.196 HTTP 909 HTTP/1.1 200 OK  (application/x-javascript)  tcp.stream == 4
174  23.016340 192.168.42.196 -> 119.167.201.241 TCP 54 36019 > http [ACK] Seq=405 Ack=3376 Win=22272 Len=0  tcp.stream == 4
175  23.016347 119.167.201.241 -> 192.168.42.196 TCP 1314 [TCP segment of a reassembled PDU]  tcp.stream == 3
176  23.016351 192.168.42.196 -> 119.167.201.241 TCP 54 36018 > http [ACK] Seq=418 Ack=15121 Win=44928 Len=0  tcp.stream == 3
177  23.018830 192.168.42.196 -> 119.167.201.241 TCP 54 36019 > http [FIN, ACK] Seq=405 Ack=3376 Win=22272 Len=0  tcp.stream == 4
178  23.024817 119.167.201.241 -> 192.168.42.196 TCP 1314 [TCP segment of a reassembled PDU]  tcp.stream == 3
179  23.024839 192.168.42.196 -> 119.167.201.241 TCP 54 36018 > http [ACK] Seq=418 Ack=16381 Win=47360 Len=0  tcp.stream == 3
180  23.044692 119.167.201.241 -> 192.168.42.196 TCP 1314 [TCP segment of a reassembled PDU]  tcp.stream == 3
181  23.044712 192.168.42.196 -> 119.167.201.241 TCP 54 36018 > http [ACK] Seq=418 Ack=17641 Win=49920 Len=0  tcp.stream == 3
182  23.044719 119.167.201.241 -> 192.168.42.196 TCP 1314 [TCP segment of a reassembled PDU]  tcp.stream == 3
183  23.044723 192.168.42.196 -> 119.167.201.241 TCP 54 36018 > http [ACK] Seq=418 Ack=18901 Win=52480 Len=0  tcp.stream == 3
184  23.055318 119.167.201.241 -> 192.168.42.196 HTTP 1215 HTTP/1.1 200 OK  (application/x-javascript)  tcp.stream == 3
185  23.055346 192.168.42.196 -> 119.167.201.241 TCP 54 36018 > http [ACK] Seq=418 Ack=20062 Win=55040 Len=0  tcp.stream == 3
186  23.058583 192.168.42.196 -> 119.167.201.241 TCP 54 36018 > http [FIN, ACK] Seq=418 Ack=20062 Win=55040 Len=0  tcp.stream == 3
187  23.114318 119.167.201.241 -> 192.168.42.196 TCP 54 http > 36020 [ACK] Seq=5819 Ack=410 Win=200000 Len=0  tcp.stream == 5
188  23.114336 119.167.201.241 -> 192.168.42.196 TCP 54 http > 36020 [FIN, ACK] Seq=5819 Ack=410 Win=200000 Len=0  tcp.stream == 5
189  23.114344 192.168.42.196 -> 119.167.201.241 TCP 54 36020 > http [ACK] Seq=410 Ack=5820 Win=27264 Len=0  tcp.stream == 5
190  23.144317 119.167.201.241 -> 192.168.42.196 TCP 54 http > 36019 [ACK] Seq=3376 Ack=406 Win=200000 Len=0  tcp.stream == 4
191  23.144336 119.167.201.241 -> 192.168.42.196 TCP 54 http > 36019 [FIN, ACK] Seq=3376 Ack=406 Win=200000 Len=0  tcp.stream == 4
192  23.144343 192.168.42.196 -> 119.167.201.241 TCP 54 36019 > http [ACK] Seq=406 Ack=3377 Win=22272 Len=0  tcp.stream == 4
193  23.174317 119.167.201.241 -> 192.168.42.196 TCP 54 http > 36018 [ACK] Seq=20062 Ack=419 Win=200000 Len=0  tcp.stream == 3
194  23.174335 119.167.201.241 -> 192.168.42.196 TCP 54 http > 36018 [FIN, ACK] Seq=20062 Ack=419 Win=200000 Len=0  tcp.stream == 3
195  23.174341 192.168.42.196 -> 119.167.201.241 TCP 54 36018 > http [ACK] Seq=419 Ack=20063 Win=55040 Len=0  tcp.stream == 3
219  25.281109 192.168.42.196 -> 121.14.89.250 TCP 74 35087 > http [SYN] Seq=0 Win=14600 Len=0 MSS=1460 SACK_PERM=1 TSval=43208723 TSecr=0 WS=128  tcp.stream == 6
222  25.291886 192.168.42.196 -> 119.97.134.250 TCP 74 48436 > http [SYN] Seq=0 Win=14600 Len=0 MSS=1460 SACK_PERM=1 TSval=43208726 TSecr=0 WS=128  tcp.stream == 7
223  25.293789 192.168.42.196 -> 121.14.89.240 TCP 74 39330 > http [SYN] Seq=0 Win=14600 Len=0 MSS=1460 SACK_PERM=1 TSval=43208726 TSecr=0 WS=128  tcp.stream == 8
225  25.300222 192.168.42.196 -> 119.97.134.240 TCP 74 50509 > http [SYN] Seq=0 Win=14600 Len=0 MSS=1460 SACK_PERM=1 TSval=43208728 TSecr=0 WS=128  tcp.stream == 9
226  25.394172 121.14.89.250 -> 192.168.42.196 TCP 66 http > 35087 [SYN, ACK] Seq=0 Ack=1 Win=65535 Len=0 MSS=1260 WS=4 SACK_PERM=1  tcp.stream == 6
227  25.394200 192.168.42.196 -> 121.14.89.250 TCP 54 35087 > http [ACK] Seq=1 Ack=1 Win=14720 Len=0  tcp.stream == 6
228  25.398930 192.168.42.196 -> 121.14.89.250 HTTP 467 GET /tps/i4/T1kkCsXelNXXXXXXXX-40-40.png HTTP/1.1   tcp.stream == 6
229  25.414179 119.97.134.250 -> 192.168.42.196 TCP 66 http > 48436 [SYN, ACK] Seq=0 Ack=1 Win=65535 Len=0 MSS=1260 WS=4 SACK_PERM=1  tcp.stream == 7
230  25.414211 192.168.42.196 -> 119.97.134.250 TCP 54 48436 > http [ACK] Seq=1 Ack=1 Win=14720 Len=0  tcp.stream == 7
231  25.414220 121.14.89.240 -> 192.168.42.196 TCP 66 http > 39330 [SYN, ACK] Seq=0 Ack=1 Win=65535 Len=0 MSS=1260 WS=4 SACK_PERM=1  tcp.stream == 8
232  25.414229 192.168.42.196 -> 121.14.89.240 TCP 54 39330 > http [ACK] Seq=1 Ack=1 Win=14720 Len=0  tcp.stream == 8
233  25.414234 119.97.134.240 -> 192.168.42.196 TCP 66 http > 50509 [SYN, ACK] Seq=0 Ack=1 Win=65535 Len=0 MSS=1260 WS=4 SACK_PERM=1  tcp.stream == 9
234  25.414240 192.168.42.196 -> 119.97.134.240 TCP 54 50509 > http [ACK] Seq=1 Ack=1 Win=14720 Len=0  tcp.stream == 9
235  25.417611 192.168.42.196 -> 119.97.134.240 HTTP 467 GET /tps/i2/T1qAqsXg8RXXXXXXXX-40-40.png HTTP/1.1   tcp.stream == 9
236  25.418881 192.168.42.196 -> 121.14.89.240 HTTP 467 GET /tps/i1/T1pkqsXhpRXXXXXXXX-40-40.png HTTP/1.1   tcp.stream == 8
237  25.420303 192.168.42.196 -> 119.97.134.250 HTTP 467 GET /tps/i3/T1rAqsXgVRXXXXXXXX-40-40.png HTTP/1.1   tcp.stream == 7
238  25.504179 121.14.89.250 -> 192.168.42.196 TCP 54 [TCP Window Update] http > 35087 [ACK] Seq=1 Ack=1 Win=200000 Len=0  tcp.stream == 6
239  25.534560 121.14.89.250 -> 192.168.42.196 HTTP 925 HTTP/1.1 200 OK  (PNG)  tcp.stream == 6
240  25.534581 192.168.42.196 -> 121.14.89.250 TCP 54 35087 > http [ACK] Seq=414 Ack=872 Win=16384 Len=0  tcp.stream == 6
241  25.534587 119.97.134.250 -> 192.168.42.196 TCP 54 [TCP Window Update] http > 48436 [ACK] Seq=1 Ack=1 Win=200000 Len=0  tcp.stream == 7
242  25.534591 121.14.89.240 -> 192.168.42.196 TCP 54 [TCP Window Update] http > 39330 [ACK] Seq=1 Ack=1 Win=200000 Len=0  tcp.stream == 8
243  25.534593 119.97.134.240 -> 192.168.42.196 TCP 54 [TCP Window Update] http > 50509 [ACK] Seq=1 Ack=1 Win=200000 Len=0  tcp.stream == 9
244  25.540347 192.168.42.196 -> 121.14.89.250 TCP 54 35087 > http [FIN, ACK] Seq=414 Ack=872 Win=16384 Len=0  tcp.stream == 6
245  25.574301 119.97.134.240 -> 192.168.42.196 HTTP 708 HTTP/1.1 200 OK  (PNG)  tcp.stream == 9
246  25.574324 192.168.42.196 -> 119.97.134.240 TCP 54 50509 > http [ACK] Seq=414 Ack=655 Win=16000 Len=0  tcp.stream == 9
247  25.580396 192.168.42.196 -> 119.97.134.240 TCP 54 50509 > http [FIN, ACK] Seq=414 Ack=655 Win=16000 Len=0  tcp.stream == 9
248  25.584808 121.14.89.240 -> 192.168.42.196 HTTP 957 HTTP/1.1 200 OK  (PNG)  tcp.stream == 8
249  25.584831 192.168.42.196 -> 121.14.89.240 TCP 54 39330 > http [ACK] Seq=414 Ack=904 Win=16512 Len=0  tcp.stream == 8
250  25.584837 119.97.134.250 -> 192.168.42.196 HTTP 1210 HTTP/1.1 200 OK  (PNG)  tcp.stream == 7
251  25.584842 192.168.42.196 -> 119.97.134.250 TCP 54 48436 > http [ACK] Seq=414 Ack=1157 Win=17024 Len=0  tcp.stream == 7
252  25.604092 192.168.42.196 -> 121.14.89.240 TCP 54 39330 > http [FIN, ACK] Seq=414 Ack=904 Win=16512 Len=0  tcp.stream == 8
253  25.605397 192.168.42.196 -> 119.97.134.250 TCP 54 48436 > http [FIN, ACK] Seq=414 Ack=1157 Win=17024 Len=0  tcp.stream == 7
254  25.654302 121.14.89.250 -> 192.168.42.196 TCP 54 http > 35087 [ACK] Seq=872 Ack=415 Win=200000 Len=0  tcp.stream == 6
255  25.654321 121.14.89.250 -> 192.168.42.196 TCP 54 http > 35087 [FIN, ACK] Seq=872 Ack=415 Win=200000 Len=0  tcp.stream == 6
256  25.654329 192.168.42.196 -> 121.14.89.250 TCP 54 35087 > http [ACK] Seq=415 Ack=873 Win=16384 Len=0  tcp.stream == 6
257  25.694430 119.97.134.240 -> 192.168.42.196 TCP 54 http > 50509 [ACK] Seq=655 Ack=415 Win=200000 Len=0  tcp.stream == 9
258  25.694449 119.97.134.240 -> 192.168.42.196 TCP 54 http > 50509 [FIN, ACK] Seq=655 Ack=415 Win=200000 Len=0  tcp.stream == 9
259  25.694457 192.168.42.196 -> 119.97.134.240 TCP 54 50509 > http [ACK] Seq=415 Ack=656 Win=16000 Len=0  tcp.stream == 9
260  25.714428 121.14.89.240 -> 192.168.42.196 TCP 54 http > 39330 [ACK] Seq=904 Ack=415 Win=200000 Len=0  tcp.stream == 8
261  25.714447 121.14.89.240 -> 192.168.42.196 TCP 54 http > 39330 [FIN, ACK] Seq=904 Ack=415 Win=200000 Len=0  tcp.stream == 8
262  25.714454 192.168.42.196 -> 121.14.89.240 TCP 54 39330 > http [ACK] Seq=415 Ack=905 Win=16512 Len=0  tcp.stream == 8
263  25.714464 119.97.134.250 -> 192.168.42.196 TCP 54 http > 48436 [ACK] Seq=1157 Ack=415 Win=200000 Len=0  tcp.stream == 7
264  25.714471 119.97.134.250 -> 192.168.42.196 TCP 54 http > 48436 [FIN, ACK] Seq=1157 Ack=415 Win=200000 Len=0  tcp.stream == 7
265  25.714474 192.168.42.196 -> 119.97.134.250 TCP 54 48436 > http [ACK] Seq=415 Ack=1158 Win=17024 Len=0  tcp.stream == 7
266  26.146440 192.168.42.196 -> 110.75.24.26 TCP 74 47772 > http [SYN] Seq=0 Win=14600 Len=0 MSS=1460 SACK_PERM=1 TSval=43208940 TSecr=0 WS=128  tcp.stream == 10
267  26.254173 110.75.24.26 -> 192.168.42.196 TCP 66 http > 47772 [SYN, ACK] Seq=0 Ack=1 Win=65535 Len=0 MSS=1260 WS=4 SACK_PERM=1  tcp.stream == 10
268  26.254198 192.168.42.196 -> 110.75.24.26 TCP 54 47772 > http [ACK] Seq=1 Ack=1 Win=14720 Len=0  tcp.stream == 10
269  26.256306 192.168.42.196 -> 110.75.24.26 HTTP 728 GET /go/rgn/mobile/taojinbi0928.html?sid=d1f9e791a405b63d&sprefer=sygd13 HTTP/1.1   tcp.stream == 10
270  26.285109 192.168.42.196 -> 110.75.24.26 TCP 74 47773 > http [SYN] Seq=0 Win=14600 Len=0 MSS=1460 SACK_PERM=1 TSval=43208974 TSecr=0 WS=128  tcp.stream == 11
271  26.354399 192.168.42.196 -> 110.75.24.26 TCP 74 47774 > http [SYN] Seq=0 Win=14600 Len=0 MSS=1460 SACK_PERM=1 TSval=43208992 TSecr=0 WS=128  tcp.stream == 12
272  26.364796 110.75.24.26 -> 192.168.42.196 TCP 54 [TCP Window Update] http > 47772 [ACK] Seq=1 Ack=1 Win=200000 Len=0  tcp.stream == 10
273  26.414297 110.75.24.26 -> 192.168.42.196 TCP 66 http > 47773 [SYN, ACK] Seq=0 Ack=1 Win=65535 Len=0 MSS=1260 WS=4 SACK_PERM=1  tcp.stream == 11
274  26.414323 192.168.42.196 -> 110.75.24.26 TCP 54 47773 > http [ACK] Seq=1 Ack=1 Win=14720 Len=0  tcp.stream == 11
275  26.417733 192.168.42.196 -> 110.75.24.26 HTTP 714 GET /go/rgn/mobile/juhuasuan0928.html?sid=d1f9e791a405b63d HTTP/1.1   tcp.stream == 11
276  26.424068 192.168.42.196 -> 110.75.24.26 TCP 74 47775 > http [SYN] Seq=0 Win=14600 Len=0 MSS=1460 SACK_PERM=1 TSval=43209009 TSecr=0 WS=128  tcp.stream == 13
277  26.466298 110.75.24.26 -> 192.168.42.196 TCP 66 http > 47774 [SYN, ACK] Seq=0 Ack=1 Win=65535 Len=0 MSS=1260 WS=4 SACK_PERM=1  tcp.stream == 12
278  26.466322 192.168.42.196 -> 110.75.24.26 TCP 54 47774 > http [ACK] Seq=1 Ack=1 Win=14720 Len=0  tcp.stream == 12
279  26.468720 192.168.42.196 -> 110.75.24.26 HTTP 709 GET /go/rgn/mobile/nvzhuang.html?sid=d1f9e791a405b63d HTTP/1.1   tcp.stream == 12
280  26.524045 110.75.24.26 -> 192.168.42.196 TCP 54 [TCP Window Update] http > 47773 [ACK] Seq=1 Ack=1 Win=200000 Len=0  tcp.stream == 11
281  26.534168 110.75.24.26 -> 192.168.42.196 TCP 54 http > 47772 [ACK] Seq=1 Ack=675 Win=200000 Len=0  tcp.stream == 10
282  26.564171 110.75.24.26 -> 192.168.42.196 TCP 66 http > 47775 [SYN, ACK] Seq=0 Ack=1 Win=65535 Len=0 MSS=1260 WS=4 SACK_PERM=1  tcp.stream == 13
283  26.564197 192.168.42.196 -> 110.75.24.26 TCP 54 47775 > http [ACK] Seq=1 Ack=1 Win=14720 Len=0  tcp.stream == 13
284  26.566727 192.168.42.196 -> 110.75.24.26 HTTP 711 GET /go/rgn/mobile/shouji0928.html?sid=d1f9e791a405b63d HTTP/1.1   tcp.stream == 13
285  26.584169 110.75.24.26 -> 192.168.42.196 TCP 54 [TCP Window Update] http > 47774 [ACK] Seq=1 Ack=1 Win=200000 Len=0  tcp.stream == 12
286  26.684676 110.75.24.26 -> 192.168.42.196 TCP 54 http > 47773 [ACK] Seq=1 Ack=661 Win=200000 Len=0  tcp.stream == 11
287  26.684699 110.75.24.26 -> 192.168.42.196 TCP 54 [TCP Window Update] http > 47775 [ACK] Seq=1 Ack=1 Win=200000 Len=0  tcp.stream == 13
288  26.734295 110.75.24.26 -> 192.168.42.196 TCP 54 http > 47774 [ACK] Seq=1 Ack=656 Win=200000 Len=0  tcp.stream == 12
289  26.835422 110.75.24.26 -> 192.168.42.196 TCP 54 http > 47775 [ACK] Seq=1 Ack=658 Win=200000 Len=0  tcp.stream == 13
290  27.112566 192.168.42.196 -> 121.14.89.240 TCP 74 39336 > http [SYN] Seq=0 Win=14600 Len=0 MSS=1460 SACK_PERM=1 TSval=43209181 TSecr=0 WS=128  tcp.stream == 14
291  27.119130 192.168.42.196 -> 121.14.89.240 TCP 74 39337 > http [SYN] Seq=0 Win=14600 Len=0 MSS=1460 SACK_PERM=1 TSval=43209183 TSecr=0 WS=128  tcp.stream == 15
292  27.126925 192.168.42.196 -> 121.14.89.240 TCP 74 39338 > http [SYN] Seq=0 Win=14600 Len=0 MSS=1460 SACK_PERM=1 TSval=43209185 TSecr=0 WS=128  tcp.stream == 16
293  27.169035 192.168.42.196 -> 121.14.89.240 TCP 74 39339 > http [SYN] Seq=0 Win=14600 Len=0 MSS=1460 SACK_PERM=1 TSval=43209195 TSecr=0 WS=128  tcp.stream == 17
294  27.174880 192.168.42.196 -> 121.14.89.240 TCP 74 39340 > http [SYN] Seq=0 Win=14600 Len=0 MSS=1460 SACK_PERM=1 TSval=43209197 TSecr=0 WS=128  tcp.stream == 18
295  27.176553 192.168.42.196 -> 121.14.89.240 TCP 74 39341 > http [SYN] Seq=0 Win=14600 Len=0 MSS=1460 SACK_PERM=1 TSval=43209197 TSecr=0 WS=128  tcp.stream == 19
296  27.224172 121.14.89.240 -> 192.168.42.196 TCP 66 http > 39336 [SYN, ACK] Seq=0 Ack=1 Win=65535 Len=0 MSS=1260 WS=4 SACK_PERM=1  tcp.stream == 14
297  27.224199 192.168.42.196 -> 121.14.89.240 TCP 54 39336 > http [ACK] Seq=1 Ack=1 Win=14720 Len=0  tcp.stream == 14
298  27.234036 121.14.89.240 -> 192.168.42.196 TCP 66 http > 39337 [SYN, ACK] Seq=0 Ack=1 Win=65535 Len=0 MSS=1260 WS=4 SACK_PERM=1  tcp.stream == 15
299  27.234059 192.168.42.196 -> 121.14.89.240 TCP 54 39337 > http [ACK] Seq=1 Ack=1 Win=14720 Len=0  tcp.stream == 15
300  27.234155 121.14.89.240 -> 192.168.42.196 TCP 66 http > 39338 [SYN, ACK] Seq=0 Ack=1 Win=65535 Len=0 MSS=1260 WS=4 SACK_PERM=1  tcp.stream == 16
301  27.234162 192.168.42.196 -> 121.14.89.240 TCP 54 39338 > http [ACK] Seq=1 Ack=1 Win=14720 Len=0  tcp.stream == 16
302  27.244948 192.168.42.196 -> 119.97.134.240 TCP 74 50520 > http [SYN] Seq=0 Win=14600 Len=0 MSS=1460 SACK_PERM=1 TSval=43209214 TSecr=0 WS=128  tcp.stream == 20
303  27.284418 121.14.89.240 -> 192.168.42.196 TCP 66 http > 39339 [SYN, ACK] Seq=0 Ack=1 Win=65535 Len=0 MSS=1260 WS=4 SACK_PERM=1  tcp.stream == 17
304  27.284443 192.168.42.196 -> 121.14.89.240 TCP 54 39339 > http [ACK] Seq=1 Ack=1 Win=14720 Len=0  tcp.stream == 17
305  27.284450 110.75.24.26 -> 192.168.42.196 HTTP 803 HTTP/1.1 200 OK  (text/html)  tcp.stream == 10
306  27.284462 192.168.42.196 -> 110.75.24.26 TCP 54 47772 > http [ACK] Seq=675 Ack=750 Win=16128 Len=0  tcp.stream == 10
307  27.294035 121.14.89.240 -> 192.168.42.196 TCP 66 http > 39340 [SYN, ACK] Seq=0 Ack=1 Win=65535 Len=0 MSS=1260 WS=4 SACK_PERM=1  tcp.stream == 18
308  27.294058 192.168.42.196 -> 121.14.89.240 TCP 54 39340 > http [ACK] Seq=1 Ack=1 Win=14720 Len=0  tcp.stream == 18
309  27.294151 121.14.89.240 -> 192.168.42.196 TCP 66 http > 39341 [SYN, ACK] Seq=0 Ack=1 Win=65535 Len=0 MSS=1260 WS=4 SACK_PERM=1  tcp.stream == 19
310  27.294158 192.168.42.196 -> 121.14.89.240 TCP 54 39341 > http [ACK] Seq=1 Ack=1 Win=14720 Len=0  tcp.stream == 19
311  27.298235 192.168.42.196 -> 119.97.134.240 TCP 74 50521 > http [SYN] Seq=0 Win=14600 Len=0 MSS=1460 SACK_PERM=1 TSval=43209228 TSecr=0 WS=128  tcp.stream == 21
312  27.300212 192.168.42.196 -> 119.97.134.240 TCP 74 50522 > http [SYN] Seq=0 Win=14600 Len=0 MSS=1460 SACK_PERM=1 TSval=43209228 TSecr=0 WS=128  tcp.stream == 22
313  27.301525 192.168.42.196 -> 119.97.134.240 TCP 74 50523 > http [SYN] Seq=0 Win=14600 Len=0 MSS=1460 SACK_PERM=1 TSval=43209228 TSecr=0 WS=128  tcp.stream == 23
314  27.302793 192.168.42.196 -> 119.97.134.240 TCP 74 50524 > http [SYN] Seq=0 Win=14600 Len=0 MSS=1460 SACK_PERM=1 TSval=43209229 TSecr=0 WS=128  tcp.stream == 24
315  27.304160 192.168.42.196 -> 119.97.134.240 TCP 74 50525 > http [SYN] Seq=0 Win=14600 Len=0 MSS=1460 SACK_PERM=1 TSval=43209229 TSecr=0 WS=128  tcp.stream == 25
316  27.323044 192.168.42.196 -> 119.97.134.250 TCP 74 48455 > http [SYN] Seq=0 Win=14600 Len=0 MSS=1460 SACK_PERM=1 TSval=43209234 TSecr=0 WS=128  tcp.stream == 26
317  27.324402 192.168.42.196 -> 119.97.134.250 TCP 74 48456 > http [SYN] Seq=0 Win=14600 Len=0 MSS=1460 SACK_PERM=1 TSval=43209234 TSecr=0 WS=128  tcp.stream == 27
318  27.334293 121.14.89.240 -> 192.168.42.196 TCP 54 [TCP Window Update] http > 39336 [ACK] Seq=1 Ack=1 Win=200000 Len=0  tcp.stream == 14
319  27.339811 192.168.42.196 -> 119.97.134.250 TCP 74 48457 > http [SYN] Seq=0 Win=14600 Len=0 MSS=1460 SACK_PERM=1 TSval=43209238 TSecr=0 WS=128  tcp.stream == 28
320  27.341084 192.168.42.196 -> 119.97.134.250 TCP 74 48458 > http [SYN] Seq=0 Win=14600 Len=0 MSS=1460 SACK_PERM=1 TSval=43209238 TSecr=0 WS=128  tcp.stream == 29
321  27.344291 121.14.89.240 -> 192.168.42.196 TCP 54 [TCP Window Update] http > 39337 [ACK] Seq=1 Ack=1 Win=200000 Len=0  tcp.stream == 15
322  27.344307 121.14.89.240 -> 192.168.42.196 TCP 54 [TCP Window Update] http > 39338 [ACK] Seq=1 Ack=1 Win=200000 Len=0  tcp.stream == 16
323  27.345499 192.168.42.196 -> 119.97.134.250 TCP 74 48459 > http [SYN] Seq=0 Win=14600 Len=0 MSS=1460 SACK_PERM=1 TSval=43209239 TSecr=0 WS=128  tcp.stream == 30
324  27.354284 119.97.134.240 -> 192.168.42.196 TCP 66 http > 50520 [SYN, ACK] Seq=0 Ack=1 Win=65535 Len=0 MSS=1260 WS=4 SACK_PERM=1  tcp.stream == 20
325  27.354309 192.168.42.196 -> 119.97.134.240 TCP 54 50520 > http [ACK] Seq=1 Ack=1 Win=14720 Len=0  tcp.stream == 20
326  27.357335 192.168.42.196 -> 119.97.134.250 TCP 74 48460 > http [SYN] Seq=0 Win=14600 Len=0 MSS=1460 SACK_PERM=1 TSval=43209242 TSecr=0 WS=128  tcp.stream == 31
327  27.362346 192.168.42.196 -> 119.167.201.241 TCP 74 36047 > http [SYN] Seq=0 Win=14600 Len=0 MSS=1460 SACK_PERM=1 TSval=43209244 TSecr=0 WS=128  tcp.stream == 32
328  27.364350 192.168.42.196 -> 119.167.201.241 TCP 74 36048 > http [SYN] Seq=0 Win=14600 Len=0 MSS=1460 SACK_PERM=1 TSval=43209244 TSecr=0 WS=128  tcp.stream == 33
329  27.365698 192.168.42.196 -> 119.167.201.241 TCP 74 36049 > http [SYN] Seq=0 Win=14600 Len=0 MSS=1460 SACK_PERM=1 TSval=43209244 TSecr=0 WS=128  tcp.stream == 34
330  27.377250 192.168.42.196 -> 119.167.201.241 TCP 74 36050 > http [SYN] Seq=0 Win=14600 Len=0 MSS=1460 SACK_PERM=1 TSval=43209247 TSecr=0 WS=128  tcp.stream == 35
331  27.378557 192.168.42.196 -> 119.167.201.241 TCP 74 36051 > http [SYN] Seq=0 Win=14600 Len=0 MSS=1460 SACK_PERM=1 TSval=43209248 TSecr=0 WS=128  tcp.stream == 36
332  27.380474 192.168.42.196 -> 121.14.89.250 TCP 74 35118 > http [SYN] Seq=0 Win=14600 Len=0 MSS=1460 SACK_PERM=1 TSval=43209248 TSecr=0 WS=128  tcp.stream == 37
333  27.381885 192.168.42.196 -> 121.14.89.250 TCP 74 35119 > http [SYN] Seq=0 Win=14600 Len=0 MSS=1460 SACK_PERM=1 TSval=43209248 TSecr=0 WS=128  tcp.stream == 38
334  27.383239 192.168.42.196 -> 121.14.89.250 TCP 74 35120 > http [SYN] Seq=0 Win=14600 Len=0 MSS=1460 SACK_PERM=1 TSval=43209249 TSecr=0 WS=128  tcp.stream == 39
335  27.384536 192.168.42.196 -> 121.14.89.250 TCP 74 35121 > http [SYN] Seq=0 Win=14600 Len=0 MSS=1460 SACK_PERM=1 TSval=43209249 TSecr=0 WS=128  tcp.stream == 40
336  27.385860 192.168.42.196 -> 121.14.89.250 TCP 74 35122 > http [SYN] Seq=0 Win=14600 Len=0 MSS=1460 SACK_PERM=1 TSval=43209249 TSecr=0 WS=128  tcp.stream == 41
337  27.394288 121.14.89.240 -> 192.168.42.196 TCP 54 [TCP Window Update] http > 39339 [ACK] Seq=1 Ack=1 Win=200000 Len=0  tcp.stream == 17
338  27.397425 192.168.42.196 -> 121.14.89.250 TCP 74 35123 > http [SYN] Seq=0 Win=14600 Len=0 MSS=1460 SACK_PERM=1 TSval=43209252 TSecr=0 WS=128  tcp.stream == 42
339  27.404292 121.14.89.240 -> 192.168.42.196 TCP 54 [TCP Window Update] http > 39340 [ACK] Seq=1 Ack=1 Win=200000 Len=0  tcp.stream == 18
340  27.404308 121.14.89.240 -> 192.168.42.196 TCP 54 [TCP Window Update] http > 39341 [ACK] Seq=1 Ack=1 Win=200000 Len=0  tcp.stream == 19
341  27.414289 119.97.134.240 -> 192.168.42.196 TCP 66 http > 50521 [SYN, ACK] Seq=0 Ack=1 Win=65535 Len=0 MSS=1260 WS=4 SACK_PERM=1  tcp.stream == 21
342  27.414315 192.168.42.196 -> 119.97.134.240 TCP 54 50521 > http [ACK] Seq=1 Ack=1 Win=14720 Len=0  tcp.stream == 21
343  27.414340 119.97.134.240 -> 192.168.42.196 TCP 66 http > 50522 [SYN, ACK] Seq=0 Ack=1 Win=65535 Len=0 MSS=1260 WS=4 SACK_PERM=1  tcp.stream == 22
344  27.414347 192.168.42.196 -> 119.97.134.240 TCP 54 50522 > http [ACK] Seq=1 Ack=1 Win=14720 Len=0  tcp.stream == 22
345  27.414350 119.97.134.240 -> 192.168.42.196 TCP 66 http > 50523 [SYN, ACK] Seq=0 Ack=1 Win=65535 Len=0 MSS=1260 WS=4 SACK_PERM=1  tcp.stream == 23
346  27.414355 192.168.42.196 -> 119.97.134.240 TCP 54 50523 > http [ACK] Seq=1 Ack=1 Win=14720 Len=0  tcp.stream == 23
347  27.416678 192.168.42.196 -> 121.14.89.240 HTTP 467 GET /tps/i1/T1_kysXcXDXXXXXXXX-40-40.png HTTP/1.1   tcp.stream == 14
348  27.417902 192.168.42.196 -> 121.14.89.240 HTTP 467 GET /tps/i1/T19TisXm8DXXXXXXXX-55-55.png HTTP/1.1   tcp.stream == 16
349  27.418968 192.168.42.196 -> 121.14.89.240 HTTP 467 GET /tps/i1/T177WsXnhrXXXXXXXX-55-55.png HTTP/1.1   tcp.stream == 15
350  27.420049 192.168.42.196 -> 121.14.89.240 HTTP 467 GET /tps/i1/T1zMOsXmXZXXXXXXXX-55-55.png HTTP/1.1   tcp.stream == 17
351  27.421293 192.168.42.196 -> 121.14.89.240 HTTP 467 GET /tps/i1/T1Dm5uXityXXXXXXXX-55-55.gif HTTP/1.1   tcp.stream == 19
352  27.422331 192.168.42.196 -> 121.14.89.240 HTTP 469 GET /tps/i1/T1DHeSXkBXXXXXXXXX-300-100.png HTTP/1.1   tcp.stream == 18
353  27.423343 192.168.42.196 -> 119.97.134.240 HTTP 467 GET /tps/i2/T19AysXiVNXXXXXXXX-40-40.png HTTP/1.1   tcp.stream == 20
