  3   0.362987 192.168.42.196 -> 199.59.148.10 TCP 74 59674 > http [SYN] Seq=0 Win=14600 Len=0 MSS=1460 SACK_PERM=1 TSval=42995850 TSecr=0 WS=128  tcp.stream == 0
  6   0.613912 192.168.42.196 -> 199.59.148.82 TCP 74 46313 > http [SYN] Seq=0 Win=14600 Len=0 MSS=1460 SACK_PERM=1 TSval=42995913 TSecr=0 WS=128  tcp.stream == 1
  7   0.635992 199.59.148.10 -> 192.168.42.196 TCP 66 http > 59674 [SYN, ACK] Seq=0 Ack=1 Win=65535 Len=0 MSS=1260 WS=4 SACK_PERM=1  tcp.stream == 0
  8   0.636024 192.168.42.196 -> 199.59.148.10 TCP 54 59674 > http [ACK] Seq=1 Ack=1 Win=14720 Len=0  tcp.stream == 0
  9   0.636120 192.168.42.196 -> 199.59.148.10 HTTP 347 GET / HTTP/1.1   tcp.stream == 0
 10   0.958263 199.59.148.82 -> 192.168.42.196 TCP 66 http > 46313 [SYN, ACK] Seq=0 Ack=1 Win=65535 Len=0 MSS=1260 WS=4 SACK_PERM=1  tcp.stream == 1
 11   0.958287 192.168.42.196 -> 199.59.148.82 TCP 54 46313 > http [ACK] Seq=1 Ack=1 Win=14720 Len=0  tcp.stream == 1
 12   1.025619 199.59.148.10 -> 192.168.42.196 TCP 54 [TCP Window Update] http > 59674 [ACK] Seq=1 Ack=1 Win=200000 Len=0  tcp.stream == 0
 13   1.789290 199.59.148.82 -> 192.168.42.196 TCP 54 [TCP Window Update] http > 46313 [ACK] Seq=1 Ack=1 Win=200000 Len=0  tcp.stream == 1
 14   1.835488 199.59.148.10 -> 192.168.42.196 TCP 54 http > 59674 [ACK] Seq=1 Ack=294 Win=200000 Len=0  tcp.stream == 0
 15   2.938645 199.59.148.10 -> 192.168.42.196 TCP 1314 [TCP segment of a reassembled PDU]  tcp.stream == 0
 16   2.938662 192.168.42.196 -> 199.59.148.10 TCP 54 59674 > http [ACK] Seq=294 Ack=1261 Win=17152 Len=0  tcp.stream == 0
 17   2.948351 199.59.148.10 -> 192.168.42.196 TCP 1314 [TCP segment of a reassembled PDU]  tcp.stream == 0
 18   2.948367 192.168.42.196 -> 199.59.148.10 TCP 54 59674 > http [ACK] Seq=294 Ack=2521 Win=19712 Len=0  tcp.stream == 0
 19   2.958720 199.59.148.10 -> 192.168.42.196 TCP 1314 [TCP segment of a reassembled PDU]  tcp.stream == 0
 20   2.958738 192.168.42.196 -> 199.59.148.10 TCP 54 59674 > http [ACK] Seq=294 Ack=3781 Win=22272 Len=0  tcp.stream == 0
 21   2.958744 199.59.148.10 -> 192.168.42.196 TCP 159 [TCP segment of a reassembled PDU]  tcp.stream == 0
 22   2.958745 192.168.42.196 -> 199.59.148.10 TCP 54 59674 > http [ACK] Seq=294 Ack=3886 Win=22272 Len=0  tcp.stream == 0
 23   2.958836 199.59.148.10 -> 192.168.42.196 TCP 1314 [TCP segment of a reassembled PDU]  tcp.stream == 0
 24   2.958840 192.168.42.196 -> 199.59.148.10 TCP 54 59674 > http [ACK] Seq=294 Ack=5146 Win=24704 Len=0  tcp.stream == 0
 25   2.968724 199.59.148.10 -> 192.168.42.196 TCP 1079 [TCP segment of a reassembled PDU]  tcp.stream == 0
 26   2.968737 192.168.42.196 -> 199.59.148.10 TCP 54 59674 > http [ACK] Seq=294 Ack=6171 Win=27264 Len=0  tcp.stream == 0
 27   2.968743 199.59.148.10 -> 192.168.42.196 TCP 1314 [TCP segment of a reassembled PDU]  tcp.stream == 0
 28   2.968745 192.168.42.196 -> 199.59.148.10 TCP 54 59674 > http [ACK] Seq=294 Ack=7431 Win=29824 Len=0  tcp.stream == 0
 29   2.988346 199.59.148.10 -> 192.168.42.196 TCP 955 [TCP segment of a reassembled PDU]  tcp.stream == 0
 30   2.988361 192.168.42.196 -> 199.59.148.10 TCP 54 59674 > http [ACK] Seq=294 Ack=8332 Win=32256 Len=0  tcp.stream == 0
 31   2.998345 199.59.148.10 -> 192.168.42.196 TCP 1314 [TCP segment of a reassembled PDU]  tcp.stream == 0
 32   2.998360 192.168.42.196 -> 199.59.148.10 TCP 54 59674 > http [ACK] Seq=294 Ack=9592 Win=34816 Len=0  tcp.stream == 0
 33   3.009373 199.59.148.10 -> 192.168.42.196 TCP 934 [TCP segment of a reassembled PDU]  tcp.stream == 0
 34   3.009391 192.168.42.196 -> 199.59.148.10 TCP 54 59674 > http [ACK] Seq=294 Ack=10472 Win=37376 Len=0  tcp.stream == 0
 35   3.009398 199.59.148.10 -> 192.168.42.196 TCP 1314 [TCP segment of a reassembled PDU]  tcp.stream == 0
 36   3.009400 192.168.42.196 -> 199.59.148.10 TCP 54 59674 > http [ACK] Seq=294 Ack=11732 Win=39808 Len=0  tcp.stream == 0
 37   3.018849 199.59.148.10 -> 192.168.42.196 TCP 1314 [TCP segment of a reassembled PDU]  tcp.stream == 0
 38   3.018868 192.168.42.196 -> 199.59.148.10 TCP 54 59674 > http [ACK] Seq=294 Ack=12992 Win=42368 Len=0  tcp.stream == 0
 39   3.038477 199.59.148.10 -> 192.168.42.196 TCP 403 [TCP segment of a reassembled PDU]  tcp.stream == 0
 40   3.038495 192.168.42.196 -> 199.59.148.10 TCP 54 59674 > http [ACK] Seq=294 Ack=13341 Win=44928 Len=0  tcp.stream == 0
 41   3.038504 199.59.148.10 -> 192.168.42.196 TCP 1314 [TCP segment of a reassembled PDU]  tcp.stream == 0
 42   3.038509 192.168.42.196 -> 199.59.148.10 TCP 54 59674 > http [ACK] Seq=294 Ack=14601 Win=47360 Len=0  tcp.stream == 0
 52   3.045335 192.168.42.196 -> 184.169.77.33 TCP 74 47354 > http [SYN] Seq=0 Win=14600 Len=0 MSS=1460 SACK_PERM=1 TSval=42996521 TSecr=0 WS=128  tcp.stream == 2
 55   3.054750 192.168.42.196 -> 199.59.148.82 HTTP 641 GET /phoenix/iefavicon.ico HTTP/1.1   tcp.stream == 1
 56   3.078348 199.59.148.10 -> 192.168.42.196 HTTP 296 HTTP/1.1 200 OK  (text/html)  tcp.stream == 0
 57   3.078367 192.168.42.196 -> 199.59.148.10 TCP 54 59674 > http [ACK] Seq=294 Ack=14843 Win=49920 Len=0  tcp.stream == 0
 61   3.170495 192.168.42.196 -> 208.46.163.50 TCP 74 58578 > http [SYN] Seq=0 Win=14600 Len=0 MSS=1460 SACK_PERM=1 TSval=42996552 TSecr=0 WS=128  tcp.stream == 3
 62   3.189251 184.169.77.33 -> 192.168.42.196 TCP 66 http > 47354 [SYN, ACK] Seq=0 Ack=1 Win=65535 Len=0 MSS=1260 WS=4 SACK_PERM=1  tcp.stream == 2
 63   3.189278 192.168.42.196 -> 184.169.77.33 TCP 54 47354 > http [ACK] Seq=1 Ack=1 Win=14720 Len=0  tcp.stream == 2
 65   3.189357 192.168.42.196 -> 184.169.77.33 HTTP 382 GET /a/1329332580/t1/css/t1_core_logged_out.bundle.css HTTP/1.1   tcp.stream == 2
 69   3.288257 208.46.163.50 -> 192.168.42.196 TCP 66 http > 58578 [SYN, ACK] Seq=0 Ack=1 Win=65535 Len=0 MSS=1260 WS=4 SACK_PERM=1  tcp.stream == 3
 70   3.288286 192.168.42.196 -> 208.46.163.50 TCP 54 58578 > http [ACK] Seq=1 Ack=1 Win=14720 Len=0  tcp.stream == 3
 71   3.288362 192.168.42.196 -> 208.46.163.50 HTTP 371 GET /a/1329332580/t1/css/t1_more.bundle.css HTTP/1.1   tcp.stream == 3
 72   3.308377 184.169.77.33 -> 192.168.42.196 TCP 54 [TCP Window Update] http > 47354 [ACK] Seq=1 Ack=1 Win=200000 Len=0  tcp.stream == 2
 73   3.344485 199.59.148.82 -> 192.168.42.196 TCP 54 http > 46313 [ACK] Seq=1 Ack=588 Win=200000 Len=0  tcp.stream == 1
 74   3.344503 199.59.148.82 -> 192.168.42.196 TCP 1314 [TCP segment of a reassembled PDU]  tcp.stream == 1
 75   3.344511 192.168.42.196 -> 199.59.148.82 TCP 54 46313 > http [ACK] Seq=588 Ack=1261 Win=17152 Len=0  tcp.stream == 1
 76   3.359381 199.59.148.82 -> 192.168.42.196 TCP 1314 [TCP segment of a reassembled PDU]  tcp.stream == 1
 77   3.359403 192.168.42.196 -> 199.59.148.82 TCP 54 46313 > http [ACK] Seq=588 Ack=2521 Win=19712 Len=0  tcp.stream == 1
 78   3.359411 199.59.148.82 -> 192.168.42.196 TCP 1314 [TCP segment of a reassembled PDU]  tcp.stream == 1
 79   3.359413 192.168.42.196 -> 199.59.148.82 TCP 54 46313 > http [ACK] Seq=588 Ack=3781 Win=22272 Len=0  tcp.stream == 1
 80   3.378725 199.59.148.82 -> 192.168.42.196 TCP 1314 [TCP segment of a reassembled PDU]  tcp.stream == 1
 81   3.378743 192.168.42.196 -> 199.59.148.82 TCP 54 46313 > http [ACK] Seq=588 Ack=5041 Win=24704 Len=0  tcp.stream == 1
 82   3.388378 199.59.148.82 -> 192.168.42.196 TCP 1314 [TCP segment of a reassembled PDU]  tcp.stream == 1
 83   3.388399 192.168.42.196 -> 199.59.148.82 TCP 54 46313 > http [ACK] Seq=588 Ack=6301 Win=27264 Len=0  tcp.stream == 1
 84   3.398357 199.59.148.82 -> 192.168.42.196 TCP 1314 [TCP segment of a reassembled PDU]  tcp.stream == 1
 85   3.398380 192.168.42.196 -> 199.59.148.82 TCP 54 46313 > http [ACK] Seq=588 Ack=7561 Win=29824 Len=0  tcp.stream == 1
 86   3.398388 199.59.148.82 -> 192.168.42.196 HTTP 674 HTTP/1.1 200 OK  (image/x-icon)  tcp.stream == 1
 87   3.398392 192.168.42.196 -> 199.59.148.82 TCP 54 46313 > http [ACK] Seq=588 Ack=8181 Win=32256 Len=0  tcp.stream == 1
 88   3.398394 208.46.163.50 -> 192.168.42.196 TCP 54 [TCP Window Update] http > 58578 [ACK] Seq=1 Ack=1 Win=200000 Len=0  tcp.stream == 3
 89   3.438349 184.169.77.33 -> 192.168.42.196 TCP 54 http > 47354 [ACK] Seq=1 Ack=329 Win=200000 Len=0  tcp.stream == 2
 90   3.558351 208.46.163.50 -> 192.168.42.196 TCP 54 http > 58578 [ACK] Seq=1 Ack=318 Win=200000 Len=0  tcp.stream == 3
 91   4.338742 184.169.77.33 -> 192.168.42.196 TCP 1314 [TCP segment of a reassembled PDU]  tcp.stream == 2
 92   4.338759 192.168.42.196 -> 184.169.77.33 TCP 54 47354 > http [ACK] Seq=329 Ack=1261 Win=17152 Len=0  tcp.stream == 2
 93   4.348464 184.169.77.33 -> 192.168.42.196 TCP 1314 [TCP segment of a reassembled PDU]  tcp.stream == 2
 94   4.348487 192.168.42.196 -> 184.169.77.33 TCP 54 47354 > http [ACK] Seq=329 Ack=2521 Win=19712 Len=0  tcp.stream == 2
 95   4.370217 184.169.77.33 -> 192.168.42.196 TCP 1314 [TCP segment of a reassembled PDU]  tcp.stream == 2
 96   4.370237 192.168.42.196 -> 184.169.77.33 TCP 54 47354 > http [ACK] Seq=329 Ack=3781 Win=22272 Len=0  tcp.stream == 2
 97   4.370332 184.169.77.33 -> 192.168.42.196 TCP 1314 [TCP segment of a reassembled PDU]  tcp.stream == 2
 98   4.370337 192.168.42.196 -> 184.169.77.33 TCP 54 47354 > http [ACK] Seq=329 Ack=5041 Win=24704 Len=0  tcp.stream == 2
 99   4.378616 184.169.77.33 -> 192.168.42.196 TCP 1314 [TCP segment of a reassembled PDU]  tcp.stream == 2
100   4.378635 192.168.42.196 -> 184.169.77.33 TCP 54 47354 > http [ACK] Seq=329 Ack=6301 Win=27264 Len=0  tcp.stream == 2
101   4.388371 184.169.77.33 -> 192.168.42.196 TCP 1314 [TCP segment of a reassembled PDU]  tcp.stream == 2
102   4.388393 192.168.42.196 -> 184.169.77.33 TCP 54 47354 > http [ACK] Seq=329 Ack=7561 Win=29824 Len=0  tcp.stream == 2
103   4.398359 184.169.77.33 -> 192.168.42.196 TCP 1314 [TCP segment of a reassembled PDU]  tcp.stream == 2
104   4.398379 192.168.42.196 -> 184.169.77.33 TCP 54 47354 > http [ACK] Seq=329 Ack=8821 Win=32256 Len=0  tcp.stream == 2
105   4.408737 184.169.77.33 -> 192.168.42.196 TCP 1314 [TCP segment of a reassembled PDU]  tcp.stream == 2
106   4.408753 192.168.42.196 -> 184.169.77.33 TCP 54 47354 > http [ACK] Seq=329 Ack=10081 Win=34816 Len=0  tcp.stream == 2
107   4.408826 184.169.77.33 -> 192.168.42.196 TCP 1314 [TCP segment of a reassembled PDU]  tcp.stream == 2
108   4.408831 192.168.42.196 -> 184.169.77.33 TCP 54 47354 > http [ACK] Seq=329 Ack=11341 Win=37376 Len=0  tcp.stream == 2
109   4.419723 184.169.77.33 -> 192.168.42.196 TCP 1314 [TCP segment of a reassembled PDU]  tcp.stream == 2
110   4.419743 192.168.42.196 -> 184.169.77.33 TCP 54 47354 > http [ACK] Seq=329 Ack=12601 Win=39808 Len=0  tcp.stream == 2
111   4.428735 184.169.77.33 -> 192.168.42.196 TCP 1314 [TCP segment of a reassembled PDU]  tcp.stream == 2
112   4.428753 192.168.42.196 -> 184.169.77.33 TCP 54 47354 > http [ACK] Seq=329 Ack=13861 Win=42368 Len=0  tcp.stream == 2
113   4.510351 184.169.77.33 -> 192.168.42.196 TCP 1314 [TCP segment of a reassembled PDU]  tcp.stream == 2
114   4.510367 192.168.42.196 -> 184.169.77.33 TCP 54 47354 > http [ACK] Seq=329 Ack=15121 Win=44928 Len=0  tcp.stream == 2
115   4.510374 184.169.77.33 -> 192.168.42.196 TCP 1314 [TCP segment of a reassembled PDU]  tcp.stream == 2
116   4.510378 192.168.42.196 -> 184.169.77.33 TCP 54 47354 > http [ACK] Seq=329 Ack=16381 Win=47360 Len=0  tcp.stream == 2
117   4.519241 184.169.77.33 -> 192.168.42.196 TCP 1314 [TCP segment of a reassembled PDU]  tcp.stream == 2
118   4.519259 192.168.42.196 -> 184.169.77.33 TCP 54 47354 > http [ACK] Seq=329 Ack=17641 Win=49920 Len=0  tcp.stream == 2
119   4.519265 184.169.77.33 -> 192.168.42.196 TCP 1314 [TCP segment of a reassembled PDU]  tcp.stream == 2
120   4.519268 192.168.42.196 -> 184.169.77.33 TCP 54 47354 > http [ACK] Seq=329 Ack=18901 Win=52480 Len=0  tcp.stream == 2
121   4.519325 184.169.77.33 -> 192.168.42.196 TCP 1314 [TCP segment of a reassembled PDU]  tcp.stream == 2
122   4.519329 192.168.42.196 -> 184.169.77.33 TCP 54 47354 > http [ACK] Seq=329 Ack=20161 Win=55040 Len=0  tcp.stream == 2
123   4.527988 184.169.77.33 -> 192.168.42.196 HTTP 981 HTTP/1.1 200 OK  (text/css)  tcp.stream == 2
124   4.528006 192.168.42.196 -> 184.169.77.33 TCP 54 47354 > http [ACK] Seq=329 Ack=21088 Win=57472 Len=0  tcp.stream == 2
125   4.548114 208.46.163.50 -> 192.168.42.196 TCP 1314 [TCP segment of a reassembled PDU]  tcp.stream == 3
126   4.548134 192.168.42.196 -> 208.46.163.50 TCP 54 58578 > http [ACK] Seq=318 Ack=1261 Win=17152 Len=0  tcp.stream == 3
127   4.568119 208.46.163.50 -> 192.168.42.196 TCP 1314 [TCP segment of a reassembled PDU]  tcp.stream == 3
128   4.568141 192.168.42.196 -> 208.46.163.50 TCP 54 58578 > http [ACK] Seq=318 Ack=2521 Win=19712 Len=0  tcp.stream == 3
129   4.578745 208.46.163.50 -> 192.168.42.196 TCP 1314 [TCP segment of a reassembled PDU]  tcp.stream == 3
130   4.578764 192.168.42.196 -> 208.46.163.50 TCP 54 58578 > http [ACK] Seq=318 Ack=3781 Win=22272 Len=0  tcp.stream == 3
131   4.578772 208.46.163.50 -> 192.168.42.196 TCP 1314 [TCP segment of a reassembled PDU]  tcp.stream == 3
132   4.578775 192.168.42.196 -> 208.46.163.50 TCP 54 58578 > http [ACK] Seq=318 Ack=5041 Win=24704 Len=0  tcp.stream == 3
133   4.588254 208.46.163.50 -> 192.168.42.196 TCP 1314 [TCP segment of a reassembled PDU]  tcp.stream == 3
134   4.588270 192.168.42.196 -> 208.46.163.50 TCP 54 58578 > http [ACK] Seq=318 Ack=6301 Win=27264 Len=0  tcp.stream == 3
135   4.609874 208.46.163.50 -> 192.168.42.196 TCP 1314 [TCP segment of a reassembled PDU]  tcp.stream == 3
136   4.609895 192.168.42.196 -> 208.46.163.50 TCP 54 58578 > http [ACK] Seq=318 Ack=7561 Win=29824 Len=0  tcp.stream == 3
137   4.609902 208.46.163.50 -> 192.168.42.196 TCP 1314 [TCP segment of a reassembled PDU]  tcp.stream == 3
138   4.609905 192.168.42.196 -> 208.46.163.50 TCP 54 58578 > http [ACK] Seq=318 Ack=8821 Win=32256 Len=0  tcp.stream == 3
139   4.609907 208.46.163.50 -> 192.168.42.196 TCP 1314 [TCP segment of a reassembled PDU]  tcp.stream == 3
140   4.609910 192.168.42.196 -> 208.46.163.50 TCP 54 58578 > http [ACK] Seq=318 Ack=10081 Win=34816 Len=0  tcp.stream == 3
141   4.618871 208.46.163.50 -> 192.168.42.196 TCP 1314 [TCP segment of a reassembled PDU]  tcp.stream == 3
142   4.618892 192.168.42.196 -> 208.46.163.50 TCP 54 58578 > http [ACK] Seq=318 Ack=11341 Win=37376 Len=0  tcp.stream == 3
143   4.628869 208.46.163.50 -> 192.168.42.196 TCP 1314 [TCP segment of a reassembled PDU]  tcp.stream == 3
144   4.628891 192.168.42.196 -> 208.46.163.50 TCP 54 58578 > http [ACK] Seq=318 Ack=12601 Win=39808 Len=0  tcp.stream == 3
145   4.648216 208.46.163.50 -> 192.168.42.196 TCP 1314 [TCP segment of a reassembled PDU]  tcp.stream == 3
146   4.648237 192.168.42.196 -> 208.46.163.50 TCP 54 58578 > http [ACK] Seq=318 Ack=13861 Win=42368 Len=0  tcp.stream == 3
147   4.658742 208.46.163.50 -> 192.168.42.196 TCP 1314 [TCP segment of a reassembled PDU]  tcp.stream == 3
148   4.658761 192.168.42.196 -> 208.46.163.50 TCP 54 58578 > http [ACK] Seq=318 Ack=15121 Win=44928 Len=0  tcp.stream == 3
149   4.679486 208.46.163.50 -> 192.168.42.196 TCP 1314 [TCP segment of a reassembled PDU]  tcp.stream == 3
150   4.679502 192.168.42.196 -> 208.46.163.50 TCP 54 58578 > http [ACK] Seq=318 Ack=16381 Win=47360 Len=0  tcp.stream == 3
151   4.679510 208.46.163.50 -> 192.168.42.196 TCP 1314 [TCP segment of a reassembled PDU]  tcp.stream == 3
152   4.679513 192.168.42.196 -> 208.46.163.50 TCP 54 58578 > http [ACK] Seq=318 Ack=17641 Win=49920 Len=0  tcp.stream == 3
153   4.688335 208.46.163.50 -> 192.168.42.196 TCP 1314 [TCP segment of a reassembled PDU]  tcp.stream == 3
154   4.688351 192.168.42.196 -> 208.46.163.50 TCP 54 58578 > http [ACK] Seq=318 Ack=18901 Win=52480 Len=0  tcp.stream == 3
155   4.708871 208.46.163.50 -> 192.168.42.196 TCP 1314 [TCP segment of a reassembled PDU]  tcp.stream == 3
156   4.708892 192.168.42.196 -> 208.46.163.50 TCP 54 58578 > http [ACK] Seq=318 Ack=20161 Win=55040 Len=0  tcp.stream == 3
157   4.708900 208.46.163.50 -> 192.168.42.196 HTTP 1265 HTTP/1.1 200 OK  (text/css)  tcp.stream == 3
158   4.708902 192.168.42.196 -> 208.46.163.50 TCP 54 58578 > http [ACK] Seq=318 Ack=21372 Win=57472 Len=0  tcp.stream == 3
163   4.737224 192.168.42.196 -> 184.169.77.33 HTTP 355 GET /b/1/bundle/t1-core-en-201202151115.js HTTP/1.1   tcp.stream == 2
164   4.737259 192.168.42.196 -> 199.59.148.10 HTTP 723 GET /account/bootstrap_data?r=0.8887096105545946 HTTP/1.1   tcp.stream == 0
165   4.737302 192.168.42.196 -> 199.59.149.208 TCP 74 57938 > http [SYN] Seq=0 Win=14600 Len=0 MSS=1460 SACK_PERM=1 TSval=42996944 TSecr=0 WS=128  tcp.stream == 4
166   4.737370 192.168.42.196 -> 199.59.148.20 TCP 74 60582 > http [SYN] Seq=0 Win=14600 Len=0 MSS=1460 SACK_PERM=1 TSval=42996944 TSecr=0 WS=128  tcp.stream == 5
167   4.768683 192.168.42.196 -> 184.169.77.33 TCP 74 47358 > http [SYN] Seq=0 Win=14600 Len=0 MSS=1460 SACK_PERM=1 TSval=42996951 TSecr=0 WS=128  tcp.stream == 6
168   4.768772 192.168.42.196 -> 184.169.77.33 TCP 74 47359 > http [SYN] Seq=0 Win=14600 Len=0 MSS=1460 SACK_PERM=1 TSval=42996951 TSecr=0 WS=128  tcp.stream == 7
169   4.768794 192.168.42.196 -> 184.169.77.33 TCP 74 47360 > http [SYN] Seq=0 Win=14600 Len=0 MSS=1460 SACK_PERM=1 TSval=42996951 TSecr=0 WS=128  tcp.stream == 8
170   4.868481 184.169.77.33 -> 192.168.42.196 TCP 1314 [TCP segment of a reassembled PDU]  tcp.stream == 2
171   4.868511 192.168.42.196 -> 184.169.77.33 TCP 54 47354 > http [ACK] Seq=630 Ack=22348 Win=60032 Len=0  tcp.stream == 2
172   4.878713 184.169.77.33 -> 192.168.42.196 TCP 1314 [TCP segment of a reassembled PDU]  tcp.stream == 2
173   4.878732 192.168.42.196 -> 184.169.77.33 TCP 54 47354 > http [ACK] Seq=630 Ack=23608 Win=62592 Len=0  tcp.stream == 2
174   4.889360 184.169.77.33 -> 192.168.42.196 TCP 1314 [TCP segment of a reassembled PDU]  tcp.stream == 2
175   4.889378 192.168.42.196 -> 184.169.77.33 TCP 54 47354 > http [ACK] Seq=630 Ack=24868 Win=64128 Len=0  tcp.stream == 2
176   4.889385 184.169.77.33 -> 192.168.42.196 TCP 1314 [TCP segment of a reassembled PDU]  tcp.stream == 2
177   4.889388 192.168.42.196 -> 184.169.77.33 TCP 54 47354 > http [ACK] Seq=630 Ack=26128 Win=62976 Len=0  tcp.stream == 2
178   4.898212 184.169.77.33 -> 192.168.42.196 TCP 1314 [TCP segment of a reassembled PDU]  tcp.stream == 2
179   4.898228 192.168.42.196 -> 184.169.77.33 TCP 54 47354 > http [ACK] Seq=630 Ack=27388 Win=64128 Len=0  tcp.stream == 2
180   4.909603 184.169.77.33 -> 192.168.42.196 TCP 1314 [TCP segment of a reassembled PDU]  tcp.stream == 2
181   4.918465 184.169.77.33 -> 192.168.42.196 TCP 1314 [TCP segment of a reassembled PDU]  tcp.stream == 2
182   4.918482 192.168.42.196 -> 184.169.77.33 TCP 54 47354 > http [ACK] Seq=630 Ack=29908 Win=64128 Len=0  tcp.stream == 2
183   4.928710 184.169.77.33 -> 192.168.42.196 TCP 1314 [TCP segment of a reassembled PDU]  tcp.stream == 2
184   4.939367 184.169.77.33 -> 192.168.42.196 TCP 804 [TCP segment of a reassembled PDU]  tcp.stream == 2
185   4.939387 192.168.42.196 -> 184.169.77.33 TCP 54 47354 > http [ACK] Seq=630 Ack=31918 Win=64128 Len=0  tcp.stream == 2
186   4.939395 184.169.77.33 -> 192.168.42.196 TCP 1314 [TCP segment of a reassembled PDU]  tcp.stream == 2
187   4.949083 184.169.77.33 -> 192.168.42.196 TCP 1314 [TCP segment of a reassembled PDU]  tcp.stream == 2
188   4.949099 192.168.42.196 -> 184.169.77.33 TCP 54 47354 > http [ACK] Seq=630 Ack=34438 Win=64128 Len=0  tcp.stream == 2
189   4.970210 184.169.77.33 -> 192.168.42.196 TCP 1314 [TCP segment of a reassembled PDU]  tcp.stream == 2
190   4.979840 184.169.77.33 -> 192.168.42.196 TCP 1314 [TCP segment of a reassembled PDU]  tcp.stream == 2
191   4.979862 192.168.42.196 -> 184.169.77.33 TCP 54 47354 > http [ACK] Seq=630 Ack=36958 Win=64128 Len=0  tcp.stream == 2
192   4.979959 184.169.77.33 -> 192.168.42.196 TCP 1314 [TCP segment of a reassembled PDU]  tcp.stream == 2
193   4.979963 184.169.77.33 -> 192.168.42.196 TCP 1314 [TCP segment of a reassembled PDU]  tcp.stream == 2
194   4.980991 192.168.42.196 -> 184.169.77.33 TCP 54 47354 > http [ACK] Seq=630 Ack=39478 Win=64128 Len=0  tcp.stream == 2
199   4.987209 192.168.42.196 -> 199.59.149.232 TCP 74 45954 > http [SYN] Seq=0 Win=14600 Len=0 MSS=1460 SACK_PERM=1 TSval=42997006 TSecr=0 WS=128  tcp.stream == 9
202   4.987703 192.168.42.196 -> 199.59.148.11 TCP 74 42703 > http [SYN] Seq=0 Win=14600 Len=0 MSS=1460 SACK_PERM=1 TSval=42997006 TSecr=0 WS=128  tcp.stream == 10
203   4.998460 184.169.77.33 -> 192.168.42.196 TCP 1314 [TCP segment of a reassembled PDU]  tcp.stream == 2
207   5.019574 184.169.77.33 -> 192.168.42.196 TCP 1314 [TCP segment of a reassembled PDU]  tcp.stream == 2
208   5.019591 192.168.42.196 -> 184.169.77.33 TCP 54 47354 > http [ACK] Seq=630 Ack=41998 Win=64128 Len=0  tcp.stream == 2
209   5.019703 184.169.77.33 -> 192.168.42.196 TCP 1314 [TCP segment of a reassembled PDU]  tcp.stream == 2
210   5.019710 184.169.77.33 -> 192.168.42.196 TCP 1314 [TCP segment of a reassembled PDU]  tcp.stream == 2
211   5.019713 184.169.77.33 -> 192.168.42.196 TCP 1314 [TCP segment of a reassembled PDU]  tcp.stream == 2
212   5.019726 192.168.42.196 -> 184.169.77.33 TCP 54 47354 > http [ACK] Seq=630 Ack=45778 Win=64128 Len=0  tcp.stream == 2
214   5.019933 192.168.42.196 -> 184.169.77.33 TCP 74 47363 > http [SYN] Seq=0 Win=14600 Len=0 MSS=1460 SACK_PERM=1 TSval=42997014 TSecr=0 WS=128  tcp.stream == 11
215   5.019959 192.168.42.196 -> 184.169.77.33 TCP 74 47364 > http [SYN] Seq=0 Win=14600 Len=0 MSS=1460 SACK_PERM=1 TSval=42997014 TSecr=0 WS=128  tcp.stream == 12
216   5.019979 192.168.42.196 -> 184.169.77.33 TCP 74 47365 > http [SYN] Seq=0 Win=14600 Len=0 MSS=1460 SACK_PERM=1 TSval=42997014 TSecr=0 WS=128  tcp.stream == 13
217   5.029740 184.169.77.33 -> 192.168.42.196 TCP 1314 [TCP segment of a reassembled PDU]  tcp.stream == 2
218   5.038465 184.169.77.33 -> 192.168.42.196 TCP 1314 [TCP segment of a reassembled PDU]  tcp.stream == 2
219   5.038484 192.168.42.196 -> 184.169.77.33 TCP 54 47354 > http [ACK] Seq=630 Ack=48298 Win=64128 Len=0  tcp.stream == 2
220   5.058620 184.169.77.33 -> 192.168.42.196 TCP 1314 [TCP segment of a reassembled PDU]  tcp.stream == 2
221   5.058638 184.169.77.33 -> 192.168.42.196 TCP 1314 [TCP segment of a reassembled PDU]  tcp.stream == 2
222   5.058721 192.168.42.196 -> 184.169.77.33 TCP 54 47354 > http [ACK] Seq=630 Ack=50818 Win=64128 Len=0  tcp.stream == 2
223   5.068367 184.169.77.33 -> 192.168.42.196 TCP 1314 [TCP segment of a reassembled PDU]  tcp.stream == 2
224   5.078365 184.169.77.33 -> 192.168.42.196 TCP 1314 [TCP segment of a reassembled PDU]  tcp.stream == 2
225   5.078385 192.168.42.196 -> 184.169.77.33 TCP 54 47354 > http [ACK] Seq=630 Ack=53338 Win=64128 Len=0  tcp.stream == 2
226   5.098838 184.169.77.33 -> 192.168.42.196 TCP 1314 [TCP segment of a reassembled PDU]  tcp.stream == 2
227   5.098852 184.169.77.33 -> 192.168.42.196 TCP 1314 [TCP segment of a reassembled PDU]  tcp.stream == 2
228   5.098929 192.168.42.196 -> 184.169.77.33 TCP 54 47354 > http [ACK] Seq=630 Ack=55858 Win=64128 Len=0  tcp.stream == 2
229   5.108735 184.169.77.33 -> 192.168.42.196 TCP 1314 [TCP segment of a reassembled PDU]  tcp.stream == 2
230   5.108748 184.169.77.33 -> 192.168.42.196 TCP 1314 [TCP segment of a reassembled PDU]  tcp.stream == 2
231   5.108804 192.168.42.196 -> 184.169.77.33 TCP 54 47354 > http [ACK] Seq=630 Ack=58378 Win=64128 Len=0  tcp.stream == 2
232   5.118491 184.169.77.33 -> 192.168.42.196 TCP 1314 [TCP segment of a reassembled PDU]  tcp.stream == 2
233   5.128606 184.169.77.33 -> 192.168.42.196 TCP 1314 [TCP segment of a reassembled PDU]  tcp.stream == 2
234   5.128633 192.168.42.196 -> 184.169.77.33 TCP 54 47354 > http [ACK] Seq=630 Ack=60898 Win=64128 Len=0  tcp.stream == 2
235   5.128642 184.169.77.33 -> 192.168.42.196 TCP 1314 [TCP segment of a reassembled PDU]  tcp.stream == 2
236   5.138480 184.169.77.33 -> 192.168.42.196 TCP 1314 [TCP segment of a reassembled PDU]  tcp.stream == 2
237   5.138496 192.168.42.196 -> 184.169.77.33 TCP 54 47354 > http [ACK] Seq=630 Ack=63418 Win=64128 Len=0  tcp.stream == 2
238   5.159358 184.169.77.33 -> 192.168.42.196 TCP 1314 [TCP segment of a reassembled PDU]  tcp.stream == 2
239   5.159443 184.169.77.33 -> 192.168.42.196 TCP 1314 [TCP segment of a reassembled PDU]  tcp.stream == 2
240   5.159453 192.168.42.196 -> 184.169.77.33 TCP 54 47354 > http [ACK] Seq=630 Ack=65938 Win=64128 Len=0  tcp.stream == 2
241   5.170716 184.169.77.33 -> 192.168.42.196 TCP 1314 [TCP segment of a reassembled PDU]  tcp.stream == 2
242   5.170733 184.169.77.33 -> 192.168.42.196 TCP 1314 [TCP segment of a reassembled PDU]  tcp.stream == 2
243   5.170787 192.168.42.196 -> 184.169.77.33 TCP 54 47354 > http [ACK] Seq=630 Ack=68458 Win=64128 Len=0  tcp.stream == 2
244   5.178607 184.169.77.33 -> 192.168.42.196 TCP 1314 [TCP segment of a reassembled PDU]  tcp.stream == 2
245   5.189358 184.169.77.33 -> 192.168.42.196 TCP 1314 [TCP segment of a reassembled PDU]  tcp.stream == 2
246   5.189379 192.168.42.196 -> 184.169.77.33 TCP 54 47354 > http [ACK] Seq=630 Ack=70978 Win=64128 Len=0  tcp.stream == 2
247   5.208859 184.169.77.33 -> 192.168.42.196 TCP 1314 [TCP segment of a reassembled PDU]  tcp.stream == 2
248   5.208873 184.169.77.33 -> 192.168.42.196 TCP 1314 [TCP segment of a reassembled PDU]  tcp.stream == 2
249   5.208909 192.168.42.196 -> 184.169.77.33 TCP 54 47354 > http [ACK] Seq=630 Ack=73498 Win=64128 Len=0  tcp.stream == 2
250   5.218355 184.169.77.33 -> 192.168.42.196 TCP 1314 [TCP segment of a reassembled PDU]  tcp.stream == 2
251   5.228359 184.169.77.33 -> 192.168.42.196 TCP 1314 [TCP segment of a reassembled PDU]  tcp.stream == 2
252   5.228378 192.168.42.196 -> 184.169.77.33 TCP 54 47354 > http [ACK] Seq=630 Ack=76018 Win=64128 Len=0  tcp.stream == 2
253   5.239455 184.169.77.33 -> 192.168.42.196 TCP 1314 [TCP segment of a reassembled PDU]  tcp.stream == 2
254   5.239580 184.169.77.33 -> 192.168.42.196 TCP 1314 [TCP segment of a reassembled PDU]  tcp.stream == 2
255   5.239591 192.168.42.196 -> 184.169.77.33 TCP 54 47354 > http [ACK] Seq=630 Ack=78538 Win=64128 Len=0  tcp.stream == 2
256   5.239598 199.59.149.208 -> 192.168.42.196 TCP 66 http > 57938 [SYN, ACK] Seq=0 Ack=1 Win=65535 Len=0 MSS=1260 WS=4 SACK_PERM=1  tcp.stream == 4
257   5.239615 192.168.42.196 -> 199.59.149.208 TCP 54 57938 > http [ACK] Seq=1 Ack=1 Win=14720 Len=0  tcp.stream == 4
258   5.239618 199.59.148.20 -> 192.168.42.196 TCP 66 http > 60582 [SYN, ACK] Seq=0 Ack=1 Win=65535 Len=0 MSS=1260 WS=4 SACK_PERM=1  tcp.stream == 5
259   5.239624 192.168.42.196 -> 199.59.148.20 TCP 54 60582 > http [ACK] Seq=1 Ack=1 Win=14720 Len=0  tcp.stream == 5
260   5.239626 184.169.77.33 -> 192.168.42.196 TCP 66 http > 47358 [SYN, ACK] Seq=0 Ack=1 Win=65535 Len=0 MSS=1260 WS=4 SACK_PERM=1  tcp.stream == 6
261   5.239630 192.168.42.196 -> 184.169.77.33 TCP 54 47358 > http [ACK] Seq=1 Ack=1 Win=14720 Len=0  tcp.stream == 6
262   5.239633 184.169.77.33 -> 192.168.42.196 TCP 66 http > 47359 [SYN, ACK] Seq=0 Ack=1 Win=65535 Len=0 MSS=1260 WS=4 SACK_PERM=1  tcp.stream == 7
263   5.239636 192.168.42.196 -> 184.169.77.33 TCP 54 47359 > http [ACK] Seq=1 Ack=1 Win=14720 Len=0  tcp.stream == 7
264   5.239650 192.168.42.196 -> 199.59.149.208 HTTP 798 GET /scribe?category=client_event&log=%7B%22context%22%3A%22front%22%2C%22event_name%22%3A%22web%3Afront%3A%3A%3Aimpression%22%7D&ts=1329408322587 HTTP/1.1   tcp.stream == 4
265   5.239670 192.168.42.196 -> 199.59.148.20 HTTP 697 GET /receiver.html HTTP/1.1   tcp.stream == 5
266   5.239684 192.168.42.196 -> 184.169.77.33 HTTP 444 GET /a/1329332580/t1/img/twitter_web_sprite_bgs.png HTTP/1.1   tcp.stream == 6
267   5.239698 184.169.77.33 -> 192.168.42.196 TCP 66 http > 47360 [SYN, ACK] Seq=0 Ack=1 Win=65535 Len=0 MSS=1260 WS=4 SACK_PERM=1  tcp.stream == 8
268   5.239703 192.168.42.196 -> 184.169.77.33 HTTP 442 GET /a/1329332580/t1/img/twitter_logo_top_bar.png HTTP/1.1   tcp.stream == 7
269   5.239705 192.168.42.196 -> 184.169.77.33 TCP 54 47360 > http [ACK] Seq=1 Ack=1 Win=14720 Len=0  tcp.stream == 8
270   5.239728 192.168.42.196 -> 184.169.77.33 HTTP 447 GET /a/1329332580/t1/img/front_page/iphone-concert.jpg HTTP/1.1   tcp.stream == 8
271   5.249861 184.169.77.33 -> 192.168.42.196 TCP 1314 [TCP segment of a reassembled PDU]  tcp.stream == 2
272   5.259856 184.169.77.33 -> 192.168.42.196 TCP 1314 [TCP segment of a reassembled PDU]  tcp.stream == 2
273   5.259871 192.168.42.196 -> 184.169.77.33 TCP 54 47354 > http [ACK] Seq=630 Ack=81058 Win=64128 Len=0  tcp.stream == 2
274   5.259878 184.169.77.33 -> 192.168.42.196 TCP 1314 [TCP segment of a reassembled PDU]  tcp.stream == 2
275   5.259881 199.59.148.10 -> 192.168.42.196 TCP 54 http > 59674 [ACK] Seq=14843 Ack=963 Win=200000 Len=0  tcp.stream == 0
276   5.259946 199.59.148.10 -> 192.168.42.196 TCP 1314 [TCP segment of a reassembled PDU]  tcp.stream == 0
277   5.259951 192.168.42.196 -> 199.59.148.10 TCP 54 59674 > http [ACK] Seq=963 Ack=16103 Win=52480 Len=0  tcp.stream == 0
278   5.269838 199.59.148.10 -> 192.168.42.196 TCP 1314 [TCP segment of a reassembled PDU]  tcp.stream == 0
279   5.269855 192.168.42.196 -> 199.59.148.10 TCP 54 59674 > http [ACK] Seq=963 Ack=17363 Win=55040 Len=0  tcp.stream == 0
280   5.269861 199.59.148.10 -> 192.168.42.196 TCP 1314 [TCP segment of a reassembled PDU]  tcp.stream == 0
281   5.269864 192.168.42.196 -> 199.59.148.10 TCP 54 59674 > http [ACK] Seq=963 Ack=18623 Win=57472 Len=0  tcp.stream == 0
282   5.269952 199.59.148.10 -> 192.168.42.196 HTTP 823 HTTP/1.1 200 OK  (application/json)  tcp.stream == 0
283   5.269956 192.168.42.196 -> 199.59.148.10 TCP 54 59674 > http [ACK] Seq=963 Ack=19392 Win=60032 Len=0  tcp.stream == 0
284   5.269960 184.169.77.33 -> 192.168.42.196 TCP 1314 [TCP segment of a reassembled PDU]  tcp.stream == 2
285   5.269963 192.168.42.196 -> 184.169.77.33 TCP 54 47354 > http [ACK] Seq=630 Ack=83578 Win=64128 Len=0  tcp.stream == 2
286   5.279462 184.169.77.33 -> 192.168.42.196 TCP 1314 [TCP segment of a reassembled PDU]  tcp.stream == 2
287   5.279568 184.169.77.33 -> 192.168.42.196 TCP 1314 [TCP segment of a reassembled PDU]  tcp.stream == 2
288   5.279598 192.168.42.196 -> 184.169.77.33 TCP 54 47354 > http [ACK] Seq=630 Ack=86098 Win=64128 Len=0  tcp.stream == 2
289   5.289737 184.169.77.33 -> 192.168.42.196 TCP 1314 [TCP segment of a reassembled PDU]  tcp.stream == 2
290   5.289754 184.169.77.33 -> 192.168.42.196 TCP 1314 [TCP segment of a reassembled PDU]  tcp.stream == 2
291   5.289795 192.168.42.196 -> 184.169.77.33 TCP 54 47354 > http [ACK] Seq=630 Ack=88618 Win=64128 Len=0  tcp.stream == 2
292   5.299490 184.169.77.33 -> 192.168.42.196 TCP 1314 [TCP segment of a reassembled PDU]  tcp.stream == 2
293   5.299508 184.169.77.33 -> 192.168.42.196 TCP 1314 [TCP segment of a reassembled PDU]  tcp.stream == 2
294   5.299561 192.168.42.196 -> 184.169.77.33 TCP 54 47354 > http [ACK] Seq=630 Ack=91138 Win=64128 Len=0  tcp.stream == 2
295   5.309348 184.169.77.33 -> 192.168.42.196 TCP 1314 [TCP segment of a reassembled PDU]  tcp.stream == 2
296   5.309364 184.169.77.33 -> 192.168.42.196 TCP 1314 [TCP segment of a reassembled PDU]  tcp.stream == 2
297   5.309402 192.168.42.196 -> 184.169.77.33 TCP 54 47354 > http [ACK] Seq=630 Ack=93658 Win=64128 Len=0  tcp.stream == 2
298   5.319216 184.169.77.33 -> 192.168.42.196 TCP 1314 [TCP segment of a reassembled PDU]  tcp.stream == 2
299   5.341500 184.169.77.33 -> 192.168.42.196 TCP 1314 [TCP segment of a reassembled PDU]  tcp.stream == 2
300   5.341516 192.168.42.196 -> 184.169.77.33 TCP 54 47354 > http [ACK] Seq=630 Ack=96178 Win=64128 Len=0  tcp.stream == 2
301   5.341524 184.169.77.33 -> 192.168.42.196 TCP 1314 [TCP segment of a reassembled PDU]  tcp.stream == 2
302   5.341527 184.169.77.33 -> 192.168.42.196 TCP 1314 [TCP segment of a reassembled PDU]  tcp.stream == 2
303   5.341570 184.169.77.33 -> 192.168.42.196 TCP 1314 [TCP segment of a reassembled PDU]  tcp.stream == 2
304   5.341572 184.169.77.33 -> 192.168.42.196 TCP 1314 [TCP segment of a reassembled PDU]  tcp.stream == 2
305   5.341585 192.168.42.196 -> 184.169.77.33 TCP 54 47354 > http [ACK] Seq=630 Ack=101218 Win=64128 Len=0  tcp.stream == 2
306   5.341699 184.169.77.33 -> 192.168.42.196 TCP 1314 [TCP segment of a reassembled PDU]  tcp.stream == 2
307   5.341704 199.59.149.232 -> 192.168.42.196 TCP 66 http > 45954 [SYN, ACK] Seq=0 Ack=1 Win=65535 Len=0 MSS=1260 WS=4 SACK_PERM=1  tcp.stream == 9
308   5.341714 192.168.42.196 -> 199.59.149.232 TCP 54 45954 > http [ACK] Seq=1 Ack=1 Win=14720 Len=0  tcp.stream == 9
309   5.341718 199.59.148.11 -> 192.168.42.196 TCP 66 http > 42703 [SYN, ACK] Seq=0 Ack=1 Win=65535 Len=0 MSS=1260 WS=4 SACK_PERM=1  tcp.stream == 10
310   5.341722 192.168.42.196 -> 199.59.148.11 TCP 54 42703 > http [ACK] Seq=1 Ack=1 Win=14720 Len=0  tcp.stream == 10
311   5.353354 184.169.77.33 -> 192.168.42.196 TCP 1314 [TCP segment of a reassembled PDU]  tcp.stream == 2
312   5.353375 192.168.42.196 -> 184.169.77.33 TCP 54 47354 > http [ACK] Seq=630 Ack=103738 Win=64128 Len=0  tcp.stream == 2
313   5.353382 184.169.77.33 -> 192.168.42.196 TCP 1314 [TCP segment of a reassembled PDU]  tcp.stream == 2
314   5.353385 184.169.77.33 -> 192.168.42.196 TCP 66 http > 47363 [SYN, ACK] Seq=0 Ack=1 Win=65535 Len=0 MSS=1260 WS=4 SACK_PERM=1  tcp.stream == 11
315   5.353393 192.168.42.196 -> 184.169.77.33 TCP 54 47363 > http [ACK] Seq=1 Ack=1 Win=14720 Len=0  tcp.stream == 11
316   5.353396 184.169.77.33 -> 192.168.42.196 TCP 1314 [TCP segment of a reassembled PDU]  tcp.stream == 2
317   5.353444 192.168.42.196 -> 184.169.77.33 TCP 54 47354 > http [ACK] Seq=630 Ack=106258 Win=64128 Len=0  tcp.stream == 2
318   5.360731 184.169.77.33 -> 192.168.42.196 TCP 1314 [TCP segment of a reassembled PDU]  tcp.stream == 2
319   5.360744 184.169.77.33 -> 192.168.42.196 TCP 1314 [TCP segment of a reassembled PDU]  tcp.stream == 2
320   5.360795 192.168.42.196 -> 184.169.77.33 TCP 54 47354 > http [ACK] Seq=630 Ack=108778 Win=64128 Len=0  tcp.stream == 2
321   5.369590 184.169.77.33 -> 192.168.42.196 TCP 66 http > 47364 [SYN, ACK] Seq=0 Ack=1 Win=65535 Len=0 MSS=1260 WS=4 SACK_PERM=1  tcp.stream == 12
322   5.369616 192.168.42.196 -> 184.169.77.33 TCP 54 47364 > http [ACK] Seq=1 Ack=1 Win=14720 Len=0  tcp.stream == 12
323   5.369623 184.169.77.33 -> 192.168.42.196 TCP 66 http > 47365 [SYN, ACK] Seq=0 Ack=1 Win=65535 Len=0 MSS=1260 WS=4 SACK_PERM=1  tcp.stream == 13
324   5.369628 192.168.42.196 -> 184.169.77.33 TCP 54 47365 > http [ACK] Seq=1 Ack=1 Win=14720 Len=0  tcp.stream == 13
325   5.369699 184.169.77.33 -> 192.168.42.196 TCP 1314 [TCP segment of a reassembled PDU]  tcp.stream == 2
326   5.369705 184.169.77.33 -> 192.168.42.196 TCP 1314 [TCP segment of a reassembled PDU]  tcp.stream == 2
327   5.369732 192.168.42.196 -> 184.169.77.33 TCP 54 47354 > http [ACK] Seq=630 Ack=111298 Win=64128 Len=0  tcp.stream == 2
328   5.378363 184.169.77.33 -> 192.168.42.196 TCP 1314 [TCP segment of a reassembled PDU]  tcp.stream == 2
329   5.389710 184.169.77.33 -> 192.168.42.196 TCP 1314 [TCP segment of a reassembled PDU]  tcp.stream == 2
330   5.389729 192.168.42.196 -> 184.169.77.33 TCP 54 47354 > http [ACK] Seq=630 Ack=113818 Win=64128 Len=0  tcp.stream == 2
331   5.389739 184.169.77.33 -> 192.168.42.196 TCP 1314 [TCP segment of a reassembled PDU]  tcp.stream == 2
332   5.411864 184.169.77.33 -> 192.168.42.196 TCP 1314 [TCP segment of a reassembled PDU]  tcp.stream == 2
333   5.411883 192.168.42.196 -> 184.169.77.33 TCP 54 47354 > http [ACK] Seq=630 Ack=116338 Win=64128 Len=0  tcp.stream == 2
334   5.411890 184.169.77.33 -> 192.168.42.196 TCP 1314 [TCP segment of a reassembled PDU]  tcp.stream == 2
335   5.411943 184.169.77.33 -> 192.168.42.196 TCP 1314 [TCP segment of a reassembled PDU]  tcp.stream == 2
336   5.411946 192.168.42.196 -> 184.169.77.33 TCP 54 47354 > http [ACK] Seq=630 Ack=118858 Win=64128 Len=0  tcp.stream == 2
337   5.412074 184.169.77.33 -> 192.168.42.196 TCP 1314 [TCP segment of a reassembled PDU]  tcp.stream == 2
338   5.412080 184.169.77.33 -> 192.168.42.196 TCP 1314 [TCP segment of a reassembled PDU]  tcp.stream == 2
339   5.412081 184.169.77.33 -> 192.168.42.196 TCP 1314 [TCP segment of a reassembled PDU]  tcp.stream == 2
340   5.412118 192.168.42.196 -> 184.169.77.33 TCP 54 47354 > http [ACK] Seq=630 Ack=122638 Win=64128 Len=0  tcp.stream == 2
341   5.412732 184.169.77.33 -> 192.168.42.196 TCP 1314 [TCP segment of a reassembled PDU]  tcp.stream == 2
342   5.418835 184.169.77.33 -> 192.168.42.196 TCP 1314 [TCP segment of a reassembled PDU]  tcp.stream == 2
343   5.418852 192.168.42.196 -> 184.169.77.33 TCP 54 47354 > http [ACK] Seq=630 Ack=125158 Win=64128 Len=0  tcp.stream == 2
344   5.428605 184.169.77.33 -> 192.168.42.196 TCP 1314 [TCP segment of a reassembled PDU]  tcp.stream == 2
345   5.428621 184.169.77.33 -> 192.168.42.196 TCP 1314 [TCP segment of a reassembled PDU]  tcp.stream == 2
346   5.428662 192.168.42.196 -> 184.169.77.33 TCP 54 47354 > http [ACK] Seq=630 Ack=127678 Win=64128 Len=0  tcp.stream == 2
347   5.451214 184.169.77.33 -> 192.168.42.196 TCP 1314 [TCP segment of a reassembled PDU]  tcp.stream == 2
348   5.451231 192.168.42.196 -> 184.169.77.33 TCP 54 47354 > http [ACK] Seq=630 Ack=128938 Win=66688 Len=0  tcp.stream == 2
349   5.451238 184.169.77.33 -> 192.168.42.196 TCP 1314 [TCP segment of a reassembled PDU]  tcp.stream == 2
350   5.451241 192.168.42.196 -> 184.169.77.33 TCP 54 47354 > http [ACK] Seq=630 Ack=130198 Win=69120 Len=0  tcp.stream == 2
351   5.451243 184.169.77.33 -> 192.168.42.196 TCP 1314 [TCP segment of a reassembled PDU]  tcp.stream == 2
352   5.451245 192.168.42.196 -> 184.169.77.33 TCP 54 47354 > http [ACK] Seq=630 Ack=131458 Win=71680 Len=0  tcp.stream == 2
353   5.451319 184.169.77.33 -> 192.168.42.196 TCP 1314 [TCP segment of a reassembled PDU]  tcp.stream == 2
354   5.451323 192.168.42.196 -> 184.169.77.33 TCP 54 47354 > http [ACK] Seq=630 Ack=132718 Win=74240 Len=0  tcp.stream == 2
355   5.451325 184.169.77.33 -> 192.168.42.196 TCP 1314 [TCP segment of a reassembled PDU]  tcp.stream == 2
356   5.451329 192.168.42.196 -> 184.169.77.33 TCP 54 47354 > http [ACK] Seq=630 Ack=133978 Win=76800 Len=0  tcp.stream == 2
357   5.451446 184.169.77.33 -> 192.168.42.196 TCP 1314 [TCP segment of a reassembled PDU]  tcp.stream == 2
358   5.451452 192.168.42.196 -> 184.169.77.33 TCP 54 47354 > http [ACK] Seq=630 Ack=135238 Win=79232 Len=0  tcp.stream == 2
359   5.458472 184.169.77.33 -> 192.168.42.196 TCP 1314 [TCP segment of a reassembled PDU]  tcp.stream == 2
360   5.458487 192.168.42.196 -> 184.169.77.33 TCP 54 47354 > http [ACK] Seq=630 Ack=136498 Win=81792 Len=0  tcp.stream == 2
361   5.469706 184.169.77.33 -> 192.168.42.196 TCP 1314 [TCP segment of a reassembled PDU]  tcp.stream == 2
362   5.469728 192.168.42.196 -> 184.169.77.33 TCP 54 47354 > http [ACK] Seq=630 Ack=137758 Win=84352 Len=0  tcp.stream == 2
363   5.469751 184.169.77.33 -> 192.168.42.196 TCP 1314 [TCP segment of a reassembled PDU]  tcp.stream == 2
364   5.469754 192.168.42.196 -> 184.169.77.33 TCP 54 47354 > http [ACK] Seq=630 Ack=139018 Win=86784 Len=0  tcp.stream == 2
365   5.479838 184.169.77.33 -> 192.168.42.196 TCP 1314 [TCP segment of a reassembled PDU]  tcp.stream == 2
366   5.479858 192.168.42.196 -> 184.169.77.33 TCP 54 47354 > http [ACK] Seq=630 Ack=140278 Win=89344 Len=0  tcp.stream == 2
367   5.479868 184.169.77.33 -> 192.168.42.196 TCP 1314 [TCP segment of a reassembled PDU]  tcp.stream == 2
368   5.479871 192.168.42.196 -> 184.169.77.33 TCP 54 47354 > http [ACK] Seq=630 Ack=141538 Win=91904 Len=0  tcp.stream == 2
369   5.479873 199.59.149.208 -> 192.168.42.196 TCP 54 [TCP Window Update] http > 57938 [ACK] Seq=1 Ack=1 Win=200000 Len=0  tcp.stream == 4
370   5.479951 199.59.148.20 -> 192.168.42.196 TCP 54 [TCP Window Update] http > 60582 [ACK] Seq=1 Ack=1 Win=200000 Len=0  tcp.stream == 5
