  7   2.324532 192.168.42.196 -> 199.59.149.198 TCP 74 37300 > http [SYN] Seq=0 Win=14600 Len=0 MSS=1460 SACK_PERM=1 TSval=42990312 TSecr=0 WS=128  tcp.stream == 0
  8   2.449272 199.59.149.198 -> 192.168.42.196 TCP 66 http > 37300 [SYN, ACK] Seq=0 Ack=1 Win=65535 Len=0 MSS=1260 WS=4 SACK_PERM=1  tcp.stream == 0
  9   2.449301 192.168.42.196 -> 199.59.149.198 TCP 54 37300 > http [ACK] Seq=1 Ack=1 Win=14720 Len=0  tcp.stream == 0
 10   2.454285 192.168.42.196 -> 199.59.149.198 HTTP 451 GET / HTTP/1.1   tcp.stream == 0
 11   2.559399 199.59.149.198 -> 192.168.42.196 TCP 54 [TCP Window Update] http > 37300 [ACK] Seq=1 Ack=1 Win=200000 Len=0  tcp.stream == 0
 12   2.659899 199.59.149.198 -> 192.168.42.196 TCP 1314 [TCP segment of a reassembled PDU]  tcp.stream == 0
 13   2.659918 192.168.42.196 -> 199.59.149.198 TCP 54 37300 > http [ACK] Seq=398 Ack=1261 Win=17152 Len=0  tcp.stream == 0
 14   2.659925 199.59.149.198 -> 192.168.42.196 HTTP 489 HTTP/1.1 200 OK  (text/html)  tcp.stream == 0
 15   2.659927 192.168.42.196 -> 199.59.149.198 TCP 54 37300 > http [ACK] Seq=398 Ack=1696 Win=19712 Len=0  tcp.stream == 0
 16   2.690278 192.168.42.196 -> 199.59.149.198 TCP 54 37300 > http [FIN, ACK] Seq=398 Ack=1696 Win=19712 Len=0  tcp.stream == 0
 17   2.800905 199.59.149.198 -> 192.168.42.196 TCP 54 http > 37300 [ACK] Seq=1696 Ack=399 Win=200000 Len=0  tcp.stream == 0
 18   2.809267 199.59.149.198 -> 192.168.42.196 TCP 54 http > 37300 [FIN, ACK] Seq=1696 Ack=399 Win=200000 Len=0  tcp.stream == 0
 19   2.809286 192.168.42.196 -> 199.59.149.198 TCP 54 37300 > http [ACK] Seq=399 Ack=1697 Win=19712 Len=0  tcp.stream == 0
 26   3.622687 192.168.42.196 -> 199.59.149.240 TCP 74 59471 > https [SYN] Seq=0 Win=14600 Len=0 MSS=1460 SACK_PERM=1 TSval=42990636 TSecr=0 WS=128  tcp.stream == 1
 27   3.739510 199.59.149.240 -> 192.168.42.196 TCP 66 https > 59471 [SYN, ACK] Seq=0 Ack=1 Win=65535 Len=0 MSS=1260 WS=4 SACK_PERM=1  tcp.stream == 1
 28   3.739535 192.168.42.196 -> 199.59.149.240 TCP 54 59471 > https [ACK] Seq=1 Ack=1 Win=14720 Len=0  tcp.stream == 1
 29   3.760301 192.168.42.196 -> 199.59.149.240 SSL 260 Client Hello  tcp.stream == 1
 30   3.849130 199.59.149.240 -> 192.168.42.196 TCP 54 [TCP Window Update] https > 59471 [ACK] Seq=1 Ack=1 Win=200000 Len=0  tcp.stream == 1
 31   3.919507 199.59.149.240 -> 192.168.42.196 TLSv1 1314 Server Hello  tcp.stream == 1
 32   3.919526 192.168.42.196 -> 199.59.149.240 TCP 54 59471 > https [ACK] Seq=207 Ack=1261 Win=17152 Len=0  tcp.stream == 1
 33   3.931257 199.59.149.240 -> 192.168.42.196 TCP 1314 [TCP segment of a reassembled PDU]  tcp.stream == 1
 34   3.931285 192.168.42.196 -> 199.59.149.240 TCP 54 59471 > https [ACK] Seq=207 Ack=2521 Win=19712 Len=0  tcp.stream == 1
 35   3.931293 199.59.149.240 -> 192.168.42.196 TLSv1 1209 Certificate, Server Key Exchange, Server Hello Done  tcp.stream == 1
 36   3.931296 192.168.42.196 -> 199.59.149.240 TCP 54 59471 > https [ACK] Seq=207 Ack=3676 Win=22272 Len=0  tcp.stream == 1
