  3   0.366381 192.168.42.196 -> 157.166.226.25 TCP 74 43215 > http [SYN] Seq=0 Win=14600 Len=0 MSS=1460 SACK_PERM=1 TSval=44373378 TSecr=0 WS=128  tcp.stream == 0
  6   0.617277 192.168.42.196 -> 157.166.255.19 TCP 74 41008 > http [SYN] Seq=0 Win=14600 Len=0 MSS=1460 SACK_PERM=1 TSval=44373441 TSecr=0 WS=128  tcp.stream == 1
  7   0.779062 157.166.226.25 -> 192.168.42.196 TCP 66 http > 43215 [SYN, ACK] Seq=0 Ack=1 Win=65535 Len=0 MSS=1260 WS=4 SACK_PERM=1  tcp.stream == 0
  8   0.779083 192.168.42.196 -> 157.166.226.25 TCP 54 43215 > http [ACK] Seq=1 Ack=1 Win=14720 Len=0  tcp.stream == 0
  9   0.779184 192.168.42.196 -> 157.166.226.25 HTTP 343 GET / HTTP/1.1   tcp.stream == 0
 10   1.288963 157.166.255.19 -> 192.168.42.196 TCP 66 http > 41008 [SYN, ACK] Seq=0 Ack=1 Win=65535 Len=0 MSS=1260 WS=4 SACK_PERM=1  tcp.stream == 1
 11   1.288987 192.168.42.196 -> 157.166.255.19 TCP 54 41008 > http [ACK] Seq=1 Ack=1 Win=14720 Len=0  tcp.stream == 1
 12   1.316050 157.166.226.25 -> 192.168.42.196 TCP 54 [TCP Window Update] http > 43215 [ACK] Seq=1 Ack=1 Win=200000 Len=0  tcp.stream == 0
 13   1.985802 157.166.255.19 -> 192.168.42.196 TCP 54 [TCP Window Update] http > 41008 [ACK] Seq=1 Ack=1 Win=200000 Len=0  tcp.stream == 1
 14   2.135932 157.166.226.25 -> 192.168.42.196 HTTP 442 HTTP/1.1 301 Moved Permanently  (text/html)  tcp.stream == 0
 15   2.135964 192.168.42.196 -> 157.166.226.25 TCP 54 43215 > http [ACK] Seq=290 Ack=389 Win=15744 Len=0  tcp.stream == 0
 18   2.234653 192.168.42.196 -> 157.166.255.18 TCP 74 34223 > http [SYN] Seq=0 Win=14600 Len=0 MSS=1460 SACK_PERM=1 TSval=44373845 TSecr=0 WS=128  tcp.stream == 2
 21   2.486968 192.168.42.196 -> 157.166.255.19 TCP 74 41010 > http [SYN] Seq=0 Win=14600 Len=0 MSS=1460 SACK_PERM=1 TSval=44373909 TSecr=0 WS=128  tcp.stream == 3
 22   2.576172 157.166.255.18 -> 192.168.42.196 TCP 66 http > 34223 [SYN, ACK] Seq=0 Ack=1 Win=65535 Len=0 MSS=1260 WS=4 SACK_PERM=1  tcp.stream == 2
 23   2.576202 192.168.42.196 -> 157.166.255.18 TCP 54 34223 > http [ACK] Seq=1 Ack=1 Win=14720 Len=0  tcp.stream == 2
 24   2.576295 192.168.42.196 -> 157.166.255.18 HTTP 347 GET / HTTP/1.1   tcp.stream == 2
 25   2.756057 157.166.255.19 -> 192.168.42.196 TCP 66 http > 41010 [SYN, ACK] Seq=0 Ack=1 Win=65535 Len=0 MSS=1260 WS=4 SACK_PERM=1  tcp.stream == 3
 26   2.756082 192.168.42.196 -> 157.166.255.19 TCP 54 41010 > http [ACK] Seq=1 Ack=1 Win=14720 Len=0  tcp.stream == 3
 27   2.976180 157.166.255.18 -> 192.168.42.196 TCP 54 [TCP Window Update] http > 34223 [ACK] Seq=1 Ack=1 Win=200000 Len=0  tcp.stream == 2
 28   3.658585 157.166.255.19 -> 192.168.42.196 TCP 54 [TCP Window Update] http > 41010 [ACK] Seq=1 Ack=1 Win=200000 Len=0  tcp.stream == 3
 29   4.167427 157.166.255.18 -> 192.168.42.196 TCP 1314 [TCP segment of a reassembled PDU]  tcp.stream == 2
 30   4.167448 192.168.42.196 -> 157.166.255.18 TCP 54 34223 > http [ACK] Seq=294 Ack=1261 Win=17152 Len=0  tcp.stream == 2
 31   4.167516 157.166.255.18 -> 192.168.42.196 TCP 1314 [TCP segment of a reassembled PDU]  tcp.stream == 2
 32   4.167519 192.168.42.196 -> 157.166.255.18 TCP 54 34223 > http [ACK] Seq=294 Ack=2521 Win=19712 Len=0  tcp.stream == 2
 33   4.176905 157.166.255.18 -> 192.168.42.196 TCP 444 [TCP segment of a reassembled PDU]  tcp.stream == 2
 34   4.176926 192.168.42.196 -> 157.166.255.18 TCP 54 34223 > http [ACK] Seq=294 Ack=2911 Win=22272 Len=0  tcp.stream == 2
 35   4.177014 157.166.255.18 -> 192.168.42.196 TCP 1314 [TCP segment of a reassembled PDU]  tcp.stream == 2
 36   4.177020 192.168.42.196 -> 157.166.255.18 TCP 54 34223 > http [ACK] Seq=294 Ack=4171 Win=24704 Len=0  tcp.stream == 2
 42   4.187150 157.166.255.18 -> 192.168.42.196 TCP 1129 [TCP segment of a reassembled PDU]  tcp.stream == 2
 43   4.187167 192.168.42.196 -> 157.166.255.18 TCP 54 34223 > http [ACK] Seq=294 Ack=5246 Win=27264 Len=0  tcp.stream == 2
 44   4.187365 192.168.42.196 -> 8.27.248.125 TCP 74 46738 > http [SYN] Seq=0 Win=14600 Len=0 MSS=1460 SACK_PERM=1 TSval=44374334 TSecr=0 WS=128  tcp.stream == 4
 45   4.187396 192.168.42.196 -> 8.27.248.125 TCP 74 46739 > http [SYN] Seq=0 Win=14600 Len=0 MSS=1460 SACK_PERM=1 TSval=44374334 TSecr=0 WS=128  tcp.stream == 5
 46   4.193785 192.168.42.196 -> 157.166.255.19 HTTP 361 GET /favicon.ie9.ico HTTP/1.1   tcp.stream == 3
 48   4.196506 192.168.42.196 -> 8.27.248.125 TCP 74 46740 > http [SYN] Seq=0 Win=14600 Len=0 MSS=1460 SACK_PERM=1 TSval=44374336 TSecr=0 WS=128  tcp.stream == 6
 49   4.197276 157.166.255.18 -> 192.168.42.196 TCP 1314 [TCP segment of a reassembled PDU]  tcp.stream == 2
 50   4.197292 192.168.42.196 -> 157.166.255.18 TCP 54 34223 > http [ACK] Seq=294 Ack=6506 Win=29824 Len=0  tcp.stream == 2
 51   4.197391 157.166.255.18 -> 192.168.42.196 TCP 413 [TCP segment of a reassembled PDU]  tcp.stream == 2
 52   4.197396 192.168.42.196 -> 157.166.255.18 TCP 54 34223 > http [ACK] Seq=294 Ack=6865 Win=32256 Len=0  tcp.stream == 2
 53   4.206881 192.168.42.196 -> 8.27.248.125 TCP 74 46741 > http [SYN] Seq=0 Win=14600 Len=0 MSS=1460 SACK_PERM=1 TSval=44374339 TSecr=0 WS=128  tcp.stream == 7
 54   4.208028 157.166.255.18 -> 192.168.42.196 TCP 1314 [TCP segment of a reassembled PDU]  tcp.stream == 2
 55   4.208048 192.168.42.196 -> 157.166.255.18 TCP 54 34223 > http [ACK] Seq=294 Ack=8125 Win=34816 Len=0  tcp.stream == 2
 56   4.208074 157.166.255.18 -> 192.168.42.196 TCP 722 [TCP segment of a reassembled PDU]  tcp.stream == 2
 57   4.208078 192.168.42.196 -> 157.166.255.18 TCP 54 34223 > http [ACK] Seq=294 Ack=8793 Win=37376 Len=0  tcp.stream == 2
 58   4.213570 192.168.42.196 -> 8.27.248.125 TCP 74 46742 > http [SYN] Seq=0 Win=14600 Len=0 MSS=1460 SACK_PERM=1 TSval=44374340 TSecr=0 WS=128  tcp.stream == 8
 59   4.213633 192.168.42.196 -> 8.27.248.125 TCP 74 46743 > http [SYN] Seq=0 Win=14600 Len=0 MSS=1460 SACK_PERM=1 TSval=44374340 TSecr=0 WS=128  tcp.stream == 9
 60   4.216908 157.166.255.18 -> 192.168.42.196 TCP 1314 [TCP segment of a reassembled PDU]  tcp.stream == 2
 61   4.216928 192.168.42.196 -> 157.166.255.18 TCP 54 34223 > http [ACK] Seq=294 Ack=10053 Win=39808 Len=0  tcp.stream == 2
 62   4.216936 157.166.255.18 -> 192.168.42.196 TCP 404 [TCP segment of a reassembled PDU]  tcp.stream == 2
 63   4.216939 192.168.42.196 -> 157.166.255.18 TCP 54 34223 > http [ACK] Seq=294 Ack=10403 Win=42368 Len=0  tcp.stream == 2
 64   4.228533 157.166.255.18 -> 192.168.42.196 TCP 816 [TCP segment of a reassembled PDU]  tcp.stream == 2
 65   4.228552 192.168.42.196 -> 157.166.255.18 TCP 54 34223 > http [ACK] Seq=294 Ack=11165 Win=44928 Len=0  tcp.stream == 2
 66   4.228560 157.166.255.18 -> 192.168.42.196 TCP 697 [TCP segment of a reassembled PDU]  tcp.stream == 2
 67   4.228563 192.168.42.196 -> 157.166.255.18 TCP 54 34223 > http [ACK] Seq=294 Ack=11808 Win=47360 Len=0  tcp.stream == 2
 68   4.237409 157.166.255.18 -> 192.168.42.196 TCP 1314 [TCP segment of a reassembled PDU]  tcp.stream == 2
 69   4.237426 192.168.42.196 -> 157.166.255.18 TCP 54 34223 > http [ACK] Seq=294 Ack=13068 Win=49920 Len=0  tcp.stream == 2
 70   4.237433 157.166.255.18 -> 192.168.42.196 TCP 397 [TCP segment of a reassembled PDU]  tcp.stream == 2
 71   4.237435 192.168.42.196 -> 157.166.255.18 TCP 54 34223 > http [ACK] Seq=294 Ack=13411 Win=52480 Len=0  tcp.stream == 2
 72   4.237437 157.166.255.18 -> 192.168.42.196 TCP 1314 [TCP segment of a reassembled PDU]  tcp.stream == 2
 73   4.237441 192.168.42.196 -> 157.166.255.18 TCP 54 34223 > http [ACK] Seq=294 Ack=14671 Win=55040 Len=0  tcp.stream == 2
 74   4.357284 157.166.255.18 -> 192.168.42.196 TCP 1314 [TCP segment of a reassembled PDU]  tcp.stream == 2
 75   4.357303 192.168.42.196 -> 157.166.255.18 TCP 54 34223 > http [ACK] Seq=294 Ack=15931 Win=57472 Len=0  tcp.stream == 2
 76   4.357390 157.166.255.18 -> 192.168.42.196 TCP 1314 [TCP segment of a reassembled PDU]  tcp.stream == 2
 77   4.357395 192.168.42.196 -> 157.166.255.18 TCP 54 34223 > http [ACK] Seq=294 Ack=17191 Win=60032 Len=0  tcp.stream == 2
 78   4.377408 157.166.255.18 -> 192.168.42.196 TCP 1314 [TCP segment of a reassembled PDU]  tcp.stream == 2
 79   4.377426 192.168.42.196 -> 157.166.255.18 TCP 54 34223 > http [ACK] Seq=294 Ack=18451 Win=62592 Len=0  tcp.stream == 2
 80   4.377434 157.166.255.18 -> 192.168.42.196 TCP 1314 [TCP segment of a reassembled PDU]  tcp.stream == 2
 81   4.377437 192.168.42.196 -> 157.166.255.18 TCP 54 34223 > http [ACK] Seq=294 Ack=19711 Win=62976 Len=0  tcp.stream == 2
 82   4.390279 157.166.255.18 -> 192.168.42.196 TCP 1314 [TCP segment of a reassembled PDU]  tcp.stream == 2
 83   4.390295 192.168.42.196 -> 157.166.255.18 TCP 54 34223 > http [ACK] Seq=294 Ack=20971 Win=64128 Len=0  tcp.stream == 2
 84   4.398530 157.166.255.18 -> 192.168.42.196 TCP 1314 [TCP segment of a reassembled PDU]  tcp.stream == 2
 85   4.398547 192.168.42.196 -> 157.166.255.18 TCP 54 34223 > http [ACK] Seq=294 Ack=22231 Win=64128 Len=0  tcp.stream == 2
 91   4.409459 192.168.42.196 -> 209.244.156.19 TCP 74 53635 > http [SYN] Seq=0 Win=14600 Len=0 MSS=1460 SACK_PERM=1 TSval=44374389 TSecr=0 WS=128  tcp.stream == 10
 92   4.417026 157.166.255.18 -> 192.168.42.196 HTTP 318 HTTP/1.1 200 OK  (text/html)  tcp.stream == 2
 93   4.417041 192.168.42.196 -> 157.166.255.18 TCP 54 34223 > http [ACK] Seq=294 Ack=22495 Win=64128 Len=0  tcp.stream == 2
 94   4.426667 8.27.248.125 -> 192.168.42.196 TCP 66 http > 46738 [SYN, ACK] Seq=0 Ack=1 Win=65535 Len=0 MSS=1260 WS=4 SACK_PERM=1  tcp.stream == 4
 95   4.426692 192.168.42.196 -> 8.27.248.125 TCP 54 46738 > http [ACK] Seq=1 Ack=1 Win=14720 Len=0  tcp.stream == 4
 96   4.426699 8.27.248.125 -> 192.168.42.196 TCP 66 http > 46739 [SYN, ACK] Seq=0 Ack=1 Win=65535 Len=0 MSS=1260 WS=4 SACK_PERM=1  tcp.stream == 5
 97   4.426704 192.168.42.196 -> 8.27.248.125 TCP 54 46739 > http [ACK] Seq=1 Ack=1 Win=14720 Len=0  tcp.stream == 5
 98   4.426811 192.168.42.196 -> 8.27.248.125 HTTP 393 GET /cnn/.e/img/3.0/global/header/hdr-main.gif HTTP/1.1   tcp.stream == 4
 99   4.426849 192.168.42.196 -> 8.27.248.125 HTTP 394 GET /cnn/.e/img/3.0/global/header/nav-arrow.gif HTTP/1.1   tcp.stream == 5
103   4.447920 192.168.42.196 -> 63.80.138.66 TCP 74 46311 > http [SYN] Seq=0 Win=14600 Len=0 MSS=1460 SACK_PERM=1 TSval=44374399 TSecr=0 WS=128  tcp.stream == 11
104   4.447961 192.168.42.196 -> 63.80.138.66 TCP 74 46312 > http [SYN] Seq=0 Win=14600 Len=0 MSS=1460 SACK_PERM=1 TSval=44374399 TSecr=0 WS=128  tcp.stream == 12
105   4.447988 192.168.42.196 -> 63.80.138.66 TCP 74 46313 > http [SYN] Seq=0 Win=14600 Len=0 MSS=1460 SACK_PERM=1 TSval=44374399 TSecr=0 WS=128  tcp.stream == 13
106   4.456528 8.27.248.125 -> 192.168.42.196 TCP 66 http > 46740 [SYN, ACK] Seq=0 Ack=1 Win=65535 Len=0 MSS=1260 WS=4 SACK_PERM=1  tcp.stream == 6
107   4.456554 192.168.42.196 -> 8.27.248.125 TCP 54 46740 > http [ACK] Seq=1 Ack=1 Win=14720 Len=0  tcp.stream == 6
108   4.456617 192.168.42.196 -> 8.27.248.125 HTTP 394 GET /cnn/.e/img/3.0/global/icons/video_icon.gif HTTP/1.1   tcp.stream == 6
109   4.466775 8.27.248.125 -> 192.168.42.196 TCP 66 http > 46741 [SYN, ACK] Seq=0 Ack=1 Win=65535 Len=0 MSS=1260 WS=4 SACK_PERM=1  tcp.stream == 7
110   4.466799 192.168.42.196 -> 8.27.248.125 TCP 54 46741 > http [ACK] Seq=1 Ack=1 Win=14720 Len=0  tcp.stream == 7
111   4.466896 192.168.42.196 -> 8.27.248.125 HTTP 374 GET /cnn/.e/img/3.0/1px.gif HTTP/1.1   tcp.stream == 7
112   4.476532 8.27.248.125 -> 192.168.42.196 TCP 66 http > 46742 [SYN, ACK] Seq=0 Ack=1 Win=65535 Len=0 MSS=1260 WS=4 SACK_PERM=1  tcp.stream == 8
113   4.476559 192.168.42.196 -> 8.27.248.125 TCP 54 46742 > http [ACK] Seq=1 Ack=1 Win=14720 Len=0  tcp.stream == 8
114   4.476654 192.168.42.196 -> 8.27.248.125 HTTP 396 GET /cnn/.e/img/3.0/global/misc/advertisement.gif HTTP/1.1   tcp.stream == 8
115   4.486651 8.27.248.125 -> 192.168.42.196 TCP 66 http > 46743 [SYN, ACK] Seq=0 Ack=1 Win=65535 Len=0 MSS=1260 WS=4 SACK_PERM=1  tcp.stream == 9
116   4.486685 192.168.42.196 -> 8.27.248.125 TCP 54 46743 > http [ACK] Seq=1 Ack=1 Win=14720 Len=0  tcp.stream == 9
118   4.486783 192.168.42.196 -> 8.27.248.125 HTTP 407 GET /cnn/.e/img/3.0/personalization/35x35_generic_avatar.gif HTTP/1.1   tcp.stream == 9
121   4.487300 192.168.42.196 -> 206.33.55.126 TCP 74 49845 > http [SYN] Seq=0 Win=14600 Len=0 MSS=1460 SACK_PERM=1 TSval=44374409 TSecr=0 WS=128  tcp.stream == 14
122   4.487339 192.168.42.196 -> 206.33.55.126 TCP 74 49846 > http [SYN] Seq=0 Win=14600 Len=0 MSS=1460 SACK_PERM=1 TSval=44374409 TSecr=0 WS=128  tcp.stream == 15
123   4.487368 192.168.42.196 -> 206.33.55.126 TCP 74 49847 > http [SYN] Seq=0 Win=14600 Len=0 MSS=1460 SACK_PERM=1 TSval=44374409 TSecr=0 WS=128  tcp.stream == 16
124   4.487397 192.168.42.196 -> 206.33.55.126 TCP 74 49848 > http [SYN] Seq=0 Win=14600 Len=0 MSS=1460 SACK_PERM=1 TSval=44374409 TSecr=0 WS=128  tcp.stream == 17
125   4.487424 192.168.42.196 -> 206.33.55.126 TCP 74 49849 > http [SYN] Seq=0 Win=14600 Len=0 MSS=1460 SACK_PERM=1 TSval=44374409 TSecr=0 WS=128  tcp.stream == 18
126   4.487452 192.168.42.196 -> 206.33.55.126 TCP 74 49850 > http [SYN] Seq=0 Win=14600 Len=0 MSS=1460 SACK_PERM=1 TSval=44374409 TSecr=0 WS=128  tcp.stream == 19
127   4.536530 209.244.156.19 -> 192.168.42.196 TCP 66 http > 53635 [SYN, ACK] Seq=0 Ack=1 Win=65535 Len=0 MSS=1260 WS=4 SACK_PERM=1  tcp.stream == 10
128   4.536555 192.168.42.196 -> 209.244.156.19 TCP 54 53635 > http [ACK] Seq=1 Ack=1 Win=14720 Len=0  tcp.stream == 10
129   4.536636 192.168.42.196 -> 209.244.156.19 HTTP 366 GET /adserver/adServer.aspx?publisherID=97 HTTP/1.1   tcp.stream == 10
130   4.546528 8.27.248.125 -> 192.168.42.196 TCP 54 [TCP Window Update] http > 46739 [ACK] Seq=1 Ack=1 Win=200000 Len=0  tcp.stream == 5
131   4.546548 8.27.248.125 -> 192.168.42.196 TCP 54 [TCP Window Update] http > 46738 [ACK] Seq=1 Ack=1 Win=200000 Len=0  tcp.stream == 4
132   4.557547 8.27.248.125 -> 192.168.42.196 TCP 1314 [TCP segment of a reassembled PDU]  tcp.stream == 4
133   4.557575 192.168.42.196 -> 8.27.248.125 TCP 54 46738 > http [ACK] Seq=340 Ack=1261 Win=17152 Len=0  tcp.stream == 4
134   4.577023 8.27.248.125 -> 192.168.42.196 TCP 1314 [TCP segment of a reassembled PDU]  tcp.stream == 4
135   4.577041 192.168.42.196 -> 8.27.248.125 TCP 54 46738 > http [ACK] Seq=340 Ack=2521 Win=19712 Len=0  tcp.stream == 4
136   4.588151 8.27.248.125 -> 192.168.42.196 TCP 1314 [TCP segment of a reassembled PDU]  tcp.stream == 4
137   4.588170 192.168.42.196 -> 8.27.248.125 TCP 54 46738 > http [ACK] Seq=340 Ack=3781 Win=22272 Len=0  tcp.stream == 4
138   4.588268 8.27.248.125 -> 192.168.42.196 HTTP 949 HTTP/1.1 200 OK  (GIF87a)  tcp.stream == 4
139   4.588273 192.168.42.196 -> 8.27.248.125 TCP 54 46738 > http [ACK] Seq=340 Ack=4676 Win=24704 Len=0  tcp.stream == 4
140   4.588275 157.166.255.19 -> 192.168.42.196 TCP 54 http > 41010 [ACK] Seq=1 Ack=308 Win=200000 Len=0  tcp.stream == 3
141   4.588280 63.80.138.66 -> 192.168.42.196 TCP 66 http > 46312 [SYN, ACK] Seq=0 Ack=1 Win=65535 Len=0 MSS=1260 WS=4 SACK_PERM=1  tcp.stream == 12
142   4.588287 192.168.42.196 -> 63.80.138.66 TCP 54 46312 > http [ACK] Seq=1 Ack=1 Win=14720 Len=0  tcp.stream == 12
143   4.588290 63.80.138.66 -> 192.168.42.196 TCP 66 http > 46311 [SYN, ACK] Seq=0 Ack=1 Win=65535 Len=0 MSS=1260 WS=4 SACK_PERM=1  tcp.stream == 11
144   4.588293 192.168.42.196 -> 63.80.138.66 TCP 54 46311 > http [ACK] Seq=1 Ack=1 Win=14720 Len=0  tcp.stream == 11
145   4.588362 192.168.42.196 -> 8.27.248.125 HTTP 395 GET /cnn/.e/img/3.0/personalization/close_bt.gif HTTP/1.1   tcp.stream == 4
146   4.588391 63.80.138.66 -> 192.168.42.196 TCP 66 http > 46313 [SYN, ACK] Seq=0 Ack=1 Win=65535 Len=0 MSS=1260 WS=4 SACK_PERM=1  tcp.stream == 13
147   4.588396 192.168.42.196 -> 63.80.138.66 TCP 54 46313 > http [ACK] Seq=1 Ack=1 Win=14720 Len=0  tcp.stream == 13
148   4.588398 8.27.248.125 -> 192.168.42.196 HTTP 418 HTTP/1.1 200 OK  (GIF89a)  tcp.stream == 5
149   4.588401 192.168.42.196 -> 8.27.248.125 TCP 54 46739 > http [ACK] Seq=341 Ack=365 Win=15744 Len=0  tcp.stream == 5
150   4.588403 8.27.248.125 -> 192.168.42.196 TCP 54 [TCP Window Update] http > 46740 [ACK] Seq=1 Ack=1 Win=200000 Len=0  tcp.stream == 6
151   4.588480 192.168.42.196 -> 8.27.248.125 HTTP 400 GET /cnn/.element/img/3.0/global/icons/video_icon.gif HTTP/1.1   tcp.stream == 5
152   4.588521 192.168.42.196 -> 63.80.138.66 HTTP 394 GET /cnn/tmpl_asset/static/www_homepage/1064/css/hplib-min.css HTTP/1.1   tcp.stream == 11
153   4.588532 192.168.42.196 -> 63.80.138.66 HTTP 377 GET /cnn/tmpl_asset/static/www_homepage/1064/js/hplib-min.js HTTP/1.1   tcp.stream == 12
154   4.588540 192.168.42.196 -> 63.80.138.66 HTTP 378 GET /cnn/tmpl_asset/static/www_global/604/js/globallib-min.js HTTP/1.1   tcp.stream == 13
160   4.589114 192.168.42.196 -> 216.223.0.211 TCP 74 48806 > http [SYN] Seq=0 Win=14600 Len=0 MSS=1460 SACK_PERM=1 TSval=44374434 TSecr=0 WS=128  tcp.stream == 20
163   4.589289 192.168.42.196 -> 68.177.32.105 TCP 74 53164 > http [SYN] Seq=0 Win=14600 Len=0 MSS=1460 SACK_PERM=1 TSval=44374434 TSecr=0 WS=128  tcp.stream == 21
164   4.589400 192.168.42.196 -> 204.245.34.169 TCP 74 35176 > http [SYN] Seq=0 Win=14600 Len=0 MSS=1460 SACK_PERM=1 TSval=44374434 TSecr=0 WS=128  tcp.stream == 22
165   4.597279 8.27.248.125 -> 192.168.42.196 HTTP 464 HTTP/1.1 200 OK  (GIF89a)  tcp.stream == 6
166   4.597299 192.168.42.196 -> 8.27.248.125 TCP 54 46740 > http [ACK] Seq=341 Ack=411 Win=15744 Len=0  tcp.stream == 6
167   4.597306 8.27.248.125 -> 192.168.42.196 TCP 54 [TCP Window Update] http > 46741 [ACK] Seq=1 Ack=1 Win=200000 Len=0  tcp.stream == 7
168   4.597387 8.27.248.125 -> 192.168.42.196 HTTP 368 HTTP/1.1 200 OK  (GIF89a)  tcp.stream == 7
169   4.597392 192.168.42.196 -> 8.27.248.125 TCP 54 46741 > http [ACK] Seq=321 Ack=315 Win=15744 Len=0  tcp.stream == 7
170   4.597395 8.27.248.125 -> 192.168.42.196 TCP 54 [TCP Window Update] http > 46742 [ACK] Seq=1 Ack=1 Win=200000 Len=0  tcp.stream == 8
171   4.597478 192.168.42.196 -> 8.27.248.125 HTTP 403 GET /cnn/.e/img/3.0/global/footer/pngs/footer_google.png HTTP/1.1   tcp.stream == 6
172   4.597601 192.168.42.196 -> 8.27.248.125 HTTP 405 GET /cnn/.e/img/3.0/global/footer/pngs/footer_cnn_logo.png HTTP/1.1   tcp.stream == 7
173   4.606650 8.27.248.125 -> 192.168.42.196 HTTP 420 HTTP/1.1 200 OK  (GIF89a)  tcp.stream == 8
174   4.606667 192.168.42.196 -> 8.27.248.125 TCP 54 46742 > http [ACK] Seq=343 Ack=367 Win=15744 Len=0  tcp.stream == 8
175   4.606866 192.168.42.196 -> 8.27.248.125 HTTP 405 GET /cnn/.e/img/3.0/global/misc/logo_ad_choices_footer.png HTTP/1.1   tcp.stream == 8
176   4.616776 8.27.248.125 -> 192.168.42.196 TCP 54 [TCP Window Update] http > 46743 [ACK] Seq=1 Ack=1 Win=200000 Len=0  tcp.stream == 9
177   4.616787 206.33.55.126 -> 192.168.42.196 TCP 66 http > 49845 [SYN, ACK] Seq=0 Ack=1 Win=65535 Len=0 MSS=1260 WS=4 SACK_PERM=1  tcp.stream == 14
178   4.616799 192.168.42.196 -> 206.33.55.126 TCP 54 49845 > http [ACK] Seq=1 Ack=1 Win=14720 Len=0  tcp.stream == 14
179   4.616805 206.33.55.126 -> 192.168.42.196 TCP 66 http > 49846 [SYN, ACK] Seq=0 Ack=1 Win=65535 Len=0 MSS=1260 WS=4 SACK_PERM=1  tcp.stream == 15
180   4.616809 192.168.42.196 -> 206.33.55.126 TCP 54 49846 > http [ACK] Seq=1 Ack=1 Win=14720 Len=0  tcp.stream == 15
181   4.616895 206.33.55.126 -> 192.168.42.196 TCP 66 http > 49847 [SYN, ACK] Seq=0 Ack=1 Win=65535 Len=0 MSS=1260 WS=4 SACK_PERM=1  tcp.stream == 16
182   4.616901 192.168.42.196 -> 206.33.55.126 TCP 54 49847 > http [ACK] Seq=1 Ack=1 Win=14720 Len=0  tcp.stream == 16
183   4.616904 8.27.248.125 -> 192.168.42.196 HTTP 555 HTTP/1.1 200 OK  (GIF89a)  tcp.stream == 9
184   4.616909 192.168.42.196 -> 8.27.248.125 TCP 54 46743 > http [ACK] Seq=354 Ack=502 Win=15744 Len=0  tcp.stream == 9
185   4.617012 192.168.42.196 -> 206.33.55.126 HTTP 412 GET /cnn/dam/assets/120216044609-honduras-body-count-t1-main.jpg HTTP/1.1   tcp.stream == 14
186   4.617027 192.168.42.196 -> 206.33.55.126 HTTP 448 GET /cnn/dam/assets/120104091455-airplane-airlines-china-european-union-carbon-emissions-c1-main.jpg HTTP/1.1   tcp.stream == 15
187   4.617052 192.168.42.196 -> 8.27.248.125 HTTP 368 GET /cnn/images/1.gif HTTP/1.1   tcp.stream == 9
188   4.617071 192.168.42.196 -> 206.33.55.126 HTTP 412 GET /cnn/dam/assets/120214010549-inside-syria-2-wall-4-tease.jpg HTTP/1.1   tcp.stream == 16
189   4.626653 206.33.55.126 -> 192.168.42.196 TCP 66 http > 49848 [SYN, ACK] Seq=0 Ack=1 Win=65535 Len=0 MSS=1260 WS=4 SACK_PERM=1  tcp.stream == 17
190   4.626674 192.168.42.196 -> 206.33.55.126 TCP 54 49848 > http [ACK] Seq=1 Ack=1 Win=14720 Len=0  tcp.stream == 17
191   4.626680 206.33.55.126 -> 192.168.42.196 TCP 66 http > 49849 [SYN, ACK] Seq=0 Ack=1 Win=65535 Len=0 MSS=1260 WS=4 SACK_PERM=1  tcp.stream == 18
192   4.626683 192.168.42.196 -> 206.33.55.126 TCP 54 49849 > http [ACK] Seq=1 Ack=1 Win=14720 Len=0  tcp.stream == 18
193   4.626685 206.33.55.126 -> 192.168.42.196 TCP 66 http > 49850 [SYN, ACK] Seq=0 Ack=1 Win=65535 Len=0 MSS=1260 WS=4 SACK_PERM=1  tcp.stream == 19
194   4.626689 192.168.42.196 -> 206.33.55.126 TCP 54 49850 > http [ACK] Seq=1 Ack=1 Win=14720 Len=0  tcp.stream == 19
195   4.626834 192.168.42.196 -> 206.33.55.126 HTTP 410 GET /cnn/dam/assets/120216115334-jeremy-lin-05-video-tease.jpg HTTP/1.1   tcp.stream == 17
196   4.626849 192.168.42.196 -> 206.33.55.126 HTTP 435 GET /cnn/dam/assets/120216080144-bts-randy-travis-arrest-video-00001623-video-tease.jpg HTTP/1.1   tcp.stream == 18
197   4.626858 192.168.42.196 -> 206.33.55.126 HTTP 411 GET /cnn/dam/assets/120216041110-factory-worker-video-tease.jpg HTTP/1.1   tcp.stream == 19
198   4.637532 157.166.255.19 -> 192.168.42.196 TCP 1314 [TCP segment of a reassembled PDU]  tcp.stream == 3
199   4.637546 192.168.42.196 -> 157.166.255.19 TCP 54 41010 > http [ACK] Seq=308 Ack=1261 Win=17152 Len=0  tcp.stream == 3
200   4.647018 157.166.255.19 -> 192.168.42.196 TCP 1314 [TCP segment of a reassembled PDU]  tcp.stream == 3
201   4.647033 192.168.42.196 -> 157.166.255.19 TCP 54 41010 > http [ACK] Seq=308 Ack=2521 Win=19712 Len=0  tcp.stream == 3
202   4.657028 157.166.255.19 -> 192.168.42.196 TCP 1314 [TCP segment of a reassembled PDU]  tcp.stream == 3
203   4.657046 192.168.42.196 -> 157.166.255.19 TCP 54 41010 > http [ACK] Seq=308 Ack=3781 Win=22272 Len=0  tcp.stream == 3
204   4.657147 157.166.255.19 -> 192.168.42.196 TCP 1314 [TCP segment of a reassembled PDU]  tcp.stream == 3
205   4.657152 192.168.42.196 -> 157.166.255.19 TCP 54 41010 > http [ACK] Seq=308 Ack=5041 Win=24704 Len=0  tcp.stream == 3
206   4.667021 157.166.255.19 -> 192.168.42.196 HTTP 706 HTTP/1.1 200 OK  (image/x-icon)  tcp.stream == 3
207   4.667036 192.168.42.196 -> 157.166.255.19 TCP 54 41010 > http [ACK] Seq=308 Ack=5693 Win=27264 Len=0  tcp.stream == 3
208   4.667042 209.244.156.19 -> 192.168.42.196 TCP 54 [TCP Window Update] http > 53635 [ACK] Seq=1 Ack=1 Win=200000 Len=0  tcp.stream == 10
209   4.726912 63.80.138.66 -> 192.168.42.196 TCP 54 [TCP Window Update] http > 46312 [ACK] Seq=1 Ack=1 Win=200000 Len=0  tcp.stream == 12
210   4.726925 63.80.138.66 -> 192.168.42.196 TCP 54 [TCP Window Update] http > 46313 [ACK] Seq=1 Ack=1 Win=200000 Len=0  tcp.stream == 13
211   4.726928 63.80.138.66 -> 192.168.42.196 TCP 54 [TCP Window Update] http > 46311 [ACK] Seq=1 Ack=1 Win=200000 Len=0  tcp.stream == 11
212   4.726930 8.27.248.125 -> 192.168.42.196 HTTP 618 HTTP/1.1 200 OK  (GIF89a)  tcp.stream == 4
213   4.736652 8.27.248.125 -> 192.168.42.196 HTTP 447 HTTP/1.1 200 OK  (GIF89a)  tcp.stream == 5
214   4.766652 209.244.156.19 -> 192.168.42.196 TCP 54 http > 53635 [ACK] Seq=1 Ack=313 Win=200000 Len=0  tcp.stream == 10
215   4.766826 192.168.42.196 -> 8.27.248.125 TCP 54 46738 > http [ACK] Seq=681 Ack=5240 Win=27264 Len=0  tcp.stream == 4
216   4.774829 192.168.42.196 -> 8.27.248.125 TCP 54 46739 > http [ACK] Seq=687 Ack=758 Win=16768 Len=0  tcp.stream == 5
217   4.798282 63.80.138.66 -> 192.168.42.196 TCP 1314 [TCP segment of a reassembled PDU]  tcp.stream == 11
218   4.798304 192.168.42.196 -> 63.80.138.66 TCP 54 46311 > http [ACK] Seq=341 Ack=1261 Win=17152 Len=0  tcp.stream == 11
219   4.798311 63.80.138.66 -> 192.168.42.196 TCP 1314 [TCP segment of a reassembled PDU]  tcp.stream == 12
220   4.798315 192.168.42.196 -> 63.80.138.66 TCP 54 46312 > http [ACK] Seq=324 Ack=1261 Win=17152 Len=0  tcp.stream == 12
221   4.807532 63.80.138.66 -> 192.168.42.196 TCP 1314 [TCP segment of a reassembled PDU]  tcp.stream == 12
222   4.807552 192.168.42.196 -> 63.80.138.66 TCP 54 46312 > http [ACK] Seq=324 Ack=2521 Win=19712 Len=0  tcp.stream == 12
223   4.807561 63.80.138.66 -> 192.168.42.196 TCP 1314 [TCP segment of a reassembled PDU]  tcp.stream == 11
224   4.807564 192.168.42.196 -> 63.80.138.66 TCP 54 46311 > http [ACK] Seq=341 Ack=2521 Win=19712 Len=0  tcp.stream == 11
225   4.816903 63.80.138.66 -> 192.168.42.196 TCP 1314 [TCP segment of a reassembled PDU]  tcp.stream == 11
226   4.816922 192.168.42.196 -> 63.80.138.66 TCP 54 46311 > http [ACK] Seq=341 Ack=3781 Win=22272 Len=0  tcp.stream == 11
227   4.826775 63.80.138.66 -> 192.168.42.196 TCP 1314 [TCP segment of a reassembled PDU]  tcp.stream == 11
228   4.826791 192.168.42.196 -> 63.80.138.66 TCP 54 46311 > http [ACK] Seq=341 Ack=5041 Win=24704 Len=0  tcp.stream == 11
234   4.839453 192.168.42.196 -> 216.223.0.211 TCP 74 48809 > http [SYN] Seq=0 Win=14600 Len=0 MSS=1460 SACK_PERM=1 TSval=44374497 TSecr=0 WS=128  tcp.stream == 23
236   4.839725 192.168.42.196 -> 68.177.32.105 TCP 74 53167 > http [SYN] Seq=0 Win=14600 Len=0 MSS=1460 SACK_PERM=1 TSval=44374497 TSecr=0 WS=128  tcp.stream == 24
241   4.840479 192.168.42.196 -> 204.245.34.169 TCP 74 35179 > http [SYN] Seq=0 Win=14600 Len=0 MSS=1460 SACK_PERM=1 TSval=44374497 TSecr=0 WS=128  tcp.stream == 25
242   4.848532 63.80.138.66 -> 192.168.42.196 TCP 1314 [TCP segment of a reassembled PDU]  tcp.stream == 11
243   4.848549 192.168.42.196 -> 63.80.138.66 TCP 54 46311 > http [ACK] Seq=341 Ack=6301 Win=27264 Len=0  tcp.stream == 11
244   4.848556 63.80.138.66 -> 192.168.42.196 TCP 1314 [TCP segment of a reassembled PDU]  tcp.stream == 11
245   4.848559 192.168.42.196 -> 63.80.138.66 TCP 54 46311 > http [ACK] Seq=341 Ack=7561 Win=29824 Len=0  tcp.stream == 11
246   4.848562 63.80.138.66 -> 192.168.42.196 TCP 1314 [TCP segment of a reassembled PDU]  tcp.stream == 11
247   4.848565 192.168.42.196 -> 63.80.138.66 TCP 54 46311 > http [ACK] Seq=341 Ack=8821 Win=32256 Len=0  tcp.stream == 11
248   4.867283 63.80.138.66 -> 192.168.42.196 TCP 1314 [TCP segment of a reassembled PDU]  tcp.stream == 11
249   4.867298 192.168.42.196 -> 63.80.138.66 TCP 54 46311 > http [ACK] Seq=341 Ack=10081 Win=34816 Len=0  tcp.stream == 11
250   4.877286 63.80.138.66 -> 192.168.42.196 TCP 1314 [TCP segment of a reassembled PDU]  tcp.stream == 11
251   4.877302 192.168.42.196 -> 63.80.138.66 TCP 54 46311 > http [ACK] Seq=341 Ack=11341 Win=37376 Len=0  tcp.stream == 11
252   4.877309 63.80.138.66 -> 192.168.42.196 TCP 1314 [TCP segment of a reassembled PDU]  tcp.stream == 11
253   4.877311 192.168.42.196 -> 63.80.138.66 TCP 54 46311 > http [ACK] Seq=341 Ack=12601 Win=39808 Len=0  tcp.stream == 11
254   4.877385 63.80.138.66 -> 192.168.42.196 TCP 1314 [TCP segment of a reassembled PDU]  tcp.stream == 11
255   4.877389 192.168.42.196 -> 63.80.138.66 TCP 54 46311 > http [ACK] Seq=341 Ack=13861 Win=42368 Len=0  tcp.stream == 11
256   4.887142 63.80.138.66 -> 192.168.42.196 TCP 1314 [TCP segment of a reassembled PDU]  tcp.stream == 12
257   4.887160 192.168.42.196 -> 63.80.138.66 TCP 54 46312 > http [ACK] Seq=324 Ack=3781 Win=22272 Len=0  tcp.stream == 12
258   4.897155 63.80.138.66 -> 192.168.42.196 TCP 1314 [TCP segment of a reassembled PDU]  tcp.stream == 12
259   4.897172 192.168.42.196 -> 63.80.138.66 TCP 54 46312 > http [ACK] Seq=324 Ack=5041 Win=24704 Len=0  tcp.stream == 12
260   4.897179 63.80.138.66 -> 192.168.42.196 TCP 1314 [TCP segment of a reassembled PDU]  tcp.stream == 12
261   4.897181 192.168.42.196 -> 63.80.138.66 TCP 54 46312 > http [ACK] Seq=324 Ack=6301 Win=27264 Len=0  tcp.stream == 12
262   4.906776 63.80.138.66 -> 192.168.42.196 TCP 1314 [TCP segment of a reassembled PDU]  tcp.stream == 12
263   4.906792 192.168.42.196 -> 63.80.138.66 TCP 54 46312 > http [ACK] Seq=324 Ack=7561 Win=29824 Len=0  tcp.stream == 12
264   4.917165 63.80.138.66 -> 192.168.42.196 TCP 1059 [TCP segment of a reassembled PDU]  tcp.stream == 12
265   4.917183 192.168.42.196 -> 63.80.138.66 TCP 54 46312 > http [ACK] Seq=324 Ack=8566 Win=32256 Len=0  tcp.stream == 12
266   4.917191 63.80.138.66 -> 192.168.42.196 TCP 1314 [TCP segment of a reassembled PDU]  tcp.stream == 12
267   4.917193 192.168.42.196 -> 63.80.138.66 TCP 54 46312 > http [ACK] Seq=324 Ack=9826 Win=34816 Len=0  tcp.stream == 12
268   4.927399 63.80.138.66 -> 192.168.42.196 TCP 1314 [TCP segment of a reassembled PDU]  tcp.stream == 12
269   4.927418 192.168.42.196 -> 63.80.138.66 TCP 54 46312 > http [ACK] Seq=324 Ack=11086 Win=37376 Len=0  tcp.stream == 12
270   4.936900 63.80.138.66 -> 192.168.42.196 TCP 1314 [TCP segment of a reassembled PDU]  tcp.stream == 12
271   4.936918 192.168.42.196 -> 63.80.138.66 TCP 54 46312 > http [ACK] Seq=324 Ack=12346 Win=39808 Len=0  tcp.stream == 12
272   4.947269 63.80.138.66 -> 192.168.42.196 TCP 1314 [TCP segment of a reassembled PDU]  tcp.stream == 12
273   4.947285 192.168.42.196 -> 63.80.138.66 TCP 54 46312 > http [ACK] Seq=324 Ack=13606 Win=42368 Len=0  tcp.stream == 12
274   4.947393 204.245.34.169 -> 192.168.42.196 TCP 66 http > 35176 [SYN, ACK] Seq=0 Ack=1 Win=65535 Len=0 MSS=1260 WS=4 SACK_PERM=1  tcp.stream == 22
275   4.947409 192.168.42.196 -> 204.245.34.169 TCP 54 35176 > http [ACK] Seq=1 Ack=1 Win=14720 Len=0  tcp.stream == 22
276   4.947412 216.223.0.211 -> 192.168.42.196 TCP 66 http > 48806 [SYN, ACK] Seq=0 Ack=1 Win=65535 Len=0 MSS=1260 WS=4 SACK_PERM=1  tcp.stream == 20
277   4.947416 192.168.42.196 -> 216.223.0.211 TCP 54 48806 > http [ACK] Seq=1 Ack=1 Win=14720 Len=0  tcp.stream == 20
278   4.947418 68.177.32.105 -> 192.168.42.196 TCP 66 http > 53164 [SYN, ACK] Seq=0 Ack=1 Win=65535 Len=0 MSS=1260 WS=4 SACK_PERM=1  tcp.stream == 21
279   4.947423 192.168.42.196 -> 68.177.32.105 TCP 54 53164 > http [ACK] Seq=1 Ack=1 Win=14720 Len=0  tcp.stream == 21
280   4.947425 206.33.55.126 -> 192.168.42.196 TCP 54 [TCP Window Update] http > 49846 [ACK] Seq=1 Ack=1 Win=200000 Len=0  tcp.stream == 15
281   4.947514 206.33.55.126 -> 192.168.42.196 TCP 54 [TCP Window Update] http > 49847 [ACK] Seq=1 Ack=1 Win=200000 Len=0  tcp.stream == 16
282   4.947518 206.33.55.126 -> 192.168.42.196 TCP 54 [TCP Window Update] http > 49845 [ACK] Seq=1 Ack=1 Win=200000 Len=0  tcp.stream == 14
283   4.947520 8.27.248.125 -> 192.168.42.196 TCP 1314 [TCP segment of a reassembled PDU]  tcp.stream == 6
284   4.947543 192.168.42.196 -> 216.223.0.211 HTTP 344 GET /gateway/gw.js?csid=A09801 HTTP/1.1   tcp.stream == 20
285   4.947562 192.168.42.196 -> 68.177.32.105 HTTP 350 GET /rms/mother/5721/nodetag.js HTTP/1.1   tcp.stream == 21
286   4.947577 192.168.42.196 -> 204.245.34.169 HTTP 340 GET /97.js HTTP/1.1   tcp.stream == 22
287   4.967276 8.27.248.125 -> 192.168.42.196 HTTP 494 HTTP/1.1 200 OK  (PNG)  tcp.stream == 6
288   4.967292 192.168.42.196 -> 8.27.248.125 TCP 54 46740 > http [ACK] Seq=690 Ack=2111 Win=20736 Len=0  tcp.stream == 6
289   4.967299 8.27.248.125 -> 192.168.42.196 HTTP 802 HTTP/1.1 200 OK  (PNG)  tcp.stream == 7
290   4.980653 63.80.138.66 -> 192.168.42.196 TCP 1314 [TCP segment of a reassembled PDU]  tcp.stream == 13
291   4.980674 192.168.42.196 -> 63.80.138.66 TCP 54 46313 > http [ACK] Seq=325 Ack=1261 Win=17152 Len=0  tcp.stream == 13
292   4.980681 63.80.138.66 -> 192.168.42.196 TCP 1314 [TCP segment of a reassembled PDU]  tcp.stream == 13
293   4.980683 192.168.42.196 -> 63.80.138.66 TCP 54 46313 > http [ACK] Seq=325 Ack=2521 Win=19712 Len=0  tcp.stream == 13
294   4.980686 8.27.248.125 -> 192.168.42.196 HTTP 911 HTTP/1.1 200 OK  (PNG)  tcp.stream == 8
295   4.980760 63.80.138.66 -> 192.168.42.196 TCP 1314 [TCP segment of a reassembled PDU]  tcp.stream == 13
296   4.980766 192.168.42.196 -> 63.80.138.66 TCP 54 46313 > http [ACK] Seq=325 Ack=3781 Win=22272 Len=0  tcp.stream == 13
297   4.980886 63.80.138.66 -> 192.168.42.196 TCP 1314 [TCP segment of a reassembled PDU]  tcp.stream == 13
298   4.980891 192.168.42.196 -> 63.80.138.66 TCP 54 46313 > http [ACK] Seq=325 Ack=5041 Win=24704 Len=0  tcp.stream == 13
299   4.980894 63.80.138.66 -> 192.168.42.196 TCP 1314 [TCP segment of a reassembled PDU]  tcp.stream == 13
300   4.980896 192.168.42.196 -> 63.80.138.66 TCP 54 46313 > http [ACK] Seq=325 Ack=6301 Win=27264 Len=0  tcp.stream == 13
301   4.988652 63.80.138.66 -> 192.168.42.196 TCP 1314 [TCP segment of a reassembled PDU]  tcp.stream == 13
302   4.988671 192.168.42.196 -> 63.80.138.66 TCP 54 46313 > http [ACK] Seq=325 Ack=7561 Win=29824 Len=0  tcp.stream == 13
303   4.988677 63.80.138.66 -> 192.168.42.196 TCP 1314 [TCP segment of a reassembled PDU]  tcp.stream == 13
304   4.988680 192.168.42.196 -> 63.80.138.66 TCP 54 46313 > http [ACK] Seq=325 Ack=8821 Win=32256 Len=0  tcp.stream == 13
305   4.988759 63.80.138.66 -> 192.168.42.196 TCP 1314 [TCP segment of a reassembled PDU]  tcp.stream == 13
306   4.988764 192.168.42.196 -> 63.80.138.66 TCP 54 46313 > http [ACK] Seq=325 Ack=10081 Win=34816 Len=0  tcp.stream == 13
307   4.998165 63.80.138.66 -> 192.168.42.196 TCP 1314 [TCP segment of a reassembled PDU]  tcp.stream == 13
308   4.998181 192.168.42.196 -> 63.80.138.66 TCP 54 46313 > http [ACK] Seq=325 Ack=11341 Win=37376 Len=0  tcp.stream == 13
309   4.998187 63.80.138.66 -> 192.168.42.196 TCP 1314 [TCP segment of a reassembled PDU]  tcp.stream == 13
310   4.998190 192.168.42.196 -> 63.80.138.66 TCP 54 46313 > http [ACK] Seq=325 Ack=12601 Win=39808 Len=0  tcp.stream == 13
311   4.998192 63.80.138.66 -> 192.168.42.196 TCP 1314 [TCP segment of a reassembled PDU]  tcp.stream == 13
312   4.998194 192.168.42.196 -> 63.80.138.66 TCP 54 46313 > http [ACK] Seq=325 Ack=13861 Win=42368 Len=0  tcp.stream == 13
313   5.006829 192.168.42.196 -> 8.27.248.125 TCP 54 46741 > http [ACK] Seq=672 Ack=1063 Win=17280 Len=0  tcp.stream == 7
314   5.008770 206.33.55.126 -> 192.168.42.196 TCP 1314 [TCP segment of a reassembled PDU]  tcp.stream == 14
315   5.008789 192.168.42.196 -> 206.33.55.126 TCP 54 49845 > http [ACK] Seq=359 Ack=1261 Win=17152 Len=0  tcp.stream == 14
316   5.010835 192.168.42.196 -> 8.27.248.125 HTTP 368 [TCP Retransmission] GET /cnn/images/1.gif HTTP/1.1   tcp.stream == 9
317   5.018775 206.33.55.126 -> 192.168.42.196 TCP 1314 [TCP segment of a reassembled PDU]  tcp.stream == 14
318   5.018791 192.168.42.196 -> 206.33.55.126 TCP 54 49845 > http [ACK] Seq=359 Ack=2521 Win=19712 Len=0  tcp.stream == 14
319   5.018823 192.168.42.196 -> 8.27.248.125 TCP 54 46742 > http [ACK] Seq=694 Ack=1224 Win=17408 Len=0  tcp.stream == 8
320   5.018889 206.33.55.126 -> 192.168.42.196 TCP 54 [TCP Window Update] http > 49848 [ACK] Seq=1 Ack=1 Win=200000 Len=0  tcp.stream == 17
321   5.018896 8.27.248.125 -> 192.168.42.196 HTTP 369 HTTP/1.1 200 OK  (GIF89a)  tcp.stream == 9
322   5.018901 206.33.55.126 -> 192.168.42.196 TCP 54 [TCP Window Update] http > 49850 [ACK] Seq=1 Ack=1 Win=200000 Len=0  tcp.stream == 19
323   5.018904 206.33.55.126 -> 192.168.42.196 TCP 54 [TCP Window Update] http > 49849 [ACK] Seq=1 Ack=1 Win=200000 Len=0  tcp.stream == 18
324   5.019008 206.33.55.126 -> 192.168.42.196 TCP 1314 [TCP segment of a reassembled PDU]  tcp.stream == 14
325   5.019014 192.168.42.196 -> 206.33.55.126 TCP 54 49845 > http [ACK] Seq=359 Ack=3781 Win=22272 Len=0  tcp.stream == 14
326   5.019017 206.33.55.126 -> 192.168.42.196 TCP 1314 [TCP segment of a reassembled PDU]  tcp.stream == 17
327   5.019021 192.168.42.196 -> 206.33.55.126 TCP 54 49848 > http [ACK] Seq=357 Ack=1261 Win=17152 Len=0  tcp.stream == 17
328   5.028275 206.33.55.126 -> 192.168.42.196 TCP 1314 [TCP segment of a reassembled PDU]  tcp.stream == 15
329   5.028295 192.168.42.196 -> 206.33.55.126 TCP 54 49846 > http [ACK] Seq=395 Ack=1261 Win=17152 Len=0  tcp.stream == 15
330   5.028389 206.33.55.126 -> 192.168.42.196 TCP 1314 [TCP segment of a reassembled PDU]  tcp.stream == 16
331   5.028396 192.168.42.196 -> 206.33.55.126 TCP 54 49847 > http [ACK] Seq=359 Ack=1261 Win=17152 Len=0  tcp.stream == 16
332   5.028399 209.244.156.19 -> 192.168.42.196 HTTP 560 HTTP/1.1 200 OK  (text/html)  tcp.stream == 10
333   5.028402 192.168.42.196 -> 209.244.156.19 TCP 54 53635 > http [ACK] Seq=313 Ack=507 Win=15744 Len=0  tcp.stream == 10
334   5.028404 206.33.55.126 -> 192.168.42.196 TCP 1314 [TCP segment of a reassembled PDU]  tcp.stream == 14
335   5.028407 192.168.42.196 -> 206.33.55.126 TCP 54 49845 > http [ACK] Seq=359 Ack=5041 Win=24704 Len=0  tcp.stream == 14
336   5.058844 192.168.42.196 -> 8.27.248.125 TCP 54 46743 > http [ACK] Seq=668 Ack=817 Win=16768 Len=0  tcp.stream == 9
337   5.064900 206.33.55.126 -> 192.168.42.196 TCP 1314 [TCP segment of a reassembled PDU]  tcp.stream == 19
338   5.064919 192.168.42.196 -> 206.33.55.126 TCP 54 49850 > http [ACK] Seq=358 Ack=1261 Win=17152 Len=0  tcp.stream == 19
339   5.065023 206.33.55.126 -> 192.168.42.196 TCP 1314 [TCP segment of a reassembled PDU]  tcp.stream == 18
340   5.065029 192.168.42.196 -> 206.33.55.126 TCP 54 49849 > http [ACK] Seq=382 Ack=1261 Win=17152 Len=0  tcp.stream == 18
341   5.065032 206.33.55.126 -> 192.168.42.196 TCP 1314 [TCP segment of a reassembled PDU]  tcp.stream == 17
342   5.065034 192.168.42.196 -> 206.33.55.126 TCP 54 49848 > http [ACK] Seq=357 Ack=2521 Win=19712 Len=0  tcp.stream == 17
343   5.065037 206.33.55.126 -> 192.168.42.196 TCP 1314 [TCP segment of a reassembled PDU]  tcp.stream == 16
344   5.065040 192.168.42.196 -> 206.33.55.126 TCP 54 49847 > http [ACK] Seq=359 Ack=2521 Win=19712 Len=0  tcp.stream == 16
345   5.065134 206.33.55.126 -> 192.168.42.196 TCP 1314 [TCP segment of a reassembled PDU]  tcp.stream == 15
346   5.065140 192.168.42.196 -> 206.33.55.126 TCP 54 49846 > http [ACK] Seq=395 Ack=2521 Win=19712 Len=0  tcp.stream == 15
347   5.065263 206.33.55.126 -> 192.168.42.196 TCP 1314 [TCP segment of a reassembled PDU]  tcp.stream == 14
348   5.065270 192.168.42.196 -> 206.33.55.126 TCP 54 49845 > http [ACK] Seq=359 Ack=6301 Win=27264 Len=0  tcp.stream == 14
349   5.065513 63.80.138.66 -> 192.168.42.196 TCP 1314 [TCP segment of a reassembled PDU]  tcp.stream == 12
350   5.065523 192.168.42.196 -> 63.80.138.66 TCP 54 46312 > http [ACK] Seq=324 Ack=14866 Win=44928 Len=0  tcp.stream == 12
351   5.065528 68.177.32.105 -> 192.168.42.196 TCP 66 http > 53167 [SYN, ACK] Seq=0 Ack=1 Win=65535 Len=0 MSS=1260 WS=4 SACK_PERM=1  tcp.stream == 24
352   5.065535 192.168.42.196 -> 68.177.32.105 TCP 54 53167 > http [ACK] Seq=1 Ack=1 Win=14720 Len=0  tcp.stream == 24
353   5.065648 204.245.34.169 -> 192.168.42.196 TCP 66 http > 35179 [SYN, ACK] Seq=0 Ack=1 Win=65535 Len=0 MSS=1260 WS=4 SACK_PERM=1  tcp.stream == 25
354   5.065656 192.168.42.196 -> 204.245.34.169 TCP 54 35179 > http [ACK] Seq=1 Ack=1 Win=14720 Len=0  tcp.stream == 25
355   5.065659 216.223.0.211 -> 192.168.42.196 TCP 66 http > 48809 [SYN, ACK] Seq=0 Ack=1 Win=65535 Len=0 MSS=1260 WS=4 SACK_PERM=1  tcp.stream == 23
356   5.065663 192.168.42.196 -> 216.223.0.211 TCP 54 48809 > http [ACK] Seq=1 Ack=1 Win=14720 Len=0  tcp.stream == 23
357   5.065665 63.80.138.66 -> 192.168.42.196 TCP 1314 [TCP segment of a reassembled PDU]  tcp.stream == 11
358   5.065668 192.168.42.196 -> 63.80.138.66 TCP 54 46311 > http [ACK] Seq=341 Ack=15121 Win=44928 Len=0  tcp.stream == 11
359   5.065671 206.33.55.126 -> 192.168.42.196 TCP 1314 [TCP segment of a reassembled PDU]  tcp.stream == 19
360   5.065673 192.168.42.196 -> 206.33.55.126 TCP 54 49850 > http [ACK] Seq=358 Ack=2521 Win=19712 Len=0  tcp.stream == 19
361   5.065762 206.33.55.126 -> 192.168.42.196 HTTP 558 HTTP/1.1 200 OK  (JPEG JFIF image)  tcp.stream == 19
