  3   0.308711 192.168.42.196 -> 202.72.51.22 TCP 74 53475 > http [SYN] Seq=0 Win=14600 Len=0 MSS=1460 SACK_PERM=1 TSval=44770523 TSecr=0 WS=128  tcp.stream == 0
  6   0.559600 192.168.42.196 -> 202.72.51.22 TCP 74 53476 > http [SYN] Seq=0 Win=14600 Len=0 MSS=1460 SACK_PERM=1 TSval=44770586 TSecr=0 WS=128  tcp.stream == 1
  7   0.606975 202.72.51.22 -> 192.168.42.196 TCP 66 http > 53475 [SYN, ACK] Seq=0 Ack=1 Win=65535 Len=0 MSS=1260 WS=4 SACK_PERM=1  tcp.stream == 0
  8   0.606998 192.168.42.196 -> 202.72.51.22 TCP 54 53475 > http [ACK] Seq=1 Ack=1 Win=14720 Len=0  tcp.stream == 0
  9   0.607089 192.168.42.196 -> 202.72.51.22 HTTP 349 GET / HTTP/1.1   tcp.stream == 0
 10   0.933370 202.72.51.22 -> 192.168.42.196 TCP 66 http > 53476 [SYN, ACK] Seq=0 Ack=1 Win=65535 Len=0 MSS=1260 WS=4 SACK_PERM=1  tcp.stream == 1
 11   0.933392 192.168.42.196 -> 202.72.51.22 TCP 54 53476 > http [ACK] Seq=1 Ack=1 Win=14720 Len=0  tcp.stream == 1
 12   0.980992 202.72.51.22 -> 192.168.42.196 TCP 54 [TCP Window Update] http > 53475 [ACK] Seq=1 Ack=1 Win=200000 Len=0  tcp.stream == 0
 14   1.685252 202.72.51.22 -> 192.168.42.196 TCP 54 [TCP Window Update] http > 53476 [ACK] Seq=1 Ack=1 Win=200000 Len=0  tcp.stream == 1
 15   1.732847 202.72.51.22 -> 192.168.42.196 TCP 54 http > 53475 [ACK] Seq=1 Ack=296 Win=200000 Len=0  tcp.stream == 0
 16   1.993483 202.72.51.22 -> 192.168.42.196 HTTP 445 HTTP/1.1 301 Moved Permanently  (text/html)  tcp.stream == 0
 17   1.993500 192.168.42.196 -> 202.72.51.22 TCP 54 53475 > http [ACK] Seq=296 Ack=392 Win=15744 Len=0  tcp.stream == 0
 22   2.084797 192.168.42.196 -> 202.72.53.63 TCP 74 34056 > http [SYN] Seq=0 Win=14600 Len=0 MSS=1460 SACK_PERM=1 TSval=44770967 TSecr=0 WS=128  tcp.stream == 2
 27   2.333070 192.168.42.196 -> 202.72.50.127 TCP 74 46101 > http [SYN] Seq=0 Win=14600 Len=0 MSS=1460 SACK_PERM=1 TSval=44771029 TSecr=0 WS=128  tcp.stream == 3
 29   2.452964 202.72.53.63 -> 192.168.42.196 TCP 66 http > 34056 [SYN, ACK] Seq=0 Ack=1 Win=65535 Len=0 MSS=1260 WS=4 SACK_PERM=1  tcp.stream == 2
 30   2.452991 192.168.42.196 -> 202.72.53.63 TCP 54 34056 > http [ACK] Seq=1 Ack=1 Win=14720 Len=0  tcp.stream == 2
 31   2.453076 192.168.42.196 -> 202.72.53.63 HTTP 353 GET / HTTP/1.1   tcp.stream == 2
 32   2.642978 202.72.50.127 -> 192.168.42.196 TCP 66 http > 46101 [SYN, ACK] Seq=0 Ack=1 Win=65535 Len=0 MSS=1260 WS=4 SACK_PERM=1  tcp.stream == 3
 33   2.643009 192.168.42.196 -> 202.72.50.127 TCP 54 46101 > http [ACK] Seq=1 Ack=1 Win=14720 Len=0  tcp.stream == 3
 34   2.847362 202.72.53.63 -> 192.168.42.196 TCP 54 [TCP Window Update] http > 34056 [ACK] Seq=1 Ack=1 Win=200000 Len=0  tcp.stream == 2
 35   3.584862 202.72.50.127 -> 192.168.42.196 TCP 54 [TCP Window Update] http > 46101 [ACK] Seq=1 Ack=1 Win=200000 Len=0  tcp.stream == 3
 36   3.622831 202.72.53.63 -> 192.168.42.196 TCP 54 http > 34056 [ACK] Seq=1 Ack=300 Win=200000 Len=0  tcp.stream == 2
 39   5.932926 192.168.42.196 -> 202.72.51.22 TCP 54 53476 > http [FIN, ACK] Seq=1 Ack=1 Win=14720 Len=0  tcp.stream == 1
 40   6.242970 202.72.51.22 -> 192.168.42.196 TCP 54 http > 53476 [ACK] Seq=1 Ack=2 Win=200000 Len=0  tcp.stream == 1
 41   6.254436 202.72.51.22 -> 192.168.42.196 TCP 54 http > 53476 [FIN, ACK] Seq=1 Ack=2 Win=200000 Len=0  tcp.stream == 1
 42   6.254453 192.168.42.196 -> 202.72.51.22 TCP 54 53476 > http [ACK] Seq=2 Ack=2 Win=14720 Len=0  tcp.stream == 1
 43   7.214268 202.72.53.63 -> 192.168.42.196 TCP 1314 [TCP segment of a reassembled PDU]  tcp.stream == 2
 44   7.214308 192.168.42.196 -> 202.72.53.63 TCP 54 34056 > http [ACK] Seq=300 Ack=1261 Win=17152 Len=0  tcp.stream == 2
 45   7.214317 202.72.53.63 -> 192.168.42.196 TCP 1314 [TCP segment of a reassembled PDU]  tcp.stream == 2
 46   7.214320 192.168.42.196 -> 202.72.53.63 TCP 54 34056 > http [ACK] Seq=300 Ack=2521 Win=19712 Len=0  tcp.stream == 2
 47   7.214323 202.72.53.63 -> 192.168.42.196 TCP 456 [TCP segment of a reassembled PDU]  tcp.stream == 2
 48   7.214326 192.168.42.196 -> 202.72.53.63 TCP 54 34056 > http [ACK] Seq=300 Ack=2923 Win=22272 Len=0  tcp.stream == 2
 49   7.223055 202.72.53.63 -> 192.168.42.196 TCP 1314 [TCP segment of a reassembled PDU]  tcp.stream == 2
 50   7.223074 192.168.42.196 -> 202.72.53.63 TCP 54 34056 > http [ACK] Seq=300 Ack=4183 Win=24704 Len=0  tcp.stream == 2
 51   7.223083 202.72.53.63 -> 192.168.42.196 TCP 1228 [TCP segment of a reassembled PDU]  tcp.stream == 2
 52   7.223086 192.168.42.196 -> 202.72.53.63 TCP 54 34056 > http [ACK] Seq=300 Ack=5357 Win=27264 Len=0  tcp.stream == 2
 53   7.223170 202.72.53.63 -> 192.168.42.196 TCP 1314 [TCP segment of a reassembled PDU]  tcp.stream == 2
 54   7.223175 192.168.42.196 -> 202.72.53.63 TCP 54 34056 > http [ACK] Seq=300 Ack=6617 Win=29824 Len=0  tcp.stream == 2
 55   7.223179 202.72.53.63 -> 192.168.42.196 TCP 957 [TCP segment of a reassembled PDU]  tcp.stream == 2
 56   7.223181 192.168.42.196 -> 202.72.53.63 TCP 54 34056 > http [ACK] Seq=300 Ack=7520 Win=32256 Len=0  tcp.stream == 2
 58   7.253678 202.72.53.63 -> 192.168.42.196 TCP 1314 [TCP segment of a reassembled PDU]  tcp.stream == 2
 59   7.253695 192.168.42.196 -> 202.72.53.63 TCP 54 34056 > http [ACK] Seq=300 Ack=8780 Win=34816 Len=0  tcp.stream == 2
 60   7.253703 202.72.53.63 -> 192.168.42.196 TCP 585 [TCP segment of a reassembled PDU]  tcp.stream == 2
 61   7.253706 192.168.42.196 -> 202.72.53.63 TCP 54 34056 > http [ACK] Seq=300 Ack=9311 Win=37376 Len=0  tcp.stream == 2
 62   7.253792 202.72.53.63 -> 192.168.42.196 TCP 1314 [TCP segment of a reassembled PDU]  tcp.stream == 2
 63   7.253797 192.168.42.196 -> 202.72.53.63 TCP 54 34056 > http [ACK] Seq=300 Ack=10571 Win=39808 Len=0  tcp.stream == 2
 64   7.253802 202.72.53.63 -> 192.168.42.196 TCP 589 [TCP segment of a reassembled PDU]  tcp.stream == 2
 65   7.253804 192.168.42.196 -> 202.72.53.63 TCP 54 34056 > http [ACK] Seq=300 Ack=11106 Win=42368 Len=0  tcp.stream == 2
 66   7.253914 202.72.53.63 -> 192.168.42.196 TCP 1314 [TCP segment of a reassembled PDU]  tcp.stream == 2
 67   7.253919 192.168.42.196 -> 202.72.53.63 TCP 54 34056 > http [ACK] Seq=300 Ack=12366 Win=44928 Len=0  tcp.stream == 2
 68   7.257479 192.168.42.196 -> 202.72.50.127 HTTP 436 GET /com/inc/home/20080930/opt/css/normal/common.css?ud=1229 HTTP/1.1   tcp.stream == 3
 69   7.257588 192.168.42.196 -> 202.72.53.63 TCP 74 34058 > http [SYN] Seq=0 Win=14600 Len=0 MSS=1460 SACK_PERM=1 TSval=44772261 TSecr=0 WS=128  tcp.stream == 4
 70   7.257614 192.168.42.196 -> 202.72.53.63 TCP 74 34059 > http [SYN] Seq=0 Win=14600 Len=0 MSS=1460 SACK_PERM=1 TSval=44772261 TSecr=0 WS=128  tcp.stream == 5
 71   7.258768 192.168.42.196 -> 202.72.53.63 TCP 74 34060 > http [SYN] Seq=0 Win=14600 Len=0 MSS=1460 SACK_PERM=1 TSval=44772261 TSecr=0 WS=128  tcp.stream == 6
 72   7.258833 192.168.42.196 -> 202.72.53.63 TCP 74 34061 > http [SYN] Seq=0 Win=14600 Len=0 MSS=1460 SACK_PERM=1 TSval=44772261 TSecr=0 WS=128  tcp.stream == 7
 73   7.262303 202.72.53.63 -> 192.168.42.196 TCP 628 [TCP segment of a reassembled PDU]  tcp.stream == 2
 74   7.262321 192.168.42.196 -> 202.72.53.63 TCP 54 34056 > http [ACK] Seq=300 Ack=12940 Win=47360 Len=0  tcp.stream == 2
 79   7.272304 202.72.53.63 -> 192.168.42.196 TCP 1314 [TCP segment of a reassembled PDU]  tcp.stream == 2
 80   7.272321 192.168.42.196 -> 202.72.53.63 TCP 54 34056 > http [ACK] Seq=300 Ack=14200 Win=49920 Len=0  tcp.stream == 2
 81   7.272330 202.72.53.63 -> 192.168.42.196 TCP 508 [TCP segment of a reassembled PDU]  tcp.stream == 2
 82   7.272334 192.168.42.196 -> 202.72.53.63 TCP 54 34056 > http [ACK] Seq=300 Ack=14654 Win=52480 Len=0  tcp.stream == 2
 83   7.297738 192.168.42.196 -> 23.1.242.127 TCP 74 35641 > http [SYN] Seq=0 Win=14600 Len=0 MSS=1460 SACK_PERM=1 TSval=44772271 TSecr=0 WS=128  tcp.stream == 8
 84   7.312023 192.168.42.196 -> 23.1.242.127 TCP 74 35642 > http [SYN] Seq=0 Win=14600 Len=0 MSS=1460 SACK_PERM=1 TSval=44772274 TSecr=0 WS=128  tcp.stream == 9
 85   7.422812 202.72.53.63 -> 192.168.42.196 TCP 1314 [TCP segment of a reassembled PDU]  tcp.stream == 2
 86   7.422832 192.168.42.196 -> 202.72.53.63 TCP 54 34056 > http [ACK] Seq=300 Ack=15914 Win=55040 Len=0  tcp.stream == 2
 87   7.432054 202.72.53.63 -> 192.168.42.196 TCP 1314 [TCP segment of a reassembled PDU]  tcp.stream == 2
 88   7.432073 192.168.42.196 -> 202.72.53.63 TCP 54 34056 > http [ACK] Seq=300 Ack=17174 Win=57472 Len=0  tcp.stream == 2
 89   7.453563 202.72.53.63 -> 192.168.42.196 TCP 1314 [TCP segment of a reassembled PDU]  tcp.stream == 2
 90   7.453588 192.168.42.196 -> 202.72.53.63 TCP 54 34056 > http [ACK] Seq=300 Ack=18434 Win=60032 Len=0  tcp.stream == 2
 91   7.453598 202.72.53.63 -> 192.168.42.196 TCP 1314 [TCP segment of a reassembled PDU]  tcp.stream == 2
 92   7.453601 192.168.42.196 -> 202.72.53.63 TCP 54 34056 > http [ACK] Seq=300 Ack=19694 Win=62592 Len=0  tcp.stream == 2
 93   7.453669 202.72.53.63 -> 192.168.42.196 TCP 1314 [TCP segment of a reassembled PDU]  tcp.stream == 2
 94   7.453674 192.168.42.196 -> 202.72.53.63 TCP 54 34056 > http [ACK] Seq=300 Ack=20954 Win=61568 Len=0  tcp.stream == 2
 95   7.472800 202.72.53.63 -> 192.168.42.196 TCP 1314 [TCP segment of a reassembled PDU]  tcp.stream == 2
 96   7.472817 192.168.42.196 -> 202.72.53.63 TCP 54 34056 > http [ACK] Seq=300 Ack=22214 Win=64128 Len=0  tcp.stream == 2
 97   7.482303 202.72.53.63 -> 192.168.42.196 TCP 1314 [TCP segment of a reassembled PDU]  tcp.stream == 2
 98   7.482320 192.168.42.196 -> 202.72.53.63 TCP 54 34056 > http [ACK] Seq=300 Ack=23474 Win=64128 Len=0  tcp.stream == 2
 99   7.482417 202.72.53.63 -> 192.168.42.196 TCP 1314 [TCP segment of a reassembled PDU]  tcp.stream == 2
100   7.482421 192.168.42.196 -> 202.72.53.63 TCP 54 34056 > http [ACK] Seq=300 Ack=24734 Win=62976 Len=0  tcp.stream == 2
101   7.492428 202.72.53.63 -> 192.168.42.196 TCP 1314 [TCP segment of a reassembled PDU]  tcp.stream == 2
102   7.516053 202.72.53.63 -> 192.168.42.196 TCP 1314 [TCP segment of a reassembled PDU]  tcp.stream == 2
103   7.516075 192.168.42.196 -> 202.72.53.63 TCP 54 34056 > http [ACK] Seq=300 Ack=27254 Win=64128 Len=0  tcp.stream == 2
104   7.516169 202.72.53.63 -> 192.168.42.196 TCP 1314 [TCP segment of a reassembled PDU]  tcp.stream == 2
105   7.516175 202.72.53.63 -> 192.168.42.196 TCP 1314 [TCP segment of a reassembled PDU]  tcp.stream == 2
106   7.516176 202.72.53.63 -> 192.168.42.196 TCP 1314 [TCP segment of a reassembled PDU]  tcp.stream == 2
107   7.516198 192.168.42.196 -> 202.72.53.63 TCP 54 34056 > http [ACK] Seq=300 Ack=31034 Win=64128 Len=0  tcp.stream == 2
108   7.523804 202.72.53.63 -> 192.168.42.196 TCP 1314 [TCP segment of a reassembled PDU]  tcp.stream == 2
109   7.525026 192.168.42.196 -> 23.1.242.127 TCP 74 35643 > http [SYN] Seq=0 Win=14600 Len=0 MSS=1460 SACK_PERM=1 TSval=44772327 TSecr=0 WS=128  tcp.stream == 10
110   7.543682 202.72.53.63 -> 192.168.42.196 TCP 1314 [TCP segment of a reassembled PDU]  tcp.stream == 2
111   7.543701 192.168.42.196 -> 202.72.53.63 TCP 54 34056 > http [ACK] Seq=300 Ack=33554 Win=64128 Len=0  tcp.stream == 2
112   7.543711 202.72.53.63 -> 192.168.42.196 TCP 1314 [TCP segment of a reassembled PDU]  tcp.stream == 2
114   7.552556 202.72.53.63 -> 192.168.42.196 TCP 1314 [TCP segment of a reassembled PDU]  tcp.stream == 2
115   7.552576 192.168.42.196 -> 202.72.53.63 TCP 54 34056 > http [ACK] Seq=300 Ack=36074 Win=64128 Len=0  tcp.stream == 2
116   7.562428 202.72.53.63 -> 192.168.42.196 TCP 1314 [TCP segment of a reassembled PDU]  tcp.stream == 2
117   7.572306 202.72.53.63 -> 192.168.42.196 TCP 1314 [TCP segment of a reassembled PDU]  tcp.stream == 2
118   7.572324 192.168.42.196 -> 202.72.53.63 TCP 54 34056 > http [ACK] Seq=300 Ack=38594 Win=64128 Len=0  tcp.stream == 2
119   7.572414 202.72.53.63 -> 192.168.42.196 TCP 1314 [TCP segment of a reassembled PDU]  tcp.stream == 2
120   7.583711 202.72.53.63 -> 192.168.42.196 TCP 1314 [TCP segment of a reassembled PDU]  tcp.stream == 2
121   7.583752 192.168.42.196 -> 202.72.53.63 TCP 54 34056 > http [ACK] Seq=300 Ack=41114 Win=64128 Len=0  tcp.stream == 2
122   7.583793 202.72.53.63 -> 192.168.42.196 TCP 1314 [TCP segment of a reassembled PDU]  tcp.stream == 2
123   7.583940 202.72.53.63 -> 192.168.42.196 HTTP 619 HTTP/1.1 200 OK  (text/html)  tcp.stream == 2
124   7.583943 202.72.53.63 -> 192.168.42.196 TCP 66 http > 34059 [SYN, ACK] Seq=0 Ack=1 Win=65535 Len=0 MSS=1260 WS=4 SACK_PERM=1  tcp.stream == 5
125   7.583952 192.168.42.196 -> 202.72.53.63 TCP 54 34059 > http [ACK] Seq=1 Ack=1 Win=14720 Len=0  tcp.stream == 5
126   7.583955 202.72.53.63 -> 192.168.42.196 TCP 66 http > 34061 [SYN, ACK] Seq=0 Ack=1 Win=65535 Len=0 MSS=1260 WS=4 SACK_PERM=1  tcp.stream == 7
127   7.583959 192.168.42.196 -> 202.72.53.63 TCP 54 34061 > http [ACK] Seq=1 Ack=1 Win=14720 Len=0  tcp.stream == 7
128   7.583962 202.72.53.63 -> 192.168.42.196 TCP 66 http > 34058 [SYN, ACK] Seq=0 Ack=1 Win=65535 Len=0 MSS=1260 WS=4 SACK_PERM=1  tcp.stream == 4
129   7.583965 192.168.42.196 -> 202.72.53.63 TCP 54 34058 > http [ACK] Seq=1 Ack=1 Win=14720 Len=0  tcp.stream == 4
130   7.583967 202.72.53.63 -> 192.168.42.196 TCP 66 http > 34060 [SYN, ACK] Seq=0 Ack=1 Win=65535 Len=0 MSS=1260 WS=4 SACK_PERM=1  tcp.stream == 6
131   7.583972 192.168.42.196 -> 202.72.53.63 TCP 54 34060 > http [ACK] Seq=1 Ack=1 Win=14720 Len=0  tcp.stream == 6
132   7.583974 23.1.242.127 -> 192.168.42.196 TCP 66 http > 35641 [SYN, ACK] Seq=0 Ack=1 Win=65535 Len=0 MSS=1260 WS=4 SACK_PERM=1  tcp.stream == 8
133   7.583979 192.168.42.196 -> 23.1.242.127 TCP 54 35641 > http [ACK] Seq=1 Ack=1 Win=14720 Len=0  tcp.stream == 8
134   7.583981 23.1.242.127 -> 192.168.42.196 TCP 66 http > 35642 [SYN, ACK] Seq=0 Ack=1 Win=65535 Len=0 MSS=1260 WS=4 SACK_PERM=1  tcp.stream == 9
135   7.583985 192.168.42.196 -> 23.1.242.127 TCP 54 35642 > http [ACK] Seq=1 Ack=1 Win=14720 Len=0  tcp.stream == 9
138   7.584199 192.168.42.196 -> 202.72.53.63 TCP 54 34056 > http [ACK] Seq=300 Ack=42939 Win=64128 Len=0  tcp.stream == 2
139   7.584304 192.168.42.196 -> 202.72.53.63 HTTP 436 GET /com/inc/home/20080930/opt/css/normal/layout.css?ud=0226 HTTP/1.1   tcp.stream == 2
140   7.584334 192.168.42.196 -> 202.72.53.63 HTTP 440 GET /com/inc/home/20080930/opt/css/normal/sidecolumn.css?ud=0226 HTTP/1.1   tcp.stream == 4
141   7.584355 192.168.42.196 -> 202.72.53.63 HTTP 434 GET /com/inc/home/20080930/beta/css/liquid/api.css?ud=0226 HTTP/1.1   tcp.stream == 5
142   7.584371 192.168.42.196 -> 202.72.53.63 HTTP 440 GET /com/inc/home/20080930/beta/css/liquid/myrakuten.css?ud=0226 HTTP/1.1   tcp.stream == 6
143   7.584388 192.168.42.196 -> 202.72.53.63 HTTP 440 GET /com/inc/home/20080930/opt/css/normal/leftcolumn.css?ud=1229 HTTP/1.1   tcp.stream == 7
144   7.584398 192.168.42.196 -> 23.1.242.127 HTTP 396 GET /com/img/home/beta/201103/tab_06.gif HTTP/1.1   tcp.stream == 8
145   7.584420 192.168.42.196 -> 23.1.242.127 HTTP 396 GET /com/img/home/beta/201011/overbg.gif HTTP/1.1   tcp.stream == 9
147   7.585066 192.168.42.196 -> 65.113.31.144 TCP 74 41775 > http [SYN] Seq=0 Win=14600 Len=0 MSS=1460 SACK_PERM=1 TSval=44772342 TSecr=0 WS=128  tcp.stream == 11
148   7.585105 192.168.42.196 -> 65.113.31.144 TCP 74 41776 > http [SYN] Seq=0 Win=14600 Len=0 MSS=1460 SACK_PERM=1 TSval=44772342 TSecr=0 WS=128  tcp.stream == 12
149   7.585130 192.168.42.196 -> 65.113.31.144 TCP 74 41777 > http [SYN] Seq=0 Win=14600 Len=0 MSS=1460 SACK_PERM=1 TSval=44772342 TSecr=0 WS=128  tcp.stream == 13
150   7.585180 192.168.42.196 -> 65.113.31.144 TCP 74 41778 > http [SYN] Seq=0 Win=14600 Len=0 MSS=1460 SACK_PERM=1 TSval=44772343 TSecr=0 WS=128  tcp.stream == 14
151   7.585203 192.168.42.196 -> 65.113.31.144 TCP 74 41779 > http [SYN] Seq=0 Win=14600 Len=0 MSS=1460 SACK_PERM=1 TSval=44772343 TSecr=0 WS=128  tcp.stream == 15
152   7.585225 192.168.42.196 -> 65.113.31.144 TCP 74 41780 > http [SYN] Seq=0 Win=14600 Len=0 MSS=1460 SACK_PERM=1 TSval=44772343 TSecr=0 WS=128  tcp.stream == 16
154   7.641957 202.72.50.127 -> 192.168.42.196 TCP 54 http > 46101 [ACK] Seq=1 Ack=383 Win=200000 Len=0  tcp.stream == 3
155   7.666957 23.1.242.127 -> 192.168.42.196 TCP 66 http > 35643 [SYN, ACK] Seq=0 Ack=1 Win=65535 Len=0 MSS=1260 WS=4 SACK_PERM=1  tcp.stream == 10
156   7.666982 192.168.42.196 -> 23.1.242.127 TCP 54 35643 > http [ACK] Seq=1 Ack=1 Win=14720 Len=0  tcp.stream == 10
157   7.667069 192.168.42.196 -> 23.1.242.127 HTTP 398 GET /com/img/home/beta/201008/qrcode03.gif HTTP/1.1   tcp.stream == 10
158   7.713340 23.1.242.127 -> 192.168.42.196 TCP 54 [TCP Window Update] http > 35642 [ACK] Seq=1 Ack=1 Win=200000 Len=0  tcp.stream == 9
159   7.713357 202.72.53.63 -> 192.168.42.196 TCP 54 [TCP Window Update] http > 34059 [ACK] Seq=1 Ack=1 Win=200000 Len=0  tcp.stream == 5
160   7.713359 202.72.53.63 -> 192.168.42.196 TCP 54 [TCP Window Update] http > 34058 [ACK] Seq=1 Ack=1 Win=200000 Len=0  tcp.stream == 4
161   7.713360 202.72.53.63 -> 192.168.42.196 TCP 54 [TCP Window Update] http > 34061 [ACK] Seq=1 Ack=1 Win=200000 Len=0  tcp.stream == 7
162   7.713361 23.1.242.127 -> 192.168.42.196 TCP 54 [TCP Window Update] http > 35641 [ACK] Seq=1 Ack=1 Win=200000 Len=0  tcp.stream == 8
163   7.713363 202.72.53.63 -> 192.168.42.196 TCP 54 [TCP Window Update] http > 34060 [ACK] Seq=1 Ack=1 Win=200000 Len=0  tcp.stream == 6
167   7.714242 192.168.42.196 -> 23.1.242.127 TCP 74 35650 > http [SYN] Seq=0 Win=14600 Len=0 MSS=1460 SACK_PERM=1 TSval=44772375 TSecr=0 WS=128  tcp.stream == 17
168   7.714295 192.168.42.196 -> 23.1.242.127 TCP 74 35651 > http [SYN] Seq=0 Win=14600 Len=0 MSS=1460 SACK_PERM=1 TSval=44772375 TSecr=0 WS=128  tcp.stream == 18
169   7.812435 23.1.242.127 -> 192.168.42.196 HTTP 818 HTTP/1.1 200 OK  (GIF87a)  tcp.stream == 8
170   7.812455 192.168.42.196 -> 23.1.242.127 TCP 54 35641 > http [ACK] Seq=343 Ack=765 Win=16128 Len=0  tcp.stream == 8
171   7.812462 65.113.31.144 -> 192.168.42.196 TCP 66 http > 41775 [SYN, ACK] Seq=0 Ack=1 Win=65535 Len=0 MSS=1260 WS=4 SACK_PERM=1  tcp.stream == 11
172   7.812474 192.168.42.196 -> 65.113.31.144 TCP 54 41775 > http [ACK] Seq=1 Ack=1 Win=14720 Len=0  tcp.stream == 11
173   7.812476 23.1.242.127 -> 192.168.42.196 HTTP 372 HTTP/1.1 200 OK  (GIF89a)  tcp.stream == 9
174   7.812480 192.168.42.196 -> 23.1.242.127 TCP 54 35642 > http [ACK] Seq=343 Ack=319 Win=15744 Len=0  tcp.stream == 9
175   7.812678 192.168.42.196 -> 65.113.31.144 HTTP 407 GET /com/js/d/common/jquery-1.4.2.min.js HTTP/1.1   tcp.stream == 11
176   7.842467 65.113.31.144 -> 192.168.42.196 TCP 66 http > 41776 [SYN, ACK] Seq=0 Ack=1 Win=65535 Len=0 MSS=1260 WS=4 SACK_PERM=1  tcp.stream == 12
177   7.842490 192.168.42.196 -> 65.113.31.144 TCP 54 41776 > http [ACK] Seq=1 Ack=1 Win=14720 Len=0  tcp.stream == 12
178   7.842498 65.113.31.144 -> 192.168.42.196 TCP 66 http > 41780 [SYN, ACK] Seq=0 Ack=1 Win=65535 Len=0 MSS=1260 WS=4 SACK_PERM=1  tcp.stream == 16
179   7.842503 192.168.42.196 -> 65.113.31.144 TCP 54 41780 > http [ACK] Seq=1 Ack=1 Win=14720 Len=0  tcp.stream == 16
180   7.842506 65.113.31.144 -> 192.168.42.196 TCP 66 http > 41779 [SYN, ACK] Seq=0 Ack=1 Win=65535 Len=0 MSS=1260 WS=4 SACK_PERM=1  tcp.stream == 15
181   7.842509 192.168.42.196 -> 65.113.31.144 TCP 54 41779 > http [ACK] Seq=1 Ack=1 Win=14720 Len=0  tcp.stream == 15
182   7.842511 65.113.31.144 -> 192.168.42.196 TCP 66 http > 41778 [SYN, ACK] Seq=0 Ack=1 Win=65535 Len=0 MSS=1260 WS=4 SACK_PERM=1  tcp.stream == 14
183   7.842515 192.168.42.196 -> 65.113.31.144 TCP 54 41778 > http [ACK] Seq=1 Ack=1 Win=14720 Len=0  tcp.stream == 14
184   7.842517 65.113.31.144 -> 192.168.42.196 TCP 66 http > 41777 [SYN, ACK] Seq=0 Ack=1 Win=65535 Len=0 MSS=1260 WS=4 SACK_PERM=1  tcp.stream == 13
185   7.842520 192.168.42.196 -> 65.113.31.144 TCP 54 41777 > http [ACK] Seq=1 Ack=1 Win=14720 Len=0  tcp.stream == 13
186   7.842523 23.1.242.127 -> 192.168.42.196 TCP 54 [TCP Window Update] http > 35643 [ACK] Seq=1 Ack=1 Win=200000 Len=0  tcp.stream == 10
187   7.842526 23.1.242.127 -> 192.168.42.196 TCP 66 http > 35650 [SYN, ACK] Seq=0 Ack=1 Win=65535 Len=0 MSS=1260 WS=4 SACK_PERM=1  tcp.stream == 17
188   7.842530 192.168.42.196 -> 23.1.242.127 TCP 54 35650 > http [ACK] Seq=1 Ack=1 Win=14720 Len=0  tcp.stream == 17
189   7.842532 23.1.242.127 -> 192.168.42.196 TCP 66 http > 35651 [SYN, ACK] Seq=0 Ack=1 Win=65535 Len=0 MSS=1260 WS=4 SACK_PERM=1  tcp.stream == 18
190   7.842538 192.168.42.196 -> 23.1.242.127 TCP 54 35651 > http [ACK] Seq=1 Ack=1 Win=14720 Len=0  tcp.stream == 18
191   7.842577 192.168.42.196 -> 65.113.31.144 HTTP 419 GET /com/js/d/common/plugin/jquery.tmpl-1.0.0.min.js HTTP/1.1   tcp.stream == 12
192   7.842639 192.168.42.196 -> 65.113.31.144 HTTP 409 GET /com/inc/home/20080930/js/swfobject.js HTTP/1.1   tcp.stream == 13
193   7.842652 192.168.42.196 -> 65.113.31.144 HTTP 453 GET /com/img/home/beta/201008_newtop/genre/bigtri_02.gif HTTP/1.1   tcp.stream == 14
194   7.842665 192.168.42.196 -> 65.113.31.144 HTTP 417 GET /com/js/d/svc_ashiato/svc_ashiato-1.0.0.min.js HTTP/1.1   tcp.stream == 15
195   7.842674 192.168.42.196 -> 65.113.31.144 HTTP 432 GET /com/img/home/beta/201105/t.gif HTTP/1.1   tcp.stream == 16
196   7.852705 23.1.242.127 -> 192.168.42.196 HTTP 941 HTTP/1.1 200 OK  (GIF87a)  tcp.stream == 10
197   7.852730 192.168.42.196 -> 23.1.242.127 TCP 54 35643 > http [ACK] Seq=345 Ack=888 Win=16384 Len=0  tcp.stream == 10
198   7.882051 202.72.53.63 -> 192.168.42.196 TCP 54 http > 34056 [ACK] Seq=42939 Ack=682 Win=200000 Len=0  tcp.stream == 2
199   7.882065 202.72.53.63 -> 192.168.42.196 TCP 54 http > 34058 [ACK] Seq=1 Ack=387 Win=200000 Len=0  tcp.stream == 4
200   7.882068 202.72.53.63 -> 192.168.42.196 TCP 54 http > 34059 [ACK] Seq=1 Ack=381 Win=200000 Len=0  tcp.stream == 5
201   7.904082 202.72.50.127 -> 192.168.42.196 TCP 1314 [TCP segment of a reassembled PDU]  tcp.stream == 3
202   7.904103 192.168.42.196 -> 202.72.50.127 TCP 54 46101 > http [ACK] Seq=383 Ack=1261 Win=17152 Len=0  tcp.stream == 3
203   7.904111 202.72.50.127 -> 192.168.42.196 HTTP 752 HTTP/1.1 200 OK  (text/css)  tcp.stream == 3
204   7.904113 192.168.42.196 -> 202.72.50.127 TCP 54 46101 > http [ACK] Seq=383 Ack=1959 Win=19712 Len=0  tcp.stream == 3
205   7.904286 192.168.42.196 -> 202.72.50.127 HTTP 436 GET /com/inc/home/20080930/opt/css/normal/header.css?ud=1229 HTTP/1.1   tcp.stream == 3
206   7.922299 202.72.53.63 -> 192.168.42.196 TCP 54 http > 34060 [ACK] Seq=1 Ack=387 Win=200000 Len=0  tcp.stream == 6
207   7.922316 202.72.53.63 -> 192.168.42.196 TCP 54 http > 34061 [ACK] Seq=1 Ack=387 Win=200000 Len=0  tcp.stream == 7
208   7.932300 65.113.31.144 -> 192.168.42.196 TCP 54 [TCP Window Update] http > 41775 [ACK] Seq=1 Ack=1 Win=200000 Len=0  tcp.stream == 11
212   7.932925 192.168.42.196 -> 65.113.31.153 TCP 74 39471 > http [SYN] Seq=0 Win=14600 Len=0 MSS=1460 SACK_PERM=1 TSval=44772429 TSecr=0 WS=128  tcp.stream == 19
213   7.932964 192.168.42.196 -> 65.113.31.153 TCP 74 39472 > http [SYN] Seq=0 Win=14600 Len=0 MSS=1460 SACK_PERM=1 TSval=44772429 TSecr=0 WS=128  tcp.stream == 20
214   7.932994 192.168.42.196 -> 65.113.31.153 TCP 74 39473 > http [SYN] Seq=0 Win=14600 Len=0 MSS=1460 SACK_PERM=1 TSval=44772429 TSecr=0 WS=128  tcp.stream == 21
215   7.985336 65.113.31.144 -> 192.168.42.196 TCP 54 [TCP Window Update] http > 41780 [ACK] Seq=1 Ack=1 Win=200000 Len=0  tcp.stream == 16
216   7.985351 65.113.31.144 -> 192.168.42.196 TCP 54 [TCP Window Update] http > 41776 [ACK] Seq=1 Ack=1 Win=200000 Len=0  tcp.stream == 12
217   7.985353 23.1.242.127 -> 192.168.42.196 TCP 54 [TCP Window Update] http > 35650 [ACK] Seq=1 Ack=1 Win=200000 Len=0  tcp.stream == 17
218   7.985354 65.113.31.144 -> 192.168.42.196 TCP 54 [TCP Window Update] http > 41779 [ACK] Seq=1 Ack=1 Win=200000 Len=0  tcp.stream == 15
219   7.985356 65.113.31.144 -> 192.168.42.196 TCP 54 [TCP Window Update] http > 41778 [ACK] Seq=1 Ack=1 Win=200000 Len=0  tcp.stream == 14
220   7.985357 65.113.31.144 -> 192.168.42.196 TCP 54 [TCP Window Update] http > 41777 [ACK] Seq=1 Ack=1 Win=200000 Len=0  tcp.stream == 13
221   8.001953 23.1.242.127 -> 192.168.42.196 TCP 54 [TCP Window Update] http > 35651 [ACK] Seq=1 Ack=1 Win=200000 Len=0  tcp.stream == 18
222   8.013996 65.113.31.144 -> 192.168.42.196 TCP 1314 [TCP segment of a reassembled PDU]  tcp.stream == 12
223   8.014064 192.168.42.196 -> 65.113.31.144 TCP 54 41776 > http [ACK] Seq=366 Ack=1261 Win=17152 Len=0  tcp.stream == 12
224   8.014086 65.113.31.144 -> 192.168.42.196 TCP 1314 [TCP segment of a reassembled PDU]  tcp.stream == 12
225   8.014093 192.168.42.196 -> 65.113.31.144 TCP 54 41776 > http [ACK] Seq=366 Ack=2521 Win=19712 Len=0  tcp.stream == 12
226   8.014101 65.113.31.144 -> 192.168.42.196 HTTP 651 HTTP/1.1 200 OK  (application/javascript)  tcp.stream == 12
227   8.014111 192.168.42.196 -> 65.113.31.144 TCP 54 41776 > http [ACK] Seq=366 Ack=3118 Win=22272 Len=0  tcp.stream == 12
228   8.014174 65.113.31.144 -> 192.168.42.196 TCP 1314 [TCP segment of a reassembled PDU]  tcp.stream == 13
229   8.014184 192.168.42.196 -> 65.113.31.144 TCP 54 41777 > http [ACK] Seq=356 Ack=1261 Win=17152 Len=0  tcp.stream == 13
230   8.014431 192.168.42.196 -> 65.113.31.144 HTTP 408 GET /com/js/c/cartnumdisplay-1.0.0.min.js HTTP/1.1   tcp.stream == 12
231   8.022582 65.113.31.144 -> 192.168.42.196 TCP 1314 [TCP segment of a reassembled PDU]  tcp.stream == 13
232   8.022602 192.168.42.196 -> 65.113.31.144 TCP 54 41777 > http [ACK] Seq=356 Ack=2521 Win=19712 Len=0  tcp.stream == 13
233   8.022610 65.113.31.144 -> 192.168.42.196 TCP 1314 [TCP segment of a reassembled PDU]  tcp.stream == 13
234   8.022612 192.168.42.196 -> 65.113.31.144 TCP 54 41777 > http [ACK] Seq=356 Ack=3781 Win=22272 Len=0  tcp.stream == 13
235   8.032173 65.113.31.144 -> 192.168.42.196 HTTP 506 HTTP/1.1 200 OK  (application/javascript)  tcp.stream == 13
236   8.032191 192.168.42.196 -> 65.113.31.144 TCP 54 41777 > http [ACK] Seq=356 Ack=4233 Win=24704 Len=0  tcp.stream == 13
237   8.032302 192.168.42.196 -> 65.113.31.144 HTTP 422 GET /com/js/d/top/suggest/suggest-hook-top-1.0.0.min.js HTTP/1.1   tcp.stream == 13
238   8.053579 65.113.31.144 -> 192.168.42.196 HTTP 444 HTTP/1.1 200 OK  (GIF89a)  tcp.stream == 14
239   8.053601 192.168.42.196 -> 65.113.31.144 TCP 54 41778 > http [ACK] Seq=400 Ack=391 Win=15744 Len=0  tcp.stream == 14
240   8.053609 65.113.31.144 -> 192.168.42.196 TCP 1314 [TCP segment of a reassembled PDU]  tcp.stream == 15
241   8.053613 192.168.42.196 -> 65.113.31.144 TCP 54 41779 > http [ACK] Seq=364 Ack=1261 Win=17152 Len=0  tcp.stream == 15
242   8.053658 65.113.31.144 -> 192.168.42.196 HTTP 1215 HTTP/1.1 200 OK  (application/javascript)  tcp.stream == 15
243   8.053660 192.168.42.196 -> 65.113.31.144 TCP 54 41779 > http [ACK] Seq=364 Ack=2422 Win=19712 Len=0  tcp.stream == 15
244   8.053837 192.168.42.196 -> 65.113.31.144 HTTP 409 GET /com/js/d/suggest/suggest-2.0.1.min.js HTTP/1.1   tcp.stream == 14
245   8.053872 192.168.42.196 -> 65.113.31.144 HTTP 423 GET /com/js/d/ranking/liquid/ranking-liquid-1.1.3.min.js HTTP/1.1   tcp.stream == 15
246   8.062458 65.113.31.144 -> 192.168.42.196 HTTP 370 HTTP/1.1 200 OK  (GIF89a)  tcp.stream == 16
247   8.062479 192.168.42.196 -> 65.113.31.144 TCP 54 41780 > http [ACK] Seq=379 Ack=317 Win=15744 Len=0  tcp.stream == 16
248   8.062487 65.113.31.153 -> 192.168.42.196 TCP 66 http > 39472 [SYN, ACK] Seq=0 Ack=1 Win=65535 Len=0 MSS=1260 WS=4 SACK_PERM=1  tcp.stream == 20
249   8.062499 192.168.42.196 -> 65.113.31.153 TCP 54 39472 > http [ACK] Seq=1 Ack=1 Win=14720 Len=0  tcp.stream == 20
250   8.062502 65.113.31.153 -> 192.168.42.196 TCP 66 http > 39471 [SYN, ACK] Seq=0 Ack=1 Win=65535 Len=0 MSS=1260 WS=4 SACK_PERM=1  tcp.stream == 19
251   8.062505 192.168.42.196 -> 65.113.31.153 TCP 54 39471 > http [ACK] Seq=1 Ack=1 Win=14720 Len=0  tcp.stream == 19
252   8.062507 65.113.31.153 -> 192.168.42.196 TCP 66 http > 39473 [SYN, ACK] Seq=0 Ack=1 Win=65535 Len=0 MSS=1260 WS=4 SACK_PERM=1  tcp.stream == 21
253   8.062509 192.168.42.196 -> 65.113.31.153 TCP 54 39473 > http [ACK] Seq=1 Ack=1 Win=14720 Len=0  tcp.stream == 21
254   8.062733 192.168.42.196 -> 65.113.31.144 HTTP 415 GET /com/js/c/top/popmenu/genremenu-1.0.0.min.js HTTP/1.1   tcp.stream == 16
255   8.062763 192.168.42.196 -> 65.113.31.153 HTTP 423 GET /borderless/img/banner/ichiba/os_ichiba_modal_flag_jp.gif HTTP/1.1   tcp.stream == 21
256   8.062787 192.168.42.196 -> 65.113.31.153 HTTP 428 GET /borderless/img/banner/ichiba/os_ichiba_modal_ttl_20120203.gif HTTP/1.1   tcp.stream == 19
257   8.062796 192.168.42.196 -> 65.113.31.153 HTTP 427 GET /borderless/img/banner/ichiba/os_ichiba_modal_flag_global.gif HTTP/1.1   tcp.stream == 20
258   8.071957 65.113.31.144 -> 192.168.42.196 TCP 54 http > 41775 [ACK] Seq=1 Ack=354 Win=200000 Len=0  tcp.stream == 11
259   8.122580 202.72.53.63 -> 192.168.42.196 TCP 1314 [TCP segment of a reassembled PDU]  tcp.stream == 2
260   8.133582 202.72.53.63 -> 192.168.42.196 TCP 925 [TCP segment of a reassembled PDU]  tcp.stream == 2
261   8.133600 192.168.42.196 -> 202.72.53.63 TCP 54 34056 > http [ACK] Seq=682 Ack=45070 Win=64128 Len=0  tcp.stream == 2
262   8.133607 202.72.53.63 -> 192.168.42.196 TCP 1314 [TCP segment of a reassembled PDU]  tcp.stream == 2
263   8.133610 202.72.53.63 -> 192.168.42.196 TCP 106 [TCP segment of a reassembled PDU]  tcp.stream == 2
264   8.133613 202.72.53.63 -> 192.168.42.196 TCP 672 [TCP segment of a reassembled PDU]  tcp.stream == 2
265   8.133614 202.72.53.63 -> 192.168.42.196 HTTP 74 HTTP/1.1 200 OK  (text/css)  tcp.stream == 2
266   8.133698 192.168.42.196 -> 202.72.53.63 TCP 54 34056 > http [ACK] Seq=682 Ack=47020 Win=64128 Len=0  tcp.stream == 2
267   8.133782 192.168.42.196 -> 202.72.53.63 HTTP 436 GET /com/inc/home/20080930/opt/css/normal/footer.css?ud=1221 HTTP/1.1   tcp.stream == 2
268   8.153834 202.72.53.63 -> 192.168.42.196 TCP 1314 [TCP segment of a reassembled PDU]  tcp.stream == 5
269   8.153855 192.168.42.196 -> 202.72.53.63 TCP 54 34059 > http [ACK] Seq=381 Ack=1261 Win=17152 Len=0  tcp.stream == 5
270   8.153862 202.72.53.63 -> 192.168.42.196 TCP 804 [TCP segment of a reassembled PDU]  tcp.stream == 5
271   8.153865 192.168.42.196 -> 202.72.53.63 TCP 54 34059 > http [ACK] Seq=381 Ack=2011 Win=19712 Len=0  tcp.stream == 5
272   8.153867 202.72.53.63 -> 192.168.42.196 TCP 121 [TCP segment of a reassembled PDU]  tcp.stream == 5
273   8.153870 192.168.42.196 -> 202.72.53.63 TCP 54 34059 > http [ACK] Seq=381 Ack=2078 Win=19712 Len=0  tcp.stream == 5
274   8.153872 202.72.53.63 -> 192.168.42.196 HTTP 74 HTTP/1.1 200 OK  (text/css)  tcp.stream == 5
275   8.153873 192.168.42.196 -> 202.72.53.63 TCP 54 34059 > http [ACK] Seq=381 Ack=2098 Win=19712 Len=0  tcp.stream == 5
276   8.154070 192.168.42.196 -> 202.72.53.63 HTTP 427 GET /com/inc/home/20080930/beta/css/liquid/ipad.css HTTP/1.1   tcp.stream == 5
277   8.162707 202.72.53.63 -> 192.168.42.196 TCP 1314 [TCP segment of a reassembled PDU]  tcp.stream == 6
278   8.162726 192.168.42.196 -> 202.72.53.63 TCP 54 34060 > http [ACK] Seq=387 Ack=1261 Win=17152 Len=0  tcp.stream == 6
279   8.162733 202.72.53.63 -> 192.168.42.196 HTTP 459 HTTP/1.1 200 OK  (text/css)  tcp.stream == 6
280   8.162735 192.168.42.196 -> 202.72.53.63 TCP 54 34060 > http [ACK] Seq=387 Ack=1666 Win=19712 Len=0  tcp.stream == 6
281   8.162738 65.113.31.144 -> 192.168.42.196 HTTP 744 HTTP/1.1 200 OK  (application/javascript)  tcp.stream == 12
282   8.162945 192.168.42.196 -> 202.72.53.63 HTTP 435 GET /com/inc/home/20080930/opt/css/normal/genre.css?ud=0226 HTTP/1.1   tcp.stream == 6
283   8.162980 192.168.42.196 -> 65.113.31.144 HTTP 397 GET /com/js/omniture/s_code.js HTTP/1.1   tcp.stream == 12
284   8.173824 202.72.53.63 -> 192.168.42.196 TCP 1314 [TCP segment of a reassembled PDU]  tcp.stream == 7
285   8.173842 192.168.42.196 -> 202.72.53.63 TCP 54 34061 > http [ACK] Seq=387 Ack=1261 Win=17152 Len=0  tcp.stream == 7
286   8.173849 202.72.53.63 -> 192.168.42.196 HTTP 877 HTTP/1.1 200 OK  (text/css)  tcp.stream == 7
287   8.173851 192.168.42.196 -> 202.72.53.63 TCP 54 34061 > http [ACK] Seq=387 Ack=2084 Win=19712 Len=0  tcp.stream == 7
288   8.174011 192.168.42.196 -> 202.72.53.63 HTTP 436 GET /com/inc/home/20080930/beta/css/liquid/suggest-2.0.1.css HTTP/1.1   tcp.stream == 7
289   8.182424 65.113.31.144 -> 192.168.42.196 HTTP 756 HTTP/1.1 200 OK  (application/javascript)  tcp.stream == 13
290   8.182442 202.72.50.127 -> 192.168.42.196 TCP 54 http > 46101 [ACK] Seq=1959 Ack=765 Win=200000 Len=0  tcp.stream == 3
291   8.182596 192.168.42.196 -> 65.113.31.144 HTTP 419 GET /com/js/c/top/liquidlist/liquidlist-1.0.0.min.js HTTP/1.1   tcp.stream == 13
292   8.193183 202.72.50.127 -> 192.168.42.196 TCP 1314 [TCP segment of a reassembled PDU]  tcp.stream == 3
293   8.193197 202.72.50.127 -> 192.168.42.196 TCP 1144 [TCP segment of a reassembled PDU]  tcp.stream == 3
294   8.193204 192.168.42.196 -> 202.72.50.127 TCP 54 46101 > http [ACK] Seq=765 Ack=4309 Win=24704 Len=0  tcp.stream == 3
295   8.193210 202.72.50.127 -> 192.168.42.196 TCP 396 [TCP segment of a reassembled PDU]  tcp.stream == 3
296   8.193213 202.72.50.127 -> 192.168.42.196 HTTP 74 HTTP/1.1 200 OK  (text/css)  tcp.stream == 3
297   8.193300 192.168.42.196 -> 202.72.50.127 TCP 54 46101 > http [ACK] Seq=765 Ack=4671 Win=27264 Len=0  tcp.stream == 3
298   8.193392 192.168.42.196 -> 202.72.50.127 HTTP 397 GET /com/js/d/rjs/rjs_helpers.min.js HTTP/1.1   tcp.stream == 3
299   8.212577 65.113.31.144 -> 192.168.42.196 TCP 1314 [TCP segment of a reassembled PDU]  tcp.stream == 14
300   8.212598 65.113.31.144 -> 192.168.42.196 TCP 1314 [TCP segment of a reassembled PDU]  tcp.stream == 14
301   8.212605 192.168.42.196 -> 65.113.31.144 TCP 54 41778 > http [ACK] Seq=755 Ack=2911 Win=20736 Len=0  tcp.stream == 14
302   8.222701 65.113.31.144 -> 192.168.42.196 TCP 1314 [TCP segment of a reassembled PDU]  tcp.stream == 14
303   8.222785 65.113.31.144 -> 192.168.42.196 HTTP 1299 HTTP/1.1 200 OK  (application/javascript)  tcp.stream == 14
304   8.222789 65.113.31.153 -> 192.168.42.196 TCP 54 [TCP Window Update] http > 39473 [ACK] Seq=1 Ack=1 Win=200000 Len=0  tcp.stream == 21
305   8.222794 65.113.31.153 -> 192.168.42.196 TCP 54 [TCP Window Update] http > 39472 [ACK] Seq=1 Ack=1 Win=200000 Len=0  tcp.stream == 20
306   8.222796 65.113.31.153 -> 192.168.42.196 TCP 54 [TCP Window Update] http > 39471 [ACK] Seq=1 Ack=1 Win=200000 Len=0  tcp.stream == 19
307   8.222805 192.168.42.196 -> 65.113.31.144 TCP 54 41778 > http [ACK] Seq=755 Ack=5416 Win=25856 Len=0  tcp.stream == 14
308   8.222878 192.168.42.196 -> 65.113.31.144 HTTP 467 GET /com/img/thumb/200309/logo/2012/20120216_jack_banners_70x60a_3.gif HTTP/1.1   tcp.stream == 14
309   8.232313 65.113.31.144 -> 192.168.42.196 TCP 1314 [TCP segment of a reassembled PDU]  tcp.stream == 15
310   8.232345 65.113.31.144 -> 192.168.42.196 TCP 1314 [TCP segment of a reassembled PDU]  tcp.stream == 15
311   8.232357 192.168.42.196 -> 65.113.31.144 TCP 54 41779 > http [ACK] Seq=733 Ack=4942 Win=24704 Len=0  tcp.stream == 15
312   8.252704 65.113.31.144 -> 192.168.42.196 TCP 1314 [TCP segment of a reassembled PDU]  tcp.stream == 15
313   8.252781 65.113.31.144 -> 192.168.42.196 TCP 1314 [TCP segment of a reassembled PDU]  tcp.stream == 15
314   8.252789 192.168.42.196 -> 65.113.31.144 TCP 54 41779 > http [ACK] Seq=733 Ack=7462 Win=29824 Len=0  tcp.stream == 15
315   8.263705 65.113.31.144 -> 192.168.42.196 HTTP 760 HTTP/1.1 200 OK  (application/javascript)  tcp.stream == 15
316   8.263725 65.113.31.144 -> 192.168.42.196 HTTP 638 HTTP/1.1 200 OK  (application/javascript)  tcp.stream == 16
317   8.263730 65.113.31.153 -> 192.168.42.196 TCP 1314 [TCP segment of a reassembled PDU]  tcp.stream == 21
318   8.263738 192.168.42.196 -> 65.113.31.153 TCP 54 39473 > http [ACK] Seq=370 Ack=1261 Win=17152 Len=0  tcp.stream == 21
319   8.263780 65.113.31.153 -> 192.168.42.196 HTTP 800 HTTP/1.1 200 OK  (GIF87a)  tcp.stream == 21
320   8.263785 192.168.42.196 -> 65.113.31.153 TCP 54 39473 > http [ACK] Seq=370 Ack=2007 Win=19712 Len=0  tcp.stream == 21
321   8.263993 192.168.42.196 -> 65.113.31.144 HTTP 472 GET /com/img/thumb/200309/message/flash/201008/20090611_ranking_195x60b.jpg HTTP/1.1   tcp.stream == 15
322   8.264046 192.168.42.196 -> 65.113.31.144 HTTP 471 GET /com/img/thumb/200309/message/flash/201008/20090422_pointup_195x60.jpg HTTP/1.1   tcp.stream == 16
323   8.272577 65.113.31.153 -> 192.168.42.196 TCP 1314 [TCP segment of a reassembled PDU]  tcp.stream == 19
324   8.272598 192.168.42.196 -> 65.113.31.153 TCP 54 39471 > http [ACK] Seq=375 Ack=1261 Win=17152 Len=0  tcp.stream == 19
325   8.272657 65.113.31.153 -> 192.168.42.196 TCP 1314 [TCP segment of a reassembled PDU]  tcp.stream == 19
326   8.272662 192.168.42.196 -> 65.113.31.153 TCP 54 39471 > http [ACK] Seq=375 Ack=2521 Win=19712 Len=0  tcp.stream == 19
327   8.282962 65.113.31.153 -> 192.168.42.196 TCP 1314 [TCP segment of a reassembled PDU]  tcp.stream == 19
328   8.282999 192.168.42.196 -> 65.113.31.153 TCP 54 39471 > http [ACK] Seq=375 Ack=3781 Win=22272 Len=0  tcp.stream == 19
329   8.283013 65.113.31.153 -> 192.168.42.196 TCP 1314 [TCP segment of a reassembled PDU]  tcp.stream == 19
330   8.283016 192.168.42.196 -> 65.113.31.153 TCP 54 39471 > http [ACK] Seq=375 Ack=5041 Win=24704 Len=0  tcp.stream == 19
331   8.283019 65.113.31.153 -> 192.168.42.196 HTTP 414 HTTP/1.1 200 OK  (GIF87a)  tcp.stream == 19
332   8.283039 192.168.42.196 -> 65.113.31.153 TCP 54 39471 > http [ACK] Seq=375 Ack=5401 Win=27264 Len=0  tcp.stream == 19
333   8.283044 65.113.31.153 -> 192.168.42.196 TCP 1314 [TCP segment of a reassembled PDU]  tcp.stream == 20
334   8.283052 192.168.42.196 -> 65.113.31.153 TCP 54 39472 > http [ACK] Seq=374 Ack=1261 Win=17152 Len=0  tcp.stream == 20
335   8.293698 65.113.31.153 -> 192.168.42.196 TCP 1314 [TCP segment of a reassembled PDU]  tcp.stream == 20
336   8.293717 192.168.42.196 -> 65.113.31.153 TCP 54 39472 > http [ACK] Seq=374 Ack=2521 Win=19712 Len=0  tcp.stream == 20
337   8.293725 65.113.31.153 -> 192.168.42.196 HTTP 353 HTTP/1.1 200 OK  (GIF87a)  tcp.stream == 20
338   8.293727 192.168.42.196 -> 65.113.31.153 TCP 54 39472 > http [ACK] Seq=374 Ack=2820 Win=22272 Len=0  tcp.stream == 20
339   8.301952 202.72.53.63 -> 192.168.42.196 HTTP 564 HTTP/1.1 200 OK  (text/css)  tcp.stream == 5
340   8.302107 192.168.42.196 -> 202.72.53.63 HTTP 399 GET /com/js/d/rjs/rjs_slideshow.min.js HTTP/1.1   tcp.stream == 5
341   8.332192 65.113.31.144 -> 192.168.42.196 HTTP 915 HTTP/1.1 200 OK  (application/javascript)  tcp.stream == 13
342   8.332380 192.168.42.196 -> 65.113.31.144 HTTP 477 GET /com/img/thumb/200309/message/flash/201008/20100412_food_shipping_195x60.jpg HTTP/1.1   tcp.stream == 13
343   8.363697 65.113.31.144 -> 192.168.42.196 TCP 1314 [TCP segment of a reassembled PDU]  tcp.stream == 14
344   8.363717 65.113.31.144 -> 192.168.42.196 TCP 1314 [TCP segment of a reassembled PDU]  tcp.stream == 14
345   8.363724 192.168.42.196 -> 65.113.31.144 TCP 54 41778 > http [ACK] Seq=1168 Ack=7936 Win=30848 Len=0  tcp.stream == 14
346   8.385952 65.113.31.144 -> 192.168.42.196 TCP 1314 [TCP segment of a reassembled PDU]  tcp.stream == 14
347   8.385966 65.113.31.144 -> 192.168.42.196 TCP 1314 [TCP segment of a reassembled PDU]  tcp.stream == 14
348   8.385972 192.168.42.196 -> 65.113.31.144 TCP 54 41778 > http [ACK] Seq=1168 Ack=10456 Win=35840 Len=0  tcp.stream == 14
349   8.385978 65.113.31.144 -> 192.168.42.196 TCP 1314 [TCP segment of a reassembled PDU]  tcp.stream == 14
350   8.386034 65.113.31.144 -> 192.168.42.196 TCP 1314 [TCP segment of a reassembled PDU]  tcp.stream == 14
351   8.386039 192.168.42.196 -> 65.113.31.144 TCP 54 41778 > http [ACK] Seq=1168 Ack=12976 Win=40960 Len=0  tcp.stream == 14
352   8.386042 65.113.31.144 -> 192.168.42.196 TCP 1314 [TCP segment of a reassembled PDU]  tcp.stream == 14
353   8.404301 65.113.31.144 -> 192.168.42.196 TCP 1314 [TCP segment of a reassembled PDU]  tcp.stream == 14
