  3   0.360538 192.168.42.196 -> 220.181.138.59 TCP 74 55163 > http [SYN] Seq=0 Win=14600 Len=0 MSS=1460 SACK_PERM=1 TSval=43020178 TSecr=0 WS=128  tcp.stream == 0
  6   0.611469 192.168.42.196 -> 125.39.127.22 TCP 74 58472 > http [SYN] Seq=0 Win=14600 Len=0 MSS=1460 SACK_PERM=1 TSval=43020241 TSecr=0 WS=128  tcp.stream == 1
  7   0.681114 220.181.138.59 -> 192.168.42.196 TCP 66 http > 55163 [SYN, ACK] Seq=0 Ack=1 Win=65535 Len=0 MSS=1260 WS=4 SACK_PERM=1  tcp.stream == 0
  8   0.681141 192.168.42.196 -> 220.181.138.59 TCP 54 55163 > http [ACK] Seq=1 Ack=1 Win=14720 Len=0  tcp.stream == 0
  9   0.681208 192.168.42.196 -> 220.181.138.59 HTTP 342 GET / HTTP/1.1   tcp.stream == 0
 10   1.113751 125.39.127.22 -> 192.168.42.196 TCP 66 http > 58472 [SYN, ACK] Seq=0 Ack=1 Win=65535 Len=0 MSS=1260 WS=4 SACK_PERM=1  tcp.stream == 1
 11   1.113782 192.168.42.196 -> 125.39.127.22 TCP 54 58472 > http [ACK] Seq=1 Ack=1 Win=14720 Len=0  tcp.stream == 1
 12   1.229989 220.181.138.59 -> 192.168.42.196 TCP 54 [TCP Window Update] http > 55163 [ACK] Seq=1 Ack=1 Win=200000 Len=0  tcp.stream == 0
 13   2.141874 125.39.127.22 -> 192.168.42.196 TCP 54 [TCP Window Update] http > 58472 [ACK] Seq=1 Ack=1 Win=200000 Len=0  tcp.stream == 1
 14   2.210108 220.181.138.59 -> 192.168.42.196 TCP 54 http > 55163 [ACK] Seq=1 Ack=289 Win=200000 Len=0  tcp.stream == 0
 15   3.182599 220.181.138.59 -> 192.168.42.196 HTTP 504 HTTP/1.1 302 Moved Temporarily  (text/html)  tcp.stream == 0
 16   3.182616 192.168.42.196 -> 220.181.138.59 TCP 54 55163 > http [ACK] Seq=289 Ack=451 Win=15744 Len=0  tcp.stream == 0
 19   3.272362 192.168.42.196 -> 60.28.14.190 TCP 74 53510 > http [SYN] Seq=0 Win=14600 Len=0 MSS=1460 SACK_PERM=1 TSval=43020906 TSecr=0 WS=128  tcp.stream == 2
 22   3.523176 192.168.42.196 -> 125.39.127.22 TCP 74 58474 > http [SYN] Seq=0 Win=14600 Len=0 MSS=1460 SACK_PERM=1 TSval=43020968 TSecr=0 WS=128  tcp.stream == 3
 23   3.580356 60.28.14.190 -> 192.168.42.196 TCP 66 http > 53510 [SYN, ACK] Seq=0 Ack=1 Win=65535 Len=0 MSS=1260 WS=4 SACK_PERM=1  tcp.stream == 2
 24   3.580384 192.168.42.196 -> 60.28.14.190 TCP 54 53510 > http [ACK] Seq=1 Ack=1 Win=14720 Len=0  tcp.stream == 2
 25   3.580460 192.168.42.196 -> 60.28.14.190 HTTP 346 GET / HTTP/1.1   tcp.stream == 2
 26   3.890329 125.39.127.22 -> 192.168.42.196 TCP 66 http > 58474 [SYN, ACK] Seq=0 Ack=1 Win=65535 Len=0 MSS=1260 WS=4 SACK_PERM=1  tcp.stream == 3
 27   3.890350 192.168.42.196 -> 125.39.127.22 TCP 54 58474 > http [ACK] Seq=1 Ack=1 Win=14720 Len=0  tcp.stream == 3
 28   3.961074 60.28.14.190 -> 192.168.42.196 TCP 54 [TCP Window Update] http > 53510 [ACK] Seq=1 Ack=1 Win=200000 Len=0  tcp.stream == 2
 29   4.702308 125.39.127.22 -> 192.168.42.196 TCP 54 [TCP Window Update] http > 58474 [ACK] Seq=1 Ack=1 Win=200000 Len=0  tcp.stream == 3
 30   4.763560 60.28.14.190 -> 192.168.42.196 TCP 54 http > 53510 [ACK] Seq=1 Ack=293 Win=200000 Len=0  tcp.stream == 2
 31   6.113416 192.168.42.196 -> 125.39.127.22 TCP 54 58472 > http [FIN, ACK] Seq=1 Ack=1 Win=14720 Len=0  tcp.stream == 1
 32   6.389809 125.39.127.22 -> 192.168.42.196 TCP 54 http > 58472 [ACK] Seq=1 Ack=2 Win=200000 Len=0  tcp.stream == 1
 33   6.408672 125.39.127.22 -> 192.168.42.196 TCP 54 http > 58472 [FIN, ACK] Seq=1 Ack=2 Win=200000 Len=0  tcp.stream == 1
 34   6.408688 192.168.42.196 -> 125.39.127.22 TCP 54 58472 > http [ACK] Seq=2 Ack=2 Win=14720 Len=0  tcp.stream == 1
 35   7.928922 60.28.14.190 -> 192.168.42.196 TCP 1314 [TCP segment of a reassembled PDU]  tcp.stream == 2
 36   7.928944 192.168.42.196 -> 60.28.14.190 TCP 54 53510 > http [ACK] Seq=293 Ack=1261 Win=17152 Len=0  tcp.stream == 2
 37   7.938669 60.28.14.190 -> 192.168.42.196 TCP 1314 [TCP segment of a reassembled PDU]  tcp.stream == 2
 38   7.938691 192.168.42.196 -> 60.28.14.190 TCP 54 53510 > http [ACK] Seq=293 Ack=2521 Win=19712 Len=0  tcp.stream == 2
 39   7.938700 60.28.14.190 -> 192.168.42.196 TCP 1314 [TCP segment of a reassembled PDU]  tcp.stream == 2
 40   7.938704 192.168.42.196 -> 60.28.14.190 TCP 54 53510 > http [ACK] Seq=293 Ack=3781 Win=22272 Len=0  tcp.stream == 2
 43   7.949797 60.28.14.190 -> 192.168.42.196 TCP 1314 [TCP segment of a reassembled PDU]  tcp.stream == 2
 44   7.949814 192.168.42.196 -> 60.28.14.190 TCP 54 53510 > http [ACK] Seq=293 Ack=5041 Win=24704 Len=0  tcp.stream == 2
 45   7.958794 60.28.14.190 -> 192.168.42.196 TCP 1314 [TCP segment of a reassembled PDU]  tcp.stream == 2
 46   7.958816 192.168.42.196 -> 60.28.14.190 TCP 54 53510 > http [ACK] Seq=293 Ack=6301 Win=27264 Len=0  tcp.stream == 2
 47   7.958825 60.28.14.190 -> 192.168.42.196 TCP 1314 [TCP segment of a reassembled PDU]  tcp.stream == 2
 48   7.958829 192.168.42.196 -> 60.28.14.190 TCP 54 53510 > http [ACK] Seq=293 Ack=7561 Win=29824 Len=0  tcp.stream == 2
 49   7.978664 60.28.14.190 -> 192.168.42.196 TCP 1314 [TCP segment of a reassembled PDU]  tcp.stream == 2
 50   7.978682 192.168.42.196 -> 60.28.14.190 TCP 54 53510 > http [ACK] Seq=293 Ack=8821 Win=32256 Len=0  tcp.stream == 2
 51   7.980107 192.168.42.196 -> 125.39.127.22 HTTP 354 GET /iskin960/s01/s_1.6.0.css HTTP/1.1   tcp.stream == 3
 52   7.988694 60.28.14.190 -> 192.168.42.196 TCP 1314 [TCP segment of a reassembled PDU]  tcp.stream == 2
 53   7.988715 192.168.42.196 -> 60.28.14.190 TCP 54 53510 > http [ACK] Seq=293 Ack=10081 Win=34816 Len=0  tcp.stream == 2
 54   7.999067 60.28.14.190 -> 192.168.42.196 TCP 1314 [TCP segment of a reassembled PDU]  tcp.stream == 2
 55   7.999085 192.168.42.196 -> 60.28.14.190 TCP 54 53510 > http [ACK] Seq=293 Ack=11341 Win=37376 Len=0  tcp.stream == 2
 56   7.999092 60.28.14.190 -> 192.168.42.196 TCP 1314 [TCP segment of a reassembled PDU]  tcp.stream == 2
 57   7.999095 192.168.42.196 -> 60.28.14.190 TCP 54 53510 > http [ACK] Seq=293 Ack=12601 Win=39808 Len=0  tcp.stream == 2
 58   8.008938 60.28.14.190 -> 192.168.42.196 TCP 1314 [TCP segment of a reassembled PDU]  tcp.stream == 2
 59   8.008956 192.168.42.196 -> 60.28.14.190 TCP 54 53510 > http [ACK] Seq=293 Ack=13861 Win=42368 Len=0  tcp.stream == 2
 60   8.079065 60.28.14.190 -> 192.168.42.196 TCP 1314 [TCP segment of a reassembled PDU]  tcp.stream == 2
 61   8.079082 192.168.42.196 -> 60.28.14.190 TCP 54 53510 > http [ACK] Seq=293 Ack=15121 Win=44928 Len=0  tcp.stream == 2
 62   8.088440 60.28.14.190 -> 192.168.42.196 TCP 1314 [TCP segment of a reassembled PDU]  tcp.stream == 2
 63   8.088460 192.168.42.196 -> 60.28.14.190 TCP 54 53510 > http [ACK] Seq=293 Ack=16381 Win=47360 Len=0  tcp.stream == 2
 64   8.098692 60.28.14.190 -> 192.168.42.196 TCP 1314 [TCP segment of a reassembled PDU]  tcp.stream == 2
 65   8.098713 192.168.42.196 -> 60.28.14.190 TCP 54 53510 > http [ACK] Seq=293 Ack=17641 Win=49920 Len=0  tcp.stream == 2
 66   8.108666 60.28.14.190 -> 192.168.42.196 TCP 1314 [TCP segment of a reassembled PDU]  tcp.stream == 2
 67   8.108689 192.168.42.196 -> 60.28.14.190 TCP 54 53510 > http [ACK] Seq=293 Ack=18901 Win=52480 Len=0  tcp.stream == 2
 69   8.119065 60.28.14.190 -> 192.168.42.196 TCP 1314 [TCP segment of a reassembled PDU]  tcp.stream == 2
 70   8.119086 192.168.42.196 -> 60.28.14.190 TCP 54 53510 > http [ACK] Seq=293 Ack=20161 Win=55040 Len=0  tcp.stream == 2
 71   8.128692 60.28.14.190 -> 192.168.42.196 TCP 1314 [TCP segment of a reassembled PDU]  tcp.stream == 2
 72   8.128712 192.168.42.196 -> 60.28.14.190 TCP 54 53510 > http [ACK] Seq=293 Ack=21421 Win=57472 Len=0  tcp.stream == 2
 73   8.138568 60.28.14.190 -> 192.168.42.196 TCP 1314 [TCP segment of a reassembled PDU]  tcp.stream == 2
 74   8.138588 192.168.42.196 -> 60.28.14.190 TCP 54 53510 > http [ACK] Seq=293 Ack=22681 Win=60032 Len=0  tcp.stream == 2
 75   8.148563 60.28.14.190 -> 192.168.42.196 TCP 1314 [TCP segment of a reassembled PDU]  tcp.stream == 2
 76   8.148583 192.168.42.196 -> 60.28.14.190 TCP 54 53510 > http [ACK] Seq=293 Ack=23941 Win=62592 Len=0  tcp.stream == 2
 77   8.159444 60.28.14.190 -> 192.168.42.196 TCP 1314 [TCP segment of a reassembled PDU]  tcp.stream == 2
 78   8.159462 192.168.42.196 -> 60.28.14.190 TCP 54 53510 > http [ACK] Seq=293 Ack=25201 Win=64128 Len=0  tcp.stream == 2
 79   8.168693 60.28.14.190 -> 192.168.42.196 TCP 1314 [TCP segment of a reassembled PDU]  tcp.stream == 2
 80   8.168714 192.168.42.196 -> 60.28.14.190 TCP 54 53510 > http [ACK] Seq=293 Ack=26461 Win=64128 Len=0  tcp.stream == 2
 81   8.178568 60.28.14.190 -> 192.168.42.196 TCP 1314 [TCP segment of a reassembled PDU]  tcp.stream == 2
 82   8.178588 192.168.42.196 -> 60.28.14.190 TCP 54 53510 > http [ACK] Seq=293 Ack=27721 Win=64128 Len=0  tcp.stream == 2
 83   8.189068 60.28.14.190 -> 192.168.42.196 TCP 1314 [TCP segment of a reassembled PDU]  tcp.stream == 2
 84   8.189085 192.168.42.196 -> 60.28.14.190 TCP 54 53510 > http [ACK] Seq=293 Ack=28981 Win=64128 Len=0  tcp.stream == 2
 85   8.189093 60.28.14.190 -> 192.168.42.196 TCP 1314 [TCP segment of a reassembled PDU]  tcp.stream == 2
 86   8.189096 192.168.42.196 -> 60.28.14.190 TCP 54 53510 > http [ACK] Seq=293 Ack=30241 Win=62976 Len=0  tcp.stream == 2
 87   8.189098 60.28.14.190 -> 192.168.42.196 TCP 1314 [TCP segment of a reassembled PDU]  tcp.stream == 2
 88   8.208537 60.28.14.190 -> 192.168.42.196 TCP 1314 [TCP segment of a reassembled PDU]  tcp.stream == 2
 89   8.208554 192.168.42.196 -> 60.28.14.190 TCP 54 53510 > http [ACK] Seq=293 Ack=32761 Win=64128 Len=0  tcp.stream == 2
 90   8.211081 192.168.42.196 -> 60.28.14.190 TCP 74 53512 > http [SYN] Seq=0 Win=14600 Len=0 MSS=1460 SACK_PERM=1 TSval=43022140 TSecr=0 WS=128  tcp.stream == 4
 91   8.211122 192.168.42.196 -> 60.28.14.190 TCP 74 53513 > http [SYN] Seq=0 Win=14600 Len=0 MSS=1460 SACK_PERM=1 TSval=43022140 TSecr=0 WS=128  tcp.stream == 5
 92   8.219685 60.28.14.190 -> 192.168.42.196 TCP 1314 [TCP segment of a reassembled PDU]  tcp.stream == 2
 93   8.219701 60.28.14.190 -> 192.168.42.196 TCP 1314 [TCP segment of a reassembled PDU]  tcp.stream == 2
 94   8.219763 192.168.42.196 -> 60.28.14.190 TCP 54 53510 > http [ACK] Seq=293 Ack=35281 Win=64128 Len=0  tcp.stream == 2
 96   8.239566 60.28.14.190 -> 192.168.42.196 TCP 1314 [TCP segment of a reassembled PDU]  tcp.stream == 2
 97   8.239585 60.28.14.190 -> 192.168.42.196 TCP 1314 [TCP segment of a reassembled PDU]  tcp.stream == 2
 98   8.239662 192.168.42.196 -> 60.28.14.190 TCP 54 53510 > http [ACK] Seq=293 Ack=37801 Win=64128 Len=0  tcp.stream == 2
 99   8.248440 60.28.14.190 -> 192.168.42.196 TCP 1314 [TCP segment of a reassembled PDU]  tcp.stream == 2
100   8.269812 60.28.14.190 -> 192.168.42.196 TCP 1314 [TCP segment of a reassembled PDU]  tcp.stream == 2
101   8.269829 192.168.42.196 -> 60.28.14.190 TCP 54 53510 > http [ACK] Seq=293 Ack=40321 Win=64128 Len=0  tcp.stream == 2
103   8.281063 60.28.14.190 -> 192.168.42.196 TCP 1314 [TCP segment of a reassembled PDU]  tcp.stream == 2
104   8.289819 60.28.14.190 -> 192.168.42.196 TCP 1314 [TCP segment of a reassembled PDU]  tcp.stream == 2
105   8.289836 192.168.42.196 -> 60.28.14.190 TCP 54 53510 > http [ACK] Seq=293 Ack=42841 Win=64128 Len=0  tcp.stream == 2
106   8.289844 60.28.14.190 -> 192.168.42.196 TCP 1314 [TCP segment of a reassembled PDU]  tcp.stream == 2
108   8.301063 60.28.14.190 -> 192.168.42.196 TCP 1314 [TCP segment of a reassembled PDU]  tcp.stream == 2
109   8.301085 192.168.42.196 -> 60.28.14.190 TCP 54 53510 > http [ACK] Seq=293 Ack=45361 Win=64128 Len=0  tcp.stream == 2
110   8.311410 60.28.14.190 -> 192.168.42.196 TCP 1314 [TCP segment of a reassembled PDU]  tcp.stream == 2
111   8.321656 60.28.14.190 -> 192.168.42.196 TCP 1314 [TCP segment of a reassembled PDU]  tcp.stream == 2
112   8.321673 192.168.42.196 -> 60.28.14.190 TCP 54 53510 > http [ACK] Seq=293 Ack=47881 Win=64128 Len=0  tcp.stream == 2
113   8.331652 125.39.127.22 -> 192.168.42.196 TCP 1314 [TCP segment of a reassembled PDU]  tcp.stream == 3
114   8.331671 192.168.42.196 -> 125.39.127.22 TCP 54 58474 > http [ACK] Seq=301 Ack=1261 Win=17152 Len=0  tcp.stream == 3
115   8.340940 125.39.127.22 -> 192.168.42.196 HTTP 726 HTTP/1.1 200 OK  (text/css)  tcp.stream == 3
116   8.340956 192.168.42.196 -> 125.39.127.22 TCP 54 58474 > http [ACK] Seq=301 Ack=1933 Win=19712 Len=0  tcp.stream == 3
117   8.340963 60.28.14.190 -> 192.168.42.196 TCP 1314 [TCP segment of a reassembled PDU]  tcp.stream == 2
119   8.341086 192.168.42.196 -> 125.39.127.22 HTTP 338 GET /js/ping_qqcom_v2.1.9.js HTTP/1.1   tcp.stream == 3
122   8.341289 192.168.42.196 -> 125.39.127.42 TCP 74 46276 > http [SYN] Seq=0 Win=14600 Len=0 MSS=1460 SACK_PERM=1 TSval=43022173 TSecr=0 WS=128  tcp.stream == 6
123   8.341317 192.168.42.196 -> 125.39.127.42 TCP 74 46277 > http [SYN] Seq=0 Win=14600 Len=0 MSS=1460 SACK_PERM=1 TSval=43022173 TSecr=0 WS=128  tcp.stream == 7
124   8.341341 192.168.42.196 -> 125.39.127.42 TCP 74 46278 > http [SYN] Seq=0 Win=14600 Len=0 MSS=1460 SACK_PERM=1 TSval=43022173 TSecr=0 WS=128  tcp.stream == 8
125   8.341362 192.168.42.196 -> 125.39.127.42 TCP 74 46279 > http [SYN] Seq=0 Win=14600 Len=0 MSS=1460 SACK_PERM=1 TSval=43022173 TSecr=0 WS=128  tcp.stream == 9
126   8.341396 192.168.42.196 -> 125.39.127.42 TCP 74 46280 > http [SYN] Seq=0 Win=14600 Len=0 MSS=1460 SACK_PERM=1 TSval=43022173 TSecr=0 WS=128  tcp.stream == 10
127   8.341422 192.168.42.196 -> 125.39.127.42 TCP 74 46281 > http [SYN] Seq=0 Win=14600 Len=0 MSS=1460 SACK_PERM=1 TSval=43022173 TSecr=0 WS=128  tcp.stream == 11
128   8.359192 60.28.14.190 -> 192.168.42.196 TCP 1314 [TCP segment of a reassembled PDU]  tcp.stream == 2
129   8.359214 192.168.42.196 -> 60.28.14.190 TCP 54 53510 > http [ACK] Seq=293 Ack=50401 Win=64128 Len=0  tcp.stream == 2
130   8.359221 60.28.14.190 -> 192.168.42.196 TCP 1314 [TCP segment of a reassembled PDU]  tcp.stream == 2
131   8.369063 60.28.14.190 -> 192.168.42.196 TCP 1314 [TCP segment of a reassembled PDU]  tcp.stream == 2
132   8.369083 192.168.42.196 -> 60.28.14.190 TCP 54 53510 > http [ACK] Seq=293 Ack=52921 Win=64128 Len=0  tcp.stream == 2
133   8.379450 60.28.14.190 -> 192.168.42.196 TCP 1314 [TCP segment of a reassembled PDU]  tcp.stream == 2
134   8.388563 60.28.14.190 -> 192.168.42.196 TCP 1314 [TCP segment of a reassembled PDU]  tcp.stream == 2
135   8.388583 192.168.42.196 -> 60.28.14.190 TCP 54 53510 > http [ACK] Seq=293 Ack=55441 Win=64128 Len=0  tcp.stream == 2
136   8.420445 60.28.14.190 -> 192.168.42.196 TCP 1314 [TCP segment of a reassembled PDU]  tcp.stream == 2
137   8.420465 60.28.14.190 -> 192.168.42.196 TCP 1314 [TCP segment of a reassembled PDU]  tcp.stream == 2
138   8.420468 60.28.14.190 -> 192.168.42.196 TCP 1314 [TCP segment of a reassembled PDU]  tcp.stream == 2
139   8.420548 192.168.42.196 -> 60.28.14.190 TCP 54 53510 > http [ACK] Seq=293 Ack=59221 Win=64128 Len=0  tcp.stream == 2
140   8.428659 60.28.14.190 -> 192.168.42.196 TCP 1314 [TCP segment of a reassembled PDU]  tcp.stream == 2
141   8.428768 60.28.14.190 -> 192.168.42.196 TCP 1314 [TCP segment of a reassembled PDU]  tcp.stream == 2
142   8.428779 192.168.42.196 -> 60.28.14.190 TCP 54 53510 > http [ACK] Seq=293 Ack=61741 Win=64128 Len=0  tcp.stream == 2
143   8.445689 60.28.14.190 -> 192.168.42.196 TCP 1314 [TCP segment of a reassembled PDU]  tcp.stream == 2
144   8.445705 60.28.14.190 -> 192.168.42.196 TCP 1314 [TCP segment of a reassembled PDU]  tcp.stream == 2
145   8.445707 60.28.14.190 -> 192.168.42.196 TCP 1314 [TCP segment of a reassembled PDU]  tcp.stream == 2
146   8.445765 60.28.14.190 -> 192.168.42.196 TCP 1314 [TCP segment of a reassembled PDU]  tcp.stream == 2
147   8.445805 192.168.42.196 -> 60.28.14.190 TCP 54 53510 > http [ACK] Seq=293 Ack=66781 Win=64128 Len=0  tcp.stream == 2
148   8.460605 192.168.42.196 -> 125.39.127.22 TCP 74 58483 > http [SYN] Seq=0 Win=14600 Len=0 MSS=1460 SACK_PERM=1 TSval=43022203 TSecr=0 WS=128  tcp.stream == 12
149   8.460644 192.168.42.196 -> 125.39.127.22 TCP 74 58484 > http [SYN] Seq=0 Win=14600 Len=0 MSS=1460 SACK_PERM=1 TSval=43022203 TSecr=0 WS=128  tcp.stream == 13
150   8.469908 60.28.14.190 -> 192.168.42.196 TCP 1314 [TCP segment of a reassembled PDU]  tcp.stream == 2
151   8.470029 60.28.14.190 -> 192.168.42.196 HTTP 798 HTTP/1.1 200 OK  (text/html)  tcp.stream == 2
152   8.470040 192.168.42.196 -> 60.28.14.190 TCP 54 53510 > http [ACK] Seq=293 Ack=68785 Win=64128 Len=0  tcp.stream == 2
153   8.470046 60.28.14.190 -> 192.168.42.196 TCP 66 http > 53512 [SYN, ACK] Seq=0 Ack=1 Win=65535 Len=0 MSS=1260 WS=4 SACK_PERM=1  tcp.stream == 4
154   8.470056 192.168.42.196 -> 60.28.14.190 TCP 54 53512 > http [ACK] Seq=1 Ack=1 Win=14720 Len=0  tcp.stream == 4
155   8.470059 60.28.14.190 -> 192.168.42.196 TCP 66 http > 53513 [SYN, ACK] Seq=0 Ack=1 Win=65535 Len=0 MSS=1260 WS=4 SACK_PERM=1  tcp.stream == 5
156   8.470063 192.168.42.196 -> 60.28.14.190 TCP 54 53513 > http [ACK] Seq=1 Ack=1 Win=14720 Len=0  tcp.stream == 5
158   8.470105 192.168.42.196 -> 60.28.14.190 HTTP 338 GET /js/smart_for_qq_v3.1.js HTTP/1.1   tcp.stream == 2
163   8.470776 192.168.42.196 -> 125.39.200.23 TCP 74 60249 > http [SYN] Seq=0 Win=14600 Len=0 MSS=1460 SACK_PERM=1 TSval=43022205 TSecr=0 WS=128  tcp.stream == 14
164   8.470812 192.168.42.196 -> 125.39.200.23 TCP 74 60250 > http [SYN] Seq=0 Win=14600 Len=0 MSS=1460 SACK_PERM=1 TSval=43022205 TSecr=0 WS=128  tcp.stream == 15
165   8.470834 192.168.42.196 -> 125.39.200.23 TCP 74 60251 > http [SYN] Seq=0 Win=14600 Len=0 MSS=1460 SACK_PERM=1 TSval=43022205 TSecr=0 WS=128  tcp.stream == 16
166   8.470857 192.168.42.196 -> 125.39.200.23 TCP 74 60252 > http [SYN] Seq=0 Win=14600 Len=0 MSS=1460 SACK_PERM=1 TSval=43022205 TSecr=0 WS=128  tcp.stream == 17
167   8.470881 192.168.42.196 -> 125.39.200.23 TCP 74 60253 > http [SYN] Seq=0 Win=14600 Len=0 MSS=1460 SACK_PERM=1 TSval=43022205 TSecr=0 WS=128  tcp.stream == 18
168   8.470903 192.168.42.196 -> 125.39.200.23 TCP 74 60254 > http [SYN] Seq=0 Win=14600 Len=0 MSS=1460 SACK_PERM=1 TSval=43022205 TSecr=0 WS=128  tcp.stream == 19
173   8.471329 192.168.42.196 -> 184.105.67.90 TCP 74 43834 > http [SYN] Seq=0 Win=14600 Len=0 MSS=1460 SACK_PERM=1 TSval=43022205 TSecr=0 WS=128  tcp.stream == 20
175   8.471516 192.168.42.196 -> 204.245.34.168 TCP 74 53351 > http [SYN] Seq=0 Win=14600 Len=0 MSS=1460 SACK_PERM=1 TSval=43022206 TSecr=0 WS=128  tcp.stream == 21
176   8.471568 192.168.42.196 -> 125.39.127.37 TCP 74 57561 > http [SYN] Seq=0 Win=14600 Len=0 MSS=1460 SACK_PERM=1 TSval=43022206 TSecr=0 WS=128  tcp.stream == 22
177   8.471607 192.168.42.196 -> 125.39.127.37 TCP 74 57562 > http [SYN] Seq=0 Win=14600 Len=0 MSS=1460 SACK_PERM=1 TSval=43022206 TSecr=0 WS=128  tcp.stream == 23
178   8.471629 192.168.42.196 -> 125.39.127.37 TCP 74 57563 > http [SYN] Seq=0 Win=14600 Len=0 MSS=1460 SACK_PERM=1 TSval=43022206 TSecr=0 WS=128  tcp.stream == 24
179   8.488194 125.39.127.42 -> 192.168.42.196 TCP 66 http > 46276 [SYN, ACK] Seq=0 Ack=1 Win=65535 Len=0 MSS=1260 WS=4 SACK_PERM=1  tcp.stream == 6
180   8.488221 192.168.42.196 -> 125.39.127.42 TCP 54 46276 > http [ACK] Seq=1 Ack=1 Win=14720 Len=0  tcp.stream == 6
181   8.488228 125.39.127.22 -> 192.168.42.196 TCP 1314 [TCP segment of a reassembled PDU]  tcp.stream == 3
182   8.488235 125.39.127.22 -> 192.168.42.196 HTTP 1179 HTTP/1.1 200 OK  (application/x-javascript)  tcp.stream == 3
183   8.488237 192.168.42.196 -> 125.39.127.22 TCP 54 58474 > http [ACK] Seq=585 Ack=4318 Win=24704 Len=0  tcp.stream == 3
184   8.488238 125.39.127.42 -> 192.168.42.196 TCP 66 http > 46277 [SYN, ACK] Seq=0 Ack=1 Win=65535 Len=0 MSS=1260 WS=4 SACK_PERM=1  tcp.stream == 7
185   8.488241 192.168.42.196 -> 125.39.127.42 TCP 54 46277 > http [ACK] Seq=1 Ack=1 Win=14720 Len=0  tcp.stream == 7
186   8.488243 125.39.127.42 -> 192.168.42.196 TCP 66 http > 46278 [SYN, ACK] Seq=0 Ack=1 Win=65535 Len=0 MSS=1260 WS=4 SACK_PERM=1  tcp.stream == 8
187   8.488246 192.168.42.196 -> 125.39.127.42 TCP 54 46278 > http [ACK] Seq=1 Ack=1 Win=14720 Len=0  tcp.stream == 8
188   8.488247 125.39.127.42 -> 192.168.42.196 TCP 66 http > 46279 [SYN, ACK] Seq=0 Ack=1 Win=65535 Len=0 MSS=1260 WS=4 SACK_PERM=1  tcp.stream == 9
189   8.488250 192.168.42.196 -> 125.39.127.42 TCP 54 46279 > http [ACK] Seq=1 Ack=1 Win=14720 Len=0  tcp.stream == 9
190   8.488371 192.168.42.196 -> 125.39.127.42 HTTP 341 GET /www/icon/favicon2.ico HTTP/1.1   tcp.stream == 6
191   8.488435 192.168.42.196 -> 125.39.127.42 HTTP 375 GET /www/iskin960/qqcomlogo.png HTTP/1.1   tcp.stream == 7
192   8.488446 192.168.42.196 -> 125.39.127.42 HTTP 375 GET /www/iskin960/logo_soso.png HTTP/1.1   tcp.stream == 8
193   8.488463 192.168.42.196 -> 125.39.127.42 HTTP 345 GET /tech/js/ipad/iscroll_v2.js HTTP/1.1   tcp.stream == 9
194   8.495037 125.39.127.42 -> 192.168.42.196 TCP 66 http > 46280 [SYN, ACK] Seq=0 Ack=1 Win=65535 Len=0 MSS=1260 WS=4 SACK_PERM=1  tcp.stream == 10
195   8.495063 192.168.42.196 -> 125.39.127.42 TCP 54 46280 > http [ACK] Seq=1 Ack=1 Win=14720 Len=0  tcp.stream == 10
196   8.495070 125.39.127.42 -> 192.168.42.196 TCP 66 http > 46281 [SYN, ACK] Seq=0 Ack=1 Win=65535 Len=0 MSS=1260 WS=4 SACK_PERM=1  tcp.stream == 11
197   8.495073 192.168.42.196 -> 125.39.127.42 TCP 54 46281 > http [ACK] Seq=1 Ack=1 Win=14720 Len=0  tcp.stream == 11
198   8.495153 192.168.42.196 -> 125.39.127.42 HTTP 380 GET /finance/02012yzw/2012021511.jpg HTTP/1.1   tcp.stream == 10
199   8.495172 192.168.42.196 -> 125.39.127.42 HTTP 378 GET /www/guirenniao/guirenniao.png HTTP/1.1   tcp.stream == 11
201   8.518853 192.168.42.196 -> 125.39.127.34 TCP 74 57032 > http [SYN] Seq=0 Win=14600 Len=0 MSS=1460 SACK_PERM=1 TSval=43022217 TSecr=0 WS=128  tcp.stream == 25
202   8.518895 192.168.42.196 -> 125.39.127.34 TCP 74 57033 > http [SYN] Seq=0 Win=14600 Len=0 MSS=1460 SACK_PERM=1 TSval=43022217 TSecr=0 WS=128  tcp.stream == 26
203   8.518921 192.168.42.196 -> 125.39.127.34 TCP 74 57034 > http [SYN] Seq=0 Win=14600 Len=0 MSS=1460 SACK_PERM=1 TSval=43022217 TSecr=0 WS=128  tcp.stream == 27
204   8.518947 192.168.42.196 -> 125.39.127.34 TCP 74 57035 > http [SYN] Seq=0 Win=14600 Len=0 MSS=1460 SACK_PERM=1 TSval=43022217 TSecr=0 WS=128  tcp.stream == 28
205   8.588442 125.39.127.22 -> 192.168.42.196 TCP 66 http > 58484 [SYN, ACK] Seq=0 Ack=1 Win=65535 Len=0 MSS=1260 WS=4 SACK_PERM=1  tcp.stream == 13
206   8.588466 192.168.42.196 -> 125.39.127.22 TCP 54 58484 > http [ACK] Seq=1 Ack=1 Win=14720 Len=0  tcp.stream == 13
207   8.588473 125.39.127.22 -> 192.168.42.196 TCP 66 http > 58483 [SYN, ACK] Seq=0 Ack=1 Win=65535 Len=0 MSS=1260 WS=4 SACK_PERM=1  tcp.stream == 12
208   8.588477 192.168.42.196 -> 125.39.127.22 TCP 54 58483 > http [ACK] Seq=1 Ack=1 Win=14720 Len=0  tcp.stream == 12
209   8.598327 60.28.14.190 -> 192.168.42.196 TCP 54 [TCP Window Update] http > 53512 [ACK] Seq=1 Ack=1 Win=200000 Len=0  tcp.stream == 4
210   8.598340 60.28.14.190 -> 192.168.42.196 TCP 54 [TCP Window Update] http > 53513 [ACK] Seq=1 Ack=1 Win=200000 Len=0  tcp.stream == 5
211   8.620305 125.39.200.23 -> 192.168.42.196 TCP 66 http > 60249 [SYN, ACK] Seq=0 Ack=1 Win=65535 Len=0 MSS=1260 WS=4 SACK_PERM=1  tcp.stream == 14
212   8.620334 192.168.42.196 -> 125.39.200.23 TCP 54 60249 > http [ACK] Seq=1 Ack=1 Win=14720 Len=0  tcp.stream == 14
213   8.620397 60.28.14.190 -> 192.168.42.196 TCP 1314 [TCP segment of a reassembled PDU]  tcp.stream == 2
214   8.620406 60.28.14.190 -> 192.168.42.196 HTTP 1175 HTTP/1.1 200 OK  (application/x-javascript)  tcp.stream == 2
215   8.620419 192.168.42.196 -> 125.39.200.23 HTTP 384 GET /www/pics/hv1/22/42/659/42862207.gif HTTP/1.1   tcp.stream == 14
216   8.620450 192.168.42.196 -> 60.28.14.190 TCP 54 53510 > http [ACK] Seq=577 Ack=71166 Win=64128 Len=0  tcp.stream == 2
217   8.620522 125.39.200.23 -> 192.168.42.196 TCP 66 http > 60250 [SYN, ACK] Seq=0 Ack=1 Win=65535 Len=0 MSS=1260 WS=4 SACK_PERM=1  tcp.stream == 15
218   8.620531 192.168.42.196 -> 125.39.200.23 TCP 54 60250 > http [ACK] Seq=1 Ack=1 Win=14720 Len=0  tcp.stream == 15
219   8.620561 192.168.42.196 -> 125.39.200.23 HTTP 384 GET /v/pics/hv1/140/205/975/63451790.jpg HTTP/1.1   tcp.stream == 15
220   8.628656 125.39.200.23 -> 192.168.42.196 TCP 66 http > 60251 [SYN, ACK] Seq=0 Ack=1 Win=65535 Len=0 MSS=1260 WS=4 SACK_PERM=1  tcp.stream == 16
221   8.628680 192.168.42.196 -> 125.39.200.23 TCP 54 60251 > http [ACK] Seq=1 Ack=1 Win=14720 Len=0  tcp.stream == 16
222   8.628766 192.168.42.196 -> 125.39.200.23 HTTP 386 GET /news/pics/hv1/17/148/975/63437132.jpg HTTP/1.1   tcp.stream == 16
223   8.628777 125.39.200.23 -> 192.168.42.196 TCP 66 http > 60252 [SYN, ACK] Seq=0 Ack=1 Win=65535 Len=0 MSS=1260 WS=4 SACK_PERM=1  tcp.stream == 17
224   8.628783 192.168.42.196 -> 125.39.200.23 TCP 54 60252 > http [ACK] Seq=1 Ack=1 Win=14720 Len=0  tcp.stream == 17
225   8.628787 125.39.200.23 -> 192.168.42.196 TCP 66 http > 60254 [SYN, ACK] Seq=0 Ack=1 Win=65535 Len=0 MSS=1260 WS=4 SACK_PERM=1  tcp.stream == 19
226   8.628791 192.168.42.196 -> 125.39.200.23 TCP 54 60254 > http [ACK] Seq=1 Ack=1 Win=14720 Len=0  tcp.stream == 19
227   8.628794 125.39.200.23 -> 192.168.42.196 TCP 66 http > 60253 [SYN, ACK] Seq=0 Ack=1 Win=65535 Len=0 MSS=1260 WS=4 SACK_PERM=1  tcp.stream == 18
228   8.628798 192.168.42.196 -> 125.39.200.23 TCP 54 60253 > http [ACK] Seq=1 Ack=1 Win=14720 Len=0  tcp.stream == 18
229   8.628801 184.105.67.90 -> 192.168.42.196 TCP 66 http > 43834 [SYN, ACK] Seq=0 Ack=1 Win=65535 Len=0 MSS=1260 WS=4 SACK_PERM=1  tcp.stream == 20
230   8.628805 192.168.42.196 -> 184.105.67.90 TCP 54 43834 > http [ACK] Seq=1 Ack=1 Win=14720 Len=0  tcp.stream == 20
231   8.628808 192.168.42.196 -> 125.39.200.23 HTTP 385 GET /news/pics/hv1/97/18/975/63404062.jpg HTTP/1.1   tcp.stream == 17
232   8.628828 192.168.42.196 -> 125.39.200.23 HTTP 385 GET /news/pics/hv1/98/18/975/63404063.jpg HTTP/1.1   tcp.stream == 18
233   8.628839 192.168.42.196 -> 125.39.200.23 HTTP 389 GET /sports/pics/hv1/185/204/975/63451580.jpg HTTP/1.1   tcp.stream == 19
234   8.628862 192.168.42.196 -> 184.105.67.90 HTTP 364 GET /web/crystal/v1.5Beta03Build035/crystal-min.js HTTP/1.1   tcp.stream == 20
235   8.639558 204.245.34.168 -> 192.168.42.196 TCP 66 http > 53351 [SYN, ACK] Seq=0 Ack=1 Win=65535 Len=0 MSS=1260 WS=4 SACK_PERM=1  tcp.stream == 21
236   8.639581 192.168.42.196 -> 204.245.34.168 TCP 54 53351 > http [ACK] Seq=1 Ack=1 Win=14720 Len=0  tcp.stream == 21
237   8.639673 125.39.127.37 -> 192.168.42.196 TCP 66 http > 57562 [SYN, ACK] Seq=0 Ack=1 Win=65535 Len=0 MSS=1260 WS=4 SACK_PERM=1  tcp.stream == 23
238   8.639681 192.168.42.196 -> 125.39.127.37 TCP 54 57562 > http [ACK] Seq=1 Ack=1 Win=14720 Len=0  tcp.stream == 23
239   8.639685 125.39.127.37 -> 192.168.42.196 TCP 66 http > 57561 [SYN, ACK] Seq=0 Ack=1 Win=65535 Len=0 MSS=1260 WS=4 SACK_PERM=1  tcp.stream == 22
240   8.639685 192.168.42.196 -> 204.245.34.168 HTTP 385 GET /qqlive/images/20120216/i1329354661_1.jpg HTTP/1.1   tcp.stream == 21
241   8.639690 192.168.42.196 -> 125.39.127.37 TCP 54 57561 > http [ACK] Seq=1 Ack=1 Win=14720 Len=0  tcp.stream == 22
242   8.639693 125.39.127.42 -> 192.168.42.196 TCP 54 [TCP Window Update] http > 46276 [ACK] Seq=1 Ack=1 Win=200000 Len=0  tcp.stream == 6
243   8.639698 125.39.127.37 -> 192.168.42.196 TCP 66 http > 57563 [SYN, ACK] Seq=0 Ack=1 Win=65535 Len=0 MSS=1260 WS=4 SACK_PERM=1  tcp.stream == 24
244   8.639702 192.168.42.196 -> 125.39.127.37 TCP 54 57563 > http [ACK] Seq=1 Ack=1 Win=14720 Len=0  tcp.stream == 24
245   8.639705 125.39.127.42 -> 192.168.42.196 TCP 54 [TCP Window Update] http > 46277 [ACK] Seq=1 Ack=1 Win=200000 Len=0  tcp.stream == 7
246   8.639707 125.39.127.42 -> 192.168.42.196 TCP 54 [TCP Window Update] http > 46278 [ACK] Seq=1 Ack=1 Win=200000 Len=0  tcp.stream == 8
247   8.639730 192.168.42.196 -> 125.39.127.37 HTTP 373 GET /ent/pics/16720/16720686.gif HTTP/1.1   tcp.stream == 22
248   8.639744 192.168.42.196 -> 125.39.127.37 HTTP 369 GET /www/pics/816/816587.gif HTTP/1.1   tcp.stream == 23
249   8.639752 192.168.42.196 -> 125.39.127.37 HTTP 371 GET /www/pics/6743/6743671.jpg HTTP/1.1   tcp.stream == 24
250   8.639768 125.39.127.42 -> 192.168.42.196 TCP 54 [TCP Window Update] http > 46279 [ACK] Seq=1 Ack=1 Win=200000 Len=0  tcp.stream == 9
251   8.649433 125.39.127.42 -> 192.168.42.196 TCP 1314 [TCP segment of a reassembled PDU]  tcp.stream == 6
252   8.649452 192.168.42.196 -> 125.39.127.42 TCP 54 46276 > http [ACK] Seq=288 Ack=1261 Win=17152 Len=0  tcp.stream == 6
253   8.658802 125.39.127.42 -> 192.168.42.196 TCP 1314 [TCP segment of a reassembled PDU]  tcp.stream == 6
254   8.658821 192.168.42.196 -> 125.39.127.42 TCP 54 46276 > http [ACK] Seq=288 Ack=2521 Win=19712 Len=0  tcp.stream == 6
255   8.658829 125.39.127.42 -> 192.168.42.196 TCP 1314 [TCP segment of a reassembled PDU]  tcp.stream == 6
256   8.658832 192.168.42.196 -> 125.39.127.42 TCP 54 46276 > http [ACK] Seq=288 Ack=3781 Win=22272 Len=0  tcp.stream == 6
257   8.670063 125.39.127.42 -> 192.168.42.196 TCP 1314 [TCP segment of a reassembled PDU]  tcp.stream == 6
258   8.670083 192.168.42.196 -> 125.39.127.42 TCP 54 46276 > http [ACK] Seq=288 Ack=5041 Win=24704 Len=0  tcp.stream == 6
259   8.670090 125.39.127.42 -> 192.168.42.196 HTTP 752 HTTP/1.1 200 OK  (image/x-icon)  tcp.stream == 6
260   8.670093 192.168.42.196 -> 125.39.127.42 TCP 54 46276 > http [ACK] Seq=288 Ack=5739 Win=27264 Len=0  tcp.stream == 6
261   8.670219 192.168.42.196 -> 125.39.127.42 HTTP 363 GET /finance/st/g/fn-smartbox/du_smartbox_1.15.js HTTP/1.1   tcp.stream == 6
262   8.684685 125.39.127.42 -> 192.168.42.196 TCP 1314 [TCP segment of a reassembled PDU]  tcp.stream == 7
263   8.684707 192.168.42.196 -> 125.39.127.42 TCP 54 46277 > http [ACK] Seq=322 Ack=1261 Win=17152 Len=0  tcp.stream == 7
264   8.684766 125.39.127.42 -> 192.168.42.196 TCP 1314 [TCP segment of a reassembled PDU]  tcp.stream == 7
265   8.684770 192.168.42.196 -> 125.39.127.42 TCP 54 46277 > http [ACK] Seq=322 Ack=2521 Win=19712 Len=0  tcp.stream == 7
266   8.684772 125.39.127.42 -> 192.168.42.196 TCP 1314 [TCP segment of a reassembled PDU]  tcp.stream == 7
267   8.684775 192.168.42.196 -> 125.39.127.42 TCP 54 46277 > http [ACK] Seq=322 Ack=3781 Win=22272 Len=0  tcp.stream == 7
268   8.684895 125.39.127.42 -> 192.168.42.196 HTTP 511 HTTP/1.1 200 OK  (PNG)[Malformed Packet]  tcp.stream == 7
269   8.684902 192.168.42.196 -> 125.39.127.42 TCP 54 46277 > http [ACK] Seq=322 Ack=4238 Win=24704 Len=0  tcp.stream == 7
270   8.684953 192.168.42.196 -> 125.39.127.42 HTTP 380 GET /lady/evaliang/2012/2/16/qq1.jpg HTTP/1.1   tcp.stream == 7
271   8.691808 125.39.127.42 -> 192.168.42.196 TCP 1314 [TCP segment of a reassembled PDU]  tcp.stream == 8
272   8.691827 192.168.42.196 -> 125.39.127.42 TCP 54 46278 > http [ACK] Seq=322 Ack=1261 Win=17152 Len=0  tcp.stream == 8
273   8.691835 125.39.127.42 -> 192.168.42.196 HTTP 1254 HTTP/1.1 200 OK  (PNG)[Malformed Packet]  tcp.stream == 8
274   8.691838 192.168.42.196 -> 125.39.127.42 TCP 54 46278 > http [ACK] Seq=322 Ack=2461 Win=19712 Len=0  tcp.stream == 8
275   8.691840 125.39.127.42 -> 192.168.42.196 TCP 54 [TCP Window Update] http > 46280 [ACK] Seq=1 Ack=1 Win=200000 Len=0  tcp.stream == 10
276   8.691843 125.39.127.42 -> 192.168.42.196 TCP 54 [TCP Window Update] http > 46281 [ACK] Seq=1 Ack=1 Win=200000 Len=0  tcp.stream == 11
277   8.691991 192.168.42.196 -> 125.39.127.42 HTTP 391 GET /zonetenpay/images/scale_img/sspp120210.gif HTTP/1.1   tcp.stream == 8
278   8.711408 125.39.127.42 -> 192.168.42.196 TCP 1314 [TCP segment of a reassembled PDU]  tcp.stream == 9
279   8.711431 192.168.42.196 -> 125.39.127.42 TCP 54 46279 > http [ACK] Seq=292 Ack=1261 Win=17152 Len=0  tcp.stream == 9
280   8.711439 125.39.127.42 -> 192.168.42.196 TCP 1314 [TCP segment of a reassembled PDU]  tcp.stream == 9
281   8.711442 192.168.42.196 -> 125.39.127.42 TCP 54 46279 > http [ACK] Seq=292 Ack=2521 Win=19712 Len=0  tcp.stream == 9
282   8.711523 125.39.127.42 -> 192.168.42.196 TCP 1314 [TCP segment of a reassembled PDU]  tcp.stream == 9
283   8.711530 192.168.42.196 -> 125.39.127.42 TCP 54 46279 > http [ACK] Seq=292 Ack=3781 Win=22272 Len=0  tcp.stream == 9
284   8.711533 125.39.127.42 -> 192.168.42.196 TCP 1314 [TCP segment of a reassembled PDU]  tcp.stream == 9
285   8.711535 192.168.42.196 -> 125.39.127.42 TCP 54 46279 > http [ACK] Seq=292 Ack=5041 Win=24704 Len=0  tcp.stream == 9
286   8.720941 125.39.127.42 -> 192.168.42.196 HTTP 1276 HTTP/1.1 200 OK  (application/x-javascript)  tcp.stream == 9
287   8.720961 192.168.42.196 -> 125.39.127.42 TCP 54 46279 > http [ACK] Seq=292 Ack=6263 Win=27264 Len=0  tcp.stream == 9
288   8.720968 125.39.127.34 -> 192.168.42.196 TCP 66 http > 57033 [SYN, ACK] Seq=0 Ack=1 Win=65535 Len=0 MSS=1260 WS=4 SACK_PERM=1  tcp.stream == 26
289   8.720982 192.168.42.196 -> 125.39.127.34 TCP 54 57033 > http [ACK] Seq=1 Ack=1 Win=14720 Len=0  tcp.stream == 26
290   8.720984 125.39.127.34 -> 192.168.42.196 TCP 66 http > 57032 [SYN, ACK] Seq=0 Ack=1 Win=65535 Len=0 MSS=1260 WS=4 SACK_PERM=1  tcp.stream == 25
291   8.720987 192.168.42.196 -> 125.39.127.34 TCP 54 57032 > http [ACK] Seq=1 Ack=1 Win=14720 Len=0  tcp.stream == 25
292   8.721016 125.39.127.42 -> 192.168.42.196 TCP 1314 [TCP segment of a reassembled PDU]  tcp.stream == 10
293   8.721020 192.168.42.196 -> 125.39.127.42 TCP 54 46280 > http [ACK] Seq=327 Ack=1261 Win=17152 Len=0  tcp.stream == 10
294   8.721022 125.39.127.42 -> 192.168.42.196 HTTP 822 HTTP/1.1 200 OK  (PNG)[Malformed Packet]  tcp.stream == 11
295   8.721024 192.168.42.196 -> 125.39.127.42 TCP 54 46281 > http [ACK] Seq=325 Ack=769 Win=16256 Len=0  tcp.stream == 11
296   8.721330 192.168.42.196 -> 125.39.127.42 HTTP 377 GET /www/images/allskin/cxrz3.png HTTP/1.1   tcp.stream == 9
297   8.721360 192.168.42.196 -> 125.39.127.34 HTTP 336 GET /js/speed_v1.9-min.js HTTP/1.1   tcp.stream == 25
298   8.721370 192.168.42.196 -> 125.39.127.34 HTTP 366 GET /www/images/ind36.gif HTTP/1.1   tcp.stream == 26
299   8.729034 125.39.127.42 -> 192.168.42.196 TCP 1314 [TCP segment of a reassembled PDU]  tcp.stream == 10
300   8.729052 192.168.42.196 -> 125.39.127.42 TCP 54 46280 > http [ACK] Seq=327 Ack=2521 Win=19712 Len=0  tcp.stream == 10
301   8.729142 125.39.127.42 -> 192.168.42.196 TCP 1314 [TCP segment of a reassembled PDU]  tcp.stream == 10
302   8.729148 192.168.42.196 -> 125.39.127.42 TCP 54 46280 > http [ACK] Seq=327 Ack=3781 Win=22272 Len=0  tcp.stream == 10
303   8.741028 125.39.127.42 -> 192.168.42.196 TCP 1314 [TCP segment of a reassembled PDU]  tcp.stream == 10
304   8.741045 192.168.42.196 -> 125.39.127.42 TCP 54 46280 > http [ACK] Seq=327 Ack=5041 Win=24704 Len=0  tcp.stream == 10
305   8.741152 125.39.127.42 -> 192.168.42.196 HTTP 359 HTTP/1.1 200 OK  (JPEG JFIF image)  tcp.stream == 10
306   8.741163 192.168.42.196 -> 125.39.127.42 TCP 54 46280 > http [ACK] Seq=327 Ack=5346 Win=27264 Len=0  tcp.stream == 10
307   8.741166 125.39.127.34 -> 192.168.42.196 TCP 66 http > 57034 [SYN, ACK] Seq=0 Ack=1 Win=65535 Len=0 MSS=1260 WS=4 SACK_PERM=1  tcp.stream == 27
308   8.741175 192.168.42.196 -> 125.39.127.34 TCP 54 57034 > http [ACK] Seq=1 Ack=1 Win=14720 Len=0  tcp.stream == 27
309   8.741178 125.39.127.34 -> 192.168.42.196 TCP 66 http > 57035 [SYN, ACK] Seq=0 Ack=1 Win=65535 Len=0 MSS=1260 WS=4 SACK_PERM=1  tcp.stream == 28
310   8.741182 192.168.42.196 -> 125.39.127.34 TCP 54 57035 > http [ACK] Seq=1 Ack=1 Win=14720 Len=0  tcp.stream == 28
311   8.741184 125.39.127.22 -> 192.168.42.196 TCP 54 [TCP Window Update] http > 58483 [ACK] Seq=1 Ack=1 Win=200000 Len=0  tcp.stream == 12
312   8.741187 125.39.127.22 -> 192.168.42.196 TCP 54 [TCP Window Update] http > 58484 [ACK] Seq=1 Ack=1 Win=200000 Len=0  tcp.stream == 13
313   8.741189 125.39.200.23 -> 192.168.42.196 TCP 54 [TCP Window Update] http > 60249 [ACK] Seq=1 Ack=1 Win=200000 Len=0  tcp.stream == 14
314   8.741191 125.39.200.23 -> 192.168.42.196 TCP 54 [TCP Window Update] http > 60250 [ACK] Seq=1 Ack=1 Win=200000 Len=0  tcp.stream == 15
315   8.741270 125.39.200.23 -> 192.168.42.196 HTTP 452 HTTP/1.1 200 OK  (GIF89a)  tcp.stream == 14
316   8.741278 192.168.42.196 -> 125.39.200.23 TCP 54 60249 > http [ACK] Seq=331 Ack=399 Win=15744 Len=0  tcp.stream == 14
317   8.741514 192.168.42.196 -> 125.39.127.34 HTTP 375 GET /www/images/allskin/wmlogo.gif HTTP/1.1   tcp.stream == 28
318   8.741579 192.168.42.196 -> 125.39.127.34 HTTP 374 GET /www/images/200709/home_b.gif HTTP/1.1   tcp.stream == 27
319   8.741600 192.168.42.196 -> 125.39.200.23 HTTP 386 GET /ent/pics/hv1/195/250/974/63398295.jpg HTTP/1.1   tcp.stream == 14
320   8.749687 125.39.200.23 -> 192.168.42.196 TCP 54 [TCP Window Update] http > 60251 [ACK] Seq=1 Ack=1 Win=200000 Len=0  tcp.stream == 16
321   8.749704 125.39.200.23 -> 192.168.42.196 TCP 1314 [TCP segment of a reassembled PDU]  tcp.stream == 15
322   8.749713 192.168.42.196 -> 125.39.200.23 TCP 54 60250 > http [ACK] Seq=331 Ack=1261 Win=17152 Len=0  tcp.stream == 15
323   8.759067 125.39.200.23 -> 192.168.42.196 TCP 1314 [TCP segment of a reassembled PDU]  tcp.stream == 15
324   8.759087 192.168.42.196 -> 125.39.200.23 TCP 54 60250 > http [ACK] Seq=331 Ack=2521 Win=19712 Len=0  tcp.stream == 15
325   8.759094 125.39.200.23 -> 192.168.42.196 HTTP 258 HTTP/1.1 200 OK  (JPEG JFIF image)  tcp.stream == 15
326   8.759097 192.168.42.196 -> 125.39.200.23 TCP 54 60250 > http [ACK] Seq=331 Ack=2725 Win=22272 Len=0  tcp.stream == 15
327   8.759099 125.39.200.23 -> 192.168.42.196 TCP 54 [TCP Window Update] http > 60254 [ACK] Seq=1 Ack=1 Win=200000 Len=0  tcp.stream == 19
328   8.759103 125.39.200.23 -> 192.168.42.196 TCP 54 [TCP Window Update] http > 60252 [ACK] Seq=1 Ack=1 Win=200000 Len=0  tcp.stream == 17
329   8.759266 192.168.42.196 -> 125.39.200.23 HTTP 387 GET /search/pics/hv1/33/50/975/63412158.jpg HTTP/1.1   tcp.stream == 15
330   8.769943 125.39.200.23 -> 192.168.42.196 TCP 1314 [TCP segment of a reassembled PDU]  tcp.stream == 16
331   8.769967 192.168.42.196 -> 125.39.200.23 TCP 54 60251 > http [ACK] Seq=333 Ack=1261 Win=17152 Len=0  tcp.stream == 16
332   8.769974 125.39.200.23 -> 192.168.42.196 TCP 1314 [TCP segment of a reassembled PDU]  tcp.stream == 16
333   8.769977 192.168.42.196 -> 125.39.200.23 TCP 54 60251 > http [ACK] Seq=333 Ack=2521 Win=19712 Len=0  tcp.stream == 16
334   8.769979 125.39.200.23 -> 192.168.42.196 HTTP 372 HTTP/1.1 200 OK  (JPEG JFIF image)  tcp.stream == 16
335   8.769982 192.168.42.196 -> 125.39.200.23 TCP 54 60251 > http [ACK] Seq=333 Ack=2839 Win=22272 Len=0  tcp.stream == 16
336   8.769983 184.105.67.90 -> 192.168.42.196 TCP 54 [TCP Window Update] http > 43834 [ACK] Seq=1 Ack=1 Win=200000 Len=0  tcp.stream == 20
337   8.770014 125.39.200.23 -> 192.168.42.196 TCP 54 [TCP Window Update] http > 60253 [ACK] Seq=1 Ack=1 Win=200000 Len=0  tcp.stream == 18
338   8.770199 192.168.42.196 -> 125.39.200.23 HTTP 387 GET /auto/pics/hv1/201/135/975/63434001.jpg HTTP/1.1   tcp.stream == 16
339   8.780435 125.39.200.23 -> 192.168.42.196 TCP 1314 [TCP segment of a reassembled PDU]  tcp.stream == 17
340   8.780456 192.168.42.196 -> 125.39.200.23 TCP 54 60252 > http [ACK] Seq=332 Ack=1261 Win=17152 Len=0  tcp.stream == 17
341   8.780463 125.39.200.23 -> 192.168.42.196 TCP 1314 [TCP segment of a reassembled PDU]  tcp.stream == 17
342   8.780466 192.168.42.196 -> 125.39.200.23 TCP 54 60252 > http [ACK] Seq=332 Ack=2521 Win=19712 Len=0  tcp.stream == 17
343   8.780515 125.39.200.23 -> 192.168.42.196 HTTP 500 HTTP/1.1 200 OK  (JPEG JFIF image)  tcp.stream == 17
344   8.780522 192.168.42.196 -> 125.39.200.23 TCP 54 60252 > http [ACK] Seq=332 Ack=2967 Win=22272 Len=0  tcp.stream == 17
345   8.780665 192.168.42.196 -> 125.39.200.23 HTTP 387 GET /house/pics/hv1/140/10/975/63402065.jpg HTTP/1.1   tcp.stream == 17
346   8.789816 125.39.200.23 -> 192.168.42.196 TCP 1314 [TCP segment of a reassembled PDU]  tcp.stream == 18
347   8.789839 192.168.42.196 -> 125.39.200.23 TCP 54 60253 > http [ACK] Seq=332 Ack=1261 Win=17152 Len=0  tcp.stream == 18
348   8.789847 125.39.200.23 -> 192.168.42.196 TCP 1314 [TCP segment of a reassembled PDU]  tcp.stream == 18
