  1   0.000000 192.168.42.196 -> 207.46.232.182 TCP 74 47668 > http [SYN] Seq=0 Win=14600 Len=0 MSS=1460 SACK_PERM=1 TSval=43486991 TSecr=0 WS=128  tcp.stream == 0
  2   0.246327 192.168.42.196 -> 207.46.232.182 TCP 74 47669 > http [SYN] Seq=0 Win=14600 Len=0 MSS=1460 SACK_PERM=1 TSval=43487052 TSecr=0 WS=128  tcp.stream == 1
  3   1.856984 207.46.232.182 -> 192.168.42.196 TCP 66 http > 47668 [SYN, ACK] Seq=0 Ack=1 Win=65535 Len=0 MSS=1260 WS=4 SACK_PERM=1  tcp.stream == 0
  4   1.857012 192.168.42.196 -> 207.46.232.182 TCP 54 47668 > http [ACK] Seq=1 Ack=1 Win=14720 Len=0  tcp.stream == 0
  5   1.861155 192.168.42.196 -> 207.46.232.182 HTTP 453 GET / HTTP/1.1   tcp.stream == 0
  6   1.997172 207.46.232.182 -> 192.168.42.196 TCP 54 [TCP Window Update] http > 47668 [ACK] Seq=1 Ack=1 Win=200000 Len=0  tcp.stream == 0
  7   1.997187 207.46.232.182 -> 192.168.42.196 TCP 66 http > 47669 [SYN, ACK] Seq=0 Ack=1 Win=65535 Len=0 MSS=1260 WS=4 SACK_PERM=1  tcp.stream == 1
  8   1.997198 192.168.42.196 -> 207.46.232.182 TCP 54 47669 > http [ACK] Seq=1 Ack=1 Win=14720 Len=0  tcp.stream == 1
  9   2.066916 207.46.232.182 -> 192.168.42.196 HTTP 502 HTTP/1.1 301 Moved Permanently  (text/html)  tcp.stream == 0
 10   2.066936 192.168.42.196 -> 207.46.232.182 TCP 54 47668 > http [ACK] Seq=400 Ack=449 Win=15744 Len=0  tcp.stream == 0
 11   2.078008 192.168.42.196 -> 207.46.232.182 TCP 54 47668 > http [FIN, ACK] Seq=400 Ack=449 Win=15744 Len=0  tcp.stream == 0
 13   2.106444 207.46.232.182 -> 192.168.42.196 TCP 54 [TCP Window Update] http > 47669 [ACK] Seq=1 Ack=1 Win=200000 Len=0  tcp.stream == 1
 14   2.187063 207.46.232.182 -> 192.168.42.196 TCP 54 http > 47668 [ACK] Seq=449 Ack=401 Win=200000 Len=0  tcp.stream == 0
 15   2.187082 207.46.232.182 -> 192.168.42.196 TCP 54 http > 47668 [FIN, ACK] Seq=449 Ack=401 Win=200000 Len=0  tcp.stream == 0
 16   2.187091 192.168.42.196 -> 207.46.232.182 TCP 54 47668 > http [ACK] Seq=401 Ack=450 Win=15744 Len=0  tcp.stream == 0
 22   2.700373 192.168.42.196 -> 65.55.12.249 TCP 74 54539 > http [SYN] Seq=0 Win=14600 Len=0 MSS=1460 SACK_PERM=1 TSval=43487666 TSecr=0 WS=128  tcp.stream == 2
 23   2.816796 65.55.12.249 -> 192.168.42.196 TCP 66 http > 54539 [SYN, ACK] Seq=0 Ack=1 Win=65535 Len=0 MSS=1260 WS=4 SACK_PERM=1  tcp.stream == 2
 24   2.816830 192.168.42.196 -> 65.55.12.249 TCP 54 54539 > http [ACK] Seq=1 Ack=1 Win=14720 Len=0  tcp.stream == 2
 25   2.818746 192.168.42.196 -> 65.55.12.249 HTTP 457 GET / HTTP/1.1   tcp.stream == 2
 26   2.937318 65.55.12.249 -> 192.168.42.196 TCP 54 [TCP Window Update] http > 54539 [ACK] Seq=1 Ack=1 Win=200000 Len=0  tcp.stream == 2
 27   3.036650 65.55.12.249 -> 192.168.42.196 HTTP 618 HTTP/1.1 302 Found  (text/html)  tcp.stream == 2
 28   3.036669 192.168.42.196 -> 65.55.12.249 TCP 54 54539 > http [ACK] Seq=404 Ack=565 Win=15744 Len=0  tcp.stream == 2
 29   3.043842 192.168.42.196 -> 65.55.12.249 TCP 54 54539 > http [FIN, ACK] Seq=404 Ack=565 Win=15744 Len=0  tcp.stream == 2
 30   3.055181 192.168.42.196 -> 65.55.186.235 TCP 74 45629 > http [SYN] Seq=0 Win=14600 Len=0 MSS=1460 SACK_PERM=1 TSval=43487755 TSecr=0 WS=128  tcp.stream == 3
 31   3.156941 65.55.12.249 -> 192.168.42.196 TCP 54 http > 54539 [ACK] Seq=565 Ack=405 Win=200000 Len=0  tcp.stream == 2
 32   3.156962 65.55.12.249 -> 192.168.42.196 TCP 54 http > 54539 [FIN, ACK] Seq=565 Ack=405 Win=200000 Len=0  tcp.stream == 2
 33   3.156968 192.168.42.196 -> 65.55.12.249 TCP 54 54539 > http [ACK] Seq=405 Ack=566 Win=15744 Len=0  tcp.stream == 2
 34   3.166652 65.55.186.235 -> 192.168.42.196 TCP 66 http > 45629 [SYN, ACK] Seq=0 Ack=1 Win=65535 Len=0 MSS=1260 WS=4 SACK_PERM=1  tcp.stream == 3
 35   3.166681 192.168.42.196 -> 65.55.186.235 TCP 54 45629 > http [ACK] Seq=1 Ack=1 Win=14720 Len=0  tcp.stream == 3
 36   3.168697 192.168.42.196 -> 65.55.186.235 HTTP 460 GET / HTTP/1.1   tcp.stream == 3
 37   3.277918 65.55.186.235 -> 192.168.42.196 TCP 54 [TCP Window Update] http > 45629 [ACK] Seq=1 Ack=1 Win=200000 Len=0  tcp.stream == 3
 38   3.406805 65.55.186.235 -> 192.168.42.196 TCP 54 http > 45629 [ACK] Seq=1 Ack=407 Win=200000 Len=0  tcp.stream == 3
 39   3.436905 65.55.186.235 -> 192.168.42.196 HTTP 530 HTTP/1.1 301 Moved Permanently  (text/html)  tcp.stream == 3
 40   3.436923 192.168.42.196 -> 65.55.186.235 TCP 54 45629 > http [ACK] Seq=407 Ack=477 Win=15744 Len=0  tcp.stream == 3
 41   3.444006 192.168.42.196 -> 65.55.186.235 TCP 54 45629 > http [FIN, ACK] Seq=407 Ack=477 Win=15744 Len=0  tcp.stream == 3
 42   3.454169 192.168.42.196 -> 65.55.186.235 TCP 74 45630 > http [SYN] Seq=0 Win=14600 Len=0 MSS=1460 SACK_PERM=1 TSval=43487854 TSecr=0 WS=128  tcp.stream == 4
 43   3.556933 65.55.186.235 -> 192.168.42.196 TCP 54 http > 45629 [ACK] Seq=477 Ack=408 Win=200000 Len=0  tcp.stream == 3
 44   3.556953 65.55.186.235 -> 192.168.42.196 TCP 54 http > 45629 [FIN, ACK] Seq=477 Ack=408 Win=200000 Len=0  tcp.stream == 3
 45   3.556960 192.168.42.196 -> 65.55.186.235 TCP 54 45629 > http [ACK] Seq=408 Ack=478 Win=15744 Len=0  tcp.stream == 3
 46   3.566793 65.55.186.235 -> 192.168.42.196 TCP 66 http > 45630 [SYN, ACK] Seq=0 Ack=1 Win=65535 Len=0 MSS=1260 WS=4 SACK_PERM=1  tcp.stream == 4
 47   3.566814 192.168.42.196 -> 65.55.186.235 TCP 54 45630 > http [ACK] Seq=1 Ack=1 Win=14720 Len=0  tcp.stream == 4
 48   3.568447 192.168.42.196 -> 65.55.186.235 HTTP 455 GET / HTTP/1.1   tcp.stream == 4
 49   3.677784 65.55.186.235 -> 192.168.42.196 TCP 54 [TCP Window Update] http > 45630 [ACK] Seq=1 Ack=1 Win=200000 Len=0  tcp.stream == 4
 50   3.806936 65.55.186.235 -> 192.168.42.196 TCP 54 http > 45630 [ACK] Seq=1 Ack=402 Win=200000 Len=0  tcp.stream == 4
 51   3.876780 65.55.186.235 -> 192.168.42.196 HTTP 832 HTTP/1.1 302 Found  (text/html)  tcp.stream == 4
 52   3.876800 192.168.42.196 -> 65.55.186.235 TCP 54 45630 > http [ACK] Seq=402 Ack=779 Win=16256 Len=0  tcp.stream == 4
 53   3.885753 192.168.42.196 -> 65.55.186.235 TCP 54 45630 > http [FIN, ACK] Seq=402 Ack=779 Win=16256 Len=0  tcp.stream == 4
 54   3.889578 192.168.42.196 -> 65.55.186.235 TCP 74 45631 > http [SYN] Seq=0 Win=14600 Len=0 MSS=1460 SACK_PERM=1 TSval=43487963 TSecr=0 WS=128  tcp.stream == 5
 55   3.996809 65.55.186.235 -> 192.168.42.196 TCP 54 http > 45630 [ACK] Seq=779 Ack=403 Win=200000 Len=0  tcp.stream == 4
 56   3.996828 65.55.186.235 -> 192.168.42.196 TCP 54 http > 45630 [FIN, ACK] Seq=779 Ack=403 Win=200000 Len=0  tcp.stream == 4
 57   3.996837 192.168.42.196 -> 65.55.186.235 TCP 54 45630 > http [ACK] Seq=403 Ack=780 Win=16256 Len=0  tcp.stream == 4
 58   4.006600 65.55.186.235 -> 192.168.42.196 TCP 66 http > 45631 [SYN, ACK] Seq=0 Ack=1 Win=65535 Len=0 MSS=1260 WS=4 SACK_PERM=1  tcp.stream == 5
 59   4.006623 192.168.42.196 -> 65.55.186.235 TCP 54 45631 > http [ACK] Seq=1 Ack=1 Win=14720 Len=0  tcp.stream == 5
 60   4.008280 192.168.42.196 -> 65.55.186.235 HTTP 473 GET /en-us/default.mspx HTTP/1.1   tcp.stream == 5
 61   4.116777 65.55.186.235 -> 192.168.42.196 TCP 54 [TCP Window Update] http > 45631 [ACK] Seq=1 Ack=1 Win=200000 Len=0  tcp.stream == 5
 62   4.256801 65.55.186.235 -> 192.168.42.196 TCP 54 http > 45631 [ACK] Seq=1 Ack=420 Win=200000 Len=0  tcp.stream == 5
 63   6.367437 65.55.186.235 -> 192.168.42.196 TCP 1314 [TCP segment of a reassembled PDU]  tcp.stream == 5
 64   6.367453 192.168.42.196 -> 65.55.186.235 TCP 54 45631 > http [ACK] Seq=420 Ack=1261 Win=17152 Len=0  tcp.stream == 5
 65   6.377259 65.55.186.235 -> 192.168.42.196 TCP 1314 [TCP segment of a reassembled PDU]  tcp.stream == 5
 66   6.377279 192.168.42.196 -> 65.55.186.235 TCP 54 45631 > http [ACK] Seq=420 Ack=2521 Win=19712 Len=0  tcp.stream == 5
 67   6.377370 65.55.186.235 -> 192.168.42.196 TCP 1314 [TCP segment of a reassembled PDU]  tcp.stream == 5
 68   6.377376 192.168.42.196 -> 65.55.186.235 TCP 54 45631 > http [ACK] Seq=420 Ack=3781 Win=22272 Len=0  tcp.stream == 5
 69   6.387257 65.55.186.235 -> 192.168.42.196 TCP 1314 [TCP segment of a reassembled PDU]  tcp.stream == 5
 70   6.387277 192.168.42.196 -> 65.55.186.235 TCP 54 45631 > http [ACK] Seq=420 Ack=5041 Win=24704 Len=0  tcp.stream == 5
 71   6.398136 65.55.186.235 -> 192.168.42.196 TCP 1314 [TCP segment of a reassembled PDU]  tcp.stream == 5
 72   6.398157 192.168.42.196 -> 65.55.186.235 TCP 54 45631 > http [ACK] Seq=420 Ack=6301 Win=27264 Len=0  tcp.stream == 5
 73   6.398164 65.55.186.235 -> 192.168.42.196 HTTP/XML 744 HTTP/1.1 200 OK   tcp.stream == 5
 74   6.398166 192.168.42.196 -> 65.55.186.235 TCP 54 45631 > http [ACK] Seq=420 Ack=6991 Win=29824 Len=0  tcp.stream == 5
 75   6.406687 192.168.42.196 -> 65.55.186.235 TCP 54 45631 > http [FIN, ACK] Seq=420 Ack=6991 Win=29824 Len=0  tcp.stream == 5
 76   6.526765 65.55.186.235 -> 192.168.42.196 TCP 54 http > 45631 [ACK] Seq=6991 Ack=421 Win=200000 Len=0  tcp.stream == 5
 77   6.526783 65.55.186.235 -> 192.168.42.196 TCP 54 http > 45631 [FIN, ACK] Seq=6991 Ack=421 Win=200000 Len=0  tcp.stream == 5
 78   6.526790 192.168.42.196 -> 65.55.186.235 TCP 54 45631 > http [ACK] Seq=421 Ack=6992 Win=29824 Len=0  tcp.stream == 5
 79   6.640500 192.168.42.196 -> 65.55.186.235 TCP 74 45632 > http [SYN] Seq=0 Win=14600 Len=0 MSS=1460 SACK_PERM=1 TSval=43488651 TSecr=0 WS=128  tcp.stream == 6
 81   6.651594 192.168.42.196 -> 65.55.186.235 TCP 74 45633 > http [SYN] Seq=0 Win=14600 Len=0 MSS=1460 SACK_PERM=1 TSval=43488654 TSecr=0 WS=128  tcp.stream == 7
 82   6.660632 192.168.42.196 -> 65.55.186.235 TCP 74 45634 > http [SYN] Seq=0 Win=14600 Len=0 MSS=1460 SACK_PERM=1 TSval=43488656 TSecr=0 WS=128  tcp.stream == 8
 83   6.683527 192.168.42.196 -> 65.55.186.235 TCP 74 45635 > http [SYN] Seq=0 Win=14600 Len=0 MSS=1460 SACK_PERM=1 TSval=43488662 TSecr=0 WS=128  tcp.stream == 9
 84   6.695752 192.168.42.196 -> 65.55.186.235 TCP 74 45636 > http [SYN] Seq=0 Win=14600 Len=0 MSS=1460 SACK_PERM=1 TSval=43488665 TSecr=0 WS=128  tcp.stream == 10
 85   6.707085 192.168.42.196 -> 65.55.186.235 TCP 74 45637 > http [SYN] Seq=0 Win=14600 Len=0 MSS=1460 SACK_PERM=1 TSval=43488668 TSecr=0 WS=128  tcp.stream == 11
 86   6.757413 65.55.186.235 -> 192.168.42.196 TCP 66 http > 45632 [SYN, ACK] Seq=0 Ack=1 Win=65535 Len=0 MSS=1260 WS=4 SACK_PERM=1  tcp.stream == 6
 87   6.757441 192.168.42.196 -> 65.55.186.235 TCP 54 45632 > http [ACK] Seq=1 Ack=1 Win=14720 Len=0  tcp.stream == 6
 88   6.759300 192.168.42.196 -> 65.55.186.235 HTTP 529 GET /Library/js/im/gmr-1.6.0/jQuery.moveTo.js HTTP/1.1   tcp.stream == 6
 89   6.766774 65.55.186.235 -> 192.168.42.196 TCP 66 http > 45633 [SYN, ACK] Seq=0 Ack=1 Win=65535 Len=0 MSS=1260 WS=4 SACK_PERM=1  tcp.stream == 7
 90   6.766797 192.168.42.196 -> 65.55.186.235 TCP 54 45633 > http [ACK] Seq=1 Ack=1 Win=14720 Len=0  tcp.stream == 7
 91   6.768587 192.168.42.196 -> 65.55.186.235 HTTP 549 GET /Library/js/im/gmr-1.6.0/jquerytools/scrollable/scrollable.js HTTP/1.1   tcp.stream == 7
 92   6.778276 65.55.186.235 -> 192.168.42.196 TCP 66 http > 45634 [SYN, ACK] Seq=0 Ack=1 Win=65535 Len=0 MSS=1260 WS=4 SACK_PERM=1  tcp.stream == 8
 93   6.778298 192.168.42.196 -> 65.55.186.235 TCP 54 45634 > http [ACK] Seq=1 Ack=1 Win=14720 Len=0  tcp.stream == 8
 94   6.779892 192.168.42.196 -> 65.55.186.235 HTTP 559 GET /Library/js/im/gmr-1.6.0/jquerytools/scrollable/scrollable.navigator.js HTTP/1.1   tcp.stream == 8
 95   6.797287 65.55.186.235 -> 192.168.42.196 TCP 66 http > 45635 [SYN, ACK] Seq=0 Ack=1 Win=65535 Len=0 MSS=1260 WS=4 SACK_PERM=1  tcp.stream == 9
 96   6.797314 192.168.42.196 -> 65.55.186.235 TCP 54 45635 > http [ACK] Seq=1 Ack=1 Win=14720 Len=0  tcp.stream == 9
 97   6.798951 192.168.42.196 -> 65.55.186.235 HTTP 560 GET /Library/js/im/gmr-1.6.0/jquerytools/scrollable/scrollable.pagenumber.js HTTP/1.1   tcp.stream == 9
 98   6.806902 65.55.186.235 -> 192.168.42.196 TCP 66 http > 45636 [SYN, ACK] Seq=0 Ack=1 Win=65535 Len=0 MSS=1260 WS=4 SACK_PERM=1  tcp.stream == 10
 99   6.806926 192.168.42.196 -> 65.55.186.235 TCP 54 45636 > http [ACK] Seq=1 Ack=1 Win=14720 Len=0  tcp.stream == 10
100   6.808458 192.168.42.196 -> 65.55.186.235 HTTP 543 GET /Library/js/im/gmr-1.6.0/touchClicker_iphone_android.js HTTP/1.1   tcp.stream == 10
101   6.817151 65.55.186.235 -> 192.168.42.196 TCP 66 http > 45637 [SYN, ACK] Seq=0 Ack=1 Win=65535 Len=0 MSS=1260 WS=4 SACK_PERM=1  tcp.stream == 11
102   6.817175 192.168.42.196 -> 65.55.186.235 TCP 54 45637 > http [ACK] Seq=1 Ack=1 Win=14720 Len=0  tcp.stream == 11
103   6.819429 192.168.42.196 -> 65.55.186.235 HTTP 526 GET /Library/js/im/gmr-1.6.0/turnscreen.js HTTP/1.1   tcp.stream == 11
106   6.876664 65.55.186.235 -> 192.168.42.196 TCP 54 [TCP Window Update] http > 45632 [ACK] Seq=1 Ack=1 Win=200000 Len=0  tcp.stream == 6
107   6.898404 65.55.186.235 -> 192.168.42.196 TCP 54 [TCP Window Update] http > 45633 [ACK] Seq=1 Ack=1 Win=200000 Len=0  tcp.stream == 7
108   6.936787 65.55.186.235 -> 192.168.42.196 TCP 54 [TCP Window Update] http > 45634 [ACK] Seq=1 Ack=1 Win=200000 Len=0  tcp.stream == 8
109   6.946783 65.55.186.235 -> 192.168.42.196 TCP 54 [TCP Window Update] http > 45635 [ACK] Seq=1 Ack=1 Win=200000 Len=0  tcp.stream == 9
110   6.946796 65.55.186.235 -> 192.168.42.196 TCP 54 [TCP Window Update] http > 45636 [ACK] Seq=1 Ack=1 Win=200000 Len=0  tcp.stream == 10
111   6.956645 65.55.186.235 -> 192.168.42.196 TCP 54 [TCP Window Update] http > 45637 [ACK] Seq=1 Ack=1 Win=200000 Len=0  tcp.stream == 11
112   7.006638 65.55.186.235 -> 192.168.42.196 TCP 54 http > 45632 [ACK] Seq=1 Ack=476 Win=200000 Len=0  tcp.stream == 6
113   7.026900 65.55.186.235 -> 192.168.42.196 HTTP 1097 HTTP/1.1 200 OK  (application/x-javascript)  tcp.stream == 6
114   7.026916 192.168.42.196 -> 65.55.186.235 TCP 54 45632 > http [ACK] Seq=476 Ack=1044 Win=16768 Len=0  tcp.stream == 6
115   7.034039 192.168.42.196 -> 65.55.186.235 TCP 54 45632 > http [FIN, ACK] Seq=476 Ack=1044 Win=16768 Len=0  tcp.stream == 6
116   7.035216 192.168.42.196 -> 65.55.186.235 TCP 74 45638 > http [SYN] Seq=0 Win=14600 Len=0 MSS=1460 SACK_PERM=1 TSval=43488750 TSecr=0 WS=128  tcp.stream == 12
117   7.056905 65.55.186.235 -> 192.168.42.196 TCP 54 http > 45634 [ACK] Seq=1 Ack=506 Win=200000 Len=0  tcp.stream == 8
118   7.056920 65.55.186.235 -> 192.168.42.196 TCP 54 http > 45635 [ACK] Seq=1 Ack=507 Win=200000 Len=0  tcp.stream == 9
119   7.056922 65.55.186.235 -> 192.168.42.196 TCP 54 http > 45633 [ACK] Seq=1 Ack=496 Win=200000 Len=0  tcp.stream == 7
122   7.077007 65.55.186.235 -> 192.168.42.196 TCP 1314 [TCP segment of a reassembled PDU]  tcp.stream == 8
123   7.077027 192.168.42.196 -> 65.55.186.235 TCP 54 45634 > http [ACK] Seq=506 Ack=1261 Win=17152 Len=0  tcp.stream == 8
124   7.077033 65.55.186.235 -> 192.168.42.196 HTTP 432 HTTP/1.1 200 OK  (application/x-javascript)  tcp.stream == 8
125   7.077036 192.168.42.196 -> 65.55.186.235 TCP 54 45634 > http [ACK] Seq=506 Ack=1639 Win=19712 Len=0  tcp.stream == 8
126   7.083793 192.168.42.196 -> 65.55.186.235 TCP 54 45634 > http [FIN, ACK] Seq=506 Ack=1639 Win=19712 Len=0  tcp.stream == 8
127   7.084766 192.168.42.196 -> 65.55.186.235 TCP 74 45639 > http [SYN] Seq=0 Win=14600 Len=0 MSS=1460 SACK_PERM=1 TSval=43488762 TSecr=0 WS=128  tcp.stream == 13
128   7.087004 65.55.186.235 -> 192.168.42.196 HTTP 928 HTTP/1.1 200 OK  (application/x-javascript)  tcp.stream == 9
129   7.087025 192.168.42.196 -> 65.55.186.235 TCP 54 45635 > http [ACK] Seq=507 Ack=875 Win=16384 Len=0  tcp.stream == 9
130   7.096635 192.168.42.196 -> 65.55.186.235 TCP 54 45635 > http [FIN, ACK] Seq=507 Ack=875 Win=16384 Len=0  tcp.stream == 9
131   7.097000 65.55.186.235 -> 192.168.42.196 TCP 1314 [TCP segment of a reassembled PDU]  tcp.stream == 10
132   7.097021 192.168.42.196 -> 65.55.186.235 TCP 54 45636 > http [ACK] Seq=490 Ack=1261 Win=17152 Len=0  tcp.stream == 10
133   7.097026 65.55.186.235 -> 192.168.42.196 HTTP 122 HTTP/1.1 200 OK  (application/x-javascript)  tcp.stream == 10
134   7.097029 192.168.42.196 -> 65.55.186.235 TCP 54 45636 > http [ACK] Seq=490 Ack=1329 Win=17152 Len=0  tcp.stream == 10
135   7.097569 192.168.42.196 -> 65.55.186.235 TCP 74 45640 > http [SYN] Seq=0 Win=14600 Len=0 MSS=1460 SACK_PERM=1 TSval=43488765 TSecr=0 WS=128  tcp.stream == 14
136   7.108355 192.168.42.196 -> 65.55.186.235 TCP 54 45636 > http [FIN, ACK] Seq=490 Ack=1329 Win=17152 Len=0  tcp.stream == 10
137   7.108619 65.55.186.235 -> 192.168.42.196 TCP 54 http > 45637 [ACK] Seq=1 Ack=473 Win=200000 Len=0  tcp.stream == 11
138   7.108633 65.55.186.235 -> 192.168.42.196 HTTP 1108 HTTP/1.1 200 OK  (application/x-javascript)  tcp.stream == 11
139   7.108639 192.168.42.196 -> 65.55.186.235 TCP 54 45637 > http [ACK] Seq=473 Ack=1055 Win=16768 Len=0  tcp.stream == 11
140   7.109283 192.168.42.196 -> 65.55.186.235 TCP 74 45641 > http [SYN] Seq=0 Win=14600 Len=0 MSS=1460 SACK_PERM=1 TSval=43488768 TSecr=0 WS=128  tcp.stream == 15
141   7.119413 192.168.42.196 -> 65.55.186.235 TCP 54 45637 > http [FIN, ACK] Seq=473 Ack=1055 Win=16768 Len=0  tcp.stream == 11
142   7.137411 65.55.186.235 -> 192.168.42.196 TCP 1314 [TCP segment of a reassembled PDU]  tcp.stream == 7
143   7.137439 192.168.42.196 -> 65.55.186.235 TCP 54 45633 > http [ACK] Seq=496 Ack=1261 Win=17152 Len=0  tcp.stream == 7
144   7.147154 65.55.186.235 -> 192.168.42.196 TCP 1314 [TCP segment of a reassembled PDU]  tcp.stream == 7
145   7.147172 192.168.42.196 -> 65.55.186.235 TCP 54 45633 > http [ACK] Seq=496 Ack=2521 Win=19712 Len=0  tcp.stream == 7
146   7.147239 65.55.186.235 -> 192.168.42.196 TCP 1314 [TCP segment of a reassembled PDU]  tcp.stream == 7
147   7.147245 192.168.42.196 -> 65.55.186.235 TCP 54 45633 > http [ACK] Seq=496 Ack=3781 Win=22272 Len=0  tcp.stream == 7
148   7.157883 65.55.186.235 -> 192.168.42.196 HTTP 336 HTTP/1.1 200 OK  (application/x-javascript)  tcp.stream == 7
149   7.157898 192.168.42.196 -> 65.55.186.235 TCP 54 45633 > http [ACK] Seq=496 Ack=4063 Win=24704 Len=0  tcp.stream == 7
150   7.157904 65.55.186.235 -> 192.168.42.196 TCP 54 http > 45632 [ACK] Seq=1044 Ack=477 Win=200000 Len=0  tcp.stream == 6
151   7.157910 65.55.186.235 -> 192.168.42.196 TCP 54 http > 45632 [FIN, ACK] Seq=1044 Ack=477 Win=200000 Len=0  tcp.stream == 6
152   7.157912 192.168.42.196 -> 65.55.186.235 TCP 54 45632 > http [ACK] Seq=477 Ack=1045 Win=16768 Len=0  tcp.stream == 6
153   7.157917 65.55.186.235 -> 192.168.42.196 TCP 66 http > 45638 [SYN, ACK] Seq=0 Ack=1 Win=65535 Len=0 MSS=1260 WS=4 SACK_PERM=1  tcp.stream == 12
154   7.157921 192.168.42.196 -> 65.55.186.235 TCP 54 45638 > http [ACK] Seq=1 Ack=1 Win=14720 Len=0  tcp.stream == 12
155   7.160232 192.168.42.196 -> 65.55.186.235 HTTP 595 GET /Library/proxy.mspx/cache/WhWqmPjMcaJO9WMnl3I!DQ/Ypflc5Ly4GXGCBBe5AQ_cg/a03ef5b5864f8ad5db1a5bc5d8076a9c.js HTTP/1.1   tcp.stream == 12
156   7.164534 192.168.42.196 -> 65.55.186.235 TCP 54 45633 > http [FIN, ACK] Seq=496 Ack=4063 Win=24704 Len=0  tcp.stream == 7
157   7.196789 65.55.186.235 -> 192.168.42.196 TCP 66 http > 45639 [SYN, ACK] Seq=0 Ack=1 Win=65535 Len=0 MSS=1260 WS=4 SACK_PERM=1  tcp.stream == 13
158   7.196812 192.168.42.196 -> 65.55.186.235 TCP 54 45639 > http [ACK] Seq=1 Ack=1 Win=14720 Len=0  tcp.stream == 13
159   7.196819 65.55.186.235 -> 192.168.42.196 TCP 54 http > 45634 [ACK] Seq=1639 Ack=507 Win=200000 Len=0  tcp.stream == 8
160   7.196822 65.55.186.235 -> 192.168.42.196 TCP 54 http > 45634 [FIN, ACK] Seq=1639 Ack=507 Win=200000 Len=0  tcp.stream == 8
161   7.196824 192.168.42.196 -> 65.55.186.235 TCP 54 45634 > http [ACK] Seq=507 Ack=1640 Win=19712 Len=0  tcp.stream == 8
162   7.198687 192.168.42.196 -> 65.55.186.235 HTTP 523 GET /Images/fcmp_320.css HTTP/1.1   tcp.stream == 13
163   7.206883 65.55.186.235 -> 192.168.42.196 TCP 54 http > 45635 [ACK] Seq=875 Ack=508 Win=200000 Len=0  tcp.stream == 9
164   7.206902 65.55.186.235 -> 192.168.42.196 TCP 54 http > 45635 [FIN, ACK] Seq=875 Ack=508 Win=200000 Len=0  tcp.stream == 9
165   7.206910 192.168.42.196 -> 65.55.186.235 TCP 54 45635 > http [ACK] Seq=508 Ack=876 Win=16384 Len=0  tcp.stream == 9
166   7.206920 65.55.186.235 -> 192.168.42.196 TCP 66 http > 45640 [SYN, ACK] Seq=0 Ack=1 Win=65535 Len=0 MSS=1260 WS=4 SACK_PERM=1  tcp.stream == 14
167   7.206927 192.168.42.196 -> 65.55.186.235 TCP 54 45640 > http [ACK] Seq=1 Ack=1 Win=14720 Len=0  tcp.stream == 14
168   7.210395 192.168.42.196 -> 65.55.186.235 HTTP 528 GET /library/js/AdvanceFeatures/webtrends.js HTTP/1.1   tcp.stream == 14
169   7.217036 65.55.186.235 -> 192.168.42.196 TCP 54 http > 45636 [ACK] Seq=1329 Ack=491 Win=200000 Len=0  tcp.stream == 10
170   7.217056 65.55.186.235 -> 192.168.42.196 TCP 54 http > 45636 [FIN, ACK] Seq=1329 Ack=491 Win=200000 Len=0  tcp.stream == 10
171   7.217063 192.168.42.196 -> 65.55.186.235 TCP 54 45636 > http [ACK] Seq=491 Ack=1330 Win=17152 Len=0  tcp.stream == 10
172   7.217071 65.55.186.235 -> 192.168.42.196 TCP 66 http > 45641 [SYN, ACK] Seq=0 Ack=1 Win=65535 Len=0 MSS=1260 WS=4 SACK_PERM=1  tcp.stream == 15
173   7.217077 192.168.42.196 -> 65.55.186.235 TCP 54 45641 > http [ACK] Seq=1 Ack=1 Win=14720 Len=0  tcp.stream == 15
174   7.219220 192.168.42.196 -> 65.55.186.235 HTTP 533 GET /library/js/AdvanceFeatures/mp.advfeatures.js HTTP/1.1   tcp.stream == 15
175   7.227288 65.55.186.235 -> 192.168.42.196 TCP 54 http > 45637 [ACK] Seq=1055 Ack=474 Win=200000 Len=0  tcp.stream == 11
176   7.227310 65.55.186.235 -> 192.168.42.196 TCP 54 http > 45637 [FIN, ACK] Seq=1055 Ack=474 Win=200000 Len=0  tcp.stream == 11
177   7.227317 192.168.42.196 -> 65.55.186.235 TCP 54 45637 > http [ACK] Seq=474 Ack=1056 Win=16768 Len=0  tcp.stream == 11
179   7.270317 192.168.42.196 -> 65.54.95.43  TCP 74 36631 > http [SYN] Seq=0 Win=14600 Len=0 MSS=1460 SACK_PERM=1 TSval=43488808 TSecr=0 WS=128  tcp.stream == 16
180   7.286783 65.55.186.235 -> 192.168.42.196 TCP 54 [TCP Window Update] http > 45638 [ACK] Seq=1 Ack=1 Win=200000 Len=0  tcp.stream == 12
181   7.286800 65.55.186.235 -> 192.168.42.196 TCP 54 http > 45633 [ACK] Seq=4063 Ack=497 Win=200000 Len=0  tcp.stream == 7
182   7.296781 65.55.186.235 -> 192.168.42.196 TCP 54 http > 45633 [FIN, ACK] Seq=4063 Ack=497 Win=200000 Len=0  tcp.stream == 7
183   7.296802 192.168.42.196 -> 65.55.186.235 TCP 54 45633 > http [ACK] Seq=497 Ack=4064 Win=24704 Len=0  tcp.stream == 7
184   7.306624 65.55.186.235 -> 192.168.42.196 TCP 54 [TCP Window Update] http > 45639 [ACK] Seq=1 Ack=1 Win=200000 Len=0  tcp.stream == 13
185   7.317288 65.55.186.235 -> 192.168.42.196 TCP 54 [TCP Window Update] http > 45640 [ACK] Seq=1 Ack=1 Win=200000 Len=0  tcp.stream == 14
186   7.326657 65.55.186.235 -> 192.168.42.196 TCP 54 [TCP Window Update] http > 45641 [ACK] Seq=1 Ack=1 Win=200000 Len=0  tcp.stream == 15
187   7.386904  65.54.95.43 -> 192.168.42.196 TCP 66 http > 36631 [SYN, ACK] Seq=0 Ack=1 Win=65535 Len=0 MSS=1260 WS=4 SACK_PERM=1  tcp.stream == 16
188   7.386935 192.168.42.196 -> 65.54.95.43  TCP 54 36631 > http [ACK] Seq=1 Ack=1 Win=14720 Len=0  tcp.stream == 16
189   7.388523 192.168.42.196 -> 65.54.95.43  HTTP 481 GET /ajax/jQuery/jquery-1.5.2.min.js HTTP/1.1   tcp.stream == 16
190   7.406898 65.55.186.235 -> 192.168.42.196 TCP 54 http > 45638 [ACK] Seq=1 Ack=542 Win=200000 Len=0  tcp.stream == 12
191   7.457657 65.55.186.235 -> 192.168.42.196 HTTP 1260 HTTP/1.1 200 OK  (text/css)  tcp.stream == 13
192   7.457679 192.168.42.196 -> 65.55.186.235 TCP 54 45639 > http [ACK] Seq=470 Ack=1207 Win=17024 Len=0  tcp.stream == 13
193   7.457688 65.55.186.235 -> 192.168.42.196 TCP 54 http > 45640 [ACK] Seq=1 Ack=475 Win=200000 Len=0  tcp.stream == 14
194   7.457691 65.55.186.235 -> 192.168.42.196 TCP 54 http > 45641 [ACK] Seq=1 Ack=480 Win=200000 Len=0  tcp.stream == 15
195   7.468318 192.168.42.196 -> 65.55.186.235 TCP 54 45639 > http [FIN, ACK] Seq=470 Ack=1207 Win=17024 Len=0  tcp.stream == 13
196   7.477398 65.55.186.235 -> 192.168.42.196 TCP 1314 [TCP segment of a reassembled PDU]  tcp.stream == 15
197   7.477415 192.168.42.196 -> 65.55.186.235 TCP 54 45641 > http [ACK] Seq=480 Ack=1261 Win=17152 Len=0  tcp.stream == 15
198   7.486873 65.55.186.235 -> 192.168.42.196 TCP 1314 [TCP segment of a reassembled PDU]  tcp.stream == 15
199   7.486888 192.168.42.196 -> 65.55.186.235 TCP 54 45641 > http [ACK] Seq=480 Ack=2521 Win=19712 Len=0  tcp.stream == 15
200   7.486895 65.55.186.235 -> 192.168.42.196 HTTP 300 HTTP/1.1 200 OK  (application/x-javascript)  tcp.stream == 15
201   7.486897 192.168.42.196 -> 65.55.186.235 TCP 54 45641 > http [ACK] Seq=480 Ack=2767 Win=22272 Len=0  tcp.stream == 15
202   7.489989 192.168.42.196 -> 65.55.186.235 TCP 54 45641 > http [FIN, ACK] Seq=480 Ack=2767 Win=22272 Len=0  tcp.stream == 15
203   7.496755  65.54.95.43 -> 192.168.42.196 TCP 54 [TCP Window Update] http > 36631 [ACK] Seq=1 Ack=1 Win=200000 Len=0  tcp.stream == 16
204   7.537381 65.55.186.235 -> 192.168.42.196 TCP 1314 [TCP segment of a reassembled PDU]  tcp.stream == 14
205   7.537397 192.168.42.196 -> 65.55.186.235 TCP 54 45640 > http [ACK] Seq=475 Ack=1261 Win=17152 Len=0  tcp.stream == 14
206   7.537404 65.55.186.235 -> 192.168.42.196 TCP 1314 [TCP segment of a reassembled PDU]  tcp.stream == 14
207   7.537406 192.168.42.196 -> 65.55.186.235 TCP 54 45640 > http [ACK] Seq=475 Ack=2521 Win=19712 Len=0  tcp.stream == 14
208   7.557883 65.55.186.235 -> 192.168.42.196 TCP 1314 [TCP segment of a reassembled PDU]  tcp.stream == 14
209   7.557900 192.168.42.196 -> 65.55.186.235 TCP 54 45640 > http [ACK] Seq=475 Ack=3781 Win=22272 Len=0  tcp.stream == 14
210   7.557907 65.55.186.235 -> 192.168.42.196 TCP 1314 [TCP segment of a reassembled PDU]  tcp.stream == 14
211   7.557909 192.168.42.196 -> 65.55.186.235 TCP 54 45640 > http [ACK] Seq=475 Ack=5041 Win=24704 Len=0  tcp.stream == 14
212   7.557910 65.55.186.235 -> 192.168.42.196 HTTP 172 HTTP/1.1 200 OK  (application/x-javascript)  tcp.stream == 14
213   7.557913 192.168.42.196 -> 65.55.186.235 TCP 54 45640 > http [ACK] Seq=475 Ack=5159 Win=24704 Len=0  tcp.stream == 14
214   7.561301 192.168.42.196 -> 65.55.186.235 TCP 54 45640 > http [FIN, ACK] Seq=475 Ack=5159 Win=24704 Len=0  tcp.stream == 14
215   7.586905 65.55.186.235 -> 192.168.42.196 TCP 54 http > 45639 [ACK] Seq=1207 Ack=471 Win=200000 Len=0  tcp.stream == 13
216   7.586925 65.55.186.235 -> 192.168.42.196 TCP 54 http > 45639 [FIN, ACK] Seq=1207 Ack=471 Win=200000 Len=0  tcp.stream == 13
217   7.586932 192.168.42.196 -> 65.55.186.235 TCP 54 45639 > http [ACK] Seq=471 Ack=1208 Win=17024 Len=0  tcp.stream == 13
218   7.606771  65.54.95.43 -> 192.168.42.196 TCP 54 http > 36631 [ACK] Seq=1 Ack=428 Win=200000 Len=0  tcp.stream == 16
219   7.616656 65.55.186.235 -> 192.168.42.196 TCP 54 http > 45641 [ACK] Seq=2767 Ack=481 Win=200000 Len=0  tcp.stream == 15
220   7.616676 65.55.186.235 -> 192.168.42.196 TCP 54 http > 45641 [FIN, ACK] Seq=2767 Ack=481 Win=200000 Len=0  tcp.stream == 15
221   7.616683 192.168.42.196 -> 65.55.186.235 TCP 54 45641 > http [ACK] Seq=481 Ack=2768 Win=22272 Len=0  tcp.stream == 15
222   7.666783 65.55.186.235 -> 192.168.42.196 TCP 54 http > 45640 [ACK] Seq=5159 Ack=476 Win=200000 Len=0  tcp.stream == 14
223   7.666801 65.55.186.235 -> 192.168.42.196 TCP 54 http > 45640 [FIN, ACK] Seq=5159 Ack=476 Win=200000 Len=0  tcp.stream == 14
224   7.666809 192.168.42.196 -> 65.55.186.235 TCP 54 45640 > http [ACK] Seq=476 Ack=5160 Win=24704 Len=0  tcp.stream == 14
225   8.168173 65.55.186.235 -> 192.168.42.196 TCP 1314 [TCP segment of a reassembled PDU]  tcp.stream == 12
226   8.168192 192.168.42.196 -> 65.55.186.235 TCP 54 45638 > http [ACK] Seq=542 Ack=1261 Win=17152 Len=0  tcp.stream == 12
227   8.177272 65.55.186.235 -> 192.168.42.196 TCP 1314 [TCP segment of a reassembled PDU]  tcp.stream == 12
228   8.177310 192.168.42.196 -> 65.55.186.235 TCP 54 45638 > http [ACK] Seq=542 Ack=2521 Win=19712 Len=0  tcp.stream == 12
229   8.177373 65.55.186.235 -> 192.168.42.196 TCP 1314 [TCP segment of a reassembled PDU]  tcp.stream == 12
230   8.177376 192.168.42.196 -> 65.55.186.235 TCP 54 45638 > http [ACK] Seq=542 Ack=3781 Win=22272 Len=0  tcp.stream == 12
231   8.197875 65.55.186.235 -> 192.168.42.196 TCP 1314 [TCP segment of a reassembled PDU]  tcp.stream == 12
232   8.197893 192.168.42.196 -> 65.55.186.235 TCP 54 45638 > http [ACK] Seq=542 Ack=5041 Win=24704 Len=0  tcp.stream == 12
233   8.197984 65.55.186.235 -> 192.168.42.196 TCP 1314 [TCP segment of a reassembled PDU]  tcp.stream == 12
234   8.197990 192.168.42.196 -> 65.55.186.235 TCP 54 45638 > http [ACK] Seq=542 Ack=6301 Win=27264 Len=0  tcp.stream == 12
235   8.197993 65.55.186.235 -> 192.168.42.196 TCP 1314 [TCP segment of a reassembled PDU]  tcp.stream == 12
236   8.197996 192.168.42.196 -> 65.55.186.235 TCP 54 45638 > http [ACK] Seq=542 Ack=7561 Win=29824 Len=0  tcp.stream == 12
237   8.207766 65.55.186.235 -> 192.168.42.196 HTTP 865 HTTP/1.1 200 OK  (application/x-javascript)  tcp.stream == 12
238   8.207783 192.168.42.196 -> 65.55.186.235 TCP 54 45638 > http [ACK] Seq=542 Ack=8372 Win=32256 Len=0  tcp.stream == 12
239   8.211430 192.168.42.196 -> 65.55.186.235 TCP 54 45638 > http [FIN, ACK] Seq=542 Ack=8372 Win=32256 Len=0  tcp.stream == 12
240   8.326780 65.55.186.235 -> 192.168.42.196 TCP 54 http > 45638 [ACK] Seq=8372 Ack=543 Win=200000 Len=0  tcp.stream == 12
241   8.326799 65.55.186.235 -> 192.168.42.196 TCP 54 http > 45638 [FIN, ACK] Seq=8372 Ack=543 Win=200000 Len=0  tcp.stream == 12
242   8.326807 192.168.42.196 -> 65.55.186.235 TCP 54 45638 > http [ACK] Seq=543 Ack=8373 Win=32256 Len=0  tcp.stream == 12
243   8.588031  65.54.95.43 -> 192.168.42.196 TCP 1314 [TCP segment of a reassembled PDU]  tcp.stream == 16
244   8.588047 192.168.42.196 -> 65.54.95.43  TCP 54 36631 > http [ACK] Seq=428 Ack=1261 Win=17152 Len=0  tcp.stream == 16
245   8.588054  65.54.95.43 -> 192.168.42.196 TCP 1314 [TCP segment of a reassembled PDU]  tcp.stream == 16
246   8.588056 192.168.42.196 -> 65.54.95.43  TCP 54 36631 > http [ACK] Seq=428 Ack=2521 Win=19712 Len=0  tcp.stream == 16
247   8.597373  65.54.95.43 -> 192.168.42.196 TCP 1314 [TCP segment of a reassembled PDU]  tcp.stream == 16
248   8.597393 192.168.42.196 -> 65.54.95.43  TCP 54 36631 > http [ACK] Seq=428 Ack=3781 Win=22272 Len=0  tcp.stream == 16
249   8.597401  65.54.95.43 -> 192.168.42.196 TCP 1314 [TCP segment of a reassembled PDU]  tcp.stream == 16
250   8.597403 192.168.42.196 -> 65.54.95.43  TCP 54 36631 > http [ACK] Seq=428 Ack=5041 Win=24704 Len=0  tcp.stream == 16
251   8.607272  65.54.95.43 -> 192.168.42.196 TCP 1314 [TCP segment of a reassembled PDU]  tcp.stream == 16
252   8.607289 192.168.42.196 -> 65.54.95.43  TCP 54 36631 > http [ACK] Seq=428 Ack=6301 Win=27264 Len=0  tcp.stream == 16
253   8.617121  65.54.95.43 -> 192.168.42.196 TCP 1314 [TCP segment of a reassembled PDU]  tcp.stream == 16
254   8.617135 192.168.42.196 -> 65.54.95.43  TCP 54 36631 > http [ACK] Seq=428 Ack=7561 Win=29824 Len=0  tcp.stream == 16
255   8.617141  65.54.95.43 -> 192.168.42.196 TCP 1232 [TCP segment of a reassembled PDU]  tcp.stream == 16
256   8.617143 192.168.42.196 -> 65.54.95.43  TCP 54 36631 > http [ACK] Seq=428 Ack=8739 Win=32256 Len=0  tcp.stream == 16
257   8.637892  65.54.95.43 -> 192.168.42.196 TCP 1314 [TCP segment of a reassembled PDU]  tcp.stream == 16
258   8.637909 192.168.42.196 -> 65.54.95.43  TCP 54 36631 > http [ACK] Seq=428 Ack=9999 Win=34816 Len=0  tcp.stream == 16
259   8.637916  65.54.95.43 -> 192.168.42.196 TCP 1314 [TCP segment of a reassembled PDU]  tcp.stream == 16
260   8.637918 192.168.42.196 -> 65.54.95.43  TCP 54 36631 > http [ACK] Seq=428 Ack=11259 Win=37376 Len=0  tcp.stream == 16
261   8.637921  65.54.95.43 -> 192.168.42.196 TCP 1314 [TCP segment of a reassembled PDU]  tcp.stream == 16
262   8.637925 192.168.42.196 -> 65.54.95.43  TCP 54 36631 > http [ACK] Seq=428 Ack=12519 Win=39808 Len=0  tcp.stream == 16
263   8.647649  65.54.95.43 -> 192.168.42.196 TCP 1314 [TCP segment of a reassembled PDU]  tcp.stream == 16
264   8.647668 192.168.42.196 -> 65.54.95.43  TCP 54 36631 > http [ACK] Seq=428 Ack=13779 Win=42368 Len=0  tcp.stream == 16
265   8.707775  65.54.95.43 -> 192.168.42.196 TCP 1314 [TCP segment of a reassembled PDU]  tcp.stream == 16
266   8.707794 192.168.42.196 -> 65.54.95.43  TCP 54 36631 > http [ACK] Seq=428 Ack=15039 Win=44928 Len=0  tcp.stream == 16
267   8.707854  65.54.95.43 -> 192.168.42.196 TCP 1314 [TCP segment of a reassembled PDU]  tcp.stream == 16
268   8.707859 192.168.42.196 -> 65.54.95.43  TCP 54 36631 > http [ACK] Seq=428 Ack=16299 Win=47360 Len=0  tcp.stream == 16
269   8.719397  65.54.95.43 -> 192.168.42.196 TCP 1314 [TCP segment of a reassembled PDU]  tcp.stream == 16
270   8.719419 192.168.42.196 -> 65.54.95.43  TCP 54 36631 > http [ACK] Seq=428 Ack=17559 Win=49920 Len=0  tcp.stream == 16
271   8.726874  65.54.95.43 -> 192.168.42.196 TCP 1314 [TCP segment of a reassembled PDU]  tcp.stream == 16
272   8.726889 192.168.42.196 -> 65.54.95.43  TCP 54 36631 > http [ACK] Seq=428 Ack=18819 Win=52480 Len=0  tcp.stream == 16
273   8.738263  65.54.95.43 -> 192.168.42.196 TCP 1314 [TCP segment of a reassembled PDU]  tcp.stream == 16
274   8.738278 192.168.42.196 -> 65.54.95.43  TCP 54 36631 > http [ACK] Seq=428 Ack=20079 Win=55040 Len=0  tcp.stream == 16
275   8.748013  65.54.95.43 -> 192.168.42.196 TCP 1314 [TCP segment of a reassembled PDU]  tcp.stream == 16
276   8.748028 192.168.42.196 -> 65.54.95.43  TCP 54 36631 > http [ACK] Seq=428 Ack=21339 Win=57472 Len=0  tcp.stream == 16
277   8.748035  65.54.95.43 -> 192.168.42.196 TCP 1314 [TCP segment of a reassembled PDU]  tcp.stream == 16
278   8.748037 192.168.42.196 -> 65.54.95.43  TCP 54 36631 > http [ACK] Seq=428 Ack=22599 Win=60032 Len=0  tcp.stream == 16
279   8.748104  65.54.95.43 -> 192.168.42.196 TCP 1314 [TCP segment of a reassembled PDU]  tcp.stream == 16
280   8.748110 192.168.42.196 -> 65.54.95.43  TCP 54 36631 > http [ACK] Seq=428 Ack=23859 Win=62592 Len=0  tcp.stream == 16
281   8.757768  65.54.95.43 -> 192.168.42.196 TCP 1314 [TCP segment of a reassembled PDU]  tcp.stream == 16
282   8.757789 192.168.42.196 -> 65.54.95.43  TCP 54 36631 > http [ACK] Seq=428 Ack=25119 Win=64128 Len=0  tcp.stream == 16
283   8.757796  65.54.95.43 -> 192.168.42.196 TCP 1314 [TCP segment of a reassembled PDU]  tcp.stream == 16
284   8.757798 192.168.42.196 -> 65.54.95.43  TCP 54 36631 > http [ACK] Seq=428 Ack=26379 Win=62976 Len=0  tcp.stream == 16
285   8.767240  65.54.95.43 -> 192.168.42.196 TCP 1314 [TCP segment of a reassembled PDU]  tcp.stream == 16
286   8.767255 192.168.42.196 -> 65.54.95.43  TCP 54 36631 > http [ACK] Seq=428 Ack=27639 Win=64128 Len=0  tcp.stream == 16
287   8.777996  65.54.95.43 -> 192.168.42.196 TCP 1314 [TCP segment of a reassembled PDU]  tcp.stream == 16
288   8.778011 192.168.42.196 -> 65.54.95.43  TCP 54 36631 > http [ACK] Seq=428 Ack=28899 Win=64128 Len=0  tcp.stream == 16
289   8.778016  65.54.95.43 -> 192.168.42.196 TCP 1314 [TCP segment of a reassembled PDU]  tcp.stream == 16
290   8.778018 192.168.42.196 -> 65.54.95.43  TCP 54 36631 > http [ACK] Seq=428 Ack=30159 Win=62976 Len=0  tcp.stream == 16
291   8.786863  65.54.95.43 -> 192.168.42.196 HTTP 406 HTTP/1.1 200 OK  (application/x-javascript)  tcp.stream == 16
292   8.786902 192.168.42.196 -> 65.54.95.43  TCP 54 36631 > http [ACK] Seq=428 Ack=30511 Win=64128 Len=0  tcp.stream == 16
293   8.788994 192.168.42.196 -> 65.54.95.43  TCP 54 36631 > http [FIN, ACK] Seq=428 Ack=30511 Win=64128 Len=0  tcp.stream == 16
294   8.896747  65.54.95.43 -> 192.168.42.196 TCP 54 http > 36631 [ACK] Seq=30511 Ack=429 Win=200000 Len=0  tcp.stream == 16
295   8.896766  65.54.95.43 -> 192.168.42.196 TCP 54 http > 36631 [FIN, ACK] Seq=30511 Ack=429 Win=200000 Len=0  tcp.stream == 16
296   8.896773 192.168.42.196 -> 65.54.95.43  TCP 54 36631 > http [ACK] Seq=429 Ack=30512 Win=64128 Len=0  tcp.stream == 16
297  10.511792 192.168.42.196 -> 65.55.186.235 TCP 74 45643 > http [SYN] Seq=0 Win=14600 Len=0 MSS=1460 SACK_PERM=1 TSval=43489619 TSecr=0 WS=128  tcp.stream == 17
299  10.602748 192.168.42.196 -> 65.55.186.235 TCP 74 45644 > http [SYN] Seq=0 Win=14600 Len=0 MSS=1460 SACK_PERM=1 TSval=43489642 TSecr=0 WS=128  tcp.stream == 18
300  10.610437 192.168.42.196 -> 65.55.186.235 TCP 74 45645 > http [SYN] Seq=0 Win=14600 Len=0 MSS=1460 SACK_PERM=1 TSval=43489643 TSecr=0 WS=128  tcp.stream == 19
301  10.627985 192.168.42.196 -> 65.55.186.235 TCP 74 45646 > http [SYN] Seq=0 Win=14600 Len=0 MSS=1460 SACK_PERM=1 TSval=43489648 TSecr=0 WS=128  tcp.stream == 20
303  10.639930 192.168.42.196 -> 65.55.186.235 TCP 74 45647 > http [SYN] Seq=0 Win=14600 Len=0 MSS=1460 SACK_PERM=1 TSval=43489651 TSecr=0 WS=128  tcp.stream == 21
304  10.641289 192.168.42.196 -> 65.55.186.235 TCP 74 45648 > http [SYN] Seq=0 Win=14600 Len=0 MSS=1460 SACK_PERM=1 TSval=43489651 TSecr=0 WS=128  tcp.stream == 22
305  10.666981 65.55.186.235 -> 192.168.42.196 TCP 66 http > 45643 [SYN, ACK] Seq=0 Ack=1 Win=65535 Len=0 MSS=1260 WS=4 SACK_PERM=1  tcp.stream == 17
306  10.667004 192.168.42.196 -> 65.55.186.235 TCP 54 45643 > http [ACK] Seq=1 Ack=1 Win=14720 Len=0  tcp.stream == 17
307  10.716610 65.55.186.235 -> 192.168.42.196 TCP 66 http > 45644 [SYN, ACK] Seq=0 Ack=1 Win=65535 Len=0 MSS=1260 WS=4 SACK_PERM=1  tcp.stream == 18
308  10.716636 192.168.42.196 -> 65.55.186.235 TCP 54 45644 > http [ACK] Seq=1 Ack=1 Win=14720 Len=0  tcp.stream == 18
309  10.726604 65.55.186.235 -> 192.168.42.196 TCP 66 http > 45645 [SYN, ACK] Seq=0 Ack=1 Win=65535 Len=0 MSS=1260 WS=4 SACK_PERM=1  tcp.stream == 19
310  10.726629 192.168.42.196 -> 65.55.186.235 TCP 54 45645 > http [ACK] Seq=1 Ack=1 Win=14720 Len=0  tcp.stream == 19
311  10.736479 65.55.186.235 -> 192.168.42.196 TCP 66 http > 45646 [SYN, ACK] Seq=0 Ack=1 Win=65535 Len=0 MSS=1260 WS=4 SACK_PERM=1  tcp.stream == 20
312  10.736503 192.168.42.196 -> 65.55.186.235 TCP 54 45646 > http [ACK] Seq=1 Ack=1 Win=14720 Len=0  tcp.stream == 20
313  10.756735 65.55.186.235 -> 192.168.42.196 TCP 66 http > 45647 [SYN, ACK] Seq=0 Ack=1 Win=65535 Len=0 MSS=1260 WS=4 SACK_PERM=1  tcp.stream == 21
314  10.756761 192.168.42.196 -> 65.55.186.235 TCP 54 45647 > http [ACK] Seq=1 Ack=1 Win=14720 Len=0  tcp.stream == 21
315  10.756768 65.55.186.235 -> 192.168.42.196 TCP 66 http > 45648 [SYN, ACK] Seq=0 Ack=1 Win=65535 Len=0 MSS=1260 WS=4 SACK_PERM=1  tcp.stream == 22
316  10.756779 192.168.42.196 -> 65.55.186.235 TCP 54 45648 > http [ACK] Seq=1 Ack=1 Win=14720 Len=0  tcp.stream == 22
319  10.776481 65.55.186.235 -> 192.168.42.196 TCP 54 [TCP Window Update] http > 45643 [ACK] Seq=1 Ack=1 Win=200000 Len=0  tcp.stream == 17
320  10.791757 192.168.42.196 -> 65.55.186.235 HTTP 506 GET /Images/Logos/MS_Header_320.jpg HTTP/1.1   tcp.stream == 17
321  10.799474 192.168.42.196 -> 65.55.186.235 HTTP 507 GET /Images/Icons/arrow_320-left.png HTTP/1.1   tcp.stream == 18
322  10.800623 192.168.42.196 -> 65.55.186.235 HTTP 508 GET /Images/Icons/arrow_320-right.png HTTP/1.1   tcp.stream == 19
323  10.802196 192.168.42.196 -> 65.55.186.235 HTTP 519 GET /en-us/Images/Panel/banner_xboxgames_320.jpg HTTP/1.1   tcp.stream == 20
324  10.803572 192.168.42.196 -> 65.55.186.235 HTTP 519 GET /en-us/Images/Panel/banner_office365_320.jpg HTTP/1.1   tcp.stream == 22
325  10.804665 192.168.42.196 -> 65.55.186.235 HTTP 517 GET /Images/Icons/PanelDarkArea_320x54_320.png HTTP/1.1   tcp.stream == 21
327  10.827494 65.55.186.235 -> 192.168.42.196 TCP 54 [TCP Window Update] http > 45644 [ACK] Seq=1 Ack=1 Win=200000 Len=0  tcp.stream == 18
329  10.836733 65.55.186.235 -> 192.168.42.196 TCP 54 [TCP Window Update] http > 45645 [ACK] Seq=1 Ack=1 Win=200000 Len=0  tcp.stream == 19
330  10.846847 65.55.186.235 -> 192.168.42.196 TCP 54 [TCP Window Update] http > 45646 [ACK] Seq=1 Ack=1 Win=200000 Len=0  tcp.stream == 20
331  10.878113 65.55.186.235 -> 192.168.42.196 TCP 54 [TCP Window Update] http > 45647 [ACK] Seq=1 Ack=1 Win=200000 Len=0  tcp.stream == 21
332  10.878132 65.55.186.235 -> 192.168.42.196 TCP 54 [TCP Window Update] http > 45648 [ACK] Seq=1 Ack=1 Win=200000 Len=0  tcp.stream == 22
