  3   0.346629 192.168.42.196 -> 205.188.100.58 TCP 74 56383 > http [SYN] Seq=0 Win=14600 Len=0 MSS=1460 SACK_PERM=1 TSval=44527869 TSecr=0 WS=128  tcp.stream == 0
  6   0.598009 192.168.42.196 -> 205.188.101.58 TCP 74 41301 > http [SYN] Seq=0 Win=14600 Len=0 MSS=1460 SACK_PERM=1 TSval=44527932 TSecr=0 WS=128  tcp.stream == 1
  7   0.642125 205.188.100.58 -> 192.168.42.196 TCP 66 http > 56383 [SYN, ACK] Seq=0 Ack=1 Win=65535 Len=0 MSS=1260 WS=4 SACK_PERM=1  tcp.stream == 0
  8   0.642153 192.168.42.196 -> 205.188.100.58 TCP 54 56383 > http [ACK] Seq=1 Ack=1 Win=14720 Len=0  tcp.stream == 0
  9   0.642259 192.168.42.196 -> 205.188.100.58 HTTP 343 GET / HTTP/1.1   tcp.stream == 0
 10   0.971649 205.188.101.58 -> 192.168.42.196 TCP 66 http > 41301 [SYN, ACK] Seq=0 Ack=1 Win=65535 Len=0 MSS=1260 WS=4 SACK_PERM=1  tcp.stream == 1
 11   0.971673 192.168.42.196 -> 205.188.101.58 TCP 54 41301 > http [ACK] Seq=1 Ack=1 Win=14720 Len=0  tcp.stream == 1
 12   1.023119 205.188.100.58 -> 192.168.42.196 TCP 54 [TCP Window Update] http > 56383 [ACK] Seq=1 Ack=1 Win=200000 Len=0  tcp.stream == 0
 13   1.853299 205.188.100.58 -> 192.168.42.196 HTTP 486 HTTP/1.1 301 Moved Permanently  (text/html)  tcp.stream == 0
 14   1.853317 192.168.42.196 -> 205.188.100.58 TCP 54 56383 > http [ACK] Seq=290 Ack=433 Win=15744 Len=0  tcp.stream == 0
 15   1.880236 205.188.101.58 -> 192.168.42.196 TCP 54 [TCP Window Update] http > 41301 [ACK] Seq=1 Ack=1 Win=200000 Len=0  tcp.stream == 1
 20   2.323971 192.168.42.196 -> 207.200.111.13 TCP 74 48059 > http [SYN] Seq=0 Win=14600 Len=0 MSS=1460 SACK_PERM=1 TSval=44528364 TSecr=0 WS=128  tcp.stream == 2
 25   2.573948 192.168.42.196 -> 207.200.111.13 TCP 74 48060 > http [SYN] Seq=0 Win=14600 Len=0 MSS=1460 SACK_PERM=1 TSval=44528426 TSecr=0 WS=128  tcp.stream == 3
 26   2.651236 207.200.111.13 -> 192.168.42.196 TCP 66 http > 48059 [SYN, ACK] Seq=0 Ack=1 Win=65535 Len=0 MSS=1260 WS=4 SACK_PERM=1  tcp.stream == 2
 27   2.651258 192.168.42.196 -> 207.200.111.13 TCP 54 48059 > http [ACK] Seq=1 Ack=1 Win=14720 Len=0  tcp.stream == 2
 28   2.651358 192.168.42.196 -> 207.200.111.13 HTTP 347 GET / HTTP/1.1   tcp.stream == 2
 29   3.191404 207.200.111.13 -> 192.168.42.196 TCP 66 http > 48060 [SYN, ACK] Seq=0 Ack=1 Win=65535 Len=0 MSS=1260 WS=4 SACK_PERM=1  tcp.stream == 3
 30   3.191429 192.168.42.196 -> 207.200.111.13 TCP 54 48060 > http [ACK] Seq=1 Ack=1 Win=14720 Len=0  tcp.stream == 3
 31   3.212605 207.200.111.13 -> 192.168.42.196 TCP 54 [TCP Window Update] http > 48059 [ACK] Seq=1 Ack=1 Win=200000 Len=0  tcp.stream == 2
 32   5.658951 192.168.42.196 -> 207.200.111.13 HTTP 347 [TCP Retransmission] GET / HTTP/1.1   tcp.stream == 2
 33   5.972177 192.168.42.196 -> 205.188.101.58 TCP 54 41301 > http [FIN, ACK] Seq=1 Ack=1 Win=14720 Len=0  tcp.stream == 1
 34   6.971672 192.168.42.196 -> 205.188.100.58 TCP 54 56383 > http [FIN, ACK] Seq=290 Ack=433 Win=15744 Len=0  tcp.stream == 0
 35   8.966800 192.168.42.196 -> 207.200.111.13 TCP 54 48060 > http [FIN, ACK] Seq=1 Ack=1 Win=14720 Len=0  tcp.stream == 3
 38  10.610956 192.168.42.196 -> 205.188.100.58 TCP 54 56383 > http [FIN, ACK] Seq=290 Ack=433 Win=15744 Len=0  tcp.stream == 0
 39  11.666953 192.168.42.196 -> 207.200.111.13 HTTP 347 [TCP Retransmission] GET / HTTP/1.1   tcp.stream == 2
 40  11.970949 192.168.42.196 -> 207.200.111.13 TCP 54 48060 > http [FIN, ACK] Seq=1 Ack=1 Win=14720 Len=0  tcp.stream == 3
 41  13.058950 192.168.42.196 -> 205.188.101.58 TCP 54 41301 > http [FIN, ACK] Seq=1 Ack=1 Win=14720 Len=0  tcp.stream == 1
 42  17.180284 207.200.111.13 -> 192.168.42.196 TCP 66 http > 48060 [SYN, ACK] Seq=0 Ack=1 Win=65535 Len=0 MSS=1260 WS=4 SACK_PERM=1  tcp.stream == 3
 43  17.180307 192.168.42.196 -> 207.200.111.13 TCP 66 [TCP Dup ACK 40#1] 48060 > http [ACK] Seq=2 Ack=1 Win=14720 Len=0 SLE=0 SRE=1  tcp.stream == 3
 44  17.511158 207.200.111.13 -> 192.168.42.196 TCP 54 [TCP Window Update] http > 48060 [ACK] Seq=1 Ack=1 Win=200000 Len=0  tcp.stream == 3
 45  17.890948 192.168.42.196 -> 205.188.100.58 TCP 54 56383 > http [FIN, ACK] Seq=290 Ack=433 Win=15744 Len=0  tcp.stream == 0
 46  17.986951 192.168.42.196 -> 207.200.111.13 TCP 54 48060 > http [FIN, ACK] Seq=1 Ack=1 Win=14720 Len=0  tcp.stream == 3
 47  18.180022 205.188.100.58 -> 192.168.42.196 TCP 54 http > 56383 [ACK] Seq=433 Ack=291 Win=200000 Len=0  tcp.stream == 0
 48  18.202132 205.188.100.58 -> 192.168.42.196 TCP 54 http > 56383 [FIN, ACK] Seq=433 Ack=291 Win=200000 Len=0  tcp.stream == 0
 49  18.202150 192.168.42.196 -> 205.188.100.58 TCP 54 56383 > http [ACK] Seq=291 Ack=434 Win=15744 Len=0  tcp.stream == 0
 50  18.323010 207.200.111.13 -> 192.168.42.196 TCP 54 http > 48060 [ACK] Seq=1 Ack=2 Win=200000 Len=0  tcp.stream == 3
 51  18.333379 207.200.111.13 -> 192.168.42.196 TCP 54 http > 48060 [FIN, ACK] Seq=1 Ack=2 Win=200000 Len=0  tcp.stream == 3
 52  18.333395 192.168.42.196 -> 207.200.111.13 TCP 54 48060 > http [ACK] Seq=2 Ack=2 Win=14720 Len=0  tcp.stream == 3
 53  23.682975 192.168.42.196 -> 207.200.111.13 HTTP 347 [TCP Retransmission] GET / HTTP/1.1   tcp.stream == 2
 54  24.541642 207.200.111.13 -> 192.168.42.196 TCP 54 http > 48059 [ACK] Seq=1 Ack=294 Win=200000 Len=0  tcp.stream == 2
 55  24.917753 207.200.111.13 -> 192.168.42.196 TCP 1314 [TCP segment of a reassembled PDU]  tcp.stream == 2
 56  24.917770 192.168.42.196 -> 207.200.111.13 TCP 54 48059 > http [ACK] Seq=294 Ack=1261 Win=17152 Len=0  tcp.stream == 2
 57  24.917778 207.200.111.13 -> 192.168.42.196 TCP 1314 [TCP segment of a reassembled PDU]  tcp.stream == 2
 58  24.917781 192.168.42.196 -> 207.200.111.13 TCP 54 48059 > http [ACK] Seq=294 Ack=2521 Win=19712 Len=0  tcp.stream == 2
 59  24.937217 207.200.111.13 -> 192.168.42.196 TCP 1314 [TCP segment of a reassembled PDU]  tcp.stream == 2
 60  24.937237 192.168.42.196 -> 207.200.111.13 TCP 54 48059 > http [ACK] Seq=294 Ack=3781 Win=22272 Len=0  tcp.stream == 2
 61  24.937245 207.200.111.13 -> 192.168.42.196 TCP 1314 [TCP segment of a reassembled PDU]  tcp.stream == 2
 62  24.937247 192.168.42.196 -> 207.200.111.13 TCP 54 48059 > http [ACK] Seq=294 Ack=5041 Win=24704 Len=0  tcp.stream == 2
 63  24.937250 207.200.111.13 -> 192.168.42.196 TCP 454 [TCP segment of a reassembled PDU]  tcp.stream == 2
 64  24.937254 192.168.42.196 -> 207.200.111.13 TCP 54 48059 > http [ACK] Seq=294 Ack=5441 Win=27264 Len=0  tcp.stream == 2
 65  24.937322 207.200.111.13 -> 192.168.42.196 TCP 1314 [TCP segment of a reassembled PDU]  tcp.stream == 2
 66  24.937325 192.168.42.196 -> 207.200.111.13 TCP 54 48059 > http [ACK] Seq=294 Ack=6701 Win=29824 Len=0  tcp.stream == 2
 69  24.946461 207.200.111.13 -> 192.168.42.196 TCP 1314 [TCP segment of a reassembled PDU]  tcp.stream == 2
 70  24.946480 192.168.42.196 -> 207.200.111.13 TCP 54 48059 > http [ACK] Seq=294 Ack=7961 Win=32256 Len=0  tcp.stream == 2
 71  24.946487 207.200.111.13 -> 192.168.42.196 TCP 1314 [TCP segment of a reassembled PDU]  tcp.stream == 2
 72  24.946490 192.168.42.196 -> 207.200.111.13 TCP 54 48059 > http [ACK] Seq=294 Ack=9221 Win=34816 Len=0  tcp.stream == 2
 73  24.951386 192.168.42.196 -> 207.200.111.13 TCP 74 48061 > http [SYN] Seq=0 Win=14600 Len=0 MSS=1460 SACK_PERM=1 TSval=44534021 TSecr=0 WS=128  tcp.stream == 4
 74  24.956588 207.200.111.13 -> 192.168.42.196 TCP 1314 [TCP segment of a reassembled PDU]  tcp.stream == 2
 75  24.956606 192.168.42.196 -> 207.200.111.13 TCP 54 48059 > http [ACK] Seq=294 Ack=10481 Win=37376 Len=0  tcp.stream == 2
 76  24.956622 207.200.111.13 -> 192.168.42.196 TCP 1314 [TCP segment of a reassembled PDU]  tcp.stream == 2
 77  24.956625 192.168.42.196 -> 207.200.111.13 TCP 54 48059 > http [ACK] Seq=294 Ack=11741 Win=39808 Len=0  tcp.stream == 2
 78  24.956694 207.200.111.13 -> 192.168.42.196 TCP 554 [TCP segment of a reassembled PDU]  tcp.stream == 2
 79  24.956699 192.168.42.196 -> 207.200.111.13 TCP 54 48059 > http [ACK] Seq=294 Ack=12241 Win=42368 Len=0  tcp.stream == 2
 81  24.966331 207.200.111.13 -> 192.168.42.196 TCP 1314 [TCP segment of a reassembled PDU]  tcp.stream == 2
 82  24.966347 192.168.42.196 -> 207.200.111.13 TCP 54 48059 > http [ACK] Seq=294 Ack=13501 Win=44928 Len=0  tcp.stream == 2
 83  25.056340 207.200.111.13 -> 192.168.42.196 TCP 1314 [TCP segment of a reassembled PDU]  tcp.stream == 2
 84  25.056358 192.168.42.196 -> 207.200.111.13 TCP 54 48059 > http [ACK] Seq=294 Ack=14761 Win=47360 Len=0  tcp.stream == 2
 85  25.056456 207.200.111.13 -> 192.168.42.196 TCP 1314 [TCP segment of a reassembled PDU]  tcp.stream == 2
 86  25.056461 192.168.42.196 -> 207.200.111.13 TCP 54 48059 > http [ACK] Seq=294 Ack=16021 Win=49920 Len=0  tcp.stream == 2
 87  25.066331 207.200.111.13 -> 192.168.42.196 TCP 1314 [TCP segment of a reassembled PDU]  tcp.stream == 2
 88  25.066345 192.168.42.196 -> 207.200.111.13 TCP 54 48059 > http [ACK] Seq=294 Ack=17281 Win=52480 Len=0  tcp.stream == 2
 89  25.066444 207.200.111.13 -> 192.168.42.196 TCP 1314 [TCP segment of a reassembled PDU]  tcp.stream == 2
 90  25.066448 192.168.42.196 -> 207.200.111.13 TCP 54 48059 > http [ACK] Seq=294 Ack=18541 Win=55040 Len=0  tcp.stream == 2
 91  25.075202 207.200.111.13 -> 192.168.42.196 TCP 1314 [TCP segment of a reassembled PDU]  tcp.stream == 2
 92  25.075216 192.168.42.196 -> 207.200.111.13 TCP 54 48059 > http [ACK] Seq=294 Ack=19801 Win=57472 Len=0  tcp.stream == 2
 93  25.085461 207.200.111.13 -> 192.168.42.196 TCP 1314 [TCP segment of a reassembled PDU]  tcp.stream == 2
 94  25.085479 192.168.42.196 -> 207.200.111.13 TCP 54 48059 > http [ACK] Seq=294 Ack=21061 Win=60032 Len=0  tcp.stream == 2
 95  25.085486 207.200.111.13 -> 192.168.42.196 TCP 1314 [TCP segment of a reassembled PDU]  tcp.stream == 2
 96  25.085488 192.168.42.196 -> 207.200.111.13 TCP 54 48059 > http [ACK] Seq=294 Ack=22321 Win=62592 Len=0  tcp.stream == 2
 98  25.095464 207.200.111.13 -> 192.168.42.196 TCP 1314 [TCP segment of a reassembled PDU]  tcp.stream == 2
 99  25.095484 192.168.42.196 -> 207.200.111.13 TCP 54 48059 > http [ACK] Seq=294 Ack=23581 Win=64128 Len=0  tcp.stream == 2
100  25.095492 207.200.111.13 -> 192.168.42.196 TCP 1314 [TCP segment of a reassembled PDU]  tcp.stream == 2
101  25.095494 192.168.42.196 -> 207.200.111.13 TCP 54 48059 > http [ACK] Seq=294 Ack=24841 Win=62976 Len=0  tcp.stream == 2
105  25.105456 207.200.111.13 -> 192.168.42.196 TCP 1314 [TCP segment of a reassembled PDU]  tcp.stream == 2
106  25.105473 192.168.42.196 -> 207.200.111.13 TCP 54 48059 > http [ACK] Seq=294 Ack=26101 Win=64128 Len=0  tcp.stream == 2
107  25.105571 207.200.111.13 -> 192.168.42.196 TCP 1314 [TCP segment of a reassembled PDU]  tcp.stream == 2
108  25.105576 192.168.42.196 -> 207.200.111.13 TCP 54 48059 > http [ACK] Seq=294 Ack=27361 Win=64128 Len=0  tcp.stream == 2
109  25.116585 207.200.111.13 -> 192.168.42.196 HTTP 583 HTTP/1.1 200 OK  (text/html)  tcp.stream == 2
110  25.116602 192.168.42.196 -> 207.200.111.13 TCP 54 48059 > http [ACK] Seq=294 Ack=27890 Win=64128 Len=0  tcp.stream == 2
111  25.116609 207.200.111.13 -> 192.168.42.196 TCP 66 http > 48061 [SYN, ACK] Seq=0 Ack=1 Win=65535 Len=0 MSS=1260 WS=4 SACK_PERM=1  tcp.stream == 4
112  25.116616 192.168.42.196 -> 207.200.111.13 TCP 54 48061 > http [ACK] Seq=1 Ack=1 Win=14720 Len=0  tcp.stream == 4
114  25.116776 192.168.42.196 -> 207.200.111.13 HTTP 509 GET /ads/load_v7.html HTTP/1.1   tcp.stream == 2
120  25.117574 192.168.42.196 -> 67.131.38.11 TCP 74 44965 > http [SYN] Seq=0 Win=14600 Len=0 MSS=1460 SACK_PERM=1 TSval=44534062 TSecr=0 WS=128  tcp.stream == 5
121  25.117606 192.168.42.196 -> 67.131.38.11 TCP 74 44966 > http [SYN] Seq=0 Win=14600 Len=0 MSS=1460 SACK_PERM=1 TSval=44534062 TSecr=0 WS=128  tcp.stream == 6
122  25.117627 192.168.42.196 -> 67.131.38.11 TCP 74 44967 > http [SYN] Seq=0 Win=14600 Len=0 MSS=1460 SACK_PERM=1 TSval=44534062 TSecr=0 WS=128  tcp.stream == 7
123  25.117651 192.168.42.196 -> 67.148.71.41 TCP 74 60603 > http [SYN] Seq=0 Win=14600 Len=0 MSS=1460 SACK_PERM=1 TSval=44534062 TSecr=0 WS=128  tcp.stream == 8
124  25.117671 192.168.42.196 -> 67.148.71.41 TCP 74 60604 > http [SYN] Seq=0 Win=14600 Len=0 MSS=1460 SACK_PERM=1 TSval=44534062 TSecr=0 WS=128  tcp.stream == 9
125  25.117708 192.168.42.196 -> 67.148.71.41 TCP 74 60605 > http [SYN] Seq=0 Win=14600 Len=0 MSS=1460 SACK_PERM=1 TSval=44534062 TSecr=0 WS=128  tcp.stream == 10
126  25.117729 192.168.42.196 -> 67.148.71.41 TCP 74 60606 > http [SYN] Seq=0 Win=14600 Len=0 MSS=1460 SACK_PERM=1 TSval=44534062 TSecr=0 WS=128  tcp.stream == 11
127  25.117748 192.168.42.196 -> 67.148.71.41 TCP 74 60607 > http [SYN] Seq=0 Win=14600 Len=0 MSS=1460 SACK_PERM=1 TSval=44534062 TSecr=0 WS=128  tcp.stream == 12
128  25.117767 192.168.42.196 -> 67.148.71.41 TCP 74 60608 > http [SYN] Seq=0 Win=14600 Len=0 MSS=1460 SACK_PERM=1 TSval=44534062 TSecr=0 WS=128  tcp.stream == 13
132  25.155750 192.168.42.196 -> 67.131.38.41 TCP 74 47193 > http [SYN] Seq=0 Win=14600 Len=0 MSS=1460 SACK_PERM=1 TSval=44534072 TSecr=0 WS=128  tcp.stream == 14
133  25.155784 192.168.42.196 -> 67.131.38.41 TCP 74 47194 > http [SYN] Seq=0 Win=14600 Len=0 MSS=1460 SACK_PERM=1 TSval=44534072 TSecr=0 WS=128  tcp.stream == 15
134  25.155818 192.168.42.196 -> 67.131.38.41 TCP 74 47195 > http [SYN] Seq=0 Win=14600 Len=0 MSS=1460 SACK_PERM=1 TSval=44534072 TSecr=0 WS=128  tcp.stream == 16
135  25.155845 192.168.42.196 -> 67.131.38.41 TCP 74 47196 > http [SYN] Seq=0 Win=14600 Len=0 MSS=1460 SACK_PERM=1 TSval=44534072 TSecr=0 WS=128  tcp.stream == 17
136  25.155882 192.168.42.196 -> 67.131.38.41 TCP 74 47197 > http [SYN] Seq=0 Win=14600 Len=0 MSS=1460 SACK_PERM=1 TSval=44534072 TSecr=0 WS=128  tcp.stream == 18
137  25.155912 192.168.42.196 -> 67.131.38.41 TCP 74 47198 > http [SYN] Seq=0 Win=14600 Len=0 MSS=1460 SACK_PERM=1 TSval=44534072 TSecr=0 WS=128  tcp.stream == 19
138  25.234966 207.200.111.13 -> 192.168.42.196 TCP 54 [TCP Window Update] http > 48061 [ACK] Seq=1 Ack=1 Win=200000 Len=0  tcp.stream == 4
148  25.247029 192.168.42.196 -> 67.148.71.41 TCP 74 60615 > http [SYN] Seq=0 Win=14600 Len=0 MSS=1460 SACK_PERM=1 TSval=44534095 TSecr=0 WS=128  tcp.stream == 20
149  25.247091 192.168.42.196 -> 67.148.71.41 TCP 74 60616 > http [SYN] Seq=0 Win=14600 Len=0 MSS=1460 SACK_PERM=1 TSval=44534095 TSecr=0 WS=128  tcp.stream == 21
150  25.247121 192.168.42.196 -> 67.148.71.41 TCP 74 60617 > http [SYN] Seq=0 Win=14600 Len=0 MSS=1460 SACK_PERM=1 TSval=44534095 TSecr=0 WS=128  tcp.stream == 22
151  25.247147 192.168.42.196 -> 64.236.85.82 TCP 74 48753 > http [SYN] Seq=0 Win=14600 Len=0 MSS=1460 SACK_PERM=1 TSval=44534095 TSecr=0 WS=128  tcp.stream == 23
152  25.247174 192.168.42.196 -> 67.131.38.58 TCP 74 34936 > http [SYN] Seq=0 Win=14600 Len=0 MSS=1460 SACK_PERM=1 TSval=44534095 TSecr=0 WS=128  tcp.stream == 24
153  25.247210 192.168.42.196 -> 67.131.38.58 TCP 74 34937 > http [SYN] Seq=0 Win=14600 Len=0 MSS=1460 SACK_PERM=1 TSval=44534095 TSecr=0 WS=128  tcp.stream == 25
157  25.255855 192.168.42.196 -> 67.148.71.42 TCP 74 38051 > http [SYN] Seq=0 Win=14600 Len=0 MSS=1460 SACK_PERM=1 TSval=44534097 TSecr=0 WS=128  tcp.stream == 26
158  25.255945 192.168.42.196 -> 67.148.71.42 TCP 74 38052 > http [SYN] Seq=0 Win=14600 Len=0 MSS=1460 SACK_PERM=1 TSval=44534097 TSecr=0 WS=128  tcp.stream == 27
159  25.256031 192.168.42.196 -> 67.148.71.42 TCP 74 38053 > http [SYN] Seq=0 Win=14600 Len=0 MSS=1460 SACK_PERM=1 TSval=44534097 TSecr=0 WS=128  tcp.stream == 28
160  25.256101 192.168.42.196 -> 67.148.71.42 TCP 74 38054 > http [SYN] Seq=0 Win=14600 Len=0 MSS=1460 SACK_PERM=1 TSval=44534097 TSecr=0 WS=128  tcp.stream == 29
161  25.265334 67.131.38.11 -> 192.168.42.196 TCP 66 http > 44965 [SYN, ACK] Seq=0 Ack=1 Win=65535 Len=0 MSS=1260 WS=4 SACK_PERM=1  tcp.stream == 5
162  25.265364 192.168.42.196 -> 67.131.38.11 TCP 54 44965 > http [ACK] Seq=1 Ack=1 Win=14720 Len=0  tcp.stream == 5
163  25.265455 67.131.38.11 -> 192.168.42.196 TCP 66 http > 44966 [SYN, ACK] Seq=0 Ack=1 Win=65535 Len=0 MSS=1260 WS=4 SACK_PERM=1  tcp.stream == 6
164  25.265462 192.168.42.196 -> 67.131.38.11 TCP 54 44966 > http [ACK] Seq=1 Ack=1 Win=14720 Len=0  tcp.stream == 6
165  25.265465 67.148.71.41 -> 192.168.42.196 TCP 66 http > 60603 [SYN, ACK] Seq=0 Ack=1 Win=65535 Len=0 MSS=1260 WS=4 SACK_PERM=1  tcp.stream == 8
166  25.265480 192.168.42.196 -> 67.148.71.41 TCP 54 60603 > http [ACK] Seq=1 Ack=1 Win=14720 Len=0  tcp.stream == 8
167  25.265482 67.131.38.11 -> 192.168.42.196 TCP 66 http > 44967 [SYN, ACK] Seq=0 Ack=1 Win=65535 Len=0 MSS=1260 WS=4 SACK_PERM=1  tcp.stream == 7
168  25.265485 192.168.42.196 -> 67.131.38.11 TCP 54 44967 > http [ACK] Seq=1 Ack=1 Win=14720 Len=0  tcp.stream == 7
169  25.265487 67.148.71.41 -> 192.168.42.196 TCP 66 http > 60605 [SYN, ACK] Seq=0 Ack=1 Win=65535 Len=0 MSS=1260 WS=4 SACK_PERM=1  tcp.stream == 10
170  25.265492 192.168.42.196 -> 67.148.71.41 TCP 54 60605 > http [ACK] Seq=1 Ack=1 Win=14720 Len=0  tcp.stream == 10
171  25.265494 67.148.71.41 -> 192.168.42.196 TCP 66 http > 60604 [SYN, ACK] Seq=0 Ack=1 Win=65535 Len=0 MSS=1260 WS=4 SACK_PERM=1  tcp.stream == 9
172  25.265497 192.168.42.196 -> 67.148.71.41 TCP 54 60604 > http [ACK] Seq=1 Ack=1 Win=14720 Len=0  tcp.stream == 9
173  25.265499 67.148.71.41 -> 192.168.42.196 TCP 66 http > 60607 [SYN, ACK] Seq=0 Ack=1 Win=65535 Len=0 MSS=1260 WS=4 SACK_PERM=1  tcp.stream == 12
174  25.265502 192.168.42.196 -> 67.148.71.41 TCP 54 60607 > http [ACK] Seq=1 Ack=1 Win=14720 Len=0  tcp.stream == 12
175  25.265504 67.148.71.41 -> 192.168.42.196 TCP 66 http > 60606 [SYN, ACK] Seq=0 Ack=1 Win=65535 Len=0 MSS=1260 WS=4 SACK_PERM=1  tcp.stream == 11
176  25.265507 192.168.42.196 -> 67.148.71.41 TCP 54 60606 > http [ACK] Seq=1 Ack=1 Win=14720 Len=0  tcp.stream == 11
177  25.265576 192.168.42.196 -> 67.131.38.11 HTTP 335 GET /ads/adsWrapper.js HTTP/1.1   tcp.stream == 5
178  25.265664 192.168.42.196 -> 67.131.38.11 HTTP 335 GET /omniunih.js?v=ptl HTTP/1.1   tcp.stream == 6
179  25.265677 192.168.42.196 -> 67.131.38.11 HTTP 356 GET /js/x.gif HTTP/1.1   tcp.stream == 7
180  25.265700 192.168.42.196 -> 67.148.71.41 HTTP 361 GET /p5/_v65.9/css/maing.css HTTP/1.1   tcp.stream == 8
181  25.265713 192.168.42.196 -> 67.148.71.41 HTTP 362 GET /p5/skin/_v24/juggler.css HTTP/1.1   tcp.stream == 9
182  25.265723 192.168.42.196 -> 67.148.71.41 HTTP 349 GET /p5/_v65.9/js/beacon.min.js HTTP/1.1   tcp.stream == 10
183  25.265734 192.168.42.196 -> 67.148.71.41 HTTP 376 GET /p5/_v65.9/css/w/w32.png HTTP/1.1   tcp.stream == 11
184  25.265744 192.168.42.196 -> 67.148.71.41 HTTP 406 GET /p5/forms/326/7116f573-7cda-4e8f-b2ec-b0d272075b69.png HTTP/1.1   tcp.stream == 12
185  25.275337 67.131.38.41 -> 192.168.42.196 TCP 66 http > 47193 [SYN, ACK] Seq=0 Ack=1 Win=65535 Len=0 MSS=1260 WS=4 SACK_PERM=1  tcp.stream == 14
186  25.275375 192.168.42.196 -> 67.131.38.41 TCP 54 47193 > http [ACK] Seq=1 Ack=1 Win=14720 Len=0  tcp.stream == 14
187  25.275382 67.148.71.41 -> 192.168.42.196 TCP 66 http > 60608 [SYN, ACK] Seq=0 Ack=1 Win=65535 Len=0 MSS=1260 WS=4 SACK_PERM=1  tcp.stream == 13
188  25.275386 192.168.42.196 -> 67.148.71.41 TCP 54 60608 > http [ACK] Seq=1 Ack=1 Win=14720 Len=0  tcp.stream == 13
189  25.275388 67.131.38.41 -> 192.168.42.196 TCP 66 http > 47195 [SYN, ACK] Seq=0 Ack=1 Win=65535 Len=0 MSS=1260 WS=4 SACK_PERM=1  tcp.stream == 16
190  25.275392 192.168.42.196 -> 67.131.38.41 TCP 54 47195 > http [ACK] Seq=1 Ack=1 Win=14720 Len=0  tcp.stream == 16
191  25.275395 67.131.38.41 -> 192.168.42.196 TCP 66 http > 47194 [SYN, ACK] Seq=0 Ack=1 Win=65535 Len=0 MSS=1260 WS=4 SACK_PERM=1  tcp.stream == 15
192  25.275398 192.168.42.196 -> 67.131.38.41 TCP 54 47194 > http [ACK] Seq=1 Ack=1 Win=14720 Len=0  tcp.stream == 15
193  25.275400 67.131.38.41 -> 192.168.42.196 TCP 66 http > 47196 [SYN, ACK] Seq=0 Ack=1 Win=65535 Len=0 MSS=1260 WS=4 SACK_PERM=1  tcp.stream == 17
194  25.275403 192.168.42.196 -> 67.131.38.41 TCP 54 47196 > http [ACK] Seq=1 Ack=1 Win=14720 Len=0  tcp.stream == 17
195  25.275405 67.131.38.41 -> 192.168.42.196 TCP 66 http > 47197 [SYN, ACK] Seq=0 Ack=1 Win=65535 Len=0 MSS=1260 WS=4 SACK_PERM=1  tcp.stream == 18
196  25.275408 192.168.42.196 -> 67.131.38.41 TCP 54 47197 > http [ACK] Seq=1 Ack=1 Win=14720 Len=0  tcp.stream == 18
197  25.275579 192.168.42.196 -> 67.148.71.41 HTTP 407 GET /p5/forms/3619/3fd44455-fa76-46b0-8bcc-962ad8f7126f.png HTTP/1.1   tcp.stream == 13
198  25.275607 192.168.42.196 -> 67.131.38.41 HTTP 392 GET /gen/502649/thumbs/a-PRISONFIRE-386x217.jpg HTTP/1.1   tcp.stream == 14
199  25.275626 192.168.42.196 -> 67.131.38.41 HTTP 386 GET /gen/502685/thumbs/a-SIGN-233x155.jpg HTTP/1.1   tcp.stream == 15
200  25.275643 192.168.42.196 -> 67.131.38.41 HTTP 392 GET /gen/502478/thumbs/a-FRANK640AZ-233x155.jpg HTTP/1.1   tcp.stream == 16
201  25.275662 192.168.42.196 -> 67.131.38.41 HTTP 401 GET /gen/502705/thumbs/s-ANNA-SUI-FALL-2012-large300.jpg HTTP/1.1   tcp.stream == 17
202  25.275691 192.168.42.196 -> 67.131.38.41 HTTP 395 GET /gen/500905/thumbs/s-RIHANNA-WORKOUT-97x75.jpg HTTP/1.1   tcp.stream == 18
203  25.285459 207.200.111.13 -> 192.168.42.196 HTTP 960 HTTP/1.1 200 OK  (text/html)  tcp.stream == 2
204  25.285476 67.131.38.41 -> 192.168.42.196 TCP 66 http > 47198 [SYN, ACK] Seq=0 Ack=1 Win=65535 Len=0 MSS=1260 WS=4 SACK_PERM=1  tcp.stream == 19
205  25.285487 192.168.42.196 -> 67.131.38.41 TCP 54 47198 > http [ACK] Seq=1 Ack=1 Win=14720 Len=0  tcp.stream == 19
206  25.285701 192.168.42.196 -> 67.131.38.41 HTTP 401 GET /gen/498580/thumbs/s-UNDERWATER-DOG-PHOTOS-97x75.jpg HTTP/1.1   tcp.stream == 19
207  25.322961 192.168.42.196 -> 207.200.111.13 TCP 54 48059 > http [ACK] Seq=749 Ack=28796 Win=64128 Len=0  tcp.stream == 2
208  25.355460 67.148.71.41 -> 192.168.42.196 TCP 66 http > 60615 [SYN, ACK] Seq=0 Ack=1 Win=65535 Len=0 MSS=1260 WS=4 SACK_PERM=1  tcp.stream == 20
209  25.355481 192.168.42.196 -> 67.148.71.41 TCP 54 60615 > http [ACK] Seq=1 Ack=1 Win=14720 Len=0  tcp.stream == 20
210  25.355487 67.148.71.41 -> 192.168.42.196 TCP 66 http > 60616 [SYN, ACK] Seq=0 Ack=1 Win=65535 Len=0 MSS=1260 WS=4 SACK_PERM=1  tcp.stream == 21
211  25.355490 192.168.42.196 -> 67.148.71.41 TCP 54 60616 > http [ACK] Seq=1 Ack=1 Win=14720 Len=0  tcp.stream == 21
212  25.355493 67.148.71.41 -> 192.168.42.196 TCP 66 http > 60617 [SYN, ACK] Seq=0 Ack=1 Win=65535 Len=0 MSS=1260 WS=4 SACK_PERM=1  tcp.stream == 22
213  25.355496 192.168.42.196 -> 67.148.71.41 TCP 54 60617 > http [ACK] Seq=1 Ack=1 Win=14720 Len=0  tcp.stream == 22
214  25.355662 192.168.42.196 -> 67.148.71.41 HTTP 429 GET /www.dailyfinance.com/media/2012/02/gary-busey-240cs021412-1329256298_97x75.jpg HTTP/1.1   tcp.stream == 20
215  25.355686 192.168.42.196 -> 67.148.71.41 HTTP 422 GET /jobs.aol.com/articles/media/2012/02/melissa-petro-293jt021512_97x75.jpg HTTP/1.1   tcp.stream == 21
216  25.355699 192.168.42.196 -> 67.148.71.41 HTTP 413 GET /www.engadget.com/media/2012/02/2012-02-1515-16-02600_97x75.jpg HTTP/1.1   tcp.stream == 22
217  25.365335 67.131.38.58 -> 192.168.42.196 TCP 66 http > 34936 [SYN, ACK] Seq=0 Ack=1 Win=65535 Len=0 MSS=1260 WS=4 SACK_PERM=1  tcp.stream == 24
218  25.365363 192.168.42.196 -> 67.131.38.58 TCP 54 34936 > http [ACK] Seq=1 Ack=1 Win=14720 Len=0  tcp.stream == 24
219  25.365378 64.236.85.82 -> 192.168.42.196 TCP 66 http > 48753 [SYN, ACK] Seq=0 Ack=1 Win=65535 Len=0 MSS=1260 WS=4 SACK_PERM=1  tcp.stream == 23
220  25.365384 192.168.42.196 -> 64.236.85.82 TCP 54 48753 > http [ACK] Seq=1 Ack=1 Win=14720 Len=0  tcp.stream == 23
221  25.365386 67.131.38.58 -> 192.168.42.196 TCP 66 http > 34937 [SYN, ACK] Seq=0 Ack=1 Win=65535 Len=0 MSS=1260 WS=4 SACK_PERM=1  tcp.stream == 25
222  25.365390 192.168.42.196 -> 67.131.38.58 TCP 54 34937 > http [ACK] Seq=1 Ack=1 Win=14720 Len=0  tcp.stream == 25
223  25.365392 67.148.71.42 -> 192.168.42.196 TCP 66 http > 38051 [SYN, ACK] Seq=0 Ack=1 Win=65535 Len=0 MSS=1260 WS=4 SACK_PERM=1  tcp.stream == 26
224  25.365397 192.168.42.196 -> 67.148.71.42 TCP 54 38051 > http [ACK] Seq=1 Ack=1 Win=14720 Len=0  tcp.stream == 26
225  25.365497 192.168.42.196 -> 64.236.85.82 HTTP 424 GET /adcedge/lb?site=695501&srvc=1&betr=aolcom_cs=1&betq=13668=438747 HTTP/1.1   tcp.stream == 23
226  25.365518 192.168.42.196 -> 67.131.38.58 HTTP 387 GET /contributors/rick-steves/headshot.jpg HTTP/1.1   tcp.stream == 24
227  25.365532 192.168.42.196 -> 67.131.38.58 HTTP 385 GET /contributors/don-mcnay/headshot.jpg HTTP/1.1   tcp.stream == 25
228  25.365545 192.168.42.196 -> 67.148.71.42 HTTP 388 GET /10345468/517273395_c_140_102.jpg HTTP/1.1   tcp.stream == 26
229  25.376086 67.148.71.42 -> 192.168.42.196 TCP 66 http > 38052 [SYN, ACK] Seq=0 Ack=1 Win=65535 Len=0 MSS=1260 WS=4 SACK_PERM=1  tcp.stream == 27
230  25.376110 192.168.42.196 -> 67.148.71.42 TCP 54 38052 > http [ACK] Seq=1 Ack=1 Win=14720 Len=0  tcp.stream == 27
231  25.376126 67.148.71.42 -> 192.168.42.196 TCP 66 http > 38054 [SYN, ACK] Seq=0 Ack=1 Win=65535 Len=0 MSS=1260 WS=4 SACK_PERM=1  tcp.stream == 29
232  25.376131 192.168.42.196 -> 67.148.71.42 TCP 54 38054 > http [ACK] Seq=1 Ack=1 Win=14720 Len=0  tcp.stream == 29
233  25.376133 67.148.71.42 -> 192.168.42.196 TCP 66 http > 38053 [SYN, ACK] Seq=0 Ack=1 Win=65535 Len=0 MSS=1260 WS=4 SACK_PERM=1  tcp.stream == 28
234  25.376137 192.168.42.196 -> 67.148.71.42 TCP 54 38053 > http [ACK] Seq=1 Ack=1 Win=14720 Len=0  tcp.stream == 28
235  25.376139 67.131.38.11 -> 192.168.42.196 TCP 54 [TCP Window Update] http > 44965 [ACK] Seq=1 Ack=1 Win=200000 Len=0  tcp.stream == 5
236  25.376255 192.168.42.196 -> 67.148.71.42 HTTP 388 GET /10345470/517273484_c_140_102.jpg HTTP/1.1   tcp.stream == 27
237  25.376286 192.168.42.196 -> 67.148.71.42 HTTP 388 GET /10345454/517272679_c_140_102.jpg HTTP/1.1   tcp.stream == 28
238  25.376302 192.168.42.196 -> 67.148.71.42 HTTP 388 GET /10345456/517272763_c_140_102.jpg HTTP/1.1   tcp.stream == 29
239  25.396463 67.148.71.41 -> 192.168.42.196 TCP 54 [TCP Window Update] http > 60605 [ACK] Seq=1 Ack=1 Win=200000 Len=0  tcp.stream == 10
240  25.396477 67.148.71.41 -> 192.168.42.196 TCP 54 [TCP Window Update] http > 60604 [ACK] Seq=1 Ack=1 Win=200000 Len=0  tcp.stream == 9
241  25.396479 67.148.71.41 -> 192.168.42.196 TCP 54 [TCP Window Update] http > 60603 [ACK] Seq=1 Ack=1 Win=200000 Len=0  tcp.stream == 8
242  25.396480 67.131.38.11 -> 192.168.42.196 TCP 54 [TCP Window Update] http > 44967 [ACK] Seq=1 Ack=1 Win=200000 Len=0  tcp.stream == 7
243  25.396482 67.148.71.41 -> 192.168.42.196 TCP 54 [TCP Window Update] http > 60607 [ACK] Seq=1 Ack=1 Win=200000 Len=0  tcp.stream == 12
244  25.396568 67.131.38.11 -> 192.168.42.196 TCP 54 [TCP Window Update] http > 44966 [ACK] Seq=1 Ack=1 Win=200000 Len=0  tcp.stream == 6
245  25.396571 67.148.71.41 -> 192.168.42.196 TCP 54 [TCP Window Update] http > 60606 [ACK] Seq=1 Ack=1 Win=200000 Len=0  tcp.stream == 11
246  25.405337 67.131.38.11 -> 192.168.42.196 TCP 1314 [TCP segment of a reassembled PDU]  tcp.stream == 6
247  25.405354 192.168.42.196 -> 67.131.38.11 TCP 54 44966 > http [ACK] Seq=282 Ack=1261 Win=17152 Len=0  tcp.stream == 6
248  25.405443 67.131.38.11 -> 192.168.42.196 TCP 1314 [TCP segment of a reassembled PDU]  tcp.stream == 6
249  25.405448 192.168.42.196 -> 67.131.38.11 TCP 54 44966 > http [ACK] Seq=282 Ack=2521 Win=19712 Len=0  tcp.stream == 6
250  25.415324 67.131.38.11 -> 192.168.42.196 TCP 1314 [TCP segment of a reassembled PDU]  tcp.stream == 6
251  25.415341 192.168.42.196 -> 67.131.38.11 TCP 54 44966 > http [ACK] Seq=282 Ack=3781 Win=22272 Len=0  tcp.stream == 6
252  25.425586 67.131.38.11 -> 192.168.42.196 TCP 1314 [TCP segment of a reassembled PDU]  tcp.stream == 6
253  25.425604 192.168.42.196 -> 67.131.38.11 TCP 54 44966 > http [ACK] Seq=282 Ack=5041 Win=24704 Len=0  tcp.stream == 6
254  25.425611 67.131.38.11 -> 192.168.42.196 TCP 1314 [TCP segment of a reassembled PDU]  tcp.stream == 6
255  25.425614 192.168.42.196 -> 67.131.38.11 TCP 54 44966 > http [ACK] Seq=282 Ack=6301 Win=27264 Len=0  tcp.stream == 6
256  25.437579 67.131.38.11 -> 192.168.42.196 TCP 1314 [TCP segment of a reassembled PDU]  tcp.stream == 6
257  25.437594 192.168.42.196 -> 67.131.38.11 TCP 54 44966 > http [ACK] Seq=282 Ack=7561 Win=29824 Len=0  tcp.stream == 6
258  25.437693 67.131.38.11 -> 192.168.42.196 TCP 1314 [TCP segment of a reassembled PDU]  tcp.stream == 6
259  25.437698 192.168.42.196 -> 67.131.38.11 TCP 54 44966 > http [ACK] Seq=282 Ack=8821 Win=32256 Len=0  tcp.stream == 6
260  25.445466 67.131.38.11 -> 192.168.42.196 TCP 1314 [TCP segment of a reassembled PDU]  tcp.stream == 6
261  25.445488 192.168.42.196 -> 67.131.38.11 TCP 54 44966 > http [ACK] Seq=282 Ack=10081 Win=34816 Len=0  tcp.stream == 6
262  25.445496 67.131.38.11 -> 192.168.42.196 TCP 1314 [TCP segment of a reassembled PDU]  tcp.stream == 6
263  25.445498 192.168.42.196 -> 67.131.38.11 TCP 54 44966 > http [ACK] Seq=282 Ack=11341 Win=37376 Len=0  tcp.stream == 6
264  25.456956 67.131.38.11 -> 192.168.42.196 TCP 1314 [TCP segment of a reassembled PDU]  tcp.stream == 6
265  25.456973 192.168.42.196 -> 67.131.38.11 TCP 54 44966 > http [ACK] Seq=282 Ack=12601 Win=39808 Len=0  tcp.stream == 6
266  25.465459 67.131.38.11 -> 192.168.42.196 TCP 1314 [TCP segment of a reassembled PDU]  tcp.stream == 6
267  25.465474 192.168.42.196 -> 67.131.38.11 TCP 54 44966 > http [ACK] Seq=282 Ack=13861 Win=42368 Len=0  tcp.stream == 6
268  25.465481 67.131.38.11 -> 192.168.42.196 TCP 1314 [TCP segment of a reassembled PDU]  tcp.stream == 5
269  25.465487 192.168.42.196 -> 67.131.38.11 TCP 54 44965 > http [ACK] Seq=282 Ack=1261 Win=17152 Len=0  tcp.stream == 5
270  25.475711 67.131.38.11 -> 192.168.42.196 TCP 1314 [TCP segment of a reassembled PDU]  tcp.stream == 5
271  25.475727 192.168.42.196 -> 67.131.38.11 TCP 54 44965 > http [ACK] Seq=282 Ack=2521 Win=19712 Len=0  tcp.stream == 5
272  25.475735 67.131.38.11 -> 192.168.42.196 TCP 1203 [TCP segment of a reassembled PDU]  tcp.stream == 5
273  25.475737 192.168.42.196 -> 67.131.38.11 TCP 54 44965 > http [ACK] Seq=282 Ack=3670 Win=22272 Len=0  tcp.stream == 5
274  25.475740 67.131.38.11 -> 192.168.42.196 TCP 797 [TCP segment of a reassembled PDU]  tcp.stream == 5
275  25.475743 192.168.42.196 -> 67.131.38.11 TCP 54 44965 > http [ACK] Seq=282 Ack=4413 Win=24704 Len=0  tcp.stream == 5
276  25.486708 67.131.38.11 -> 192.168.42.196 TCP 1314 [TCP segment of a reassembled PDU]  tcp.stream == 5
277  25.486725 192.168.42.196 -> 67.131.38.11 TCP 54 44965 > http [ACK] Seq=282 Ack=5673 Win=27264 Len=0  tcp.stream == 5
278  25.498100 67.131.38.11 -> 192.168.42.196 TCP 1305 [TCP segment of a reassembled PDU]  tcp.stream == 5
279  25.498117 192.168.42.196 -> 67.131.38.11 TCP 54 44965 > http [ACK] Seq=282 Ack=6924 Win=29824 Len=0  tcp.stream == 5
280  25.498124 67.131.38.11 -> 192.168.42.196 HTTP 74 HTTP/1.1 200 OK  (application/javascript)  tcp.stream == 5
281  25.498127 192.168.42.196 -> 67.131.38.11 TCP 54 44965 > http [ACK] Seq=282 Ack=6944 Win=29824 Len=0  tcp.stream == 5
282  25.498129 67.131.38.11 -> 192.168.42.196 HTTP 362 HTTP/1.1 200 OK  (GIF89a)  tcp.stream == 7
283  25.498135 192.168.42.196 -> 67.131.38.11 TCP 54 44967 > http [ACK] Seq=303 Ack=309 Win=15744 Len=0  tcp.stream == 7
284  25.498138 67.148.71.41 -> 192.168.42.196 TCP 1314 [TCP segment of a reassembled PDU]  tcp.stream == 8
285  25.498141 192.168.42.196 -> 67.148.71.41 TCP 54 60603 > http [ACK] Seq=308 Ack=1261 Win=17152 Len=0  tcp.stream == 8
286  25.506716 67.148.71.41 -> 192.168.42.196 TCP 1314 [TCP segment of a reassembled PDU]  tcp.stream == 8
287  25.506736 192.168.42.196 -> 67.148.71.41 TCP 54 60603 > http [ACK] Seq=308 Ack=2521 Win=19712 Len=0  tcp.stream == 8
288  25.506744 67.148.71.41 -> 192.168.42.196 TCP 1314 [TCP segment of a reassembled PDU]  tcp.stream == 8
289  25.506747 192.168.42.196 -> 67.148.71.41 TCP 54 60603 > http [ACK] Seq=308 Ack=3781 Win=22272 Len=0  tcp.stream == 8
290  25.506749 67.148.71.41 -> 192.168.42.196 TCP 1314 [TCP segment of a reassembled PDU]  tcp.stream == 8
291  25.506753 192.168.42.196 -> 67.148.71.41 TCP 54 60603 > http [ACK] Seq=308 Ack=5041 Win=24704 Len=0  tcp.stream == 8
292  25.515333 67.148.71.41 -> 192.168.42.196 TCP 1314 [TCP segment of a reassembled PDU]  tcp.stream == 8
293  25.515355 192.168.42.196 -> 67.148.71.41 TCP 54 60603 > http [ACK] Seq=308 Ack=6301 Win=27264 Len=0  tcp.stream == 8
294  25.536957 67.148.71.41 -> 192.168.42.196 TCP 1314 [TCP segment of a reassembled PDU]  tcp.stream == 8
295  25.536975 192.168.42.196 -> 67.148.71.41 TCP 54 60603 > http [ACK] Seq=308 Ack=7561 Win=29824 Len=0  tcp.stream == 8
296  25.537069 67.148.71.41 -> 192.168.42.196 TCP 1314 [TCP segment of a reassembled PDU]  tcp.stream == 8
297  25.537075 192.168.42.196 -> 67.148.71.41 TCP 54 60603 > http [ACK] Seq=308 Ack=8821 Win=32256 Len=0  tcp.stream == 8
298  25.537077 67.148.71.41 -> 192.168.42.196 TCP 1314 [TCP segment of a reassembled PDU]  tcp.stream == 8
299  25.537079 192.168.42.196 -> 67.148.71.41 TCP 54 60603 > http [ACK] Seq=308 Ack=10081 Win=34816 Len=0  tcp.stream == 8
300  25.546330 67.148.71.41 -> 192.168.42.196 TCP 1314 [TCP segment of a reassembled PDU]  tcp.stream == 8
301  25.546345 192.168.42.196 -> 67.148.71.41 TCP 54 60603 > http [ACK] Seq=308 Ack=11341 Win=37376 Len=0  tcp.stream == 8
302  25.546446 67.148.71.41 -> 192.168.42.196 TCP 1314 [TCP segment of a reassembled PDU]  tcp.stream == 8
303  25.546451 192.168.42.196 -> 67.148.71.41 TCP 54 60603 > http [ACK] Seq=308 Ack=12601 Win=39808 Len=0  tcp.stream == 8
304  25.556583 67.148.71.41 -> 192.168.42.196 TCP 1314 [TCP segment of a reassembled PDU]  tcp.stream == 8
305  25.556601 192.168.42.196 -> 67.148.71.41 TCP 54 60603 > http [ACK] Seq=308 Ack=13861 Win=42368 Len=0  tcp.stream == 8
306  25.556608 67.148.71.41 -> 192.168.42.196 TCP 1314 [TCP segment of a reassembled PDU]  tcp.stream == 10
307  25.556614 192.168.42.196 -> 67.148.71.41 TCP 54 60605 > http [ACK] Seq=296 Ack=1261 Win=17152 Len=0  tcp.stream == 10
308  25.556692 67.148.71.41 -> 192.168.42.196 TCP 1314 [TCP segment of a reassembled PDU]  tcp.stream == 10
309  25.556697 192.168.42.196 -> 67.148.71.41 TCP 54 60605 > http [ACK] Seq=296 Ack=2521 Win=19712 Len=0  tcp.stream == 10
310  25.566454 67.148.71.41 -> 192.168.42.196 HTTP 368 HTTP/1.1 200 OK  (application/x-javascript)  tcp.stream == 10
311  25.566469 192.168.42.196 -> 67.148.71.41 TCP 54 60605 > http [ACK] Seq=296 Ack=2835 Win=22272 Len=0  tcp.stream == 10
312  25.566582 67.148.71.41 -> 192.168.42.196 HTTP 1030 HTTP/1.1 200 OK  (PNG)  tcp.stream == 11
313  25.566591 192.168.42.196 -> 67.148.71.41 TCP 54 60606 > http [ACK] Seq=323 Ack=977 Win=16640 Len=0  tcp.stream == 11
314  25.566593 67.148.71.41 -> 192.168.42.196 HTTP 537 HTTP/1.1 200 OK  (text/css)  tcp.stream == 9
315  25.566597 192.168.42.196 -> 67.148.71.41 TCP 54 60604 > http [ACK] Seq=309 Ack=484 Win=15744 Len=0  tcp.stream == 9
316  25.566599 67.148.71.41 -> 192.168.42.196 TCP 54 [TCP Window Update] http > 60608 [ACK] Seq=1 Ack=1 Win=200000 Len=0  tcp.stream == 13
317  25.566602 67.131.38.41 -> 192.168.42.196 TCP 54 [TCP Window Update] http > 47195 [ACK] Seq=1 Ack=1 Win=200000 Len=0  tcp.stream == 16
318  25.566603 67.131.38.41 -> 192.168.42.196 TCP 54 [TCP Window Update] http > 47193 [ACK] Seq=1 Ack=1 Win=200000 Len=0  tcp.stream == 14
319  25.566656 192.168.42.196 -> 67.148.71.41 HTTP 343 GET /p5/_v65.9/js/main.js HTTP/1.1   tcp.stream == 10
320  25.567265 192.168.42.196 -> 67.148.71.41 HTTP 376 GET /p5/_v65.9/css/maing.png HTTP/1.1   tcp.stream == 9
321  25.567382 192.168.42.196 -> 67.148.71.41 HTTP 407 GET /p5/forms/4335/97221ba0-aab6-4fd6-b8db-aa2d22fbd728.png HTTP/1.1   tcp.stream == 11
324  25.570698 192.168.42.196 -> 205.188.60.65 TCP 74 45073 > http [SYN] Seq=0 Win=14600 Len=0 MSS=1460 SACK_PERM=1 TSval=44534175 TSecr=0 WS=128  tcp.stream == 30
325  25.577718 67.148.71.41 -> 192.168.42.196 TCP 1314 [TCP segment of a reassembled PDU]  tcp.stream == 12
326  25.577739 192.168.42.196 -> 67.148.71.41 TCP 54 60607 > http [ACK] Seq=353 Ack=1261 Win=17152 Len=0  tcp.stream == 12
327  25.577747 67.131.38.41 -> 192.168.42.196 TCP 54 [TCP Window Update] http > 47194 [ACK] Seq=1 Ack=1 Win=200000 Len=0  tcp.stream == 15
328  25.577751 67.131.38.41 -> 192.168.42.196 TCP 54 [TCP Window Update] http > 47196 [ACK] Seq=1 Ack=1 Win=200000 Len=0  tcp.stream == 17
329  25.577752 67.131.38.41 -> 192.168.42.196 TCP 54 [TCP Window Update] http > 47197 [ACK] Seq=1 Ack=1 Win=200000 Len=0  tcp.stream == 18
330  25.577754 67.148.71.41 -> 192.168.42.196 TCP 54 [TCP Window Update] http > 60615 [ACK] Seq=1 Ack=1 Win=200000 Len=0  tcp.stream == 20
331  25.577756 67.131.38.41 -> 192.168.42.196 TCP 54 [TCP Window Update] http > 47198 [ACK] Seq=1 Ack=1 Win=200000 Len=0  tcp.stream == 19
332  25.577825 67.148.71.41 -> 192.168.42.196 TCP 54 [TCP Window Update] http > 60616 [ACK] Seq=1 Ack=1 Win=200000 Len=0  tcp.stream == 21
333  25.577830 67.148.71.41 -> 192.168.42.196 HTTP 898 HTTP/1.1 200 OK  (PNG)  tcp.stream == 12
334  25.577832 192.168.42.196 -> 67.148.71.41 TCP 54 60607 > http [ACK] Seq=353 Ack=2105 Win=19712 Len=0  tcp.stream == 12
335  25.577835 67.148.71.41 -> 192.168.42.196 TCP 54 [TCP Window Update] http > 60617 [ACK] Seq=1 Ack=1 Win=200000 Len=0  tcp.stream == 22
336  25.577837 67.131.38.58 -> 192.168.42.196 TCP 54 [TCP Window Update] http > 34936 [ACK] Seq=1 Ack=1 Win=200000 Len=0  tcp.stream == 24
337  25.577839 67.148.71.42 -> 192.168.42.196 TCP 54 [TCP Window Update] http > 38051 [ACK] Seq=1 Ack=1 Win=200000 Len=0  tcp.stream == 26
338  25.577841 64.236.85.82 -> 192.168.42.196 TCP 54 [TCP Window Update] http > 48753 [ACK] Seq=1 Ack=1 Win=200000 Len=0  tcp.stream == 23
339  25.577947 67.131.38.58 -> 192.168.42.196 TCP 54 [TCP Window Update] http > 34937 [ACK] Seq=1 Ack=1 Win=200000 Len=0  tcp.stream == 25
340  25.577951 67.148.71.42 -> 192.168.42.196 TCP 54 [TCP Window Update] http > 38052 [ACK] Seq=1 Ack=1 Win=200000 Len=0  tcp.stream == 27
341  25.577953 67.148.71.42 -> 192.168.42.196 TCP 54 [TCP Window Update] http > 38054 [ACK] Seq=1 Ack=1 Win=200000 Len=0  tcp.stream == 29
342  25.577955 67.148.71.42 -> 192.168.42.196 TCP 54 [TCP Window Update] http > 38053 [ACK] Seq=1 Ack=1 Win=200000 Len=0  tcp.stream == 28
343  25.578022 192.168.42.196 -> 67.148.71.41 HTTP 407 GET /p5/forms/4335/5534901d-5f39-4f43-a119-adbb286d996d.png HTTP/1.1   tcp.stream == 12
344  25.585204 67.131.38.41 -> 192.168.42.196 TCP 1314 [TCP segment of a reassembled PDU]  tcp.stream == 17
345  25.585223 192.168.42.196 -> 67.131.38.41 TCP 54 47196 > http [ACK] Seq=348 Ack=1261 Win=17152 Len=0  tcp.stream == 17
346  25.596452 67.131.38.41 -> 192.168.42.196 TCP 1314 [TCP segment of a reassembled PDU]  tcp.stream == 16
347  25.596469 192.168.42.196 -> 67.131.38.41 TCP 54 47195 > http [ACK] Seq=339 Ack=1261 Win=17152 Len=0  tcp.stream == 16
348  25.596567 67.131.38.41 -> 192.168.42.196 TCP 1314 [TCP segment of a reassembled PDU]  tcp.stream == 15
349  25.596574 192.168.42.196 -> 67.131.38.41 TCP 54 47194 > http [ACK] Seq=333 Ack=1261 Win=17152 Len=0  tcp.stream == 15
350  25.631582 67.131.38.41 -> 192.168.42.196 TCP 1314 [TCP segment of a reassembled PDU]  tcp.stream == 14
351  25.631602 192.168.42.196 -> 67.131.38.41 TCP 54 47193 > http [ACK] Seq=339 Ack=1261 Win=17152 Len=0  tcp.stream == 14
352  25.631693 67.131.38.11 -> 192.168.42.196 TCP 1314 [TCP segment of a reassembled PDU]  tcp.stream == 6
353  25.631699 192.168.42.196 -> 67.131.38.11 TCP 54 44966 > http [ACK] Seq=282 Ack=15121 Win=44928 Len=0  tcp.stream == 6
354  25.631702 67.131.38.58 -> 192.168.42.196 HTTP 1149 HTTP/1.1 200 OK  (JPEG JFIF image)  tcp.stream == 25
355  25.631707 192.168.42.196 -> 67.131.38.58 TCP 54 34937 > http [ACK] Seq=332 Ack=1096 Win=16896 Len=0  tcp.stream == 25
356  25.631817 67.148.71.41 -> 192.168.42.196 TCP 1314 [TCP segment of a reassembled PDU]  tcp.stream == 13
357  25.631824 192.168.42.196 -> 67.148.71.41 TCP 54 60608 > http [ACK] Seq=354 Ack=1261 Win=17152 Len=0  tcp.stream == 13
358  25.631826 67.131.38.58 -> 192.168.42.196 HTTP 1106 HTTP/1.1 200 OK  (JPEG JFIF image)  tcp.stream == 24
