  3   4.384220 192.168.42.196 -> 202.72.51.22 TCP 74 53314 > http [SYN] Seq=0 Win=14600 Len=0 MSS=1460 SACK_PERM=1 TSval=44759834 TSecr=0 WS=128  tcp.stream == 0
  4   4.608965 192.168.42.196 -> 202.72.51.22 TCP 74 53315 > http [SYN] Seq=0 Win=14600 Len=0 MSS=1460 SACK_PERM=1 TSval=44759890 TSecr=0 WS=128  tcp.stream == 1
  5   6.319693 202.72.51.22 -> 192.168.42.196 TCP 66 http > 53314 [SYN, ACK] Seq=0 Ack=1 Win=65535 Len=0 MSS=1260 WS=4 SACK_PERM=1  tcp.stream == 0
  6   6.319723 192.168.42.196 -> 202.72.51.22 TCP 54 53314 > http [ACK] Seq=1 Ack=1 Win=14720 Len=0  tcp.stream == 0
  7   6.323776 192.168.42.196 -> 202.72.51.22 HTTP 453 GET / HTTP/1.1   tcp.stream == 0
  8   6.454554 202.72.51.22 -> 192.168.42.196 TCP 66 http > 53315 [SYN, ACK] Seq=0 Ack=1 Win=65535 Len=0 MSS=1260 WS=4 SACK_PERM=1  tcp.stream == 1
  9   6.454579 192.168.42.196 -> 202.72.51.22 TCP 54 53315 > http [ACK] Seq=1 Ack=1 Win=14720 Len=0  tcp.stream == 1
 10   6.454596 202.72.51.22 -> 192.168.42.196 TCP 54 [TCP Window Update] http > 53314 [ACK] Seq=1 Ack=1 Win=200000 Len=0  tcp.stream == 0
 11   6.609302 202.72.51.22 -> 192.168.42.196 TCP 54 [TCP Window Update] http > 53315 [ACK] Seq=1 Ack=1 Win=200000 Len=0  tcp.stream == 1
 12   6.659168 202.72.51.22 -> 192.168.42.196 TCP 54 http > 53314 [ACK] Seq=1 Ack=400 Win=200000 Len=0  tcp.stream == 0
 13   6.909435 202.72.51.22 -> 192.168.42.196 HTTP 445 HTTP/1.1 301 Moved Permanently  (text/html)  tcp.stream == 0
 14   6.909454 192.168.42.196 -> 202.72.51.22 TCP 54 53314 > http [ACK] Seq=400 Ack=392 Win=15744 Len=0  tcp.stream == 0
 15   6.922823 192.168.42.196 -> 202.72.51.22 TCP 54 53314 > http [FIN, ACK] Seq=400 Ack=392 Win=15744 Len=0  tcp.stream == 0
 17   7.059297 202.72.51.22 -> 192.168.42.196 TCP 54 http > 53314 [ACK] Seq=392 Ack=401 Win=200000 Len=0  tcp.stream == 0
 18   7.149426 202.72.51.22 -> 192.168.42.196 TCP 54 http > 53314 [FIN, ACK] Seq=392 Ack=401 Win=200000 Len=0  tcp.stream == 0
 19   7.149446 192.168.42.196 -> 202.72.51.22 TCP 54 53314 > http [ACK] Seq=401 Ack=393 Win=15744 Len=0  tcp.stream == 0
 25   7.839538 192.168.42.196 -> 202.72.53.58 TCP 74 56057 > http [SYN] Seq=0 Win=14600 Len=0 MSS=1460 SACK_PERM=1 TSval=44760697 TSecr=0 WS=128  tcp.stream == 2
 26   7.969436 202.72.53.58 -> 192.168.42.196 TCP 66 http > 56057 [SYN, ACK] Seq=0 Ack=1 Win=65535 Len=0 MSS=1260 WS=4 SACK_PERM=1  tcp.stream == 2
 27   7.969466 192.168.42.196 -> 202.72.53.58 TCP 54 56057 > http [ACK] Seq=1 Ack=1 Win=14720 Len=0  tcp.stream == 2
 28   7.971400 192.168.42.196 -> 202.72.53.58 HTTP 457 GET / HTTP/1.1   tcp.stream == 2
 29   8.109409 202.72.53.58 -> 192.168.42.196 TCP 54 [TCP Window Update] http > 56057 [ACK] Seq=1 Ack=1 Win=200000 Len=0  tcp.stream == 2
 30   8.359341 202.72.53.58 -> 192.168.42.196 TCP 54 http > 56057 [ACK] Seq=1 Ack=404 Win=200000 Len=0  tcp.stream == 2
 31   9.710687 202.72.53.58 -> 192.168.42.196 TCP 1314 [TCP segment of a reassembled PDU]  tcp.stream == 2
 32   9.710706 192.168.42.196 -> 202.72.53.58 TCP 54 56057 > http [ACK] Seq=404 Ack=1261 Win=17152 Len=0  tcp.stream == 2
 33   9.710715 202.72.53.58 -> 192.168.42.196 TCP 1314 [TCP segment of a reassembled PDU]  tcp.stream == 2
 34   9.710718 192.168.42.196 -> 202.72.53.58 TCP 54 56057 > http [ACK] Seq=404 Ack=2521 Win=19712 Len=0  tcp.stream == 2
 35   9.710753 202.72.53.58 -> 192.168.42.196 TCP 471 [TCP segment of a reassembled PDU]  tcp.stream == 2
 36   9.710759 192.168.42.196 -> 202.72.53.58 TCP 54 56057 > http [ACK] Seq=404 Ack=2938 Win=22272 Len=0  tcp.stream == 2
 37   9.731020 202.72.53.58 -> 192.168.42.196 TCP 1314 [TCP segment of a reassembled PDU]  tcp.stream == 2
 38   9.731041 192.168.42.196 -> 202.72.53.58 TCP 54 56057 > http [ACK] Seq=404 Ack=4198 Win=24704 Len=0  tcp.stream == 2
 39   9.731134 202.72.53.58 -> 192.168.42.196 TCP 983 [TCP segment of a reassembled PDU]  tcp.stream == 2
 40   9.731139 192.168.42.196 -> 202.72.53.58 TCP 54 56057 > http [ACK] Seq=404 Ack=5127 Win=27264 Len=0  tcp.stream == 2
 41   9.731142 202.72.53.58 -> 192.168.42.196 TCP 1314 [TCP segment of a reassembled PDU]  tcp.stream == 2
 42   9.731145 192.168.42.196 -> 202.72.53.58 TCP 54 56057 > http [ACK] Seq=404 Ack=6387 Win=29824 Len=0  tcp.stream == 2
 43   9.739890 202.72.53.58 -> 192.168.42.196 TCP 358 [TCP segment of a reassembled PDU]  tcp.stream == 2
 44   9.739909 192.168.42.196 -> 202.72.53.58 TCP 54 56057 > http [ACK] Seq=404 Ack=6691 Win=32256 Len=0  tcp.stream == 2
 45   9.739916 202.72.53.58 -> 192.168.42.196 TCP 1314 [TCP segment of a reassembled PDU]  tcp.stream == 2
 46   9.739918 192.168.42.196 -> 202.72.53.58 TCP 54 56057 > http [ACK] Seq=404 Ack=7951 Win=34816 Len=0  tcp.stream == 2
 47   9.740008 202.72.53.58 -> 192.168.42.196 TCP 577 [TCP segment of a reassembled PDU]  tcp.stream == 2
 48   9.740013 192.168.42.196 -> 202.72.53.58 TCP 54 56057 > http [ACK] Seq=404 Ack=8474 Win=37376 Len=0  tcp.stream == 2
 49   9.749896 202.72.53.58 -> 192.168.42.196 TCP 1314 [TCP segment of a reassembled PDU]  tcp.stream == 2
 50   9.749915 192.168.42.196 -> 202.72.53.58 TCP 54 56057 > http [ACK] Seq=404 Ack=9734 Win=39808 Len=0  tcp.stream == 2
 51   9.749922 202.72.53.58 -> 192.168.42.196 TCP 355 [TCP segment of a reassembled PDU]  tcp.stream == 2
 52   9.749925 192.168.42.196 -> 202.72.53.58 TCP 54 56057 > http [ACK] Seq=404 Ack=10035 Win=42368 Len=0  tcp.stream == 2
 53   9.750010 202.72.53.58 -> 192.168.42.196 TCP 1314 [TCP segment of a reassembled PDU]  tcp.stream == 2
 54   9.750015 192.168.42.196 -> 202.72.53.58 TCP 54 56057 > http [ACK] Seq=404 Ack=11295 Win=44928 Len=0  tcp.stream == 2
 55   9.750018 202.72.53.58 -> 192.168.42.196 TCP 626 [TCP segment of a reassembled PDU]  tcp.stream == 2
 56   9.750020 192.168.42.196 -> 202.72.53.58 TCP 54 56057 > http [ACK] Seq=404 Ack=11867 Win=47360 Len=0  tcp.stream == 2
 57   9.750022 202.72.53.58 -> 192.168.42.196 HTTP 74 HTTP/1.1 200 OK  (text/html)  tcp.stream == 2
 58   9.750024 192.168.42.196 -> 202.72.53.58 TCP 54 56057 > http [ACK] Seq=404 Ack=11887 Win=47360 Len=0  tcp.stream == 2
 59   9.756477 192.168.42.196 -> 202.72.53.58 TCP 54 56057 > http [FIN, ACK] Seq=404 Ack=11887 Win=47360 Len=0  tcp.stream == 2
 60   9.979662 202.72.53.58 -> 192.168.42.196 TCP 54 http > 56057 [ACK] Seq=11887 Ack=405 Win=200000 Len=0  tcp.stream == 2
 61   9.979680 202.72.53.58 -> 192.168.42.196 TCP 54 http > 56057 [FIN, ACK] Seq=11887 Ack=405 Win=200000 Len=0  tcp.stream == 2
 62   9.979693 192.168.42.196 -> 202.72.53.58 TCP 54 56057 > http [ACK] Seq=405 Ack=11888 Win=47360 Len=0  tcp.stream == 2
 63  10.009825 192.168.42.196 -> 202.72.53.58 TCP 74 56058 > http [SYN] Seq=0 Win=14600 Len=0 MSS=1460 SACK_PERM=1 TSval=44761240 TSecr=0 WS=128  tcp.stream == 3
 65  10.027415 192.168.42.196 -> 202.72.53.58 TCP 74 56059 > http [SYN] Seq=0 Win=14600 Len=0 MSS=1460 SACK_PERM=1 TSval=44761244 TSecr=0 WS=128  tcp.stream == 4
 67  10.129645 202.72.53.58 -> 192.168.42.196 TCP 66 http > 56058 [SYN, ACK] Seq=0 Ack=1 Win=65535 Len=0 MSS=1260 WS=4 SACK_PERM=1  tcp.stream == 3
 68  10.129670 192.168.42.196 -> 202.72.53.58 TCP 54 56058 > http [ACK] Seq=1 Ack=1 Win=14720 Len=0  tcp.stream == 3
 69  10.142788 192.168.42.196 -> 202.72.53.58 HTTP 515 GET /com/inc/home/20080930/smart/css/commonV2.css HTTP/1.1   tcp.stream == 3
 70  10.149144 202.72.53.58 -> 192.168.42.196 TCP 66 http > 56059 [SYN, ACK] Seq=0 Ack=1 Win=65535 Len=0 MSS=1260 WS=4 SACK_PERM=1  tcp.stream == 4
 71  10.149172 192.168.42.196 -> 202.72.53.58 TCP 54 56059 > http [ACK] Seq=1 Ack=1 Win=14720 Len=0  tcp.stream == 4
 72  10.152039 192.168.42.196 -> 202.72.53.58 TCP 74 56060 > http [SYN] Seq=0 Win=14600 Len=0 MSS=1460 SACK_PERM=1 TSval=44761276 TSecr=0 WS=128  tcp.stream == 5
 73  10.153713 192.168.42.196 -> 202.72.53.58 HTTP 512 GET /com/inc/home/20080930/smart/css/jsCss.css HTTP/1.1   tcp.stream == 4
 76  10.249517 202.72.53.58 -> 192.168.42.196 TCP 54 [TCP Window Update] http > 56058 [ACK] Seq=1 Ack=1 Win=200000 Len=0  tcp.stream == 3
 77  10.269244 192.168.42.196 -> 202.72.53.58 TCP 74 56061 > http [SYN] Seq=0 Win=14600 Len=0 MSS=1460 SACK_PERM=1 TSval=44761305 TSecr=0 WS=128  tcp.stream == 6
 80  10.299142 202.72.53.58 -> 192.168.42.196 TCP 54 [TCP Window Update] http > 56059 [ACK] Seq=1 Ack=1 Win=200000 Len=0  tcp.stream == 4
 81  10.309268 202.72.53.58 -> 192.168.42.196 TCP 66 http > 56060 [SYN, ACK] Seq=0 Ack=1 Win=65535 Len=0 MSS=1260 WS=4 SACK_PERM=1  tcp.stream == 5
 82  10.309299 192.168.42.196 -> 202.72.53.58 TCP 54 56060 > http [ACK] Seq=1 Ack=1 Win=14720 Len=0  tcp.stream == 5
 83  10.312103 192.168.42.196 -> 202.72.53.58 HTTP 501 GET /com/js/d/smart/banner/smt_banner-1.0.0.min.js HTTP/1.1   tcp.stream == 5
 84  10.389146 202.72.53.58 -> 192.168.42.196 TCP 66 http > 56061 [SYN, ACK] Seq=0 Ack=1 Win=65535 Len=0 MSS=1260 WS=4 SACK_PERM=1  tcp.stream == 6
 85  10.389172 192.168.42.196 -> 202.72.53.58 TCP 54 56061 > http [ACK] Seq=1 Ack=1 Win=14720 Len=0  tcp.stream == 6
 86  10.409265 202.72.53.58 -> 192.168.42.196 TCP 54 http > 56058 [ACK] Seq=1 Ack=462 Win=200000 Len=0  tcp.stream == 3
 87  10.429518 202.72.53.58 -> 192.168.42.196 TCP 54 [TCP Window Update] http > 56060 [ACK] Seq=1 Ack=1 Win=200000 Len=0  tcp.stream == 5
 90  10.459141 202.72.53.58 -> 192.168.42.196 TCP 54 http > 56059 [ACK] Seq=1 Ack=459 Win=200000 Len=0  tcp.stream == 4
 93  10.509139 202.72.53.58 -> 192.168.42.196 TCP 54 [TCP Window Update] http > 56061 [ACK] Seq=1 Ack=1 Win=200000 Len=0  tcp.stream == 6
 94  10.559268 202.72.53.58 -> 192.168.42.196 TCP 54 http > 56060 [ACK] Seq=1 Ack=448 Win=200000 Len=0  tcp.stream == 5
 95  10.689650 202.72.53.58 -> 192.168.42.196 TCP 1314 [TCP segment of a reassembled PDU]  tcp.stream == 5
 96  10.689671 192.168.42.196 -> 202.72.53.58 TCP 54 56060 > http [ACK] Seq=448 Ack=1261 Win=17152 Len=0  tcp.stream == 5
 97  10.689679 202.72.53.58 -> 192.168.42.196 HTTP 294 HTTP/1.1 200 OK  (application/x-javascript)  tcp.stream == 5
 98  10.689681 192.168.42.196 -> 202.72.53.58 TCP 54 56060 > http [ACK] Seq=448 Ack=1501 Win=19712 Len=0  tcp.stream == 5
 99  10.698822 192.168.42.196 -> 202.72.53.58 TCP 54 56060 > http [FIN, ACK] Seq=448 Ack=1501 Win=19712 Len=0  tcp.stream == 5
100  10.709890 202.72.53.58 -> 192.168.42.196 TCP 1314 [TCP segment of a reassembled PDU]  tcp.stream == 4
101  10.709915 192.168.42.196 -> 202.72.53.58 TCP 54 56059 > http [ACK] Seq=459 Ack=1261 Win=17152 Len=0  tcp.stream == 4
102  10.719516 202.72.53.58 -> 192.168.42.196 TCP 1031 [TCP segment of a reassembled PDU]  tcp.stream == 4
103  10.719537 192.168.42.196 -> 202.72.53.58 TCP 54 56059 > http [ACK] Seq=459 Ack=2238 Win=19712 Len=0  tcp.stream == 4
104  10.719543 202.72.53.58 -> 192.168.42.196 TCP 152 [TCP segment of a reassembled PDU]  tcp.stream == 4
105  10.719545 192.168.42.196 -> 202.72.53.58 TCP 54 56059 > http [ACK] Seq=459 Ack=2336 Win=19712 Len=0  tcp.stream == 4
106  10.719548 202.72.53.58 -> 192.168.42.196 HTTP 74 HTTP/1.1 200 OK  (text/css)  tcp.stream == 4
107  10.719552 192.168.42.196 -> 202.72.53.58 TCP 54 56059 > http [ACK] Seq=459 Ack=2356 Win=19712 Len=0  tcp.stream == 4
108  10.750394 192.168.42.196 -> 202.72.53.58 TCP 54 56059 > http [FIN, ACK] Seq=459 Ack=2356 Win=19712 Len=0  tcp.stream == 4
109  10.819517 202.72.53.58 -> 192.168.42.196 TCP 54 http > 56060 [ACK] Seq=1501 Ack=449 Win=200000 Len=0  tcp.stream == 5
110  10.819537 202.72.53.58 -> 192.168.42.196 TCP 54 http > 56060 [FIN, ACK] Seq=1501 Ack=449 Win=200000 Len=0  tcp.stream == 5
111  10.819544 192.168.42.196 -> 202.72.53.58 TCP 54 56060 > http [ACK] Seq=449 Ack=1502 Win=19712 Len=0  tcp.stream == 5
112  10.869269 202.72.53.58 -> 192.168.42.196 TCP 54 http > 56059 [ACK] Seq=2356 Ack=460 Win=200000 Len=0  tcp.stream == 4
113  10.869288 202.72.53.58 -> 192.168.42.196 TCP 54 http > 56059 [FIN, ACK] Seq=2356 Ack=460 Win=200000 Len=0  tcp.stream == 4
114  10.869295 192.168.42.196 -> 202.72.53.58 TCP 54 56059 > http [ACK] Seq=460 Ack=2357 Win=19712 Len=0  tcp.stream == 4
116  10.904850 192.168.42.196 -> 96.6.169.41  TCP 74 42187 > http [SYN] Seq=0 Win=14600 Len=0 MSS=1460 SACK_PERM=1 TSval=44761464 TSecr=0 WS=128  tcp.stream == 7
117  10.905361 192.168.42.196 -> 96.6.169.41  TCP 74 42188 > http [SYN] Seq=0 Win=14600 Len=0 MSS=1460 SACK_PERM=1 TSval=44761464 TSecr=0 WS=128  tcp.stream == 8
118  10.905796 192.168.42.196 -> 96.6.169.41  TCP 74 42189 > http [SYN] Seq=0 Win=14600 Len=0 MSS=1460 SACK_PERM=1 TSval=44761464 TSecr=0 WS=128  tcp.stream == 9
119  10.906196 192.168.42.196 -> 96.6.169.41  TCP 74 42190 > http [SYN] Seq=0 Win=14600 Len=0 MSS=1460 SACK_PERM=1 TSval=44761464 TSecr=0 WS=128  tcp.stream == 10
120  10.906588 192.168.42.196 -> 96.6.169.41  TCP 74 42191 > http [SYN] Seq=0 Win=14600 Len=0 MSS=1460 SACK_PERM=1 TSval=44761464 TSecr=0 WS=128  tcp.stream == 11
121  10.906993 192.168.42.196 -> 96.6.169.41  TCP 74 42192 > http [SYN] Seq=0 Win=14600 Len=0 MSS=1460 SACK_PERM=1 TSval=44761464 TSecr=0 WS=128  tcp.stream == 12
123  10.934148 192.168.42.196 -> 18.7.20.68   TCP 74 53665 > http [SYN] Seq=0 Win=14600 Len=0 MSS=1460 SACK_PERM=1 TSval=44761471 TSecr=0 WS=128  tcp.stream == 13
124  10.934658 192.168.42.196 -> 18.7.20.68   TCP 74 53666 > http [SYN] Seq=0 Win=14600 Len=0 MSS=1460 SACK_PERM=1 TSval=44761471 TSecr=0 WS=128  tcp.stream == 14
125  10.935231 192.168.42.196 -> 18.7.20.68   TCP 74 53667 > http [SYN] Seq=0 Win=14600 Len=0 MSS=1460 SACK_PERM=1 TSval=44761471 TSecr=0 WS=128  tcp.stream == 15
126  10.936339 192.168.42.196 -> 18.7.20.68   TCP 74 53668 > http [SYN] Seq=0 Win=14600 Len=0 MSS=1460 SACK_PERM=1 TSval=44761472 TSecr=0 WS=128  tcp.stream == 16
127  11.029519  96.6.169.41 -> 192.168.42.196 TCP 66 http > 42189 [SYN, ACK] Seq=0 Ack=1 Win=65535 Len=0 MSS=1260 WS=4 SACK_PERM=1  tcp.stream == 9
128  11.029550 192.168.42.196 -> 96.6.169.41  TCP 54 42189 > http [ACK] Seq=1 Ack=1 Win=14720 Len=0  tcp.stream == 9
129  11.029558  96.6.169.41 -> 192.168.42.196 TCP 66 http > 42188 [SYN, ACK] Seq=0 Ack=1 Win=65535 Len=0 MSS=1260 WS=4 SACK_PERM=1  tcp.stream == 8
130  11.029565 192.168.42.196 -> 96.6.169.41  TCP 54 42188 > http [ACK] Seq=1 Ack=1 Win=14720 Len=0  tcp.stream == 8
131  11.029568  96.6.169.41 -> 192.168.42.196 TCP 66 http > 42187 [SYN, ACK] Seq=0 Ack=1 Win=65535 Len=0 MSS=1260 WS=4 SACK_PERM=1  tcp.stream == 7
132  11.029578 192.168.42.196 -> 96.6.169.41  TCP 54 42187 > http [ACK] Seq=1 Ack=1 Win=14720 Len=0  tcp.stream == 7
133  11.029625  96.6.169.41 -> 192.168.42.196 TCP 66 http > 42192 [SYN, ACK] Seq=0 Ack=1 Win=65535 Len=0 MSS=1260 WS=4 SACK_PERM=1  tcp.stream == 12
134  11.029631 192.168.42.196 -> 96.6.169.41  TCP 54 42192 > http [ACK] Seq=1 Ack=1 Win=14720 Len=0  tcp.stream == 12
135  11.029634  96.6.169.41 -> 192.168.42.196 TCP 66 http > 42191 [SYN, ACK] Seq=0 Ack=1 Win=65535 Len=0 MSS=1260 WS=4 SACK_PERM=1  tcp.stream == 11
136  11.029640 192.168.42.196 -> 96.6.169.41  TCP 54 42191 > http [ACK] Seq=1 Ack=1 Win=14720 Len=0  tcp.stream == 11
137  11.029643  96.6.169.41 -> 192.168.42.196 TCP 66 http > 42190 [SYN, ACK] Seq=0 Ack=1 Win=65535 Len=0 MSS=1260 WS=4 SACK_PERM=1  tcp.stream == 10
138  11.029648 192.168.42.196 -> 96.6.169.41  TCP 54 42190 > http [ACK] Seq=1 Ack=1 Win=14720 Len=0  tcp.stream == 10
139  11.035335 192.168.42.196 -> 96.6.169.41  HTTP 503 GET /com/inc/home/20080930/smart/css/import.css HTTP/1.1   tcp.stream == 12
140  11.036612 192.168.42.196 -> 96.6.169.41  HTTP 513 GET /com/inc/home/20080930/smart/css/smt_banner-1.0.0.css HTTP/1.1   tcp.stream == 11
141  11.037569 192.168.42.196 -> 96.6.169.41  HTTP 481 GET /com/js/d/common/jquery-1.3.2.min.js HTTP/1.1   tcp.stream == 10
142  11.039304 192.168.42.196 -> 96.6.169.41  HTTP 483 GET /com/js/c/smart/sdup/sdup-1.0.0.min.js HTTP/1.1   tcp.stream == 9
143  11.041242 192.168.42.196 -> 96.6.169.41  HTTP 489 GET /com/js/c/smart/flicker/flicker-1.0.3.min.js HTTP/1.1   tcp.stream == 7
144  11.042196 192.168.42.196 -> 96.6.169.41  HTTP 505 GET /com/inc/home/20080930/iphone/js/jquery.featureList-1.0.1.js HTTP/1.1   tcp.stream == 8
145  11.069520   18.7.20.68 -> 192.168.42.196 TCP 66 http > 53666 [SYN, ACK] Seq=0 Ack=1 Win=65535 Len=0 MSS=1260 WS=4 SACK_PERM=1  tcp.stream == 14
146  11.069557 192.168.42.196 -> 18.7.20.68   TCP 54 53666 > http [ACK] Seq=1 Ack=1 Win=14720 Len=0  tcp.stream == 14
147  11.069565   18.7.20.68 -> 192.168.42.196 TCP 66 http > 53667 [SYN, ACK] Seq=0 Ack=1 Win=65535 Len=0 MSS=1260 WS=4 SACK_PERM=1  tcp.stream == 15
148  11.069570 192.168.42.196 -> 18.7.20.68   TCP 54 53667 > http [ACK] Seq=1 Ack=1 Win=14720 Len=0  tcp.stream == 15
149  11.069573   18.7.20.68 -> 192.168.42.196 TCP 66 http > 53665 [SYN, ACK] Seq=0 Ack=1 Win=65535 Len=0 MSS=1260 WS=4 SACK_PERM=1  tcp.stream == 13
150  11.069578 192.168.42.196 -> 18.7.20.68   TCP 54 53665 > http [ACK] Seq=1 Ack=1 Win=14720 Len=0  tcp.stream == 13
151  11.069580   18.7.20.68 -> 192.168.42.196 TCP 66 http > 53668 [SYN, ACK] Seq=0 Ack=1 Win=65535 Len=0 MSS=1260 WS=4 SACK_PERM=1  tcp.stream == 16
152  11.069585 192.168.42.196 -> 18.7.20.68   TCP 54 53668 > http [ACK] Seq=1 Ack=1 Win=14720 Len=0  tcp.stream == 16
153  11.074654 192.168.42.196 -> 18.7.20.68   HTTP 534 GET /com/css/d/ranking/smartphone/rnk_ajax_parts-1.0.1.min.css HTTP/1.1   tcp.stream == 16
154  11.075791 192.168.42.196 -> 18.7.20.68   HTTP 535 GET /com/js/d/ranking/smartphone/rjs_slideshow_ranking_smartphone-1.0.3.min.js HTTP/1.1   tcp.stream == 15
155  11.078848 192.168.42.196 -> 18.7.20.68   HTTP 521 GET /com/js/d/ranking/smartphone/ranking_smartphone-1.0.2.min.js HTTP/1.1   tcp.stream == 14
156  11.080179 192.168.42.196 -> 18.7.20.68   HTTP 498 GET /com/js/omniture/s_smartphone_code.js HTTP/1.1   tcp.stream == 13
157  11.149516  96.6.169.41 -> 192.168.42.196 TCP 54 [TCP Window Update] http > 42191 [ACK] Seq=1 Ack=1 Win=200000 Len=0  tcp.stream == 11
158  11.149532  96.6.169.41 -> 192.168.42.196 TCP 54 [TCP Window Update] http > 42189 [ACK] Seq=1 Ack=1 Win=200000 Len=0  tcp.stream == 9
159  11.149535  96.6.169.41 -> 192.168.42.196 TCP 54 [TCP Window Update] http > 42192 [ACK] Seq=1 Ack=1 Win=200000 Len=0  tcp.stream == 12
160  11.149622  96.6.169.41 -> 192.168.42.196 TCP 54 [TCP Window Update] http > 42188 [ACK] Seq=1 Ack=1 Win=200000 Len=0  tcp.stream == 8
161  11.149628  96.6.169.41 -> 192.168.42.196 TCP 54 [TCP Window Update] http > 42187 [ACK] Seq=1 Ack=1 Win=200000 Len=0  tcp.stream == 7
162  11.161137 202.72.53.58 -> 192.168.42.196 TCP 1314 [TCP segment of a reassembled PDU]  tcp.stream == 3
163  11.161158 192.168.42.196 -> 202.72.53.58 TCP 54 56058 > http [ACK] Seq=462 Ack=1261 Win=17152 Len=0  tcp.stream == 3
164  11.161252 202.72.53.58 -> 192.168.42.196 TCP 1314 [TCP segment of a reassembled PDU]  tcp.stream == 3
165  11.161258 192.168.42.196 -> 202.72.53.58 TCP 54 56058 > http [ACK] Seq=462 Ack=2521 Win=19712 Len=0  tcp.stream == 3
166  11.161261 202.72.53.58 -> 192.168.42.196 TCP 298 [TCP segment of a reassembled PDU]  tcp.stream == 3
167  11.161265 192.168.42.196 -> 202.72.53.58 TCP 54 56058 > http [ACK] Seq=462 Ack=2765 Win=22272 Len=0  tcp.stream == 3
168  11.161269 202.72.53.58 -> 192.168.42.196 TCP 818 [TCP segment of a reassembled PDU]  tcp.stream == 3
169  11.161272 192.168.42.196 -> 202.72.53.58 TCP 54 56058 > http [ACK] Seq=462 Ack=3529 Win=24704 Len=0  tcp.stream == 3
170  11.169511 202.72.53.58 -> 192.168.42.196 TCP 398 [TCP segment of a reassembled PDU]  tcp.stream == 3
171  11.169530 192.168.42.196 -> 202.72.53.58 TCP 54 56058 > http [ACK] Seq=462 Ack=3873 Win=27264 Len=0  tcp.stream == 3
172  11.169536 202.72.53.58 -> 192.168.42.196 TCP 1120 [TCP segment of a reassembled PDU]  tcp.stream == 3
173  11.169539 192.168.42.196 -> 202.72.53.58 TCP 54 56058 > http [ACK] Seq=462 Ack=4939 Win=29824 Len=0  tcp.stream == 3
174  11.179391 202.72.53.58 -> 192.168.42.196 TCP 1314 [TCP segment of a reassembled PDU]  tcp.stream == 3
175  11.179411 192.168.42.196 -> 202.72.53.58 TCP 54 56058 > http [ACK] Seq=462 Ack=6199 Win=32256 Len=0  tcp.stream == 3
176  11.179418 202.72.53.58 -> 192.168.42.196 TCP 545 [TCP segment of a reassembled PDU]  tcp.stream == 3
177  11.179420 192.168.42.196 -> 202.72.53.58 TCP 54 56058 > http [ACK] Seq=462 Ack=6690 Win=34816 Len=0  tcp.stream == 3
178  11.189638 202.72.53.58 -> 192.168.42.196 TCP 587 [TCP segment of a reassembled PDU]  tcp.stream == 3
179  11.189658 192.168.42.196 -> 202.72.53.58 TCP 54 56058 > http [ACK] Seq=462 Ack=7223 Win=37376 Len=0  tcp.stream == 3
180  11.189665 202.72.53.58 -> 192.168.42.196 HTTP 74 HTTP/1.1 200 OK  (text/css)  tcp.stream == 3
181  11.189667 192.168.42.196 -> 202.72.53.58 TCP 54 56058 > http [ACK] Seq=462 Ack=7243 Win=37376 Len=0  tcp.stream == 3
182  11.189670  96.6.169.41 -> 192.168.42.196 TCP 54 [TCP Window Update] http > 42190 [ACK] Seq=1 Ack=1 Win=200000 Len=0  tcp.stream == 10
183  11.192540 192.168.42.196 -> 202.72.53.58 TCP 54 56058 > http [FIN, ACK] Seq=462 Ack=7243 Win=37376 Len=0  tcp.stream == 3
184  11.199138   18.7.20.68 -> 192.168.42.196 TCP 54 [TCP Window Update] http > 53665 [ACK] Seq=1 Ack=1 Win=200000 Len=0  tcp.stream == 13
185  11.199155   18.7.20.68 -> 192.168.42.196 TCP 54 [TCP Window Update] http > 53666 [ACK] Seq=1 Ack=1 Win=200000 Len=0  tcp.stream == 14
186  11.209265   18.7.20.68 -> 192.168.42.196 TCP 54 [TCP Window Update] http > 53668 [ACK] Seq=1 Ack=1 Win=200000 Len=0  tcp.stream == 16
187  11.209286   18.7.20.68 -> 192.168.42.196 TCP 54 [TCP Window Update] http > 53667 [ACK] Seq=1 Ack=1 Win=200000 Len=0  tcp.stream == 15
188  11.319642  96.6.169.41 -> 192.168.42.196 TCP 54 http > 42192 [ACK] Seq=1 Ack=450 Win=200000 Len=0  tcp.stream == 12
189  11.319755  96.6.169.41 -> 192.168.42.196 TCP 54 http > 42191 [ACK] Seq=1 Ack=460 Win=200000 Len=0  tcp.stream == 11
190  11.319761  96.6.169.41 -> 192.168.42.196 TCP 54 http > 42187 [ACK] Seq=1 Ack=436 Win=200000 Len=0  tcp.stream == 7
191  11.319764  96.6.169.41 -> 192.168.42.196 TCP 54 http > 42188 [ACK] Seq=1 Ack=452 Win=200000 Len=0  tcp.stream == 8
192  11.319767  96.6.169.41 -> 192.168.42.196 TCP 54 http > 42189 [ACK] Seq=1 Ack=430 Win=200000 Len=0  tcp.stream == 9
193  11.319778  96.6.169.41 -> 192.168.42.196 TCP 54 http > 42190 [ACK] Seq=1 Ack=428 Win=200000 Len=0  tcp.stream == 10
194  11.319781 202.72.53.58 -> 192.168.42.196 TCP 54 http > 56058 [ACK] Seq=7243 Ack=463 Win=200000 Len=0  tcp.stream == 3
195  11.319789 202.72.53.58 -> 192.168.42.196 TCP 54 http > 56058 [FIN, ACK] Seq=7243 Ack=463 Win=200000 Len=0  tcp.stream == 3
196  11.319800 192.168.42.196 -> 202.72.53.58 TCP 54 56058 > http [ACK] Seq=463 Ack=7244 Win=37376 Len=0  tcp.stream == 3
197  11.369272   18.7.20.68 -> 192.168.42.196 TCP 54 http > 53668 [ACK] Seq=1 Ack=481 Win=200000 Len=0  tcp.stream == 16
198  11.369290   18.7.20.68 -> 192.168.42.196 TCP 54 http > 53667 [ACK] Seq=1 Ack=482 Win=200000 Len=0  tcp.stream == 15
199  11.369294   18.7.20.68 -> 192.168.42.196 TCP 54 http > 53666 [ACK] Seq=1 Ack=468 Win=200000 Len=0  tcp.stream == 14
200  11.369296   18.7.20.68 -> 192.168.42.196 TCP 54 http > 53665 [ACK] Seq=1 Ack=445 Win=200000 Len=0  tcp.stream == 13
201  11.379638  96.6.169.41 -> 192.168.42.196 HTTP 538 HTTP/1.1 200 OK  (text/css)  tcp.stream == 12
202  11.379659 192.168.42.196 -> 96.6.169.41  TCP 54 42192 > http [ACK] Seq=450 Ack=485 Win=15744 Len=0  tcp.stream == 12
203  11.379666  96.6.169.41 -> 192.168.42.196 TCP 1314 [TCP segment of a reassembled PDU]  tcp.stream == 11
204  11.379669 192.168.42.196 -> 96.6.169.41  TCP 54 42191 > http [ACK] Seq=460 Ack=1261 Win=17152 Len=0  tcp.stream == 11
205  11.379679  96.6.169.41 -> 192.168.42.196 HTTP 132 HTTP/1.1 200 OK  (text/css)  tcp.stream == 11
206  11.379681 192.168.42.196 -> 96.6.169.41  TCP 54 42191 > http [ACK] Seq=460 Ack=1339 Win=17152 Len=0  tcp.stream == 11
207  11.390889  96.6.169.41 -> 192.168.42.196 TCP 1314 [TCP segment of a reassembled PDU]  tcp.stream == 10
208  11.390909 192.168.42.196 -> 96.6.169.41  TCP 54 42190 > http [ACK] Seq=428 Ack=1261 Win=17152 Len=0  tcp.stream == 10
209  11.390915  96.6.169.41 -> 192.168.42.196 TCP 1314 [TCP segment of a reassembled PDU]  tcp.stream == 10
210  11.390918 192.168.42.196 -> 96.6.169.41  TCP 54 42190 > http [ACK] Seq=428 Ack=2521 Win=19712 Len=0  tcp.stream == 10
211  11.390921  96.6.169.41 -> 192.168.42.196 TCP 1314 [TCP segment of a reassembled PDU]  tcp.stream == 10
212  11.390924 192.168.42.196 -> 96.6.169.41  TCP 54 42190 > http [ACK] Seq=428 Ack=3781 Win=22272 Len=0  tcp.stream == 10
213  11.392984 192.168.42.196 -> 96.6.169.41  TCP 54 42192 > http [FIN, ACK] Seq=450 Ack=485 Win=15744 Len=0  tcp.stream == 12
214  11.393895 192.168.42.196 -> 96.6.169.41  TCP 74 42197 > http [SYN] Seq=0 Win=14600 Len=0 MSS=1460 SACK_PERM=1 TSval=44761586 TSecr=0 WS=128  tcp.stream == 17
215  11.395610 192.168.42.196 -> 96.6.169.41  TCP 54 42191 > http [FIN, ACK] Seq=460 Ack=1339 Win=17152 Len=0  tcp.stream == 11
216  11.396345 192.168.42.196 -> 96.6.169.41  TCP 74 42198 > http [SYN] Seq=0 Win=14600 Len=0 MSS=1460 SACK_PERM=1 TSval=44761587 TSecr=0 WS=128  tcp.stream == 18
217  11.399633  96.6.169.41 -> 192.168.42.196 TCP 1314 [TCP segment of a reassembled PDU]  tcp.stream == 10
218  11.399653 192.168.42.196 -> 96.6.169.41  TCP 54 42190 > http [ACK] Seq=428 Ack=5041 Win=24704 Len=0  tcp.stream == 10
219  11.420387  96.6.169.41 -> 192.168.42.196 TCP 1314 [TCP segment of a reassembled PDU]  tcp.stream == 10
220  11.420408 192.168.42.196 -> 96.6.169.41  TCP 54 42190 > http [ACK] Seq=428 Ack=6301 Win=27264 Len=0  tcp.stream == 10
221  11.420414  96.6.169.41 -> 192.168.42.196 TCP 1314 [TCP segment of a reassembled PDU]  tcp.stream == 10
222  11.420417 192.168.42.196 -> 96.6.169.41  TCP 54 42190 > http [ACK] Seq=428 Ack=7561 Win=29824 Len=0  tcp.stream == 10
223  11.420499  96.6.169.41 -> 192.168.42.196 TCP 1042 [TCP segment of a reassembled PDU]  tcp.stream == 10
224  11.420504 192.168.42.196 -> 96.6.169.41  TCP 54 42190 > http [ACK] Seq=428 Ack=8549 Win=32256 Len=0  tcp.stream == 10
225  11.420507  96.6.169.41 -> 192.168.42.196 TCP 1314 [TCP segment of a reassembled PDU]  tcp.stream == 10
226  11.420510 192.168.42.196 -> 96.6.169.41  TCP 54 42190 > http [ACK] Seq=428 Ack=9809 Win=34816 Len=0  tcp.stream == 10
227  11.422264 192.168.42.196 -> 18.7.20.68   TCP 74 53671 > http [SYN] Seq=0 Win=14600 Len=0 MSS=1460 SACK_PERM=1 TSval=44761593 TSecr=0 WS=128  tcp.stream == 19
228  11.440511  96.6.169.41 -> 192.168.42.196 TCP 1314 [TCP segment of a reassembled PDU]  tcp.stream == 10
229  11.440530 192.168.42.196 -> 96.6.169.41  TCP 54 42190 > http [ACK] Seq=428 Ack=11069 Win=37376 Len=0  tcp.stream == 10
230  11.440537  96.6.169.41 -> 192.168.42.196 TCP 1314 [TCP segment of a reassembled PDU]  tcp.stream == 10
231  11.440540 192.168.42.196 -> 96.6.169.41  TCP 54 42190 > http [ACK] Seq=428 Ack=12329 Win=39808 Len=0  tcp.stream == 10
232  11.449508  96.6.169.41 -> 192.168.42.196 TCP 1314 [TCP segment of a reassembled PDU]  tcp.stream == 10
233  11.449527 192.168.42.196 -> 96.6.169.41  TCP 54 42190 > http [ACK] Seq=428 Ack=13589 Win=42368 Len=0  tcp.stream == 10
234  11.459717  96.6.169.41 -> 192.168.42.196 HTTP 763 HTTP/1.1 200 OK  (application/javascript)  tcp.stream == 9
235  11.459751 192.168.42.196 -> 96.6.169.41  TCP 54 42189 > http [ACK] Seq=430 Ack=710 Win=16128 Len=0  tcp.stream == 9
236  11.459759  96.6.169.41 -> 192.168.42.196 HTTP 1207 HTTP/1.1 200 OK  (application/javascript)  tcp.stream == 8
237  11.459765 192.168.42.196 -> 96.6.169.41  TCP 54 42188 > http [ACK] Seq=452 Ack=1154 Win=17024 Len=0  tcp.stream == 8
238  11.459871  96.6.169.41 -> 192.168.42.196 HTTP 1280 HTTP/1.1 200 OK  (application/javascript)  tcp.stream == 7
239  11.459877 192.168.42.196 -> 96.6.169.41  TCP 54 42187 > http [ACK] Seq=436 Ack=1227 Win=17152 Len=0  tcp.stream == 7
240  11.475968 192.168.42.196 -> 96.6.169.41  TCP 54 42189 > http [FIN, ACK] Seq=430 Ack=710 Win=16128 Len=0  tcp.stream == 9
241  11.476774 192.168.42.196 -> 96.6.169.41  TCP 74 42200 > http [SYN] Seq=0 Win=14600 Len=0 MSS=1460 SACK_PERM=1 TSval=44761607 TSecr=0 WS=128  tcp.stream == 20
242  11.477741 192.168.42.196 -> 96.6.169.41  TCP 54 42188 > http [FIN, ACK] Seq=452 Ack=1154 Win=17024 Len=0  tcp.stream == 8
243  11.489888   18.7.20.68 -> 192.168.42.196 TCP 1314 [TCP segment of a reassembled PDU]  tcp.stream == 16
244  11.489910 192.168.42.196 -> 18.7.20.68   TCP 54 53668 > http [ACK] Seq=481 Ack=1261 Win=17152 Len=0  tcp.stream == 16
245  11.489916   18.7.20.68 -> 192.168.42.196 HTTP 128 HTTP/1.1 200 OK  (text/css)  tcp.stream == 16
246  11.489919 192.168.42.196 -> 18.7.20.68   TCP 54 53668 > http [ACK] Seq=481 Ack=1335 Win=17152 Len=0  tcp.stream == 16
247  11.489922   18.7.20.68 -> 192.168.42.196 TCP 1314 [TCP segment of a reassembled PDU]  tcp.stream == 14
248  11.489925 192.168.42.196 -> 18.7.20.68   TCP 54 53666 > http [ACK] Seq=468 Ack=1261 Win=17152 Len=0  tcp.stream == 14
249  11.498689 192.168.42.196 -> 96.6.169.41  TCP 74 42201 > http [SYN] Seq=0 Win=14600 Len=0 MSS=1460 SACK_PERM=1 TSval=44761612 TSecr=0 WS=128  tcp.stream == 21
250  11.500003 192.168.42.196 -> 96.6.169.41  TCP 54 42187 > http [FIN, ACK] Seq=436 Ack=1227 Win=17152 Len=0  tcp.stream == 7
251  11.500376   18.7.20.68 -> 192.168.42.196 TCP 1314 [TCP segment of a reassembled PDU]  tcp.stream == 14
252  11.500393 192.168.42.196 -> 18.7.20.68   TCP 54 53666 > http [ACK] Seq=468 Ack=2521 Win=19712 Len=0  tcp.stream == 14
253  11.500399   18.7.20.68 -> 192.168.42.196 TCP 825 [TCP segment of a reassembled PDU]  tcp.stream == 14
254  11.500401 192.168.42.196 -> 18.7.20.68   TCP 54 53666 > http [ACK] Seq=468 Ack=3292 Win=22272 Len=0  tcp.stream == 14
255  11.500498   18.7.20.68 -> 192.168.42.196 TCP 994 [TCP segment of a reassembled PDU]  tcp.stream == 14
256  11.500504 192.168.42.196 -> 18.7.20.68   TCP 54 53666 > http [ACK] Seq=468 Ack=4232 Win=24704 Len=0  tcp.stream == 14
257  11.500507   18.7.20.68 -> 192.168.42.196 HTTP 74 HTTP/1.1 200 OK  (application/javascript)  tcp.stream == 14
258  11.500509 192.168.42.196 -> 18.7.20.68   TCP 54 53666 > http [ACK] Seq=468 Ack=4252 Win=24704 Len=0  tcp.stream == 14
259  11.500882 192.168.42.196 -> 96.6.169.41  TCP 74 42202 > http [SYN] Seq=0 Win=14600 Len=0 MSS=1460 SACK_PERM=1 TSval=44761613 TSecr=0 WS=128  tcp.stream == 22
260  11.520885  96.6.169.41 -> 192.168.42.196 TCP 1314 [TCP segment of a reassembled PDU]  tcp.stream == 10
261  11.520905 192.168.42.196 -> 96.6.169.41  TCP 54 42190 > http [ACK] Seq=428 Ack=14849 Win=44928 Len=0  tcp.stream == 10
262  11.520913  96.6.169.41 -> 192.168.42.196 TCP 1314 [TCP segment of a reassembled PDU]  tcp.stream == 10
263  11.520916 192.168.42.196 -> 96.6.169.41  TCP 54 42190 > http [ACK] Seq=428 Ack=16109 Win=47360 Len=0  tcp.stream == 10
264  11.520996  96.6.169.41 -> 192.168.42.196 TCP 1314 [TCP segment of a reassembled PDU]  tcp.stream == 10
265  11.521001 192.168.42.196 -> 96.6.169.41  TCP 54 42190 > http [ACK] Seq=428 Ack=17369 Win=49920 Len=0  tcp.stream == 10
266  11.523319 192.168.42.196 -> 18.7.20.68   TCP 54 53668 > http [FIN, ACK] Seq=481 Ack=1335 Win=17152 Len=0  tcp.stream == 16
267  11.526838 192.168.42.196 -> 18.7.20.68   TCP 54 53666 > http [FIN, ACK] Seq=468 Ack=4252 Win=24704 Len=0  tcp.stream == 14
268  11.530634  96.6.169.41 -> 192.168.42.196 TCP 1314 [TCP segment of a reassembled PDU]  tcp.stream == 10
269  11.530655 192.168.42.196 -> 96.6.169.41  TCP 54 42190 > http [ACK] Seq=428 Ack=18629 Win=52480 Len=0  tcp.stream == 10
270  11.540004  96.6.169.41 -> 192.168.42.196 TCP 1314 [TCP segment of a reassembled PDU]  tcp.stream == 10
271  11.540024 192.168.42.196 -> 96.6.169.41  TCP 54 42190 > http [ACK] Seq=428 Ack=19889 Win=55040 Len=0  tcp.stream == 10
272  11.540131  96.6.169.41 -> 192.168.42.196 HTTP 263 HTTP/1.1 200 OK  (application/javascript)  tcp.stream == 10
273  11.540137 192.168.42.196 -> 96.6.169.41  TCP 54 42190 > http [ACK] Seq=428 Ack=20098 Win=57472 Len=0  tcp.stream == 10
274  11.540140  96.6.169.41 -> 192.168.42.196 TCP 54 http > 42191 [ACK] Seq=1339 Ack=461 Win=200000 Len=0  tcp.stream == 11
275  11.540147  96.6.169.41 -> 192.168.42.196 TCP 66 http > 42197 [SYN, ACK] Seq=0 Ack=1 Win=65535 Len=0 MSS=1260 WS=4 SACK_PERM=1  tcp.stream == 17
276  11.540154 192.168.42.196 -> 96.6.169.41  TCP 54 42197 > http [ACK] Seq=1 Ack=1 Win=14720 Len=0  tcp.stream == 17
277  11.540159  96.6.169.41 -> 192.168.42.196 TCP 54 http > 42192 [ACK] Seq=485 Ack=451 Win=200000 Len=0  tcp.stream == 12
278  11.540162  96.6.169.41 -> 192.168.42.196 TCP 54 http > 42191 [FIN, ACK] Seq=1339 Ack=461 Win=200000 Len=0  tcp.stream == 11
279  11.540167 192.168.42.196 -> 96.6.169.41  TCP 54 42191 > http [ACK] Seq=461 Ack=1340 Win=17152 Len=0  tcp.stream == 11
280  11.540173  96.6.169.41 -> 192.168.42.196 TCP 54 http > 42192 [FIN, ACK] Seq=485 Ack=451 Win=200000 Len=0  tcp.stream == 12
281  11.540176 192.168.42.196 -> 96.6.169.41  TCP 54 42192 > http [ACK] Seq=451 Ack=486 Win=15744 Len=0  tcp.stream == 12
282  11.540180  96.6.169.41 -> 192.168.42.196 TCP 66 http > 42198 [SYN, ACK] Seq=0 Ack=1 Win=65535 Len=0 MSS=1260 WS=4 SACK_PERM=1  tcp.stream == 18
283  11.540186 192.168.42.196 -> 96.6.169.41  TCP 54 42198 > http [ACK] Seq=1 Ack=1 Win=14720 Len=0  tcp.stream == 18
284  11.540246   18.7.20.68 -> 192.168.42.196 TCP 1314 [TCP segment of a reassembled PDU]  tcp.stream == 15
285  11.540251 192.168.42.196 -> 18.7.20.68   TCP 54 53667 > http [ACK] Seq=482 Ack=1261 Win=17152 Len=0  tcp.stream == 15
286  11.547377 192.168.42.196 -> 96.6.169.41  HTTP 491 GET /com/js/c/smart/dropDown/dropDown-1.0.0.min.js HTTP/1.1   tcp.stream == 18
287  11.552528 192.168.42.196 -> 96.6.169.41  HTTP 481 GET /com/js/d/iphone/clearvalue-1.0.0.js HTTP/1.1   tcp.stream == 17
288  11.556847 192.168.42.196 -> 96.6.169.41  TCP 54 42190 > http [FIN, ACK] Seq=428 Ack=20098 Win=57472 Len=0  tcp.stream == 10
289  11.557652 192.168.42.196 -> 96.6.169.41  TCP 74 42203 > http [SYN] Seq=0 Win=14600 Len=0 MSS=1460 SACK_PERM=1 TSval=44761627 TSecr=0 WS=128  tcp.stream == 23
290  11.559632   18.7.20.68 -> 192.168.42.196 TCP 1314 [TCP segment of a reassembled PDU]  tcp.stream == 15
291  11.559652 192.168.42.196 -> 18.7.20.68   TCP 54 53667 > http [ACK] Seq=482 Ack=2521 Win=19712 Len=0  tcp.stream == 15
292  11.559749   18.7.20.68 -> 192.168.42.196 TCP 352 [TCP segment of a reassembled PDU]  tcp.stream == 15
293  11.559754 192.168.42.196 -> 18.7.20.68   TCP 54 53667 > http [ACK] Seq=482 Ack=2819 Win=22272 Len=0  tcp.stream == 15
294  11.559758   18.7.20.68 -> 192.168.42.196 TCP 805 [TCP segment of a reassembled PDU]  tcp.stream == 15
295  11.559767 192.168.42.196 -> 18.7.20.68   TCP 54 53667 > http [ACK] Seq=482 Ack=3570 Win=24704 Len=0  tcp.stream == 15
296  11.559769   18.7.20.68 -> 192.168.42.196 HTTP 74 HTTP/1.1 200 OK  (application/javascript)  tcp.stream == 15
297  11.559778 192.168.42.196 -> 18.7.20.68   TCP 54 53667 > http [ACK] Seq=482 Ack=3590 Win=24704 Len=0  tcp.stream == 15
298  11.559784   18.7.20.68 -> 192.168.42.196 TCP 66 http > 53671 [SYN, ACK] Seq=0 Ack=1 Win=65535 Len=0 MSS=1260 WS=4 SACK_PERM=1  tcp.stream == 19
299  11.559792 192.168.42.196 -> 18.7.20.68   TCP 54 53671 > http [ACK] Seq=1 Ack=1 Win=14720 Len=0  tcp.stream == 19
300  11.574008 192.168.42.196 -> 18.7.20.68   TCP 54 53667 > http [FIN, ACK] Seq=482 Ack=3590 Win=24704 Len=0  tcp.stream == 15
301  11.576465 192.168.42.196 -> 18.7.20.68   HTTP 519 GET /com/inc/home/20080930/iphone/css/reset.css HTTP/1.1   tcp.stream == 19
302  11.610640  96.6.169.41 -> 192.168.42.196 TCP 54 http > 42189 [ACK] Seq=710 Ack=431 Win=200000 Len=0  tcp.stream == 9
303  11.610658  96.6.169.41 -> 192.168.42.196 TCP 54 http > 42188 [ACK] Seq=1154 Ack=453 Win=200000 Len=0  tcp.stream == 8
304  11.610662  96.6.169.41 -> 192.168.42.196 TCP 66 http > 42200 [SYN, ACK] Seq=0 Ack=1 Win=65535 Len=0 MSS=1260 WS=4 SACK_PERM=1  tcp.stream == 20
305  11.610672 192.168.42.196 -> 96.6.169.41  TCP 54 42200 > http [ACK] Seq=1 Ack=1 Win=14720 Len=0  tcp.stream == 20
306  11.610686  96.6.169.41 -> 192.168.42.196 TCP 54 http > 42189 [FIN, ACK] Seq=710 Ack=431 Win=200000 Len=0  tcp.stream == 9
307  11.610692 192.168.42.196 -> 96.6.169.41  TCP 54 42189 > http [ACK] Seq=431 Ack=711 Win=16128 Len=0  tcp.stream == 9
308  11.610698  96.6.169.41 -> 192.168.42.196 TCP 54 http > 42188 [FIN, ACK] Seq=1154 Ack=453 Win=200000 Len=0  tcp.stream == 8
309  11.610701 192.168.42.196 -> 96.6.169.41  TCP 54 42188 > http [ACK] Seq=453 Ack=1155 Win=17024 Len=0  tcp.stream == 8
310  11.613752 192.168.42.196 -> 96.6.169.41  HTTP 497 GET /com/js/c/smart/pointShow/smt_pointShow-1.0.0.min.js HTTP/1.1   tcp.stream == 20
311  11.619136  96.6.169.41 -> 192.168.42.196 TCP 66 http > 42201 [SYN, ACK] Seq=0 Ack=1 Win=65535 Len=0 MSS=1260 WS=4 SACK_PERM=1  tcp.stream == 21
312  11.619161 192.168.42.196 -> 96.6.169.41  TCP 54 42201 > http [ACK] Seq=1 Ack=1 Win=14720 Len=0  tcp.stream == 21
313  11.619168  96.6.169.41 -> 192.168.42.196 TCP 54 http > 42187 [ACK] Seq=1227 Ack=437 Win=200000 Len=0  tcp.stream == 7
314  11.619179  96.6.169.41 -> 192.168.42.196 TCP 54 http > 42187 [FIN, ACK] Seq=1227 Ack=437 Win=200000 Len=0  tcp.stream == 7
315  11.619183 192.168.42.196 -> 96.6.169.41  TCP 54 42187 > http [ACK] Seq=437 Ack=1228 Win=17152 Len=0  tcp.stream == 7
316  11.624175 192.168.42.196 -> 96.6.169.41  HTTP 477 GET /com/js/d/rjs/rjs_helpers.min.js HTTP/1.1   tcp.stream == 21
317  11.632007  96.6.169.41 -> 192.168.42.196 TCP 66 http > 42202 [SYN, ACK] Seq=0 Ack=1 Win=65535 Len=0 MSS=1260 WS=4 SACK_PERM=1  tcp.stream == 22
318  11.632031 192.168.42.196 -> 96.6.169.41  TCP 54 42202 > http [ACK] Seq=1 Ack=1 Win=14720 Len=0  tcp.stream == 22
319  11.633529 192.168.42.196 -> 96.6.169.41  HTTP 495 GET /com/js/d/smart/rjs/smt_rjs_slideshow-1.0.0.min.js HTTP/1.1   tcp.stream == 22
320  11.649635   18.7.20.68 -> 192.168.42.196 TCP 54 http > 53666 [ACK] Seq=4252 Ack=469 Win=200000 Len=0  tcp.stream == 14
321  11.649653   18.7.20.68 -> 192.168.42.196 TCP 54 http > 53666 [FIN, ACK] Seq=4252 Ack=469 Win=200000 Len=0  tcp.stream == 14
322  11.649661 192.168.42.196 -> 18.7.20.68   TCP 54 53666 > http [ACK] Seq=469 Ack=4253 Win=24704 Len=0  tcp.stream == 14
323  11.649671   18.7.20.68 -> 192.168.42.196 TCP 54 http > 53668 [ACK] Seq=1335 Ack=482 Win=200000 Len=0  tcp.stream == 16
324  11.649745   18.7.20.68 -> 192.168.42.196 TCP 54 http > 53668 [FIN, ACK] Seq=1335 Ack=482 Win=200000 Len=0  tcp.stream == 16
325  11.649749 192.168.42.196 -> 18.7.20.68   TCP 54 53668 > http [ACK] Seq=482 Ack=1336 Win=17152 Len=0  tcp.stream == 16
326  11.659007  96.6.169.41 -> 192.168.42.196 TCP 54 [TCP Window Update] http > 42197 [ACK] Seq=1 Ack=1 Win=200000 Len=0  tcp.stream == 17
327  11.669507  96.6.169.41 -> 192.168.42.196 TCP 54 [TCP Window Update] http > 42198 [ACK] Seq=1 Ack=1 Win=200000 Len=0  tcp.stream == 18
328  11.690387  96.6.169.41 -> 192.168.42.196 TCP 66 http > 42203 [SYN, ACK] Seq=0 Ack=1 Win=65535 Len=0 MSS=1260 WS=4 SACK_PERM=1  tcp.stream == 23
329  11.690415 192.168.42.196 -> 96.6.169.41  TCP 54 42203 > http [ACK] Seq=1 Ack=1 Win=14720 Len=0  tcp.stream == 23
330  11.690422  96.6.169.41 -> 192.168.42.196 TCP 54 http > 42190 [ACK] Seq=20098 Ack=429 Win=200000 Len=0  tcp.stream == 10
331  11.690433   18.7.20.68 -> 192.168.42.196 TCP 54 [TCP Window Update] http > 53671 [ACK] Seq=1 Ack=1 Win=200000 Len=0  tcp.stream == 19
332  11.692425 192.168.42.196 -> 96.6.169.41  HTTP 499 GET /com/js/c/smart/basket/cartnumdisplay.and-1.0.0.min.js HTTP/1.1   tcp.stream == 23
333  11.699006   18.7.20.68 -> 192.168.42.196 TCP 54 http > 53667 [ACK] Seq=3590 Ack=483 Win=200000 Len=0  tcp.stream == 15
334  11.729133  96.6.169.41 -> 192.168.42.196 TCP 54 [TCP Window Update] http > 42200 [ACK] Seq=1 Ack=1 Win=200000 Len=0  tcp.stream == 20
335  11.739133  96.6.169.41 -> 192.168.42.196 TCP 54 [TCP Window Update] http > 42201 [ACK] Seq=1 Ack=1 Win=200000 Len=0  tcp.stream == 21
336  11.769382  96.6.169.41 -> 192.168.42.196 TCP 54 [TCP Window Update] http > 42202 [ACK] Seq=1 Ack=1 Win=200000 Len=0  tcp.stream == 22
337  11.769495   18.7.20.68 -> 192.168.42.196 TCP 54 http > 53667 [FIN, ACK] Seq=3590 Ack=483 Win=200000 Len=0  tcp.stream == 15
