  1   0.000000 192.168.42.196 -> 220.181.138.59 TCP 74 54994 > http [SYN] Seq=0 Win=14600 Len=0 MSS=1460 SACK_PERM=1 TSval=43006080 TSecr=0 WS=128  tcp.stream == 0
  2   0.217464 192.168.42.196 -> 220.181.138.59 TCP 74 54995 > http [SYN] Seq=0 Win=14600 Len=0 MSS=1460 SACK_PERM=1 TSval=43006135 TSecr=0 WS=128  tcp.stream == 1
  3   2.030679 208.46.163.50 -> 192.168.42.196 HTTP 1314 Continuation or non-HTTP traffic  tcp.stream == 2
  4   2.030695 192.168.42.196 -> 208.46.163.50 TCP 54 [TCP ACKed unseen segment] 58578 > http [ACK] Seq=2 Ack=194631 Win=1516 Len=0  tcp.stream == 2
  5   2.030701 208.46.163.50 -> 192.168.42.196 HTTP 1314 Continuation or non-HTTP traffic  tcp.stream == 2
  6   2.030703 192.168.42.196 -> 208.46.163.50 TCP 54 [TCP Dup ACK 4#1] [TCP ACKed unseen segment] 58578 > http [ACK] Seq=2 Ack=194631 Win=1516 Len=0  tcp.stream == 2
  7   2.040272 208.46.163.50 -> 192.168.42.196 HTTP 1314 Continuation or non-HTTP traffic  tcp.stream == 2
  8   2.040292 192.168.42.196 -> 208.46.163.50 TCP 54 [TCP Dup ACK 4#2] [TCP ACKed unseen segment] 58578 > http [ACK] Seq=2 Ack=194631 Win=1516 Len=0  tcp.stream == 2
  9   2.040355 208.46.163.50 -> 192.168.42.196 HTTP 1314 Continuation or non-HTTP traffic  tcp.stream == 2
 10   2.040358 192.168.42.196 -> 208.46.163.50 TCP 54 [TCP Dup ACK 4#3] [TCP ACKed unseen segment] 58578 > http [ACK] Seq=2 Ack=194631 Win=1516 Len=0  tcp.stream == 2
 11   2.050152 208.46.163.50 -> 192.168.42.196 HTTP 1314 Continuation or non-HTTP traffic  tcp.stream == 2
 12   2.050172 192.168.42.196 -> 208.46.163.50 TCP 54 [TCP Dup ACK 4#4] [TCP ACKed unseen segment] 58578 > http [ACK] Seq=2 Ack=194631 Win=1516 Len=0  tcp.stream == 2
 13   2.050178 208.46.163.50 -> 192.168.42.196 HTTP 1314 Continuation or non-HTTP traffic  tcp.stream == 2
 14   2.050181 192.168.42.196 -> 208.46.163.50 TCP 54 [TCP Dup ACK 4#5] [TCP ACKed unseen segment] 58578 > http [ACK] Seq=2 Ack=194631 Win=1516 Len=0  tcp.stream == 2
 15   2.060022 208.46.163.50 -> 192.168.42.196 HTTP 1314 Continuation or non-HTTP traffic  tcp.stream == 2
 16   2.060040 192.168.42.196 -> 208.46.163.50 TCP 54 [TCP Dup ACK 4#6] [TCP ACKed unseen segment] 58578 > http [ACK] Seq=2 Ack=194631 Win=1516 Len=0  tcp.stream == 2
 17   2.070274 208.46.163.50 -> 192.168.42.196 HTTP 1314 Continuation or non-HTTP traffic  tcp.stream == 2
 18   2.070294 192.168.42.196 -> 208.46.163.50 TCP 54 [TCP Dup ACK 4#7] [TCP ACKed unseen segment] 58578 > http [ACK] Seq=2 Ack=194631 Win=1516 Len=0  tcp.stream == 2
 19   2.084397 220.181.138.59 -> 192.168.42.196 TCP 66 http > 54994 [SYN, ACK] Seq=0 Ack=1 Win=65535 Len=0 MSS=1260 WS=4 SACK_PERM=1  tcp.stream == 0
 20   2.084426 192.168.42.196 -> 220.181.138.59 TCP 54 54994 > http [ACK] Seq=1 Ack=1 Win=14720 Len=0  tcp.stream == 0
 21   2.084433 220.181.138.59 -> 192.168.42.196 TCP 66 http > 54995 [SYN, ACK] Seq=0 Ack=1 Win=65535 Len=0 MSS=1260 WS=4 SACK_PERM=1  tcp.stream == 1
 22   2.084437 192.168.42.196 -> 220.181.138.59 TCP 54 54995 > http [ACK] Seq=1 Ack=1 Win=14720 Len=0  tcp.stream == 1
 23   2.089441 192.168.42.196 -> 220.181.138.59 HTTP 446 GET / HTTP/1.1   tcp.stream == 1
 24   2.140901 208.46.163.50 -> 192.168.42.196 TCP 54 http > 58578 [RST, ACK] Seq=194631 Ack=2 Win=0 Len=0  tcp.stream == 2
 25   2.140916 208.46.163.50 -> 192.168.42.196 TCP 54 http > 58578 [RST, ACK] Seq=194631 Ack=2 Win=0 Len=0  tcp.stream == 2
 26   2.149897 208.46.163.50 -> 192.168.42.196 TCP 54 http > 58578 [RST, ACK] Seq=194631 Ack=2 Win=0 Len=0  tcp.stream == 2
 27   2.172031 208.46.163.50 -> 192.168.42.196 TCP 54 http > 58578 [RST, ACK] Seq=194631 Ack=2 Win=0 Len=0  tcp.stream == 2
 28   2.172045 208.46.163.50 -> 192.168.42.196 TCP 54 http > 58578 [RST, ACK] Seq=194631 Ack=2 Win=0 Len=0  tcp.stream == 2
 29   2.172046 208.46.163.50 -> 192.168.42.196 TCP 54 http > 58578 [RST, ACK] Seq=194631 Ack=2 Win=0 Len=0  tcp.stream == 2
 30   2.172047 208.46.163.50 -> 192.168.42.196 TCP 54 http > 58578 [RST, ACK] Seq=194631 Ack=2 Win=0 Len=0  tcp.stream == 2
 31   2.180512 208.46.163.50 -> 192.168.42.196 TCP 54 http > 58578 [RST, ACK] Seq=194631 Ack=2 Win=0 Len=0  tcp.stream == 2
 32   2.201400 220.181.138.59 -> 192.168.42.196 TCP 54 [TCP Window Update] http > 54994 [ACK] Seq=1 Ack=1 Win=200000 Len=0  tcp.stream == 0
 33   2.201414 220.181.138.59 -> 192.168.42.196 TCP 54 [TCP Window Update] http > 54995 [ACK] Seq=1 Ack=1 Win=200000 Len=0  tcp.stream == 1
 34   2.350147 220.181.138.59 -> 192.168.42.196 TCP 54 http > 54995 [ACK] Seq=1 Ack=393 Win=200000 Len=0  tcp.stream == 1
 35   3.501276 220.181.138.59 -> 192.168.42.196 HTTP 504 HTTP/1.1 302 Moved Temporarily  (text/html)  tcp.stream == 1
 36   3.501291 192.168.42.196 -> 220.181.138.59 TCP 54 54995 > http [ACK] Seq=393 Ack=451 Win=15744 Len=0  tcp.stream == 1
 37   3.511424 192.168.42.196 -> 220.181.138.59 TCP 54 54995 > http [FIN, ACK] Seq=393 Ack=451 Win=15744 Len=0  tcp.stream == 1
 39   3.650026 220.181.138.59 -> 192.168.42.196 TCP 54 http > 54995 [ACK] Seq=451 Ack=394 Win=200000 Len=0  tcp.stream == 1
 40   3.650045 220.181.138.59 -> 192.168.42.196 TCP 54 http > 54995 [FIN, ACK] Seq=451 Ack=394 Win=200000 Len=0  tcp.stream == 1
 41   3.650054 192.168.42.196 -> 220.181.138.59 TCP 54 54995 > http [ACK] Seq=394 Ack=452 Win=15744 Len=0  tcp.stream == 1
 47   4.396644 192.168.42.196 -> 60.28.14.190 TCP 74 53341 > http [SYN] Seq=0 Win=14600 Len=0 MSS=1460 SACK_PERM=1 TSval=43007180 TSecr=0 WS=128  tcp.stream == 3
 48   4.519891 60.28.14.190 -> 192.168.42.196 TCP 66 http > 53341 [SYN, ACK] Seq=0 Ack=1 Win=65535 Len=0 MSS=1260 WS=4 SACK_PERM=1  tcp.stream == 3
 49   4.519923 192.168.42.196 -> 60.28.14.190 TCP 54 53341 > http [ACK] Seq=1 Ack=1 Win=14720 Len=0  tcp.stream == 3
 50   4.521938 192.168.42.196 -> 60.28.14.190 HTTP 450 GET / HTTP/1.1   tcp.stream == 3
 51   4.630015 60.28.14.190 -> 192.168.42.196 TCP 54 [TCP Window Update] http > 53341 [ACK] Seq=1 Ack=1 Win=200000 Len=0  tcp.stream == 3
 52   4.750007 60.28.14.190 -> 192.168.42.196 TCP 54 http > 53341 [ACK] Seq=1 Ack=397 Win=200000 Len=0  tcp.stream == 3
 53   5.941383 60.28.14.190 -> 192.168.42.196 TCP 1314 [TCP segment of a reassembled PDU]  tcp.stream == 3
 54   5.941404 192.168.42.196 -> 60.28.14.190 TCP 54 53341 > http [ACK] Seq=397 Ack=1261 Win=17152 Len=0  tcp.stream == 3
 55   5.941455 60.28.14.190 -> 192.168.42.196 TCP 1314 [TCP segment of a reassembled PDU]  tcp.stream == 3
 56   5.941458 192.168.42.196 -> 60.28.14.190 TCP 54 53341 > http [ACK] Seq=397 Ack=2521 Win=19712 Len=0  tcp.stream == 3
 57   5.941460 60.28.14.190 -> 192.168.42.196 TCP 1314 [TCP segment of a reassembled PDU]  tcp.stream == 3
 58   5.941464 192.168.42.196 -> 60.28.14.190 TCP 54 53341 > http [ACK] Seq=397 Ack=3781 Win=22272 Len=0  tcp.stream == 3
 59   5.960968 60.28.14.190 -> 192.168.42.196 TCP 1314 [TCP segment of a reassembled PDU]  tcp.stream == 3
 60   5.960986 192.168.42.196 -> 60.28.14.190 TCP 54 53341 > http [ACK] Seq=397 Ack=5041 Win=24704 Len=0  tcp.stream == 3
 61   5.960994 60.28.14.190 -> 192.168.42.196 TCP 1314 [TCP segment of a reassembled PDU]  tcp.stream == 3
 62   5.960996 192.168.42.196 -> 60.28.14.190 TCP 54 53341 > http [ACK] Seq=397 Ack=6301 Win=27264 Len=0  tcp.stream == 3
 63   5.961081 60.28.14.190 -> 192.168.42.196 TCP 1314 [TCP segment of a reassembled PDU]  tcp.stream == 3
 64   5.961086 192.168.42.196 -> 60.28.14.190 TCP 54 53341 > http [ACK] Seq=397 Ack=7561 Win=29824 Len=0  tcp.stream == 3
 65   5.980471 60.28.14.190 -> 192.168.42.196 TCP 1031 [TCP segment of a reassembled PDU]  tcp.stream == 3
 66   5.980491 192.168.42.196 -> 60.28.14.190 TCP 54 53341 > http [ACK] Seq=397 Ack=8538 Win=32256 Len=0  tcp.stream == 3
 67   5.980498 60.28.14.190 -> 192.168.42.196 TCP 1314 [TCP segment of a reassembled PDU]  tcp.stream == 3
 68   5.980501 192.168.42.196 -> 60.28.14.190 TCP 54 53341 > http [ACK] Seq=397 Ack=9798 Win=34816 Len=0  tcp.stream == 3
 69   5.990348 60.28.14.190 -> 192.168.42.196 TCP 1314 [TCP segment of a reassembled PDU]  tcp.stream == 3
 70   5.990368 192.168.42.196 -> 60.28.14.190 TCP 54 53341 > http [ACK] Seq=397 Ack=11058 Win=37376 Len=0  tcp.stream == 3
 71   5.990375 60.28.14.190 -> 192.168.42.196 TCP 346 [TCP segment of a reassembled PDU]  tcp.stream == 3
 72   5.990377 192.168.42.196 -> 60.28.14.190 TCP 54 53341 > http [ACK] Seq=397 Ack=11350 Win=39808 Len=0  tcp.stream == 3
 73   6.000968 60.28.14.190 -> 192.168.42.196 TCP 1314 [TCP segment of a reassembled PDU]  tcp.stream == 3
 74   6.000987 192.168.42.196 -> 60.28.14.190 TCP 54 53341 > http [ACK] Seq=397 Ack=12610 Win=42368 Len=0  tcp.stream == 3
 75   6.000994 60.28.14.190 -> 192.168.42.196 TCP 1314 [TCP segment of a reassembled PDU]  tcp.stream == 3
 76   6.000998 192.168.42.196 -> 60.28.14.190 TCP 54 53341 > http [ACK] Seq=397 Ack=13870 Win=44928 Len=0  tcp.stream == 3
 77   6.061095 60.28.14.190 -> 192.168.42.196 TCP 1314 [TCP segment of a reassembled PDU]  tcp.stream == 3
 78   6.061115 192.168.42.196 -> 60.28.14.190 TCP 54 53341 > http [ACK] Seq=397 Ack=15130 Win=47360 Len=0  tcp.stream == 3
 79   6.061122 60.28.14.190 -> 192.168.42.196 TCP 1314 [TCP segment of a reassembled PDU]  tcp.stream == 3
 80   6.061132 192.168.42.196 -> 60.28.14.190 TCP 54 53341 > http [ACK] Seq=397 Ack=16390 Win=49920 Len=0  tcp.stream == 3
 81   6.069967 60.28.14.190 -> 192.168.42.196 TCP 1314 [TCP segment of a reassembled PDU]  tcp.stream == 3
 82   6.069987 192.168.42.196 -> 60.28.14.190 TCP 54 53341 > http [ACK] Seq=397 Ack=17650 Win=52480 Len=0  tcp.stream == 3
 83   6.081843 60.28.14.190 -> 192.168.42.196 TCP 1314 [TCP segment of a reassembled PDU]  tcp.stream == 3
 84   6.081864 192.168.42.196 -> 60.28.14.190 TCP 54 53341 > http [ACK] Seq=397 Ack=18910 Win=55040 Len=0  tcp.stream == 3
 85   6.081955 60.28.14.190 -> 192.168.42.196 TCP 1021 [TCP segment of a reassembled PDU]  tcp.stream == 3
 86   6.081959 192.168.42.196 -> 60.28.14.190 TCP 54 53341 > http [ACK] Seq=397 Ack=19877 Win=57472 Len=0  tcp.stream == 3
 88   6.250590 60.28.14.190 -> 192.168.42.196 TCP 1314 [TCP segment of a reassembled PDU]  tcp.stream == 3
 89   6.250611 192.168.42.196 -> 60.28.14.190 TCP 54 53341 > http [ACK] Seq=397 Ack=21137 Win=60032 Len=0  tcp.stream == 3
 90   6.260461 60.28.14.190 -> 192.168.42.196 TCP 1314 [TCP segment of a reassembled PDU]  tcp.stream == 3
 91   6.260481 192.168.42.196 -> 60.28.14.190 TCP 54 53341 > http [ACK] Seq=397 Ack=22397 Win=62592 Len=0  tcp.stream == 3
 92   6.260603 192.168.42.196 -> 60.28.14.190 TCP 74 53342 > http [SYN] Seq=0 Win=14600 Len=0 MSS=1460 SACK_PERM=1 TSval=43007646 TSecr=0 WS=128  tcp.stream == 4
 93   6.271093 60.28.14.190 -> 192.168.42.196 TCP 1314 [TCP segment of a reassembled PDU]  tcp.stream == 3
 94   6.271113 192.168.42.196 -> 60.28.14.190 TCP 54 53341 > http [ACK] Seq=397 Ack=23657 Win=64128 Len=0  tcp.stream == 3
 95   6.271120 60.28.14.190 -> 192.168.42.196 TCP 1314 [TCP segment of a reassembled PDU]  tcp.stream == 3
 96   6.271122 192.168.42.196 -> 60.28.14.190 TCP 54 53341 > http [ACK] Seq=397 Ack=24917 Win=62976 Len=0  tcp.stream == 3
 97   6.290465 60.28.14.190 -> 192.168.42.196 TCP 1314 [TCP segment of a reassembled PDU]  tcp.stream == 3
 98   6.290485 192.168.42.196 -> 60.28.14.190 TCP 54 53341 > http [ACK] Seq=397 Ack=26177 Win=64128 Len=0  tcp.stream == 3
 99   6.303464 60.28.14.190 -> 192.168.42.196 TCP 1314 [TCP segment of a reassembled PDU]  tcp.stream == 3
100   6.303483 192.168.42.196 -> 60.28.14.190 TCP 54 53341 > http [ACK] Seq=397 Ack=27437 Win=64128 Len=0  tcp.stream == 3
101   6.303581 60.28.14.190 -> 192.168.42.196 TCP 694 [TCP segment of a reassembled PDU]  tcp.stream == 3
102   6.303586 192.168.42.196 -> 60.28.14.190 TCP 54 53341 > http [ACK] Seq=397 Ack=28077 Win=63488 Len=0  tcp.stream == 3
103   6.303590 60.28.14.190 -> 192.168.42.196 TCP 1314 [TCP segment of a reassembled PDU]  tcp.stream == 3
104   6.303596 60.28.14.190 -> 192.168.42.196 TCP 1314 [TCP segment of a reassembled PDU]  tcp.stream == 3
105   6.304045 192.168.42.196 -> 60.28.14.190 TCP 54 53341 > http [ACK] Seq=397 Ack=30597 Win=61056 Len=0  tcp.stream == 3
106   6.311593 60.28.14.190 -> 192.168.42.196 TCP 1314 [TCP segment of a reassembled PDU]  tcp.stream == 3
107   6.311607 60.28.14.190 -> 192.168.42.196 TCP 1314 [TCP segment of a reassembled PDU]  tcp.stream == 3
108   6.311614 192.168.42.196 -> 60.28.14.190 TCP 54 53341 > http [ACK] Seq=397 Ack=33117 Win=62976 Len=0  tcp.stream == 3
109   6.320336 60.28.14.190 -> 192.168.42.196 TCP 1314 [TCP segment of a reassembled PDU]  tcp.stream == 3
110   6.330594 60.28.14.190 -> 192.168.42.196 TCP 1314 [TCP segment of a reassembled PDU]  tcp.stream == 3
111   6.330615 192.168.42.196 -> 60.28.14.190 TCP 54 53341 > http [ACK] Seq=397 Ack=35637 Win=64128 Len=0  tcp.stream == 3
112   6.330622 60.28.14.190 -> 192.168.42.196 TCP 694 [TCP segment of a reassembled PDU]  tcp.stream == 3
113   6.331366 192.168.42.196 -> 60.28.14.190 TCP 54 53341 > http [ACK] Seq=397 Ack=36277 Win=64128 Len=0  tcp.stream == 3
115   6.352461 60.28.14.190 -> 192.168.42.196 TCP 1314 [TCP segment of a reassembled PDU]  tcp.stream == 3
116   6.352703 60.28.14.190 -> 192.168.42.196 TCP 1314 [TCP segment of a reassembled PDU]  tcp.stream == 3
117   6.354341 192.168.42.196 -> 60.28.14.190 TCP 54 53341 > http [ACK] Seq=397 Ack=38797 Win=64128 Len=0  tcp.stream == 3
118   6.363465 60.28.14.190 -> 192.168.42.196 TCP 1029 [TCP segment of a reassembled PDU]  tcp.stream == 3
119   6.363577 60.28.14.190 -> 192.168.42.196 TCP 1314 [TCP segment of a reassembled PDU]  tcp.stream == 3
120   6.363581 60.28.14.190 -> 192.168.42.196 TCP 1314 [TCP segment of a reassembled PDU]  tcp.stream == 3
121   6.363583 60.28.14.190 -> 192.168.42.196 TCP 381 [TCP segment of a reassembled PDU]  tcp.stream == 3
122   6.364332 192.168.42.196 -> 60.28.14.190 TCP 54 53341 > http [ACK] Seq=397 Ack=42619 Win=64128 Len=0  tcp.stream == 3
123   6.379841 60.28.14.190 -> 192.168.42.196 TCP 66 http > 53342 [SYN, ACK] Seq=0 Ack=1 Win=65535 Len=0 MSS=1260 WS=4 SACK_PERM=1  tcp.stream == 4
124   6.379868 192.168.42.196 -> 60.28.14.190 TCP 54 53342 > http [ACK] Seq=1 Ack=1 Win=14720 Len=0  tcp.stream == 4
125   6.385513 192.168.42.196 -> 60.28.14.190 HTTP 458 GET /iskin960/s01/s_1.6.0.css HTTP/1.1   tcp.stream == 4
126   6.390346 192.168.42.196 -> 60.28.14.190 TCP 74 53343 > http [SYN] Seq=0 Win=14600 Len=0 MSS=1460 SACK_PERM=1 TSval=43007678 TSecr=0 WS=128  tcp.stream == 5
127   6.397585 192.168.42.196 -> 60.28.14.190 TCP 74 53344 > http [SYN] Seq=0 Win=14600 Len=0 MSS=1460 SACK_PERM=1 TSval=43007680 TSecr=0 WS=128  tcp.stream == 6
128   6.429536 192.168.42.196 -> 184.105.67.86 TCP 74 34953 > http [SYN] Seq=0 Win=14600 Len=0 MSS=1460 SACK_PERM=1 TSval=43007688 TSecr=0 WS=128  tcp.stream == 7
131   6.490371 60.28.14.190 -> 192.168.42.196 TCP 54 [TCP Window Update] http > 53342 [ACK] Seq=1 Ack=1 Win=200000 Len=0  tcp.stream == 4
132   6.519875 60.28.14.190 -> 192.168.42.196 TCP 66 http > 53343 [SYN, ACK] Seq=0 Ack=1 Win=65535 Len=0 MSS=1260 WS=4 SACK_PERM=1  tcp.stream == 5
133   6.519901 192.168.42.196 -> 60.28.14.190 TCP 54 53343 > http [ACK] Seq=1 Ack=1 Win=14720 Len=0  tcp.stream == 5
134   6.521557 192.168.42.196 -> 60.28.14.190 HTTP 442 GET /js/ping_qqcom_v2.1.9.js HTTP/1.1   tcp.stream == 5
135   6.529840 60.28.14.190 -> 192.168.42.196 TCP 66 http > 53344 [SYN, ACK] Seq=0 Ack=1 Win=65535 Len=0 MSS=1260 WS=4 SACK_PERM=1  tcp.stream == 6
136   6.529863 192.168.42.196 -> 60.28.14.190 TCP 54 53344 > http [ACK] Seq=1 Ack=1 Win=14720 Len=0  tcp.stream == 6
137   6.531354 192.168.42.196 -> 60.28.14.190 HTTP 442 GET /js/smart_for_qq_v3.1.js HTTP/1.1   tcp.stream == 6
138   6.539465 184.105.67.86 -> 192.168.42.196 TCP 66 http > 34953 [SYN, ACK] Seq=0 Ack=1 Win=65535 Len=0 MSS=1260 WS=4 SACK_PERM=1  tcp.stream == 7
139   6.539493 192.168.42.196 -> 184.105.67.86 TCP 54 34953 > http [ACK] Seq=1 Ack=1 Win=14720 Len=0  tcp.stream == 7
140   6.540982 192.168.42.196 -> 184.105.67.86 HTTP 468 GET /web/crystal/v1.5Beta03Build035/crystal-min.js HTTP/1.1   tcp.stream == 7
143   6.571213 60.28.14.190 -> 192.168.42.196 TCP 1314 [TCP segment of a reassembled PDU]  tcp.stream == 3
144   6.571327 60.28.14.190 -> 192.168.42.196 TCP 1314 [TCP segment of a reassembled PDU]  tcp.stream == 3
145   6.571336 192.168.42.196 -> 60.28.14.190 TCP 54 53341 > http [ACK] Seq=397 Ack=45139 Win=64128 Len=0  tcp.stream == 3
146   6.571343 60.28.14.190 -> 192.168.42.196 TCP 381 [TCP segment of a reassembled PDU]  tcp.stream == 3
147   6.575129 192.168.42.196 -> 60.28.14.190 TCP 54 53341 > http [ACK] Seq=397 Ack=45466 Win=64128 Len=0  tcp.stream == 3
148   6.591965 60.28.14.190 -> 192.168.42.196 TCP 1314 [TCP segment of a reassembled PDU]  tcp.stream == 3
149   6.591979 60.28.14.190 -> 192.168.42.196 TCP 1314 [TCP segment of a reassembled PDU]  tcp.stream == 3
150   6.592022 192.168.42.196 -> 60.28.14.190 TCP 54 53341 > http [ACK] Seq=397 Ack=47986 Win=64128 Len=0  tcp.stream == 3
151   6.592079 60.28.14.190 -> 192.168.42.196 TCP 1314 [TCP segment of a reassembled PDU]  tcp.stream == 3
152   6.592083 60.28.14.190 -> 192.168.42.196 TCP 1314 [TCP segment of a reassembled PDU]  tcp.stream == 3
153   6.595110 192.168.42.196 -> 60.28.14.190 TCP 54 53341 > http [ACK] Seq=397 Ack=50506 Win=64128 Len=0  tcp.stream == 3
154   6.611089 60.28.14.190 -> 192.168.42.196 TCP 1314 [TCP segment of a reassembled PDU]  tcp.stream == 3
155   6.632099 60.28.14.190 -> 192.168.42.196 TCP 1314 [TCP segment of a reassembled PDU]  tcp.stream == 3
156   6.632118 192.168.42.196 -> 60.28.14.190 TCP 54 53341 > http [ACK] Seq=397 Ack=53026 Win=64128 Len=0  tcp.stream == 3
157   6.632203 60.28.14.190 -> 192.168.42.196 TCP 694 [TCP segment of a reassembled PDU]  tcp.stream == 3
158   6.632208 60.28.14.190 -> 192.168.42.196 TCP 1314 [TCP segment of a reassembled PDU]  tcp.stream == 3
159   6.632210 60.28.14.190 -> 192.168.42.196 TCP 1314 [TCP segment of a reassembled PDU]  tcp.stream == 3
160   6.634069 192.168.42.196 -> 60.28.14.190 TCP 54 53341 > http [ACK] Seq=397 Ack=56186 Win=64128 Len=0  tcp.stream == 3
161   6.641465 60.28.14.190 -> 192.168.42.196 TCP 1314 [TCP segment of a reassembled PDU]  tcp.stream == 3
162   6.641574 60.28.14.190 -> 192.168.42.196 TCP 1314 [TCP segment of a reassembled PDU]  tcp.stream == 3
163   6.642056 192.168.42.196 -> 60.28.14.190 TCP 54 53341 > http [ACK] Seq=397 Ack=58706 Win=64128 Len=0  tcp.stream == 3
164   6.651969 60.28.14.190 -> 192.168.42.196 TCP 1314 [TCP segment of a reassembled PDU]  tcp.stream == 3
165   6.651986 60.28.14.190 -> 192.168.42.196 TCP 1314 [TCP segment of a reassembled PDU]  tcp.stream == 3
166   6.651988 60.28.14.190 -> 192.168.42.196 TCP 694 [TCP segment of a reassembled PDU]  tcp.stream == 3
167   6.654047 192.168.42.196 -> 60.28.14.190 TCP 54 53341 > http [ACK] Seq=397 Ack=61866 Win=64128 Len=0  tcp.stream == 3
168   6.660337 60.28.14.190 -> 192.168.42.196 TCP 1314 [TCP segment of a reassembled PDU]  tcp.stream == 3
169   6.670214 60.28.14.190 -> 192.168.42.196 TCP 1314 [TCP segment of a reassembled PDU]  tcp.stream == 3
170   6.670232 192.168.42.196 -> 60.28.14.190 TCP 54 53341 > http [ACK] Seq=397 Ack=64386 Win=64128 Len=0  tcp.stream == 3
171   6.680212 60.28.14.190 -> 192.168.42.196 TCP 1314 [TCP segment of a reassembled PDU]  tcp.stream == 3
172   6.691121 60.28.14.190 -> 192.168.42.196 TCP 1314 [TCP segment of a reassembled PDU]  tcp.stream == 3
173   6.691137 192.168.42.196 -> 60.28.14.190 TCP 54 53341 > http [ACK] Seq=397 Ack=66906 Win=64128 Len=0  tcp.stream == 3
174   6.691144 60.28.14.190 -> 192.168.42.196 TCP 1314 [TCP segment of a reassembled PDU]  tcp.stream == 3
175   6.700460 60.28.14.190 -> 192.168.42.196 TCP 1314 [TCP segment of a reassembled PDU]  tcp.stream == 3
176   6.700478 192.168.42.196 -> 60.28.14.190 TCP 54 53341 > http [ACK] Seq=397 Ack=69426 Win=64128 Len=0  tcp.stream == 3
177   6.700485 60.28.14.190 -> 192.168.42.196 TCP 694 [TCP segment of a reassembled PDU]  tcp.stream == 3
178   6.700576 60.28.14.190 -> 192.168.42.196 TCP 690 [TCP segment of a reassembled PDU]  tcp.stream == 3
179   6.700581 60.28.14.190 -> 192.168.42.196 HTTP 59 HTTP/1.1 200 OK  (text/html)  tcp.stream == 3
180   6.701998 192.168.42.196 -> 60.28.14.190 TCP 54 53341 > http [ACK] Seq=397 Ack=70707 Win=62976 Len=0  tcp.stream == 3
182   6.712727 60.28.14.190 -> 192.168.42.196 TCP 54 [TCP Window Update] http > 53343 [ACK] Seq=1 Ack=1 Win=200000 Len=0  tcp.stream == 5
183   6.712735 60.28.14.190 -> 192.168.42.196 TCP 54 http > 53342 [ACK] Seq=1 Ack=405 Win=200000 Len=0  tcp.stream == 4
184   6.712824 60.28.14.190 -> 192.168.42.196 TCP 54 [TCP Window Update] http > 53344 [ACK] Seq=1 Ack=1 Win=200000 Len=0  tcp.stream == 6
185   6.712827 184.105.67.86 -> 192.168.42.196 TCP 54 [TCP Window Update] http > 34953 [ACK] Seq=1 Ack=1 Win=200000 Len=0  tcp.stream == 7
186   6.713695 192.168.42.196 -> 60.28.14.190 TCP 54 53341 > http [FIN, ACK] Seq=397 Ack=70707 Win=64128 Len=0  tcp.stream == 3
190   6.799968 60.28.14.190 -> 192.168.42.196 TCP 54 http > 53343 [ACK] Seq=1 Ack=389 Win=200000 Len=0  tcp.stream == 5
191   6.799983 60.28.14.190 -> 192.168.42.196 TCP 54 http > 53344 [ACK] Seq=1 Ack=389 Win=200000 Len=0  tcp.stream == 6
192   6.799985 184.105.67.86 -> 192.168.42.196 TCP 54 http > 34953 [ACK] Seq=1 Ack=415 Win=200000 Len=0  tcp.stream == 7
193   6.829847 60.28.14.190 -> 192.168.42.196 TCP 54 http > 53341 [ACK] Seq=70707 Ack=398 Win=200000 Len=0  tcp.stream == 3
194   6.829865 60.28.14.190 -> 192.168.42.196 TCP 54 http > 53341 [FIN, ACK] Seq=70707 Ack=398 Win=200000 Len=0  tcp.stream == 3
195   6.829872 192.168.42.196 -> 60.28.14.190 TCP 54 53341 > http [ACK] Seq=398 Ack=70708 Win=64128 Len=0  tcp.stream == 3
197   6.924816 192.168.42.196 -> 125.39.200.22 TCP 74 49160 > http [SYN] Seq=0 Win=14600 Len=0 MSS=1460 SACK_PERM=1 TSval=43007812 TSecr=0 WS=128  tcp.stream == 8
199   6.984182 192.168.42.196 -> 60.28.14.148 TCP 74 55101 > http [SYN] Seq=0 Win=14600 Len=0 MSS=1460 SACK_PERM=1 TSval=43007827 TSecr=0 WS=128  tcp.stream == 9
200   6.984664 192.168.42.196 -> 60.28.14.148 TCP 74 55102 > http [SYN] Seq=0 Win=14600 Len=0 MSS=1460 SACK_PERM=1 TSval=43007827 TSecr=0 WS=128  tcp.stream == 10
201   7.039861 125.39.200.22 -> 192.168.42.196 TCP 66 http > 49160 [SYN, ACK] Seq=0 Ack=1 Win=65535 Len=0 MSS=1260 WS=4 SACK_PERM=1  tcp.stream == 8
202   7.039891 192.168.42.196 -> 125.39.200.22 TCP 54 49160 > http [ACK] Seq=1 Ack=1 Win=14720 Len=0  tcp.stream == 8
203   7.041503 192.168.42.196 -> 125.39.200.22 HTTP 440 GET /js/speed_v1.9-min.js HTTP/1.1   tcp.stream == 8
204   7.099846 60.28.14.148 -> 192.168.42.196 TCP 66 http > 55101 [SYN, ACK] Seq=0 Ack=1 Win=65535 Len=0 MSS=1260 WS=4 SACK_PERM=1  tcp.stream == 9
205   7.099875 192.168.42.196 -> 60.28.14.148 TCP 54 55101 > http [ACK] Seq=1 Ack=1 Win=14720 Len=0  tcp.stream == 9
206   7.099882 60.28.14.148 -> 192.168.42.196 TCP 66 http > 55102 [SYN, ACK] Seq=0 Ack=1 Win=65535 Len=0 MSS=1260 WS=4 SACK_PERM=1  tcp.stream == 10
207   7.099886 192.168.42.196 -> 60.28.14.148 TCP 54 55102 > http [ACK] Seq=1 Ack=1 Win=14720 Len=0  tcp.stream == 10
208   7.102026 192.168.42.196 -> 60.28.14.148 HTTP 449 GET /tech/js/ipad/iscroll_v2.js HTTP/1.1   tcp.stream == 10
209   7.103108 192.168.42.196 -> 60.28.14.148 HTTP 467 GET /finance/st/g/fn-smartbox/du_smartbox_1.15.js HTTP/1.1   tcp.stream == 9
210   7.150214 125.39.200.22 -> 192.168.42.196 TCP 54 [TCP Window Update] http > 49160 [ACK] Seq=1 Ack=1 Win=200000 Len=0  tcp.stream == 8
211   7.160482 60.28.14.190 -> 192.168.42.196 TCP 1314 [TCP segment of a reassembled PDU]  tcp.stream == 4
212   7.160499 192.168.42.196 -> 60.28.14.190 TCP 54 53342 > http [ACK] Seq=405 Ack=1261 Win=17152 Len=0  tcp.stream == 4
213   7.160506 60.28.14.190 -> 192.168.42.196 HTTP 717 HTTP/1.1 200 OK  (text/css)  tcp.stream == 4
214   7.160510 192.168.42.196 -> 60.28.14.190 TCP 54 53342 > http [ACK] Seq=405 Ack=1924 Win=19712 Len=0  tcp.stream == 4
215   7.168728 192.168.42.196 -> 60.28.14.190 TCP 54 53342 > http [FIN, ACK] Seq=405 Ack=1924 Win=19712 Len=0  tcp.stream == 4
216   7.210118 60.28.14.148 -> 192.168.42.196 TCP 54 [TCP Window Update] http > 55101 [ACK] Seq=1 Ack=1 Win=200000 Len=0  tcp.stream == 9
217   7.210135 60.28.14.148 -> 192.168.42.196 TCP 54 [TCP Window Update] http > 55102 [ACK] Seq=1 Ack=1 Win=200000 Len=0  tcp.stream == 10
218   7.280243 60.28.14.190 -> 192.168.42.196 TCP 54 http > 53342 [ACK] Seq=1924 Ack=406 Win=200000 Len=0  tcp.stream == 4
219   7.280263 60.28.14.190 -> 192.168.42.196 TCP 54 http > 53342 [FIN, ACK] Seq=1924 Ack=406 Win=200000 Len=0  tcp.stream == 4
220   7.280271 192.168.42.196 -> 60.28.14.190 TCP 54 53342 > http [ACK] Seq=406 Ack=1925 Win=19712 Len=0  tcp.stream == 4
221   7.301487 60.28.14.190 -> 192.168.42.196 TCP 1314 [TCP segment of a reassembled PDU]  tcp.stream == 5
222   7.301504 192.168.42.196 -> 60.28.14.190 TCP 54 53343 > http [ACK] Seq=389 Ack=1261 Win=17152 Len=0  tcp.stream == 5
223   7.309961 60.28.14.190 -> 192.168.42.196 HTTP 1214 HTTP/1.1 200 OK  (application/x-javascript)  tcp.stream == 5
224   7.309981 192.168.42.196 -> 60.28.14.190 TCP 54 53343 > http [ACK] Seq=389 Ack=2421 Win=19712 Len=0  tcp.stream == 5
225   7.309986 125.39.200.22 -> 192.168.42.196 TCP 54 http > 49160 [ACK] Seq=1 Ack=387 Win=200000 Len=0  tcp.stream == 8
226   7.313203 192.168.42.196 -> 60.28.14.190 TCP 54 53343 > http [FIN, ACK] Seq=389 Ack=2421 Win=19712 Len=0  tcp.stream == 5
227   7.330366 60.28.14.190 -> 192.168.42.196 TCP 1314 [TCP segment of a reassembled PDU]  tcp.stream == 6
228   7.330384 192.168.42.196 -> 60.28.14.190 TCP 54 53344 > http [ACK] Seq=389 Ack=1261 Win=17152 Len=0  tcp.stream == 6
229   7.330390 60.28.14.190 -> 192.168.42.196 HTTP 1166 HTTP/1.1 200 OK  (application/x-javascript)  tcp.stream == 6
230   7.330392 192.168.42.196 -> 60.28.14.190 TCP 54 53344 > http [ACK] Seq=389 Ack=2373 Win=19712 Len=0  tcp.stream == 6
231   7.337790 192.168.42.196 -> 60.28.14.190 TCP 54 53344 > http [FIN, ACK] Seq=389 Ack=2373 Win=19712 Len=0  tcp.stream == 6
232   7.350117 60.28.14.148 -> 192.168.42.196 TCP 54 http > 55101 [ACK] Seq=1 Ack=414 Win=200000 Len=0  tcp.stream == 9
233   7.350136 60.28.14.148 -> 192.168.42.196 TCP 54 http > 55102 [ACK] Seq=1 Ack=396 Win=200000 Len=0  tcp.stream == 10
234   7.420124 60.28.14.190 -> 192.168.42.196 TCP 54 http > 53343 [ACK] Seq=2421 Ack=390 Win=200000 Len=0  tcp.stream == 5
235   7.420143 60.28.14.190 -> 192.168.42.196 TCP 54 http > 53343 [FIN, ACK] Seq=2421 Ack=390 Win=200000 Len=0  tcp.stream == 5
236   7.420149 192.168.42.196 -> 60.28.14.190 TCP 54 53343 > http [ACK] Seq=390 Ack=2422 Win=19712 Len=0  tcp.stream == 5
237   7.449992 60.28.14.190 -> 192.168.42.196 TCP 54 http > 53344 [ACK] Seq=2373 Ack=390 Win=200000 Len=0  tcp.stream == 6
238   7.450014 60.28.14.190 -> 192.168.42.196 TCP 54 http > 53344 [FIN, ACK] Seq=2373 Ack=390 Win=200000 Len=0  tcp.stream == 6
239   7.450022 192.168.42.196 -> 60.28.14.190 TCP 54 53344 > http [ACK] Seq=390 Ack=2374 Win=19712 Len=0  tcp.stream == 6
240   8.022141 184.105.67.86 -> 192.168.42.196 TCP 1314 [TCP segment of a reassembled PDU]  tcp.stream == 7
241   8.022160 192.168.42.196 -> 184.105.67.86 TCP 54 34953 > http [ACK] Seq=415 Ack=1261 Win=17152 Len=0  tcp.stream == 7
242   8.031356 184.105.67.86 -> 192.168.42.196 TCP 1314 [TCP segment of a reassembled PDU]  tcp.stream == 7
243   8.031374 192.168.42.196 -> 184.105.67.86 TCP 54 34953 > http [ACK] Seq=415 Ack=2521 Win=19712 Len=0  tcp.stream == 7
244   8.031382 184.105.67.86 -> 192.168.42.196 TCP 1314 [TCP segment of a reassembled PDU]  tcp.stream == 7
245   8.031384 192.168.42.196 -> 184.105.67.86 TCP 54 34953 > http [ACK] Seq=415 Ack=3781 Win=22272 Len=0  tcp.stream == 7
246   8.042588 184.105.67.86 -> 192.168.42.196 TCP 1314 [TCP segment of a reassembled PDU]  tcp.stream == 7
247   8.042607 192.168.42.196 -> 184.105.67.86 TCP 54 34953 > http [ACK] Seq=415 Ack=5041 Win=24704 Len=0  tcp.stream == 7
248   8.042619 184.105.67.86 -> 192.168.42.196 TCP 1314 [TCP segment of a reassembled PDU]  tcp.stream == 7
249   8.042622 192.168.42.196 -> 184.105.67.86 TCP 54 34953 > http [ACK] Seq=415 Ack=6301 Win=27264 Len=0  tcp.stream == 7
250   8.042624 184.105.67.86 -> 192.168.42.196 TCP 1314 [TCP segment of a reassembled PDU]  tcp.stream == 7
251   8.042627 192.168.42.196 -> 184.105.67.86 TCP 54 34953 > http [ACK] Seq=415 Ack=7561 Win=29824 Len=0  tcp.stream == 7
252   8.050365 184.105.67.86 -> 192.168.42.196 TCP 974 [TCP segment of a reassembled PDU]  tcp.stream == 7
253   8.050385 192.168.42.196 -> 184.105.67.86 TCP 54 34953 > http [ACK] Seq=415 Ack=8481 Win=32256 Len=0  tcp.stream == 7
254   8.050392 184.105.67.86 -> 192.168.42.196 HTTP 877 HTTP/1.1 200 OK  (application/x-javascript)  tcp.stream == 7
255   8.050395 192.168.42.196 -> 184.105.67.86 TCP 54 34953 > http [ACK] Seq=415 Ack=9304 Win=34816 Len=0  tcp.stream == 7
256   8.052790 192.168.42.196 -> 184.105.67.86 TCP 54 34953 > http [FIN, ACK] Seq=415 Ack=9304 Win=34816 Len=0  tcp.stream == 7
257   8.160489 60.28.14.148 -> 192.168.42.196 TCP 1314 [TCP segment of a reassembled PDU]  tcp.stream == 10
258   8.160513 192.168.42.196 -> 60.28.14.148 TCP 54 55102 > http [ACK] Seq=396 Ack=1261 Win=17152 Len=0  tcp.stream == 10
259   8.171963 60.28.14.148 -> 192.168.42.196 TCP 1314 [TCP segment of a reassembled PDU]  tcp.stream == 10
260   8.171982 192.168.42.196 -> 60.28.14.148 TCP 54 55102 > http [ACK] Seq=396 Ack=2521 Win=19712 Len=0  tcp.stream == 10
261   8.171989 60.28.14.148 -> 192.168.42.196 TCP 1314 [TCP segment of a reassembled PDU]  tcp.stream == 10
262   8.171991 192.168.42.196 -> 60.28.14.148 TCP 54 55102 > http [ACK] Seq=396 Ack=3781 Win=22272 Len=0  tcp.stream == 10
263   8.171993 60.28.14.148 -> 192.168.42.196 TCP 1314 [TCP segment of a reassembled PDU]  tcp.stream == 10
264   8.171996 192.168.42.196 -> 60.28.14.148 TCP 54 55102 > http [ACK] Seq=396 Ack=5041 Win=24704 Len=0  tcp.stream == 10
265   8.180114 60.28.14.148 -> 192.168.42.196 HTTP 1267 HTTP/1.1 200 OK  (application/x-javascript)  tcp.stream == 10
266   8.180135 192.168.42.196 -> 60.28.14.148 TCP 54 55102 > http [ACK] Seq=396 Ack=6254 Win=27264 Len=0  tcp.stream == 10
267   8.180142 184.105.67.86 -> 192.168.42.196 TCP 54 http > 34953 [ACK] Seq=9304 Ack=416 Win=200000 Len=0  tcp.stream == 7
268   8.180148 184.105.67.86 -> 192.168.42.196 TCP 54 http > 34953 [FIN, ACK] Seq=9304 Ack=416 Win=200000 Len=0  tcp.stream == 7
269   8.180151 192.168.42.196 -> 184.105.67.86 TCP 54 34953 > http [ACK] Seq=416 Ack=9305 Win=34816 Len=0  tcp.stream == 7
270   8.184255 192.168.42.196 -> 60.28.14.148 TCP 54 55102 > http [FIN, ACK] Seq=396 Ack=6254 Win=27264 Len=0  tcp.stream == 10
271   8.260594 125.39.200.22 -> 192.168.42.196 TCP 1314 [TCP segment of a reassembled PDU]  tcp.stream == 8
272   8.260616 192.168.42.196 -> 125.39.200.22 TCP 54 49160 > http [ACK] Seq=387 Ack=1261 Win=17152 Len=0  tcp.stream == 8
273   8.260624 125.39.200.22 -> 192.168.42.196 HTTP 157 HTTP/1.1 200 OK  (application/x-javascript)  tcp.stream == 8
274   8.260627 192.168.42.196 -> 125.39.200.22 TCP 54 49160 > http [ACK] Seq=387 Ack=1364 Win=17152 Len=0  tcp.stream == 8
275   8.267492 192.168.42.196 -> 125.39.200.22 TCP 54 49160 > http [FIN, ACK] Seq=387 Ack=1364 Win=17152 Len=0  tcp.stream == 8
276   8.299831 60.28.14.148 -> 192.168.42.196 TCP 54 http > 55102 [ACK] Seq=6254 Ack=397 Win=200000 Len=0  tcp.stream == 10
277   8.299851 60.28.14.148 -> 192.168.42.196 TCP 54 http > 55102 [FIN, ACK] Seq=6254 Ack=397 Win=200000 Len=0  tcp.stream == 10
278   8.299858 192.168.42.196 -> 60.28.14.148 TCP 54 55102 > http [ACK] Seq=397 Ack=6255 Win=27264 Len=0  tcp.stream == 10
279   8.380456 60.28.14.148 -> 192.168.42.196 TCP 1314 [TCP segment of a reassembled PDU]  tcp.stream == 9
280   8.380475 192.168.42.196 -> 60.28.14.148 TCP 54 55101 > http [ACK] Seq=414 Ack=1261 Win=17152 Len=0  tcp.stream == 9
281   8.401580 60.28.14.148 -> 192.168.42.196 TCP 1314 [TCP segment of a reassembled PDU]  tcp.stream == 9
282   8.401601 192.168.42.196 -> 60.28.14.148 TCP 54 55101 > http [ACK] Seq=414 Ack=2521 Win=19712 Len=0  tcp.stream == 9
283   8.401608 60.28.14.148 -> 192.168.42.196 TCP 1314 [TCP segment of a reassembled PDU]  tcp.stream == 9
284   8.401612 192.168.42.196 -> 60.28.14.148 TCP 54 55101 > http [ACK] Seq=414 Ack=3781 Win=22272 Len=0  tcp.stream == 9
285   8.411207 60.28.14.148 -> 192.168.42.196 TCP 1314 [TCP segment of a reassembled PDU]  tcp.stream == 9
286   8.411229 192.168.42.196 -> 60.28.14.148 TCP 54 55101 > http [ACK] Seq=414 Ack=5041 Win=24704 Len=0  tcp.stream == 9
287   8.411235 60.28.14.148 -> 192.168.42.196 TCP 1314 [TCP segment of a reassembled PDU]  tcp.stream == 9
288   8.411238 192.168.42.196 -> 60.28.14.148 TCP 54 55101 > http [ACK] Seq=414 Ack=6301 Win=27264 Len=0  tcp.stream == 9
289   8.422325 60.28.14.148 -> 192.168.42.196 TCP 1314 [TCP segment of a reassembled PDU]  tcp.stream == 9
290   8.422345 192.168.42.196 -> 60.28.14.148 TCP 54 55101 > http [ACK] Seq=414 Ack=7561 Win=29824 Len=0  tcp.stream == 9
291   8.422440 60.28.14.148 -> 192.168.42.196 TCP 1057 [TCP segment of a reassembled PDU]  tcp.stream == 9
292   8.422446 192.168.42.196 -> 60.28.14.148 TCP 54 55101 > http [ACK] Seq=414 Ack=8564 Win=32256 Len=0  tcp.stream == 9
293   8.430326 60.28.14.148 -> 192.168.42.196 TCP 1314 [TCP segment of a reassembled PDU]  tcp.stream == 9
294   8.430345 192.168.42.196 -> 60.28.14.148 TCP 54 55101 > http [ACK] Seq=414 Ack=9824 Win=34816 Len=0  tcp.stream == 9
295   8.441829 60.28.14.148 -> 192.168.42.196 TCP 1314 [TCP segment of a reassembled PDU]  tcp.stream == 9
296   8.441849 192.168.42.196 -> 60.28.14.148 TCP 54 55101 > http [ACK] Seq=414 Ack=11084 Win=37376 Len=0  tcp.stream == 9
297   8.441857 125.39.200.22 -> 192.168.42.196 TCP 54 http > 49160 [ACK] Seq=1364 Ack=388 Win=200000 Len=0  tcp.stream == 8
298   8.441864 60.28.14.148 -> 192.168.42.196 TCP 321 [TCP segment of a reassembled PDU]  tcp.stream == 9
299   8.441872 192.168.42.196 -> 60.28.14.148 TCP 54 55101 > http [ACK] Seq=414 Ack=11351 Win=39808 Len=0  tcp.stream == 9
300   8.441874 125.39.200.22 -> 192.168.42.196 TCP 54 http > 49160 [FIN, ACK] Seq=1364 Ack=388 Win=200000 Len=0  tcp.stream == 8
301   8.441878 192.168.42.196 -> 125.39.200.22 TCP 54 49160 > http [ACK] Seq=388 Ack=1365 Win=17152 Len=0  tcp.stream == 8
302   8.460825 60.28.14.148 -> 192.168.42.196 TCP 1314 [TCP segment of a reassembled PDU]  tcp.stream == 9
303   8.460843 192.168.42.196 -> 60.28.14.148 TCP 54 55101 > http [ACK] Seq=414 Ack=12611 Win=42368 Len=0  tcp.stream == 9
304   8.460940 60.28.14.148 -> 192.168.42.196 TCP 1314 [TCP segment of a reassembled PDU]  tcp.stream == 9
305   8.460945 192.168.42.196 -> 60.28.14.148 TCP 54 55101 > http [ACK] Seq=414 Ack=13871 Win=44928 Len=0  tcp.stream == 9
306   8.500202 60.28.14.148 -> 192.168.42.196 TCP 1314 [TCP segment of a reassembled PDU]  tcp.stream == 9
307   8.500221 192.168.42.196 -> 60.28.14.148 TCP 54 55101 > http [ACK] Seq=414 Ack=15131 Win=47360 Len=0  tcp.stream == 9
308   8.511079 60.28.14.148 -> 192.168.42.196 TCP 1314 [TCP segment of a reassembled PDU]  tcp.stream == 9
309   8.511099 192.168.42.196 -> 60.28.14.148 TCP 54 55101 > http [ACK] Seq=414 Ack=16391 Win=49920 Len=0  tcp.stream == 9
310   8.511105 60.28.14.148 -> 192.168.42.196 TCP 1314 [TCP segment of a reassembled PDU]  tcp.stream == 9
311   8.511108 192.168.42.196 -> 60.28.14.148 TCP 54 55101 > http [ACK] Seq=414 Ack=17651 Win=52480 Len=0  tcp.stream == 9
312   8.520115 60.28.14.148 -> 192.168.42.196 HTTP 893 HTTP/1.1 200 OK  (application/x-javascript)  tcp.stream == 9
313   8.520136 192.168.42.196 -> 60.28.14.148 TCP 54 55101 > http [ACK] Seq=414 Ack=18490 Win=55040 Len=0  tcp.stream == 9
314   8.521757 192.168.42.196 -> 60.28.14.148 TCP 54 55101 > http [FIN, ACK] Seq=414 Ack=18490 Win=55040 Len=0  tcp.stream == 9
318   8.606573 192.168.42.196 -> 60.28.14.148 TCP 74 55103 > http [SYN] Seq=0 Win=14600 Len=0 MSS=1460 SACK_PERM=1 TSval=43008232 TSecr=0 WS=128  tcp.stream == 11
319   8.612943 192.168.42.196 -> 60.28.14.148 TCP 74 55104 > http [SYN] Seq=0 Win=14600 Len=0 MSS=1460 SACK_PERM=1 TSval=43008234 TSecr=0 WS=128  tcp.stream == 12
320   8.620556 192.168.42.196 -> 60.28.14.148 TCP 74 55105 > http [SYN] Seq=0 Win=14600 Len=0 MSS=1460 SACK_PERM=1 TSval=43008236 TSecr=0 WS=128  tcp.stream == 13
321   8.629600 192.168.42.196 -> 60.28.14.148 TCP 74 55106 > http [SYN] Seq=0 Win=14600 Len=0 MSS=1460 SACK_PERM=1 TSval=43008238 TSecr=0 WS=128  tcp.stream == 14
322   8.640321 60.28.14.148 -> 192.168.42.196 TCP 54 http > 55101 [ACK] Seq=18490 Ack=415 Win=200000 Len=0  tcp.stream == 9
323   8.640339 60.28.14.148 -> 192.168.42.196 TCP 54 http > 55101 [FIN, ACK] Seq=18490 Ack=415 Win=200000 Len=0  tcp.stream == 9
324   8.640347 192.168.42.196 -> 60.28.14.148 TCP 54 55101 > http [ACK] Seq=415 Ack=18491 Win=55040 Len=0  tcp.stream == 9
325   8.691821 192.168.42.196 -> 60.28.14.148 TCP 74 55107 > http [SYN] Seq=0 Win=14600 Len=0 MSS=1460 SACK_PERM=1 TSval=43008253 TSecr=0 WS=128  tcp.stream == 15
326   8.703941 192.168.42.196 -> 60.28.14.148 TCP 74 55108 > http [SYN] Seq=0 Win=14600 Len=0 MSS=1460 SACK_PERM=1 TSval=43008256 TSecr=0 WS=128  tcp.stream == 16
327   8.719830 60.28.14.148 -> 192.168.42.196 TCP 66 http > 55103 [SYN, ACK] Seq=0 Ack=1 Win=65535 Len=0 MSS=1260 WS=4 SACK_PERM=1  tcp.stream == 11
328   8.719856 192.168.42.196 -> 60.28.14.148 TCP 54 55103 > http [ACK] Seq=1 Ack=1 Win=14720 Len=0  tcp.stream == 11
329   8.729952 60.28.14.148 -> 192.168.42.196 TCP 66 http > 55104 [SYN, ACK] Seq=0 Ack=1 Win=65535 Len=0 MSS=1260 WS=4 SACK_PERM=1  tcp.stream == 12
330   8.729975 192.168.42.196 -> 60.28.14.148 TCP 54 55104 > http [ACK] Seq=1 Ack=1 Win=14720 Len=0  tcp.stream == 12
331   8.750076 60.28.14.148 -> 192.168.42.196 TCP 66 http > 55106 [SYN, ACK] Seq=0 Ack=1 Win=65535 Len=0 MSS=1260 WS=4 SACK_PERM=1  tcp.stream == 14
332   8.750102 192.168.42.196 -> 60.28.14.148 TCP 54 55106 > http [ACK] Seq=1 Ack=1 Win=14720 Len=0  tcp.stream == 14
333   8.750109 60.28.14.148 -> 192.168.42.196 TCP 66 http > 55105 [SYN, ACK] Seq=0 Ack=1 Win=65535 Len=0 MSS=1260 WS=4 SACK_PERM=1  tcp.stream == 13
334   8.750119 192.168.42.196 -> 60.28.14.148 TCP 54 55105 > http [ACK] Seq=1 Ack=1 Win=14720 Len=0  tcp.stream == 13
335   8.755704 192.168.42.196 -> 125.39.200.22 TCP 74 49169 > http [SYN] Seq=0 Win=14600 Len=0 MSS=1460 SACK_PERM=1 TSval=43008269 TSecr=0 WS=128  tcp.stream == 17
338   8.772779 192.168.42.196 -> 125.39.200.22 TCP 74 49170 > http [SYN] Seq=0 Win=14600 Len=0 MSS=1460 SACK_PERM=1 TSval=43008274 TSecr=0 WS=128  tcp.stream == 18
339   8.774262 192.168.42.196 -> 125.39.200.22 TCP 74 49171 > http [SYN] Seq=0 Win=14600 Len=0 MSS=1460 SACK_PERM=1 TSval=43008274 TSecr=0 WS=128  tcp.stream == 19
344   8.809826 60.28.14.148 -> 192.168.42.196 TCP 66 http > 55107 [SYN, ACK] Seq=0 Ack=1 Win=65535 Len=0 MSS=1260 WS=4 SACK_PERM=1  tcp.stream == 15
345   8.809857 192.168.42.196 -> 60.28.14.148 TCP 54 55107 > http [ACK] Seq=1 Ack=1 Win=14720 Len=0  tcp.stream == 15
346   8.819947 60.28.14.148 -> 192.168.42.196 TCP 66 http > 55108 [SYN, ACK] Seq=0 Ack=1 Win=65535 Len=0 MSS=1260 WS=4 SACK_PERM=1  tcp.stream == 16
347   8.819969 192.168.42.196 -> 60.28.14.148 TCP 54 55108 > http [ACK] Seq=1 Ack=1 Win=14720 Len=0  tcp.stream == 16
348   8.829830 60.28.14.148 -> 192.168.42.196 TCP 54 [TCP Window Update] http > 55103 [ACK] Seq=1 Ack=1 Win=200000 Len=0  tcp.stream == 11
349   8.839830 60.28.14.148 -> 192.168.42.196 TCP 54 [TCP Window Update] http > 55104 [ACK] Seq=1 Ack=1 Win=200000 Len=0  tcp.stream == 12
350   8.859950 60.28.14.148 -> 192.168.42.196 TCP 54 [TCP Window Update] http > 55106 [ACK] Seq=1 Ack=1 Win=200000 Len=0  tcp.stream == 14
351   8.859966 60.28.14.148 -> 192.168.42.196 TCP 54 [TCP Window Update] http > 55105 [ACK] Seq=1 Ack=1 Win=200000 Len=0  tcp.stream == 13
352   8.871074 125.39.200.22 -> 192.168.42.196 TCP 66 http > 49169 [SYN, ACK] Seq=0 Ack=1 Win=65535 Len=0 MSS=1260 WS=4 SACK_PERM=1  tcp.stream == 17
