  3   0.366329 192.168.42.196 -> 192.150.16.117 TCP 74 49134 > http [SYN] Seq=0 Win=14600 Len=0 MSS=1460 SACK_PERM=1 TSval=44610772 TSecr=0 WS=128  tcp.stream == 0
  6   0.616909 192.168.42.196 -> 192.150.16.117 TCP 74 49135 > http [SYN] Seq=0 Win=14600 Len=0 MSS=1460 SACK_PERM=1 TSval=44610835 TSecr=0 WS=128  tcp.stream == 1
  7   2.177069 192.150.16.117 -> 192.168.42.196 TCP 66 http > 49134 [SYN, ACK] Seq=0 Ack=1 Win=65535 Len=0 MSS=1260 WS=4 SACK_PERM=1  tcp.stream == 0
  8   2.177107 192.168.42.196 -> 192.150.16.117 TCP 54 49134 > http [ACK] Seq=1 Ack=1 Win=14720 Len=0  tcp.stream == 0
  9   2.177195 192.168.42.196 -> 192.150.16.117 HTTP 345 GET / HTTP/1.1   tcp.stream == 0
 10   2.276782 192.150.16.117 -> 192.168.42.196 TCP 66 http > 49135 [SYN, ACK] Seq=0 Ack=1 Win=65535 Len=0 MSS=1260 WS=4 SACK_PERM=1  tcp.stream == 1
 11   2.276808 192.168.42.196 -> 192.150.16.117 TCP 54 49135 > http [ACK] Seq=1 Ack=1 Win=14720 Len=0  tcp.stream == 1
 12   2.316645 192.150.16.117 -> 192.168.42.196 TCP 54 [TCP Window Update] http > 49134 [ACK] Seq=1 Ack=1 Win=200000 Len=0  tcp.stream == 0
 13   2.396778 192.150.16.117 -> 192.168.42.196 TCP 54 [TCP Window Update] http > 49135 [ACK] Seq=1 Ack=1 Win=200000 Len=0  tcp.stream == 1
 14   2.486650 192.150.16.117 -> 192.168.42.196 HTTP 491 HTTP/1.1 301 Moved Permanently  (text/html)  tcp.stream == 0
 15   2.486671 192.168.42.196 -> 192.150.16.117 TCP 54 49134 > http [ACK] Seq=292 Ack=438 Win=15744 Len=0  tcp.stream == 0
 18   2.626979 192.168.42.196 -> 192.150.16.64 TCP 74 41305 > http [SYN] Seq=0 Win=14600 Len=0 MSS=1460 SACK_PERM=1 TSval=44611337 TSecr=0 WS=128  tcp.stream == 2
 19   2.746542 192.150.16.64 -> 192.168.42.196 TCP 66 http > 41305 [SYN, ACK] Seq=0 Ack=1 Win=65535 Len=0 MSS=1260 WS=4 SACK_PERM=1  tcp.stream == 2
 20   2.746604 192.168.42.196 -> 192.150.16.64 TCP 54 41305 > http [ACK] Seq=1 Ack=1 Win=14720 Len=0  tcp.stream == 2
 21   2.746751 192.168.42.196 -> 192.150.16.64 HTTP 349 GET / HTTP/1.1   tcp.stream == 2
 22   2.869403 192.150.16.64 -> 192.168.42.196 TCP 54 [TCP Window Update] http > 41305 [ACK] Seq=1 Ack=1 Win=200000 Len=0  tcp.stream == 2
 23   2.977025 192.150.16.64 -> 192.168.42.196 TCP 1314 [TCP segment of a reassembled PDU]  tcp.stream == 2
 24   2.977047 192.168.42.196 -> 192.150.16.64 TCP 54 41305 > http [ACK] Seq=296 Ack=1261 Win=17152 Len=0  tcp.stream == 2
 25   2.986641 192.150.16.64 -> 192.168.42.196 TCP 906 [TCP segment of a reassembled PDU]  tcp.stream == 2
 26   2.986658 192.168.42.196 -> 192.150.16.64 TCP 54 41305 > http [ACK] Seq=296 Ack=2113 Win=19712 Len=0  tcp.stream == 2
 28   2.995147 192.168.42.196 -> 192.150.16.64 TCP 74 41306 > http [SYN] Seq=0 Win=14600 Len=0 MSS=1460 SACK_PERM=1 TSval=44611429 TSecr=0 WS=128  tcp.stream == 3
 29   2.995442 192.168.42.196 -> 192.150.16.64 TCP 74 41307 > http [SYN] Seq=0 Win=14600 Len=0 MSS=1460 SACK_PERM=1 TSval=44611429 TSecr=0 WS=128  tcp.stream == 4
 30   2.997234 192.168.42.196 -> 192.150.16.64 TCP 74 41308 > http [SYN] Seq=0 Win=14600 Len=0 MSS=1460 SACK_PERM=1 TSval=44611430 TSecr=0 WS=128  tcp.stream == 5
 31   3.007018 192.150.16.64 -> 192.168.42.196 TCP 1314 [TCP segment of a reassembled PDU]  tcp.stream == 2
 32   3.007035 192.168.42.196 -> 192.150.16.64 TCP 54 41305 > http [ACK] Seq=296 Ack=3373 Win=22272 Len=0  tcp.stream == 2
 33   3.007042 192.150.16.64 -> 192.168.42.196 TCP 111 [TCP segment of a reassembled PDU]  tcp.stream == 2
 34   3.007045 192.168.42.196 -> 192.150.16.64 TCP 54 41305 > http [ACK] Seq=296 Ack=3430 Win=22272 Len=0  tcp.stream == 2
 35   3.017895 192.150.16.64 -> 192.168.42.196 TCP 1314 [TCP segment of a reassembled PDU]  tcp.stream == 2
 36   3.017914 192.168.42.196 -> 192.150.16.64 TCP 54 41305 > http [ACK] Seq=296 Ack=4690 Win=24704 Len=0  tcp.stream == 2
 37   3.017921 192.150.16.64 -> 192.168.42.196 TCP 259 [TCP segment of a reassembled PDU]  tcp.stream == 2
 38   3.017923 192.168.42.196 -> 192.150.16.64 TCP 54 41305 > http [ACK] Seq=296 Ack=4895 Win=27264 Len=0  tcp.stream == 2
 39   3.024516 192.168.42.196 -> 192.150.16.64 TCP 74 41309 > http [SYN] Seq=0 Win=14600 Len=0 MSS=1460 SACK_PERM=1 TSval=44611437 TSecr=0 WS=128  tcp.stream == 6
 40   3.024555 192.168.42.196 -> 192.150.16.64 TCP 74 41310 > http [SYN] Seq=0 Win=14600 Len=0 MSS=1460 SACK_PERM=1 TSval=44611437 TSecr=0 WS=128  tcp.stream == 7
 41   3.046892 192.150.16.64 -> 192.168.42.196 TCP 1065 [TCP segment of a reassembled PDU]  tcp.stream == 2
 42   3.046908 192.168.42.196 -> 192.150.16.64 TCP 54 41305 > http [ACK] Seq=296 Ack=5906 Win=29824 Len=0  tcp.stream == 2
 43   3.057395 192.150.16.64 -> 192.168.42.196 TCP 1314 [TCP segment of a reassembled PDU]  tcp.stream == 2
 44   3.057418 192.168.42.196 -> 192.150.16.64 TCP 54 41305 > http [ACK] Seq=296 Ack=7166 Win=32256 Len=0  tcp.stream == 2
 45   3.057427 192.150.16.64 -> 192.168.42.196 TCP 206 [TCP segment of a reassembled PDU]  tcp.stream == 2
 46   3.057430 192.168.42.196 -> 192.150.16.64 TCP 54 41305 > http [ACK] Seq=296 Ack=7318 Win=34816 Len=0  tcp.stream == 2
 47   3.057433 192.150.16.64 -> 192.168.42.196 TCP 1300 [TCP segment of a reassembled PDU]  tcp.stream == 2
 48   3.057437 192.168.42.196 -> 192.150.16.64 TCP 54 41305 > http [ACK] Seq=296 Ack=8564 Win=37376 Len=0  tcp.stream == 2
 49   3.077265 192.150.16.64 -> 192.168.42.196 TCP 1314 [TCP segment of a reassembled PDU]  tcp.stream == 2
 50   3.077286 192.168.42.196 -> 192.150.16.64 TCP 54 41305 > http [ACK] Seq=296 Ack=9824 Win=39808 Len=0  tcp.stream == 2
 51   3.077379 192.150.16.64 -> 192.168.42.196 TCP 781 [TCP segment of a reassembled PDU]  tcp.stream == 2
 52   3.077384 192.168.42.196 -> 192.150.16.64 TCP 54 41305 > http [ACK] Seq=296 Ack=10551 Win=42368 Len=0  tcp.stream == 2
 53   3.077390 192.150.16.64 -> 192.168.42.196 HTTP 74 HTTP/1.1 200 OK  (text/html)  tcp.stream == 2
 54   3.077407 192.168.42.196 -> 192.150.16.64 TCP 54 41305 > http [ACK] Seq=296 Ack=10571 Win=42368 Len=0  tcp.stream == 2
 55   3.077474 192.168.42.196 -> 192.150.16.64 HTTP 408 GET /homepage/include/style/homepage-120911-touch-challenger3-light-short.css HTTP/1.1   tcp.stream == 2
 59   3.117708 192.168.42.196 -> 63.166.98.81 TCP 74 55610 > http [SYN] Seq=0 Win=14600 Len=0 MSS=1460 SACK_PERM=1 TSval=44611460 TSecr=0 WS=128  tcp.stream == 8
 60   3.117748 192.168.42.196 -> 63.166.98.81 TCP 74 55611 > http [SYN] Seq=0 Win=14600 Len=0 MSS=1460 SACK_PERM=1 TSval=44611460 TSecr=0 WS=128  tcp.stream == 9
 61   3.117775 192.168.42.196 -> 63.166.98.81 TCP 74 55612 > http [SYN] Seq=0 Win=14600 Len=0 MSS=1460 SACK_PERM=1 TSval=44611460 TSecr=0 WS=128  tcp.stream == 10
 62   3.117801 192.168.42.196 -> 63.166.98.81 TCP 74 55613 > http [SYN] Seq=0 Win=14600 Len=0 MSS=1460 SACK_PERM=1 TSval=44611460 TSecr=0 WS=128  tcp.stream == 11
 63   3.117829 192.168.42.196 -> 63.166.98.81 TCP 74 55614 > http [SYN] Seq=0 Win=14600 Len=0 MSS=1460 SACK_PERM=1 TSval=44611460 TSecr=0 WS=128  tcp.stream == 12
 64   3.117856 192.168.42.196 -> 63.166.98.81 TCP 74 55615 > http [SYN] Seq=0 Win=14600 Len=0 MSS=1460 SACK_PERM=1 TSval=44611460 TSecr=0 WS=128  tcp.stream == 13
 65   3.127017 192.150.16.64 -> 192.168.42.196 TCP 66 http > 41306 [SYN, ACK] Seq=0 Ack=1 Win=65535 Len=0 MSS=1260 WS=4 SACK_PERM=1  tcp.stream == 3
 66   3.127052 192.168.42.196 -> 192.150.16.64 TCP 54 41306 > http [ACK] Seq=1 Ack=1 Win=14720 Len=0  tcp.stream == 3
 67   3.127060 192.150.16.64 -> 192.168.42.196 TCP 66 http > 41307 [SYN, ACK] Seq=0 Ack=1 Win=65535 Len=0 MSS=1260 WS=4 SACK_PERM=1  tcp.stream == 4
 68   3.127065 192.168.42.196 -> 192.150.16.64 TCP 54 41307 > http [ACK] Seq=1 Ack=1 Win=14720 Len=0  tcp.stream == 4
 69   3.127067 192.150.16.64 -> 192.168.42.196 TCP 66 http > 41308 [SYN, ACK] Seq=0 Ack=1 Win=65535 Len=0 MSS=1260 WS=4 SACK_PERM=1  tcp.stream == 5
 70   3.127071 192.168.42.196 -> 192.150.16.64 TCP 54 41308 > http [ACK] Seq=1 Ack=1 Win=14720 Len=0  tcp.stream == 5
 71   3.127175 192.168.42.196 -> 192.150.16.64 HTTP 372 GET /etc/pagetables/reflowtypes/adobe.css HTTP/1.1   tcp.stream == 3
 72   3.127199 192.168.42.196 -> 192.150.16.64 HTTP 345 GET /uber/js/omniture/mbox.js HTTP/1.1   tcp.stream == 4
 73   3.127216 192.168.42.196 -> 192.150.16.64 HTTP 406 GET /homepage/include/style/homepage/bg_120911_touchapps.jpg HTTP/1.1   tcp.stream == 5
 74   3.156919 192.150.16.64 -> 192.168.42.196 TCP 66 http > 41309 [SYN, ACK] Seq=0 Ack=1 Win=65535 Len=0 MSS=1260 WS=4 SACK_PERM=1  tcp.stream == 6
 75   3.156947 192.168.42.196 -> 192.150.16.64 TCP 54 41309 > http [ACK] Seq=1 Ack=1 Win=14720 Len=0  tcp.stream == 6
 76   3.157073 192.168.42.196 -> 192.150.16.64 HTTP 403 GET /homepage/include/style/homepage/adobe_logo_45x45.jpg HTTP/1.1   tcp.stream == 6
 77   3.166640 192.150.16.64 -> 192.168.42.196 TCP 66 http > 41310 [SYN, ACK] Seq=0 Ack=1 Win=65535 Len=0 MSS=1260 WS=4 SACK_PERM=1  tcp.stream == 7
 78   3.166668 192.168.42.196 -> 192.150.16.64 TCP 54 41310 > http [ACK] Seq=1 Ack=1 Win=14720 Len=0  tcp.stream == 7
 79   3.166782 192.168.42.196 -> 192.150.16.64 HTTP 415 GET /homepage/include/style/homepage/pod_120911_education_306x180.jpg HTTP/1.1   tcp.stream == 7
 80   3.236659 63.166.98.81 -> 192.168.42.196 TCP 66 http > 55610 [SYN, ACK] Seq=0 Ack=1 Win=65535 Len=0 MSS=1260 WS=4 SACK_PERM=1  tcp.stream == 8
 81   3.236684 192.168.42.196 -> 63.166.98.81 TCP 54 55610 > http [ACK] Seq=1 Ack=1 Win=14720 Len=0  tcp.stream == 8
 82   3.236771 192.168.42.196 -> 63.166.98.81 HTTP 384 GET /www.adobe.com/include/style/compressed.css HTTP/1.1   tcp.stream == 8
 83   3.248393 63.166.98.81 -> 192.168.42.196 TCP 66 http > 55613 [SYN, ACK] Seq=0 Ack=1 Win=65535 Len=0 MSS=1260 WS=4 SACK_PERM=1  tcp.stream == 11
 84   3.248422 192.168.42.196 -> 63.166.98.81 TCP 54 55613 > http [ACK] Seq=1 Ack=1 Win=14720 Len=0  tcp.stream == 11
 85   3.248429 63.166.98.81 -> 192.168.42.196 TCP 66 http > 55612 [SYN, ACK] Seq=0 Ack=1 Win=65535 Len=0 MSS=1260 WS=4 SACK_PERM=1  tcp.stream == 10
 86   3.248437 192.168.42.196 -> 63.166.98.81 TCP 54 55612 > http [ACK] Seq=1 Ack=1 Win=14720 Len=0  tcp.stream == 10
 87   3.248441 63.166.98.81 -> 192.168.42.196 TCP 66 http > 55611 [SYN, ACK] Seq=0 Ack=1 Win=65535 Len=0 MSS=1260 WS=4 SACK_PERM=1  tcp.stream == 9
 88   3.248445 192.168.42.196 -> 63.166.98.81 TCP 54 55611 > http [ACK] Seq=1 Ack=1 Win=14720 Len=0  tcp.stream == 9
 89   3.248517 192.168.42.196 -> 63.166.98.81 HTTP 399 GET /www.adobe.com/homepage/include/style/grid/ThreeColumn.css HTTP/1.1   tcp.stream == 11
 90   3.248541 192.168.42.196 -> 63.166.98.81 HTTP 399 GET /www.adobe.com/homepage/include/style/default/Mnemonic.css HTTP/1.1   tcp.stream == 9
 91   3.248552 192.168.42.196 -> 63.166.98.81 HTTP 398 GET /www.adobe.com/homepage/include/style/grid/LayoutGrid.css HTTP/1.1   tcp.stream == 10
 92   3.256913 63.166.98.81 -> 192.168.42.196 TCP 66 http > 55614 [SYN, ACK] Seq=0 Ack=1 Win=65535 Len=0 MSS=1260 WS=4 SACK_PERM=1  tcp.stream == 12
 93   3.256941 192.168.42.196 -> 63.166.98.81 TCP 54 55614 > http [ACK] Seq=1 Ack=1 Win=14720 Len=0  tcp.stream == 12
 94   3.257028 192.168.42.196 -> 63.166.98.81 HTTP 393 GET /www.adobe.com/include/style/default/SearchBuddy.css HTTP/1.1   tcp.stream == 12
 95   3.266774 63.166.98.81 -> 192.168.42.196 TCP 66 http > 55615 [SYN, ACK] Seq=0 Ack=1 Win=65535 Len=0 MSS=1260 WS=4 SACK_PERM=1  tcp.stream == 13
 96   3.266800 192.168.42.196 -> 63.166.98.81 TCP 54 55615 > http [ACK] Seq=1 Ack=1 Win=14720 Len=0  tcp.stream == 13
 97   3.266806 192.150.16.64 -> 192.168.42.196 TCP 54 [TCP Window Update] http > 41306 [ACK] Seq=1 Ack=1 Win=200000 Len=0  tcp.stream == 3
 98   3.266810 192.150.16.64 -> 192.168.42.196 TCP 54 [TCP Window Update] http > 41308 [ACK] Seq=1 Ack=1 Win=200000 Len=0  tcp.stream == 5
 99   3.266812 192.150.16.64 -> 192.168.42.196 TCP 54 [TCP Window Update] http > 41307 [ACK] Seq=1 Ack=1 Win=200000 Len=0  tcp.stream == 4
100   3.266877 192.168.42.196 -> 63.166.98.81 HTTP 407 GET /www.adobe.com/include/style/theme/adobe-light/jquery-ui-1.8.1.css HTTP/1.1   tcp.stream == 13
101   3.276764 192.150.16.64 -> 192.168.42.196 TCP 1314 [TCP segment of a reassembled PDU]  tcp.stream == 2
102   3.286909 192.150.16.64 -> 192.168.42.196 TCP 1314 [TCP segment of a reassembled PDU]  tcp.stream == 2
103   3.286928 192.168.42.196 -> 192.150.16.64 TCP 54 41305 > http [ACK] Seq=650 Ack=13091 Win=47360 Len=0  tcp.stream == 2
104   3.296890 192.150.16.64 -> 192.168.42.196 TCP 1314 [TCP segment of a reassembled PDU]  tcp.stream == 2
105   3.307540 192.150.16.64 -> 192.168.42.196 TCP 1314 [TCP segment of a reassembled PDU]  tcp.stream == 2
106   3.307560 192.168.42.196 -> 192.150.16.64 TCP 54 41305 > http [ACK] Seq=650 Ack=15611 Win=52480 Len=0  tcp.stream == 2
107   3.307568 192.150.16.64 -> 192.168.42.196 TCP 1314 [TCP segment of a reassembled PDU]  tcp.stream == 2
108   3.316921 192.150.16.64 -> 192.168.42.196 TCP 1314 [TCP segment of a reassembled PDU]  tcp.stream == 2
109   3.316943 192.168.42.196 -> 192.150.16.64 TCP 54 41305 > http [ACK] Seq=650 Ack=18131 Win=57472 Len=0  tcp.stream == 2
110   3.326892 192.150.16.64 -> 192.168.42.196 TCP 963 [TCP segment of a reassembled PDU]  tcp.stream == 2
111   3.337141 192.150.16.64 -> 192.168.42.196 TCP 1314 [TCP segment of a reassembled PDU]  tcp.stream == 2
112   3.337159 192.168.42.196 -> 192.150.16.64 TCP 54 41305 > http [ACK] Seq=650 Ack=20300 Win=62592 Len=0  tcp.stream == 2
113   3.337168 192.150.16.64 -> 192.168.42.196 TCP 1314 [TCP segment of a reassembled PDU]  tcp.stream == 2
114   3.346763 192.150.16.64 -> 192.168.42.196 TCP 1314 [TCP segment of a reassembled PDU]  tcp.stream == 2
115   3.346780 192.168.42.196 -> 192.150.16.64 TCP 54 41305 > http [ACK] Seq=650 Ack=22820 Win=64128 Len=0  tcp.stream == 2
116   3.357044 192.150.16.64 -> 192.168.42.196 TCP 1314 [TCP segment of a reassembled PDU]  tcp.stream == 2
117   3.368795 192.150.16.64 -> 192.168.42.196 TCP 1022 [TCP segment of a reassembled PDU]  tcp.stream == 2
118   3.368817 192.168.42.196 -> 192.150.16.64 TCP 54 41305 > http [ACK] Seq=650 Ack=25048 Win=64128 Len=0  tcp.stream == 2
119   3.368824 192.150.16.64 -> 192.168.42.196 HTTP 488 HTTP/1.1 200 OK  (text/css)  tcp.stream == 3
120   3.368829 192.168.42.196 -> 192.150.16.64 TCP 54 41306 > http [ACK] Seq=319 Ack=435 Win=15744 Len=0  tcp.stream == 3
121   3.368832 192.150.16.64 -> 192.168.42.196 TCP 1314 [TCP segment of a reassembled PDU]  tcp.stream == 2
122   3.369046 192.168.42.196 -> 192.150.16.64 HTTP 415 GET /homepage/include/style/homepage/pod_120911_solutions_306x180.jpg HTTP/1.1   tcp.stream == 3
123   3.387922 192.150.16.64 -> 192.168.42.196 TCP 1314 [TCP segment of a reassembled PDU]  tcp.stream == 2
124   3.387942 192.168.42.196 -> 192.150.16.64 TCP 54 41305 > http [ACK] Seq=650 Ack=27568 Win=64128 Len=0  tcp.stream == 2
125   3.387951 192.150.16.64 -> 192.168.42.196 TCP 1314 [TCP segment of a reassembled PDU]  tcp.stream == 2
126   3.397017 192.150.16.64 -> 192.168.42.196 TCP 1314 [TCP segment of a reassembled PDU]  tcp.stream == 2
127   3.397036 192.168.42.196 -> 192.150.16.64 TCP 54 41305 > http [ACK] Seq=650 Ack=30088 Win=64128 Len=0  tcp.stream == 2
128   3.407043 192.150.16.64 -> 192.168.42.196 TCP 1314 [TCP segment of a reassembled PDU]  tcp.stream == 2
129   3.417295 192.150.16.64 -> 192.168.42.196 TCP 854 [TCP segment of a reassembled PDU]  tcp.stream == 2
130   3.417314 192.168.42.196 -> 192.150.16.64 TCP 54 41305 > http [ACK] Seq=650 Ack=32148 Win=64128 Len=0  tcp.stream == 2
131   3.417321 192.150.16.64 -> 192.168.42.196 HTTP 263 HTTP/1.1 200 OK  (text/css)  tcp.stream == 2
132   3.417324 192.150.16.64 -> 192.168.42.196 TCP 54 [TCP Window Update] http > 41309 [ACK] Seq=1 Ack=1 Win=200000 Len=0  tcp.stream == 6
133   3.417438 192.168.42.196 -> 192.150.16.64 HTTP 412 GET /include/style/grid-narrow-compressed.css HTTP/1.1   tcp.stream == 2
134   3.427035 192.150.16.64 -> 192.168.42.196 TCP 1314 [TCP segment of a reassembled PDU]  tcp.stream == 5
135   3.427055 192.168.42.196 -> 192.150.16.64 TCP 54 41308 > http [ACK] Seq=353 Ack=1261 Win=17152 Len=0  tcp.stream == 5
136   3.427062 192.150.16.64 -> 192.168.42.196 TCP 1314 [TCP segment of a reassembled PDU]  tcp.stream == 5
137   3.427065 192.168.42.196 -> 192.150.16.64 TCP 54 41308 > http [ACK] Seq=353 Ack=2521 Win=19712 Len=0  tcp.stream == 5
138   3.458527 192.150.16.64 -> 192.168.42.196 HTTP 1215 HTTP/1.1 200 OK  (JPEG JFIF image)  tcp.stream == 6
139   3.458558 192.168.42.196 -> 192.150.16.64 TCP 54 41309 > http [ACK] Seq=350 Ack=1162 Win=17024 Len=0  tcp.stream == 6
140   3.458642 192.150.16.64 -> 192.168.42.196 TCP 1314 [TCP segment of a reassembled PDU]  tcp.stream == 5
141   3.458649 192.168.42.196 -> 192.150.16.64 TCP 54 41308 > http [ACK] Seq=353 Ack=3781 Win=22272 Len=0  tcp.stream == 5
142   3.458652 192.150.16.64 -> 192.168.42.196 TCP 1314 [TCP segment of a reassembled PDU]  tcp.stream == 5
143   3.458654 192.168.42.196 -> 192.150.16.64 TCP 54 41308 > http [ACK] Seq=353 Ack=5041 Win=24704 Len=0  tcp.stream == 5
144   3.458656 192.150.16.64 -> 192.168.42.196 TCP 54 http > 41310 [ACK] Seq=1 Ack=362 Win=200000 Len=0  tcp.stream == 7
145   3.458660 63.166.98.81 -> 192.168.42.196 TCP 54 [TCP Window Update] http > 55610 [ACK] Seq=1 Ack=1 Win=200000 Len=0  tcp.stream == 8
146   3.458663 63.166.98.81 -> 192.168.42.196 TCP 54 [TCP Window Update] http > 55612 [ACK] Seq=1 Ack=1 Win=200000 Len=0  tcp.stream == 10
147   3.458665 63.166.98.81 -> 192.168.42.196 TCP 54 [TCP Window Update] http > 55613 [ACK] Seq=1 Ack=1 Win=200000 Len=0  tcp.stream == 11
148   3.458666 63.166.98.81 -> 192.168.42.196 TCP 54 [TCP Window Update] http > 55611 [ACK] Seq=1 Ack=1 Win=200000 Len=0  tcp.stream == 9
149   3.458762 63.166.98.81 -> 192.168.42.196 HTTP 683 HTTP/1.1 200 OK  (text/css)  tcp.stream == 11
150   3.458772 192.168.42.196 -> 63.166.98.81 TCP 54 55613 > http [ACK] Seq=346 Ack=630 Win=15872 Len=0  tcp.stream == 11
151   3.458775 63.166.98.81 -> 192.168.42.196 TCP 54 [TCP Window Update] http > 55614 [ACK] Seq=1 Ack=1 Win=200000 Len=0  tcp.stream == 12
152   3.458777 63.166.98.81 -> 192.168.42.196 TCP 54 [TCP Window Update] http > 55615 [ACK] Seq=1 Ack=1 Win=200000 Len=0  tcp.stream == 13
153   3.458847 192.168.42.196 -> 192.150.16.64 HTTP 415 GET /homepage/include/style/homepage/pod_120911_migration_306x180.jpg HTTP/1.1   tcp.stream == 6
154   3.458941 192.168.42.196 -> 63.166.98.81 HTTP 367 GET /www.adobe.com/include/script/homepage.js HTTP/1.1   tcp.stream == 11
155   3.466919 63.166.98.81 -> 192.168.42.196 HTTP 1228 HTTP/1.1 200 OK  (text/css)  tcp.stream == 12
156   3.466942 192.168.42.196 -> 63.166.98.81 TCP 54 55614 > http [ACK] Seq=340 Ack=1175 Win=17024 Len=0  tcp.stream == 12
157   3.467089 192.168.42.196 -> 63.166.98.81 HTTP 373 GET /www.adobe.com/homepage/include/script/store.js HTTP/1.1   tcp.stream == 12
158   3.477544 192.150.16.64 -> 192.168.42.196 TCP 1314 [TCP segment of a reassembled PDU]  tcp.stream == 5
159   3.477564 192.168.42.196 -> 192.150.16.64 TCP 54 41308 > http [ACK] Seq=353 Ack=6301 Win=27264 Len=0  tcp.stream == 5
160   3.488291 192.150.16.64 -> 192.168.42.196 TCP 1314 [TCP segment of a reassembled PDU]  tcp.stream == 5
161   3.488310 192.168.42.196 -> 192.150.16.64 TCP 54 41308 > http [ACK] Seq=353 Ack=7561 Win=29824 Len=0  tcp.stream == 5
162   3.497426 63.166.98.81 -> 192.168.42.196 TCP 1314 [TCP segment of a reassembled PDU]  tcp.stream == 9
163   3.497450 192.168.42.196 -> 63.166.98.81 TCP 54 55611 > http [ACK] Seq=346 Ack=1261 Win=17152 Len=0  tcp.stream == 9
164   3.497457 63.166.98.81 -> 192.168.42.196 HTTP 441 HTTP/1.1 200 OK  (text/css)  tcp.stream == 9
165   3.497460 192.168.42.196 -> 63.166.98.81 TCP 54 55611 > http [ACK] Seq=346 Ack=1648 Win=19712 Len=0  tcp.stream == 9
166   3.497462 63.166.98.81 -> 192.168.42.196 HTTP 1003 HTTP/1.1 200 OK  (text/css)  tcp.stream == 10
167   3.497465 192.168.42.196 -> 63.166.98.81 TCP 54 55612 > http [ACK] Seq=345 Ack=950 Win=16512 Len=0  tcp.stream == 10
168   3.497673 192.168.42.196 -> 63.166.98.81 HTTP 376 GET /www.adobe.com/include/script/adobe/SearchBuddy.js HTTP/1.1   tcp.stream == 9
169   3.497706 192.168.42.196 -> 63.166.98.81 HTTP 386 GET /www.adobe.com/homepage/include/script/adobe/GlobalFooter.js HTTP/1.1   tcp.stream == 10
170   3.507021 63.166.98.81 -> 192.168.42.196 TCP 1314 [TCP segment of a reassembled PDU]  tcp.stream == 8
171   3.507045 192.168.42.196 -> 63.166.98.81 TCP 54 55610 > http [ACK] Seq=331 Ack=1261 Win=17152 Len=0  tcp.stream == 8
172   3.507053 192.150.16.64 -> 192.168.42.196 TCP 54 http > 41307 [ACK] Seq=1 Ack=292 Win=200000 Len=0  tcp.stream == 4
173   3.516917 192.150.16.64 -> 192.168.42.196 TCP 1314 [TCP segment of a reassembled PDU]  tcp.stream == 7
174   3.516935 192.168.42.196 -> 192.150.16.64 TCP 54 41310 > http [ACK] Seq=362 Ack=1261 Win=17152 Len=0  tcp.stream == 7
175   3.537665 192.150.16.64 -> 192.168.42.196 TCP 1314 [TCP segment of a reassembled PDU]  tcp.stream == 7
176   3.537685 192.168.42.196 -> 192.150.16.64 TCP 54 41310 > http [ACK] Seq=362 Ack=2521 Win=19712 Len=0  tcp.stream == 7
177   3.537693 192.150.16.64 -> 192.168.42.196 TCP 1314 [TCP segment of a reassembled PDU]  tcp.stream == 5
178   3.537696 192.168.42.196 -> 192.150.16.64 TCP 54 41308 > http [ACK] Seq=353 Ack=8821 Win=32256 Len=0  tcp.stream == 5
179   3.537746 192.150.16.64 -> 192.168.42.196 TCP 1314 [TCP segment of a reassembled PDU]  tcp.stream == 4
180   3.537749 192.168.42.196 -> 192.150.16.64 TCP 54 41307 > http [ACK] Seq=292 Ack=1261 Win=17152 Len=0  tcp.stream == 4
181   3.557264 192.150.16.64 -> 192.168.42.196 TCP 1314 [TCP segment of a reassembled PDU]  tcp.stream == 4
182   3.557285 192.168.42.196 -> 192.150.16.64 TCP 54 41307 > http [ACK] Seq=292 Ack=2521 Win=19712 Len=0  tcp.stream == 4
183   3.557295 63.166.98.81 -> 192.168.42.196 TCP 1314 [TCP segment of a reassembled PDU]  tcp.stream == 8
184   3.557300 192.168.42.196 -> 63.166.98.81 TCP 54 55610 > http [ACK] Seq=331 Ack=2521 Win=19712 Len=0  tcp.stream == 8
185   3.566915 63.166.98.81 -> 192.168.42.196 TCP 1314 [TCP segment of a reassembled PDU]  tcp.stream == 13
186   3.566936 192.168.42.196 -> 63.166.98.81 TCP 54 55615 > http [ACK] Seq=354 Ack=1261 Win=17152 Len=0  tcp.stream == 13
187   3.577039 63.166.98.81 -> 192.168.42.196 TCP 1314 [TCP segment of a reassembled PDU]  tcp.stream == 13
188   3.577057 192.168.42.196 -> 63.166.98.81 TCP 54 55615 > http [ACK] Seq=354 Ack=2521 Win=19712 Len=0  tcp.stream == 13
189   3.587012 192.150.16.64 -> 192.168.42.196 TCP 1314 [TCP segment of a reassembled PDU]  tcp.stream == 7
190   3.587031 192.168.42.196 -> 192.150.16.64 TCP 54 41310 > http [ACK] Seq=362 Ack=3781 Win=22272 Len=0  tcp.stream == 7
191   3.587041 192.150.16.64 -> 192.168.42.196 TCP 1314 [TCP segment of a reassembled PDU]  tcp.stream == 7
192   3.587045 192.168.42.196 -> 192.150.16.64 TCP 54 41310 > http [ACK] Seq=362 Ack=5041 Win=24704 Len=0  tcp.stream == 7
193   3.596772 192.150.16.64 -> 192.168.42.196 TCP 1314 [TCP segment of a reassembled PDU]  tcp.stream == 4
194   3.596804 192.168.42.196 -> 192.150.16.64 TCP 54 41307 > http [ACK] Seq=292 Ack=3781 Win=22272 Len=0  tcp.stream == 4
195   3.618670 192.150.16.64 -> 192.168.42.196 TCP 1314 [TCP segment of a reassembled PDU]  tcp.stream == 4
196   3.618699 192.168.42.196 -> 192.150.16.64 TCP 54 41307 > http [ACK] Seq=292 Ack=5041 Win=24704 Len=0  tcp.stream == 4
197   3.618706 192.150.16.64 -> 192.168.42.196 TCP 1314 [TCP segment of a reassembled PDU]  tcp.stream == 5
198   3.618709 192.168.42.196 -> 192.150.16.64 TCP 54 41308 > http [ACK] Seq=353 Ack=10081 Win=34816 Len=0  tcp.stream == 5
199   3.618711 63.166.98.81 -> 192.168.42.196 TCP 1314 [TCP segment of a reassembled PDU]  tcp.stream == 13
200   3.618713 192.168.42.196 -> 63.166.98.81 TCP 54 55615 > http [ACK] Seq=354 Ack=3781 Win=22272 Len=0  tcp.stream == 13
201   3.618745 63.166.98.81 -> 192.168.42.196 TCP 1314 [TCP segment of a reassembled PDU]  tcp.stream == 8
202   3.618748 192.168.42.196 -> 63.166.98.81 TCP 54 55610 > http [ACK] Seq=331 Ack=3781 Win=22272 Len=0  tcp.stream == 8
203   3.618750 63.166.98.81 -> 192.168.42.196 TCP 1314 [TCP segment of a reassembled PDU]  tcp.stream == 8
204   3.618752 192.168.42.196 -> 63.166.98.81 TCP 54 55610 > http [ACK] Seq=331 Ack=5041 Win=24704 Len=0  tcp.stream == 8
205   3.626544 192.150.16.64 -> 192.168.42.196 TCP 1314 [TCP segment of a reassembled PDU]  tcp.stream == 7
206   3.626567 192.168.42.196 -> 192.150.16.64 TCP 54 41310 > http [ACK] Seq=362 Ack=6301 Win=27264 Len=0  tcp.stream == 7
207   3.750018 192.150.16.64 -> 192.168.42.196 TCP 1314 [TCP segment of a reassembled PDU]  tcp.stream == 7
208   3.750037 192.168.42.196 -> 192.150.16.64 TCP 54 41310 > http [ACK] Seq=362 Ack=7561 Win=29824 Len=0  tcp.stream == 7
209   3.750126 192.150.16.64 -> 192.168.42.196 HTTP 704 HTTP/1.1 200 OK  (text/css)  tcp.stream == 2
210   3.750137 192.150.16.64 -> 192.168.42.196 TCP 1314 [TCP segment of a reassembled PDU]  tcp.stream == 4
211   3.750156 192.168.42.196 -> 192.150.16.64 TCP 54 41307 > http [ACK] Seq=292 Ack=6301 Win=27264 Len=0  tcp.stream == 4
212   3.750159 192.150.16.64 -> 192.168.42.196 TCP 1314 [TCP segment of a reassembled PDU]  tcp.stream == 3
213   3.750249 192.150.16.64 -> 192.168.42.196 TCP 1314 [TCP segment of a reassembled PDU]  tcp.stream == 3
214   3.750255 192.168.42.196 -> 192.150.16.64 TCP 54 41306 > http [ACK] Seq=680 Ack=2955 Win=20736 Len=0  tcp.stream == 3
215   3.750258 192.150.16.64 -> 192.168.42.196 TCP 1314 [TCP segment of a reassembled PDU]  tcp.stream == 5
216   3.750262 192.168.42.196 -> 192.150.16.64 TCP 54 41308 > http [ACK] Seq=353 Ack=11341 Win=37376 Len=0  tcp.stream == 5
217   3.750300 192.168.42.196 -> 192.150.16.64 HTTP 391 GET /homepage/img/home_learning_60x40_img.jpg HTTP/1.1   tcp.stream == 2
218   3.750882 192.150.16.64 -> 192.168.42.196 TCP 1314 [TCP segment of a reassembled PDU]  tcp.stream == 5
219   3.750898 192.168.42.196 -> 192.150.16.64 TCP 54 41308 > http [ACK] Seq=353 Ack=12601 Win=39808 Len=0  tcp.stream == 5
220   3.750905 63.166.98.81 -> 192.168.42.196 TCP 1314 [TCP segment of a reassembled PDU]  tcp.stream == 8
221   3.750909 192.168.42.196 -> 63.166.98.81 TCP 54 55610 > http [ACK] Seq=331 Ack=6301 Win=27264 Len=0  tcp.stream == 8
222   3.751000 63.166.98.81 -> 192.168.42.196 TCP 1314 [TCP segment of a reassembled PDU]  tcp.stream == 13
223   3.751006 192.168.42.196 -> 63.166.98.81 TCP 54 55615 > http [ACK] Seq=354 Ack=5041 Win=24704 Len=0  tcp.stream == 13
224   3.751011 63.166.98.81 -> 192.168.42.196 TCP 1314 [TCP segment of a reassembled PDU]  tcp.stream == 13
225   3.751015 192.168.42.196 -> 63.166.98.81 TCP 54 55615 > http [ACK] Seq=354 Ack=6301 Win=27264 Len=0  tcp.stream == 13
226   3.751127 192.150.16.64 -> 192.168.42.196 TCP 1314 [TCP segment of a reassembled PDU]  tcp.stream == 3
227   3.751132 192.150.16.64 -> 192.168.42.196 TCP 1314 [TCP segment of a reassembled PDU]  tcp.stream == 5
228   3.751135 192.168.42.196 -> 192.150.16.64 TCP 54 41308 > http [ACK] Seq=353 Ack=13861 Win=42368 Len=0  tcp.stream == 5
229   3.751138 192.150.16.64 -> 192.168.42.196 HTTP 89 HTTP/1.1 200 OK  (JPEG JFIF image)  tcp.stream == 7
230   3.751142 192.168.42.196 -> 192.150.16.64 TCP 54 41310 > http [ACK] Seq=362 Ack=7596 Win=29824 Len=0  tcp.stream == 7
231   3.751212 192.168.42.196 -> 192.150.16.64 HTTP 387 GET /homepage/img/home_help_60x40_img.jpg HTTP/1.1   tcp.stream == 7
232   3.753399 192.150.16.64 -> 192.168.42.196 TCP 1314 [TCP segment of a reassembled PDU]  tcp.stream == 4
233   3.753421 192.168.42.196 -> 192.150.16.64 TCP 54 41307 > http [ACK] Seq=292 Ack=7561 Win=29824 Len=0  tcp.stream == 4
234   3.753429 63.166.98.81 -> 192.168.42.196 HTTP 492 HTTP/1.1 200 OK  (text/css)  tcp.stream == 13
235   3.753432 192.168.42.196 -> 63.166.98.81 TCP 54 55615 > http [ACK] Seq=354 Ack=6739 Win=29824 Len=0  tcp.stream == 13
236   3.753435 192.150.16.64 -> 192.168.42.196 TCP 1314 [TCP segment of a reassembled PDU]  tcp.stream == 4
237   3.753437 192.168.42.196 -> 192.150.16.64 TCP 54 41307 > http [ACK] Seq=292 Ack=8821 Win=32256 Len=0  tcp.stream == 4
238   3.753501 63.166.98.81 -> 192.168.42.196 TCP 1314 [TCP segment of a reassembled PDU]  tcp.stream == 8
239   3.753504 192.168.42.196 -> 63.166.98.81 TCP 54 55610 > http [ACK] Seq=331 Ack=7561 Win=29824 Len=0  tcp.stream == 8
240   3.753507 63.166.98.81 -> 192.168.42.196 TCP 1314 [TCP segment of a reassembled PDU]  tcp.stream == 8
241   3.753509 192.168.42.196 -> 63.166.98.81 TCP 54 55610 > http [ACK] Seq=331 Ack=8821 Win=32256 Len=0  tcp.stream == 8
242   3.753573 192.168.42.196 -> 63.166.98.81 HTTP 370 GET /www.adobe.com/js/foresee/foresee-trigger.js HTTP/1.1   tcp.stream == 13
243   3.753625 192.150.16.64 -> 192.168.42.196 TCP 1314 [TCP segment of a reassembled PDU]  tcp.stream == 5
244   3.753629 192.168.42.196 -> 192.150.16.64 TCP 54 41308 > http [ACK] Seq=353 Ack=15121 Win=44928 Len=0  tcp.stream == 5
245   3.754511 63.166.98.81 -> 192.168.42.196 TCP 1314 [TCP segment of a reassembled PDU]  tcp.stream == 11
246   3.754625 192.150.16.64 -> 192.168.42.196 TCP 1314 [TCP segment of a reassembled PDU]  tcp.stream == 6
247   3.754632 192.150.16.64 -> 192.168.42.196 TCP 1314 [TCP segment of a reassembled PDU]  tcp.stream == 6
248   3.754639 192.168.42.196 -> 192.150.16.64 TCP 54 41309 > http [ACK] Seq=711 Ack=3682 Win=22016 Len=0  tcp.stream == 6
249   3.754752 63.166.98.81 -> 192.168.42.196 TCP 1314 [TCP segment of a reassembled PDU]  tcp.stream == 11
250   3.754758 192.168.42.196 -> 63.166.98.81 TCP 54 55613 > http [ACK] Seq=659 Ack=3150 Win=20992 Len=0  tcp.stream == 11
251   3.754762 192.150.16.64 -> 192.168.42.196 TCP 1314 [TCP segment of a reassembled PDU]  tcp.stream == 3
252   3.754764 192.168.42.196 -> 192.150.16.64 TCP 54 41306 > http [ACK] Seq=680 Ack=5475 Win=25856 Len=0  tcp.stream == 3
253   3.754875 63.166.98.81 -> 192.168.42.196 TCP 1314 [TCP segment of a reassembled PDU]  tcp.stream == 8
254   3.754882 192.168.42.196 -> 63.166.98.81 TCP 54 55610 > http [ACK] Seq=331 Ack=10081 Win=34816 Len=0  tcp.stream == 8
255   3.755253 192.150.16.64 -> 192.168.42.196 HTTP 405 HTTP/1.1 200 OK  (application/x-javascript)  tcp.stream == 4
256   3.755268 192.168.42.196 -> 192.150.16.64 TCP 54 41307 > http [ACK] Seq=292 Ack=9172 Win=34816 Len=0  tcp.stream == 4
257   3.755379 63.166.98.81 -> 192.168.42.196 TCP 1314 [TCP segment of a reassembled PDU]  tcp.stream == 10
258   3.755393 63.166.98.81 -> 192.168.42.196 TCP 1314 [TCP segment of a reassembled PDU]  tcp.stream == 8
259   3.755398 192.168.42.196 -> 63.166.98.81 TCP 54 55610 > http [ACK] Seq=331 Ack=11341 Win=37376 Len=0  tcp.stream == 8
260   3.755454 192.168.42.196 -> 192.150.16.64 HTTP 372 GET /homepage/img/news.png HTTP/1.1   tcp.stream == 4
261   3.755501 192.150.16.64 -> 192.168.42.196 TCP 1314 [TCP segment of a reassembled PDU]  tcp.stream == 5
262   3.755506 192.168.42.196 -> 192.150.16.64 TCP 54 41308 > http [ACK] Seq=353 Ack=16381 Win=47360 Len=0  tcp.stream == 5
263   3.763780 192.150.16.64 -> 192.168.42.196 TCP 1314 [TCP segment of a reassembled PDU]  tcp.stream == 5
264   3.763796 192.168.42.196 -> 192.150.16.64 TCP 54 41308 > http [ACK] Seq=353 Ack=17641 Win=49920 Len=0  tcp.stream == 5
265   3.763873 63.166.98.81 -> 192.168.42.196 TCP 1314 [TCP segment of a reassembled PDU]  tcp.stream == 11
266   3.763879 63.166.98.81 -> 192.168.42.196 TCP 1314 [TCP segment of a reassembled PDU]  tcp.stream == 11
267   3.763882 192.168.42.196 -> 63.166.98.81 TCP 54 55613 > http [ACK] Seq=659 Ack=5670 Win=25984 Len=0  tcp.stream == 11
268   3.764005 63.166.98.81 -> 192.168.42.196 TCP 1314 [TCP segment of a reassembled PDU]  tcp.stream == 12
269   3.764013 63.166.98.81 -> 192.168.42.196 HTTP 486 HTTP/1.1 200 OK  (application/x-javascript)  tcp.stream == 12
270   3.764017 192.168.42.196 -> 63.166.98.81 TCP 54 55614 > http [ACK] Seq=659 Ack=2867 Win=22016 Len=0  tcp.stream == 12
271   3.764021 63.166.98.81 -> 192.168.42.196 TCP 1314 [TCP segment of a reassembled PDU]  tcp.stream == 9
272   3.764127 63.166.98.81 -> 192.168.42.196 TCP 1314 [TCP segment of a reassembled PDU]  tcp.stream == 9
273   3.764134 192.168.42.196 -> 63.166.98.81 TCP 54 55611 > http [ACK] Seq=668 Ack=4168 Win=24704 Len=0  tcp.stream == 9
274   3.764137 192.150.16.64 -> 192.168.42.196 TCP 1314 [TCP segment of a reassembled PDU]  tcp.stream == 6
275   3.764178 192.168.42.196 -> 63.166.98.81 HTTP 427 GET /www.adobe.com/homepage/include/style/product/CPod/CPod-Reader-dark.png HTTP/1.1   tcp.stream == 12
276   3.778280 192.150.16.64 -> 192.168.42.196 TCP 1314 [TCP segment of a reassembled PDU]  tcp.stream == 3
277   3.787415 192.150.16.64 -> 192.168.42.196 TCP 1314 [TCP segment of a reassembled PDU]  tcp.stream == 3
278   3.787436 192.168.42.196 -> 192.150.16.64 TCP 54 41306 > http [ACK] Seq=680 Ack=7995 Win=30848 Len=0  tcp.stream == 3
279   3.787496 63.166.98.81 -> 192.168.42.196 TCP 1314 [TCP segment of a reassembled PDU]  tcp.stream == 8
280   3.787509 192.168.42.196 -> 63.166.98.81 TCP 54 55610 > http [ACK] Seq=331 Ack=12601 Win=39808 Len=0  tcp.stream == 8
281   3.787529 63.166.98.81 -> 192.168.42.196 TCP 1314 [TCP segment of a reassembled PDU]  tcp.stream == 8
282   3.787532 192.168.42.196 -> 63.166.98.81 TCP 54 55610 > http [ACK] Seq=331 Ack=13861 Win=42368 Len=0  tcp.stream == 8
283   3.791560 192.168.42.196 -> 63.166.98.81 TCP 54 55612 > http [ACK] Seq=677 Ack=2210 Win=19072 Len=0  tcp.stream == 10
284   3.798417 192.150.16.64 -> 192.168.42.196 TCP 1314 [TCP segment of a reassembled PDU]  tcp.stream == 5
285   3.798437 192.168.42.196 -> 192.150.16.64 TCP 54 41308 > http [ACK] Seq=353 Ack=18901 Win=52480 Len=0  tcp.stream == 5
286   3.798445 192.150.16.64 -> 192.168.42.196 TCP 1314 [TCP segment of a reassembled PDU]  tcp.stream == 5
287   3.798447 192.168.42.196 -> 192.150.16.64 TCP 54 41308 > http [ACK] Seq=353 Ack=20161 Win=55040 Len=0  tcp.stream == 5
288   3.803569 192.168.42.196 -> 192.150.16.64 TCP 54 41309 > http [ACK] Seq=711 Ack=4942 Win=24576 Len=0  tcp.stream == 6
289   3.807665 63.166.98.81 -> 192.168.42.196 TCP 1314 [TCP segment of a reassembled PDU]  tcp.stream == 9
290   3.807681 63.166.98.81 -> 192.168.42.196 HTTP 246 HTTP/1.1 200 OK  (application/x-javascript)  tcp.stream == 10
291   3.807689 192.168.42.196 -> 63.166.98.81 TCP 54 55612 > http [ACK] Seq=677 Ack=2402 Win=21632 Len=0  tcp.stream == 10
292   3.807695 63.166.98.81 -> 192.168.42.196 TCP 1314 [TCP segment of a reassembled PDU]  tcp.stream == 11
293   3.807839 192.168.42.196 -> 63.166.98.81 HTTP 432 GET /www.adobe.com/homepage/include/style/product/CPod/CPod-FlashPlayer-dark.png HTTP/1.1   tcp.stream == 10
294   3.817409 63.166.98.81 -> 192.168.42.196 TCP 1314 [TCP segment of a reassembled PDU]  tcp.stream == 11
295   3.817430 192.168.42.196 -> 63.166.98.81 TCP 54 55613 > http [ACK] Seq=659 Ack=8190 Win=31104 Len=0  tcp.stream == 11
296   3.817438 192.150.16.64 -> 192.168.42.196 TCP 1314 [TCP segment of a reassembled PDU]  tcp.stream == 3
297   3.817441 192.150.16.64 -> 192.168.42.196 TCP 1314 [TCP segment of a reassembled PDU]  tcp.stream == 3
298   3.817443 192.168.42.196 -> 192.150.16.64 TCP 54 41306 > http [ACK] Seq=680 Ack=10515 Win=35840 Len=0  tcp.stream == 3
299   3.828508 192.150.16.64 -> 192.168.42.196 TCP 1314 [TCP segment of a reassembled PDU]  tcp.stream == 6
300   3.828528 192.168.42.196 -> 192.150.16.64 TCP 54 41309 > http [ACK] Seq=711 Ack=6202 Win=27008 Len=0  tcp.stream == 6
301   3.828538 192.150.16.64 -> 192.168.42.196 TCP 1314 [TCP segment of a reassembled PDU]  tcp.stream == 6
302   3.828560 192.168.42.196 -> 192.150.16.64 TCP 54 41309 > http [ACK] Seq=711 Ack=7462 Win=29568 Len=0  tcp.stream == 6
303   3.837408 63.166.98.81 -> 192.168.42.196 TCP 1314 [TCP segment of a reassembled PDU]  tcp.stream == 8
304   3.837424 192.168.42.196 -> 63.166.98.81 TCP 54 55610 > http [ACK] Seq=331 Ack=15121 Win=44928 Len=0  tcp.stream == 8
305   3.837431 63.166.98.81 -> 192.168.42.196 TCP 1314 [TCP segment of a reassembled PDU]  tcp.stream == 8
306   3.837435 192.168.42.196 -> 63.166.98.81 TCP 54 55610 > http [ACK] Seq=331 Ack=16381 Win=47360 Len=0  tcp.stream == 8
307   3.847563 192.168.42.196 -> 63.166.98.81 TCP 54 55611 > http [ACK] Seq=668 Ack=5428 Win=27264 Len=0  tcp.stream == 9
308   3.848004 192.150.16.64 -> 192.168.42.196 TCP 1314 [TCP segment of a reassembled PDU]  tcp.stream == 5
309   3.848018 192.168.42.196 -> 192.150.16.64 TCP 54 41308 > http [ACK] Seq=353 Ack=21421 Win=57472 Len=0  tcp.stream == 5
310   3.848023 192.150.16.64 -> 192.168.42.196 TCP 1314 [TCP segment of a reassembled PDU]  tcp.stream == 5
311   3.848025 192.168.42.196 -> 192.150.16.64 TCP 54 41308 > http [ACK] Seq=353 Ack=22681 Win=60032 Len=0  tcp.stream == 5
312   3.848124 63.166.98.81 -> 192.168.42.196 TCP 1314 [TCP segment of a reassembled PDU]  tcp.stream == 9
313   3.848130 192.168.42.196 -> 63.166.98.81 TCP 54 55611 > http [ACK] Seq=668 Ack=6688 Win=29824 Len=0  tcp.stream == 9
314   3.856914 63.166.98.81 -> 192.168.42.196 TCP 1314 [TCP segment of a reassembled PDU]  tcp.stream == 9
315   3.856932 192.168.42.196 -> 63.166.98.81 TCP 54 55611 > http [ACK] Seq=668 Ack=7948 Win=32256 Len=0  tcp.stream == 9
316   3.888160 63.166.98.81 -> 192.168.42.196 TCP 1314 [TCP segment of a reassembled PDU]  tcp.stream == 11
317   3.888176 63.166.98.81 -> 192.168.42.196 TCP 1314 [TCP segment of a reassembled PDU]  tcp.stream == 11
318   3.888183 192.168.42.196 -> 63.166.98.81 TCP 54 55613 > http [ACK] Seq=659 Ack=10710 Win=36096 Len=0  tcp.stream == 11
319   3.888189 63.166.98.81 -> 192.168.42.196 HTTP 138 HTTP/1.1 200 OK  (application/x-javascript)  tcp.stream == 9
320   3.888192 192.168.42.196 -> 63.166.98.81 TCP 54 55611 > http [ACK] Seq=668 Ack=8032 Win=32256 Len=0  tcp.stream == 9
321   3.888341 192.168.42.196 -> 63.166.98.81 HTTP 424 GET /www.adobe.com/homepage/include/style/product/CPod/CPod-Air-dark.png HTTP/1.1   tcp.stream == 9
322   3.913535 192.150.16.64 -> 192.168.42.196 TCP 1314 [TCP segment of a reassembled PDU]  tcp.stream == 5
323   3.913552 192.168.42.196 -> 192.150.16.64 TCP 54 41308 > http [ACK] Seq=353 Ack=23941 Win=62592 Len=0  tcp.stream == 5
324   3.913559 192.150.16.64 -> 192.168.42.196 HTTP 57 HTTP/1.1 200 OK  (JPEG JFIF image)  tcp.stream == 3
325   3.913562 63.166.98.81 -> 192.168.42.196 TCP 1314 [TCP segment of a reassembled PDU]  tcp.stream == 11
326   3.913620 63.166.98.81 -> 192.168.42.196 TCP 1314 [TCP segment of a reassembled PDU]  tcp.stream == 11
327   3.913626 192.168.42.196 -> 63.166.98.81 TCP 54 55613 > http [ACK] Seq=659 Ack=13230 Win=41088 Len=0  tcp.stream == 11
328   3.913629 192.150.16.64 -> 192.168.42.196 TCP 1314 [TCP segment of a reassembled PDU]  tcp.stream == 6
329   3.913631 192.168.42.196 -> 192.150.16.64 TCP 54 41309 > http [ACK] Seq=711 Ack=8722 Win=32128 Len=0  tcp.stream == 6
330   3.913716 192.168.42.196 -> 192.150.16.64 HTTP 381 GET /include/img/truste_seal_eu.gif HTTP/1.1   tcp.stream == 3
331   3.920915 192.150.16.64 -> 192.168.42.196 TCP 1314 [TCP segment of a reassembled PDU]  tcp.stream == 6
332   3.920932 192.168.42.196 -> 192.150.16.64 TCP 54 41309 > http [ACK] Seq=711 Ack=9982 Win=34688 Len=0  tcp.stream == 6
333   3.920940 63.166.98.81 -> 192.168.42.196 TCP 1314 [TCP segment of a reassembled PDU]  tcp.stream == 8
334   3.920943 192.168.42.196 -> 63.166.98.81 TCP 54 55610 > http [ACK] Seq=331 Ack=17641 Win=49920 Len=0  tcp.stream == 8
335   3.920997 63.166.98.81 -> 192.168.42.196 TCP 1314 [TCP segment of a reassembled PDU]  tcp.stream == 8
336   3.921002 192.168.42.196 -> 63.166.98.81 TCP 54 55610 > http [ACK] Seq=331 Ack=18901 Win=52480 Len=0  tcp.stream == 8
337   3.921005 192.150.16.64 -> 192.168.42.196 TCP 1314 [TCP segment of a reassembled PDU]  tcp.stream == 6
338   3.921007 192.168.42.196 -> 192.150.16.64 TCP 54 41309 > http [ACK] Seq=711 Ack=11242 Win=37120 Len=0  tcp.stream == 6
339   3.928637 192.150.16.64 -> 192.168.42.196 TCP 1314 [TCP segment of a reassembled PDU]  tcp.stream == 6
340   3.928655 192.168.42.196 -> 192.150.16.64 TCP 54 41309 > http [ACK] Seq=711 Ack=12502 Win=39680 Len=0  tcp.stream == 6
