  1   0.000000 70.37.129.153 -> 172.20.10.4  HTTP 1464 Continuation or non-HTTP traffic  tcp.stream == 0
  2   0.000022  172.20.10.4 -> 70.37.129.153 TCP 54 47350 > http [RST] Seq=1 Win=0 Len=0  tcp.stream == 0
  3   0.008015 70.37.129.153 -> 172.20.10.4  HTTP 1464 Continuation or non-HTTP traffic  tcp.stream == 0
  4   0.008035  172.20.10.4 -> 70.37.129.153 TCP 54 47350 > http [RST] Seq=1 Win=0 Len=0  tcp.stream == 0
  5   0.008132  23.32.13.43 -> 172.20.10.4  TCP 66 http > 33184 [FIN, ACK] Seq=1 Ack=1 Win=4726 Len=0 TSval=3551775236 TSecr=92030317  tcp.stream == 1
  6   0.008140  172.20.10.4 -> 23.32.13.43  TCP 54 33184 > http [RST] Seq=1 Win=0 Len=0  tcp.stream == 1
  7   0.053265 157.166.255.19 -> 172.20.10.4  TCP 1464 [TCP segment of a reassembled PDU]  tcp.stream == 2
  8   0.053294  172.20.10.4 -> 157.166.255.19 TCP 54 41873 > http [RST] Seq=1 Win=0 Len=0  tcp.stream == 2
  9   0.060395  172.20.10.4 -> 23.32.13.59  TCP 66 36705 > http [FIN, ACK] Seq=1 Ack=1 Win=501 Len=0 TSval=92030624 TSecr=3552338814  tcp.stream == 3
 10   0.060629 157.166.255.19 -> 172.20.10.4  TCP 1464 [TCP segment of a reassembled PDU]  tcp.stream == 2
 11   0.060641  172.20.10.4 -> 157.166.255.19 TCP 54 41873 > http [RST] Seq=1 Win=0 Len=0  tcp.stream == 2
 12   0.073515 157.166.255.19 -> 172.20.10.4  TCP 1464 [TCP segment of a reassembled PDU]  tcp.stream == 2
 13   0.073535  172.20.10.4 -> 157.166.255.19 TCP 54 41873 > http [RST] Seq=1 Win=0 Len=0  tcp.stream == 2
 14   0.088388 157.166.255.19 -> 172.20.10.4  TCP 1464 [TCP segment of a reassembled PDU]  tcp.stream == 2
 15   0.088408  172.20.10.4 -> 157.166.255.19 TCP 54 41873 > http [RST] Seq=1 Win=0 Len=0  tcp.stream == 2
 16   0.090764 72.32.153.177 -> 172.20.10.4  TCP 58 http > 35058 [SYN, ACK] Seq=0 Ack=0 Win=16384 Len=0 MSS=1410  tcp.stream == 4
 17   0.090786  172.20.10.4 -> 72.32.153.177 TCP 54 35058 > http [RST] Seq=0 Win=0 Len=0  tcp.stream == 4
 18   0.135517 157.166.255.19 -> 172.20.10.4  HTTP 188 [TCP ACKed unseen segment] HTTP/1.1 200 OK  (image/x-icon)  tcp.stream == 2
 19   0.135537  172.20.10.4 -> 157.166.255.19 TCP 54 41873 > http [RST] Seq=2 Win=0 Len=0  tcp.stream == 2
 20   0.138611 70.37.129.153 -> 172.20.10.4  TCP 66 http > 47351 [ACK] Seq=1 Ack=1 Win=6291 Len=0 TSval=4163084632 TSecr=92030329  tcp.stream == 5
 21   0.139608 23.32.12.147 -> 172.20.10.4  TCP 66 http > 57473 [FIN, ACK] Seq=1 Ack=1 Win=3888 Len=0 TSval=2528558368 TSecr=92030370  tcp.stream == 6
 22   0.139632  172.20.10.4 -> 23.32.12.147 TCP 66 57473 > http [ACK] Seq=1 Ack=2 Win=137 Len=0 TSval=92030643 TSecr=2528558368  tcp.stream == 6
 23   0.139722 96.6.175.139 -> 172.20.10.4  TCP 66 http > 54852 [FIN, ACK] Seq=1 Ack=1 Win=3888 Len=0 TSval=1422066654 TSecr=92030370  tcp.stream == 7
 24   0.139728  172.20.10.4 -> 96.6.175.139 TCP 66 54852 > http [ACK] Seq=1 Ack=2 Win=501 Len=0 TSval=92030643 TSecr=1422066654  tcp.stream == 7
 25   0.140106 23.32.12.170 -> 172.20.10.4  TCP 66 http > 44833 [FIN, ACK] Seq=1 Ack=1 Win=4156 Len=0 TSval=3486807191 TSecr=92030370  tcp.stream == 8
 26   0.140122  172.20.10.4 -> 23.32.12.170 TCP 66 44833 > http [ACK] Seq=1 Ack=2 Win=137 Len=0 TSval=92030643 TSecr=3486807191  tcp.stream == 8
 27   0.140221  23.32.13.41 -> 172.20.10.4  TCP 66 http > 45212 [FIN, ACK] Seq=1 Ack=1 Win=7907 Len=0 TSval=485755316 TSecr=92030370  tcp.stream == 9
 28   0.140346  172.20.10.4 -> 23.32.13.41  TCP 66 45212 > http [ACK] Seq=1 Ack=2 Win=123 Len=0 TSval=92030643 TSecr=485755316  tcp.stream == 9
 29   0.140349 70.37.129.153 -> 172.20.10.4  TCP 66 http > 47351 [ACK] Seq=1 Ack=2 Win=6291 Len=0 TSval=4163084638 TSecr=92030370  tcp.stream == 5
 30   0.140471 70.37.129.153 -> 172.20.10.4  TCP 66 http > 47351 [FIN, ACK] Seq=1 Ack=2 Win=6291 Len=0 TSval=4163084638 TSecr=92030370  tcp.stream == 5
 31   0.140596  172.20.10.4 -> 70.37.129.153 TCP 66 47351 > http [ACK] Seq=2 Ack=2 Win=115 Len=0 TSval=92030644 TSecr=4163084638  tcp.stream == 5
 32   0.176397  172.20.10.4 -> 23.32.12.160 TCP 66 51368 > http [FIN, ACK] Seq=1 Ack=1 Win=123 Len=0 TSval=92030653 TSecr=488769496  tcp.stream == 10
 33   0.214864 157.166.255.218 -> 172.20.10.4  TCP 66 http > 40241 [FIN, ACK] Seq=1 Ack=1 Win=1448 Len=0 TSval=1265225910 TSecr=92030370  tcp.stream == 11
 34   0.214888  172.20.10.4 -> 157.166.255.218 TCP 66 40241 > http [ACK] Seq=1 Ack=2 Win=115 Len=0 TSval=92030662 TSecr=1265225910  tcp.stream == 11
 35   0.217737 157.166.255.218 -> 172.20.10.4  TCP 66 http > 40213 [FIN, ACK] Seq=1 Ack=1 Win=3075 Len=0 TSval=1614882893 TSecr=92030370  tcp.stream == 12
 36   0.217758  172.20.10.4 -> 157.166.255.218 TCP 66 40213 > http [ACK] Seq=1 Ack=2 Win=212 Len=0 TSval=92030663 TSecr=1614882893  tcp.stream == 12
 37   0.218482 192.221.100.126 -> 172.20.10.4  TCP 66 http > 45476 [FIN, ACK] Seq=1 Ack=1 Win=46 Len=0 TSval=4005427148 TSecr=92030370  tcp.stream == 13
 38   0.218504  172.20.10.4 -> 192.221.100.126 TCP 66 45476 > http [ACK] Seq=1 Ack=2 Win=115 Len=0 TSval=92030663 TSecr=4005427148  tcp.stream == 13
 39   0.218598 192.221.100.126 -> 172.20.10.4  TCP 66 http > 45461 [FIN, ACK] Seq=1 Ack=1 Win=72 Len=0 TSval=3526627899 TSecr=92030370  tcp.stream == 14
 40   0.218604  172.20.10.4 -> 192.221.100.126 TCP 66 45461 > http [ACK] Seq=1 Ack=2 Win=155 Len=0 TSval=92030663 TSecr=3526627899  tcp.stream == 14
 41   0.218722 157.166.255.19 -> 172.20.10.4  TCP 66 http > 41874 [ACK] Seq=1 Ack=1 Win=84 Len=0 TSval=226131145 TSecr=92030353  tcp.stream == 15
 42   0.218849  172.20.10.4 -> 157.166.255.19 TCP 54 41874 > http [RST] Seq=1 Win=0 Len=0  tcp.stream == 15
 43   0.218851 192.221.100.126 -> 172.20.10.4  TCP 66 http > 45463 [FIN, ACK] Seq=1 Ack=1 Win=72 Len=0 TSval=4005413219 TSecr=92030370  tcp.stream == 16
 44   0.219100  172.20.10.4 -> 192.221.100.126 TCP 66 45463 > http [ACK] Seq=1 Ack=2 Win=361 Len=0 TSval=92030663 TSecr=4005413219  tcp.stream == 16
 45   0.258862 192.221.100.126 -> 172.20.10.4  TCP 66 http > 45462 [FIN, ACK] Seq=1 Ack=1 Win=72 Len=0 TSval=3976411435 TSecr=92030370  tcp.stream == 17
 46   0.258885  172.20.10.4 -> 192.221.100.126 TCP 66 45462 > http [ACK] Seq=1 Ack=2 Win=140 Len=0 TSval=92030673 TSecr=3976411435  tcp.stream == 17
 47   0.261859 192.221.100.126 -> 172.20.10.4  TCP 66 http > 45459 [FIN, ACK] Seq=1 Ack=1 Win=82 Len=0 TSval=3976381427 TSecr=92030370  tcp.stream == 18
 48   0.261880  172.20.10.4 -> 192.221.100.126 TCP 66 45459 > http [ACK] Seq=1 Ack=2 Win=501 Len=0 TSval=92030674 TSecr=3976381427  tcp.stream == 18
 49   0.270982  23.32.13.43 -> 172.20.10.4  TCP 66 http > 33185 [FIN, ACK] Seq=1 Ack=1 Win=4006 Len=0 TSval=3551775512 TSecr=92030370  tcp.stream == 19
 50   0.271005  172.20.10.4 -> 23.32.13.43  TCP 66 33185 > http [ACK] Seq=1 Ack=2 Win=159 Len=0 TSval=92030676 TSecr=3551775512  tcp.stream == 19
 51   0.271859 23.32.12.160 -> 172.20.10.4  TCP 66 http > 51368 [FIN, ACK] Seq=1 Ack=2 Win=3931 Len=0 TSval=488779643 TSecr=92030370  tcp.stream == 10
 52   0.271884  172.20.10.4 -> 23.32.12.160 TCP 66 51368 > http [ACK] Seq=2 Ack=2 Win=123 Len=0 TSval=92030676 TSecr=488779643  tcp.stream == 10
 53   0.271973 192.221.100.126 -> 172.20.10.4  TCP 66 http > 45460 [FIN, ACK] Seq=1 Ack=1 Win=81 Len=0 TSval=131239458 TSecr=92030370  tcp.stream == 20
 54   0.271980  172.20.10.4 -> 192.221.100.126 TCP 66 45460 > http [ACK] Seq=1 Ack=2 Win=198 Len=0 TSval=92030676 TSecr=131239458  tcp.stream == 20
 55   0.272225  23.32.13.19 -> 172.20.10.4  TCP 66 http > 41362 [FIN, ACK] Seq=1 Ack=1 Win=3888 Len=0 TSval=2879962419 TSecr=92030370  tcp.stream == 21
 56   0.272234  172.20.10.4 -> 23.32.13.19  TCP 66 41362 > http [ACK] Seq=1 Ack=2 Win=363 Len=0 TSval=92030676 TSecr=2879962419  tcp.stream == 21
 57   0.272475  23.32.13.35 -> 172.20.10.4  TCP 66 http > 37449 [FIN, ACK] Seq=1 Ack=1 Win=3888 Len=0 TSval=2879736527 TSecr=92030370  tcp.stream == 22
 58   0.272484  172.20.10.4 -> 23.32.13.35  TCP 66 37449 > http [ACK] Seq=1 Ack=2 Win=127 Len=0 TSval=92030677 TSecr=2879736527  tcp.stream == 22
 59   0.286109 157.166.226.31 -> 172.20.10.4  TCP 66 http > 41827 [ACK] Seq=1 Ack=1 Win=68 Len=0 TSval=3622650396 TSecr=92030370  tcp.stream == 23
 60   0.292733 157.166.255.19 -> 172.20.10.4  TCP 66 http > 41872 [FIN, ACK] Seq=1 Ack=1 Win=68 Len=0 TSval=215049446 TSecr=92030370  tcp.stream == 24
 61   0.292753  172.20.10.4 -> 157.166.255.19 TCP 66 41872 > http [ACK] Seq=1 Ack=2 Win=124 Len=0 TSval=92030682 TSecr=215049446  tcp.stream == 24
 62   0.295609 157.166.255.19 -> 172.20.10.4  TCP 66 http > 41871 [FIN, ACK] Seq=1 Ack=1 Win=61 Len=0 TSval=215417600 TSecr=92030370  tcp.stream == 25
 63   0.295629  172.20.10.4 -> 157.166.255.19 TCP 66 41871 > http [ACK] Seq=1 Ack=2 Win=182 Len=0 TSval=92030682 TSecr=215417600  tcp.stream == 25
 64   0.296106 157.166.255.218 -> 172.20.10.4  TCP 66 http > 40216 [FIN, ACK] Seq=1 Ack=1 Win=1448 Len=0 TSval=1614769053 TSecr=92030370  tcp.stream == 26
 65   0.296124  172.20.10.4 -> 157.166.255.218 TCP 66 40216 > http [ACK] Seq=1 Ack=2 Win=115 Len=0 TSval=92030682 TSecr=1614769053  tcp.stream == 26
 66   0.296223 157.166.255.19 -> 172.20.10.4  TCP 66 http > 41875 [FIN, ACK] Seq=1 Ack=1 Win=46 Len=0 TSval=215775184 TSecr=92030370  tcp.stream == 27
 67   0.296229  172.20.10.4 -> 157.166.255.19 TCP 66 41875 > http [ACK] Seq=1 Ack=2 Win=115 Len=0 TSval=92030682 TSecr=215775184  tcp.stream == 27
 68   0.304857 138.108.6.20 -> 172.20.10.4  TCP 66 http > 48263 [FIN, ACK] Seq=1 Ack=1 Win=62 Len=0 TSval=2457539804 TSecr=92030370  tcp.stream == 28
 69   0.304874  172.20.10.4 -> 138.108.6.20 TCP 66 48263 > http [ACK] Seq=1 Ack=2 Win=142 Len=0 TSval=92030685 TSecr=2457539804  tcp.stream == 28
 70   0.319109  23.32.13.59 -> 172.20.10.4  TCP 66 http > 36703 [FIN, ACK] Seq=1 Ack=1 Win=3888 Len=0 TSval=3552381535 TSecr=92030370  tcp.stream == 29
 71   0.319134  172.20.10.4 -> 23.32.13.59  TCP 66 36703 > http [ACK] Seq=1 Ack=2 Win=501 Len=0 TSval=92030688 TSecr=3552381535  tcp.stream == 29
 72   0.321986  23.32.13.59 -> 172.20.10.4  TCP 66 http > 36705 [FIN, ACK] Seq=1 Ack=2 Win=3888 Len=0 TSval=3552381535 TSecr=92030370  tcp.stream == 3
 73   0.322010  172.20.10.4 -> 23.32.13.59  TCP 66 36705 > http [ACK] Seq=2 Ack=2 Win=501 Len=0 TSval=92030689 TSecr=3552381535  tcp.stream == 3
 74   0.469116  23.32.13.59 -> 172.20.10.4  TCP 66 http > 36704 [FIN, ACK] Seq=1 Ack=1 Win=4185 Len=0 TSval=3552381679 TSecr=92030370  tcp.stream == 30
 75   0.469141  172.20.10.4 -> 23.32.13.59  TCP 66 36704 > http [ACK] Seq=1 Ack=2 Win=765 Len=0 TSval=92030726 TSecr=3552381679  tcp.stream == 30
 76   0.471483 72.14.204.103 -> 172.20.10.4  TCP 66 https > 56468 [FIN, ACK] Seq=1 Ack=1 Win=256 Len=0 TSval=524344435 TSecr=92030370  tcp.stream == 31
 77   0.471505  172.20.10.4 -> 72.14.204.103 TCP 66 56468 > https [ACK] Seq=1 Ack=2 Win=203 Len=0 TSval=92030726 TSecr=524344435  tcp.stream == 31
 78   0.575615  23.32.13.43 -> 172.20.10.4  TCP 78 [TCP Dup ACK 49#1] http > 33185 [ACK] Seq=2 Ack=1 Win=4006 Len=0 TSval=3551775817 TSecr=92030477 SLE=0 SRE=1  tcp.stream == 19
 79   0.578233  23.32.13.59 -> 172.20.10.4  TCP 78 [TCP Dup ACK 70#1] http > 36703 [ACK] Seq=2 Ack=1 Win=3888 Len=0 TSval=3552381789 TSecr=92030573 SLE=0 SRE=1  tcp.stream == 29
 80   0.634362  23.32.13.59 -> 172.20.10.4  TCP 78 [TCP Dup ACK 72#1] http > 36705 [ACK] Seq=2 Ack=2 Win=3888 Len=0 TSval=3552381850 TSecr=92030624 SLE=1 SRE=2  tcp.stream == 3
 81   0.685485  23.32.13.43 -> 172.20.10.4  TCP 66 http > 33185 [FIN, ACK] Seq=1 Ack=1 Win=4006 Len=0 TSval=3551775921 TSecr=92030477  tcp.stream == 19
 82   0.685502  172.20.10.4 -> 23.32.13.43  TCP 66 [TCP Dup ACK 50#1] 33185 > http [ACK] Seq=1 Ack=2 Win=159 Len=0 TSval=92030780 TSecr=3551775817  tcp.stream == 19
 83   0.970755 23.32.12.160 -> 172.20.10.4  TCP 78 [TCP Dup ACK 51#1] http > 51368 [ACK] Seq=2 Ack=2 Win=3931 Len=0 TSval=488780347 TSecr=92030653 SLE=1 SRE=2  tcp.stream == 10
 84   1.172243  23.32.13.43 -> 172.20.10.4  TCP 54 http > 33185 [RST] Seq=2 Win=0 Len=0  tcp.stream == 19
 85   1.404395  172.20.10.4 -> 157.166.255.218 TCP 66 40049 > http [FIN, ACK] Seq=1 Ack=1 Win=123 Len=0 TSval=92030960 TSecr=1614864718  tcp.stream == 32
 86   1.537362 157.166.255.218 -> 172.20.10.4  TCP 54 http > 40049 [RST] Seq=1 Win=0 Len=0  tcp.stream == 32
 87   1.852393  172.20.10.4 -> 157.166.255.218 TCP 66 40047 > http [FIN, ACK] Seq=1 Ack=1 Win=204 Len=0 TSval=92031072 TSecr=1614529890  tcp.stream == 33
 88   2.005977 157.166.255.218 -> 172.20.10.4  TCP 54 http > 40047 [RST] Seq=1 Win=0 Len=0  tcp.stream == 33
 89   5.244399  172.20.10.4 -> 204.160.126.126 HTTP 491 GET /cnn/dam/assets/120221011828-dereck-chisora-slaps-vitali-klitschko-video-tease.jpg HTTP/1.1   tcp.stream == 34
 90   6.332396  172.20.10.4 -> 192.221.100.126 HTTP 462 GET /cnn/.e/img/3.0/global/footer/pngs/footer_cnn_logo.png HTTP/1.1   tcp.stream == 35
 93   6.588399  172.20.10.4 -> 204.160.126.126 HTTP 469 GET /cnn/dam/assets/120221042243-bacon-explosion-video-tease.jpg HTTP/1.1   tcp.stream == 36
 94   6.822815  172.20.10.4 -> 157.166.255.19 TCP 74 41891 > http [SYN] Seq=0 Win=14600 Len=0 MSS=1460 SACK_PERM=1 TSval=92032314 TSecr=0 WS=128  tcp.stream == 37
 95   6.927571 157.166.255.19 -> 172.20.10.4  TCP 74 http > 41891 [SYN, ACK] Seq=0 Ack=1 Win=5792 Len=0 MSS=1410 SACK_PERM=1 TSval=215419155 TSecr=92032314 WS=128  tcp.stream == 37
 96   6.927599  172.20.10.4 -> 157.166.255.19 TCP 66 41891 > http [ACK] Seq=1 Ack=1 Win=14720 Len=0 TSval=92032340 TSecr=215419155  tcp.stream == 37
 97   6.927674  172.20.10.4 -> 157.166.255.19 HTTP 355 GET / HTTP/1.1   tcp.stream == 37
 98   7.417691 157.166.255.19 -> 172.20.10.4  TCP 66 http > 41891 [ACK] Seq=1 Ack=290 Win=6912 Len=0 TSval=215419168 TSecr=92032340  tcp.stream == 37
 99   7.419966 157.166.255.19 -> 172.20.10.4  HTTP 511 HTTP/1.1 301 Moved Permanently  (text/html)  tcp.stream == 37
100   7.419987  172.20.10.4 -> 157.166.255.19 TCP 66 41891 > http [ACK] Seq=290 Ack=446 Win=15744 Len=0 TSval=92032463 TSecr=215419168  tcp.stream == 37
101   7.423690 157.166.255.19 -> 172.20.10.4  HTTP 511 [TCP Retransmission] HTTP/1.1 301 Moved Permanently  (text/html)  tcp.stream == 37
102   7.423711  172.20.10.4 -> 157.166.255.19 TCP 78 [TCP Dup ACK 100#1] 41891 > http [ACK] Seq=290 Ack=446 Win=15744 Len=0 TSval=92032464 TSecr=215419204 SLE=1 SRE=446  tcp.stream == 37
105   7.679287  172.20.10.4 -> 157.166.255.18 TCP 74 36299 > http [SYN] Seq=0 Win=14600 Len=0 MSS=1460 SACK_PERM=1 TSval=92032528 TSecr=0 WS=128  tcp.stream == 38
106   7.809719 157.166.255.18 -> 172.20.10.4  TCP 74 http > 36299 [SYN, ACK] Seq=0 Ack=1 Win=5792 Len=0 MSS=1410 SACK_PERM=1 TSval=216433477 TSecr=92032528 WS=128  tcp.stream == 38
107   7.809754  172.20.10.4 -> 157.166.255.18 TCP 66 36299 > http [ACK] Seq=1 Ack=1 Win=14720 Len=0 TSval=92032561 TSecr=216433477  tcp.stream == 38
108   7.809923  172.20.10.4 -> 157.166.255.18 HTTP 359 GET / HTTP/1.1   tcp.stream == 38
109   7.997192 157.166.255.18 -> 172.20.10.4  TCP 66 http > 36299 [ACK] Seq=1 Ack=294 Win=6912 Len=0 TSval=216433495 TSecr=92032561  tcp.stream == 38
110   8.017433 157.166.255.18 -> 172.20.10.4  TCP 1464 [TCP segment of a reassembled PDU]  tcp.stream == 38
111   8.017449  172.20.10.4 -> 157.166.255.18 TCP 66 36299 > http [ACK] Seq=294 Ack=1399 Win=17536 Len=0 TSval=92032613 TSecr=216433495  tcp.stream == 38
112   8.098957 157.166.255.18 -> 172.20.10.4  TCP 1464 [TCP segment of a reassembled PDU]  tcp.stream == 38
113   8.098977  172.20.10.4 -> 157.166.255.18 TCP 66 36299 > http [ACK] Seq=294 Ack=2797 Win=20480 Len=0 TSval=92032633 TSecr=216433495  tcp.stream == 38
116   8.107968  172.20.10.4 -> 157.166.255.18 TCP 74 36300 > http [SYN] Seq=0 Win=14600 Len=0 MSS=1460 SACK_PERM=1 TSval=92032635 TSecr=0 WS=128  tcp.stream == 39
117   8.116192 157.166.255.18 -> 172.20.10.4  TCP 1464 [TCP segment of a reassembled PDU]  tcp.stream == 38
118   8.116219  172.20.10.4 -> 157.166.255.18 TCP 66 36299 > http [ACK] Seq=294 Ack=4195 Win=23296 Len=0 TSval=92032637 TSecr=216433495  tcp.stream == 38
119   8.184435 157.166.255.18 -> 172.20.10.4  TCP 1464 [TCP segment of a reassembled PDU]  tcp.stream == 38
120   8.184455  172.20.10.4 -> 157.166.255.18 TCP 66 36299 > http [ACK] Seq=294 Ack=5593 Win=26240 Len=0 TSval=92032655 TSecr=216433510  tcp.stream == 38
122   8.210937 157.166.255.18 -> 172.20.10.4  TCP 1464 [TCP segment of a reassembled PDU]  tcp.stream == 38
123   8.210962  172.20.10.4 -> 157.166.255.18 TCP 66 36299 > http [ACK] Seq=294 Ack=6991 Win=29184 Len=0 TSval=92032661 TSecr=216433510  tcp.stream == 38
128   8.254933 157.166.255.18 -> 172.20.10.4  TCP 1464 [TCP segment of a reassembled PDU]  tcp.stream == 38
129   8.254951  172.20.10.4 -> 157.166.255.18 TCP 66 36299 > http [ACK] Seq=294 Ack=8389 Win=32000 Len=0 TSval=92032672 TSecr=216433519  tcp.stream == 38
130   8.281687 157.166.255.18 -> 172.20.10.4  TCP 1464 [TCP segment of a reassembled PDU]  tcp.stream == 38
131   8.281707  172.20.10.4 -> 157.166.255.18 TCP 66 36299 > http [ACK] Seq=294 Ack=9787 Win=34944 Len=0 TSval=92032679 TSecr=216433519  tcp.stream == 38
132   8.301055 157.166.255.18 -> 172.20.10.4  TCP 1464 [TCP segment of a reassembled PDU]  tcp.stream == 38
133   8.301071  172.20.10.4 -> 157.166.255.18 TCP 66 36299 > http [ACK] Seq=294 Ack=11185 Win=37888 Len=0 TSval=92032684 TSecr=216433520  tcp.stream == 38
134   8.303429 157.166.255.18 -> 172.20.10.4  TCP 74 http > 36300 [SYN, ACK] Seq=0 Ack=1 Win=5792 Len=0 MSS=1410 SACK_PERM=1 TSval=216433262 TSecr=92032635 WS=128  tcp.stream == 39
135   8.303453  172.20.10.4 -> 157.166.255.18 TCP 66 36300 > http [ACK] Seq=1 Ack=1 Win=14720 Len=0 TSval=92032684 TSecr=216433262  tcp.stream == 39
136   8.303550  172.20.10.4 -> 157.166.255.18 HTTP 371 GET /favicon.ie9.ico HTTP/1.1   tcp.stream == 39
139   8.330937 157.166.255.18 -> 172.20.10.4  TCP 1464 [TCP segment of a reassembled PDU]  tcp.stream == 38
140   8.330959  172.20.10.4 -> 157.166.255.18 TCP 66 36299 > http [ACK] Seq=294 Ack=12583 Win=40704 Len=0 TSval=92032691 TSecr=216433527  tcp.stream == 38
141   8.341336 157.166.255.18 -> 172.20.10.4  TCP 1464 [TCP segment of a reassembled PDU]  tcp.stream == 38
142   8.341357  172.20.10.4 -> 157.166.255.18 TCP 66 36299 > http [ACK] Seq=294 Ack=13981 Win=43648 Len=0 TSval=92032694 TSecr=216433527  tcp.stream == 38
143   8.361179 157.166.255.18 -> 172.20.10.4  TCP 1464 [TCP segment of a reassembled PDU]  tcp.stream == 38
144   8.361199  172.20.10.4 -> 157.166.255.18 TCP 66 36299 > http [ACK] Seq=294 Ack=15379 Win=46464 Len=0 TSval=92032699 TSecr=216433527  tcp.stream == 38
146   8.370664  172.20.10.4 -> 192.221.98.126 TCP 74 59058 > http [SYN] Seq=0 Win=14600 Len=0 MSS=1460 SACK_PERM=1 TSval=92032701 TSecr=0 WS=128  tcp.stream == 40
147   8.370796  172.20.10.4 -> 192.221.98.126 TCP 74 59059 > http [SYN] Seq=0 Win=14600 Len=0 MSS=1460 SACK_PERM=1 TSval=92032701 TSecr=0 WS=128  tcp.stream == 41
148   8.371044  172.20.10.4 -> 192.221.98.126 TCP 74 59060 > http [SYN] Seq=0 Win=14600 Len=0 MSS=1460 SACK_PERM=1 TSval=92032701 TSecr=0 WS=128  tcp.stream == 42
149   8.371930  172.20.10.4 -> 192.221.98.126 TCP 74 59061 > http [SYN] Seq=0 Win=14600 Len=0 MSS=1460 SACK_PERM=1 TSval=92032701 TSecr=0 WS=128  tcp.stream == 43
150   8.373052  172.20.10.4 -> 192.221.98.126 TCP 74 59062 > http [SYN] Seq=0 Win=14600 Len=0 MSS=1460 SACK_PERM=1 TSval=92032701 TSecr=0 WS=128  tcp.stream == 44
151   8.373944  172.20.10.4 -> 192.221.98.126 TCP 74 59063 > http [SYN] Seq=0 Win=14600 Len=0 MSS=1460 SACK_PERM=1 TSval=92032701 TSecr=0 WS=128  tcp.stream == 45
153   8.416437  172.20.10.4 -> 23.32.12.240 TCP 74 40374 > http [SYN] Seq=0 Win=14600 Len=0 MSS=1460 SACK_PERM=1 TSval=92032713 TSecr=0 WS=128  tcp.stream == 46
154   8.416572  172.20.10.4 -> 23.32.12.240 TCP 74 40375 > http [SYN] Seq=0 Win=14600 Len=0 MSS=1460 SACK_PERM=1 TSval=92032713 TSecr=0 WS=128  tcp.stream == 47
155   8.429305 157.166.255.18 -> 172.20.10.4  TCP 1464 [TCP segment of a reassembled PDU]  tcp.stream == 38
156   8.429325  172.20.10.4 -> 157.166.255.18 TCP 66 36299 > http [ACK] Seq=294 Ack=16777 Win=49408 Len=0 TSval=92032716 TSecr=216433536  tcp.stream == 38
157   8.442208 157.166.255.18 -> 172.20.10.4  TCP 1464 [TCP segment of a reassembled PDU]  tcp.stream == 38
158   8.442230  172.20.10.4 -> 157.166.255.18 TCP 66 36299 > http [ACK] Seq=294 Ack=18175 Win=52352 Len=0 TSval=92032719 TSecr=216433536  tcp.stream == 38
159   8.462434 157.166.255.18 -> 172.20.10.4  TCP 1464 [TCP segment of a reassembled PDU]  tcp.stream == 38
160   8.462460  172.20.10.4 -> 157.166.255.18 TCP 66 36299 > http [ACK] Seq=294 Ack=19573 Win=55168 Len=0 TSval=92032724 TSecr=216433536  tcp.stream == 38
161   8.469579 157.166.255.18 -> 172.20.10.4  TCP 1464 [TCP segment of a reassembled PDU]  tcp.stream == 38
162   8.469598  172.20.10.4 -> 157.166.255.18 TCP 66 36299 > http [ACK] Seq=294 Ack=20971 Win=58112 Len=0 TSval=92032726 TSecr=216433536  tcp.stream == 38
163   8.482440 157.166.255.18 -> 172.20.10.4  TCP 1464 [TCP segment of a reassembled PDU]  tcp.stream == 38
164   8.482465  172.20.10.4 -> 157.166.255.18 TCP 66 36299 > http [ACK] Seq=294 Ack=22369 Win=61056 Len=0 TSval=92032729 TSecr=216433539  tcp.stream == 38
165   8.489681 157.166.255.18 -> 172.20.10.4  TCP 1464 [TCP segment of a reassembled PDU]  tcp.stream == 38
166   8.489698  172.20.10.4 -> 157.166.255.18 TCP 66 36299 > http [ACK] Seq=294 Ack=23767 Win=63872 Len=0 TSval=92032731 TSecr=216433539  tcp.stream == 38
167   8.497180 157.166.255.18 -> 172.20.10.4  TCP 1464 [TCP segment of a reassembled PDU]  tcp.stream == 38
168   8.497201  172.20.10.4 -> 157.166.255.18 TCP 66 36299 > http [ACK] Seq=294 Ack=25165 Win=64128 Len=0 TSval=92032733 TSecr=216433539  tcp.stream == 38
172   8.505178 157.166.255.18 -> 172.20.10.4  HTTP 213 HTTP/1.1 200 OK  (text/html)  tcp.stream == 38
173   8.505189  172.20.10.4 -> 157.166.255.18 TCP 66 36299 > http [ACK] Seq=294 Ack=25312 Win=64128 Len=0 TSval=92032735 TSecr=216433539  tcp.stream == 38
175   8.506314 157.166.255.18 -> 172.20.10.4  TCP 66 http > 36300 [ACK] Seq=1 Ack=306 Win=6912 Len=0 TSval=216433287 TSecr=92032684  tcp.stream == 39
176   8.507169  172.20.10.4 -> 23.32.12.240 TCP 74 40376 > http [SYN] Seq=0 Win=14600 Len=0 MSS=1460 SACK_PERM=1 TSval=92032735 TSecr=0 WS=128  tcp.stream == 48
177   8.513430 157.166.255.18 -> 172.20.10.4  TCP 1464 [TCP segment of a reassembled PDU]  tcp.stream == 39
178   8.513451  172.20.10.4 -> 157.166.255.18 TCP 66 36300 > http [ACK] Seq=306 Ack=1399 Win=17536 Len=0 TSval=92032737 TSecr=216433287  tcp.stream == 39
179   8.517054 157.166.255.18 -> 172.20.10.4  TCP 1464 [TCP segment of a reassembled PDU]  tcp.stream == 39
180   8.517074  172.20.10.4 -> 157.166.255.18 TCP 66 36300 > http [ACK] Seq=306 Ack=2797 Win=20480 Len=0 TSval=92032738 TSecr=216433287  tcp.stream == 39
181   8.545456 157.166.255.18 -> 172.20.10.4  TCP 1464 [TCP segment of a reassembled PDU]  tcp.stream == 39
182   8.545477  172.20.10.4 -> 157.166.255.18 TCP 66 36300 > http [ACK] Seq=306 Ack=4195 Win=23296 Len=0 TSval=92032745 TSecr=216433287  tcp.stream == 39
184   8.548420  172.20.10.4 -> 4.26.252.126 TCP 74 42466 > http [SYN] Seq=0 Win=14600 Len=0 MSS=1460 SACK_PERM=1 TSval=92032746 TSecr=0 WS=128  tcp.stream == 49
185   8.548546  172.20.10.4 -> 4.26.252.126 TCP 74 42467 > http [SYN] Seq=0 Win=14600 Len=0 MSS=1460 SACK_PERM=1 TSval=92032746 TSecr=0 WS=128  tcp.stream == 50
186   8.548923  172.20.10.4 -> 4.26.252.126 TCP 74 42468 > http [SYN] Seq=0 Win=14600 Len=0 MSS=1460 SACK_PERM=1 TSval=92032746 TSecr=0 WS=128  tcp.stream == 51
187   8.549678  172.20.10.4 -> 4.26.252.126 TCP 74 42469 > http [SYN] Seq=0 Win=14600 Len=0 MSS=1460 SACK_PERM=1 TSval=92032746 TSecr=0 WS=128  tcp.stream == 52
188   8.550680  172.20.10.4 -> 4.26.252.126 TCP 74 42470 > http [SYN] Seq=0 Win=14600 Len=0 MSS=1460 SACK_PERM=1 TSval=92032746 TSecr=0 WS=128  tcp.stream == 53
189   8.551805  172.20.10.4 -> 4.26.252.126 TCP 74 42471 > http [SYN] Seq=0 Win=14600 Len=0 MSS=1460 SACK_PERM=1 TSval=92032746 TSecr=0 WS=128  tcp.stream == 54
190   8.577058 192.221.98.126 -> 172.20.10.4  TCP 74 http > 59058 [SYN, ACK] Seq=0 Ack=1 Win=5792 Len=0 MSS=1410 SACK_PERM=1 TSval=245970553 TSecr=92032701 WS=128  tcp.stream == 40
191   8.577092  172.20.10.4 -> 192.221.98.126 TCP 66 59058 > http [ACK] Seq=1 Ack=1 Win=14720 Len=0 TSval=92032753 TSecr=245970553  tcp.stream == 40
192   8.577210  172.20.10.4 -> 192.221.98.126 HTTP 405 GET /cnn/.e/img/3.0/global/header/hdr-main.gif HTTP/1.1   tcp.stream == 40
193   8.590832 192.221.98.126 -> 172.20.10.4  TCP 74 http > 59059 [SYN, ACK] Seq=0 Ack=1 Win=5792 Len=0 MSS=1410 SACK_PERM=1 TSval=1711415616 TSecr=92032701 WS=128  tcp.stream == 41
194   8.590858  172.20.10.4 -> 192.221.98.126 TCP 66 59059 > http [ACK] Seq=1 Ack=1 Win=14720 Len=0 TSval=92032756 TSecr=1711415616  tcp.stream == 41
195   8.591071  172.20.10.4 -> 192.221.98.126 HTTP 406 GET /cnn/.e/img/3.0/global/header/nav-arrow.gif HTTP/1.1   tcp.stream == 41
196   8.612176 192.221.98.126 -> 172.20.10.4  TCP 74 http > 59061 [SYN, ACK] Seq=0 Ack=1 Win=5792 Len=0 MSS=1410 SACK_PERM=1 TSval=2194550094 TSecr=92032701 WS=128  tcp.stream == 43
197   8.612197  172.20.10.4 -> 192.221.98.126 TCP 66 59061 > http [ACK] Seq=1 Ack=1 Win=14720 Len=0 TSval=92032761 TSecr=2194550094  tcp.stream == 43
198   8.612292  172.20.10.4 -> 192.221.98.126 HTTP 386 GET /cnn/.e/img/3.0/1px.gif HTTP/1.1   tcp.stream == 43
199   8.614560 192.221.98.126 -> 172.20.10.4  TCP 74 http > 59060 [SYN, ACK] Seq=0 Ack=1 Win=5792 Len=0 MSS=1410 SACK_PERM=1 TSval=113645202 TSecr=92032701 WS=128  tcp.stream == 42
200   8.614591  172.20.10.4 -> 192.221.98.126 TCP 66 59060 > http [ACK] Seq=1 Ack=1 Win=14720 Len=0 TSval=92032762 TSecr=113645202  tcp.stream == 42
201   8.614713  172.20.10.4 -> 192.221.98.126 HTTP 406 GET /cnn/.e/img/3.0/global/icons/video_icon.gif HTTP/1.1   tcp.stream == 42
202   8.623555 192.221.98.126 -> 172.20.10.4  TCP 74 http > 59063 [SYN, ACK] Seq=0 Ack=1 Win=5792 Len=0 MSS=1410 SACK_PERM=1 TSval=916143988 TSecr=92032701 WS=128  tcp.stream == 45
203   8.623578  172.20.10.4 -> 192.221.98.126 TCP 66 59063 > http [ACK] Seq=1 Ack=1 Win=14720 Len=0 TSval=92032764 TSecr=916143988  tcp.stream == 45
204   8.623667  172.20.10.4 -> 192.221.98.126 HTTP 419 GET /cnn/.e/img/3.0/personalization/35x35_generic_avatar.gif HTTP/1.1   tcp.stream == 45
205   8.623791 192.221.98.126 -> 172.20.10.4  TCP 74 http > 59062 [SYN, ACK] Seq=0 Ack=1 Win=5792 Len=0 MSS=1410 SACK_PERM=1 TSval=3416883970 TSecr=92032701 WS=128  tcp.stream == 44
206   8.623915  172.20.10.4 -> 192.221.98.126 TCP 66 59062 > http [ACK] Seq=1 Ack=1 Win=14720 Len=0 TSval=92032764 TSecr=3416883970  tcp.stream == 44
207   8.624168  172.20.10.4 -> 192.221.98.126 HTTP 408 GET /cnn/.e/img/3.0/global/misc/advertisement.gif HTTP/1.1   tcp.stream == 44
208   8.653700 23.32.12.240 -> 172.20.10.4  TCP 74 http > 40374 [SYN, ACK] Seq=0 Ack=1 Win=14480 Len=0 MSS=1410 SACK_PERM=1 TSval=2791688002 TSecr=92032713 WS=4  tcp.stream == 46
209   8.653728  172.20.10.4 -> 23.32.12.240 TCP 66 40374 > http [ACK] Seq=1 Ack=1 Win=14720 Len=0 TSval=92032772 TSecr=2791688002  tcp.stream == 46
210   8.653937  172.20.10.4 -> 23.32.12.240 HTTP 406 GET /cnn/tmpl_asset/static/www_homepage/1080/css/hplib-min.css HTTP/1.1   tcp.stream == 46
212   8.705457 23.32.12.240 -> 172.20.10.4  TCP 74 http > 40375 [SYN, ACK] Seq=0 Ack=1 Win=14480 Len=0 MSS=1410 SACK_PERM=1 TSval=2791688062 TSecr=92032713 WS=4  tcp.stream == 47
213   8.705480  172.20.10.4 -> 23.32.12.240 TCP 66 40375 > http [ACK] Seq=1 Ack=1 Win=14720 Len=0 TSval=92032785 TSecr=2791688062  tcp.stream == 47
214   8.705699  172.20.10.4 -> 23.32.12.240 HTTP 389 GET /cnn/tmpl_asset/static/www_homepage/1080/js/hplib-min.js HTTP/1.1   tcp.stream == 47
216   8.783628  172.20.10.4 -> 209.244.156.19 TCP 74 56364 > http [SYN] Seq=0 Win=14600 Len=0 MSS=1460 SACK_PERM=1 TSval=92032804 TSecr=0 WS=128  tcp.stream == 55
221   8.813708 23.32.12.240 -> 172.20.10.4  TCP 74 http > 40376 [SYN, ACK] Seq=0 Ack=1 Win=14480 Len=0 MSS=1410 SACK_PERM=1 TSval=2791688148 TSecr=92032735 WS=4  tcp.stream == 48
222   8.813736  172.20.10.4 -> 23.32.12.240 TCP 66 40376 > http [ACK] Seq=1 Ack=1 Win=14720 Len=0 TSval=92032812 TSecr=2791688148  tcp.stream == 48
223   8.813949  172.20.10.4 -> 23.32.12.240 HTTP 390 GET /cnn/tmpl_asset/static/www_global/604/js/globallib-min.js HTTP/1.1   tcp.stream == 48
225   8.816256  172.20.10.4 -> 74.217.240.83 TCP 74 44973 > http [SYN] Seq=0 Win=14600 Len=0 MSS=1460 SACK_PERM=1 TSval=92032812 TSecr=0 WS=128  tcp.stream == 56
226   8.816291 4.26.252.126 -> 172.20.10.4  TCP 74 http > 42466 [SYN, ACK] Seq=0 Ack=1 Win=5792 Len=0 MSS=1410 SACK_PERM=1 TSval=3565090505 TSecr=92032746 WS=128  tcp.stream == 49
227   8.816414  172.20.10.4 -> 4.26.252.126 TCP 66 42466 > http [ACK] Seq=1 Ack=1 Win=14720 Len=0 TSval=92032812 TSecr=3565090505  tcp.stream == 49
228   8.816702  172.20.10.4 -> 4.26.252.126 HTTP 416 GET /cnn/dam/assets/120221121420-greece-flag-t1-main.jpg HTTP/1.1   tcp.stream == 49
229   8.837706 157.166.255.18 -> 172.20.10.4  TCP 1464 [TCP segment of a reassembled PDU]  tcp.stream == 39
230   8.837727  172.20.10.4 -> 157.166.255.18 TCP 66 36300 > http [ACK] Seq=306 Ack=5593 Win=26240 Len=0 TSval=92032818 TSecr=216433320  tcp.stream == 39
231   8.846831 157.166.255.18 -> 172.20.10.4  HTTP 188 HTTP/1.1 200 OK  (image/x-icon)  tcp.stream == 39
232   8.846851  172.20.10.4 -> 157.166.255.18 TCP 66 36300 > http [ACK] Seq=306 Ack=5715 Win=26240 Len=0 TSval=92032820 TSecr=216433320  tcp.stream == 39
233   8.847801 4.26.252.126 -> 172.20.10.4  TCP 74 http > 42469 [SYN, ACK] Seq=0 Ack=1 Win=5792 Len=0 MSS=1410 SACK_PERM=1 TSval=537508518 TSecr=92032746 WS=128  tcp.stream == 52
234   8.847826  172.20.10.4 -> 4.26.252.126 TCP 66 42469 > http [ACK] Seq=1 Ack=1 Win=14720 Len=0 TSval=92032820 TSecr=537508518  tcp.stream == 52
235   8.847916 4.26.252.126 -> 172.20.10.4  TCP 74 http > 42468 [SYN, ACK] Seq=0 Ack=1 Win=5792 Len=0 MSS=1410 SACK_PERM=1 TSval=3565090531 TSecr=92032746 WS=128  tcp.stream == 51
236   8.847924  172.20.10.4 -> 4.26.252.126 TCP 66 42468 > http [ACK] Seq=1 Ack=1 Win=14720 Len=0 TSval=92032820 TSecr=3565090531  tcp.stream == 51
237   8.848303 4.26.252.126 -> 172.20.10.4  TCP 74 http > 42467 [SYN, ACK] Seq=0 Ack=1 Win=5792 Len=0 MSS=1410 SACK_PERM=1 TSval=490363370 TSecr=92032746 WS=128  tcp.stream == 50
238   8.848321  172.20.10.4 -> 4.26.252.126 TCP 66 42467 > http [ACK] Seq=1 Ack=1 Win=14720 Len=0 TSval=92032820 TSecr=490363370  tcp.stream == 50
239   8.848479  172.20.10.4 -> 4.26.252.126 HTTP 449 GET /cnn/dam/assets/120221013513-pkg-damon-syria-humanitarian-crisis-00001103-c1-main.jpg HTTP/1.1   tcp.stream == 50
240   8.848542 4.26.252.126 -> 172.20.10.4  TCP 74 http > 42470 [SYN, ACK] Seq=0 Ack=1 Win=5792 Len=0 MSS=1410 SACK_PERM=1 TSval=537508526 TSecr=92032746 WS=128  tcp.stream == 53
241   8.848668  172.20.10.4 -> 4.26.252.126 HTTP 428 GET /cnn/dam/assets/111116021415-john-king-live-chat-video-tease.jpg HTTP/1.1   tcp.stream == 51
242   8.848672 4.26.252.126 -> 172.20.10.4  TCP 74 http > 42471 [SYN, ACK] Seq=0 Ack=1 Win=5792 Len=0 MSS=1410 SACK_PERM=1 TSval=1165408753 TSecr=92032746 WS=128  tcp.stream == 54
243   8.848918  172.20.10.4 -> 4.26.252.126 HTTP 446 GET /cnn/dam/assets/110920071517-multiple-smartphones-white-background-video-tease.jpg HTTP/1.1   tcp.stream == 52
244   8.849799  172.20.10.4 -> 4.26.252.126 TCP 66 42470 > http [ACK] Seq=1 Ack=1 Win=14720 Len=0 TSval=92032821 TSecr=537508526  tcp.stream == 53
245   8.850316  172.20.10.4 -> 4.26.252.126 HTTP 440 GET /cnn/dam/assets/120220114143-pkg-mn-police-standoff-00005210-video-tease.jpg HTTP/1.1   tcp.stream == 53
246   8.850665  172.20.10.4 -> 4.26.252.126 TCP 66 42471 > http [ACK] Seq=1 Ack=1 Win=14720 Len=0 TSval=92032821 TSecr=1165408753  tcp.stream == 54
247   8.851041  172.20.10.4 -> 4.26.252.126 HTTP 443 GET /cnn/dam/assets/120220054213-chrissie-wellington-roth-triathlon-video-tease.jpg HTTP/1.1   tcp.stream == 54
248   8.890456 192.221.98.126 -> 172.20.10.4  TCP 66 http > 59058 [ACK] Seq=1 Ack=340 Win=6912 Len=0 TSval=245970913 TSecr=92032753  tcp.stream == 40
249   8.904703 192.221.98.126 -> 172.20.10.4  TCP 1464 [TCP segment of a reassembled PDU]  tcp.stream == 40
250   8.904721  172.20.10.4 -> 192.221.98.126 TCP 66 59058 > http [ACK] Seq=340 Ack=1399 Win=17536 Len=0 TSval=92032835 TSecr=245970913  tcp.stream == 40
251   8.911552 192.221.98.126 -> 172.20.10.4  TCP 1464 [TCP segment of a reassembled PDU]  tcp.stream == 40
252   8.911571  172.20.10.4 -> 192.221.98.126 TCP 66 59058 > http [ACK] Seq=340 Ack=2797 Win=20480 Len=0 TSval=92032836 TSecr=245970913  tcp.stream == 40
253   8.989074 192.221.98.126 -> 172.20.10.4  TCP 66 http > 59059 [ACK] Seq=1 Ack=341 Win=6912 Len=0 TSval=1711416003 TSecr=92032756  tcp.stream == 41
254   9.010957 192.221.98.126 -> 172.20.10.4  HTTP 418 HTTP/1.1 200 OK  (GIF89a)  tcp.stream == 41
255   9.010978  172.20.10.4 -> 192.221.98.126 TCP 66 59059 > http [ACK] Seq=341 Ack=353 Win=15744 Len=0 TSval=92032861 TSecr=1711416003  tcp.stream == 41
256   9.011167  172.20.10.4 -> 192.221.98.126 HTTP 407 GET /cnn/.e/img/3.0/personalization/close_bt.gif HTTP/1.1   tcp.stream == 41
257   9.023801 192.221.98.126 -> 172.20.10.4  TCP 66 http > 59061 [ACK] Seq=1 Ack=321 Win=6912 Len=0 TSval=2194550506 TSecr=92032761  tcp.stream == 43
258   9.026923 192.221.98.126 -> 172.20.10.4  HTTP 368 HTTP/1.1 200 OK  (GIF89a)  tcp.stream == 43
259   9.026943  172.20.10.4 -> 192.221.98.126 TCP 66 59061 > http [ACK] Seq=321 Ack=303 Win=15744 Len=0 TSval=92032865 TSecr=2194550506  tcp.stream == 43
260   9.027117  172.20.10.4 -> 192.221.98.126 HTTP 412 GET /cnn/.element/img/3.0/global/icons/video_icon.gif HTTP/1.1   tcp.stream == 43
263   9.091080 192.221.98.126 -> 172.20.10.4  TCP 66 http > 59060 [ACK] Seq=1 Ack=341 Win=6912 Len=0 TSval=113645664 TSecr=92032762  tcp.stream == 42
264   9.093329 192.221.98.126 -> 172.20.10.4  HTTP 464 HTTP/1.1 200 OK  (GIF89a)  tcp.stream == 42
265   9.093350  172.20.10.4 -> 192.221.98.126 TCP 66 59060 > http [ACK] Seq=341 Ack=399 Win=15744 Len=0 TSval=92032882 TSecr=113645664  tcp.stream == 42
266   9.093541  172.20.10.4 -> 192.221.98.126 HTTP 415 GET /cnn/.e/img/3.0/global/footer/pngs/footer_google.png HTTP/1.1   tcp.stream == 42
267   9.159707 192.221.98.126 -> 172.20.10.4  TCP 66 http > 59063 [ACK] Seq=1 Ack=354 Win=6912 Len=0 TSval=916144520 TSecr=92032764  tcp.stream == 45
268   9.162424 192.221.98.126 -> 172.20.10.4  HTTP 555 HTTP/1.1 200 OK  (GIF89a)  tcp.stream == 45
269   9.162445  172.20.10.4 -> 192.221.98.126 TCP 66 59063 > http [ACK] Seq=354 Ack=490 Win=15744 Len=0 TSval=92032899 TSecr=916144521  tcp.stream == 45
270   9.162560  172.20.10.4 -> 192.221.98.126 HTTP 417 GET /cnn/.e/img/3.0/global/footer/pngs/footer_cnn_logo.png HTTP/1.1   tcp.stream == 45
271   9.271459 192.221.98.126 -> 172.20.10.4  TCP 66 http > 59062 [ACK] Seq=1 Ack=343 Win=6912 Len=0 TSval=3416884621 TSecr=92032764  tcp.stream == 44
272   9.274076 192.221.98.126 -> 172.20.10.4  HTTP 419 HTTP/1.1 200 OK  (GIF89a)  tcp.stream == 44
273   9.274097  172.20.10.4 -> 192.221.98.126 TCP 66 59062 > http [ACK] Seq=343 Ack=354 Win=15744 Len=0 TSval=92032927 TSecr=3416884621  tcp.stream == 44
274   9.274290  172.20.10.4 -> 192.221.98.126 HTTP 417 GET /cnn/.e/img/3.0/global/misc/logo_ad_choices_footer.png HTTP/1.1   tcp.stream == 44
275   9.430804 23.32.12.240 -> 172.20.10.4  TCP 66 http > 40374 [ACK] Seq=1 Ack=341 Win=15552 Len=0 TSval=2791688783 TSecr=92032772  tcp.stream == 46
276   9.437594 23.32.12.240 -> 172.20.10.4  TCP 1464 [TCP segment of a reassembled PDU]  tcp.stream == 46
277   9.437631  172.20.10.4 -> 23.32.12.240 TCP 66 40374 > http [ACK] Seq=341 Ack=1399 Win=17536 Len=0 TSval=92032968 TSecr=2791688784  tcp.stream == 46
278   9.477828 23.32.12.240 -> 172.20.10.4  TCP 1464 [TCP segment of a reassembled PDU]  tcp.stream == 46
279   9.477850  172.20.10.4 -> 23.32.12.240 TCP 66 40374 > http [ACK] Seq=341 Ack=2797 Win=20480 Len=0 TSval=92032978 TSecr=2791688784  tcp.stream == 46
280   9.490951 23.32.12.240 -> 172.20.10.4  TCP 1464 [TCP segment of a reassembled PDU]  tcp.stream == 46
281   9.490971  172.20.10.4 -> 23.32.12.240 TCP 66 40374 > http [ACK] Seq=341 Ack=4195 Win=23296 Len=0 TSval=92032981 TSecr=2791688784  tcp.stream == 46
282   9.517578 23.32.12.240 -> 172.20.10.4  TCP 1464 [TCP segment of a reassembled PDU]  tcp.stream == 46
283   9.517598  172.20.10.4 -> 23.32.12.240 TCP 66 40374 > http [ACK] Seq=341 Ack=5593 Win=26240 Len=0 TSval=92032988 TSecr=2791688784  tcp.stream == 46
284   9.530970 157.166.255.18 -> 172.20.10.4  TCP 1464 [TCP Retransmission] [TCP segment of a reassembled PDU]  tcp.stream == 39
285   9.531011  172.20.10.4 -> 157.166.255.18 TCP 78 [TCP Dup ACK 232#1] 36300 > http [ACK] Seq=306 Ack=5715 Win=26240 Len=0 TSval=92032991 TSecr=216433320 SLE=4195 SRE=5593  tcp.stream == 39
288   9.604395  172.20.10.4 -> 4.26.252.126 HTTP 416 [TCP Retransmission] GET /cnn/dam/assets/120221121420-greece-flag-t1-main.jpg HTTP/1.1   tcp.stream == 49
289   9.682456 23.32.12.240 -> 172.20.10.4  TCP 66 http > 40375 [ACK] Seq=1 Ack=324 Win=15552 Len=0 TSval=2791689037 TSecr=92032785  tcp.stream == 47
291   9.691130  172.20.10.4 -> 23.32.12.147 TCP 74 57717 > http [SYN] Seq=0 Win=14600 Len=0 MSS=1460 SACK_PERM=1 TSval=92033031 TSecr=0 WS=128  tcp.stream == 57
292   9.700540 23.32.12.240 -> 172.20.10.4  TCP 1464 [TCP segment of a reassembled PDU]  tcp.stream == 47
293   9.700560  172.20.10.4 -> 23.32.12.240 TCP 66 40375 > http [ACK] Seq=324 Ack=1399 Win=17536 Len=0 TSval=92033034 TSecr=2791689040  tcp.stream == 47
294   9.704199 23.32.12.240 -> 172.20.10.4  TCP 1464 [TCP segment of a reassembled PDU]  tcp.stream == 47
295   9.704219  172.20.10.4 -> 23.32.12.240 TCP 66 40375 > http [ACK] Seq=324 Ack=2797 Win=20480 Len=0 TSval=92033034 TSecr=2791689040  tcp.stream == 47
296   9.711451 23.32.12.240 -> 172.20.10.4  TCP 1464 [TCP segment of a reassembled PDU]  tcp.stream == 47
297   9.711471  172.20.10.4 -> 23.32.12.240 TCP 66 40375 > http [ACK] Seq=324 Ack=4195 Win=23296 Len=0 TSval=92033036 TSecr=2791689040  tcp.stream == 47
298   9.729076 23.32.12.240 -> 172.20.10.4  TCP 1464 [TCP segment of a reassembled PDU]  tcp.stream == 47
299   9.729097  172.20.10.4 -> 23.32.12.240 TCP 66 40375 > http [ACK] Seq=324 Ack=5593 Win=26240 Len=0 TSval=92033041 TSecr=2791689040  tcp.stream == 47
300   9.736394  172.20.10.4 -> 4.26.252.126 HTTP 449 [TCP Retransmission] GET /cnn/dam/assets/120221013513-pkg-damon-syria-humanitarian-crisis-00001103-c1-main.jpg HTTP/1.1   tcp.stream == 50
301   9.736540  172.20.10.4 -> 4.26.252.126 HTTP 428 [TCP Retransmission] GET /cnn/dam/assets/111116021415-john-king-live-chat-video-tease.jpg HTTP/1.1   tcp.stream == 51
303   9.737297  172.20.10.4 -> 4.26.252.126 HTTP 446 [TCP Retransmission] GET /cnn/dam/assets/110920071517-multiple-smartphones-white-background-video-tease.jpg HTTP/1.1   tcp.stream == 52
304   9.737306 209.244.156.19 -> 172.20.10.4  TCP 74 http > 56364 [SYN, ACK] Seq=0 Ack=1 Win=8192 Len=0 MSS=1380 WS=256 SACK_PERM=1 TSval=44161132 TSecr=92032804  tcp.stream == 55
305   9.737410  172.20.10.4 -> 23.32.12.240 TCP 74 40386 > http [SYN] Seq=0 Win=14600 Len=0 MSS=1460 SACK_PERM=1 TSval=92033043 TSecr=0 WS=128  tcp.stream == 58
306   9.737413 23.32.12.240 -> 172.20.10.4  TCP 66 http > 40376 [ACK] Seq=1 Ack=325 Win=15552 Len=0 TSval=2791689089 TSecr=92032812  tcp.stream == 48
307   9.737664  172.20.10.4 -> 209.244.156.19 TCP 66 56364 > http [ACK] Seq=1 Ack=1 Win=14720 Len=0 TSval=92033043 TSecr=44161132  tcp.stream == 55
308   9.738295  172.20.10.4 -> 209.244.156.19 HTTP 378 GET /adserver/adServer.aspx?publisherID=97 HTTP/1.1   tcp.stream == 55
309   9.748299 23.32.12.240 -> 172.20.10.4  TCP 1464 [TCP segment of a reassembled PDU]  tcp.stream == 48
310   9.748318  172.20.10.4 -> 23.32.12.240 TCP 66 40376 > http [ACK] Seq=325 Ack=1399 Win=17536 Len=0 TSval=92033045 TSecr=2791689089  tcp.stream == 48
311   9.748408  172.20.10.4 -> 4.26.252.126 HTTP 440 [TCP Retransmission] GET /cnn/dam/assets/120220114143-pkg-mn-police-standoff-00005210-video-tease.jpg HTTP/1.1   tcp.stream == 53
