  3   0.438662  172.20.10.4 -> 207.46.197.32 TCP 74 56920 > http [SYN] Seq=0 Win=14600 Len=0 MSS=1460 SACK_PERM=1 TSval=92685440 TSecr=0 WS=128  tcp.stream == 0
  4   0.623758 207.46.197.32 -> 172.20.10.4  TCP 78 http > 56920 [SYN, ACK] Seq=0 Ack=1 Win=16384 Len=0 MSS=1410 WS=1 TSval=0 TSecr=0 SACK_PERM=1  tcp.stream == 0
  5   0.623793  172.20.10.4 -> 207.46.197.32 TCP 66 56920 > http [ACK] Seq=1 Ack=1 Win=14720 Len=0 TSval=92685486 TSecr=0  tcp.stream == 0
  6   0.623986  172.20.10.4 -> 207.46.197.32 HTTP 361 GET / HTTP/1.1   tcp.stream == 0
  7   1.007514 207.46.197.32 -> 172.20.10.4  HTTP 550 HTTP/1.1 301 Moved Permanently  (text/html)  tcp.stream == 0
  8   1.007542  172.20.10.4 -> 207.46.197.32 TCP 66 56920 > http [ACK] Seq=296 Ack=485 Win=15744 Len=0 TSval=92685582 TSecr=48239276  tcp.stream == 0
  9   1.007737  172.20.10.4 -> 207.46.197.32 TCP 66 56920 > http [FIN, ACK] Seq=296 Ack=485 Win=15744 Len=0 TSval=92685582 TSecr=48239276  tcp.stream == 0
 10   1.009745 207.46.197.32 -> 172.20.10.4  TCP 66 http > 56920 [FIN, ACK] Seq=485 Ack=296 Win=65240 Len=0 TSval=48239276 TSecr=92685486  tcp.stream == 0
 11   1.009768  172.20.10.4 -> 207.46.197.32 TCP 66 56920 > http [ACK] Seq=297 Ack=486 Win=15744 Len=0 TSval=92685582 TSecr=48239276  tcp.stream == 0
 15   1.193365 207.46.197.32 -> 172.20.10.4  TCP 66 http > 56920 [ACK] Seq=486 Ack=297 Win=65240 Len=0 TSval=48239277 TSecr=92685582  tcp.stream == 0
 17   1.335690  172.20.10.4 -> 207.46.131.43 TCP 74 43448 > http [SYN] Seq=0 Win=14600 Len=0 MSS=1460 SACK_PERM=1 TSval=92685664 TSecr=0 WS=128  tcp.stream == 1
 18   1.521875 207.46.131.43 -> 172.20.10.4  TCP 58 http > 43448 [SYN, ACK] Seq=0 Ack=1 Win=8190 Len=0 MSS=1360  tcp.stream == 1
 19   1.521913  172.20.10.4 -> 207.46.131.43 TCP 54 43448 > http [ACK] Seq=1 Ack=1 Win=14600 Len=0  tcp.stream == 1
 20   1.521988  172.20.10.4 -> 207.46.131.43 HTTP 353 GET / HTTP/1.1   tcp.stream == 1
 21   1.822123 207.46.131.43 -> 172.20.10.4  HTTP 593 HTTP/1.1 302 Found  (text/html)  tcp.stream == 1
 22   1.822153  172.20.10.4 -> 207.46.131.43 TCP 54 43448 > http [ACK] Seq=300 Ack=540 Win=15631 Len=0  tcp.stream == 1
 23   1.824500  172.20.10.4 -> 207.46.131.43 HTTP 371 GET /en/us/default.aspx HTTP/1.1   tcp.stream == 1
 24   2.282145 207.46.131.43 -> 172.20.10.4  HTTP 600 HTTP/1.1 301 Moved Permanently  (text/html)  tcp.stream == 1
 25   2.284570  172.20.10.4 -> 207.46.131.43 HTTP 371 GET /en-us/default.aspx HTTP/1.1   tcp.stream == 1
 26   2.575745 207.46.131.43 -> 172.20.10.4  TCP 1414 [TCP segment of a reassembled PDU]  tcp.stream == 1
 27   2.595615 207.46.131.43 -> 172.20.10.4  TCP 1414 [TCP segment of a reassembled PDU]  tcp.stream == 1
 28   2.595633  172.20.10.4 -> 207.46.131.43 TCP 54 43448 > http [ACK] Seq=934 Ack=3806 Win=21760 Len=0  tcp.stream == 1
 33   2.609710  172.20.10.4 -> 207.46.131.43 TCP 74 43449 > http [SYN] Seq=0 Win=14600 Len=0 MSS=1460 SACK_PERM=1 TSval=92685982 TSecr=0 WS=128  tcp.stream == 2
 34   2.609854  172.20.10.4 -> 207.46.131.43 TCP 74 43450 > http [SYN] Seq=0 Win=14600 Len=0 MSS=1460 SACK_PERM=1 TSval=92685982 TSecr=0 WS=128  tcp.stream == 3
 35   2.612611 207.46.131.43 -> 172.20.10.4  TCP 1414 [TCP segment of a reassembled PDU]  tcp.stream == 1
 36   2.621867 207.46.131.43 -> 172.20.10.4  TCP 1414 [TCP segment of a reassembled PDU]  tcp.stream == 1
 37   2.621884  172.20.10.4 -> 207.46.131.43 TCP 54 43448 > http [ACK] Seq=934 Ack=6526 Win=27200 Len=0  tcp.stream == 1
 38   2.647129 207.46.131.43 -> 172.20.10.4  TCP 1414 [TCP segment of a reassembled PDU]  tcp.stream == 1
 39   2.677611 207.46.131.43 -> 172.20.10.4  TCP 1414 [TCP segment of a reassembled PDU]  tcp.stream == 1
 40   2.677631  172.20.10.4 -> 207.46.131.43 TCP 54 43448 > http [ACK] Seq=934 Ack=9246 Win=34000 Len=0  tcp.stream == 1
 41   2.697611 207.46.131.43 -> 172.20.10.4  TCP 1414 [TCP segment of a reassembled PDU]  tcp.stream == 1
 42   2.737889  172.20.10.4 -> 207.46.131.43 TCP 54 43448 > http [ACK] Seq=934 Ack=10606 Win=36720 Len=0  tcp.stream == 1
 43   2.744986 207.46.131.43 -> 172.20.10.4  TCP 1414 [TCP segment of a reassembled PDU]  tcp.stream == 1
 44   2.745004  172.20.10.4 -> 207.46.131.43 TCP 54 43448 > http [ACK] Seq=934 Ack=11966 Win=39440 Len=0  tcp.stream == 1
 45   2.767367 207.46.131.43 -> 172.20.10.4  TCP 1414 [TCP segment of a reassembled PDU]  tcp.stream == 1
 46   2.767392  172.20.10.4 -> 207.46.131.43 TCP 54 43448 > http [ACK] Seq=934 Ack=13326 Win=42160 Len=0  tcp.stream == 1
 47   2.793487 207.46.131.43 -> 172.20.10.4  TCP 1414 [TCP segment of a reassembled PDU]  tcp.stream == 1
 48   2.793506  172.20.10.4 -> 207.46.131.43 TCP 54 43448 > http [ACK] Seq=934 Ack=14686 Win=44880 Len=0  tcp.stream == 1
 50   2.906488 207.46.131.43 -> 172.20.10.4  TCP 1414 [TCP segment of a reassembled PDU]  tcp.stream == 1
 51   2.906506  172.20.10.4 -> 207.46.131.43 TCP 54 43448 > http [ACK] Seq=934 Ack=16046 Win=47600 Len=0  tcp.stream == 1
 52   2.936737 207.46.131.43 -> 172.20.10.4  TCP 1414 [TCP segment of a reassembled PDU]  tcp.stream == 1
 53   2.936758  172.20.10.4 -> 207.46.131.43 TCP 54 43448 > http [ACK] Seq=934 Ack=17406 Win=51680 Len=0  tcp.stream == 1
 58   2.971112 207.46.131.43 -> 172.20.10.4  TCP 1414 [TCP segment of a reassembled PDU]  tcp.stream == 1
 59   2.971130  172.20.10.4 -> 207.46.131.43 TCP 54 43448 > http [ACK] Seq=934 Ack=18766 Win=54400 Len=0  tcp.stream == 1
 61   3.297004 207.46.131.43 -> 172.20.10.4  TCP 1414 [TCP segment of a reassembled PDU]  tcp.stream == 1
 62   3.297024  172.20.10.4 -> 207.46.131.43 TCP 54 43448 > http [ACK] Seq=934 Ack=20126 Win=57120 Len=0  tcp.stream == 1
 63   3.328609 207.46.131.43 -> 172.20.10.4  TCP 1414 [TCP segment of a reassembled PDU]  tcp.stream == 1
 64   3.328628  172.20.10.4 -> 207.46.131.43 TCP 54 43448 > http [ACK] Seq=934 Ack=21486 Win=59840 Len=0  tcp.stream == 1
 65   3.348482 207.46.131.43 -> 172.20.10.4  TCP 1414 [TCP segment of a reassembled PDU]  tcp.stream == 1
 66   3.348502  172.20.10.4 -> 207.46.131.43 TCP 54 43448 > http [ACK] Seq=934 Ack=22846 Win=62560 Len=0  tcp.stream == 1
 67   3.391735 207.46.131.43 -> 172.20.10.4  TCP 1414 [TCP segment of a reassembled PDU]  tcp.stream == 1
 68   3.391754  172.20.10.4 -> 207.46.131.43 TCP 54 43448 > http [ACK] Seq=934 Ack=24206 Win=63920 Len=0  tcp.stream == 1
 69   3.410230 207.46.131.43 -> 172.20.10.4  TCP 1414 [TCP segment of a reassembled PDU]  tcp.stream == 1
 70   3.410246  172.20.10.4 -> 207.46.131.43 TCP 54 43448 > http [ACK] Seq=934 Ack=25566 Win=63920 Len=0  tcp.stream == 1
 74   3.470035  172.20.10.4 -> 64.4.11.30   TCP 74 46320 > http [SYN] Seq=0 Win=14600 Len=0 MSS=1460 SACK_PERM=1 TSval=92686198 TSecr=0 WS=128  tcp.stream == 4
 75   3.470091 207.46.131.43 -> 172.20.10.4  TCP 58 http > 43449 [SYN, ACK] Seq=0 Ack=1 Win=8190 Len=0 MSS=1360  tcp.stream == 2
 76   3.470216  172.20.10.4 -> 207.46.131.43 TCP 54 43449 > http [ACK] Seq=1 Ack=1 Win=14600 Len=0  tcp.stream == 2
 77   3.470340  172.20.10.4 -> 207.46.131.43 HTTP 397 GET /en-us/homepage/shared/core/2/js/js.ashx?pt=hpPage& HTTP/1.1   tcp.stream == 2
 78   3.514856 207.46.131.43 -> 172.20.10.4  TCP 1414 [TCP segment of a reassembled PDU]  tcp.stream == 1
 79   3.514884  172.20.10.4 -> 207.46.131.43 TCP 54 43448 > http [ACK] Seq=934 Ack=26926 Win=63920 Len=0  tcp.stream == 1
 80   3.522356 207.46.131.43 -> 172.20.10.4  TCP 1414 [TCP segment of a reassembled PDU]  tcp.stream == 1
 81   3.522374  172.20.10.4 -> 207.46.131.43 TCP 54 43448 > http [ACK] Seq=934 Ack=28286 Win=63920 Len=0  tcp.stream == 1
 82   3.576236 207.46.131.43 -> 172.20.10.4  TCP 1414 [TCP segment of a reassembled PDU]  tcp.stream == 1
 83   3.576255  172.20.10.4 -> 207.46.131.43 TCP 54 43448 > http [ACK] Seq=934 Ack=29646 Win=63920 Len=0  tcp.stream == 1
 84   3.588479 207.46.131.43 -> 172.20.10.4  TCP 1414 [TCP segment of a reassembled PDU]  tcp.stream == 1
 85   3.588496  172.20.10.4 -> 207.46.131.43 TCP 54 43448 > http [ACK] Seq=934 Ack=31006 Win=63920 Len=0  tcp.stream == 1
 86   3.653487 207.46.131.43 -> 172.20.10.4  TCP 1414 [TCP segment of a reassembled PDU]  tcp.stream == 1
 87   3.653507  172.20.10.4 -> 207.46.131.43 TCP 54 43448 > http [ACK] Seq=934 Ack=32366 Win=63920 Len=0  tcp.stream == 1
 88   3.680728 207.46.131.43 -> 172.20.10.4  TCP 1414 [TCP segment of a reassembled PDU]  tcp.stream == 1
 89   3.680746  172.20.10.4 -> 207.46.131.43 TCP 54 43448 > http [ACK] Seq=934 Ack=33726 Win=63920 Len=0  tcp.stream == 1
 90   3.700988 207.46.131.43 -> 172.20.10.4  TCP 1414 [TCP segment of a reassembled PDU]  tcp.stream == 1
 91   3.701007  172.20.10.4 -> 207.46.131.43 TCP 54 43448 > http [ACK] Seq=934 Ack=35086 Win=63920 Len=0  tcp.stream == 1
 92   3.703851 207.46.131.43 -> 172.20.10.4  HTTP 217 HTTP/1.1 200 OK  (text/html)  tcp.stream == 1
 93   3.703866  172.20.10.4 -> 207.46.131.43 TCP 54 43448 > http [ACK] Seq=934 Ack=35249 Win=63920 Len=0  tcp.stream == 1
 94   3.703971  172.20.10.4 -> 207.46.131.43 HTTP 444 GET /en-us/homepage/shared/core/2/css/css.ashx?sc=/en-us/homepage/site.config&pt=hpPage HTTP/1.1   tcp.stream == 1
 95   3.704219 207.46.131.43 -> 172.20.10.4  TCP 58 http > 43450 [SYN, ACK] Seq=0 Ack=1 Win=8190 Len=0 MSS=1360  tcp.stream == 3
 96   3.704232  172.20.10.4 -> 207.46.131.43 TCP 54 43450 > http [ACK] Seq=1 Ack=1 Win=14600 Len=0  tcp.stream == 3
101   3.724560  172.20.10.4 -> 23.32.12.219 TCP 74 41848 > http [SYN] Seq=0 Win=14600 Len=0 MSS=1460 SACK_PERM=1 TSval=92686261 TSecr=0 WS=128  tcp.stream == 5
102   3.724716  172.20.10.4 -> 23.32.12.219 TCP 74 41849 > http [SYN] Seq=0 Win=14600 Len=0 MSS=1460 SACK_PERM=1 TSval=92686261 TSecr=0 WS=128  tcp.stream == 6
103   3.725091  172.20.10.4 -> 23.32.12.219 TCP 74 41850 > http [SYN] Seq=0 Win=14600 Len=0 MSS=1460 SACK_PERM=1 TSval=92686261 TSecr=0 WS=128  tcp.stream == 7
104   3.725969  172.20.10.4 -> 23.32.12.219 TCP 74 41851 > http [SYN] Seq=0 Win=14600 Len=0 MSS=1460 SACK_PERM=1 TSval=92686261 TSecr=0 WS=128  tcp.stream == 8
105   3.726972  172.20.10.4 -> 23.32.12.219 TCP 74 41852 > http [SYN] Seq=0 Win=14600 Len=0 MSS=1460 SACK_PERM=1 TSval=92686261 TSecr=0 WS=128  tcp.stream == 9
106   3.728230  172.20.10.4 -> 23.32.12.219 TCP 74 41853 > http [SYN] Seq=0 Win=14600 Len=0 MSS=1460 SACK_PERM=1 TSval=92686261 TSecr=0 WS=128  tcp.stream == 10
108   3.735046  172.20.10.4 -> 23.32.12.219 TCP 74 41854 > http [SYN] Seq=0 Win=14600 Len=0 MSS=1460 SACK_PERM=1 TSval=92686264 TSecr=0 WS=128  tcp.stream == 11
112   3.745919  172.20.10.4 -> 70.37.129.152 TCP 74 41703 > http [SYN] Seq=0 Win=14600 Len=0 MSS=1460 SACK_PERM=1 TSval=92686267 TSecr=0 WS=128  tcp.stream == 12
113   3.746095   64.4.11.30 -> 172.20.10.4  TCP 66 http > 46320 [SYN, ACK] Seq=0 Ack=1 Win=8190 Len=0 MSS=1360 WS=16 SACK_PERM=1  tcp.stream == 4
114   3.746109  172.20.10.4 -> 64.4.11.30   TCP 54 46320 > http [ACK] Seq=1 Ack=1 Win=14720 Len=0  tcp.stream == 4
115   3.746340  172.20.10.4 -> 64.4.11.30   HTTP 496 GET /trans_pixel.aspx?tz=5&cot=5&qos.uri=http://www.microsoft.com/en-us/default.aspx&qos.ti=1329849657352&ts=1329849657352&qos.tl=&qos.n=init HTTP/1.1   tcp.stream == 4
116   3.768482 207.46.131.43 -> 172.20.10.4  HTTP 595 HTTP/1.1 200 OK  (text/javascript)  tcp.stream == 2
117   3.768505  172.20.10.4 -> 207.46.131.43 TCP 54 43449 > http [ACK] Seq=344 Ack=542 Win=15148 Len=0  tcp.stream == 2
120   4.039357 207.46.131.43 -> 172.20.10.4  HTTP 699 HTTP/1.1 200 OK  (text/css)  tcp.stream == 1
122   4.071424  172.20.10.4 -> 65.55.12.249 TCP 74 46526 > http [SYN] Seq=0 Win=14600 Len=0 MSS=1460 SACK_PERM=1 TSval=92686348 TSecr=0 WS=128  tcp.stream == 13
123   4.071589  172.20.10.4 -> 65.55.12.249 TCP 74 46527 > http [SYN] Seq=0 Win=14600 Len=0 MSS=1460 SACK_PERM=1 TSval=92686348 TSecr=0 WS=128  tcp.stream == 14
124   4.074477 23.32.12.219 -> 172.20.10.4  TCP 74 http > 41848 [SYN, ACK] Seq=0 Ack=1 Win=14480 Len=0 MSS=1410 SACK_PERM=1 TSval=2882441252 TSecr=92686261 WS=4  tcp.stream == 5
125   4.074505  172.20.10.4 -> 23.32.12.219 TCP 66 41848 > http [ACK] Seq=1 Ack=1 Win=14720 Len=0 TSval=92686349 TSecr=2882441252  tcp.stream == 5
126   4.074609  172.20.10.4 -> 23.32.12.219 HTTP 912 GET /en-us/homepage/style.cssx?k=~/shared/templates/components/mscomViews/VPivot/VPivot-css.aspx;~/shared/templates/components/mscomViews/grid/grid-css.aspx;~/shared/templates/components/mscomViews/hero/hero-css.aspx;~/shared/templates/components/mscomViews/Accordion/Accordion-css.aspx;~/shared/templates/components/mscomViews/controls/featureitem/featureItem-css.aspx;~/shared/templates/components/mscomViews/Carousel/Carousel-css.aspx;~/shared/templates/components/mscomViews/List/list-css.aspx&sc=/en-us/homepage/site.config&pc=&v=1114074694 HTTP/1.1   tcp.stream == 5
127   4.077875  172.20.10.4 -> 207.46.131.43 TCP 54 43448 > http [ACK] Seq=1324 Ack=35894 Win=63920 Len=0  tcp.stream == 1
129   4.102381  172.20.10.4 -> 64.4.11.30   TCP 74 46331 > http [SYN] Seq=0 Win=14600 Len=0 MSS=1460 SACK_PERM=1 TSval=92686356 TSecr=0 WS=128  tcp.stream == 15
130   4.105223 23.32.12.219 -> 172.20.10.4  TCP 74 http > 41849 [SYN, ACK] Seq=0 Ack=1 Win=14480 Len=0 MSS=1410 SACK_PERM=1 TSval=2882441278 TSecr=92686261 WS=4  tcp.stream == 6
131   4.105246  172.20.10.4 -> 23.32.12.219 TCP 66 41849 > http [ACK] Seq=1 Ack=1 Win=14720 Len=0 TSval=92686356 TSecr=2882441278  tcp.stream == 6
132   4.105348  172.20.10.4 -> 23.32.12.219 HTTP 1164 GET /en-us/homepage/style.cssx?k=~/shared/templates/master/hpMaster/master-css.aspx;~/shared/templates/components/mscomViews/Blade/blade-css.aspx;~/shared/templates/components/mscomViews/Header/header-css.aspx;~/shared/templates/components/mscomViews/Products/Products-css.aspx;~/shared/templates/components/mscomViews/ProductTiles/ProductTiles-css.aspx;~/shared/templates/components/mscomViews/ProductList/ProductList-css.aspx;~/shared/templates/components/mscomViews/Search/Search-css.aspx;~/shared/templates/components/mscomViews/LocalePicker/LocalePicker-css.aspx;~/shared/templates/components/mscomViews/Menu/menu-css.aspx;~/shared/templates/components/mscomViews/Footer/footer-css.aspx;~/shared/templates/master/hpMaster/master-header-css.aspx&sc=/en-us/homepage/site.config&pc=&v=2035960675 HTTP/1.1   tcp.stream == 6
133   4.156358 23.32.12.219 -> 172.20.10.4  TCP 74 http > 41850 [SYN, ACK] Seq=0 Ack=1 Win=14480 Len=0 MSS=1410 SACK_PERM=1 TSval=2882441278 TSecr=92686261 WS=4  tcp.stream == 7
134   4.156383  172.20.10.4 -> 23.32.12.219 TCP 66 41850 > http [ACK] Seq=1 Ack=1 Win=14720 Len=0 TSval=92686369 TSecr=2882441278  tcp.stream == 7
135   4.156494  172.20.10.4 -> 23.32.12.219 HTTP 654 GET /en-us/homepage/script.jsx?k=~/shared/templates/components/mscomViews/Controls/Scripts/mscomhelper.js;~/shared/templates/components/mscomViews/Blade/blade.js;~/shared/templates/components/mscomViews/Search/Search.js;~/shared/templates/components/mscomViews/LocalePicker/LocalePicker.js&v=-282235141 HTTP/1.1   tcp.stream == 7
136   4.252233 23.32.12.219 -> 172.20.10.4  TCP 74 http > 41852 [SYN, ACK] Seq=0 Ack=1 Win=14480 Len=0 MSS=1410 SACK_PERM=1 TSval=2882441391 TSecr=92686261 WS=4  tcp.stream == 9
137   4.252257  172.20.10.4 -> 23.32.12.219 TCP 66 41852 > http [ACK] Seq=1 Ack=1 Win=14720 Len=0 TSval=92686393 TSecr=2882441391  tcp.stream == 9
138   4.252369  172.20.10.4 -> 23.32.12.219 HTTP 448 GET /global/en-us/homepage/PublishingImages/Header/WindowsLogo.png HTTP/1.1   tcp.stream == 9
139   4.255097 23.32.12.219 -> 172.20.10.4  TCP 74 http > 41851 [SYN, ACK] Seq=0 Ack=1 Win=14480 Len=0 MSS=1410 SACK_PERM=1 TSval=2882441391 TSecr=92686261 WS=4  tcp.stream == 8
140   4.255118  172.20.10.4 -> 23.32.12.219 TCP 66 41851 > http [ACK] Seq=1 Ack=1 Win=14720 Len=0 TSval=92686394 TSecr=2882441391  tcp.stream == 8
141   4.255219  172.20.10.4 -> 23.32.12.219 HTTP 689 GET /en-us/homepage/script.jsx?k=~/shared/templates/components/mscomViews/VPivot/VPivot.js;~/shared/templates/components/mscomViews/grid/grid.js;~/shared/templates/components/mscomViews/hero/hero.js;~/shared/templates/components/mscomViews/Accordion/Accordion.js;~/shared/templates/components/mscomViews/Carousel/Carousel.js&v=1793508902 HTTP/1.1   tcp.stream == 8
142   4.255594 23.32.12.219 -> 172.20.10.4  TCP 74 http > 41853 [SYN, ACK] Seq=0 Ack=1 Win=14480 Len=0 MSS=1410 SACK_PERM=1 TSval=2882441418 TSecr=92686261 WS=4  tcp.stream == 10
143   4.255610  172.20.10.4 -> 23.32.12.219 TCP 66 41853 > http [ACK] Seq=1 Ack=1 Win=14720 Len=0 TSval=92686394 TSecr=2882441418  tcp.stream == 10
144   4.255710  172.20.10.4 -> 23.32.12.219 HTTP 447 GET /global/en-us/homepage/PublishingImages/Header/OfficeLogo.png HTTP/1.1   tcp.stream == 10
145   4.270100 23.32.12.219 -> 172.20.10.4  TCP 74 http > 41854 [SYN, ACK] Seq=0 Ack=1 Win=14480 Len=0 MSS=1410 SACK_PERM=1 TSval=2882441446 TSecr=92686264 WS=4  tcp.stream == 11
146   4.270122  172.20.10.4 -> 23.32.12.219 TCP 66 41854 > http [ACK] Seq=1 Ack=1 Win=14720 Len=0 TSval=92686398 TSecr=2882441446  tcp.stream == 11
147   4.270233  172.20.10.4 -> 23.32.12.219 HTTP 379 GET /library/svy/broker.js HTTP/1.1   tcp.stream == 11
148   4.272849 70.37.129.152 -> 172.20.10.4  TCP 74 http > 41703 [SYN, ACK] Seq=0 Ack=1 Win=65535 Len=0 MSS=1410 WS=16 SACK_PERM=1 TSval=755948194 TSecr=92686267  tcp.stream == 12
149   4.272872  172.20.10.4 -> 70.37.129.152 TCP 66 41703 > http [ACK] Seq=1 Ack=1 Win=14720 Len=0 TSval=92686398 TSecr=755948194  tcp.stream == 12
150   4.272978  172.20.10.4 -> 70.37.129.152 HTTP 391 GET /ajax/jQuery/jquery-1.5.1.min.js HTTP/1.1   tcp.stream == 12
152   4.279307  172.20.10.4 -> 192.221.100.126 TCP 74 50731 > http [SYN] Seq=0 Win=14600 Len=0 MSS=1460 SACK_PERM=1 TSval=92686400 TSecr=0 WS=128  tcp.stream == 16
157   4.522851   64.4.11.30 -> 172.20.10.4  HTTP 744 HTTP/1.1 200 OK  (GIF89a)  tcp.stream == 4
158   4.522876  172.20.10.4 -> 64.4.11.30   TCP 54 46320 > http [ACK] Seq=443 Ack=691 Win=16000 Len=0  tcp.stream == 4
160   4.574097 65.55.12.249 -> 172.20.10.4  TCP 58 http > 46526 [SYN, ACK] Seq=0 Ack=1 Win=8190 Len=0 MSS=1380  tcp.stream == 13
161   4.574119  172.20.10.4 -> 65.55.12.249 TCP 54 46526 > http [ACK] Seq=1 Ack=1 Win=14600 Len=0  tcp.stream == 13
162   4.576473 65.55.12.249 -> 172.20.10.4  TCP 58 http > 46527 [SYN, ACK] Seq=0 Ack=1 Win=8190 Len=0 MSS=1380  tcp.stream == 14
163   4.576497  172.20.10.4 -> 65.55.12.249 TCP 54 46527 > http [ACK] Seq=1 Ack=1 Win=14600 Len=0  tcp.stream == 14
164   4.690103 23.32.12.219 -> 172.20.10.4  TCP 66 http > 41848 [ACK] Seq=1 Ack=847 Win=16172 Len=0 TSval=2882441865 TSecr=92686349  tcp.stream == 5
165   4.719729 23.32.12.219 -> 172.20.10.4  TCP 1464 [TCP segment of a reassembled PDU]  tcp.stream == 5
166   4.719755  172.20.10.4 -> 23.32.12.219 TCP 66 41848 > http [ACK] Seq=847 Ack=1399 Win=17536 Len=0 TSval=92686510 TSecr=2882441871  tcp.stream == 5
167   4.732594 23.32.12.219 -> 172.20.10.4  TCP 1464 [TCP segment of a reassembled PDU]  tcp.stream == 5
168   4.732615  172.20.10.4 -> 23.32.12.219 TCP 66 41848 > http [ACK] Seq=847 Ack=2797 Win=20480 Len=0 TSval=92686513 TSecr=2882441871  tcp.stream == 5
169   4.760475 23.32.12.219 -> 172.20.10.4  TCP 1464 [TCP segment of a reassembled PDU]  tcp.stream == 5
170   4.760493  172.20.10.4 -> 23.32.12.219 TCP 66 41848 > http [ACK] Seq=847 Ack=4195 Win=23296 Len=0 TSval=92686520 TSecr=2882441871  tcp.stream == 5
171   4.800096 23.32.12.219 -> 172.20.10.4  TCP 1464 [TCP segment of a reassembled PDU]  tcp.stream == 5
172   4.800115  172.20.10.4 -> 23.32.12.219 TCP 66 41848 > http [ACK] Seq=847 Ack=5593 Win=26240 Len=0 TSval=92686530 TSecr=2882441871  tcp.stream == 5
173   4.802470   64.4.11.30 -> 172.20.10.4  TCP 66 http > 46331 [SYN, ACK] Seq=0 Ack=1 Win=8190 Len=0 MSS=1360 WS=16 SACK_PERM=1  tcp.stream == 15
174   4.802494  172.20.10.4 -> 64.4.11.30   TCP 54 46331 > http [ACK] Seq=1 Ack=1 Win=14720 Len=0  tcp.stream == 15
175   5.096867 23.32.12.219 -> 172.20.10.4  TCP 66 http > 41849 [ACK] Seq=1 Ack=1099 Win=16676 Len=0 TSval=2882442279 TSecr=92686356  tcp.stream == 6
176   5.119346 23.32.12.219 -> 172.20.10.4  TCP 1464 [TCP segment of a reassembled PDU]  tcp.stream == 6
177   5.119362  172.20.10.4 -> 23.32.12.219 TCP 66 41849 > http [ACK] Seq=1099 Ack=1399 Win=17536 Len=0 TSval=92686610 TSecr=2882442280  tcp.stream == 6
178   5.161858 23.32.12.219 -> 172.20.10.4  TCP 1464 [TCP segment of a reassembled PDU]  tcp.stream == 6
179   5.161879  172.20.10.4 -> 23.32.12.219 TCP 66 41849 > http [ACK] Seq=1099 Ack=2797 Win=20480 Len=0 TSval=92686621 TSecr=2882442280  tcp.stream == 6
180   5.181969 23.32.12.219 -> 172.20.10.4  TCP 1464 [TCP segment of a reassembled PDU]  tcp.stream == 6
181   5.181985  172.20.10.4 -> 23.32.12.219 TCP 66 41849 > http [ACK] Seq=1099 Ack=4195 Win=23296 Len=0 TSval=92686626 TSecr=2882442280  tcp.stream == 6
182   5.201851 23.32.12.219 -> 172.20.10.4  TCP 1464 [TCP segment of a reassembled PDU]  tcp.stream == 6
183   5.201873  172.20.10.4 -> 23.32.12.219 TCP 66 41849 > http [ACK] Seq=1099 Ack=5593 Win=26240 Len=0 TSval=92686631 TSecr=2882442280  tcp.stream == 6
184   5.204718 23.32.12.219 -> 172.20.10.4  TCP 66 http > 41850 [ACK] Seq=1 Ack=589 Win=15656 Len=0 TSval=2882442353 TSecr=92686369  tcp.stream == 7
185   5.221968 23.32.12.219 -> 172.20.10.4  TCP 1464 [TCP segment of a reassembled PDU]  tcp.stream == 7
186   5.221987  172.20.10.4 -> 23.32.12.219 TCP 66 41850 > http [ACK] Seq=589 Ack=1399 Win=17536 Len=0 TSval=92686636 TSecr=2882442355  tcp.stream == 7
187   5.228972 23.32.12.219 -> 172.20.10.4  TCP 1464 [TCP segment of a reassembled PDU]  tcp.stream == 7
188   5.228991  172.20.10.4 -> 23.32.12.219 TCP 66 41850 > http [ACK] Seq=589 Ack=2797 Win=20480 Len=0 TSval=92686637 TSecr=2882442355  tcp.stream == 7
189   5.242344 23.32.12.219 -> 172.20.10.4  TCP 1464 [TCP segment of a reassembled PDU]  tcp.stream == 7
190   5.242362  172.20.10.4 -> 23.32.12.219 TCP 66 41850 > http [ACK] Seq=589 Ack=4195 Win=23296 Len=0 TSval=92686641 TSecr=2882442355  tcp.stream == 7
191   5.261470 23.32.12.219 -> 172.20.10.4  TCP 1464 [TCP segment of a reassembled PDU]  tcp.stream == 7
192   5.261490  172.20.10.4 -> 23.32.12.219 TCP 66 41850 > http [ACK] Seq=589 Ack=5593 Win=26240 Len=0 TSval=92686645 TSecr=2882442355  tcp.stream == 7
193   5.297594 23.32.12.219 -> 172.20.10.4  TCP 66 http > 41852 [ACK] Seq=1 Ack=383 Win=15552 Len=0 TSval=2882442478 TSecr=92686393  tcp.stream == 9
194   5.366720 23.32.12.219 -> 172.20.10.4  TCP 1464 [TCP segment of a reassembled PDU]  tcp.stream == 9
195   5.366740  172.20.10.4 -> 23.32.12.219 TCP 66 41852 > http [ACK] Seq=383 Ack=1399 Win=17536 Len=0 TSval=92686672 TSecr=2882442479  tcp.stream == 9
196   5.393469 23.32.12.219 -> 172.20.10.4  TCP 1464 [TCP segment of a reassembled PDU]  tcp.stream == 9
197   5.393488  172.20.10.4 -> 23.32.12.219 TCP 66 41852 > http [ACK] Seq=383 Ack=2797 Win=20480 Len=0 TSval=92686678 TSecr=2882442479  tcp.stream == 9
198   5.413716 23.32.12.219 -> 172.20.10.4  TCP 1464 [TCP segment of a reassembled PDU]  tcp.stream == 9
199   5.413735  172.20.10.4 -> 23.32.12.219 TCP 66 41852 > http [ACK] Seq=383 Ack=4195 Win=23296 Len=0 TSval=92686683 TSecr=2882442479  tcp.stream == 9
200   5.448600 23.32.12.219 -> 172.20.10.4  TCP 1464 [TCP segment of a reassembled PDU]  tcp.stream == 9
201   5.448624  172.20.10.4 -> 23.32.12.219 TCP 66 41852 > http [ACK] Seq=383 Ack=5593 Win=26240 Len=0 TSval=92686692 TSecr=2882442479  tcp.stream == 9
202   5.451343 23.32.12.219 -> 172.20.10.4  TCP 66 http > 41851 [ACK] Seq=1 Ack=624 Win=15728 Len=0 TSval=2882442593 TSecr=92686394  tcp.stream == 8
203   5.465715 23.32.12.219 -> 172.20.10.4  TCP 1464 [TCP segment of a reassembled PDU]  tcp.stream == 8
204   5.465733  172.20.10.4 -> 23.32.12.219 TCP 66 41851 > http [ACK] Seq=624 Ack=1399 Win=17536 Len=0 TSval=92686696 TSecr=2882442596  tcp.stream == 8
205   5.505898 23.32.12.219 -> 172.20.10.4  TCP 1464 [TCP segment of a reassembled PDU]  tcp.stream == 8
206   5.505918  172.20.10.4 -> 23.32.12.219 TCP 66 41851 > http [ACK] Seq=624 Ack=2797 Win=20480 Len=0 TSval=92686707 TSecr=2882442596  tcp.stream == 8
207   5.525594 23.32.12.219 -> 172.20.10.4  TCP 1464 [TCP segment of a reassembled PDU]  tcp.stream == 8
208   5.525614  172.20.10.4 -> 23.32.12.219 TCP 66 41851 > http [ACK] Seq=624 Ack=4195 Win=23296 Len=0 TSval=92686711 TSecr=2882442596  tcp.stream == 8
209   5.545966 23.32.12.219 -> 172.20.10.4  TCP 1464 [TCP segment of a reassembled PDU]  tcp.stream == 8
210   5.545982  172.20.10.4 -> 23.32.12.219 TCP 66 41851 > http [ACK] Seq=624 Ack=5593 Win=26240 Len=0 TSval=92686717 TSecr=2882442596  tcp.stream == 8
211   5.558964   64.4.11.30 -> 172.20.10.4  HTTP 744 [TCP Retransmission] HTTP/1.1 200 OK  (GIF89a)  tcp.stream == 4
212   5.558982  172.20.10.4 -> 64.4.11.30   TCP 66 [TCP Dup ACK 158#1] 46320 > http [ACK] Seq=443 Ack=691 Win=16000 Len=0 SLE=1 SRE=691  tcp.stream == 4
213   5.561841 23.32.12.219 -> 172.20.10.4  TCP 66 http > 41853 [ACK] Seq=1 Ack=382 Win=15552 Len=0 TSval=2882442717 TSecr=92686394  tcp.stream == 10
214   5.585966 23.32.12.219 -> 172.20.10.4  TCP 1464 [TCP segment of a reassembled PDU]  tcp.stream == 10
215   5.585982  172.20.10.4 -> 23.32.12.219 TCP 66 41853 > http [ACK] Seq=382 Ack=1399 Win=17536 Len=0 TSval=92686727 TSecr=2882442731  tcp.stream == 10
216   5.635345 23.32.12.219 -> 172.20.10.4  TCP 1464 [TCP segment of a reassembled PDU]  tcp.stream == 10
217   5.635365  172.20.10.4 -> 23.32.12.219 TCP 66 41853 > http [ACK] Seq=382 Ack=2797 Win=20480 Len=0 TSval=92686739 TSecr=2882442731  tcp.stream == 10
218   5.655968 23.32.12.219 -> 172.20.10.4  TCP 1464 [TCP segment of a reassembled PDU]  tcp.stream == 10
219   5.655986  172.20.10.4 -> 23.32.12.219 TCP 66 41853 > http [ACK] Seq=382 Ack=4195 Win=23296 Len=0 TSval=92686744 TSecr=2882442731  tcp.stream == 10
220   5.681589 23.32.12.219 -> 172.20.10.4  TCP 1464 [TCP segment of a reassembled PDU]  tcp.stream == 10
221   5.681604  172.20.10.4 -> 23.32.12.219 TCP 66 41853 > http [ACK] Seq=382 Ack=5593 Win=26240 Len=0 TSval=92686750 TSecr=2882442731  tcp.stream == 10
222   5.688338 23.32.12.219 -> 172.20.10.4  TCP 66 http > 41854 [ACK] Seq=1 Ack=314 Win=15552 Len=0 TSval=2882442856 TSecr=92686398  tcp.stream == 11
223   5.701965 23.32.12.219 -> 172.20.10.4  TCP 1464 [TCP segment of a reassembled PDU]  tcp.stream == 11
224   5.701982  172.20.10.4 -> 23.32.12.219 TCP 66 41854 > http [ACK] Seq=314 Ack=1399 Win=17536 Len=0 TSval=92686756 TSecr=2882442857  tcp.stream == 11
225   5.729218 23.32.12.219 -> 172.20.10.4  TCP 1464 [TCP segment of a reassembled PDU]  tcp.stream == 11
226   5.729238  172.20.10.4 -> 23.32.12.219 TCP 66 41854 > http [ACK] Seq=314 Ack=2797 Win=20480 Len=0 TSval=92686762 TSecr=2882442857  tcp.stream == 11
227   5.741962 23.32.12.219 -> 172.20.10.4  TCP 1464 [TCP segment of a reassembled PDU]  tcp.stream == 11
228   5.741978  172.20.10.4 -> 23.32.12.219 TCP 66 41854 > http [ACK] Seq=314 Ack=4195 Win=23296 Len=0 TSval=92686766 TSecr=2882442857  tcp.stream == 11
229   5.831973 23.32.12.219 -> 172.20.10.4  TCP 1464 [TCP segment of a reassembled PDU]  tcp.stream == 11
230   5.831993  172.20.10.4 -> 23.32.12.219 TCP 66 41854 > http [ACK] Seq=314 Ack=5593 Win=26240 Len=0 TSval=92686788 TSecr=2882442857  tcp.stream == 11
231   5.834213 192.221.100.126 -> 172.20.10.4  TCP 74 http > 50731 [SYN, ACK] Seq=0 Ack=1 Win=5792 Len=0 MSS=1410 SACK_PERM=1 TSval=4008035010 TSecr=92686400 WS=128  tcp.stream == 16
232   5.834235  172.20.10.4 -> 192.221.100.126 TCP 66 50731 > http [ACK] Seq=1 Ack=1 Win=14720 Len=0 TSval=92686789 TSecr=4008035010  tcp.stream == 16
233   5.834345  172.20.10.4 -> 192.221.100.126 HTTP 368 GET /library/dap.js HTTP/1.1   tcp.stream == 16
234   5.856716 70.37.129.152 -> 172.20.10.4  TCP 1464 [TCP segment of a reassembled PDU]  tcp.stream == 12
235   5.856738  172.20.10.4 -> 70.37.129.152 TCP 66 41703 > http [ACK] Seq=326 Ack=1399 Win=17536 Len=0 TSval=92686794 TSecr=755949754  tcp.stream == 12
236   5.877467 70.37.129.152 -> 172.20.10.4  TCP 1464 [TCP segment of a reassembled PDU]  tcp.stream == 12
237   5.877485  172.20.10.4 -> 70.37.129.152 TCP 66 41703 > http [ACK] Seq=326 Ack=2797 Win=20480 Len=0 TSval=92686799 TSecr=755949754  tcp.stream == 12
238   5.937847 70.37.129.152 -> 172.20.10.4  TCP 1464 [TCP segment of a reassembled PDU]  tcp.stream == 12
239   5.937874  172.20.10.4 -> 70.37.129.152 TCP 66 41703 > http [ACK] Seq=326 Ack=4195 Win=23296 Len=0 TSval=92686815 TSecr=755949754  tcp.stream == 12
243   5.941083  172.20.10.4 -> 70.37.129.135 TCP 74 40295 > http [SYN] Seq=0 Win=14600 Len=0 MSS=1460 SACK_PERM=1 TSval=92686815 TSecr=0 WS=128  tcp.stream == 17
244   5.979213 23.32.12.219 -> 172.20.10.4  TCP 1464 [TCP segment of a reassembled PDU]  tcp.stream == 5
245   5.979232  172.20.10.4 -> 23.32.12.219 TCP 66 41848 > http [ACK] Seq=847 Ack=6991 Win=29184 Len=0 TSval=92686825 TSecr=2882443037  tcp.stream == 5
246   6.031341 23.32.12.219 -> 172.20.10.4  TCP 1464 [TCP segment of a reassembled PDU]  tcp.stream == 5
247   6.031360  172.20.10.4 -> 23.32.12.219 TCP 66 41848 > http [ACK] Seq=847 Ack=8389 Win=32000 Len=0 TSval=92686838 TSecr=2882443037  tcp.stream == 5
249   6.038746  172.20.10.4 -> 23.32.12.219 TCP 74 41861 > http [SYN] Seq=0 Win=14600 Len=0 MSS=1460 SACK_PERM=1 TSval=92686840 TSecr=0 WS=128  tcp.stream == 18
250   6.052467 23.32.12.219 -> 172.20.10.4  TCP 1464 [TCP segment of a reassembled PDU]  tcp.stream == 5
251   6.052493  172.20.10.4 -> 23.32.12.219 TCP 66 41848 > http [ACK] Seq=847 Ack=9787 Win=34944 Len=0 TSval=92686843 TSecr=2882443065  tcp.stream == 5
252   6.064462 23.32.12.219 -> 172.20.10.4  TCP 1464 [TCP segment of a reassembled PDU]  tcp.stream == 5
253   6.064481  172.20.10.4 -> 23.32.12.219 TCP 66 41848 > http [ACK] Seq=847 Ack=11185 Win=37888 Len=0 TSval=92686846 TSecr=2882443065  tcp.stream == 5
254   6.091838 23.32.12.219 -> 172.20.10.4  TCP 1464 [TCP segment of a reassembled PDU]  tcp.stream == 5
255   6.091855  172.20.10.4 -> 23.32.12.219 TCP 66 41848 > http [ACK] Seq=847 Ack=12583 Win=40704 Len=0 TSval=92686853 TSecr=2882443065  tcp.stream == 5
256   6.094589 23.32.12.219 -> 172.20.10.4  TCP 1464 [TCP segment of a reassembled PDU]  tcp.stream == 5
257   6.094608  172.20.10.4 -> 23.32.12.219 TCP 66 41848 > http [ACK] Seq=847 Ack=13981 Win=43648 Len=0 TSval=92686854 TSecr=2882443065  tcp.stream == 5
258   6.104215 23.32.12.219 -> 172.20.10.4  HTTP 530 HTTP/1.1 200 OK  (text/css)  tcp.stream == 5
259   6.104233  172.20.10.4 -> 23.32.12.219 TCP 66 41848 > http [ACK] Seq=847 Ack=14445 Win=46464 Len=0 TSval=92686856 TSecr=2882443090  tcp.stream == 5
260   6.104364  172.20.10.4 -> 23.32.12.219 HTTP 1060 GET /en-us/homepage/script.jsx?k=~/shared/templates/components/mscomViews/Controls/Scripts/jquery.bi.js;~/shared/templates/components/mscomViews/Controls/Scripts/jquery.bi.dataretrievers.attr.js;~/shared/templates/components/mscomViews/Controls/Scripts/jquery.bi.dataretrievers.structure.js;~/shared/templates/components/mscomViews/Controls/Scripts/jquery.bi.queue.js;~/shared/templates/components/mscomViews/controls/scripts/wedcs.js;~/shared/templates/components/mscomViews/Controls/Scripts/jquery.bi.dataconsumers.wedcs.js;~/shared/templates/components/mscomViews/Controls/Scripts/webtrends_16.js;~/shared/templates/components/mscomViews/Controls/Scripts/jquery.bi.dataconsumers.webtrends.js&v=-1065951950 HTTP/1.1   tcp.stream == 5
261   6.114456 23.32.12.219 -> 172.20.10.4  HTTP 1086 HTTP/1.1 200 OK  (text/css)  tcp.stream == 6
262   6.114477  172.20.10.4 -> 23.32.12.219 TCP 66 41849 > http [ACK] Seq=1099 Ack=6613 Win=29056 Len=0 TSval=92686859 TSecr=2882443090  tcp.stream == 6
263   6.114611  172.20.10.4 -> 23.32.12.219 HTTP 458 GET /en-us/homepage/bimapping.js?gv=BiMapping&k=/en-us/homepage/Components/BiMappingEN-US.xml&v=-577931044 HTTP/1.1   tcp.stream == 6
264   6.128464 23.32.12.219 -> 172.20.10.4  TCP 1464 [TCP segment of a reassembled PDU]  tcp.stream == 7
265   6.128487  172.20.10.4 -> 23.32.12.219 TCP 66 41850 > http [ACK] Seq=589 Ack=6991 Win=29184 Len=0 TSval=92686862 TSecr=2882443099  tcp.stream == 7
266   6.141959 23.32.12.219 -> 172.20.10.4  HTTP 717 HTTP/1.1 200 OK  (text/javascript)  tcp.stream == 7
267   6.141977  172.20.10.4 -> 23.32.12.219 TCP 66 41850 > http [ACK] Seq=589 Ack=7642 Win=32000 Len=0 TSval=92686866 TSecr=2882443099  tcp.stream == 7
268   6.142107  172.20.10.4 -> 23.32.12.219 HTTP 445 GET /global/en-us/homepage/PublishingImages/Header/XboxLogo.png HTTP/1.1   tcp.stream == 7
269   6.161977 23.32.12.219 -> 172.20.10.4  TCP 1464 [TCP segment of a reassembled PDU]  tcp.stream == 9
270   6.162020  172.20.10.4 -> 23.32.12.219 TCP 66 41852 > http [ACK] Seq=383 Ack=6991 Win=29184 Len=0 TSval=92686871 TSecr=2882443151  tcp.stream == 9
271   6.182087 23.32.12.219 -> 172.20.10.4  TCP 1464 [TCP segment of a reassembled PDU]  tcp.stream == 9
272   6.182102  172.20.10.4 -> 23.32.12.219 TCP 66 41852 > http [ACK] Seq=383 Ack=8389 Win=32000 Len=0 TSval=92686876 TSecr=2882443151  tcp.stream == 9
273   6.195464 23.32.12.219 -> 172.20.10.4  HTTP 724 HTTP/1.1 200 OK  (PNG)  tcp.stream == 9
274   6.195484  172.20.10.4 -> 23.32.12.219 TCP 66 41852 > http [ACK] Seq=383 Ack=9047 Win=34816 Len=0 TSval=92686879 TSecr=2882443151  tcp.stream == 9
275   6.195613  172.20.10.4 -> 23.32.12.219 HTTP 446 GET /global/en-us/homepage/PublishingImages/Header/PhoneLogo.png HTTP/1.1   tcp.stream == 9
276   6.228713 23.32.12.219 -> 172.20.10.4  TCP 1464 [TCP segment of a reassembled PDU]  tcp.stream == 8
277   6.228734  172.20.10.4 -> 23.32.12.219 TCP 66 41851 > http [ACK] Seq=624 Ack=6991 Win=29184 Len=0 TSval=92686887 TSecr=2882443159  tcp.stream == 8
278   6.241960 23.32.12.219 -> 172.20.10.4  TCP 1464 [TCP segment of a reassembled PDU]  tcp.stream == 8
279   6.241978  172.20.10.4 -> 23.32.12.219 TCP 66 41851 > http [ACK] Seq=624 Ack=8389 Win=32000 Len=0 TSval=92686891 TSecr=2882443159  tcp.stream == 8
280   6.255343 23.32.12.219 -> 172.20.10.4  TCP 1464 [TCP segment of a reassembled PDU]  tcp.stream == 8
281   6.255366  172.20.10.4 -> 23.32.12.219 TCP 66 41851 > http [ACK] Seq=624 Ack=9787 Win=34944 Len=0 TSval=92686894 TSecr=2882443164  tcp.stream == 8
282   6.296216 23.32.12.219 -> 172.20.10.4  TCP 1464 [TCP segment of a reassembled PDU]  tcp.stream == 8
283   6.296235  172.20.10.4 -> 23.32.12.219 TCP 66 41851 > http [ACK] Seq=624 Ack=11185 Win=37888 Len=0 TSval=92686904 TSecr=2882443164  tcp.stream == 8
284   6.299086 23.32.12.219 -> 172.20.10.4  TCP 1464 [TCP segment of a reassembled PDU]  tcp.stream == 8
285   6.299105  172.20.10.4 -> 23.32.12.219 TCP 66 41851 > http [ACK] Seq=624 Ack=12583 Win=40704 Len=0 TSval=92686905 TSecr=2882443164  tcp.stream == 8
286   6.301714 23.32.12.219 -> 172.20.10.4  TCP 1464 [TCP segment of a reassembled PDU]  tcp.stream == 8
287   6.301733  172.20.10.4 -> 23.32.12.219 TCP 66 41851 > http [ACK] Seq=624 Ack=13981 Win=43648 Len=0 TSval=92686905 TSecr=2882443164  tcp.stream == 8
288   6.311338 23.32.12.219 -> 172.20.10.4  TCP 1464 [TCP segment of a reassembled PDU]  tcp.stream == 8
289   6.311356  172.20.10.4 -> 23.32.12.219 TCP 66 41851 > http [ACK] Seq=624 Ack=15379 Win=46464 Len=0 TSval=92686908 TSecr=2882443232  tcp.stream == 8
290   6.328465 23.32.12.219 -> 172.20.10.4  TCP 1464 [TCP segment of a reassembled PDU]  tcp.stream == 8
291   6.328483  172.20.10.4 -> 23.32.12.219 TCP 66 41851 > http [ACK] Seq=624 Ack=16777 Win=49408 Len=0 TSval=92686912 TSecr=2882443232  tcp.stream == 8
292   6.342084 23.32.12.219 -> 172.20.10.4  TCP 1464 [TCP segment of a reassembled PDU]  tcp.stream == 10
293   6.342103  172.20.10.4 -> 23.32.12.219 TCP 66 41853 > http [ACK] Seq=382 Ack=6991 Win=29184 Len=0 TSval=92686916 TSecr=2882443232  tcp.stream == 10
294   6.348839 23.32.12.219 -> 172.20.10.4  HTTP 1134 HTTP/1.1 200 OK  (PNG)  tcp.stream == 10
295   6.348858  172.20.10.4 -> 23.32.12.219 TCP 66 41853 > http [ACK] Seq=382 Ack=8059 Win=32000 Len=0 TSval=92686917 TSecr=2882443232  tcp.stream == 10
296   6.348990  172.20.10.4 -> 23.32.12.219 HTTP 443 GET /global/en-us/homepage/PublishingImages/Header/IELogo.png HTTP/1.1   tcp.stream == 10
297   6.368586 23.32.12.219 -> 172.20.10.4  TCP 1464 [TCP segment of a reassembled PDU]  tcp.stream == 11
298   6.368606  172.20.10.4 -> 23.32.12.219 TCP 66 41854 > http [ACK] Seq=314 Ack=6991 Win=29184 Len=0 TSval=92686922 TSecr=2882443245  tcp.stream == 11
299   6.382084 23.32.12.219 -> 172.20.10.4  HTTP 1170 HTTP/1.1 200 OK  (application/x-javascript)  tcp.stream == 11
300   6.382101  172.20.10.4 -> 23.32.12.219 TCP 66 41854 > http [ACK] Seq=314 Ack=8095 Win=32000 Len=0 TSval=92686926 TSecr=2882443245  tcp.stream == 11
301   6.384460 192.221.100.126 -> 172.20.10.4  TCP 66 http > 50731 [ACK] Seq=1 Ack=303 Win=6912 Len=0 TSval=4008035322 TSecr=92686789  tcp.stream == 16
302   6.395335 70.37.129.152 -> 172.20.10.4  TCP 1464 [TCP segment of a reassembled PDU]  tcp.stream == 12
303   6.395353  172.20.10.4 -> 70.37.129.152 TCP 66 41703 > http [ACK] Seq=326 Ack=5593 Win=26240 Len=0 TSval=92686929 TSecr=755950065  tcp.stream == 12
304   6.398081 192.221.100.126 -> 172.20.10.4  TCP 66 [TCP Keep-Alive] http > 50731 [ACK] Seq=0 Ack=303 Win=6912 Len=0 TSval=4008035322 TSecr=92686789  tcp.stream == 16
305   6.398099  172.20.10.4 -> 192.221.100.126 TCP 66 [TCP Keep-Alive ACK] 50731 > http [ACK] Seq=303 Ack=1 Win=14720 Len=0 TSval=92686930 TSecr=4008035322  tcp.stream == 16
306   6.422087 192.221.100.126 -> 172.20.10.4  TCP 1464 [TCP segment of a reassembled PDU]  tcp.stream == 16
307   6.422104  172.20.10.4 -> 192.221.100.126 TCP 66 50731 > http [ACK] Seq=303 Ack=1399 Win=17536 Len=0 TSval=92686936 TSecr=4008035323  tcp.stream == 16
308   6.435337 192.221.100.126 -> 172.20.10.4  TCP 1464 [TCP segment of a reassembled PDU]  tcp.stream == 16
309   6.435357  172.20.10.4 -> 192.221.100.126 TCP 66 50731 > http [ACK] Seq=303 Ack=2797 Win=20480 Len=0 TSval=92686939 TSecr=4008035323  tcp.stream == 16
310   6.442714 70.37.129.152 -> 172.20.10.4  TCP 1464 [TCP segment of a reassembled PDU]  tcp.stream == 12
311   6.442733  172.20.10.4 -> 70.37.129.152 TCP 66 41703 > http [ACK] Seq=326 Ack=6991 Win=29184 Len=0 TSval=92686941 TSecr=755950074  tcp.stream == 12
312   6.455208 70.37.129.152 -> 172.20.10.4  TCP 1464 [TCP segment of a reassembled PDU]  tcp.stream == 12
313   6.455226  172.20.10.4 -> 70.37.129.152 TCP 66 41703 > http [ACK] Seq=326 Ack=8389 Win=32000 Len=0 TSval=92686944 TSecr=755950083  tcp.stream == 12
314   6.476210 70.37.129.152 -> 172.20.10.4  TCP 1464 [TCP segment of a reassembled PDU]  tcp.stream == 12
315   6.476230  172.20.10.4 -> 70.37.129.152 TCP 66 41703 > http [ACK] Seq=326 Ack=9787 Win=34944 Len=0 TSval=92686949 TSecr=755950092  tcp.stream == 12
316   6.488210 70.37.129.152 -> 172.20.10.4  TCP 1464 [TCP segment of a reassembled PDU]  tcp.stream == 12
317   6.488228  172.20.10.4 -> 70.37.129.152 TCP 66 41703 > http [ACK] Seq=326 Ack=11185 Win=37888 Len=0 TSval=92686952 TSecr=755950100  tcp.stream == 12
318   6.512588 70.37.129.152 -> 172.20.10.4  TCP 1464 [TCP segment of a reassembled PDU]  tcp.stream == 12
319   6.512606  172.20.10.4 -> 70.37.129.152 TCP 66 41703 > http [ACK] Seq=326 Ack=12583 Win=40704 Len=0 TSval=92686958 TSecr=755950100  tcp.stream == 12
320   6.514959 70.37.129.135 -> 172.20.10.4  TCP 74 http > 40295 [SYN, ACK] Seq=0 Ack=1 Win=65535 Len=0 MSS=1410 WS=16 SACK_PERM=1 TSval=568724775 TSecr=92686815  tcp.stream == 17
321   6.514990  172.20.10.4 -> 70.37.129.135 TCP 66 40295 > http [ACK] Seq=1 Ack=1 Win=14720 Len=0 TSval=92686959 TSecr=568724775  tcp.stream == 17
323   6.520769  172.20.10.4 -> 209.84.14.126 TCP 74 32867 > http [SYN] Seq=0 Win=14600 Len=0 MSS=1460 SACK_PERM=1 TSval=92686960 TSecr=0 WS=128  tcp.stream == 19
324   6.532586 70.37.129.152 -> 172.20.10.4  TCP 1464 [TCP segment of a reassembled PDU]  tcp.stream == 12
325   6.532606  172.20.10.4 -> 70.37.129.152 TCP 66 41703 > http [ACK] Seq=326 Ack=13981 Win=43648 Len=0 TSval=92686963 TSecr=755950108  tcp.stream == 12
326   6.546332 70.37.129.152 -> 172.20.10.4  TCP 1464 [TCP segment of a reassembled PDU]  tcp.stream == 12
