  1   0.000000 165.254.32.35 -> 172.20.10.4  TCP 54 http > 33030 [RST] Seq=1 Win=0 Len=0  tcp.stream == 0
  4   6.740822  172.20.10.4 -> 199.59.148.10 TCP 74 58437 > http [SYN] Seq=0 Win=14600 Len=0 MSS=1460 SACK_PERM=1 TSval=91767695 TSecr=0 WS=128  tcp.stream == 1
  5   6.898674 199.59.148.10 -> 172.20.10.4  TCP 74 http > 58437 [SYN, ACK] Seq=0 Ack=1 Win=5792 Len=0 MSS=1410 SACK_PERM=1 TSval=2920752407 TSecr=91767695 WS=256  tcp.stream == 1
  6   6.898706  172.20.10.4 -> 199.59.148.10 TCP 66 58437 > http [ACK] Seq=1 Ack=1 Win=14720 Len=0 TSval=91767735 TSecr=2920752407  tcp.stream == 1
  7   6.898785  172.20.10.4 -> 199.59.148.10 HTTP 359 GET / HTTP/1.1   tcp.stream == 1
  8   7.068682 199.59.148.10 -> 172.20.10.4  TCP 66 http > 58437 [ACK] Seq=1 Ack=294 Win=6912 Len=0 TSval=2920752582 TSecr=91767735  tcp.stream == 1
  9   7.109570 199.59.148.10 -> 172.20.10.4  TCP 1176 [TCP segment of a reassembled PDU]  tcp.stream == 1
 10   7.109588  172.20.10.4 -> 199.59.148.10 TCP 66 58437 > http [ACK] Seq=294 Ack=1111 Win=16896 Len=0 TSval=91767788 TSecr=2920752613  tcp.stream == 1
 11   7.122673 199.59.148.10 -> 172.20.10.4  TCP 1464 [TCP segment of a reassembled PDU]  tcp.stream == 1
 12   7.122699  172.20.10.4 -> 199.59.148.10 TCP 66 58437 > http [ACK] Seq=294 Ack=2509 Win=19840 Len=0 TSval=91767791 TSecr=2920752613  tcp.stream == 1
 13   7.131167 199.59.148.10 -> 172.20.10.4  TCP 1464 [TCP segment of a reassembled PDU]  tcp.stream == 1
 14   7.131186  172.20.10.4 -> 199.59.148.10 TCP 66 58437 > http [ACK] Seq=294 Ack=3907 Win=22656 Len=0 TSval=91767793 TSecr=2920752613  tcp.stream == 1
 15   7.142541 199.59.148.10 -> 172.20.10.4  TCP 1464 [TCP segment of a reassembled PDU]  tcp.stream == 1
 16   7.142562  172.20.10.4 -> 199.59.148.10 TCP 66 58437 > http [ACK] Seq=294 Ack=5305 Win=25600 Len=0 TSval=91767796 TSecr=2920752613  tcp.stream == 1
 20   7.156415 199.59.148.10 -> 172.20.10.4  TCP 1464 [TCP segment of a reassembled PDU]  tcp.stream == 1
 21   7.156435  172.20.10.4 -> 199.59.148.10 TCP 66 58437 > http [ACK] Seq=294 Ack=6703 Win=28416 Len=0 TSval=91767799 TSecr=2920752613  tcp.stream == 1
 22   7.165149  172.20.10.4 -> 199.59.148.10 TCP 74 58438 > http [SYN] Seq=0 Win=14600 Len=0 MSS=1460 SACK_PERM=1 TSval=91767801 TSecr=0 WS=128  tcp.stream == 2
 23   7.169418 199.59.148.10 -> 172.20.10.4  TCP 1464 [TCP segment of a reassembled PDU]  tcp.stream == 1
 24   7.169438  172.20.10.4 -> 199.59.148.10 TCP 66 58437 > http [ACK] Seq=294 Ack=8101 Win=31360 Len=0 TSval=91767803 TSecr=2920752613  tcp.stream == 1
 25   7.188570 199.59.148.10 -> 172.20.10.4  TCP 1268 [TCP segment of a reassembled PDU]  tcp.stream == 1
 26   7.188591  172.20.10.4 -> 199.59.148.10 TCP 66 58437 > http [ACK] Seq=294 Ack=9303 Win=34304 Len=0 TSval=91767807 TSecr=2920752613  tcp.stream == 1
 33   7.283572 199.59.148.10 -> 172.20.10.4  TCP 1464 [TCP segment of a reassembled PDU]  tcp.stream == 1
 34   7.283594  172.20.10.4 -> 199.59.148.10 TCP 66 58437 > http [ACK] Seq=294 Ack=10701 Win=37120 Len=0 TSval=91767831 TSecr=2920752773  tcp.stream == 1
 35   7.294417 199.59.148.10 -> 172.20.10.4  TCP 1464 [TCP segment of a reassembled PDU]  tcp.stream == 1
 36   7.294438  172.20.10.4 -> 199.59.148.10 TCP 66 58437 > http [ACK] Seq=294 Ack=12099 Win=40064 Len=0 TSval=91767834 TSecr=2920752773  tcp.stream == 1
 37   7.328415 199.59.148.10 -> 172.20.10.4  TCP 1464 [TCP segment of a reassembled PDU]  tcp.stream == 1
 38   7.328435  172.20.10.4 -> 199.59.148.10 TCP 66 58437 > http [ACK] Seq=294 Ack=13497 Win=43008 Len=0 TSval=91767842 TSecr=2920752773  tcp.stream == 1
 39   7.341943 199.59.148.10 -> 172.20.10.4  HTTP 1223 HTTP/1.1 200 OK  (text/html)  tcp.stream == 1
 40   7.341967  172.20.10.4 -> 199.59.148.10 TCP 66 58437 > http [ACK] Seq=294 Ack=14654 Win=45696 Len=0 TSval=91767846 TSecr=2920752773  tcp.stream == 1
 41   7.342155  172.20.10.4 -> 199.59.148.10 HTTP 656 GET /phoenix/favicon.ico HTTP/1.1   tcp.stream == 1
 43   7.368425  172.20.10.4 -> 165.254.32.10 TCP 74 48357 > http [SYN] Seq=0 Win=14600 Len=0 MSS=1460 SACK_PERM=1 TSval=91767852 TSecr=0 WS=128  tcp.stream == 3
 48   7.384653  172.20.10.4 -> 165.254.32.67 TCP 74 57258 > http [SYN] Seq=0 Win=14600 Len=0 MSS=1460 SACK_PERM=1 TSval=91767856 TSecr=0 WS=128  tcp.stream == 4
 49   7.388789 199.59.148.10 -> 172.20.10.4  TCP 74 http > 58438 [SYN, ACK] Seq=0 Ack=1 Win=5792 Len=0 MSS=1410 SACK_PERM=1 TSval=2920741767 TSecr=91767801 WS=256  tcp.stream == 2
 50   7.388817  172.20.10.4 -> 199.59.148.10 TCP 66 58438 > http [ACK] Seq=1 Ack=1 Win=14720 Len=0 TSval=91767857 TSecr=2920741767  tcp.stream == 2
 51   7.584931 165.254.32.10 -> 172.20.10.4  TCP 74 http > 48357 [SYN, ACK] Seq=0 Ack=1 Win=14480 Len=0 MSS=1410 SACK_PERM=1 TSval=2879427890 TSecr=91767852 WS=4  tcp.stream == 3
 52   7.584967  172.20.10.4 -> 165.254.32.10 TCP 66 48357 > http [ACK] Seq=1 Ack=1 Win=14720 Len=0 TSval=91767906 TSecr=2879427890  tcp.stream == 3
 53   7.585152  172.20.10.4 -> 165.254.32.10 HTTP 394 GET /a/1329497727/t1/css/t1_core_logged_out.bundle.css HTTP/1.1   tcp.stream == 3
 55   7.655442 199.59.148.10 -> 172.20.10.4  TCP 1464 [TCP segment of a reassembled PDU]  tcp.stream == 1
 56   7.657688 199.59.148.10 -> 172.20.10.4  HTTP 112 HTTP/1.1 200 OK  (image/x-icon)  tcp.stream == 1
 57   7.657707  172.20.10.4 -> 199.59.148.10 TCP 66 58437 > http [ACK] Seq=884 Ack=16098 Win=48640 Len=0 TSval=91767925 TSecr=2920753116  tcp.stream == 1
 60   7.671416 165.254.32.67 -> 172.20.10.4  TCP 74 http > 57258 [SYN, ACK] Seq=0 Ack=1 Win=14480 Len=0 MSS=1410 SACK_PERM=1 TSval=3486059969 TSecr=91767856 WS=4  tcp.stream == 4
 61   7.671450  172.20.10.4 -> 165.254.32.67 TCP 66 57258 > http [ACK] Seq=1 Ack=1 Win=14720 Len=0 TSval=91767928 TSecr=3486059969  tcp.stream == 4
 62   7.671533  172.20.10.4 -> 165.254.32.67 HTTP 383 GET /a/1329497727/t1/css/t1_more.bundle.css HTTP/1.1   tcp.stream == 4
 64   7.758293 165.254.32.10 -> 172.20.10.4  TCP 66 http > 48357 [ACK] Seq=1 Ack=329 Win=15552 Len=0 TSval=2879428059 TSecr=91767906  tcp.stream == 3
 65   7.816792 165.254.32.10 -> 172.20.10.4  TCP 1464 [TCP segment of a reassembled PDU]  tcp.stream == 3
 66   7.816811  172.20.10.4 -> 165.254.32.10 TCP 66 48357 > http [ACK] Seq=329 Ack=1399 Win=17536 Len=0 TSval=91767964 TSecr=2879428060  tcp.stream == 3
 67   7.836663 165.254.32.10 -> 172.20.10.4  TCP 1464 [TCP segment of a reassembled PDU]  tcp.stream == 3
 68   7.836680  172.20.10.4 -> 165.254.32.10 TCP 66 48357 > http [ACK] Seq=329 Ack=2797 Win=20480 Len=0 TSval=91767969 TSecr=2879428060  tcp.stream == 3
 69   7.850296 165.254.32.10 -> 172.20.10.4  TCP 1464 [TCP segment of a reassembled PDU]  tcp.stream == 3
 70   7.850324  172.20.10.4 -> 165.254.32.10 TCP 66 48357 > http [ACK] Seq=329 Ack=4195 Win=23296 Len=0 TSval=91767973 TSecr=2879428060  tcp.stream == 3
 71   7.871163 165.254.32.10 -> 172.20.10.4  TCP 1464 [TCP segment of a reassembled PDU]  tcp.stream == 3
 72   7.871183  172.20.10.4 -> 165.254.32.10 TCP 66 48357 > http [ACK] Seq=329 Ack=5593 Win=26240 Len=0 TSval=91767978 TSecr=2879428060  tcp.stream == 3
 76   7.878928 165.254.32.67 -> 172.20.10.4  TCP 66 http > 57258 [ACK] Seq=1 Ack=318 Win=15552 Len=0 TSval=3486060150 TSecr=91767928  tcp.stream == 4
 77   7.890541 165.254.32.67 -> 172.20.10.4  TCP 1464 [TCP segment of a reassembled PDU]  tcp.stream == 4
 78   7.890564  172.20.10.4 -> 165.254.32.67 TCP 66 57258 > http [ACK] Seq=318 Ack=1399 Win=17536 Len=0 TSval=91767983 TSecr=3486060150  tcp.stream == 4
 79   7.910192 165.254.32.67 -> 172.20.10.4  TCP 1464 [TCP segment of a reassembled PDU]  tcp.stream == 4
 80   7.910211  172.20.10.4 -> 165.254.32.67 TCP 66 57258 > http [ACK] Seq=318 Ack=2797 Win=20480 Len=0 TSval=91767988 TSecr=3486060150  tcp.stream == 4
 81   7.944191 165.254.32.67 -> 172.20.10.4  TCP 1464 [TCP segment of a reassembled PDU]  tcp.stream == 4
 82   7.944213  172.20.10.4 -> 165.254.32.67 TCP 66 57258 > http [ACK] Seq=318 Ack=4195 Win=23296 Len=0 TSval=91767996 TSecr=3486060150  tcp.stream == 4
 83   7.951044 165.254.32.67 -> 172.20.10.4  TCP 1464 [TCP segment of a reassembled PDU]  tcp.stream == 4
 84   7.951069  172.20.10.4 -> 165.254.32.67 TCP 66 57258 > http [ACK] Seq=318 Ack=5593 Win=26240 Len=0 TSval=91767998 TSecr=3486060150  tcp.stream == 4
 85   7.963564 165.254.32.10 -> 172.20.10.4  TCP 1464 [TCP segment of a reassembled PDU]  tcp.stream == 3
 86   7.963585  172.20.10.4 -> 165.254.32.10 TCP 66 48357 > http [ACK] Seq=329 Ack=6991 Win=29184 Len=0 TSval=91768001 TSecr=2879428205  tcp.stream == 3
 87   7.970442 165.254.32.10 -> 172.20.10.4  TCP 1464 [TCP segment of a reassembled PDU]  tcp.stream == 3
 88   7.970463  172.20.10.4 -> 165.254.32.10 TCP 66 48357 > http [ACK] Seq=329 Ack=8389 Win=32000 Len=0 TSval=91768003 TSecr=2879428205  tcp.stream == 3
 89   7.983687 165.254.32.10 -> 172.20.10.4  TCP 1464 [TCP segment of a reassembled PDU]  tcp.stream == 3
 90   7.983704  172.20.10.4 -> 165.254.32.10 TCP 66 48357 > http [ACK] Seq=329 Ack=9787 Win=34944 Len=0 TSval=91768006 TSecr=2879428232  tcp.stream == 3
 91   8.117044 165.254.32.10 -> 172.20.10.4  TCP 1464 [TCP segment of a reassembled PDU]  tcp.stream == 3
 92   8.117064  172.20.10.4 -> 165.254.32.10 TCP 66 48357 > http [ACK] Seq=329 Ack=11185 Win=37888 Len=0 TSval=91768039 TSecr=2879428232  tcp.stream == 3
 93   8.136913 165.254.32.10 -> 172.20.10.4  TCP 1464 [TCP segment of a reassembled PDU]  tcp.stream == 3
 94   8.136932  172.20.10.4 -> 165.254.32.10 TCP 66 48357 > http [ACK] Seq=329 Ack=12583 Win=40704 Len=0 TSval=91768044 TSecr=2879428239  tcp.stream == 3
 95   8.162565 165.254.32.10 -> 172.20.10.4  TCP 1464 [TCP segment of a reassembled PDU]  tcp.stream == 3
 96   8.162585  172.20.10.4 -> 165.254.32.10 TCP 66 48357 > http [ACK] Seq=329 Ack=13981 Win=43648 Len=0 TSval=91768051 TSecr=2879428264  tcp.stream == 3
 97   8.188939 165.254.32.10 -> 172.20.10.4  TCP 1464 [TCP segment of a reassembled PDU]  tcp.stream == 3
 98   8.188961  172.20.10.4 -> 165.254.32.10 TCP 66 48357 > http [ACK] Seq=329 Ack=15379 Win=46464 Len=0 TSval=91768057 TSecr=2879428264  tcp.stream == 3
 99   8.247294 165.254.32.10 -> 172.20.10.4  TCP 1464 [TCP segment of a reassembled PDU]  tcp.stream == 3
100   8.247319  172.20.10.4 -> 165.254.32.10 TCP 66 48357 > http [ACK] Seq=329 Ack=16777 Win=49408 Len=0 TSval=91768072 TSecr=2879428264  tcp.stream == 3
101   8.263438 165.254.32.67 -> 172.20.10.4  TCP 1464 [TCP segment of a reassembled PDU]  tcp.stream == 4
102   8.263458  172.20.10.4 -> 165.254.32.67 TCP 66 57258 > http [ACK] Seq=318 Ack=6991 Win=29184 Len=0 TSval=91768076 TSecr=3486060276  tcp.stream == 4
103   8.303541 165.254.32.67 -> 172.20.10.4  TCP 1464 [TCP segment of a reassembled PDU]  tcp.stream == 4
104   8.303563  172.20.10.4 -> 165.254.32.67 TCP 66 57258 > http [ACK] Seq=318 Ack=8389 Win=32000 Len=0 TSval=91768086 TSecr=3486060276  tcp.stream == 4
105   8.355921 165.254.32.67 -> 172.20.10.4  TCP 1464 [TCP segment of a reassembled PDU]  tcp.stream == 4
106   8.355946  172.20.10.4 -> 165.254.32.67 TCP 66 57258 > http [ACK] Seq=318 Ack=9787 Win=34944 Len=0 TSval=91768099 TSecr=3486060282  tcp.stream == 4
107   8.410066 165.254.32.67 -> 172.20.10.4  TCP 1464 [TCP segment of a reassembled PDU]  tcp.stream == 4
108   8.410087  172.20.10.4 -> 165.254.32.67 TCP 66 57258 > http [ACK] Seq=318 Ack=11185 Win=37888 Len=0 TSval=91768113 TSecr=3486060282  tcp.stream == 4
110   8.417956  172.20.10.4 -> 165.254.32.18 TCP 74 36475 > http [SYN] Seq=0 Win=14600 Len=0 MSS=1460 SACK_PERM=1 TSval=91768115 TSecr=0 WS=128  tcp.stream == 5
111   8.437054 165.254.32.67 -> 172.20.10.4  TCP 1464 [TCP segment of a reassembled PDU]  tcp.stream == 4
112   8.437071  172.20.10.4 -> 165.254.32.67 TCP 66 57258 > http [ACK] Seq=318 Ack=12583 Win=40704 Len=0 TSval=91768119 TSecr=3486060329  tcp.stream == 4
113   8.607194 165.254.32.67 -> 172.20.10.4  TCP 1464 [TCP segment of a reassembled PDU]  tcp.stream == 4
114   8.607219  172.20.10.4 -> 165.254.32.67 TCP 66 57258 > http [ACK] Seq=318 Ack=13981 Win=43648 Len=0 TSval=91768162 TSecr=3486060329  tcp.stream == 4
115   8.660563 165.254.32.67 -> 172.20.10.4  TCP 1464 [TCP segment of a reassembled PDU]  tcp.stream == 4
116   8.660586  172.20.10.4 -> 165.254.32.67 TCP 66 57258 > http [ACK] Seq=318 Ack=15379 Win=46464 Len=0 TSval=91768175 TSecr=3486060329  tcp.stream == 4
117   8.708437 165.254.32.67 -> 172.20.10.4  TCP 1464 [TCP segment of a reassembled PDU]  tcp.stream == 4
118   8.708458  172.20.10.4 -> 165.254.32.67 TCP 66 57258 > http [ACK] Seq=318 Ack=16777 Win=49408 Len=0 TSval=91768187 TSecr=3486060329  tcp.stream == 4
119   8.758439 165.254.32.10 -> 172.20.10.4  TCP 1464 [TCP segment of a reassembled PDU]  tcp.stream == 3
120   8.758460  172.20.10.4 -> 165.254.32.10 TCP 66 48357 > http [ACK] Seq=329 Ack=18175 Win=52352 Len=0 TSval=91768200 TSecr=2879428359  tcp.stream == 3
121   8.804812 165.254.32.10 -> 172.20.10.4  TCP 1464 [TCP segment of a reassembled PDU]  tcp.stream == 3
122   8.804834  172.20.10.4 -> 165.254.32.10 TCP 66 48357 > http [ACK] Seq=329 Ack=19573 Win=55168 Len=0 TSval=91768211 TSecr=2879428359  tcp.stream == 3
123   8.828686 165.254.32.10 -> 172.20.10.4  HTTP 712 HTTP/1.1 200 OK  (text/css)  tcp.stream == 3
124   8.828707  172.20.10.4 -> 165.254.32.10 TCP 66 48357 > http [ACK] Seq=329 Ack=20219 Win=57984 Len=0 TSval=91768217 TSecr=2879428359  tcp.stream == 3
125   8.877436 165.254.32.67 -> 172.20.10.4  TCP 1464 [TCP segment of a reassembled PDU]  tcp.stream == 4
126   8.877455  172.20.10.4 -> 165.254.32.67 TCP 66 57258 > http [ACK] Seq=318 Ack=18175 Win=52352 Len=0 TSval=91768230 TSecr=3486060682  tcp.stream == 4
127   8.919184 165.254.32.67 -> 172.20.10.4  TCP 1464 [TCP segment of a reassembled PDU]  tcp.stream == 4
128   8.919206  172.20.10.4 -> 165.254.32.67 TCP 66 57258 > http [ACK] Seq=318 Ack=19573 Win=55168 Len=0 TSval=91768240 TSecr=3486060682  tcp.stream == 4
129   8.943560 165.254.32.67 -> 172.20.10.4  TCP 1464 [TCP segment of a reassembled PDU]  tcp.stream == 4
130   8.943582  172.20.10.4 -> 165.254.32.67 TCP 66 57258 > http [ACK] Seq=318 Ack=20971 Win=58112 Len=0 TSval=91768246 TSecr=3486060768  tcp.stream == 4
131   8.963683 165.254.32.67 -> 172.20.10.4  TCP 1464 [TCP segment of a reassembled PDU]  tcp.stream == 4
132   8.963700  172.20.10.4 -> 165.254.32.67 TCP 66 57258 > http [ACK] Seq=318 Ack=22369 Win=61056 Len=0 TSval=91768251 TSecr=3486060768  tcp.stream == 4
133   9.314323 165.254.32.67 -> 172.20.10.4  HTTP 1103 HTTP/1.1 200 OK  (text/css)  tcp.stream == 4
134   9.314343  172.20.10.4 -> 165.254.32.67 TCP 66 57258 > http [ACK] Seq=318 Ack=23406 Win=63744 Len=0 TSval=91768339 TSecr=3486060768  tcp.stream == 4
135   9.316524 165.254.32.18 -> 172.20.10.4  TCP 74 http > 36475 [SYN, ACK] Seq=0 Ack=1 Win=14480 Len=0 MSS=1410 SACK_PERM=1 TSval=3551143733 TSecr=91768115 WS=4  tcp.stream == 5
136   9.316555  172.20.10.4 -> 165.254.32.18 TCP 66 36475 > http [ACK] Seq=1 Ack=1 Win=14720 Len=0 TSval=91768339 TSecr=3551143733  tcp.stream == 5
138   9.342925  172.20.10.4 -> 165.254.32.10 HTTP 367 GET /b/1/bundle/t1-core-en-201202170910.js HTTP/1.1   tcp.stream == 3
139   9.343017  172.20.10.4 -> 199.59.148.10 HTTP 739 GET /account/bootstrap_data?r=0.155901759489963 HTTP/1.1   tcp.stream == 1
140   9.343396  172.20.10.4 -> 199.59.149.200 TCP 74 46136 > http [SYN] Seq=0 Win=14600 Len=0 MSS=1460 SACK_PERM=1 TSval=91768346 TSecr=0 WS=128  tcp.stream == 6
141   9.377151  172.20.10.4 -> 165.254.32.10 TCP 74 48361 > http [SYN] Seq=0 Win=14600 Len=0 MSS=1460 SACK_PERM=1 TSval=91768354 TSecr=0 WS=128  tcp.stream == 7
142   9.377270  172.20.10.4 -> 165.254.32.10 TCP 74 48362 > http [SYN] Seq=0 Win=14600 Len=0 MSS=1460 SACK_PERM=1 TSval=91768354 TSecr=0 WS=128  tcp.stream == 8
143   9.377663  172.20.10.4 -> 165.254.32.10 TCP 74 48363 > http [SYN] Seq=0 Win=14600 Len=0 MSS=1460 SACK_PERM=1 TSval=91768354 TSecr=0 WS=128  tcp.stream == 9
148   9.662151 165.254.32.10 -> 172.20.10.4  TCP 1464 [TCP segment of a reassembled PDU]  tcp.stream == 3
149   9.662171  172.20.10.4 -> 165.254.32.10 TCP 66 48357 > http [ACK] Seq=630 Ack=21617 Win=60928 Len=0 TSval=91768426 TSecr=2879429952  tcp.stream == 3
150   9.675275 165.254.32.10 -> 172.20.10.4  TCP 1464 [TCP segment of a reassembled PDU]  tcp.stream == 3
151   9.675297  172.20.10.4 -> 165.254.32.10 TCP 66 48357 > http [ACK] Seq=630 Ack=23015 Win=63744 Len=0 TSval=91768429 TSecr=2879429952  tcp.stream == 3
152   9.682399 165.254.32.10 -> 172.20.10.4  TCP 1464 [TCP segment of a reassembled PDU]  tcp.stream == 3
153   9.682415  172.20.10.4 -> 165.254.32.10 TCP 66 48357 > http [ACK] Seq=630 Ack=24413 Win=64128 Len=0 TSval=91768431 TSecr=2879429952  tcp.stream == 3
154   9.697550 165.254.32.10 -> 172.20.10.4  TCP 1464 [TCP segment of a reassembled PDU]  tcp.stream == 3
155   9.697570  172.20.10.4 -> 165.254.32.10 TCP 66 48357 > http [ACK] Seq=630 Ack=25811 Win=64128 Len=0 TSval=91768435 TSecr=2879429952  tcp.stream == 3
156   9.710177 165.254.32.10 -> 172.20.10.4  TCP 1464 [TCP segment of a reassembled PDU]  tcp.stream == 3
157   9.710198  172.20.10.4 -> 165.254.32.10 TCP 66 48357 > http [ACK] Seq=630 Ack=27209 Win=64128 Len=0 TSval=91768438 TSecr=2879429952  tcp.stream == 3
158   9.717176 165.254.32.10 -> 172.20.10.4  TCP 1464 [TCP segment of a reassembled PDU]  tcp.stream == 3
159   9.717197  172.20.10.4 -> 165.254.32.10 TCP 66 48357 > http [ACK] Seq=630 Ack=28607 Win=64128 Len=0 TSval=91768439 TSecr=2879429952  tcp.stream == 3
160   9.737401 165.254.32.10 -> 172.20.10.4  TCP 1464 [TCP segment of a reassembled PDU]  tcp.stream == 3
161   9.737420  172.20.10.4 -> 165.254.32.10 TCP 66 48357 > http [ACK] Seq=630 Ack=30005 Win=64128 Len=0 TSval=91768445 TSecr=2879429952  tcp.stream == 3
162   9.768555 165.254.32.10 -> 172.20.10.4  TCP 1464 [TCP segment of a reassembled PDU]  tcp.stream == 3
163   9.768576  172.20.10.4 -> 165.254.32.10 TCP 66 48357 > http [ACK] Seq=630 Ack=31403 Win=64128 Len=0 TSval=91768452 TSecr=2879429952  tcp.stream == 3
164   9.861436  172.20.10.4 -> 199.59.148.10 HTTP 739 [TCP Retransmission] GET /account/bootstrap_data?r=0.155901759489963 HTTP/1.1   tcp.stream == 1
165   9.990433 165.254.32.10 -> 172.20.10.4  TCP 1464 [TCP segment of a reassembled PDU]  tcp.stream == 3
166   9.990459  172.20.10.4 -> 165.254.32.10 TCP 66 48357 > http [ACK] Seq=630 Ack=32801 Win=64128 Len=0 TSval=91768508 TSecr=2879429952  tcp.stream == 3
167  10.030552 165.254.32.10 -> 172.20.10.4  TCP 1464 [TCP segment of a reassembled PDU]  tcp.stream == 3
168  10.030574  172.20.10.4 -> 165.254.32.10 TCP 66 48357 > http [ACK] Seq=630 Ack=34199 Win=64128 Len=0 TSval=91768518 TSecr=2879429952  tcp.stream == 3
169  10.050301 165.254.32.10 -> 172.20.10.4  TCP 1464 [TCP segment of a reassembled PDU]  tcp.stream == 3
170  10.050320  172.20.10.4 -> 165.254.32.10 TCP 66 48357 > http [ACK] Seq=630 Ack=35597 Win=64128 Len=0 TSval=91768523 TSecr=2879429952  tcp.stream == 3
171  10.163930 165.254.32.10 -> 172.20.10.4  TCP 1464 [TCP segment of a reassembled PDU]  tcp.stream == 3
172  10.163950  172.20.10.4 -> 165.254.32.10 TCP 66 48357 > http [ACK] Seq=630 Ack=36995 Win=64128 Len=0 TSval=91768551 TSecr=2879429952  tcp.stream == 3
173  10.166301 165.254.32.10 -> 172.20.10.4  TCP 74 http > 48361 [SYN, ACK] Seq=0 Ack=1 Win=14480 Len=0 MSS=1410 SACK_PERM=1 TSval=2879430465 TSecr=91768354 WS=4  tcp.stream == 7
174  10.166327  172.20.10.4 -> 165.254.32.10 TCP 66 48361 > http [ACK] Seq=1 Ack=1 Win=14720 Len=0 TSval=91768552 TSecr=2879430465  tcp.stream == 7
175  10.166510  172.20.10.4 -> 165.254.32.10 HTTP 456 GET /a/1329497727/t1/img/twitter_web_sprite_bgs.png HTTP/1.1   tcp.stream == 7
176  10.166513 165.254.32.10 -> 172.20.10.4  TCP 74 http > 48362 [SYN, ACK] Seq=0 Ack=1 Win=14480 Len=0 MSS=1410 SACK_PERM=1 TSval=2879430470 TSecr=91768354 WS=4  tcp.stream == 8
177  10.166906  172.20.10.4 -> 165.254.32.10 TCP 66 48362 > http [ACK] Seq=1 Ack=1 Win=14720 Len=0 TSval=91768552 TSecr=2879430470  tcp.stream == 8
178  10.167288  172.20.10.4 -> 165.254.32.10 HTTP 454 GET /a/1329497727/t1/img/twitter_logo_top_bar.png HTTP/1.1   tcp.stream == 8
179  10.196925 199.59.148.10 -> 172.20.10.4  TCP 1464 [TCP segment of a reassembled PDU]  tcp.stream == 1
180  10.210051 199.59.148.10 -> 172.20.10.4  TCP 1464 [TCP segment of a reassembled PDU]  tcp.stream == 1
181  10.210072  172.20.10.4 -> 199.59.148.10 TCP 66 58437 > http [ACK] Seq=1557 Ack=18894 Win=54400 Len=0 TSval=91768563 TSecr=2920755681  tcp.stream == 1
182  10.236648 199.59.148.10 -> 172.20.10.4  TCP 1464 [TCP segment of a reassembled PDU]  tcp.stream == 1
183  10.277428  172.20.10.4 -> 199.59.148.10 TCP 66 58437 > http [ACK] Seq=1557 Ack=20292 Win=57344 Len=0 TSval=91768580 TSecr=2920755681  tcp.stream == 1
184  10.352048 199.59.148.10 -> 172.20.10.4  HTTP 351 HTTP/1.1 200 OK  (application/json)  tcp.stream == 1
185  10.352066  172.20.10.4 -> 199.59.148.10 TCP 66 58437 > http [ACK] Seq=1557 Ack=20577 Win=60160 Len=0 TSval=91768598 TSecr=2920755681  tcp.stream == 1
186  10.354396 199.59.149.200 -> 172.20.10.4  TCP 74 http > 46136 [SYN, ACK] Seq=0 Ack=1 Win=5792 Len=0 MSS=1410 SACK_PERM=1 TSval=3436909447 TSecr=91768346 WS=256  tcp.stream == 6
187  10.354432  172.20.10.4 -> 199.59.149.200 TCP 66 46136 > http [ACK] Seq=1 Ack=1 Win=14720 Len=0 TSval=91768599 TSecr=3436909447  tcp.stream == 6
188  10.354633  172.20.10.4 -> 199.59.149.200 HTTP 714 GET /receiver.html HTTP/1.1   tcp.stream == 6
189  10.354888 165.254.32.10 -> 172.20.10.4  TCP 74 http > 48363 [SYN, ACK] Seq=0 Ack=1 Win=14480 Len=0 MSS=1410 SACK_PERM=1 TSval=2879430517 TSecr=91768354 WS=4  tcp.stream == 9
190  10.354911  172.20.10.4 -> 165.254.32.10 TCP 66 48363 > http [ACK] Seq=1 Ack=1 Win=14720 Len=0 TSval=91768599 TSecr=2879430517  tcp.stream == 9
191  10.355133  172.20.10.4 -> 165.254.32.10 HTTP 452 GET /a/1329497727/t1/img/front_page/cricket.jpg HTTP/1.1   tcp.stream == 9
193  10.369261  172.20.10.4 -> 199.59.148.84 TCP 74 33183 > http [SYN] Seq=0 Win=14600 Len=0 MSS=1460 SACK_PERM=1 TSval=91768602 TSecr=0 WS=128  tcp.stream == 10
195  10.372047  172.20.10.4 -> 199.59.149.232 TCP 74 50091 > http [SYN] Seq=0 Win=14600 Len=0 MSS=1460 SACK_PERM=1 TSval=91768603 TSecr=0 WS=128  tcp.stream == 11
196  10.372512 165.254.32.10 -> 172.20.10.4  TCP 74 http > 48361 [SYN, ACK] Seq=0 Ack=1 Win=14480 Len=0 MSS=1410 SACK_PERM=1 TSval=2879430621 TSecr=91768354 WS=4  tcp.stream == 7
197  10.372528  172.20.10.4 -> 165.254.32.10 TCP 78 [TCP Dup ACK 175#1] 48361 > http [ACK] Seq=391 Ack=1 Win=14720 Len=0 TSval=91768603 TSecr=2879430621 SLE=0 SRE=1  tcp.stream == 7
198  10.372632 165.254.32.10 -> 172.20.10.4  TCP 74 http > 48362 [SYN, ACK] Seq=0 Ack=1 Win=14480 Len=0 MSS=1410 SACK_PERM=1 TSval=2879430621 TSecr=91768354 WS=4  tcp.stream == 8
199  10.372639  172.20.10.4 -> 165.254.32.10 TCP 78 [TCP Dup ACK 178#1] 48362 > http [ACK] Seq=389 Ack=1 Win=14720 Len=0 TSval=91768603 TSecr=2879430621 SLE=0 SRE=1  tcp.stream == 8
202  10.421892 165.254.32.10 -> 172.20.10.4  TCP 1464 [TCP segment of a reassembled PDU]  tcp.stream == 3
203  10.421911  172.20.10.4 -> 165.254.32.10 TCP 66 48357 > http [ACK] Seq=630 Ack=38393 Win=64128 Len=0 TSval=91768616 TSecr=2879430690  tcp.stream == 3
204  10.435295 165.254.32.10 -> 172.20.10.4  TCP 1464 [TCP segment of a reassembled PDU]  tcp.stream == 3
205  10.435314  172.20.10.4 -> 165.254.32.10 TCP 66 48357 > http [ACK] Seq=630 Ack=39791 Win=64128 Len=0 TSval=91768619 TSecr=2879430690  tcp.stream == 3
206  10.471522 165.254.32.10 -> 172.20.10.4  TCP 1464 [TCP segment of a reassembled PDU]  tcp.stream == 3
207  10.471543  172.20.10.4 -> 165.254.32.10 TCP 66 48357 > http [ACK] Seq=630 Ack=41189 Win=64128 Len=0 TSval=91768628 TSecr=2879430690  tcp.stream == 3
208  10.500816 165.254.32.10 -> 172.20.10.4  TCP 1464 [TCP segment of a reassembled PDU]  tcp.stream == 3
209  10.500835  172.20.10.4 -> 165.254.32.10 TCP 66 48357 > http [ACK] Seq=630 Ack=42587 Win=64128 Len=0 TSval=91768635 TSecr=2879430690  tcp.stream == 3
210  10.520520 165.254.32.10 -> 172.20.10.4  TCP 1464 [TCP segment of a reassembled PDU]  tcp.stream == 3
211  10.520540  172.20.10.4 -> 165.254.32.10 TCP 66 48357 > http [ACK] Seq=630 Ack=43985 Win=64128 Len=0 TSval=91768640 TSecr=2879430741  tcp.stream == 3
212  10.527425 165.254.32.10 -> 172.20.10.4  TCP 1464 [TCP segment of a reassembled PDU]  tcp.stream == 3
213  10.527447  172.20.10.4 -> 165.254.32.10 TCP 66 48357 > http [ACK] Seq=630 Ack=45383 Win=64128 Len=0 TSval=91768642 TSecr=2879430741  tcp.stream == 3
214  10.575302 165.254.32.10 -> 172.20.10.4  TCP 1464 [TCP segment of a reassembled PDU]  tcp.stream == 3
215  10.575323  172.20.10.4 -> 165.254.32.10 TCP 66 48357 > http [ACK] Seq=630 Ack=46781 Win=64128 Len=0 TSval=91768654 TSecr=2879430741  tcp.stream == 3
216  10.596674 165.254.32.10 -> 172.20.10.4  TCP 1464 [TCP segment of a reassembled PDU]  tcp.stream == 3
217  10.614298 165.254.32.10 -> 172.20.10.4  TCP 1464 [TCP segment of a reassembled PDU]  tcp.stream == 3
218  10.614316  172.20.10.4 -> 165.254.32.10 TCP 66 48357 > http [ACK] Seq=630 Ack=49577 Win=64128 Len=0 TSval=91768664 TSecr=2879430741  tcp.stream == 3
220  10.627923 165.254.32.10 -> 172.20.10.4  TCP 1464 [TCP segment of a reassembled PDU]  tcp.stream == 3
221  10.665427  172.20.10.4 -> 165.254.32.10 TCP 66 48357 > http [ACK] Seq=630 Ack=50975 Win=64128 Len=0 TSval=91768677 TSecr=2879430741  tcp.stream == 3
222  10.668795 165.254.32.10 -> 172.20.10.4  TCP 1464 [TCP segment of a reassembled PDU]  tcp.stream == 3
223  10.683267 165.254.32.10 -> 172.20.10.4  TCP 1464 [TCP segment of a reassembled PDU]  tcp.stream == 3
224  10.683286  172.20.10.4 -> 165.254.32.10 TCP 66 48357 > http [ACK] Seq=630 Ack=53771 Win=64128 Len=0 TSval=91768681 TSecr=2879430810  tcp.stream == 3
225  10.720777 165.254.32.10 -> 172.20.10.4  TCP 1464 [TCP segment of a reassembled PDU]  tcp.stream == 3
226  10.743394 165.254.32.10 -> 172.20.10.4  TCP 1464 [TCP segment of a reassembled PDU]  tcp.stream == 3
227  10.743415  172.20.10.4 -> 165.254.32.10 TCP 66 48357 > http [ACK] Seq=630 Ack=56567 Win=64128 Len=0 TSval=91768696 TSecr=2879430810  tcp.stream == 3
228  10.746263 165.254.32.10 -> 172.20.10.4  TCP 74 http > 48363 [SYN, ACK] Seq=0 Ack=1 Win=14480 Len=0 MSS=1410 SACK_PERM=1 TSval=2879430821 TSecr=91768354 WS=4  tcp.stream == 9
229  10.746282  172.20.10.4 -> 165.254.32.10 TCP 78 [TCP Dup ACK 191#1] 48363 > http [ACK] Seq=387 Ack=1 Win=14720 Len=0 TSval=91768697 TSecr=2879430821 SLE=0 SRE=1  tcp.stream == 9
230  10.768646 199.59.148.10 -> 172.20.10.4  TCP 1464 [TCP Retransmission] http > 58437 [ACK] Seq=16098 Ack=1557 Win=9472 Len=1398 TSval=2920756176 TSecr=91768346  tcp.stream == 1
231  10.768666  172.20.10.4 -> 199.59.148.10 TCP 78 [TCP Dup ACK 185#1] 58437 > http [ACK] Seq=1557 Ack=20577 Win=60160 Len=0 TSval=91768702 TSecr=2920755681 SLE=16098 SRE=17496  tcp.stream == 1
232  10.801139 165.254.32.10 -> 172.20.10.4  TCP 1464 [TCP segment of a reassembled PDU]  tcp.stream == 3
233  10.820546 165.254.32.10 -> 172.20.10.4  TCP 1464 [TCP segment of a reassembled PDU]  tcp.stream == 3
234  10.820567  172.20.10.4 -> 165.254.32.10 TCP 66 48357 > http [ACK] Seq=630 Ack=59363 Win=64128 Len=0 TSval=91768715 TSecr=2879431011  tcp.stream == 3
235  10.843298 165.254.32.10 -> 172.20.10.4  TCP 1464 [TCP segment of a reassembled PDU]  tcp.stream == 3
236  10.849793 165.254.32.10 -> 172.20.10.4  TCP 1464 [TCP segment of a reassembled PDU]  tcp.stream == 3
237  10.849814  172.20.10.4 -> 165.254.32.10 TCP 66 48357 > http [ACK] Seq=630 Ack=62159 Win=64128 Len=0 TSval=91768723 TSecr=2879431011  tcp.stream == 3
238  10.869794 165.254.32.10 -> 172.20.10.4  TCP 1464 [TCP segment of a reassembled PDU]  tcp.stream == 3
239  10.909425  172.20.10.4 -> 165.254.32.10 TCP 66 48357 > http [ACK] Seq=630 Ack=63557 Win=64128 Len=0 TSval=91768738 TSecr=2879431016  tcp.stream == 3
240  10.931546 165.254.32.10 -> 172.20.10.4  TCP 1464 [TCP segment of a reassembled PDU]  tcp.stream == 3
241  10.939438 165.254.32.10 -> 172.20.10.4  TCP 1464 [TCP segment of a reassembled PDU]  tcp.stream == 3
242  10.939472  172.20.10.4 -> 165.254.32.10 TCP 66 48357 > http [ACK] Seq=630 Ack=66353 Win=64128 Len=0 TSval=91768745 TSecr=2879431016  tcp.stream == 3
243  10.953794 165.254.32.10 -> 172.20.10.4  TCP 1464 [TCP segment of a reassembled PDU]  tcp.stream == 3
244  10.967294 165.254.32.10 -> 172.20.10.4  TCP 1464 [TCP segment of a reassembled PDU]  tcp.stream == 3
245  10.967315  172.20.10.4 -> 165.254.32.10 TCP 66 48357 > http [ACK] Seq=630 Ack=69149 Win=64128 Len=0 TSval=91768752 TSecr=2879431024  tcp.stream == 3
246  10.990037 165.254.32.10 -> 172.20.10.4  TCP 1464 [TCP segment of a reassembled PDU]  tcp.stream == 3
247  10.992659 199.59.148.10 -> 172.20.10.4  TCP 78 [TCP Dup ACK 230#1] http > 58437 [ACK] Seq=20577 Ack=1557 Win=9472 Len=0 TSval=2920756253 TSecr=91768476 SLE=884 SRE=1557  tcp.stream == 1
248  10.992876 165.254.32.10 -> 172.20.10.4  TCP 66 http > 48361 [ACK] Seq=1 Ack=391 Win=15552 Len=0 TSval=2879431250 TSecr=91768552  tcp.stream == 7
249  11.013424 165.254.32.10 -> 172.20.10.4  TCP 1464 [TCP segment of a reassembled PDU]  tcp.stream == 7
250  11.013444  172.20.10.4 -> 165.254.32.10 TCP 66 48361 > http [ACK] Seq=391 Ack=1399 Win=17536 Len=0 TSval=91768764 TSecr=2879431250  tcp.stream == 7
251  11.020170 165.254.32.10 -> 172.20.10.4  TCP 1464 [TCP segment of a reassembled PDU]  tcp.stream == 7
252  11.020190  172.20.10.4 -> 165.254.32.10 TCP 66 48361 > http [ACK] Seq=391 Ack=2797 Win=20480 Len=0 TSval=91768765 TSecr=2879431250  tcp.stream == 7
253  11.033428  172.20.10.4 -> 165.254.32.10 TCP 66 48357 > http [ACK] Seq=630 Ack=70547 Win=64128 Len=0 TSval=91768769 TSecr=2879431024  tcp.stream == 3
254  11.043295 165.254.32.10 -> 172.20.10.4  TCP 1464 [TCP segment of a reassembled PDU]  tcp.stream == 7
255  11.043316  172.20.10.4 -> 165.254.32.10 TCP 66 48361 > http [ACK] Seq=391 Ack=4195 Win=23296 Len=0 TSval=91768771 TSecr=2879431250  tcp.stream == 7
256  11.050420 165.254.32.10 -> 172.20.10.4  TCP 1464 [TCP segment of a reassembled PDU]  tcp.stream == 7
257  11.050441  172.20.10.4 -> 165.254.32.10 TCP 66 48361 > http [ACK] Seq=391 Ack=5593 Win=26240 Len=0 TSval=91768773 TSecr=2879431250  tcp.stream == 7
258  11.353179 165.254.32.10 -> 172.20.10.4  TCP 66 http > 48362 [ACK] Seq=1 Ack=389 Win=15552 Len=0 TSval=2879431663 TSecr=91768552  tcp.stream == 8
259  11.391543 165.254.32.10 -> 172.20.10.4  TCP 1464 [TCP segment of a reassembled PDU]  tcp.stream == 8
260  11.391563  172.20.10.4 -> 165.254.32.10 TCP 66 48362 > http [ACK] Seq=389 Ack=1399 Win=17536 Len=0 TSval=91768858 TSecr=2879431664  tcp.stream == 8
261  11.399293 165.254.32.10 -> 172.20.10.4  HTTP 806 HTTP/1.1 200 OK  (PNG)  tcp.stream == 8
262  11.399315  172.20.10.4 -> 165.254.32.10 TCP 66 48362 > http [ACK] Seq=389 Ack=2139 Win=20352 Len=0 TSval=91768860 TSecr=2879431664  tcp.stream == 8
263  11.881917 199.59.149.200 -> 172.20.10.4  TCP 66 http > 46136 [ACK] Seq=1 Ack=649 Win=5632 Len=0 TSval=3436911228 TSecr=91768599  tcp.stream == 6
264  11.888641 199.59.149.200 -> 172.20.10.4  HTTP 521 HTTP/1.1 200 OK  (text/html)  tcp.stream == 6
265  11.888666  172.20.10.4 -> 199.59.149.200 TCP 66 46136 > http [ACK] Seq=649 Ack=456 Win=15744 Len=0 TSval=91768982 TSecr=3436911230  tcp.stream == 6
266  11.904642 165.254.32.10 -> 172.20.10.4  TCP 66 http > 48363 [ACK] Seq=1 Ack=387 Win=15552 Len=0 TSval=2879432212 TSecr=91768599  tcp.stream == 9
267  11.924884 165.254.32.10 -> 172.20.10.4  TCP 1464 [TCP segment of a reassembled PDU]  tcp.stream == 9
268  11.924899  172.20.10.4 -> 165.254.32.10 TCP 66 48363 > http [ACK] Seq=387 Ack=1399 Win=17536 Len=0 TSval=91768991 TSecr=2879432214  tcp.stream == 9
269  11.932516 165.254.32.10 -> 172.20.10.4  TCP 1464 [TCP segment of a reassembled PDU]  tcp.stream == 9
270  11.932541  172.20.10.4 -> 165.254.32.10 TCP 66 48363 > http [ACK] Seq=387 Ack=2797 Win=20480 Len=0 TSval=91768993 TSecr=2879432214  tcp.stream == 9
271  11.939637 165.254.32.10 -> 172.20.10.4  TCP 1464 [TCP segment of a reassembled PDU]  tcp.stream == 9
272  11.939659  172.20.10.4 -> 165.254.32.10 TCP 66 48363 > http [ACK] Seq=387 Ack=4195 Win=23296 Len=0 TSval=91768995 TSecr=2879432214  tcp.stream == 9
273  11.958135 165.254.32.10 -> 172.20.10.4  TCP 1464 [TCP segment of a reassembled PDU]  tcp.stream == 9
274  11.958153  172.20.10.4 -> 165.254.32.10 TCP 66 48363 > http [ACK] Seq=387 Ack=5593 Win=26240 Len=0 TSval=91769000 TSecr=2879432214  tcp.stream == 9
275  11.981286 199.59.148.84 -> 172.20.10.4  TCP 74 http > 33183 [SYN, ACK] Seq=0 Ack=1 Win=5792 Len=0 MSS=1410 SACK_PERM=1 TSval=2550654146 TSecr=91768602 WS=256  tcp.stream == 10
276  11.981318  172.20.10.4 -> 199.59.148.84 TCP 66 33183 > http [ACK] Seq=1 Ack=1 Win=14720 Len=0 TSval=91769005 TSecr=2550654146  tcp.stream == 10
277  11.981498  172.20.10.4 -> 199.59.148.84 HTTP 815 GET /scribe?category=client_event&log=%7B%22context%22%3A%22front%22%2C%22event_name%22%3A%22web%3Afront%3A%3A%3Aimpression%22%7D&ts=1329845986808 HTTP/1.1   tcp.stream == 10
278  12.068668 199.59.149.232 -> 172.20.10.4  TCP 74 http > 50091 [SYN, ACK] Seq=0 Ack=1 Win=5792 Len=0 MSS=1410 SACK_PERM=1 TSval=1089535367 TSecr=91768603 WS=256  tcp.stream == 11
279  12.068701  172.20.10.4 -> 199.59.149.232 TCP 66 50091 > http [ACK] Seq=1 Ack=1 Win=14720 Len=0 TSval=91769027 TSecr=1089535367  tcp.stream == 11
281  12.071194  172.20.10.4 -> 165.254.32.10 TCP 74 48366 > http [SYN] Seq=0 Win=14600 Len=0 MSS=1460 SACK_PERM=1 TSval=91769028 TSecr=0 WS=128  tcp.stream == 12
282  12.071376  172.20.10.4 -> 165.254.32.10 TCP 74 48367 > http [SYN] Seq=0 Win=14600 Len=0 MSS=1460 SACK_PERM=1 TSval=91769028 TSecr=0 WS=128  tcp.stream == 13
283  12.071627  172.20.10.4 -> 165.254.32.10 TCP 74 48368 > http [SYN] Seq=0 Win=14600 Len=0 MSS=1460 SACK_PERM=1 TSval=91769028 TSecr=0 WS=128  tcp.stream == 14
284  12.086516 165.254.32.10 -> 172.20.10.4  TCP 1464 [TCP segment of a reassembled PDU]  tcp.stream == 3
285  12.086543  172.20.10.4 -> 165.254.32.10 TCP 66 48357 > http [ACK] Seq=630 Ack=71945 Win=64128 Len=0 TSval=91769032 TSecr=2879432372  tcp.stream == 3
286  12.090664 165.254.32.10 -> 172.20.10.4  TCP 1464 [TCP segment of a reassembled PDU]  tcp.stream == 3
287  12.090684  172.20.10.4 -> 165.254.32.10 TCP 66 48357 > http [ACK] Seq=630 Ack=73343 Win=64128 Len=0 TSval=91769033 TSecr=2879432372  tcp.stream == 3
288  12.103506 165.254.32.10 -> 172.20.10.4  TCP 1464 [TCP segment of a reassembled PDU]  tcp.stream == 3
289  12.103524  172.20.10.4 -> 165.254.32.10 TCP 66 48357 > http [ACK] Seq=630 Ack=74741 Win=64128 Len=0 TSval=91769036 TSecr=2879432372  tcp.stream == 3
290  12.123260 165.254.32.10 -> 172.20.10.4  TCP 1464 [TCP segment of a reassembled PDU]  tcp.stream == 3
291  12.123281  172.20.10.4 -> 165.254.32.10 TCP 66 48357 > http [ACK] Seq=630 Ack=76139 Win=64128 Len=0 TSval=91769041 TSecr=2879432372  tcp.stream == 3
292  12.148413 165.254.32.10 -> 172.20.10.4  TCP 1464 [TCP segment of a reassembled PDU]  tcp.stream == 3
293  12.148435  172.20.10.4 -> 165.254.32.10 TCP 66 48357 > http [ACK] Seq=630 Ack=77537 Win=64128 Len=0 TSval=91769047 TSecr=2879432403  tcp.stream == 3
294  12.164913 165.254.32.10 -> 172.20.10.4  TCP 1464 [TCP segment of a reassembled PDU]  tcp.stream == 3
295  12.164934  172.20.10.4 -> 165.254.32.10 TCP 66 48357 > http [ACK] Seq=630 Ack=78935 Win=67072 Len=0 TSval=91769051 TSecr=2879432403  tcp.stream == 3
296  12.180787 165.254.32.10 -> 172.20.10.4  TCP 1464 [TCP segment of a reassembled PDU]  tcp.stream == 3
297  12.180808  172.20.10.4 -> 165.254.32.10 TCP 66 48357 > http [ACK] Seq=630 Ack=80333 Win=69888 Len=0 TSval=91769055 TSecr=2879432403  tcp.stream == 3
298  12.183662 165.254.32.10 -> 172.20.10.4  TCP 1464 [TCP segment of a reassembled PDU]  tcp.stream == 3
299  12.183683  172.20.10.4 -> 165.254.32.10 TCP 66 48357 > http [ACK] Seq=630 Ack=81731 Win=72832 Len=0 TSval=91769056 TSecr=2879432403  tcp.stream == 3
300  12.195538 165.254.32.10 -> 172.20.10.4  TCP 1464 [TCP segment of a reassembled PDU]  tcp.stream == 3
301  12.195559  172.20.10.4 -> 165.254.32.10 TCP 66 48357 > http [ACK] Seq=630 Ack=83129 Win=75776 Len=0 TSval=91769059 TSecr=2879432451  tcp.stream == 3
302  12.203008 165.254.32.10 -> 172.20.10.4  TCP 1464 [TCP segment of a reassembled PDU]  tcp.stream == 3
303  12.203027  172.20.10.4 -> 165.254.32.10 TCP 66 48357 > http [ACK] Seq=630 Ack=84527 Win=78336 Len=0 TSval=91769061 TSecr=2879432451  tcp.stream == 3
304  12.210786 165.254.32.10 -> 172.20.10.4  TCP 1464 [TCP segment of a reassembled PDU]  tcp.stream == 3
305  12.210806  172.20.10.4 -> 165.254.32.10 TCP 66 48357 > http [ACK] Seq=630 Ack=85925 Win=78336 Len=0 TSval=91769063 TSecr=2879432451  tcp.stream == 3
306  12.221793 165.254.32.10 -> 172.20.10.4  TCP 1464 [TCP segment of a reassembled PDU]  tcp.stream == 3
307  12.221829  172.20.10.4 -> 165.254.32.10 TCP 66 48357 > http [ACK] Seq=630 Ack=87323 Win=78336 Len=0 TSval=91769066 TSecr=2879432451  tcp.stream == 3
308  12.224538 165.254.32.10 -> 172.20.10.4  TCP 1464 [TCP segment of a reassembled PDU]  tcp.stream == 3
309  12.224559  172.20.10.4 -> 165.254.32.10 TCP 66 48357 > http [ACK] Seq=630 Ack=88721 Win=78336 Len=0 TSval=91769066 TSecr=2879432451  tcp.stream == 3
310  12.236257 165.254.32.10 -> 172.20.10.4  TCP 1464 [TCP segment of a reassembled PDU]  tcp.stream == 3
311  12.236278  172.20.10.4 -> 165.254.32.10 TCP 66 48357 > http [ACK] Seq=630 Ack=90119 Win=78336 Len=0 TSval=91769069 TSecr=2879432451  tcp.stream == 3
312  12.243136 165.254.32.10 -> 172.20.10.4  TCP 1464 [TCP segment of a reassembled PDU]  tcp.stream == 3
313  12.243157  172.20.10.4 -> 165.254.32.10 TCP 66 48357 > http [ACK] Seq=630 Ack=91517 Win=78336 Len=0 TSval=91769071 TSecr=2879432451  tcp.stream == 3
314  12.250136 165.254.32.10 -> 172.20.10.4  TCP 1464 [TCP segment of a reassembled PDU]  tcp.stream == 3
315  12.250160  172.20.10.4 -> 165.254.32.10 TCP 66 48357 > http [ACK] Seq=630 Ack=92915 Win=78336 Len=0 TSval=91769073 TSecr=2879432451  tcp.stream == 3
316  12.263284 165.254.32.10 -> 172.20.10.4  TCP 1464 [TCP segment of a reassembled PDU]  tcp.stream == 3
317  12.263305  172.20.10.4 -> 165.254.32.10 TCP 66 48357 > http [ACK] Seq=630 Ack=94313 Win=78336 Len=0 TSval=91769076 TSecr=2879432451  tcp.stream == 3
318  12.270257 165.254.32.10 -> 172.20.10.4  TCP 1464 [TCP segment of a reassembled PDU]  tcp.stream == 3
319  12.270272  172.20.10.4 -> 165.254.32.10 TCP 66 48357 > http [ACK] Seq=630 Ack=95711 Win=78336 Len=0 TSval=91769078 TSecr=2879432457  tcp.stream == 3
320  12.277013 165.254.32.10 -> 172.20.10.4  TCP 1464 [TCP segment of a reassembled PDU]  tcp.stream == 3
321  12.277036  172.20.10.4 -> 165.254.32.10 TCP 66 48357 > http [ACK] Seq=630 Ack=97109 Win=78336 Len=0 TSval=91769079 TSecr=2879432457  tcp.stream == 3
324  12.285661 165.254.32.10 -> 172.20.10.4  TCP 1464 [TCP segment of a reassembled PDU]  tcp.stream == 3
325  12.285683  172.20.10.4 -> 165.254.32.10 TCP 66 48357 > http [ACK] Seq=630 Ack=98507 Win=78336 Len=0 TSval=91769082 TSecr=2879432465  tcp.stream == 3
326  12.290286 165.254.32.10 -> 172.20.10.4  TCP 1464 [TCP segment of a reassembled PDU]  tcp.stream == 3
327  12.310663 165.254.32.10 -> 172.20.10.4  TCP 1464 [TCP segment of a reassembled PDU]  tcp.stream == 3
328  12.310684  172.20.10.4 -> 165.254.32.10 TCP 66 48357 > http [ACK] Seq=630 Ack=101303 Win=78336 Len=0 TSval=91769088 TSecr=2879432465  tcp.stream == 3
329  12.313658 165.254.32.10 -> 172.20.10.4  TCP 1464 [TCP segment of a reassembled PDU]  tcp.stream == 3
330  12.323540 165.254.32.10 -> 172.20.10.4  TCP 1464 [TCP segment of a reassembled PDU]  tcp.stream == 3
331  12.323562  172.20.10.4 -> 165.254.32.10 TCP 66 48357 > http [ACK] Seq=630 Ack=104099 Win=78336 Len=0 TSval=91769091 TSecr=2879432465  tcp.stream == 3
332  12.331536 165.254.32.10 -> 172.20.10.4  TCP 1464 [TCP segment of a reassembled PDU]  tcp.stream == 3
333  12.343287 165.254.32.10 -> 172.20.10.4  TCP 1464 [TCP segment of a reassembled PDU]  tcp.stream == 3
