 75   9.603772 216.165.108.217 -> 157.166.226.25 TCP 74 52676 > http [SYN] Seq=0 Win=14600 Len=0 MSS=1460 SACK_PERM=1 TSval=44246558 TSecr=0 WS=128  tcp.stream == 0
 76   9.623074 157.166.226.25 -> 216.165.108.217 TCP 74 http > 52676 [SYN, ACK] Seq=0 Ack=1 Win=5792 Len=0 MSS=1460 SACK_PERM=1 TSval=190507851 TSecr=44246558 WS=128  tcp.stream == 0
 77   9.623102 216.165.108.217 -> 157.166.226.25 TCP 66 52676 > http [ACK] Seq=1 Ack=1 Win=14720 Len=0 TSval=44246563 TSecr=190507851  tcp.stream == 0
 78   9.632863 216.165.108.217 -> 157.166.226.25 HTTP 459 GET / HTTP/1.1   tcp.stream == 0
 79   9.651632 157.166.226.25 -> 216.165.108.217 TCP 66 http > 52676 [ACK] Seq=1 Ack=394 Win=6912 Len=0 TSval=190507854 TSecr=44246565  tcp.stream == 0
 80   9.652034 157.166.226.25 -> 216.165.108.217 HTTP 506 HTTP/1.1 301 Moved Permanently  (text/html)  tcp.stream == 0
 81   9.652046 216.165.108.217 -> 157.166.226.25 TCP 66 52676 > http [ACK] Seq=394 Ack=441 Win=15744 Len=0 TSval=44246570 TSecr=190507854  tcp.stream == 0
 82   9.652052 157.166.226.25 -> 216.165.108.217 TCP 66 http > 52676 [FIN, ACK] Seq=441 Ack=394 Win=6912 Len=0 TSval=190507854 TSecr=44246565  tcp.stream == 0
 83   9.675652 216.165.108.217 -> 157.166.226.25 TCP 66 52676 > http [FIN, ACK] Seq=394 Ack=442 Win=15744 Len=0 TSval=44246576 TSecr=190507854  tcp.stream == 0
 85   9.694484 157.166.226.25 -> 216.165.108.217 TCP 66 http > 52676 [ACK] Seq=442 Ack=395 Win=6912 Len=0 TSval=190507859 TSecr=44246576  tcp.stream == 0
 89   9.739554 216.165.108.217 -> 157.166.226.26 TCP 74 54122 > http [SYN] Seq=0 Win=14600 Len=0 MSS=1460 SACK_PERM=1 TSval=44246592 TSecr=0 WS=128  tcp.stream == 1
 90   9.758388 157.166.226.26 -> 216.165.108.217 TCP 74 http > 54122 [SYN, ACK] Seq=0 Ack=1 Win=5792 Len=0 MSS=1460 SACK_PERM=1 TSval=190569870 TSecr=44246592 WS=128  tcp.stream == 1
 91   9.758412 216.165.108.217 -> 157.166.226.26 TCP 66 54122 > http [ACK] Seq=1 Ack=1 Win=14720 Len=0 TSval=44246597 TSecr=190569870  tcp.stream == 1
 92   9.760944 216.165.108.217 -> 157.166.226.26 HTTP 463 GET / HTTP/1.1   tcp.stream == 1
 93   9.779661 157.166.226.26 -> 216.165.108.217 TCP 66 http > 54122 [ACK] Seq=1 Ack=398 Win=6912 Len=0 TSval=190569872 TSecr=44246597  tcp.stream == 1
 94   9.780246 157.166.226.26 -> 216.165.108.217 HTTP 522 HTTP/1.1 302 Moved Temporarily  (text/html)  tcp.stream == 1
 95   9.780261 216.165.108.217 -> 157.166.226.26 TCP 66 54122 > http [ACK] Seq=398 Ack=457 Win=15744 Len=0 TSval=44246602 TSecr=190569872  tcp.stream == 1
 96   9.780267 157.166.226.26 -> 216.165.108.217 TCP 66 http > 54122 [FIN, ACK] Seq=457 Ack=398 Win=6912 Len=0 TSval=190569872 TSecr=44246597  tcp.stream == 1
 97   9.790475 216.165.108.217 -> 157.166.226.26 TCP 66 54122 > http [FIN, ACK] Seq=398 Ack=458 Win=15744 Len=0 TSval=44246605 TSecr=190569872  tcp.stream == 1
100   9.806285 216.165.108.217 -> 157.166.246.200 TCP 74 41374 > http [SYN] Seq=0 Win=14600 Len=0 MSS=1460 SACK_PERM=1 TSval=44246609 TSecr=0 WS=128  tcp.stream == 2
101   9.808897 157.166.226.26 -> 216.165.108.217 TCP 66 http > 54122 [ACK] Seq=458 Ack=399 Win=6912 Len=0 TSval=190569875 TSecr=44246605  tcp.stream == 1
102   9.825968 157.166.246.200 -> 216.165.108.217 TCP 74 http > 41374 [SYN, ACK] Seq=0 Ack=1 Win=14600 Len=0 MSS=1460 WS=128 TSval=2761210609 TSecr=44246609  tcp.stream == 2
103   9.826018 216.165.108.217 -> 157.166.246.200 TCP 66 41374 > http [ACK] Seq=1 Ack=1 Win=14720 Len=0 TSval=44246614 TSecr=2761210609  tcp.stream == 2
104   9.827802 216.165.108.217 -> 157.166.246.200 HTTP 461 GET / HTTP/1.1   tcp.stream == 2
105   9.848228 157.166.246.200 -> 216.165.108.217 TCP 66 http > 41374 [ACK] Seq=1 Ack=396 Win=6912 Len=0 TSval=2761210615 TSecr=44246614  tcp.stream == 2
106   9.864541 157.166.246.200 -> 216.165.108.217 HTTP 624 HTTP/1.1 302 Moved Temporarily   tcp.stream == 2
107   9.864560 216.165.108.217 -> 157.166.246.200 TCP 66 41374 > http [ACK] Seq=396 Ack=559 Win=15744 Len=0 TSval=44246623 TSecr=2761210619  tcp.stream == 2
108   9.864567 157.166.246.200 -> 216.165.108.217 TCP 66 http > 41374 [FIN, ACK] Seq=559 Ack=396 Win=6912 Len=0 TSval=2761210619 TSecr=44246614  tcp.stream == 2
109   9.874094 216.165.108.217 -> 157.166.246.200 TCP 66 41374 > http [FIN, ACK] Seq=396 Ack=560 Win=15744 Len=0 TSval=44246626 TSecr=2761210619  tcp.stream == 2
110   9.878276 216.165.108.217 -> 157.166.246.200 TCP 74 41375 > http [SYN] Seq=0 Win=14600 Len=0 MSS=1460 SACK_PERM=1 TSval=44246627 TSecr=0 WS=128  tcp.stream == 3
111   9.894556 157.166.246.200 -> 216.165.108.217 TCP 66 http > 41374 [ACK] Seq=560 Ack=397 Win=6912 Len=0 TSval=2761210626 TSecr=44246626  tcp.stream == 2
113   9.897508 157.166.246.200 -> 216.165.108.217 TCP 74 http > 41375 [SYN, ACK] Seq=0 Ack=1 Win=14600 Len=0 MSS=1460 WS=128 TSval=2761210627 TSecr=44246627  tcp.stream == 3
114   9.897530 216.165.108.217 -> 157.166.246.200 TCP 66 41375 > http [ACK] Seq=1 Ack=1 Win=14720 Len=0 TSval=44246631 TSecr=2761210627  tcp.stream == 3
115   9.899874 216.165.108.217 -> 157.166.246.200 HTTP 658 GET /primary/wk_Home?cookieFlag=COOKIE_SET HTTP/1.1   tcp.stream == 3
116   9.919365 157.166.246.200 -> 216.165.108.217 TCP 66 http > 41375 [ACK] Seq=1 Ack=593 Win=7040 Len=0 TSval=2761210633 TSecr=44246632  tcp.stream == 3
118  10.097492 157.166.246.200 -> 216.165.108.217 TCP 1434 [TCP segment of a reassembled PDU]  tcp.stream == 3
119  10.097510 216.165.108.217 -> 157.166.246.200 TCP 66 41375 > http [ACK] Seq=593 Ack=1369 Win=17408 Len=0 TSval=44246681 TSecr=2761210677  tcp.stream == 3
120  10.097609 157.166.246.200 -> 216.165.108.217 TCP 1434 [TCP segment of a reassembled PDU]  tcp.stream == 3
121  10.097613 216.165.108.217 -> 157.166.246.200 TCP 66 41375 > http [ACK] Seq=593 Ack=2737 Win=20096 Len=0 TSval=44246681 TSecr=2761210677  tcp.stream == 3
122  10.097720 157.166.246.200 -> 216.165.108.217 TCP 1434 [TCP segment of a reassembled PDU]  tcp.stream == 3
123  10.097725 216.165.108.217 -> 157.166.246.200 TCP 66 41375 > http [ACK] Seq=593 Ack=4105 Win=22912 Len=0 TSval=44246681 TSecr=2761210677  tcp.stream == 3
124  10.097838 157.166.246.200 -> 216.165.108.217 TCP 1434 [TCP segment of a reassembled PDU]  tcp.stream == 3
125  10.097841 216.165.108.217 -> 157.166.246.200 TCP 66 41375 > http [ACK] Seq=593 Ack=5473 Win=25600 Len=0 TSval=44246681 TSecr=2761210677  tcp.stream == 3
126  10.097942 157.166.246.200 -> 216.165.108.217 HTTP/XML 1279 HTTP/1.1 200 OK   tcp.stream == 3
127  10.124394 216.165.108.217 -> 157.166.246.200 TCP 66 41375 > http [FIN, ACK] Seq=593 Ack=6687 Win=28288 Len=0 TSval=44246688 TSecr=2761210677  tcp.stream == 3
128  10.143749 157.166.246.200 -> 216.165.108.217 TCP 66 http > 41375 [ACK] Seq=6687 Ack=594 Win=7040 Len=0 TSval=2761210689 TSecr=44246688  tcp.stream == 3
133  10.600158 216.165.108.217 -> 4.26.251.254 TCP 74 59024 > http [SYN] Seq=0 Win=14600 Len=0 MSS=1460 SACK_PERM=1 TSval=44246807 TSecr=0 WS=128  tcp.stream == 4
134  10.600663 216.165.108.217 -> 4.26.251.254 TCP 74 59025 > http [SYN] Seq=0 Win=14600 Len=0 MSS=1460 SACK_PERM=1 TSval=44246807 TSecr=0 WS=128  tcp.stream == 5
135  10.600966 4.26.251.254 -> 216.165.108.217 TCP 74 http > 59024 [SYN, ACK] Seq=0 Ack=1 Win=5792 Len=0 MSS=1460 SACK_PERM=1 TSval=3364533517 TSecr=44246807 WS=128  tcp.stream == 4
136  10.600992 216.165.108.217 -> 4.26.251.254 TCP 66 59024 > http [ACK] Seq=1 Ack=1 Win=14720 Len=0 TSval=44246807 TSecr=3364533517  tcp.stream == 4
137  10.601450 216.165.108.217 -> 4.26.251.254 TCP 74 59026 > http [SYN] Seq=0 Win=14600 Len=0 MSS=1460 SACK_PERM=1 TSval=44246807 TSecr=0 WS=128  tcp.stream == 6
138  10.602256 4.26.251.254 -> 216.165.108.217 TCP 74 http > 59025 [SYN, ACK] Seq=0 Ack=1 Win=5792 Len=0 MSS=1460 SACK_PERM=1 TSval=2692413848 TSecr=44246807 WS=128  tcp.stream == 5
139  10.602279 216.165.108.217 -> 4.26.251.254 TCP 66 59025 > http [ACK] Seq=1 Ack=1 Win=14720 Len=0 TSval=44246808 TSecr=2692413848  tcp.stream == 5
141  10.603467 4.26.251.254 -> 216.165.108.217 TCP 74 http > 59026 [SYN, ACK] Seq=0 Ack=1 Win=5792 Len=0 MSS=1460 SACK_PERM=1 TSval=3364533518 TSecr=44246807 WS=128  tcp.stream == 6
142  10.603490 216.165.108.217 -> 4.26.251.254 TCP 66 59026 > http [ACK] Seq=1 Ack=1 Win=14720 Len=0 TSval=44246808 TSecr=3364533518  tcp.stream == 6
143  10.604956 216.165.108.217 -> 4.26.251.254 HTTP 540 GET /cnn/mobile/.element/msdp4.2/css/webkit/1.0/m.cnn.css HTTP/1.1   tcp.stream == 4
144  10.606005 4.26.251.254 -> 216.165.108.217 TCP 66 http > 59024 [ACK] Seq=1 Ack=475 Win=6912 Len=0 TSval=3364533522 TSecr=44246808  tcp.stream == 4
145  10.606432 4.26.251.254 -> 216.165.108.217 TCP 1514 [TCP segment of a reassembled PDU]  tcp.stream == 4
146  10.606451 216.165.108.217 -> 4.26.251.254 TCP 66 59024 > http [ACK] Seq=475 Ack=1449 Win=17536 Len=0 TSval=44246809 TSecr=3364533522  tcp.stream == 4
147  10.606553 4.26.251.254 -> 216.165.108.217 TCP 1514 [TCP segment of a reassembled PDU]  tcp.stream == 4
148  10.606560 216.165.108.217 -> 4.26.251.254 TCP 66 59024 > http [ACK] Seq=475 Ack=2897 Win=20480 Len=0 TSval=44246809 TSecr=3364533522  tcp.stream == 4
149  10.606675 4.26.251.254 -> 216.165.108.217 TCP 1514 [TCP segment of a reassembled PDU]  tcp.stream == 4
150  10.606682 216.165.108.217 -> 4.26.251.254 TCP 66 59024 > http [ACK] Seq=475 Ack=4345 Win=23296 Len=0 TSval=44246809 TSecr=3364533522  tcp.stream == 4
151  10.607602 4.26.251.254 -> 216.165.108.217 TCP 1514 [TCP segment of a reassembled PDU]  tcp.stream == 4
152  10.607624 216.165.108.217 -> 4.26.251.254 TCP 66 59024 > http [ACK] Seq=475 Ack=5793 Win=26240 Len=0 TSval=44246809 TSecr=3364533523  tcp.stream == 4
153  10.607721 4.26.251.254 -> 216.165.108.217 TCP 1514 [TCP segment of a reassembled PDU]  tcp.stream == 4
154  10.607727 216.165.108.217 -> 4.26.251.254 TCP 66 59024 > http [ACK] Seq=475 Ack=7241 Win=29184 Len=0 TSval=44246809 TSecr=3364533523  tcp.stream == 4
155  10.607837 4.26.251.254 -> 216.165.108.217 TCP 1514 [TCP segment of a reassembled PDU]  tcp.stream == 4
156  10.607843 216.165.108.217 -> 4.26.251.254 TCP 66 59024 > http [ACK] Seq=475 Ack=8689 Win=32000 Len=0 TSval=44246809 TSecr=3364533523  tcp.stream == 4
157  10.607960 4.26.251.254 -> 216.165.108.217 TCP 1514 [TCP segment of a reassembled PDU]  tcp.stream == 4
158  10.607967 216.165.108.217 -> 4.26.251.254 TCP 66 59024 > http [ACK] Seq=475 Ack=10137 Win=34944 Len=0 TSval=44246809 TSecr=3364533523  tcp.stream == 4
159  10.608091 4.26.251.254 -> 216.165.108.217 TCP 1514 [TCP segment of a reassembled PDU]  tcp.stream == 4
160  10.608098 216.165.108.217 -> 4.26.251.254 TCP 66 59024 > http [ACK] Seq=475 Ack=11585 Win=37888 Len=0 TSval=44246809 TSecr=3364533523  tcp.stream == 4
161  10.608212 4.26.251.254 -> 216.165.108.217 TCP 1514 [TCP segment of a reassembled PDU]  tcp.stream == 4
162  10.608221 216.165.108.217 -> 4.26.251.254 TCP 66 59024 > http [ACK] Seq=475 Ack=13033 Win=40704 Len=0 TSval=44246809 TSecr=3364533523  tcp.stream == 4
163  10.608788 4.26.251.254 -> 216.165.108.217 TCP 1514 [TCP segment of a reassembled PDU]  tcp.stream == 4
164  10.608805 216.165.108.217 -> 4.26.251.254 TCP 66 59024 > http [ACK] Seq=475 Ack=14481 Win=43648 Len=0 TSval=44246809 TSecr=3364533524  tcp.stream == 4
165  10.608905 4.26.251.254 -> 216.165.108.217 TCP 1514 [TCP segment of a reassembled PDU]  tcp.stream == 4
166  10.608913 216.165.108.217 -> 4.26.251.254 TCP 66 59024 > http [ACK] Seq=475 Ack=15929 Win=46464 Len=0 TSval=44246809 TSecr=3364533524  tcp.stream == 4
167  10.609035 4.26.251.254 -> 216.165.108.217 TCP 1514 [TCP segment of a reassembled PDU]  tcp.stream == 4
168  10.609041 216.165.108.217 -> 4.26.251.254 TCP 66 59024 > http [ACK] Seq=475 Ack=17377 Win=49408 Len=0 TSval=44246809 TSecr=3364533524  tcp.stream == 4
169  10.609165 4.26.251.254 -> 216.165.108.217 TCP 1514 [TCP segment of a reassembled PDU]  tcp.stream == 4
170  10.609174 216.165.108.217 -> 4.26.251.254 TCP 66 59024 > http [ACK] Seq=475 Ack=18825 Win=52352 Len=0 TSval=44246809 TSecr=3364533524  tcp.stream == 4
171  10.609287 4.26.251.254 -> 216.165.108.217 TCP 1514 [TCP segment of a reassembled PDU]  tcp.stream == 4
172  10.609294 216.165.108.217 -> 4.26.251.254 TCP 66 59024 > http [ACK] Seq=475 Ack=20273 Win=51840 Len=0 TSval=44246809 TSecr=3364533524  tcp.stream == 4
173  10.609410 4.26.251.254 -> 216.165.108.217 TCP 1514 [TCP segment of a reassembled PDU]  tcp.stream == 4
174  10.609417 216.165.108.217 -> 4.26.251.254 TCP 66 59024 > http [ACK] Seq=475 Ack=21721 Win=50432 Len=0 TSval=44246809 TSecr=3364533524  tcp.stream == 4
175  10.609534 4.26.251.254 -> 216.165.108.217 TCP 1514 [TCP segment of a reassembled PDU]  tcp.stream == 4
176  10.609542 216.165.108.217 -> 4.26.251.254 TCP 66 59024 > http [ACK] Seq=475 Ack=23169 Win=49024 Len=0 TSval=44246809 TSecr=3364533524  tcp.stream == 4
177  10.609656 4.26.251.254 -> 216.165.108.217 TCP 1514 [TCP segment of a reassembled PDU]  tcp.stream == 4
178  10.609662 216.165.108.217 -> 4.26.251.254 TCP 66 59024 > http [ACK] Seq=475 Ack=24617 Win=47616 Len=0 TSval=44246809 TSecr=3364533524  tcp.stream == 4
179  10.609788 4.26.251.254 -> 216.165.108.217 TCP 1514 [TCP segment of a reassembled PDU]  tcp.stream == 4
180  10.609795 216.165.108.217 -> 4.26.251.254 TCP 66 59024 > http [ACK] Seq=475 Ack=26065 Win=54528 Len=0 TSval=44246809 TSecr=3364533525  tcp.stream == 4
181  10.609909 4.26.251.254 -> 216.165.108.217 TCP 1514 [TCP segment of a reassembled PDU]  tcp.stream == 4
182  10.610033 4.26.251.254 -> 216.165.108.217 TCP 1514 [TCP segment of a reassembled PDU]  tcp.stream == 4
183  10.610154 4.26.251.254 -> 216.165.108.217 TCP 1514 [TCP segment of a reassembled PDU]  tcp.stream == 4
184  10.610364 4.26.251.254 -> 216.165.108.217 TCP 1514 [TCP segment of a reassembled PDU]  tcp.stream == 4
185  10.610487 4.26.251.254 -> 216.165.108.217 TCP 1514 [TCP segment of a reassembled PDU]  tcp.stream == 4
186  10.610610 4.26.251.254 -> 216.165.108.217 TCP 1514 [TCP segment of a reassembled PDU]  tcp.stream == 4
187  10.610699 216.165.108.217 -> 4.26.251.254 TCP 66 59024 > http [ACK] Seq=475 Ack=34753 Win=49024 Len=0 TSval=44246810 TSecr=3364533525  tcp.stream == 4
188  10.610733 4.26.251.254 -> 216.165.108.217 TCP 1514 [TCP segment of a reassembled PDU]  tcp.stream == 4
189  10.610857 4.26.251.254 -> 216.165.108.217 TCP 1514 [TCP segment of a reassembled PDU]  tcp.stream == 4
190  10.610863 216.165.108.217 -> 4.26.251.254 TCP 66 59024 > http [ACK] Seq=475 Ack=37649 Win=51840 Len=0 TSval=44246810 TSecr=3364533526  tcp.stream == 4
191  10.610992 4.26.251.254 -> 216.165.108.217 TCP 1514 [TCP segment of a reassembled PDU]  tcp.stream == 4
192  10.611103 4.26.251.254 -> 216.165.108.217 TCP 1514 [TCP segment of a reassembled PDU]  tcp.stream == 4
193  10.611108 4.26.251.254 -> 216.165.108.217 HTTP 594 HTTP/1.1 200 OK  (text/css)  tcp.stream == 4
194  10.611709 216.165.108.217 -> 4.26.251.254 TCP 66 59024 > http [ACK] Seq=475 Ack=41073 Win=50432 Len=0 TSval=44246810 TSecr=3364533526  tcp.stream == 4
195  10.615641 216.165.108.217 -> 4.26.251.254 HTTP 516 GET /cnn/mobile/.element/global/js/jquery-min.js HTTP/1.1   tcp.stream == 6
196  10.616723 4.26.251.254 -> 216.165.108.217 TCP 66 http > 59026 [ACK] Seq=1 Ack=451 Win=6912 Len=0 TSval=3364533532 TSecr=44246811  tcp.stream == 6
197  10.617394 4.26.251.254 -> 216.165.108.217 TCP 1514 [TCP segment of a reassembled PDU]  tcp.stream == 6
198  10.617414 216.165.108.217 -> 4.26.251.254 TCP 66 59026 > http [ACK] Seq=451 Ack=1449 Win=17536 Len=0 TSval=44246811 TSecr=3364533533  tcp.stream == 6
199  10.617516 4.26.251.254 -> 216.165.108.217 TCP 1514 [TCP segment of a reassembled PDU]  tcp.stream == 6
200  10.617522 216.165.108.217 -> 4.26.251.254 TCP 66 59026 > http [ACK] Seq=451 Ack=2897 Win=20480 Len=0 TSval=44246811 TSecr=3364533533  tcp.stream == 6
201  10.617848 4.26.251.254 -> 216.165.108.217 TCP 1514 [TCP segment of a reassembled PDU]  tcp.stream == 6
202  10.617863 216.165.108.217 -> 4.26.251.254 TCP 66 59026 > http [ACK] Seq=451 Ack=4345 Win=23296 Len=0 TSval=44246811 TSecr=3364533533  tcp.stream == 6
203  10.619179 4.26.251.254 -> 216.165.108.217 TCP 1514 [TCP segment of a reassembled PDU]  tcp.stream == 6
204  10.619205 216.165.108.217 -> 4.26.251.254 TCP 66 59026 > http [ACK] Seq=451 Ack=5793 Win=26240 Len=0 TSval=44246812 TSecr=3364533534  tcp.stream == 6
205  10.619302 4.26.251.254 -> 216.165.108.217 TCP 1514 [TCP segment of a reassembled PDU]  tcp.stream == 6
206  10.619308 216.165.108.217 -> 4.26.251.254 TCP 66 59026 > http [ACK] Seq=451 Ack=7241 Win=29184 Len=0 TSval=44246812 TSecr=3364533534  tcp.stream == 6
207  10.619439 4.26.251.254 -> 216.165.108.217 TCP 1514 [TCP segment of a reassembled PDU]  tcp.stream == 6
208  10.619445 216.165.108.217 -> 4.26.251.254 TCP 66 59026 > http [ACK] Seq=451 Ack=8689 Win=32000 Len=0 TSval=44246812 TSecr=3364533534  tcp.stream == 6
209  10.619561 4.26.251.254 -> 216.165.108.217 TCP 1514 [TCP segment of a reassembled PDU]  tcp.stream == 6
210  10.619570 216.165.108.217 -> 4.26.251.254 TCP 66 59026 > http [ACK] Seq=451 Ack=10137 Win=34944 Len=0 TSval=44246812 TSecr=3364533534  tcp.stream == 6
211  10.619692 4.26.251.254 -> 216.165.108.217 TCP 1514 [TCP segment of a reassembled PDU]  tcp.stream == 6
212  10.619698 216.165.108.217 -> 4.26.251.254 TCP 66 59026 > http [ACK] Seq=451 Ack=11585 Win=37888 Len=0 TSval=44246812 TSecr=3364533534  tcp.stream == 6
213  10.619813 4.26.251.254 -> 216.165.108.217 TCP 1514 [TCP segment of a reassembled PDU]  tcp.stream == 6
214  10.619820 216.165.108.217 -> 4.26.251.254 TCP 66 59026 > http [ACK] Seq=451 Ack=13033 Win=40704 Len=0 TSval=44246812 TSecr=3364533534  tcp.stream == 6
215  10.620887 4.26.251.254 -> 216.165.108.217 TCP 1514 [TCP segment of a reassembled PDU]  tcp.stream == 6
216  10.620905 216.165.108.217 -> 4.26.251.254 TCP 66 59026 > http [ACK] Seq=451 Ack=14481 Win=43648 Len=0 TSval=44246812 TSecr=3364533536  tcp.stream == 6
217  10.621003 4.26.251.254 -> 216.165.108.217 TCP 1514 [TCP segment of a reassembled PDU]  tcp.stream == 6
218  10.621009 216.165.108.217 -> 4.26.251.254 TCP 66 59026 > http [ACK] Seq=451 Ack=15929 Win=46464 Len=0 TSval=44246812 TSecr=3364533536  tcp.stream == 6
219  10.621124 4.26.251.254 -> 216.165.108.217 TCP 1514 [TCP segment of a reassembled PDU]  tcp.stream == 6
220  10.621131 216.165.108.217 -> 4.26.251.254 TCP 66 59026 > http [ACK] Seq=451 Ack=17377 Win=49408 Len=0 TSval=44246812 TSecr=3364533536  tcp.stream == 6
221  10.621246 4.26.251.254 -> 216.165.108.217 TCP 1514 [TCP segment of a reassembled PDU]  tcp.stream == 6
222  10.621253 216.165.108.217 -> 4.26.251.254 TCP 66 59026 > http [ACK] Seq=451 Ack=18825 Win=52352 Len=0 TSval=44246812 TSecr=3364533536  tcp.stream == 6
223  10.621378 4.26.251.254 -> 216.165.108.217 TCP 1514 [TCP segment of a reassembled PDU]  tcp.stream == 6
224  10.621386 216.165.108.217 -> 4.26.251.254 TCP 66 59026 > http [ACK] Seq=451 Ack=20273 Win=55168 Len=0 TSval=44246812 TSecr=3364533536  tcp.stream == 6
225  10.621498 4.26.251.254 -> 216.165.108.217 TCP 1514 [TCP segment of a reassembled PDU]  tcp.stream == 6
226  10.621505 216.165.108.217 -> 4.26.251.254 TCP 66 59026 > http [ACK] Seq=451 Ack=21721 Win=57344 Len=0 TSval=44246812 TSecr=3364533536  tcp.stream == 6
227  10.621623 4.26.251.254 -> 216.165.108.217 TCP 1514 [TCP segment of a reassembled PDU]  tcp.stream == 6
228  10.621631 216.165.108.217 -> 4.26.251.254 TCP 66 59026 > http [ACK] Seq=451 Ack=23169 Win=55936 Len=0 TSval=44246812 TSecr=3364533536  tcp.stream == 6
229  10.621745 4.26.251.254 -> 216.165.108.217 TCP 1514 [TCP segment of a reassembled PDU]  tcp.stream == 6
230  10.621751 216.165.108.217 -> 4.26.251.254 TCP 66 59026 > http [ACK] Seq=451 Ack=24617 Win=54528 Len=0 TSval=44246812 TSecr=3364533536  tcp.stream == 6
231  10.621869 4.26.251.254 -> 216.165.108.217 TCP 1514 [TCP segment of a reassembled PDU]  tcp.stream == 6
232  10.621876 216.165.108.217 -> 4.26.251.254 TCP 66 59026 > http [ACK] Seq=451 Ack=26065 Win=53120 Len=0 TSval=44246812 TSecr=3364533536  tcp.stream == 6
233  10.621992 4.26.251.254 -> 216.165.108.217 TCP 1514 [TCP segment of a reassembled PDU]  tcp.stream == 6
234  10.621998 216.165.108.217 -> 4.26.251.254 TCP 66 59026 > http [ACK] Seq=451 Ack=27513 Win=51840 Len=0 TSval=44246813 TSecr=3364533536  tcp.stream == 6
235  10.622116 4.26.251.254 -> 216.165.108.217 TCP 1514 [TCP segment of a reassembled PDU]  tcp.stream == 6
236  10.622237 4.26.251.254 -> 216.165.108.217 TCP 1514 [TCP segment of a reassembled PDU]  tcp.stream == 6
237  10.622689 216.165.108.217 -> 4.26.251.254 TCP 66 59026 > http [ACK] Seq=451 Ack=30409 Win=53120 Len=0 TSval=44246813 TSecr=3364533536  tcp.stream == 6
238  10.623029 4.26.251.254 -> 216.165.108.217 TCP 1514 [TCP segment of a reassembled PDU]  tcp.stream == 6
239  10.623151 4.26.251.254 -> 216.165.108.217 TCP 1514 [TCP segment of a reassembled PDU]  tcp.stream == 6
240  10.623161 216.165.108.217 -> 4.26.251.254 TCP 66 59026 > http [ACK] Seq=451 Ack=33305 Win=53120 Len=0 TSval=44246813 TSecr=3364533538  tcp.stream == 6
241  10.623276 4.26.251.254 -> 216.165.108.217 TCP 1514 [TCP segment of a reassembled PDU]  tcp.stream == 6
242  10.623400 4.26.251.254 -> 216.165.108.217 TCP 1514 [TCP segment of a reassembled PDU]  tcp.stream == 6
243  10.623522 4.26.251.254 -> 216.165.108.217 TCP 1514 [TCP segment of a reassembled PDU]  tcp.stream == 6
244  10.623645 4.26.251.254 -> 216.165.108.217 TCP 1514 [TCP segment of a reassembled PDU]  tcp.stream == 6
245  10.623769 4.26.251.254 -> 216.165.108.217 TCP 1514 [TCP segment of a reassembled PDU]  tcp.stream == 6
246  10.623891 4.26.251.254 -> 216.165.108.217 TCP 1514 [TCP segment of a reassembled PDU]  tcp.stream == 6
247  10.624014 4.26.251.254 -> 216.165.108.217 TCP 1514 [TCP segment of a reassembled PDU]  tcp.stream == 6
248  10.624137 4.26.251.254 -> 216.165.108.217 TCP 1514 [TCP segment of a reassembled PDU]  tcp.stream == 6
249  10.624259 4.26.251.254 -> 216.165.108.217 TCP 1514 [TCP segment of a reassembled PDU]  tcp.stream == 6
250  10.624384 4.26.251.254 -> 216.165.108.217 TCP 1514 [TCP segment of a reassembled PDU]  tcp.stream == 6
251  10.624513 4.26.251.254 -> 216.165.108.217 TCP 1514 [TCP segment of a reassembled PDU]  tcp.stream == 6
252  10.624637 4.26.251.254 -> 216.165.108.217 TCP 1514 [TCP segment of a reassembled PDU]  tcp.stream == 6
253  10.624760 4.26.251.254 -> 216.165.108.217 TCP 1514 [TCP segment of a reassembled PDU]  tcp.stream == 6
254  10.624882 4.26.251.254 -> 216.165.108.217 TCP 1514 [TCP segment of a reassembled PDU]  tcp.stream == 6
255  10.625006 4.26.251.254 -> 216.165.108.217 TCP 1514 [TCP segment of a reassembled PDU]  tcp.stream == 6
256  10.625129 4.26.251.254 -> 216.165.108.217 TCP 1514 [TCP segment of a reassembled PDU]  tcp.stream == 6
257  10.625136 4.26.251.254 -> 216.165.108.217 HTTP 682 HTTP/1.1 200 OK  (application/x-javascript)  tcp.stream == 6
258  10.625692 216.165.108.217 -> 4.26.251.254 TCP 66 59026 > http [ACK] Seq=451 Ack=57089 Win=35200 Len=0 TSval=44246813 TSecr=3364533538  tcp.stream == 6
259  10.627700 216.165.108.217 -> 4.26.251.254 HTTP 522 GET /cnn/mobile/.element/msdp4.2/js/webkit/1.0/cnnd.js HTTP/1.1   tcp.stream == 5
260  10.628861 4.26.251.254 -> 216.165.108.217 TCP 66 http > 59025 [ACK] Seq=1 Ack=457 Win=6912 Len=0 TSval=2692413875 TSecr=44246814  tcp.stream == 5
261  10.631057 4.26.251.254 -> 216.165.108.217 TCP 1514 [TCP segment of a reassembled PDU]  tcp.stream == 5
262  10.631080 216.165.108.217 -> 4.26.251.254 TCP 66 59025 > http [ACK] Seq=457 Ack=1449 Win=17536 Len=0 TSval=44246815 TSecr=2692413876  tcp.stream == 5
263  10.631178 4.26.251.254 -> 216.165.108.217 TCP 1514 [TCP segment of a reassembled PDU]  tcp.stream == 5
264  10.631185 216.165.108.217 -> 4.26.251.254 TCP 66 59025 > http [ACK] Seq=457 Ack=2897 Win=20480 Len=0 TSval=44246815 TSecr=2692413876  tcp.stream == 5
265  10.631301 4.26.251.254 -> 216.165.108.217 TCP 1514 [TCP segment of a reassembled PDU]  tcp.stream == 5
266  10.631309 216.165.108.217 -> 4.26.251.254 TCP 66 59025 > http [ACK] Seq=457 Ack=4345 Win=23296 Len=0 TSval=44246815 TSecr=2692413876  tcp.stream == 5
267  10.631881 216.165.108.217 -> 4.26.251.254 TCP 74 59027 > http [SYN] Seq=0 Win=14600 Len=0 MSS=1460 SACK_PERM=1 TSval=44246815 TSecr=0 WS=128  tcp.stream == 7
268  10.632196 4.26.251.254 -> 216.165.108.217 TCP 1514 [TCP segment of a reassembled PDU]  tcp.stream == 5
269  10.632211 216.165.108.217 -> 4.26.251.254 TCP 66 59025 > http [ACK] Seq=457 Ack=5793 Win=26240 Len=0 TSval=44246815 TSecr=2692413878  tcp.stream == 5
270  10.632317 4.26.251.254 -> 216.165.108.217 TCP 1514 [TCP segment of a reassembled PDU]  tcp.stream == 5
271  10.632326 216.165.108.217 -> 4.26.251.254 TCP 66 59025 > http [ACK] Seq=457 Ack=7241 Win=29184 Len=0 TSval=44246815 TSecr=2692413878  tcp.stream == 5
272  10.632440 4.26.251.254 -> 216.165.108.217 TCP 1514 [TCP segment of a reassembled PDU]  tcp.stream == 5
273  10.632448 216.165.108.217 -> 4.26.251.254 TCP 66 59025 > http [ACK] Seq=457 Ack=8689 Win=32000 Len=0 TSval=44246815 TSecr=2692413878  tcp.stream == 5
274  10.632451 4.26.251.254 -> 216.165.108.217 HTTP 749 HTTP/1.1 200 OK  (application/x-javascript)  tcp.stream == 5
275  10.632455 216.165.108.217 -> 4.26.251.254 TCP 66 59025 > http [ACK] Seq=457 Ack=9372 Win=34944 Len=0 TSval=44246815 TSecr=2692413878  tcp.stream == 5
276  10.632641 4.26.251.254 -> 216.165.108.217 TCP 74 http > 59027 [SYN, ACK] Seq=0 Ack=1 Win=5792 Len=0 MSS=1460 SACK_PERM=1 TSval=3364533548 TSecr=44246815 WS=128  tcp.stream == 7
277  10.632656 216.165.108.217 -> 4.26.251.254 TCP 66 59027 > http [ACK] Seq=1 Ack=1 Win=14720 Len=0 TSval=44246815 TSecr=3364533548  tcp.stream == 7
278  10.660941 216.165.108.217 -> 4.26.251.254 TCP 74 59028 > http [SYN] Seq=0 Win=14600 Len=0 MSS=1460 SACK_PERM=1 TSval=44246822 TSecr=0 WS=128  tcp.stream == 8
279  10.661734 4.26.251.254 -> 216.165.108.217 TCP 74 http > 59028 [SYN, ACK] Seq=0 Ack=1 Win=5792 Len=0 MSS=1460 SACK_PERM=1 TSval=2692413908 TSecr=44246822 WS=128  tcp.stream == 8
280  10.661760 216.165.108.217 -> 4.26.251.254 TCP 66 59028 > http [ACK] Seq=1 Ack=1 Win=14720 Len=0 TSval=44246822 TSecr=2692413908  tcp.stream == 8
281  10.690745 216.165.108.217 -> 4.26.251.254 TCP 66 59024 > http [FIN, ACK] Seq=475 Ack=41073 Win=55168 Len=0 TSval=44246830 TSecr=3364533526  tcp.stream == 4
282  10.691593 4.26.251.254 -> 216.165.108.217 TCP 66 http > 59024 [FIN, ACK] Seq=41073 Ack=476 Win=6912 Len=0 TSval=3364533607 TSecr=44246830  tcp.stream == 4
283  10.691618 216.165.108.217 -> 4.26.251.254 TCP 66 59024 > http [ACK] Seq=476 Ack=41074 Win=55168 Len=0 TSval=44246830 TSecr=3364533607  tcp.stream == 4
284  10.696714 216.165.108.217 -> 4.26.251.254 TCP 66 59026 > http [FIN, ACK] Seq=451 Ack=57089 Win=58112 Len=0 TSval=44246831 TSecr=3364533538  tcp.stream == 6
285  10.697608 4.26.251.254 -> 216.165.108.217 TCP 66 http > 59026 [FIN, ACK] Seq=57089 Ack=452 Win=6912 Len=0 TSval=3364533613 TSecr=44246831  tcp.stream == 6
286  10.697631 216.165.108.217 -> 4.26.251.254 TCP 66 59026 > http [ACK] Seq=452 Ack=57090 Win=58112 Len=0 TSval=44246831 TSecr=3364533613  tcp.stream == 6
287  10.718591 216.165.108.217 -> 4.26.251.254 HTTP 525 GET /cnn/mobile/.element/msdp4.2/js/webkit/1.0/weather.js HTTP/1.1   tcp.stream == 7
288  10.719630 4.26.251.254 -> 216.165.108.217 TCP 66 http > 59027 [ACK] Seq=1 Ack=460 Win=6912 Len=0 TSval=3364533635 TSecr=44246837  tcp.stream == 7
289  10.719839 4.26.251.254 -> 216.165.108.217 TCP 1514 [TCP segment of a reassembled PDU]  tcp.stream == 7
290  10.719849 216.165.108.217 -> 4.26.251.254 TCP 66 59027 > http [ACK] Seq=460 Ack=1449 Win=17536 Len=0 TSval=44246837 TSecr=3364533635  tcp.stream == 7
291  10.719876 216.165.108.217 -> 4.26.251.254 HTTP 516 GET /cnn/mobile/.element/global/js/csiManager.js HTTP/1.1   tcp.stream == 8
292  10.719965 4.26.251.254 -> 216.165.108.217 TCP 1514 [TCP segment of a reassembled PDU]  tcp.stream == 7
293  10.719972 216.165.108.217 -> 4.26.251.254 TCP 66 59027 > http [ACK] Seq=460 Ack=2897 Win=20480 Len=0 TSval=44246837 TSecr=3364533635  tcp.stream == 7
294  10.720091 4.26.251.254 -> 216.165.108.217 TCP 1514 [TCP segment of a reassembled PDU]  tcp.stream == 7
295  10.720099 216.165.108.217 -> 4.26.251.254 TCP 66 59027 > http [ACK] Seq=460 Ack=4345 Win=23296 Len=0 TSval=44246837 TSecr=3364533635  tcp.stream == 7
296  10.720758 4.26.251.254 -> 216.165.108.217 TCP 1514 [TCP segment of a reassembled PDU]  tcp.stream == 7
297  10.720775 216.165.108.217 -> 4.26.251.254 TCP 66 59027 > http [ACK] Seq=460 Ack=5793 Win=26240 Len=0 TSval=44246837 TSecr=3364533636  tcp.stream == 7
298  10.720880 4.26.251.254 -> 216.165.108.217 TCP 1514 [TCP segment of a reassembled PDU]  tcp.stream == 7
299  10.720885 216.165.108.217 -> 4.26.251.254 TCP 66 59027 > http [ACK] Seq=460 Ack=7241 Win=29184 Len=0 TSval=44246837 TSecr=3364533636  tcp.stream == 7
300  10.720888 4.26.251.254 -> 216.165.108.217 TCP 66 http > 59028 [ACK] Seq=1 Ack=451 Win=6912 Len=0 TSval=2692413967 TSecr=44246837  tcp.stream == 8
301  10.721011 4.26.251.254 -> 216.165.108.217 TCP 1514 [TCP segment of a reassembled PDU]  tcp.stream == 8
302  10.721016 216.165.108.217 -> 4.26.251.254 TCP 66 59028 > http [ACK] Seq=451 Ack=1449 Win=17536 Len=0 TSval=44246837 TSecr=2692413967  tcp.stream == 8
303  10.721135 4.26.251.254 -> 216.165.108.217 TCP 1514 [TCP segment of a reassembled PDU]  tcp.stream == 7
304  10.721141 216.165.108.217 -> 4.26.251.254 TCP 66 59027 > http [ACK] Seq=460 Ack=8689 Win=32000 Len=0 TSval=44246837 TSecr=3364533636  tcp.stream == 7
305  10.721265 4.26.251.254 -> 216.165.108.217 TCP 1514 [TCP segment of a reassembled PDU]  tcp.stream == 7
306  10.721272 216.165.108.217 -> 4.26.251.254 TCP 66 59027 > http [ACK] Seq=460 Ack=10137 Win=34944 Len=0 TSval=44246837 TSecr=3364533636  tcp.stream == 7
307  10.721387 4.26.251.254 -> 216.165.108.217 TCP 1514 [TCP segment of a reassembled PDU]  tcp.stream == 7
308  10.721393 216.165.108.217 -> 4.26.251.254 TCP 66 59027 > http [ACK] Seq=460 Ack=11585 Win=37888 Len=0 TSval=44246837 TSecr=3364533636  tcp.stream == 7
309  10.721510 4.26.251.254 -> 216.165.108.217 TCP 1514 [TCP segment of a reassembled PDU]  tcp.stream == 7
310  10.721516 216.165.108.217 -> 4.26.251.254 TCP 66 59027 > http [ACK] Seq=460 Ack=13033 Win=40704 Len=0 TSval=44246837 TSecr=3364533637  tcp.stream == 7
311  10.721634 4.26.251.254 -> 216.165.108.217 TCP 1514 [TCP segment of a reassembled PDU]  tcp.stream == 8
312  10.721641 216.165.108.217 -> 4.26.251.254 TCP 66 59028 > http [ACK] Seq=451 Ack=2897 Win=20480 Len=0 TSval=44246837 TSecr=2692413967  tcp.stream == 8
313  10.721757 4.26.251.254 -> 216.165.108.217 TCP 1514 [TCP segment of a reassembled PDU]  tcp.stream == 8
314  10.721763 216.165.108.217 -> 4.26.251.254 TCP 66 59028 > http [ACK] Seq=451 Ack=4345 Win=23296 Len=0 TSval=44246837 TSecr=2692413967  tcp.stream == 8
315  10.721917 4.26.251.254 -> 216.165.108.217 TCP 1514 [TCP segment of a reassembled PDU]  tcp.stream == 7
316  10.721925 216.165.108.217 -> 4.26.251.254 TCP 66 59027 > http [ACK] Seq=460 Ack=14481 Win=43648 Len=0 TSval=44246837 TSecr=3364533637  tcp.stream == 7
317  10.722046 4.26.251.254 -> 216.165.108.217 TCP 1514 [TCP segment of a reassembled PDU]  tcp.stream == 7
318  10.722054 216.165.108.217 -> 4.26.251.254 TCP 66 59027 > http [ACK] Seq=460 Ack=15929 Win=46464 Len=0 TSval=44246838 TSecr=3364533637  tcp.stream == 7
319  10.722170 4.26.251.254 -> 216.165.108.217 TCP 1514 [TCP segment of a reassembled PDU]  tcp.stream == 7
320  10.722175 216.165.108.217 -> 4.26.251.254 TCP 66 59027 > http [ACK] Seq=460 Ack=17377 Win=49408 Len=0 TSval=44246838 TSecr=3364533637  tcp.stream == 7
321  10.722292 4.26.251.254 -> 216.165.108.217 TCP 1514 [TCP segment of a reassembled PDU]  tcp.stream == 8
322  10.722299 216.165.108.217 -> 4.26.251.254 TCP 66 59028 > http [ACK] Seq=451 Ack=5793 Win=26240 Len=0 TSval=44246838 TSecr=2692413968  tcp.stream == 8
323  10.722415 4.26.251.254 -> 216.165.108.217 TCP 1514 [TCP segment of a reassembled PDU]  tcp.stream == 7
324  10.722422 216.165.108.217 -> 4.26.251.254 TCP 66 59027 > http [ACK] Seq=460 Ack=18825 Win=52352 Len=0 TSval=44246838 TSecr=3364533637  tcp.stream == 7
325  10.722538 4.26.251.254 -> 216.165.108.217 TCP 1514 [TCP segment of a reassembled PDU]  tcp.stream == 8
326  10.722545 216.165.108.217 -> 4.26.251.254 TCP 66 59028 > http [ACK] Seq=451 Ack=7241 Win=29184 Len=0 TSval=44246838 TSecr=2692413968  tcp.stream == 8
327  10.722668 4.26.251.254 -> 216.165.108.217 TCP 1514 [TCP segment of a reassembled PDU]  tcp.stream == 7
328  10.722674 216.165.108.217 -> 4.26.251.254 TCP 66 59027 > http [ACK] Seq=460 Ack=20273 Win=54528 Len=0 TSval=44246838 TSecr=3364533638  tcp.stream == 7
329  10.722791 4.26.251.254 -> 216.165.108.217 TCP 1514 [TCP segment of a reassembled PDU]  tcp.stream == 7
330  10.722798 216.165.108.217 -> 4.26.251.254 TCP 66 59027 > http [ACK] Seq=460 Ack=21721 Win=53120 Len=0 TSval=44246838 TSecr=3364533638  tcp.stream == 7
331  10.722914 4.26.251.254 -> 216.165.108.217 TCP 1514 [TCP segment of a reassembled PDU]  tcp.stream == 7
332  10.722920 216.165.108.217 -> 4.26.251.254 TCP 66 59027 > http [ACK] Seq=460 Ack=23169 Win=51840 Len=0 TSval=44246838 TSecr=3364533638  tcp.stream == 7
333  10.723037 4.26.251.254 -> 216.165.108.217 TCP 1514 [TCP segment of a reassembled PDU]  tcp.stream == 7
334  10.723043 216.165.108.217 -> 4.26.251.254 TCP 66 59027 > http [ACK] Seq=460 Ack=24617 Win=50432 Len=0 TSval=44246838 TSecr=3364533638  tcp.stream == 7
335  10.723161 4.26.251.254 -> 216.165.108.217 TCP 1514 [TCP segment of a reassembled PDU]  tcp.stream == 7
336  10.723167 216.165.108.217 -> 4.26.251.254 TCP 66 59027 > http [ACK] Seq=460 Ack=26065 Win=49024 Len=0 TSval=44246838 TSecr=3364533638  tcp.stream == 7
337  10.723284 4.26.251.254 -> 216.165.108.217 TCP 1514 [TCP segment of a reassembled PDU]  tcp.stream == 7
338  10.723405 4.26.251.254 -> 216.165.108.217 TCP 1514 [TCP segment of a reassembled PDU]  tcp.stream == 7
339  10.723535 4.26.251.254 -> 216.165.108.217 TCP 1514 [TCP segment of a reassembled PDU]  tcp.stream == 7
340  10.723603 216.165.108.217 -> 4.26.251.254 TCP 66 59027 > http [ACK] Seq=460 Ack=30409 Win=44928 Len=0 TSval=44246838 TSecr=3364533638  tcp.stream == 7
341  10.723654 4.26.251.254 -> 216.165.108.217 TCP 1514 [TCP segment of a reassembled PDU]  tcp.stream == 8
342  10.723660 216.165.108.217 -> 4.26.251.254 TCP 66 59028 > http [ACK] Seq=451 Ack=8689 Win=32000 Len=0 TSval=44246838 TSecr=2692413970  tcp.stream == 8
343  10.723790 4.26.251.254 -> 216.165.108.217 TCP 1514 [TCP segment of a reassembled PDU]  tcp.stream == 8
344  10.723795 216.165.108.217 -> 4.26.251.254 TCP 66 59028 > http [ACK] Seq=451 Ack=10137 Win=34944 Len=0 TSval=44246838 TSecr=2692413970  tcp.stream == 8
345  10.723913 4.26.251.254 -> 216.165.108.217 TCP 1514 [TCP segment of a reassembled PDU]  tcp.stream == 8
346  10.723920 216.165.108.217 -> 4.26.251.254 TCP 66 59028 > http [ACK] Seq=451 Ack=11585 Win=37888 Len=0 TSval=44246838 TSecr=2692413970  tcp.stream == 8
347  10.724036 4.26.251.254 -> 216.165.108.217 TCP 1514 [TCP segment of a reassembled PDU]  tcp.stream == 8
348  10.724043 216.165.108.217 -> 4.26.251.254 TCP 66 59028 > http [ACK] Seq=451 Ack=13033 Win=40704 Len=0 TSval=44246838 TSecr=2692413970  tcp.stream == 8
349  10.724159 4.26.251.254 -> 216.165.108.217 TCP 1514 [TCP segment of a reassembled PDU]  tcp.stream == 8
350  10.724167 216.165.108.217 -> 4.26.251.254 TCP 66 59028 > http [ACK] Seq=451 Ack=14481 Win=43648 Len=0 TSval=44246838 TSecr=2692413970  tcp.stream == 8
351  10.724281 4.26.251.254 -> 216.165.108.217 TCP 1514 [TCP segment of a reassembled PDU]  tcp.stream == 8
352  10.724287 216.165.108.217 -> 4.26.251.254 TCP 66 59028 > http [ACK] Seq=451 Ack=15929 Win=46464 Len=0 TSval=44246838 TSecr=2692413970  tcp.stream == 8
353  10.724404 4.26.251.254 -> 216.165.108.217 TCP 1514 [TCP segment of a reassembled PDU]  tcp.stream == 7
354  10.724528 4.26.251.254 -> 216.165.108.217 TCP 1514 [TCP segment of a reassembled PDU]  tcp.stream == 7
355  10.724535 216.165.108.217 -> 4.26.251.254 TCP 66 59027 > http [ACK] Seq=460 Ack=33305 Win=50432 Len=0 TSval=44246838 TSecr=3364533639  tcp.stream == 7
356  10.724650 4.26.251.254 -> 216.165.108.217 TCP 1514 [TCP segment of a reassembled PDU]  tcp.stream == 7
357  10.724773 4.26.251.254 -> 216.165.108.217 TCP 1514 [TCP segment of a reassembled PDU]  tcp.stream == 7
358  10.724897 4.26.251.254 -> 216.165.108.217 TCP 1514 [TCP segment of a reassembled PDU]  tcp.stream == 7
359  10.724969 4.26.251.254 -> 216.165.108.217 HTTP 1060 HTTP/1.1 200 OK  (application/x-javascript)  tcp.stream == 7
360  10.725162 4.26.251.254 -> 216.165.108.217 TCP 1514 [TCP segment of a reassembled PDU]  tcp.stream == 8
361  10.725173 216.165.108.217 -> 4.26.251.254 TCP 66 59028 > http [ACK] Seq=451 Ack=17377 Win=49408 Len=0 TSval=44246838 TSecr=2692413971  tcp.stream == 8
362  10.725285 4.26.251.254 -> 216.165.108.217 TCP 1514 [TCP segment of a reassembled PDU]  tcp.stream == 8
363  10.725292 216.165.108.217 -> 4.26.251.254 TCP 66 59028 > http [ACK] Seq=451 Ack=18825 Win=52352 Len=0 TSval=44246838 TSecr=2692413971  tcp.stream == 8
364  10.725409 4.26.251.254 -> 216.165.108.217 TCP 1514 [TCP segment of a reassembled PDU]  tcp.stream == 8
365  10.725415 216.165.108.217 -> 4.26.251.254 TCP 66 59028 > http [ACK] Seq=451 Ack=20273 Win=53120 Len=0 TSval=44246838 TSecr=2692413971  tcp.stream == 8
366  10.725418 4.26.251.254 -> 216.165.108.217 HTTP 489 HTTP/1.1 200 OK  (application/x-javascript)  tcp.stream == 8
367  10.725421 216.165.108.217 -> 4.26.251.254 TCP 66 59028 > http [ACK] Seq=451 Ack=20696 Win=52736 Len=0 TSval=44246838 TSecr=2692413971  tcp.stream == 8
368  10.728607 216.165.108.217 -> 4.26.251.254 TCP 66 59027 > http [ACK] Seq=460 Ack=38643 Win=45184 Len=0 TSval=44246839 TSecr=3364533639  tcp.stream == 7
369  10.733402 216.165.108.217 -> 4.26.251.254 TCP 66 59025 > http [FIN, ACK] Seq=457 Ack=9372 Win=34944 Len=0 TSval=44246840 TSecr=2692413878  tcp.stream == 5
370  10.734337 4.26.251.254 -> 216.165.108.217 TCP 66 http > 59025 [FIN, ACK] Seq=9372 Ack=458 Win=6912 Len=0 TSval=2692413981 TSecr=44246840  tcp.stream == 5
371  10.734362 216.165.108.217 -> 4.26.251.254 TCP 66 59025 > http [ACK] Seq=458 Ack=9373 Win=34944 Len=0 TSval=44246841 TSecr=2692413981  tcp.stream == 5
372  10.759699 216.165.108.217 -> 4.26.251.254 TCP 66 59028 > http [FIN, ACK] Seq=451 Ack=20696 Win=55168 Len=0 TSval=44246847 TSecr=2692413971  tcp.stream == 8
373  10.760666 4.26.251.254 -> 216.165.108.217 TCP 66 http > 59028 [FIN, ACK] Seq=20696 Ack=452 Win=6912 Len=0 TSval=2692414007 TSecr=44246847  tcp.stream == 8
374  10.760690 216.165.108.217 -> 4.26.251.254 TCP 66 59028 > http [ACK] Seq=452 Ack=20697 Win=55168 Len=0 TSval=44246847 TSecr=2692414007  tcp.stream == 8
375  10.772346 216.165.108.217 -> 4.26.251.254 TCP 66 59027 > http [FIN, ACK] Seq=460 Ack=38643 Win=55168 Len=0 TSval=44246850 TSecr=3364533639  tcp.stream == 7
376  10.773271 4.26.251.254 -> 216.165.108.217 TCP 66 http > 59027 [FIN, ACK] Seq=38643 Ack=461 Win=6912 Len=0 TSval=3364533689 TSecr=44246850  tcp.stream == 7
377  10.773296 216.165.108.217 -> 4.26.251.254 TCP 66 59027 > http [ACK] Seq=461 Ack=38644 Win=55168 Len=0 TSval=44246850 TSecr=3364533689  tcp.stream == 7
385  11.914452 216.165.108.217 -> 157.166.246.200 TCP 74 41381 > http [SYN] Seq=0 Win=14600 Len=0 MSS=1460 SACK_PERM=1 TSval=44247136 TSecr=0 WS=128  tcp.stream == 9
386  11.935258 157.166.246.200 -> 216.165.108.217 TCP 74 http > 41381 [SYN, ACK] Seq=0 Ack=1 Win=14600 Len=0 MSS=1460 WS=128 TSval=2761211136 TSecr=44247136  tcp.stream == 9
387  11.935285 216.165.108.217 -> 157.166.246.200 TCP 66 41381 > http [ACK] Seq=1 Ack=1 Win=14720 Len=0 TSval=44247141 TSecr=2761211136  tcp.stream == 9
388  11.937240 216.165.108.217 -> 157.166.246.200 HTTP 640 GET /primary/_Faceu1-IAgqbzV1Lzq HTTP/1.1   tcp.stream == 9
389  11.959170 157.166.246.200 -> 216.165.108.217 TCP 66 http > 41381 [ACK] Seq=1 Ack=575 Win=7040 Len=0 TSval=2761211142 TSecr=44247141  tcp.stream == 9
391  11.975371 157.166.246.200 -> 216.165.108.217 TCP 1434 [TCP segment of a reassembled PDU]  tcp.stream == 9
392  11.975392 216.165.108.217 -> 157.166.246.200 TCP 66 41381 > http [ACK] Seq=575 Ack=1369 Win=17408 Len=0 TSval=44247151 TSecr=2761211146  tcp.stream == 9
393  11.975397 157.166.246.200 -> 216.165.108.217 HTTP 582 HTTP/1.1 200 OK  (GIF89a)  tcp.stream == 9
394  11.975400 216.165.108.217 -> 157.166.246.200 TCP 66 41381 > http [ACK] Seq=575 Ack=1885 Win=20096 Len=0 TSval=44247151 TSecr=2761211146  tcp.stream == 9
395  11.975402 157.166.246.200 -> 216.165.108.217 TCP 66 http > 41381 [FIN, ACK] Seq=1885 Ack=575 Win=7040 Len=0 TSval=2761211146 TSecr=44247141  tcp.stream == 9
396  11.983200 216.165.108.217 -> 157.166.246.200 TCP 66 41381 > http [FIN, ACK] Seq=575 Ack=1886 Win=20096 Len=0 TSval=44247153 TSecr=2761211146  tcp.stream == 9
397  12.005118 157.166.246.200 -> 216.165.108.217 TCP 66 http > 41381 [ACK] Seq=1886 Ack=576 Win=7040 Len=0 TSval=2761211154 TSecr=44247153  tcp.stream == 9
398  12.150002 216.165.108.217 -> 4.26.251.254 TCP 74 59030 > http [SYN] Seq=0 Win=14600 Len=0 MSS=1460 SACK_PERM=1 TSval=44247195 TSecr=0 WS=128  tcp.stream == 10
399  12.150825 4.26.251.254 -> 216.165.108.217 TCP 74 http > 59030 [SYN, ACK] Seq=0 Ack=1 Win=5792 Len=0 MSS=1460 SACK_PERM=1 TSval=3364534106 TSecr=44247195 WS=128  tcp.stream == 10
400  12.150845 216.165.108.217 -> 4.26.251.254 TCP 66 59030 > http [ACK] Seq=1 Ack=1 Win=14720 Len=0 TSval=44247195 TSecr=3364534106  tcp.stream == 10
401  12.153814 216.165.108.217 -> 4.26.251.254 HTTP 505 GET /cnn/mobile/.element/img/1.0/webkit/tab-on.png HTTP/1.1   tcp.stream == 10
402  12.154628 4.26.251.254 -> 216.165.108.217 TCP 66 http > 59030 [ACK] Seq=1 Ack=440 Win=6912 Len=0 TSval=3364534110 TSecr=44247195  tcp.stream == 10
403  12.155897 4.26.251.254 -> 216.165.108.217 HTTP 520 HTTP/1.1 200 OK  (PNG)  tcp.stream == 10
404  12.155918 216.165.108.217 -> 4.26.251.254 TCP 66 59030 > http [ACK] Seq=440 Ack=455 Win=15744 Len=0 TSval=44247196 TSecr=3364534111  tcp.stream == 10
406  12.162446 216.165.108.217 -> 4.26.251.254 TCP 74 59031 > http [SYN] Seq=0 Win=14600 Len=0 MSS=1460 SACK_PERM=1 TSval=44247198 TSecr=0 WS=128  tcp.stream == 11
407  12.163265 4.26.251.254 -> 216.165.108.217 TCP 74 http > 59031 [SYN, ACK] Seq=0 Ack=1 Win=5792 Len=0 MSS=1460 SACK_PERM=1 TSval=3364532118 TSecr=44247198 WS=128  tcp.stream == 11
408  12.163297 216.165.108.217 -> 4.26.251.254 TCP 66 59031 > http [ACK] Seq=1 Ack=1 Win=14720 Len=0 TSval=44247198 TSecr=3364532118  tcp.stream == 11
409  12.168639 216.165.108.217 -> 4.26.251.254 TCP 66 59030 > http [FIN, ACK] Seq=440 Ack=455 Win=15744 Len=0 TSval=44247199 TSecr=3364534111  tcp.stream == 10
410  12.170581 4.26.251.254 -> 216.165.108.217 TCP 66 http > 59030 [FIN, ACK] Seq=455 Ack=441 Win=6912 Len=0 TSval=3364534125 TSecr=44247199  tcp.stream == 10
411  12.170613 216.165.108.217 -> 4.26.251.254 TCP 66 59030 > http [ACK] Seq=441 Ack=456 Win=15744 Len=0 TSval=44247200 TSecr=3364534125  tcp.stream == 10
413  12.229992 216.165.108.217 -> 4.26.251.254 TCP 74 59032 > http [SYN] Seq=0 Win=14600 Len=0 MSS=1460 SACK_PERM=1 TSval=44247214 TSecr=0 WS=128  tcp.stream == 12
414  12.231256 4.26.251.254 -> 216.165.108.217 TCP 74 http > 59032 [SYN, ACK] Seq=0 Ack=1 Win=5792 Len=0 MSS=1460 SACK_PERM=1 TSval=45478143 TSecr=44247214 WS=128  tcp.stream == 12
415  12.231278 216.165.108.217 -> 4.26.251.254 TCP 66 59032 > http [ACK] Seq=1 Ack=1 Win=14720 Len=0 TSval=44247215 TSecr=45478143  tcp.stream == 12
416  12.260472 216.165.108.217 -> 4.26.251.254 TCP 74 59033 > http [SYN] Seq=0 Win=14600 Len=0 MSS=1460 SACK_PERM=1 TSval=44247222 TSecr=0 WS=128  tcp.stream == 13
417  12.261319 4.26.251.254 -> 216.165.108.217 TCP 74 http > 59033 [SYN, ACK] Seq=0 Ack=1 Win=5792 Len=0 MSS=1460 SACK_PERM=1 TSval=3364535186 TSecr=44247222 WS=128  tcp.stream == 13
418  12.261339 216.165.108.217 -> 4.26.251.254 TCP 66 59033 > http [ACK] Seq=1 Ack=1 Win=14720 Len=0 TSval=44247222 TSecr=3364535186  tcp.stream == 13
419  12.261723 216.165.108.217 -> 4.26.251.254 TCP 74 59034 > http [SYN] Seq=0 Win=14600 Len=0 MSS=1460 SACK_PERM=1 TSval=44247222 TSecr=0 WS=128  tcp.stream == 14
420  12.262425 4.26.251.254 -> 216.165.108.217 TCP 74 http > 59034 [SYN, ACK] Seq=0 Ack=1 Win=5792 Len=0 MSS=1460 SACK_PERM=1 TSval=3364535676 TSecr=44247222 WS=128  tcp.stream == 14
421  12.262444 216.165.108.217 -> 4.26.251.254 TCP 66 59034 > http [ACK] Seq=1 Ack=1 Win=14720 Len=0 TSval=44247223 TSecr=3364535676  tcp.stream == 14
422  12.290410 216.165.108.217 -> 157.166.246.200 TCP 74 41387 > http [SYN] Seq=0 Win=14600 Len=0 MSS=1460 SACK_PERM=1 TSval=44247230 TSecr=0 WS=128  tcp.stream == 15
423  12.292015 216.165.108.217 -> 157.166.246.200 TCP 74 41388 > http [SYN] Seq=0 Win=14600 Len=0 MSS=1460 SACK_PERM=1 TSval=44247230 TSecr=0 WS=128  tcp.stream == 16
424  12.293286 216.165.108.217 -> 157.166.246.200 TCP 74 41389 > http [SYN] Seq=0 Win=14600 Len=0 MSS=1460 SACK_PERM=1 TSval=44247230 TSecr=0 WS=128  tcp.stream == 17
425  12.294495 216.165.108.217 -> 157.166.246.200 TCP 74 41390 > http [SYN] Seq=0 Win=14600 Len=0 MSS=1460 SACK_PERM=1 TSval=44247231 TSecr=0 WS=128  tcp.stream == 18
426  12.296401 216.165.108.217 -> 157.166.246.200 TCP 74 41391 > http [SYN] Seq=0 Win=14600 Len=0 MSS=1460 SACK_PERM=1 TSval=44247231 TSecr=0 WS=128  tcp.stream == 19
427  12.297665 216.165.108.217 -> 157.166.246.200 TCP 74 41392 > http [SYN] Seq=0 Win=14600 Len=0 MSS=1460 SACK_PERM=1 TSval=44247231 TSecr=0 WS=128  tcp.stream == 20
428  12.309540 157.166.246.200 -> 216.165.108.217 TCP 74 http > 41387 [SYN, ACK] Seq=0 Ack=1 Win=14600 Len=0 MSS=1460 WS=128 TSval=2761211230 TSecr=44247230  tcp.stream == 15
429  12.309562 216.165.108.217 -> 157.166.246.200 TCP 66 41387 > http [ACK] Seq=1 Ack=1 Win=14720 Len=0 TSval=44247234 TSecr=2761211230  tcp.stream == 15
430  12.311386 157.166.246.200 -> 216.165.108.217 TCP 74 http > 41388 [SYN, ACK] Seq=0 Ack=1 Win=14600 Len=0 MSS=1460 WS=128 TSval=2761211231 TSecr=44247230  tcp.stream == 16
431  12.311408 216.165.108.217 -> 157.166.246.200 TCP 66 41388 > http [ACK] Seq=1 Ack=1 Win=14720 Len=0 TSval=44247235 TSecr=2761211231  tcp.stream == 16
432  12.312315 157.166.246.200 -> 216.165.108.217 TCP 74 http > 41389 [SYN, ACK] Seq=0 Ack=1 Win=14600 Len=0 MSS=1460 WS=128 TSval=2761211231 TSecr=44247230  tcp.stream == 17
433  12.312335 216.165.108.217 -> 157.166.246.200 TCP 66 41389 > http [ACK] Seq=1 Ack=1 Win=14720 Len=0 TSval=44247235 TSecr=2761211231  tcp.stream == 17
434  12.313788 157.166.246.200 -> 216.165.108.217 TCP 74 http > 41390 [SYN, ACK] Seq=0 Ack=1 Win=14600 Len=0 MSS=1460 WS=128 TSval=2761211232 TSecr=44247231  tcp.stream == 18
435  12.313808 216.165.108.217 -> 157.166.246.200 TCP 66 41390 > http [ACK] Seq=1 Ack=1 Win=14720 Len=0 TSval=44247235 TSecr=2761211232  tcp.stream == 18
436  12.315598 157.166.246.200 -> 216.165.108.217 TCP 74 http > 41391 [SYN, ACK] Seq=0 Ack=1 Win=14600 Len=0 MSS=1460 WS=128 TSval=2761211232 TSecr=44247231  tcp.stream == 19
437  12.315616 216.165.108.217 -> 157.166.246.200 TCP 66 41391 > http [ACK] Seq=1 Ack=1 Win=14720 Len=0 TSval=44247236 TSecr=2761211232  tcp.stream == 19
438  12.317285 157.166.246.200 -> 216.165.108.217 TCP 74 http > 41392 [SYN, ACK] Seq=0 Ack=1 Win=14600 Len=0 MSS=1460 WS=128 TSval=2761211232 TSecr=44247231  tcp.stream == 20
439  12.317304 216.165.108.217 -> 157.166.246.200 TCP 66 41392 > http [ACK] Seq=1 Ack=1 Win=14720 Len=0 TSval=44247236 TSecr=2761211232  tcp.stream == 20
440  12.347601 216.165.108.217 -> 4.26.251.254 HTTP 508 GET /cnn/mobile/.element/img/1.0/webkit/listArrow.png HTTP/1.1   tcp.stream == 11
441  12.348692 216.165.108.217 -> 4.26.251.254 HTTP 505 GET /cnn/mobile/.element/img/1.0/webkit/reddot.png HTTP/1.1   tcp.stream == 12
442  12.348810 4.26.251.254 -> 216.165.108.217 TCP 66 http > 59031 [ACK] Seq=1 Ack=443 Win=6912 Len=0 TSval=3364532304 TSecr=44247244  tcp.stream == 11
443  12.349111 4.26.251.254 -> 216.165.108.217 HTTP 520 HTTP/1.1 200 OK  (PNG)  tcp.stream == 11
444  12.349124 216.165.108.217 -> 4.26.251.254 TCP 66 59031 > http [ACK] Seq=443 Ack=455 Win=15744 Len=0 TSval=44247244 TSecr=3364532304  tcp.stream == 11
445  12.349455 4.26.251.254 -> 216.165.108.217 TCP 66 http > 59032 [ACK] Seq=1 Ack=440 Win=6912 Len=0 TSval=45478261 TSecr=44247244  tcp.stream == 12
446  12.349752 216.165.108.217 -> 4.26.251.254 HTTP 517 GET /cnn/mobile/.element/img/1.0/webkit/international.icon.gif HTTP/1.1   tcp.stream == 13
447  12.349932 4.26.251.254 -> 216.165.108.217 TCP 1514 [TCP segment of a reassembled PDU]  tcp.stream == 12
448  12.349942 216.165.108.217 -> 4.26.251.254 TCP 66 59032 > http [ACK] Seq=440 Ack=1449 Win=17536 Len=0 TSval=44247244 TSecr=45478262  tcp.stream == 12
449  12.350057 4.26.251.254 -> 216.165.108.217 TCP 1514 [TCP segment of a reassembled PDU]  tcp.stream == 12
450  12.350061 216.165.108.217 -> 4.26.251.254 TCP 66 59032 > http [ACK] Seq=440 Ack=2897 Win=20480 Len=0 TSval=44247245 TSecr=45478262  tcp.stream == 12
451  12.350111 4.26.251.254 -> 216.165.108.217 HTTP 1021 HTTP/1.1 200 OK  (PNG)  tcp.stream == 12
452  12.350115 216.165.108.217 -> 4.26.251.254 TCP 66 59032 > http [ACK] Seq=440 Ack=3852 Win=23296 Len=0 TSval=44247245 TSecr=45478262  tcp.stream == 12
453  12.350569 4.26.251.254 -> 216.165.108.217 TCP 66 http > 59033 [ACK] Seq=1 Ack=452 Win=6912 Len=0 TSval=3364535275 TSecr=44247244  tcp.stream == 13
454  12.351129 216.165.108.217 -> 4.26.251.254 HTTP 508 GET /cnn/mobile/.element/img/1.0/webkit/redButton.png HTTP/1.1   tcp.stream == 14
455  12.352056 4.26.251.254 -> 216.165.108.217 TCP 66 http > 59034 [ACK] Seq=1 Ack=443 Win=6912 Len=0 TSval=3364535765 TSecr=44247245  tcp.stream == 14
456  12.352172 216.165.108.217 -> 157.166.246.200 HTTP 640 GET /primary/_Faceu1-ItgqbKr0WVL HTTP/1.1   tcp.stream == 15
457  12.352399 4.26.251.254 -> 216.165.108.217 HTTP 1261 HTTP/1.1 200 OK  (GIF89a)  tcp.stream == 13
458  12.352407 216.165.108.217 -> 4.26.251.254 TCP 66 59033 > http [ACK] Seq=452 Ack=1196 Win=17024 Len=0 TSval=44247245 TSecr=3364535277  tcp.stream == 13
459  12.352737 4.26.251.254 -> 216.165.108.217 TCP 1514 [TCP segment of a reassembled PDU]  tcp.stream == 14
460  12.352747 216.165.108.217 -> 4.26.251.254 TCP 66 59034 > http [ACK] Seq=443 Ack=1449 Win=17536 Len=0 TSval=44247245 TSecr=3364535766  tcp.stream == 14
461  12.352751 4.26.251.254 -> 216.165.108.217 HTTP 80 HTTP/1.1 200 OK  (PNG)  tcp.stream == 14
462  12.352753 216.165.108.217 -> 4.26.251.254 TCP 66 59034 > http [ACK] Seq=443 Ack=1463 Win=17536 Len=0 TSval=44247245 TSecr=3364535766  tcp.stream == 14
463  12.353201 216.165.108.217 -> 157.166.246.200 HTTP 640 GET /primary/_Faceu1-Iugqbm4Ve4k HTTP/1.1   tcp.stream == 16
464  12.354232 216.165.108.217 -> 157.166.246.200 HTTP 640 GET /primary/_Faceu1-IsgqbYBPcDT HTTP/1.1   tcp.stream == 19
465  12.355653 216.165.108.217 -> 157.166.246.200 HTTP 638 GET /primary/_Faceu1-Iac6sfe5i HTTP/1.1   tcp.stream == 18
466  12.356862 216.165.108.217 -> 157.166.246.200 HTTP 639 GET /primary/_Faceu1-I7qO9yuNcR HTTP/1.1   tcp.stream == 17
467  12.357944 216.165.108.217 -> 157.166.246.200 HTTP 639 GET /primary/_Faceu1-I6LNmf5bO8 HTTP/1.1   tcp.stream == 20
469  12.371708 157.166.246.200 -> 216.165.108.217 TCP 66 http > 41387 [ACK] Seq=1 Ack=575 Win=7040 Len=0 TSval=2761211246 TSecr=44247245  tcp.stream == 15
470  12.372674 157.166.246.200 -> 216.165.108.217 TCP 66 http > 41388 [ACK] Seq=1 Ack=575 Win=7040 Len=0 TSval=2761211246 TSecr=44247245  tcp.stream == 16
471  12.373547 157.166.246.200 -> 216.165.108.217 TCP 66 http > 41391 [ACK] Seq=1 Ack=575 Win=7040 Len=0 TSval=2761211246 TSecr=44247246  tcp.stream == 19
472  12.375183 157.166.246.200 -> 216.165.108.217 TCP 66 http > 41390 [ACK] Seq=1 Ack=573 Win=7040 Len=0 TSval=2761211247 TSecr=44247246  tcp.stream == 18
473  12.376339 157.166.246.200 -> 216.165.108.217 TCP 66 http > 41389 [ACK] Seq=1 Ack=574 Win=7040 Len=0 TSval=2761211247 TSecr=44247246  tcp.stream == 17
474  12.377064 157.166.246.200 -> 216.165.108.217 HTTP 805 HTTP/1.1 200 OK  (PNG)  tcp.stream == 16
475  12.377076 216.165.108.217 -> 157.166.246.200 TCP 66 41388 > http [ACK] Seq=575 Ack=740 Win=16128 Len=0 TSval=44247251 TSecr=2761211247  tcp.stream == 16
476  12.377081 157.166.246.200 -> 216.165.108.217 TCP 66 http > 41388 [FIN, ACK] Seq=740 Ack=575 Win=7040 Len=0 TSval=2761211247 TSecr=44247245  tcp.stream == 16
477  12.377127 157.166.246.200 -> 216.165.108.217 TCP 66 http > 41392 [ACK] Seq=1 Ack=574 Win=7040 Len=0 TSval=2761211247 TSecr=44247246  tcp.stream == 20
478  12.378609 157.166.246.200 -> 216.165.108.217 HTTP 1014 HTTP/1.1 200 OK  (PNG)  tcp.stream == 19
479  12.378623 216.165.108.217 -> 157.166.246.200 TCP 66 41391 > http [ACK] Seq=575 Ack=949 Win=16512 Len=0 TSval=44247252 TSecr=2761211248  tcp.stream == 19
480  12.378628 157.166.246.200 -> 216.165.108.217 TCP 66 http > 41391 [FIN, ACK] Seq=949 Ack=575 Win=7040 Len=0 TSval=2761211248 TSecr=44247246  tcp.stream == 19
481  12.385605 157.166.246.200 -> 216.165.108.217 HTTP 924 HTTP/1.1 200 OK  (PNG)  tcp.stream == 15
482  12.385622 216.165.108.217 -> 157.166.246.200 TCP 66 41387 > http [ACK] Seq=575 Ack=859 Win=16384 Len=0 TSval=44247253 TSecr=2761211249  tcp.stream == 15
483  12.385627 157.166.246.200 -> 216.165.108.217 TCP 66 http > 41387 [FIN, ACK] Seq=859 Ack=575 Win=7040 Len=0 TSval=2761211249 TSecr=44247245  tcp.stream == 15
484  12.404458 157.166.246.200 -> 216.165.108.217 TCP 1434 [TCP segment of a reassembled PDU]  tcp.stream == 20
485  12.404473 216.165.108.217 -> 157.166.246.200 TCP 66 41392 > http [ACK] Seq=574 Ack=1369 Win=17408 Len=0 TSval=44247258 TSecr=2761211254  tcp.stream == 20
486  12.404478 157.166.246.200 -> 216.165.108.217 HTTP 204 HTTP/1.1 200 OK  (JPEG JFIF image)  tcp.stream == 20
487  12.404480 216.165.108.217 -> 157.166.246.200 TCP 66 41392 > http [ACK] Seq=574 Ack=1507 Win=20096 Len=0 TSval=44247258 TSecr=2761211254  tcp.stream == 20
488  12.404482 157.166.246.200 -> 216.165.108.217 TCP 66 http > 41392 [FIN, ACK] Seq=1507 Ack=574 Win=7040 Len=0 TSval=2761211254 TSecr=44247246  tcp.stream == 20
489  12.407303 216.165.108.217 -> 4.26.251.254 TCP 66 59032 > http [FIN, ACK] Seq=440 Ack=3852 Win=23296 Len=0 TSval=44247259 TSecr=45478262  tcp.stream == 12
490  12.408251 216.165.108.217 -> 4.26.251.254 TCP 66 59031 > http [FIN, ACK] Seq=443 Ack=455 Win=15744 Len=0 TSval=44247259 TSecr=3364532304  tcp.stream == 11
491  12.408307 4.26.251.254 -> 216.165.108.217 TCP 66 http > 59032 [FIN, ACK] Seq=3852 Ack=441 Win=6912 Len=0 TSval=45478320 TSecr=44247259  tcp.stream == 12
492  12.408319 216.165.108.217 -> 4.26.251.254 TCP 66 59032 > http [ACK] Seq=441 Ack=3853 Win=23296 Len=0 TSval=44247259 TSecr=45478320  tcp.stream == 12
493  12.409182 157.166.246.200 -> 216.165.108.217 HTTP 445 HTTP/1.1 200 OK  (GIF89a)  tcp.stream == 18
494  12.409196 216.165.108.217 -> 157.166.246.200 TCP 66 41390 > http [ACK] Seq=573 Ack=380 Win=15744 Len=0 TSval=44247259 TSecr=2761211255  tcp.stream == 18
495  12.409201 157.166.246.200 -> 216.165.108.217 TCP 66 http > 41390 [FIN, ACK] Seq=380 Ack=573 Win=7040 Len=0 TSval=2761211255 TSecr=44247246  tcp.stream == 18
496  12.409245 4.26.251.254 -> 216.165.108.217 TCP 66 http > 59031 [FIN, ACK] Seq=455 Ack=444 Win=6912 Len=0 TSval=3364532364 TSecr=44247259  tcp.stream == 11
497  12.409252 216.165.108.217 -> 4.26.251.254 TCP 66 59031 > http [ACK] Seq=444 Ack=456 Win=15744 Len=0 TSval=44247259 TSecr=3364532364  tcp.stream == 11
498  12.409444 216.165.108.217 -> 4.26.251.254 TCP 66 59034 > http [FIN, ACK] Seq=443 Ack=1463 Win=17536 Len=0 TSval=44247259 TSecr=3364535766  tcp.stream == 14
499  12.410285 4.26.251.254 -> 216.165.108.217 TCP 66 http > 59034 [FIN, ACK] Seq=1463 Ack=444 Win=6912 Len=0 TSval=3364535823 TSecr=44247259  tcp.stream == 14
500  12.410301 216.165.108.217 -> 4.26.251.254 TCP 66 59034 > http [ACK] Seq=444 Ack=1464 Win=17536 Len=0 TSval=44247260 TSecr=3364535823  tcp.stream == 14
501  12.413986 216.165.108.217 -> 157.166.246.200 TCP 66 41388 > http [ACK] Seq=575 Ack=741 Win=16128 Len=0 TSval=44247261 TSecr=2761211247  tcp.stream == 16
502  12.417988 216.165.108.217 -> 157.166.246.200 TCP 66 41391 > http [ACK] Seq=575 Ack=950 Win=16512 Len=0 TSval=44247262 TSecr=2761211248  tcp.stream == 19
503  12.421586 216.165.108.217 -> 4.26.251.254 TCP 66 59033 > http [FIN, ACK] Seq=452 Ack=1196 Win=17024 Len=0 TSval=44247262 TSecr=3364535277  tcp.stream == 13
504  12.421986 216.165.108.217 -> 157.166.246.200 TCP 66 41387 > http [ACK] Seq=575 Ack=860 Win=16384 Len=0 TSval=44247263 TSecr=2761211249  tcp.stream == 15
505  12.422386 4.26.251.254 -> 216.165.108.217 TCP 66 http > 59033 [FIN, ACK] Seq=1196 Ack=453 Win=6912 Len=0 TSval=3364535347 TSecr=44247262  tcp.stream == 13
506  12.422403 216.165.108.217 -> 4.26.251.254 TCP 66 59033 > http [ACK] Seq=453 Ack=1197 Win=17024 Len=0 TSval=44247263 TSecr=3364535347  tcp.stream == 13
508  12.437969 216.165.108.217 -> 146.101.146.121 TCP 74 52537 > http [SYN] Seq=0 Win=14600 Len=0 MSS=1460 SACK_PERM=1 TSval=44247266 TSecr=0 WS=128  tcp.stream == 21
509  12.441994 216.165.108.217 -> 157.166.246.200 TCP 66 41392 > http [ACK] Seq=574 Ack=1508 Win=20096 Len=0 TSval=44247268 TSecr=2761211254  tcp.stream == 20
510  12.445989 216.165.108.217 -> 157.166.246.200 TCP 66 41390 > http [ACK] Seq=573 Ack=381 Win=15744 Len=0 TSval=44247269 TSecr=2761211255  tcp.stream == 18
512  12.467880 157.166.246.200 -> 216.165.108.217 TCP 1434 [TCP segment of a reassembled PDU]  tcp.stream == 17
513  12.467898 216.165.108.217 -> 157.166.246.200 TCP 66 41389 > http [ACK] Seq=574 Ack=1369 Win=17408 Len=0 TSval=44247274 TSecr=2761211270  tcp.stream == 17
514  12.467997 157.166.246.200 -> 216.165.108.217 TCP 1434 [TCP segment of a reassembled PDU]  tcp.stream == 17
515  12.468001 216.165.108.217 -> 157.166.246.200 TCP 66 41389 > http [ACK] Seq=574 Ack=2737 Win=20096 Len=0 TSval=44247274 TSecr=2761211270  tcp.stream == 17
516  12.468110 157.166.246.200 -> 216.165.108.217 TCP 1434 [TCP segment of a reassembled PDU]  tcp.stream == 17
517  12.468116 216.165.108.217 -> 157.166.246.200 TCP 66 41389 > http [ACK] Seq=574 Ack=4105 Win=22912 Len=0 TSval=44247274 TSecr=2761211270  tcp.stream == 17
518  12.468119 157.166.246.200 -> 216.165.108.217 TCP 108 [TCP segment of a reassembled PDU]  tcp.stream == 17
519  12.468122 216.165.108.217 -> 157.166.246.200 TCP 66 41389 > http [ACK] Seq=574 Ack=4147 Win=22912 Len=0 TSval=44247274 TSecr=2761211270  tcp.stream == 17
520  12.474297 216.165.108.217 -> 157.166.246.200 TCP 66 41391 > http [FIN, ACK] Seq=575 Ack=950 Win=16512 Len=0 TSval=44247276 TSecr=2761211248  tcp.stream == 19
521  12.475277 216.165.108.217 -> 157.166.246.200 TCP 74 41394 > http [SYN] Seq=0 Win=14600 Len=0 MSS=1460 SACK_PERM=1 TSval=44247276 TSecr=0 WS=128  tcp.stream == 22
522  12.476065 216.165.108.217 -> 157.166.246.200 TCP 66 41388 > http [FIN, ACK] Seq=575 Ack=741 Win=16128 Len=0 TSval=44247276 TSecr=2761211247  tcp.stream == 16
523  12.476743 216.165.108.217 -> 157.166.246.200 TCP 74 41395 > http [SYN] Seq=0 Win=14600 Len=0 MSS=1460 SACK_PERM=1 TSval=44247276 TSecr=0 WS=128  tcp.stream == 23
524  12.477445 216.165.108.217 -> 157.166.246.200 TCP 66 41387 > http [FIN, ACK] Seq=575 Ack=860 Win=16384 Len=0 TSval=44247276 TSecr=2761211249  tcp.stream == 15
525  12.478127 216.165.108.217 -> 157.166.246.200 TCP 74 41396 > http [SYN] Seq=0 Win=14600 Len=0 MSS=1460 SACK_PERM=1 TSval=44247277 TSecr=0 WS=128  tcp.stream == 24
526  12.478789 216.165.108.217 -> 157.166.246.200 TCP 66 41392 > http [FIN, ACK] Seq=574 Ack=1508 Win=20096 Len=0 TSval=44247277 TSecr=2761211254  tcp.stream == 20
527  12.479469 216.165.108.217 -> 157.166.246.200 TCP 74 41397 > http [SYN] Seq=0 Win=14600 Len=0 MSS=1460 SACK_PERM=1 TSval=44247277 TSecr=0 WS=128  tcp.stream == 25
528  12.480145 216.165.108.217 -> 157.166.246.200 TCP 66 41390 > http [FIN, ACK] Seq=573 Ack=381 Win=15744 Len=0 TSval=44247277 TSecr=2761211255  tcp.stream == 18
529  12.487255 157.166.246.200 -> 216.165.108.217 TCP 1434 [TCP segment of a reassembled PDU]  tcp.stream == 17
530  12.487273 216.165.108.217 -> 157.166.246.200 TCP 66 41389 > http [ACK] Seq=574 Ack=5515 Win=25600 Len=0 TSval=44247279 TSecr=2761211275  tcp.stream == 17
531  12.487389 157.166.246.200 -> 216.165.108.217 TCP 1434 [TCP segment of a reassembled PDU]  tcp.stream == 17
532  12.487393 216.165.108.217 -> 157.166.246.200 TCP 66 41389 > http [ACK] Seq=574 Ack=6883 Win=28288 Len=0 TSval=44247279 TSecr=2761211275  tcp.stream == 17
533  12.487506 157.166.246.200 -> 216.165.108.217 TCP 1426 [TCP segment of a reassembled PDU]  tcp.stream == 17
534  12.487510 216.165.108.217 -> 157.166.246.200 TCP 66 41389 > http [ACK] Seq=574 Ack=8243 Win=31104 Len=0 TSval=44247279 TSecr=2761211275  tcp.stream == 17
535  12.487624 157.166.246.200 -> 216.165.108.217 TCP 1434 [TCP segment of a reassembled PDU]  tcp.stream == 17
536  12.487627 216.165.108.217 -> 157.166.246.200 TCP 66 41389 > http [ACK] Seq=574 Ack=9611 Win=33792 Len=0 TSval=44247279 TSecr=2761211275  tcp.stream == 17
537  12.487739 157.166.246.200 -> 216.165.108.217 TCP 1434 [TCP segment of a reassembled PDU]  tcp.stream == 17
538  12.487745 216.165.108.217 -> 157.166.246.200 TCP 66 41389 > http [ACK] Seq=574 Ack=10979 Win=36608 Len=0 TSval=44247279 TSecr=2761211275  tcp.stream == 17
539  12.487856 157.166.246.200 -> 216.165.108.217 TCP 1434 [TCP segment of a reassembled PDU]  tcp.stream == 17
540  12.487861 216.165.108.217 -> 157.166.246.200 TCP 66 41389 > http [ACK] Seq=574 Ack=12347 Win=39296 Len=0 TSval=44247279 TSecr=2761211275  tcp.stream == 17
541  12.487863 157.166.246.200 -> 216.165.108.217 HTTP 400 HTTP/1.1 200 OK  (JPEG JFIF image)  tcp.stream == 17
542  12.493534 157.166.246.200 -> 216.165.108.217 TCP 66 http > 41391 [ACK] Seq=950 Ack=576 Win=7040 Len=0 TSval=2761211276 TSecr=44247276  tcp.stream == 19
543  12.494532 157.166.246.200 -> 216.165.108.217 TCP 74 http > 41394 [SYN, ACK] Seq=0 Ack=1 Win=14600 Len=0 MSS=1460 WS=128 TSval=2761211277 TSecr=44247276  tcp.stream == 22
544  12.494550 216.165.108.217 -> 157.166.246.200 TCP 66 41394 > http [ACK] Seq=1 Ack=1 Win=14720 Len=0 TSval=44247281 TSecr=2761211277  tcp.stream == 22
545  12.495434 157.166.246.200 -> 216.165.108.217 TCP 66 http > 41388 [ACK] Seq=741 Ack=576 Win=7040 Len=0 TSval=2761211277 TSecr=44247276  tcp.stream == 16
546  12.495946 157.166.246.200 -> 216.165.108.217 TCP 74 http > 41395 [SYN, ACK] Seq=0 Ack=1 Win=14600 Len=0 MSS=1460 WS=128 TSval=2761211277 TSecr=44247276  tcp.stream == 23
547  12.495965 216.165.108.217 -> 157.166.246.200 TCP 66 41395 > http [ACK] Seq=1 Ack=1 Win=14720 Len=0 TSval=44247281 TSecr=2761211277  tcp.stream == 23
548  12.496629 157.166.246.200 -> 216.165.108.217 TCP 66 http > 41387 [ACK] Seq=860 Ack=576 Win=7040 Len=0 TSval=2761211277 TSecr=44247276  tcp.stream == 15
549  12.497230 157.166.246.200 -> 216.165.108.217 TCP 74 http > 41396 [SYN, ACK] Seq=0 Ack=1 Win=14600 Len=0 MSS=1460 WS=128 TSval=2761211277 TSecr=44247277  tcp.stream == 24
550  12.497249 216.165.108.217 -> 157.166.246.200 TCP 66 41396 > http [ACK] Seq=1 Ack=1 Win=14720 Len=0 TSval=44247281 TSecr=2761211277  tcp.stream == 24
551  12.498307 157.166.246.200 -> 216.165.108.217 TCP 66 http > 41392 [ACK] Seq=1508 Ack=575 Win=7040 Len=0 TSval=2761211278 TSecr=44247277  tcp.stream == 20
552  12.498756 157.166.246.200 -> 216.165.108.217 TCP 74 http > 41397 [SYN, ACK] Seq=0 Ack=1 Win=14600 Len=0 MSS=1460 WS=128 TSval=2761211278 TSecr=44247277  tcp.stream == 25
553  12.498776 216.165.108.217 -> 157.166.246.200 TCP 66 41397 > http [ACK] Seq=1 Ack=1 Win=14720 Len=0 TSval=44247282 TSecr=2761211278  tcp.stream == 25
554  12.499466 157.166.246.200 -> 216.165.108.217 TCP 66 http > 41390 [ACK] Seq=381 Ack=574 Win=7040 Len=0 TSval=2761211278 TSecr=44247277  tcp.stream == 18
555  12.500065 216.165.108.217 -> 157.166.246.200 TCP 66 41389 > http [FIN, ACK] Seq=574 Ack=12682 Win=41984 Len=0 TSval=44247282 TSecr=2761211275  tcp.stream == 17
556  12.514786 216.165.108.217 -> 157.166.246.200 HTTP 640 GET /primary/_Faceu1-IBgqb9hAj5f HTTP/1.1   tcp.stream == 22
557  12.516393 216.165.108.217 -> 157.166.246.200 HTTP 639 GET /primary/_Faceu1-IX7NXmhnhL HTTP/1.1   tcp.stream == 24
558  12.517417 216.165.108.217 -> 157.166.246.200 HTTP 639 GET /primary/_Faceu1-I2dKILBZhm HTTP/1.1   tcp.stream == 23
559  12.518450 216.165.108.217 -> 157.166.246.200 HTTP 639 GET /primary/_Faceu1-I6IvTkKjFT HTTP/1.1   tcp.stream == 25
560  12.519137 157.166.246.200 -> 216.165.108.217 TCP 66 http > 41389 [ACK] Seq=12682 Ack=575 Win=7040 Len=0 TSval=2761211283 TSecr=44247282  tcp.stream == 17
561  12.534341 157.166.246.200 -> 216.165.108.217 TCP 66 http > 41394 [ACK] Seq=1 Ack=575 Win=7040 Len=0 TSval=2761211287 TSecr=44247286  tcp.stream == 22
562  12.535838 157.166.246.200 -> 216.165.108.217 TCP 66 http > 41396 [ACK] Seq=1 Ack=574 Win=7040 Len=0 TSval=2761211287 TSecr=44247286  tcp.stream == 24
563  12.536875 157.166.246.200 -> 216.165.108.217 TCP 66 http > 41395 [ACK] Seq=1 Ack=574 Win=7040 Len=0 TSval=2761211287 TSecr=44247286  tcp.stream == 23
564  12.537904 157.166.246.200 -> 216.165.108.217 TCP 66 http > 41397 [ACK] Seq=1 Ack=574 Win=7040 Len=0 TSval=2761211288 TSecr=44247287  tcp.stream == 25
565  12.538201 146.101.146.121 -> 216.165.108.217 TCP 74 http > 52537 [SYN, ACK] Seq=0 Ack=1 Win=5792 Len=0 MSS=1380 SACK_PERM=1 TSval=2498474496 TSecr=44247266 WS=4  tcp.stream == 21
566  12.538223 216.165.108.217 -> 146.101.146.121 TCP 66 52537 > http [ACK] Seq=1 Ack=1 Win=14720 Len=0 TSval=44247292 TSecr=2498474496  tcp.stream == 21
567  12.541608 216.165.108.217 -> 146.101.146.121 HTTP 593 GET /exid/111555006919.gif?url=Home&title=CNN&bgo_content=Home&bgo_source=web.mw.cnn.com&bgo_section=Home&random=1329413320455&bgo_custom1=gemini HTTP/1.1   tcp.stream == 21
568  12.548484 157.166.246.200 -> 216.165.108.217 TCP 1434 [TCP segment of a reassembled PDU]  tcp.stream == 22
569  12.548503 216.165.108.217 -> 157.166.246.200 TCP 66 41394 > http [ACK] Seq=575 Ack=1369 Win=17408 Len=0 TSval=44247294 TSecr=2761211290  tcp.stream == 22
570  12.548603 157.166.246.200 -> 216.165.108.217 TCP 1434 [TCP segment of a reassembled PDU]  tcp.stream == 22
571  12.548608 216.165.108.217 -> 157.166.246.200 TCP 66 41394 > http [ACK] Seq=575 Ack=2737 Win=20096 Len=0 TSval=44247294 TSecr=2761211290  tcp.stream == 22
572  12.548610 157.166.246.200 -> 216.165.108.217 HTTP 268 HTTP/1.1 200 OK  (PNG)  tcp.stream == 22
573  12.548614 216.165.108.217 -> 157.166.246.200 TCP 66 41394 > http [ACK] Seq=575 Ack=2939 Win=22912 Len=0 TSval=44247294 TSecr=2761211290  tcp.stream == 22
574  12.548617 157.166.246.200 -> 216.165.108.217 TCP 66 http > 41394 [FIN, ACK] Seq=2939 Ack=575 Win=7040 Len=0 TSval=2761211290 TSecr=44247286  tcp.stream == 22
575  12.551356 157.166.246.200 -> 216.165.108.217 TCP 1434 [TCP segment of a reassembled PDU]  tcp.stream == 24
576  12.551372 216.165.108.217 -> 157.166.246.200 TCP 66 41396 > http [ACK] Seq=574 Ack=1369 Win=17408 Len=0 TSval=44247295 TSecr=2761211291  tcp.stream == 24
577  12.551377 157.166.246.200 -> 216.165.108.217 HTTP 203 HTTP/1.1 200 OK  (JPEG JFIF image)  tcp.stream == 24
578  12.551379 216.165.108.217 -> 157.166.246.200 TCP 66 41396 > http [ACK] Seq=574 Ack=1506 Win=20096 Len=0 TSval=44247295 TSecr=2761211291  tcp.stream == 24
579  12.551381 157.166.246.200 -> 216.165.108.217 TCP 66 http > 41396 [FIN, ACK] Seq=1506 Ack=574 Win=7040 Len=0 TSval=2761211291 TSecr=44247286  tcp.stream == 24
580  12.551890 157.166.246.200 -> 216.165.108.217 HTTP 1412 HTTP/1.1 200 OK  (JPEG JFIF image)  tcp.stream == 23
581  12.551904 216.165.108.217 -> 157.166.246.200 TCP 66 41395 > http [ACK] Seq=574 Ack=1347 Win=17408 Len=0 TSval=44247295 TSecr=2761211291  tcp.stream == 23
582  12.551909 157.166.246.200 -> 216.165.108.217 TCP 66 http > 41395 [FIN, ACK] Seq=1347 Ack=574 Win=7040 Len=0 TSval=2761211291 TSecr=44247286  tcp.stream == 23
583  12.553412 216.165.108.217 -> 157.166.246.200 TCP 66 41394 > http [FIN, ACK] Seq=575 Ack=2940 Win=22912 Len=0 TSval=44247295 TSecr=2761211290  tcp.stream == 22
585  12.572721 157.166.246.200 -> 216.165.108.217 TCP 66 http > 41394 [ACK] Seq=2940 Ack=576 Win=7040 Len=0 TSval=2761211296 TSecr=44247295  tcp.stream == 22
586  12.575365 216.165.108.217 -> 157.166.246.200 TCP 66 41396 > http [FIN, ACK] Seq=574 Ack=1507 Win=20096 Len=0 TSval=44247301 TSecr=2761211291  tcp.stream == 24
587  12.576214 216.165.108.217 -> 157.166.246.200 TCP 66 41395 > http [FIN, ACK] Seq=574 Ack=1348 Win=17408 Len=0 TSval=44247301 TSecr=2761211291  tcp.stream == 23
588  12.583013 157.166.246.200 -> 216.165.108.217 TCP 1434 [TCP segment of a reassembled PDU]  tcp.stream == 25
589  12.583029 216.165.108.217 -> 157.166.246.200 TCP 66 41397 > http [ACK] Seq=574 Ack=1369 Win=17408 Len=0 TSval=44247303 TSecr=2761211299  tcp.stream == 25
590  12.583235 157.166.246.200 -> 216.165.108.217 TCP 1434 [TCP segment of a reassembled PDU]  tcp.stream == 25
591  12.583240 216.165.108.217 -> 157.166.246.200 TCP 66 41397 > http [ACK] Seq=574 Ack=2737 Win=20096 Len=0 TSval=44247303 TSecr=2761211299  tcp.stream == 25
592  12.583350 157.166.246.200 -> 216.165.108.217 TCP 1434 [TCP segment of a reassembled PDU]  tcp.stream == 25
593  12.583356 216.165.108.217 -> 157.166.246.200 TCP 66 41397 > http [ACK] Seq=574 Ack=4105 Win=22912 Len=0 TSval=44247303 TSecr=2761211299  tcp.stream == 25
594  12.583358 157.166.246.200 -> 216.165.108.217 TCP 108 [TCP segment of a reassembled PDU]  tcp.stream == 25
595  12.583361 216.165.108.217 -> 157.166.246.200 TCP 66 41397 > http [ACK] Seq=574 Ack=4147 Win=22912 Len=0 TSval=44247303 TSecr=2761211299  tcp.stream == 25
596  12.583406 157.166.246.200 -> 216.165.108.217 HTTP 757 HTTP/1.1 200 OK  (GIF89a)  tcp.stream == 25
597  12.589042 216.165.108.217 -> 157.166.246.200 TCP 66 41397 > http [FIN, ACK] Seq=574 Ack=4839 Win=25600 Len=0 TSval=44247304 TSecr=2761211299  tcp.stream == 25
598  12.594546 157.166.246.200 -> 216.165.108.217 TCP 66 http > 41396 [ACK] Seq=1507 Ack=575 Win=7040 Len=0 TSval=2761211302 TSecr=44247301  tcp.stream == 24
599  12.595496 157.166.246.200 -> 216.165.108.217 TCP 66 http > 41395 [ACK] Seq=1348 Ack=575 Win=7040 Len=0 TSval=2761211302 TSecr=44247301  tcp.stream == 23
600  12.608373 157.166.246.200 -> 216.165.108.217 TCP 66 http > 41397 [ACK] Seq=4839 Ack=575 Win=7040 Len=0 TSval=2761211305 TSecr=44247304  tcp.stream == 25
601  12.643410 146.101.146.121 -> 216.165.108.217 TCP 66 http > 52537 [ACK] Seq=1 Ack=528 Win=6864 Len=0 TSval=2498474507 TSecr=44247292  tcp.stream == 21
602  12.648678 146.101.146.121 -> 216.165.108.217 TCP 999 [TCP segment of a reassembled PDU]  tcp.stream == 21
603  12.648695 216.165.108.217 -> 146.101.146.121 TCP 66 52537 > http [ACK] Seq=528 Ack=934 Win=16512 Len=0 TSval=44247319 TSecr=2498474507  tcp.stream == 21
604  12.648700 146.101.146.121 -> 216.165.108.217 HTTP 66 HTTP/1.1 302 Found  (text/html)  tcp.stream == 21
605  12.685987 216.165.108.217 -> 146.101.146.121 TCP 66 52537 > http [ACK] Seq=528 Ack=935 Win=16512 Len=0 TSval=44247329 TSecr=2498474507  tcp.stream == 21
609  13.128940 216.165.108.217 -> 146.101.146.121 TCP 66 52537 > http [FIN, ACK] Seq=528 Ack=935 Win=16512 Len=0 TSval=44247439 TSecr=2498474507  tcp.stream == 21
610  13.134536 216.165.108.217 -> 146.101.146.121 TCP 74 52542 > http [SYN] Seq=0 Win=14600 Len=0 MSS=1460 SACK_PERM=1 TSval=44247441 TSecr=0 WS=128  tcp.stream == 26
611  13.234906 146.101.146.121 -> 216.165.108.217 TCP 66 http > 52537 [ACK] Seq=935 Ack=529 Win=6864 Len=0 TSval=2498474565 TSecr=44247439  tcp.stream == 21
612  13.240676 146.101.146.121 -> 216.165.108.217 TCP 74 http > 52542 [SYN, ACK] Seq=0 Ack=1 Win=5792 Len=0 MSS=1380 SACK_PERM=1 TSval=2498474566 TSecr=44247441 WS=4  tcp.stream == 26
613  13.240699 216.165.108.217 -> 146.101.146.121 TCP 66 52542 > http [ACK] Seq=1 Ack=1 Win=14720 Len=0 TSval=44247467 TSecr=2498474566  tcp.stream == 26
614  13.242842 216.165.108.217 -> 146.101.146.121 HTTP 742 GET /idimagequeued.aspx?bango=111555006919&format=gif&url=Home&title=CNN&bgo_content=Home&bgo_source=web.mw.cnn.com&bgo_section=Home&random=1329413320455&bgo_custom1=gemini&AspxAutoDetectCookieSupport=1 HTTP/1.1   tcp.stream == 26
616  13.349565 146.101.146.121 -> 216.165.108.217 TCP 66 http > 52542 [ACK] Seq=1 Ack=677 Win=7144 Len=0 TSval=2498474577 TSecr=44247468  tcp.stream == 26
618  13.608271 146.101.146.121 -> 216.165.108.217 HTTP 1010 HTTP/1.1 302 Found  (application/xhtml+xml)  tcp.stream == 26
619  13.608287 216.165.108.217 -> 146.101.146.121 TCP 66 52542 > http [ACK] Seq=677 Ack=945 Win=16512 Len=0 TSval=44247559 TSecr=2498474602  tcp.stream == 26
620  13.616326 216.165.108.217 -> 146.101.146.121 TCP 66 52542 > http [FIN, ACK] Seq=677 Ack=945 Win=16512 Len=0 TSval=44247561 TSecr=2498474602  tcp.stream == 26
623  13.633712 216.165.108.217 -> 204.141.87.27 TCP 74 43311 > http [SYN] Seq=0 Win=14600 Len=0 MSS=1460 SACK_PERM=1 TSval=44247565 TSecr=0 WS=128  tcp.stream == 27
625  13.666937 204.141.87.27 -> 216.165.108.217 TCP 74 http > 43311 [SYN, ACK] Seq=0 Ack=1 Win=14480 Len=0 MSS=1460 SACK_PERM=1 TSval=2965431961 TSecr=44247565 WS=4  tcp.stream == 27
626  13.666958 216.165.108.217 -> 204.141.87.27 TCP 66 43311 > http [ACK] Seq=1 Ack=1 Win=14720 Len=0 TSval=44247574 TSecr=2965431961  tcp.stream == 27
627  13.668768 216.165.108.217 -> 204.141.87.27 HTTP 615 GET /p?c1=10&c2=6035748&c7=http%3a%2f%2fm.cnn.com%2fHome&c8=CNN&c9=&c10=BANG&c12=116126803016690&rn=1137229513&cv=2&make=Google&model=google_sdk&version= HTTP/1.1   tcp.stream == 27
628  13.704891 204.141.87.27 -> 216.165.108.217 TCP 66 http > 43311 [ACK] Seq=1 Ack=550 Win=15580 Len=0 TSval=2965431996 TSecr=44247574  tcp.stream == 27
629  13.705662 204.141.87.27 -> 216.165.108.217 HTTP 821 HTTP/1.1 302 Moved Temporarily   tcp.stream == 27
630  13.705677 216.165.108.217 -> 204.141.87.27 TCP 66 43311 > http [ACK] Seq=550 Ack=756 Win=16128 Len=0 TSval=44247583 TSecr=2965431996  tcp.stream == 27
631  13.716621 216.165.108.217 -> 204.141.87.27 TCP 66 43311 > http [FIN, ACK] Seq=550 Ack=756 Win=16128 Len=0 TSval=44247586 TSecr=2965431996  tcp.stream == 27
632  13.720355 216.165.108.217 -> 204.141.87.27 TCP 74 43312 > http [SYN] Seq=0 Win=14600 Len=0 MSS=1460 SACK_PERM=1 TSval=44247587 TSecr=0 WS=128  tcp.stream == 28
633  13.730926 146.101.146.121 -> 216.165.108.217 TCP 66 http > 52542 [FIN, ACK] Seq=945 Ack=678 Win=7144 Len=0 TSval=2498474614 TSecr=44247561  tcp.stream == 26
634  13.730953 216.165.108.217 -> 146.101.146.121 TCP 66 52542 > http [ACK] Seq=678 Ack=946 Win=16512 Len=0 TSval=44247590 TSecr=2498474614  tcp.stream == 26
636  13.751822 204.141.87.27 -> 216.165.108.217 TCP 66 http > 43311 [FIN, ACK] Seq=756 Ack=551 Win=15580 Len=0 TSval=2965432044 TSecr=44247586  tcp.stream == 27
637  13.751848 216.165.108.217 -> 204.141.87.27 TCP 66 43311 > http [ACK] Seq=551 Ack=757 Win=16128 Len=0 TSval=44247595 TSecr=2965432044  tcp.stream == 27
638  13.754297 204.141.87.27 -> 216.165.108.217 TCP 74 http > 43312 [SYN, ACK] Seq=0 Ack=1 Win=14480 Len=0 MSS=1460 SACK_PERM=1 TSval=2965432047 TSecr=44247587 WS=4  tcp.stream == 28
639  13.754325 216.165.108.217 -> 204.141.87.27 TCP 66 43312 > http [ACK] Seq=1 Ack=1 Win=14720 Len=0 TSval=44247596 TSecr=2965432047  tcp.stream == 28
640  13.756036 216.165.108.217 -> 204.141.87.27 HTTP 679 GET /p2?c1=10&c2=6035748&c7=http%3a%2f%2fm.cnn.com%2fHome&c8=CNN&c9=&c10=BANG&c12=116126803016690&rn=1137229513&cv=2&make=Google&model=google_sdk&version= HTTP/1.1   tcp.stream == 28
641  13.785740 204.141.87.27 -> 216.165.108.217 TCP 66 http > 43312 [ACK] Seq=1 Ack=614 Win=15708 Len=0 TSval=2965432083 TSecr=44247596  tcp.stream == 28
642  13.786181 204.141.87.27 -> 216.165.108.217 HTTP 375 HTTP/1.1 200 OK  (GIF89a)  tcp.stream == 28
643  13.786189 216.165.108.217 -> 204.141.87.27 TCP 66 43312 > http [ACK] Seq=614 Ack=310 Win=15744 Len=0 TSval=44247604 TSecr=2965432084  tcp.stream == 28
644  13.792440 216.165.108.217 -> 204.141.87.27 TCP 66 43312 > http [FIN, ACK] Seq=614 Ack=310 Win=15744 Len=0 TSval=44247605 TSecr=2965432084  tcp.stream == 28
645  13.818306 204.141.87.27 -> 216.165.108.217 TCP 66 http > 43312 [FIN, ACK] Seq=310 Ack=615 Win=15708 Len=0 TSval=2965432120 TSecr=44247605  tcp.stream == 28
646  13.818322 216.165.108.217 -> 204.141.87.27 TCP 66 43312 > http [ACK] Seq=615 Ack=311 Win=15744 Len=0 TSval=44247612 TSecr=2965432120  tcp.stream == 28
