 68   9.467656 216.165.108.217 -> 121.14.24.241 TCP 74 57436 > http [SYN] Seq=0 Win=14600 Len=0 MSS=1460 SACK_PERM=1 TSval=43072715 TSecr=0 WS=128  tcp.stream == 0
 74  10.093326 121.14.24.241 -> 216.165.108.217 TCP 66 http > 57436 [SYN, ACK] Seq=0 Ack=1 Win=5840 Len=0 MSS=1460 SACK_PERM=1 WS=512  tcp.stream == 0
 75  10.093354 216.165.108.217 -> 121.14.24.241 TCP 54 57436 > http [ACK] Seq=1 Ack=1 Win=14720 Len=0  tcp.stream == 0
 76  10.097964 216.165.108.217 -> 121.14.24.241 HTTP 450 GET / HTTP/1.1   tcp.stream == 0
 81  10.725222 121.14.24.241 -> 216.165.108.217 TCP 60 http > 57436 [ACK] Seq=1 Ack=397 Win=7168 Len=0  tcp.stream == 0
 82  10.725377 121.14.24.241 -> 216.165.108.217 HTTP 561 HTTP/1.1 302 Moved Temporarily  (text/html)  tcp.stream == 0
 83  10.725387 216.165.108.217 -> 121.14.24.241 TCP 54 57436 > http [ACK] Seq=397 Ack=508 Win=15744 Len=0  tcp.stream == 0
 84  10.725393 121.14.24.241 -> 216.165.108.217 TCP 60 http > 57436 [FIN, ACK] Seq=508 Ack=397 Win=7168 Len=0  tcp.stream == 0
 86  10.737448 216.165.108.217 -> 121.14.24.241 TCP 54 57436 > http [FIN, ACK] Seq=397 Ack=509 Win=15744 Len=0  tcp.stream == 0
 93  11.363279 121.14.24.241 -> 216.165.108.217 TCP 60 http > 57436 [ACK] Seq=509 Ack=398 Win=7168 Len=0  tcp.stream == 0
 96  11.592368 216.165.108.217 -> 119.167.201.241 TCP 74 34606 > http [SYN] Seq=0 Win=14600 Len=0 MSS=1460 SACK_PERM=1 TSval=43073247 TSecr=0 WS=128  tcp.stream == 1
100  11.957774 119.167.201.241 -> 216.165.108.217 TCP 60 http > 34606 [SYN, ACK] Seq=0 Ack=1 Win=5840 Len=0 MSS=1460  tcp.stream == 1
101  11.957802 216.165.108.217 -> 119.167.201.241 TCP 54 34606 > http [ACK] Seq=1 Ack=1 Win=14600 Len=0  tcp.stream == 1
102  11.959738 216.165.108.217 -> 119.167.201.241 HTTP 479 GET / HTTP/1.1   tcp.stream == 1
105  12.321546 119.167.201.241 -> 216.165.108.217 TCP 60 http > 34606 [ACK] Seq=1 Ack=426 Win=6432 Len=0  tcp.stream == 1
106  12.322253 119.167.201.241 -> 216.165.108.217 HTTP 577 HTTP/1.1 302 Found  (text/html)  tcp.stream == 1
107  12.322268 216.165.108.217 -> 119.167.201.241 TCP 54 34606 > http [ACK] Seq=426 Ack=524 Win=15544 Len=0  tcp.stream == 1
108  12.329213 216.165.108.217 -> 119.167.201.241 TCP 54 34606 > http [FIN, ACK] Seq=426 Ack=524 Win=15544 Len=0  tcp.stream == 1
113  12.695221 119.167.201.241 -> 216.165.108.217 TCP 60 http > 34606 [FIN, ACK] Seq=524 Ack=427 Win=6432 Len=0  tcp.stream == 1
114  12.695242 216.165.108.217 -> 119.167.201.241 TCP 54 34606 > http [ACK] Seq=427 Ack=525 Win=15544 Len=0  tcp.stream == 1
118  13.132810 216.165.108.217 -> 110.75.24.26 TCP 74 41152 > http [SYN] Seq=0 Win=14600 Len=0 MSS=1460 SACK_PERM=1 TSval=43073632 TSecr=0 WS=128  tcp.stream == 2
121  13.413189 110.75.24.26 -> 216.165.108.217 TCP 60 http > 41152 [SYN, ACK] Seq=0 Ack=1 Win=14600 Len=0 MSS=1400  tcp.stream == 2
122  13.413216 216.165.108.217 -> 110.75.24.26 TCP 54 41152 > http [ACK] Seq=1 Ack=1 Win=14600 Len=0  tcp.stream == 2
123  13.415595 216.165.108.217 -> 110.75.24.26 HTTP 492 GET /?sprefer=sypc00 HTTP/1.1   tcp.stream == 2
125  13.696385 110.75.24.26 -> 216.165.108.217 TCP 60 http > 41152 [ACK] Seq=1 Ack=439 Win=6432 Len=0  tcp.stream == 2
127  13.735439 110.75.24.26 -> 216.165.108.217 TCP 1434 [TCP segment of a reassembled PDU]  tcp.stream == 2
128  13.735455 216.165.108.217 -> 110.75.24.26 TCP 54 41152 > http [ACK] Seq=439 Ack=1381 Win=16560 Len=0  tcp.stream == 2
129  13.735525 110.75.24.26 -> 216.165.108.217 TCP 1434 [TCP segment of a reassembled PDU]  tcp.stream == 2
130  13.735530 216.165.108.217 -> 110.75.24.26 TCP 54 41152 > http [ACK] Seq=439 Ack=2761 Win=19320 Len=0  tcp.stream == 2
133  14.016340 110.75.24.26 -> 216.165.108.217 TCP 1434 [TCP segment of a reassembled PDU]  tcp.stream == 2
134  14.016362 216.165.108.217 -> 110.75.24.26 TCP 54 41152 > http [ACK] Seq=439 Ack=4141 Win=22080 Len=0  tcp.stream == 2
135  14.016513 110.75.24.26 -> 216.165.108.217 TCP 1434 [TCP segment of a reassembled PDU]  tcp.stream == 2
136  14.016520 216.165.108.217 -> 110.75.24.26 TCP 54 41152 > http [ACK] Seq=439 Ack=5521 Win=26220 Len=0  tcp.stream == 2
137  14.016631 110.75.24.26 -> 216.165.108.217 HTTP 1893 HTTP/1.1 200 OK  (text/html)  tcp.stream == 2
138  14.016640 216.165.108.217 -> 110.75.24.26 TCP 54 41152 > http [ACK] Seq=439 Ack=7360 Win=28980 Len=0  tcp.stream == 2
139  14.022421 216.165.108.217 -> 110.75.24.26 TCP 54 41152 > http [FIN, ACK] Seq=439 Ack=7360 Win=28980 Len=0  tcp.stream == 2
145  14.303156 110.75.24.26 -> 216.165.108.217 TCP 60 http > 41152 [FIN, ACK] Seq=7360 Ack=440 Win=6432 Len=0  tcp.stream == 2
146  14.303177 216.165.108.217 -> 110.75.24.26 TCP 54 41152 > http [ACK] Seq=440 Ack=7361 Win=28980 Len=0  tcp.stream == 2
149  14.587100 216.165.108.217 -> 119.167.201.251 TCP 74 46212 > http [SYN] Seq=0 Win=14600 Len=0 MSS=1460 SACK_PERM=1 TSval=43073995 TSecr=0 WS=128  tcp.stream == 3
150  14.587615 216.165.108.217 -> 119.167.201.251 TCP 74 46213 > http [SYN] Seq=0 Win=14600 Len=0 MSS=1460 SACK_PERM=1 TSval=43073995 TSecr=0 WS=128  tcp.stream == 4
151  14.588039 216.165.108.217 -> 119.167.201.251 TCP 74 46214 > http [SYN] Seq=0 Win=14600 Len=0 MSS=1460 SACK_PERM=1 TSval=43073996 TSecr=0 WS=128  tcp.stream == 5
152  14.588470 216.165.108.217 -> 119.167.201.251 TCP 74 46215 > http [SYN] Seq=0 Win=14600 Len=0 MSS=1460 SACK_PERM=1 TSval=43073996 TSecr=0 WS=128  tcp.stream == 6
153  14.588864 216.165.108.217 -> 119.167.201.251 TCP 74 46216 > http [SYN] Seq=0 Win=14600 Len=0 MSS=1460 SACK_PERM=1 TSval=43073996 TSecr=0 WS=128  tcp.stream == 7
156  14.958089 119.167.201.251 -> 216.165.108.217 TCP 60 http > 46212 [SYN, ACK] Seq=0 Ack=1 Win=5840 Len=0 MSS=1460  tcp.stream == 3
157  14.958117 216.165.108.217 -> 119.167.201.251 TCP 54 46212 > http [ACK] Seq=1 Ack=1 Win=14600 Len=0  tcp.stream == 3
158  14.958880 119.167.201.251 -> 216.165.108.217 TCP 60 http > 46213 [SYN, ACK] Seq=0 Ack=1 Win=5840 Len=0 MSS=1460  tcp.stream == 4
159  14.958901 216.165.108.217 -> 119.167.201.251 TCP 54 46213 > http [ACK] Seq=1 Ack=1 Win=14600 Len=0  tcp.stream == 4
160  14.959336 119.167.201.251 -> 216.165.108.217 TCP 60 http > 46214 [SYN, ACK] Seq=0 Ack=1 Win=5840 Len=0 MSS=1460  tcp.stream == 5
161  14.959353 216.165.108.217 -> 119.167.201.251 TCP 54 46214 > http [ACK] Seq=1 Ack=1 Win=14600 Len=0  tcp.stream == 5
162  14.960042 119.167.201.251 -> 216.165.108.217 TCP 60 http > 46215 [SYN, ACK] Seq=0 Ack=1 Win=5840 Len=0 MSS=1460  tcp.stream == 6
163  14.960062 216.165.108.217 -> 119.167.201.251 TCP 54 46215 > http [ACK] Seq=1 Ack=1 Win=14600 Len=0  tcp.stream == 6
164  14.963630 216.165.108.217 -> 119.167.201.251 HTTP 471 GET /mw/s/lib/jquery/jquery.1.3.2.min.js HTTP/1.1   tcp.stream == 6
165  14.964836 216.165.108.217 -> 119.167.201.251 HTTP 462 GET /mw/s/hi/tbtouch/tbtouch.js HTTP/1.1   tcp.stream == 5
166  14.965775 216.165.108.217 -> 119.167.201.251 HTTP 478 GET /mw/s/hi/tbtouch/tbtouch.css HTTP/1.1   tcp.stream == 4
167  14.966692 216.165.108.217 -> 119.167.201.251 HTTP 458 GET /mw/s/hi/tbtouch/tms.js HTTP/1.1   tcp.stream == 3
171  15.336790 119.167.201.251 -> 216.165.108.217 TCP 60 http > 46215 [ACK] Seq=1 Ack=418 Win=6432 Len=0  tcp.stream == 6
172  15.339345 119.167.201.251 -> 216.165.108.217 TCP 60 http > 46213 [ACK] Seq=1 Ack=425 Win=6432 Len=0  tcp.stream == 4
173  15.340022 119.167.201.251 -> 216.165.108.217 TCP 60 http > 46212 [ACK] Seq=1 Ack=405 Win=6432 Len=0  tcp.stream == 3
174  15.340736 119.167.201.251 -> 216.165.108.217 HTTP 534 [TCP Previous segment not captured] Continuation or non-HTTP traffic  tcp.stream == 3
175  15.340755 216.165.108.217 -> 119.167.201.251 TCP 54 [TCP Dup ACK 167#1] 46212 > http [ACK] Seq=405 Ack=1 Win=14600 Len=0  tcp.stream == 3
176  15.340885 119.167.201.251 -> 216.165.108.217 TCP 1514 [TCP Out-Of-Order] [TCP segment of a reassembled PDU]  tcp.stream == 3
177  15.340890 216.165.108.217 -> 119.167.201.251 TCP 54 46212 > http [ACK] Seq=405 Ack=1461 Win=17520 Len=0  tcp.stream == 3
178  15.341118 119.167.201.251 -> 216.165.108.217 TCP 1514 [TCP Out-Of-Order] [TCP segment of a reassembled PDU]  tcp.stream == 3
179  15.341128 216.165.108.217 -> 119.167.201.251 TCP 54 46212 > http [ACK] Seq=405 Ack=3401 Win=20440 Len=0  tcp.stream == 3
180  15.341131 119.167.201.251 -> 216.165.108.217 TCP 60 http > 46212 [FIN, ACK] Seq=3401 Ack=405 Win=6432 Len=0  tcp.stream == 3
181  15.342454 119.167.201.251 -> 216.165.108.217 TCP 1514 [TCP segment of a reassembled PDU]  tcp.stream == 6
182  15.342473 216.165.108.217 -> 119.167.201.251 TCP 54 46215 > http [ACK] Seq=418 Ack=1461 Win=17520 Len=0  tcp.stream == 6
183  15.342571 119.167.201.251 -> 216.165.108.217 TCP 1514 [TCP segment of a reassembled PDU]  tcp.stream == 6
184  15.342576 216.165.108.217 -> 119.167.201.251 TCP 54 46215 > http [ACK] Seq=418 Ack=2921 Win=20440 Len=0  tcp.stream == 6
185  15.342690 119.167.201.251 -> 216.165.108.217 TCP 1514 [TCP segment of a reassembled PDU]  tcp.stream == 6
186  15.342697 216.165.108.217 -> 119.167.201.251 TCP 54 46215 > http [ACK] Seq=418 Ack=4381 Win=23360 Len=0  tcp.stream == 6
187  15.343840 119.167.201.251 -> 216.165.108.217 TCP 1514 [TCP segment of a reassembled PDU]  tcp.stream == 4
188  15.343858 216.165.108.217 -> 119.167.201.251 TCP 54 46213 > http [ACK] Seq=425 Ack=1461 Win=17520 Len=0  tcp.stream == 4
189  15.343909 119.167.201.251 -> 216.165.108.217 HTTP 1300 [TCP Previous segment not captured] Continuation or non-HTTP traffic  tcp.stream == 4
190  15.343915 216.165.108.217 -> 119.167.201.251 TCP 54 [TCP Dup ACK 188#1] 46213 > http [ACK] Seq=425 Ack=1461 Win=17520 Len=0  tcp.stream == 4
191  15.344057 119.167.201.251 -> 216.165.108.217 TCP 1514 [TCP Out-Of-Order] [TCP segment of a reassembled PDU]  tcp.stream == 4
192  15.344064 216.165.108.217 -> 119.167.201.251 TCP 54 46213 > http [ACK] Seq=425 Ack=2921 Win=20440 Len=0  tcp.stream == 4
193  15.344181 119.167.201.251 -> 216.165.108.217 TCP 1514 [TCP Out-Of-Order] [TCP segment of a reassembled PDU]  tcp.stream == 4
194  15.344187 216.165.108.217 -> 119.167.201.251 TCP 54 46213 > http [ACK] Seq=425 Ack=5628 Win=23360 Len=0  tcp.stream == 4
195  15.374197 216.165.108.217 -> 119.167.201.251 TCP 54 46212 > http [FIN, ACK] Seq=405 Ack=3402 Win=20440 Len=0  tcp.stream == 3
196  15.377444 216.165.108.217 -> 119.167.201.251 TCP 54 46213 > http [FIN, ACK] Seq=425 Ack=5628 Win=23360 Len=0  tcp.stream == 4
199  15.713756 119.167.201.251 -> 216.165.108.217 TCP 1514 [TCP segment of a reassembled PDU]  tcp.stream == 6
200  15.713779 216.165.108.217 -> 119.167.201.251 TCP 54 46215 > http [ACK] Seq=418 Ack=5841 Win=26280 Len=0  tcp.stream == 6
201  15.713878 119.167.201.251 -> 216.165.108.217 HTTP 1514 [TCP Previous segment not captured] Continuation or non-HTTP traffic  tcp.stream == 6
202  15.713886 216.165.108.217 -> 119.167.201.251 TCP 54 [TCP Dup ACK 200#1] 46215 > http [ACK] Seq=418 Ack=5841 Win=26280 Len=0  tcp.stream == 6
203  15.713994 119.167.201.251 -> 216.165.108.217 TCP 1514 [TCP Out-Of-Order] [TCP segment of a reassembled PDU]  tcp.stream == 6
204  15.714003 216.165.108.217 -> 119.167.201.251 TCP 54 46215 > http [ACK] Seq=418 Ack=8761 Win=29200 Len=0  tcp.stream == 6
205  15.714117 119.167.201.251 -> 216.165.108.217 HTTP 1514 Continuation or non-HTTP traffic  tcp.stream == 6
206  15.714125 216.165.108.217 -> 119.167.201.251 TCP 54 46215 > http [ACK] Seq=418 Ack=10221 Win=32120 Len=0  tcp.stream == 6
207  15.714240 119.167.201.251 -> 216.165.108.217 HTTP 1514 Continuation or non-HTTP traffic  tcp.stream == 6
208  15.714247 216.165.108.217 -> 119.167.201.251 TCP 54 46215 > http [ACK] Seq=418 Ack=11681 Win=35040 Len=0  tcp.stream == 6
209  15.744178 119.167.201.251 -> 216.165.108.217 TCP 60 http > 46212 [ACK] Seq=3402 Ack=406 Win=6432 Len=0  tcp.stream == 3
210  15.747702 119.167.201.251 -> 216.165.108.217 TCP 60 http > 46213 [ACK] Seq=5628 Ack=426 Win=6432 Len=0  tcp.stream == 4
214  16.081866 119.167.201.251 -> 216.165.108.217 HTTP 1514 Continuation or non-HTTP traffic  tcp.stream == 6
215  16.081888 216.165.108.217 -> 119.167.201.251 TCP 54 46215 > http [ACK] Seq=418 Ack=13141 Win=37960 Len=0  tcp.stream == 6
216  16.082105 119.167.201.251 -> 216.165.108.217 HTTP 1514 [TCP Previous segment not captured] Continuation or non-HTTP traffic  tcp.stream == 6
217  16.082114 216.165.108.217 -> 119.167.201.251 TCP 54 [TCP Dup ACK 215#1] 46215 > http [ACK] Seq=418 Ack=13141 Win=37960 Len=0  tcp.stream == 6
218  16.082223 119.167.201.251 -> 216.165.108.217 HTTP 1514 [TCP Out-Of-Order] Continuation or non-HTTP traffic  tcp.stream == 6
219  16.082233 216.165.108.217 -> 119.167.201.251 TCP 54 46215 > http [ACK] Seq=418 Ack=14601 Win=40880 Len=0  tcp.stream == 6
220  16.082346 119.167.201.251 -> 216.165.108.217 HTTP 1514 [TCP Out-Of-Order] Continuation or non-HTTP traffic  tcp.stream == 6
221  16.082354 216.165.108.217 -> 119.167.201.251 TCP 54 46215 > http [ACK] Seq=418 Ack=17521 Win=43800 Len=0  tcp.stream == 6
222  16.082469 119.167.201.251 -> 216.165.108.217 HTTP 1514 Continuation or non-HTTP traffic  tcp.stream == 6
223  16.082475 216.165.108.217 -> 119.167.201.251 TCP 54 46215 > http [ACK] Seq=418 Ack=18981 Win=46720 Len=0  tcp.stream == 6
224  16.082527 119.167.201.251 -> 216.165.108.217 HTTP 1160 Continuation or non-HTTP traffic  tcp.stream == 6
225  16.088241 216.165.108.217 -> 119.167.201.251 TCP 54 46215 > http [FIN, ACK] Seq=418 Ack=20088 Win=49640 Len=0  tcp.stream == 6
228  16.455973 119.167.201.251 -> 216.165.108.217 TCP 60 http > 46215 [ACK] Seq=20088 Ack=419 Win=6432 Len=0  tcp.stream == 6
236  17.595695 216.165.108.217 -> 119.167.201.251 TCP 74 46216 > http [SYN] Seq=0 Win=14600 Len=0 MSS=1460 SACK_PERM=1 TSval=43074748 TSecr=0 WS=128  tcp.stream == 7
240  17.970365 119.167.201.251 -> 216.165.108.217 TCP 60 http > 46216 [SYN, ACK] Seq=0 Ack=1 Win=5840 Len=0 MSS=1460  tcp.stream == 7
241  17.970394 216.165.108.217 -> 119.167.201.251 TCP 54 46216 > http [ACK] Seq=1 Ack=1 Win=14600 Len=0  tcp.stream == 7
242  17.971693 216.165.108.217 -> 119.167.201.251 HTTP 462 [TCP Retransmission] GET /mw/s/hi/tbtouch/tbtouch.js HTTP/1.1   tcp.stream == 5
243  17.973087 216.165.108.217 -> 119.167.201.251 HTTP 474 GET /mw/s/hi/tbtouch/tms.css HTTP/1.1   tcp.stream == 7
247  18.341191 119.167.201.251 -> 216.165.108.217 TCP 60 http > 46214 [ACK] Seq=1 Ack=409 Win=6432 Len=0  tcp.stream == 5
248  18.342571 119.167.201.251 -> 216.165.108.217 TCP 60 http > 46216 [ACK] Seq=1 Ack=421 Win=6432 Len=0  tcp.stream == 7
249  18.343144 119.167.201.251 -> 216.165.108.217 TCP 1514 [TCP segment of a reassembled PDU]  tcp.stream == 5
250  18.343165 216.165.108.217 -> 119.167.201.251 TCP 54 46214 > http [ACK] Seq=409 Ack=1461 Win=17520 Len=0  tcp.stream == 5
251  18.343263 119.167.201.251 -> 216.165.108.217 TCP 1514 [TCP segment of a reassembled PDU]  tcp.stream == 5
252  18.343270 216.165.108.217 -> 119.167.201.251 TCP 54 46214 > http [ACK] Seq=409 Ack=2921 Win=20440 Len=0  tcp.stream == 5
253  18.343383 119.167.201.251 -> 216.165.108.217 TCP 1514 [TCP segment of a reassembled PDU]  tcp.stream == 5
254  18.343392 216.165.108.217 -> 119.167.201.251 TCP 54 46214 > http [ACK] Seq=409 Ack=4381 Win=23360 Len=0  tcp.stream == 5
255  18.343724 119.167.201.251 -> 216.165.108.217 HTTP 157 [TCP Previous segment not captured] Continuation or non-HTTP traffic  tcp.stream == 7
256  18.343737 216.165.108.217 -> 119.167.201.251 TCP 54 [TCP Dup ACK 243#1] 46216 > http [ACK] Seq=421 Ack=1 Win=14600 Len=0  tcp.stream == 7
257  18.343929 119.167.201.251 -> 216.165.108.217 TCP 1514 [TCP Out-Of-Order] [TCP segment of a reassembled PDU]  tcp.stream == 7
258  18.343938 216.165.108.217 -> 119.167.201.251 TCP 54 46216 > http [ACK] Seq=421 Ack=1461 Win=17520 Len=0  tcp.stream == 7
259  18.344043 119.167.201.251 -> 216.165.108.217 TCP 1514 [TCP Out-Of-Order] [TCP segment of a reassembled PDU]  tcp.stream == 7
260  18.344050 216.165.108.217 -> 119.167.201.251 TCP 54 46216 > http [ACK] Seq=421 Ack=2921 Win=20440 Len=0  tcp.stream == 7
261  18.344199 119.167.201.251 -> 216.165.108.217 TCP 1514 [TCP Out-Of-Order] [TCP segment of a reassembled PDU]  tcp.stream == 7
262  18.344207 216.165.108.217 -> 119.167.201.251 TCP 54 46216 > http [ACK] Seq=421 Ack=4484 Win=23360 Len=0  tcp.stream == 7
263  18.344209 119.167.201.251 -> 216.165.108.217 TCP 60 http > 46216 [FIN, ACK] Seq=4484 Ack=421 Win=6432 Len=0  tcp.stream == 7
264  18.369486 216.165.108.217 -> 119.167.201.251 TCP 54 46216 > http [FIN, ACK] Seq=421 Ack=4485 Win=23360 Len=0  tcp.stream == 7
267  18.717627 119.167.201.251 -> 216.165.108.217 HTTP 60 [TCP Previous segment not captured] Continuation or non-HTTP traffic  tcp.stream == 5
268  18.717649 216.165.108.217 -> 119.167.201.251 TCP 54 [TCP Dup ACK 254#1] 46214 > http [ACK] Seq=409 Ack=4381 Win=23360 Len=0  tcp.stream == 5
269  18.717861 119.167.201.251 -> 216.165.108.217 TCP 1514 [TCP Out-Of-Order] [TCP segment of a reassembled PDU]  tcp.stream == 5
270  18.717870 216.165.108.217 -> 119.167.201.251 TCP 54 46214 > http [ACK] Seq=409 Ack=5846 Win=26280 Len=0  tcp.stream == 5
271  18.723060 216.165.108.217 -> 119.167.201.251 TCP 54 46214 > http [FIN, ACK] Seq=409 Ack=5846 Win=26280 Len=0  tcp.stream == 5
273  18.741715 119.167.201.251 -> 216.165.108.217 TCP 60 http > 46216 [ACK] Seq=4485 Ack=422 Win=6432 Len=0  tcp.stream == 7
275  19.088206 119.167.201.251 -> 216.165.108.217 TCP 60 http > 46214 [ACK] Seq=5846 Ack=410 Win=6432 Len=0  tcp.stream == 5
290  19.990812 216.165.108.217 -> 117.25.148.240 TCP 74 50866 > http [SYN] Seq=0 Win=14600 Len=0 MSS=1460 SACK_PERM=1 TSval=43075346 TSecr=0 WS=128  tcp.stream == 8
291  19.992954 216.165.108.217 -> 117.25.148.240 TCP 74 50867 > http [SYN] Seq=0 Win=14600 Len=0 MSS=1460 SACK_PERM=1 TSval=43075347 TSecr=0 WS=128  tcp.stream == 9
292  19.998680 216.165.108.217 -> 117.25.148.240 TCP 74 50868 > http [SYN] Seq=0 Win=14600 Len=0 MSS=1460 SACK_PERM=1 TSval=43075348 TSecr=0 WS=128  tcp.stream == 10
293  19.999477 216.165.108.217 -> 117.25.148.240 TCP 74 50869 > http [SYN] Seq=0 Win=14600 Len=0 MSS=1460 SACK_PERM=1 TSval=43075348 TSecr=0 WS=128  tcp.stream == 11
297  20.419833 117.25.148.240 -> 216.165.108.217 TCP 66 http > 50866 [SYN, ACK] Seq=0 Ack=1 Win=5840 Len=0 MSS=1460 SACK_PERM=1 WS=512  tcp.stream == 8
298  20.419860 216.165.108.217 -> 117.25.148.240 TCP 54 50866 > http [ACK] Seq=1 Ack=1 Win=14720 Len=0  tcp.stream == 8
299  20.421536 117.25.148.240 -> 216.165.108.217 TCP 66 http > 50867 [SYN, ACK] Seq=0 Ack=1 Win=5840 Len=0 MSS=1460 SACK_PERM=1 WS=512  tcp.stream == 9
300  20.421560 216.165.108.217 -> 117.25.148.240 TCP 54 50867 > http [ACK] Seq=1 Ack=1 Win=14720 Len=0  tcp.stream == 9
301  20.422747 216.165.108.217 -> 117.25.148.240 HTTP 467 GET /tps/i1/T1pkqsXhpRXXXXXXXX-40-40.png HTTP/1.1   tcp.stream == 8
302  20.425098 117.25.148.240 -> 216.165.108.217 TCP 66 http > 50869 [SYN, ACK] Seq=0 Ack=1 Win=5840 Len=0 MSS=1460 SACK_PERM=1 WS=512  tcp.stream == 11
303  20.425123 216.165.108.217 -> 117.25.148.240 TCP 54 50869 > http [ACK] Seq=1 Ack=1 Win=14720 Len=0  tcp.stream == 11
304  20.425127 216.165.108.217 -> 117.25.148.240 HTTP 467 GET /tps/i4/T1kkCsXelNXXXXXXXX-40-40.png HTTP/1.1   tcp.stream == 9
305  20.427980 216.165.108.217 -> 117.25.148.240 HTTP 467 GET /tps/i3/T1rAqsXgVRXXXXXXXX-40-40.png HTTP/1.1   tcp.stream == 11
306  20.428429 117.25.148.240 -> 216.165.108.217 TCP 66 http > 50868 [SYN, ACK] Seq=0 Ack=1 Win=5840 Len=0 MSS=1460 SACK_PERM=1 WS=512  tcp.stream == 10
307  20.428451 216.165.108.217 -> 117.25.148.240 TCP 54 50868 > http [ACK] Seq=1 Ack=1 Win=14720 Len=0  tcp.stream == 10
308  20.431870 216.165.108.217 -> 117.25.148.240 HTTP 467 GET /tps/i2/T1qAqsXg8RXXXXXXXX-40-40.png HTTP/1.1   tcp.stream == 10
312  20.841804 117.25.148.240 -> 216.165.108.217 TCP 342 [TCP segment of a reassembled PDU]  tcp.stream == 8
313  20.841830 216.165.108.217 -> 117.25.148.240 TCP 54 50866 > http [ACK] Seq=414 Ack=289 Win=15744 Len=0  tcp.stream == 8
314  20.841836 117.25.148.240 -> 216.165.108.217 HTTP 707 HTTP/1.1 200 OK  (PNG)  tcp.stream == 8
315  20.841839 216.165.108.217 -> 117.25.148.240 TCP 54 50866 > http [ACK] Seq=414 Ack=942 Win=17024 Len=0  tcp.stream == 8
316  20.843679 117.25.148.240 -> 216.165.108.217 HTTP 1210 HTTP/1.1 200 OK  (PNG)  tcp.stream == 11
317  20.843704 216.165.108.217 -> 117.25.148.240 TCP 54 50869 > http [ACK] Seq=414 Ack=1157 Win=17024 Len=0  tcp.stream == 11
318  20.844566 117.25.148.240 -> 216.165.108.217 HTTP 925 HTTP/1.1 200 OK  (PNG)  tcp.stream == 9
319  20.844593 216.165.108.217 -> 117.25.148.240 TCP 54 50867 > http [ACK] Seq=414 Ack=872 Win=16384 Len=0  tcp.stream == 9
320  20.848448 216.165.108.217 -> 117.25.148.240 TCP 54 50866 > http [FIN, ACK] Seq=414 Ack=942 Win=17024 Len=0  tcp.stream == 8
321  20.851572 117.25.148.240 -> 216.165.108.217 HTTP 708 HTTP/1.1 200 OK  (PNG)  tcp.stream == 10
322  20.851597 216.165.108.217 -> 117.25.148.240 TCP 54 50868 > http [ACK] Seq=414 Ack=655 Win=16000 Len=0  tcp.stream == 10
323  20.890743 216.165.108.217 -> 117.25.148.240 TCP 54 50869 > http [FIN, ACK] Seq=414 Ack=1157 Win=17024 Len=0  tcp.stream == 11
324  20.891842 216.165.108.217 -> 117.25.148.240 TCP 54 50867 > http [FIN, ACK] Seq=414 Ack=872 Win=16384 Len=0  tcp.stream == 9
325  20.892923 216.165.108.217 -> 117.25.148.240 TCP 54 50868 > http [FIN, ACK] Seq=414 Ack=655 Win=16000 Len=0  tcp.stream == 10
327  20.954251 216.165.108.217 -> 110.75.24.26 TCP 74 41162 > http [SYN] Seq=0 Win=14600 Len=0 MSS=1460 SACK_PERM=1 TSval=43075587 TSecr=0 WS=128  tcp.stream == 12
328  21.062266 216.165.108.217 -> 110.75.24.26 TCP 74 41163 > http [SYN] Seq=0 Win=14600 Len=0 MSS=1460 SACK_PERM=1 TSval=43075614 TSecr=0 WS=128  tcp.stream == 13
330  21.130519 216.165.108.217 -> 110.75.24.26 TCP 74 41164 > http [SYN] Seq=0 Win=14600 Len=0 MSS=1460 SACK_PERM=1 TSval=43075631 TSecr=0 WS=128  tcp.stream == 14
331  21.202174 216.165.108.217 -> 110.75.24.26 TCP 74 41165 > http [SYN] Seq=0 Win=14600 Len=0 MSS=1460 SACK_PERM=1 TSval=43075649 TSecr=0 WS=128  tcp.stream == 15
332  21.205654 216.165.108.217 -> 110.75.24.26 TCP 74 41166 > http [SYN] Seq=0 Win=14600 Len=0 MSS=1460 SACK_PERM=1 TSval=43075650 TSecr=0 WS=128  tcp.stream == 16
333  21.235872 110.75.24.26 -> 216.165.108.217 TCP 60 http > 41162 [SYN, ACK] Seq=0 Ack=1 Win=14600 Len=0 MSS=1400  tcp.stream == 12
334  21.235894 216.165.108.217 -> 110.75.24.26 TCP 54 41162 > http [ACK] Seq=1 Ack=1 Win=14600 Len=0  tcp.stream == 12
335  21.238600 216.165.108.217 -> 110.75.24.26 HTTP 726 GET /go/rgn/mobile/taojinbi0928.html?sid=bf3da37d9d1a9af9&sprefer=sygd13 HTTP/1.1   tcp.stream == 12
337  21.299704 117.25.148.240 -> 216.165.108.217 TCP 60 http > 50869 [FIN, ACK] Seq=1157 Ack=415 Win=7168 Len=0  tcp.stream == 11
338  21.299728 216.165.108.217 -> 117.25.148.240 TCP 54 50869 > http [ACK] Seq=415 Ack=1158 Win=17024 Len=0  tcp.stream == 11
339  21.303511 117.25.148.240 -> 216.165.108.217 TCP 60 http > 50867 [FIN, ACK] Seq=872 Ack=415 Win=7168 Len=0  tcp.stream == 9
340  21.303537 216.165.108.217 -> 117.25.148.240 TCP 54 50867 > http [ACK] Seq=415 Ack=873 Win=16384 Len=0  tcp.stream == 9
341  21.305059 117.25.148.240 -> 216.165.108.217 TCP 60 http > 50868 [FIN, ACK] Seq=655 Ack=415 Win=7168 Len=0  tcp.stream == 10
342  21.305083 216.165.108.217 -> 117.25.148.240 TCP 54 50868 > http [ACK] Seq=415 Ack=656 Win=16000 Len=0  tcp.stream == 10
343  21.338252 110.75.24.26 -> 216.165.108.217 TCP 60 http > 41163 [SYN, ACK] Seq=0 Ack=1 Win=14600 Len=0 MSS=1400  tcp.stream == 13
344  21.338277 216.165.108.217 -> 110.75.24.26 TCP 54 41163 > http [ACK] Seq=1 Ack=1 Win=14600 Len=0  tcp.stream == 13
345  21.340524 216.165.108.217 -> 110.75.24.26 HTTP 712 GET /go/rgn/mobile/juhuasuan0928.html?sid=bf3da37d9d1a9af9 HTTP/1.1   tcp.stream == 13
346  21.393761 110.75.24.26 -> 216.165.108.217 TCP 60 http > 41164 [SYN, ACK] Seq=0 Ack=1 Win=14600 Len=0 MSS=1400  tcp.stream == 14
347  21.393787 216.165.108.217 -> 110.75.24.26 TCP 54 41164 > http [ACK] Seq=1 Ack=1 Win=14600 Len=0  tcp.stream == 14
348  21.396286 216.165.108.217 -> 110.75.24.26 HTTP 707 GET /go/rgn/mobile/nvzhuang.html?sid=bf3da37d9d1a9af9 HTTP/1.1   tcp.stream == 14
350  21.483812 110.75.24.26 -> 216.165.108.217 TCP 60 http > 41165 [SYN, ACK] Seq=0 Ack=1 Win=14600 Len=0 MSS=1400  tcp.stream == 15
351  21.483838 216.165.108.217 -> 110.75.24.26 TCP 54 41165 > http [ACK] Seq=1 Ack=1 Win=14600 Len=0  tcp.stream == 15
352  21.485583 110.75.24.26 -> 216.165.108.217 TCP 60 http > 41166 [SYN, ACK] Seq=0 Ack=1 Win=14600 Len=0 MSS=1400  tcp.stream == 16
353  21.485609 216.165.108.217 -> 110.75.24.26 TCP 54 41166 > http [ACK] Seq=1 Ack=1 Win=14600 Len=0  tcp.stream == 16
354  21.486232 216.165.108.217 -> 110.75.24.26 HTTP 709 GET /go/rgn/mobile/shouji0928.html?sid=bf3da37d9d1a9af9 HTTP/1.1   tcp.stream == 15
355  21.520467 110.75.24.26 -> 216.165.108.217 TCP 60 http > 41162 [ACK] Seq=1 Ack=673 Win=6720 Len=0  tcp.stream == 12
356  21.520870 110.75.24.26 -> 216.165.108.217 HTTP 821 HTTP/1.1 200 OK  (text/html)  tcp.stream == 12
357  21.520888 216.165.108.217 -> 110.75.24.26 TCP 54 41162 > http [ACK] Seq=673 Ack=768 Win=16107 Len=0  tcp.stream == 12
358  21.527909 216.165.108.217 -> 110.75.24.26 TCP 54 41162 > http [FIN, ACK] Seq=673 Ack=768 Win=16107 Len=0  tcp.stream == 12
359  21.616653 110.75.24.26 -> 216.165.108.217 TCP 60 http > 41163 [ACK] Seq=1 Ack=659 Win=6580 Len=0  tcp.stream == 13
360  21.617325 110.75.24.26 -> 216.165.108.217 HTTP 958 HTTP/1.1 200 OK  (text/html)  tcp.stream == 13
361  21.617347 216.165.108.217 -> 110.75.24.26 TCP 54 41163 > http [ACK] Seq=659 Ack=905 Win=16272 Len=0  tcp.stream == 13
362  21.623092 216.165.108.217 -> 110.75.24.26 TCP 54 41163 > http [FIN, ACK] Seq=659 Ack=905 Win=16272 Len=0  tcp.stream == 13
364  21.660041 110.75.24.26 -> 216.165.108.217 TCP 60 http > 41164 [ACK] Seq=1 Ack=654 Win=6530 Len=0  tcp.stream == 14
365  21.660586 110.75.24.26 -> 216.165.108.217 HTTP 946 HTTP/1.1 200 OK  (text/html)  tcp.stream == 14
366  21.660607 216.165.108.217 -> 110.75.24.26 TCP 54 41164 > http [ACK] Seq=654 Ack=893 Win=16056 Len=0  tcp.stream == 14
367  21.666768 216.165.108.217 -> 110.75.24.26 TCP 54 41164 > http [FIN, ACK] Seq=654 Ack=893 Win=16056 Len=0  tcp.stream == 14
368  21.767587 110.75.24.26 -> 216.165.108.217 TCP 60 http > 41165 [ACK] Seq=1 Ack=656 Win=6550 Len=0  tcp.stream == 15
369  21.768303 110.75.24.26 -> 216.165.108.217 HTTP 949 HTTP/1.1 200 OK  (text/html)  tcp.stream == 15
370  21.768326 216.165.108.217 -> 110.75.24.26 TCP 54 41165 > http [ACK] Seq=656 Ack=896 Win=16110 Len=0  tcp.stream == 15
371  21.775436 216.165.108.217 -> 110.75.24.26 TCP 54 41165 > http [FIN, ACK] Seq=656 Ack=896 Win=16110 Len=0  tcp.stream == 15
373  21.809799 110.75.24.26 -> 216.165.108.217 TCP 60 http > 41162 [FIN, ACK] Seq=768 Ack=674 Win=6720 Len=0  tcp.stream == 12
374  21.809826 216.165.108.217 -> 110.75.24.26 TCP 54 41162 > http [ACK] Seq=674 Ack=769 Win=16107 Len=0  tcp.stream == 12
376  21.896592 216.165.108.217 -> 117.25.148.240 TCP 74 50875 > http [SYN] Seq=0 Win=14600 Len=0 MSS=1460 SACK_PERM=1 TSval=43075823 TSecr=0 WS=128  tcp.stream == 17
377  21.899049 110.75.24.26 -> 216.165.108.217 TCP 60 http > 41163 [FIN, ACK] Seq=905 Ack=660 Win=6580 Len=0  tcp.stream == 13
378  21.899074 216.165.108.217 -> 110.75.24.26 TCP 54 41163 > http [ACK] Seq=660 Ack=906 Win=16272 Len=0  tcp.stream == 13
379  21.902947 216.165.108.217 -> 117.25.148.240 TCP 74 50876 > http [SYN] Seq=0 Win=14600 Len=0 MSS=1460 SACK_PERM=1 TSval=43075824 TSecr=0 WS=128  tcp.stream == 18
380  21.910752 216.165.108.217 -> 117.25.148.240 TCP 74 50877 > http [SYN] Seq=0 Win=14600 Len=0 MSS=1460 SACK_PERM=1 TSval=43075826 TSecr=0 WS=128  tcp.stream == 19
381  21.930525 110.75.24.26 -> 216.165.108.217 TCP 60 http > 41164 [FIN, ACK] Seq=893 Ack=655 Win=6530 Len=0  tcp.stream == 14
382  21.930550 216.165.108.217 -> 110.75.24.26 TCP 54 41164 > http [ACK] Seq=655 Ack=894 Win=16056 Len=0  tcp.stream == 14
383  21.982625 216.165.108.217 -> 117.25.148.240 TCP 74 50878 > http [SYN] Seq=0 Win=14600 Len=0 MSS=1460 SACK_PERM=1 TSval=43075844 TSecr=0 WS=128  tcp.stream == 20
384  21.992668 216.165.108.217 -> 117.25.148.240 TCP 74 50879 > http [SYN] Seq=0 Win=14600 Len=0 MSS=1460 SACK_PERM=1 TSval=43075847 TSecr=0 WS=128  tcp.stream == 21
385  21.993940 216.165.108.217 -> 117.25.148.240 TCP 74 50880 > http [SYN] Seq=0 Win=14600 Len=0 MSS=1460 SACK_PERM=1 TSval=43075847 TSecr=0 WS=128  tcp.stream == 22
387  22.045604 216.165.108.217 -> 117.25.148.240 TCP 74 50881 > http [SYN] Seq=0 Win=14600 Len=0 MSS=1460 SACK_PERM=1 TSval=43075860 TSecr=0 WS=128  tcp.stream == 23
388  22.046900 216.165.108.217 -> 117.25.148.240 TCP 74 50882 > http [SYN] Seq=0 Win=14600 Len=0 MSS=1460 SACK_PERM=1 TSval=43075860 TSecr=0 WS=128  tcp.stream == 24
389  22.057253 110.75.24.26 -> 216.165.108.217 TCP 60 http > 41165 [FIN, ACK] Seq=896 Ack=657 Win=6550 Len=0  tcp.stream == 15
390  22.057279 216.165.108.217 -> 110.75.24.26 TCP 54 41165 > http [ACK] Seq=657 Ack=897 Win=16110 Len=0  tcp.stream == 15
391  22.081948 216.165.108.217 -> 117.25.148.240 TCP 74 50883 > http [SYN] Seq=0 Win=14600 Len=0 MSS=1460 SACK_PERM=1 TSval=43075869 TSecr=0 WS=128  tcp.stream == 25
392  22.083650 216.165.108.217 -> 117.25.148.240 TCP 74 50884 > http [SYN] Seq=0 Win=14600 Len=0 MSS=1460 SACK_PERM=1 TSval=43075869 TSecr=0 WS=128  tcp.stream == 26
393  22.096145 216.165.108.217 -> 117.25.148.240 TCP 74 50885 > http [SYN] Seq=0 Win=14600 Len=0 MSS=1460 SACK_PERM=1 TSval=43075873 TSecr=0 WS=128  tcp.stream == 27
394  22.097417 216.165.108.217 -> 117.25.148.240 TCP 74 50886 > http [SYN] Seq=0 Win=14600 Len=0 MSS=1460 SACK_PERM=1 TSval=43075873 TSecr=0 WS=128  tcp.stream == 28
395  22.111687 216.165.108.217 -> 117.25.148.240 TCP 54 50866 > http [FIN, ACK] Seq=414 Ack=942 Win=17024 Len=0  tcp.stream == 8
396  22.137895 216.165.108.217 -> 117.25.148.240 TCP 74 50887 > http [SYN] Seq=0 Win=14600 Len=0 MSS=1460 SACK_PERM=1 TSval=43075883 TSecr=0 WS=128  tcp.stream == 29
397  22.139246 216.165.108.217 -> 117.25.148.240 TCP 74 50888 > http [SYN] Seq=0 Win=14600 Len=0 MSS=1460 SACK_PERM=1 TSval=43075883 TSecr=0 WS=128  tcp.stream == 30
398  22.143627 216.165.108.217 -> 117.25.148.240 TCP 74 50889 > http [SYN] Seq=0 Win=14600 Len=0 MSS=1460 SACK_PERM=1 TSval=43075884 TSecr=0 WS=128  tcp.stream == 31
399  22.155229 216.165.108.217 -> 117.25.148.240 TCP 74 50890 > http [SYN] Seq=0 Win=14600 Len=0 MSS=1460 SACK_PERM=1 TSval=43075887 TSecr=0 WS=128  tcp.stream == 32
400  22.156832 216.165.108.217 -> 117.25.148.240 TCP 74 50891 > http [SYN] Seq=0 Win=14600 Len=0 MSS=1460 SACK_PERM=1 TSval=43075888 TSecr=0 WS=128  tcp.stream == 33
401  22.158067 216.165.108.217 -> 117.25.148.240 TCP 74 50892 > http [SYN] Seq=0 Win=14600 Len=0 MSS=1460 SACK_PERM=1 TSval=43075888 TSecr=0 WS=128  tcp.stream == 34
402  22.182323 216.165.108.217 -> 119.167.201.251 TCP 74 46244 > http [SYN] Seq=0 Win=14600 Len=0 MSS=1460 SACK_PERM=1 TSval=43075894 TSecr=0 WS=128  tcp.stream == 35
403  22.184177 216.165.108.217 -> 119.167.201.251 TCP 74 46245 > http [SYN] Seq=0 Win=14600 Len=0 MSS=1460 SACK_PERM=1 TSval=43075895 TSecr=0 WS=128  tcp.stream == 36
404  22.195778 216.165.108.217 -> 119.167.201.251 TCP 74 46246 > http [SYN] Seq=0 Win=14600 Len=0 MSS=1460 SACK_PERM=1 TSval=43075898 TSecr=0 WS=128  tcp.stream == 37
405  22.197101 216.165.108.217 -> 119.167.201.251 TCP 74 46247 > http [SYN] Seq=0 Win=14600 Len=0 MSS=1460 SACK_PERM=1 TSval=43075898 TSecr=0 WS=128  tcp.stream == 38
407  22.198298 216.165.108.217 -> 119.167.201.251 TCP 74 46248 > http [SYN] Seq=0 Win=14600 Len=0 MSS=1460 SACK_PERM=1 TSval=43075898 TSecr=0 WS=128  tcp.stream == 39
408  22.200258 216.165.108.217 -> 117.25.148.240 TCP 74 50898 > http [SYN] Seq=0 Win=14600 Len=0 MSS=1460 SACK_PERM=1 TSval=43075899 TSecr=0 WS=128  tcp.stream == 40
409  22.201557 216.165.108.217 -> 117.25.148.240 TCP 74 50899 > http [SYN] Seq=0 Win=14600 Len=0 MSS=1460 SACK_PERM=1 TSval=43075899 TSecr=0 WS=128  tcp.stream == 41
410  22.202898 216.165.108.217 -> 117.25.148.240 TCP 74 50900 > http [SYN] Seq=0 Win=14600 Len=0 MSS=1460 SACK_PERM=1 TSval=43075899 TSecr=0 WS=128  tcp.stream == 42
411  22.204152 216.165.108.217 -> 117.25.148.240 TCP 74 50901 > http [SYN] Seq=0 Win=14600 Len=0 MSS=1460 SACK_PERM=1 TSval=43075900 TSecr=0 WS=128  tcp.stream == 43
412  22.216281 216.165.108.217 -> 117.25.148.240 TCP 74 50902 > http [SYN] Seq=0 Win=14600 Len=0 MSS=1460 SACK_PERM=1 TSval=43075903 TSecr=0 WS=128  tcp.stream == 44
413  22.217686 216.165.108.217 -> 117.25.148.240 TCP 74 50903 > http [SYN] Seq=0 Win=14600 Len=0 MSS=1460 SACK_PERM=1 TSval=43075903 TSecr=0 WS=128  tcp.stream == 45
414  22.322661 117.25.148.240 -> 216.165.108.217 TCP 66 http > 50875 [SYN, ACK] Seq=0 Ack=1 Win=5840 Len=0 MSS=1460 SACK_PERM=1 WS=512  tcp.stream == 17
415  22.322686 216.165.108.217 -> 117.25.148.240 TCP 54 50875 > http [ACK] Seq=1 Ack=1 Win=14720 Len=0  tcp.stream == 17
416  22.325438 216.165.108.217 -> 117.25.148.240 HTTP 467 GET /tps/i1/T1_kysXcXDXXXXXXXX-40-40.png HTTP/1.1   tcp.stream == 17
417  22.328629 117.25.148.240 -> 216.165.108.217 TCP 66 http > 50876 [SYN, ACK] Seq=0 Ack=1 Win=5840 Len=0 MSS=1460 SACK_PERM=1 WS=512  tcp.stream == 18
418  22.328652 216.165.108.217 -> 117.25.148.240 TCP 54 50876 > http [ACK] Seq=1 Ack=1 Win=14720 Len=0  tcp.stream == 18
419  22.334871 216.165.108.217 -> 117.25.148.240 HTTP 467 GET /tps/i1/T19TisXm8DXXXXXXXX-55-55.png HTTP/1.1   tcp.stream == 18
420  22.338016 117.25.148.240 -> 216.165.108.217 TCP 66 http > 50877 [SYN, ACK] Seq=0 Ack=1 Win=5840 Len=0 MSS=1460 SACK_PERM=1 WS=512  tcp.stream == 19
421  22.338042 216.165.108.217 -> 117.25.148.240 TCP 54 50877 > http [ACK] Seq=1 Ack=1 Win=14720 Len=0  tcp.stream == 19
422  22.344116 216.165.108.217 -> 117.25.148.240 HTTP 467 GET /tps/i1/T177WsXnhrXXXXXXXX-55-55.png HTTP/1.1   tcp.stream == 19
424  22.408385 117.25.148.240 -> 216.165.108.217 TCP 66 http > 50878 [SYN, ACK] Seq=0 Ack=1 Win=5840 Len=0 MSS=1460 SACK_PERM=1 WS=512  tcp.stream == 20
425  22.408410 216.165.108.217 -> 117.25.148.240 TCP 54 50878 > http [ACK] Seq=1 Ack=1 Win=14720 Len=0  tcp.stream == 20
426  22.412092 216.165.108.217 -> 117.25.148.240 HTTP 467 GET /tps/i1/T1zMOsXmXZXXXXXXXX-55-55.png HTTP/1.1   tcp.stream == 20
427  22.419421 117.25.148.240 -> 216.165.108.217 TCP 66 http > 50879 [SYN, ACK] Seq=0 Ack=1 Win=5840 Len=0 MSS=1460 SACK_PERM=1 WS=512  tcp.stream == 21
428  22.419448 216.165.108.217 -> 117.25.148.240 TCP 54 50879 > http [ACK] Seq=1 Ack=1 Win=14720 Len=0  tcp.stream == 21
429  22.420246 117.25.148.240 -> 216.165.108.217 TCP 66 http > 50880 [SYN, ACK] Seq=0 Ack=1 Win=5840 Len=0 MSS=1460 SACK_PERM=1 WS=512  tcp.stream == 22
430  22.420269 216.165.108.217 -> 117.25.148.240 TCP 54 50880 > http [ACK] Seq=1 Ack=1 Win=14720 Len=0  tcp.stream == 22
431  22.422253 216.165.108.217 -> 117.25.148.240 HTTP 467 GET /tps/i1/T1Dm5uXityXXXXXXXX-55-55.gif HTTP/1.1   tcp.stream == 22
432  22.423379 216.165.108.217 -> 117.25.148.240 HTTP 469 GET /tps/i1/T1DHeSXkBXXXXXXXXX-300-100.png HTTP/1.1   tcp.stream == 21
433  22.436962 216.165.108.217 -> 119.167.201.251 TCP 74 46255 > http [SYN] Seq=0 Win=14600 Len=0 MSS=1460 SACK_PERM=1 TSval=43075958 TSecr=0 WS=128  tcp.stream == 46
434  22.474939 117.25.148.240 -> 216.165.108.217 TCP 66 http > 50882 [SYN, ACK] Seq=0 Ack=1 Win=5840 Len=0 MSS=1460 SACK_PERM=1 WS=512  tcp.stream == 24
435  22.474966 216.165.108.217 -> 117.25.148.240 TCP 54 50882 > http [ACK] Seq=1 Ack=1 Win=14720 Len=0  tcp.stream == 24
436  22.475251 117.25.148.240 -> 216.165.108.217 TCP 66 http > 50881 [SYN, ACK] Seq=0 Ack=1 Win=5840 Len=0 MSS=1460 SACK_PERM=1 WS=512  tcp.stream == 23
437  22.475262 216.165.108.217 -> 117.25.148.240 TCP 54 50881 > http [ACK] Seq=1 Ack=1 Win=14720 Len=0  tcp.stream == 23
438  22.478423 216.165.108.217 -> 117.25.148.240 HTTP 467 GET /tps/i2/T19AysXiVNXXXXXXXX-40-40.png HTTP/1.1   tcp.stream == 24
439  22.479655 216.165.108.217 -> 117.25.148.240 HTTP 467 GET /tps/i2/T1DzOsXXNDXXXXXXXX-55-55.png HTTP/1.1   tcp.stream == 23
440  22.507947 117.25.148.240 -> 216.165.108.217 TCP 66 http > 50883 [SYN, ACK] Seq=0 Ack=1 Win=5840 Len=0 MSS=1460 SACK_PERM=1 WS=512  tcp.stream == 25
441  22.507969 216.165.108.217 -> 117.25.148.240 TCP 54 50883 > http [ACK] Seq=1 Ack=1 Win=14720 Len=0  tcp.stream == 25
442  22.510030 216.165.108.217 -> 117.25.148.240 HTTP 467 GET /tps/i2/T1wkSsXeJsXXXXXXXX-55-55.png HTTP/1.1   tcp.stream == 25
443  22.510951 117.25.148.240 -> 216.165.108.217 TCP 66 http > 50884 [SYN, ACK] Seq=0 Ack=1 Win=5840 Len=0 MSS=1460 SACK_PERM=1 WS=512  tcp.stream == 26
444  22.510976 216.165.108.217 -> 117.25.148.240 TCP 54 50884 > http [ACK] Seq=1 Ack=1 Win=14720 Len=0  tcp.stream == 26
445  22.513034 216.165.108.217 -> 117.25.148.240 HTTP 467 GET /tps/i2/T1blCsXcdoXXXXXXXX-55-55.png HTTP/1.1   tcp.stream == 26
446  22.523276 117.25.148.240 -> 216.165.108.217 TCP 66 http > 50886 [SYN, ACK] Seq=0 Ack=1 Win=5840 Len=0 MSS=1460 SACK_PERM=1 WS=512  tcp.stream == 28
447  22.523300 216.165.108.217 -> 117.25.148.240 TCP 54 50886 > http [ACK] Seq=1 Ack=1 Win=14720 Len=0  tcp.stream == 28
448  22.525105 216.165.108.217 -> 117.25.148.240 HTTP 467 GET /tps/i2/T1GzCtXotqXXXXXXXX-55-55.png HTTP/1.1   tcp.stream == 28
449  22.526492 117.25.148.240 -> 216.165.108.217 TCP 66 http > 50885 [SYN, ACK] Seq=0 Ack=1 Win=5840 Len=0 MSS=1460 SACK_PERM=1 WS=512  tcp.stream == 27
450  22.526517 216.165.108.217 -> 117.25.148.240 TCP 54 50885 > http [ACK] Seq=1 Ack=1 Win=14720 Len=0  tcp.stream == 27
451  22.528935 216.165.108.217 -> 117.25.148.240 HTTP 467 GET /tps/i2/T1okmsXclxXXXXXXXX-55-55.png HTTP/1.1   tcp.stream == 27
452  22.540692 117.25.148.240 -> 216.165.108.217 TCP 60 http > 50866 [FIN, ACK] Seq=942 Ack=415 Win=7168 Len=0  tcp.stream == 8
453  22.540717 216.165.108.217 -> 117.25.148.240 TCP 54 50866 > http [ACK] Seq=415 Ack=943 Win=17024 Len=0  tcp.stream == 8
455  22.563777 119.167.201.251 -> 216.165.108.217 TCP 60 http > 46244 [SYN, ACK] Seq=0 Ack=1 Win=5840 Len=0 MSS=1460  tcp.stream == 35
456  22.563801 216.165.108.217 -> 119.167.201.251 TCP 54 46244 > http [ACK] Seq=1 Ack=1 Win=14600 Len=0  tcp.stream == 35
457  22.565397 119.167.201.251 -> 216.165.108.217 TCP 60 http > 46245 [SYN, ACK] Seq=0 Ack=1 Win=5840 Len=0 MSS=1460  tcp.stream == 36
458  22.565422 216.165.108.217 -> 119.167.201.251 TCP 54 46245 > http [ACK] Seq=1 Ack=1 Win=14600 Len=0  tcp.stream == 36
459  22.565984 216.165.108.217 -> 119.167.201.251 HTTP 456 GET /mw/s/hi/tbtouch/logos/logo-v2.png HTTP/1.1   tcp.stream == 35
460  22.567458 117.25.148.240 -> 216.165.108.217 TCP 66 http > 50887 [SYN, ACK] Seq=0 Ack=1 Win=5840 Len=0 MSS=1460 SACK_PERM=1 WS=512  tcp.stream == 29
461  22.567482 216.165.108.217 -> 117.25.148.240 TCP 54 50887 > http [ACK] Seq=1 Ack=1 Win=14720 Len=0  tcp.stream == 29
462  22.568075 216.165.108.217 -> 119.167.201.251 HTTP 459 GET /mw/s/hi/tbtouch/images/header-v2.png HTTP/1.1   tcp.stream == 36
463  22.568347 117.25.148.240 -> 216.165.108.217 TCP 66 http > 50888 [SYN, ACK] Seq=0 Ack=1 Win=5840 Len=0 MSS=1460 SACK_PERM=1 WS=512  tcp.stream == 30
464  22.568365 216.165.108.217 -> 117.25.148.240 TCP 54 50888 > http [ACK] Seq=1 Ack=1 Win=14720 Len=0  tcp.stream == 30
465  22.571318 216.165.108.217 -> 117.25.148.240 HTTP 467 GET /tps/i3/T1jAusXmtQXXXXXXXX-40-40.png HTTP/1.1   tcp.stream == 29
466  22.572930 216.165.108.217 -> 117.25.148.240 HTTP 467 GET /tps/i3/T1C5KsXk8LXXXXXXXX-55-55.png HTTP/1.1   tcp.stream == 30
467  22.573182 117.25.148.240 -> 216.165.108.217 TCP 66 http > 50889 [SYN, ACK] Seq=0 Ack=1 Win=5840 Len=0 MSS=1460 SACK_PERM=1 WS=512  tcp.stream == 31
468  22.573202 216.165.108.217 -> 117.25.148.240 TCP 54 50889 > http [ACK] Seq=1 Ack=1 Win=14720 Len=0  tcp.stream == 31
469  22.575429 216.165.108.217 -> 117.25.148.240 HTTP 467 GET /tps/i3/T1tTisXaVEXXXXXXXX-55-55.png HTTP/1.1   tcp.stream == 31
470  22.577724 119.167.201.251 -> 216.165.108.217 TCP 60 http > 46246 [SYN, ACK] Seq=0 Ack=1 Win=5840 Len=0 MSS=1460  tcp.stream == 37
471  22.577749 216.165.108.217 -> 119.167.201.251 TCP 54 46246 > http [ACK] Seq=1 Ack=1 Win=14600 Len=0  tcp.stream == 37
472  22.578683 119.167.201.251 -> 216.165.108.217 TCP 60 http > 46247 [SYN, ACK] Seq=0 Ack=1 Win=5840 Len=0 MSS=1460  tcp.stream == 38
473  22.578709 216.165.108.217 -> 119.167.201.251 TCP 54 46247 > http [ACK] Seq=1 Ack=1 Win=14600 Len=0  tcp.stream == 38
474  22.579938 216.165.108.217 -> 119.167.201.251 HTTP 453 GET /mw/s/hi/tbtouch/images/tab.png HTTP/1.1   tcp.stream == 37
475  22.580493 119.167.201.251 -> 216.165.108.217 TCP 60 http > 46248 [SYN, ACK] Seq=0 Ack=1 Win=5840 Len=0 MSS=1460  tcp.stream == 39
476  22.580516 216.165.108.217 -> 119.167.201.251 TCP 54 46248 > http [ACK] Seq=1 Ack=1 Win=14600 Len=0  tcp.stream == 39
477  22.582024 216.165.108.217 -> 119.167.201.251 HTTP 464 GET /mw/s/hi/tbtouch/images/icon-list-link.png HTTP/1.1   tcp.stream == 38
478  22.585708 117.25.148.240 -> 216.165.108.217 TCP 66 http > 50890 [SYN, ACK] Seq=0 Ack=1 Win=5840 Len=0 MSS=1460 SACK_PERM=1 WS=512  tcp.stream == 32
479  22.585732 216.165.108.217 -> 117.25.148.240 TCP 54 50890 > http [ACK] Seq=1 Ack=1 Win=14720 Len=0  tcp.stream == 32
480  22.586270 117.25.148.240 -> 216.165.108.217 TCP 66 http > 50891 [SYN, ACK] Seq=0 Ack=1 Win=5840 Len=0 MSS=1460 SACK_PERM=1 WS=512  tcp.stream == 33
481  22.586291 216.165.108.217 -> 117.25.148.240 TCP 54 50891 > http [ACK] Seq=1 Ack=1 Win=14720 Len=0  tcp.stream == 33
482  22.589565 117.25.148.240 -> 216.165.108.217 TCP 66 http > 50892 [SYN, ACK] Seq=0 Ack=1 Win=5840 Len=0 MSS=1460 SACK_PERM=1 WS=512  tcp.stream == 34
483  22.589591 216.165.108.217 -> 117.25.148.240 TCP 54 50892 > http [ACK] Seq=1 Ack=1 Win=14720 Len=0  tcp.stream == 34
484  22.594237 216.165.108.217 -> 119.167.201.251 HTTP 457 GET /mw/s/hi/tbtouch/images/loading.gif HTTP/1.1   tcp.stream == 39
485  22.601723 216.165.108.217 -> 117.25.148.240 HTTP 467 GET /tps/i3/T1fh9qXkXgXXXXXXXX-55-55.png HTTP/1.1   tcp.stream == 33
486  22.602824 216.165.108.217 -> 117.25.148.240 HTTP 467 GET /tps/i3/T1BOesXeVPXXXXXXXX-55-55.png HTTP/1.1   tcp.stream == 32
487  22.604169 216.165.108.217 -> 117.25.148.240 HTTP 467 GET /tps/i3/T1sHatXaNbXXXXXXXX-55-55.png HTTP/1.1   tcp.stream == 34
488  22.626964 117.25.148.240 -> 216.165.108.217 TCP 66 http > 50899 [SYN, ACK] Seq=0 Ack=1 Win=5840 Len=0 MSS=1460 SACK_PERM=1 WS=512  tcp.stream == 41
489  22.626989 216.165.108.217 -> 117.25.148.240 TCP 54 50899 > http [ACK] Seq=1 Ack=1 Win=14720 Len=0  tcp.stream == 41
490  22.629876 216.165.108.217 -> 117.25.148.240 HTTP 467 GET /tps/i4/T1nAqsXhxRXXXXXXXX-40-40.png HTTP/1.1   tcp.stream == 41
491  22.633258 117.25.148.240 -> 216.165.108.217 TCP 66 http > 50901 [SYN, ACK] Seq=0 Ack=1 Win=5840 Len=0 MSS=1460 SACK_PERM=1 WS=512  tcp.stream == 43
492  22.633281 216.165.108.217 -> 117.25.148.240 TCP 54 50901 > http [ACK] Seq=1 Ack=1 Win=14720 Len=0  tcp.stream == 43
493  22.635855 216.165.108.217 -> 117.25.148.240 HTTP 467 GET /tps/i4/T138WsXeVNXXXXXXXX-55-55.png HTTP/1.1   tcp.stream == 43
494  22.645630 117.25.148.240 -> 216.165.108.217 TCP 66 http > 50902 [SYN, ACK] Seq=0 Ack=1 Win=5840 Len=0 MSS=1460 SACK_PERM=1 WS=512  tcp.stream == 44
495  22.645655 216.165.108.217 -> 117.25.148.240 TCP 54 50902 > http [ACK] Seq=1 Ack=1 Win=14720 Len=0  tcp.stream == 44
496  22.647836 216.165.108.217 -> 117.25.148.240 HTTP 467 GET /tps/i4/T15jKsXfdDXXXXXXXX-55-55.png HTTP/1.1   tcp.stream == 44
497  22.648495 117.25.148.240 -> 216.165.108.217 TCP 66 http > 50903 [SYN, ACK] Seq=0 Ack=1 Win=5840 Len=0 MSS=1460 SACK_PERM=1 WS=512  tcp.stream == 45
498  22.648520 216.165.108.217 -> 117.25.148.240 TCP 54 50903 > http [ACK] Seq=1 Ack=1 Win=14720 Len=0  tcp.stream == 45
499  22.651854 216.165.108.217 -> 117.25.148.240 HTTP 467 GET /tps/i4/T1slusXbRpXXXXXXXX-55-55.png HTTP/1.1   tcp.stream == 45
501  22.752297 117.25.148.240 -> 216.165.108.217 HTTP 974 HTTP/1.1 200 OK  (PNG)  tcp.stream == 17
502  22.752322 216.165.108.217 -> 117.25.148.240 TCP 54 50875 > http [ACK] Seq=414 Ack=921 Win=16512 Len=0  tcp.stream == 17
503  22.760230 216.165.108.217 -> 117.25.148.240 TCP 54 50875 > http [FIN, ACK] Seq=414 Ack=921 Win=16512 Len=0  tcp.stream == 17
504  22.761306 216.165.108.217 -> 117.25.148.240 TCP 74 50905 > http [SYN] Seq=0 Win=14600 Len=0 MSS=1460 SACK_PERM=1 TSval=43076039 TSecr=0 WS=128  tcp.stream == 47
505  22.762648 117.25.148.240 -> 216.165.108.217 HTTP 1109 HTTP/1.1 200 OK  (PNG)  tcp.stream == 18
506  22.762675 216.165.108.217 -> 117.25.148.240 TCP 54 50876 > http [ACK] Seq=414 Ack=1056 Win=16768 Len=0  tcp.stream == 18
507  22.771364 117.25.148.240 -> 216.165.108.217 HTTP 1239 HTTP/1.1 200 OK  (PNG)  tcp.stream == 19
508  22.771388 216.165.108.217 -> 117.25.148.240 TCP 54 50877 > http [ACK] Seq=414 Ack=1186 Win=17024 Len=0  tcp.stream == 19
509  22.775130 216.165.108.217 -> 117.25.148.240 TCP 54 50876 > http [FIN, ACK] Seq=414 Ack=1056 Win=16768 Len=0  tcp.stream == 18
510  22.776183 216.165.108.217 -> 117.25.148.240 TCP 74 50906 > http [SYN] Seq=0 Win=14600 Len=0 MSS=1460 SACK_PERM=1 TSval=43076043 TSecr=0 WS=128  tcp.stream == 48
511  22.788070 216.165.108.217 -> 117.25.148.240 TCP 54 50877 > http [FIN, ACK] Seq=414 Ack=1186 Win=17024 Len=0  tcp.stream == 19
512  22.789151 216.165.108.217 -> 117.25.148.240 TCP 74 50907 > http [SYN] Seq=0 Win=14600 Len=0 MSS=1460 SACK_PERM=1 TSval=43076046 TSecr=0 WS=128  tcp.stream == 49
513  22.848877 117.25.148.240 -> 216.165.108.217 HTTP 1148 HTTP/1.1 200 OK  (GIF89a)  tcp.stream == 22
514  22.848902 216.165.108.217 -> 117.25.148.240 TCP 54 50880 > http [ACK] Seq=414 Ack=1095 Win=16896 Len=0  tcp.stream == 22
515  22.851596 117.25.148.240 -> 216.165.108.217 TCP 1514 [TCP segment of a reassembled PDU]  tcp.stream == 21
516  22.851622 216.165.108.217 -> 117.25.148.240 TCP 54 50879 > http [ACK] Seq=416 Ack=1461 Win=17536 Len=0  tcp.stream == 21
517  22.851720 117.25.148.240 -> 216.165.108.217 TCP 1514 [TCP segment of a reassembled PDU]  tcp.stream == 21
518  22.851727 216.165.108.217 -> 117.25.148.240 TCP 54 50879 > http [ACK] Seq=416 Ack=2921 Win=20480 Len=0  tcp.stream == 21
519  22.854639 216.165.108.217 -> 117.25.148.240 TCP 54 50880 > http [FIN, ACK] Seq=414 Ack=1095 Win=16896 Len=0  tcp.stream == 22
520  22.907004 117.25.148.240 -> 216.165.108.217 HTTP 971 HTTP/1.1 200 OK  (PNG)  tcp.stream == 24
521  22.907030 216.165.108.217 -> 117.25.148.240 TCP 54 50882 > http [ACK] Seq=414 Ack=918 Win=16512 Len=0  tcp.stream == 24
522  22.908913 117.25.148.240 -> 216.165.108.217 TCP 342 [TCP segment of a reassembled PDU]  tcp.stream == 23
523  22.908945 216.165.108.217 -> 117.25.148.240 TCP 54 50881 > http [ACK] Seq=414 Ack=289 Win=15744 Len=0  tcp.stream == 23
524  22.909043 117.25.148.240 -> 216.165.108.217 HTTP 920 HTTP/1.1 200 OK  (PNG)  tcp.stream == 23
525  22.909049 216.165.108.217 -> 117.25.148.240 TCP 54 50881 > http [ACK] Seq=414 Ack=1155 Win=17408 Len=0  tcp.stream == 23
526  22.914800 216.165.108.217 -> 117.25.148.240 TCP 54 50882 > http [FIN, ACK] Seq=414 Ack=918 Win=16512 Len=0  tcp.stream == 24
527  22.916165 216.165.108.217 -> 117.25.148.240 TCP 74 50908 > http [SYN] Seq=0 Win=14600 Len=0 MSS=1460 SACK_PERM=1 TSval=43076078 TSecr=0 WS=128  tcp.stream == 50
529  22.936206 119.167.201.251 -> 216.165.108.217 TCP 60 http > 46244 [ACK] Seq=1 Ack=403 Win=6432 Len=0  tcp.stream == 35
530  22.936253 216.165.108.217 -> 117.25.148.240 TCP 54 50881 > http [FIN, ACK] Seq=414 Ack=1155 Win=17408 Len=0  tcp.stream == 23
531  22.936498 119.167.201.251 -> 216.165.108.217 HTTP 632 [TCP Previous segment not captured] Continuation or non-HTTP traffic  tcp.stream == 35
532  22.936511 216.165.108.217 -> 119.167.201.251 TCP 54 [TCP Dup ACK 459#1] 46244 > http [ACK] Seq=403 Ack=1 Win=14600 Len=0  tcp.stream == 35
533  22.936644 119.167.201.251 -> 216.165.108.217 TCP 1514 [TCP Out-Of-Order] [TCP segment of a reassembled PDU]  tcp.stream == 35
534  22.936655 216.165.108.217 -> 119.167.201.251 TCP 54 46244 > http [ACK] Seq=403 Ack=2040 Win=17520 Len=0  tcp.stream == 35
535  22.937401 216.165.108.217 -> 117.25.148.240 TCP 74 50909 > http [SYN] Seq=0 Win=14600 Len=0 MSS=1460 SACK_PERM=1 TSval=43076083 TSecr=0 WS=128  tcp.stream == 51
536  22.938699 119.167.201.251 -> 216.165.108.217 TCP 60 http > 46245 [ACK] Seq=1 Ack=406 Win=6432 Len=0  tcp.stream == 36
537  22.938770 119.167.201.251 -> 216.165.108.217 HTTP 77 [TCP Previous segment not captured] Continuation or non-HTTP traffic  tcp.stream == 36
538  22.938780 216.165.108.217 -> 119.167.201.251 TCP 54 [TCP Dup ACK 462#1] 46245 > http [ACK] Seq=406 Ack=1 Win=14600 Len=0  tcp.stream == 36
539  22.939124 119.167.201.251 -> 216.165.108.217 TCP 1514 [TCP Out-Of-Order] [TCP segment of a reassembled PDU]  tcp.stream == 36
540  22.939139 216.165.108.217 -> 119.167.201.251 TCP 54 46245 > http [ACK] Seq=406 Ack=1485 Win=17520 Len=0  tcp.stream == 36
541  22.939245 117.25.148.240 -> 216.165.108.217 HTTP 1766 HTTP/1.1 200 OK  (PNG)  tcp.stream == 25
542  22.939254 216.165.108.217 -> 117.25.148.240 TCP 54 50883 > http [ACK] Seq=414 Ack=1713 Win=17536 Len=0  tcp.stream == 25
543  22.940172 117.25.148.240 -> 216.165.108.217 TCP 343 [TCP segment of a reassembled PDU]  tcp.stream == 26
544  22.940193 216.165.108.217 -> 117.25.148.240 TCP 54 50884 > http [ACK] Seq=414 Ack=290 Win=15744 Len=0  tcp.stream == 26
545  22.940413 117.25.148.240 -> 216.165.108.217 TCP 1514 [TCP segment of a reassembled PDU]  tcp.stream == 26
546  22.940421 216.165.108.217 -> 117.25.148.240 TCP 54 50884 > http [ACK] Seq=414 Ack=1750 Win=18688 Len=0  tcp.stream == 26
547  22.952003 117.25.148.240 -> 216.165.108.217 HTTP 1206 HTTP/1.1 200 OK  (PNG)  tcp.stream == 28
548  22.952025 216.165.108.217 -> 117.25.148.240 TCP 54 50886 > http [ACK] Seq=414 Ack=1153 Win=17024 Len=0  tcp.stream == 28
549  22.952032 119.167.201.251 -> 216.165.108.217 TCP 60 http > 46246 [ACK] Seq=1 Ack=400 Win=6432 Len=0  tcp.stream == 37
550  22.952038 119.167.201.251 -> 216.165.108.217 HTTP 681 HTTP/1.1 200 OK  (PNG)  tcp.stream == 37
551  22.952042 216.165.108.217 -> 119.167.201.251 TCP 54 46246 > http [ACK] Seq=400 Ack=629 Win=15675 Len=0  tcp.stream == 37
552  22.953312 119.167.201.251 -> 216.165.108.217 TCP 60 http > 46247 [ACK] Seq=1 Ack=411 Win=6432 Len=0  tcp.stream == 38
553  22.954023 119.167.201.251 -> 216.165.108.217 HTTP 587 HTTP/1.1 200 OK  (PNG)  tcp.stream == 38
554  22.960295 117.25.148.240 -> 216.165.108.217 HTTP 1265 HTTP/1.1 200 OK  (PNG)  tcp.stream == 27
555  22.960323 216.165.108.217 -> 117.25.148.240 TCP 54 50885 > http [ACK] Seq=414 Ack=1212 Win=17024 Len=0  tcp.stream == 27
556  22.966029 119.167.201.251 -> 216.165.108.217 TCP 60 http > 46248 [ACK] Seq=1 Ack=404 Win=6432 Len=0  tcp.stream == 39
557  22.966403 119.167.201.251 -> 216.165.108.217 HTTP 203 [TCP Previous segment not captured] Continuation or non-HTTP traffic  tcp.stream == 39
558  22.966418 216.165.108.217 -> 119.167.201.251 TCP 54 [TCP Dup ACK 484#1] 46248 > http [ACK] Seq=404 Ack=1 Win=14600 Len=0  tcp.stream == 39
559  22.966597 119.167.201.251 -> 216.165.108.217 TCP 1514 [TCP Out-Of-Order] [TCP segment of a reassembled PDU]  tcp.stream == 39
560  22.966607 216.165.108.217 -> 119.167.201.251 TCP 54 46248 > http [ACK] Seq=404 Ack=1461 Win=17520 Len=0  tcp.stream == 39
561  22.966717 119.167.201.251 -> 216.165.108.217 TCP 1514 [TCP Out-Of-Order] [TCP segment of a reassembled PDU]  tcp.stream == 39
562  22.966725 216.165.108.217 -> 119.167.201.251 TCP 54 46248 > http [ACK] Seq=404 Ack=3071 Win=20440 Len=0  tcp.stream == 39
563  22.991440 216.165.108.217 -> 119.167.201.251 TCP 54 46244 > http [FIN, ACK] Seq=403 Ack=2040 Win=17520 Len=0  tcp.stream == 35
564  22.991680 216.165.108.217 -> 119.167.201.251 TCP 54 46247 > http [ACK] Seq=411 Ack=535 Win=15544 Len=0  tcp.stream == 38
565  22.992997 216.165.108.217 -> 119.167.201.251 TCP 54 46245 > http [FIN, ACK] Seq=406 Ack=1485 Win=17520 Len=0  tcp.stream == 36
566  22.993727 216.165.108.217 -> 117.25.148.240 TCP 54 50883 > http [FIN, ACK] Seq=414 Ack=1713 Win=17536 Len=0  tcp.stream == 25
567  23.002258 117.25.148.240 -> 216.165.108.217 HTTP 1283 HTTP/1.1 200 OK  (PNG)  tcp.stream == 29
568  23.002284 216.165.108.217 -> 117.25.148.240 TCP 54 50887 > http [ACK] Seq=414 Ack=1230 Win=17152 Len=0  tcp.stream == 29
569  23.004445 117.25.148.240 -> 216.165.108.217 HTTP 1288 HTTP/1.1 200 OK  (PNG)  tcp.stream == 30
570  23.004466 216.165.108.217 -> 117.25.148.240 TCP 54 50888 > http [ACK] Seq=414 Ack=1235 Win=17152 Len=0  tcp.stream == 30
571  23.007100 117.25.148.240 -> 216.165.108.217 HTTP 820 HTTP/1.1 200 OK  (PNG)  tcp.stream == 31
572  23.007127 216.165.108.217 -> 117.25.148.240 TCP 54 50889 > http [ACK] Seq=414 Ack=767 Win=16256 Len=0  tcp.stream == 31
573  23.031964 117.25.148.240 -> 216.165.108.217 HTTP 1054 HTTP/1.1 200 OK  (PNG)  tcp.stream == 33
574  23.031992 216.165.108.217 -> 117.25.148.240 TCP 54 50891 > http [ACK] Seq=414 Ack=1001 Win=16640 Len=0  tcp.stream == 33
575  23.032782 117.25.148.240 -> 216.165.108.217 TCP 342 [TCP segment of a reassembled PDU]  tcp.stream == 32
576  23.032806 216.165.108.217 -> 117.25.148.240 TCP 54 50890 > http [ACK] Seq=414 Ack=289 Win=15744 Len=0  tcp.stream == 32
577  23.032811 117.25.148.240 -> 216.165.108.217 HTTP 600 HTTP/1.1 200 OK  (PNG)  tcp.stream == 32
578  23.032815 216.165.108.217 -> 117.25.148.240 TCP 54 50890 > http [ACK] Seq=414 Ack=835 Win=16768 Len=0  tcp.stream == 32
579  23.036057 117.25.148.240 -> 216.165.108.217 HTTP 1697 HTTP/1.1 200 OK  (PNG)  tcp.stream == 34
580  23.036081 216.165.108.217 -> 117.25.148.240 TCP 54 50892 > http [ACK] Seq=414 Ack=1644 Win=17536 Len=0  tcp.stream == 34
581  23.054031 117.25.148.240 -> 216.165.108.217 TCP 342 [TCP segment of a reassembled PDU]  tcp.stream == 41
582  23.054057 216.165.108.217 -> 117.25.148.240 TCP 54 50899 > http [ACK] Seq=414 Ack=289 Win=15744 Len=0  tcp.stream == 41
583  23.054062 117.25.148.240 -> 216.165.108.217 HTTP 390 HTTP/1.1 200 OK  (PNG)  tcp.stream == 41
584  23.054065 216.165.108.217 -> 117.25.148.240 TCP 54 50899 > http [ACK] Seq=414 Ack=625 Win=16768 Len=0  tcp.stream == 41
585  23.063114 117.25.148.240 -> 216.165.108.217 TCP 342 [TCP segment of a reassembled PDU]  tcp.stream == 43
586  23.063139 216.165.108.217 -> 117.25.148.240 TCP 54 50901 > http [ACK] Seq=414 Ack=289 Win=15744 Len=0  tcp.stream == 43
587  23.063189 117.25.148.240 -> 216.165.108.217 HTTP 1042 HTTP/1.1 200 OK  (PNG)  tcp.stream == 43
588  23.063195 216.165.108.217 -> 117.25.148.240 TCP 54 50901 > http [ACK] Seq=414 Ack=1277 Win=17664 Len=0  tcp.stream == 43
595  23.081308 117.25.148.240 -> 216.165.108.217 HTTP 1723 HTTP/1.1 200 OK  (PNG)  tcp.stream == 45
596  23.081332 216.165.108.217 -> 117.25.148.240 TCP 54 50903 > http [ACK] Seq=414 Ack=1670 Win=17536 Len=0  tcp.stream == 45
598  23.110155 216.165.108.217 -> 119.167.201.251 TCP 54 46246 > http [FIN, ACK] Seq=400 Ack=629 Win=15675 Len=0  tcp.stream == 37
599  23.111041 216.165.108.217 -> 117.25.148.240 TCP 54 50886 > http [FIN, ACK] Seq=414 Ack=1153 Win=17024 Len=0  tcp.stream == 28
600  23.111786 216.165.108.217 -> 119.167.201.251 TCP 54 46247 > http [FIN, ACK] Seq=411 Ack=535 Win=15544 Len=0  tcp.stream == 38
601  23.112555 216.165.108.217 -> 117.25.148.240 TCP 54 50885 > http [FIN, ACK] Seq=414 Ack=1212 Win=17024 Len=0  tcp.stream == 27
602  23.113292 216.165.108.217 -> 119.167.201.251 TCP 54 46248 > http [FIN, ACK] Seq=404 Ack=3071 Win=20440 Len=0  tcp.stream == 39
603  23.113771 117.25.148.240 -> 216.165.108.217 TCP 60 http > 50902 [ACK] Seq=1 Ack=414 Win=7168 Len=0  tcp.stream == 44
604  23.122503 216.165.108.217 -> 117.25.148.240 TCP 54 50887 > http [FIN, ACK] Seq=414 Ack=1230 Win=17152 Len=0  tcp.stream == 29
605  23.123279 216.165.108.217 -> 117.25.148.240 TCP 74 50910 > http [SYN] Seq=0 Win=14600 Len=0 MSS=1460 SACK_PERM=1 TSval=43076129 TSecr=0 WS=128  tcp.stream == 52
606  23.124113 216.165.108.217 -> 117.25.148.240 TCP 54 50889 > http [FIN, ACK] Seq=414 Ack=767 Win=16256 Len=0  tcp.stream == 31
607  23.124821 216.165.108.217 -> 117.25.148.240 TCP 74 50911 > http [SYN] Seq=0 Win=14600 Len=0 MSS=1460 SACK_PERM=1 TSval=43076130 TSecr=0 WS=128  tcp.stream == 53
608  23.125533 216.165.108.217 -> 117.25.148.240 TCP 54 50888 > http [FIN, ACK] Seq=414 Ack=1235 Win=17152 Len=0  tcp.stream == 30
609  23.126257 216.165.108.217 -> 117.25.148.240 TCP 74 50912 > http [SYN] Seq=0 Win=14600 Len=0 MSS=1460 SACK_PERM=1 TSval=43076130 TSecr=0 WS=128  tcp.stream == 54
615  23.181623 117.25.148.240 -> 216.165.108.217 TCP 60 http > 50875 [FIN, ACK] Seq=921 Ack=415 Win=7168 Len=0  tcp.stream == 17
616  23.181641 216.165.108.217 -> 117.25.148.240 TCP 54 50875 > http [ACK] Seq=415 Ack=922 Win=16512 Len=0  tcp.stream == 17
618  23.182991 117.25.148.240 -> 216.165.108.217 TCP 66 http > 50905 [SYN, ACK] Seq=0 Ack=1 Win=5840 Len=0 MSS=1460 SACK_PERM=1 WS=512  tcp.stream == 47
619  23.183015 216.165.108.217 -> 117.25.148.240 TCP 54 50905 > http [ACK] Seq=1 Ack=1 Win=14720 Len=0  tcp.stream == 47
620  23.195975 117.25.148.240 -> 216.165.108.217 TCP 60 http > 50876 [FIN, ACK] Seq=1056 Ack=415 Win=7168 Len=0  tcp.stream == 18
621  23.195998 216.165.108.217 -> 117.25.148.240 TCP 54 50876 > http [ACK] Seq=415 Ack=1057 Win=16768 Len=0  tcp.stream == 18
622  23.197632 117.25.148.240 -> 216.165.108.217 TCP 66 http > 50906 [SYN, ACK] Seq=0 Ack=1 Win=5840 Len=0 MSS=1460 SACK_PERM=1 WS=512  tcp.stream == 48
623  23.197659 216.165.108.217 -> 117.25.148.240 TCP 54 50906 > http [ACK] Seq=1 Ack=1 Win=14720 Len=0  tcp.stream == 48
624  23.213146 117.25.148.240 -> 216.165.108.217 TCP 66 http > 50907 [SYN, ACK] Seq=0 Ack=1 Win=5840 Len=0 MSS=1460 SACK_PERM=1 WS=512  tcp.stream == 49
625  23.213171 216.165.108.217 -> 117.25.148.240 TCP 54 50907 > http [ACK] Seq=1 Ack=1 Win=14720 Len=0  tcp.stream == 49
626  23.221954 216.165.108.217 -> 117.25.148.240 TCP 54 50891 > http [FIN, ACK] Seq=414 Ack=1001 Win=16640 Len=0  tcp.stream == 33
627  23.222753 216.165.108.217 -> 117.25.148.240 TCP 74 50913 > http [SYN] Seq=0 Win=14600 Len=0 MSS=1460 SACK_PERM=1 TSval=43076154 TSecr=0 WS=128  tcp.stream == 55
628  23.223454 216.165.108.217 -> 117.25.148.240 TCP 54 50890 > http [FIN, ACK] Seq=414 Ack=835 Win=16768 Len=0  tcp.stream == 32
629  23.224216 216.165.108.217 -> 117.25.148.240 TCP 54 50892 > http [FIN, ACK] Seq=414 Ack=1644 Win=17536 Len=0  tcp.stream == 34
630  23.245138 216.165.108.217 -> 117.25.148.240 TCP 54 50899 > http [FIN, ACK] Seq=414 Ack=625 Win=16768 Len=0  tcp.stream == 41
631  23.245886 216.165.108.217 -> 117.25.148.240 TCP 74 50914 > http [SYN] Seq=0 Win=14600 Len=0 MSS=1460 SACK_PERM=1 TSval=43076160 TSecr=0 WS=128  tcp.stream == 56
632  23.246567 216.165.108.217 -> 117.25.148.240 TCP 54 50901 > http [FIN, ACK] Seq=414 Ack=1277 Win=17664 Len=0  tcp.stream == 43
633  23.247272 216.165.108.217 -> 117.25.148.240 TCP 74 50915 > http [SYN] Seq=0 Win=14600 Len=0 MSS=1460 SACK_PERM=1 TSval=43076160 TSecr=0 WS=128  tcp.stream == 57
634  23.248344 216.165.108.217 -> 117.25.148.240 TCP 54 50903 > http [FIN, ACK] Seq=414 Ack=1670 Win=17536 Len=0  tcp.stream == 45
635  23.249056 216.165.108.217 -> 117.25.148.240 TCP 74 50916 > http [SYN] Seq=0 Win=14600 Len=0 MSS=1460 SACK_PERM=1 TSval=43076161 TSecr=0 WS=128  tcp.stream == 58
636  23.256118 216.165.108.217 -> 117.25.148.240 HTTP 467 GET /tps/i1/T1s4GNXk0fXXXXXXXX-30-30.jpg HTTP/1.1   tcp.stream == 47
637  23.257067 216.165.108.217 -> 117.25.148.240 HTTP 467 GET /tps/i1/T1vVexXdVSXXXXXXXX-30-30.png HTTP/1.1   tcp.stream == 48
638  23.257968 216.165.108.217 -> 117.25.148.240 HTTP 467 GET /tps/i1/T1B81IXl4wXXXXXXXX-30-30.jpg HTTP/1.1   tcp.stream == 49
639  23.287440 117.25.148.240 -> 216.165.108.217 HTTP 1841 HTTP/1.1 200 OK  (PNG)  tcp.stream == 44
640  23.287461 216.165.108.217 -> 117.25.148.240 TCP 54 50902 > http [ACK] Seq=414 Ack=1788 Win=17536 Len=0  tcp.stream == 44
642  23.292140 216.165.108.217 -> 117.25.148.240 TCP 54 50902 > http [FIN, ACK] Seq=414 Ack=1788 Win=17536 Len=0  tcp.stream == 44
643  23.292943 216.165.108.217 -> 117.25.148.240 TCP 74 50917 > http [SYN] Seq=0 Win=14600 Len=0 MSS=1460 SACK_PERM=1 TSval=43076172 TSecr=0 WS=128  tcp.stream == 59
644  23.334110 117.25.148.240 -> 216.165.108.217 TCP 60 http > 50882 [FIN, ACK] Seq=918 Ack=415 Win=7168 Len=0  tcp.stream == 24
645  23.334135 216.165.108.217 -> 117.25.148.240 TCP 54 50882 > http [ACK] Seq=415 Ack=919 Win=16512 Len=0  tcp.stream == 24
646  23.337000 117.25.148.240 -> 216.165.108.217 TCP 66 http > 50908 [SYN, ACK] Seq=0 Ack=1 Win=5840 Len=0 MSS=1460 SACK_PERM=1 WS=512  tcp.stream == 50
647  23.337025 216.165.108.217 -> 117.25.148.240 TCP 54 50908 > http [ACK] Seq=1 Ack=1 Win=14720 Len=0  tcp.stream == 50
648  23.339281 216.165.108.217 -> 117.25.148.240 HTTP 467 GET /tps/i2/T1RzCsXjpEXXXXXXXX-55-55.png HTTP/1.1   tcp.stream == 50
649  23.355969 119.167.201.251 -> 216.165.108.217 TCP 60 http > 46244 [ACK] Seq=2040 Ack=404 Win=6432 Len=0  tcp.stream == 35
650  23.357100 117.25.148.240 -> 216.165.108.217 TCP 66 http > 50909 [SYN, ACK] Seq=0 Ack=1 Win=5840 Len=0 MSS=1460 SACK_PERM=1 WS=512  tcp.stream == 51
651  23.357125 216.165.108.217 -> 117.25.148.240 TCP 54 50909 > http [ACK] Seq=1 Ack=1 Win=14720 Len=0  tcp.stream == 51
652  23.357131 117.25.148.240 -> 216.165.108.217 TCP 60 http > 50881 [FIN, ACK] Seq=1155 Ack=415 Win=7168 Len=0  tcp.stream == 23
653  23.357138 216.165.108.217 -> 117.25.148.240 TCP 54 50881 > http [ACK] Seq=415 Ack=1156 Win=17408 Len=0  tcp.stream == 23
654  23.357145 117.25.148.240 -> 216.165.108.217 HTTP 482 HTTP/1.1 200 OK  (PNG)  tcp.stream == 26
655  23.357149 216.165.108.217 -> 117.25.148.240 TCP 54 50884 > http [ACK] Seq=414 Ack=2178 Win=21632 Len=0  tcp.stream == 26
656  23.357955 119.167.201.251 -> 216.165.108.217 TCP 60 http > 46245 [ACK] Seq=1485 Ack=407 Win=6432 Len=0  tcp.stream == 36
657  23.364899 216.165.108.217 -> 117.25.148.240 HTTP 467 GET /tps/i2/T1FveNXhNmXXXXXXXX-30-30.png HTTP/1.1   tcp.stream == 51
658  23.365505 216.165.108.217 -> 117.25.148.240 TCP 54 50884 > http [FIN, ACK] Seq=414 Ack=2178 Win=21632 Len=0  tcp.stream == 26
659  23.407567 117.25.148.240 -> 216.165.108.217 TCP 60 http > 50883 [FIN, ACK] Seq=1713 Ack=415 Win=7168 Len=0  tcp.stream == 25
660  23.407593 216.165.108.217 -> 117.25.148.240 TCP 54 50883 > http [ACK] Seq=415 Ack=1714 Win=17536 Len=0  tcp.stream == 25
662  23.475593 119.167.201.251 -> 216.165.108.217 TCP 60 http > 46246 [ACK] Seq=629 Ack=401 Win=6432 Len=0  tcp.stream == 37
663  23.477058 119.167.201.251 -> 216.165.108.217 TCP 60 http > 46247 [ACK] Seq=535 Ack=412 Win=6432 Len=0  tcp.stream == 38
664  23.478498 119.167.201.251 -> 216.165.108.217 TCP 60 http > 46248 [ACK] Seq=3071 Ack=405 Win=6432 Len=0  tcp.stream == 39
665  23.521996 117.25.148.240 -> 216.165.108.217 TCP 60 http > 50886 [FIN, ACK] Seq=1153 Ack=415 Win=7168 Len=0  tcp.stream == 28
666  23.522022 216.165.108.217 -> 117.25.148.240 TCP 54 50886 > http [ACK] Seq=415 Ack=1154 Win=17024 Len=0  tcp.stream == 28
667  23.528088 117.25.148.240 -> 216.165.108.217 TCP 60 http > 50885 [FIN, ACK] Seq=1212 Ack=415 Win=7168 Len=0  tcp.stream == 27
668  23.528110 216.165.108.217 -> 117.25.148.240 TCP 54 50885 > http [ACK] Seq=415 Ack=1213 Win=17024 Len=0  tcp.stream == 27
669  23.536632 117.25.148.240 -> 216.165.108.217 TCP 66 http > 50910 [SYN, ACK] Seq=0 Ack=1 Win=5840 Len=0 MSS=1460 SACK_PERM=1 WS=512  tcp.stream == 52
670  23.536656 216.165.108.217 -> 117.25.148.240 TCP 54 50910 > http [ACK] Seq=1 Ack=1 Win=14720 Len=0  tcp.stream == 52
671  23.537020 117.25.148.240 -> 216.165.108.217 TCP 66 http > 50912 [SYN, ACK] Seq=0 Ack=1 Win=5840 Len=0 MSS=1460 SACK_PERM=1 WS=512  tcp.stream == 54
672  23.537037 216.165.108.217 -> 117.25.148.240 TCP 54 50912 > http [ACK] Seq=1 Ack=1 Win=14720 Len=0  tcp.stream == 54
673  23.537677 117.25.148.240 -> 216.165.108.217 TCP 60 http > 50887 [FIN, ACK] Seq=1230 Ack=415 Win=7168 Len=0  tcp.stream == 29
674  23.537701 216.165.108.217 -> 117.25.148.240 TCP 54 50887 > http [ACK] Seq=415 Ack=1231 Win=17152 Len=0  tcp.stream == 29
675  23.539229 117.25.148.240 -> 216.165.108.217 TCP 60 http > 50889 [FIN, ACK] Seq=767 Ack=415 Win=7168 Len=0  tcp.stream == 31
676  23.539253 216.165.108.217 -> 117.25.148.240 TCP 54 50889 > http [ACK] Seq=415 Ack=768 Win=16256 Len=0  tcp.stream == 31
677  23.540610 117.25.148.240 -> 216.165.108.217 TCP 66 http > 50911 [SYN, ACK] Seq=0 Ack=1 Win=5840 Len=0 MSS=1460 SACK_PERM=1 WS=512  tcp.stream == 53
678  23.540634 216.165.108.217 -> 117.25.148.240 TCP 54 50911 > http [ACK] Seq=1 Ack=1 Win=14720 Len=0  tcp.stream == 53
679  23.541369 216.165.108.217 -> 117.25.148.240 HTTP 467 GET /tps/i3/T1OqSyXmNmXXXXXXXX-55-55.png HTTP/1.1   tcp.stream == 54
680  23.542655 216.165.108.217 -> 117.25.148.240 HTTP 469 GET /tps/i3/T1ABeRXcpbXXXXXXXX-300-100.png HTTP/1.1   tcp.stream == 52
681  23.544568 216.165.108.217 -> 117.25.148.240 HTTP 467 GET /tps/i3/T12RGsXe8oXXXXXXXX-30-30.png HTTP/1.1   tcp.stream == 53
683  23.634955 117.25.148.240 -> 216.165.108.217 TCP 66 http > 50913 [SYN, ACK] Seq=0 Ack=1 Win=5840 Len=0 MSS=1460 SACK_PERM=1 WS=512  tcp.stream == 55
684  23.634978 216.165.108.217 -> 117.25.148.240 TCP 54 50913 > http [ACK] Seq=1 Ack=1 Win=14720 Len=0  tcp.stream == 55
685  23.636618 117.25.148.240 -> 216.165.108.217 TCP 60 http > 50890 [FIN, ACK] Seq=835 Ack=415 Win=7168 Len=0  tcp.stream == 32
686  23.636640 216.165.108.217 -> 117.25.148.240 TCP 54 50890 > http [ACK] Seq=415 Ack=836 Win=16768 Len=0  tcp.stream == 32
687  23.637862 117.25.148.240 -> 216.165.108.217 TCP 60 http > 50892 [FIN, ACK] Seq=1644 Ack=415 Win=7168 Len=0  tcp.stream == 34
688  23.637886 216.165.108.217 -> 117.25.148.240 TCP 54 50892 > http [ACK] Seq=415 Ack=1645 Win=17536 Len=0  tcp.stream == 34
689  23.638034 216.165.108.217 -> 117.25.148.240 HTTP 467 GET /tps/i3/T1lWasXbpZXXXXXXXX-30-30.png HTTP/1.1   tcp.stream == 55
690  23.654174 117.25.148.240 -> 216.165.108.217 TCP 60 http > 50899 [FIN, ACK] Seq=625 Ack=415 Win=7168 Len=0  tcp.stream == 41
691  23.654198 216.165.108.217 -> 117.25.148.240 TCP 54 50899 > http [ACK] Seq=415 Ack=626 Win=16768 Len=0  tcp.stream == 41
692  23.656018 117.25.148.240 -> 216.165.108.217 TCP 66 http > 50915 [SYN, ACK] Seq=0 Ack=1 Win=5840 Len=0 MSS=1460 SACK_PERM=1 WS=512  tcp.stream == 57
693  23.656042 216.165.108.217 -> 117.25.148.240 TCP 54 50915 > http [ACK] Seq=1 Ack=1 Win=14720 Len=0  tcp.stream == 57
694  23.657792 216.165.108.217 -> 117.25.148.240 HTTP 467 GET /tps/i4/T1GOesXe0PXXXXXXXX-55-55.png HTTP/1.1   tcp.stream == 57
695  23.658859 117.25.148.240 -> 216.165.108.217 TCP 60 http > 50901 [FIN, ACK] Seq=1277 Ack=415 Win=7168 Len=0  tcp.stream == 43
696  23.658880 216.165.108.217 -> 117.25.148.240 TCP 54 50901 > http [ACK] Seq=415 Ack=1278 Win=17664 Len=0  tcp.stream == 43
697  23.658981 117.25.148.240 -> 216.165.108.217 TCP 66 http > 50914 [SYN, ACK] Seq=0 Ack=1 Win=5840 Len=0 MSS=1460 SACK_PERM=1 WS=512  tcp.stream == 56
698  23.658990 216.165.108.217 -> 117.25.148.240 TCP 54 50914 > http [ACK] Seq=1 Ack=1 Win=14720 Len=0  tcp.stream == 56
699  23.661384 117.25.148.240 -> 216.165.108.217 TCP 66 http > 50916 [SYN, ACK] Seq=0 Ack=1 Win=5840 Len=0 MSS=1460 SACK_PERM=1 WS=512  tcp.stream == 58
700  23.661408 216.165.108.217 -> 117.25.148.240 TCP 54 50916 > http [ACK] Seq=1 Ack=1 Win=14720 Len=0  tcp.stream == 58
701  23.662234 117.25.148.240 -> 216.165.108.217 TCP 60 http > 50903 [FIN, ACK] Seq=1670 Ack=415 Win=7168 Len=0  tcp.stream == 45
702  23.662256 216.165.108.217 -> 117.25.148.240 TCP 54 50903 > http [ACK] Seq=415 Ack=1671 Win=17536 Len=0  tcp.stream == 45
703  23.662998 216.165.108.217 -> 117.25.148.240 HTTP 469 GET /tps/i4/T1w2yRXntwXXXXXXXX-300-100.png HTTP/1.1   tcp.stream == 56
704  23.665193 216.165.108.217 -> 117.25.148.240 HTTP 469 GET /tps/i4/T1l99RXeVvXXXXXXXX-300-100.png HTTP/1.1   tcp.stream == 58
705  23.667295 117.25.148.240 -> 216.165.108.217 HTTP 1254 HTTP/1.1 200 OK  (JPEG JFIF image)  tcp.stream == 47
706  23.667321 216.165.108.217 -> 117.25.148.240 TCP 54 50905 > http [ACK] Seq=414 Ack=1201 Win=17024 Len=0  tcp.stream == 47
707  23.668442 117.25.148.240 -> 216.165.108.217 HTTP 1036 HTTP/1.1 200 OK  (PNG)  tcp.stream == 48
708  23.668465 216.165.108.217 -> 117.25.148.240 TCP 54 50906 > http [ACK] Seq=414 Ack=983 Win=16640 Len=0  tcp.stream == 48
709  23.672389 216.165.108.217 -> 117.25.148.240 TCP 54 50905 > http [FIN, ACK] Seq=414 Ack=1201 Win=17024 Len=0  tcp.stream == 47
710  23.672677 117.25.148.240 -> 216.165.108.217 HTTP 1232 HTTP/1.1 200 OK  (JPEG JFIF image)  tcp.stream == 49
711  23.672691 216.165.108.217 -> 117.25.148.240 TCP 54 50907 > http [ACK] Seq=414 Ack=1179 Win=17024 Len=0  tcp.stream == 49
712  23.677867 216.165.108.217 -> 117.25.148.240 TCP 54 50906 > http [FIN, ACK] Seq=414 Ack=983 Win=16640 Len=0  tcp.stream == 48
713  23.689134 216.165.108.217 -> 117.25.148.240 TCP 54 50907 > http [FIN, ACK] Seq=414 Ack=1179 Win=17024 Len=0  tcp.stream == 49
714  23.704243 117.25.148.240 -> 216.165.108.217 TCP 60 http > 50902 [FIN, ACK] Seq=1788 Ack=415 Win=7168 Len=0  tcp.stream == 44
715  23.704264 216.165.108.217 -> 117.25.148.240 TCP 54 50902 > http [ACK] Seq=415 Ack=1789 Win=17536 Len=0  tcp.stream == 44
717  23.753146 117.25.148.240 -> 216.165.108.217 TCP 344 [TCP segment of a reassembled PDU]  tcp.stream == 50
718  23.753169 216.165.108.217 -> 117.25.148.240 TCP 54 50908 > http [ACK] Seq=414 Ack=291 Win=15744 Len=0  tcp.stream == 50
719  23.753285 117.25.148.240 -> 216.165.108.217 HTTP 1088 HTTP/1.1 200 OK  (PNG)  tcp.stream == 50
720  23.753292 216.165.108.217 -> 117.25.148.240 TCP 54 50908 > http [ACK] Seq=414 Ack=1325 Win=17792 Len=0  tcp.stream == 50
721  23.758044 216.165.108.217 -> 117.25.148.240 TCP 54 50908 > http [FIN, ACK] Seq=414 Ack=1325 Win=17792 Len=0  tcp.stream == 50
722  23.776006 117.25.148.240 -> 216.165.108.217 TCP 60 http > 50884 [FIN, ACK] Seq=2178 Ack=415 Win=7168 Len=0  tcp.stream == 26
723  23.776029 216.165.108.217 -> 117.25.148.240 TCP 54 50884 > http [ACK] Seq=415 Ack=2179 Win=21632 Len=0  tcp.stream == 26
724  23.779086 117.25.148.240 -> 216.165.108.217 HTTP 977 HTTP/1.1 200 OK  (PNG)  tcp.stream == 51
725  23.779116 216.165.108.217 -> 117.25.148.240 TCP 54 50909 > http [ACK] Seq=414 Ack=924 Win=16512 Len=0  tcp.stream == 51
726  23.783614 216.165.108.217 -> 117.25.148.240 TCP 54 50909 > http [FIN, ACK] Seq=414 Ack=924 Win=16512 Len=0  tcp.stream == 51
729  23.954096 117.25.148.240 -> 216.165.108.217 HTTP 1356 HTTP/1.1 200 OK  (PNG)  tcp.stream == 54
730  23.954121 216.165.108.217 -> 117.25.148.240 TCP 54 50912 > http [ACK] Seq=414 Ack=1303 Win=17280 Len=0  tcp.stream == 54
731  23.962514 117.25.148.240 -> 216.165.108.217 HTTP 1095 HTTP/1.1 200 OK  (PNG)  tcp.stream == 53
732  23.962541 216.165.108.217 -> 117.25.148.240 TCP 54 50911 > http [ACK] Seq=414 Ack=1042 Win=16768 Len=0  tcp.stream == 53
733  23.963018 216.165.108.217 -> 117.25.148.240 TCP 54 50912 > http [FIN, ACK] Seq=414 Ack=1303 Win=17280 Len=0  tcp.stream == 54
734  23.967793 216.165.108.217 -> 117.25.148.240 TCP 54 50911 > http [FIN, ACK] Seq=414 Ack=1042 Win=16768 Len=0  tcp.stream == 53
736  24.053065 117.25.148.240 -> 216.165.108.217 TCP 343 [TCP segment of a reassembled PDU]  tcp.stream == 55
737  24.053091 216.165.108.217 -> 117.25.148.240 TCP 54 50913 > http [ACK] Seq=414 Ack=290 Win=15744 Len=0  tcp.stream == 55
738  24.053310 117.25.148.240 -> 216.165.108.217 HTTP 1239 HTTP/1.1 200 OK  (PNG)  tcp.stream == 55
739  24.053318 216.165.108.217 -> 117.25.148.240 TCP 54 50913 > http [ACK] Seq=414 Ack=1475 Win=18048 Len=0  tcp.stream == 55
740  24.057317 216.165.108.217 -> 117.25.148.240 TCP 54 50913 > http [FIN, ACK] Seq=414 Ack=1475 Win=18048 Len=0  tcp.stream == 55
741  24.063695 216.165.108.217 -> 117.25.148.240 TCP 54 50877 > http [FIN, ACK] Seq=414 Ack=1186 Win=17024 Len=0  tcp.stream == 19
742  24.070599 117.25.148.240 -> 216.165.108.217 HTTP 1271 HTTP/1.1 200 OK  (PNG)  tcp.stream == 57
743  24.070622 216.165.108.217 -> 117.25.148.240 TCP 54 50915 > http [ACK] Seq=414 Ack=1218 Win=17152 Len=0  tcp.stream == 57
744  24.075104 216.165.108.217 -> 117.25.148.240 TCP 54 50915 > http [FIN, ACK] Seq=414 Ack=1218 Win=17152 Len=0  tcp.stream == 57
745  24.080648 117.25.148.240 -> 216.165.108.217 TCP 1514 [TCP segment of a reassembled PDU]  tcp.stream == 56
746  24.080674 216.165.108.217 -> 117.25.148.240 TCP 54 50914 > http [ACK] Seq=416 Ack=1461 Win=17536 Len=0  tcp.stream == 56
747  24.080772 117.25.148.240 -> 216.165.108.217 TCP 1514 [TCP segment of a reassembled PDU]  tcp.stream == 56
748  24.080778 216.165.108.217 -> 117.25.148.240 TCP 54 50914 > http [ACK] Seq=416 Ack=2921 Win=20480 Len=0  tcp.stream == 56
749  24.082192 117.25.148.240 -> 216.165.108.217 TCP 1514 [TCP segment of a reassembled PDU]  tcp.stream == 58
750  24.082214 216.165.108.217 -> 117.25.148.240 TCP 54 50916 > http [ACK] Seq=416 Ack=1461 Win=17536 Len=0  tcp.stream == 58
751  24.082315 117.25.148.240 -> 216.165.108.217 TCP 1514 [TCP segment of a reassembled PDU]  tcp.stream == 58
752  24.082320 216.165.108.217 -> 117.25.148.240 TCP 54 50916 > http [ACK] Seq=416 Ack=2921 Win=20480 Len=0  tcp.stream == 58
753  24.086127 117.25.148.240 -> 216.165.108.217 TCP 60 http > 50905 [FIN, ACK] Seq=1201 Ack=415 Win=7168 Len=0  tcp.stream == 47
754  24.086149 216.165.108.217 -> 117.25.148.240 TCP 54 50905 > http [ACK] Seq=415 Ack=1202 Win=17024 Len=0  tcp.stream == 47
755  24.092329 117.25.148.240 -> 216.165.108.217 TCP 60 http > 50906 [FIN, ACK] Seq=983 Ack=415 Win=7168 Len=0  tcp.stream == 48
756  24.092349 216.165.108.217 -> 117.25.148.240 TCP 54 50906 > http [ACK] Seq=415 Ack=984 Win=16640 Len=0  tcp.stream == 48
757  24.106625 117.25.148.240 -> 216.165.108.217 TCP 60 http > 50907 [FIN, ACK] Seq=1179 Ack=415 Win=7168 Len=0  tcp.stream == 49
758  24.106647 216.165.108.217 -> 117.25.148.240 TCP 54 50907 > http [ACK] Seq=415 Ack=1180 Win=17024 Len=0  tcp.stream == 49
759  24.139692 216.165.108.217 -> 117.25.148.240 TCP 54 50880 > http [FIN, ACK] Seq=414 Ack=1095 Win=16896 Len=0  tcp.stream == 22
761  24.177553 117.25.148.240 -> 216.165.108.217 TCP 60 http > 50908 [FIN, ACK] Seq=1325 Ack=415 Win=7168 Len=0  tcp.stream == 50
762  24.177577 216.165.108.217 -> 117.25.148.240 TCP 54 50908 > http [ACK] Seq=415 Ack=1326 Win=17792 Len=0  tcp.stream == 50
763  24.202976 117.25.148.240 -> 216.165.108.217 TCP 60 http > 50909 [FIN, ACK] Seq=924 Ack=415 Win=7168 Len=0  tcp.stream == 51
764  24.202997 216.165.108.217 -> 117.25.148.240 TCP 54 50909 > http [ACK] Seq=415 Ack=925 Win=16512 Len=0  tcp.stream == 51
766  24.381527 117.25.148.240 -> 216.165.108.217 TCP 60 http > 50912 [FIN, ACK] Seq=1303 Ack=415 Win=7168 Len=0  tcp.stream == 54
767  24.381549 216.165.108.217 -> 117.25.148.240 TCP 54 50912 > http [ACK] Seq=415 Ack=1304 Win=17280 Len=0  tcp.stream == 54
768  24.390421 117.25.148.240 -> 216.165.108.217 TCP 60 http > 50911 [FIN, ACK] Seq=1042 Ack=415 Win=7168 Len=0  tcp.stream == 53
769  24.390443 216.165.108.217 -> 117.25.148.240 TCP 54 50911 > http [ACK] Seq=415 Ack=1043 Win=16768 Len=0  tcp.stream == 53
770  24.423690 216.165.108.217 -> 117.25.148.240 TCP 54 50888 > http [FIN, ACK] Seq=414 Ack=1235 Win=17152 Len=0  tcp.stream == 30
771  24.448424 117.25.148.240 -> 216.165.108.217 TCP 60 http > 50875 [FIN, ACK] Seq=921 Ack=415 Win=7168 Len=0  tcp.stream == 17
772  24.448446 216.165.108.217 -> 117.25.148.240 TCP 54 [TCP Dup ACK 616#1] 50875 > http [ACK] Seq=415 Ack=922 Win=16512 Len=0  tcp.stream == 17
773  24.480879 117.25.148.240 -> 216.165.108.217 TCP 60 http > 50913 [FIN, ACK] Seq=1475 Ack=415 Win=7168 Len=0  tcp.stream == 55
774  24.480900 216.165.108.217 -> 117.25.148.240 TCP 54 50913 > http [ACK] Seq=415 Ack=1476 Win=18048 Len=0  tcp.stream == 55
775  24.484210 117.25.148.240 -> 216.165.108.217 TCP 60 http > 50877 [FIN, ACK] Seq=1186 Ack=415 Win=7168 Len=0  tcp.stream == 19
776  24.484234 216.165.108.217 -> 117.25.148.240 TCP 54 50877 > http [ACK] Seq=415 Ack=1187 Win=17024 Len=0  tcp.stream == 19
777  24.494637 117.25.148.240 -> 216.165.108.217 TCP 60 http > 50915 [FIN, ACK] Seq=1218 Ack=415 Win=7168 Len=0  tcp.stream == 57
778  24.494660 216.165.108.217 -> 117.25.148.240 TCP 54 50915 > http [ACK] Seq=415 Ack=1219 Win=17152 Len=0  tcp.stream == 57
779  24.504358 117.25.148.240 -> 216.165.108.217 TCP 1514 [TCP segment of a reassembled PDU]  tcp.stream == 56
780  24.504380 216.165.108.217 -> 117.25.148.240 TCP 54 50914 > http [ACK] Seq=416 Ack=4381 Win=23424 Len=0  tcp.stream == 56
781  24.504477 117.25.148.240 -> 216.165.108.217 TCP 1514 [TCP segment of a reassembled PDU]  tcp.stream == 56
782  24.504482 216.165.108.217 -> 117.25.148.240 TCP 54 50914 > http [ACK] Seq=416 Ack=5841 Win=26368 Len=0  tcp.stream == 56
783  24.504593 117.25.148.240 -> 216.165.108.217 TCP 1514 [TCP segment of a reassembled PDU]  tcp.stream == 56
784  24.504600 216.165.108.217 -> 117.25.148.240 TCP 54 50914 > http [ACK] Seq=416 Ack=7301 Win=29312 Len=0  tcp.stream == 56
785  24.505119 117.25.148.240 -> 216.165.108.217 TCP 1514 [TCP segment of a reassembled PDU]  tcp.stream == 58
786  24.505138 216.165.108.217 -> 117.25.148.240 TCP 54 50916 > http [ACK] Seq=416 Ack=4381 Win=23424 Len=0  tcp.stream == 58
787  24.505232 117.25.148.240 -> 216.165.108.217 TCP 1514 [TCP segment of a reassembled PDU]  tcp.stream == 58
788  24.505238 216.165.108.217 -> 117.25.148.240 TCP 54 50916 > http [ACK] Seq=416 Ack=5841 Win=26368 Len=0  tcp.stream == 58
789  24.505355 117.25.148.240 -> 216.165.108.217 TCP 1514 [TCP segment of a reassembled PDU]  tcp.stream == 58
790  24.505362 216.165.108.217 -> 117.25.148.240 TCP 54 50916 > http [ACK] Seq=416 Ack=7301 Win=29312 Len=0  tcp.stream == 58
791  24.505479 117.25.148.240 -> 216.165.108.217 TCP 1514 [TCP segment of a reassembled PDU]  tcp.stream == 58
792  24.505485 216.165.108.217 -> 117.25.148.240 TCP 54 50916 > http [ACK] Seq=416 Ack=8761 Win=32128 Len=0  tcp.stream == 58
793  24.519693 216.165.108.217 -> 117.25.148.240 TCP 54 50891 > http [FIN, ACK] Seq=414 Ack=1001 Win=16640 Len=0  tcp.stream == 33
794  24.560809 117.25.148.240 -> 216.165.108.217 TCP 60 http > 50880 [FIN, ACK] Seq=1095 Ack=415 Win=7168 Len=0  tcp.stream == 22
795  24.560835 216.165.108.217 -> 117.25.148.240 TCP 54 50880 > http [ACK] Seq=415 Ack=1096 Win=16896 Len=0  tcp.stream == 22
798  24.594919 216.165.108.217 -> 115.239.199.250 TCP 74 54918 > http [SYN] Seq=0 Win=14600 Len=0 MSS=1460 SACK_PERM=1 TSval=43076497 TSecr=0 WS=128  tcp.stream == 60
799  24.661970 117.25.148.240 -> 216.165.108.217 TCP 60 http > 50883 [FIN, ACK] Seq=1713 Ack=415 Win=7168 Len=0  tcp.stream == 25
800  24.661989 216.165.108.217 -> 117.25.148.240 TCP 54 [TCP Dup ACK 660#1] 50883 > http [ACK] Seq=415 Ack=1714 Win=17536 Len=0  tcp.stream == 25
802  24.859654 115.239.199.250 -> 216.165.108.217 TCP 66 http > 54918 [SYN, ACK] Seq=0 Ack=1 Win=5840 Len=0 MSS=1460 SACK_PERM=1 WS=512  tcp.stream == 60
803  24.859689 216.165.108.217 -> 115.239.199.250 TCP 54 54918 > http [ACK] Seq=1 Ack=1 Win=14720 Len=0  tcp.stream == 60
804  24.862130 216.165.108.217 -> 115.239.199.250 HTTP 647 GET /bao/uploaded/i4/T1CQSIXdhnXXcUG33W_023558.jpg_80x80.jpg HTTP/1.1   tcp.stream == 60
805  24.931872 117.25.148.240 -> 216.165.108.217 HTTP 686 HTTP/1.1 200 OK  (PNG)  tcp.stream == 58
806  24.931889 216.165.108.217 -> 117.25.148.240 TCP 54 50916 > http [ACK] Seq=416 Ack=9393 Win=35072 Len=0  tcp.stream == 58
807  24.932146 117.25.148.240 -> 216.165.108.217 TCP 1514 [TCP segment of a reassembled PDU]  tcp.stream == 56
808  24.932158 216.165.108.217 -> 117.25.148.240 TCP 54 50914 > http [ACK] Seq=416 Ack=8761 Win=32128 Len=0  tcp.stream == 56
809  24.932259 117.25.148.240 -> 216.165.108.217 TCP 1514 [TCP segment of a reassembled PDU]  tcp.stream == 56
810  24.932265 216.165.108.217 -> 117.25.148.240 TCP 54 50914 > http [ACK] Seq=416 Ack=10221 Win=35072 Len=0  tcp.stream == 56
811  24.932388 117.25.148.240 -> 216.165.108.217 TCP 1514 [TCP segment of a reassembled PDU]  tcp.stream == 56
812  24.932397 216.165.108.217 -> 117.25.148.240 TCP 54 50914 > http [ACK] Seq=416 Ack=11681 Win=38016 Len=0  tcp.stream == 56
813  24.932510 117.25.148.240 -> 216.165.108.217 TCP 1514 [TCP segment of a reassembled PDU]  tcp.stream == 56
814  24.932517 216.165.108.217 -> 117.25.148.240 TCP 54 50914 > http [ACK] Seq=416 Ack=13141 Win=40960 Len=0  tcp.stream == 56
815  24.932641 117.25.148.240 -> 216.165.108.217 TCP 1514 [TCP segment of a reassembled PDU]  tcp.stream == 56
816  24.932649 216.165.108.217 -> 117.25.148.240 TCP 54 50914 > http [ACK] Seq=416 Ack=14601 Win=43904 Len=0  tcp.stream == 56
817  24.932764 117.25.148.240 -> 216.165.108.217 TCP 1514 [TCP segment of a reassembled PDU]  tcp.stream == 56
818  24.932769 216.165.108.217 -> 117.25.148.240 TCP 54 50914 > http [ACK] Seq=416 Ack=16061 Win=46720 Len=0  tcp.stream == 56
819  24.935910 216.165.108.217 -> 117.25.148.240 TCP 54 50916 > http [FIN, ACK] Seq=416 Ack=9393 Win=35072 Len=0  tcp.stream == 58
820  24.947067 117.25.148.240 -> 216.165.108.217 TCP 60 http > 50891 [FIN, ACK] Seq=1001 Ack=415 Win=7168 Len=0  tcp.stream == 33
821  24.947094 216.165.108.217 -> 117.25.148.240 TCP 54 50891 > http [ACK] Seq=415 Ack=1002 Win=16640 Len=0  tcp.stream == 33
823  25.109107 216.165.108.217 -> 117.25.148.240 TCP 74 50919 > http [SYN] Seq=0 Win=14600 Len=0 MSS=1460 SACK_PERM=1 TSval=43076626 TSecr=0 WS=128  tcp.stream == 61
824  25.127837 115.239.199.250 -> 216.165.108.217 TCP 1514 [TCP segment of a reassembled PDU]  tcp.stream == 60
825  25.127861 216.165.108.217 -> 115.239.199.250 TCP 54 54918 > http [ACK] Seq=594 Ack=1461 Win=17536 Len=0  tcp.stream == 60
826  25.127964 115.239.199.250 -> 216.165.108.217 HTTP 1640 HTTP/1.1 200 OK  (JPEG JFIF image)  tcp.stream == 60
827  25.127971 216.165.108.217 -> 115.239.199.250 TCP 54 54918 > http [ACK] Seq=594 Ack=3047 Win=20480 Len=0  tcp.stream == 60
829  25.136676 216.165.108.217 -> 115.239.199.250 TCP 54 54918 > http [FIN, ACK] Seq=594 Ack=3047 Win=20480 Len=0  tcp.stream == 60
830  25.203694 216.165.108.217 -> 117.25.148.240 TCP 74 50898 > http [SYN] Seq=0 Win=14600 Len=0 MSS=1460 SACK_PERM=1 TSval=43076650 TSecr=0 WS=128  tcp.stream == 40
831  25.203706 216.165.108.217 -> 117.25.148.240 TCP 74 50900 > http [SYN] Seq=0 Win=14600 Len=0 MSS=1460 SACK_PERM=1 TSval=43076650 TSecr=0 WS=128  tcp.stream == 42
833  25.366842 117.25.148.240 -> 216.165.108.217 TCP 1514 [TCP segment of a reassembled PDU]  tcp.stream == 56
834  25.366864 216.165.108.217 -> 117.25.148.240 TCP 54 50914 > http [ACK] Seq=416 Ack=17521 Win=49664 Len=0  tcp.stream == 56
835  25.366962 117.25.148.240 -> 216.165.108.217 TCP 1514 [TCP segment of a reassembled PDU]  tcp.stream == 56
836  25.366968 216.165.108.217 -> 117.25.148.240 TCP 54 50914 > http [ACK] Seq=416 Ack=18981 Win=52608 Len=0  tcp.stream == 56
837  25.367084 117.25.148.240 -> 216.165.108.217 HTTP 1728 HTTP/1.1 200 OK  (PNG)  tcp.stream == 56
838  25.367088 216.165.108.217 -> 117.25.148.240 TCP 54 50914 > http [ACK] Seq=416 Ack=20655 Win=55552 Len=0  tcp.stream == 56
839  25.368906 117.25.148.240 -> 216.165.108.217 TCP 60 http > 50916 [FIN, ACK] Seq=9393 Ack=417 Win=7168 Len=0  tcp.stream == 58
840  25.368930 216.165.108.217 -> 117.25.148.240 TCP 54 50916 > http [ACK] Seq=417 Ack=9394 Win=35072 Len=0  tcp.stream == 58
841  25.371044 216.165.108.217 -> 117.25.148.240 TCP 54 50914 > http [FIN, ACK] Seq=416 Ack=20655 Win=55552 Len=0  tcp.stream == 56
842  25.407980 115.239.199.250 -> 216.165.108.217 TCP 60 http > 54918 [FIN, ACK] Seq=3047 Ack=595 Win=7168 Len=0  tcp.stream == 60
843  25.408002 216.165.108.217 -> 115.239.199.250 TCP 54 54918 > http [ACK] Seq=595 Ack=3048 Win=20480 Len=0  tcp.stream == 60
844  25.419688 216.165.108.217 -> 117.25.148.240 HTTP 467 [TCP Retransmission] GET /tps/i1/T1zMOsXmXZXXXXXXXX-55-55.png HTTP/1.1   tcp.stream == 20
845  25.443688 216.165.108.217 -> 119.167.201.251 TCP 74 46255 > http [SYN] Seq=0 Win=14600 Len=0 MSS=1460 SACK_PERM=1 TSval=43076710 TSecr=0 WS=128  tcp.stream == 46
846  25.448915 216.165.108.217 -> 117.25.148.240 TCP 74 50920 > http [SYN] Seq=0 Win=14600 Len=0 MSS=1460 SACK_PERM=1 TSval=43076711 TSecr=0 WS=128  tcp.stream == 62
848  25.539977 117.25.148.240 -> 216.165.108.217 TCP 66 http > 50919 [SYN, ACK] Seq=0 Ack=1 Win=5840 Len=0 MSS=1460 SACK_PERM=1 WS=512  tcp.stream == 61
849  25.540001 216.165.108.217 -> 117.25.148.240 TCP 54 50919 > http [ACK] Seq=1 Ack=1 Win=14720 Len=0  tcp.stream == 61
850  25.543131 216.165.108.217 -> 117.25.148.240 HTTP 469 GET /tps/i4/T1yr5SXhRgXXXXXXXX-300-100.jpg HTTP/1.1   tcp.stream == 61
851  25.628237 117.25.148.240 -> 216.165.108.217 TCP 66 http > 50898 [SYN, ACK] Seq=0 Ack=1 Win=5840 Len=0 MSS=1460 SACK_PERM=1 WS=512  tcp.stream == 40
852  25.628267 216.165.108.217 -> 117.25.148.240 TCP 54 50898 > http [ACK] Seq=1 Ack=1 Win=14720 Len=0  tcp.stream == 40
853  25.630383 216.165.108.217 -> 117.25.148.240 HTTP 467 GET /tps/i4/T15g9qXmtlXXXXXXXX-30-30.png HTTP/1.1   tcp.stream == 40
854  25.632288 117.25.148.240 -> 216.165.108.217 TCP 66 http > 50900 [SYN, ACK] Seq=0 Ack=1 Win=5840 Len=0 MSS=1460 SACK_PERM=1 WS=512  tcp.stream == 42
855  25.632312 216.165.108.217 -> 117.25.148.240 TCP 54 50900 > http [ACK] Seq=1 Ack=1 Win=14720 Len=0  tcp.stream == 42
856  25.634882 216.165.108.217 -> 117.25.148.240 HTTP 467 GET /tps/i4/T1caqJXoFhXXXXXXXX-30-30.jpg HTTP/1.1   tcp.stream == 42
858  25.799661 117.25.148.240 -> 216.165.108.217 TCP 60 http > 50914 [FIN, ACK] Seq=20655 Ack=417 Win=7168 Len=0  tcp.stream == 56
859  25.799692 216.165.108.217 -> 117.25.148.240 TCP 54 50914 > http [ACK] Seq=417 Ack=20656 Win=55552 Len=0  tcp.stream == 56
861  25.847361 117.25.148.240 -> 216.165.108.217 HTTP 1229 HTTP/1.1 200 OK  (PNG)  tcp.stream == 20
862  25.847388 216.165.108.217 -> 117.25.148.240 TCP 54 50878 > http [ACK] Seq=414 Ack=1176 Win=17024 Len=0  tcp.stream == 20
863  25.852530 216.165.108.217 -> 117.25.148.240 TCP 54 50878 > http [FIN, ACK] Seq=414 Ack=1176 Win=17024 Len=0  tcp.stream == 20
864  25.858910 117.25.148.240 -> 216.165.108.217 TCP 1514 [TCP Retransmission] http > 50879 [ACK] Seq=1 Ack=416 Win=7168 Len=1460  tcp.stream == 21
865  25.858929 216.165.108.217 -> 117.25.148.240 TCP 66 [TCP Dup ACK 518#1] 50879 > http [ACK] Seq=416 Ack=2921 Win=20480 Len=0 SLE=1 SRE=1461  tcp.stream == 21
868  25.964288 117.25.148.240 -> 216.165.108.217 TCP 1514 [TCP segment of a reassembled PDU]  tcp.stream == 61
869  25.964311 216.165.108.217 -> 117.25.148.240 TCP 54 50919 > http [ACK] Seq=416 Ack=1461 Win=17536 Len=0  tcp.stream == 61
870  25.964360 117.25.148.240 -> 216.165.108.217 TCP 1514 [TCP segment of a reassembled PDU]  tcp.stream == 61
871  25.964366 216.165.108.217 -> 117.25.148.240 TCP 54 50919 > http [ACK] Seq=416 Ack=2921 Win=20480 Len=0  tcp.stream == 61
872  26.003869 117.25.148.240 -> 216.165.108.217 HTTP 1288 [TCP Retransmission] HTTP/1.1 200 OK  (PNG)  tcp.stream == 30
873  26.003895 216.165.108.217 -> 117.25.148.240 TCP 66 [TCP Dup ACK 770#1] 50888 > http [ACK] Seq=415 Ack=1235 Win=17152 Len=0 SLE=1 SRE=1235  tcp.stream == 30
874  26.044574 117.25.148.240 -> 216.165.108.217 TCP 342 [TCP segment of a reassembled PDU]  tcp.stream == 40
875  26.044596 216.165.108.217 -> 117.25.148.240 TCP 54 50898 > http [ACK] Seq=414 Ack=289 Win=15744 Len=0  tcp.stream == 40
876  26.044643 117.25.148.240 -> 216.165.108.217 HTTP 513 HTTP/1.1 200 OK  (PNG)  tcp.stream == 40
877  26.044649 216.165.108.217 -> 117.25.148.240 TCP 54 50898 > http [ACK] Seq=414 Ack=748 Win=16768 Len=0  tcp.stream == 40
878  26.049016 216.165.108.217 -> 117.25.148.240 TCP 54 50898 > http [FIN, ACK] Seq=414 Ack=748 Win=16768 Len=0  tcp.stream == 40
879  26.053627 117.25.148.240 -> 216.165.108.217 TCP 343 [TCP segment of a reassembled PDU]  tcp.stream == 42
880  26.053650 216.165.108.217 -> 117.25.148.240 TCP 54 50900 > http [ACK] Seq=414 Ack=290 Win=15744 Len=0  tcp.stream == 42
881  26.053792 117.25.148.240 -> 216.165.108.217 HTTP 966 HTTP/1.1 200 OK  (JPEG JFIF image)  tcp.stream == 42
882  26.053798 216.165.108.217 -> 117.25.148.240 TCP 54 50900 > http [ACK] Seq=414 Ack=1202 Win=17536 Len=0  tcp.stream == 42
883  26.060721 216.165.108.217 -> 117.25.148.240 TCP 54 50900 > http [FIN, ACK] Seq=414 Ack=1202 Win=17536 Len=0  tcp.stream == 42
885  26.262164 117.25.148.240 -> 216.165.108.217 TCP 60 http > 50878 [FIN, ACK] Seq=1176 Ack=415 Win=7168 Len=0  tcp.stream == 20
886  26.262192 216.165.108.217 -> 117.25.148.240 TCP 54 50878 > http [ACK] Seq=415 Ack=1177 Win=17024 Len=0  tcp.stream == 20
888  26.269031 117.25.148.240 -> 216.165.108.217 TCP 1514 [TCP segment of a reassembled PDU]  tcp.stream == 21
889  26.269051 216.165.108.217 -> 117.25.148.240 TCP 54 50879 > http [ACK] Seq=416 Ack=4381 Win=23424 Len=0  tcp.stream == 21
890  26.269151 117.25.148.240 -> 216.165.108.217 TCP 1514 [TCP segment of a reassembled PDU]  tcp.stream == 21
891  26.269156 216.165.108.217 -> 117.25.148.240 TCP 54 50879 > http [ACK] Seq=416 Ack=5841 Win=26368 Len=0  tcp.stream == 21
892  26.299693 216.165.108.217 -> 117.25.148.240 TCP 74 50917 > http [SYN] Seq=0 Win=14600 Len=0 MSS=1460 SACK_PERM=1 TSval=43076924 TSecr=0 WS=128  tcp.stream == 59
895  26.459191 117.25.148.240 -> 216.165.108.217 TCP 60 http > 50898 [FIN, ACK] Seq=748 Ack=415 Win=7168 Len=0  tcp.stream == 40
896  26.459217 216.165.108.217 -> 117.25.148.240 TCP 54 50898 > http [ACK] Seq=415 Ack=749 Win=16768 Len=0  tcp.stream == 40
897  26.474001 117.25.148.240 -> 216.165.108.217 TCP 60 http > 50900 [FIN, ACK] Seq=1202 Ack=415 Win=7168 Len=0  tcp.stream == 42
898  26.474026 216.165.108.217 -> 117.25.148.240 TCP 54 50900 > http [ACK] Seq=415 Ack=1203 Win=17536 Len=0  tcp.stream == 42
899  26.547685 216.165.108.217 -> 117.25.148.240 HTTP 469 [TCP Retransmission] GET /tps/i3/T1ABeRXcpbXXXXXXXX-300-100.png HTTP/1.1   tcp.stream == 52
901  26.682665 117.25.148.240 -> 216.165.108.217 TCP 1514 [TCP segment of a reassembled PDU]  tcp.stream == 21
902  26.682684 216.165.108.217 -> 117.25.148.240 TCP 54 50879 > http [ACK] Seq=416 Ack=7301 Win=29312 Len=0  tcp.stream == 21
903  26.682848 117.25.148.240 -> 216.165.108.217 TCP 1514 [TCP segment of a reassembled PDU]  tcp.stream == 21
904  26.682854 216.165.108.217 -> 117.25.148.240 TCP 54 50879 > http [ACK] Seq=416 Ack=8761 Win=32128 Len=0  tcp.stream == 21
905  26.682972 117.25.148.240 -> 216.165.108.217 TCP 1514 [TCP segment of a reassembled PDU]  tcp.stream == 21
906  26.682979 216.165.108.217 -> 117.25.148.240 TCP 54 50879 > http [ACK] Seq=416 Ack=10221 Win=35072 Len=0  tcp.stream == 21
907  26.718339 117.25.148.240 -> 216.165.108.217 TCP 66 http > 50917 [SYN, ACK] Seq=0 Ack=1 Win=5840 Len=0 MSS=1460 SACK_PERM=1 WS=512  tcp.stream == 59
908  26.718362 216.165.108.217 -> 117.25.148.240 TCP 54 50917 > http [ACK] Seq=1 Ack=1 Win=14720 Len=0  tcp.stream == 59
909  26.720551 216.165.108.217 -> 117.25.148.240 HTTP 469 GET /tps/i4/T16l5PXlJsXXXXXXXX-120-120.jpg HTTP/1.1   tcp.stream == 59
911  26.967311 117.25.148.240 -> 216.165.108.217 TCP 66 http > 50910 [SYN, ACK] Seq=0 Ack=1 Win=5840 Len=0 MSS=1460 SACK_PERM=1 WS=512  tcp.stream == 52
912  26.967333 216.165.108.217 -> 117.25.148.240 TCP 66 [TCP Dup ACK 899#1] 50910 > http [ACK] Seq=416 Ack=1 Win=14720 Len=0 SLE=0 SRE=1  tcp.stream == 52
914  27.019690 216.165.108.217 -> 117.25.148.240 TCP 54 50888 > http [FIN, ACK] Seq=414 Ack=1235 Win=17152 Len=0  tcp.stream == 30
915  27.103605 117.25.148.240 -> 216.165.108.217 TCP 1514 [TCP segment of a reassembled PDU]  tcp.stream == 21
916  27.103624 216.165.108.217 -> 117.25.148.240 TCP 54 50879 > http [ACK] Seq=416 Ack=11681 Win=38016 Len=0  tcp.stream == 21
917  27.103694 117.25.148.240 -> 216.165.108.217 TCP 1514 [TCP segment of a reassembled PDU]  tcp.stream == 21
918  27.103699 216.165.108.217 -> 117.25.148.240 TCP 54 50879 > http [ACK] Seq=416 Ack=13141 Win=40960 Len=0  tcp.stream == 21
919  27.103814 117.25.148.240 -> 216.165.108.217 TCP 1514 [TCP segment of a reassembled PDU]  tcp.stream == 21
920  27.103819 216.165.108.217 -> 117.25.148.240 TCP 54 50879 > http [ACK] Seq=416 Ack=14601 Win=43904 Len=0  tcp.stream == 21
921  27.103946 117.25.148.240 -> 216.165.108.217 TCP 1514 [TCP segment of a reassembled PDU]  tcp.stream == 21
922  27.103955 216.165.108.217 -> 117.25.148.240 TCP 54 50879 > http [ACK] Seq=416 Ack=16061 Win=46720 Len=0  tcp.stream == 21
923  27.104067 117.25.148.240 -> 216.165.108.217 TCP 1514 [TCP segment of a reassembled PDU]  tcp.stream == 21
924  27.104073 216.165.108.217 -> 117.25.148.240 TCP 54 50879 > http [ACK] Seq=416 Ack=17521 Win=49664 Len=0  tcp.stream == 21
925  27.142023 117.25.148.240 -> 216.165.108.217 TCP 1514 [TCP segment of a reassembled PDU]  tcp.stream == 59
926  27.142044 216.165.108.217 -> 117.25.148.240 TCP 54 50917 > http [ACK] Seq=416 Ack=1461 Win=17536 Len=0  tcp.stream == 59
927  27.142123 117.25.148.240 -> 216.165.108.217 TCP 1514 [TCP segment of a reassembled PDU]  tcp.stream == 59
928  27.142129 216.165.108.217 -> 117.25.148.240 TCP 54 50917 > http [ACK] Seq=416 Ack=2921 Win=20480 Len=0  tcp.stream == 59
931  27.445247 117.25.148.240 -> 216.165.108.217 TCP 60 http > 50888 [FIN, ACK] Seq=1235 Ack=415 Win=7168 Len=0  tcp.stream == 30
932  27.445272 216.165.108.217 -> 117.25.148.240 TCP 54 50888 > http [ACK] Seq=415 Ack=1236 Win=17152 Len=0  tcp.stream == 30
933  27.527019 117.25.148.240 -> 216.165.108.217 TCP 1514 [TCP segment of a reassembled PDU]  tcp.stream == 21
934  27.527037 216.165.108.217 -> 117.25.148.240 TCP 54 50879 > http [ACK] Seq=416 Ack=18981 Win=52608 Len=0  tcp.stream == 21
935  27.527252 117.25.148.240 -> 216.165.108.217 TCP 1514 [TCP segment of a reassembled PDU]  tcp.stream == 21
936  27.527259 216.165.108.217 -> 117.25.148.240 TCP 54 50879 > http [ACK] Seq=416 Ack=20441 Win=55552 Len=0  tcp.stream == 21
937  27.527363 117.25.148.240 -> 216.165.108.217 HTTP 1288 HTTP/1.1 200 OK  (PNG)  tcp.stream == 21
938  27.527371 216.165.108.217 -> 117.25.148.240 TCP 54 50879 > http [ACK] Seq=416 Ack=21675 Win=58496 Len=0  tcp.stream == 21
939  27.531640 216.165.108.217 -> 117.25.148.240 TCP 54 50879 > http [FIN, ACK] Seq=416 Ack=21675 Win=58496 Len=0  tcp.stream == 21
941  27.569519 117.25.148.240 -> 216.165.108.217 HTTP 1674 HTTP/1.1 200 OK  (JPEG JFIF image)  tcp.stream == 59
942  27.569535 216.165.108.217 -> 117.25.148.240 TCP 54 50917 > http [ACK] Seq=416 Ack=4541 Win=23424 Len=0  tcp.stream == 59
943  27.571486 216.165.108.217 -> 117.25.148.240 TCP 54 50917 > http [FIN, ACK] Seq=416 Ack=4541 Win=23424 Len=0  tcp.stream == 59
949  27.957916 117.25.148.240 -> 216.165.108.217 TCP 60 http > 50879 [FIN, ACK] Seq=21675 Ack=417 Win=7168 Len=0  tcp.stream == 21
950  27.957941 216.165.108.217 -> 117.25.148.240 TCP 54 50879 > http [ACK] Seq=417 Ack=21676 Win=58496 Len=0  tcp.stream == 21
951  28.001348 117.25.148.240 -> 216.165.108.217 TCP 60 http > 50917 [FIN, ACK] Seq=4541 Ack=417 Win=7168 Len=0  tcp.stream == 59
952  28.001372 216.165.108.217 -> 117.25.148.240 TCP 54 50917 > http [ACK] Seq=417 Ack=4542 Win=23424 Len=0  tcp.stream == 59
956  28.451688 216.165.108.217 -> 117.25.148.240 TCP 74 50920 > http [SYN] Seq=0 Win=14600 Len=0 MSS=1460 SACK_PERM=1 TSval=43077462 TSecr=0 WS=128  tcp.stream == 62
959  28.964137 117.25.148.240 -> 216.165.108.217 TCP 1514 [TCP Retransmission] http > 50919 [ACK] Seq=1 Ack=416 Win=7168 Len=1460  tcp.stream == 61
960  28.964155 216.165.108.217 -> 117.25.148.240 TCP 66 [TCP Dup ACK 871#1] 50919 > http [ACK] Seq=416 Ack=2921 Win=20480 Len=0 SLE=1 SRE=1461  tcp.stream == 61
961  28.991517 117.25.148.240 -> 216.165.108.217 TCP 60 http > 50879 [FIN, ACK] Seq=21675 Ack=417 Win=7168 Len=0  tcp.stream == 21
962  28.991536 216.165.108.217 -> 117.25.148.240 TCP 54 [TCP Dup ACK 950#1] 50879 > http [ACK] Seq=417 Ack=21676 Win=58496 Len=0  tcp.stream == 21
966  29.371386 117.25.148.240 -> 216.165.108.217 TCP 1514 [TCP segment of a reassembled PDU]  tcp.stream == 61
967  29.371407 216.165.108.217 -> 117.25.148.240 TCP 54 50919 > http [ACK] Seq=416 Ack=4381 Win=23424 Len=0  tcp.stream == 61
968  29.371484 117.25.148.240 -> 216.165.108.217 TCP 1514 [TCP segment of a reassembled PDU]  tcp.stream == 61
969  29.371489 216.165.108.217 -> 117.25.148.240 TCP 54 50919 > http [ACK] Seq=416 Ack=5841 Win=26368 Len=0  tcp.stream == 61
972  29.786383 117.25.148.240 -> 216.165.108.217 TCP 1514 [TCP segment of a reassembled PDU]  tcp.stream == 61
973  29.786401 216.165.108.217 -> 117.25.148.240 TCP 54 50919 > http [ACK] Seq=416 Ack=7301 Win=29312 Len=0  tcp.stream == 61
974  29.786471 117.25.148.240 -> 216.165.108.217 TCP 1514 [TCP segment of a reassembled PDU]  tcp.stream == 61
975  29.786477 216.165.108.217 -> 117.25.148.240 TCP 54 50919 > http [ACK] Seq=416 Ack=8761 Win=32128 Len=0  tcp.stream == 61
976  29.786527 117.25.148.240 -> 216.165.108.217 HTTP 1120 HTTP/1.1 200 OK  (JPEG JFIF image)  tcp.stream == 61
977  29.786532 216.165.108.217 -> 117.25.148.240 TCP 54 50919 > http [ACK] Seq=416 Ack=9827 Win=35072 Len=0  tcp.stream == 61
978  29.791120 216.165.108.217 -> 117.25.148.240 TCP 54 50919 > http [FIN, ACK] Seq=416 Ack=9827 Win=35072 Len=0  tcp.stream == 61
982  30.213036 117.25.148.240 -> 216.165.108.217 TCP 60 http > 50919 [FIN, ACK] Seq=9827 Ack=417 Win=7168 Len=0  tcp.stream == 61
983  30.213056 216.165.108.217 -> 117.25.148.240 TCP 54 50919 > http [ACK] Seq=417 Ack=9828 Win=35072 Len=0  tcp.stream == 61
990  31.058060 117.25.148.240 -> 216.165.108.217 TCP 60 http > 50879 [FIN, ACK] Seq=21675 Ack=417 Win=7168 Len=0  tcp.stream == 21
991  31.058082 216.165.108.217 -> 117.25.148.240 TCP 54 [TCP Dup ACK 950#2] 50879 > http [ACK] Seq=417 Ack=21676 Win=58496 Len=0  tcp.stream == 21
994  31.451687 216.165.108.217 -> 119.167.201.251 TCP 74 46255 > http [SYN] Seq=0 Win=14600 Len=0 MSS=1460 SACK_PERM=1 TSval=43078212 TSecr=0 WS=128  tcp.stream == 46
995  31.494915 216.165.108.217 -> 110.75.24.26 TCP 54 41166 > http [FIN, ACK] Seq=1 Ack=1 Win=14600 Len=0  tcp.stream == 16
998  31.775733 110.75.24.26 -> 216.165.108.217 TCP 60 http > 41166 [ACK] Seq=1 Ack=2 Win=5840 Len=0  tcp.stream == 16
999  31.775749 110.75.24.26 -> 216.165.108.217 TCP 60 http > 41166 [FIN, ACK] Seq=1 Ack=2 Win=5840 Len=0  tcp.stream == 16
1000  31.775755 216.165.108.217 -> 110.75.24.26 TCP 54 41166 > http [ACK] Seq=2 Ack=2 Win=14600 Len=0  tcp.stream == 16
1001  31.824015 119.167.201.251 -> 216.165.108.217 TCP 60 http > 46255 [SYN, ACK] Seq=0 Ack=1 Win=5840 Len=0 MSS=1460  tcp.stream == 46
1002  31.824041 216.165.108.217 -> 119.167.201.251 TCP 54 46255 > http [ACK] Seq=1 Ack=1 Win=14600 Len=0  tcp.stream == 46
1007  32.391947 117.25.148.240 -> 216.165.108.217 TCP 266 [TCP segment of a reassembled PDU]  tcp.stream == 52
1008  32.398263 216.165.108.217 -> 117.25.148.240 TCP 54 50910 > http [FIN, ACK] Seq=416 Ack=214 Win=15744 Len=0  tcp.stream == 52
1010  32.555686 216.165.108.217 -> 117.25.148.240 HTTP 469 [TCP Retransmission] GET /tps/i3/T1ABeRXcpbXXXXXXXX-300-100.png HTTP/1.1   tcp.stream == 52
1012  32.827913 117.25.148.240 -> 216.165.108.217 TCP 60 http > 50910 [RST] Seq=214 Win=0 Len=0  tcp.stream == 52
1014  32.984944 117.25.148.240 -> 216.165.108.217 TCP 60 http > 50910 [RST] Seq=214 Win=0 Len=0  tcp.stream == 52
1025  34.459689 216.165.108.217 -> 117.25.148.240 TCP 74 50920 > http [SYN] Seq=0 Win=14600 Len=0 MSS=1460 SACK_PERM=1 TSval=43078964 TSecr=0 WS=128  tcp.stream == 62
1074  41.836205 216.165.108.217 -> 119.167.201.251 TCP 54 46255 > http [FIN, ACK] Seq=1 Ack=1 Win=14600 Len=0  tcp.stream == 46
1078  42.211389 119.167.201.251 -> 216.165.108.217 TCP 60 http > 46255 [FIN, ACK] Seq=1 Ack=2 Win=5840 Len=0  tcp.stream == 46
1079  42.211413 216.165.108.217 -> 119.167.201.251 TCP 54 46255 > http [ACK] Seq=2 Ack=2 Win=14600 Len=0  tcp.stream == 46
1081  42.443694 216.165.108.217 -> 114.111.109.20 TCP 54 39838 > http [FIN, ACK] Seq=1 Ack=1 Win=14600 Len=0  tcp.stream == 63
