 45   6.016040 216.165.108.217 -> 72.21.211.176 TCP 74 34989 > http [SYN] Seq=0 Win=14600 Len=0 MSS=1460 SACK_PERM=1 TSval=43033370 TSecr=0 WS=128  tcp.stream == 0
 46   6.028152 72.21.211.176 -> 216.165.108.217 TCP 62 http > 34989 [SYN, ACK] Seq=0 Ack=1 Win=8190 Len=0 MSS=1460 WS=64  tcp.stream == 0
 47   6.028184 216.165.108.217 -> 72.21.211.176 TCP 54 34989 > http [ACK] Seq=1 Ack=1 Win=14720 Len=0  tcp.stream == 0
 48   6.028266 216.165.108.217 -> 72.21.211.176 HTTP 346 GET / HTTP/1.1   tcp.stream == 0
 49   6.045890 72.21.211.176 -> 216.165.108.217 HTTP 526 HTTP/1.1 301 Moved Permanently  (text/html)  tcp.stream == 0
 50   6.045927 216.165.108.217 -> 72.21.211.176 TCP 54 34989 > http [ACK] Seq=293 Ack=473 Win=15744 Len=0  tcp.stream == 0
 53   6.134254 216.165.108.217 -> 72.21.194.1  TCP 74 52433 > http [SYN] Seq=0 Win=14600 Len=0 MSS=1460 SACK_PERM=1 TSval=43033400 TSecr=0 WS=128  tcp.stream == 1
 54   6.142351  72.21.194.1 -> 216.165.108.217 TCP 62 http > 52433 [SYN, ACK] Seq=0 Ack=1 Win=8190 Len=0 MSS=1460 WS=64  tcp.stream == 1
 55   6.142379 216.165.108.217 -> 72.21.194.1  TCP 54 52433 > http [ACK] Seq=1 Ack=1 Win=14720 Len=0  tcp.stream == 1
 56   6.142455 216.165.108.217 -> 72.21.194.1  HTTP 350 GET / HTTP/1.1   tcp.stream == 1
 57   6.150625  72.21.194.1 -> 216.165.108.217 TCP 60 http > 52433 [ACK] Seq=1 Ack=297 Win=6912 Len=0  tcp.stream == 1
 59   6.237565  72.21.194.1 -> 216.165.108.217 TCP 1514 [TCP segment of a reassembled PDU]  tcp.stream == 1
 60   6.237582 216.165.108.217 -> 72.21.194.1  TCP 54 52433 > http [ACK] Seq=297 Ack=1461 Win=17536 Len=0  tcp.stream == 1
 61   6.237653  72.21.194.1 -> 216.165.108.217 TCP 1551 [TCP segment of a reassembled PDU]  tcp.stream == 1
 62   6.237659 216.165.108.217 -> 72.21.194.1  TCP 54 52433 > http [ACK] Seq=297 Ack=2958 Win=20480 Len=0  tcp.stream == 1
 63   6.237854  72.21.194.1 -> 216.165.108.217 TCP 1051 [TCP segment of a reassembled PDU]  tcp.stream == 1
 64   6.237862 216.165.108.217 -> 72.21.194.1  TCP 54 52433 > http [ACK] Seq=297 Ack=3955 Win=23424 Len=0  tcp.stream == 1
 65   6.238467  72.21.194.1 -> 216.165.108.217 TCP 1679 [TCP segment of a reassembled PDU]  tcp.stream == 1
 66   6.238483 216.165.108.217 -> 72.21.194.1  TCP 54 52433 > http [ACK] Seq=297 Ack=5580 Win=26368 Len=0  tcp.stream == 1
 83   6.257045 216.165.108.217 -> 72.247.238.24 TCP 74 37119 > http [SYN] Seq=0 Win=14600 Len=0 MSS=1460 SACK_PERM=1 TSval=43033430 TSecr=0 WS=128  tcp.stream == 2
 84   6.257148 216.165.108.217 -> 72.247.238.24 TCP 74 37120 > http [SYN] Seq=0 Win=14600 Len=0 MSS=1460 SACK_PERM=1 TSval=43033430 TSecr=0 WS=128  tcp.stream == 3
 85   6.258474 72.247.238.24 -> 216.165.108.217 TCP 74 http > 37119 [SYN, ACK] Seq=0 Ack=1 Win=14480 Len=0 MSS=1460 SACK_PERM=1 TSval=2090510172 TSecr=43033430 WS=4  tcp.stream == 2
 86   6.258499 216.165.108.217 -> 72.247.238.24 TCP 66 37119 > http [ACK] Seq=1 Ack=1 Win=14720 Len=0 TSval=43033431 TSecr=2090510172  tcp.stream == 2
 87   6.258550 72.247.238.24 -> 216.165.108.217 TCP 74 http > 37120 [SYN, ACK] Seq=0 Ack=1 Win=14480 Len=0 MSS=1460 SACK_PERM=1 TSval=2090510172 TSecr=43033430 WS=4  tcp.stream == 3
 88   6.258559 216.165.108.217 -> 72.247.238.24 TCP 66 37120 > http [ACK] Seq=1 Ack=1 Win=14720 Len=0 TSval=43033431 TSecr=2090510172  tcp.stream == 3
 89   6.258593 216.165.108.217 -> 72.247.238.24 HTTP 447 GET /images/G/01/gno/images/orangeBlue/navPackedSprites-US-22._V141013035_.png HTTP/1.1   tcp.stream == 2
 90   6.258621 216.165.108.217 -> 72.247.238.24 HTTP 436 GET /images/G/01/x-locale/common/transparent-pixel._V192234675_.gif HTTP/1.1   tcp.stream == 3
 91   6.259854 72.247.238.24 -> 216.165.108.217 TCP 66 http > 37119 [ACK] Seq=1 Ack=382 Win=15552 Len=0 TSval=2090510173 TSecr=43033431  tcp.stream == 2
 92   6.259874 72.247.238.24 -> 216.165.108.217 TCP 66 http > 37120 [ACK] Seq=1 Ack=371 Win=15552 Len=0 TSval=2090510173 TSecr=43033431  tcp.stream == 3
 93   6.260474 72.247.238.24 -> 216.165.108.217 TCP 1514 [TCP segment of a reassembled PDU]  tcp.stream == 2
 94   6.260490 216.165.108.217 -> 72.247.238.24 TCP 66 37119 > http [ACK] Seq=382 Ack=1449 Win=17536 Len=0 TSval=43033431 TSecr=2090510174  tcp.stream == 2
 95   6.260593 72.247.238.24 -> 216.165.108.217 TCP 1514 [TCP segment of a reassembled PDU]  tcp.stream == 2
 96   6.260598 216.165.108.217 -> 72.247.238.24 TCP 66 37119 > http [ACK] Seq=382 Ack=2897 Win=20480 Len=0 TSval=43033431 TSecr=2090510174  tcp.stream == 2
 97   6.260711 72.247.238.24 -> 216.165.108.217 TCP 1514 [TCP segment of a reassembled PDU]  tcp.stream == 2
 98   6.260718 216.165.108.217 -> 72.247.238.24 TCP 66 37119 > http [ACK] Seq=382 Ack=4345 Win=23296 Len=0 TSval=43033431 TSecr=2090510174  tcp.stream == 2
 99   6.260833 72.247.238.24 -> 216.165.108.217 HTTP 378 HTTP/1.1 200 OK  (GIF89a)  tcp.stream == 3
100   6.260838 216.165.108.217 -> 72.247.238.24 TCP 66 37120 > http [ACK] Seq=371 Ack=313 Win=15744 Len=0 TSval=43033431 TSecr=2090510174  tcp.stream == 3
101   6.260841 72.247.238.24 -> 216.165.108.217 TCP 1514 [TCP segment of a reassembled PDU]  tcp.stream == 2
102   6.260843 216.165.108.217 -> 72.247.238.24 TCP 66 37119 > http [ACK] Seq=382 Ack=5793 Win=26240 Len=0 TSval=43033431 TSecr=2090510174  tcp.stream == 2
103   6.261839 72.247.238.24 -> 216.165.108.217 HTTP 1858 HTTP/1.1 200 OK  (PNG)  tcp.stream == 2
104   6.261857 216.165.108.217 -> 72.247.238.24 TCP 66 37119 > http [ACK] Seq=382 Ack=7585 Win=29184 Len=0 TSval=43033432 TSecr=2090510175  tcp.stream == 2
106   6.380971  72.21.194.1 -> 216.165.108.217 TCP 1514 [TCP segment of a reassembled PDU]  tcp.stream == 1
107   6.380986 216.165.108.217 -> 72.21.194.1  TCP 54 52433 > http [ACK] Seq=297 Ack=7040 Win=29312 Len=0  tcp.stream == 1
108   6.380991  72.21.194.1 -> 216.165.108.217 TCP 60 [TCP segment of a reassembled PDU]  tcp.stream == 1
109   6.380993 216.165.108.217 -> 72.21.194.1  TCP 54 52433 > http [ACK] Seq=297 Ack=7042 Win=29312 Len=0  tcp.stream == 1
110   6.380995  72.21.194.1 -> 216.165.108.217 TCP 742 [TCP segment of a reassembled PDU]  tcp.stream == 1
111   6.380996 216.165.108.217 -> 72.21.194.1  TCP 54 52433 > http [ACK] Seq=297 Ack=7730 Win=32128 Len=0  tcp.stream == 1
112   6.386544 216.165.108.217 -> 72.247.238.24 HTTP 457 GET /images/G/01/kindle/merch/gw/kindle-family/kindle-family-gw-470x445._V138559989_.jpg HTTP/1.1   tcp.stream == 2
113   6.386577 216.165.108.217 -> 72.247.238.24 HTTP 443 GET /images/G/01/electronics/camera/2012/camera-newincamphoto_300x75._.png HTTP/1.1   tcp.stream == 3
114   6.389347 72.247.238.24 -> 216.165.108.217 TCP 1514 [TCP segment of a reassembled PDU]  tcp.stream == 3
115   6.389369 216.165.108.217 -> 72.247.238.24 TCP 66 37120 > http [ACK] Seq=748 Ack=1761 Win=18688 Len=0 TSval=43033464 TSecr=2090510301  tcp.stream == 3
116   6.389442 72.247.238.24 -> 216.165.108.217 TCP 1514 [TCP segment of a reassembled PDU]  tcp.stream == 3
117   6.389447 216.165.108.217 -> 72.247.238.24 TCP 66 37120 > http [ACK] Seq=748 Ack=3209 Win=21504 Len=0 TSval=43033464 TSecr=2090510301  tcp.stream == 3
118   6.389568 72.247.238.24 -> 216.165.108.217 TCP 1514 [TCP segment of a reassembled PDU]  tcp.stream == 3
119   6.389574 216.165.108.217 -> 72.247.238.24 TCP 66 37120 > http [ACK] Seq=748 Ack=4657 Win=24448 Len=0 TSval=43033464 TSecr=2090510301  tcp.stream == 3
120   6.389690 72.247.238.24 -> 216.165.108.217 TCP 1514 [TCP segment of a reassembled PDU]  tcp.stream == 3
121   6.389696 216.165.108.217 -> 72.247.238.24 TCP 66 37120 > http [ACK] Seq=748 Ack=6105 Win=27264 Len=0 TSval=43033464 TSecr=2090510301  tcp.stream == 3
122   6.389812 72.247.238.24 -> 216.165.108.217 TCP 1514 [TCP segment of a reassembled PDU]  tcp.stream == 3
123   6.389818 216.165.108.217 -> 72.247.238.24 TCP 66 37120 > http [ACK] Seq=748 Ack=7553 Win=30208 Len=0 TSval=43033464 TSecr=2090510301  tcp.stream == 3
124   6.389936 72.247.238.24 -> 216.165.108.217 TCP 1514 [TCP segment of a reassembled PDU]  tcp.stream == 2
125   6.389947 216.165.108.217 -> 72.247.238.24 TCP 66 37119 > http [ACK] Seq=773 Ack=9033 Win=32000 Len=0 TSval=43033464 TSecr=2090510302  tcp.stream == 2
126   6.390059 72.247.238.24 -> 216.165.108.217 TCP 1514 [TCP segment of a reassembled PDU]  tcp.stream == 2
127   6.390064 216.165.108.217 -> 72.247.238.24 TCP 66 37119 > http [ACK] Seq=773 Ack=10481 Win=34944 Len=0 TSval=43033464 TSecr=2090510302  tcp.stream == 2
128   6.390182 72.247.238.24 -> 216.165.108.217 TCP 1514 [TCP segment of a reassembled PDU]  tcp.stream == 2
129   6.390186 216.165.108.217 -> 72.247.238.24 TCP 66 37119 > http [ACK] Seq=773 Ack=11929 Win=37888 Len=0 TSval=43033464 TSecr=2090510302  tcp.stream == 2
130   6.390306 72.247.238.24 -> 216.165.108.217 TCP 1514 [TCP segment of a reassembled PDU]  tcp.stream == 2
131   6.390311 216.165.108.217 -> 72.247.238.24 TCP 66 37119 > http [ACK] Seq=773 Ack=13377 Win=40704 Len=0 TSval=43033464 TSecr=2090510302  tcp.stream == 2
132   6.390428 72.247.238.24 -> 216.165.108.217 TCP 1514 [TCP segment of a reassembled PDU]  tcp.stream == 2
133   6.390434 216.165.108.217 -> 72.247.238.24 TCP 66 37119 > http [ACK] Seq=773 Ack=14825 Win=43648 Len=0 TSval=43033464 TSecr=2090510302  tcp.stream == 2
134   6.390552 72.247.238.24 -> 216.165.108.217 TCP 1514 [TCP segment of a reassembled PDU]  tcp.stream == 2
135   6.390558 216.165.108.217 -> 72.247.238.24 TCP 66 37119 > http [ACK] Seq=773 Ack=16273 Win=46464 Len=0 TSval=43033464 TSecr=2090510302  tcp.stream == 2
136   6.390675 72.247.238.24 -> 216.165.108.217 TCP 1514 [TCP segment of a reassembled PDU]  tcp.stream == 2
137   6.390679 216.165.108.217 -> 72.247.238.24 TCP 66 37119 > http [ACK] Seq=773 Ack=17721 Win=49408 Len=0 TSval=43033464 TSecr=2090510302  tcp.stream == 2
138   6.391307 72.247.238.24 -> 216.165.108.217 HTTP 1054 HTTP/1.1 200 OK  (PNG)  tcp.stream == 3
139   6.391324 216.165.108.217 -> 72.247.238.24 TCP 66 37120 > http [ACK] Seq=748 Ack=8541 Win=33152 Len=0 TSval=43033464 TSecr=2090510304  tcp.stream == 3
140   6.391997 72.247.238.24 -> 216.165.108.217 TCP 1514 [TCP segment of a reassembled PDU]  tcp.stream == 2
141   6.392019 216.165.108.217 -> 72.247.238.24 TCP 66 37119 > http [ACK] Seq=773 Ack=19169 Win=52352 Len=0 TSval=43033464 TSecr=2090510304  tcp.stream == 2
142   6.392118 72.247.238.24 -> 216.165.108.217 TCP 1514 [TCP segment of a reassembled PDU]  tcp.stream == 2
143   6.392123 216.165.108.217 -> 72.247.238.24 TCP 66 37119 > http [ACK] Seq=773 Ack=20617 Win=55168 Len=0 TSval=43033464 TSecr=2090510304  tcp.stream == 2
144   6.392239 72.247.238.24 -> 216.165.108.217 TCP 1514 [TCP segment of a reassembled PDU]  tcp.stream == 2
145   6.392244 216.165.108.217 -> 72.247.238.24 TCP 66 37119 > http [ACK] Seq=773 Ack=22065 Win=58112 Len=0 TSval=43033464 TSecr=2090510305  tcp.stream == 2
146   6.392364 72.247.238.24 -> 216.165.108.217 TCP 1514 [TCP segment of a reassembled PDU]  tcp.stream == 2
147   6.392369 216.165.108.217 -> 72.247.238.24 TCP 66 37119 > http [ACK] Seq=773 Ack=23513 Win=61056 Len=0 TSval=43033464 TSecr=2090510305  tcp.stream == 2
148   6.392485 72.247.238.24 -> 216.165.108.217 TCP 1514 [TCP segment of a reassembled PDU]  tcp.stream == 2
149   6.392491 216.165.108.217 -> 72.247.238.24 TCP 66 37119 > http [ACK] Seq=773 Ack=24961 Win=63872 Len=0 TSval=43033464 TSecr=2090510305  tcp.stream == 2
150   6.392608 72.247.238.24 -> 216.165.108.217 TCP 1514 [TCP segment of a reassembled PDU]  tcp.stream == 2
151   6.392613 216.165.108.217 -> 72.247.238.24 TCP 66 37119 > http [ACK] Seq=773 Ack=26409 Win=64128 Len=0 TSval=43033464 TSecr=2090510305  tcp.stream == 2
152   6.392732 72.247.238.24 -> 216.165.108.217 TCP 1514 [TCP segment of a reassembled PDU]  tcp.stream == 2
153   6.392736 216.165.108.217 -> 72.247.238.24 TCP 66 37119 > http [ACK] Seq=773 Ack=27857 Win=64128 Len=0 TSval=43033464 TSecr=2090510305  tcp.stream == 2
154   6.392855 72.247.238.24 -> 216.165.108.217 TCP 1514 [TCP segment of a reassembled PDU]  tcp.stream == 2
155   6.392860 216.165.108.217 -> 72.247.238.24 TCP 66 37119 > http [ACK] Seq=773 Ack=29305 Win=64128 Len=0 TSval=43033464 TSecr=2090510305  tcp.stream == 2
156   6.392978 72.247.238.24 -> 216.165.108.217 TCP 1514 [TCP segment of a reassembled PDU]  tcp.stream == 2
157   6.393102 72.247.238.24 -> 216.165.108.217 TCP 1514 [TCP segment of a reassembled PDU]  tcp.stream == 2
158   6.393108 216.165.108.217 -> 72.247.238.24 TCP 66 37119 > http [ACK] Seq=773 Ack=32201 Win=64128 Len=0 TSval=43033464 TSecr=2090510305  tcp.stream == 2
159   6.393225 72.247.238.24 -> 216.165.108.217 TCP 1514 [TCP segment of a reassembled PDU]  tcp.stream == 2
160   6.393346 72.247.238.24 -> 216.165.108.217 TCP 1514 [TCP segment of a reassembled PDU]  tcp.stream == 2
161   6.393352 216.165.108.217 -> 72.247.238.24 TCP 66 37119 > http [ACK] Seq=773 Ack=35097 Win=64128 Len=0 TSval=43033465 TSecr=2090510305  tcp.stream == 2
162   6.393477 72.247.238.24 -> 216.165.108.217 TCP 1514 [TCP segment of a reassembled PDU]  tcp.stream == 2
163   6.393600 72.247.238.24 -> 216.165.108.217 TCP 1514 [TCP segment of a reassembled PDU]  tcp.stream == 2
164   6.393605 216.165.108.217 -> 72.247.238.24 TCP 66 37119 > http [ACK] Seq=773 Ack=37993 Win=64128 Len=0 TSval=43033465 TSecr=2090510305  tcp.stream == 2
165   6.394112 72.247.238.24 -> 216.165.108.217 TCP 1514 [TCP segment of a reassembled PDU]  tcp.stream == 2
166   6.394228 72.247.238.24 -> 216.165.108.217 TCP 1514 [TCP segment of a reassembled PDU]  tcp.stream == 2
167   6.394236 216.165.108.217 -> 72.247.238.24 TCP 66 37119 > http [ACK] Seq=773 Ack=40889 Win=64128 Len=0 TSval=43033465 TSecr=2090510307  tcp.stream == 2
168   6.394361 72.247.238.24 -> 216.165.108.217 TCP 1514 [TCP segment of a reassembled PDU]  tcp.stream == 2
169   6.394483 72.247.238.24 -> 216.165.108.217 TCP 1514 [TCP segment of a reassembled PDU]  tcp.stream == 2
170   6.394488 216.165.108.217 -> 72.247.238.24 TCP 66 37119 > http [ACK] Seq=773 Ack=43785 Win=64128 Len=0 TSval=43033465 TSecr=2090510307  tcp.stream == 2
171   6.394608 72.247.238.24 -> 216.165.108.217 TCP 1514 [TCP segment of a reassembled PDU]  tcp.stream == 2
172   6.394728 72.247.238.24 -> 216.165.108.217 TCP 1514 [TCP segment of a reassembled PDU]  tcp.stream == 2
173   6.394733 216.165.108.217 -> 72.247.238.24 TCP 66 37119 > http [ACK] Seq=773 Ack=46681 Win=64128 Len=0 TSval=43033465 TSecr=2090510307  tcp.stream == 2
174   6.394854 72.247.238.24 -> 216.165.108.217 TCP 1514 [TCP segment of a reassembled PDU]  tcp.stream == 2
175   6.394974 72.247.238.24 -> 216.165.108.217 TCP 1514 [TCP segment of a reassembled PDU]  tcp.stream == 2
176   6.394979 216.165.108.217 -> 72.247.238.24 TCP 66 37119 > http [ACK] Seq=773 Ack=49577 Win=64128 Len=0 TSval=43033465 TSecr=2090510307  tcp.stream == 2
177   6.395100 72.247.238.24 -> 216.165.108.217 TCP 1514 [TCP segment of a reassembled PDU]  tcp.stream == 2
178   6.395224 72.247.238.24 -> 216.165.108.217 TCP 1514 [TCP segment of a reassembled PDU]  tcp.stream == 2
179   6.395230 216.165.108.217 -> 72.247.238.24 TCP 66 37119 > http [ACK] Seq=773 Ack=52473 Win=64128 Len=0 TSval=43033465 TSecr=2090510307  tcp.stream == 2
180   6.395345 72.247.238.24 -> 216.165.108.217 TCP 1514 [TCP segment of a reassembled PDU]  tcp.stream == 2
181   6.395467 72.247.238.24 -> 216.165.108.217 TCP 1514 [TCP segment of a reassembled PDU]  tcp.stream == 2
182   6.395473 216.165.108.217 -> 72.247.238.24 TCP 66 37119 > http [ACK] Seq=773 Ack=55369 Win=64128 Len=0 TSval=43033465 TSecr=2090510307  tcp.stream == 2
183   6.395591 72.247.238.24 -> 216.165.108.217 TCP 1514 [TCP segment of a reassembled PDU]  tcp.stream == 2
184   6.395641 72.247.238.24 -> 216.165.108.217 HTTP 776 HTTP/1.1 200 OK  (JPEG JFIF image)  tcp.stream == 2
185   6.395646 216.165.108.217 -> 72.247.238.24 TCP 66 37119 > http [ACK] Seq=773 Ack=57527 Win=64128 Len=0 TSval=43033465 TSecr=2090510307  tcp.stream == 2
186   6.413983  72.21.194.1 -> 216.165.108.217 TCP 2131 [TCP segment of a reassembled PDU]  tcp.stream == 1
187   6.414004 216.165.108.217 -> 72.21.194.1  TCP 54 52433 > http [ACK] Seq=297 Ack=9807 Win=35072 Len=0  tcp.stream == 1
188   6.415107  72.21.194.1 -> 216.165.108.217 TCP 1514 [TCP segment of a reassembled PDU]  tcp.stream == 1
189   6.415136 216.165.108.217 -> 72.21.194.1  TCP 54 52433 > http [ACK] Seq=297 Ack=11267 Win=38016 Len=0  tcp.stream == 1
190   6.415147  72.21.194.1 -> 216.165.108.217 TCP 60 [TCP segment of a reassembled PDU]  tcp.stream == 1
191   6.415150 216.165.108.217 -> 72.21.194.1  TCP 54 52433 > http [ACK] Seq=297 Ack=11269 Win=38016 Len=0  tcp.stream == 1
192   6.415154  72.21.194.1 -> 216.165.108.217 TCP 938 [TCP segment of a reassembled PDU]  tcp.stream == 1
193   6.415157 216.165.108.217 -> 72.21.194.1  TCP 54 52433 > http [ACK] Seq=297 Ack=12153 Win=40960 Len=0  tcp.stream == 1
194   6.418634 216.165.108.217 -> 72.247.238.58 TCP 74 54305 > http [SYN] Seq=0 Win=14600 Len=0 MSS=1460 SACK_PERM=1 TSval=43033471 TSecr=0 WS=128  tcp.stream == 4
195   6.418761 216.165.108.217 -> 72.247.238.58 TCP 74 54306 > http [SYN] Seq=0 Win=14600 Len=0 MSS=1460 SACK_PERM=1 TSval=43033471 TSecr=0 WS=128  tcp.stream == 5
196   6.423347 72.247.238.58 -> 216.165.108.217 TCP 74 http > 54305 [SYN, ACK] Seq=0 Ack=1 Win=14480 Len=0 MSS=1460 SACK_PERM=1 TSval=3113630347 TSecr=43033471 WS=4  tcp.stream == 4
197   6.423377 216.165.108.217 -> 72.247.238.58 TCP 66 54305 > http [ACK] Seq=1 Ack=1 Win=14720 Len=0 TSval=43033472 TSecr=3113630347  tcp.stream == 4
198   6.423386 72.247.238.58 -> 216.165.108.217 TCP 74 http > 54306 [SYN, ACK] Seq=0 Ack=1 Win=14480 Len=0 MSS=1460 SACK_PERM=1 TSval=3113630347 TSecr=43033471 WS=4  tcp.stream == 5
199   6.423391 216.165.108.217 -> 72.247.238.58 TCP 66 54306 > http [ACK] Seq=1 Ack=1 Win=14720 Len=0 TSval=43033472 TSecr=3113630347  tcp.stream == 5
200   6.423450 216.165.108.217 -> 72.247.238.58 HTTP 452 GET /images/G/01/browser-scripts/us-site-wide-css-quirks/site-wide-3527593236.css._V162874846_.css HTTP/1.1   tcp.stream == 4
201   6.423477 216.165.108.217 -> 72.247.238.58 HTTP 453 GET /images/G/01/nav2/gamma/websiteGridCSS/websiteGridCSS-websiteGridCSS-10698.css._V163247933_.css HTTP/1.1   tcp.stream == 5
202   6.426085 72.247.238.58 -> 216.165.108.217 TCP 66 http > 54305 [ACK] Seq=1 Ack=387 Win=15552 Len=0 TSval=3113630352 TSecr=43033472  tcp.stream == 4
203   6.426101 72.247.238.58 -> 216.165.108.217 TCP 66 http > 54306 [ACK] Seq=1 Ack=388 Win=15552 Len=0 TSval=3113630352 TSecr=43033472  tcp.stream == 5
204   6.426484 72.247.238.58 -> 216.165.108.217 TCP 1514 [TCP segment of a reassembled PDU]  tcp.stream == 4
205   6.426499 216.165.108.217 -> 72.247.238.58 TCP 66 54305 > http [ACK] Seq=387 Ack=1449 Win=17536 Len=0 TSval=43033473 TSecr=3113630352  tcp.stream == 4
206   6.426607 72.247.238.58 -> 216.165.108.217 TCP 1514 [TCP segment of a reassembled PDU]  tcp.stream == 4
207   6.426614 216.165.108.217 -> 72.247.238.58 TCP 66 54305 > http [ACK] Seq=387 Ack=2897 Win=20480 Len=0 TSval=43033473 TSecr=3113630352  tcp.stream == 4
208   6.426732 72.247.238.58 -> 216.165.108.217 TCP 1514 [TCP segment of a reassembled PDU]  tcp.stream == 4
209   6.426736 216.165.108.217 -> 72.247.238.58 TCP 66 54305 > http [ACK] Seq=387 Ack=4345 Win=23296 Len=0 TSval=43033473 TSecr=3113630352  tcp.stream == 4
210   6.426855 72.247.238.58 -> 216.165.108.217 TCP 1514 [TCP segment of a reassembled PDU]  tcp.stream == 4
211   6.426861 216.165.108.217 -> 72.247.238.58 TCP 66 54305 > http [ACK] Seq=387 Ack=5793 Win=26240 Len=0 TSval=43033473 TSecr=3113630352  tcp.stream == 4
212   6.427166 72.247.238.58 -> 216.165.108.217 TCP 1514 [TCP segment of a reassembled PDU]  tcp.stream == 5
213   6.427174 216.165.108.217 -> 72.247.238.58 TCP 66 54306 > http [ACK] Seq=388 Ack=1449 Win=17536 Len=0 TSval=43033473 TSecr=3113630353  tcp.stream == 5
214   6.427268 72.247.238.58 -> 216.165.108.217 TCP 1514 [TCP segment of a reassembled PDU]  tcp.stream == 5
215   6.427273 216.165.108.217 -> 72.247.238.58 TCP 66 54306 > http [ACK] Seq=388 Ack=2897 Win=20480 Len=0 TSval=43033473 TSecr=3113630353  tcp.stream == 5
216   6.427388 72.247.238.58 -> 216.165.108.217 TCP 1514 [TCP segment of a reassembled PDU]  tcp.stream == 5
217   6.427393 216.165.108.217 -> 72.247.238.58 TCP 66 54306 > http [ACK] Seq=388 Ack=4345 Win=23296 Len=0 TSval=43033473 TSecr=3113630353  tcp.stream == 5
218   6.427498 72.247.238.58 -> 216.165.108.217 HTTP 1389 HTTP/1.1 200 OK  (text/css)  tcp.stream == 5
219   6.427504 216.165.108.217 -> 72.247.238.58 TCP 66 54306 > http [ACK] Seq=388 Ack=5668 Win=26240 Len=0 TSval=43033473 TSecr=3113630353  tcp.stream == 5
220   6.428173 72.247.238.58 -> 216.165.108.217 HTTP 860 HTTP/1.1 200 OK  (text/css)  tcp.stream == 4
221   6.428190 216.165.108.217 -> 72.247.238.58 TCP 66 54305 > http [ACK] Seq=387 Ack=6587 Win=29184 Len=0 TSval=43033473 TSecr=3113630355  tcp.stream == 4
222   6.460017  72.21.194.1 -> 216.165.108.217 TCP 2090 [TCP segment of a reassembled PDU]  tcp.stream == 1
223   6.460039 216.165.108.217 -> 72.21.194.1  TCP 54 52433 > http [ACK] Seq=297 Ack=14189 Win=43904 Len=0  tcp.stream == 1
224   6.460163  72.21.194.1 -> 216.165.108.217 TCP 1541 [TCP segment of a reassembled PDU]  tcp.stream == 1
225   6.460170 216.165.108.217 -> 72.21.194.1  TCP 54 52433 > http [ACK] Seq=297 Ack=15676 Win=46720 Len=0  tcp.stream == 1
227   6.467983  72.21.194.1 -> 216.165.108.217 TCP 1069 [TCP segment of a reassembled PDU]  tcp.stream == 1
228   6.468004 216.165.108.217 -> 72.21.194.1  TCP 54 52433 > http [ACK] Seq=297 Ack=16691 Win=49664 Len=0  tcp.stream == 1
229   6.469139  72.21.194.1 -> 216.165.108.217 TCP 1197 [TCP segment of a reassembled PDU]  tcp.stream == 1
230   6.469154 216.165.108.217 -> 72.21.194.1  TCP 54 52433 > http [ACK] Seq=297 Ack=17834 Win=52608 Len=0  tcp.stream == 1
231   6.490282  72.21.194.1 -> 216.165.108.217 TCP 1435 [TCP segment of a reassembled PDU]  tcp.stream == 1
232   6.490300 216.165.108.217 -> 72.21.194.1  TCP 54 52433 > http [ACK] Seq=297 Ack=19215 Win=55552 Len=0  tcp.stream == 1
234   6.600169  72.21.194.1 -> 216.165.108.217 TCP 1625 [TCP segment of a reassembled PDU]  tcp.stream == 1
235   6.600185 216.165.108.217 -> 72.21.194.1  TCP 54 52433 > http [ACK] Seq=297 Ack=20786 Win=58496 Len=0  tcp.stream == 1
236   6.610258 216.165.108.217 -> 72.21.194.1  TCP 74 52438 > http [SYN] Seq=0 Win=14600 Len=0 MSS=1460 SACK_PERM=1 TSval=43033519 TSecr=0 WS=128  tcp.stream == 6
237   6.614218  72.21.194.1 -> 216.165.108.217 TCP 1178 [TCP segment of a reassembled PDU]  tcp.stream == 1
238   6.614236 216.165.108.217 -> 72.21.194.1  TCP 54 52433 > http [ACK] Seq=297 Ack=21910 Win=61440 Len=0  tcp.stream == 1
239   6.615353  72.21.194.1 -> 216.165.108.217 TCP 1656 [TCP segment of a reassembled PDU]  tcp.stream == 1
240   6.615368 216.165.108.217 -> 72.21.194.1  TCP 54 52433 > http [ACK] Seq=297 Ack=23512 Win=64128 Len=0  tcp.stream == 1
241   6.616366  72.21.194.1 -> 216.165.108.217 TCP 933 [TCP segment of a reassembled PDU]  tcp.stream == 1
242   6.616466 216.165.108.217 -> 72.21.194.1  TCP 54 52433 > http [ACK] Seq=297 Ack=24391 Win=64128 Len=0  tcp.stream == 1
243   6.617019 216.165.108.217 -> 72.247.238.58 HTTP 410 GET /images/G/01/s9-campaigns/s9-widget._V139062658_.css HTTP/1.1   tcp.stream == 4
244   6.617052 216.165.108.217 -> 72.247.238.58 HTTP 433 GET /images/G/01/browser-scripts/us-site-wide-js-1.2.6/site-wide-2377001959.js._V140676873_.js HTTP/1.1   tcp.stream == 5
245   6.618203  72.21.194.1 -> 216.165.108.217 TCP 62 http > 52438 [SYN, ACK] Seq=0 Ack=1 Win=8190 Len=0 MSS=1460 WS=64  tcp.stream == 6
246   6.618224 216.165.108.217 -> 72.21.194.1  TCP 54 52438 > http [ACK] Seq=1 Ack=1 Win=14720 Len=0  tcp.stream == 6
247   6.618278 216.165.108.217 -> 72.21.194.1  HTTP 499 GET /aan/2009-09-09/static/amazon/iframeproxy-9.html HTTP/1.1   tcp.stream == 6
248   6.618793 72.247.238.58 -> 216.165.108.217 TCP 1514 [TCP segment of a reassembled PDU]  tcp.stream == 4
249   6.618814 216.165.108.217 -> 72.247.238.58 TCP 66 54305 > http [ACK] Seq=731 Ack=8035 Win=32000 Len=0 TSval=43033521 TSecr=3113630545  tcp.stream == 4
250   6.618914 72.247.238.58 -> 216.165.108.217 HTTP 2175 HTTP/1.1 200 OK  (text/css)  tcp.stream == 4
251   6.618919 216.165.108.217 -> 72.247.238.58 TCP 66 54305 > http [ACK] Seq=731 Ack=10144 Win=34944 Len=0 TSval=43033521 TSecr=3113630545  tcp.stream == 4
252   6.619098 72.247.238.58 -> 216.165.108.217 TCP 1514 [TCP segment of a reassembled PDU]  tcp.stream == 5
253   6.619108 216.165.108.217 -> 72.247.238.58 TCP 66 54306 > http [ACK] Seq=755 Ack=7116 Win=29184 Len=0 TSval=43033521 TSecr=3113630545  tcp.stream == 5
254   6.619218 72.247.238.58 -> 216.165.108.217 TCP 1514 [TCP segment of a reassembled PDU]  tcp.stream == 5
255   6.619225 216.165.108.217 -> 72.247.238.58 TCP 66 54306 > http [ACK] Seq=755 Ack=8564 Win=32000 Len=0 TSval=43033521 TSecr=3113630545  tcp.stream == 5
256   6.619338 72.247.238.58 -> 216.165.108.217 TCP 1514 [TCP segment of a reassembled PDU]  tcp.stream == 5
257   6.619344 216.165.108.217 -> 72.247.238.58 TCP 66 54306 > http [ACK] Seq=755 Ack=10012 Win=34944 Len=0 TSval=43033521 TSecr=3113630545  tcp.stream == 5
258   6.619465 72.247.238.58 -> 216.165.108.217 TCP 1514 [TCP segment of a reassembled PDU]  tcp.stream == 5
259   6.619471 216.165.108.217 -> 72.247.238.58 TCP 66 54306 > http [ACK] Seq=755 Ack=11460 Win=37888 Len=0 TSval=43033521 TSecr=3113630545  tcp.stream == 5
260   6.619588 72.247.238.58 -> 216.165.108.217 TCP 1514 [TCP segment of a reassembled PDU]  tcp.stream == 5
261   6.619594 216.165.108.217 -> 72.247.238.58 TCP 66 54306 > http [ACK] Seq=755 Ack=12908 Win=40704 Len=0 TSval=43033521 TSecr=3113630545  tcp.stream == 5
262   6.619708 72.247.238.58 -> 216.165.108.217 TCP 1514 [TCP segment of a reassembled PDU]  tcp.stream == 5
263   6.619714 216.165.108.217 -> 72.247.238.58 TCP 66 54306 > http [ACK] Seq=755 Ack=14356 Win=43648 Len=0 TSval=43033521 TSecr=3113630545  tcp.stream == 5
264   6.621577 72.247.238.58 -> 216.165.108.217 TCP 1514 [TCP segment of a reassembled PDU]  tcp.stream == 5
265   6.621591 216.165.108.217 -> 72.247.238.58 TCP 66 54306 > http [ACK] Seq=755 Ack=15804 Win=46464 Len=0 TSval=43033522 TSecr=3113630547  tcp.stream == 5
266   6.621692 72.247.238.58 -> 216.165.108.217 TCP 1514 [TCP segment of a reassembled PDU]  tcp.stream == 5
267   6.621697 216.165.108.217 -> 72.247.238.58 TCP 66 54306 > http [ACK] Seq=755 Ack=17252 Win=49408 Len=0 TSval=43033522 TSecr=3113630547  tcp.stream == 5
268   6.621820 72.247.238.58 -> 216.165.108.217 TCP 1514 [TCP segment of a reassembled PDU]  tcp.stream == 5
269   6.621826 216.165.108.217 -> 72.247.238.58 TCP 66 54306 > http [ACK] Seq=755 Ack=18700 Win=52352 Len=0 TSval=43033522 TSecr=3113630547  tcp.stream == 5
270   6.621946 72.247.238.58 -> 216.165.108.217 TCP 1514 [TCP segment of a reassembled PDU]  tcp.stream == 5
271   6.621954 216.165.108.217 -> 72.247.238.58 TCP 66 54306 > http [ACK] Seq=755 Ack=20148 Win=55168 Len=0 TSval=43033522 TSecr=3113630547  tcp.stream == 5
272   6.622066 72.247.238.58 -> 216.165.108.217 TCP 1514 [TCP segment of a reassembled PDU]  tcp.stream == 5
273   6.622072 216.165.108.217 -> 72.247.238.58 TCP 66 54306 > http [ACK] Seq=755 Ack=21596 Win=58112 Len=0 TSval=43033522 TSecr=3113630547  tcp.stream == 5
274   6.622193 72.247.238.58 -> 216.165.108.217 TCP 1514 [TCP segment of a reassembled PDU]  tcp.stream == 5
275   6.622199 216.165.108.217 -> 72.247.238.58 TCP 66 54306 > http [ACK] Seq=755 Ack=23044 Win=61056 Len=0 TSval=43033522 TSecr=3113630547  tcp.stream == 5
276   6.622317 72.247.238.58 -> 216.165.108.217 TCP 1514 [TCP segment of a reassembled PDU]  tcp.stream == 5
277   6.622323 216.165.108.217 -> 72.247.238.58 TCP 66 54306 > http [ACK] Seq=755 Ack=24492 Win=63872 Len=0 TSval=43033522 TSecr=3113630547  tcp.stream == 5
278   6.622436 72.247.238.58 -> 216.165.108.217 TCP 1514 [TCP segment of a reassembled PDU]  tcp.stream == 5
279   6.622442 216.165.108.217 -> 72.247.238.58 TCP 66 54306 > http [ACK] Seq=755 Ack=25940 Win=64128 Len=0 TSval=43033522 TSecr=3113630547  tcp.stream == 5
280   6.622566 72.247.238.58 -> 216.165.108.217 TCP 1514 [TCP segment of a reassembled PDU]  tcp.stream == 5
281   6.622572 216.165.108.217 -> 72.247.238.58 TCP 66 54306 > http [ACK] Seq=755 Ack=27388 Win=64128 Len=0 TSval=43033522 TSecr=3113630548  tcp.stream == 5
282   6.622692 72.247.238.58 -> 216.165.108.217 TCP 1514 [TCP segment of a reassembled PDU]  tcp.stream == 5
283   6.622698 216.165.108.217 -> 72.247.238.58 TCP 66 54306 > http [ACK] Seq=755 Ack=28836 Win=64128 Len=0 TSval=43033522 TSecr=3113630548  tcp.stream == 5
284   6.622812 72.247.238.58 -> 216.165.108.217 TCP 1514 [TCP segment of a reassembled PDU]  tcp.stream == 5
285   6.622981 72.247.238.58 -> 216.165.108.217 TCP 1514 [TCP segment of a reassembled PDU]  tcp.stream == 5
286   6.622989 216.165.108.217 -> 72.247.238.58 TCP 66 54306 > http [ACK] Seq=755 Ack=31732 Win=64128 Len=0 TSval=43033522 TSecr=3113630548  tcp.stream == 5
287   6.623484 72.247.238.58 -> 216.165.108.217 TCP 1514 [TCP segment of a reassembled PDU]  tcp.stream == 5
288   6.623592 72.247.238.58 -> 216.165.108.217 TCP 1514 [TCP segment of a reassembled PDU]  tcp.stream == 5
289   6.623600 216.165.108.217 -> 72.247.238.58 TCP 66 54306 > http [ACK] Seq=755 Ack=34628 Win=64128 Len=0 TSval=43033522 TSecr=3113630550  tcp.stream == 5
290   6.623720 72.247.238.58 -> 216.165.108.217 TCP 1514 [TCP segment of a reassembled PDU]  tcp.stream == 5
291   6.623846 72.247.238.58 -> 216.165.108.217 TCP 1514 [TCP segment of a reassembled PDU]  tcp.stream == 5
292   6.623853 216.165.108.217 -> 72.247.238.58 TCP 66 54306 > http [ACK] Seq=755 Ack=37524 Win=64128 Len=0 TSval=43033522 TSecr=3113630550  tcp.stream == 5
293   6.623967 72.247.238.58 -> 216.165.108.217 TCP 1514 [TCP segment of a reassembled PDU]  tcp.stream == 5
294   6.624092 72.247.238.58 -> 216.165.108.217 TCP 1514 [TCP segment of a reassembled PDU]  tcp.stream == 5
295   6.624099 216.165.108.217 -> 72.247.238.58 TCP 66 54306 > http [ACK] Seq=755 Ack=40420 Win=64128 Len=0 TSval=43033522 TSecr=3113630550  tcp.stream == 5
296   6.624214 72.247.238.58 -> 216.165.108.217 TCP 1514 [TCP segment of a reassembled PDU]  tcp.stream == 5
297   6.624335 72.247.238.58 -> 216.165.108.217 TCP 1514 [TCP segment of a reassembled PDU]  tcp.stream == 5
298   6.624340 216.165.108.217 -> 72.247.238.58 TCP 66 54306 > http [ACK] Seq=755 Ack=43316 Win=64128 Len=0 TSval=43033522 TSecr=3113630550  tcp.stream == 5
299   6.624462 72.247.238.58 -> 216.165.108.217 TCP 1514 [TCP segment of a reassembled PDU]  tcp.stream == 5
300   6.624583 72.247.238.58 -> 216.165.108.217 HTTP 1521 HTTP/1.1 200 OK  (application/x-javascript)  tcp.stream == 5
301   6.624589 216.165.108.217 -> 72.247.238.58 TCP 66 54306 > http [ACK] Seq=755 Ack=46219 Win=64128 Len=0 TSval=43033522 TSecr=3113630550  tcp.stream == 5
302   6.626352 216.165.108.217 -> 72.247.238.10 TCP 74 38106 > http [SYN] Seq=0 Win=14600 Len=0 MSS=1460 SACK_PERM=1 TSval=43033523 TSecr=0 WS=128  tcp.stream == 7
303   6.627994  72.21.194.1 -> 216.165.108.217 TCP 60 http > 52438 [ACK] Seq=1 Ack=446 Win=40448 Len=0  tcp.stream == 6
304   6.628801 72.247.238.10 -> 216.165.108.217 TCP 74 http > 38106 [SYN, ACK] Seq=0 Ack=1 Win=14480 Len=0 MSS=1460 SACK_PERM=1 TSval=3114191550 TSecr=43033523 WS=4  tcp.stream == 7
305   6.628826 216.165.108.217 -> 72.247.238.10 TCP 66 38106 > http [ACK] Seq=1 Ack=1 Win=14720 Len=0 TSval=43033523 TSecr=3114191550  tcp.stream == 7
306   6.628887 216.165.108.217 -> 72.247.238.10 HTTP 404 GET /images/I/51Invrn5FoL._SL135_.jpg HTTP/1.1   tcp.stream == 7
307   6.630134 216.165.108.217 -> 72.247.238.10 TCP 74 38107 > http [SYN] Seq=0 Win=14600 Len=0 MSS=1460 SACK_PERM=1 TSval=43033524 TSecr=0 WS=128  tcp.stream == 8
308   6.630216 216.165.108.217 -> 72.247.238.10 TCP 74 38108 > http [SYN] Seq=0 Win=14600 Len=0 MSS=1460 SACK_PERM=1 TSval=43033524 TSecr=0 WS=128  tcp.stream == 9
309   6.630235 216.165.108.217 -> 72.247.238.10 TCP 74 38109 > http [SYN] Seq=0 Win=14600 Len=0 MSS=1460 SACK_PERM=1 TSval=43033524 TSecr=0 WS=128  tcp.stream == 10
310   6.631477 72.247.238.10 -> 216.165.108.217 TCP 66 http > 38106 [ACK] Seq=1 Ack=339 Win=15552 Len=0 TSval=3114191553 TSecr=43033523  tcp.stream == 7
311   6.631839 72.247.238.10 -> 216.165.108.217 TCP 1514 [TCP segment of a reassembled PDU]  tcp.stream == 7
312   6.631851 216.165.108.217 -> 72.247.238.10 TCP 66 38106 > http [ACK] Seq=339 Ack=1449 Win=17536 Len=0 TSval=43033524 TSecr=3114191553  tcp.stream == 7
313   6.631965 72.247.238.10 -> 216.165.108.217 TCP 1514 [TCP segment of a reassembled PDU]  tcp.stream == 7
314   6.631970 216.165.108.217 -> 72.247.238.10 TCP 66 38106 > http [ACK] Seq=339 Ack=2897 Win=20480 Len=0 TSval=43033524 TSecr=3114191553  tcp.stream == 7
315   6.632089 72.247.238.10 -> 216.165.108.217 HTTP 1937 HTTP/1.1 200 OK  (JPEG JFIF image)  tcp.stream == 7
316   6.632095 216.165.108.217 -> 72.247.238.10 TCP 66 38106 > http [ACK] Seq=339 Ack=4768 Win=23296 Len=0 TSval=43033524 TSecr=3114191553  tcp.stream == 7
317   6.632099 72.247.238.10 -> 216.165.108.217 TCP 74 http > 38107 [SYN, ACK] Seq=0 Ack=1 Win=14480 Len=0 MSS=1460 SACK_PERM=1 TSval=3114191554 TSecr=43033524 WS=4  tcp.stream == 8
318   6.632107 216.165.108.217 -> 72.247.238.10 TCP 66 38107 > http [ACK] Seq=1 Ack=1 Win=14720 Len=0 TSval=43033524 TSecr=3114191554  tcp.stream == 8
319   6.632109 72.247.238.10 -> 216.165.108.217 TCP 74 http > 38108 [SYN, ACK] Seq=0 Ack=1 Win=14480 Len=0 MSS=1460 SACK_PERM=1 TSval=3114191554 TSecr=43033524 WS=4  tcp.stream == 9
320   6.632114 216.165.108.217 -> 72.247.238.10 TCP 66 38108 > http [ACK] Seq=1 Ack=1 Win=14720 Len=0 TSval=43033524 TSecr=3114191554  tcp.stream == 9
321   6.632116 72.247.238.10 -> 216.165.108.217 TCP 74 http > 38109 [SYN, ACK] Seq=0 Ack=1 Win=14480 Len=0 MSS=1460 SACK_PERM=1 TSval=3114191554 TSecr=43033524 WS=4  tcp.stream == 10
322   6.632120 216.165.108.217 -> 72.247.238.10 TCP 66 38109 > http [ACK] Seq=1 Ack=1 Win=14720 Len=0 TSval=43033524 TSecr=3114191554  tcp.stream == 10
323   6.632189 216.165.108.217 -> 72.247.238.10 HTTP 406 GET /images/I/411H%2B731ZzL._SL135_.jpg HTTP/1.1   tcp.stream == 7
324   6.632212 216.165.108.217 -> 72.247.238.10 HTTP 404 GET /images/I/417j8GAjnyL._SL135_.jpg HTTP/1.1   tcp.stream == 8
325   6.632227 216.165.108.217 -> 72.247.238.10 HTTP 404 GET /images/I/51pjVr4h51L._SL135_.jpg HTTP/1.1   tcp.stream == 9
326   6.633030  72.21.194.1 -> 216.165.108.217 TCP 1817 [TCP segment of a reassembled PDU]  tcp.stream == 1
327   6.633082 216.165.108.217 -> 72.21.194.1  TCP 54 52433 > http [ACK] Seq=297 Ack=26154 Win=64128 Len=0  tcp.stream == 1
328   6.633829  72.21.194.1 -> 216.165.108.217 TCP 1843 [TCP segment of a reassembled PDU]  tcp.stream == 1
329   6.633842 72.247.238.10 -> 216.165.108.217 TCP 66 http > 38107 [ACK] Seq=1 Ack=339 Win=15552 Len=0 TSval=3114191556 TSecr=43033524  tcp.stream == 8
330   6.633849 72.247.238.10 -> 216.165.108.217 TCP 66 http > 38108 [ACK] Seq=1 Ack=339 Win=15552 Len=0 TSval=3114191556 TSecr=43033524  tcp.stream == 9
331   6.633888 216.165.108.217 -> 72.21.194.1  TCP 54 52433 > http [ACK] Seq=297 Ack=27943 Win=64128 Len=0  tcp.stream == 1
332   6.634053 72.247.238.10 -> 216.165.108.217 TCP 1514 [TCP segment of a reassembled PDU]  tcp.stream == 7
333   6.634153 72.247.238.10 -> 216.165.108.217 HTTP 1314 HTTP/1.1 200 OK  (JPEG JFIF image)  tcp.stream == 7
334   6.634159 216.165.108.217 -> 72.247.238.10 TCP 66 38106 > http [ACK] Seq=679 Ack=7464 Win=29184 Len=0 TSval=43033525 TSecr=3114191556  tcp.stream == 7
335   6.634284 72.247.238.10 -> 216.165.108.217 TCP 1514 [TCP segment of a reassembled PDU]  tcp.stream == 8
336   6.634291 216.165.108.217 -> 72.247.238.10 TCP 66 38107 > http [ACK] Seq=339 Ack=1449 Win=17536 Len=0 TSval=43033525 TSecr=3114191556  tcp.stream == 8
337   6.634394 72.247.238.10 -> 216.165.108.217 HTTP 1408 HTTP/1.1 200 OK  (JPEG JFIF image)  tcp.stream == 8
338   6.634399 216.165.108.217 -> 72.247.238.10 TCP 66 38107 > http [ACK] Seq=339 Ack=2791 Win=20480 Len=0 TSval=43033525 TSecr=3114191556  tcp.stream == 8
339   6.634529 72.247.238.10 -> 216.165.108.217 TCP 1514 [TCP segment of a reassembled PDU]  tcp.stream == 9
340   6.634535 216.165.108.217 -> 72.247.238.10 TCP 66 38108 > http [ACK] Seq=339 Ack=1449 Win=17536 Len=0 TSval=43033525 TSecr=3114191556  tcp.stream == 9
341   6.634652 72.247.238.10 -> 216.165.108.217 TCP 1514 [TCP segment of a reassembled PDU]  tcp.stream == 9
342   6.634658 216.165.108.217 -> 72.247.238.10 TCP 66 38108 > http [ACK] Seq=339 Ack=2897 Win=20480 Len=0 TSval=43033525 TSecr=3114191556  tcp.stream == 9
343   6.634775 72.247.238.10 -> 216.165.108.217 TCP 1514 [TCP segment of a reassembled PDU]  tcp.stream == 9
344   6.634780 216.165.108.217 -> 72.247.238.10 TCP 66 38108 > http [ACK] Seq=339 Ack=4345 Win=23296 Len=0 TSval=43033525 TSecr=3114191556  tcp.stream == 9
345   6.634831 72.247.238.10 -> 216.165.108.217 HTTP 1181 HTTP/1.1 200 OK  (JPEG JFIF image)  tcp.stream == 9
346   6.634835 216.165.108.217 -> 72.247.238.10 TCP 66 38108 > http [ACK] Seq=339 Ack=5460 Win=26240 Len=0 TSval=43033525 TSecr=3114191556  tcp.stream == 9
347   6.634997  72.21.194.1 -> 216.165.108.217 TCP 2042 [TCP segment of a reassembled PDU]  tcp.stream == 1
348   6.635020 216.165.108.217 -> 72.21.194.1  TCP 54 52433 > http [ACK] Seq=297 Ack=29931 Win=64128 Len=0  tcp.stream == 1
349   6.635153  72.21.194.1 -> 216.165.108.217 HTTP 1405 HTTP/1.1 200 OK  (text/html)  tcp.stream == 6
350   6.635159 216.165.108.217 -> 72.21.194.1  TCP 54 52438 > http [ACK] Seq=446 Ack=1352 Win=17408 Len=0  tcp.stream == 6
351   6.635671  72.21.194.1 -> 216.165.108.217 TCP 1514 [TCP segment of a reassembled PDU]  tcp.stream == 1
352   6.635682  72.21.194.1 -> 216.165.108.217 TCP 60 [TCP segment of a reassembled PDU]  tcp.stream == 1
353   6.635685  72.21.194.1 -> 216.165.108.217 TCP 485 [TCP segment of a reassembled PDU]  tcp.stream == 1
354   6.635737 216.165.108.217 -> 72.21.194.1  TCP 54 52433 > http [ACK] Seq=297 Ack=31824 Win=64128 Len=0  tcp.stream == 1
355   6.636304 216.165.108.217 -> 72.247.238.10 HTTP 404 GET /images/I/51kvx0BXUnL._SL135_.jpg HTTP/1.1   tcp.stream == 9
356   6.636335 216.165.108.217 -> 72.247.238.10 HTTP 404 GET /images/I/51z2jbIGTCL._SL135_.jpg HTTP/1.1   tcp.stream == 7
357   6.636353 216.165.108.217 -> 72.247.238.24 HTTP 433 GET /images/G/01/electronics/detail-page/asus-2._V189604747_.gif HTTP/1.1   tcp.stream == 2
358   6.636369 216.165.108.217 -> 72.247.238.24 HTTP 431 GET /images/G/01/electronics/detail-page/dell._V189604740_.gif HTTP/1.1   tcp.stream == 3
359   6.637546  72.21.194.1 -> 216.165.108.217 TCP 1796 [TCP segment of a reassembled PDU]  tcp.stream == 1
360   6.637600 216.165.108.217 -> 72.21.194.1  TCP 54 52433 > http [ACK] Seq=297 Ack=33566 Win=64128 Len=0  tcp.stream == 1
361   6.637930 72.247.238.10 -> 216.165.108.217 TCP 1514 [TCP segment of a reassembled PDU]  tcp.stream == 9
362   6.638047 72.247.238.10 -> 216.165.108.217 TCP 1514 [TCP segment of a reassembled PDU]  tcp.stream == 9
363   6.638055 216.165.108.217 -> 72.247.238.10 TCP 66 38108 > http [ACK] Seq=677 Ack=8356 Win=32000 Len=0 TSval=43033526 TSecr=3114191560  tcp.stream == 9
364   6.638172 72.247.238.10 -> 216.165.108.217 TCP 1514 [TCP segment of a reassembled PDU]  tcp.stream == 9
365   6.638294 72.247.238.10 -> 216.165.108.217 TCP 1514 [TCP segment of a reassembled PDU]  tcp.stream == 9
366   6.638300 216.165.108.217 -> 72.247.238.10 TCP 66 38108 > http [ACK] Seq=677 Ack=11252 Win=37888 Len=0 TSval=43033526 TSecr=3114191560  tcp.stream == 9
367   6.638417 72.247.238.10 -> 216.165.108.217 HTTP 275 HTTP/1.1 200 OK  (JPEG JFIF image)  tcp.stream == 9
368   6.638423 72.247.238.24 -> 216.165.108.217 TCP 1514 [TCP segment of a reassembled PDU]  tcp.stream == 2
369   6.638432 216.165.108.217 -> 72.247.238.24 TCP 66 37119 > http [ACK] Seq=1140 Ack=58975 Win=64128 Len=0 TSval=43033526 TSecr=2090510551  tcp.stream == 2
370   6.638564 72.247.238.24 -> 216.165.108.217 TCP 1514 [TCP segment of a reassembled PDU]  tcp.stream == 2
