  8   1.289444 115.239.199.240 -> 216.165.108.217 TCP 241 [TCP segment of a reassembled PDU]  tcp.stream == 0
  9   1.289461 216.165.108.217 -> 115.239.199.240 TCP 54 39613 > http [RST] Seq=1 Win=0 Len=0  tcp.stream == 0
 46   6.402732 216.165.108.217 -> 121.14.24.241 TCP 74 57587 > http [SYN] Seq=0 Win=14600 Len=0 MSS=1460 SACK_PERM=1 TSval=43088064 TSecr=0 WS=128  tcp.stream == 1
 50   6.653570 216.165.108.217 -> 115.238.23.241 TCP 74 48413 > http [SYN] Seq=0 Win=14600 Len=0 MSS=1460 SACK_PERM=1 TSval=43088127 TSecr=0 WS=128  tcp.stream == 2
 54   6.933623 115.238.23.241 -> 216.165.108.217 TCP 66 http > 48413 [SYN, ACK] Seq=0 Ack=1 Win=5840 Len=0 MSS=1460 SACK_PERM=1 WS=512  tcp.stream == 2
 55   6.933650 216.165.108.217 -> 115.238.23.241 TCP 54 48413 > http [ACK] Seq=1 Ack=1 Win=14720 Len=0  tcp.stream == 2
 56   6.933727 216.165.108.217 -> 115.238.23.241 HTTP 346 GET / HTTP/1.1   tcp.stream == 2
 58   7.047882 121.14.24.241 -> 216.165.108.217 TCP 66 http > 57587 [SYN, ACK] Seq=0 Ack=1 Win=5840 Len=0 MSS=1460 SACK_PERM=1 WS=512  tcp.stream == 1
 59   7.047906 216.165.108.217 -> 121.14.24.241 TCP 54 57587 > http [ACK] Seq=1 Ack=1 Win=14720 Len=0  tcp.stream == 1
 61   7.216868 115.238.23.241 -> 216.165.108.217 TCP 60 http > 48413 [ACK] Seq=1 Ack=293 Win=7168 Len=0  tcp.stream == 2
 62   7.216975 115.238.23.241 -> 216.165.108.217 HTTP 564 HTTP/1.1 302 Found  (text/html)  tcp.stream == 2
 63   7.216985 216.165.108.217 -> 115.238.23.241 TCP 54 48413 > http [ACK] Seq=293 Ack=511 Win=15744 Len=0  tcp.stream == 2
 68   7.318064 216.165.108.217 -> 119.167.201.241 TCP 74 34758 > http [SYN] Seq=0 Win=14600 Len=0 MSS=1460 SACK_PERM=1 TSval=43088293 TSecr=0 WS=128  tcp.stream == 3
 72   7.568413 216.165.108.217 -> 119.167.201.241 TCP 74 34759 > http [SYN] Seq=0 Win=14600 Len=0 MSS=1460 SACK_PERM=1 TSval=43088356 TSecr=0 WS=128  tcp.stream == 4
 75   7.691946 119.167.201.241 -> 216.165.108.217 TCP 60 http > 34758 [SYN, ACK] Seq=0 Ack=1 Win=5840 Len=0 MSS=1460  tcp.stream == 3
 76   7.691969 216.165.108.217 -> 119.167.201.241 TCP 54 34758 > http [ACK] Seq=1 Ack=1 Win=14600 Len=0  tcp.stream == 3
 77   7.692038 216.165.108.217 -> 119.167.201.241 HTTP 350 GET / HTTP/1.1   tcp.stream == 3
 79   7.942249 119.167.201.241 -> 216.165.108.217 TCP 60 http > 34759 [SYN, ACK] Seq=0 Ack=1 Win=5840 Len=0 MSS=1460  tcp.stream == 4
 80   7.942273 216.165.108.217 -> 119.167.201.241 TCP 54 34759 > http [ACK] Seq=1 Ack=1 Win=14600 Len=0  tcp.stream == 4
 82   8.063672 119.167.201.241 -> 216.165.108.217 TCP 60 http > 34758 [ACK] Seq=1 Ack=297 Win=6432 Len=0  tcp.stream == 3
 83   8.063705 119.167.201.241 -> 216.165.108.217 HTTP 510 HTTP/1.1 302 Found  (text/html)  tcp.stream == 3
 84   8.063712 216.165.108.217 -> 119.167.201.241 TCP 54 34758 > http [ACK] Seq=297 Ack=457 Win=15544 Len=0  tcp.stream == 3
 85   8.065839 216.165.108.217 -> 119.167.201.241 HTTP 366 GET /index_global.php HTTP/1.1   tcp.stream == 3
 89   8.437762 119.167.201.241 -> 216.165.108.217 TCP 1514 [TCP segment of a reassembled PDU]  tcp.stream == 3
 90   8.437850 119.167.201.241 -> 216.165.108.217 TCP 1514 [TCP segment of a reassembled PDU]  tcp.stream == 3
 91   8.437859 216.165.108.217 -> 119.167.201.241 TCP 54 34758 > http [ACK] Seq=609 Ack=3377 Win=20440 Len=0  tcp.stream == 3
 92   8.437982 119.167.201.241 -> 216.165.108.217 TCP 1514 [TCP segment of a reassembled PDU]  tcp.stream == 3
 93   8.438074 119.167.201.241 -> 216.165.108.217 TCP 1514 [TCP segment of a reassembled PDU]  tcp.stream == 3
 94   8.438079 216.165.108.217 -> 119.167.201.241 TCP 54 34758 > http [ACK] Seq=609 Ack=6297 Win=26280 Len=0  tcp.stream == 3
103   8.456874 216.165.108.217 -> 119.167.201.251 TCP 74 46364 > http [SYN] Seq=0 Win=14600 Len=0 MSS=1460 SACK_PERM=1 TSval=43088578 TSecr=0 WS=128  tcp.stream == 5
104   8.456912 216.165.108.217 -> 119.167.201.251 TCP 74 46365 > http [SYN] Seq=0 Win=14600 Len=0 MSS=1460 SACK_PERM=1 TSval=43088578 TSecr=0 WS=128  tcp.stream == 6
105   8.456974 216.165.108.217 -> 119.167.201.251 TCP 74 46366 > http [SYN] Seq=0 Win=14600 Len=0 MSS=1460 SACK_PERM=1 TSval=43088578 TSecr=0 WS=128  tcp.stream == 7
106   8.457022 216.165.108.217 -> 110.75.24.10 TCP 74 38106 > http [SYN] Seq=0 Win=14600 Len=0 MSS=1460 SACK_PERM=1 TSval=43088578 TSecr=0 WS=128  tcp.stream == 8
107   8.457045 216.165.108.217 -> 115.239.199.240 TCP 74 39685 > http [SYN] Seq=0 Win=14600 Len=0 MSS=1460 SACK_PERM=1 TSval=43088578 TSecr=0 WS=128  tcp.stream == 9
109   8.704825 115.239.199.240 -> 216.165.108.217 TCP 66 http > 39685 [SYN, ACK] Seq=0 Ack=1 Win=5840 Len=0 MSS=1460 SACK_PERM=1 WS=512  tcp.stream == 9
110   8.704854 216.165.108.217 -> 115.239.199.240 TCP 54 39685 > http [ACK] Seq=1 Ack=1 Win=14720 Len=0  tcp.stream == 9
111   8.704941 216.165.108.217 -> 115.239.199.240 HTTP 410 GET /tps/i3/T1ogqgXfXeXXXXXXXX-168-42.png HTTP/1.1   tcp.stream == 9
114   8.707677 216.165.108.217 -> 119.167.201.251 TCP 74 46369 > http [SYN] Seq=0 Win=14600 Len=0 MSS=1460 SACK_PERM=1 TSval=43088640 TSecr=0 WS=128  tcp.stream == 10
115   8.707710 216.165.108.217 -> 119.167.201.251 TCP 74 46370 > http [SYN] Seq=0 Win=14600 Len=0 MSS=1460 SACK_PERM=1 TSval=43088640 TSecr=0 WS=128  tcp.stream == 11
117   8.707731 216.165.108.217 -> 119.167.201.251 TCP 74 46371 > http [SYN] Seq=0 Win=14600 Len=0 MSS=1460 SACK_PERM=1 TSval=43088640 TSecr=0 WS=128  tcp.stream == 12
119   8.708043 216.165.108.217 -> 110.75.24.10 TCP 74 38111 > http [SYN] Seq=0 Win=14600 Len=0 MSS=1460 SACK_PERM=1 TSval=43088641 TSecr=0 WS=128  tcp.stream == 13
120   8.723389 110.75.24.10 -> 216.165.108.217 TCP 60 http > 38106 [SYN, ACK] Seq=0 Ack=1 Win=14600 Len=0 MSS=1400  tcp.stream == 8
121   8.723415 216.165.108.217 -> 110.75.24.10 TCP 54 38106 > http [ACK] Seq=1 Ack=1 Win=14600 Len=0  tcp.stream == 8
122   8.723508 216.165.108.217 -> 110.75.24.10 HTTP 348 GET /tbk_inf.js HTTP/1.1   tcp.stream == 8
124   8.792286 119.167.201.241 -> 216.165.108.217 TCP 1514 [TCP segment of a reassembled PDU]  tcp.stream == 3
125   8.792380 119.167.201.241 -> 216.165.108.217 TCP 1514 [TCP segment of a reassembled PDU]  tcp.stream == 3
126   8.792389 216.165.108.217 -> 119.167.201.241 TCP 54 34758 > http [ACK] Seq=609 Ack=9217 Win=32120 Len=0  tcp.stream == 3
127   8.792492 119.167.201.241 -> 216.165.108.217 TCP 1514 [TCP segment of a reassembled PDU]  tcp.stream == 3
128   8.792614 119.167.201.241 -> 216.165.108.217 TCP 1514 [TCP segment of a reassembled PDU]  tcp.stream == 3
129   8.792618 216.165.108.217 -> 119.167.201.241 TCP 54 34758 > http [ACK] Seq=609 Ack=12137 Win=37960 Len=0  tcp.stream == 3
130   8.792736 119.167.201.241 -> 216.165.108.217 TCP 1514 [TCP segment of a reassembled PDU]  tcp.stream == 3
139   8.798505 216.165.108.217 -> 58.218.213.240 TCP 74 48577 > http [SYN] Seq=0 Win=14600 Len=0 MSS=1460 SACK_PERM=1 TSval=43088663 TSecr=0 WS=128  tcp.stream == 14
140   8.798668 216.165.108.217 -> 115.239.199.240 TCP 74 39691 > http [SYN] Seq=0 Win=14600 Len=0 MSS=1460 SACK_PERM=1 TSval=43088663 TSecr=0 WS=128  tcp.stream == 15
141   8.798719 216.165.108.217 -> 220.181.151.240 TCP 74 42784 > http [SYN] Seq=0 Win=14600 Len=0 MSS=1460 SACK_PERM=1 TSval=43088663 TSecr=0 WS=128  tcp.stream == 16
146   8.807364 216.165.108.217 -> 58.218.213.240 TCP 74 48580 > http [SYN] Seq=0 Win=14600 Len=0 MSS=1460 SACK_PERM=1 TSval=43088665 TSecr=0 WS=128  tcp.stream == 17
147   8.807464 216.165.108.217 -> 58.218.213.240 TCP 74 48581 > http [SYN] Seq=0 Win=14600 Len=0 MSS=1460 SACK_PERM=1 TSval=43088665 TSecr=0 WS=128  tcp.stream == 18
148   8.807547 216.165.108.217 -> 220.181.151.240 TCP 74 42787 > http [SYN] Seq=0 Win=14600 Len=0 MSS=1460 SACK_PERM=1 TSval=43088665 TSecr=0 WS=128  tcp.stream == 19
149   8.807643 216.165.108.217 -> 220.181.151.240 TCP 74 42788 > http [SYN] Seq=0 Win=14600 Len=0 MSS=1460 SACK_PERM=1 TSval=43088665 TSecr=0 WS=128  tcp.stream == 20
150   8.807670 216.165.108.217 -> 117.25.148.240 TCP 74 51029 > http [SYN] Seq=0 Win=14600 Len=0 MSS=1460 SACK_PERM=1 TSval=43088665 TSecr=0 WS=128  tcp.stream == 21
151   8.807701 216.165.108.217 -> 115.239.199.240 TCP 74 39698 > http [SYN] Seq=0 Win=14600 Len=0 MSS=1460 SACK_PERM=1 TSval=43088665 TSecr=0 WS=128  tcp.stream == 22
152   8.807730 216.165.108.217 -> 117.25.148.240 TCP 74 51031 > http [SYN] Seq=0 Win=14600 Len=0 MSS=1460 SACK_PERM=1 TSval=43088665 TSecr=0 WS=128  tcp.stream == 23
153   8.807763 216.165.108.217 -> 58.218.213.240 TCP 74 48587 > http [SYN] Seq=0 Win=14600 Len=0 MSS=1460 SACK_PERM=1 TSval=43088665 TSecr=0 WS=128  tcp.stream == 24
154   8.831923 216.165.108.217 -> 119.167.201.241 TCP 54 34758 > http [ACK] Seq=609 Ack=13597 Win=40880 Len=0  tcp.stream == 3
155   8.833202 119.167.201.251 -> 216.165.108.217 TCP 60 http > 46364 [SYN, ACK] Seq=0 Ack=1 Win=5840 Len=0 MSS=1460  tcp.stream == 5
156   8.833230 216.165.108.217 -> 119.167.201.251 TCP 54 46364 > http [ACK] Seq=1 Ack=1 Win=14600 Len=0  tcp.stream == 5
157   8.833237 119.167.201.251 -> 216.165.108.217 TCP 66 http > 46366 [SYN, ACK] Seq=0 Ack=1 Win=5840 Len=0 MSS=1460 SACK_PERM=1 WS=512  tcp.stream == 7
158   8.833243 216.165.108.217 -> 119.167.201.251 TCP 54 46366 > http [ACK] Seq=1 Ack=1 Win=14720 Len=0  tcp.stream == 7
159   8.833342 216.165.108.217 -> 119.167.201.251 HTTP 402 GET /??p/global/1.0/global-min.css?t=2012011120110301.css HTTP/1.1   tcp.stream == 5
160   8.833360 216.165.108.217 -> 119.167.201.251 HTTP 412 GET /??s/kissy/1.1.6/kissy-min.js,p/global/1.0/global-min.js?t=2012011120110301.js HTTP/1.1   tcp.stream == 7
161   8.833532 119.167.201.251 -> 216.165.108.217 TCP 60 http > 46365 [SYN, ACK] Seq=0 Ack=1 Win=5840 Len=0 MSS=1460  tcp.stream == 6
162   8.833545 216.165.108.217 -> 119.167.201.251 TCP 54 46365 > http [ACK] Seq=1 Ack=1 Win=14600 Len=0  tcp.stream == 6
163   8.833589 216.165.108.217 -> 119.167.201.251 HTTP 783 GET /p/fp/2011hk/??html5-reset.css,global.css,header/header.css,attraction/attraction.css,bottom-gg/bottom-gg.css,category/category.css,category-sub-recom/category-sub-recom.css,footer/footer.css,header/header.css,header/header-logo-info.css,help/help.css,most-popular/most-popular.css,pavilion/pavilion.css,sell-top/sell-top.css,site-nav/site-nav.css,sub-promotion/sub-promotion.css,top10/top10.css,subfooter/subfooter.css?t=20111110.css HTTP/1.1   tcp.stream == 6
164   8.952624 115.239.199.240 -> 216.165.108.217 TCP 344 [TCP segment of a reassembled PDU]  tcp.stream == 9
165   8.952648 216.165.108.217 -> 115.239.199.240 TCP 54 39685 > http [ACK] Seq=357 Ack=291 Win=15744 Len=0  tcp.stream == 9
166   8.952850 115.239.199.240 -> 216.165.108.217 HTTP 1500 HTTP/1.1 200 OK  (PNG)  tcp.stream == 9
167   8.952858 216.165.108.217 -> 115.239.199.240 TCP 54 39685 > http [ACK] Seq=357 Ack=1737 Win=18688 Len=0  tcp.stream == 9
168   8.952938 216.165.108.217 -> 115.239.199.240 HTTP 408 GET /tps/i3/T1gq9zXlXGXXXXXXXX-15-8.png HTTP/1.1   tcp.stream == 9
170   8.970600 110.75.24.10 -> 216.165.108.217 TCP 60 http > 38111 [SYN, ACK] Seq=0 Ack=1 Win=14600 Len=0 MSS=1400  tcp.stream == 13
171   8.970625 216.165.108.217 -> 110.75.24.10 TCP 54 38111 > http [ACK] Seq=1 Ack=1 Win=14600 Len=0  tcp.stream == 13
172   8.990082 110.75.24.10 -> 216.165.108.217 TCP 60 http > 38106 [ACK] Seq=1 Ack=295 Win=6432 Len=0  tcp.stream == 8
173   8.990480 110.75.24.10 -> 216.165.108.217 HTTP 2023 HTTP/1.1 200 OK  (application/x-javascript)  tcp.stream == 8
174   8.990488 216.165.108.217 -> 110.75.24.10 TCP 54 38106 > http [ACK] Seq=295 Ack=1970 Win=16560 Len=0  tcp.stream == 8
175   8.990493 110.75.24.10 -> 216.165.108.217 TCP 60 http > 38106 [FIN, ACK] Seq=1970 Ack=295 Win=6432 Len=0  tcp.stream == 8
176   8.990670 216.165.108.217 -> 110.75.24.10 TCP 54 38106 > http [FIN, ACK] Seq=295 Ack=1971 Win=16560 Len=0  tcp.stream == 8
177   9.046138 115.239.199.240 -> 216.165.108.217 TCP 66 http > 39698 [SYN, ACK] Seq=0 Ack=1 Win=5840 Len=0 MSS=1460 SACK_PERM=1 WS=512  tcp.stream == 22
178   9.046161 216.165.108.217 -> 115.239.199.240 TCP 54 39698 > http [ACK] Seq=1 Ack=1 Win=14720 Len=0  tcp.stream == 22
179   9.046270 216.165.108.217 -> 115.239.199.240 HTTP 411 GET /tps/i3/T1i2WwXehjXXXXXXXX-110-135.png HTTP/1.1   tcp.stream == 22
180   9.047514 115.239.199.240 -> 216.165.108.217 TCP 66 http > 39691 [SYN, ACK] Seq=0 Ack=1 Win=5840 Len=0 MSS=1460 SACK_PERM=1 WS=512  tcp.stream == 15
181   9.047541 216.165.108.217 -> 115.239.199.240 TCP 54 39691 > http [ACK] Seq=1 Ack=1 Win=14720 Len=0  tcp.stream == 15
190   9.049703 216.165.108.217 -> 58.218.213.250 TCP 74 44904 > http [SYN] Seq=0 Win=14600 Len=0 MSS=1460 SACK_PERM=1 TSval=43088726 TSecr=0 WS=128  tcp.stream == 25
191   9.049761 216.165.108.217 -> 58.218.213.240 TCP 74 48589 > http [SYN] Seq=0 Win=14600 Len=0 MSS=1460 SACK_PERM=1 TSval=43088726 TSecr=0 WS=128  tcp.stream == 26
192   9.056975 216.165.108.217 -> 58.218.213.250 TCP 74 44906 > http [SYN] Seq=0 Win=14600 Len=0 MSS=1460 SACK_PERM=1 TSval=43088728 TSecr=0 WS=128  tcp.stream == 27
194   9.058313 216.165.108.217 -> 58.218.213.250 TCP 74 44907 > http [SYN] Seq=0 Win=14600 Len=0 MSS=1460 SACK_PERM=1 TSval=43088728 TSecr=0 WS=128  tcp.stream == 28
195   9.058340 216.165.108.217 -> 58.218.213.240 TCP 74 48592 > http [SYN] Seq=0 Win=14600 Len=0 MSS=1460 SACK_PERM=1 TSval=43088728 TSecr=0 WS=128  tcp.stream == 29
196   9.058366 216.165.108.217 -> 58.218.213.240 TCP 74 48593 > http [SYN] Seq=0 Win=14600 Len=0 MSS=1460 SACK_PERM=1 TSval=43088728 TSecr=0 WS=128  tcp.stream == 30
197   9.058389 216.165.108.217 -> 58.218.213.250 TCP 74 44910 > http [SYN] Seq=0 Win=14600 Len=0 MSS=1460 SACK_PERM=1 TSval=43088728 TSecr=0 WS=128  tcp.stream == 31
201   9.058921 216.165.108.217 -> 220.181.151.240 TCP 74 42800 > http [SYN] Seq=0 Win=14600 Len=0 MSS=1460 SACK_PERM=1 TSval=43088728 TSecr=0 WS=128  tcp.stream == 32
202   9.058956 216.165.108.217 -> 220.181.151.240 TCP 74 42801 > http [SYN] Seq=0 Win=14600 Len=0 MSS=1460 SACK_PERM=1 TSval=43088728 TSecr=0 WS=128  tcp.stream == 33
203   9.075303 119.167.201.251 -> 216.165.108.217 TCP 60 http > 46369 [SYN, ACK] Seq=0 Ack=1 Win=5840 Len=0 MSS=1460  tcp.stream == 10
204   9.075330 216.165.108.217 -> 119.167.201.251 TCP 54 46369 > http [ACK] Seq=1 Ack=1 Win=14600 Len=0  tcp.stream == 10
205   9.075336 119.167.201.251 -> 216.165.108.217 TCP 60 http > 46371 [SYN, ACK] Seq=0 Ack=1 Win=5840 Len=0 MSS=1460  tcp.stream == 12
206   9.075342 216.165.108.217 -> 119.167.201.251 TCP 54 46371 > http [ACK] Seq=1 Ack=1 Win=14600 Len=0  tcp.stream == 12
207   9.075462 119.167.201.251 -> 216.165.108.217 TCP 60 http > 46370 [SYN, ACK] Seq=0 Ack=1 Win=5840 Len=0 MSS=1460  tcp.stream == 11
208   9.075470 216.165.108.217 -> 119.167.201.251 TCP 54 46370 > http [ACK] Seq=1 Ack=1 Win=14600 Len=0  tcp.stream == 11
209   9.100016 58.218.213.240 -> 216.165.108.217 TCP 66 http > 48577 [SYN, ACK] Seq=0 Ack=1 Win=5840 Len=0 MSS=1460 SACK_PERM=1 WS=512  tcp.stream == 14
210   9.100039 216.165.108.217 -> 58.218.213.240 TCP 54 48577 > http [ACK] Seq=1 Ack=1 Win=14720 Len=0  tcp.stream == 14
211   9.100123 216.165.108.217 -> 58.218.213.240 HTTP 409 GET /tps/i2/T18L9zXoVuXXXXXXXX-21-16.gif HTTP/1.1   tcp.stream == 14
212   9.111203 58.218.213.240 -> 216.165.108.217 TCP 66 http > 48581 [SYN, ACK] Seq=0 Ack=1 Win=5840 Len=0 MSS=1460 SACK_PERM=1 WS=512  tcp.stream == 18
213   9.111228 216.165.108.217 -> 58.218.213.240 TCP 54 48581 > http [ACK] Seq=1 Ack=1 Win=14720 Len=0  tcp.stream == 18
214   9.111319 216.165.108.217 -> 58.218.213.240 HTTP 411 GET /tps/i2/T1GP1RXgByXXXXXXXX-490-170.jpg HTTP/1.1   tcp.stream == 18
215   9.113665 58.218.213.240 -> 216.165.108.217 TCP 66 http > 48580 [SYN, ACK] Seq=0 Ack=1 Win=5840 Len=0 MSS=1460 SACK_PERM=1 WS=512  tcp.stream == 17
216   9.113689 216.165.108.217 -> 58.218.213.240 TCP 54 48580 > http [ACK] Seq=1 Ack=1 Win=14720 Len=0  tcp.stream == 17
217   9.113765 216.165.108.217 -> 58.218.213.240 HTTP 411 GET /tps/i2/T1WLaRXgRpXXXXXXXX-490-170.jpg HTTP/1.1   tcp.stream == 17
218   9.114525 58.218.213.240 -> 216.165.108.217 TCP 66 http > 48587 [SYN, ACK] Seq=0 Ack=1 Win=5840 Len=0 MSS=1460 SACK_PERM=1 WS=512  tcp.stream == 24
219   9.114551 216.165.108.217 -> 58.218.213.240 TCP 54 48587 > http [ACK] Seq=1 Ack=1 Win=14720 Len=0  tcp.stream == 24
220   9.114653 216.165.108.217 -> 58.218.213.240 HTTP 411 GET /tps/i2/T1VrGSXa8pXXXXXXXX-110-135.png HTTP/1.1   tcp.stream == 24
222   9.155884 220.181.151.240 -> 216.165.108.217 TCP 66 http > 42787 [SYN, ACK] Seq=0 Ack=1 Win=5840 Len=0 MSS=1460 SACK_PERM=1 WS=512  tcp.stream == 19
223   9.155939 216.165.108.217 -> 220.181.151.240 TCP 54 42787 > http [ACK] Seq=1 Ack=1 Win=14720 Len=0  tcp.stream == 19
224   9.156120 216.165.108.217 -> 220.181.151.240 HTTP 411 GET /tps/i1/T1p_yRXflfXXXXXXXX-440-135.jpg HTTP/1.1   tcp.stream == 19
225   9.159586 119.167.201.241 -> 216.165.108.217 TCP 1514 [TCP segment of a reassembled PDU]  tcp.stream == 3
226   9.159606 216.165.108.217 -> 119.167.201.241 TCP 54 34758 > http [ACK] Seq=609 Ack=15057 Win=43800 Len=0  tcp.stream == 3
227   9.159705 119.167.201.241 -> 216.165.108.217 TCP 1514 [TCP segment of a reassembled PDU]  tcp.stream == 3
228   9.159710 216.165.108.217 -> 119.167.201.241 TCP 54 34758 > http [ACK] Seq=609 Ack=16517 Win=46720 Len=0  tcp.stream == 3
229   9.159827 119.167.201.241 -> 216.165.108.217 TCP 1514 [TCP segment of a reassembled PDU]  tcp.stream == 3
230   9.159833 216.165.108.217 -> 119.167.201.241 TCP 54 34758 > http [ACK] Seq=609 Ack=17977 Win=49640 Len=0  tcp.stream == 3
231   9.159949 220.181.151.240 -> 216.165.108.217 TCP 66 http > 42784 [SYN, ACK] Seq=0 Ack=1 Win=5840 Len=0 MSS=1460 SACK_PERM=1 WS=512  tcp.stream == 16
232   9.159961 216.165.108.217 -> 220.181.151.240 TCP 54 42784 > http [ACK] Seq=1 Ack=1 Win=14720 Len=0  tcp.stream == 16
233   9.159974 119.167.201.241 -> 216.165.108.217 TCP 1514 [TCP segment of a reassembled PDU]  tcp.stream == 3
234   9.159978 216.165.108.217 -> 119.167.201.241 TCP 54 34758 > http [ACK] Seq=609 Ack=19437 Win=52560 Len=0  tcp.stream == 3
235   9.160054 216.165.108.217 -> 220.181.151.240 HTTP 409 GET /tps/i1/T1bfGRXgXsXXXXXXXX-70-40.gif HTTP/1.1   tcp.stream == 16
236   9.160588 119.167.201.241 -> 216.165.108.217 TCP 1514 [TCP segment of a reassembled PDU]  tcp.stream == 3
237   9.160603 216.165.108.217 -> 119.167.201.241 TCP 54 34758 > http [ACK] Seq=609 Ack=20897 Win=55480 Len=0  tcp.stream == 3
238   9.169206 220.181.151.240 -> 216.165.108.217 TCP 66 http > 42788 [SYN, ACK] Seq=0 Ack=1 Win=5840 Len=0 MSS=1460 SACK_PERM=1 WS=512  tcp.stream == 20
239   9.169231 216.165.108.217 -> 220.181.151.240 TCP 54 42788 > http [ACK] Seq=1 Ack=1 Win=14720 Len=0  tcp.stream == 20
240   9.169376 216.165.108.217 -> 220.181.151.240 HTTP 411 GET /tps/i1/T1rZiwXgtfXXXXXXXX-110-135.png HTTP/1.1   tcp.stream == 20
241   9.196165 216.165.108.217 -> 115.239.199.240 HTTP 411 GET /tps/i3/T1WemSXcBhXXXXXXXX-110-135.png HTTP/1.1   tcp.stream == 15
242   9.196329 216.165.108.217 -> 115.239.199.240 TCP 74 39710 > http [SYN] Seq=0 Win=14600 Len=0 MSS=1460 SACK_PERM=1 TSval=43088763 TSecr=0 WS=128  tcp.stream == 34
243   9.196500 216.165.108.217 -> 115.239.199.240 TCP 74 39711 > http [SYN] Seq=0 Win=14600 Len=0 MSS=1460 SACK_PERM=1 TSval=43088763 TSecr=0 WS=128  tcp.stream == 35
244   9.196591 216.165.108.217 -> 115.239.199.240 TCP 74 39712 > http [SYN] Seq=0 Win=14600 Len=0 MSS=1460 SACK_PERM=1 TSval=43088763 TSecr=0 WS=128  tcp.stream == 36
245   9.196682 216.165.108.217 -> 117.25.148.240 TCP 74 51045 > http [SYN] Seq=0 Win=14600 Len=0 MSS=1460 SACK_PERM=1 TSval=43088763 TSecr=0 WS=128  tcp.stream == 37
246   9.196911 216.165.108.217 -> 117.25.148.240 TCP 74 51046 > http [SYN] Seq=0 Win=14600 Len=0 MSS=1460 SACK_PERM=1 TSval=43088763 TSecr=0 WS=128  tcp.stream == 38
247   9.197018 216.165.108.217 -> 117.25.148.240 TCP 74 51047 > http [SYN] Seq=0 Win=14600 Len=0 MSS=1460 SACK_PERM=1 TSval=43088763 TSecr=0 WS=128  tcp.stream == 39
248   9.197108 216.165.108.217 -> 117.25.148.240 TCP 74 51048 > http [SYN] Seq=0 Win=14600 Len=0 MSS=1460 SACK_PERM=1 TSval=43088763 TSecr=0 WS=128  tcp.stream == 40
249   9.198010 115.239.199.240 -> 216.165.108.217 HTTP 511 HTTP/1.1 200 OK  (PNG)  tcp.stream == 9
250   9.198169 216.165.108.217 -> 115.239.199.240 HTTP 411 GET /tps/i3/T1BeuSXXJhXXXXXXXX-110-135.png HTTP/1.1   tcp.stream == 9
251   9.198627 119.167.201.251 -> 216.165.108.217 TCP 60 http > 46366 [ACK] Seq=1 Ack=359 Win=7168 Len=0  tcp.stream == 7
252   9.198643 119.167.201.251 -> 216.165.108.217 TCP 60 http > 46364 [ACK] Seq=1 Ack=349 Win=6432 Len=0  tcp.stream == 5
253   9.198648 119.167.201.251 -> 216.165.108.217 TCP 60 http > 46365 [ACK] Seq=1 Ack=730 Win=7290 Len=0  tcp.stream == 6
254   9.202888 119.167.201.241 -> 216.165.108.217 TCP 1514 [TCP segment of a reassembled PDU]  tcp.stream == 3
255   9.202906 216.165.108.217 -> 119.167.201.241 TCP 54 34758 > http [ACK] Seq=609 Ack=22357 Win=58400 Len=0  tcp.stream == 3
256   9.203007 119.167.201.241 -> 216.165.108.217 TCP 1514 [TCP segment of a reassembled PDU]  tcp.stream == 3
257   9.203012 216.165.108.217 -> 119.167.201.241 TCP 54 34758 > http [ACK] Seq=609 Ack=23817 Win=61320 Len=0  tcp.stream == 3
258   9.203121 119.167.201.241 -> 216.165.108.217 TCP 1514 [TCP segment of a reassembled PDU]  tcp.stream == 3
259   9.203127 216.165.108.217 -> 119.167.201.241 TCP 54 34758 > http [ACK] Seq=609 Ack=25277 Win=62780 Len=0  tcp.stream == 3
260   9.203259 119.167.201.241 -> 216.165.108.217 TCP 1514 [TCP segment of a reassembled PDU]  tcp.stream == 3
261   9.203263 216.165.108.217 -> 119.167.201.241 TCP 54 34758 > http [ACK] Seq=609 Ack=26737 Win=61320 Len=0  tcp.stream == 3
262   9.205747 119.167.201.251 -> 216.165.108.217 TCP 1514 [TCP segment of a reassembled PDU]  tcp.stream == 7
263   9.205761 216.165.108.217 -> 119.167.201.251 TCP 54 46366 > http [ACK] Seq=359 Ack=1461 Win=17536 Len=0  tcp.stream == 7
264   9.205863 119.167.201.251 -> 216.165.108.217 TCP 1514 [TCP segment of a reassembled PDU]  tcp.stream == 7
265   9.205870 216.165.108.217 -> 119.167.201.251 TCP 54 46366 > http [ACK] Seq=359 Ack=2921 Win=20480 Len=0  tcp.stream == 7
266   9.205987 119.167.201.251 -> 216.165.108.217 TCP 1514 [TCP segment of a reassembled PDU]  tcp.stream == 7
267   9.205995 216.165.108.217 -> 119.167.201.251 TCP 54 46366 > http [ACK] Seq=359 Ack=4381 Win=23424 Len=0  tcp.stream == 7
268   9.206504 119.167.201.251 -> 216.165.108.217 HTTP 962 [TCP Previous segment not captured] Continuation or non-HTTP traffic  tcp.stream == 5
269   9.206518 216.165.108.217 -> 119.167.201.251 TCP 54 [TCP Dup ACK 159#1] 46364 > http [ACK] Seq=349 Ack=1 Win=14600 Len=0  tcp.stream == 5
270   9.206637 119.167.201.251 -> 216.165.108.217 TCP 1514 [TCP Out-Of-Order] [TCP segment of a reassembled PDU]  tcp.stream == 5
271   9.206646 216.165.108.217 -> 119.167.201.251 TCP 54 46364 > http [ACK] Seq=349 Ack=1461 Win=17520 Len=0  tcp.stream == 5
272   9.206836 119.167.201.251 -> 216.165.108.217 TCP 1514 [TCP Out-Of-Order] [TCP segment of a reassembled PDU]  tcp.stream == 5
273   9.206846 216.165.108.217 -> 119.167.201.251 TCP 54 46364 > http [ACK] Seq=349 Ack=3829 Win=20440 Len=0  tcp.stream == 5
274   9.207446 119.167.201.251 -> 216.165.108.217 TCP 1514 [TCP segment of a reassembled PDU]  tcp.stream == 6
275   9.207460 216.165.108.217 -> 119.167.201.251 TCP 54 46365 > http [ACK] Seq=730 Ack=1461 Win=17520 Len=0  tcp.stream == 6
276   9.207640 119.167.201.251 -> 216.165.108.217 TCP 1514 [TCP segment of a reassembled PDU]  tcp.stream == 6
277   9.207647 216.165.108.217 -> 119.167.201.251 TCP 54 46365 > http [ACK] Seq=730 Ack=2921 Win=20440 Len=0  tcp.stream == 6
278   9.207761 119.167.201.251 -> 216.165.108.217 TCP 1514 [TCP segment of a reassembled PDU]  tcp.stream == 6
279   9.207766 216.165.108.217 -> 119.167.201.251 TCP 54 46365 > http [ACK] Seq=730 Ack=4381 Win=23360 Len=0  tcp.stream == 6
280   9.231252 117.25.148.240 -> 216.165.108.217 TCP 66 http > 51029 [SYN, ACK] Seq=0 Ack=1 Win=5840 Len=0 MSS=1460 SACK_PERM=1 WS=512  tcp.stream == 21
281   9.231274 216.165.108.217 -> 117.25.148.240 TCP 54 51029 > http [ACK] Seq=1 Ack=1 Win=14720 Len=0  tcp.stream == 21
282   9.231373 216.165.108.217 -> 117.25.148.240 HTTP 411 GET /tps/i4/T1hIqwXoldXXXXXXXX-110-135.png HTTP/1.1   tcp.stream == 21
283   9.231792 117.25.148.240 -> 216.165.108.217 TCP 66 http > 51031 [SYN, ACK] Seq=0 Ack=1 Win=5840 Len=0 MSS=1460 SACK_PERM=1 WS=512  tcp.stream == 23
284   9.231808 216.165.108.217 -> 117.25.148.240 TCP 54 51031 > http [ACK] Seq=1 Ack=1 Win=14720 Len=0  tcp.stream == 23
285   9.231891 216.165.108.217 -> 117.25.148.240 HTTP 428 GET /imgextra/i4/91106030/T2_ud7Xh4aXXXXXXXX_!!91106030.png HTTP/1.1   tcp.stream == 23
286   9.257156 110.75.24.10 -> 216.165.108.217 TCP 60 http > 38106 [ACK] Seq=1971 Ack=296 Win=6432 Len=0  tcp.stream == 8
287   9.290106 115.239.199.240 -> 216.165.108.217 TCP 1514 [TCP segment of a reassembled PDU]  tcp.stream == 22
288   9.290131 216.165.108.217 -> 115.239.199.240 TCP 54 39698 > http [ACK] Seq=358 Ack=1461 Win=17536 Len=0  tcp.stream == 22
289   9.290200 115.239.199.240 -> 216.165.108.217 TCP 1514 [TCP segment of a reassembled PDU]  tcp.stream == 22
290   9.290205 216.165.108.217 -> 115.239.199.240 TCP 54 39698 > http [ACK] Seq=358 Ack=2921 Win=20480 Len=0  tcp.stream == 22
291   9.290325 115.239.199.240 -> 216.165.108.217 TCP 1514 [TCP segment of a reassembled PDU]  tcp.stream == 22
292   9.290330 216.165.108.217 -> 115.239.199.240 TCP 54 39698 > http [ACK] Seq=358 Ack=4381 Win=23424 Len=0  tcp.stream == 22
293   9.290382 115.239.199.240 -> 216.165.108.217 HTTP 1042 HTTP/1.1 200 OK  (PNG)  tcp.stream == 22
294   9.290387 216.165.108.217 -> 115.239.199.240 TCP 54 39698 > http [ACK] Seq=358 Ack=5369 Win=26368 Len=0  tcp.stream == 22
295   9.290450 216.165.108.217 -> 115.239.199.240 HTTP 409 GET /tps/i3/T1ZNSFXnRkXXXXXXXX-70-30.png HTTP/1.1   tcp.stream == 22
296   9.321883 58.218.213.250 -> 216.165.108.217 TCP 66 http > 44904 [SYN, ACK] Seq=0 Ack=1 Win=5840 Len=0 MSS=1460 SACK_PERM=1 WS=512  tcp.stream == 25
297   9.321906 216.165.108.217 -> 58.218.213.250 TCP 54 44904 > http [ACK] Seq=1 Ack=1 Win=14720 Len=0  tcp.stream == 25
298   9.322028 216.165.108.217 -> 58.218.213.250 HTTP 409 GET /tps/i2/T1sGqtXalwXXXXXXXX-70-30.png HTTP/1.1   tcp.stream == 25
300   9.337792 58.218.213.250 -> 216.165.108.217 TCP 66 http > 44906 [SYN, ACK] Seq=0 Ack=1 Win=5840 Len=0 MSS=1460 SACK_PERM=1 WS=512  tcp.stream == 27
301   9.337816 216.165.108.217 -> 58.218.213.250 TCP 54 44906 > http [ACK] Seq=1 Ack=1 Win=14720 Len=0  tcp.stream == 27
302   9.337938 216.165.108.217 -> 58.218.213.250 HTTP 403 GET /tps/i2/T1SE87XehwXXXXXXXX.png HTTP/1.1   tcp.stream == 27
303   9.342023 58.218.213.250 -> 216.165.108.217 TCP 66 http > 44907 [SYN, ACK] Seq=0 Ack=1 Win=5840 Len=0 MSS=1460 SACK_PERM=1 WS=512  tcp.stream == 28
304   9.342047 216.165.108.217 -> 58.218.213.250 TCP 54 44907 > http [ACK] Seq=1 Ack=1 Win=14720 Len=0  tcp.stream == 28
305   9.342175 216.165.108.217 -> 58.218.213.250 HTTP 411 GET /tps/i2/T1L8aRXhFdXXXXXXXX-250-125.jpg HTTP/1.1   tcp.stream == 28
306   9.343242 58.218.213.250 -> 216.165.108.217 TCP 66 http > 44910 [SYN, ACK] Seq=0 Ack=1 Win=5840 Len=0 MSS=1460 SACK_PERM=1 WS=512  tcp.stream == 31
307   9.343269 216.165.108.217 -> 58.218.213.250 TCP 54 44910 > http [ACK] Seq=1 Ack=1 Win=14720 Len=0  tcp.stream == 31
308   9.343399 216.165.108.217 -> 58.218.213.250 HTTP 411 GET /tps/i2/T1NwGRXX0qXXXXXXXX-250-125.jpg HTTP/1.1   tcp.stream == 31
309   9.356418 58.218.213.240 -> 216.165.108.217 TCP 66 http > 48589 [SYN, ACK] Seq=0 Ack=1 Win=5840 Len=0 MSS=1460 SACK_PERM=1 WS=512  tcp.stream == 26
310   9.356440 216.165.108.217 -> 58.218.213.240 TCP 54 48589 > http [ACK] Seq=1 Ack=1 Win=14720 Len=0  tcp.stream == 26
311   9.356564 216.165.108.217 -> 58.218.213.240 HTTP 411 GET /tps/i1/T1FfyRXm0oXXXXXXXX-110-135.png HTTP/1.1   tcp.stream == 26
312   9.365753 58.218.213.240 -> 216.165.108.217 TCP 66 http > 48593 [SYN, ACK] Seq=0 Ack=1 Win=5840 Len=0 MSS=1460 SACK_PERM=1 WS=512  tcp.stream == 30
313   9.365779 216.165.108.217 -> 58.218.213.240 TCP 54 48593 > http [ACK] Seq=1 Ack=1 Win=14720 Len=0  tcp.stream == 30
314   9.365922 216.165.108.217 -> 58.218.213.240 HTTP 409 GET /tps/i1/T1cc9cXcdcXXXXXXXX-70-30.png HTTP/1.1   tcp.stream == 30
315   9.369702 58.218.213.240 -> 216.165.108.217 TCP 66 http > 48592 [SYN, ACK] Seq=0 Ack=1 Win=5840 Len=0 MSS=1460 SACK_PERM=1 WS=512  tcp.stream == 29
316   9.369726 216.165.108.217 -> 58.218.213.240 TCP 54 48592 > http [ACK] Seq=1 Ack=1 Win=14720 Len=0  tcp.stream == 29
317   9.369857 216.165.108.217 -> 58.218.213.240 HTTP 409 GET /tps/i1/T1j5qGXcVuXXXXXXXX-70-30.png HTTP/1.1   tcp.stream == 29
318   9.405666 58.218.213.240 -> 216.165.108.217 HTTP 1167 HTTP/1.1 200 OK  (GIF89a)  tcp.stream == 14
319   9.405690 216.165.108.217 -> 58.218.213.240 TCP 54 48577 > http [ACK] Seq=356 Ack=1114 Win=16896 Len=0  tcp.stream == 14
320   9.405843 216.165.108.217 -> 58.218.213.240 HTTP 411 GET /tps/i2/T12JaPXahhXXXXXXXX-190-250.jpg HTTP/1.1   tcp.stream == 14
321   9.416504 220.181.151.240 -> 216.165.108.217 TCP 66 http > 42800 [SYN, ACK] Seq=0 Ack=1 Win=5840 Len=0 MSS=1460 SACK_PERM=1 WS=512  tcp.stream == 32
322   9.416527 216.165.108.217 -> 220.181.151.240 TCP 54 42800 > http [ACK] Seq=1 Ack=1 Win=14720 Len=0  tcp.stream == 32
323   9.416652 216.165.108.217 -> 220.181.151.240 HTTP 411 GET /tps/i4/T1TL5SXcXbXXXXXXXX-163-160.jpg HTTP/1.1   tcp.stream == 32
324   9.420713 220.181.151.240 -> 216.165.108.217 TCP 66 http > 42801 [SYN, ACK] Seq=0 Ack=1 Win=5840 Len=0 MSS=1460 SACK_PERM=1 WS=512  tcp.stream == 33
325   9.420737 216.165.108.217 -> 220.181.151.240 TCP 54 42801 > http [ACK] Seq=1 Ack=1 Win=14720 Len=0  tcp.stream == 33
326   9.420862 216.165.108.217 -> 220.181.151.240 HTTP 411 GET /tps/i4/T1nBeRXe0dXXXXXXXX-250-125.jpg HTTP/1.1   tcp.stream == 33
327   9.421640 58.218.213.240 -> 216.165.108.217 TCP 1514 [TCP segment of a reassembled PDU]  tcp.stream == 24
328   9.421657 216.165.108.217 -> 58.218.213.240 TCP 54 48587 > http [ACK] Seq=358 Ack=1461 Win=17536 Len=0  tcp.stream == 24
329   9.421757 58.218.213.240 -> 216.165.108.217 TCP 1514 [TCP segment of a reassembled PDU]  tcp.stream == 24
330   9.421762 216.165.108.217 -> 58.218.213.240 TCP 54 48587 > http [ACK] Seq=358 Ack=2921 Win=20480 Len=0  tcp.stream == 24
331   9.421882 58.218.213.240 -> 216.165.108.217 TCP 1514 [TCP segment of a reassembled PDU]  tcp.stream == 24
332   9.421888 216.165.108.217 -> 58.218.213.240 TCP 54 48587 > http [ACK] Seq=358 Ack=4381 Win=23424 Len=0  tcp.stream == 24
333   9.421939 58.218.213.240 -> 216.165.108.217 HTTP 1114 HTTP/1.1 200 OK  (PNG)  tcp.stream == 24
334   9.421944 216.165.108.217 -> 58.218.213.240 TCP 54 48587 > http [ACK] Seq=358 Ack=5441 Win=26368 Len=0  tcp.stream == 24
335   9.421995 216.165.108.217 -> 58.218.213.240 HTTP 411 GET /tps/i2/T1xhKRXbloXXXXXXXX-250-125.jpg HTTP/1.1   tcp.stream == 24
336   9.435328 115.239.199.240 -> 216.165.108.217 TCP 66 http > 39712 [SYN, ACK] Seq=0 Ack=1 Win=5840 Len=0 MSS=1460 SACK_PERM=1 WS=512  tcp.stream == 36
337   9.435352 216.165.108.217 -> 115.239.199.240 TCP 54 39712 > http [ACK] Seq=1 Ack=1 Win=14720 Len=0  tcp.stream == 36
338   9.435472 216.165.108.217 -> 115.239.199.240 HTTP 409 GET /tps/i3/T1v5ymXh4AXXXXXXXX-70-30.png HTTP/1.1   tcp.stream == 36
339   9.443688 115.239.199.240 -> 216.165.108.217 TCP 341 [TCP segment of a reassembled PDU]  tcp.stream == 9
340   9.443987 115.239.199.240 -> 216.165.108.217 TCP 1514 [TCP segment of a reassembled PDU]  tcp.stream == 9
341   9.443998 216.165.108.217 -> 115.239.199.240 TCP 54 39685 > http [ACK] Seq=1068 Ack=3941 Win=27392 Len=0  tcp.stream == 9
342   9.444073 115.239.199.240 -> 216.165.108.217 TCP 1514 [TCP segment of a reassembled PDU]  tcp.stream == 9
343   9.444134 115.239.199.240 -> 216.165.108.217 TCP 981 [TCP segment of a reassembled PDU]  tcp.stream == 9
344   9.444139 216.165.108.217 -> 115.239.199.240 TCP 54 39685 > http [ACK] Seq=1068 Ack=6328 Win=33152 Len=0  tcp.stream == 9
345   9.444185 115.239.199.240 -> 216.165.108.217 HTTP 679 HTTP/1.1 200 OK  (PNG)  tcp.stream == 9
346   9.444245 216.165.108.217 -> 115.239.199.240 HTTP 411 GET /tps/i3/T1.LWSXglbXXXXXXXX-163-160.jpg HTTP/1.1   tcp.stream == 9
347   9.445357 115.239.199.240 -> 216.165.108.217 TCP 341 [TCP segment of a reassembled PDU]  tcp.stream == 15
348   9.445381 216.165.108.217 -> 115.239.199.240 TCP 54 39691 > http [ACK] Seq=358 Ack=288 Win=15744 Len=0  tcp.stream == 15
349   9.445572 115.239.199.240 -> 216.165.108.217 TCP 1514 [TCP segment of a reassembled PDU]  tcp.stream == 15
350   9.445583 216.165.108.217 -> 115.239.199.240 TCP 54 39691 > http [ACK] Seq=358 Ack=1748 Win=18688 Len=0  tcp.stream == 15
351   9.445690 115.239.199.240 -> 216.165.108.217 TCP 1514 [TCP segment of a reassembled PDU]  tcp.stream == 15
352   9.445697 216.165.108.217 -> 115.239.199.240 TCP 54 39691 > http [ACK] Seq=358 Ack=3208 Win=21632 Len=0  tcp.stream == 15
353   9.445750 115.239.199.240 -> 216.165.108.217 TCP 981 [TCP segment of a reassembled PDU]  tcp.stream == 15
354   9.445755 216.165.108.217 -> 115.239.199.240 TCP 54 39691 > http [ACK] Seq=358 Ack=4135 Win=24448 Len=0  tcp.stream == 15
355   9.445898 115.239.199.240 -> 216.165.108.217 HTTP 1688 HTTP/1.1 200 OK  (PNG)  tcp.stream == 15
356   9.445906 216.165.108.217 -> 115.239.199.240 TCP 54 39691 > http [ACK] Seq=358 Ack=5769 Win=27392 Len=0  tcp.stream == 15
357   9.446001 216.165.108.217 -> 115.239.199.240 HTTP 411 GET /tps/i3/T1MeOSXh8eXXXXXXXX-163-160.jpg HTTP/1.1   tcp.stream == 15
358   9.447525 115.239.199.240 -> 216.165.108.217 TCP 66 http > 39711 [SYN, ACK] Seq=0 Ack=1 Win=5840 Len=0 MSS=1460 SACK_PERM=1 WS=512  tcp.stream == 35
359   9.447543 216.165.108.217 -> 115.239.199.240 TCP 54 39711 > http [ACK] Seq=1 Ack=1 Win=14720 Len=0  tcp.stream == 35
360   9.447656 216.165.108.217 -> 115.239.199.240 HTTP 403 GET /tps/i3/T1z3SRXlJpXXXXXXXX.png HTTP/1.1   tcp.stream == 35
361   9.452373 115.239.199.240 -> 216.165.108.217 TCP 66 http > 39710 [SYN, ACK] Seq=0 Ack=1 Win=5840 Len=0 MSS=1460 SACK_PERM=1 WS=512  tcp.stream == 34
362   9.452393 216.165.108.217 -> 115.239.199.240 TCP 54 39710 > http [ACK] Seq=1 Ack=1 Win=14720 Len=0  tcp.stream == 34
363   9.452508 216.165.108.217 -> 115.239.199.240 HTTP 411 GET /tps/i3/T1NRaRXhxdXXXXXXXX-250-125.jpg HTTP/1.1   tcp.stream == 34
365   9.511756 220.181.151.240 -> 216.165.108.217 TCP 343 [TCP segment of a reassembled PDU]  tcp.stream == 19
366   9.511782 216.165.108.217 -> 220.181.151.240 TCP 54 42787 > http [ACK] Seq=358 Ack=290 Win=15744 Len=0  tcp.stream == 19
367   9.511851 220.181.151.240 -> 216.165.108.217 TCP 979 [TCP Previous segment not captured] [TCP segment of a reassembled PDU]  tcp.stream == 19
368   9.511861 216.165.108.217 -> 220.181.151.240 TCP 66 [TCP Dup ACK 366#1] 42787 > http [ACK] Seq=358 Ack=290 Win=15744 Len=0 SLE=3210 SRE=4135  tcp.stream == 19
369   9.512018 220.181.151.240 -> 216.165.108.217 TCP 1514 [TCP Out-Of-Order] [TCP segment of a reassembled PDU]  tcp.stream == 19
370   9.512028 216.165.108.217 -> 220.181.151.240 TCP 66 42787 > http [ACK] Seq=358 Ack=1750 Win=18688 Len=0 SLE=3210 SRE=4135  tcp.stream == 19
371   9.512049 220.181.151.240 -> 216.165.108.217 TCP 1230 [TCP Previous segment not captured] [TCP segment of a reassembled PDU]  tcp.stream == 19
372   9.512054 216.165.108.217 -> 220.181.151.240 TCP 74 [TCP Dup ACK 370#1] 42787 > http [ACK] Seq=358 Ack=1750 Win=18688 Len=0 SLE=7055 SRE=8231 SLE=3210 SRE=4135  tcp.stream == 19
373   9.512212 220.181.151.240 -> 216.165.108.217 TCP 1514 [TCP Out-Of-Order] [TCP segment of a reassembled PDU]  tcp.stream == 19
374   9.512222 216.165.108.217 -> 220.181.151.240 TCP 66 42787 > http [ACK] Seq=358 Ack=4135 Win=21632 Len=0 SLE=7055 SRE=8231  tcp.stream == 19
375   9.512343 220.181.151.240 -> 216.165.108.217 TCP 1514 [TCP Out-Of-Order] [TCP segment of a reassembled PDU]  tcp.stream == 19
376   9.512366 216.165.108.217 -> 220.181.151.240 TCP 66 42787 > http [ACK] Seq=358 Ack=5595 Win=24448 Len=0 SLE=7055 SRE=8231  tcp.stream == 19
377   9.512479 220.181.151.240 -> 216.165.108.217 TCP 1514 [TCP Out-Of-Order] [TCP segment of a reassembled PDU]  tcp.stream == 19
378   9.512497 216.165.108.217 -> 220.181.151.240 TCP 54 42787 > http [ACK] Seq=358 Ack=8231 Win=27392 Len=0  tcp.stream == 19
379   9.512603 220.181.151.240 -> 216.165.108.217 TCP 1514 [TCP segment of a reassembled PDU]  tcp.stream == 19
380   9.512617 216.165.108.217 -> 220.181.151.240 TCP 54 42787 > http [ACK] Seq=358 Ack=9691 Win=30336 Len=0  tcp.stream == 19
381   9.528132 220.181.151.240 -> 216.165.108.217 TCP 343 [TCP segment of a reassembled PDU]  tcp.stream == 16
382   9.528155 216.165.108.217 -> 220.181.151.240 TCP 54 42784 > http [ACK] Seq=356 Ack=290 Win=15744 Len=0  tcp.stream == 16
383   9.528160 220.181.151.240 -> 216.165.108.217 TCP 437 [TCP Previous segment not captured] [TCP segment of a reassembled PDU]  tcp.stream == 16
384   9.528164 216.165.108.217 -> 220.181.151.240 TCP 66 [TCP Dup ACK 382#1] 42784 > http [ACK] Seq=356 Ack=290 Win=15744 Len=0 SLE=3210 SRE=3593  tcp.stream == 16
385   9.528335 220.181.151.240 -> 216.165.108.217 TCP 1514 [TCP Out-Of-Order] [TCP segment of a reassembled PDU]  tcp.stream == 16
386   9.528345 216.165.108.217 -> 220.181.151.240 TCP 66 42784 > http [ACK] Seq=356 Ack=1750 Win=18688 Len=0 SLE=3210 SRE=3593  tcp.stream == 16
387   9.528416 220.181.151.240 -> 216.165.108.217 HTTP 1514 [TCP Out-Of-Order] HTTP/1.1 200 OK  (GIF89a)  tcp.stream == 16
388   9.528422 216.165.108.217 -> 220.181.151.240 TCP 54 42784 > http [ACK] Seq=356 Ack=3593 Win=21632 Len=0  tcp.stream == 16
389   9.528509 216.165.108.217 -> 220.181.151.240 HTTP 409 GET /tps/i1/T1.zCmXkRpXXXXXXXX-70-30.png HTTP/1.1   tcp.stream == 16
390   9.534627 115.239.199.240 -> 216.165.108.217 TCP 343 [TCP segment of a reassembled PDU]  tcp.stream == 22
391   9.534904 115.239.199.240 -> 216.165.108.217 HTTP 1690 HTTP/1.1 200 OK  (PNG)  tcp.stream == 22
392   9.534915 216.165.108.217 -> 115.239.199.240 TCP 54 39698 > http [ACK] Seq=713 Ack=7294 Win=32128 Len=0  tcp.stream == 22
393   9.535000 216.165.108.217 -> 115.239.199.240 HTTP 411 GET /tps/i3/T1EMKRXoxpXXXXXXXX-250-125.jpg HTTP/1.1   tcp.stream == 22
394   9.535456 119.167.201.241 -> 216.165.108.217 TCP 1514 [TCP segment of a reassembled PDU]  tcp.stream == 3
395   9.535468 216.165.108.217 -> 119.167.201.241 TCP 54 34758 > http [ACK] Seq=609 Ack=28197 Win=62780 Len=0  tcp.stream == 3
396   9.535659 119.167.201.241 -> 216.165.108.217 TCP 1514 [TCP segment of a reassembled PDU]  tcp.stream == 3
397   9.535665 216.165.108.217 -> 119.167.201.241 TCP 54 34758 > http [ACK] Seq=609 Ack=29657 Win=62780 Len=0  tcp.stream == 3
398   9.535768 119.167.201.241 -> 216.165.108.217 HTTP 1395 HTTP/1.1 200 OK  (text/html)  tcp.stream == 3
399   9.535775 216.165.108.217 -> 119.167.201.241 TCP 54 34758 > http [ACK] Seq=609 Ack=30998 Win=61439 Len=0  tcp.stream == 3
400   9.540536 220.181.151.240 -> 216.165.108.217 HTTP 852 [TCP Previous segment not captured] Continuation or non-HTTP traffic  tcp.stream == 20
401   9.540555 216.165.108.217 -> 220.181.151.240 TCP 66 [TCP Dup ACK 240#1] 42788 > http [ACK] Seq=358 Ack=1 Win=14720 Len=0 SLE=4381 SRE=5179  tcp.stream == 20
402   9.540672 220.181.151.240 -> 216.165.108.217 TCP 1514 [TCP Out-Of-Order] [TCP segment of a reassembled PDU]  tcp.stream == 20
403   9.540682 216.165.108.217 -> 220.181.151.240 TCP 66 42788 > http [ACK] Seq=358 Ack=1461 Win=17536 Len=0 SLE=4381 SRE=5179  tcp.stream == 20
404   9.540797 220.181.151.240 -> 216.165.108.217 TCP 1514 [TCP Out-Of-Order] [TCP segment of a reassembled PDU]  tcp.stream == 20
405   9.540805 216.165.108.217 -> 220.181.151.240 TCP 66 42788 > http [ACK] Seq=358 Ack=2921 Win=20480 Len=0 SLE=4381 SRE=5179  tcp.stream == 20
406   9.540917 220.181.151.240 -> 216.165.108.217 TCP 1514 [TCP Out-Of-Order] [TCP segment of a reassembled PDU]  tcp.stream == 20
407   9.540925 216.165.108.217 -> 220.181.151.240 TCP 54 42788 > http [ACK] Seq=358 Ack=5179 Win=23424 Len=0  tcp.stream == 20
