  2   0.177604 180.149.134.225 -> 216.165.108.217 TCP 66 http > 35283 [FIN, ACK] Seq=1 Ack=1 Win=46 Len=0 TSval=3415290063 TSecr=43361376  tcp.stream == 0
  3   0.177620 216.165.108.217 -> 180.149.134.225 TCP 66 35283 > http [ACK] Seq=1 Ack=2 Win=115 Len=0 TSval=43361747 TSecr=3415288953  tcp.stream == 0
  6   0.390628 119.84.71.195 -> 216.165.108.217 TCP 60 http > 47903 [RST] Seq=1 Win=0 Len=0  tcp.stream == 1
 16   1.812742 216.165.108.217 -> 180.149.134.223 TCP 54 38397 > http [FIN, ACK] Seq=1 Ack=1 Win=20440 Len=0  tcp.stream == 2
 19   2.166071 180.149.134.223 -> 216.165.108.217 TCP 60 http > 38397 [ACK] Seq=1 Ack=2 Win=6432 Len=0  tcp.stream == 2
 70   9.275690 216.165.108.217 -> 207.46.232.182 TCP 74 40445 > http [SYN] Seq=0 Win=14600 Len=0 MSS=1460 SACK_PERM=1 TSval=43364021 TSecr=0 WS=128  tcp.stream == 3
 71   9.353958 207.46.232.182 -> 216.165.108.217 TCP 78 http > 40445 [SYN, ACK] Seq=0 Ack=1 Win=16384 Len=0 MSS=1460 WS=1 TSval=0 TSecr=0 SACK_PERM=1  tcp.stream == 3
 72   9.353988 216.165.108.217 -> 207.46.232.182 TCP 66 40445 > http [ACK] Seq=1 Ack=1 Win=14720 Len=0 TSval=43364041 TSecr=0  tcp.stream == 3
 73   9.359493 216.165.108.217 -> 207.46.232.182 HTTP 465 GET / HTTP/1.1   tcp.stream == 3
 75   9.438408 207.46.232.182 -> 216.165.108.217 HTTP 483 HTTP/1.1 301 Moved Permanently  (text/html)  tcp.stream == 3
 76   9.438430 216.165.108.217 -> 207.46.232.182 TCP 66 40445 > http [ACK] Seq=400 Ack=418 Win=15744 Len=0 TSval=43364062 TSecr=6861973  tcp.stream == 3
 77   9.438434 207.46.232.182 -> 216.165.108.217 TCP 66 http > 40445 [FIN, ACK] Seq=418 Ack=400 Win=65136 Len=0 TSval=6861973 TSecr=43364042  tcp.stream == 3
 78   9.450216 216.165.108.217 -> 207.46.232.182 TCP 66 40445 > http [FIN, ACK] Seq=400 Ack=419 Win=15744 Len=0 TSval=43364065 TSecr=6861973  tcp.stream == 3
 80   9.528450 207.46.232.182 -> 216.165.108.217 TCP 66 http > 40445 [ACK] Seq=419 Ack=401 Win=65136 Len=0 TSval=6861974 TSecr=43364065  tcp.stream == 3
 82   9.563366 216.165.108.217 -> 207.46.19.254 TCP 74 44712 > http [SYN] Seq=0 Win=14600 Len=0 MSS=1460 SACK_PERM=1 TSval=43364093 TSecr=0 WS=128  tcp.stream == 4
 84   9.659980 207.46.19.254 -> 216.165.108.217 TCP 60 http > 44712 [SYN, ACK] Seq=0 Ack=1 Win=8190 Len=0 MSS=1460  tcp.stream == 4
 85   9.660005 216.165.108.217 -> 207.46.19.254 TCP 54 44712 > http [ACK] Seq=1 Ack=1 Win=14600 Len=0  tcp.stream == 4
 86   9.661987 216.165.108.217 -> 207.46.19.254 HTTP 457 GET / HTTP/1.1   tcp.stream == 4
 88   9.776160 207.46.19.254 -> 216.165.108.217 HTTP 603 HTTP/1.1 302 Found  (text/html)  tcp.stream == 4
 89   9.776183 216.165.108.217 -> 207.46.19.254 TCP 54 44712 > http [ACK] Seq=404 Ack=550 Win=15372 Len=0  tcp.stream == 4
 90   9.807134 216.165.108.217 -> 207.46.19.254 TCP 54 44712 > http [FIN, ACK] Seq=404 Ack=550 Win=15372 Len=0  tcp.stream == 4
 92   9.903497 207.46.19.254 -> 216.165.108.217 TCP 60 http > 44712 [FIN, ACK] Seq=550 Ack=405 Win=8190 Len=0  tcp.stream == 4
 93   9.903520 216.165.108.217 -> 207.46.19.254 TCP 54 44712 > http [ACK] Seq=405 Ack=551 Win=15372 Len=0  tcp.stream == 4
 96   9.975895 216.165.108.217 -> 65.55.186.235 TCP 74 33031 > http [SYN] Seq=0 Win=14600 Len=0 MSS=1460 SACK_PERM=1 TSval=43364196 TSecr=0 WS=128  tcp.stream == 5
 97  10.070202 216.165.108.217 -> 65.55.186.235 TCP 74 33032 > http [SYN] Seq=0 Win=14600 Len=0 MSS=1460 SACK_PERM=1 TSval=43364220 TSecr=0 WS=128  tcp.stream == 6
 98  10.123144 65.55.186.235 -> 216.165.108.217 TCP 70 http > 33031 [SYN, ACK] Seq=0 Ack=1 Win=8192 Len=0 MSS=1460 SACK_PERM=1 TSval=136786322 TSecr=43364196  tcp.stream == 5
 99  10.123173 216.165.108.217 -> 65.55.186.235 TCP 66 33031 > http [ACK] Seq=1 Ack=1 Win=14600 Len=0 TSval=43364233 TSecr=136786322  tcp.stream == 5
100  10.124859 216.165.108.217 -> 65.55.186.235 HTTP 472 GET / HTTP/1.1   tcp.stream == 5
102  10.217509 65.55.186.235 -> 216.165.108.217 TCP 70 http > 33032 [SYN, ACK] Seq=0 Ack=1 Win=8192 Len=0 MSS=1460 SACK_PERM=1 TSval=136896617 TSecr=43364220  tcp.stream == 6
103  10.217532 216.165.108.217 -> 65.55.186.235 TCP 66 33032 > http [ACK] Seq=1 Ack=1 Win=14600 Len=0 TSval=43364257 TSecr=136896617  tcp.stream == 6
104  10.273341 65.55.186.235 -> 216.165.108.217 HTTP 523 HTTP/1.1 301 Moved Permanently  (text/html)  tcp.stream == 5
105  10.273363 216.165.108.217 -> 65.55.186.235 TCP 66 33031 > http [ACK] Seq=407 Ack=458 Win=15544 Len=0 TSval=43364271 TSecr=136786336  tcp.stream == 5
106  10.282471 216.165.108.217 -> 65.55.186.235 TCP 66 33031 > http [FIN, ACK] Seq=407 Ack=458 Win=15544 Len=0 TSval=43364273 TSecr=136786336  tcp.stream == 5
109  10.429685 65.55.186.235 -> 216.165.108.217 TCP 66 http > 33031 [FIN, ACK] Seq=458 Ack=408 Win=65160 Len=0 TSval=136786353 TSecr=43364273  tcp.stream == 5
110  10.429707 216.165.108.217 -> 65.55.186.235 TCP 66 33031 > http [ACK] Seq=408 Ack=459 Win=15544 Len=0 TSval=43364310 TSecr=136786353  tcp.stream == 5
112  10.437545 216.165.108.217 -> 65.55.186.235 TCP 74 33033 > http [SYN] Seq=0 Win=14600 Len=0 MSS=1460 SACK_PERM=1 TSval=43364312 TSecr=0 WS=128  tcp.stream == 7
114  10.539731 216.165.108.217 -> 65.55.186.235 TCP 74 33034 > http [SYN] Seq=0 Win=14600 Len=0 MSS=1460 SACK_PERM=1 TSval=43364337 TSecr=0 WS=128  tcp.stream == 8
115  10.585117 65.55.186.235 -> 216.165.108.217 TCP 70 http > 33033 [SYN, ACK] Seq=0 Ack=1 Win=8192 Len=0 MSS=1460 SACK_PERM=1 TSval=137030672 TSecr=43364312  tcp.stream == 7
116  10.585139 216.165.108.217 -> 65.55.186.235 TCP 66 33033 > http [ACK] Seq=1 Ack=1 Win=14600 Len=0 TSval=43364349 TSecr=137030672  tcp.stream == 7
117  10.586716 216.165.108.217 -> 65.55.186.235 HTTP 467 GET / HTTP/1.1   tcp.stream == 7
119  10.687059 65.55.186.235 -> 216.165.108.217 TCP 70 http > 33034 [SYN, ACK] Seq=0 Ack=1 Win=8192 Len=0 MSS=1460 SACK_PERM=1 TSval=136896664 TSecr=43364337  tcp.stream == 8
120  10.687081 216.165.108.217 -> 65.55.186.235 TCP 66 33034 > http [ACK] Seq=1 Ack=1 Win=14600 Len=0 TSval=43364374 TSecr=136896664  tcp.stream == 8
121  10.769148 65.55.186.235 -> 216.165.108.217 HTTP 1033 HTTP/1.1 302 Found  (text/html)  tcp.stream == 7
122  10.769172 216.165.108.217 -> 65.55.186.235 TCP 66 33033 > http [ACK] Seq=402 Ack=968 Win=16439 Len=0 TSval=43364395 TSecr=137030690  tcp.stream == 7
123  10.776937 216.165.108.217 -> 65.55.186.235 TCP 66 33033 > http [FIN, ACK] Seq=402 Ack=968 Win=16439 Len=0 TSval=43364397 TSecr=137030690  tcp.stream == 7
124  10.783078 216.165.108.217 -> 65.55.186.235 HTTP 485 GET /en-us/default.mspx HTTP/1.1   tcp.stream == 8
126  10.924166 65.55.186.235 -> 216.165.108.217 TCP 66 http > 33033 [FIN, ACK] Seq=968 Ack=403 Win=65160 Len=0 TSval=137030706 TSecr=43364397  tcp.stream == 7
127  10.924190 216.165.108.217 -> 65.55.186.235 TCP 66 33033 > http [ACK] Seq=403 Ack=969 Win=16439 Len=0 TSval=43364433 TSecr=137030706  tcp.stream == 7
130  11.126269 65.55.186.235 -> 216.165.108.217 TCP 66 http > 33034 [ACK] Seq=1 Ack=420 Win=65160 Len=0 TSval=136896708 TSecr=43364398  tcp.stream == 8
147  13.938306 65.55.186.235 -> 216.165.108.217 TCP 1514 [TCP segment of a reassembled PDU]  tcp.stream == 8
148  13.938331 216.165.108.217 -> 65.55.186.235 TCP 66 33034 > http [ACK] Seq=420 Ack=1449 Win=17376 Len=0 TSval=43365187 TSecr=136896989  tcp.stream == 8
149  13.938399 65.55.186.235 -> 216.165.108.217 TCP 1514 [TCP segment of a reassembled PDU]  tcp.stream == 8
150  13.938404 216.165.108.217 -> 65.55.186.235 TCP 66 33034 > http [ACK] Seq=420 Ack=2897 Win=20272 Len=0 TSval=43365187 TSecr=136896989  tcp.stream == 8
152  14.085785 65.55.186.235 -> 216.165.108.217 TCP 1514 [TCP segment of a reassembled PDU]  tcp.stream == 8
153  14.085804 216.165.108.217 -> 65.55.186.235 TCP 66 33034 > http [ACK] Seq=420 Ack=4345 Win=23168 Len=0 TSval=43365224 TSecr=136897004  tcp.stream == 8
154  14.085903 65.55.186.235 -> 216.165.108.217 TCP 1514 [TCP segment of a reassembled PDU]  tcp.stream == 8
155  14.085909 216.165.108.217 -> 65.55.186.235 TCP 66 33034 > http [ACK] Seq=420 Ack=5793 Win=26064 Len=0 TSval=43365224 TSecr=136897004  tcp.stream == 8
156  14.086025 65.55.186.235 -> 216.165.108.217 TCP 1514 [TCP segment of a reassembled PDU]  tcp.stream == 8
157  14.086032 216.165.108.217 -> 65.55.186.235 TCP 66 33034 > http [ACK] Seq=420 Ack=7241 Win=28960 Len=0 TSval=43365224 TSecr=136897004  tcp.stream == 8
158  14.086145 65.55.186.235 -> 216.165.108.217 HTTP/XML 1502 HTTP/1.1 200 OK   tcp.stream == 8
159  14.086151 216.165.108.217 -> 65.55.186.235 TCP 66 33034 > http [ACK] Seq=420 Ack=8677 Win=31856 Len=0 TSval=43365224 TSecr=136897004  tcp.stream == 8
160  14.091058 216.165.108.217 -> 65.55.186.235 TCP 66 33034 > http [FIN, ACK] Seq=420 Ack=8677 Win=31856 Len=0 TSval=43365225 TSecr=136897004  tcp.stream == 8
162  14.229821 216.165.108.217 -> 65.55.186.235 TCP 74 33035 > http [SYN] Seq=0 Win=14600 Len=0 MSS=1460 SACK_PERM=1 TSval=43365260 TSecr=0 WS=128  tcp.stream == 9
163  14.237454 216.165.108.217 -> 65.55.186.235 TCP 74 33036 > http [SYN] Seq=0 Win=14600 Len=0 MSS=1460 SACK_PERM=1 TSval=43365262 TSecr=0 WS=128  tcp.stream == 10
164  14.238292 65.55.186.235 -> 216.165.108.217 TCP 66 http > 33034 [FIN, ACK] Seq=8677 Ack=421 Win=65160 Len=0 TSval=136897019 TSecr=43365225  tcp.stream == 8
165  14.238315 216.165.108.217 -> 65.55.186.235 TCP 66 33034 > http [ACK] Seq=421 Ack=8678 Win=31856 Len=0 TSval=43365262 TSecr=136897019  tcp.stream == 8
167  14.249814 216.165.108.217 -> 65.55.186.235 TCP 74 33037 > http [SYN] Seq=0 Win=14600 Len=0 MSS=1460 SACK_PERM=1 TSval=43365265 TSecr=0 WS=128  tcp.stream == 11
168  14.265758 216.165.108.217 -> 65.55.186.235 TCP 74 33038 > http [SYN] Seq=0 Win=14600 Len=0 MSS=1460 SACK_PERM=1 TSval=43365269 TSecr=0 WS=128  tcp.stream == 12
171  14.277533 216.165.108.217 -> 65.55.186.235 TCP 74 33039 > http [SYN] Seq=0 Win=14600 Len=0 MSS=1460 SACK_PERM=1 TSval=43365272 TSecr=0 WS=128  tcp.stream == 13
172  14.289250 216.165.108.217 -> 65.55.186.235 TCP 74 33040 > http [SYN] Seq=0 Win=14600 Len=0 MSS=1460 SACK_PERM=1 TSval=43365275 TSecr=0 WS=128  tcp.stream == 14
174  14.377161 65.55.186.235 -> 216.165.108.217 TCP 70 http > 33035 [SYN, ACK] Seq=0 Ack=1 Win=8192 Len=0 MSS=1460 SACK_PERM=1 TSval=136897033 TSecr=43365260  tcp.stream == 9
175  14.377183 216.165.108.217 -> 65.55.186.235 TCP 66 33035 > http [ACK] Seq=1 Ack=1 Win=14600 Len=0 TSval=43365297 TSecr=136897033  tcp.stream == 9
176  14.378983 216.165.108.217 -> 65.55.186.235 HTTP 541 GET /Library/js/im/gmr-1.6.0/jQuery.moveTo.js HTTP/1.1   tcp.stream == 9
177  14.384667 65.55.186.235 -> 216.165.108.217 TCP 70 http > 33036 [SYN, ACK] Seq=0 Ack=1 Win=8192 Len=0 MSS=1460 SACK_PERM=1 TSval=136897034 TSecr=43365262  tcp.stream == 10
178  14.384693 216.165.108.217 -> 65.55.186.235 TCP 66 33036 > http [ACK] Seq=1 Ack=1 Win=14600 Len=0 TSval=43365298 TSecr=136897034  tcp.stream == 10
179  14.386886 216.165.108.217 -> 65.55.186.235 HTTP 561 GET /Library/js/im/gmr-1.6.0/jquerytools/scrollable/scrollable.js HTTP/1.1   tcp.stream == 10
180  14.397134 65.55.186.235 -> 216.165.108.217 TCP 70 http > 33037 [SYN, ACK] Seq=0 Ack=1 Win=8192 Len=0 MSS=1460 SACK_PERM=1 TSval=136786749 TSecr=43365265  tcp.stream == 11
181  14.397156 216.165.108.217 -> 65.55.186.235 TCP 66 33037 > http [ACK] Seq=1 Ack=1 Win=14600 Len=0 TSval=43365302 TSecr=136786749  tcp.stream == 11
182  14.398752 216.165.108.217 -> 65.55.186.235 HTTP 571 GET /Library/js/im/gmr-1.6.0/jquerytools/scrollable/scrollable.navigator.js HTTP/1.1   tcp.stream == 11
183  14.412972 65.55.186.235 -> 216.165.108.217 TCP 70 http > 33038 [SYN, ACK] Seq=0 Ack=1 Win=8192 Len=0 MSS=1460 SACK_PERM=1 TSval=136897036 TSecr=43365269  tcp.stream == 12
184  14.412995 216.165.108.217 -> 65.55.186.235 TCP 66 33038 > http [ACK] Seq=1 Ack=1 Win=14600 Len=0 TSval=43365306 TSecr=136897036  tcp.stream == 12
185  14.414595 216.165.108.217 -> 65.55.186.235 HTTP 572 GET /Library/js/im/gmr-1.6.0/jquerytools/scrollable/scrollable.pagenumber.js HTTP/1.1   tcp.stream == 12
186  14.424872 65.55.186.235 -> 216.165.108.217 TCP 70 http > 33039 [SYN, ACK] Seq=0 Ack=1 Win=8192 Len=0 MSS=1460 SACK_PERM=1 TSval=136786752 TSecr=43365272  tcp.stream == 13
187  14.424899 216.165.108.217 -> 65.55.186.235 TCP 66 33039 > http [ACK] Seq=1 Ack=1 Win=14600 Len=0 TSval=43365309 TSecr=136786752  tcp.stream == 13
188  14.426523 216.165.108.217 -> 65.55.186.235 HTTP 555 GET /Library/js/im/gmr-1.6.0/touchClicker_iphone_android.js HTTP/1.1   tcp.stream == 13
189  14.436687 65.55.186.235 -> 216.165.108.217 TCP 70 http > 33040 [SYN, ACK] Seq=0 Ack=1 Win=8192 Len=0 MSS=1460 SACK_PERM=1 TSval=136786753 TSecr=43365275  tcp.stream == 14
190  14.436713 216.165.108.217 -> 65.55.186.235 TCP 66 33040 > http [ACK] Seq=1 Ack=1 Win=14600 Len=0 TSval=43365311 TSecr=136786753  tcp.stream == 14
191  14.438386 216.165.108.217 -> 65.55.186.235 HTTP 538 GET /Library/js/im/gmr-1.6.0/turnscreen.js HTTP/1.1   tcp.stream == 14
193  14.513789 216.165.108.217 -> 65.54.95.134 TCP 74 41196 > http [SYN] Seq=0 Win=14600 Len=0 MSS=1460 SACK_PERM=1 TSval=43365331 TSecr=0 WS=128  tcp.stream == 15
195  14.527336 65.55.186.235 -> 216.165.108.217 HTTP 1109 HTTP/1.1 200 OK  (application/x-javascript)  tcp.stream == 9
196  14.527355 216.165.108.217 -> 65.55.186.235 TCP 66 33035 > http [ACK] Seq=476 Ack=1044 Win=15645 Len=0 TSval=43365334 TSecr=136897048  tcp.stream == 9
197  14.535293 216.165.108.217 -> 65.55.186.235 TCP 66 33035 > http [FIN, ACK] Seq=476 Ack=1044 Win=15645 Len=0 TSval=43365336 TSecr=136897048  tcp.stream == 9
198  14.535525 65.55.186.235 -> 216.165.108.217 TCP 1514 [TCP segment of a reassembled PDU]  tcp.stream == 10
199  14.535542 216.165.108.217 -> 65.55.186.235 TCP 66 33036 > http [ACK] Seq=496 Ack=1449 Win=17376 Len=0 TSval=43365336 TSecr=136897048  tcp.stream == 10
200  14.535647 65.55.186.235 -> 216.165.108.217 TCP 1514 [TCP segment of a reassembled PDU]  tcp.stream == 10
201  14.535653 216.165.108.217 -> 65.55.186.235 TCP 66 33036 > http [ACK] Seq=496 Ack=2897 Win=20272 Len=0 TSval=43365336 TSecr=136897048  tcp.stream == 10
202  14.536440 216.165.108.217 -> 65.55.186.235 TCP 74 33042 > http [SYN] Seq=0 Win=14600 Len=0 MSS=1460 SACK_PERM=1 TSval=43365336 TSecr=0 WS=128  tcp.stream == 16
203  14.547582 65.55.186.235 -> 216.165.108.217 HTTP 1704 HTTP/1.1 200 OK  (application/x-javascript)  tcp.stream == 11
204  14.547606 216.165.108.217 -> 65.55.186.235 TCP 66 33037 > http [ACK] Seq=506 Ack=1639 Win=17376 Len=0 TSval=43365339 TSecr=136786764  tcp.stream == 11
205  14.555112 216.165.108.217 -> 65.55.186.235 TCP 66 33037 > http [FIN, ACK] Seq=506 Ack=1639 Win=17376 Len=0 TSval=43365341 TSecr=136786764  tcp.stream == 11
206  14.555942 216.165.108.217 -> 65.55.186.235 TCP 74 33043 > http [SYN] Seq=0 Win=14600 Len=0 MSS=1460 SACK_PERM=1 TSval=43365341 TSecr=0 WS=128  tcp.stream == 17
207  14.563091 65.55.186.235 -> 216.165.108.217 HTTP 940 HTTP/1.1 200 OK  (application/x-javascript)  tcp.stream == 12
208  14.563113 216.165.108.217 -> 65.55.186.235 TCP 66 33038 > http [ACK] Seq=507 Ack=875 Win=15732 Len=0 TSval=43365343 TSecr=136897051  tcp.stream == 12
209  14.568708 216.165.108.217 -> 65.55.186.235 TCP 66 33038 > http [FIN, ACK] Seq=507 Ack=875 Win=15732 Len=0 TSval=43365344 TSecr=136897051  tcp.stream == 12
210  14.569628 216.165.108.217 -> 65.55.186.235 TCP 74 33044 > http [SYN] Seq=0 Win=14600 Len=0 MSS=1460 SACK_PERM=1 TSval=43365345 TSecr=0 WS=128  tcp.stream == 18
211  14.575302 65.55.186.235 -> 216.165.108.217 HTTP 1394 HTTP/1.1 200 OK  (application/x-javascript)  tcp.stream == 13
212  14.575326 216.165.108.217 -> 65.55.186.235 TCP 66 33039 > http [ACK] Seq=490 Ack=1329 Win=15936 Len=0 TSval=43365346 TSecr=136786767  tcp.stream == 13
213  14.583388 216.165.108.217 -> 65.55.186.235 TCP 66 33039 > http [FIN, ACK] Seq=490 Ack=1329 Win=15936 Len=0 TSval=43365348 TSecr=136786767  tcp.stream == 13
214  14.584212 216.165.108.217 -> 65.55.186.235 TCP 74 33045 > http [SYN] Seq=0 Win=14600 Len=0 MSS=1460 SACK_PERM=1 TSval=43365348 TSecr=0 WS=128  tcp.stream == 19
215  14.586500 65.55.186.235 -> 216.165.108.217 HTTP 1120 HTTP/1.1 200 OK  (application/x-javascript)  tcp.stream == 14
216  14.586527 216.165.108.217 -> 65.55.186.235 TCP 66 33040 > http [ACK] Seq=473 Ack=1055 Win=15810 Len=0 TSval=43365349 TSecr=136786768  tcp.stream == 14
217  14.592664 65.54.95.134 -> 216.165.108.217 TCP 74 http > 41196 [SYN, ACK] Seq=0 Ack=1 Win=65535 Len=0 MSS=1460 WS=16 SACK_PERM=1 TSval=1693653324 TSecr=43365331  tcp.stream == 15
218  14.592694 216.165.108.217 -> 65.54.95.134 TCP 66 41196 > http [ACK] Seq=1 Ack=1 Win=14720 Len=0 TSval=43365350 TSecr=1693653324  tcp.stream == 15
219  14.597968 216.165.108.217 -> 65.55.186.235 TCP 66 33040 > http [FIN, ACK] Seq=473 Ack=1055 Win=15810 Len=0 TSval=43365352 TSecr=136786768  tcp.stream == 14
220  14.602172 216.165.108.217 -> 65.54.95.134 HTTP 493 GET /ajax/jQuery/jquery-1.5.2.min.js HTTP/1.1   tcp.stream == 15
221  14.671201 65.54.95.134 -> 216.165.108.217 TCP 66 [TCP Window Update] http > 41196 [ACK] Seq=1 Ack=1 Win=101360 Len=0 TSval=1693653403 TSecr=43365350  tcp.stream == 15
222  14.681333 65.54.95.134 -> 216.165.108.217 TCP 1514 [TCP segment of a reassembled PDU]  tcp.stream == 15
223  14.681355 216.165.108.217 -> 65.54.95.134 TCP 66 41196 > http [ACK] Seq=428 Ack=1449 Win=17536 Len=0 TSval=43365373 TSecr=1693653413  tcp.stream == 15
224  14.681380 65.54.95.134 -> 216.165.108.217 TCP 1514 [TCP segment of a reassembled PDU]  tcp.stream == 15
225  14.681383 216.165.108.217 -> 65.54.95.134 TCP 66 41196 > http [ACK] Seq=428 Ack=2897 Win=20480 Len=0 TSval=43365373 TSecr=1693653413  tcp.stream == 15
226  14.682560 65.55.186.235 -> 216.165.108.217 TCP 66 http > 33035 [FIN, ACK] Seq=1044 Ack=477 Win=65160 Len=0 TSval=136897063 TSecr=43365336  tcp.stream == 9
227  14.682583 216.165.108.217 -> 65.55.186.235 TCP 66 33035 > http [ACK] Seq=477 Ack=1045 Win=15645 Len=0 TSval=43365373 TSecr=136897063  tcp.stream == 9
228  14.682952 65.55.186.235 -> 216.165.108.217 HTTP 1232 HTTP/1.1 200 OK  (application/x-javascript)  tcp.stream == 10
229  14.682967 216.165.108.217 -> 65.55.186.235 TCP 66 33036 > http [ACK] Seq=496 Ack=4063 Win=23168 Len=0 TSval=43365373 TSecr=136897063  tcp.stream == 10
230  14.683648 65.55.186.235 -> 216.165.108.217 TCP 70 http > 33042 [SYN, ACK] Seq=0 Ack=1 Win=8192 Len=0 MSS=1460 SACK_PERM=1 TSval=136786778 TSecr=43365336  tcp.stream == 16
231  14.683672 216.165.108.217 -> 65.55.186.235 TCP 66 33042 > http [ACK] Seq=1 Ack=1 Win=14600 Len=0 TSval=43365373 TSecr=136786778  tcp.stream == 16
232  14.692077 216.165.108.217 -> 65.55.186.235 HTTP 607 GET /Library/proxy.mspx/cache/WhWqmPjMcaJO9WMnl3I!DQ/Ypflc5Ly4GXGCBBe5AQ_cg/a03ef5b5864f8ad5db1a5bc5d8076a9c.js HTTP/1.1   tcp.stream == 16
233  14.693938 216.165.108.217 -> 65.55.186.235 TCP 66 33036 > http [FIN, ACK] Seq=496 Ack=4063 Win=23168 Len=0 TSval=43365376 TSecr=136897063  tcp.stream == 10
234  14.702361 65.55.186.235 -> 216.165.108.217 TCP 66 http > 33037 [FIN, ACK] Seq=1639 Ack=507 Win=65160 Len=0 TSval=136786780 TSecr=43365341  tcp.stream == 11
235  14.702384 216.165.108.217 -> 65.55.186.235 TCP 66 33037 > http [ACK] Seq=507 Ack=1640 Win=17376 Len=0 TSval=43365378 TSecr=136786780  tcp.stream == 11
237  14.703273 65.55.186.235 -> 216.165.108.217 TCP 70 http > 33043 [SYN, ACK] Seq=0 Ack=1 Win=8192 Len=0 MSS=1460 SACK_PERM=1 TSval=136897065 TSecr=43365341  tcp.stream == 17
238  14.703292 216.165.108.217 -> 65.55.186.235 TCP 66 33043 > http [ACK] Seq=1 Ack=1 Win=14600 Len=0 TSval=43365378 TSecr=136897065  tcp.stream == 17
239  14.705005 216.165.108.217 -> 65.55.186.235 HTTP 535 GET /Images/fcmp_320.css HTTP/1.1   tcp.stream == 17
240  14.715936 65.55.186.235 -> 216.165.108.217 TCP 66 http > 33038 [FIN, ACK] Seq=875 Ack=508 Win=65160 Len=0 TSval=136897067 TSecr=43365344  tcp.stream == 12
241  14.715958 216.165.108.217 -> 65.55.186.235 TCP 66 33038 > http [ACK] Seq=508 Ack=876 Win=15732 Len=0 TSval=43365381 TSecr=136897067  tcp.stream == 12
242  14.716959 65.55.186.235 -> 216.165.108.217 TCP 70 http > 33044 [SYN, ACK] Seq=0 Ack=1 Win=8192 Len=0 MSS=1460 SACK_PERM=1 TSval=136786781 TSecr=43365345  tcp.stream == 18
243  14.716980 216.165.108.217 -> 65.55.186.235 TCP 66 33044 > http [ACK] Seq=1 Ack=1 Win=14600 Len=0 TSval=43365382 TSecr=136786781  tcp.stream == 18
244  14.718522 216.165.108.217 -> 65.55.186.235 HTTP 540 GET /library/js/AdvanceFeatures/webtrends.js HTTP/1.1   tcp.stream == 18
245  14.730666 65.55.186.235 -> 216.165.108.217 TCP 66 http > 33039 [FIN, ACK] Seq=1329 Ack=491 Win=65160 Len=0 TSval=136786783 TSecr=43365348  tcp.stream == 13
246  14.730686 216.165.108.217 -> 65.55.186.235 TCP 66 33039 > http [ACK] Seq=491 Ack=1330 Win=15936 Len=0 TSval=43365385 TSecr=136786783  tcp.stream == 13
247  14.731560 65.55.186.235 -> 216.165.108.217 TCP 70 http > 33045 [SYN, ACK] Seq=0 Ack=1 Win=8192 Len=0 MSS=1460 SACK_PERM=1 TSval=136897068 TSecr=43365348  tcp.stream == 19
248  14.731585 216.165.108.217 -> 65.55.186.235 TCP 66 33045 > http [ACK] Seq=1 Ack=1 Win=14600 Len=0 TSval=43365385 TSecr=136897068  tcp.stream == 19
249  14.733220 216.165.108.217 -> 65.55.186.235 HTTP 545 GET /library/js/AdvanceFeatures/mp.advfeatures.js HTTP/1.1   tcp.stream == 19
250  14.745236 65.55.186.235 -> 216.165.108.217 TCP 66 http > 33040 [FIN, ACK] Seq=1055 Ack=474 Win=65160 Len=0 TSval=136786784 TSecr=43365352  tcp.stream == 14
251  14.745258 216.165.108.217 -> 65.55.186.235 TCP 66 33040 > http [ACK] Seq=474 Ack=1056 Win=15810 Len=0 TSval=43365389 TSecr=136786784  tcp.stream == 14
252  14.760091 65.54.95.134 -> 216.165.108.217 TCP 1514 [TCP segment of a reassembled PDU]  tcp.stream == 15
253  14.760110 216.165.108.217 -> 65.54.95.134 TCP 66 41196 > http [ACK] Seq=428 Ack=4345 Win=23296 Len=0 TSval=43365392 TSecr=1693653492  tcp.stream == 15
254  14.760179 65.54.95.134 -> 216.165.108.217 TCP 1514 [TCP segment of a reassembled PDU]  tcp.stream == 15
255  14.760184 216.165.108.217 -> 65.54.95.134 TCP 66 41196 > http [ACK] Seq=428 Ack=5793 Win=26240 Len=0 TSval=43365392 TSecr=1693653492  tcp.stream == 15
256  14.760304 65.54.95.134 -> 216.165.108.217 TCP 1514 [TCP segment of a reassembled PDU]  tcp.stream == 15
257  14.760310 216.165.108.217 -> 65.54.95.134 TCP 66 41196 > http [ACK] Seq=428 Ack=7241 Win=29184 Len=0 TSval=43365392 TSecr=1693653492  tcp.stream == 15
258  14.760428 65.54.95.134 -> 216.165.108.217 TCP 1514 [TCP segment of a reassembled PDU]  tcp.stream == 15
259  14.760436 216.165.108.217 -> 65.54.95.134 TCP 66 41196 > http [ACK] Seq=428 Ack=8689 Win=32000 Len=0 TSval=43365392 TSecr=1693653492  tcp.stream == 15
260  14.838889 65.54.95.134 -> 216.165.108.217 TCP 1514 [TCP segment of a reassembled PDU]  tcp.stream == 15
261  14.838907 216.165.108.217 -> 65.54.95.134 TCP 66 41196 > http [ACK] Seq=428 Ack=10137 Win=34944 Len=0 TSval=43365412 TSecr=1693653570  tcp.stream == 15
262  14.838978 65.54.95.134 -> 216.165.108.217 TCP 1514 [TCP segment of a reassembled PDU]  tcp.stream == 15
263  14.838982 216.165.108.217 -> 65.54.95.134 TCP 66 41196 > http [ACK] Seq=428 Ack=11585 Win=37888 Len=0 TSval=43365412 TSecr=1693653570  tcp.stream == 15
264  14.839093 65.54.95.134 -> 216.165.108.217 TCP 1514 [TCP segment of a reassembled PDU]  tcp.stream == 15
265  14.839099 216.165.108.217 -> 65.54.95.134 TCP 66 41196 > http [ACK] Seq=428 Ack=13033 Win=40704 Len=0 TSval=43365412 TSecr=1693653570  tcp.stream == 15
266  14.839218 65.54.95.134 -> 216.165.108.217 TCP 1514 [TCP segment of a reassembled PDU]  tcp.stream == 15
267  14.839226 216.165.108.217 -> 65.54.95.134 TCP 66 41196 > http [ACK] Seq=428 Ack=14481 Win=43648 Len=0 TSval=43365412 TSecr=1693653570  tcp.stream == 15
268  14.839340 65.54.95.134 -> 216.165.108.217 TCP 1514 [TCP segment of a reassembled PDU]  tcp.stream == 15
269  14.839346 216.165.108.217 -> 65.54.95.134 TCP 66 41196 > http [ACK] Seq=428 Ack=15929 Win=46464 Len=0 TSval=43365412 TSecr=1693653571  tcp.stream == 15
270  14.839463 65.54.95.134 -> 216.165.108.217 TCP 1514 [TCP segment of a reassembled PDU]  tcp.stream == 15
271  14.839470 216.165.108.217 -> 65.54.95.134 TCP 66 41196 > http [ACK] Seq=428 Ack=17377 Win=49408 Len=0 TSval=43365412 TSecr=1693653571  tcp.stream == 15
272  14.839586 65.54.95.134 -> 216.165.108.217 TCP 1514 [TCP segment of a reassembled PDU]  tcp.stream == 15
273  14.839592 216.165.108.217 -> 65.54.95.134 TCP 66 41196 > http [ACK] Seq=428 Ack=18825 Win=52352 Len=0 TSval=43365412 TSecr=1693653571  tcp.stream == 15
274  14.839709 65.54.95.134 -> 216.165.108.217 TCP 1514 [TCP segment of a reassembled PDU]  tcp.stream == 15
275  14.839715 216.165.108.217 -> 65.54.95.134 TCP 66 41196 > http [ACK] Seq=428 Ack=20273 Win=55168 Len=0 TSval=43365412 TSecr=1693653571  tcp.stream == 15
276  14.841204 65.55.186.235 -> 216.165.108.217 TCP 66 http > 33036 [FIN, ACK] Seq=4063 Ack=497 Win=65160 Len=0 TSval=136897079 TSecr=43365376  tcp.stream == 10
277  14.841229 216.165.108.217 -> 65.55.186.235 TCP 66 33036 > http [ACK] Seq=497 Ack=4064 Win=23168 Len=0 TSval=43365413 TSecr=136897079  tcp.stream == 10
278  14.853832 65.55.186.235 -> 216.165.108.217 HTTP 1272 HTTP/1.1 200 OK  (text/css)  tcp.stream == 17
279  14.853856 216.165.108.217 -> 65.55.186.235 TCP 66 33043 > http [ACK] Seq=470 Ack=1207 Win=16884 Len=0 TSval=43365416 TSecr=136897080  tcp.stream == 17
280  14.863134 216.165.108.217 -> 65.55.186.235 TCP 66 33043 > http [FIN, ACK] Seq=470 Ack=1207 Win=16884 Len=0 TSval=43365418 TSecr=136897080  tcp.stream == 17
281  14.867368 65.55.186.235 -> 216.165.108.217 TCP 1514 [TCP segment of a reassembled PDU]  tcp.stream == 18
282  14.867394 216.165.108.217 -> 65.55.186.235 TCP 66 33044 > http [ACK] Seq=475 Ack=1449 Win=17376 Len=0 TSval=43365419 TSecr=136786796  tcp.stream == 18
283  14.867493 65.55.186.235 -> 216.165.108.217 TCP 1514 [TCP segment of a reassembled PDU]  tcp.stream == 18
284  14.867499 216.165.108.217 -> 65.55.186.235 TCP 66 33044 > http [ACK] Seq=475 Ack=2897 Win=20272 Len=0 TSval=43365419 TSecr=136786796  tcp.stream == 18
285  14.881980 65.55.186.235 -> 216.165.108.217 TCP 1514 [TCP segment of a reassembled PDU]  tcp.stream == 19
286  14.882003 216.165.108.217 -> 65.55.186.235 TCP 66 33045 > http [ACK] Seq=480 Ack=1449 Win=17376 Len=0 TSval=43365423 TSecr=136897083  tcp.stream == 19
287  14.882071 65.55.186.235 -> 216.165.108.217 HTTP 1384 HTTP/1.1 200 OK  (application/x-javascript)  tcp.stream == 19
288  14.882076 216.165.108.217 -> 65.55.186.235 TCP 66 33045 > http [ACK] Seq=480 Ack=2767 Win=20272 Len=0 TSval=43365423 TSecr=136897083  tcp.stream == 19
290  14.892991 216.165.108.217 -> 65.55.186.235 TCP 66 33045 > http [FIN, ACK] Seq=480 Ack=2767 Win=20272 Len=0 TSval=43365426 TSecr=136897083  tcp.stream == 19
291  14.917621 65.54.95.134 -> 216.165.108.217 TCP 1514 [TCP segment of a reassembled PDU]  tcp.stream == 15
292  14.917641 216.165.108.217 -> 65.54.95.134 TCP 66 41196 > http [ACK] Seq=428 Ack=21721 Win=58112 Len=0 TSval=43365432 TSecr=1693653649  tcp.stream == 15
293  14.917721 65.54.95.134 -> 216.165.108.217 TCP 1514 [TCP segment of a reassembled PDU]  tcp.stream == 15
294  14.917726 216.165.108.217 -> 65.54.95.134 TCP 66 41196 > http [ACK] Seq=428 Ack=23169 Win=61056 Len=0 TSval=43365432 TSecr=1693653649  tcp.stream == 15
295  14.917837 65.54.95.134 -> 216.165.108.217 TCP 1514 [TCP segment of a reassembled PDU]  tcp.stream == 15
296  14.917844 216.165.108.217 -> 65.54.95.134 TCP 66 41196 > http [ACK] Seq=428 Ack=24617 Win=62848 Len=0 TSval=43365432 TSecr=1693653649  tcp.stream == 15
297  14.917962 65.54.95.134 -> 216.165.108.217 TCP 1514 [TCP segment of a reassembled PDU]  tcp.stream == 15
298  14.917971 216.165.108.217 -> 65.54.95.134 TCP 66 41196 > http [ACK] Seq=428 Ack=26065 Win=61440 Len=0 TSval=43365432 TSecr=1693653649  tcp.stream == 15
299  14.918083 65.54.95.134 -> 216.165.108.217 TCP 1514 [TCP segment of a reassembled PDU]  tcp.stream == 15
300  14.918090 216.165.108.217 -> 65.54.95.134 TCP 66 41196 > http [ACK] Seq=428 Ack=27513 Win=60032 Len=0 TSval=43365432 TSecr=1693653649  tcp.stream == 15
301  14.918205 65.54.95.134 -> 216.165.108.217 TCP 1514 [TCP segment of a reassembled PDU]  tcp.stream == 15
302  14.918211 216.165.108.217 -> 65.54.95.134 TCP 66 41196 > http [ACK] Seq=428 Ack=28961 Win=58752 Len=0 TSval=43365432 TSecr=1693653649  tcp.stream == 15
303  14.918330 65.54.95.134 -> 216.165.108.217 HTTP 1641 HTTP/1.1 200 OK  (application/x-javascript)  tcp.stream == 15
304  14.918336 216.165.108.217 -> 65.54.95.134 TCP 66 41196 > http [ACK] Seq=428 Ack=30536 Win=57216 Len=0 TSval=43365432 TSecr=1693653650  tcp.stream == 15
305  14.930450 216.165.108.217 -> 65.54.95.134 TCP 66 41196 > http [FIN, ACK] Seq=428 Ack=30536 Win=63872 Len=0 TSval=43365435 TSecr=1693653650  tcp.stream == 15
307  15.008856 65.54.95.134 -> 216.165.108.217 TCP 66 http > 41196 [ACK] Seq=30536 Ack=429 Win=101360 Len=0 TSval=1693653741 TSecr=43365435  tcp.stream == 15
308  15.008872 65.54.95.134 -> 216.165.108.217 TCP 66 http > 41196 [FIN, ACK] Seq=30536 Ack=429 Win=101360 Len=0 TSval=1693653741 TSecr=43365435  tcp.stream == 15
309  15.008879 216.165.108.217 -> 65.54.95.134 TCP 66 41196 > http [ACK] Seq=429 Ack=30537 Win=63872 Len=0 TSval=43365455 TSecr=1693653741  tcp.stream == 15
310  15.010417 65.55.186.235 -> 216.165.108.217 TCP 66 http > 33043 [FIN, ACK] Seq=1207 Ack=471 Win=65160 Len=0 TSval=136897096 TSecr=43365418  tcp.stream == 17
311  15.010440 216.165.108.217 -> 65.55.186.235 TCP 66 33043 > http [ACK] Seq=471 Ack=1208 Win=16884 Len=0 TSval=43365455 TSecr=136897096  tcp.stream == 17
312  15.014935 65.55.186.235 -> 216.165.108.217 TCP 1514 [TCP segment of a reassembled PDU]  tcp.stream == 18
313  15.014955 216.165.108.217 -> 65.55.186.235 TCP 66 33044 > http [ACK] Seq=475 Ack=4345 Win=23168 Len=0 TSval=43365456 TSecr=136786811  tcp.stream == 18
314  15.014989 65.55.186.235 -> 216.165.108.217 HTTP 880 HTTP/1.1 200 OK  (application/x-javascript)  tcp.stream == 18
315  15.014993 216.165.108.217 -> 65.55.186.235 TCP 66 33044 > http [ACK] Seq=475 Ack=5159 Win=26064 Len=0 TSval=43365456 TSecr=136786811  tcp.stream == 18
316  15.018674 216.165.108.217 -> 65.55.186.235 TCP 66 33044 > http [FIN, ACK] Seq=475 Ack=5159 Win=26064 Len=0 TSval=43365457 TSecr=136786811  tcp.stream == 18
317  15.038363 65.55.186.235 -> 216.165.108.217 TCP 66 http > 33042 [ACK] Seq=1 Ack=542 Win=65160 Len=0 TSval=136786813 TSecr=43365375  tcp.stream == 16
318  15.040214 65.55.186.235 -> 216.165.108.217 TCP 66 http > 33045 [FIN, ACK] Seq=2767 Ack=481 Win=65160 Len=0 TSval=136897099 TSecr=43365426  tcp.stream == 19
319  15.040237 216.165.108.217 -> 65.55.186.235 TCP 66 33045 > http [ACK] Seq=481 Ack=2768 Win=20272 Len=0 TSval=43365462 TSecr=136897099  tcp.stream == 19
321  15.165949 65.55.186.235 -> 216.165.108.217 TCP 66 http > 33044 [FIN, ACK] Seq=5159 Ack=476 Win=65160 Len=0 TSval=136786826 TSecr=43365457  tcp.stream == 18
322  15.165973 216.165.108.217 -> 65.55.186.235 TCP 66 33044 > http [ACK] Seq=476 Ack=5160 Win=26064 Len=0 TSval=43365494 TSecr=136786826  tcp.stream == 18
324  15.356005 65.55.186.235 -> 216.165.108.217 TCP 1514 [TCP segment of a reassembled PDU]  tcp.stream == 16
325  15.356033 216.165.108.217 -> 65.55.186.235 TCP 66 33042 > http [ACK] Seq=542 Ack=1449 Win=17376 Len=0 TSval=43365541 TSecr=136786845  tcp.stream == 16
326  15.356133 65.55.186.235 -> 216.165.108.217 TCP 1514 [TCP segment of a reassembled PDU]  tcp.stream == 16
327  15.356139 216.165.108.217 -> 65.55.186.235 TCP 66 33042 > http [ACK] Seq=542 Ack=2897 Win=20272 Len=0 TSval=43365541 TSecr=136786845  tcp.stream == 16
329  15.503499 65.55.186.235 -> 216.165.108.217 TCP 1514 [TCP segment of a reassembled PDU]  tcp.stream == 16
330  15.503520 216.165.108.217 -> 65.55.186.235 TCP 66 33042 > http [ACK] Seq=542 Ack=4345 Win=23168 Len=0 TSval=43365578 TSecr=136786860  tcp.stream == 16
331  15.503619 65.55.186.235 -> 216.165.108.217 TCP 1514 [TCP segment of a reassembled PDU]  tcp.stream == 16
332  15.503625 216.165.108.217 -> 65.55.186.235 TCP 66 33042 > http [ACK] Seq=542 Ack=5793 Win=26064 Len=0 TSval=43365578 TSecr=136786860  tcp.stream == 16
333  15.503749 65.55.186.235 -> 216.165.108.217 TCP 1514 [TCP segment of a reassembled PDU]  tcp.stream == 16
334  15.503756 216.165.108.217 -> 65.55.186.235 TCP 66 33042 > http [ACK] Seq=542 Ack=7241 Win=28960 Len=0 TSval=43365578 TSecr=136786860  tcp.stream == 16
335  15.503806 65.55.186.235 -> 216.165.108.217 HTTP 1197 HTTP/1.1 200 OK  (application/x-javascript)  tcp.stream == 16
336  15.503811 216.165.108.217 -> 65.55.186.235 TCP 66 33042 > http [ACK] Seq=542 Ack=8372 Win=31856 Len=0 TSval=43365578 TSecr=136786860  tcp.stream == 16
337  15.506795 216.165.108.217 -> 65.55.186.235 TCP 66 33042 > http [FIN, ACK] Seq=542 Ack=8372 Win=31856 Len=0 TSval=43365579 TSecr=136786860  tcp.stream == 16
339  15.653972 65.55.186.235 -> 216.165.108.217 TCP 66 http > 33042 [FIN, ACK] Seq=8372 Ack=543 Win=65160 Len=0 TSval=136786875 TSecr=43365579  tcp.stream == 16
340  15.653997 216.165.108.217 -> 65.55.186.235 TCP 66 33042 > http [ACK] Seq=543 Ack=8373 Win=31856 Len=0 TSval=43365616 TSecr=136786875  tcp.stream == 16
349  16.744145 216.165.108.217 -> 65.55.186.235 TCP 74 33046 > http [SYN] Seq=0 Win=14600 Len=0 MSS=1460 SACK_PERM=1 TSval=43365888 TSecr=0 WS=128  tcp.stream == 20
350  16.751595 216.165.108.217 -> 65.55.186.235 TCP 74 33047 > http [SYN] Seq=0 Win=14600 Len=0 MSS=1460 SACK_PERM=1 TSval=43365890 TSecr=0 WS=128  tcp.stream == 21
352  16.779869 216.165.108.217 -> 65.55.186.235 TCP 74 33048 > http [SYN] Seq=0 Win=14600 Len=0 MSS=1460 SACK_PERM=1 TSval=43365897 TSecr=0 WS=128  tcp.stream == 22
353  16.781165 216.165.108.217 -> 65.55.186.235 TCP 74 33049 > http [SYN] Seq=0 Win=14600 Len=0 MSS=1460 SACK_PERM=1 TSval=43365898 TSecr=0 WS=128  tcp.stream == 23
354  16.782314 216.165.108.217 -> 65.55.186.235 TCP 74 33050 > http [SYN] Seq=0 Win=14600 Len=0 MSS=1460 SACK_PERM=1 TSval=43365898 TSecr=0 WS=128  tcp.stream == 24
355  16.786454 216.165.108.217 -> 65.55.186.235 TCP 74 33051 > http [SYN] Seq=0 Win=14600 Len=0 MSS=1460 SACK_PERM=1 TSval=43365899 TSecr=0 WS=128  tcp.stream == 25
358  16.891592 65.55.186.235 -> 216.165.108.217 TCP 70 http > 33046 [SYN, ACK] Seq=0 Ack=1 Win=8192 Len=0 MSS=1460 SACK_PERM=1 TSval=137031303 TSecr=43365888  tcp.stream == 20
359  16.891619 216.165.108.217 -> 65.55.186.235 TCP 66 33046 > http [ACK] Seq=1 Ack=1 Win=14600 Len=0 TSval=43365925 TSecr=137031303  tcp.stream == 20
360  16.898906 65.55.186.235 -> 216.165.108.217 TCP 70 http > 33047 [SYN, ACK] Seq=0 Ack=1 Win=8192 Len=0 MSS=1460 SACK_PERM=1 TSval=136897285 TSecr=43365890  tcp.stream == 21
361  16.898933 216.165.108.217 -> 65.55.186.235 TCP 66 33047 > http [ACK] Seq=1 Ack=1 Win=14600 Len=0 TSval=43365927 TSecr=136897285  tcp.stream == 21
362  16.902361 216.165.108.217 -> 65.54.95.192 TCP 74 40598 > http [SYN] Seq=0 Win=14600 Len=0 MSS=1460 SACK_PERM=1 TSval=43365928 TSecr=0 WS=128  tcp.stream == 26
363  16.927231 65.55.186.235 -> 216.165.108.217 TCP 70 http > 33048 [SYN, ACK] Seq=0 Ack=1 Win=8192 Len=0 MSS=1460 SACK_PERM=1 TSval=136897288 TSecr=43365897  tcp.stream == 22
364  16.927258 216.165.108.217 -> 65.55.186.235 TCP 66 33048 > http [ACK] Seq=1 Ack=1 Win=14600 Len=0 TSval=43365934 TSecr=136897288  tcp.stream == 22
365  16.928563 65.55.186.235 -> 216.165.108.217 TCP 70 http > 33049 [SYN, ACK] Seq=0 Ack=1 Win=8192 Len=0 MSS=1460 SACK_PERM=1 TSval=137031307 TSecr=43365898  tcp.stream == 23
366  16.928589 216.165.108.217 -> 65.55.186.235 TCP 66 33049 > http [ACK] Seq=1 Ack=1 Win=14600 Len=0 TSval=43365934 TSecr=137031307  tcp.stream == 23
367  16.929590 65.55.186.235 -> 216.165.108.217 TCP 70 http > 33050 [SYN, ACK] Seq=0 Ack=1 Win=8192 Len=0 MSS=1460 SACK_PERM=1 TSval=136787003 TSecr=43365898  tcp.stream == 24
368  16.929615 216.165.108.217 -> 65.55.186.235 TCP 66 33050 > http [ACK] Seq=1 Ack=1 Win=14600 Len=0 TSval=43365935 TSecr=136787003  tcp.stream == 24
369  16.933814 65.55.186.235 -> 216.165.108.217 TCP 70 http > 33051 [SYN, ACK] Seq=0 Ack=1 Win=8192 Len=0 MSS=1460 SACK_PERM=1 TSval=136787003 TSecr=43365899  tcp.stream == 25
370  16.933840 216.165.108.217 -> 65.55.186.235 TCP 66 33051 > http [ACK] Seq=1 Ack=1 Win=14600 Len=0 TSval=43365936 TSecr=136787003  tcp.stream == 25
371  16.937612 216.165.108.217 -> 65.55.186.235 HTTP 518 GET /Images/Logos/MS_Header_320.jpg HTTP/1.1   tcp.stream == 20
372  16.938987 216.165.108.217 -> 65.55.186.235 HTTP 519 GET /Images/Icons/arrow_320-left.png HTTP/1.1   tcp.stream == 21
373  16.940507 216.165.108.217 -> 65.55.186.235 HTTP 520 GET /Images/Icons/arrow_320-right.png HTTP/1.1   tcp.stream == 22
374  16.943172 216.165.108.217 -> 65.55.186.235 HTTP 531 GET /en-us/Images/Panel/banner_xboxgames_320.jpg HTTP/1.1   tcp.stream == 23
375  16.952411 216.165.108.217 -> 65.54.95.192 TCP 74 40599 > http [SYN] Seq=0 Win=14600 Len=0 MSS=1460 SACK_PERM=1 TSval=43365940 TSecr=0 WS=128  tcp.stream == 27
376  16.953774 216.165.108.217 -> 65.55.186.235 HTTP 531 GET /en-us/Images/Panel/banner_office365_320.jpg HTTP/1.1   tcp.stream == 24
377  16.955006 216.165.108.217 -> 65.55.186.235 HTTP 529 GET /Images/Icons/PanelDarkArea_320x54_320.png HTTP/1.1   tcp.stream == 25
379  16.980859 65.54.95.192 -> 216.165.108.217 TCP 74 http > 40598 [SYN, ACK] Seq=0 Ack=1 Win=65535 Len=0 MSS=1460 WS=16 SACK_PERM=1 TSval=1421872976 TSecr=43365928  tcp.stream == 26
380  16.980889 216.165.108.217 -> 65.54.95.192 TCP 66 40598 > http [ACK] Seq=1 Ack=1 Win=14720 Len=0 TSval=43365948 TSecr=1421872976  tcp.stream == 26
381  16.983733 216.165.108.217 -> 65.54.95.192 HTTP 521 GET /image.aspx?uuid=0d78d0a2-942f-4a0d-96a4-c94509df0092&w=320&h=240 HTTP/1.1   tcp.stream == 26
384  17.030869 65.54.95.192 -> 216.165.108.217 TCP 74 http > 40599 [SYN, ACK] Seq=0 Ack=1 Win=65535 Len=0 MSS=1460 WS=16 SACK_PERM=1 TSval=244065503 TSecr=43365940  tcp.stream == 27
385  17.030895 216.165.108.217 -> 65.54.95.192 TCP 66 40599 > http [ACK] Seq=1 Ack=1 Win=14720 Len=0 TSval=43365960 TSecr=244065503  tcp.stream == 27
387  17.088095 65.55.186.235 -> 216.165.108.217 TCP 1514 [TCP segment of a reassembled PDU]  tcp.stream == 20
388  17.088121 216.165.108.217 -> 65.55.186.235 TCP 66 33046 > http [ACK] Seq=453 Ack=1449 Win=17376 Len=0 TSval=43365974 TSecr=137031322  tcp.stream == 20
389  17.088168 65.55.186.235 -> 216.165.108.217 HTTP 1275 HTTP/1.1 200 OK  (JPEG JFIF image)  tcp.stream == 20
390  17.088173 216.165.108.217 -> 65.55.186.235 TCP 66 33046 > http [ACK] Seq=453 Ack=2658 Win=20272 Len=0 TSval=43365974 TSecr=137031322  tcp.stream == 20
391  17.092147 65.55.186.235 -> 216.165.108.217 TCP 1514 [TCP segment of a reassembled PDU]  tcp.stream == 23
392  17.092173 216.165.108.217 -> 65.55.186.235 TCP 66 33049 > http [ACK] Seq=466 Ack=1449 Win=17376 Len=0 TSval=43365975 TSecr=137031322  tcp.stream == 23
393  17.092270 65.55.186.235 -> 216.165.108.217 TCP 1514 [TCP segment of a reassembled PDU]  tcp.stream == 23
394  17.092276 216.165.108.217 -> 65.55.186.235 TCP 66 33049 > http [ACK] Seq=466 Ack=2897 Win=20272 Len=0 TSval=43365975 TSecr=137031322  tcp.stream == 23
395  17.093616 65.55.186.235 -> 216.165.108.217 HTTP 1512 HTTP/1.1 200 OK  (PNG)  tcp.stream == 21
396  17.093644 216.165.108.217 -> 65.55.186.235 TCP 66 33047 > http [ACK] Seq=454 Ack=1447 Win=17352 Len=0 TSval=43365976 TSecr=136897304  tcp.stream == 21
397  17.093988 216.165.108.217 -> 65.55.186.235 TCP 66 33046 > http [FIN, ACK] Seq=453 Ack=2658 Win=20272 Len=0 TSval=43365976 TSecr=137031322  tcp.stream == 20
398  17.094243 65.54.95.192 -> 216.165.108.217 TCP 1514 [TCP segment of a reassembled PDU]  tcp.stream == 26
399  17.094260 216.165.108.217 -> 65.54.95.192 TCP 66 40598 > http [ACK] Seq=456 Ack=1449 Win=17536 Len=0 TSval=43365976 TSecr=1421873090  tcp.stream == 26
400  17.094364 65.54.95.192 -> 216.165.108.217 TCP 1514 [TCP segment of a reassembled PDU]  tcp.stream == 26
401  17.094371 216.165.108.217 -> 65.54.95.192 TCP 66 40598 > http [ACK] Seq=456 Ack=2897 Win=20480 Len=0 TSval=43365976 TSecr=1421873090  tcp.stream == 26
402  17.094487 65.54.95.192 -> 216.165.108.217 TCP 1514 [TCP segment of a reassembled PDU]  tcp.stream == 26
403  17.094493 216.165.108.217 -> 65.54.95.192 TCP 66 40598 > http [ACK] Seq=456 Ack=4345 Win=23296 Len=0 TSval=43365976 TSecr=1421873090  tcp.stream == 26
404  17.094611 65.54.95.192 -> 216.165.108.217 TCP 1514 [TCP segment of a reassembled PDU]  tcp.stream == 26
405  17.094620 216.165.108.217 -> 65.54.95.192 TCP 66 40598 > http [ACK] Seq=456 Ack=5793 Win=26240 Len=0 TSval=43365976 TSecr=1421873090  tcp.stream == 26
406  17.094733 65.54.95.192 -> 216.165.108.217 TCP 1514 [TCP segment of a reassembled PDU]  tcp.stream == 26
407  17.094740 216.165.108.217 -> 65.54.95.192 TCP 66 40598 > http [ACK] Seq=456 Ack=7241 Win=29184 Len=0 TSval=43365976 TSecr=1421873090  tcp.stream == 26
408  17.094855 65.54.95.192 -> 216.165.108.217 TCP 1514 [TCP segment of a reassembled PDU]  tcp.stream == 26
409  17.094862 216.165.108.217 -> 65.54.95.192 TCP 66 40598 > http [ACK] Seq=456 Ack=8689 Win=32000 Len=0 TSval=43365976 TSecr=1421873090  tcp.stream == 26
410  17.095609 216.165.108.217 -> 65.55.186.235 TCP 74 33054 > http [SYN] Seq=0 Win=14600 Len=0 MSS=1460 SACK_PERM=1 TSval=43365976 TSecr=0 WS=128  tcp.stream == 28
411  17.096376 65.55.186.235 -> 216.165.108.217 HTTP 1312 HTTP/1.1 200 OK  (PNG)  tcp.stream == 22
412  17.096402 216.165.108.217 -> 65.55.186.235 TCP 66 33048 > http [ACK] Seq=455 Ack=1247 Win=16198 Len=0 TSval=43365976 TSecr=136897304  tcp.stream == 22
413  17.102697 65.55.186.235 -> 216.165.108.217 TCP 1514 [TCP segment of a reassembled PDU]  tcp.stream == 24
414  17.102723 216.165.108.217 -> 65.55.186.235 TCP 66 33050 > http [ACK] Seq=466 Ack=1449 Win=17376 Len=0 TSval=43365978 TSecr=136787019  tcp.stream == 24
415  17.102820 65.55.186.235 -> 216.165.108.217 TCP 1514 [TCP segment of a reassembled PDU]  tcp.stream == 24
416  17.102826 216.165.108.217 -> 65.55.186.235 TCP 66 33050 > http [ACK] Seq=466 Ack=2897 Win=20272 Len=0 TSval=43365978 TSecr=136787019  tcp.stream == 24
417  17.108852 65.55.186.235 -> 216.165.108.217 TCP 1514 [TCP segment of a reassembled PDU]  tcp.stream == 25
418  17.108875 216.165.108.217 -> 65.55.186.235 TCP 66 33051 > http [ACK] Seq=464 Ack=1449 Win=17376 Len=0 TSval=43365980 TSecr=136787019  tcp.stream == 25
419  17.108977 65.55.186.235 -> 216.165.108.217 TCP 1514 [TCP segment of a reassembled PDU]  tcp.stream == 25
420  17.108983 216.165.108.217 -> 65.55.186.235 TCP 66 33051 > http [ACK] Seq=464 Ack=2897 Win=20272 Len=0 TSval=43365980 TSecr=136787019  tcp.stream == 25
421  17.172961 65.54.95.192 -> 216.165.108.217 TCP 1514 [TCP segment of a reassembled PDU]  tcp.stream == 26
422  17.172981 216.165.108.217 -> 65.54.95.192 TCP 66 40598 > http [ACK] Seq=456 Ack=10137 Win=34944 Len=0 TSval=43365996 TSecr=1421873168  tcp.stream == 26
423  17.173082 65.54.95.192 -> 216.165.108.217 TCP 1514 [TCP segment of a reassembled PDU]  tcp.stream == 26
424  17.173089 216.165.108.217 -> 65.54.95.192 TCP 66 40598 > http [ACK] Seq=456 Ack=11585 Win=37888 Len=0 TSval=43365996 TSecr=1421873168  tcp.stream == 26
425  17.173195 65.54.95.192 -> 216.165.108.217 TCP 1514 [TCP segment of a reassembled PDU]  tcp.stream == 26
426  17.173202 216.165.108.217 -> 65.54.95.192 TCP 66 40598 > http [ACK] Seq=456 Ack=13033 Win=40704 Len=0 TSval=43365996 TSecr=1421873168  tcp.stream == 26
427  17.173326 65.54.95.192 -> 216.165.108.217 TCP 1514 [TCP segment of a reassembled PDU]  tcp.stream == 26
428  17.173335 216.165.108.217 -> 65.54.95.192 TCP 66 40598 > http [ACK] Seq=456 Ack=14481 Win=43648 Len=0 TSval=43365996 TSecr=1421873169  tcp.stream == 26
429  17.173447 65.54.95.192 -> 216.165.108.217 TCP 1514 [TCP segment of a reassembled PDU]  tcp.stream == 26
430  17.173454 216.165.108.217 -> 65.54.95.192 TCP 66 40598 > http [ACK] Seq=456 Ack=15929 Win=46464 Len=0 TSval=43365996 TSecr=1421873169  tcp.stream == 26
431  17.173506 65.54.95.192 -> 216.165.108.217 HTTP 913 HTTP/1.1 200 OK  (JPEG JFIF image)  tcp.stream == 26
432  17.173511 216.165.108.217 -> 65.54.95.192 TCP 66 40598 > http [ACK] Seq=456 Ack=16776 Win=49408 Len=0 TSval=43365996 TSecr=1421873169  tcp.stream == 26
433  17.177301 216.165.108.217 -> 65.55.186.235 TCP 66 33047 > http [FIN, ACK] Seq=454 Ack=1447 Win=17352 Len=0 TSval=43365997 TSecr=136897304  tcp.stream == 21
434  17.178308 216.165.108.217 -> 65.55.186.235 TCP 74 33055 > http [SYN] Seq=0 Win=14600 Len=0 MSS=1460 SACK_PERM=1 TSval=43365997 TSecr=0 WS=128  tcp.stream == 29
435  17.179050 216.165.108.217 -> 65.55.186.235 TCP 66 33048 > http [FIN, ACK] Seq=455 Ack=1247 Win=16198 Len=0 TSval=43365997 TSecr=136897304  tcp.stream == 22
436  17.180061 216.165.108.217 -> 65.55.186.235 TCP 74 33056 > http [SYN] Seq=0 Win=14600 Len=0 MSS=1460 SACK_PERM=1 TSval=43365997 TSecr=0 WS=128  tcp.stream == 30
437  17.190106 216.165.108.217 -> 65.54.95.192 TCP 66 40598 > http [FIN, ACK] Seq=456 Ack=16776 Win=49408 Len=0 TSval=43366000 TSecr=1421873169  tcp.stream == 26
440  17.237922 216.165.108.217 -> 66.150.117.33 TCP 74 43218 > http [SYN] Seq=0 Win=14600 Len=0 MSS=1460 SACK_PERM=1 TSval=43366012 TSecr=0 WS=128  tcp.stream == 31
441  17.239751 65.55.186.235 -> 216.165.108.217 TCP 1514 [TCP segment of a reassembled PDU]  tcp.stream == 23
442  17.239774 216.165.108.217 -> 65.55.186.235 TCP 66 33049 > http [ACK] Seq=466 Ack=4345 Win=23168 Len=0 TSval=43366012 TSecr=137031338  tcp.stream == 23
443  17.239872 65.55.186.235 -> 216.165.108.217 TCP 1514 [TCP segment of a reassembled PDU]  tcp.stream == 23
444  17.239878 216.165.108.217 -> 65.55.186.235 TCP 66 33049 > http [ACK] Seq=466 Ack=5793 Win=26064 Len=0 TSval=43366012 TSecr=137031338  tcp.stream == 23
445  17.239987 65.55.186.235 -> 216.165.108.217 TCP 1514 [TCP segment of a reassembled PDU]  tcp.stream == 23
446  17.239995 216.165.108.217 -> 65.55.186.235 TCP 66 33049 > http [ACK] Seq=466 Ack=7241 Win=28960 Len=0 TSval=43366012 TSecr=137031338  tcp.stream == 23
447  17.240110 65.55.186.235 -> 216.165.108.217 TCP 1514 [TCP segment of a reassembled PDU]  tcp.stream == 23
448  17.240116 216.165.108.217 -> 65.55.186.235 TCP 66 33049 > http [ACK] Seq=466 Ack=8689 Win=31856 Len=0 TSval=43366012 TSecr=137031338  tcp.stream == 23
449  17.241213 65.55.186.235 -> 216.165.108.217 TCP 66 http > 33046 [FIN, ACK] Seq=2658 Ack=454 Win=65160 Len=0 TSval=137031338 TSecr=43365976  tcp.stream == 20
450  17.241237 216.165.108.217 -> 65.55.186.235 TCP 66 33046 > http [ACK] Seq=454 Ack=2659 Win=20272 Len=0 TSval=43366013 TSecr=137031338  tcp.stream == 20
451  17.242904 65.55.186.235 -> 216.165.108.217 TCP 70 http > 33054 [SYN, ACK] Seq=0 Ack=1 Win=8192 Len=0 MSS=1460 SACK_PERM=1 TSval=136787034 TSecr=43365976  tcp.stream == 28
452  17.242932 216.165.108.217 -> 65.55.186.235 TCP 66 33054 > http [ACK] Seq=1 Ack=1 Win=14600 Len=0 TSval=43366013 TSecr=136787034  tcp.stream == 28
453  17.244592 66.150.117.33 -> 216.165.108.217 TCP 78 http > 43218 [SYN, ACK] Seq=0 Ack=1 Win=16384 Len=0 MSS=1460 WS=1 TSval=0 TSecr=0 SACK_PERM=1  tcp.stream == 31
454  17.244624 216.165.108.217 -> 66.150.117.33 TCP 66 43218 > http [ACK] Seq=1 Ack=1 Win=14720 Len=0 TSval=43366013 TSecr=0  tcp.stream == 31
455  17.250236 65.55.186.235 -> 216.165.108.217 TCP 1514 [TCP segment of a reassembled PDU]  tcp.stream == 24
456  17.250257 216.165.108.217 -> 65.55.186.235 TCP 66 33050 > http [ACK] Seq=466 Ack=4345 Win=23168 Len=0 TSval=43366015 TSecr=136787035  tcp.stream == 24
457  17.250356 65.55.186.235 -> 216.165.108.217 TCP 1514 [TCP segment of a reassembled PDU]  tcp.stream == 24
458  17.250362 216.165.108.217 -> 65.55.186.235 TCP 66 33050 > http [ACK] Seq=466 Ack=5793 Win=26064 Len=0 TSval=43366015 TSecr=136787035  tcp.stream == 24
459  17.250471 65.55.186.235 -> 216.165.108.217 TCP 1514 [TCP segment of a reassembled PDU]  tcp.stream == 24
460  17.250479 216.165.108.217 -> 65.55.186.235 TCP 66 33050 > http [ACK] Seq=466 Ack=7241 Win=28960 Len=0 TSval=43366015 TSecr=136787035  tcp.stream == 24
461  17.250594 65.55.186.235 -> 216.165.108.217 TCP 1514 [TCP segment of a reassembled PDU]  tcp.stream == 24
462  17.250603 216.165.108.217 -> 65.55.186.235 TCP 66 33050 > http [ACK] Seq=466 Ack=8689 Win=31856 Len=0 TSval=43366015 TSecr=136787035  tcp.stream == 24
463  17.256182 65.55.186.235 -> 216.165.108.217 HTTP 506 HTTP/1.1 200 OK  (PNG)  tcp.stream == 25
464  17.256205 216.165.108.217 -> 65.55.186.235 TCP 66 33051 > http [ACK] Seq=464 Ack=3337 Win=23168 Len=0 TSval=43366016 TSecr=136787035  tcp.stream == 25
465  17.256623 216.165.108.217 -> 65.55.186.235 HTTP 524 GET /Images/Icons/carousel_dot_active.png HTTP/1.1   tcp.stream == 28
466  17.257920 216.165.108.217 -> 66.150.117.33 HTTP 1038 GET /dcs3k3lty00000oa4hws4uybu_3c3o/dcs.gif?dcsdat=120216172953&dcssip=m.microsoft.com&dcsuri=%2Fen-us%2Fdefault.mspx&dcscfg=&dcsref=none&dcsqry=none&sid=ZoCx_2ZVW0e9EBVGPwdoQw&dm=Android+4.x&mo=Internet&c=US&df=Generic&dg=hi&sc=1&sj=0&os=Android&ov=4.x&x=320&y=640&ml=xhtml&sm=0&scc=1&sv=1&se=1&ss=1&wt.ti=Microsoft+Home&nvr=New&wt.es=android&wt.mpe=mHP-views&wt.mpvf=10104&wt.mpoem=Unknown&wt.mpmo=Unknown&wt.mpivcr=1&wt.ua=Mozilla%2F5.0+(Linux%3B+U%3B+Android+4.0.2%3B+en-us%3B+google_sdk+Build%2FICS_MR0)+AppleWebKit%2F534.30+(KHTML,+like+Gecko)+Version%2F4.0+Mobile+Safari%2F534.30&wt.mpjsr=1 HTTP/1.1   tcp.stream == 31
467  17.262252 216.165.108.217 -> 65.55.186.235 TCP 66 33051 > http [FIN, ACK] Seq=464 Ack=3337 Win=23168 Len=0 TSval=43366018 TSecr=136787035  tcp.stream == 25
468  17.265341 66.150.117.33 -> 216.165.108.217 HTTP 1107 HTTP/1.1 303 Object Moved   tcp.stream == 31
469  17.265368 216.165.108.217 -> 66.150.117.33 TCP 66 43218 > http [ACK] Seq=973 Ack=1042 Win=16768 Len=0 TSval=43366019 TSecr=2424984  tcp.stream == 31
470  17.265375 66.150.117.33 -> 216.165.108.217 TCP 66 http > 43218 [FIN, ACK] Seq=1042 Ack=973 Win=64563 Len=0 TSval=2424984 TSecr=43366017  tcp.stream == 31
471  17.268608 65.54.95.192 -> 216.165.108.217 TCP 66 http > 40598 [ACK] Seq=16776 Ack=457 Win=66608 Len=0 TSval=1421873264 TSecr=43366000  tcp.stream == 26
472  17.268798 65.54.95.192 -> 216.165.108.217 TCP 66 http > 40598 [FIN, ACK] Seq=16776 Ack=457 Win=66608 Len=0 TSval=1421873265 TSecr=43366000  tcp.stream == 26
473  17.268809 216.165.108.217 -> 65.54.95.192 TCP 66 40598 > http [ACK] Seq=457 Ack=16777 Win=49408 Len=0 TSval=43366020 TSecr=1421873265  tcp.stream == 26
474  17.269091 216.165.108.217 -> 65.55.186.235 TCP 74 33058 > http [SYN] Seq=0 Win=14600 Len=0 MSS=1460 SACK_PERM=1 TSval=43366020 TSecr=0 WS=128  tcp.stream == 32
475  17.304740 216.165.108.217 -> 66.150.117.33 TCP 66 43218 > http [ACK] Seq=973 Ack=1043 Win=16768 Len=0 TSval=43366029 TSecr=2424984  tcp.stream == 31
476  17.324629 65.55.186.235 -> 216.165.108.217 TCP 66 http > 33047 [FIN, ACK] Seq=1447 Ack=455 Win=65160 Len=0 TSval=136897328 TSecr=43365997  tcp.stream == 21
477  17.324654 216.165.108.217 -> 65.55.186.235 TCP 66 33047 > http [ACK] Seq=455 Ack=1448 Win=17352 Len=0 TSval=43366033 TSecr=136897328  tcp.stream == 21
478  17.325650 65.55.186.235 -> 216.165.108.217 TCP 70 http > 33055 [SYN, ACK] Seq=0 Ack=1 Win=8192 Len=0 MSS=1460 SACK_PERM=1 TSval=136787042 TSecr=43365997  tcp.stream == 29
479  17.325678 216.165.108.217 -> 65.55.186.235 TCP 66 33055 > http [ACK] Seq=1 Ack=1 Win=14600 Len=0 TSval=43366034 TSecr=136787042  tcp.stream == 29
480  17.326430 65.55.186.235 -> 216.165.108.217 TCP 66 http > 33048 [FIN, ACK] Seq=1247 Ack=456 Win=65160 Len=0 TSval=136897328 TSecr=43365997  tcp.stream == 22
481  17.326453 216.165.108.217 -> 65.55.186.235 TCP 66 33048 > http [ACK] Seq=456 Ack=1248 Win=16198 Len=0 TSval=43366034 TSecr=136897328  tcp.stream == 22
482  17.327370 65.55.186.235 -> 216.165.108.217 TCP 70 http > 33056 [SYN, ACK] Seq=0 Ack=1 Win=8192 Len=0 MSS=1460 SACK_PERM=1 TSval=136897328 TSecr=43365997  tcp.stream == 30
483  17.327396 216.165.108.217 -> 65.55.186.235 TCP 66 33056 > http [ACK] Seq=1 Ack=1 Win=14600 Len=0 TSval=43366034 TSecr=136897328  tcp.stream == 30
484  17.327987 216.165.108.217 -> 65.55.186.235 HTTP 517 GET /Images/Icons/carousel_dot.png HTTP/1.1   tcp.stream == 29
485  17.330447 216.165.108.217 -> 65.55.186.235 HTTP 543 GET /en-us/Images/Tiles/Android/android_bing_156X140_320.png HTTP/1.1   tcp.stream == 30
486  17.387445 65.55.186.235 -> 216.165.108.217 TCP 1514 [TCP segment of a reassembled PDU]  tcp.stream == 23
487  17.387466 216.165.108.217 -> 65.55.186.235 TCP 66 33049 > http [ACK] Seq=466 Ack=10137 Win=34752 Len=0 TSval=43366049 TSecr=137031353  tcp.stream == 23
488  17.387648 65.55.186.235 -> 216.165.108.217 TCP 1514 [TCP segment of a reassembled PDU]  tcp.stream == 23
489  17.387656 216.165.108.217 -> 65.55.186.235 TCP 66 33049 > http [ACK] Seq=466 Ack=11585 Win=37648 Len=0 TSval=43366049 TSecr=137031353  tcp.stream == 23
490  17.387776 65.55.186.235 -> 216.165.108.217 TCP 1514 [TCP segment of a reassembled PDU]  tcp.stream == 23
491  17.387785 216.165.108.217 -> 65.55.186.235 TCP 66 33049 > http [ACK] Seq=466 Ack=13033 Win=40544 Len=0 TSval=43366049 TSecr=137031353  tcp.stream == 23
492  17.387898 65.55.186.235 -> 216.165.108.217 TCP 1514 [TCP segment of a reassembled PDU]  tcp.stream == 23
493  17.387905 216.165.108.217 -> 65.55.186.235 TCP 66 33049 > http [ACK] Seq=466 Ack=14481 Win=43440 Len=0 TSval=43366049 TSecr=137031353  tcp.stream == 23
494  17.388021 65.55.186.235 -> 216.165.108.217 TCP 1514 [TCP segment of a reassembled PDU]  tcp.stream == 23
495  17.388029 216.165.108.217 -> 65.55.186.235 TCP 66 33049 > http [ACK] Seq=466 Ack=15929 Win=46336 Len=0 TSval=43366049 TSecr=137031353  tcp.stream == 23
496  17.388144 65.55.186.235 -> 216.165.108.217 TCP 1514 [TCP segment of a reassembled PDU]  tcp.stream == 23
497  17.388151 216.165.108.217 -> 65.55.186.235 TCP 66 33049 > http [ACK] Seq=466 Ack=17377 Win=49232 Len=0 TSval=43366049 TSecr=137031353  tcp.stream == 23
498  17.388267 65.55.186.235 -> 216.165.108.217 TCP 1514 [TCP segment of a reassembled PDU]  tcp.stream == 23
499  17.388272 216.165.108.217 -> 65.55.186.235 TCP 66 33049 > http [ACK] Seq=466 Ack=18825 Win=52128 Len=0 TSval=43366049 TSecr=137031353  tcp.stream == 23
500  17.388380 65.55.186.235 -> 216.165.108.217 HTTP 1436 HTTP/1.1 200 OK  (JPEG JFIF image)  tcp.stream == 23
501  17.388387 216.165.108.217 -> 65.55.186.235 TCP 66 33049 > http [ACK] Seq=466 Ack=20195 Win=55024 Len=0 TSval=43366049 TSecr=137031353  tcp.stream == 23
502  17.392422 216.165.108.217 -> 65.55.186.235 TCP 66 33049 > http [FIN, ACK] Seq=466 Ack=20195 Win=55024 Len=0 TSval=43366050 TSecr=137031353  tcp.stream == 23
503  17.393437 216.165.108.217 -> 65.55.186.235 TCP 74 33059 > http [SYN] Seq=0 Win=14600 Len=0 MSS=1460 SACK_PERM=1 TSval=43366051 TSecr=0 WS=128  tcp.stream == 33
504  17.397785 65.55.186.235 -> 216.165.108.217 TCP 1514 [TCP segment of a reassembled PDU]  tcp.stream == 24
505  17.397807 216.165.108.217 -> 65.55.186.235 TCP 66 33050 > http [ACK] Seq=466 Ack=10137 Win=34752 Len=0 TSval=43366052 TSecr=136787049  tcp.stream == 24
506  17.397905 65.55.186.235 -> 216.165.108.217 TCP 1514 [TCP segment of a reassembled PDU]  tcp.stream == 24
507  17.397911 216.165.108.217 -> 65.55.186.235 TCP 66 33050 > http [ACK] Seq=466 Ack=11585 Win=37648 Len=0 TSval=43366052 TSecr=136787049  tcp.stream == 24
508  17.398028 65.55.186.235 -> 216.165.108.217 TCP 1514 [TCP segment of a reassembled PDU]  tcp.stream == 24
509  17.398035 216.165.108.217 -> 65.55.186.235 TCP 66 33050 > http [ACK] Seq=466 Ack=13033 Win=40544 Len=0 TSval=43366052 TSecr=136787049  tcp.stream == 24
510  17.398149 65.55.186.235 -> 216.165.108.217 TCP 1514 [TCP segment of a reassembled PDU]  tcp.stream == 24
511  17.398157 216.165.108.217 -> 65.55.186.235 TCP 66 33050 > http [ACK] Seq=466 Ack=14481 Win=43440 Len=0 TSval=43366052 TSecr=136787049  tcp.stream == 24
512  17.398273 65.55.186.235 -> 216.165.108.217 TCP 1514 [TCP segment of a reassembled PDU]  tcp.stream == 24
513  17.398278 216.165.108.217 -> 65.55.186.235 TCP 66 33050 > http [ACK] Seq=466 Ack=15929 Win=46336 Len=0 TSval=43366052 TSecr=136787049  tcp.stream == 24
514  17.398389 65.55.186.235 -> 216.165.108.217 TCP 1514 [TCP segment of a reassembled PDU]  tcp.stream == 24
515  17.398393 216.165.108.217 -> 65.55.186.235 TCP 66 33050 > http [ACK] Seq=466 Ack=17377 Win=49232 Len=0 TSval=43366052 TSecr=136787049  tcp.stream == 24
516  17.398520 65.55.186.235 -> 216.165.108.217 TCP 1514 [TCP segment of a reassembled PDU]  tcp.stream == 24
517  17.398527 216.165.108.217 -> 65.55.186.235 TCP 66 33050 > http [ACK] Seq=466 Ack=18825 Win=52128 Len=0 TSval=43366052 TSecr=136787049  tcp.stream == 24
518  17.398650 65.55.186.235 -> 216.165.108.217 TCP 1514 [TCP segment of a reassembled PDU]  tcp.stream == 24
519  17.398657 216.165.108.217 -> 65.55.186.235 TCP 66 33050 > http [ACK] Seq=466 Ack=20273 Win=55024 Len=0 TSval=43366052 TSecr=136787049  tcp.stream == 24
520  17.406760 65.55.186.235 -> 216.165.108.217 HTTP 1510 HTTP/1.1 200 OK  (PNG)  tcp.stream == 28
521  17.406791 216.165.108.217 -> 65.55.186.235 TCP 66 33054 > http [ACK] Seq=459 Ack=1445 Win=17328 Len=0 TSval=43366054 TSecr=136787049  tcp.stream == 28
523  17.409571 65.55.186.235 -> 216.165.108.217 TCP 66 http > 33051 [FIN, ACK] Seq=3337 Ack=465 Win=65160 Len=0 TSval=136787051 TSecr=43366018  tcp.stream == 25
524  17.409596 216.165.108.217 -> 65.55.186.235 TCP 66 33051 > http [ACK] Seq=465 Ack=3338 Win=23168 Len=0 TSval=43366055 TSecr=136787051  tcp.stream == 25
525  17.413572 216.165.108.217 -> 65.55.186.235 TCP 66 33054 > http [FIN, ACK] Seq=459 Ack=1445 Win=17328 Len=0 TSval=43366056 TSecr=136787049  tcp.stream == 28
526  17.416423 65.55.186.235 -> 216.165.108.217 TCP 70 http > 33058 [SYN, ACK] Seq=0 Ack=1 Win=8192 Len=0 MSS=1460 SACK_PERM=1 TSval=136897337 TSecr=43366020  tcp.stream == 32
527  17.416450 216.165.108.217 -> 65.55.186.235 TCP 66 33058 > http [ACK] Seq=1 Ack=1 Win=14600 Len=0 TSval=43366056 TSecr=136897337  tcp.stream == 32
528  17.420718 216.165.108.217 -> 65.55.186.235 TCP 74 33060 > http [SYN] Seq=0 Win=14600 Len=0 MSS=1460 SACK_PERM=1 TSval=43366057 TSecr=0 WS=128  tcp.stream == 34
529  17.423613 216.165.108.217 -> 65.55.186.235 HTTP 544 GET /en-us/Images/Tiles/Android/android_msnbc_156X140_320.png HTTP/1.1   tcp.stream == 32
530  17.478016 65.55.186.235 -> 216.165.108.217 HTTP 751 HTTP/1.1 200 OK  (PNG)  tcp.stream == 29
531  17.478039 216.165.108.217 -> 65.55.186.235 TCP 66 33055 > http [ACK] Seq=452 Ack=686 Win=15755 Len=0 TSval=43366072 TSecr=136787057  tcp.stream == 29
532  17.481684 65.55.186.235 -> 216.165.108.217 TCP 1514 [TCP segment of a reassembled PDU]  tcp.stream == 30
533  17.481707 216.165.108.217 -> 65.55.186.235 TCP 66 33056 > http [ACK] Seq=478 Ack=1449 Win=17376 Len=0 TSval=43366073 TSecr=136897343  tcp.stream == 30
534  17.481757 65.55.186.235 -> 216.165.108.217 HTTP 1223 HTTP/1.1 200 OK  (PNG)  tcp.stream == 30
535  17.481762 216.165.108.217 -> 65.55.186.235 TCP 66 33056 > http [ACK] Seq=478 Ack=2606 Win=20272 Len=0 TSval=43366073 TSecr=136897343  tcp.stream == 30
536  17.485084 216.165.108.217 -> 65.55.186.235 TCP 66 33055 > http [FIN, ACK] Seq=452 Ack=686 Win=15755 Len=0 TSval=43366074 TSecr=136787057  tcp.stream == 29
537  17.486084 216.165.108.217 -> 65.55.186.235 TCP 74 33061 > http [SYN] Seq=0 Win=14600 Len=0 MSS=1460 SACK_PERM=1 TSval=43366074 TSecr=0 WS=128  tcp.stream == 35
538  17.491584 216.165.108.217 -> 65.55.186.235 TCP 66 33056 > http [FIN, ACK] Seq=478 Ack=2606 Win=20272 Len=0 TSval=43366075 TSecr=136897343  tcp.stream == 30
539  17.492622 216.165.108.217 -> 65.55.186.235 TCP 74 33062 > http [SYN] Seq=0 Win=14600 Len=0 MSS=1460 SACK_PERM=1 TSval=43366075 TSecr=0 WS=128  tcp.stream == 36
540  17.539677 65.55.186.235 -> 216.165.108.217 TCP 66 http > 33049 [FIN, ACK] Seq=20195 Ack=467 Win=65160 Len=0 TSval=137031368 TSecr=43366050  tcp.stream == 23
541  17.539704 216.165.108.217 -> 65.55.186.235 TCP 66 33049 > http [ACK] Seq=467 Ack=20196 Win=55024 Len=0 TSval=43366087 TSecr=137031368  tcp.stream == 23
542  17.540769 65.55.186.235 -> 216.165.108.217 TCP 70 http > 33059 [SYN, ACK] Seq=0 Ack=1 Win=8192 Len=0 MSS=1460 SACK_PERM=1 TSval=136897349 TSecr=43366051  tcp.stream == 33
543  17.540790 216.165.108.217 -> 65.55.186.235 TCP 66 33059 > http [ACK] Seq=1 Ack=1 Win=14600 Len=0 TSval=43366088 TSecr=136897349  tcp.stream == 33
544  17.544394 216.165.108.217 -> 65.55.186.235 HTTP 526 GET /library/assets/images/ratingstar_4.gif HTTP/1.1   tcp.stream == 33
545  17.545410 65.55.186.235 -> 216.165.108.217 TCP 1514 [TCP segment of a reassembled PDU]  tcp.stream == 24
546  17.545434 216.165.108.217 -> 65.55.186.235 TCP 66 33050 > http [ACK] Seq=466 Ack=21721 Win=57920 Len=0 TSval=43366089 TSecr=136787064  tcp.stream == 24
547  17.545532 65.55.186.235 -> 216.165.108.217 TCP 1514 [TCP segment of a reassembled PDU]  tcp.stream == 24
548  17.545538 216.165.108.217 -> 65.55.186.235 TCP 66 33050 > http [ACK] Seq=466 Ack=23169 Win=60816 Len=0 TSval=43366089 TSecr=136787064  tcp.stream == 24
549  17.545650 65.55.186.235 -> 216.165.108.217 TCP 1514 [TCP segment of a reassembled PDU]  tcp.stream == 24
550  17.545657 216.165.108.217 -> 65.55.186.235 TCP 66 33050 > http [ACK] Seq=466 Ack=24617 Win=60816 Len=0 TSval=43366089 TSecr=136787064  tcp.stream == 24
551  17.545771 65.55.186.235 -> 216.165.108.217 TCP 1514 [TCP segment of a reassembled PDU]  tcp.stream == 24
552  17.545779 216.165.108.217 -> 65.55.186.235 TCP 66 33050 > http [ACK] Seq=466 Ack=26065 Win=59368 Len=0 TSval=43366089 TSecr=136787064  tcp.stream == 24
553  17.545896 65.55.186.235 -> 216.165.108.217 TCP 1514 [TCP segment of a reassembled PDU]  tcp.stream == 24
554  17.545903 216.165.108.217 -> 65.55.186.235 TCP 66 33050 > http [ACK] Seq=466 Ack=27513 Win=63712 Len=0 TSval=43366089 TSecr=136787064  tcp.stream == 24
555  17.546018 65.55.186.235 -> 216.165.108.217 TCP 1514 [TCP segment of a reassembled PDU]  tcp.stream == 24
556  17.546024 216.165.108.217 -> 65.55.186.235 TCP 66 33050 > http [ACK] Seq=466 Ack=28961 Win=62264 Len=0 TSval=43366089 TSecr=136787064  tcp.stream == 24
557  17.546143 65.55.186.235 -> 216.165.108.217 TCP 1514 [TCP segment of a reassembled PDU]  tcp.stream == 24
558  17.546150 216.165.108.217 -> 65.55.186.235 TCP 66 33050 > http [ACK] Seq=466 Ack=30409 Win=60816 Len=0 TSval=43366089 TSecr=136787064  tcp.stream == 24
559  17.546266 65.55.186.235 -> 216.165.108.217 TCP 1514 [TCP segment of a reassembled PDU]  tcp.stream == 24
560  17.546273 65.55.186.235 -> 216.165.108.217 HTTP 467 HTTP/1.1 200 OK  (JPEG JFIF image)  tcp.stream == 24
561  17.546868 216.165.108.217 -> 65.55.186.235 TCP 66 33050 > http [ACK] Seq=466 Ack=32258 Win=58967 Len=0 TSval=43366089 TSecr=136787064  tcp.stream == 24
562  17.549808 216.165.108.217 -> 65.55.186.235 TCP 66 33050 > http [FIN, ACK] Seq=466 Ack=32258 Win=63712 Len=0 TSval=43366090 TSecr=136787064  tcp.stream == 24
563  17.550885 216.165.108.217 -> 65.55.186.235 TCP 74 33063 > http [SYN] Seq=0 Win=14600 Len=0 MSS=1460 SACK_PERM=1 TSval=43366090 TSecr=0 WS=128  tcp.stream == 37
564  17.560807 65.55.186.235 -> 216.165.108.217 TCP 66 http > 33054 [FIN, ACK] Seq=1445 Ack=460 Win=65160 Len=0 TSval=136787066 TSecr=43366056  tcp.stream == 28
565  17.560829 216.165.108.217 -> 65.55.186.235 TCP 66 33054 > http [ACK] Seq=460 Ack=1446 Win=17328 Len=0 TSval=43366093 TSecr=136787066  tcp.stream == 28
566  17.568127 65.55.186.235 -> 216.165.108.217 TCP 70 http > 33060 [SYN, ACK] Seq=0 Ack=1 Win=8192 Len=0 MSS=1460 SACK_PERM=1 TSval=136787066 TSecr=43366057  tcp.stream == 34
567  17.568153 216.165.108.217 -> 65.55.186.235 TCP 66 33060 > http [ACK] Seq=1 Ack=1 Win=14600 Len=0 TSval=43366094 TSecr=136787066  tcp.stream == 34
568  17.570359 216.165.108.217 -> 65.55.186.235 HTTP 520 GET /Images/Icons/Expand_Icon_480.png HTTP/1.1   tcp.stream == 34
569  17.573101 65.55.186.235 -> 216.165.108.217 TCP 1514 [TCP segment of a reassembled PDU]  tcp.stream == 32
570  17.573127 216.165.108.217 -> 65.55.186.235 TCP 66 33058 > http [ACK] Seq=479 Ack=1449 Win=17376 Len=0 TSval=43366096 TSecr=136897352  tcp.stream == 32
571  17.573226 65.55.186.235 -> 216.165.108.217 TCP 1514 [TCP segment of a reassembled PDU]  tcp.stream == 32
572  17.573232 216.165.108.217 -> 65.55.186.235 TCP 66 33058 > http [ACK] Seq=479 Ack=2897 Win=20272 Len=0 TSval=43366096 TSecr=136897352  tcp.stream == 32
574  17.632395 65.55.186.235 -> 216.165.108.217 TCP 66 http > 33055 [FIN, ACK] Seq=686 Ack=453 Win=65160 Len=0 TSval=136787073 TSecr=43366074  tcp.stream == 29
575  17.632423 216.165.108.217 -> 65.55.186.235 TCP 66 33055 > http [ACK] Seq=453 Ack=687 Win=15755 Len=0 TSval=43366110 TSecr=136787073  tcp.stream == 29
576  17.633471 65.55.186.235 -> 216.165.108.217 TCP 70 http > 33061 [SYN, ACK] Seq=0 Ack=1 Win=8192 Len=0 MSS=1460 SACK_PERM=1 TSval=137031377 TSecr=43366074  tcp.stream == 35
577  17.633497 216.165.108.217 -> 65.55.186.235 TCP 66 33061 > http [ACK] Seq=1 Ack=1 Win=14600 Len=0 TSval=43366111 TSecr=137031377  tcp.stream == 35
578  17.635518 216.165.108.217 -> 65.55.186.235 HTTP 522 GET /Images/Icons/Collapse_Icon_480.png HTTP/1.1   tcp.stream == 35
579  17.638784 65.55.186.235 -> 216.165.108.217 TCP 66 http > 33056 [FIN, ACK] Seq=2606 Ack=479 Win=65160 Len=0 TSval=136897359 TSecr=43366075  tcp.stream == 30
580  17.638810 216.165.108.217 -> 65.55.186.235 TCP 66 33056 > http [ACK] Seq=479 Ack=2607 Win=20272 Len=0 TSval=43366112 TSecr=136897359  tcp.stream == 30
581  17.639972 65.55.186.235 -> 216.165.108.217 TCP 70 http > 33062 [SYN, ACK] Seq=0 Ack=1 Win=8192 Len=0 MSS=1460 SACK_PERM=1 TSval=136787074 TSecr=43366075  tcp.stream == 36
582  17.639998 216.165.108.217 -> 65.55.186.235 TCP 66 33062 > http [ACK] Seq=1 Ack=1 Win=14600 Len=0 TSval=43366112 TSecr=136787074  tcp.stream == 36
583  17.643307 216.165.108.217 -> 65.55.186.235 HTTP 519 GET /Images/Products/Windows_320.jpg HTTP/1.1   tcp.stream == 36
584  17.693085 65.55.186.235 -> 216.165.108.217 HTTP 806 HTTP/1.1 200 OK  (GIF89a)  tcp.stream == 33
585  17.693110 216.165.108.217 -> 65.55.186.235 TCP 66 33059 > http [ACK] Seq=461 Ack=741 Win=15540 Len=0 TSval=43366126 TSecr=136897363  tcp.stream == 33
586  17.697025 65.55.186.235 -> 216.165.108.217 TCP 66 http > 33050 [FIN, ACK] Seq=32258 Ack=467 Win=65160 Len=0 TSval=136787079 TSecr=43366090  tcp.stream == 24
587  17.697046 216.165.108.217 -> 65.55.186.235 TCP 66 33050 > http [ACK] Seq=467 Ack=32259 Win=63712 Len=0 TSval=43366127 TSecr=136787079  tcp.stream == 24
588  17.698049 65.55.186.235 -> 216.165.108.217 TCP 70 http > 33063 [SYN, ACK] Seq=0 Ack=1 Win=8192 Len=0 MSS=1460 SACK_PERM=1 TSval=137031384 TSecr=43366090  tcp.stream == 37
589  17.698073 216.165.108.217 -> 65.55.186.235 TCP 66 33063 > http [ACK] Seq=1 Ack=1 Win=14600 Len=0 TSval=43366127 TSecr=137031384  tcp.stream == 37
590  17.698500 216.165.108.217 -> 65.55.186.235 TCP 66 33059 > http [FIN, ACK] Seq=461 Ack=741 Win=15540 Len=0 TSval=43366127 TSecr=136897363  tcp.stream == 33
591  17.699429 216.165.108.217 -> 65.55.186.235 TCP 74 33064 > http [SYN] Seq=0 Win=14600 Len=0 MSS=1460 SACK_PERM=1 TSval=43366127 TSecr=0 WS=128  tcp.stream == 38
592  17.702994 216.165.108.217 -> 65.55.186.235 HTTP 521 GET /Images/Products/HP_Office_320.jpg HTTP/1.1   tcp.stream == 37
593  17.720171 65.55.186.235 -> 216.165.108.217 HTTP 1866 HTTP/1.1 200 OK  (PNG)  tcp.stream == 34
594  17.720198 216.165.108.217 -> 65.55.186.235 TCP 66 33060 > http [ACK] Seq=455 Ack=1801 Win=17376 Len=0 TSval=43366132 TSecr=136787081  tcp.stream == 34
595  17.720639 65.55.186.235 -> 216.165.108.217 HTTP 1524 HTTP/1.1 200 OK  (PNG)  tcp.stream == 32
596  17.720653 216.165.108.217 -> 65.55.186.235 TCP 66 33058 > http [ACK] Seq=479 Ack=4355 Win=23168 Len=0 TSval=43366132 TSecr=136897367  tcp.stream == 32
597  17.725328 216.165.108.217 -> 65.55.186.235 TCP 66 33058 > http [FIN, ACK] Seq=479 Ack=4355 Win=23168 Len=0 TSval=43366134 TSecr=136897367  tcp.stream == 32
598  17.726376 216.165.108.217 -> 65.55.186.235 TCP 74 33065 > http [SYN] Seq=0 Win=14600 Len=0 MSS=1460 SACK_PERM=1 TSval=43366134 TSecr=0 WS=128  tcp.stream == 39
599  17.730234 216.165.108.217 -> 65.55.186.235 TCP 66 33060 > http [FIN, ACK] Seq=455 Ack=1801 Win=17376 Len=0 TSval=43366135 TSecr=136787081  tcp.stream == 34
600  17.731158 216.165.108.217 -> 65.55.186.235 TCP 74 33066 > http [SYN] Seq=0 Win=14600 Len=0 MSS=1460 SACK_PERM=1 TSval=43366135 TSecr=0 WS=128  tcp.stream == 40
602  17.784186 65.55.186.235 -> 216.165.108.217 HTTP 2041 HTTP/1.1 200 OK  (PNG)  tcp.stream == 35
603  17.784213 216.165.108.217 -> 65.55.186.235 TCP 66 33061 > http [ACK] Seq=457 Ack=1976 Win=17376 Len=0 TSval=43366148 TSecr=137031392  tcp.stream == 35
604  17.788939 216.165.108.217 -> 65.55.186.235 TCP 66 33061 > http [FIN, ACK] Seq=457 Ack=1976 Win=17376 Len=0 TSval=43366150 TSecr=137031392  tcp.stream == 35
605  17.790686 216.165.108.217 -> 65.55.186.235 TCP 74 33067 > http [SYN] Seq=0 Win=14600 Len=0 MSS=1460 SACK_PERM=1 TSval=43366150 TSecr=0 WS=128  tcp.stream == 41
606  17.793668 65.55.186.235 -> 216.165.108.217 HTTP 1715 HTTP/1.1 200 OK  (JPEG JFIF image)  tcp.stream == 36
607  17.793690 216.165.108.217 -> 65.55.186.235 TCP 66 33062 > http [ACK] Seq=454 Ack=1650 Win=17376 Len=0 TSval=43366151 TSecr=136787088  tcp.stream == 36
608  17.798842 216.165.108.217 -> 65.55.186.235 TCP 66 33062 > http [FIN, ACK] Seq=454 Ack=1650 Win=17376 Len=0 TSval=43366152 TSecr=136787088  tcp.stream == 36
609  17.799747 216.165.108.217 -> 65.55.186.235 TCP 74 33068 > http [SYN] Seq=0 Win=14600 Len=0 MSS=1460 SACK_PERM=1 TSval=43366152 TSecr=0 WS=128  tcp.stream == 42
610  17.845735 65.55.186.235 -> 216.165.108.217 TCP 66 http > 33059 [FIN, ACK] Seq=741 Ack=462 Win=65160 Len=0 TSval=136897380 TSecr=43366127  tcp.stream == 33
611  17.845759 216.165.108.217 -> 65.55.186.235 TCP 66 33059 > http [ACK] Seq=462 Ack=742 Win=15540 Len=0 TSval=43366164 TSecr=136897380  tcp.stream == 33
612  17.846753 65.55.186.235 -> 216.165.108.217 TCP 70 http > 33064 [SYN, ACK] Seq=0 Ack=1 Win=8192 Len=0 MSS=1460 SACK_PERM=1 TSval=137031398 TSecr=43366127  tcp.stream == 38
613  17.846780 216.165.108.217 -> 65.55.186.235 TCP 66 33064 > http [ACK] Seq=1 Ack=1 Win=14600 Len=0 TSval=43366164 TSecr=137031398  tcp.stream == 38
614  17.850391 216.165.108.217 -> 65.55.186.235 HTTP 516 GET /Images/Products/Xbox_320.jpg HTTP/1.1   tcp.stream == 38
615  17.853400 65.55.186.235 -> 216.165.108.217 HTTP 1812 HTTP/1.1 200 OK  (JPEG JFIF image)  tcp.stream == 37
616  17.853427 216.165.108.217 -> 65.55.186.235 TCP 66 33063 > http [ACK] Seq=456 Ack=1747 Win=17376 Len=0 TSval=43366166 TSecr=137031399  tcp.stream == 37
617  17.860577 216.165.108.217 -> 65.55.186.235 TCP 66 33063 > http [FIN, ACK] Seq=456 Ack=1747 Win=17376 Len=0 TSval=43366167 TSecr=137031399  tcp.stream == 37
618  17.861421 216.165.108.217 -> 65.55.186.235 TCP 74 33069 > http [SYN] Seq=0 Win=14600 Len=0 MSS=1460 SACK_PERM=1 TSval=43366168 TSecr=0 WS=128  tcp.stream == 43
619  17.872550 65.55.186.235 -> 216.165.108.217 TCP 66 http > 33058 [FIN, ACK] Seq=4355 Ack=480 Win=65160 Len=0 TSval=136897382 TSecr=43366134  tcp.stream == 32
620  17.872576 216.165.108.217 -> 65.55.186.235 TCP 66 33058 > http [ACK] Seq=480 Ack=4356 Win=23168 Len=0 TSval=43366170 TSecr=136897382  tcp.stream == 32
621  17.873737 65.55.186.235 -> 216.165.108.217 TCP 70 http > 33065 [SYN, ACK] Seq=0 Ack=1 Win=8192 Len=0 MSS=1460 SACK_PERM=1 TSval=137031401 TSecr=43366134  tcp.stream == 39
622  17.873762 216.165.108.217 -> 65.55.186.235 TCP 66 33065 > http [ACK] Seq=1 Ack=1 Win=14600 Len=0 TSval=43366171 TSecr=137031401  tcp.stream == 39
623  17.877457 65.55.186.235 -> 216.165.108.217 TCP 66 http > 33060 [FIN, ACK] Seq=1801 Ack=456 Win=65160 Len=0 TSval=136787097 TSecr=43366135  tcp.stream == 34
624  17.877481 216.165.108.217 -> 65.55.186.235 TCP 66 33060 > http [ACK] Seq=456 Ack=1802 Win=17376 Len=0 TSval=43366172 TSecr=136787097  tcp.stream == 34
625  17.878506 65.55.186.235 -> 216.165.108.217 TCP 70 http > 33066 [SYN, ACK] Seq=0 Ack=1 Win=8192 Len=0 MSS=1460 SACK_PERM=1 TSval=137031402 TSecr=43366135  tcp.stream == 40
626  17.878558 216.165.108.217 -> 65.55.186.235 TCP 66 33066 > http [ACK] Seq=1 Ack=1 Win=14600 Len=0 TSval=43366172 TSecr=137031402  tcp.stream == 40
627  17.891408 216.165.108.217 -> 65.55.186.235 HTTP 514 GET /Images/Products/wp_320.jpg HTTP/1.1   tcp.stream == 39
628  17.904612 216.165.108.217 -> 65.55.186.235 HTTP 520 GET /Images/Products/students_320.jpg HTTP/1.1   tcp.stream == 40
629  17.936196 65.55.186.235 -> 216.165.108.217 TCP 66 http > 33061 [FIN, ACK] Seq=1976 Ack=458 Win=65160 Len=0 TSval=137031407 TSecr=43366150  tcp.stream == 35
630  17.936222 216.165.108.217 -> 65.55.186.235 TCP 66 33061 > http [ACK] Seq=458 Ack=1977 Win=17376 Len=0 TSval=43366186 TSecr=137031407  tcp.stream == 35
631  17.938403 65.55.186.235 -> 216.165.108.217 TCP 70 http > 33067 [SYN, ACK] Seq=0 Ack=1 Win=8192 Len=0 MSS=1460 SACK_PERM=1 TSval=136787103 TSecr=43366150  tcp.stream == 41
632  17.938429 216.165.108.217 -> 65.55.186.235 TCP 66 33067 > http [ACK] Seq=1 Ack=1 Win=14600 Len=0 TSval=43366187 TSecr=136787103  tcp.stream == 41
633  17.941078 216.165.108.217 -> 65.55.186.235 HTTP 515 GET /Images/Products/msn_320.jpg HTTP/1.1   tcp.stream == 41
634  17.947180 65.55.186.235 -> 216.165.108.217 TCP 70 http > 33068 [SYN, ACK] Seq=0 Ack=1 Win=8192 Len=0 MSS=1460 SACK_PERM=1 TSval=136787104 TSecr=43366152  tcp.stream == 42
635  17.947207 216.165.108.217 -> 65.55.186.235 TCP 66 33068 > http [ACK] Seq=1 Ack=1 Win=14600 Len=0 TSval=43366189 TSecr=136787104  tcp.stream == 42
636  17.947579 65.55.186.235 -> 216.165.108.217 TCP 66 http > 33062 [FIN, ACK] Seq=1650 Ack=455 Win=65160 Len=0 TSval=136787104 TSecr=43366152  tcp.stream == 36
637  17.947601 216.165.108.217 -> 65.55.186.235 TCP 66 33062 > http [ACK] Seq=455 Ack=1651 Win=17376 Len=0 TSval=43366189 TSecr=136787104  tcp.stream == 36
638  17.949361 216.165.108.217 -> 65.55.186.235 HTTP 520 GET /Images/Products/Dynamics_320.jpg HTTP/1.1   tcp.stream == 42
640  18.001245 65.55.186.235 -> 216.165.108.217 HTTP 1542 HTTP/1.1 200 OK  (JPEG JFIF image)  tcp.stream == 38
641  18.001272 216.165.108.217 -> 65.55.186.235 TCP 66 33064 > http [ACK] Seq=451 Ack=1477 Win=17376 Len=0 TSval=43366203 TSecr=137031414  tcp.stream == 38
642  18.006796 216.165.108.217 -> 65.55.186.235 TCP 66 33064 > http [FIN, ACK] Seq=451 Ack=1477 Win=17376 Len=0 TSval=43366204 TSecr=137031414  tcp.stream == 38
643  18.007813 65.55.186.235 -> 216.165.108.217 TCP 66 http > 33063 [FIN, ACK] Seq=1747 Ack=457 Win=65160 Len=0 TSval=137031415 TSecr=43366167  tcp.stream == 37
644  18.007838 216.165.108.217 -> 65.55.186.235 TCP 66 33063 > http [ACK] Seq=457 Ack=1748 Win=17376 Len=0 TSval=43366204 TSecr=137031415  tcp.stream == 37
645  18.007842 216.165.108.217 -> 65.55.186.235 TCP 74 33070 > http [SYN] Seq=0 Win=14600 Len=0 MSS=1460 SACK_PERM=1 TSval=43366204 TSecr=0 WS=128  tcp.stream == 44
646  18.008673 65.55.186.235 -> 216.165.108.217 TCP 70 http > 33069 [SYN, ACK] Seq=0 Ack=1 Win=8192 Len=0 MSS=1460 SACK_PERM=1 TSval=136897396 TSecr=43366168  tcp.stream == 43
647  18.008701 216.165.108.217 -> 65.55.186.235 TCP 66 33069 > http [ACK] Seq=1 Ack=1 Win=14600 Len=0 TSval=43366204 TSecr=136897396  tcp.stream == 43
648  18.012150 216.165.108.217 -> 65.55.186.235 HTTP 517 GET /Images/Products/Azure_320.jpg HTTP/1.1   tcp.stream == 43
649  18.042219 65.55.186.235 -> 216.165.108.217 TCP 1514 [TCP segment of a reassembled PDU]  tcp.stream == 39
650  18.042246 216.165.108.217 -> 65.55.186.235 TCP 66 33065 > http [ACK] Seq=449 Ack=1449 Win=17376 Len=0 TSval=43366213 TSecr=137031417  tcp.stream == 39
651  18.042343 65.55.186.235 -> 216.165.108.217 TCP 1514 [TCP segment of a reassembled PDU]  tcp.stream == 39
652  18.042348 216.165.108.217 -> 65.55.186.235 TCP 66 33065 > http [ACK] Seq=449 Ack=2897 Win=20272 Len=0 TSval=43366213 TSecr=137031417  tcp.stream == 39
653  18.053725 65.55.186.235 -> 216.165.108.217 HTTP 1991 HTTP/1.1 200 OK  (JPEG JFIF image)  tcp.stream == 40
654  18.053751 216.165.108.217 -> 65.55.186.235 TCP 66 33066 > http [ACK] Seq=455 Ack=1926 Win=17376 Len=0 TSval=43366216 TSecr=137031418  tcp.stream == 40
655  18.059102 216.165.108.217 -> 65.55.186.235 TCP 66 33066 > http [FIN, ACK] Seq=455 Ack=1926 Win=17376 Len=0 TSval=43366217 TSecr=137031418  tcp.stream == 40
656  18.060070 216.165.108.217 -> 65.55.186.235 TCP 74 33071 > http [SYN] Seq=0 Win=14600 Len=0 MSS=1460 SACK_PERM=1 TSval=43366217 TSecr=0 WS=128  tcp.stream == 45
657  18.091204 65.55.186.235 -> 216.165.108.217 HTTP 1334 HTTP/1.1 200 OK  (JPEG JFIF image)  tcp.stream == 41
658  18.091233 216.165.108.217 -> 65.55.186.235 TCP 66 33067 > http [ACK] Seq=450 Ack=1269 Win=16484 Len=0 TSval=43366225 TSecr=136787118  tcp.stream == 41
659  18.095015 216.165.108.217 -> 65.55.186.235 TCP 66 33067 > http [FIN, ACK] Seq=450 Ack=1269 Win=16484 Len=0 TSval=43366226 TSecr=136787118  tcp.stream == 41
660  18.096448 216.165.108.217 -> 65.55.186.235 TCP 74 33072 > http [SYN] Seq=0 Win=14600 Len=0 MSS=1460 SACK_PERM=1 TSval=43366226 TSecr=0 WS=128  tcp.stream == 46
661  18.099770 65.55.186.235 -> 216.165.108.217 TCP 1514 [TCP segment of a reassembled PDU]  tcp.stream == 42
662  18.099795 216.165.108.217 -> 65.55.186.235 TCP 66 33068 > http [ACK] Seq=455 Ack=1449 Win=17376 Len=0 TSval=43366227 TSecr=136787119  tcp.stream == 42
663  18.099840 65.55.186.235 -> 216.165.108.217 HTTP 1424 HTTP/1.1 200 OK  (JPEG JFIF image)  tcp.stream == 42
664  18.099846 216.165.108.217 -> 65.55.186.235 TCP 66 33068 > http [ACK] Seq=455 Ack=2807 Win=20272 Len=0 TSval=43366227 TSecr=136787119  tcp.stream == 42
665  18.108006 216.165.108.217 -> 65.55.186.235 TCP 66 33068 > http [FIN, ACK] Seq=455 Ack=2807 Win=20272 Len=0 TSval=43366229 TSecr=136787119  tcp.stream == 42
666  18.108845 216.165.108.217 -> 65.55.186.235 TCP 74 33073 > http [SYN] Seq=0 Win=14600 Len=0 MSS=1460 SACK_PERM=1 TSval=43366230 TSecr=0 WS=128  tcp.stream == 47
667  18.154061 65.55.186.235 -> 216.165.108.217 TCP 66 http > 33064 [FIN, ACK] Seq=1477 Ack=452 Win=65160 Len=0 TSval=137031429 TSecr=43366204  tcp.stream == 38
668  18.154086 216.165.108.217 -> 65.55.186.235 TCP 66 33064 > http [ACK] Seq=452 Ack=1478 Win=17376 Len=0 TSval=43366241 TSecr=137031429  tcp.stream == 38
669  18.155331 65.55.186.235 -> 216.165.108.217 TCP 70 http > 33070 [SYN, ACK] Seq=0 Ack=1 Win=8192 Len=0 MSS=1460 SACK_PERM=1 TSval=136787125 TSecr=43366204  tcp.stream == 44
670  18.155354 216.165.108.217 -> 65.55.186.235 TCP 66 33070 > http [ACK] Seq=1 Ack=1 Win=14600 Len=0 TSval=43366241 TSecr=136787125  tcp.stream == 44
671  18.157940 216.165.108.217 -> 65.55.186.235 HTTP 524 GET /Images/Products/VisualStudio_320.jpg HTTP/1.1   tcp.stream == 44
672  18.162581 65.55.186.235 -> 216.165.108.217 TCP 1514 [TCP segment of a reassembled PDU]  tcp.stream == 43
673  18.162605 216.165.108.217 -> 65.55.186.235 TCP 66 33069 > http [ACK] Seq=452 Ack=1449 Win=17376 Len=0 TSval=43366243 TSecr=136897411  tcp.stream == 43
674  18.162704 65.55.186.235 -> 216.165.108.217 TCP 1514 [TCP segment of a reassembled PDU]  tcp.stream == 43
675  18.162709 216.165.108.217 -> 65.55.186.235 TCP 66 33069 > http [ACK] Seq=452 Ack=2897 Win=20272 Len=0 TSval=43366243 TSecr=136897411  tcp.stream == 43
677  18.189653 65.55.186.235 -> 216.165.108.217 HTTP 786 HTTP/1.1 200 OK  (JPEG JFIF image)  tcp.stream == 39
678  18.189672 216.165.108.217 -> 65.55.186.235 TCP 66 33065 > http [ACK] Seq=449 Ack=3617 Win=23168 Len=0 TSval=43366250 TSecr=137031433  tcp.stream == 39
679  18.193877 216.165.108.217 -> 65.55.186.235 TCP 66 33065 > http [FIN, ACK] Seq=449 Ack=3617 Win=23168 Len=0 TSval=43366251 TSecr=137031433  tcp.stream == 39
680  18.207362 65.55.186.235 -> 216.165.108.217 TCP 66 http > 33066 [FIN, ACK] Seq=1926 Ack=456 Win=65160 Len=0 TSval=137031434 TSecr=43366217  tcp.stream == 40
681  18.207386 216.165.108.217 -> 65.55.186.235 TCP 66 33066 > http [ACK] Seq=456 Ack=1927 Win=17376 Len=0 TSval=43366254 TSecr=137031434  tcp.stream == 40
682  18.207396 65.55.186.235 -> 216.165.108.217 TCP 70 http > 33071 [SYN, ACK] Seq=0 Ack=1 Win=8192 Len=0 MSS=1460 SACK_PERM=1 TSval=136787130 TSecr=43366217  tcp.stream == 45
683  18.207403 216.165.108.217 -> 65.55.186.235 TCP 66 33071 > http [ACK] Seq=1 Ack=1 Win=14600 Len=0 TSval=43366254 TSecr=136787130  tcp.stream == 45
684  18.210968 216.165.108.217 -> 65.55.186.235 HTTP 527 GET /en-us/Images/Products/news_tile_320.jpg HTTP/1.1   tcp.stream == 45
685  18.242317 65.55.186.235 -> 216.165.108.217 TCP 66 http > 33067 [FIN, ACK] Seq=1269 Ack=451 Win=65160 Len=0 TSval=136787134 TSecr=43366226  tcp.stream == 41
686  18.242341 216.165.108.217 -> 65.55.186.235 TCP 66 33067 > http [ACK] Seq=451 Ack=1270 Win=16484 Len=0 TSval=43366263 TSecr=136787134  tcp.stream == 41
687  18.243790 65.55.186.235 -> 216.165.108.217 TCP 70 http > 33072 [SYN, ACK] Seq=0 Ack=1 Win=8192 Len=0 MSS=1460 SACK_PERM=1 TSval=136897419 TSecr=43366226  tcp.stream == 46
688  18.243819 216.165.108.217 -> 65.55.186.235 TCP 66 33072 > http [ACK] Seq=1 Ack=1 Win=14600 Len=0 TSval=43366263 TSecr=136897419  tcp.stream == 46
689  18.245860 216.165.108.217 -> 65.55.186.235 HTTP 531 GET /en-us/Images/Products/showcase_tile_320.jpg HTTP/1.1   tcp.stream == 46
690  18.255211 65.55.186.235 -> 216.165.108.217 TCP 66 http > 33068 [FIN, ACK] Seq=2807 Ack=456 Win=65160 Len=0 TSval=136787135 TSecr=43366229  tcp.stream == 42
691  18.255235 216.165.108.217 -> 65.55.186.235 TCP 66 33068 > http [ACK] Seq=456 Ack=2808 Win=20272 Len=0 TSval=43366266 TSecr=136787135  tcp.stream == 42
692  18.256192 65.55.186.235 -> 216.165.108.217 TCP 70 http > 33073 [SYN, ACK] Seq=0 Ack=1 Win=8192 Len=0 MSS=1460 SACK_PERM=1 TSval=136787135 TSecr=43366230  tcp.stream == 47
693  18.256218 216.165.108.217 -> 65.55.186.235 TCP 66 33073 > http [ACK] Seq=1 Ack=1 Win=14600 Len=0 TSval=43366266 TSecr=136787135  tcp.stream == 47
694  18.258767 216.165.108.217 -> 65.55.186.235 HTTP 512 GET /Images/fonts/SegoeWP.ttf HTTP/1.1   tcp.stream == 47
695  18.308283 65.55.186.235 -> 216.165.108.217 TCP 1514 [TCP segment of a reassembled PDU]  tcp.stream == 44
696  18.308309 216.165.108.217 -> 65.55.186.235 TCP 66 33070 > http [ACK] Seq=459 Ack=1449 Win=17376 Len=0 TSval=43366279 TSecr=136787140  tcp.stream == 44
697  18.308409 65.55.186.235 -> 216.165.108.217 TCP 1514 [TCP segment of a reassembled PDU]  tcp.stream == 44
698  18.308416 216.165.108.217 -> 65.55.186.235 TCP 66 33070 > http [ACK] Seq=459 Ack=2897 Win=20272 Len=0 TSval=43366279 TSecr=136787140  tcp.stream == 44
699  18.309876 65.55.186.235 -> 216.165.108.217 HTTP 387 HTTP/1.1 200 OK  (JPEG JFIF image)  tcp.stream == 43
700  18.309894 216.165.108.217 -> 65.55.186.235 TCP 66 33069 > http [ACK] Seq=452 Ack=3218 Win=23168 Len=0 TSval=43366280 TSecr=136897426  tcp.stream == 43
701  18.316388 216.165.108.217 -> 65.55.186.235 TCP 66 33069 > http [FIN, ACK] Seq=452 Ack=3218 Win=23168 Len=0 TSval=43366281 TSecr=136897426  tcp.stream == 43
702  18.341155 65.55.186.235 -> 216.165.108.217 TCP 66 http > 33065 [FIN, ACK] Seq=3617 Ack=450 Win=65160 Len=0 TSval=137031448 TSecr=43366251  tcp.stream == 39
703  18.341180 216.165.108.217 -> 65.55.186.235 TCP 66 33065 > http [ACK] Seq=450 Ack=3618 Win=23168 Len=0 TSval=43366288 TSecr=137031448  tcp.stream == 39
705  18.361720 65.55.186.235 -> 216.165.108.217 TCP 1514 [TCP segment of a reassembled PDU]  tcp.stream == 45
706  18.361751 216.165.108.217 -> 65.55.186.235 TCP 66 33071 > http [ACK] Seq=462 Ack=1449 Win=17376 Len=0 TSval=43366293 TSecr=136787146  tcp.stream == 45
707  18.361848 65.55.186.235 -> 216.165.108.217 TCP 1514 [TCP segment of a reassembled PDU]  tcp.stream == 45
708  18.361854 216.165.108.217 -> 65.55.186.235 TCP 66 33071 > http [ACK] Seq=462 Ack=2897 Win=20272 Len=0 TSval=43366293 TSecr=136787146  tcp.stream == 45
709  18.396060 65.55.186.235 -> 216.165.108.217 TCP 1514 [TCP segment of a reassembled PDU]  tcp.stream == 46
710  18.396084 216.165.108.217 -> 65.55.186.235 TCP 66 33072 > http [ACK] Seq=466 Ack=1449 Win=17376 Len=0 TSval=43366301 TSecr=136897435  tcp.stream == 46
711  18.396185 65.55.186.235 -> 216.165.108.217 TCP 1514 [TCP segment of a reassembled PDU]  tcp.stream == 46
712  18.396191 216.165.108.217 -> 65.55.186.235 TCP 66 33072 > http [ACK] Seq=466 Ack=2897 Win=20272 Len=0 TSval=43366301 TSecr=136897435  tcp.stream == 46
713  18.411364 65.55.186.235 -> 216.165.108.217 TCP 1514 [TCP segment of a reassembled PDU]  tcp.stream == 47
714  18.411396 216.165.108.217 -> 65.55.186.235 TCP 66 33073 > http [ACK] Seq=447 Ack=1449 Win=17376 Len=0 TSval=43366305 TSecr=136787150  tcp.stream == 47
715  18.411445 65.55.186.235 -> 216.165.108.217 TCP 1514 [TCP segment of a reassembled PDU]  tcp.stream == 47
716  18.411451 216.165.108.217 -> 65.55.186.235 TCP 66 33073 > http [ACK] Seq=447 Ack=2897 Win=20272 Len=0 TSval=43366305 TSecr=136787150  tcp.stream == 47
717  18.455551 65.55.186.235 -> 216.165.108.217 HTTP 181 HTTP/1.1 200 OK  (JPEG JFIF image)  tcp.stream == 44
718  18.455571 216.165.108.217 -> 65.55.186.235 TCP 66 33070 > http [ACK] Seq=459 Ack=3012 Win=20272 Len=0 TSval=43366316 TSecr=136787155  tcp.stream == 44
719  18.457848 216.165.108.217 -> 65.55.186.235 TCP 66 33070 > http [FIN, ACK] Seq=459 Ack=3012 Win=20272 Len=0 TSval=43366317 TSecr=136787155  tcp.stream == 44
720  18.463623 65.55.186.235 -> 216.165.108.217 TCP 66 http > 33069 [FIN, ACK] Seq=3218 Ack=453 Win=65160 Len=0 TSval=136897441 TSecr=43366281  tcp.stream == 43
721  18.463645 216.165.108.217 -> 65.55.186.235 TCP 66 33069 > http [ACK] Seq=453 Ack=3219 Win=23168 Len=0 TSval=43366318 TSecr=136897441  tcp.stream == 43
722  18.509281 65.55.186.235 -> 216.165.108.217 TCP 1514 [TCP segment of a reassembled PDU]  tcp.stream == 45
723  18.509317 216.165.108.217 -> 65.55.186.235 TCP 66 33071 > http [ACK] Seq=462 Ack=4345 Win=23168 Len=0 TSval=43366330 TSecr=136787161  tcp.stream == 45
724  18.509374 65.55.186.235 -> 216.165.108.217 TCP 1514 [TCP segment of a reassembled PDU]  tcp.stream == 45
725  18.509379 216.165.108.217 -> 65.55.186.235 TCP 66 33071 > http [ACK] Seq=462 Ack=5793 Win=26064 Len=0 TSval=43366330 TSecr=136787161  tcp.stream == 45
726  18.509382 65.55.186.235 -> 216.165.108.217 HTTP 513 HTTP/1.1 200 OK  (JPEG JFIF image)  tcp.stream == 45
727  18.509388 216.165.108.217 -> 65.55.186.235 TCP 66 33071 > http [ACK] Seq=462 Ack=6240 Win=28960 Len=0 TSval=43366330 TSecr=136787161  tcp.stream == 45
729  18.512971 216.165.108.217 -> 65.55.186.235 TCP 66 33071 > http [FIN, ACK] Seq=462 Ack=6240 Win=28960 Len=0 TSval=43366331 TSecr=136787161  tcp.stream == 45
730  18.543585 65.55.186.235 -> 216.165.108.217 TCP 1514 [TCP segment of a reassembled PDU]  tcp.stream == 46
731  18.543608 216.165.108.217 -> 65.55.186.235 TCP 66 33072 > http [ACK] Seq=466 Ack=4345 Win=23168 Len=0 TSval=43366338 TSecr=136897449  tcp.stream == 46
732  18.543705 65.55.186.235 -> 216.165.108.217 TCP 1514 [TCP segment of a reassembled PDU]  tcp.stream == 46
733  18.543711 216.165.108.217 -> 65.55.186.235 TCP 66 33072 > http [ACK] Seq=466 Ack=5793 Win=26064 Len=0 TSval=43366338 TSecr=136897449  tcp.stream == 46
734  18.543756 65.55.186.235 -> 216.165.108.217 HTTP 861 HTTP/1.1 200 OK  (JPEG JFIF image)  tcp.stream == 46
735  18.543763 216.165.108.217 -> 65.55.186.235 TCP 66 33072 > http [ACK] Seq=466 Ack=6588 Win=28960 Len=0 TSval=43366338 TSecr=136897449  tcp.stream == 46
736  18.546948 216.165.108.217 -> 65.55.186.235 TCP 66 33072 > http [FIN, ACK] Seq=466 Ack=6588 Win=28960 Len=0 TSval=43366339 TSecr=136897449  tcp.stream == 46
737  18.558882 65.55.186.235 -> 216.165.108.217 TCP 1514 [TCP segment of a reassembled PDU]  tcp.stream == 47
738  18.558904 216.165.108.217 -> 65.55.186.235 TCP 66 33073 > http [ACK] Seq=447 Ack=4345 Win=23168 Len=0 TSval=43366342 TSecr=136787166  tcp.stream == 47
739  18.559004 65.55.186.235 -> 216.165.108.217 TCP 1514 [TCP segment of a reassembled PDU]  tcp.stream == 47
740  18.559010 216.165.108.217 -> 65.55.186.235 TCP 66 33073 > http [ACK] Seq=447 Ack=5793 Win=26064 Len=0 TSval=43366342 TSecr=136787166  tcp.stream == 47
741  18.559116 65.55.186.235 -> 216.165.108.217 TCP 1514 [TCP segment of a reassembled PDU]  tcp.stream == 47
742  18.559124 216.165.108.217 -> 65.55.186.235 TCP 66 33073 > http [ACK] Seq=447 Ack=7241 Win=28960 Len=0 TSval=43366342 TSecr=136787166  tcp.stream == 47
743  18.559241 65.55.186.235 -> 216.165.108.217 TCP 1514 [TCP segment of a reassembled PDU]  tcp.stream == 47
744  18.559246 216.165.108.217 -> 65.55.186.235 TCP 66 33073 > http [ACK] Seq=447 Ack=8689 Win=31856 Len=0 TSval=43366342 TSecr=136787166  tcp.stream == 47
745  18.605101 65.55.186.235 -> 216.165.108.217 TCP 66 http > 33070 [FIN, ACK] Seq=3012 Ack=460 Win=65160 Len=0 TSval=136787170 TSecr=43366317  tcp.stream == 44
746  18.605126 216.165.108.217 -> 65.55.186.235 TCP 66 33070 > http [ACK] Seq=460 Ack=3013 Win=20272 Len=0 TSval=43366354 TSecr=136787170  tcp.stream == 44
747  18.660224 65.55.186.235 -> 216.165.108.217 TCP 66 http > 33071 [FIN, ACK] Seq=6240 Ack=463 Win=65160 Len=0 TSval=136787176 TSecr=43366331  tcp.stream == 45
748  18.660243 216.165.108.217 -> 65.55.186.235 TCP 66 33071 > http [ACK] Seq=463 Ack=6241 Win=28960 Len=0 TSval=43366367 TSecr=136787176  tcp.stream == 45
750  18.694181 65.55.186.235 -> 216.165.108.217 TCP 66 http > 33072 [FIN, ACK] Seq=6588 Ack=467 Win=65160 Len=0 TSval=136897465 TSecr=43366339  tcp.stream == 46
751  18.694203 216.165.108.217 -> 65.55.186.235 TCP 66 33072 > http [ACK] Seq=467 Ack=6589 Win=28960 Len=0 TSval=43366376 TSecr=136897465  tcp.stream == 46
752  18.706635 65.55.186.235 -> 216.165.108.217 TCP 1514 [TCP segment of a reassembled PDU]  tcp.stream == 47
753  18.706655 216.165.108.217 -> 65.55.186.235 TCP 66 33073 > http [ACK] Seq=447 Ack=10137 Win=34752 Len=0 TSval=43366379 TSecr=136787180  tcp.stream == 47
754  18.706754 65.55.186.235 -> 216.165.108.217 TCP 1514 [TCP segment of a reassembled PDU]  tcp.stream == 47
755  18.706760 216.165.108.217 -> 65.55.186.235 TCP 66 33073 > http [ACK] Seq=447 Ack=11585 Win=37648 Len=0 TSval=43366379 TSecr=136787180  tcp.stream == 47
756  18.706873 65.55.186.235 -> 216.165.108.217 TCP 1514 [TCP segment of a reassembled PDU]  tcp.stream == 47
757  18.706879 216.165.108.217 -> 65.55.186.235 TCP 66 33073 > http [ACK] Seq=447 Ack=13033 Win=40544 Len=0 TSval=43366379 TSecr=136787180  tcp.stream == 47
758  18.707004 65.55.186.235 -> 216.165.108.217 TCP 1514 [TCP segment of a reassembled PDU]  tcp.stream == 47
759  18.707013 216.165.108.217 -> 65.55.186.235 TCP 66 33073 > http [ACK] Seq=447 Ack=14481 Win=43440 Len=0 TSval=43366379 TSecr=136787180  tcp.stream == 47
760  18.707170 65.55.186.235 -> 216.165.108.217 TCP 1514 [TCP segment of a reassembled PDU]  tcp.stream == 47
761  18.707177 216.165.108.217 -> 65.55.186.235 TCP 66 33073 > http [ACK] Seq=447 Ack=15929 Win=46336 Len=0 TSval=43366379 TSecr=136787180  tcp.stream == 47
762  18.707293 65.55.186.235 -> 216.165.108.217 TCP 1514 [TCP segment of a reassembled PDU]  tcp.stream == 47
763  18.707302 216.165.108.217 -> 65.55.186.235 TCP 66 33073 > http [ACK] Seq=447 Ack=17377 Win=49232 Len=0 TSval=43366379 TSecr=136787180  tcp.stream == 47
764  18.707415 65.55.186.235 -> 216.165.108.217 TCP 1514 [TCP segment of a reassembled PDU]  tcp.stream == 47
765  18.707421 216.165.108.217 -> 65.55.186.235 TCP 66 33073 > http [ACK] Seq=447 Ack=18825 Win=52128 Len=0 TSval=43366379 TSecr=136787180  tcp.stream == 47
766  18.707538 65.55.186.235 -> 216.165.108.217 TCP 1514 [TCP segment of a reassembled PDU]  tcp.stream == 47
767  18.707544 216.165.108.217 -> 65.55.186.235 TCP 66 33073 > http [ACK] Seq=447 Ack=20273 Win=55024 Len=0 TSval=43366379 TSecr=136787180  tcp.stream == 47
768  18.766154 216.165.108.217 -> 66.150.117.33 TCP 66 43218 > http [FIN, ACK] Seq=973 Ack=1043 Win=16768 Len=0 TSval=43366394 TSecr=2424984  tcp.stream == 31
769  18.771605 216.165.108.217 -> 66.150.117.33 TCP 74 43235 > http [SYN] Seq=0 Win=14600 Len=0 MSS=1460 SACK_PERM=1 TSval=43366395 TSecr=0 WS=128  tcp.stream == 48
770  18.772867 66.150.117.33 -> 216.165.108.217 TCP 66 http > 43218 [ACK] Seq=1043 Ack=974 Win=64563 Len=0 TSval=2424999 TSecr=43366394  tcp.stream == 31
771  18.778275 66.150.117.33 -> 216.165.108.217 TCP 78 http > 43235 [SYN, ACK] Seq=0 Ack=1 Win=16384 Len=0 MSS=1460 WS=1 TSval=0 TSecr=0 SACK_PERM=1  tcp.stream == 48
772  18.778299 216.165.108.217 -> 66.150.117.33 TCP 66 43235 > http [ACK] Seq=1 Ack=1 Win=14720 Len=0 TSval=43366397 TSecr=0  tcp.stream == 48
773  18.781316 216.165.108.217 -> 66.150.117.33 HTTP 1198 GET /dcs3k3lty00000oa4hws4uybu_3c3o/dcs.gif?dcsredirect=126&dcstlh=0&dcstlv=0&dcsdat=120216172953&dcssip=m.microsoft.com&dcsuri=%2Fen-us%2Fdefault.mspx&dcscfg=&dcsref=none&dcsqry=none&sid=ZoCx_2ZVW0e9EBVGPwdoQw&dm=Android+4.x&mo=Internet&c=US&df=Generic&dg=hi&sc=1&sj=0&os=Android&ov=4.x&x=320&y=640&ml=xhtml&sm=0&scc=1&sv=1&se=1&ss=1&wt.ti=Microsoft+Home&nvr=New&wt.es=android&wt.mpe=mHP-views&wt.mpvf=10104&wt.mpoem=Unknown&wt.mpmo=Unknown&wt.mpivcr=1&wt.ua=Mozilla%2F5.0+(Linux%3B+U%3B+Android+4.0.2%3B+en-us%3B+google_sdk+Build%2FICS_MR0)+AppleWebKit%2F534.30+(KHTML,+like+Gecko)+Version%2F4.0+Mobile+Safari%2F534.30&wt.mpjsr=1 HTTP/1.1   tcp.stream == 48
774  18.788761 66.150.117.33 -> 216.165.108.217 TCP 540 [TCP segment of a reassembled PDU]  tcp.stream == 48
775  18.788781 216.165.108.217 -> 66.150.117.33 TCP 66 43235 > http [ACK] Seq=1133 Ack=475 Win=15744 Len=0 TSval=43366400 TSecr=2424999  tcp.stream == 48
776  18.788788 66.150.117.33 -> 216.165.108.217 HTTP 133 HTTP/1.1 200 OK  (GIF89a)  tcp.stream == 48
777  18.788791 216.165.108.217 -> 66.150.117.33 TCP 66 43235 > http [ACK] Seq=1133 Ack=542 Win=15744 Len=0 TSval=43366400 TSecr=2424999  tcp.stream == 48
778  18.788793 66.150.117.33 -> 216.165.108.217 TCP 66 http > 43235 [FIN, ACK] Seq=542 Ack=1133 Win=64403 Len=0 TSval=2424999 TSecr=43366395  tcp.stream == 48
779  18.794414 216.165.108.217 -> 66.150.117.33 TCP 66 43235 > http [FIN, ACK] Seq=1133 Ack=543 Win=15744 Len=0 TSval=43366401 TSecr=2424999  tcp.stream == 48
780  18.801030 66.150.117.33 -> 216.165.108.217 TCP 66 http > 43235 [ACK] Seq=543 Ack=1134 Win=64403 Len=0 TSval=2424999 TSecr=43366401  tcp.stream == 48
781  18.854217 65.55.186.235 -> 216.165.108.217 TCP 1514 [TCP segment of a reassembled PDU]  tcp.stream == 47
782  18.854241 216.165.108.217 -> 65.55.186.235 TCP 66 33073 > http [ACK] Seq=447 Ack=21721 Win=57920 Len=0 TSval=43366416 TSecr=136787195  tcp.stream == 47
783  18.854338 65.55.186.235 -> 216.165.108.217 TCP 1514 [TCP segment of a reassembled PDU]  tcp.stream == 47
784  18.854344 216.165.108.217 -> 65.55.186.235 TCP 66 33073 > http [ACK] Seq=447 Ack=23169 Win=60816 Len=0 TSval=43366416 TSecr=136787195  tcp.stream == 47
785  18.854457 65.55.186.235 -> 216.165.108.217 TCP 1514 [TCP segment of a reassembled PDU]  tcp.stream == 47
786  18.854462 216.165.108.217 -> 65.55.186.235 TCP 66 33073 > http [ACK] Seq=447 Ack=24617 Win=60816 Len=0 TSval=43366416 TSecr=136787195  tcp.stream == 47
787  18.854580 65.55.186.235 -> 216.165.108.217 TCP 1514 [TCP segment of a reassembled PDU]  tcp.stream == 47
788  18.854586 216.165.108.217 -> 65.55.186.235 TCP 66 33073 > http [ACK] Seq=447 Ack=26065 Win=59368 Len=0 TSval=43366416 TSecr=136787195  tcp.stream == 47
789  18.854702 65.55.186.235 -> 216.165.108.217 TCP 1514 [TCP segment of a reassembled PDU]  tcp.stream == 47
790  18.854709 216.165.108.217 -> 65.55.186.235 TCP 66 33073 > http [ACK] Seq=447 Ack=27513 Win=57920 Len=0 TSval=43366416 TSecr=136787195  tcp.stream == 47
791  18.854824 65.55.186.235 -> 216.165.108.217 TCP 1514 [TCP segment of a reassembled PDU]  tcp.stream == 47
792  18.854830 216.165.108.217 -> 65.55.186.235 TCP 66 33073 > http [ACK] Seq=447 Ack=28961 Win=56472 Len=0 TSval=43366416 TSecr=136787195  tcp.stream == 47
793  18.854947 65.55.186.235 -> 216.165.108.217 TCP 1514 [TCP segment of a reassembled PDU]  tcp.stream == 47
794  18.854953 216.165.108.217 -> 65.55.186.235 TCP 66 33073 > http [ACK] Seq=447 Ack=30409 Win=55024 Len=0 TSval=43366416 TSecr=136787195  tcp.stream == 47
795  18.855071 65.55.186.235 -> 216.165.108.217 TCP 1514 [TCP segment of a reassembled PDU]  tcp.stream == 47
796  18.855201 65.55.186.235 -> 216.165.108.217 TCP 1514 [TCP segment of a reassembled PDU]  tcp.stream == 47
797  18.855319 65.55.186.235 -> 216.165.108.217 TCP 1514 [TCP segment of a reassembled PDU]  tcp.stream == 47
798  18.855445 65.55.186.235 -> 216.165.108.217 TCP 1514 [TCP segment of a reassembled PDU]  tcp.stream == 47
799  18.855555 216.165.108.217 -> 65.55.186.235 TCP 66 33073 > http [ACK] Seq=447 Ack=36201 Win=55024 Len=0 TSval=43366416 TSecr=136787195  tcp.stream == 47
800  18.855570 65.55.186.235 -> 216.165.108.217 TCP 1514 [TCP segment of a reassembled PDU]  tcp.stream == 47
801  18.855694 65.55.186.235 -> 216.165.108.217 TCP 1514 [TCP segment of a reassembled PDU]  tcp.stream == 47
802  18.855701 216.165.108.217 -> 65.55.186.235 TCP 66 33073 > http [ACK] Seq=447 Ack=39097 Win=55024 Len=0 TSval=43366416 TSecr=136787195  tcp.stream == 47
803  18.855816 65.55.186.235 -> 216.165.108.217 TCP 1514 [TCP segment of a reassembled PDU]  tcp.stream == 47
804  18.855941 65.55.186.235 -> 216.165.108.217 TCP 1514 [TCP segment of a reassembled PDU]  tcp.stream == 47
805  18.856062 65.55.186.235 -> 216.165.108.217 TCP 1514 [TCP segment of a reassembled PDU]  tcp.stream == 47
806  18.857568 216.165.108.217 -> 65.55.186.235 TCP 66 33073 > http [ACK] Seq=447 Ack=43441 Win=56472 Len=0 TSval=43366417 TSecr=136787195  tcp.stream == 47
810  19.001715 65.55.186.235 -> 216.165.108.217 TCP 1514 [TCP segment of a reassembled PDU]  tcp.stream == 47
811  19.001739 216.165.108.217 -> 65.55.186.235 TCP 66 33073 > http [ACK] Seq=447 Ack=44889 Win=63712 Len=0 TSval=43366453 TSecr=136787210  tcp.stream == 47
812  19.001839 65.55.186.235 -> 216.165.108.217 TCP 1514 [TCP segment of a reassembled PDU]  tcp.stream == 47
813  19.001957 65.55.186.235 -> 216.165.108.217 TCP 1514 [TCP segment of a reassembled PDU]  tcp.stream == 47
814  19.002074 65.55.186.235 -> 216.165.108.217 TCP 1514 [TCP segment of a reassembled PDU]  tcp.stream == 47
815  19.002194 65.55.186.235 -> 216.165.108.217 TCP 1514 [TCP segment of a reassembled PDU]  tcp.stream == 47
816  19.002328 65.55.186.235 -> 216.165.108.217 TCP 1514 [TCP segment of a reassembled PDU]  tcp.stream == 47
817  19.002404 216.165.108.217 -> 65.55.186.235 TCP 66 33073 > http [ACK] Seq=447 Ack=52129 Win=56472 Len=0 TSval=43366453 TSecr=136787210  tcp.stream == 47
818  19.002452 65.55.186.235 -> 216.165.108.217 TCP 1514 [TCP segment of a reassembled PDU]  tcp.stream == 47
819  19.002586 65.55.186.235 -> 216.165.108.217 TCP 1514 [TCP segment of a reassembled PDU]  tcp.stream == 47
820  19.002594 216.165.108.217 -> 65.55.186.235 TCP 66 33073 > http [ACK] Seq=447 Ack=55025 Win=62264 Len=0 TSval=43366453 TSecr=136787210  tcp.stream == 47
821  19.002710 65.55.186.235 -> 216.165.108.217 TCP 1514 [TCP segment of a reassembled PDU]  tcp.stream == 47
822  19.002833 65.55.186.235 -> 216.165.108.217 TCP 1514 [TCP segment of a reassembled PDU]  tcp.stream == 47
823  19.002955 65.55.186.235 -> 216.165.108.217 TCP 1514 [TCP segment of a reassembled PDU]  tcp.stream == 47
824  19.003078 65.55.186.235 -> 216.165.108.217 TCP 1514 [TCP segment of a reassembled PDU]  tcp.stream == 47
825  19.003202 65.55.186.235 -> 216.165.108.217 HTTP/DL 2031 Connect  tcp.stream == 47
826  19.005410 216.165.108.217 -> 65.55.186.235 TCP 66 33073 > http [ACK] Seq=447 Ack=62782 Win=55024 Len=0 TSval=43366454 TSecr=136787210  tcp.stream == 47
827  19.010118 216.165.108.217 -> 65.55.186.235 TCP 66 33073 > http [FIN, ACK] Seq=447 Ack=62782 Win=63712 Len=0 TSval=43366455 TSecr=136787210  tcp.stream == 47
829  19.157353 65.55.186.235 -> 216.165.108.217 TCP 66 http > 33073 [FIN, ACK] Seq=62782 Ack=448 Win=65160 Len=0 TSval=136787225 TSecr=43366455  tcp.stream == 47
830  19.157378 216.165.108.217 -> 65.55.186.235 TCP 66 33073 > http [ACK] Seq=448 Ack=62783 Win=63712 Len=0 TSval=43366492 TSecr=136787225  tcp.stream == 47
838  20.221947 216.165.108.217 -> 65.55.186.235 TCP 66 33032 > http [FIN, ACK] Seq=1 Ack=1 Win=14600 Len=0 TSval=43366758 TSecr=136896617  tcp.stream == 6
840  20.369149 65.55.186.235 -> 216.165.108.217 TCP 60 http > 33032 [RST, ACK] Seq=1 Ack=2 Win=0 Len=0  tcp.stream == 6
