 83  10.670481 216.165.108.217 -> 202.72.51.22 TCP 74 40912 > http [SYN] Seq=0 Win=14600 Len=0 MSS=1460 SACK_PERM=1 TSval=44671608 TSecr=0 WS=128  tcp.stream == 0
 84  10.680714 216.165.108.217 -> 202.72.51.22 TCP 74 40913 > http [SYN] Seq=0 Win=14600 Len=0 MSS=1460 SACK_PERM=1 TSval=44671611 TSecr=0 WS=128  tcp.stream == 1
 86  10.851636 202.72.51.22 -> 216.165.108.217 TCP 60 http > 40912 [SYN, ACK] Seq=0 Ack=1 Win=18200 Len=0 MSS=1460  tcp.stream == 0
 87  10.851667 216.165.108.217 -> 202.72.51.22 TCP 54 40912 > http [ACK] Seq=1 Ack=1 Win=14600 Len=0  tcp.stream == 0
 88  10.862427 202.72.51.22 -> 216.165.108.217 TCP 60 http > 40913 [SYN, ACK] Seq=0 Ack=1 Win=18200 Len=0 MSS=1460  tcp.stream == 1
 89  10.862451 216.165.108.217 -> 202.72.51.22 TCP 54 40913 > http [ACK] Seq=1 Ack=1 Win=14600 Len=0  tcp.stream == 1
 90  10.864224 216.165.108.217 -> 202.72.51.22 HTTP 453 GET / HTTP/1.1   tcp.stream == 0
 92  11.050804 202.72.51.22 -> 216.165.108.217 TCP 60 http > 40912 [ACK] Seq=1 Ack=400 Win=24820 Len=0  tcp.stream == 0
 93  11.051115 202.72.51.22 -> 216.165.108.217 HTTP 491 HTTP/1.1 301 Moved Permanently  (text/html)  tcp.stream == 0
 94  11.051127 216.165.108.217 -> 202.72.51.22 TCP 54 40912 > http [ACK] Seq=400 Ack=438 Win=15544 Len=0  tcp.stream == 0
 95  11.058795 202.72.51.22 -> 216.165.108.217 TCP 60 http > 40912 [FIN, ACK] Seq=438 Ack=400 Win=24820 Len=0  tcp.stream == 0
 96  11.075843 216.165.108.217 -> 202.72.51.22 TCP 54 40912 > http [FIN, ACK] Seq=400 Ack=439 Win=15544 Len=0  tcp.stream == 0
 99  11.266624 202.72.51.22 -> 216.165.108.217 TCP 60 http > 40912 [ACK] Seq=439 Ack=401 Win=24820 Len=0  tcp.stream == 0
102  11.290480 216.165.108.217 -> 202.72.50.127 TCP 74 52422 > http [SYN] Seq=0 Win=14600 Len=0 MSS=1460 SACK_PERM=1 TSval=44671763 TSecr=0 WS=128  tcp.stream == 2
103  11.345535 216.165.108.217 -> 202.72.50.127 TCP 74 52423 > http [SYN] Seq=0 Win=14600 Len=0 MSS=1460 SACK_PERM=1 TSval=44671777 TSecr=0 WS=128  tcp.stream == 3
106  11.475242 202.72.50.127 -> 216.165.108.217 TCP 60 http > 52422 [SYN, ACK] Seq=0 Ack=1 Win=18200 Len=0 MSS=1460  tcp.stream == 2
107  11.475272 216.165.108.217 -> 202.72.50.127 TCP 54 52422 > http [ACK] Seq=1 Ack=1 Win=14600 Len=0  tcp.stream == 2
108  11.483119 216.165.108.217 -> 202.72.50.127 HTTP 457 GET / HTTP/1.1   tcp.stream == 2
109  11.529895 202.72.50.127 -> 216.165.108.217 TCP 60 http > 52423 [SYN, ACK] Seq=0 Ack=1 Win=18200 Len=0 MSS=1460  tcp.stream == 3
110  11.529919 216.165.108.217 -> 202.72.50.127 TCP 54 52423 > http [ACK] Seq=1 Ack=1 Win=14600 Len=0  tcp.stream == 3
111  11.666674 202.72.50.127 -> 216.165.108.217 TCP 60 http > 52422 [ACK] Seq=1 Ack=404 Win=33580 Len=0  tcp.stream == 2
113  11.709798 202.72.50.127 -> 216.165.108.217 TCP 1514 [TCP segment of a reassembled PDU]  tcp.stream == 2
114  11.709817 216.165.108.217 -> 202.72.50.127 TCP 54 52422 > http [ACK] Seq=404 Ack=1461 Win=17520 Len=0  tcp.stream == 2
115  11.709881 202.72.50.127 -> 216.165.108.217 TCP 1514 [TCP segment of a reassembled PDU]  tcp.stream == 2
116  11.709886 216.165.108.217 -> 202.72.50.127 TCP 54 52422 > http [ACK] Seq=404 Ack=2921 Win=20440 Len=0  tcp.stream == 2
117  11.709991 202.72.50.127 -> 216.165.108.217 TCP 1514 [TCP segment of a reassembled PDU]  tcp.stream == 2
118  11.709996 216.165.108.217 -> 202.72.50.127 TCP 54 52422 > http [ACK] Seq=404 Ack=4381 Win=23360 Len=0  tcp.stream == 2
120  11.892351 202.72.50.127 -> 216.165.108.217 TCP 1598 [TCP segment of a reassembled PDU]  tcp.stream == 2
121  11.892370 216.165.108.217 -> 202.72.50.127 TCP 54 52422 > http [ACK] Seq=404 Ack=5925 Win=26280 Len=0  tcp.stream == 2
122  11.892474 202.72.50.127 -> 216.165.108.217 TCP 1514 [TCP segment of a reassembled PDU]  tcp.stream == 2
123  11.892479 216.165.108.217 -> 202.72.50.127 TCP 54 52422 > http [ACK] Seq=404 Ack=7385 Win=29200 Len=0  tcp.stream == 2
124  11.893159 202.72.50.127 -> 216.165.108.217 TCP 1514 [TCP segment of a reassembled PDU]  tcp.stream == 2
125  11.893175 216.165.108.217 -> 202.72.50.127 TCP 54 52422 > http [ACK] Seq=404 Ack=8845 Win=32120 Len=0  tcp.stream == 2
126  11.893275 202.72.50.127 -> 216.165.108.217 TCP 1514 [TCP segment of a reassembled PDU]  tcp.stream == 2
127  11.893280 216.165.108.217 -> 202.72.50.127 TCP 54 52422 > http [ACK] Seq=404 Ack=10305 Win=35040 Len=0  tcp.stream == 2
128  11.893399 202.72.50.127 -> 216.165.108.217 TCP 1514 [TCP segment of a reassembled PDU]  tcp.stream == 2
129  11.893404 216.165.108.217 -> 202.72.50.127 TCP 54 52422 > http [ACK] Seq=404 Ack=11765 Win=37960 Len=0  tcp.stream == 2
131  12.060080 216.165.108.217 -> 202.72.50.127 HTTP 515 GET /com/inc/home/20080930/smart/css/commonV2.css HTTP/1.1   tcp.stream == 3
133  12.073994 202.72.50.127 -> 216.165.108.217 TCP 68 [TCP segment of a reassembled PDU]  tcp.stream == 2
134  12.074014 216.165.108.217 -> 202.72.50.127 TCP 54 52422 > http [ACK] Seq=404 Ack=11779 Win=37960 Len=0  tcp.stream == 2
135  12.074246 202.72.50.127 -> 216.165.108.217 TCP 1514 [TCP segment of a reassembled PDU]  tcp.stream == 2
136  12.074253 216.165.108.217 -> 202.72.50.127 TCP 54 52422 > http [ACK] Seq=404 Ack=13239 Win=40880 Len=0  tcp.stream == 2
137  12.074637 202.72.50.127 -> 216.165.108.217 TCP 1514 [TCP segment of a reassembled PDU]  tcp.stream == 2
138  12.074650 216.165.108.217 -> 202.72.50.127 TCP 54 52422 > http [ACK] Seq=404 Ack=14699 Win=43800 Len=0  tcp.stream == 2
139  12.074753 202.72.50.127 -> 216.165.108.217 TCP 1514 [TCP segment of a reassembled PDU]  tcp.stream == 2
140  12.074758 216.165.108.217 -> 202.72.50.127 TCP 54 52422 > http [ACK] Seq=404 Ack=16159 Win=46720 Len=0  tcp.stream == 2
141  12.074879 202.72.50.127 -> 216.165.108.217 TCP 1528 [TCP segment of a reassembled PDU]  tcp.stream == 2
142  12.074885 216.165.108.217 -> 202.72.50.127 TCP 54 52422 > http [ACK] Seq=404 Ack=17633 Win=49640 Len=0  tcp.stream == 2
143  12.075059 202.72.50.127 -> 216.165.108.217 TCP 1514 [TCP segment of a reassembled PDU]  tcp.stream == 2
144  12.075066 216.165.108.217 -> 202.72.50.127 TCP 54 52422 > http [ACK] Seq=404 Ack=19093 Win=52560 Len=0  tcp.stream == 2
145  12.075178 202.72.50.127 -> 216.165.108.217 TCP 1514 [TCP segment of a reassembled PDU]  tcp.stream == 2
146  12.075184 216.165.108.217 -> 202.72.50.127 TCP 54 52422 > http [ACK] Seq=404 Ack=20553 Win=55480 Len=0  tcp.stream == 2
147  12.075302 202.72.50.127 -> 216.165.108.217 TCP 1514 [TCP segment of a reassembled PDU]  tcp.stream == 2
148  12.075308 216.165.108.217 -> 202.72.50.127 TCP 54 52422 > http [ACK] Seq=404 Ack=22013 Win=56940 Len=0  tcp.stream == 2
149  12.075427 202.72.50.127 -> 216.165.108.217 TCP 1528 [TCP segment of a reassembled PDU]  tcp.stream == 2
150  12.075435 216.165.108.217 -> 202.72.50.127 TCP 54 52422 > http [ACK] Seq=404 Ack=23487 Win=55480 Len=0  tcp.stream == 2
151  12.075562 202.72.50.127 -> 216.165.108.217 TCP 1514 [TCP segment of a reassembled PDU]  tcp.stream == 2
152  12.075567 216.165.108.217 -> 202.72.50.127 TCP 54 52422 > http [ACK] Seq=404 Ack=24947 Win=54020 Len=0  tcp.stream == 2
153  12.075686 202.72.50.127 -> 216.165.108.217 TCP 1514 [TCP segment of a reassembled PDU]  tcp.stream == 2
154  12.109602 216.165.108.217 -> 202.72.50.127 TCP 74 52424 > http [SYN] Seq=0 Win=14600 Len=0 MSS=1460 SACK_PERM=1 TSval=44671968 TSecr=0 WS=128  tcp.stream == 4
155  12.114527 216.165.108.217 -> 202.72.50.127 TCP 54 52422 > http [ACK] Seq=404 Ack=26407 Win=58400 Len=0  tcp.stream == 2
157  12.192625 216.165.108.217 -> 202.72.50.127 TCP 74 52425 > http [SYN] Seq=0 Win=14600 Len=0 MSS=1460 SACK_PERM=1 TSval=44671989 TSecr=0 WS=128  tcp.stream == 5
159  12.237224 202.72.50.127 -> 216.165.108.217 TCP 60 http > 52423 [ACK] Seq=1 Ack=462 Win=33580 Len=0  tcp.stream == 3
160  12.245895 202.72.50.127 -> 216.165.108.217 TCP 1514 [TCP segment of a reassembled PDU]  tcp.stream == 3
161  12.245918 216.165.108.217 -> 202.72.50.127 TCP 54 52423 > http [ACK] Seq=462 Ack=1461 Win=17520 Len=0  tcp.stream == 3
162  12.246079 202.72.50.127 -> 216.165.108.217 TCP 1514 [TCP segment of a reassembled PDU]  tcp.stream == 3
163  12.246086 216.165.108.217 -> 202.72.50.127 TCP 54 52423 > http [ACK] Seq=462 Ack=2921 Win=20440 Len=0  tcp.stream == 3
164  12.246202 202.72.50.127 -> 216.165.108.217 TCP 1514 [TCP segment of a reassembled PDU]  tcp.stream == 3
165  12.246211 216.165.108.217 -> 202.72.50.127 TCP 54 52423 > http [ACK] Seq=462 Ack=4381 Win=23360 Len=0  tcp.stream == 3
166  12.251989 202.72.50.127 -> 216.165.108.217 TCP 1514 [TCP segment of a reassembled PDU]  tcp.stream == 2
167  12.252006 216.165.108.217 -> 202.72.50.127 TCP 54 52422 > http [ACK] Seq=404 Ack=27867 Win=61320 Len=0  tcp.stream == 2
168  12.253336 202.72.50.127 -> 216.165.108.217 TCP 1528 [TCP segment of a reassembled PDU]  tcp.stream == 2
169  12.253352 216.165.108.217 -> 202.72.50.127 TCP 54 52422 > http [ACK] Seq=404 Ack=29341 Win=61320 Len=0  tcp.stream == 2
170  12.253453 202.72.50.127 -> 216.165.108.217 TCP 1514 [TCP segment of a reassembled PDU]  tcp.stream == 2
171  12.253575 202.72.50.127 -> 216.165.108.217 TCP 1514 [TCP segment of a reassembled PDU]  tcp.stream == 2
172  12.253699 202.72.50.127 -> 216.165.108.217 TCP 1514 [TCP segment of a reassembled PDU]  tcp.stream == 2
173  12.253823 202.72.50.127 -> 216.165.108.217 TCP 1528 [TCP segment of a reassembled PDU]  tcp.stream == 2
174  12.253949 202.72.50.127 -> 216.165.108.217 TCP 1514 [TCP segment of a reassembled PDU]  tcp.stream == 2
175  12.254078 202.72.50.127 -> 216.165.108.217 TCP 1514 [TCP segment of a reassembled PDU]  tcp.stream == 2
176  12.254203 202.72.50.127 -> 216.165.108.217 TCP 1514 [TCP segment of a reassembled PDU]  tcp.stream == 2
177  12.254327 202.72.50.127 -> 216.165.108.217 TCP 1528 [TCP segment of a reassembled PDU]  tcp.stream == 2
178  12.254520 202.72.50.127 -> 216.165.108.217 TCP 1514 [TCP segment of a reassembled PDU]  tcp.stream == 2
179  12.254637 202.72.50.127 -> 216.165.108.217 TCP 1514 [TCP segment of a reassembled PDU]  tcp.stream == 2
180  12.254753 216.165.108.217 -> 202.72.50.127 TCP 54 52422 > http [ACK] Seq=404 Ack=43969 Win=55480 Len=0  tcp.stream == 2
181  12.254771 202.72.50.127 -> 216.165.108.217 TCP 1514 [TCP segment of a reassembled PDU]  tcp.stream == 2
182  12.254896 202.72.50.127 -> 216.165.108.217 TCP 1514 [TCP segment of a reassembled PDU]  tcp.stream == 2
183  12.255022 202.72.50.127 -> 216.165.108.217 TCP 1514 [TCP segment of a reassembled PDU]  tcp.stream == 2
184  12.255076 202.72.50.127 -> 216.165.108.217 TCP 868 [TCP segment of a reassembled PDU]  tcp.stream == 2
185  12.255080 202.72.50.127 -> 216.165.108.217 HTTP 60 HTTP/1.1 200 OK  (text/html)  tcp.stream == 2
186  12.255765 216.165.108.217 -> 202.72.50.127 TCP 54 52422 > http [ACK] Seq=404 Ack=49168 Win=55480 Len=0  tcp.stream == 2
188  12.285720 202.72.50.127 -> 216.165.108.217 TCP 60 http > 52424 [SYN, ACK] Seq=0 Ack=1 Win=18200 Len=0 MSS=1460  tcp.stream == 4
189  12.285744 216.165.108.217 -> 202.72.50.127 TCP 54 52424 > http [ACK] Seq=1 Ack=1 Win=14600 Len=0  tcp.stream == 4
190  12.301003 216.165.108.217 -> 202.72.50.127 TCP 54 52422 > http [FIN, ACK] Seq=404 Ack=49168 Win=62780 Len=0  tcp.stream == 2
192  12.330255 216.165.108.217 -> 80.12.97.161 TCP 74 52472 > http [SYN] Seq=0 Win=14600 Len=0 MSS=1460 SACK_PERM=1 TSval=44672023 TSecr=0 WS=128  tcp.stream == 6
193  12.331310 216.165.108.217 -> 80.12.97.161 TCP 74 52473 > http [SYN] Seq=0 Win=14600 Len=0 MSS=1460 SACK_PERM=1 TSval=44672024 TSecr=0 WS=128  tcp.stream == 7
194  12.331495 80.12.97.161 -> 216.165.108.217 TCP 74 http > 52472 [SYN, ACK] Seq=0 Ack=1 Win=14480 Len=0 MSS=1460 SACK_PERM=1 TSval=3054206463 TSecr=44672023 WS=4  tcp.stream == 6
195  12.331512 216.165.108.217 -> 80.12.97.161 TCP 66 52472 > http [ACK] Seq=1 Ack=1 Win=14720 Len=0 TSval=44672024 TSecr=3054206463  tcp.stream == 6
196  12.332505 80.12.97.161 -> 216.165.108.217 TCP 74 http > 52473 [SYN, ACK] Seq=0 Ack=1 Win=14480 Len=0 MSS=1460 SACK_PERM=1 TSval=3054206464 TSecr=44672024 WS=4  tcp.stream == 7
197  12.332531 216.165.108.217 -> 80.12.97.161 TCP 66 52473 > http [ACK] Seq=1 Ack=1 Win=14720 Len=0 TSval=44672024 TSecr=3054206464  tcp.stream == 7
199  12.337808 216.165.108.217 -> 80.12.97.161 TCP 74 52474 > http [SYN] Seq=0 Win=14600 Len=0 MSS=1460 SACK_PERM=1 TSval=44672025 TSecr=0 WS=128  tcp.stream == 8
200  12.339020 80.12.97.161 -> 216.165.108.217 TCP 74 http > 52474 [SYN, ACK] Seq=0 Ack=1 Win=14480 Len=0 MSS=1460 SACK_PERM=1 TSval=3054206471 TSecr=44672025 WS=4  tcp.stream == 8
201  12.339045 216.165.108.217 -> 80.12.97.161 TCP 66 52474 > http [ACK] Seq=1 Ack=1 Win=14720 Len=0 TSval=44672026 TSecr=3054206471  tcp.stream == 8
202  12.341399 216.165.108.217 -> 96.6.169.41  TCP 74 40309 > http [SYN] Seq=0 Win=14600 Len=0 MSS=1460 SACK_PERM=1 TSval=44672026 TSecr=0 WS=128  tcp.stream == 9
203  12.341876 216.165.108.217 -> 96.6.169.41  TCP 74 40310 > http [SYN] Seq=0 Win=14600 Len=0 MSS=1460 SACK_PERM=1 TSval=44672026 TSecr=0 WS=128  tcp.stream == 10
204  12.342289 216.165.108.217 -> 96.6.169.41  TCP 74 40311 > http [SYN] Seq=0 Win=14600 Len=0 MSS=1460 SACK_PERM=1 TSval=44672026 TSecr=0 WS=128  tcp.stream == 11
205  12.342690  96.6.169.41 -> 216.165.108.217 TCP 74 http > 40309 [SYN, ACK] Seq=0 Ack=1 Win=14480 Len=0 MSS=1460 SACK_PERM=1 TSval=990052835 TSecr=44672026 WS=4  tcp.stream == 9
206  12.342716 216.165.108.217 -> 96.6.169.41  TCP 66 40309 > http [ACK] Seq=1 Ack=1 Win=14720 Len=0 TSval=44672027 TSecr=990052835  tcp.stream == 9
207  12.342720 216.165.108.217 -> 96.6.169.41  TCP 74 40312 > http [SYN] Seq=0 Win=14600 Len=0 MSS=1460 SACK_PERM=1 TSval=44672027 TSecr=0 WS=128  tcp.stream == 12
208  12.343090 216.165.108.217 -> 96.6.169.41  TCP 74 40313 > http [SYN] Seq=0 Win=14600 Len=0 MSS=1460 SACK_PERM=1 TSval=44672027 TSecr=0 WS=128  tcp.stream == 13
209  12.343275  96.6.169.41 -> 216.165.108.217 TCP 74 http > 40310 [SYN, ACK] Seq=0 Ack=1 Win=14480 Len=0 MSS=1460 SACK_PERM=1 TSval=990053693 TSecr=44672026 WS=4  tcp.stream == 10
210  12.343291 216.165.108.217 -> 96.6.169.41  TCP 66 40310 > http [ACK] Seq=1 Ack=1 Win=14720 Len=0 TSval=44672027 TSecr=990053693  tcp.stream == 10
211  12.343484 216.165.108.217 -> 96.6.169.41  TCP 74 40314 > http [SYN] Seq=0 Win=14600 Len=0 MSS=1460 SACK_PERM=1 TSval=44672027 TSecr=0 WS=128  tcp.stream == 14
212  12.343617  96.6.169.41 -> 216.165.108.217 TCP 74 http > 40311 [SYN, ACK] Seq=0 Ack=1 Win=14480 Len=0 MSS=1460 SACK_PERM=1 TSval=990052836 TSecr=44672026 WS=4  tcp.stream == 11
213  12.343630 216.165.108.217 -> 96.6.169.41  TCP 66 40311 > http [ACK] Seq=1 Ack=1 Win=14720 Len=0 TSval=44672027 TSecr=990052836  tcp.stream == 11
214  12.344082  96.6.169.41 -> 216.165.108.217 TCP 74 http > 40312 [SYN, ACK] Seq=0 Ack=1 Win=14480 Len=0 MSS=1460 SACK_PERM=1 TSval=990053694 TSecr=44672027 WS=4  tcp.stream == 12
215  12.344100 216.165.108.217 -> 96.6.169.41  TCP 66 40312 > http [ACK] Seq=1 Ack=1 Win=14720 Len=0 TSval=44672027 TSecr=990053694  tcp.stream == 12
216  12.344750  96.6.169.41 -> 216.165.108.217 TCP 74 http > 40313 [SYN, ACK] Seq=0 Ack=1 Win=14480 Len=0 MSS=1460 SACK_PERM=1 TSval=990052837 TSecr=44672027 WS=4  tcp.stream == 13
217  12.344772 216.165.108.217 -> 96.6.169.41  TCP 66 40313 > http [ACK] Seq=1 Ack=1 Win=14720 Len=0 TSval=44672027 TSecr=990052837  tcp.stream == 13
218  12.344778  96.6.169.41 -> 216.165.108.217 TCP 74 http > 40314 [SYN, ACK] Seq=0 Ack=1 Win=14480 Len=0 MSS=1460 SACK_PERM=1 TSval=990053695 TSecr=44672027 WS=4  tcp.stream == 14
219  12.344783 216.165.108.217 -> 96.6.169.41  TCP 66 40314 > http [ACK] Seq=1 Ack=1 Win=14720 Len=0 TSval=44672027 TSecr=990053695  tcp.stream == 14
220  12.345550 216.165.108.217 -> 80.12.97.161 TCP 74 52481 > http [SYN] Seq=0 Win=14600 Len=0 MSS=1460 SACK_PERM=1 TSval=44672027 TSecr=0 WS=128  tcp.stream == 15
221  12.346997 80.12.97.161 -> 216.165.108.217 TCP 74 http > 52481 [SYN, ACK] Seq=0 Ack=1 Win=14480 Len=0 MSS=1460 SACK_PERM=1 TSval=3054206478 TSecr=44672027 WS=4  tcp.stream == 15
222  12.347023 216.165.108.217 -> 80.12.97.161 TCP 66 52481 > http [ACK] Seq=1 Ack=1 Win=14720 Len=0 TSval=44672028 TSecr=3054206478  tcp.stream == 15
223  12.365466 216.165.108.217 -> 80.12.97.161 TCP 74 52482 > http [SYN] Seq=0 Win=14600 Len=0 MSS=1460 SACK_PERM=1 TSval=44672032 TSecr=0 WS=128  tcp.stream == 16
224  12.366811 80.12.97.161 -> 216.165.108.217 TCP 74 http > 52482 [SYN, ACK] Seq=0 Ack=1 Win=14480 Len=0 MSS=1460 SACK_PERM=1 TSval=3054206498 TSecr=44672032 WS=4  tcp.stream == 16
225  12.366834 216.165.108.217 -> 80.12.97.161 TCP 66 52482 > http [ACK] Seq=1 Ack=1 Win=14720 Len=0 TSval=44672033 TSecr=3054206498  tcp.stream == 16
226  12.370795 216.165.108.217 -> 202.72.50.127 HTTP 512 GET /com/inc/home/20080930/smart/css/jsCss.css HTTP/1.1   tcp.stream == 4
227  12.371845 216.165.108.217 -> 80.12.97.161 HTTP 546 GET /com/css/d/ranking/smartphone/rnk_ajax_parts-1.0.1.min.css HTTP/1.1   tcp.stream == 7
228  12.372872 216.165.108.217 -> 80.12.97.161 HTTP 547 GET /com/js/d/ranking/smartphone/rjs_slideshow_ranking_smartphone-1.0.3.min.js HTTP/1.1   tcp.stream == 6
229  12.373147 80.12.97.161 -> 216.165.108.217 TCP 66 http > 52473 [ACK] Seq=1 Ack=481 Win=15552 Len=0 TSval=3054206505 TSecr=44672034  tcp.stream == 7
230  12.373213 202.72.50.127 -> 216.165.108.217 TCP 60 http > 52425 [SYN, ACK] Seq=0 Ack=1 Win=18200 Len=0 MSS=1460  tcp.stream == 5
231  12.373225 216.165.108.217 -> 202.72.50.127 TCP 54 52425 > http [ACK] Seq=1 Ack=1 Win=14600 Len=0  tcp.stream == 5
232  12.373938 216.165.108.217 -> 96.6.169.41  HTTP 515 GET /com/inc/home/20080930/smart/css/import.css HTTP/1.1   tcp.stream == 11
233  12.374152 80.12.97.161 -> 216.165.108.217 TCP 66 http > 52472 [ACK] Seq=1 Ack=482 Win=15552 Len=0 TSval=3054206506 TSecr=44672034  tcp.stream == 6
234  12.375386  96.6.169.41 -> 216.165.108.217 TCP 66 http > 40311 [ACK] Seq=1 Ack=450 Win=15552 Len=0 TSval=990052867 TSecr=44672034  tcp.stream == 11
235  12.376517 216.165.108.217 -> 96.6.169.41  HTTP 525 GET /com/inc/home/20080930/smart/css/smt_banner-1.0.0.css HTTP/1.1   tcp.stream == 10
236  12.377990  96.6.169.41 -> 216.165.108.217 TCP 66 http > 40310 [ACK] Seq=1 Ack=460 Win=15552 Len=0 TSval=990053728 TSecr=44672035  tcp.stream == 10
237  12.378144 216.165.108.217 -> 96.6.169.41  HTTP 493 GET /com/js/d/common/jquery-1.3.2.min.js HTTP/1.1   tcp.stream == 9
238  12.379524  96.6.169.41 -> 216.165.108.217 TCP 66 http > 40309 [ACK] Seq=1 Ack=428 Win=15552 Len=0 TSval=990052871 TSecr=44672035  tcp.stream == 9
239  12.379763  96.6.169.41 -> 216.165.108.217 HTTP 1428 HTTP/1.1 200 OK  (text/css)  tcp.stream == 10
240  12.379773 216.165.108.217 -> 96.6.169.41  TCP 66 40310 > http [ACK] Seq=460 Ack=1363 Win=17408 Len=0 TSval=44672036 TSecr=990053730  tcp.stream == 10
241  12.379886 216.165.108.217 -> 80.12.97.161 HTTP 533 GET /com/js/d/ranking/smartphone/ranking_smartphone-1.0.2.min.js HTTP/1.1   tcp.stream == 8
242  12.380894 216.165.108.217 -> 96.6.169.41  HTTP 495 GET /com/js/c/smart/sdup/sdup-1.0.0.min.js HTTP/1.1   tcp.stream == 12
243  12.381207  96.6.169.41 -> 216.165.108.217 TCP 1514 [TCP segment of a reassembled PDU]  tcp.stream == 9
244  12.381223 216.165.108.217 -> 96.6.169.41  TCP 66 40309 > http [ACK] Seq=428 Ack=1449 Win=17536 Len=0 TSval=44672036 TSecr=990052873  tcp.stream == 9
245  12.381324  96.6.169.41 -> 216.165.108.217 TCP 1514 [TCP segment of a reassembled PDU]  tcp.stream == 9
246  12.381331 216.165.108.217 -> 96.6.169.41  TCP 66 40309 > http [ACK] Seq=428 Ack=2897 Win=20480 Len=0 TSval=44672036 TSecr=990052873  tcp.stream == 9
247  12.381448  96.6.169.41 -> 216.165.108.217 TCP 1514 [TCP segment of a reassembled PDU]  tcp.stream == 9
248  12.381456 216.165.108.217 -> 96.6.169.41  TCP 66 40309 > http [ACK] Seq=428 Ack=4345 Win=23296 Len=0 TSval=44672036 TSecr=990052873  tcp.stream == 9
249  12.381572  96.6.169.41 -> 216.165.108.217 TCP 1514 [TCP segment of a reassembled PDU]  tcp.stream == 9
250  12.381578 216.165.108.217 -> 96.6.169.41  TCP 66 40309 > http [ACK] Seq=428 Ack=5793 Win=26240 Len=0 TSval=44672036 TSecr=990052873  tcp.stream == 9
251  12.381695 80.12.97.161 -> 216.165.108.217 TCP 66 http > 52474 [ACK] Seq=1 Ack=468 Win=15552 Len=0 TSval=3054206513 TSecr=44672036  tcp.stream == 8
252  12.381706  96.6.169.41 -> 216.165.108.217 TCP 1514 [TCP segment of a reassembled PDU]  tcp.stream == 9
253  12.381711 216.165.108.217 -> 96.6.169.41  TCP 66 40309 > http [ACK] Seq=428 Ack=7241 Win=29184 Len=0 TSval=44672036 TSecr=990052873  tcp.stream == 9
254  12.382029 216.165.108.217 -> 96.6.169.41  HTTP 501 GET /com/js/c/smart/flicker/flicker-1.0.3.min.js HTTP/1.1   tcp.stream == 14
255  12.382379  96.6.169.41 -> 216.165.108.217 TCP 66 http > 40312 [ACK] Seq=1 Ack=430 Win=15552 Len=0 TSval=990053733 TSecr=44672036  tcp.stream == 12
256  12.382909  96.6.169.41 -> 216.165.108.217 TCP 1514 [TCP segment of a reassembled PDU]  tcp.stream == 9
257  12.382927 216.165.108.217 -> 96.6.169.41  TCP 66 40309 > http [ACK] Seq=428 Ack=8689 Win=32000 Len=0 TSval=44672037 TSecr=990052875  tcp.stream == 9
258  12.383027  96.6.169.41 -> 216.165.108.217 TCP 1514 [TCP segment of a reassembled PDU]  tcp.stream == 9
259  12.383033 216.165.108.217 -> 96.6.169.41  TCP 66 40309 > http [ACK] Seq=428 Ack=10137 Win=34944 Len=0 TSval=44672037 TSecr=990052875  tcp.stream == 9
260  12.383152  96.6.169.41 -> 216.165.108.217 TCP 1514 [TCP segment of a reassembled PDU]  tcp.stream == 9
261  12.383158 216.165.108.217 -> 96.6.169.41  TCP 66 40309 > http [ACK] Seq=428 Ack=11585 Win=37888 Len=0 TSval=44672037 TSecr=990052875  tcp.stream == 9
262  12.383274  96.6.169.41 -> 216.165.108.217 TCP 1514 [TCP segment of a reassembled PDU]  tcp.stream == 9
263  12.383281 216.165.108.217 -> 96.6.169.41  TCP 66 40309 > http [ACK] Seq=428 Ack=13033 Win=40704 Len=0 TSval=44672037 TSecr=990052875  tcp.stream == 9
264  12.383396  96.6.169.41 -> 216.165.108.217 TCP 1514 [TCP segment of a reassembled PDU]  tcp.stream == 9
265  12.383402 216.165.108.217 -> 96.6.169.41  TCP 66 40309 > http [ACK] Seq=428 Ack=14481 Win=43648 Len=0 TSval=44672037 TSecr=990052875  tcp.stream == 9
266  12.383566  96.6.169.41 -> 216.165.108.217 TCP 1514 [TCP segment of a reassembled PDU]  tcp.stream == 9
267  12.383575 216.165.108.217 -> 96.6.169.41  TCP 66 40309 > http [ACK] Seq=428 Ack=15929 Win=46464 Len=0 TSval=44672037 TSecr=990052875  tcp.stream == 9
268  12.383689  96.6.169.41 -> 216.165.108.217 TCP 1514 [TCP segment of a reassembled PDU]  tcp.stream == 9
269  12.383698 216.165.108.217 -> 96.6.169.41  TCP 66 40309 > http [ACK] Seq=428 Ack=17377 Win=49408 Len=0 TSval=44672037 TSecr=990052875  tcp.stream == 9
270  12.383811  96.6.169.41 -> 216.165.108.217 TCP 1514 [TCP segment of a reassembled PDU]  tcp.stream == 9
271  12.383818 216.165.108.217 -> 96.6.169.41  TCP 66 40309 > http [ACK] Seq=428 Ack=18825 Win=52352 Len=0 TSval=44672037 TSecr=990052875  tcp.stream == 9
272  12.383901 216.165.108.217 -> 96.6.169.41  HTTP 517 GET /com/inc/home/20080930/iphone/js/jquery.featureList-1.0.1.js HTTP/1.1   tcp.stream == 13
273  12.383916  96.6.169.41 -> 216.165.108.217 HTTP 1363 HTTP/1.1 200 OK  (application/javascript)  tcp.stream == 9
274  12.383922 216.165.108.217 -> 96.6.169.41  TCP 66 40309 > http [ACK] Seq=428 Ack=20122 Win=53120 Len=0 TSval=44672037 TSecr=990052875  tcp.stream == 9
275  12.383925  96.6.169.41 -> 216.165.108.217 TCP 66 http > 40314 [ACK] Seq=1 Ack=436 Win=15552 Len=0 TSval=990053734 TSecr=44672036  tcp.stream == 14
276  12.384189  96.6.169.41 -> 216.165.108.217 HTTP 799 HTTP/1.1 200 OK  (application/javascript)  tcp.stream == 12
277  12.384201 216.165.108.217 -> 96.6.169.41  TCP 66 40312 > http [ACK] Seq=430 Ack=734 Win=16128 Len=0 TSval=44672037 TSecr=990053734  tcp.stream == 12
278  12.385619  96.6.169.41 -> 216.165.108.217 TCP 66 http > 40313 [ACK] Seq=1 Ack=452 Win=15552 Len=0 TSval=990052878 TSecr=44672037  tcp.stream == 13
279  12.388860  96.6.169.41 -> 216.165.108.217 HTTP 1243 HTTP/1.1 200 OK  (application/javascript)  tcp.stream == 13
280  12.388881 216.165.108.217 -> 96.6.169.41  TCP 66 40313 > http [ACK] Seq=452 Ack=1178 Win=17024 Len=0 TSval=44672038 TSecr=990052881  tcp.stream == 13
281  12.396794 216.165.108.217 -> 80.12.97.161 HTTP 510 GET /com/js/omniture/s_smartphone_code.js HTTP/1.1   tcp.stream == 15
282  12.398258 80.12.97.161 -> 216.165.108.217 TCP 66 http > 52481 [ACK] Seq=1 Ack=445 Win=15552 Len=0 TSval=3054206530 TSecr=44672040  tcp.stream == 15
284  12.421767 216.165.108.217 -> 202.72.50.127 HTTP 501 GET /com/js/d/smart/banner/smt_banner-1.0.0.min.js HTTP/1.1   tcp.stream == 5
285  12.430662 202.72.50.127 -> 216.165.108.217 TCP 1514 [TCP segment of a reassembled PDU]  tcp.stream == 3
286  12.430681 216.165.108.217 -> 202.72.50.127 TCP 54 52423 > http [ACK] Seq=462 Ack=5841 Win=26280 Len=0  tcp.stream == 3
287  12.430781 202.72.50.127 -> 216.165.108.217 TCP 1514 [TCP segment of a reassembled PDU]  tcp.stream == 3
288  12.430788 216.165.108.217 -> 202.72.50.127 TCP 54 52423 > http [ACK] Seq=462 Ack=7301 Win=29200 Len=0  tcp.stream == 3
289  12.431098 202.72.50.127 -> 216.165.108.217 TCP 1514 [TCP segment of a reassembled PDU]  tcp.stream == 3
290  12.431111 216.165.108.217 -> 202.72.50.127 TCP 54 52423 > http [ACK] Seq=462 Ack=8761 Win=32120 Len=0  tcp.stream == 3
291  12.431215 202.72.50.127 -> 216.165.108.217 TCP 1514 [TCP segment of a reassembled PDU]  tcp.stream == 3
292  12.431222 216.165.108.217 -> 202.72.50.127 TCP 54 52423 > http [ACK] Seq=462 Ack=10221 Win=35040 Len=0  tcp.stream == 3
293  12.431340 202.72.50.127 -> 216.165.108.217 TCP 1514 [TCP segment of a reassembled PDU]  tcp.stream == 3
294  12.431349 216.165.108.217 -> 202.72.50.127 TCP 54 52423 > http [ACK] Seq=462 Ack=11681 Win=37960 Len=0  tcp.stream == 3
295  12.431463 202.72.50.127 -> 216.165.108.217 TCP 1514 [TCP segment of a reassembled PDU]  tcp.stream == 3
296  12.431469 216.165.108.217 -> 202.72.50.127 TCP 54 52423 > http [ACK] Seq=462 Ack=13141 Win=40880 Len=0  tcp.stream == 3
297  12.435994  96.6.169.41 -> 216.165.108.217 HTTP 574 HTTP/1.1 200 OK  (text/css)  tcp.stream == 11
298  12.436016 216.165.108.217 -> 96.6.169.41  TCP 66 40311 > http [ACK] Seq=450 Ack=509 Win=15744 Len=0 TSval=44672050 TSecr=990052928  tcp.stream == 11
299  12.461722 216.165.108.217 -> 96.6.169.41  TCP 66 40310 > http [FIN, ACK] Seq=460 Ack=1363 Win=17408 Len=0 TSval=44672056 TSecr=990053730  tcp.stream == 10
300  12.462787 216.165.108.217 -> 96.6.169.41  TCP 74 40317 > http [SYN] Seq=0 Win=14600 Len=0 MSS=1460 SACK_PERM=1 TSval=44672057 TSecr=0 WS=128  tcp.stream == 17
301  12.463153  96.6.169.41 -> 216.165.108.217 TCP 66 http > 40310 [FIN, ACK] Seq=1363 Ack=461 Win=15552 Len=0 TSval=990053813 TSecr=44672056  tcp.stream == 10
302  12.463174 216.165.108.217 -> 96.6.169.41  TCP 66 40310 > http [ACK] Seq=461 Ack=1364 Win=17408 Len=0 TSval=44672057 TSecr=990053813  tcp.stream == 10
303  12.464323  96.6.169.41 -> 216.165.108.217 TCP 74 http > 40317 [SYN, ACK] Seq=0 Ack=1 Win=14480 Len=0 MSS=1460 SACK_PERM=1 TSval=990052956 TSecr=44672057 WS=4  tcp.stream == 17
304  12.464349 216.165.108.217 -> 96.6.169.41  TCP 66 40317 > http [ACK] Seq=1 Ack=1 Win=14720 Len=0 TSval=44672057 TSecr=990052956  tcp.stream == 17
305  12.476278 216.165.108.217 -> 96.6.169.41  TCP 66 40312 > http [FIN, ACK] Seq=430 Ack=734 Win=16128 Len=0 TSval=44672060 TSecr=990053734  tcp.stream == 12
306  12.477080 216.165.108.217 -> 96.6.169.41  TCP 74 40318 > http [SYN] Seq=0 Win=14600 Len=0 MSS=1460 SACK_PERM=1 TSval=44672060 TSecr=0 WS=128  tcp.stream == 18
307  12.478147 216.165.108.217 -> 96.6.169.41  TCP 66 40313 > http [FIN, ACK] Seq=452 Ack=1178 Win=17024 Len=0 TSval=44672060 TSecr=990052881  tcp.stream == 13
308  12.478273  96.6.169.41 -> 216.165.108.217 TCP 74 http > 40318 [SYN, ACK] Seq=0 Ack=1 Win=14480 Len=0 MSS=1460 SACK_PERM=1 TSval=990053828 TSecr=44672060 WS=4  tcp.stream == 18
309  12.478289 216.165.108.217 -> 96.6.169.41  TCP 66 40318 > http [ACK] Seq=1 Ack=1 Win=14720 Len=0 TSval=44672060 TSecr=990053828  tcp.stream == 18
310  12.478910 216.165.108.217 -> 96.6.169.41  TCP 74 40319 > http [SYN] Seq=0 Win=14600 Len=0 MSS=1460 SACK_PERM=1 TSval=44672061 TSecr=0 WS=128  tcp.stream == 19
311  12.479510  96.6.169.41 -> 216.165.108.217 TCP 66 http > 40312 [FIN, ACK] Seq=734 Ack=431 Win=15552 Len=0 TSval=990053830 TSecr=44672060  tcp.stream == 12
312  12.479533 216.165.108.217 -> 96.6.169.41  TCP 66 40312 > http [ACK] Seq=431 Ack=735 Win=16128 Len=0 TSval=44672061 TSecr=990053830  tcp.stream == 12
313  12.480098  96.6.169.41 -> 216.165.108.217 TCP 66 http > 40313 [FIN, ACK] Seq=1178 Ack=453 Win=15552 Len=0 TSval=990052972 TSecr=44672060  tcp.stream == 13
314  12.480119 216.165.108.217 -> 96.6.169.41  TCP 66 40313 > http [ACK] Seq=453 Ack=1179 Win=17024 Len=0 TSval=44672061 TSecr=990052972  tcp.stream == 13
315  12.480266  96.6.169.41 -> 216.165.108.217 TCP 74 http > 40319 [SYN, ACK] Seq=0 Ack=1 Win=14480 Len=0 MSS=1460 SACK_PERM=1 TSval=990052972 TSecr=44672061 WS=4  tcp.stream == 19
316  12.480278 216.165.108.217 -> 96.6.169.41  TCP 66 40319 > http [ACK] Seq=1 Ack=1 Win=14720 Len=0 TSval=44672061 TSecr=990052972  tcp.stream == 19
317  12.483556 202.72.50.127 -> 216.165.108.217 TCP 60 http > 52422 [ACK] Seq=49168 Ack=405 Win=33580 Len=0  tcp.stream == 2
318  12.483575 202.72.50.127 -> 216.165.108.217 TCP 60 http > 52422 [FIN, ACK] Seq=49168 Ack=405 Win=33580 Len=0  tcp.stream == 2
319  12.483583 216.165.108.217 -> 202.72.50.127 TCP 54 52422 > http [ACK] Seq=405 Ack=49169 Win=62780 Len=0  tcp.stream == 2
320  12.496950 216.165.108.217 -> 96.6.169.41  TCP 66 40309 > http [FIN, ACK] Seq=428 Ack=20122 Win=55168 Len=0 TSval=44672065 TSecr=990052875  tcp.stream == 9
321  12.497751 216.165.108.217 -> 96.6.169.41  TCP 74 40320 > http [SYN] Seq=0 Win=14600 Len=0 MSS=1460 SACK_PERM=1 TSval=44672065 TSecr=0 WS=128  tcp.stream == 20
322  12.499179  96.6.169.41 -> 216.165.108.217 TCP 74 http > 40320 [SYN, ACK] Seq=0 Ack=1 Win=14480 Len=0 MSS=1460 SACK_PERM=1 TSval=990053849 TSecr=44672065 WS=4  tcp.stream == 20
323  12.499206 216.165.108.217 -> 96.6.169.41  TCP 66 40320 > http [ACK] Seq=1 Ack=1 Win=14720 Len=0 TSval=44672066 TSecr=990053849  tcp.stream == 20
324  12.500019  96.6.169.41 -> 216.165.108.217 HTTP 1316 HTTP/1.1 200 OK  (application/javascript)  tcp.stream == 14
325  12.500038 216.165.108.217 -> 96.6.169.41  TCP 66 40314 > http [ACK] Seq=436 Ack=1251 Win=17152 Len=0 TSval=44672066 TSecr=990053850  tcp.stream == 14
326  12.511761  96.6.169.41 -> 216.165.108.217 TCP 66 http > 40309 [FIN, ACK] Seq=20122 Ack=429 Win=15552 Len=0 TSval=990053004 TSecr=44672065  tcp.stream == 9
327  12.511787 216.165.108.217 -> 96.6.169.41  TCP 66 40309 > http [ACK] Seq=429 Ack=20123 Win=55168 Len=0 TSval=44672069 TSecr=990053004  tcp.stream == 9
328  12.519827 216.165.108.217 -> 96.6.169.41  HTTP 503 GET /com/js/c/smart/dropDown/dropDown-1.0.0.min.js HTTP/1.1   tcp.stream == 17
329  12.520804 216.165.108.217 -> 96.6.169.41  HTTP 493 GET /com/js/d/iphone/clearvalue-1.0.0.js HTTP/1.1   tcp.stream == 19
330  12.521350  96.6.169.41 -> 216.165.108.217 TCP 66 http > 40317 [ACK] Seq=1 Ack=438 Win=15552 Len=0 TSval=990053013 TSecr=44672071  tcp.stream == 17
331  12.521841 216.165.108.217 -> 96.6.169.41  HTTP 509 GET /com/js/c/smart/pointShow/smt_pointShow-1.0.0.min.js HTTP/1.1   tcp.stream == 18
332  12.522234  96.6.169.41 -> 216.165.108.217 TCP 66 http > 40319 [ACK] Seq=1 Ack=428 Win=15552 Len=0 TSval=990053014 TSecr=44672071  tcp.stream == 19
333  12.523251  96.6.169.41 -> 216.165.108.217 TCP 66 http > 40318 [ACK] Seq=1 Ack=444 Win=15552 Len=0 TSval=990053873 TSecr=44672071  tcp.stream == 18
334  12.523485  96.6.169.41 -> 216.165.108.217 HTTP 1112 HTTP/1.1 200 OK  (application/javascript)  tcp.stream == 19
335  12.523497 216.165.108.217 -> 96.6.169.41  TCP 66 40319 > http [ACK] Seq=428 Ack=1047 Win=16768 Len=0 TSval=44672072 TSecr=990053015  tcp.stream == 19
336  12.524248 216.165.108.217 -> 96.6.169.41  TCP 66 40311 > http [FIN, ACK] Seq=450 Ack=509 Win=15744 Len=0 TSval=44672072 TSecr=990052928  tcp.stream == 11
337  12.524717  96.6.169.41 -> 216.165.108.217 HTTP 669 HTTP/1.1 200 OK  (application/javascript)  tcp.stream == 18
338  12.524736 216.165.108.217 -> 96.6.169.41  TCP 66 40318 > http [ACK] Seq=444 Ack=604 Win=15872 Len=0 TSval=44672072 TSecr=990053875  tcp.stream == 18
339  12.525906  96.6.169.41 -> 216.165.108.217 HTTP 717 HTTP/1.1 200 OK  (application/javascript)  tcp.stream == 17
340  12.525927 216.165.108.217 -> 96.6.169.41  TCP 66 40317 > http [ACK] Seq=438 Ack=652 Win=16000 Len=0 TSval=44672072 TSecr=990053018  tcp.stream == 17
341  12.532365 216.165.108.217 -> 96.6.169.41  TCP 74 40321 > http [SYN] Seq=0 Win=14600 Len=0 MSS=1460 SACK_PERM=1 TSval=44672074 TSecr=0 WS=128  tcp.stream == 21
342  12.533818  96.6.169.41 -> 216.165.108.217 TCP 74 http > 40321 [SYN, ACK] Seq=0 Ack=1 Win=14480 Len=0 MSS=1460 SACK_PERM=1 TSval=990053026 TSecr=44672074 WS=4  tcp.stream == 21
343  12.533844 216.165.108.217 -> 96.6.169.41  TCP 66 40321 > http [ACK] Seq=1 Ack=1 Win=14720 Len=0 TSval=44672074 TSecr=990053026  tcp.stream == 21
344  12.544587 216.165.108.217 -> 96.6.169.41  HTTP 489 GET /com/js/d/rjs/rjs_helpers.min.js HTTP/1.1   tcp.stream == 20
345  12.546103  96.6.169.41 -> 216.165.108.217 TCP 66 http > 40320 [ACK] Seq=1 Ack=424 Win=15552 Len=0 TSval=990053896 TSecr=44672077  tcp.stream == 20
346  12.547539  96.6.169.41 -> 216.165.108.217 HTTP 1255 HTTP/1.1 200 OK  (application/javascript)  tcp.stream == 20
347  12.547561 216.165.108.217 -> 96.6.169.41  TCP 66 40320 > http [ACK] Seq=424 Ack=1190 Win=17024 Len=0 TSval=44672078 TSecr=990053897  tcp.stream == 20
348  12.551299 202.72.50.127 -> 216.165.108.217 TCP 60 http > 52424 [ACK] Seq=1 Ack=459 Win=33580 Len=0  tcp.stream == 4
349  12.554945 202.72.50.127 -> 216.165.108.217 TCP 1514 [TCP segment of a reassembled PDU]  tcp.stream == 4
350  12.554976 216.165.108.217 -> 202.72.50.127 TCP 54 52424 > http [ACK] Seq=459 Ack=1461 Win=17520 Len=0  tcp.stream == 4
351  12.555027 202.72.50.127 -> 216.165.108.217 TCP 1514 [TCP segment of a reassembled PDU]  tcp.stream == 4
352  12.555031 216.165.108.217 -> 202.72.50.127 TCP 54 52424 > http [ACK] Seq=459 Ack=2921 Win=20440 Len=0  tcp.stream == 4
353  12.555182 202.72.50.127 -> 216.165.108.217 TCP 1514 [TCP segment of a reassembled PDU]  tcp.stream == 4
354  12.555192 216.165.108.217 -> 202.72.50.127 TCP 54 52424 > http [ACK] Seq=459 Ack=4381 Win=23360 Len=0  tcp.stream == 4
355  12.564118 216.165.108.217 -> 96.6.169.41  HTTP 507 GET /com/js/d/smart/rjs/smt_rjs_slideshow-1.0.0.min.js HTTP/1.1   tcp.stream == 21
356  12.564702  96.6.169.41 -> 216.165.108.217 TCP 66 http > 40311 [ACK] Seq=509 Ack=451 Win=15552 Len=0 TSval=990053057 TSecr=44672072  tcp.stream == 11
357  12.565757  96.6.169.41 -> 216.165.108.217 TCP 66 http > 40321 [ACK] Seq=1 Ack=442 Win=15552 Len=0 TSval=990053058 TSecr=44672082  tcp.stream == 21
358  12.567981  96.6.169.41 -> 216.165.108.217 TCP 1514 [TCP segment of a reassembled PDU]  tcp.stream == 21
359  12.568002 216.165.108.217 -> 96.6.169.41  TCP 66 40321 > http [ACK] Seq=442 Ack=1449 Win=17536 Len=0 TSval=44672083 TSecr=990053060  tcp.stream == 21
360  12.568101  96.6.169.41 -> 216.165.108.217 HTTP 1399 HTTP/1.1 200 OK  (application/javascript)  tcp.stream == 21
361  12.568107 216.165.108.217 -> 96.6.169.41  TCP 66 40321 > http [ACK] Seq=442 Ack=2782 Win=20480 Len=0 TSval=44672083 TSecr=990053060  tcp.stream == 21
363  12.584314  96.6.169.41 -> 216.165.108.217 TCP 66 http > 40311 [FIN, ACK] Seq=509 Ack=451 Win=15552 Len=0 TSval=990053076 TSecr=44672072  tcp.stream == 11
364  12.584336 216.165.108.217 -> 96.6.169.41  TCP 66 40311 > http [ACK] Seq=451 Ack=510 Win=15744 Len=0 TSval=44672087 TSecr=990053076  tcp.stream == 11
365  12.597483 202.72.50.127 -> 216.165.108.217 TCP 60 http > 52425 [ACK] Seq=1 Ack=448 Win=33580 Len=0  tcp.stream == 5
366  12.603974 202.72.50.127 -> 216.165.108.217 TCP 1514 [TCP segment of a reassembled PDU]  tcp.stream == 5
367  12.603996 216.165.108.217 -> 202.72.50.127 TCP 54 52425 > http [ACK] Seq=448 Ack=1461 Win=17520 Len=0  tcp.stream == 5
368  12.604098 202.72.50.127 -> 216.165.108.217 TCP 1514 [TCP segment of a reassembled PDU]  tcp.stream == 5
369  12.604103 216.165.108.217 -> 202.72.50.127 TCP 54 52425 > http [ACK] Seq=448 Ack=2921 Win=20440 Len=0  tcp.stream == 5
370  12.604106 202.72.50.127 -> 216.165.108.217 HTTP 407 HTTP/1.1 200 OK  (application/x-javascript)  tcp.stream == 5
371  12.604110 216.165.108.217 -> 202.72.50.127 TCP 54 52425 > http [ACK] Seq=448 Ack=3274 Win=23360 Len=0  tcp.stream == 5
372  12.606694 202.72.50.127 -> 216.165.108.217 TCP 1514 [TCP segment of a reassembled PDU]  tcp.stream == 3
373  12.606709 216.165.108.217 -> 202.72.50.127 TCP 54 52423 > http [ACK] Seq=462 Ack=14601 Win=43800 Len=0  tcp.stream == 3
374  12.606810 202.72.50.127 -> 216.165.108.217 TCP 1514 [TCP segment of a reassembled PDU]  tcp.stream == 3
375  12.606816 216.165.108.217 -> 202.72.50.127 TCP 54 52423 > http [ACK] Seq=462 Ack=16061 Win=46720 Len=0  tcp.stream == 3
376  12.607079 202.72.50.127 -> 216.165.108.217 TCP 1514 [TCP segment of a reassembled PDU]  tcp.stream == 3
377  12.607089 216.165.108.217 -> 202.72.50.127 TCP 54 52423 > http [ACK] Seq=462 Ack=17521 Win=49640 Len=0  tcp.stream == 3
378  12.607198 202.72.50.127 -> 216.165.108.217 TCP 1514 [TCP segment of a reassembled PDU]  tcp.stream == 3
379  12.607204 216.165.108.217 -> 202.72.50.127 TCP 54 52423 > http [ACK] Seq=462 Ack=18981 Win=52560 Len=0  tcp.stream == 3
380  12.607321 202.72.50.127 -> 216.165.108.217 TCP 1514 [TCP segment of a reassembled PDU]  tcp.stream == 3
381  12.607327 216.165.108.217 -> 202.72.50.127 TCP 54 52423 > http [ACK] Seq=462 Ack=20441 Win=55480 Len=0  tcp.stream == 3
382  12.607444 202.72.50.127 -> 216.165.108.217 TCP 1514 [TCP segment of a reassembled PDU]  tcp.stream == 3
383  12.607450 216.165.108.217 -> 202.72.50.127 TCP 54 52423 > http [ACK] Seq=462 Ack=21901 Win=56940 Len=0  tcp.stream == 3
384  12.607583 202.72.50.127 -> 216.165.108.217 TCP 1514 [TCP segment of a reassembled PDU]  tcp.stream == 3
385  12.607591 216.165.108.217 -> 202.72.50.127 TCP 54 52423 > http [ACK] Seq=462 Ack=23361 Win=55480 Len=0  tcp.stream == 3
386  12.607704 202.72.50.127 -> 216.165.108.217 TCP 1514 [TCP segment of a reassembled PDU]  tcp.stream == 3
387  12.607710 216.165.108.217 -> 202.72.50.127 TCP 54 52423 > http [ACK] Seq=462 Ack=24821 Win=54020 Len=0  tcp.stream == 3
388  12.607828 202.72.50.127 -> 216.165.108.217 TCP 1514 [TCP segment of a reassembled PDU]  tcp.stream == 3
389  12.607837 216.165.108.217 -> 202.72.50.127 TCP 54 52423 > http [ACK] Seq=462 Ack=26281 Win=52560 Len=0  tcp.stream == 3
390  12.607966 202.72.50.127 -> 216.165.108.217 TCP 1514 [TCP segment of a reassembled PDU]  tcp.stream == 3
391  12.607972 216.165.108.217 -> 202.72.50.127 TCP 54 52423 > http [ACK] Seq=462 Ack=27741 Win=51100 Len=0  tcp.stream == 3
392  12.608090 202.72.50.127 -> 216.165.108.217 TCP 1514 [TCP segment of a reassembled PDU]  tcp.stream == 3
393  12.608212 202.72.50.127 -> 216.165.108.217 TCP 1514 [TCP segment of a reassembled PDU]  tcp.stream == 3
394  12.608407 216.165.108.217 -> 202.72.50.127 TCP 54 52423 > http [ACK] Seq=462 Ack=30661 Win=52560 Len=0  tcp.stream == 3
395  12.628593 216.165.108.217 -> 80.12.97.161 HTTP 531 GET /com/inc/home/20080930/iphone/css/reset.css HTTP/1.1   tcp.stream == 16
396  12.630087 80.12.97.161 -> 216.165.108.217 TCP 66 http > 52482 [ACK] Seq=1 Ack=466 Win=15552 Len=0 TSval=3054206761 TSecr=44672098  tcp.stream == 16
397  12.630850 216.165.108.217 -> 96.6.169.41  TCP 66 40314 > http [FIN, ACK] Seq=436 Ack=1251 Win=17152 Len=0 TSval=44672099 TSecr=990053850  tcp.stream == 14
398  12.631617 216.165.108.217 -> 96.6.169.41  TCP 74 40322 > http [SYN] Seq=0 Win=14600 Len=0 MSS=1460 SACK_PERM=1 TSval=44672099 TSecr=0 WS=128  tcp.stream == 22
399  12.632620 216.165.108.217 -> 96.6.169.41  TCP 66 40319 > http [FIN, ACK] Seq=428 Ack=1047 Win=16768 Len=0 TSval=44672099 TSecr=990053015  tcp.stream == 19
