  4   0.721724 207.46.19.254 -> 216.165.108.217 TCP 1514 [TCP segment of a reassembled PDU]  tcp.stream == 0
  5   0.721742 216.165.108.217 -> 207.46.19.254 TCP 54 44765 > http [RST] Seq=1 Win=0 Len=0  tcp.stream == 0
  7   1.180437 207.46.19.254 -> 216.165.108.217 TCP 1514 [TCP segment of a reassembled PDU]  tcp.stream == 1
  8   1.180457 216.165.108.217 -> 207.46.19.254 TCP 54 44766 > http [RST] Seq=1 Win=0 Len=0  tcp.stream == 1
 21   4.012872 207.46.19.254 -> 216.165.108.217 TCP 1514 [TCP Retransmission] http > 44765 [ACK] Seq=1 Ack=1 Win=64240 Len=1460  tcp.stream == 0
 22   4.012892 216.165.108.217 -> 207.46.19.254 TCP 54 44765 > http [RST] Seq=1 Win=0 Len=0  tcp.stream == 0
 27   4.893863 207.46.19.254 -> 216.165.108.217 TCP 1514 [TCP Retransmission] http > 44766 [ACK] Seq=1 Ack=1 Win=64240 Len=1460  tcp.stream == 1
 28   4.893883 216.165.108.217 -> 207.46.19.254 TCP 54 44766 > http [RST] Seq=1 Win=0 Len=0  tcp.stream == 1
 36   6.288929 216.165.108.217 -> 207.46.232.182 TCP 74 40531 > http [SYN] Seq=0 Win=14600 Len=0 MSS=1460 SACK_PERM=1 TSval=43371129 TSecr=0 WS=128  tcp.stream == 2
 37   6.367105 207.46.232.182 -> 216.165.108.217 TCP 78 http > 40531 [SYN, ACK] Seq=0 Ack=1 Win=16384 Len=0 MSS=1460 WS=1 TSval=0 TSecr=0 SACK_PERM=1  tcp.stream == 2
 38   6.367129 216.165.108.217 -> 207.46.232.182 TCP 66 40531 > http [ACK] Seq=1 Ack=1 Win=14720 Len=0 TSval=43371149 TSecr=0  tcp.stream == 2
 39   6.367218 216.165.108.217 -> 207.46.232.182 HTTP 361 GET / HTTP/1.1   tcp.stream == 2
 40   6.446156 207.46.232.182 -> 216.165.108.217 HTTP 550 HTTP/1.1 301 Moved Permanently  (text/html)  tcp.stream == 2
 41   6.446181 216.165.108.217 -> 207.46.232.182 TCP 66 40531 > http [ACK] Seq=296 Ack=485 Win=15744 Len=0 TSval=43371169 TSecr=4992297  tcp.stream == 2
 42   6.446186 207.46.232.182 -> 216.165.108.217 TCP 66 http > 40531 [FIN, ACK] Seq=485 Ack=296 Win=65240 Len=0 TSval=4992297 TSecr=43371149  tcp.stream == 2
 43   6.446342 216.165.108.217 -> 207.46.232.182 TCP 66 40531 > http [FIN, ACK] Seq=296 Ack=486 Win=15744 Len=0 TSval=43371169 TSecr=4992297  tcp.stream == 2
 44   6.527637 207.46.232.182 -> 216.165.108.217 TCP 66 http > 40531 [ACK] Seq=486 Ack=297 Win=65240 Len=0 TSval=4992298 TSecr=43371169  tcp.stream == 2
 49   6.540720 216.165.108.217 -> 207.46.19.254 TCP 74 44798 > http [SYN] Seq=0 Win=14600 Len=0 MSS=1460 SACK_PERM=1 TSval=43371192 TSecr=0 WS=128  tcp.stream == 3
 51   6.637284 207.46.19.254 -> 216.165.108.217 TCP 60 http > 44798 [SYN, ACK] Seq=0 Ack=1 Win=8190 Len=0 MSS=1460  tcp.stream == 3
 52   6.637309 216.165.108.217 -> 207.46.19.254 TCP 54 44798 > http [ACK] Seq=1 Ack=1 Win=14600 Len=0  tcp.stream == 3
 53   6.637429 216.165.108.217 -> 207.46.19.254 HTTP 353 GET / HTTP/1.1   tcp.stream == 3
 54   6.739468 207.46.19.254 -> 216.165.108.217 HTTP 593 HTTP/1.1 302 Found  (text/html)  tcp.stream == 3
 55   6.739492 216.165.108.217 -> 207.46.19.254 TCP 54 44798 > http [ACK] Seq=300 Ack=540 Win=15631 Len=0  tcp.stream == 3
 56   6.749919 216.165.108.217 -> 207.46.19.254 HTTP 371 GET /en/us/default.aspx HTTP/1.1   tcp.stream == 3
 58   6.848563 207.46.19.254 -> 216.165.108.217 HTTP 600 HTTP/1.1 301 Moved Permanently  (text/html)  tcp.stream == 3
 59   6.850635 216.165.108.217 -> 207.46.19.254 HTTP 371 GET /en-us/default.aspx HTTP/1.1   tcp.stream == 3
 61   7.086932 207.46.19.254 -> 216.165.108.217 TCP 1514 [TCP segment of a reassembled PDU]  tcp.stream == 3
 62   7.087059 207.46.19.254 -> 216.165.108.217 TCP 1514 [TCP segment of a reassembled PDU]  tcp.stream == 3
 63   7.087066 216.165.108.217 -> 207.46.19.254 TCP 54 44798 > http [ACK] Seq=934 Ack=4006 Win=21900 Len=0  tcp.stream == 3
 64   7.087178 207.46.19.254 -> 216.165.108.217 TCP 1514 [TCP segment of a reassembled PDU]  tcp.stream == 3
 65   7.087299 207.46.19.254 -> 216.165.108.217 TCP 1514 [TCP segment of a reassembled PDU]  tcp.stream == 3
 66   7.087305 216.165.108.217 -> 207.46.19.254 TCP 54 44798 > http [ACK] Seq=934 Ack=6926 Win=27740 Len=0  tcp.stream == 3
 67   7.087423 207.46.19.254 -> 216.165.108.217 TCP 1514 [TCP segment of a reassembled PDU]  tcp.stream == 3
 82   7.114223 216.165.108.217 -> 72.247.238.42 TCP 74 56520 > http [SYN] Seq=0 Win=14600 Len=0 MSS=1460 SACK_PERM=1 TSval=43371336 TSecr=0 WS=128  tcp.stream == 4
 83   7.114252 216.165.108.217 -> 207.46.19.254 TCP 74 44800 > http [SYN] Seq=0 Win=14600 Len=0 MSS=1460 SACK_PERM=1 TSval=43371336 TSecr=0 WS=128  tcp.stream == 5
 84   7.114352 216.165.108.217 -> 207.46.19.254 TCP 74 44801 > http [SYN] Seq=0 Win=14600 Len=0 MSS=1460 SACK_PERM=1 TSval=43371336 TSecr=0 WS=128  tcp.stream == 6
 85   7.114414 216.165.108.217 -> 72.247.238.42 TCP 74 56523 > http [SYN] Seq=0 Win=14600 Len=0 MSS=1460 SACK_PERM=1 TSval=43371336 TSecr=0 WS=128  tcp.stream == 7
 86   7.114488 216.165.108.217 -> 72.247.238.42 TCP 74 56524 > http [SYN] Seq=0 Win=14600 Len=0 MSS=1460 SACK_PERM=1 TSval=43371336 TSecr=0 WS=128  tcp.stream == 8
 87   7.114508 216.165.108.217 -> 65.54.95.134 TCP 74 41277 > http [SYN] Seq=0 Win=14600 Len=0 MSS=1460 SACK_PERM=1 TSval=43371336 TSecr=0 WS=128  tcp.stream == 9
 88   7.114541 216.165.108.217 -> 72.247.238.42 TCP 74 56526 > http [SYN] Seq=0 Win=14600 Len=0 MSS=1460 SACK_PERM=1 TSval=43371336 TSecr=0 WS=128  tcp.stream == 10
 89   7.114560 216.165.108.217 -> 72.247.238.42 TCP 74 56527 > http [SYN] Seq=0 Win=14600 Len=0 MSS=1460 SACK_PERM=1 TSval=43371336 TSecr=0 WS=128  tcp.stream == 11
 90   7.115639 216.165.108.217 -> 72.247.238.42 TCP 74 56528 > http [SYN] Seq=0 Win=14600 Len=0 MSS=1460 SACK_PERM=1 TSval=43371336 TSecr=0 WS=128  tcp.stream == 12
 91   7.115676 216.165.108.217 -> 72.247.238.42 TCP 74 56529 > http [SYN] Seq=0 Win=14600 Len=0 MSS=1460 SACK_PERM=1 TSval=43371336 TSecr=0 WS=128  tcp.stream == 13
 92   7.116329 216.165.108.217 -> 64.4.30.89   TCP 74 35068 > http [SYN] Seq=0 Win=14600 Len=0 MSS=1460 SACK_PERM=1 TSval=43371336 TSecr=0 WS=128  tcp.stream == 14
 93   7.125781 216.165.108.217 -> 207.46.19.254 TCP 54 44798 > http [ACK] Seq=934 Ack=8386 Win=30660 Len=0  tcp.stream == 3
 94   7.137521 72.247.238.42 -> 216.165.108.217 TCP 74 http > 56520 [SYN, ACK] Seq=0 Ack=1 Win=14480 Len=0 MSS=1460 SACK_PERM=1 TSval=3115093778 TSecr=43371336 WS=4  tcp.stream == 4
 95   7.137547 216.165.108.217 -> 72.247.238.42 TCP 66 56520 > http [ACK] Seq=1 Ack=1 Win=14720 Len=0 TSval=43371341 TSecr=3115093778  tcp.stream == 4
 96   7.137654 216.165.108.217 -> 72.247.238.42 HTTP 912 GET /en-us/homepage/style.cssx?k=~/shared/templates/components/mscomViews/VPivot/VPivot-css.aspx;~/shared/templates/components/mscomViews/grid/grid-css.aspx;~/shared/templates/components/mscomViews/hero/hero-css.aspx;~/shared/templates/components/mscomViews/Accordion/Accordion-css.aspx;~/shared/templates/components/mscomViews/controls/featureitem/featureItem-css.aspx;~/shared/templates/components/mscomViews/Carousel/Carousel-css.aspx;~/shared/templates/components/mscomViews/List/list-css.aspx&sc=/en-us/homepage/site.config&pc=&v=1114074694 HTTP/1.1   tcp.stream == 4
 97   7.137937 72.247.238.42 -> 216.165.108.217 TCP 74 http > 56523 [SYN, ACK] Seq=0 Ack=1 Win=14480 Len=0 MSS=1460 SACK_PERM=1 TSval=3115093778 TSecr=43371336 WS=4  tcp.stream == 7
 98   7.137947 216.165.108.217 -> 72.247.238.42 TCP 66 56523 > http [ACK] Seq=1 Ack=1 Win=14720 Len=0 TSval=43371342 TSecr=3115093778  tcp.stream == 7
 99   7.137998 72.247.238.42 -> 216.165.108.217 TCP 74 http > 56524 [SYN, ACK] Seq=0 Ack=1 Win=14480 Len=0 MSS=1460 SACK_PERM=1 TSval=3115093779 TSecr=43371336 WS=4  tcp.stream == 8
100   7.138004 216.165.108.217 -> 72.247.238.42 TCP 66 56524 > http [ACK] Seq=1 Ack=1 Win=14720 Len=0 TSval=43371342 TSecr=3115093779  tcp.stream == 8
101   7.138017 216.165.108.217 -> 72.247.238.42 HTTP 379 GET /library/svy/broker.js HTTP/1.1   tcp.stream == 7
102   7.138052 216.165.108.217 -> 72.247.238.42 HTTP 1164 GET /en-us/homepage/style.cssx?k=~/shared/templates/master/hpMaster/master-css.aspx;~/shared/templates/components/mscomViews/Blade/blade-css.aspx;~/shared/templates/components/mscomViews/Header/header-css.aspx;~/shared/templates/components/mscomViews/Products/Products-css.aspx;~/shared/templates/components/mscomViews/ProductTiles/ProductTiles-css.aspx;~/shared/templates/components/mscomViews/ProductList/ProductList-css.aspx;~/shared/templates/components/mscomViews/Search/Search-css.aspx;~/shared/templates/components/mscomViews/LocalePicker/LocalePicker-css.aspx;~/shared/templates/components/mscomViews/Menu/menu-css.aspx;~/shared/templates/components/mscomViews/Footer/footer-css.aspx;~/shared/templates/master/hpMaster/master-header-css.aspx&sc=/en-us/homepage/site.config&pc=&v=2035960675 HTTP/1.1   tcp.stream == 8
103   7.138055 72.247.238.42 -> 216.165.108.217 TCP 74 http > 56526 [SYN, ACK] Seq=0 Ack=1 Win=14480 Len=0 MSS=1460 SACK_PERM=1 TSval=3115093779 TSecr=43371336 WS=4  tcp.stream == 10
104   7.138060 216.165.108.217 -> 72.247.238.42 TCP 66 56526 > http [ACK] Seq=1 Ack=1 Win=14720 Len=0 TSval=43371342 TSecr=3115093779  tcp.stream == 10
105   7.138085 216.165.108.217 -> 72.247.238.42 HTTP 654 GET /en-us/homepage/script.jsx?k=~/shared/templates/components/mscomViews/Controls/Scripts/mscomhelper.js;~/shared/templates/components/mscomViews/Blade/blade.js;~/shared/templates/components/mscomViews/Search/Search.js;~/shared/templates/components/mscomViews/LocalePicker/LocalePicker.js&v=-282235141 HTTP/1.1   tcp.stream == 10
106   7.138222 72.247.238.42 -> 216.165.108.217 TCP 74 http > 56527 [SYN, ACK] Seq=0 Ack=1 Win=14480 Len=0 MSS=1460 SACK_PERM=1 TSval=3115093779 TSecr=43371336 WS=4  tcp.stream == 11
107   7.138230 216.165.108.217 -> 72.247.238.42 TCP 66 56527 > http [ACK] Seq=1 Ack=1 Win=14720 Len=0 TSval=43371342 TSecr=3115093779  tcp.stream == 11
108   7.138303 216.165.108.217 -> 72.247.238.42 HTTP 689 GET /en-us/homepage/script.jsx?k=~/shared/templates/components/mscomViews/VPivot/VPivot.js;~/shared/templates/components/mscomViews/grid/grid.js;~/shared/templates/components/mscomViews/hero/hero.js;~/shared/templates/components/mscomViews/Accordion/Accordion.js;~/shared/templates/components/mscomViews/Carousel/Carousel.js&v=1793508902 HTTP/1.1   tcp.stream == 11
110   7.139853 72.247.238.42 -> 216.165.108.217 TCP 74 http > 56528 [SYN, ACK] Seq=0 Ack=1 Win=14480 Len=0 MSS=1460 SACK_PERM=1 TSval=3115093780 TSecr=43371336 WS=4  tcp.stream == 12
111   7.139872 216.165.108.217 -> 72.247.238.42 TCP 66 56528 > http [ACK] Seq=1 Ack=1 Win=14720 Len=0 TSval=43371342 TSecr=3115093780  tcp.stream == 12
112   7.139876 72.247.238.42 -> 216.165.108.217 TCP 74 http > 56529 [SYN, ACK] Seq=0 Ack=1 Win=14480 Len=0 MSS=1460 SACK_PERM=1 TSval=3115093780 TSecr=43371336 WS=4  tcp.stream == 13
113   7.139889 216.165.108.217 -> 72.247.238.42 TCP 66 56529 > http [ACK] Seq=1 Ack=1 Win=14720 Len=0 TSval=43371342 TSecr=3115093780  tcp.stream == 13
114   7.139995 216.165.108.217 -> 72.247.238.42 HTTP 448 GET /global/en-us/homepage/PublishingImages/Header/WindowsLogo.png HTTP/1.1   tcp.stream == 12
115   7.140014 216.165.108.217 -> 72.247.238.42 HTTP 447 GET /global/en-us/homepage/PublishingImages/Header/OfficeLogo.png HTTP/1.1   tcp.stream == 13
116   7.162363 72.247.238.42 -> 216.165.108.217 TCP 66 http > 56520 [ACK] Seq=1 Ack=847 Win=16172 Len=0 TSval=3115093802 TSecr=43371341  tcp.stream == 4
117   7.162672 72.247.238.42 -> 216.165.108.217 TCP 1514 [TCP segment of a reassembled PDU]  tcp.stream == 4
118   7.162681 216.165.108.217 -> 72.247.238.42 TCP 66 56520 > http [ACK] Seq=847 Ack=1449 Win=17536 Len=0 TSval=43371348 TSecr=3115093802  tcp.stream == 4
119   7.162802 72.247.238.42 -> 216.165.108.217 TCP 1514 [TCP segment of a reassembled PDU]  tcp.stream == 4
120   7.162815 216.165.108.217 -> 72.247.238.42 TCP 66 56520 > http [ACK] Seq=847 Ack=2897 Win=20480 Len=0 TSval=43371348 TSecr=3115093802  tcp.stream == 4
121   7.162925 72.247.238.42 -> 216.165.108.217 TCP 1514 [TCP segment of a reassembled PDU]  tcp.stream == 4
122   7.162930 216.165.108.217 -> 72.247.238.42 TCP 66 56520 > http [ACK] Seq=847 Ack=4345 Win=23296 Len=0 TSval=43371348 TSecr=3115093802  tcp.stream == 4
123   7.163048 72.247.238.42 -> 216.165.108.217 TCP 66 http > 56523 [ACK] Seq=1 Ack=314 Win=15552 Len=0 TSval=3115093802 TSecr=43371342  tcp.stream == 7
124   7.163055 72.247.238.42 -> 216.165.108.217 TCP 66 http > 56524 [ACK] Seq=1 Ack=1099 Win=16676 Len=0 TSval=3115093802 TSecr=43371342  tcp.stream == 8
125   7.163059 72.247.238.42 -> 216.165.108.217 TCP 1514 [TCP segment of a reassembled PDU]  tcp.stream == 4
126   7.163063 216.165.108.217 -> 72.247.238.42 TCP 66 56520 > http [ACK] Seq=847 Ack=5793 Win=26240 Len=0 TSval=43371348 TSecr=3115093802  tcp.stream == 4
127   7.163185 72.247.238.42 -> 216.165.108.217 TCP 1514 [TCP segment of a reassembled PDU]  tcp.stream == 7
128   7.163191 216.165.108.217 -> 72.247.238.42 TCP 66 56523 > http [ACK] Seq=314 Ack=1449 Win=17536 Len=0 TSval=43371348 TSecr=3115093802  tcp.stream == 7
129   7.163309 72.247.238.42 -> 216.165.108.217 TCP 1514 [TCP segment of a reassembled PDU]  tcp.stream == 7
130   7.163314 216.165.108.217 -> 72.247.238.42 TCP 66 56523 > http [ACK] Seq=314 Ack=2897 Win=20480 Len=0 TSval=43371348 TSecr=3115093802  tcp.stream == 7
131   7.163433 72.247.238.42 -> 216.165.108.217 TCP 1514 [TCP segment of a reassembled PDU]  tcp.stream == 7
132   7.163438 216.165.108.217 -> 72.247.238.42 TCP 66 56523 > http [ACK] Seq=314 Ack=4345 Win=23296 Len=0 TSval=43371348 TSecr=3115093802  tcp.stream == 7
133   7.163555 72.247.238.42 -> 216.165.108.217 TCP 66 http > 56526 [ACK] Seq=1 Ack=589 Win=15656 Len=0 TSval=3115093802 TSecr=43371342  tcp.stream == 10
134   7.163563 72.247.238.42 -> 216.165.108.217 TCP 66 http > 56527 [ACK] Seq=1 Ack=624 Win=15728 Len=0 TSval=3115093802 TSecr=43371342  tcp.stream == 11
135   7.163567 72.247.238.42 -> 216.165.108.217 TCP 1514 [TCP segment of a reassembled PDU]  tcp.stream == 7
136   7.163571 216.165.108.217 -> 72.247.238.42 TCP 66 56523 > http [ACK] Seq=314 Ack=5793 Win=26240 Len=0 TSval=43371348 TSecr=3115093802  tcp.stream == 7
137   7.163692 72.247.238.42 -> 216.165.108.217 TCP 1514 [TCP segment of a reassembled PDU]  tcp.stream == 10
138   7.163697 216.165.108.217 -> 72.247.238.42 TCP 66 56526 > http [ACK] Seq=589 Ack=1449 Win=17536 Len=0 TSval=43371348 TSecr=3115093803  tcp.stream == 10
139   7.163816 72.247.238.42 -> 216.165.108.217 TCP 1514 [TCP segment of a reassembled PDU]  tcp.stream == 10
140   7.163822 216.165.108.217 -> 72.247.238.42 TCP 66 56526 > http [ACK] Seq=589 Ack=2897 Win=20480 Len=0 TSval=43371348 TSecr=3115093803  tcp.stream == 10
141   7.163939 72.247.238.42 -> 216.165.108.217 TCP 1514 [TCP segment of a reassembled PDU]  tcp.stream == 10
142   7.163944 216.165.108.217 -> 72.247.238.42 TCP 66 56526 > http [ACK] Seq=589 Ack=4345 Win=23296 Len=0 TSval=43371348 TSecr=3115093803  tcp.stream == 10
143   7.164062 72.247.238.42 -> 216.165.108.217 TCP 1514 [TCP segment of a reassembled PDU]  tcp.stream == 10
144   7.164066 216.165.108.217 -> 72.247.238.42 TCP 66 56526 > http [ACK] Seq=589 Ack=5793 Win=26240 Len=0 TSval=43371348 TSecr=3115093803  tcp.stream == 10
145   7.164184 72.247.238.42 -> 216.165.108.217 TCP 1514 [TCP segment of a reassembled PDU]  tcp.stream == 8
146   7.164189 216.165.108.217 -> 72.247.238.42 TCP 66 56524 > http [ACK] Seq=1099 Ack=1449 Win=17536 Len=0 TSval=43371348 TSecr=3115093803  tcp.stream == 8
147   7.164309 72.247.238.42 -> 216.165.108.217 TCP 1514 [TCP segment of a reassembled PDU]  tcp.stream == 8
148   7.164314 216.165.108.217 -> 72.247.238.42 TCP 66 56524 > http [ACK] Seq=1099 Ack=2897 Win=20480 Len=0 TSval=43371348 TSecr=3115093803  tcp.stream == 8
149   7.164430 72.247.238.42 -> 216.165.108.217 TCP 1514 [TCP segment of a reassembled PDU]  tcp.stream == 8
150   7.164435 216.165.108.217 -> 72.247.238.42 TCP 66 56524 > http [ACK] Seq=1099 Ack=4345 Win=23296 Len=0 TSval=43371348 TSecr=3115093803  tcp.stream == 8
151   7.164553 72.247.238.42 -> 216.165.108.217 TCP 1514 [TCP segment of a reassembled PDU]  tcp.stream == 8
152   7.164558 216.165.108.217 -> 72.247.238.42 TCP 66 56524 > http [ACK] Seq=1099 Ack=5793 Win=26240 Len=0 TSval=43371348 TSecr=3115093803  tcp.stream == 8
153   7.164683 72.247.238.42 -> 216.165.108.217 TCP 1514 [TCP segment of a reassembled PDU]  tcp.stream == 11
154   7.164689 216.165.108.217 -> 72.247.238.42 TCP 66 56527 > http [ACK] Seq=624 Ack=1449 Win=17536 Len=0 TSval=43371348 TSecr=3115093803  tcp.stream == 11
155   7.164814 72.247.238.42 -> 216.165.108.217 TCP 1514 [TCP segment of a reassembled PDU]  tcp.stream == 11
156   7.164818 216.165.108.217 -> 72.247.238.42 TCP 66 56527 > http [ACK] Seq=624 Ack=2897 Win=20480 Len=0 TSval=43371348 TSecr=3115093803  tcp.stream == 11
157   7.164929 72.247.238.42 -> 216.165.108.217 TCP 1514 [TCP segment of a reassembled PDU]  tcp.stream == 11
158   7.164934 216.165.108.217 -> 72.247.238.42 TCP 66 56527 > http [ACK] Seq=624 Ack=4345 Win=23296 Len=0 TSval=43371348 TSecr=3115093803  tcp.stream == 11
159   7.165052 72.247.238.42 -> 216.165.108.217 TCP 66 http > 56528 [ACK] Seq=1 Ack=383 Win=15552 Len=0 TSval=3115093804 TSecr=43371342  tcp.stream == 12
160   7.165059 72.247.238.42 -> 216.165.108.217 TCP 66 http > 56529 [ACK] Seq=1 Ack=382 Win=15552 Len=0 TSval=3115093804 TSecr=43371342  tcp.stream == 13
161   7.165064 72.247.238.42 -> 216.165.108.217 TCP 1514 [TCP segment of a reassembled PDU]  tcp.stream == 11
162   7.165066 216.165.108.217 -> 72.247.238.42 TCP 66 56527 > http [ACK] Seq=624 Ack=5793 Win=26240 Len=0 TSval=43371348 TSecr=3115093803  tcp.stream == 11
163   7.165215 72.247.238.42 -> 216.165.108.217 TCP 1514 [TCP segment of a reassembled PDU]  tcp.stream == 12
164   7.165220 216.165.108.217 -> 72.247.238.42 TCP 66 56528 > http [ACK] Seq=383 Ack=1449 Win=17536 Len=0 TSval=43371348 TSecr=3115093804  tcp.stream == 12
165   7.165340 72.247.238.42 -> 216.165.108.217 TCP 1514 [TCP segment of a reassembled PDU]  tcp.stream == 12
166   7.165345 216.165.108.217 -> 72.247.238.42 TCP 66 56528 > http [ACK] Seq=383 Ack=2897 Win=20480 Len=0 TSval=43371348 TSecr=3115093804  tcp.stream == 12
167   7.165461 72.247.238.42 -> 216.165.108.217 TCP 1514 [TCP segment of a reassembled PDU]  tcp.stream == 12
168   7.165466 216.165.108.217 -> 72.247.238.42 TCP 66 56528 > http [ACK] Seq=383 Ack=4345 Win=23296 Len=0 TSval=43371348 TSecr=3115093804  tcp.stream == 12
169   7.165585 72.247.238.42 -> 216.165.108.217 TCP 1514 [TCP segment of a reassembled PDU]  tcp.stream == 12
170   7.165590 216.165.108.217 -> 72.247.238.42 TCP 66 56528 > http [ACK] Seq=383 Ack=5793 Win=26240 Len=0 TSval=43371348 TSecr=3115093804  tcp.stream == 12
171   7.165708 72.247.238.42 -> 216.165.108.217 TCP 1514 [TCP segment of a reassembled PDU]  tcp.stream == 13
172   7.165714 216.165.108.217 -> 72.247.238.42 TCP 66 56529 > http [ACK] Seq=382 Ack=1449 Win=17536 Len=0 TSval=43371348 TSecr=3115093804  tcp.stream == 13
173   7.165831 72.247.238.42 -> 216.165.108.217 TCP 1514 [TCP segment of a reassembled PDU]  tcp.stream == 13
174   7.165838 216.165.108.217 -> 72.247.238.42 TCP 66 56529 > http [ACK] Seq=382 Ack=2897 Win=20480 Len=0 TSval=43371349 TSecr=3115093804  tcp.stream == 13
175   7.165969 72.247.238.42 -> 216.165.108.217 TCP 1514 [TCP segment of a reassembled PDU]  tcp.stream == 13
176   7.165974 216.165.108.217 -> 72.247.238.42 TCP 66 56529 > http [ACK] Seq=382 Ack=4345 Win=23296 Len=0 TSval=43371349 TSecr=3115093804  tcp.stream == 13
177   7.166090 72.247.238.42 -> 216.165.108.217 TCP 1514 [TCP segment of a reassembled PDU]  tcp.stream == 13
178   7.166095 216.165.108.217 -> 72.247.238.42 TCP 66 56529 > http [ACK] Seq=382 Ack=5793 Win=26240 Len=0 TSval=43371349 TSecr=3115093804  tcp.stream == 13
179   7.184096 207.46.19.254 -> 216.165.108.217 TCP 1514 [TCP segment of a reassembled PDU]  tcp.stream == 3
180   7.184114 216.165.108.217 -> 207.46.19.254 TCP 54 44798 > http [ACK] Seq=934 Ack=9846 Win=33580 Len=0  tcp.stream == 3
181   7.184214 207.46.19.254 -> 216.165.108.217 TCP 1514 [TCP segment of a reassembled PDU]  tcp.stream == 3
182   7.184219 216.165.108.217 -> 207.46.19.254 TCP 54 44798 > http [ACK] Seq=934 Ack=11306 Win=36500 Len=0  tcp.stream == 3
183   7.184330 207.46.19.254 -> 216.165.108.217 TCP 1514 [TCP segment of a reassembled PDU]  tcp.stream == 3
184   7.184335 216.165.108.217 -> 207.46.19.254 TCP 54 44798 > http [ACK] Seq=934 Ack=12766 Win=39420 Len=0  tcp.stream == 3
185   7.184490 207.46.19.254 -> 216.165.108.217 TCP 1514 [TCP segment of a reassembled PDU]  tcp.stream == 3
186   7.184497 216.165.108.217 -> 207.46.19.254 TCP 54 44798 > http [ACK] Seq=934 Ack=14226 Win=42340 Len=0  tcp.stream == 3
187   7.184611 207.46.19.254 -> 216.165.108.217 TCP 1514 [TCP segment of a reassembled PDU]  tcp.stream == 3
188   7.184616 216.165.108.217 -> 207.46.19.254 TCP 54 44798 > http [ACK] Seq=934 Ack=15686 Win=45260 Len=0  tcp.stream == 3
189   7.189453 72.247.238.42 -> 216.165.108.217 TCP 1514 [TCP segment of a reassembled PDU]  tcp.stream == 4
190   7.189470 216.165.108.217 -> 72.247.238.42 TCP 66 56520 > http [ACK] Seq=847 Ack=7241 Win=29184 Len=0 TSval=43371354 TSecr=3115093827  tcp.stream == 4
191   7.189568 72.247.238.42 -> 216.165.108.217 TCP 1514 [TCP segment of a reassembled PDU]  tcp.stream == 4
192   7.189572 216.165.108.217 -> 72.247.238.42 TCP 66 56520 > http [ACK] Seq=847 Ack=8689 Win=32000 Len=0 TSval=43371354 TSecr=3115093827  tcp.stream == 4
193   7.189687 72.247.238.42 -> 216.165.108.217 TCP 1514 [TCP segment of a reassembled PDU]  tcp.stream == 4
194   7.189692 216.165.108.217 -> 72.247.238.42 TCP 66 56520 > http [ACK] Seq=847 Ack=10137 Win=34944 Len=0 TSval=43371354 TSecr=3115093827  tcp.stream == 4
195   7.189810 72.247.238.42 -> 216.165.108.217 TCP 1514 [TCP segment of a reassembled PDU]  tcp.stream == 4
196   7.189816 216.165.108.217 -> 72.247.238.42 TCP 66 56520 > http [ACK] Seq=847 Ack=11585 Win=37888 Len=0 TSval=43371355 TSecr=3115093827  tcp.stream == 4
197   7.189934 72.247.238.42 -> 216.165.108.217 TCP 1514 [TCP segment of a reassembled PDU]  tcp.stream == 4
198   7.189940 216.165.108.217 -> 72.247.238.42 TCP 66 56520 > http [ACK] Seq=847 Ack=13033 Win=40704 Len=0 TSval=43371355 TSecr=3115093827  tcp.stream == 4
199   7.190050 72.247.238.42 -> 216.165.108.217 HTTP 1476 HTTP/1.1 200 OK  (text/css)  tcp.stream == 4
200   7.190055 216.165.108.217 -> 72.247.238.42 TCP 66 56520 > http [ACK] Seq=847 Ack=14443 Win=43648 Len=0 TSval=43371355 TSecr=3115093827  tcp.stream == 4
201   7.190140 216.165.108.217 -> 72.247.238.42 HTTP 445 GET /global/en-us/homepage/PublishingImages/Header/XboxLogo.png HTTP/1.1   tcp.stream == 4
202   7.190178 72.247.238.42 -> 216.165.108.217 TCP 1514 [TCP segment of a reassembled PDU]  tcp.stream == 7
203   7.190183 216.165.108.217 -> 72.247.238.42 TCP 66 56523 > http [ACK] Seq=314 Ack=7241 Win=29184 Len=0 TSval=43371355 TSecr=3115093827  tcp.stream == 7
204   7.190234 72.247.238.42 -> 216.165.108.217 HTTP 920 HTTP/1.1 200 OK  (application/x-javascript)  tcp.stream == 7
205   7.190238 216.165.108.217 -> 72.247.238.42 TCP 66 56523 > http [ACK] Seq=314 Ack=8095 Win=32000 Len=0 TSval=43371355 TSecr=3115093827  tcp.stream == 7
206   7.190386 72.247.238.42 -> 216.165.108.217 HTTP 1913 HTTP/1.1 200 OK  (text/javascript)  tcp.stream == 10
207   7.190392 216.165.108.217 -> 72.247.238.42 TCP 66 56526 > http [ACK] Seq=589 Ack=7640 Win=29184 Len=0 TSval=43371355 TSecr=3115093828  tcp.stream == 10
208   7.190434 216.165.108.217 -> 72.247.238.42 HTTP 446 GET /global/en-us/homepage/PublishingImages/Header/PhoneLogo.png HTTP/1.1   tcp.stream == 10
209   7.190703 72.247.238.42 -> 216.165.108.217 HTTP 884 HTTP/1.1 200 OK  (text/css)  tcp.stream == 8
210   7.190710 216.165.108.217 -> 72.247.238.42 TCP 66 56524 > http [ACK] Seq=1099 Ack=6611 Win=29184 Len=0 TSval=43371355 TSecr=3115093828  tcp.stream == 8
211   7.190754 216.165.108.217 -> 72.247.238.42 HTTP 443 GET /global/en-us/homepage/PublishingImages/Header/IELogo.png HTTP/1.1   tcp.stream == 8
212   7.191603 72.247.238.42 -> 216.165.108.217 TCP 1514 [TCP segment of a reassembled PDU]  tcp.stream == 11
213   7.191619 216.165.108.217 -> 72.247.238.42 TCP 66 56527 > http [ACK] Seq=624 Ack=7241 Win=29184 Len=0 TSval=43371355 TSecr=3115093829  tcp.stream == 11
214   7.191717 72.247.238.42 -> 216.165.108.217 TCP 1514 [TCP segment of a reassembled PDU]  tcp.stream == 11
215   7.191721 216.165.108.217 -> 72.247.238.42 TCP 66 56527 > http [ACK] Seq=624 Ack=8689 Win=32000 Len=0 TSval=43371355 TSecr=3115093829  tcp.stream == 11
216   7.191847 72.247.238.42 -> 216.165.108.217 TCP 1514 [TCP segment of a reassembled PDU]  tcp.stream == 11
217   7.191852 216.165.108.217 -> 72.247.238.42 TCP 66 56527 > http [ACK] Seq=624 Ack=10137 Win=34944 Len=0 TSval=43371355 TSecr=3115093829  tcp.stream == 11
218   7.191968 72.247.238.42 -> 216.165.108.217 TCP 1514 [TCP segment of a reassembled PDU]  tcp.stream == 11
219   7.191973 216.165.108.217 -> 72.247.238.42 TCP 66 56527 > http [ACK] Seq=624 Ack=11585 Win=37888 Len=0 TSval=43371355 TSecr=3115093829  tcp.stream == 11
220   7.192120 72.247.238.42 -> 216.165.108.217 TCP 1514 [TCP segment of a reassembled PDU]  tcp.stream == 11
221   7.192125 216.165.108.217 -> 72.247.238.42 TCP 66 56527 > http [ACK] Seq=624 Ack=13033 Win=40704 Len=0 TSval=43371355 TSecr=3115093829  tcp.stream == 11
222   7.192248 72.247.238.42 -> 216.165.108.217 TCP 1514 [TCP segment of a reassembled PDU]  tcp.stream == 11
223   7.192253 216.165.108.217 -> 72.247.238.42 TCP 66 56527 > http [ACK] Seq=624 Ack=14481 Win=43648 Len=0 TSval=43371355 TSecr=3115093829  tcp.stream == 11
224   7.192416 72.247.238.42 -> 216.165.108.217 TCP 1514 [TCP segment of a reassembled PDU]  tcp.stream == 11
225   7.192421 216.165.108.217 -> 72.247.238.42 TCP 66 56527 > http [ACK] Seq=624 Ack=15929 Win=46464 Len=0 TSval=43371355 TSecr=3115093829  tcp.stream == 11
226   7.192539 72.247.238.42 -> 216.165.108.217 TCP 1514 [TCP segment of a reassembled PDU]  tcp.stream == 11
227   7.192544 216.165.108.217 -> 72.247.238.42 TCP 66 56527 > http [ACK] Seq=624 Ack=17377 Win=49408 Len=0 TSval=43371355 TSecr=3115093829  tcp.stream == 11
228   7.192828 72.247.238.42 -> 216.165.108.217 TCP 1514 [TCP segment of a reassembled PDU]  tcp.stream == 12
229   7.192835 216.165.108.217 -> 72.247.238.42 TCP 66 56528 > http [ACK] Seq=383 Ack=7241 Win=29184 Len=0 TSval=43371355 TSecr=3115093829  tcp.stream == 12
230   7.192949 72.247.238.42 -> 216.165.108.217 TCP 1514 [TCP segment of a reassembled PDU]  tcp.stream == 12
231   7.192953 216.165.108.217 -> 72.247.238.42 TCP 66 56528 > http [ACK] Seq=383 Ack=8689 Win=32000 Len=0 TSval=43371355 TSecr=3115093829  tcp.stream == 12
232   7.192955 72.247.238.42 -> 216.165.108.217 HTTP 424 HTTP/1.1 200 OK  (PNG)  tcp.stream == 12
233   7.192959 216.165.108.217 -> 72.247.238.42 TCP 66 56528 > http [ACK] Seq=383 Ack=9047 Win=34944 Len=0 TSval=43371355 TSecr=3115093829  tcp.stream == 12
234   7.193003 65.54.95.134 -> 216.165.108.217 TCP 74 http > 41277 [SYN, ACK] Seq=0 Ack=1 Win=65535 Len=0 MSS=1460 WS=16 SACK_PERM=1 TSval=1204722130 TSecr=43371336  tcp.stream == 9
235   7.193011 216.165.108.217 -> 65.54.95.134 TCP 66 41277 > http [ACK] Seq=1 Ack=1 Win=14720 Len=0 TSval=43371355 TSecr=1204722130  tcp.stream == 9
236   7.193249 72.247.238.42 -> 216.165.108.217 TCP 1514 [TCP segment of a reassembled PDU]  tcp.stream == 13
237   7.193254 216.165.108.217 -> 72.247.238.42 TCP 66 56529 > http [ACK] Seq=382 Ack=7241 Win=29184 Len=0 TSval=43371355 TSecr=3115093830  tcp.stream == 13
238   7.193304 72.247.238.42 -> 216.165.108.217 HTTP 885 HTTP/1.1 200 OK  (PNG)  tcp.stream == 13
239   7.193307 216.165.108.217 -> 72.247.238.42 TCP 66 56529 > http [ACK] Seq=382 Ack=8060 Win=32000 Len=0 TSval=43371355 TSecr=3115093830  tcp.stream == 13
240   7.193734 216.165.108.217 -> 72.247.238.42 HTTP 466 GET /en-us/homepage/shared/templates/components/hpSearch/images/searchSprite.ltr.gif HTTP/1.1   tcp.stream == 12
241   7.193761 216.165.108.217 -> 65.54.95.134 HTTP 391 GET /ajax/jQuery/jquery-1.5.1.min.js HTTP/1.1   tcp.stream == 9
242   7.193853 216.165.108.217 -> 72.247.238.42 HTTP 452 GET /global/en-us/homepage/PublishingImages/sprites/microsoft_gray.png HTTP/1.1   tcp.stream == 13
243   7.210513 207.46.19.254 -> 216.165.108.217 TCP 60 http > 44800 [SYN, ACK] Seq=0 Ack=1 Win=8190 Len=0 MSS=1460  tcp.stream == 5
244   7.210535 216.165.108.217 -> 207.46.19.254 TCP 54 44800 > http [ACK] Seq=1 Ack=1 Win=14600 Len=0  tcp.stream == 5
245   7.210584 207.46.19.254 -> 216.165.108.217 TCP 60 http > 44801 [SYN, ACK] Seq=0 Ack=1 Win=8190 Len=0 MSS=1460  tcp.stream == 6
246   7.210590 216.165.108.217 -> 207.46.19.254 TCP 54 44801 > http [ACK] Seq=1 Ack=1 Win=14600 Len=0  tcp.stream == 6
247   7.210658 216.165.108.217 -> 207.46.19.254 HTTP 397 GET /en-us/homepage/shared/core/2/js/js.ashx?pt=hpPage& HTTP/1.1   tcp.stream == 5
248   7.210687 216.165.108.217 -> 207.46.19.254 HTTP 444 GET /en-us/homepage/shared/core/2/css/css.ashx?sc=/en-us/homepage/site.config&pt=hpPage HTTP/1.1   tcp.stream == 6
249   7.212604   64.4.30.89 -> 216.165.108.217 TCP 60 http > 35068 [SYN, ACK] Seq=0 Ack=1 Win=8190 Len=0 MSS=1460  tcp.stream == 14
250   7.212629 216.165.108.217 -> 64.4.30.89   TCP 54 35068 > http [ACK] Seq=1 Ack=1 Win=14600 Len=0  tcp.stream == 14
251   7.212742 216.165.108.217 -> 64.4.30.89   HTTP 496 GET /trans_pixel.aspx?tz=5&cot=5&qos.uri=http://www.microsoft.com/en-us/default.aspx&qos.ti=1329409820164&ts=1329409820165&qos.tl=&qos.n=init HTTP/1.1   tcp.stream == 14
252   7.217603 72.247.238.42 -> 216.165.108.217 TCP 1514 [TCP segment of a reassembled PDU]  tcp.stream == 4
253   7.217707 72.247.238.42 -> 216.165.108.217 TCP 1514 [TCP segment of a reassembled PDU]  tcp.stream == 4
254   7.217716 216.165.108.217 -> 72.247.238.42 TCP 66 56520 > http [ACK] Seq=1226 Ack=17339 Win=49408 Len=0 TSval=43371361 TSecr=3115093854  tcp.stream == 4
255   7.217836 72.247.238.42 -> 216.165.108.217 TCP 1514 [TCP segment of a reassembled PDU]  tcp.stream == 4
256   7.217962 72.247.238.42 -> 216.165.108.217 TCP 1514 [TCP segment of a reassembled PDU]  tcp.stream == 4
257   7.217968 216.165.108.217 -> 72.247.238.42 TCP 66 56520 > http [ACK] Seq=1226 Ack=20235 Win=55168 Len=0 TSval=43371362 TSecr=3115093854  tcp.stream == 4
258   7.218085 72.247.238.42 -> 216.165.108.217 TCP 1514 [TCP segment of a reassembled PDU]  tcp.stream == 4
259   7.218205 72.247.238.42 -> 216.165.108.217 TCP 1514 [TCP segment of a reassembled PDU]  tcp.stream == 4
260   7.218210 216.165.108.217 -> 72.247.238.42 TCP 66 56520 > http [ACK] Seq=1226 Ack=23131 Win=61056 Len=0 TSval=43371362 TSecr=3115093854  tcp.stream == 4
261   7.218261 72.247.238.42 -> 216.165.108.217 HTTP 992 HTTP/1.1 200 OK  (PNG)  tcp.stream == 4
262   7.218410 72.247.238.42 -> 216.165.108.217 TCP 1514 [TCP segment of a reassembled PDU]  tcp.stream == 10
263   7.218528 72.247.238.42 -> 216.165.108.217 TCP 1514 [TCP segment of a reassembled PDU]  tcp.stream == 10
264   7.218534 216.165.108.217 -> 72.247.238.42 TCP 66 56526 > http [ACK] Seq=969 Ack=10536 Win=34944 Len=0 TSval=43371362 TSecr=3115093855  tcp.stream == 10
265   7.218667 72.247.238.42 -> 216.165.108.217 TCP 1514 [TCP segment of a reassembled PDU]  tcp.stream == 10
266   7.218778 72.247.238.42 -> 216.165.108.217 TCP 1514 [TCP segment of a reassembled PDU]  tcp.stream == 10
267   7.218783 216.165.108.217 -> 72.247.238.42 TCP 66 56526 > http [ACK] Seq=969 Ack=13432 Win=40704 Len=0 TSval=43371362 TSecr=3115093855  tcp.stream == 10
268   7.218827 72.247.238.42 -> 216.165.108.217 HTTP 740 HTTP/1.1 200 OK  (PNG)  tcp.stream == 10
269   7.218986 72.247.238.42 -> 216.165.108.217 TCP 1514 [TCP segment of a reassembled PDU]  tcp.stream == 8
270   7.219108 72.247.238.42 -> 216.165.108.217 TCP 1514 [TCP segment of a reassembled PDU]  tcp.stream == 8
271   7.219114 216.165.108.217 -> 72.247.238.42 TCP 66 56524 > http [ACK] Seq=1476 Ack=9507 Win=34944 Len=0 TSval=43371362 TSecr=3115093855  tcp.stream == 8
272   7.219233 72.247.238.42 -> 216.165.108.217 TCP 1514 [TCP segment of a reassembled PDU]  tcp.stream == 8
273   7.219332 72.247.238.42 -> 216.165.108.217 TCP 1514 [TCP segment of a reassembled PDU]  tcp.stream == 8
274   7.219338 216.165.108.217 -> 72.247.238.42 TCP 66 56524 > http [ACK] Seq=1476 Ack=12403 Win=40704 Len=0 TSval=43371362 TSecr=3115093855  tcp.stream == 8
275   7.219479 72.247.238.42 -> 216.165.108.217 TCP 1514 [TCP segment of a reassembled PDU]  tcp.stream == 8
276   7.219600 72.247.238.42 -> 216.165.108.217 TCP 1514 [TCP segment of a reassembled PDU]  tcp.stream == 8
277   7.219605 216.165.108.217 -> 72.247.238.42 TCP 66 56524 > http [ACK] Seq=1476 Ack=15299 Win=46464 Len=0 TSval=43371362 TSecr=3115093855  tcp.stream == 8
278   7.219723 72.247.238.42 -> 216.165.108.217 TCP 1514 [TCP segment of a reassembled PDU]  tcp.stream == 8
279   7.219854 72.247.238.42 -> 216.165.108.217 TCP 1514 [TCP segment of a reassembled PDU]  tcp.stream == 11
280   7.219860 216.165.108.217 -> 72.247.238.42 TCP 66 56527 > http [ACK] Seq=624 Ack=18825 Win=52352 Len=0 TSval=43371362 TSecr=3115093856  tcp.stream == 11
281   7.219979 72.247.238.42 -> 216.165.108.217 HTTP 1685 HTTP/1.1 200 OK  (text/javascript)  tcp.stream == 11
282   7.219984 216.165.108.217 -> 72.247.238.42 TCP 66 56527 > http [ACK] Seq=624 Ack=20444 Win=55168 Len=0 TSval=43371362 TSecr=3115093856  tcp.stream == 11
283   7.220262 72.247.238.42 -> 216.165.108.217 HTTP 1920 HTTP/1.1 200 OK  (GIF89a)  tcp.stream == 12
284   7.220274 216.165.108.217 -> 72.247.238.42 TCP 66 56528 > http [ACK] Seq=783 Ack=10901 Win=37888 Len=0 TSval=43371362 TSecr=3115093858  tcp.stream == 12
285   7.220422 72.247.238.42 -> 216.165.108.217 TCP 1514 [TCP segment of a reassembled PDU]  tcp.stream == 13
286   7.220542 72.247.238.42 -> 216.165.108.217 TCP 1514 [TCP segment of a reassembled PDU]  tcp.stream == 13
287   7.220547 216.165.108.217 -> 72.247.238.42 TCP 66 56529 > http [ACK] Seq=768 Ack=10956 Win=37888 Len=0 TSval=43371362 TSecr=3115093858  tcp.stream == 13
288   7.220668 72.247.238.42 -> 216.165.108.217 HTTP 1534 HTTP/1.1 200 OK  (PNG)  tcp.stream == 13
289   7.220673 216.165.108.217 -> 72.247.238.42 TCP 66 56529 > http [ACK] Seq=768 Ack=12424 Win=40704 Len=0 TSval=43371362 TSecr=3115093858  tcp.stream == 13
290   7.223393 207.46.19.254 -> 216.165.108.217 TCP 1514 [TCP segment of a reassembled PDU]  tcp.stream == 3
291   7.223412 216.165.108.217 -> 207.46.19.254 TCP 54 44798 > http [ACK] Seq=934 Ack=17146 Win=48180 Len=0  tcp.stream == 3
292   7.244336 72.247.238.42 -> 216.165.108.217 HTTP 561 HTTP/1.1 200 OK  (PNG)  tcp.stream == 8
293   7.244353 216.165.108.217 -> 72.247.238.42 TCP 66 56524 > http [ACK] Seq=1476 Ack=17242 Win=52352 Len=0 TSval=43371368 TSecr=3115093855  tcp.stream == 8
294   7.257777 216.165.108.217 -> 72.247.238.42 TCP 66 56526 > http [ACK] Seq=969 Ack=14106 Win=43648 Len=0 TSval=43371372 TSecr=3115093855  tcp.stream == 10
295   7.257785 216.165.108.217 -> 72.247.238.42 TCP 66 56520 > http [ACK] Seq=1226 Ack=24057 Win=63872 Len=0 TSval=43371372 TSecr=3115093854  tcp.stream == 4
297   7.271503 65.54.95.134 -> 216.165.108.217 TCP 66 [TCP Window Update] http > 41277 [ACK] Seq=1 Ack=1 Win=101360 Len=0 TSval=1204722208 TSecr=43371355  tcp.stream == 9
298   7.272909 65.54.95.134 -> 216.165.108.217 TCP 1514 [TCP segment of a reassembled PDU]  tcp.stream == 9
299   7.272926 216.165.108.217 -> 65.54.95.134 TCP 66 41277 > http [ACK] Seq=326 Ack=1449 Win=17536 Len=0 TSval=43371375 TSecr=1204722209  tcp.stream == 9
300   7.273029 65.54.95.134 -> 216.165.108.217 TCP 1514 [TCP segment of a reassembled PDU]  tcp.stream == 9
301   7.273037 216.165.108.217 -> 65.54.95.134 TCP 66 41277 > http [ACK] Seq=326 Ack=2897 Win=20480 Len=0 TSval=43371375 TSecr=1204722209  tcp.stream == 9
302   7.281139 207.46.19.254 -> 216.165.108.217 TCP 1514 [TCP segment of a reassembled PDU]  tcp.stream == 3
303   7.281154 216.165.108.217 -> 207.46.19.254 TCP 54 44798 > http [ACK] Seq=934 Ack=18606 Win=51100 Len=0  tcp.stream == 3
304   7.281333 207.46.19.254 -> 216.165.108.217 TCP 1514 [TCP segment of a reassembled PDU]  tcp.stream == 3
305   7.281338 216.165.108.217 -> 207.46.19.254 TCP 54 44798 > http [ACK] Seq=934 Ack=20066 Win=54020 Len=0  tcp.stream == 3
306   7.281459 207.46.19.254 -> 216.165.108.217 TCP 1514 [TCP segment of a reassembled PDU]  tcp.stream == 3
307   7.281465 216.165.108.217 -> 207.46.19.254 TCP 54 44798 > http [ACK] Seq=934 Ack=21526 Win=56940 Len=0  tcp.stream == 3
308   7.281706 207.46.19.254 -> 216.165.108.217 TCP 1514 [TCP segment of a reassembled PDU]  tcp.stream == 3
309   7.281713 216.165.108.217 -> 207.46.19.254 TCP 54 44798 > http [ACK] Seq=934 Ack=22986 Win=59860 Len=0  tcp.stream == 3
310   7.281830 207.46.19.254 -> 216.165.108.217 TCP 1514 [TCP segment of a reassembled PDU]  tcp.stream == 3
311   7.281836 216.165.108.217 -> 207.46.19.254 TCP 54 44798 > http [ACK] Seq=934 Ack=24446 Win=62780 Len=0  tcp.stream == 3
312   7.281951 207.46.19.254 -> 216.165.108.217 TCP 1514 [TCP segment of a reassembled PDU]  tcp.stream == 3
313   7.281956 216.165.108.217 -> 207.46.19.254 TCP 54 44798 > http [ACK] Seq=934 Ack=25906 Win=62780 Len=0  tcp.stream == 3
318   7.291213 216.165.108.217 -> 72.247.238.42 HTTP 450 GET /global/en-us/homepage/PublishingImages/Sprites/white_vpivot.png HTTP/1.1   tcp.stream == 11
319   7.291270 216.165.108.217 -> 72.247.238.42 HTTP 436 GET /global/en-us/homepage/PublishingImages/sprite.png HTTP/1.1   tcp.stream == 4
320   7.291287 216.165.108.217 -> 72.247.238.42 HTTP 464 GET /global/en-us/homepage/PublishingImages/hero/OfficePCTrial_0213_530x320_dk.jpg HTTP/1.1   tcp.stream == 8
321   7.291302 216.165.108.217 -> 72.247.238.42 HTTP 456 GET /global/en-us/homepage/PublishingImages/thumbnails/ServicePack2_sm.png HTTP/1.1   tcp.stream == 12
322   7.291350 216.165.108.217 -> 4.27.18.126  TCP 74 47932 > http [SYN] Seq=0 Win=14600 Len=0 MSS=1460 SACK_PERM=1 TSval=43371380 TSecr=0 WS=128  tcp.stream == 15
323   7.291365 216.165.108.217 -> 72.247.238.42 HTTP 450 GET /global/en-us/homepage/PublishingImages/thumbnails/SecEss_sm.png HTTP/1.1   tcp.stream == 13
324   7.291380 216.165.108.217 -> 72.247.238.42 HTTP 447 GET /global/en-us/homepage/PublishingImages/thumbnails/tag_sm.png HTTP/1.1   tcp.stream == 10
325   7.292463  4.27.18.126 -> 216.165.108.217 TCP 74 http > 47932 [SYN, ACK] Seq=0 Ack=1 Win=5792 Len=0 MSS=1460 SACK_PERM=1 TSval=2469096638 TSecr=43371380 WS=128  tcp.stream == 15
326   7.292489 216.165.108.217 -> 4.27.18.126  TCP 66 47932 > http [ACK] Seq=1 Ack=1 Win=14720 Len=0 TSval=43371380 TSecr=2469096638  tcp.stream == 15
327   7.292575 216.165.108.217 -> 4.27.18.126  HTTP 368 GET /library/dap.js HTTP/1.1   tcp.stream == 15
328   7.294121  4.27.18.126 -> 216.165.108.217 TCP 66 http > 47932 [ACK] Seq=1 Ack=303 Win=6912 Len=0 TSval=2469096639 TSecr=43371380  tcp.stream == 15
329   7.294335  4.27.18.126 -> 216.165.108.217 TCP 66 [TCP Keep-Alive] http > 47932 [ACK] Seq=0 Ack=303 Win=6912 Len=0 TSval=2469096639 TSecr=43371380  tcp.stream == 15
330   7.294344 216.165.108.217 -> 4.27.18.126  TCP 66 [TCP Keep-Alive ACK] 47932 > http [ACK] Seq=303 Ack=1 Win=14720 Len=0 TSval=43371381 TSecr=2469096639  tcp.stream == 15
331   7.294679  4.27.18.126 -> 216.165.108.217 TCP 1514 [TCP segment of a reassembled PDU]  tcp.stream == 15
332   7.294688 216.165.108.217 -> 4.27.18.126  TCP 66 47932 > http [ACK] Seq=303 Ack=1449 Win=17536 Len=0 TSval=43371381 TSecr=2469096639  tcp.stream == 15
333   7.294792  4.27.18.126 -> 216.165.108.217 TCP 1514 [TCP segment of a reassembled PDU]  tcp.stream == 15
334   7.294801 216.165.108.217 -> 4.27.18.126  TCP 66 47932 > http [ACK] Seq=303 Ack=2897 Win=20480 Len=0 TSval=43371381 TSecr=2469096639  tcp.stream == 15
335   7.296270  4.27.18.126 -> 216.165.108.217 HTTP 1499 HTTP/1.1 200 OK  (application/x-javascript)  tcp.stream == 15
336   7.296284 216.165.108.217 -> 4.27.18.126  TCP 66 47932 > http [ACK] Seq=303 Ack=4330 Win=23296 Len=0 TSval=43371381 TSecr=2469096641  tcp.stream == 15
