 55   8.269789 157.55.96.253 -> 216.165.108.217 TCP 60 https > 40960 [RST, ACK] Seq=1 Ack=1 Win=5380 Len=0  tcp.stream == 0
 64   9.302180 216.165.108.217 -> 199.59.149.230 TCP 74 53521 > http [SYN] Seq=0 Win=14600 Len=0 MSS=1460 SACK_PERM=1 TSval=42867433 TSecr=0 WS=128  tcp.stream == 1
 67   9.377150 199.59.149.230 -> 216.165.108.217 TCP 74 http > 53521 [SYN, ACK] Seq=0 Ack=1 Win=5792 Len=0 MSS=1460 SACK_PERM=1 TSval=651350407 TSecr=42867433 WS=256  tcp.stream == 1
 68   9.377185 216.165.108.217 -> 199.59.149.230 TCP 66 53521 > http [ACK] Seq=1 Ack=1 Win=14720 Len=0 TSval=42867452 TSecr=651350407  tcp.stream == 1
 69   9.381794 216.165.108.217 -> 199.59.149.230 HTTP 463 GET / HTTP/1.1   tcp.stream == 1
 70   9.455832 199.59.149.230 -> 216.165.108.217 TCP 66 http > 53521 [ACK] Seq=1 Ack=398 Win=6912 Len=0 TSval=651350819 TSecr=42867453  tcp.stream == 1
 71   9.469201 199.59.149.230 -> 216.165.108.217 HTTP 1753 HTTP/1.1 200 OK  (text/html)  tcp.stream == 1
 72   9.469225 216.165.108.217 -> 199.59.149.230 TCP 66 53521 > http [ACK] Seq=398 Ack=1688 Win=17536 Len=0 TSval=42867475 TSecr=651350832  tcp.stream == 1
 73   9.505488 216.165.108.217 -> 199.59.149.230 TCP 66 53521 > http [FIN, ACK] Seq=398 Ack=1688 Win=17536 Len=0 TSval=42867484 TSecr=651350832  tcp.stream == 1
 75   9.579757 199.59.149.230 -> 216.165.108.217 TCP 66 http > 53521 [FIN, ACK] Seq=1688 Ack=399 Win=6912 Len=0 TSval=651350943 TSecr=42867484  tcp.stream == 1
 76   9.579787 216.165.108.217 -> 199.59.149.230 TCP 66 53521 > http [ACK] Seq=399 Ack=1689 Win=17536 Len=0 TSval=42867502 TSecr=651350943  tcp.stream == 1
 81  10.036975 216.165.108.217 -> 199.59.149.240 TCP 74 35458 > https [SYN] Seq=0 Win=14600 Len=0 MSS=1460 SACK_PERM=1 TSval=42867616 TSecr=0 WS=128  tcp.stream == 2
 83  10.122589 199.59.149.240 -> 216.165.108.217 TCP 74 https > 35458 [SYN, ACK] Seq=0 Ack=1 Win=14480 Len=0 MSS=1460 SACK_PERM=1 TSval=1975188278 TSecr=42867616 WS=256  tcp.stream == 2
 84  10.122627 216.165.108.217 -> 199.59.149.240 TCP 66 35458 > https [ACK] Seq=1 Ack=1 Win=14720 Len=0 TSval=42867638 TSecr=1975188278  tcp.stream == 2
 85  10.131454 216.165.108.217 -> 199.59.149.240 SSL 272 Client Hello  tcp.stream == 2
 86  10.216465 199.59.149.240 -> 216.165.108.217 TCP 66 https > 35458 [ACK] Seq=1 Ack=207 Win=15616 Len=0 TSval=1975188372 TSecr=42867640  tcp.stream == 2
 87  10.227544 199.59.149.240 -> 216.165.108.217 TLSv1 1514 Server Hello  tcp.stream == 2
 88  10.227568 216.165.108.217 -> 199.59.149.240 TCP 66 35458 > https [ACK] Seq=207 Ack=1449 Win=17536 Len=0 TSval=42867664 TSecr=1975188383  tcp.stream == 2
 89  10.227634 199.59.149.240 -> 216.165.108.217 TCP 1514 [TCP segment of a reassembled PDU]  tcp.stream == 2
 90  10.227641 216.165.108.217 -> 199.59.149.240 TCP 66 35458 > https [ACK] Seq=207 Ack=2897 Win=20480 Len=0 TSval=42867664 TSecr=1975188383  tcp.stream == 2
 91  10.227692 199.59.149.240 -> 216.165.108.217 TLSv1 845 Certificate, Server Key Exchange, Server Hello Done  tcp.stream == 2
 92  10.227702 216.165.108.217 -> 199.59.149.240 TCP 66 35458 > https [ACK] Seq=207 Ack=3676 Win=23296 Len=0 TSval=42867664 TSecr=1975188383  tcp.stream == 2
 94  10.412874 216.165.108.217 -> 199.59.149.240 TLSv1 264 Client Key Exchange, Change Cipher Spec, Encrypted Handshake Message  tcp.stream == 2
 96  10.501913 199.59.149.240 -> 216.165.108.217 TLSv1 125 Change Cipher Spec, Encrypted Handshake Message  tcp.stream == 2
 97  10.501939 216.165.108.217 -> 199.59.149.240 TCP 66 35458 > https [ACK] Seq=405 Ack=3735 Win=23296 Len=0 TSval=42867733 TSecr=1975188657  tcp.stream == 2
