 14   1.956559 216.165.108.217 -> 184.105.67.85 TCP 66 42299 > http [FIN, ACK] Seq=1 Ack=1 Win=115 Len=0 TSval=42883187 TSecr=2127445994  tcp.stream == 0
 15   1.957706 216.165.108.217 -> 184.105.67.85 TCP 66 42300 > http [FIN, ACK] Seq=1 Ack=1 Win=115 Len=0 TSval=42883188 TSecr=2127446194  tcp.stream == 1
 16   1.958170 216.165.108.217 -> 184.105.67.85 TCP 66 42301 > http [FIN, ACK] Seq=1 Ack=1 Win=115 Len=0 TSval=42883188 TSecr=2127446094  tcp.stream == 2
 17   1.958562 216.165.108.217 -> 184.105.67.85 TCP 66 42302 > http [FIN, ACK] Seq=1 Ack=1 Win=115 Len=0 TSval=42883188 TSecr=2127446344  tcp.stream == 3
 18   1.958988 216.165.108.217 -> 184.105.67.85 TCP 66 42303 > http [FIN, ACK] Seq=1 Ack=1 Win=115 Len=0 TSval=42883188 TSecr=2127446194  tcp.stream == 4
 19   1.959619 216.165.108.217 -> 119.147.67.67 TCP 66 50980 > http [FIN, ACK] Seq=1 Ack=1 Win=115 Len=0 TSval=42883188 TSecr=3105453643  tcp.stream == 5
 20   1.960185 216.165.108.217 -> 125.39.127.25 TCP 66 51747 > http [FIN, ACK] Seq=1 Ack=1 Win=115 Len=0 TSval=42883188 TSecr=1481236857  tcp.stream == 6
 22   2.036066 184.105.67.85 -> 216.165.108.217 TCP 66 http > 42299 [RST, ACK] Seq=1 Ack=2 Win=1448 Len=0 TSval=2127447983 TSecr=42883187  tcp.stream == 0
 23   2.037016 184.105.67.85 -> 216.165.108.217 TCP 66 http > 42300 [RST, ACK] Seq=1 Ack=2 Win=1448 Len=0 TSval=2127447983 TSecr=42883188  tcp.stream == 1
 24   2.037433 184.105.67.85 -> 216.165.108.217 TCP 66 http > 42301 [RST, ACK] Seq=1 Ack=2 Win=1448 Len=0 TSval=2127447983 TSecr=42883188  tcp.stream == 2
 25   2.037608 184.105.67.85 -> 216.165.108.217 TCP 66 http > 42302 [RST, ACK] Seq=1 Ack=2 Win=1448 Len=0 TSval=2127447983 TSecr=42883188  tcp.stream == 3
 26   2.037768 184.105.67.85 -> 216.165.108.217 TCP 66 http > 42303 [RST, ACK] Seq=1 Ack=2 Win=1448 Len=0 TSval=2127447984 TSecr=42883188  tcp.stream == 4
 28   2.222977 119.147.67.67 -> 216.165.108.217 TCP 66 http > 50980 [FIN, ACK] Seq=1 Ack=2 Win=1448 Len=0 TSval=3105457762 TSecr=42883188  tcp.stream == 5
 29   2.223006 216.165.108.217 -> 119.147.67.67 TCP 66 50980 > http [ACK] Seq=2 Ack=2 Win=115 Len=0 TSval=42883254 TSecr=3105457762  tcp.stream == 5
 30   2.255900 125.39.127.25 -> 216.165.108.217 TCP 66 http > 51747 [FIN, ACK] Seq=1 Ack=2 Win=179 Len=0 TSval=1481241284 TSecr=42883188  tcp.stream == 6
 31   2.255927 216.165.108.217 -> 125.39.127.25 TCP 66 51747 > http [ACK] Seq=2 Ack=2 Win=115 Len=0 TSval=42883262 TSecr=1481241284  tcp.stream == 6
 61   6.532818 216.165.108.217 -> 220.181.138.59 TCP 74 40930 > http [SYN] Seq=0 Win=14600 Len=0 MSS=1460 SACK_PERM=1 TSval=42884331 TSecr=0 WS=128  tcp.stream == 7
 67   6.783774 216.165.108.217 -> 125.39.127.22 TCP 74 35024 > http [SYN] Seq=0 Win=14600 Len=0 MSS=1460 SACK_PERM=1 TSval=42884394 TSecr=0 WS=128  tcp.stream == 8
 69   7.033568 220.181.138.59 -> 216.165.108.217 TCP 74 http > 40930 [SYN, ACK] Seq=0 Ack=1 Win=5712 Len=0 MSS=1440 SACK_PERM=1 TSval=52056679 TSecr=42884331 WS=32  tcp.stream == 7
 70   7.033598 216.165.108.217 -> 220.181.138.59 TCP 66 40930 > http [ACK] Seq=1 Ack=1 Win=14720 Len=0 TSval=42884457 TSecr=52056679  tcp.stream == 7
 71   7.033686 216.165.108.217 -> 220.181.138.59 HTTP 354 GET / HTTP/1.1   tcp.stream == 7
 72   7.072190 125.39.127.22 -> 216.165.108.217 TCP 74 http > 35024 [SYN, ACK] Seq=0 Ack=1 Win=5712 Len=0 MSS=1440 SACK_PERM=1 TSval=1214134995 TSecr=42884394 WS=32  tcp.stream == 8
 73   7.072222 216.165.108.217 -> 125.39.127.22 TCP 66 35024 > http [ACK] Seq=1 Ack=1 Win=14720 Len=0 TSval=42884466 TSecr=1214134995  tcp.stream == 8
 76   7.542495 220.181.138.59 -> 216.165.108.217 TCP 66 http > 40930 [ACK] Seq=1 Ack=289 Win=6784 Len=0 TSval=52056806 TSecr=42884457  tcp.stream == 7
 77   7.542616 220.181.138.59 -> 216.165.108.217 TCP 394 [TCP segment of a reassembled PDU]  tcp.stream == 7
 78   7.542626 216.165.108.217 -> 220.181.138.59 TCP 66 40930 > http [ACK] Seq=289 Ack=329 Win=15744 Len=0 TSval=42884584 TSecr=52056806  tcp.stream == 7
 79   7.542636 220.181.138.59 -> 216.165.108.217 HTTP 234 HTTP/1.1 302 Moved Temporarily  (text/html)  tcp.stream == 7
 80   7.542658 216.165.108.217 -> 220.181.138.59 TCP 66 40930 > http [ACK] Seq=289 Ack=497 Win=16768 Len=0 TSval=42884584 TSecr=52056806  tcp.stream == 7
 86   7.650412 216.165.108.217 -> 125.39.127.25 TCP 74 51825 > http [SYN] Seq=0 Win=14600 Len=0 MSS=1460 SACK_PERM=1 TSval=42884611 TSecr=0 WS=128  tcp.stream == 9
 90   7.900025 216.165.108.217 -> 125.39.127.22 TCP 74 35026 > http [SYN] Seq=0 Win=14600 Len=0 MSS=1460 SACK_PERM=1 TSval=42884673 TSecr=0 WS=128  tcp.stream == 10
 92   7.946235 125.39.127.25 -> 216.165.108.217 TCP 74 http > 51825 [SYN, ACK] Seq=0 Ack=1 Win=5712 Len=0 MSS=1440 SACK_PERM=1 TSval=1241274138 TSecr=42884611 WS=32  tcp.stream == 9
 93   7.946263 216.165.108.217 -> 125.39.127.25 TCP 66 51825 > http [ACK] Seq=1 Ack=1 Win=14720 Len=0 TSval=42884685 TSecr=1241274138  tcp.stream == 9
 94   7.946369 216.165.108.217 -> 125.39.127.25 HTTP 358 GET / HTTP/1.1   tcp.stream == 9
 96   8.188356 125.39.127.22 -> 216.165.108.217 TCP 74 http > 35026 [SYN, ACK] Seq=0 Ack=1 Win=5712 Len=0 MSS=1440 SACK_PERM=1 TSval=1233166719 TSecr=42884673 WS=32  tcp.stream == 10
 97   8.188386 216.165.108.217 -> 125.39.127.22 TCP 66 35026 > http [ACK] Seq=1 Ack=1 Win=14720 Len=0 TSval=42884745 TSecr=1233166719  tcp.stream == 10
 98   8.241585 125.39.127.25 -> 216.165.108.217 TCP 66 http > 51825 [ACK] Seq=1 Ack=293 Win=6784 Len=0 TSval=1241274212 TSecr=42884685  tcp.stream == 9
 99   8.246615 125.39.127.25 -> 216.165.108.217 TCP 1494 [TCP segment of a reassembled PDU]  tcp.stream == 9
100   8.246641 216.165.108.217 -> 125.39.127.25 TCP 66 51825 > http [ACK] Seq=293 Ack=1429 Win=17536 Len=0 TSval=42884760 TSecr=1241274213  tcp.stream == 9
101   8.246739 125.39.127.25 -> 216.165.108.217 TCP 1494 [TCP segment of a reassembled PDU]  tcp.stream == 9
102   8.246745 216.165.108.217 -> 125.39.127.25 TCP 66 51825 > http [ACK] Seq=293 Ack=2857 Win=20480 Len=0 TSval=42884760 TSecr=1241274213  tcp.stream == 9
107   8.261587 216.165.108.217 -> 125.39.200.22 TCP 74 53039 > http [SYN] Seq=0 Win=14600 Len=0 MSS=1460 SACK_PERM=1 TSval=42884764 TSecr=0 WS=128  tcp.stream == 11
110   8.265756 216.165.108.217 -> 125.39.127.42 TCP 74 34861 > http [SYN] Seq=0 Win=14600 Len=0 MSS=1460 SACK_PERM=1 TSval=42884765 TSecr=0 WS=128  tcp.stream == 12
117   8.512543 216.165.108.217 -> 60.28.14.148 TCP 74 55507 > http [SYN] Seq=0 Win=14600 Len=0 MSS=1460 SACK_PERM=1 TSval=42884826 TSecr=0 WS=128  tcp.stream == 13
120   8.516221 216.165.108.217 -> 125.39.200.22 TCP 74 53042 > http [SYN] Seq=0 Win=14600 Len=0 MSS=1460 SACK_PERM=1 TSval=42884827 TSecr=0 WS=128  tcp.stream == 14
121   8.542121 125.39.127.25 -> 216.165.108.217 TCP 1494 [TCP segment of a reassembled PDU]  tcp.stream == 9
122   8.542142 216.165.108.217 -> 125.39.127.25 TCP 66 51825 > http [ACK] Seq=293 Ack=4285 Win=23296 Len=0 TSval=42884834 TSecr=1241274287  tcp.stream == 9
123   8.543026 125.39.127.25 -> 216.165.108.217 TCP 1494 [TCP segment of a reassembled PDU]  tcp.stream == 9
124   8.543048 216.165.108.217 -> 125.39.127.25 TCP 66 51825 > http [ACK] Seq=293 Ack=5713 Win=26240 Len=0 TSval=42884834 TSecr=1241274287  tcp.stream == 9
125   8.543152 125.39.127.25 -> 216.165.108.217 TCP 1494 [TCP segment of a reassembled PDU]  tcp.stream == 9
126   8.543161 216.165.108.217 -> 125.39.127.25 TCP 66 51825 > http [ACK] Seq=293 Ack=7141 Win=29184 Len=0 TSval=42884834 TSecr=1241274287  tcp.stream == 9
127   8.543260 125.39.127.25 -> 216.165.108.217 TCP 1494 [TCP segment of a reassembled PDU]  tcp.stream == 9
128   8.543268 216.165.108.217 -> 125.39.127.25 TCP 66 51825 > http [ACK] Seq=293 Ack=8569 Win=32000 Len=0 TSval=42884834 TSecr=1241274287  tcp.stream == 9
129   8.544989 216.165.108.217 -> 125.39.127.22 HTTP 366 GET /iskin960/s01/s_1.6.0.css HTTP/1.1   tcp.stream == 10
130   8.553889 125.39.127.42 -> 216.165.108.217 TCP 74 http > 34861 [SYN, ACK] Seq=0 Ack=1 Win=5712 Len=0 MSS=1440 SACK_PERM=1 TSval=2021626767 TSecr=42884765 WS=32  tcp.stream == 12
131   8.553915 216.165.108.217 -> 125.39.127.42 TCP 66 34861 > http [ACK] Seq=1 Ack=1 Win=14720 Len=0 TSval=42884837 TSecr=2021626767  tcp.stream == 12
132   8.554031 216.165.108.217 -> 125.39.127.42 HTTP 353 GET /www/icon/favicon2.ico HTTP/1.1   tcp.stream == 12
133   8.568014 125.39.200.22 -> 216.165.108.217 TCP 74 http > 53039 [SYN, ACK] Seq=0 Ack=1 Win=5712 Len=0 MSS=1440 SACK_PERM=1 TSval=4006801567 TSecr=42884764 WS=32  tcp.stream == 11
134   8.568048 216.165.108.217 -> 125.39.200.22 TCP 66 53039 > http [ACK] Seq=1 Ack=1 Win=14720 Len=0 TSval=42884840 TSecr=4006801567  tcp.stream == 11
135   8.568168 216.165.108.217 -> 125.39.200.22 HTTP 348 GET /js/speed_v1.9-min.js HTTP/1.1   tcp.stream == 11
138   8.791285 60.28.14.148 -> 216.165.108.217 TCP 74 http > 55507 [SYN, ACK] Seq=0 Ack=1 Win=5712 Len=0 MSS=1440 SACK_PERM=1 TSval=2001996108 TSecr=42884826 WS=32  tcp.stream == 13
139   8.791311 216.165.108.217 -> 60.28.14.148 TCP 66 55507 > http [ACK] Seq=1 Ack=1 Win=14720 Len=0 TSval=42884896 TSecr=2001996108  tcp.stream == 13
140   8.815779 125.39.200.22 -> 216.165.108.217 TCP 74 http > 53042 [SYN, ACK] Seq=0 Ack=1 Win=5712 Len=0 MSS=1440 SACK_PERM=1 TSval=4026232022 TSecr=42884827 WS=32  tcp.stream == 14
141   8.815808 216.165.108.217 -> 125.39.200.22 TCP 66 53042 > http [ACK] Seq=1 Ack=1 Win=14720 Len=0 TSval=42884902 TSecr=4026232022  tcp.stream == 14
142   8.833348 125.39.127.22 -> 216.165.108.217 TCP 66 http > 35026 [ACK] Seq=1 Ack=301 Win=6784 Len=0 TSval=1233166880 TSecr=42884834  tcp.stream == 10
143   8.833603 125.39.127.22 -> 216.165.108.217 TCP 458 [TCP segment of a reassembled PDU]  tcp.stream == 10
144   8.833614 216.165.108.217 -> 125.39.127.22 TCP 66 35026 > http [ACK] Seq=301 Ack=393 Win=15744 Len=0 TSval=42884907 TSecr=1233166880  tcp.stream == 10
145   8.833763 125.39.127.22 -> 216.165.108.217 HTTP 1640 HTTP/1.1 200 OK  (text/css)  tcp.stream == 10
146   8.833772 216.165.108.217 -> 125.39.127.22 TCP 66 35026 > http [ACK] Seq=301 Ack=1967 Win=18688 Len=0 TSval=42884907 TSecr=1233166880  tcp.stream == 10
147   8.837472 125.39.127.25 -> 216.165.108.217 TCP 1494 [TCP segment of a reassembled PDU]  tcp.stream == 9
148   8.837493 216.165.108.217 -> 125.39.127.25 TCP 66 51825 > http [ACK] Seq=293 Ack=9997 Win=34944 Len=0 TSval=42884908 TSecr=1241274361  tcp.stream == 9
149   8.837992 125.39.127.25 -> 216.165.108.217 TCP 1494 [TCP segment of a reassembled PDU]  tcp.stream == 9
150   8.838010 216.165.108.217 -> 125.39.127.25 TCP 66 51825 > http [ACK] Seq=293 Ack=11425 Win=37888 Len=0 TSval=42884908 TSecr=1241274361  tcp.stream == 9
151   8.838111 125.39.127.25 -> 216.165.108.217 TCP 1494 [TCP segment of a reassembled PDU]  tcp.stream == 9
152   8.838119 216.165.108.217 -> 125.39.127.25 TCP 66 51825 > http [ACK] Seq=293 Ack=12853 Win=40704 Len=0 TSval=42884908 TSecr=1241274361  tcp.stream == 9
153   8.838229 125.39.127.25 -> 216.165.108.217 TCP 1494 [TCP segment of a reassembled PDU]  tcp.stream == 9
154   8.838238 216.165.108.217 -> 125.39.127.25 TCP 66 51825 > http [ACK] Seq=293 Ack=14281 Win=43648 Len=0 TSval=42884908 TSecr=1241274361  tcp.stream == 9
155   8.838350 125.39.127.25 -> 216.165.108.217 TCP 1494 [TCP segment of a reassembled PDU]  tcp.stream == 9
156   8.838359 216.165.108.217 -> 125.39.127.25 TCP 66 51825 > http [ACK] Seq=293 Ack=15709 Win=46464 Len=0 TSval=42884908 TSecr=1241274361  tcp.stream == 9
157   8.838473 125.39.127.25 -> 216.165.108.217 TCP 1494 [TCP segment of a reassembled PDU]  tcp.stream == 9
158   8.838481 216.165.108.217 -> 125.39.127.25 TCP 66 51825 > http [ACK] Seq=293 Ack=17137 Win=49408 Len=0 TSval=42884908 TSecr=1241274361  tcp.stream == 9
159   8.838593 125.39.127.25 -> 216.165.108.217 TCP 1494 [TCP segment of a reassembled PDU]  tcp.stream == 9
160   8.838601 216.165.108.217 -> 125.39.127.25 TCP 66 51825 > http [ACK] Seq=293 Ack=18565 Win=52352 Len=0 TSval=42884908 TSecr=1241274361  tcp.stream == 9
161   8.838715 125.39.127.25 -> 216.165.108.217 TCP 1494 [TCP segment of a reassembled PDU]  tcp.stream == 9
162   8.838724 216.165.108.217 -> 125.39.127.25 TCP 66 51825 > http [ACK] Seq=293 Ack=19993 Win=55168 Len=0 TSval=42884908 TSecr=1241274361  tcp.stream == 9
165   8.842402 125.39.127.42 -> 216.165.108.217 TCP 66 http > 34861 [ACK] Seq=1 Ack=288 Win=6784 Len=0 TSval=2021626839 TSecr=42884837  tcp.stream == 12
166   8.842421 216.165.108.217 -> 125.39.200.22 HTTP 387 GET /www/iskin960/qqcomlogo.png HTTP/1.1   tcp.stream == 14
167   8.842421 125.39.127.42 -> 216.165.108.217 TCP 389 [TCP segment of a reassembled PDU]  tcp.stream == 12
168   8.842428 216.165.108.217 -> 125.39.127.42 TCP 66 34861 > http [ACK] Seq=288 Ack=324 Win=15744 Len=0 TSval=42884909 TSecr=2021626839  tcp.stream == 12
169   8.842562 216.165.108.217 -> 125.39.200.24 TCP 74 54268 > http [SYN] Seq=0 Win=14600 Len=0 MSS=1460 SACK_PERM=1 TSval=42884909 TSecr=0 WS=128  tcp.stream == 15
170   8.842601 216.165.108.217 -> 125.39.127.42 TCP 74 34865 > http [SYN] Seq=0 Win=14600 Len=0 MSS=1460 SACK_PERM=1 TSval=42884909 TSecr=0 WS=128  tcp.stream == 16
171   8.842724 125.39.127.42 -> 216.165.108.217 TCP 1494 [TCP segment of a reassembled PDU]  tcp.stream == 12
172   8.842736 216.165.108.217 -> 125.39.127.42 TCP 66 34861 > http [ACK] Seq=288 Ack=1752 Win=18688 Len=0 TSval=42884909 TSecr=2021626839  tcp.stream == 12
173   8.870990 125.39.200.22 -> 216.165.108.217 TCP 66 http > 53039 [ACK] Seq=1 Ack=283 Win=6784 Len=0 TSval=4006801642 TSecr=42884840  tcp.stream == 11
174   8.871562 125.39.200.22 -> 216.165.108.217 HTTP 1471 HTTP/1.1 200 OK  (application/x-javascript)  tcp.stream == 11
175   8.871585 216.165.108.217 -> 125.39.200.22 TCP 66 53039 > http [ACK] Seq=283 Ack=1406 Win=17536 Len=0 TSval=42884916 TSecr=4006801642  tcp.stream == 11
181   8.933545 216.165.108.217 -> 125.39.127.42 TCP 74 34866 > http [SYN] Seq=0 Win=14600 Len=0 MSS=1460 SACK_PERM=1 TSval=42884932 TSecr=0 WS=128  tcp.stream == 17
182   8.933581 216.165.108.217 -> 112.90.139.165 TCP 74 60761 > http [SYN] Seq=0 Win=14600 Len=0 MSS=1460 SACK_PERM=1 TSval=42884932 TSecr=0 WS=128  tcp.stream == 18
183   8.964574 216.165.108.217 -> 125.39.127.42 TCP 74 34868 > http [SYN] Seq=0 Win=14600 Len=0 MSS=1460 SACK_PERM=1 TSval=42884939 TSecr=0 WS=128  tcp.stream == 19
184   8.964611 216.165.108.217 -> 125.39.127.42 TCP 74 34869 > http [SYN] Seq=0 Win=14600 Len=0 MSS=1460 SACK_PERM=1 TSval=42884939 TSecr=0 WS=128  tcp.stream == 20
185   8.964889 216.165.108.217 -> 125.39.200.22 HTTP 387 GET /www/iskin/skin4/expo_line.gif HTTP/1.1   tcp.stream == 11
188   9.089475 216.165.108.217 -> 125.39.200.23 TCP 74 34396 > http [SYN] Seq=0 Win=14600 Len=0 MSS=1460 SACK_PERM=1 TSval=42884971 TSecr=0 WS=128  tcp.stream == 21
189   9.120492 125.39.200.24 -> 216.165.108.217 TCP 74 http > 54268 [SYN, ACK] Seq=0 Ack=1 Win=5712 Len=0 MSS=1440 SACK_PERM=1 TSval=4006851110 TSecr=42884909 WS=32  tcp.stream == 15
190   9.120523 216.165.108.217 -> 125.39.200.24 TCP 66 54268 > http [ACK] Seq=1 Ack=1 Win=14720 Len=0 TSval=42884978 TSecr=4006851110  tcp.stream == 15
191   9.120669 216.165.108.217 -> 125.39.200.24 HTTP 396 GET /www/pics/hv1/22/42/659/42862207.gif HTTP/1.1   tcp.stream == 15
192   9.131140 125.39.127.42 -> 216.165.108.217 TCP 1494 [TCP segment of a reassembled PDU]  tcp.stream == 12
193   9.131164 216.165.108.217 -> 125.39.127.42 TCP 66 34861 > http [ACK] Seq=288 Ack=3180 Win=21504 Len=0 TSval=42884981 TSecr=2021626911  tcp.stream == 12
194   9.131363 125.39.127.42 -> 216.165.108.217 TCP 1494 [TCP segment of a reassembled PDU]  tcp.stream == 12
195   9.131374 216.165.108.217 -> 125.39.127.42 TCP 66 34861 > http [ACK] Seq=288 Ack=4608 Win=24448 Len=0 TSval=42884981 TSecr=2021626911  tcp.stream == 12
196   9.131427 125.39.127.42 -> 216.165.108.217 HTTP 1212 HTTP/1.1 200 OK  (image/x-icon)  tcp.stream == 12
197   9.131434 216.165.108.217 -> 125.39.127.42 TCP 66 34861 > http [ACK] Seq=288 Ack=5754 Win=27264 Len=0 TSval=42884981 TSecr=2021626911  tcp.stream == 12
198   9.131438 125.39.127.42 -> 216.165.108.217 TCP 74 http > 34865 [SYN, ACK] Seq=0 Ack=1 Win=5712 Len=0 MSS=1440 SACK_PERM=1 TSval=2214778230 TSecr=42884909 WS=32  tcp.stream == 16
199   9.131448 216.165.108.217 -> 125.39.127.42 TCP 66 34865 > http [ACK] Seq=1 Ack=1 Win=14720 Len=0 TSval=42884981 TSecr=2214778230  tcp.stream == 16
200   9.131560 216.165.108.217 -> 125.39.127.42 HTTP 370 GET /www/mb/js/portal/mi.MiniNav_110901V1.js HTTP/1.1   tcp.stream == 12
201   9.131587 216.165.108.217 -> 125.39.127.42 HTTP 387 GET /www/iskin960/logo_soso.png HTTP/1.1   tcp.stream == 16
202   9.132301 125.39.127.25 -> 216.165.108.217 TCP 1494 [TCP segment of a reassembled PDU]  tcp.stream == 9
203   9.132329 216.165.108.217 -> 125.39.127.25 TCP 66 51825 > http [ACK] Seq=293 Ack=21421 Win=58112 Len=0 TSval=42884981 TSecr=1241274435  tcp.stream == 9
204   9.132432 125.39.127.25 -> 216.165.108.217 TCP 1494 [TCP segment of a reassembled PDU]  tcp.stream == 9
205   9.132441 216.165.108.217 -> 125.39.127.25 TCP 66 51825 > http [ACK] Seq=293 Ack=22849 Win=61056 Len=0 TSval=42884981 TSecr=1241274435  tcp.stream == 9
206   9.133237 125.39.127.25 -> 216.165.108.217 TCP 1494 [TCP segment of a reassembled PDU]  tcp.stream == 9
207   9.133258 216.165.108.217 -> 125.39.127.25 TCP 66 51825 > http [ACK] Seq=293 Ack=24277 Win=63872 Len=0 TSval=42884981 TSecr=1241274435  tcp.stream == 9
208   9.133359 125.39.127.25 -> 216.165.108.217 TCP 1494 [TCP segment of a reassembled PDU]  tcp.stream == 9
209   9.133367 216.165.108.217 -> 125.39.127.25 TCP 66 51825 > http [ACK] Seq=293 Ack=25705 Win=62848 Len=0 TSval=42884982 TSecr=1241274435  tcp.stream == 9
210   9.133477 125.39.127.25 -> 216.165.108.217 TCP 1494 [TCP segment of a reassembled PDU]  tcp.stream == 9
211   9.133489 216.165.108.217 -> 125.39.127.25 TCP 66 51825 > http [ACK] Seq=293 Ack=27133 Win=61440 Len=0 TSval=42884982 TSecr=1241274435  tcp.stream == 9
212   9.133596 125.39.127.25 -> 216.165.108.217 TCP 1494 [TCP segment of a reassembled PDU]  tcp.stream == 9
213   9.133604 216.165.108.217 -> 125.39.127.25 TCP 66 51825 > http [ACK] Seq=293 Ack=28561 Win=64128 Len=0 TSval=42884982 TSecr=1241274435  tcp.stream == 9
214   9.133718 125.39.127.25 -> 216.165.108.217 TCP 1494 [TCP segment of a reassembled PDU]  tcp.stream == 9
215   9.133727 216.165.108.217 -> 125.39.127.25 TCP 66 51825 > http [ACK] Seq=293 Ack=29989 Win=64128 Len=0 TSval=42884982 TSecr=1241274435  tcp.stream == 9
216   9.133840 125.39.127.25 -> 216.165.108.217 TCP 1494 [TCP segment of a reassembled PDU]  tcp.stream == 9
217   9.133849 216.165.108.217 -> 125.39.127.25 TCP 66 51825 > http [ACK] Seq=293 Ack=31417 Win=64128 Len=0 TSval=42884982 TSecr=1241274435  tcp.stream == 9
218   9.133959 125.39.127.25 -> 216.165.108.217 TCP 1494 [TCP segment of a reassembled PDU]  tcp.stream == 9
219   9.134080 125.39.127.25 -> 216.165.108.217 TCP 1494 [TCP segment of a reassembled PDU]  tcp.stream == 9
220   9.134090 216.165.108.217 -> 125.39.127.25 TCP 66 51825 > http [ACK] Seq=293 Ack=34273 Win=64128 Len=0 TSval=42884982 TSecr=1241274435  tcp.stream == 9
221   9.134204 125.39.127.25 -> 216.165.108.217 TCP 1494 [TCP segment of a reassembled PDU]  tcp.stream == 9
222   9.134323 125.39.127.25 -> 216.165.108.217 TCP 1494 [TCP segment of a reassembled PDU]  tcp.stream == 9
223   9.134332 216.165.108.217 -> 125.39.127.25 TCP 66 51825 > http [ACK] Seq=293 Ack=37129 Win=64128 Len=0 TSval=42884982 TSecr=1241274435  tcp.stream == 9
225   9.145724 125.39.200.22 -> 216.165.108.217 TCP 66 http > 53042 [ACK] Seq=1 Ack=322 Win=6784 Len=0 TSval=4026232105 TSecr=42884909  tcp.stream == 14
226   9.145745 125.39.200.22 -> 216.165.108.217 TCP 386 [TCP segment of a reassembled PDU]  tcp.stream == 14
227   9.145754 216.165.108.217 -> 125.39.200.22 TCP 66 53042 > http [ACK] Seq=322 Ack=321 Win=15744 Len=0 TSval=42884985 TSecr=4026232105  tcp.stream == 14
228   9.145928 125.39.200.22 -> 216.165.108.217 TCP 1494 [TCP segment of a reassembled PDU]  tcp.stream == 14
229   9.145938 216.165.108.217 -> 125.39.200.22 TCP 66 53042 > http [ACK] Seq=322 Ack=1749 Win=18688 Len=0 TSval=42884985 TSecr=4026232105  tcp.stream == 14
234   9.157407 216.165.108.217 -> 125.39.200.24 TCP 74 54275 > http [SYN] Seq=0 Win=14600 Len=0 MSS=1460 SACK_PERM=1 TSval=42884988 TSecr=0 WS=128  tcp.stream == 22
235   9.157675 216.165.108.217 -> 125.39.200.24 TCP 74 54276 > http [SYN] Seq=0 Win=14600 Len=0 MSS=1460 SACK_PERM=1 TSval=42884988 TSecr=0 WS=128  tcp.stream == 23
236   9.157858 216.165.108.217 -> 125.39.127.22 HTTP 387 GET /js/ping_qqcom_v2.1.9.js HTTP/1.1   tcp.stream == 10
237   9.158038 216.165.108.217 -> 125.39.200.24 TCP 74 54277 > http [SYN] Seq=0 Win=14600 Len=0 MSS=1460 SACK_PERM=1 TSval=42884988 TSecr=0 WS=128  tcp.stream == 24
238   9.158133 216.165.108.217 -> 125.39.200.24 TCP 74 54278 > http [SYN] Seq=0 Win=14600 Len=0 MSS=1460 SACK_PERM=1 TSval=42884988 TSecr=0 WS=128  tcp.stream == 25
239   9.158209 216.165.108.217 -> 125.39.127.25 TCP 74 51842 > http [SYN] Seq=0 Win=14600 Len=0 MSS=1460 SACK_PERM=1 TSval=42884988 TSecr=0 WS=128  tcp.stream == 26
240   9.158264 216.165.108.217 -> 184.105.67.92 TCP 74 54846 > http [SYN] Seq=0 Win=14600 Len=0 MSS=1460 SACK_PERM=1 TSval=42884988 TSecr=0 WS=128  tcp.stream == 27
245   9.180914 216.165.108.217 -> 60.28.188.154 TCP 74 35602 > http [SYN] Seq=0 Win=14600 Len=0 MSS=1460 SACK_PERM=1 TSval=42884993 TSecr=0 WS=128  tcp.stream == 28
246   9.214188 125.39.127.42 -> 216.165.108.217 TCP 74 http > 34866 [SYN, ACK] Seq=0 Ack=1 Win=5712 Len=0 MSS=1440 SACK_PERM=1 TSval=2214328322 TSecr=42884932 WS=32  tcp.stream == 17
247   9.214218 216.165.108.217 -> 125.39.127.42 TCP 66 34866 > http [ACK] Seq=1 Ack=1 Win=14720 Len=0 TSval=42885002 TSecr=2214328322  tcp.stream == 17
248   9.214329 216.165.108.217 -> 125.39.127.42 HTTP 357 GET /tech/js/ipad/iscroll_v2.js HTTP/1.1   tcp.stream == 17
249   9.239292 125.39.127.42 -> 216.165.108.217 TCP 74 http > 34868 [SYN, ACK] Seq=0 Ack=1 Win=5712 Len=0 MSS=1440 SACK_PERM=1 TSval=2214328328 TSecr=42884939 WS=32  tcp.stream == 19
250   9.239323 216.165.108.217 -> 125.39.127.42 TCP 66 34868 > http [ACK] Seq=1 Ack=1 Win=14720 Len=0 TSval=42885008 TSecr=2214328328  tcp.stream == 19
251   9.239423 216.165.108.217 -> 125.39.127.42 HTTP 395 GET /www/images/nav/mini_bg20101228.png HTTP/1.1   tcp.stream == 19
252   9.248482 184.105.67.92 -> 216.165.108.217 TCP 74 http > 54846 [SYN, ACK] Seq=0 Ack=1 Win=5792 Len=0 MSS=1460 SACK_PERM=1 TSval=2127453875 TSecr=42884988 WS=4  tcp.stream == 27
253   9.248517 216.165.108.217 -> 184.105.67.92 TCP 66 54846 > http [ACK] Seq=1 Ack=1 Win=14720 Len=0 TSval=42885010 TSecr=2127453875  tcp.stream == 27
254   9.248621 216.165.108.217 -> 184.105.67.92 HTTP 376 GET /web/crystal/v1.5Beta03Build035/crystal-min.js HTTP/1.1   tcp.stream == 27
255   9.250338 112.90.139.165 -> 216.165.108.217 TCP 74 http > 60761 [SYN, ACK] Seq=0 Ack=1 Win=5792 Len=0 MSS=1460 SACK_PERM=1 TSval=716634812 TSecr=42884932 WS=1024  tcp.stream == 18
256   9.250373 216.165.108.217 -> 112.90.139.165 TCP 66 60761 > http [ACK] Seq=1 Ack=1 Win=14720 Len=0 TSval=42885011 TSecr=716634812  tcp.stream == 18
257   9.250479 216.165.108.217 -> 112.90.139.165 HTTP 496 GET /collect?sIp=&iQQ=&sBiz=qq.com&sOp=&iSta=&iTy=105&iFlow=&sItem=skin&iPage=0&sUrl=&sLocalUrl=http%3A//www.qq.com/&iRnd=0.38022346905058113 HTTP/1.1   tcp.stream == 18
258   9.259042 125.39.127.42 -> 216.165.108.217 TCP 74 http > 34869 [SYN, ACK] Seq=0 Ack=1 Win=5712 Len=0 MSS=1440 SACK_PERM=1 TSval=2214768238 TSecr=42884939 WS=32  tcp.stream == 20
259   9.259071 216.165.108.217 -> 125.39.127.42 TCP 66 34869 > http [ACK] Seq=1 Ack=1 Win=14720 Len=0 TSval=42885013 TSecr=2214768238  tcp.stream == 20
260   9.259178 216.165.108.217 -> 125.39.127.42 HTTP 392 GET /www/images/nav/mini_icon1.2.png HTTP/1.1   tcp.stream == 20
261   9.267780 125.39.200.22 -> 216.165.108.217 TCP 385 [TCP segment of a reassembled PDU]  tcp.stream == 11
262   9.267808 216.165.108.217 -> 125.39.200.22 TCP 66 53039 > http [ACK] Seq=604 Ack=1725 Win=20352 Len=0 TSval=42885015 TSecr=4006801742  tcp.stream == 11
263   9.267815 125.39.200.22 -> 216.165.108.217 HTTP 188 HTTP/1.1 200 OK  (GIF89a)  tcp.stream == 11
264   9.267819 216.165.108.217 -> 125.39.200.22 TCP 66 53039 > http [ACK] Seq=604 Ack=1847 Win=20352 Len=0 TSval=42885015 TSecr=4006801742  tcp.stream == 11
266   9.341850 184.105.67.92 -> 216.165.108.217 TCP 66 http > 54846 [ACK] Seq=1 Ack=311 Win=6864 Len=0 TSval=2127453898 TSecr=42885010  tcp.stream == 27
267   9.342181 184.105.67.92 -> 216.165.108.217 TCP 1514 [TCP segment of a reassembled PDU]  tcp.stream == 27
268   9.342193 216.165.108.217 -> 184.105.67.92 TCP 66 54846 > http [ACK] Seq=311 Ack=1449 Win=17536 Len=0 TSval=42885034 TSecr=2127453898  tcp.stream == 27
269   9.342319 184.105.67.92 -> 216.165.108.217 TCP 1514 [TCP segment of a reassembled PDU]  tcp.stream == 27
270   9.342327 216.165.108.217 -> 184.105.67.92 TCP 66 54846 > http [ACK] Seq=311 Ack=2897 Win=20480 Len=0 TSval=42885034 TSecr=2127453898  tcp.stream == 27
271   9.375943 125.39.200.23 -> 216.165.108.217 TCP 74 http > 34396 [SYN, ACK] Seq=0 Ack=1 Win=5712 Len=0 MSS=1440 SACK_PERM=1 TSval=4006822421 TSecr=42884971 WS=32  tcp.stream == 21
272   9.375971 216.165.108.217 -> 125.39.200.23 TCP 66 34396 > http [ACK] Seq=1 Ack=1 Win=14720 Len=0 TSval=42885042 TSecr=4006822421  tcp.stream == 21
273   9.376154 216.165.108.217 -> 125.39.200.23 HTTP 396 GET /v/pics/hv1/140/205/975/63451790.jpg HTTP/1.1   tcp.stream == 21
274   9.401482 125.39.200.24 -> 216.165.108.217 TCP 66 http > 54268 [ACK] Seq=1 Ack=331 Win=6784 Len=0 TSval=4006851180 TSecr=42884978  tcp.stream == 15
275   9.401513 125.39.200.24 -> 216.165.108.217 TCP 384 [TCP segment of a reassembled PDU]  tcp.stream == 15
276   9.401523 216.165.108.217 -> 125.39.200.24 TCP 66 54268 > http [ACK] Seq=331 Ack=319 Win=15744 Len=0 TSval=42885049 TSecr=4006851180  tcp.stream == 15
277   9.401530 125.39.200.24 -> 216.165.108.217 HTTP 161 HTTP/1.1 200 OK  (GIF89a)  tcp.stream == 15
278   9.401534 216.165.108.217 -> 125.39.200.24 TCP 66 54268 > http [ACK] Seq=331 Ack=414 Win=15744 Len=0 TSval=42885049 TSecr=4006851180  tcp.stream == 15
279   9.401700 216.165.108.217 -> 125.39.200.24 HTTP 398 GET /news/pics/hv1/17/148/975/63437132.jpg HTTP/1.1   tcp.stream == 15
280   9.410745 216.165.108.217 -> 125.39.127.22 TCP 74 35045 > http [SYN] Seq=0 Win=14600 Len=0 MSS=1460 SACK_PERM=1 TSval=42885051 TSecr=0 WS=128  tcp.stream == 29
281   9.419957 125.39.127.42 -> 216.165.108.217 TCP 66 http > 34865 [ACK] Seq=1 Ack=322 Win=6784 Len=0 TSval=2214778303 TSecr=42884981  tcp.stream == 16
282   9.419980 125.39.127.42 -> 216.165.108.217 TCP 386 [TCP segment of a reassembled PDU]  tcp.stream == 16
283   9.419988 216.165.108.217 -> 125.39.127.42 TCP 66 34865 > http [ACK] Seq=322 Ack=321 Win=15744 Len=0 TSval=42885053 TSecr=2214778303  tcp.stream == 16
284   9.420178 125.39.127.42 -> 216.165.108.217 TCP 1494 [TCP segment of a reassembled PDU]  tcp.stream == 16
285   9.420186 216.165.108.217 -> 125.39.127.42 TCP 66 34865 > http [ACK] Seq=322 Ack=1749 Win=18688 Len=0 TSval=42885053 TSecr=2214778303  tcp.stream == 16
286   9.420624 125.39.127.42 -> 216.165.108.217 TCP 1494 [TCP segment of a reassembled PDU]  tcp.stream == 12
287   9.420766 125.39.127.42 -> 216.165.108.217 TCP 1494 [TCP segment of a reassembled PDU]  tcp.stream == 12
288   9.420779 216.165.108.217 -> 125.39.127.42 TCP 66 34861 > http [ACK] Seq=592 Ack=8610 Win=33024 Len=0 TSval=42885053 TSecr=2021626983  tcp.stream == 12
289   9.420893 125.39.127.42 -> 216.165.108.217 TCP 1494 [TCP segment of a reassembled PDU]  tcp.stream == 12
290   9.421023 125.39.127.42 -> 216.165.108.217 TCP 1494 [TCP segment of a reassembled PDU]  tcp.stream == 12
291   9.421032 216.165.108.217 -> 125.39.127.42 TCP 66 34861 > http [ACK] Seq=592 Ack=11466 Win=38912 Len=0 TSval=42885053 TSecr=2021626983  tcp.stream == 12
292   9.425668 125.39.200.24 -> 216.165.108.217 TCP 74 http > 54277 [SYN, ACK] Seq=0 Ack=1 Win=5712 Len=0 MSS=1440 SACK_PERM=1 TSval=4026235746 TSecr=42884988 WS=32  tcp.stream == 24
293   9.425695 216.165.108.217 -> 125.39.200.24 TCP 66 54277 > http [ACK] Seq=1 Ack=1 Win=14720 Len=0 TSval=42885055 TSecr=4026235746  tcp.stream == 24
294   9.425821 216.165.108.217 -> 125.39.200.24 HTTP 397 GET /news/pics/hv1/97/18/975/63404062.jpg HTTP/1.1   tcp.stream == 24
295   9.427357 125.39.127.25 -> 216.165.108.217 TCP 1494 [TCP segment of a reassembled PDU]  tcp.stream == 9
296   9.427461 125.39.127.25 -> 216.165.108.217 TCP 1494 [TCP segment of a reassembled PDU]  tcp.stream == 9
297   9.427529 216.165.108.217 -> 125.39.127.25 TCP 66 51825 > http [ACK] Seq=293 Ack=39985 Win=64128 Len=0 TSval=42885055 TSecr=1241274508  tcp.stream == 9
298   9.427592 125.39.127.25 -> 216.165.108.217 TCP 1494 [TCP segment of a reassembled PDU]  tcp.stream == 9
299   9.427714 125.39.127.25 -> 216.165.108.217 TCP 1494 [TCP segment of a reassembled PDU]  tcp.stream == 9
300   9.427723 216.165.108.217 -> 125.39.127.25 TCP 66 51825 > http [ACK] Seq=293 Ack=42841 Win=64128 Len=0 TSval=42885055 TSecr=1241274509  tcp.stream == 9
301   9.427837 125.39.127.25 -> 216.165.108.217 TCP 1494 [TCP segment of a reassembled PDU]  tcp.stream == 9
302   9.427957 125.39.127.25 -> 216.165.108.217 TCP 1494 [TCP segment of a reassembled PDU]  tcp.stream == 9
303   9.427966 216.165.108.217 -> 125.39.127.25 TCP 66 51825 > http [ACK] Seq=293 Ack=45697 Win=64128 Len=0 TSval=42885055 TSecr=1241274509  tcp.stream == 9
304   9.428079 125.39.127.25 -> 216.165.108.217 TCP 1494 [TCP segment of a reassembled PDU]  tcp.stream == 9
305   9.428198 125.39.127.25 -> 216.165.108.217 TCP 1494 [TCP segment of a reassembled PDU]  tcp.stream == 9
306   9.428207 216.165.108.217 -> 125.39.127.25 TCP 66 51825 > http [ACK] Seq=293 Ack=48553 Win=64128 Len=0 TSval=42885055 TSecr=1241274509  tcp.stream == 9
307   9.428584 125.39.127.25 -> 216.165.108.217 TCP 1494 [TCP segment of a reassembled PDU]  tcp.stream == 9
308   9.428703 125.39.127.25 -> 216.165.108.217 TCP 1494 [TCP segment of a reassembled PDU]  tcp.stream == 9
309   9.428715 216.165.108.217 -> 125.39.127.25 TCP 66 51825 > http [ACK] Seq=293 Ack=51409 Win=64128 Len=0 TSval=42885055 TSecr=1241274509  tcp.stream == 9
310   9.428818 125.39.127.25 -> 216.165.108.217 TCP 1494 [TCP segment of a reassembled PDU]  tcp.stream == 9
311   9.428948 125.39.127.25 -> 216.165.108.217 TCP 1494 [TCP segment of a reassembled PDU]  tcp.stream == 9
312   9.428957 216.165.108.217 -> 125.39.127.25 TCP 66 51825 > http [ACK] Seq=293 Ack=54265 Win=64128 Len=0 TSval=42885055 TSecr=1241274509  tcp.stream == 9
313   9.429078 125.39.127.25 -> 216.165.108.217 TCP 1494 [TCP segment of a reassembled PDU]  tcp.stream == 9
314   9.429196 125.39.127.25 -> 216.165.108.217 TCP 1494 [TCP segment of a reassembled PDU]  tcp.stream == 9
315   9.429205 216.165.108.217 -> 125.39.127.25 TCP 66 51825 > http [ACK] Seq=293 Ack=57121 Win=64128 Len=0 TSval=42885055 TSecr=1241274509  tcp.stream == 9
316   9.429321 125.39.127.25 -> 216.165.108.217 TCP 1494 [TCP segment of a reassembled PDU]  tcp.stream == 9
317   9.429441 125.39.127.25 -> 216.165.108.217 TCP 1494 [TCP segment of a reassembled PDU]  tcp.stream == 9
318   9.429451 216.165.108.217 -> 125.39.127.25 TCP 66 51825 > http [ACK] Seq=293 Ack=59977 Win=64128 Len=0 TSval=42885056 TSecr=1241274509  tcp.stream == 9
319   9.429572 125.39.127.25 -> 216.165.108.217 TCP 1494 [TCP segment of a reassembled PDU]  tcp.stream == 9
320   9.429701 125.39.127.25 -> 216.165.108.217 TCP 1494 [TCP segment of a reassembled PDU]  tcp.stream == 9
321   9.429711 216.165.108.217 -> 125.39.127.25 TCP 66 51825 > http [ACK] Seq=293 Ack=62833 Win=64128 Len=0 TSval=42885056 TSecr=1241274509  tcp.stream == 9
322   9.429827 125.39.127.25 -> 216.165.108.217 TCP 1494 [TCP segment of a reassembled PDU]  tcp.stream == 9
323   9.429947 125.39.127.25 -> 216.165.108.217 TCP 1494 [TCP segment of a reassembled PDU]  tcp.stream == 9
324   9.429958 216.165.108.217 -> 125.39.127.25 TCP 66 51825 > http [ACK] Seq=293 Ack=65689 Win=64128 Len=0 TSval=42885056 TSecr=1241274509  tcp.stream == 9
325   9.430071 125.39.200.24 -> 216.165.108.217 TCP 74 http > 54275 [SYN, ACK] Seq=0 Ack=1 Win=5712 Len=0 MSS=1440 SACK_PERM=1 TSval=3939425392 TSecr=42884988 WS=32  tcp.stream == 22
326   9.430085 216.165.108.217 -> 125.39.200.24 TCP 66 54275 > http [ACK] Seq=1 Ack=1 Win=14720 Len=0 TSval=42885056 TSecr=3939425392  tcp.stream == 22
327   9.430089 125.39.200.24 -> 216.165.108.217 TCP 74 http > 54276 [SYN, ACK] Seq=0 Ack=1 Win=5712 Len=0 MSS=1440 SACK_PERM=1 TSval=4006802947 TSecr=42884988 WS=32  tcp.stream == 23
328   9.430095 216.165.108.217 -> 125.39.200.24 TCP 66 54276 > http [ACK] Seq=1 Ack=1 Win=14720 Len=0 TSval=42885056 TSecr=4006802947  tcp.stream == 23
329   9.430099 125.39.127.25 -> 216.165.108.217 TCP 1494 [TCP segment of a reassembled PDU]  tcp.stream == 9
330   9.430188 216.165.108.217 -> 125.39.200.24 HTTP 397 GET /news/pics/hv1/98/18/975/63404063.jpg HTTP/1.1   tcp.stream == 22
331   9.430429 125.39.200.24 -> 216.165.108.217 TCP 74 http > 54278 [SYN, ACK] Seq=0 Ack=1 Win=5712 Len=0 MSS=1440 SACK_PERM=1 TSval=3987140459 TSecr=42884988 WS=32  tcp.stream == 25
332   9.430443 216.165.108.217 -> 125.39.200.24 TCP 66 54278 > http [ACK] Seq=1 Ack=1 Win=14720 Len=0 TSval=42885056 TSecr=3987140459  tcp.stream == 25
338   9.437668 184.105.67.92 -> 216.165.108.217 TCP 1514 [TCP segment of a reassembled PDU]  tcp.stream == 27
339   9.437685 216.165.108.217 -> 184.105.67.92 TCP 66 54846 > http [ACK] Seq=311 Ack=4345 Win=23296 Len=0 TSval=42885058 TSecr=2127453921  tcp.stream == 27
340   9.437789 184.105.67.92 -> 216.165.108.217 TCP 1514 [TCP segment of a reassembled PDU]  tcp.stream == 27
341   9.437795 216.165.108.217 -> 184.105.67.92 TCP 66 54846 > http [ACK] Seq=311 Ack=5793 Win=26240 Len=0 TSval=42885058 TSecr=2127453921  tcp.stream == 27
342   9.437912 184.105.67.92 -> 216.165.108.217 TCP 1514 [TCP segment of a reassembled PDU]  tcp.stream == 27
343   9.437958 216.165.108.217 -> 184.105.67.92 TCP 66 54846 > http [ACK] Seq=311 Ack=7241 Win=29184 Len=0 TSval=42885058 TSecr=2127453921  tcp.stream == 27
344   9.438058 184.105.67.92 -> 216.165.108.217 TCP 1514 [TCP segment of a reassembled PDU]  tcp.stream == 27
345   9.438068 216.165.108.217 -> 184.105.67.92 TCP 66 54846 > http [ACK] Seq=311 Ack=8689 Win=32000 Len=0 TSval=42885058 TSecr=2127453921  tcp.stream == 27
349   9.439758 216.165.108.217 -> 125.39.200.24 HTTP 401 GET /sports/pics/hv1/185/204/975/63451580.jpg HTTP/1.1   tcp.stream == 23
350   9.439850 216.165.108.217 -> 125.39.200.24 HTTP 398 GET /ent/pics/hv1/195/250/974/63398295.jpg HTTP/1.1   tcp.stream == 25
351   9.439988 216.165.108.217 -> 60.28.14.152 TCP 74 60692 > http [SYN] Seq=0 Win=14600 Len=0 MSS=1460 SACK_PERM=1 TSval=42885058 TSecr=0 WS=128  tcp.stream == 30
352   9.440081 216.165.108.217 -> 24.143.200.35 TCP 74 55525 > http [SYN] Seq=0 Win=14600 Len=0 MSS=1460 SACK_PERM=1 TSval=42885058 TSecr=0 WS=128  tcp.stream == 31
353   9.441574 24.143.200.35 -> 216.165.108.217 TCP 74 http > 55525 [SYN, ACK] Seq=0 Ack=1 Win=14480 Len=0 MSS=1460 SACK_PERM=1 TSval=2012020574 TSecr=42885058 WS=4  tcp.stream == 31
354   9.441599 216.165.108.217 -> 24.143.200.35 TCP 66 55525 > http [ACK] Seq=1 Ack=1 Win=14720 Len=0 TSval=42885059 TSecr=2012020574  tcp.stream == 31
355   9.441719 216.165.108.217 -> 24.143.200.35 HTTP 397 GET /qqlive/images/20120216/i1329354661_1.jpg HTTP/1.1   tcp.stream == 31
356   9.443251 24.143.200.35 -> 216.165.108.217 TCP 66 http > 55525 [ACK] Seq=1 Ack=332 Win=15552 Len=0 TSval=2012020576 TSecr=42885059  tcp.stream == 31
357   9.443869 125.39.200.22 -> 216.165.108.217 TCP 1494 [TCP segment of a reassembled PDU]  tcp.stream == 14
358   9.443889 216.165.108.217 -> 125.39.200.22 TCP 66 53042 > http [ACK] Seq=322 Ack=3177 Win=21504 Len=0 TSval=42885059 TSecr=4026232179  tcp.stream == 14
359   9.443939 125.39.200.22 -> 216.165.108.217 HTTP 1142 HTTP/1.1 200 OK  (PNG)[Malformed Packet]  tcp.stream == 14
360   9.443946 216.165.108.217 -> 125.39.200.22 TCP 66 53042 > http [ACK] Seq=322 Ack=4253 Win=24320 Len=0 TSval=42885059 TSecr=4026232179  tcp.stream == 14
361   9.444075 216.165.108.217 -> 125.39.200.22 HTTP 393 GET /www/images/nav/wblogin_bt_v3.png HTTP/1.1   tcp.stream == 14
362   9.444086 24.143.200.35 -> 216.165.108.217 TCP 1514 [TCP segment of a reassembled PDU]  tcp.stream == 31
363   9.444092 216.165.108.217 -> 24.143.200.35 TCP 66 55525 > http [ACK] Seq=332 Ack=1449 Win=17536 Len=0 TSval=42885059 TSecr=2012020576  tcp.stream == 31
364   9.444208 24.143.200.35 -> 216.165.108.217 TCP 1514 [TCP segment of a reassembled PDU]  tcp.stream == 31
365   9.444217 216.165.108.217 -> 24.143.200.35 TCP 66 55525 > http [ACK] Seq=332 Ack=2897 Win=20480 Len=0 TSval=42885059 TSecr=2012020576  tcp.stream == 31
366   9.444331 24.143.200.35 -> 216.165.108.217 TCP 1514 [TCP segment of a reassembled PDU]  tcp.stream == 31
367   9.444338 216.165.108.217 -> 24.143.200.35 TCP 66 55525 > http [ACK] Seq=332 Ack=4345 Win=23296 Len=0 TSval=42885059 TSecr=2012020576  tcp.stream == 31
368   9.444382 24.143.200.35 -> 216.165.108.217 HTTP 848 HTTP/1.1 200 OK  (JPEG JFIF image)  tcp.stream == 31
369   9.444389 216.165.108.217 -> 24.143.200.35 TCP 66 55525 > http [ACK] Seq=332 Ack=5127 Win=26240 Len=0 TSval=42885059 TSecr=2012020576  tcp.stream == 31
370   9.446125 125.39.127.22 -> 216.165.108.217 TCP 474 [TCP segment of a reassembled PDU]  tcp.stream == 10
371   9.446152 216.165.108.217 -> 125.39.127.22 TCP 66 35026 > http [ACK] Seq=622 Ack=2375 Win=21504 Len=0 TSval=42885060 TSecr=1233167033  tcp.stream == 10
372   9.446382 125.39.127.22 -> 216.165.108.217 TCP 2070 [TCP segment of a reassembled PDU]  tcp.stream == 10
373   9.446393 216.165.108.217 -> 125.39.127.22 TCP 66 35026 > http [ACK] Seq=622 Ack=4379 Win=24320 Len=0 TSval=42885060 TSecr=1233167033  tcp.stream == 10
374   9.453522 60.28.188.154 -> 216.165.108.217 TCP 74 http > 35602 [SYN, ACK] Seq=0 Ack=1 Win=5792 Len=0 MSS=1460 SACK_PERM=1 TSval=2002282188 TSecr=42884993 WS=1024  tcp.stream == 28
375   9.453553 216.165.108.217 -> 60.28.188.154 TCP 66 35602 > http [ACK] Seq=1 Ack=1 Win=14720 Len=0 TSval=42885062 TSecr=2002282188  tcp.stream == 28
376   9.453602 125.39.127.25 -> 216.165.108.217 TCP 74 http > 51842 [SYN, ACK] Seq=0 Ack=1 Win=5712 Len=0 MSS=1440 SACK_PERM=1 TSval=1493920549 TSecr=42884988 WS=32  tcp.stream == 26
377   9.453612 216.165.108.217 -> 125.39.127.25 TCP 66 51842 > http [ACK] Seq=1 Ack=1 Win=14720 Len=0 TSval=42885062 TSecr=1493920549  tcp.stream == 26
378   9.453692 216.165.108.217 -> 125.39.127.25 HTTP 387 GET /js/smart_for_qq_v3.1.js HTTP/1.1   tcp.stream == 26
379   9.460899 216.165.108.217 -> 125.39.200.22 HTTP 378 GET /www/images/ind36.gif HTTP/1.1   tcp.stream == 11
380   9.461006 216.165.108.217 -> 60.28.14.148 HTTP 386 GET /www/images/200709/home_b.gif HTTP/1.1   tcp.stream == 13
381   9.461074 216.165.108.217 -> 60.28.14.152 TCP 74 60694 > http [SYN] Seq=0 Win=14600 Len=0 MSS=1460 SACK_PERM=1 TSval=42885063 TSecr=0 WS=128  tcp.stream == 32
382   9.461146 216.165.108.217 -> 60.28.14.152 TCP 74 60695 > http [SYN] Seq=0 Win=14600 Len=0 MSS=1460 SACK_PERM=1 TSval=42885063 TSecr=0 WS=128  tcp.stream == 33
383   9.461211 216.165.108.217 -> 125.39.200.22 TCP 74 53062 > http [SYN] Seq=0 Win=14600 Len=0 MSS=1460 SACK_PERM=1 TSval=42885063 TSecr=0 WS=128  tcp.stream == 34
384   9.469342 216.165.108.217 -> 125.39.127.25 TCP 66 51825 > http [ACK] Seq=293 Ack=67117 Win=64128 Len=0 TSval=42885066 TSecr=1241274509  tcp.stream == 9
385   9.494938 125.39.127.42 -> 216.165.108.217 TCP 66 http > 34866 [ACK] Seq=1 Ack=292 Win=6784 Len=0 TSval=2214328392 TSecr=42885002  tcp.stream == 17
386   9.495853 125.39.127.42 -> 216.165.108.217 TCP 1494 [TCP segment of a reassembled PDU]  tcp.stream == 17
387   9.495873 216.165.108.217 -> 125.39.127.42 TCP 66 34866 > http [ACK] Seq=292 Ack=1429 Win=17536 Len=0 TSval=42885072 TSecr=2214328392  tcp.stream == 17
