 68   9.506987 216.165.108.217 -> 220.181.138.59 TCP 74 40771 > http [SYN] Seq=0 Win=14600 Len=0 MSS=1460 SACK_PERM=1 TSval=42874411 TSecr=0 WS=128  tcp.stream == 0
 71  10.002919 220.181.138.59 -> 216.165.108.217 TCP 74 http > 40771 [SYN, ACK] Seq=0 Ack=1 Win=5712 Len=0 MSS=1440 SACK_PERM=1 TSval=39888571 TSecr=42874411 WS=32  tcp.stream == 0
 72  10.002953 216.165.108.217 -> 220.181.138.59 TCP 66 40771 > http [ACK] Seq=1 Ack=1 Win=14720 Len=0 TSval=42874535 TSecr=39888571  tcp.stream == 0
 73  10.008477 216.165.108.217 -> 220.181.138.59 HTTP 458 GET / HTTP/1.1   tcp.stream == 0
 77  10.511003 220.181.138.59 -> 216.165.108.217 TCP 66 http > 40771 [ACK] Seq=1 Ack=393 Win=6784 Len=0 TSval=39888698 TSecr=42874536  tcp.stream == 0
 78  10.511063 220.181.138.59 -> 216.165.108.217 TCP 389 [TCP segment of a reassembled PDU]  tcp.stream == 0
 79  10.511075 216.165.108.217 -> 220.181.138.59 TCP 66 40771 > http [ACK] Seq=393 Ack=324 Win=15744 Len=0 TSval=42874662 TSecr=39888698  tcp.stream == 0
 80  10.511083 220.181.138.59 -> 216.165.108.217 HTTP 234 HTTP/1.1 302 Moved Temporarily  (text/html)  tcp.stream == 0
 81  10.523309 216.165.108.217 -> 220.181.138.59 TCP 66 40771 > http [FIN, ACK] Seq=393 Ack=493 Win=16768 Len=0 TSval=42874665 TSecr=39888698  tcp.stream == 0
 86  11.012866 220.181.138.59 -> 216.165.108.217 TCP 66 http > 40771 [ACK] Seq=493 Ack=394 Win=6784 Len=0 TSval=39888825 TSecr=42874665  tcp.stream == 0
 88  11.080285 216.165.108.217 -> 125.39.127.25 TCP 74 51665 > http [SYN] Seq=0 Win=14600 Len=0 MSS=1460 SACK_PERM=1 TSval=42874804 TSecr=0 WS=128  tcp.stream == 1
 92  11.370560 125.39.127.25 -> 216.165.108.217 TCP 74 http > 51665 [SYN, ACK] Seq=0 Ack=1 Win=5712 Len=0 MSS=1440 SACK_PERM=1 TSval=1234268645 TSecr=42874804 WS=32  tcp.stream == 1
 93  11.370591 216.165.108.217 -> 125.39.127.25 TCP 66 51665 > http [ACK] Seq=1 Ack=1 Win=14720 Len=0 TSval=42874877 TSecr=1234268645  tcp.stream == 1
 94  11.372962 216.165.108.217 -> 125.39.127.25 HTTP 462 GET / HTTP/1.1   tcp.stream == 1
 97  11.663527 125.39.127.25 -> 216.165.108.217 TCP 66 http > 51665 [ACK] Seq=1 Ack=397 Win=6784 Len=0 TSval=1234268718 TSecr=42874877  tcp.stream == 1
 98  11.668671 125.39.127.25 -> 216.165.108.217 TCP 1494 [TCP segment of a reassembled PDU]  tcp.stream == 1
 99  11.668697 216.165.108.217 -> 125.39.127.25 TCP 66 51665 > http [ACK] Seq=397 Ack=1429 Win=17536 Len=0 TSval=42874951 TSecr=1234268719  tcp.stream == 1
100  11.668794 125.39.127.25 -> 216.165.108.217 TCP 1494 [TCP segment of a reassembled PDU]  tcp.stream == 1
101  11.668804 216.165.108.217 -> 125.39.127.25 TCP 66 51665 > http [ACK] Seq=397 Ack=2857 Win=20480 Len=0 TSval=42874951 TSecr=1234268719  tcp.stream == 1
104  11.961467 125.39.127.25 -> 216.165.108.217 TCP 1494 [TCP segment of a reassembled PDU]  tcp.stream == 1
105  11.961492 216.165.108.217 -> 125.39.127.25 TCP 66 51665 > http [ACK] Seq=397 Ack=4285 Win=23296 Len=0 TSval=42875025 TSecr=1234268792  tcp.stream == 1
106  11.961701 125.39.127.25 -> 216.165.108.217 TCP 1494 [TCP segment of a reassembled PDU]  tcp.stream == 1
107  11.961711 216.165.108.217 -> 125.39.127.25 TCP 66 51665 > http [ACK] Seq=397 Ack=5713 Win=26240 Len=0 TSval=42875025 TSecr=1234268792  tcp.stream == 1
108  11.961821 125.39.127.25 -> 216.165.108.217 TCP 1494 [TCP segment of a reassembled PDU]  tcp.stream == 1
109  11.961831 216.165.108.217 -> 125.39.127.25 TCP 66 51665 > http [ACK] Seq=397 Ack=7141 Win=29184 Len=0 TSval=42875025 TSecr=1234268792  tcp.stream == 1
110  11.961944 125.39.127.25 -> 216.165.108.217 TCP 1494 [TCP segment of a reassembled PDU]  tcp.stream == 1
111  11.961957 216.165.108.217 -> 125.39.127.25 TCP 66 51665 > http [ACK] Seq=397 Ack=8569 Win=32000 Len=0 TSval=42875025 TSecr=1234268792  tcp.stream == 1
113  11.994603 216.165.108.217 -> 125.39.127.25 TCP 74 51666 > http [SYN] Seq=0 Win=14600 Len=0 MSS=1460 SACK_PERM=1 TSval=42875033 TSecr=0 WS=128  tcp.stream == 2
116  12.252384 125.39.127.25 -> 216.165.108.217 TCP 1494 [TCP segment of a reassembled PDU]  tcp.stream == 1
117  12.252412 216.165.108.217 -> 125.39.127.25 TCP 66 51665 > http [ACK] Seq=397 Ack=9997 Win=34944 Len=0 TSval=42875097 TSecr=1234268865  tcp.stream == 1
118  12.252455 125.39.127.25 -> 216.165.108.217 TCP 1494 [TCP segment of a reassembled PDU]  tcp.stream == 1
119  12.252461 216.165.108.217 -> 125.39.127.25 TCP 66 51665 > http [ACK] Seq=397 Ack=11425 Win=37888 Len=0 TSval=42875097 TSecr=1234268865  tcp.stream == 1
120  12.252587 125.39.127.25 -> 216.165.108.217 TCP 1494 [TCP segment of a reassembled PDU]  tcp.stream == 1
121  12.252597 216.165.108.217 -> 125.39.127.25 TCP 66 51665 > http [ACK] Seq=397 Ack=12853 Win=40704 Len=0 TSval=42875097 TSecr=1234268865  tcp.stream == 1
122  12.252713 125.39.127.25 -> 216.165.108.217 TCP 1494 [TCP segment of a reassembled PDU]  tcp.stream == 1
123  12.252725 216.165.108.217 -> 125.39.127.25 TCP 66 51665 > http [ACK] Seq=397 Ack=14281 Win=43648 Len=0 TSval=42875097 TSecr=1234268865  tcp.stream == 1
124  12.252834 125.39.127.25 -> 216.165.108.217 TCP 1494 [TCP segment of a reassembled PDU]  tcp.stream == 1
125  12.252845 216.165.108.217 -> 125.39.127.25 TCP 66 51665 > http [ACK] Seq=397 Ack=15709 Win=46464 Len=0 TSval=42875097 TSecr=1234268865  tcp.stream == 1
126  12.252956 125.39.127.25 -> 216.165.108.217 TCP 1494 [TCP segment of a reassembled PDU]  tcp.stream == 1
127  12.252967 216.165.108.217 -> 125.39.127.25 TCP 66 51665 > http [ACK] Seq=397 Ack=17137 Win=49408 Len=0 TSval=42875097 TSecr=1234268865  tcp.stream == 1
128  12.253078 125.39.127.25 -> 216.165.108.217 TCP 1494 [TCP segment of a reassembled PDU]  tcp.stream == 1
129  12.253088 216.165.108.217 -> 125.39.127.25 TCP 66 51665 > http [ACK] Seq=397 Ack=18565 Win=52352 Len=0 TSval=42875097 TSecr=1234268865  tcp.stream == 1
130  12.253200 125.39.127.25 -> 216.165.108.217 TCP 1494 [TCP segment of a reassembled PDU]  tcp.stream == 1
131  12.253212 216.165.108.217 -> 125.39.127.25 TCP 66 51665 > http [ACK] Seq=397 Ack=19993 Win=55168 Len=0 TSval=42875097 TSecr=1234268865  tcp.stream == 1
132  12.289371 125.39.127.25 -> 216.165.108.217 TCP 74 http > 51666 [SYN, ACK] Seq=0 Ack=1 Win=5712 Len=0 MSS=1440 SACK_PERM=1 TSval=1234268874 TSecr=42875033 WS=32  tcp.stream == 2
133  12.289409 216.165.108.217 -> 125.39.127.25 TCP 66 51666 > http [ACK] Seq=1 Ack=1 Win=14720 Len=0 TSval=42875107 TSecr=1234268874  tcp.stream == 2
134  12.291082 216.165.108.217 -> 125.39.127.25 HTTP 470 GET /iskin960/s01/s_1.6.0.css HTTP/1.1   tcp.stream == 2
136  12.543167 125.39.127.25 -> 216.165.108.217 TCP 1494 [TCP segment of a reassembled PDU]  tcp.stream == 1
137  12.543192 216.165.108.217 -> 125.39.127.25 TCP 66 51665 > http [ACK] Seq=397 Ack=21421 Win=58112 Len=0 TSval=42875170 TSecr=1234268938  tcp.stream == 1
138  12.543400 125.39.127.25 -> 216.165.108.217 TCP 1494 [TCP segment of a reassembled PDU]  tcp.stream == 1
139  12.543412 216.165.108.217 -> 125.39.127.25 TCP 66 51665 > http [ACK] Seq=397 Ack=22849 Win=61056 Len=0 TSval=42875170 TSecr=1234268938  tcp.stream == 1
140  12.543623 125.39.127.25 -> 216.165.108.217 TCP 1494 [TCP segment of a reassembled PDU]  tcp.stream == 1
141  12.543638 216.165.108.217 -> 125.39.127.25 TCP 66 51665 > http [ACK] Seq=397 Ack=24277 Win=62848 Len=0 TSval=42875170 TSecr=1234268938  tcp.stream == 1
142  12.543741 125.39.127.25 -> 216.165.108.217 TCP 1494 [TCP segment of a reassembled PDU]  tcp.stream == 1
143  12.543751 216.165.108.217 -> 125.39.127.25 TCP 66 51665 > http [ACK] Seq=397 Ack=25705 Win=61440 Len=0 TSval=42875170 TSecr=1234268938  tcp.stream == 1
144  12.543864 125.39.127.25 -> 216.165.108.217 TCP 1494 [TCP segment of a reassembled PDU]  tcp.stream == 1
145  12.543873 216.165.108.217 -> 125.39.127.25 TCP 66 51665 > http [ACK] Seq=397 Ack=27133 Win=60032 Len=0 TSval=42875170 TSecr=1234268938  tcp.stream == 1
146  12.543985 125.39.127.25 -> 216.165.108.217 TCP 1494 [TCP segment of a reassembled PDU]  tcp.stream == 1
147  12.543994 216.165.108.217 -> 125.39.127.25 TCP 66 51665 > http [ACK] Seq=397 Ack=28561 Win=58752 Len=0 TSval=42875170 TSecr=1234268938  tcp.stream == 1
148  12.544114 125.39.127.25 -> 216.165.108.217 TCP 1494 [TCP segment of a reassembled PDU]  tcp.stream == 1
149  12.544124 216.165.108.217 -> 125.39.127.25 TCP 66 51665 > http [ACK] Seq=397 Ack=29989 Win=57344 Len=0 TSval=42875170 TSecr=1234268938  tcp.stream == 1
150  12.544235 125.39.127.25 -> 216.165.108.217 TCP 1494 [TCP segment of a reassembled PDU]  tcp.stream == 1
151  12.544356 125.39.127.25 -> 216.165.108.217 TCP 1494 [TCP segment of a reassembled PDU]  tcp.stream == 1
152  12.544476 125.39.127.25 -> 216.165.108.217 TCP 1494 [TCP segment of a reassembled PDU]  tcp.stream == 1
153  12.544599 125.39.127.25 -> 216.165.108.217 TCP 1494 [TCP segment of a reassembled PDU]  tcp.stream == 1
154  12.544720 125.39.127.25 -> 216.165.108.217 TCP 1494 [TCP segment of a reassembled PDU]  tcp.stream == 1
155  12.547124 216.165.108.217 -> 125.39.127.25 TCP 66 51665 > http [ACK] Seq=397 Ack=37129 Win=54528 Len=0 TSval=42875171 TSecr=1234268938  tcp.stream == 1
158  12.586112 125.39.127.25 -> 216.165.108.217 TCP 66 http > 51666 [ACK] Seq=1 Ack=405 Win=6784 Len=0 TSval=1234268949 TSecr=42875107  tcp.stream == 2
159  12.586337 125.39.127.25 -> 216.165.108.217 TCP 453 [TCP segment of a reassembled PDU]  tcp.stream == 2
160  12.586348 216.165.108.217 -> 125.39.127.25 TCP 66 51666 > http [ACK] Seq=405 Ack=388 Win=15744 Len=0 TSval=42875181 TSecr=1234268949  tcp.stream == 2
161  12.586494 125.39.127.25 -> 216.165.108.217 HTTP 1640 HTTP/1.1 200 OK  (text/css)  tcp.stream == 2
162  12.586505 216.165.108.217 -> 125.39.127.25 TCP 66 51666 > http [ACK] Seq=405 Ack=1963 Win=18688 Len=0 TSval=42875181 TSecr=1234268949  tcp.stream == 2
163  12.596953 216.165.108.217 -> 125.39.127.25 TCP 66 51666 > http [FIN, ACK] Seq=405 Ack=1963 Win=18688 Len=0 TSval=42875183 TSecr=1234268949  tcp.stream == 2
164  12.628745 216.165.108.217 -> 125.39.127.25 TCP 74 51667 > http [SYN] Seq=0 Win=14600 Len=0 MSS=1460 SACK_PERM=1 TSval=42875191 TSecr=0 WS=128  tcp.stream == 3
165  12.636028 216.165.108.217 -> 125.39.127.25 TCP 74 51668 > http [SYN] Seq=0 Win=14600 Len=0 MSS=1460 SACK_PERM=1 TSval=42875193 TSecr=0 WS=128  tcp.stream == 4
168  12.837369 125.39.127.25 -> 216.165.108.217 TCP 1494 [TCP segment of a reassembled PDU]  tcp.stream == 1
169  12.837393 216.165.108.217 -> 125.39.127.25 TCP 66 51665 > http [ACK] Seq=397 Ack=38557 Win=64128 Len=0 TSval=42875244 TSecr=1234269010  tcp.stream == 1
170  12.837473 125.39.127.25 -> 216.165.108.217 TCP 1494 [TCP segment of a reassembled PDU]  tcp.stream == 1
171  12.837604 125.39.127.25 -> 216.165.108.217 TCP 1494 [TCP segment of a reassembled PDU]  tcp.stream == 1
172  12.837726 125.39.127.25 -> 216.165.108.217 TCP 1494 [TCP segment of a reassembled PDU]  tcp.stream == 1
173  12.837846 125.39.127.25 -> 216.165.108.217 TCP 1494 [TCP segment of a reassembled PDU]  tcp.stream == 1
174  12.837969 125.39.127.25 -> 216.165.108.217 TCP 1494 [TCP segment of a reassembled PDU]  tcp.stream == 1
175  12.838089 125.39.127.25 -> 216.165.108.217 TCP 1494 [TCP segment of a reassembled PDU]  tcp.stream == 1
176  12.838211 125.39.127.25 -> 216.165.108.217 TCP 1494 [TCP segment of a reassembled PDU]  tcp.stream == 1
177  12.838331 125.39.127.25 -> 216.165.108.217 TCP 1494 [TCP segment of a reassembled PDU]  tcp.stream == 1
178  12.838454 125.39.127.25 -> 216.165.108.217 TCP 1494 [TCP segment of a reassembled PDU]  tcp.stream == 1
179  12.838575 125.39.127.25 -> 216.165.108.217 TCP 1494 [TCP segment of a reassembled PDU]  tcp.stream == 1
180  12.838696 125.39.127.25 -> 216.165.108.217 TCP 1494 [TCP segment of a reassembled PDU]  tcp.stream == 1
181  12.838818 125.39.127.25 -> 216.165.108.217 TCP 1494 [TCP segment of a reassembled PDU]  tcp.stream == 1
182  12.838938 125.39.127.25 -> 216.165.108.217 TCP 1494 [TCP segment of a reassembled PDU]  tcp.stream == 1
183  12.839061 125.39.127.25 -> 216.165.108.217 TCP 1494 [TCP segment of a reassembled PDU]  tcp.stream == 1
184  12.839179 125.39.127.25 -> 216.165.108.217 TCP 1494 [TCP segment of a reassembled PDU]  tcp.stream == 1
185  12.839829 216.165.108.217 -> 125.39.127.25 TCP 66 51665 > http [ACK] Seq=397 Ack=59977 Win=49024 Len=0 TSval=42875244 TSecr=1234269010  tcp.stream == 1
186  12.841001 125.39.127.25 -> 216.165.108.217 TCP 1494 [TCP segment of a reassembled PDU]  tcp.stream == 1
187  12.841201 125.39.127.25 -> 216.165.108.217 TCP 1494 [TCP segment of a reassembled PDU]  tcp.stream == 1
188  12.841215 216.165.108.217 -> 125.39.127.25 TCP 66 51665 > http [ACK] Seq=397 Ack=62833 Win=50432 Len=0 TSval=42875244 TSecr=1234269011  tcp.stream == 1
189  12.841323 125.39.127.25 -> 216.165.108.217 TCP 1494 [TCP segment of a reassembled PDU]  tcp.stream == 1
190  12.841446 125.39.127.25 -> 216.165.108.217 TCP 1494 [TCP segment of a reassembled PDU]  tcp.stream == 1
191  12.841566 125.39.127.25 -> 216.165.108.217 TCP 1494 [TCP segment of a reassembled PDU]  tcp.stream == 1
192  12.841696 125.39.127.25 -> 216.165.108.217 TCP 1494 [TCP segment of a reassembled PDU]  tcp.stream == 1
193  12.841806 125.39.127.25 -> 216.165.108.217 TCP 1494 [TCP segment of a reassembled PDU]  tcp.stream == 1
194  12.841836 216.165.108.217 -> 125.39.127.25 TCP 66 51665 > http [ACK] Seq=397 Ack=69973 Win=47616 Len=0 TSval=42875245 TSecr=1234269011  tcp.stream == 1
195  12.841857 125.39.127.25 -> 216.165.108.217 HTTP 750 HTTP/1.1 200 OK  (text/html)  tcp.stream == 1
196  12.867417 216.165.108.217 -> 125.39.127.25 TCP 66 51665 > http [FIN, ACK] Seq=397 Ack=70658 Win=64128 Len=0 TSval=42875251 TSecr=1234269011  tcp.stream == 1
197  12.894178 125.39.127.25 -> 216.165.108.217 TCP 66 http > 51666 [ACK] Seq=1963 Ack=406 Win=6784 Len=0 TSval=1234269025 TSecr=42875183  tcp.stream == 2
199  12.925082 125.39.127.25 -> 216.165.108.217 TCP 74 http > 51667 [SYN, ACK] Seq=0 Ack=1 Win=5712 Len=0 MSS=1440 SACK_PERM=1 TSval=1234269033 TSecr=42875191 WS=32  tcp.stream == 3
200  12.925122 216.165.108.217 -> 125.39.127.25 TCP 66 51667 > http [ACK] Seq=1 Ack=1 Win=14720 Len=0 TSval=42875265 TSecr=1234269033  tcp.stream == 3
201  12.928867 216.165.108.217 -> 125.39.127.25 HTTP 454 GET /js/ping_qqcom_v2.1.9.js HTTP/1.1   tcp.stream == 3
202  12.937514 125.39.127.25 -> 216.165.108.217 TCP 74 http > 51668 [SYN, ACK] Seq=0 Ack=1 Win=5712 Len=0 MSS=1440 SACK_PERM=1 TSval=1493910756 TSecr=42875193 WS=32  tcp.stream == 4
203  12.937543 216.165.108.217 -> 125.39.127.25 TCP 66 51668 > http [ACK] Seq=1 Ack=1 Win=14720 Len=0 TSval=42875269 TSecr=1493910756  tcp.stream == 4
204  12.940157 216.165.108.217 -> 125.39.127.25 HTTP 454 GET /js/smart_for_qq_v3.1.js HTTP/1.1   tcp.stream == 4
207  12.984412 216.165.108.217 -> 60.28.14.148 TCP 74 55347 > http [SYN] Seq=0 Win=14600 Len=0 MSS=1460 SACK_PERM=1 TSval=42875280 TSecr=0 WS=128  tcp.stream == 5
208  12.986146 216.165.108.217 -> 60.28.14.148 TCP 74 55348 > http [SYN] Seq=0 Win=14600 Len=0 MSS=1460 SACK_PERM=1 TSval=42875281 TSecr=0 WS=128  tcp.stream == 6
209  12.986598 216.165.108.217 -> 60.28.14.148 TCP 74 55349 > http [SYN] Seq=0 Win=14600 Len=0 MSS=1460 SACK_PERM=1 TSval=42875281 TSecr=0 WS=128  tcp.stream == 7
211  13.157802 125.39.127.25 -> 216.165.108.217 TCP 66 http > 51665 [ACK] Seq=70658 Ack=398 Win=6784 Len=0 TSval=1234269092 TSecr=42875251  tcp.stream == 1
213  13.222818 125.39.127.25 -> 216.165.108.217 TCP 66 http > 51667 [ACK] Seq=1 Ack=389 Win=6784 Len=0 TSval=1234269108 TSecr=42875266  tcp.stream == 3
214  13.222945 125.39.127.25 -> 216.165.108.217 TCP 469 [TCP segment of a reassembled PDU]  tcp.stream == 3
215  13.222955 216.165.108.217 -> 125.39.127.25 TCP 66 51667 > http [ACK] Seq=389 Ack=404 Win=15744 Len=0 TSval=42875340 TSecr=1234269108  tcp.stream == 3
216  13.223103 125.39.127.25 -> 216.165.108.217 HTTP 2077 HTTP/1.1 200 OK  (application/x-javascript)  tcp.stream == 3
217  13.223115 216.165.108.217 -> 125.39.127.25 TCP 66 51667 > http [ACK] Seq=389 Ack=2416 Win=18688 Len=0 TSval=42875340 TSecr=1234269108  tcp.stream == 3
218  13.228052 216.165.108.217 -> 125.39.127.25 TCP 66 51667 > http [FIN, ACK] Seq=389 Ack=2416 Win=18688 Len=0 TSval=42875341 TSecr=1234269108  tcp.stream == 3
219  13.239935 125.39.127.25 -> 216.165.108.217 TCP 66 http > 51668 [ACK] Seq=1 Ack=389 Win=6784 Len=0 TSval=1493910832 TSecr=42875269  tcp.stream == 4
220  13.239961 125.39.127.25 -> 216.165.108.217 TCP 469 [TCP segment of a reassembled PDU]  tcp.stream == 4
221  13.239969 216.165.108.217 -> 125.39.127.25 TCP 66 51668 > http [ACK] Seq=389 Ack=404 Win=15744 Len=0 TSval=42875344 TSecr=1493910832  tcp.stream == 4
222  13.240118 125.39.127.25 -> 216.165.108.217 HTTP 2073 HTTP/1.1 200 OK  (application/x-javascript)  tcp.stream == 4
223  13.240128 216.165.108.217 -> 125.39.127.25 TCP 66 51668 > http [ACK] Seq=389 Ack=2412 Win=18688 Len=0 TSval=42875344 TSecr=1493910832  tcp.stream == 4
224  13.246968 216.165.108.217 -> 125.39.127.25 TCP 66 51668 > http [FIN, ACK] Seq=389 Ack=2412 Win=18688 Len=0 TSval=42875346 TSecr=1493910832  tcp.stream == 4
225  13.262383 60.28.14.148 -> 216.165.108.217 TCP 74 http > 55347 [SYN, ACK] Seq=0 Ack=1 Win=5712 Len=0 MSS=1440 SACK_PERM=1 TSval=2002041087 TSecr=42875280 WS=32  tcp.stream == 5
226  13.262420 216.165.108.217 -> 60.28.14.148 TCP 66 55347 > http [ACK] Seq=1 Ack=1 Win=14720 Len=0 TSval=42875350 TSecr=2002041087  tcp.stream == 5
227  13.263630 60.28.14.148 -> 216.165.108.217 TCP 74 http > 55349 [SYN, ACK] Seq=0 Ack=1 Win=5712 Len=0 MSS=1440 SACK_PERM=1 TSval=2002041087 TSecr=42875281 WS=32  tcp.stream == 7
228  13.263665 216.165.108.217 -> 60.28.14.148 TCP 66 55349 > http [ACK] Seq=1 Ack=1 Win=14720 Len=0 TSval=42875350 TSecr=2002041087  tcp.stream == 7
229  13.264551 60.28.14.148 -> 216.165.108.217 TCP 74 http > 55348 [SYN, ACK] Seq=0 Ack=1 Win=5712 Len=0 MSS=1440 SACK_PERM=1 TSval=1289166832 TSecr=42875281 WS=32  tcp.stream == 6
230  13.264583 216.165.108.217 -> 60.28.14.148 TCP 66 55348 > http [ACK] Seq=1 Ack=1 Win=14720 Len=0 TSval=42875350 TSecr=1289166832  tcp.stream == 6
231  13.264957 216.165.108.217 -> 60.28.14.148 HTTP 452 GET /js/speed_v1.9-min.js HTTP/1.1   tcp.stream == 5
232  13.266793 216.165.108.217 -> 60.28.14.148 HTTP 461 GET /tech/js/ipad/iscroll_v2.js HTTP/1.1   tcp.stream == 7
233  13.268926 216.165.108.217 -> 60.28.14.148 HTTP 479 GET /finance/st/g/fn-smartbox/du_smartbox_1.15.js HTTP/1.1   tcp.stream == 6
236  13.522580 125.39.127.25 -> 216.165.108.217 TCP 66 http > 51667 [ACK] Seq=2416 Ack=390 Win=6784 Len=0 TSval=1234269183 TSecr=42875341  tcp.stream == 3
237  13.543335 60.28.14.148 -> 216.165.108.217 TCP 66 http > 55347 [ACK] Seq=1 Ack=387 Win=6784 Len=0 TSval=2002041157 TSecr=42875350  tcp.stream == 5
238  13.543598 60.28.14.148 -> 216.165.108.217 HTTP 1466 HTTP/1.1 200 OK  (application/x-javascript)  tcp.stream == 5
239  13.543612 216.165.108.217 -> 60.28.14.148 TCP 66 55347 > http [ACK] Seq=387 Ack=1401 Win=17536 Len=0 TSval=42875420 TSecr=2002041157  tcp.stream == 5
240  13.543618 60.28.14.148 -> 216.165.108.217 TCP 66 http > 55347 [FIN, ACK] Seq=1401 Ack=387 Win=6784 Len=0 TSval=2002041157 TSecr=42875350  tcp.stream == 5
241  13.544099 60.28.14.148 -> 216.165.108.217 TCP 66 http > 55349 [ACK] Seq=1 Ack=396 Win=6784 Len=0 TSval=2002041157 TSecr=42875351  tcp.stream == 7
242  13.544905 60.28.14.148 -> 216.165.108.217 TCP 1494 [TCP segment of a reassembled PDU]  tcp.stream == 7
243  13.544931 216.165.108.217 -> 60.28.14.148 TCP 66 55349 > http [ACK] Seq=396 Ack=1429 Win=17536 Len=0 TSval=42875420 TSecr=2002041157  tcp.stream == 7
244  13.545031 60.28.14.148 -> 216.165.108.217 TCP 1494 [TCP segment of a reassembled PDU]  tcp.stream == 7
245  13.545041 216.165.108.217 -> 60.28.14.148 TCP 66 55349 > http [ACK] Seq=396 Ack=2857 Win=20480 Len=0 TSval=42875420 TSecr=2002041157  tcp.stream == 7
246  13.546350 125.39.127.25 -> 216.165.108.217 TCP 66 http > 51668 [ACK] Seq=2412 Ack=390 Win=6784 Len=0 TSval=1493910908 TSecr=42875346  tcp.stream == 4
247  13.547480 60.28.14.148 -> 216.165.108.217 TCP 66 http > 55348 [ACK] Seq=1 Ack=414 Win=6784 Len=0 TSval=1289166903 TSecr=42875351  tcp.stream == 6
248  13.549633 60.28.14.148 -> 216.165.108.217 TCP 1494 [TCP segment of a reassembled PDU]  tcp.stream == 6
249  13.549660 216.165.108.217 -> 60.28.14.148 TCP 66 55348 > http [ACK] Seq=414 Ack=1429 Win=17536 Len=0 TSval=42875422 TSecr=1289166903  tcp.stream == 6
250  13.549762 60.28.14.148 -> 216.165.108.217 TCP 1494 [TCP segment of a reassembled PDU]  tcp.stream == 6
251  13.549770 216.165.108.217 -> 60.28.14.148 TCP 66 55348 > http [ACK] Seq=414 Ack=2857 Win=20480 Len=0 TSval=42875422 TSecr=1289166903  tcp.stream == 6
252  13.553297 216.165.108.217 -> 60.28.14.148 TCP 66 55347 > http [FIN, ACK] Seq=387 Ack=1402 Win=17536 Len=0 TSval=42875422 TSecr=2002041157  tcp.stream == 5
254  13.822097 60.28.14.148 -> 216.165.108.217 TCP 1494 [TCP segment of a reassembled PDU]  tcp.stream == 7
255  13.822125 216.165.108.217 -> 60.28.14.148 TCP 66 55349 > http [ACK] Seq=396 Ack=4285 Win=23296 Len=0 TSval=42875490 TSecr=2002041227  tcp.stream == 7
256  13.822229 60.28.14.148 -> 216.165.108.217 HTTP 2073 HTTP/1.1 200 OK  (application/x-javascript)  tcp.stream == 7
257  13.822241 216.165.108.217 -> 60.28.14.148 TCP 66 55349 > http [ACK] Seq=396 Ack=6293 Win=26240 Len=0 TSval=42875490 TSecr=2002041227  tcp.stream == 7
258  13.827203 216.165.108.217 -> 60.28.14.148 TCP 66 55349 > http [FIN, ACK] Seq=396 Ack=6293 Win=26240 Len=0 TSval=42875491 TSecr=2002041227  tcp.stream == 7
259  13.828578 60.28.14.148 -> 216.165.108.217 TCP 1494 [TCP segment of a reassembled PDU]  tcp.stream == 6
260  13.828605 216.165.108.217 -> 60.28.14.148 TCP 66 55348 > http [ACK] Seq=414 Ack=4285 Win=23296 Len=0 TSval=42875491 TSecr=1289166973  tcp.stream == 6
261  13.828705 60.28.14.148 -> 216.165.108.217 TCP 1494 [TCP segment of a reassembled PDU]  tcp.stream == 6
262  13.828715 216.165.108.217 -> 60.28.14.148 TCP 66 55348 > http [ACK] Seq=414 Ack=5713 Win=26240 Len=0 TSval=42875491 TSecr=1289166973  tcp.stream == 6
263  13.829427 60.28.14.148 -> 216.165.108.217 TCP 1494 [TCP segment of a reassembled PDU]  tcp.stream == 6
264  13.829454 216.165.108.217 -> 60.28.14.148 TCP 66 55348 > http [ACK] Seq=414 Ack=7141 Win=29184 Len=0 TSval=42875492 TSecr=1289166973  tcp.stream == 6
265  13.829557 60.28.14.148 -> 216.165.108.217 TCP 1494 [TCP segment of a reassembled PDU]  tcp.stream == 6
266  13.829566 216.165.108.217 -> 60.28.14.148 TCP 66 55348 > http [ACK] Seq=414 Ack=8569 Win=32000 Len=0 TSval=42875492 TSecr=1289166973  tcp.stream == 6
267  13.832374 60.28.14.148 -> 216.165.108.217 TCP 66 http > 55347 [ACK] Seq=1402 Ack=388 Win=6784 Len=0 TSval=2002041229 TSecr=42875422  tcp.stream == 5
272  13.897767 216.165.108.217 -> 60.28.14.148 TCP 74 55350 > http [SYN] Seq=0 Win=14600 Len=0 MSS=1460 SACK_PERM=1 TSval=42875509 TSecr=0 WS=128  tcp.stream == 8
273  13.906757 216.165.108.217 -> 60.28.14.148 TCP 74 55351 > http [SYN] Seq=0 Win=14600 Len=0 MSS=1460 SACK_PERM=1 TSval=42875511 TSecr=0 WS=128  tcp.stream == 9
274  13.913440 216.165.108.217 -> 60.28.14.148 TCP 74 55352 > http [SYN] Seq=0 Win=14600 Len=0 MSS=1460 SACK_PERM=1 TSval=42875513 TSecr=0 WS=128  tcp.stream == 10
275  13.936816 216.165.108.217 -> 60.28.14.148 TCP 74 55353 > http [SYN] Seq=0 Win=14600 Len=0 MSS=1460 SACK_PERM=1 TSval=42875518 TSecr=0 WS=128  tcp.stream == 11
276  13.938386 216.165.108.217 -> 60.28.14.148 TCP 74 55354 > http [SYN] Seq=0 Win=14600 Len=0 MSS=1460 SACK_PERM=1 TSval=42875519 TSecr=0 WS=128  tcp.stream == 12
278  14.035580 216.165.108.217 -> 60.28.14.148 TCP 74 55355 > http [SYN] Seq=0 Win=14600 Len=0 MSS=1460 SACK_PERM=1 TSval=42875543 TSecr=0 WS=128  tcp.stream == 13
279  14.040848 216.165.108.217 -> 60.28.14.148 TCP 74 55356 > http [SYN] Seq=0 Win=14600 Len=0 MSS=1460 SACK_PERM=1 TSval=42875544 TSecr=0 WS=128  tcp.stream == 14
280  14.063533 216.165.108.217 -> 60.28.14.148 TCP 74 55357 > http [SYN] Seq=0 Win=14600 Len=0 MSS=1460 SACK_PERM=1 TSval=42875550 TSecr=0 WS=128  tcp.stream == 15
281  14.108591 60.28.14.148 -> 216.165.108.217 TCP 66 http > 55349 [ACK] Seq=6293 Ack=397 Win=6784 Len=0 TSval=2002041297 TSecr=42875491  tcp.stream == 7
282  14.111250 60.28.14.148 -> 216.165.108.217 TCP 1494 [TCP segment of a reassembled PDU]  tcp.stream == 6
283  14.111280 216.165.108.217 -> 60.28.14.148 TCP 66 55348 > http [ACK] Seq=414 Ack=9997 Win=34944 Len=0 TSval=42875562 TSecr=1289167043  tcp.stream == 6
284  14.111539 60.28.14.148 -> 216.165.108.217 TCP 1494 [TCP segment of a reassembled PDU]  tcp.stream == 6
285  14.111552 216.165.108.217 -> 60.28.14.148 TCP 66 55348 > http [ACK] Seq=414 Ack=11425 Win=37888 Len=0 TSval=42875562 TSecr=1289167043  tcp.stream == 6
286  14.111658 60.28.14.148 -> 216.165.108.217 TCP 1494 [TCP segment of a reassembled PDU]  tcp.stream == 6
287  14.111669 216.165.108.217 -> 60.28.14.148 TCP 66 55348 > http [ACK] Seq=414 Ack=12853 Win=40704 Len=0 TSval=42875562 TSecr=1289167043  tcp.stream == 6
288  14.111780 60.28.14.148 -> 216.165.108.217 TCP 1494 [TCP segment of a reassembled PDU]  tcp.stream == 6
289  14.111789 216.165.108.217 -> 60.28.14.148 TCP 66 55348 > http [ACK] Seq=414 Ack=14281 Win=43648 Len=0 TSval=42875562 TSecr=1289167043  tcp.stream == 6
290  14.111901 60.28.14.148 -> 216.165.108.217 TCP 1494 [TCP segment of a reassembled PDU]  tcp.stream == 6
291  14.111913 216.165.108.217 -> 60.28.14.148 TCP 66 55348 > http [ACK] Seq=414 Ack=15709 Win=46464 Len=0 TSval=42875562 TSecr=1289167043  tcp.stream == 6
292  14.112113 60.28.14.148 -> 216.165.108.217 TCP 1494 [TCP segment of a reassembled PDU]  tcp.stream == 6
293  14.112125 216.165.108.217 -> 60.28.14.148 TCP 66 55348 > http [ACK] Seq=414 Ack=17137 Win=49408 Len=0 TSval=42875562 TSecr=1289167043  tcp.stream == 6
294  14.112226 60.28.14.148 -> 216.165.108.217 HTTP 1416 HTTP/1.1 200 OK  (application/x-javascript)  tcp.stream == 6
295  14.149358 216.165.108.217 -> 60.28.14.148 TCP 66 55348 > http [ACK] Seq=414 Ack=18488 Win=52224 Len=0 TSval=42875572 TSecr=1289167043  tcp.stream == 6
296  14.178129 60.28.14.148 -> 216.165.108.217 TCP 74 http > 55350 [SYN, ACK] Seq=0 Ack=1 Win=5712 Len=0 MSS=1440 SACK_PERM=1 TSval=2002041315 TSecr=42875509 WS=32  tcp.stream == 8
297  14.178159 216.165.108.217 -> 60.28.14.148 TCP 66 55350 > http [ACK] Seq=1 Ack=1 Win=14720 Len=0 TSval=42875579 TSecr=2002041315  tcp.stream == 8
298  14.182596 60.28.14.148 -> 216.165.108.217 TCP 74 http > 55351 [SYN, ACK] Seq=0 Ack=1 Win=5712 Len=0 MSS=1440 SACK_PERM=1 TSval=1289167061 TSecr=42875511 WS=32  tcp.stream == 9
299  14.182626 216.165.108.217 -> 60.28.14.148 TCP 66 55351 > http [ACK] Seq=1 Ack=1 Win=14720 Len=0 TSval=42875580 TSecr=1289167061  tcp.stream == 9
300  14.192398 60.28.14.148 -> 216.165.108.217 TCP 74 http > 55352 [SYN, ACK] Seq=0 Ack=1 Win=5712 Len=0 MSS=1440 SACK_PERM=1 TSval=1289167064 TSecr=42875513 WS=32  tcp.stream == 10
301  14.192436 216.165.108.217 -> 60.28.14.148 TCP 66 55352 > http [ACK] Seq=1 Ack=1 Win=14720 Len=0 TSval=42875582 TSecr=1289167064  tcp.stream == 10
303  14.215556 60.28.14.148 -> 216.165.108.217 TCP 74 http > 55353 [SYN, ACK] Seq=0 Ack=1 Win=5712 Len=0 MSS=1440 SACK_PERM=1 TSval=2002064739 TSecr=42875518 WS=32  tcp.stream == 11
304  14.215587 216.165.108.217 -> 60.28.14.148 TCP 66 55353 > http [ACK] Seq=1 Ack=1 Win=14720 Len=0 TSval=42875588 TSecr=2002064739  tcp.stream == 11
305  14.217295 60.28.14.148 -> 216.165.108.217 TCP 74 http > 55354 [SYN, ACK] Seq=0 Ack=1 Win=5712 Len=0 MSS=1440 SACK_PERM=1 TSval=2002253785 TSecr=42875519 WS=32  tcp.stream == 12
306  14.217326 216.165.108.217 -> 60.28.14.148 TCP 66 55354 > http [ACK] Seq=1 Ack=1 Win=14720 Len=0 TSval=42875588 TSecr=2002253785  tcp.stream == 12
307  14.232579 216.165.108.217 -> 60.28.14.148 TCP 66 55348 > http [FIN, ACK] Seq=414 Ack=18488 Win=52224 Len=0 TSval=42875592 TSecr=1289167043  tcp.stream == 6
308  14.233892 216.165.108.217 -> 60.28.14.148 TCP 74 55358 > http [SYN] Seq=0 Win=14600 Len=0 MSS=1460 SACK_PERM=1 TSval=42875593 TSecr=0 WS=128  tcp.stream == 16
309  14.235255 216.165.108.217 -> 60.28.14.148 HTTP 448 GET /www/iskin960/qqcomlogo.png HTTP/1.1   tcp.stream == 8
310  14.247049 216.165.108.217 -> 60.28.14.148 HTTP 448 GET /www/iskin960/logo_soso.png HTTP/1.1   tcp.stream == 9
311  14.248251 216.165.108.217 -> 60.28.14.148 HTTP 453 GET /finance/02012yzw/2012021511.jpg HTTP/1.1   tcp.stream == 10
312  14.261404 216.165.108.217 -> 60.28.14.148 HTTP 451 GET /www/guirenniao/guirenniao.png HTTP/1.1   tcp.stream == 12
313  14.262640 216.165.108.217 -> 60.28.14.148 HTTP 453 GET /lady/evaliang/2012/2/16/qq1.jpg HTTP/1.1   tcp.stream == 11
315  14.280401 216.165.108.217 -> 184.105.67.86 TCP 74 58761 > http [SYN] Seq=0 Win=14600 Len=0 MSS=1460 SACK_PERM=1 TSval=42875604 TSecr=0 WS=128  tcp.stream == 17
316  14.292389 216.165.108.217 -> 60.28.14.148 TCP 74 55360 > http [SYN] Seq=0 Win=14600 Len=0 MSS=1460 SACK_PERM=1 TSval=42875607 TSecr=0 WS=128  tcp.stream == 18
317  14.313706 60.28.14.148 -> 216.165.108.217 TCP 74 http > 55355 [SYN, ACK] Seq=0 Ack=1 Win=5712 Len=0 MSS=1440 SACK_PERM=1 TSval=2002253808 TSecr=42875543 WS=32  tcp.stream == 13
318  14.313738 216.165.108.217 -> 60.28.14.148 TCP 66 55355 > http [ACK] Seq=1 Ack=1 Win=14720 Len=0 TSval=42875613 TSecr=2002253808  tcp.stream == 13
319  14.319240 60.28.14.148 -> 216.165.108.217 TCP 74 http > 55356 [SYN, ACK] Seq=0 Ack=1 Win=5712 Len=0 MSS=1440 SACK_PERM=1 TSval=1289167096 TSecr=42875544 WS=32  tcp.stream == 14
320  14.319272 216.165.108.217 -> 60.28.14.148 TCP 66 55356 > http [ACK] Seq=1 Ack=1 Win=14720 Len=0 TSval=42875614 TSecr=1289167096  tcp.stream == 14
321  14.319746 216.165.108.217 -> 60.28.14.148 HTTP 439 GET /www/images/ind36.gif HTTP/1.1   tcp.stream == 13
322  14.321951 216.165.108.217 -> 60.28.14.148 HTTP 447 GET /www/images/200709/home_b.gif HTTP/1.1   tcp.stream == 14
323  14.342239 60.28.14.148 -> 216.165.108.217 TCP 74 http > 55357 [SYN, ACK] Seq=0 Ack=1 Win=5712 Len=0 MSS=1440 SACK_PERM=1 TSval=2002064771 TSecr=42875550 WS=32  tcp.stream == 15
324  14.342270 216.165.108.217 -> 60.28.14.148 TCP 66 55357 > http [ACK] Seq=1 Ack=1 Win=14720 Len=0 TSval=42875620 TSecr=2002064771  tcp.stream == 15
325  14.344026 216.165.108.217 -> 60.28.14.148 HTTP 448 GET /www/images/allskin/wmlogo.gif HTTP/1.1   tcp.stream == 15
326  14.354923 184.105.67.86 -> 216.165.108.217 TCP 74 http > 58761 [SYN, ACK] Seq=0 Ack=1 Win=5792 Len=0 MSS=1460 SACK_PERM=1 TSval=2127455854 TSecr=42875604 WS=4  tcp.stream == 17
327  14.354962 216.165.108.217 -> 184.105.67.86 TCP 66 58761 > http [ACK] Seq=1 Ack=1 Win=14720 Len=0 TSval=42875623 TSecr=2127455854  tcp.stream == 17
328  14.357888 216.165.108.217 -> 184.105.67.86 HTTP 480 GET /web/crystal/v1.5Beta03Build035/crystal-min.js HTTP/1.1   tcp.stream == 17
330  14.374953 216.165.108.217 -> 60.28.14.152 TCP 74 60529 > http [SYN] Seq=0 Win=14600 Len=0 MSS=1460 SACK_PERM=1 TSval=42875628 TSecr=0 WS=128  tcp.stream == 19
331  14.375857 216.165.108.217 -> 60.28.14.152 TCP 74 60530 > http [SYN] Seq=0 Win=14600 Len=0 MSS=1460 SACK_PERM=1 TSval=42875628 TSecr=0 WS=128  tcp.stream == 20
332  14.376461 216.165.108.217 -> 60.28.14.152 TCP 74 60531 > http [SYN] Seq=0 Win=14600 Len=0 MSS=1460 SACK_PERM=1 TSval=42875628 TSecr=0 WS=128  tcp.stream == 21
333  14.376939 216.165.108.217 -> 60.28.14.152 TCP 74 60532 > http [SYN] Seq=0 Win=14600 Len=0 MSS=1460 SACK_PERM=1 TSval=42875628 TSecr=0 WS=128  tcp.stream == 22
334  14.377458 216.165.108.217 -> 60.28.14.152 TCP 74 60533 > http [SYN] Seq=0 Win=14600 Len=0 MSS=1460 SACK_PERM=1 TSval=42875629 TSecr=0 WS=128  tcp.stream == 23
335  14.378071 216.165.108.217 -> 60.28.14.152 TCP 74 60534 > http [SYN] Seq=0 Win=14600 Len=0 MSS=1460 SACK_PERM=1 TSval=42875629 TSecr=0 WS=128  tcp.stream == 24
339  14.414783 216.165.108.217 -> 125.39.200.24 TCP 74 54126 > http [SYN] Seq=0 Win=14600 Len=0 MSS=1460 SACK_PERM=1 TSval=42875638 TSecr=0 WS=128  tcp.stream == 25
340  14.415322 216.165.108.217 -> 125.39.200.24 TCP 74 54127 > http [SYN] Seq=0 Win=14600 Len=0 MSS=1460 SACK_PERM=1 TSval=42875638 TSecr=0 WS=128  tcp.stream == 26
341  14.415773 216.165.108.217 -> 125.39.200.24 TCP 74 54128 > http [SYN] Seq=0 Win=14600 Len=0 MSS=1460 SACK_PERM=1 TSval=42875638 TSecr=0 WS=128  tcp.stream == 27
342  14.440423 184.105.67.86 -> 216.165.108.217 TCP 66 http > 58761 [ACK] Seq=1 Ack=415 Win=6864 Len=0 TSval=2127455873 TSecr=42875624  tcp.stream == 17
343  14.440687 184.105.67.86 -> 216.165.108.217 TCP 1514 [TCP segment of a reassembled PDU]  tcp.stream == 17
344  14.440702 216.165.108.217 -> 184.105.67.86 TCP 66 58761 > http [ACK] Seq=415 Ack=1449 Win=17536 Len=0 TSval=42875644 TSecr=2127455873  tcp.stream == 17
345  14.440811 184.105.67.86 -> 216.165.108.217 TCP 1514 [TCP segment of a reassembled PDU]  tcp.stream == 17
346  14.440819 216.165.108.217 -> 184.105.67.86 TCP 66 58761 > http [ACK] Seq=415 Ack=2897 Win=20480 Len=0 TSval=42875644 TSecr=2127455873  tcp.stream == 17
347  14.506981 60.28.14.148 -> 216.165.108.217 TCP 74 http > 55358 [SYN, ACK] Seq=0 Ack=1 Win=5712 Len=0 MSS=1440 SACK_PERM=1 TSval=2002041398 TSecr=42875593 WS=32  tcp.stream == 16
348  14.507010 216.165.108.217 -> 60.28.14.148 TCP 66 55358 > http [ACK] Seq=1 Ack=1 Win=14720 Len=0 TSval=42875661 TSecr=2002041398  tcp.stream == 16
349  14.508783 216.165.108.217 -> 60.28.14.148 HTTP 464 GET /zonetenpay/images/scale_img/sspp120210.gif HTTP/1.1   tcp.stream == 16
350  14.511794 60.28.14.148 -> 216.165.108.217 TCP 66 http > 55348 [ACK] Seq=18488 Ack=415 Win=6784 Len=0 TSval=1289167144 TSecr=42875592  tcp.stream == 6
351  14.513803 60.28.14.148 -> 216.165.108.217 TCP 66 http > 55350 [ACK] Seq=1 Ack=383 Win=6784 Len=0 TSval=2002041400 TSecr=42875593  tcp.stream == 8
352  14.513827 60.28.14.148 -> 216.165.108.217 TCP 381 [TCP segment of a reassembled PDU]  tcp.stream == 8
353  14.513841 216.165.108.217 -> 60.28.14.148 TCP 66 55350 > http [ACK] Seq=383 Ack=316 Win=15744 Len=0 TSval=42875663 TSecr=2002041400  tcp.stream == 8
354  14.514115 60.28.14.148 -> 216.165.108.217 TCP 1494 [TCP segment of a reassembled PDU]  tcp.stream == 8
355  14.514129 216.165.108.217 -> 60.28.14.148 TCP 66 55350 > http [ACK] Seq=383 Ack=1744 Win=18688 Len=0 TSval=42875663 TSecr=2002041400  tcp.stream == 8
356  14.514231 60.28.14.148 -> 216.165.108.217 TCP 1494 [TCP segment of a reassembled PDU]  tcp.stream == 8
357  14.514241 216.165.108.217 -> 60.28.14.148 TCP 66 55350 > http [ACK] Seq=383 Ack=3172 Win=21504 Len=0 TSval=42875663 TSecr=2002041400  tcp.stream == 8
358  14.514294 60.28.14.148 -> 216.165.108.217 HTTP 1142 HTTP/1.1 200 OK  (PNG)[Malformed Packet]  tcp.stream == 8
359  14.520787 216.165.108.217 -> 60.28.14.148 TCP 66 55350 > http [FIN, ACK] Seq=383 Ack=4249 Win=24320 Len=0 TSval=42875664 TSecr=2002041400  tcp.stream == 8
360  14.521255 60.28.14.148 -> 216.165.108.217 TCP 66 http > 55351 [ACK] Seq=1 Ack=383 Win=6784 Len=0 TSval=1289167146 TSecr=42875596  tcp.stream == 9
361  14.521279 60.28.14.148 -> 216.165.108.217 TCP 381 [TCP segment of a reassembled PDU]  tcp.stream == 9
362  14.521288 216.165.108.217 -> 60.28.14.148 TCP 66 55351 > http [ACK] Seq=383 Ack=316 Win=15744 Len=0 TSval=42875664 TSecr=1289167146  tcp.stream == 9
363  14.521974 216.165.108.217 -> 60.28.14.148 TCP 74 55370 > http [SYN] Seq=0 Win=14600 Len=0 MSS=1460 SACK_PERM=1 TSval=42875665 TSecr=0 WS=128  tcp.stream == 28
364  14.522292 60.28.14.148 -> 216.165.108.217 TCP 1494 [TCP segment of a reassembled PDU]  tcp.stream == 9
365  14.522312 216.165.108.217 -> 60.28.14.148 TCP 66 55351 > http [ACK] Seq=383 Ack=1744 Win=18688 Len=0 TSval=42875665 TSecr=1289167146  tcp.stream == 9
366  14.522352 60.28.14.148 -> 216.165.108.217 HTTP 793 HTTP/1.1 200 OK  (PNG)[Malformed Packet]  tcp.stream == 9
367  14.523308 184.105.67.86 -> 216.165.108.217 TCP 1514 [TCP segment of a reassembled PDU]  tcp.stream == 17
368  14.523335 216.165.108.217 -> 184.105.67.86 TCP 66 58761 > http [ACK] Seq=415 Ack=4345 Win=23296 Len=0 TSval=42875665 TSecr=2127455894  tcp.stream == 17
369  14.523454 184.105.67.86 -> 216.165.108.217 TCP 1514 [TCP segment of a reassembled PDU]  tcp.stream == 17
370  14.523463 216.165.108.217 -> 184.105.67.86 TCP 66 58761 > http [ACK] Seq=415 Ack=5793 Win=26240 Len=0 TSval=42875665 TSecr=2127455894  tcp.stream == 17
371  14.523577 184.105.67.86 -> 216.165.108.217 TCP 1514 [TCP segment of a reassembled PDU]  tcp.stream == 17
372  14.523588 216.165.108.217 -> 184.105.67.86 TCP 66 58761 > http [ACK] Seq=415 Ack=7241 Win=29184 Len=0 TSval=42875665 TSecr=2127455894  tcp.stream == 17
373  14.523708 184.105.67.86 -> 216.165.108.217 TCP 1514 [TCP segment of a reassembled PDU]  tcp.stream == 17
374  14.523720 216.165.108.217 -> 184.105.67.86 TCP 66 58761 > http [ACK] Seq=415 Ack=8689 Win=32000 Len=0 TSval=42875665 TSecr=2127455894  tcp.stream == 17
375  14.526555 60.28.14.148 -> 216.165.108.217 TCP 66 http > 55352 [ACK] Seq=1 Ack=388 Win=6784 Len=0 TSval=1289167147 TSecr=42875596  tcp.stream == 10
376  14.526680 60.28.14.148 -> 216.165.108.217 TCP 382 [TCP segment of a reassembled PDU]  tcp.stream == 10
377  14.526693 216.165.108.217 -> 60.28.14.148 TCP 66 55352 > http [ACK] Seq=388 Ack=317 Win=15744 Len=0 TSval=42875666 TSecr=1289167147  tcp.stream == 10
378  14.526872 60.28.14.148 -> 216.165.108.217 TCP 1494 [TCP segment of a reassembled PDU]  tcp.stream == 10
379  14.526889 216.165.108.217 -> 60.28.14.148 TCP 66 55352 > http [ACK] Seq=388 Ack=1745 Win=18688 Len=0 TSval=42875666 TSecr=1289167147  tcp.stream == 10
380  14.540456 60.28.14.148 -> 216.165.108.217 TCP 66 http > 55354 [ACK] Seq=1 Ack=386 Win=6784 Len=0 TSval=2002253865 TSecr=42875600  tcp.stream == 12
381  14.540744 60.28.14.148 -> 216.165.108.217 TCP 380 [TCP segment of a reassembled PDU]  tcp.stream == 12
382  14.540758 216.165.108.217 -> 60.28.14.148 TCP 66 55354 > http [ACK] Seq=386 Ack=315 Win=15744 Len=0 TSval=42875669 TSecr=2002253865  tcp.stream == 12
383  14.540768 60.28.14.148 -> 216.165.108.217 HTTP 530 HTTP/1.1 200 OK  (PNG)[Malformed Packet]  tcp.stream == 12
384  14.541057 60.28.14.148 -> 216.165.108.217 TCP 66 http > 55353 [ACK] Seq=1 Ack=388 Win=6784 Len=0 TSval=2002064821 TSecr=42875600  tcp.stream == 11
385  14.541075 60.28.14.148 -> 216.165.108.217 TCP 382 [TCP segment of a reassembled PDU]  tcp.stream == 11
386  14.541087 216.165.108.217 -> 60.28.14.148 TCP 66 55353 > http [ACK] Seq=388 Ack=317 Win=15744 Len=0 TSval=42875669 TSecr=2002064821  tcp.stream == 11
387  14.541594 60.28.14.148 -> 216.165.108.217 TCP 1494 [TCP segment of a reassembled PDU]  tcp.stream == 11
388  14.541618 216.165.108.217 -> 60.28.14.148 TCP 66 55353 > http [ACK] Seq=388 Ack=1745 Win=18688 Len=0 TSval=42875670 TSecr=2002064821  tcp.stream == 11
389  14.548226 216.165.108.217 -> 60.28.14.148 TCP 66 55351 > http [FIN, ACK] Seq=383 Ack=2472 Win=21504 Len=0 TSval=42875671 TSecr=1289167146  tcp.stream == 9
390  14.549023 216.165.108.217 -> 60.28.14.148 TCP 74 55371 > http [SYN] Seq=0 Win=14600 Len=0 MSS=1460 SACK_PERM=1 TSval=42875671 TSecr=0 WS=128  tcp.stream == 29
391  14.571028 60.28.14.148 -> 216.165.108.217 TCP 74 http > 55360 [SYN, ACK] Seq=0 Ack=1 Win=5712 Len=0 MSS=1440 SACK_PERM=1 TSval=2001986889 TSecr=42875607 WS=32  tcp.stream == 18
392  14.571065 216.165.108.217 -> 60.28.14.148 TCP 66 55360 > http [ACK] Seq=1 Ack=1 Win=14720 Len=0 TSval=42875677 TSecr=2001986889  tcp.stream == 18
393  14.577357 216.165.108.217 -> 60.28.14.148 TCP 66 55354 > http [ACK] Seq=386 Ack=780 Win=16768 Len=0 TSval=42875679 TSecr=2002253865  tcp.stream == 12
395  14.588196 216.165.108.217 -> 60.28.14.148 TCP 66 55354 > http [FIN, ACK] Seq=386 Ack=780 Win=16768 Len=0 TSval=42875681 TSecr=2002253865  tcp.stream == 12
396  14.597339 60.28.14.148 -> 216.165.108.217 TCP 66 http > 55355 [ACK] Seq=1 Ack=374 Win=6784 Len=0 TSval=2002253879 TSecr=42875614  tcp.stream == 13
397  14.597370 60.28.14.148 -> 216.165.108.217 TCP 380 [TCP segment of a reassembled PDU]  tcp.stream == 13
