 73   9.289193 216.165.108.217 -> 192.150.16.117 TCP 74 48235 > http [SYN] Seq=0 Win=14600 Len=0 MSS=1460 SACK_PERM=1 TSval=44440494 TSecr=0 WS=128  tcp.stream == 0
 75   9.334215 192.150.16.117 -> 216.165.108.217 TCP 74 http > 48235 [SYN, ACK] Seq=0 Ack=1 Win=5792 Len=0 MSS=1460 SACK_PERM=1 TSval=470325830 TSecr=44440494 WS=128  tcp.stream == 0
 76   9.334238 216.165.108.217 -> 192.150.16.117 TCP 66 48235 > http [ACK] Seq=1 Ack=1 Win=14720 Len=0 TSval=44440505 TSecr=470325830  tcp.stream == 0
 77   9.338431 216.165.108.217 -> 192.150.16.117 HTTP 461 GET / HTTP/1.1   tcp.stream == 0
 78   9.386685 192.150.16.117 -> 216.165.108.217 TCP 66 http > 48235 [ACK] Seq=1 Ack=396 Win=6912 Len=0 TSval=470325883 TSecr=44440506  tcp.stream == 0
 79   9.388362 192.150.16.117 -> 216.165.108.217 HTTP 537 HTTP/1.1 301 Moved Permanently  (text/html)  tcp.stream == 0
 80   9.388381 216.165.108.217 -> 192.150.16.117 TCP 66 48235 > http [ACK] Seq=396 Ack=472 Win=15744 Len=0 TSval=44440519 TSecr=470325884  tcp.stream == 0
 81   9.399160 216.165.108.217 -> 192.150.16.117 TCP 66 48235 > http [FIN, ACK] Seq=396 Ack=472 Win=15744 Len=0 TSval=44440521 TSecr=470325884  tcp.stream == 0
 83   9.444397 192.150.16.117 -> 216.165.108.217 TCP 66 http > 48235 [FIN, ACK] Seq=472 Ack=397 Win=6912 Len=0 TSval=470325941 TSecr=44440521  tcp.stream == 0
 84   9.444421 216.165.108.217 -> 192.150.16.117 TCP 66 48235 > http [ACK] Seq=397 Ack=473 Win=15744 Len=0 TSval=44440533 TSecr=470325941  tcp.stream == 0
 86   9.485986 216.165.108.217 -> 192.150.16.64 TCP 74 60981 > http [SYN] Seq=0 Win=14600 Len=0 MSS=1460 SACK_PERM=1 TSval=44440543 TSecr=0 WS=128  tcp.stream == 1
 89   9.530377 192.150.16.64 -> 216.165.108.217 TCP 78 http > 60981 [SYN, ACK] Seq=0 Ack=1 Win=4380 Len=0 MSS=1460 WS=2 TSval=2269202554 TSecr=44440543 SACK_PERM=1  tcp.stream == 1
 90   9.530408 216.165.108.217 -> 192.150.16.64 TCP 66 60981 > http [ACK] Seq=1 Ack=1 Win=14720 Len=0 TSval=44440554 TSecr=2269202554  tcp.stream == 1
 91   9.532664 216.165.108.217 -> 192.150.16.64 HTTP 465 GET / HTTP/1.1   tcp.stream == 1
 94   9.676859 192.150.16.64 -> 216.165.108.217 TCP 66 http > 60981 [ACK] Seq=1 Ack=400 Win=4778 Len=0 TSval=2269202701 TSecr=44440555  tcp.stream == 1
 96   9.702056 192.150.16.64 -> 216.165.108.217 TCP 374 [TCP segment of a reassembled PDU]  tcp.stream == 1
 97   9.702076 216.165.108.217 -> 192.150.16.64 TCP 66 60981 > http [ACK] Seq=400 Ack=309 Win=15744 Len=0 TSval=44440597 TSecr=2269202726  tcp.stream == 1
 98   9.702209 192.150.16.64 -> 216.165.108.217 TCP 1514 [TCP segment of a reassembled PDU]  tcp.stream == 1
 99   9.702216 216.165.108.217 -> 192.150.16.64 TCP 66 60981 > http [ACK] Seq=400 Ack=1757 Win=18688 Len=0 TSval=44440597 TSecr=2269202726  tcp.stream == 1
100   9.702331 192.150.16.64 -> 216.165.108.217 TCP 1514 [TCP segment of a reassembled PDU]  tcp.stream == 1
101   9.702337 216.165.108.217 -> 192.150.16.64 TCP 66 60981 > http [ACK] Seq=400 Ack=3205 Win=21504 Len=0 TSval=44440597 TSecr=2269202726  tcp.stream == 1
102   9.746496 192.150.16.64 -> 216.165.108.217 TCP 1514 [TCP segment of a reassembled PDU]  tcp.stream == 1
103   9.746518 216.165.108.217 -> 192.150.16.64 TCP 66 60981 > http [ACK] Seq=400 Ack=4653 Win=24448 Len=0 TSval=44440608 TSecr=2269202770  tcp.stream == 1
104   9.746618 192.150.16.64 -> 216.165.108.217 TCP 1514 [TCP segment of a reassembled PDU]  tcp.stream == 1
105   9.746623 216.165.108.217 -> 192.150.16.64 TCP 66 60981 > http [ACK] Seq=400 Ack=6101 Win=27264 Len=0 TSval=44440608 TSecr=2269202770  tcp.stream == 1
106   9.746725 192.150.16.64 -> 216.165.108.217 TCP 1514 [TCP segment of a reassembled PDU]  tcp.stream == 1
107   9.746731 216.165.108.217 -> 192.150.16.64 TCP 66 60981 > http [ACK] Seq=400 Ack=7549 Win=30208 Len=0 TSval=44440608 TSecr=2269202770  tcp.stream == 1
108   9.746850 192.150.16.64 -> 216.165.108.217 TCP 1514 [TCP segment of a reassembled PDU]  tcp.stream == 1
109   9.746859 216.165.108.217 -> 192.150.16.64 TCP 66 60981 > http [ACK] Seq=400 Ack=8997 Win=33152 Len=0 TSval=44440608 TSecr=2269202770  tcp.stream == 1
110   9.746973 192.150.16.64 -> 216.165.108.217 TCP 1514 [TCP segment of a reassembled PDU]  tcp.stream == 1
111   9.746979 216.165.108.217 -> 192.150.16.64 TCP 66 60981 > http [ACK] Seq=400 Ack=10445 Win=35968 Len=0 TSval=44440608 TSecr=2269202770  tcp.stream == 1
112   9.790999 192.150.16.64 -> 216.165.108.217 HTTP 2014 HTTP/1.1 200 OK  (text/html)  tcp.stream == 1
113   9.791022 216.165.108.217 -> 192.150.16.64 TCP 66 60981 > http [ACK] Seq=400 Ack=12393 Win=38912 Len=0 TSval=44440619 TSecr=2269202814  tcp.stream == 1
114   9.791027 192.150.16.64 -> 216.165.108.217 TCP 66 http > 60981 [FIN, ACK] Seq=12393 Ack=400 Win=4778 Len=0 TSval=2269202814 TSecr=44440608  tcp.stream == 1
115   9.795608 216.165.108.217 -> 192.150.16.64 TCP 66 60981 > http [FIN, ACK] Seq=400 Ack=12394 Win=38912 Len=0 TSval=44440620 TSecr=2269202814  tcp.stream == 1
116   9.839883 192.150.16.64 -> 216.165.108.217 TCP 66 http > 60981 [ACK] Seq=12394 Ack=401 Win=4778 Len=0 TSval=2269202863 TSecr=44440620  tcp.stream == 1
119  10.206758 216.165.108.217 -> 192.150.16.64 TCP 74 60982 > http [SYN] Seq=0 Win=14600 Len=0 MSS=1460 SACK_PERM=1 TSval=44440723 TSecr=0 WS=128  tcp.stream == 2
121  10.253359 192.150.16.64 -> 216.165.108.217 TCP 78 http > 60982 [SYN, ACK] Seq=0 Ack=1 Win=4380 Len=0 MSS=1460 WS=2 TSval=2269203275 TSecr=44440723 SACK_PERM=1  tcp.stream == 2
122  10.253383 216.165.108.217 -> 192.150.16.64 TCP 66 60982 > http [ACK] Seq=1 Ack=1 Win=14720 Len=0 TSval=44440735 TSecr=2269203275  tcp.stream == 2
124  10.271540 216.165.108.217 -> 192.150.16.64 TCP 74 60983 > http [SYN] Seq=0 Win=14600 Len=0 MSS=1460 SACK_PERM=1 TSval=44440739 TSecr=0 WS=128  tcp.stream == 3
125  10.281325 216.165.108.217 -> 192.150.16.64 HTTP 524 GET /homepage/include/style/homepage-120911-touch-challenger3-light-short.css HTTP/1.1   tcp.stream == 2
126  10.305546 216.165.108.217 -> 192.150.16.64 TCP 74 60984 > http [SYN] Seq=0 Win=14600 Len=0 MSS=1460 SACK_PERM=1 TSval=44440748 TSecr=0 WS=128  tcp.stream == 4
127  10.318959 192.150.16.64 -> 216.165.108.217 TCP 78 http > 60983 [SYN, ACK] Seq=0 Ack=1 Win=4380 Len=0 MSS=1460 WS=2 TSval=2269203340 TSecr=44440739 SACK_PERM=1  tcp.stream == 3
128  10.318988 216.165.108.217 -> 192.150.16.64 TCP 66 60983 > http [ACK] Seq=1 Ack=1 Win=14720 Len=0 TSval=44440751 TSecr=2269203340  tcp.stream == 3
129  10.323587 216.165.108.217 -> 192.150.16.64 HTTP 488 GET /etc/pagetables/reflowtypes/adobe.css HTTP/1.1   tcp.stream == 3
130  10.350126 192.150.16.64 -> 216.165.108.217 TCP 78 http > 60984 [SYN, ACK] Seq=0 Ack=1 Win=4380 Len=0 MSS=1460 WS=2 TSval=2269203373 TSecr=44440748 SACK_PERM=1  tcp.stream == 4
131  10.350150 216.165.108.217 -> 192.150.16.64 TCP 66 60984 > http [ACK] Seq=1 Ack=1 Win=14720 Len=0 TSval=44440759 TSecr=2269203373  tcp.stream == 4
132  10.353290 216.165.108.217 -> 192.150.16.64 HTTP 461 GET /uber/js/omniture/mbox.js HTTP/1.1   tcp.stream == 4
134  10.366233 216.165.108.217 -> 72.247.238.35 TCP 74 34581 > http [SYN] Seq=0 Win=14600 Len=0 MSS=1460 SACK_PERM=1 TSval=44440763 TSecr=0 WS=128  tcp.stream == 5
135  10.366720 216.165.108.217 -> 72.247.238.35 TCP 74 34582 > http [SYN] Seq=0 Win=14600 Len=0 MSS=1460 SACK_PERM=1 TSval=44440763 TSecr=0 WS=128  tcp.stream == 6
136  10.367176 216.165.108.217 -> 72.247.238.35 TCP 74 34583 > http [SYN] Seq=0 Win=14600 Len=0 MSS=1460 SACK_PERM=1 TSval=44440763 TSecr=0 WS=128  tcp.stream == 7
137  10.367589 216.165.108.217 -> 72.247.238.35 TCP 74 34584 > http [SYN] Seq=0 Win=14600 Len=0 MSS=1460 SACK_PERM=1 TSval=44440763 TSecr=0 WS=128  tcp.stream == 8
138  10.367997 216.165.108.217 -> 72.247.238.35 TCP 74 34585 > http [SYN] Seq=0 Win=14600 Len=0 MSS=1460 SACK_PERM=1 TSval=44440764 TSecr=0 WS=128  tcp.stream == 9
139  10.368363 216.165.108.217 -> 72.247.238.35 TCP 74 34586 > http [SYN] Seq=0 Win=14600 Len=0 MSS=1460 SACK_PERM=1 TSval=44440764 TSecr=0 WS=128  tcp.stream == 10
140  10.370888 192.150.16.64 -> 216.165.108.217 HTTP 422 HTTP/1.1 200 OK  (text/css)  tcp.stream == 3
141  10.370920 216.165.108.217 -> 192.150.16.64 TCP 66 60983 > http [ACK] Seq=423 Ack=357 Win=15744 Len=0 TSval=44440764 TSecr=2269203392  tcp.stream == 3
142  10.386360 216.165.108.217 -> 192.150.16.64 TCP 66 60983 > http [FIN, ACK] Seq=423 Ack=357 Win=15744 Len=0 TSval=44440768 TSecr=2269203392  tcp.stream == 3
143  10.406106 192.150.16.64 -> 216.165.108.217 TCP 358 [TCP segment of a reassembled PDU]  tcp.stream == 2
144  10.406127 216.165.108.217 -> 192.150.16.64 TCP 66 60982 > http [ACK] Seq=459 Ack=293 Win=15744 Len=0 TSval=44440773 TSecr=2269203427  tcp.stream == 2
145  10.406258 192.150.16.64 -> 216.165.108.217 TCP 1514 [TCP segment of a reassembled PDU]  tcp.stream == 2
146  10.406263 216.165.108.217 -> 192.150.16.64 TCP 66 60982 > http [ACK] Seq=459 Ack=1741 Win=18688 Len=0 TSval=44440773 TSecr=2269203427  tcp.stream == 2
147  10.406381 192.150.16.64 -> 216.165.108.217 TCP 1514 [TCP segment of a reassembled PDU]  tcp.stream == 2
148  10.406386 216.165.108.217 -> 192.150.16.64 TCP 66 60982 > http [ACK] Seq=459 Ack=3189 Win=21504 Len=0 TSval=44440773 TSecr=2269203427  tcp.stream == 2
149  10.411417 192.150.16.64 -> 216.165.108.217 TCP 375 [TCP segment of a reassembled PDU]  tcp.stream == 4
150  10.411442 216.165.108.217 -> 192.150.16.64 TCP 66 60984 > http [ACK] Seq=396 Ack=310 Win=15744 Len=0 TSval=44440774 TSecr=2269203435  tcp.stream == 4
151  10.411612 192.150.16.64 -> 216.165.108.217 TCP 1514 [TCP segment of a reassembled PDU]  tcp.stream == 4
152  10.411616 216.165.108.217 -> 192.150.16.64 TCP 66 60984 > http [ACK] Seq=396 Ack=1758 Win=18688 Len=0 TSval=44440774 TSecr=2269203435  tcp.stream == 4
153  10.411734 192.150.16.64 -> 216.165.108.217 TCP 1514 [TCP segment of a reassembled PDU]  tcp.stream == 4
154  10.411739 216.165.108.217 -> 192.150.16.64 TCP 66 60984 > http [ACK] Seq=396 Ack=3206 Win=21504 Len=0 TSval=44440774 TSecr=2269203435  tcp.stream == 4
155  10.433059 192.150.16.64 -> 216.165.108.217 TCP 66 http > 60983 [ACK] Seq=357 Ack=424 Win=4802 Len=0 TSval=2269203455 TSecr=44440768  tcp.stream == 3
156  10.433078 192.150.16.64 -> 216.165.108.217 TCP 66 http > 60983 [FIN, ACK] Seq=357 Ack=424 Win=4802 Len=0 TSval=2269203455 TSecr=44440768  tcp.stream == 3
157  10.433086 216.165.108.217 -> 192.150.16.64 TCP 66 60983 > http [ACK] Seq=424 Ack=358 Win=15744 Len=0 TSval=44440780 TSecr=2269203455  tcp.stream == 3
159  10.452562 192.150.16.64 -> 216.165.108.217 TCP 1514 [TCP segment of a reassembled PDU]  tcp.stream == 2
160  10.452583 216.165.108.217 -> 192.150.16.64 TCP 66 60982 > http [ACK] Seq=459 Ack=4637 Win=24448 Len=0 TSval=44440785 TSecr=2269203474  tcp.stream == 2
161  10.452767 192.150.16.64 -> 216.165.108.217 TCP 1514 [TCP segment of a reassembled PDU]  tcp.stream == 2
162  10.452775 216.165.108.217 -> 192.150.16.64 TCP 66 60982 > http [ACK] Seq=459 Ack=6085 Win=27264 Len=0 TSval=44440785 TSecr=2269203474  tcp.stream == 2
163  10.452887 192.150.16.64 -> 216.165.108.217 TCP 1514 [TCP segment of a reassembled PDU]  tcp.stream == 2
164  10.452894 216.165.108.217 -> 192.150.16.64 TCP 66 60982 > http [ACK] Seq=459 Ack=7533 Win=30208 Len=0 TSval=44440785 TSecr=2269203474  tcp.stream == 2
165  10.453012 192.150.16.64 -> 216.165.108.217 TCP 1514 [TCP segment of a reassembled PDU]  tcp.stream == 2
166  10.453020 216.165.108.217 -> 192.150.16.64 TCP 66 60982 > http [ACK] Seq=459 Ack=8981 Win=33152 Len=0 TSval=44440785 TSecr=2269203474  tcp.stream == 2
167  10.453134 192.150.16.64 -> 216.165.108.217 TCP 1514 [TCP segment of a reassembled PDU]  tcp.stream == 2
168  10.453143 216.165.108.217 -> 192.150.16.64 TCP 66 60982 > http [ACK] Seq=459 Ack=10429 Win=35968 Len=0 TSval=44440785 TSecr=2269203474  tcp.stream == 2
169  10.455800 192.150.16.64 -> 216.165.108.217 TCP 1514 [TCP segment of a reassembled PDU]  tcp.stream == 4
170  10.455822 216.165.108.217 -> 192.150.16.64 TCP 66 60984 > http [ACK] Seq=396 Ack=4654 Win=24448 Len=0 TSval=44440785 TSecr=2269203479  tcp.stream == 4
171  10.455998 192.150.16.64 -> 216.165.108.217 TCP 1514 [TCP segment of a reassembled PDU]  tcp.stream == 4
172  10.456006 216.165.108.217 -> 192.150.16.64 TCP 66 60984 > http [ACK] Seq=396 Ack=6102 Win=27264 Len=0 TSval=44440786 TSecr=2269203479  tcp.stream == 4
173  10.456119 192.150.16.64 -> 216.165.108.217 TCP 1514 [TCP segment of a reassembled PDU]  tcp.stream == 4
174  10.456127 216.165.108.217 -> 192.150.16.64 TCP 66 60984 > http [ACK] Seq=396 Ack=7550 Win=30208 Len=0 TSval=44440786 TSecr=2269203479  tcp.stream == 4
175  10.456259 192.150.16.64 -> 216.165.108.217 HTTP 1712 HTTP/1.1 200 OK  (application/x-javascript)  tcp.stream == 4
176  10.456266 216.165.108.217 -> 192.150.16.64 TCP 66 60984 > http [ACK] Seq=396 Ack=9196 Win=33152 Len=0 TSval=44440786 TSecr=2269203479  tcp.stream == 4
177  10.456269 192.150.16.64 -> 216.165.108.217 TCP 66 http > 60984 [FIN, ACK] Seq=9196 Ack=396 Win=4774 Len=0 TSval=2269203479 TSecr=44440774  tcp.stream == 4
178  10.460274 72.247.238.35 -> 216.165.108.217 TCP 74 http > 34581 [SYN, ACK] Seq=0 Ack=1 Win=14480 Len=0 MSS=1460 SACK_PERM=1 TSval=2360170574 TSecr=44440763 WS=4  tcp.stream == 5
179  10.460301 216.165.108.217 -> 72.247.238.35 TCP 66 34581 > http [ACK] Seq=1 Ack=1 Win=14720 Len=0 TSval=44440787 TSecr=2360170574  tcp.stream == 5
180  10.461079 72.247.238.35 -> 216.165.108.217 TCP 74 http > 34582 [SYN, ACK] Seq=0 Ack=1 Win=14480 Len=0 MSS=1460 SACK_PERM=1 TSval=2360170574 TSecr=44440763 WS=4  tcp.stream == 6
181  10.461100 216.165.108.217 -> 72.247.238.35 TCP 66 34582 > http [ACK] Seq=1 Ack=1 Win=14720 Len=0 TSval=44440787 TSecr=2360170574  tcp.stream == 6
182  10.461508 72.247.238.35 -> 216.165.108.217 TCP 74 http > 34583 [SYN, ACK] Seq=0 Ack=1 Win=14480 Len=0 MSS=1460 SACK_PERM=1 TSval=2360170575 TSecr=44440763 WS=4  tcp.stream == 7
183  10.461518 216.165.108.217 -> 72.247.238.35 TCP 66 34583 > http [ACK] Seq=1 Ack=1 Win=14720 Len=0 TSval=44440787 TSecr=2360170575  tcp.stream == 7
184  10.462192 72.247.238.35 -> 216.165.108.217 TCP 74 http > 34584 [SYN, ACK] Seq=0 Ack=1 Win=14480 Len=0 MSS=1460 SACK_PERM=1 TSval=2360170575 TSecr=44440763 WS=4  tcp.stream == 8
185  10.462213 216.165.108.217 -> 72.247.238.35 TCP 66 34584 > http [ACK] Seq=1 Ack=1 Win=14720 Len=0 TSval=44440787 TSecr=2360170575  tcp.stream == 8
186  10.462476 72.247.238.35 -> 216.165.108.217 TCP 74 http > 34585 [SYN, ACK] Seq=0 Ack=1 Win=14480 Len=0 MSS=1460 SACK_PERM=1 TSval=2360170576 TSecr=44440764 WS=4  tcp.stream == 9
187  10.462486 216.165.108.217 -> 72.247.238.35 TCP 66 34585 > http [ACK] Seq=1 Ack=1 Win=14720 Len=0 TSval=44440787 TSecr=2360170576  tcp.stream == 9
188  10.463140 72.247.238.35 -> 216.165.108.217 TCP 74 http > 34586 [SYN, ACK] Seq=0 Ack=1 Win=14480 Len=0 MSS=1460 SACK_PERM=1 TSval=2360170576 TSecr=44440764 WS=4  tcp.stream == 10
189  10.463158 216.165.108.217 -> 72.247.238.35 TCP 66 34586 > http [ACK] Seq=1 Ack=1 Win=14720 Len=0 TSval=44440787 TSecr=2360170576  tcp.stream == 10
190  10.495840 216.165.108.217 -> 192.150.16.64 TCP 66 60984 > http [ACK] Seq=396 Ack=9197 Win=33152 Len=0 TSval=44440796 TSecr=2269203479  tcp.stream == 4
191  10.499181 192.150.16.64 -> 216.165.108.217 TCP 1514 [TCP segment of a reassembled PDU]  tcp.stream == 2
192  10.499201 216.165.108.217 -> 192.150.16.64 TCP 66 60982 > http [ACK] Seq=459 Ack=11877 Win=38912 Len=0 TSval=44440796 TSecr=2269203520  tcp.stream == 2
193  10.499299 192.150.16.64 -> 216.165.108.217 TCP 1514 [TCP segment of a reassembled PDU]  tcp.stream == 2
194  10.499303 216.165.108.217 -> 192.150.16.64 TCP 66 60982 > http [ACK] Seq=459 Ack=13325 Win=41856 Len=0 TSval=44440796 TSecr=2269203520  tcp.stream == 2
195  10.499430 192.150.16.64 -> 216.165.108.217 TCP 1557 [TCP segment of a reassembled PDU]  tcp.stream == 2
196  10.499436 216.165.108.217 -> 192.150.16.64 TCP 66 60982 > http [ACK] Seq=459 Ack=14816 Win=44672 Len=0 TSval=44440796 TSecr=2269203520  tcp.stream == 2
197  10.499562 192.150.16.64 -> 216.165.108.217 TCP 1514 [TCP segment of a reassembled PDU]  tcp.stream == 2
198  10.499569 216.165.108.217 -> 192.150.16.64 TCP 66 60982 > http [ACK] Seq=459 Ack=16264 Win=47616 Len=0 TSval=44440796 TSecr=2269203521  tcp.stream == 2
199  10.499684 192.150.16.64 -> 216.165.108.217 TCP 1514 [TCP segment of a reassembled PDU]  tcp.stream == 2
200  10.499690 216.165.108.217 -> 192.150.16.64 TCP 66 60982 > http [ACK] Seq=459 Ack=17712 Win=50432 Len=0 TSval=44440796 TSecr=2269203521  tcp.stream == 2
201  10.499808 192.150.16.64 -> 216.165.108.217 TCP 1514 [TCP segment of a reassembled PDU]  tcp.stream == 2
202  10.499813 216.165.108.217 -> 192.150.16.64 TCP 66 60982 > http [ACK] Seq=459 Ack=19160 Win=53376 Len=0 TSval=44440796 TSecr=2269203521  tcp.stream == 2
203  10.499931 192.150.16.64 -> 216.165.108.217 TCP 1514 [TCP segment of a reassembled PDU]  tcp.stream == 2
204  10.499938 216.165.108.217 -> 192.150.16.64 TCP 66 60982 > http [ACK] Seq=459 Ack=20608 Win=55936 Len=0 TSval=44440797 TSecr=2269203521  tcp.stream == 2
205  10.500039 192.150.16.64 -> 216.165.108.217 HTTP 1260 HTTP/1.1 200 OK  (text/css)  tcp.stream == 2
206  10.500044 216.165.108.217 -> 192.150.16.64 TCP 66 60982 > http [ACK] Seq=459 Ack=21802 Win=54784 Len=0 TSval=44440797 TSecr=2269203521  tcp.stream == 2
207  10.500048 192.150.16.64 -> 216.165.108.217 TCP 66 http > 60982 [FIN, ACK] Seq=21802 Ack=459 Win=4838 Len=0 TSval=2269203521 TSecr=44440785  tcp.stream == 2
208  10.525726 216.165.108.217 -> 192.150.16.64 TCP 66 60984 > http [FIN, ACK] Seq=396 Ack=9197 Win=33152 Len=0 TSval=44440803 TSecr=2269203479  tcp.stream == 4
209  10.529132 216.165.108.217 -> 192.150.16.64 TCP 74 60991 > http [SYN] Seq=0 Win=14600 Len=0 MSS=1460 SACK_PERM=1 TSval=44440804 TSecr=0 WS=128  tcp.stream == 11
210  10.539839 216.165.108.217 -> 192.150.16.64 TCP 66 60982 > http [ACK] Seq=459 Ack=21803 Win=56320 Len=0 TSval=44440807 TSecr=2269203521  tcp.stream == 2
211  10.547292 216.165.108.217 -> 192.150.16.64 TCP 66 60982 > http [FIN, ACK] Seq=459 Ack=21803 Win=56320 Len=0 TSval=44440808 TSecr=2269203521  tcp.stream == 2
212  10.566615 216.165.108.217 -> 72.247.238.35 HTTP 500 GET /www.adobe.com/include/style/compressed.css HTTP/1.1   tcp.stream == 7
213  10.569895 192.150.16.64 -> 216.165.108.217 TCP 66 http > 60984 [ACK] Seq=9197 Ack=397 Win=4774 Len=0 TSval=2269203593 TSecr=44440803  tcp.stream == 4
214  10.574272 192.150.16.64 -> 216.165.108.217 TCP 78 http > 60991 [SYN, ACK] Seq=0 Ack=1 Win=4380 Len=0 MSS=1460 WS=2 TSval=2269203597 TSecr=44440804 SACK_PERM=1  tcp.stream == 11
215  10.574299 216.165.108.217 -> 192.150.16.64 TCP 66 60991 > http [ACK] Seq=1 Ack=1 Win=14720 Len=0 TSval=44440815 TSecr=2269203597  tcp.stream == 11
216  10.585390 216.165.108.217 -> 72.247.238.35 HTTP 515 GET /www.adobe.com/homepage/include/style/default/Mnemonic.css HTTP/1.1   tcp.stream == 6
217  10.586480 216.165.108.217 -> 72.247.238.35 HTTP 514 GET /www.adobe.com/homepage/include/style/grid/LayoutGrid.css HTTP/1.1   tcp.stream == 5
218  10.587433 216.165.108.217 -> 72.247.238.35 HTTP 515 GET /www.adobe.com/homepage/include/style/grid/ThreeColumn.css HTTP/1.1   tcp.stream == 10
219  10.588392 216.165.108.217 -> 72.247.238.35 HTTP 509 GET /www.adobe.com/include/style/default/SearchBuddy.css HTTP/1.1   tcp.stream == 9
220  10.589338 216.165.108.217 -> 72.247.238.35 HTTP 523 GET /www.adobe.com/include/style/theme/adobe-light/jquery-ui-1.8.1.css HTTP/1.1   tcp.stream == 8
221  10.591061 216.165.108.217 -> 192.150.16.64 HTTP 492 GET /include/style/grid-narrow-compressed.css HTTP/1.1   tcp.stream == 11
222  10.593487 192.150.16.64 -> 216.165.108.217 TCP 66 http > 60982 [ACK] Seq=21803 Ack=460 Win=4838 Len=0 TSval=2269203615 TSecr=44440808  tcp.stream == 2
224  10.636101 192.150.16.64 -> 216.165.108.217 HTTP 1274 HTTP/1.1 200 OK  (text/css)  tcp.stream == 11
225  10.636124 216.165.108.217 -> 192.150.16.64 TCP 66 60991 > http [ACK] Seq=427 Ack=1209 Win=17024 Len=0 TSval=44440831 TSecr=2269203659  tcp.stream == 11
226  10.645766 216.165.108.217 -> 192.150.16.64 TCP 66 60991 > http [FIN, ACK] Seq=427 Ack=1209 Win=17024 Len=0 TSval=44440833 TSecr=2269203659  tcp.stream == 11
227  10.659531 72.247.238.35 -> 216.165.108.217 TCP 66 http > 34583 [ACK] Seq=1 Ack=435 Win=15552 Len=0 TSval=2360170774 TSecr=44440813  tcp.stream == 7
228  10.660476 72.247.238.35 -> 216.165.108.217 TCP 1514 [TCP segment of a reassembled PDU]  tcp.stream == 7
229  10.660496 216.165.108.217 -> 72.247.238.35 TCP 66 34583 > http [ACK] Seq=435 Ack=1449 Win=17536 Len=0 TSval=44440837 TSecr=2360170775  tcp.stream == 7
230  10.660596 72.247.238.35 -> 216.165.108.217 TCP 1514 [TCP segment of a reassembled PDU]  tcp.stream == 7
231  10.660601 216.165.108.217 -> 72.247.238.35 TCP 66 34583 > http [ACK] Seq=435 Ack=2897 Win=20480 Len=0 TSval=44440837 TSecr=2360170775  tcp.stream == 7
232  10.660717 72.247.238.35 -> 216.165.108.217 TCP 1514 [TCP segment of a reassembled PDU]  tcp.stream == 7
233  10.660723 216.165.108.217 -> 72.247.238.35 TCP 66 34583 > http [ACK] Seq=435 Ack=4345 Win=23296 Len=0 TSval=44440837 TSecr=2360170775  tcp.stream == 7
234  10.660848 72.247.238.35 -> 216.165.108.217 TCP 1514 [TCP segment of a reassembled PDU]  tcp.stream == 7
235  10.660855 216.165.108.217 -> 72.247.238.35 TCP 66 34583 > http [ACK] Seq=435 Ack=5793 Win=26240 Len=0 TSval=44440837 TSecr=2360170775  tcp.stream == 7
236  10.676283 72.247.238.35 -> 216.165.108.217 TCP 66 http > 34582 [ACK] Seq=1 Ack=450 Win=15552 Len=0 TSval=2360170793 TSecr=44440818  tcp.stream == 6
237  10.676686 72.247.238.35 -> 216.165.108.217 HTTP 1664 HTTP/1.1 200 OK  (text/css)  tcp.stream == 6
238  10.676703 216.165.108.217 -> 72.247.238.35 TCP 66 34582 > http [ACK] Seq=450 Ack=1599 Win=17536 Len=0 TSval=44440841 TSecr=2360170793  tcp.stream == 6
239  10.677620 72.247.238.35 -> 216.165.108.217 TCP 66 http > 34581 [ACK] Seq=1 Ack=449 Win=15552 Len=0 TSval=2360170794 TSecr=44440818  tcp.stream == 5
240  10.678022 72.247.238.35 -> 216.165.108.217 HTTP 969 HTTP/1.1 200 OK  (text/css)  tcp.stream == 5
241  10.678040 216.165.108.217 -> 72.247.238.35 TCP 66 34581 > http [ACK] Seq=449 Ack=904 Win=16512 Len=0 TSval=44440841 TSecr=2360170794  tcp.stream == 5
242  10.678156 72.247.238.35 -> 216.165.108.217 TCP 66 http > 34586 [ACK] Seq=1 Ack=450 Win=15552 Len=0 TSval=2360170795 TSecr=44440818  tcp.stream == 10
243  10.678726 72.247.238.35 -> 216.165.108.217 HTTP 652 HTTP/1.1 200 OK  (text/css)  tcp.stream == 10
244  10.678746 216.165.108.217 -> 72.247.238.35 TCP 66 34586 > http [ACK] Seq=450 Ack=587 Win=15872 Len=0 TSval=44440841 TSecr=2360170796  tcp.stream == 10
245  10.679085 72.247.238.35 -> 216.165.108.217 TCP 66 http > 34585 [ACK] Seq=1 Ack=444 Win=15552 Len=0 TSval=2360170796 TSecr=44440819  tcp.stream == 9
246  10.679673 72.247.238.35 -> 216.165.108.217 HTTP 1192 HTTP/1.1 200 OK  (text/css)  tcp.stream == 9
247  10.679692 216.165.108.217 -> 72.247.238.35 TCP 66 34585 > http [ACK] Seq=444 Ack=1127 Win=16896 Len=0 TSval=44440841 TSecr=2360170796  tcp.stream == 9
248  10.680015 72.247.238.35 -> 216.165.108.217 TCP 66 http > 34584 [ACK] Seq=1 Ack=458 Win=15552 Len=0 TSval=2360170797 TSecr=44440819  tcp.stream == 8
249  10.680845 72.247.238.35 -> 216.165.108.217 TCP 1514 [TCP segment of a reassembled PDU]  tcp.stream == 8
250  10.680864 216.165.108.217 -> 72.247.238.35 TCP 66 34584 > http [ACK] Seq=458 Ack=1449 Win=17536 Len=0 TSval=44440842 TSecr=2360170798  tcp.stream == 8
251  10.680964 72.247.238.35 -> 216.165.108.217 TCP 1514 [TCP segment of a reassembled PDU]  tcp.stream == 8
252  10.680969 216.165.108.217 -> 72.247.238.35 TCP 66 34584 > http [ACK] Seq=458 Ack=2897 Win=20480 Len=0 TSval=44440842 TSecr=2360170798  tcp.stream == 8
253  10.681086 72.247.238.35 -> 216.165.108.217 TCP 1514 [TCP segment of a reassembled PDU]  tcp.stream == 8
254  10.681093 216.165.108.217 -> 72.247.238.35 TCP 66 34584 > http [ACK] Seq=458 Ack=4345 Win=23296 Len=0 TSval=44440842 TSecr=2360170798  tcp.stream == 8
255  10.681208 72.247.238.35 -> 216.165.108.217 TCP 1514 [TCP segment of a reassembled PDU]  tcp.stream == 8
256  10.681214 216.165.108.217 -> 72.247.238.35 TCP 66 34584 > http [ACK] Seq=458 Ack=5793 Win=26240 Len=0 TSval=44440842 TSecr=2360170798  tcp.stream == 8
257  10.689919 216.165.108.217 -> 72.247.238.35 TCP 66 34582 > http [FIN, ACK] Seq=450 Ack=1599 Win=17536 Len=0 TSval=44440844 TSecr=2360170793  tcp.stream == 6
258  10.690688 192.150.16.64 -> 216.165.108.217 TCP 66 http > 60991 [ACK] Seq=1209 Ack=428 Win=4806 Len=0 TSval=2269203714 TSecr=44440833  tcp.stream == 11
259  10.690707 192.150.16.64 -> 216.165.108.217 TCP 66 http > 60991 [FIN, ACK] Seq=1209 Ack=428 Win=4806 Len=0 TSval=2269203714 TSecr=44440833  tcp.stream == 11
260  10.690715 216.165.108.217 -> 192.150.16.64 TCP 66 60991 > http [ACK] Seq=428 Ack=1210 Win=17024 Len=0 TSval=44440844 TSecr=2269203714  tcp.stream == 11
261  10.690857 216.165.108.217 -> 72.247.238.35 TCP 74 34588 > http [SYN] Seq=0 Win=14600 Len=0 MSS=1460 SACK_PERM=1 TSval=44440844 TSecr=0 WS=128  tcp.stream == 12
262  10.691883 216.165.108.217 -> 72.247.238.35 TCP 66 34581 > http [FIN, ACK] Seq=449 Ack=904 Win=16512 Len=0 TSval=44440845 TSecr=2360170794  tcp.stream == 5
263  10.692590 216.165.108.217 -> 72.247.238.35 TCP 74 34589 > http [SYN] Seq=0 Win=14600 Len=0 MSS=1460 SACK_PERM=1 TSval=44440845 TSecr=0 WS=128  tcp.stream == 13
264  10.732078 216.165.108.217 -> 72.247.238.35 TCP 66 34586 > http [FIN, ACK] Seq=450 Ack=587 Win=15872 Len=0 TSval=44440855 TSecr=2360170796  tcp.stream == 10
265  10.743219 216.165.108.217 -> 72.247.238.35 TCP 74 34590 > http [SYN] Seq=0 Win=14600 Len=0 MSS=1460 SACK_PERM=1 TSval=44440857 TSecr=0 WS=128  tcp.stream == 14
266  10.744264 216.165.108.217 -> 72.247.238.35 TCP 66 34585 > http [FIN, ACK] Seq=444 Ack=1127 Win=16896 Len=0 TSval=44440858 TSecr=2360170796  tcp.stream == 9
267  10.745053 216.165.108.217 -> 72.247.238.35 TCP 74 34591 > http [SYN] Seq=0 Win=14600 Len=0 MSS=1460 SACK_PERM=1 TSval=44440858 TSecr=0 WS=128  tcp.stream == 15
268  10.747747 72.247.238.35 -> 216.165.108.217 TCP 1514 [TCP segment of a reassembled PDU]  tcp.stream == 7
269  10.747766 216.165.108.217 -> 72.247.238.35 TCP 66 34583 > http [ACK] Seq=435 Ack=7241 Win=29184 Len=0 TSval=44440858 TSecr=2360170868  tcp.stream == 7
270  10.747942 72.247.238.35 -> 216.165.108.217 TCP 1514 [TCP segment of a reassembled PDU]  tcp.stream == 7
271  10.747949 216.165.108.217 -> 72.247.238.35 TCP 66 34583 > http [ACK] Seq=435 Ack=8689 Win=32000 Len=0 TSval=44440859 TSecr=2360170868  tcp.stream == 7
272  10.748066 72.247.238.35 -> 216.165.108.217 TCP 1514 [TCP segment of a reassembled PDU]  tcp.stream == 7
273  10.748074 216.165.108.217 -> 72.247.238.35 TCP 66 34583 > http [ACK] Seq=435 Ack=10137 Win=34944 Len=0 TSval=44440859 TSecr=2360170868  tcp.stream == 7
274  10.748188 72.247.238.35 -> 216.165.108.217 TCP 1514 [TCP segment of a reassembled PDU]  tcp.stream == 7
275  10.748194 216.165.108.217 -> 72.247.238.35 TCP 66 34583 > http [ACK] Seq=435 Ack=11585 Win=37888 Len=0 TSval=44440859 TSecr=2360170868  tcp.stream == 7
276  10.748310 72.247.238.35 -> 216.165.108.217 TCP 1514 [TCP segment of a reassembled PDU]  tcp.stream == 7
277  10.748316 216.165.108.217 -> 72.247.238.35 TCP 66 34583 > http [ACK] Seq=435 Ack=13033 Win=40704 Len=0 TSval=44440859 TSecr=2360170868  tcp.stream == 7
278  10.748434 72.247.238.35 -> 216.165.108.217 TCP 1514 [TCP segment of a reassembled PDU]  tcp.stream == 7
279  10.748440 216.165.108.217 -> 72.247.238.35 TCP 66 34583 > http [ACK] Seq=435 Ack=14481 Win=43648 Len=0 TSval=44440859 TSecr=2360170868  tcp.stream == 7
280  10.748564 72.247.238.35 -> 216.165.108.217 TCP 1514 [TCP segment of a reassembled PDU]  tcp.stream == 7
281  10.748570 216.165.108.217 -> 72.247.238.35 TCP 66 34583 > http [ACK] Seq=435 Ack=15929 Win=46464 Len=0 TSval=44440859 TSecr=2360170868  tcp.stream == 7
282  10.748687 72.247.238.35 -> 216.165.108.217 TCP 1514 [TCP segment of a reassembled PDU]  tcp.stream == 7
283  10.748692 216.165.108.217 -> 72.247.238.35 TCP 66 34583 > http [ACK] Seq=435 Ack=17377 Win=49408 Len=0 TSval=44440859 TSecr=2360170868  tcp.stream == 7
284  10.771867 72.247.238.35 -> 216.165.108.217 HTTP 969 HTTP/1.1 200 OK  (text/css)  tcp.stream == 8
285  10.771886 216.165.108.217 -> 72.247.238.35 TCP 66 34584 > http [ACK] Seq=458 Ack=6696 Win=29184 Len=0 TSval=44440865 TSecr=2360170888  tcp.stream == 8
286  10.779682 72.247.238.35 -> 216.165.108.217 TCP 66 http > 34582 [FIN, ACK] Seq=1599 Ack=451 Win=15552 Len=0 TSval=2360170898 TSecr=44440844  tcp.stream == 6
287  10.779704 216.165.108.217 -> 72.247.238.35 TCP 66 34582 > http [ACK] Seq=451 Ack=1600 Win=17536 Len=0 TSval=44440866 TSecr=2360170898  tcp.stream == 6
288  10.780679 72.247.238.35 -> 216.165.108.217 TCP 74 http > 34588 [SYN, ACK] Seq=0 Ack=1 Win=14480 Len=0 MSS=1460 SACK_PERM=1 TSval=2360170898 TSecr=44440844 WS=4  tcp.stream == 12
289  10.780705 216.165.108.217 -> 72.247.238.35 TCP 66 34588 > http [ACK] Seq=1 Ack=1 Win=14720 Len=0 TSval=44440867 TSecr=2360170898  tcp.stream == 12
290  10.781724 72.247.238.35 -> 216.165.108.217 TCP 66 http > 34581 [FIN, ACK] Seq=904 Ack=450 Win=15552 Len=0 TSval=2360170900 TSecr=44440845  tcp.stream == 5
291  10.781746 216.165.108.217 -> 72.247.238.35 TCP 66 34581 > http [ACK] Seq=450 Ack=905 Win=16512 Len=0 TSval=44440867 TSecr=2360170900  tcp.stream == 5
292  10.782139 72.247.238.35 -> 216.165.108.217 TCP 74 http > 34589 [SYN, ACK] Seq=0 Ack=1 Win=14480 Len=0 MSS=1460 SACK_PERM=1 TSval=2360170900 TSecr=44440845 WS=4  tcp.stream == 13
293  10.782157 216.165.108.217 -> 72.247.238.35 TCP 66 34589 > http [ACK] Seq=1 Ack=1 Win=14720 Len=0 TSval=44440867 TSecr=2360170900  tcp.stream == 13
294  10.785499 216.165.108.217 -> 72.247.238.35 TCP 66 34584 > http [FIN, ACK] Seq=458 Ack=6696 Win=29184 Len=0 TSval=44440868 TSecr=2360170888  tcp.stream == 8
295  10.786299 216.165.108.217 -> 72.247.238.35 TCP 74 34592 > http [SYN] Seq=0 Win=14600 Len=0 MSS=1460 SACK_PERM=1 TSval=44440868 TSecr=0 WS=128  tcp.stream == 16
296  10.787413 216.165.108.217 -> 72.247.238.35 HTTP 483 GET /www.adobe.com/include/script/homepage.js HTTP/1.1   tcp.stream == 13
297  10.788378 216.165.108.217 -> 72.247.238.35 HTTP 489 GET /www.adobe.com/homepage/include/script/store.js HTTP/1.1   tcp.stream == 12
298  10.820832 72.247.238.35 -> 216.165.108.217 TCP 66 http > 34586 [FIN, ACK] Seq=587 Ack=451 Win=15552 Len=0 TSval=2360170940 TSecr=44440855  tcp.stream == 10
299  10.820856 216.165.108.217 -> 72.247.238.35 TCP 66 34586 > http [ACK] Seq=451 Ack=588 Win=15872 Len=0 TSval=44440877 TSecr=2360170940  tcp.stream == 10
300  10.827060 72.247.238.35 -> 216.165.108.217 TCP 74 http > 34590 [SYN, ACK] Seq=0 Ack=1 Win=14480 Len=0 MSS=1460 SACK_PERM=1 TSval=2360170951 TSecr=44440857 WS=4  tcp.stream == 14
301  10.827083 216.165.108.217 -> 72.247.238.35 TCP 66 34590 > http [ACK] Seq=1 Ack=1 Win=14720 Len=0 TSval=44440878 TSecr=2360170951  tcp.stream == 14
302  10.827563 72.247.238.35 -> 216.165.108.217 TCP 66 http > 34585 [FIN, ACK] Seq=1127 Ack=445 Win=15552 Len=0 TSval=2360170952 TSecr=44440858  tcp.stream == 9
303  10.827582 216.165.108.217 -> 72.247.238.35 TCP 66 34585 > http [ACK] Seq=445 Ack=1128 Win=16896 Len=0 TSval=44440878 TSecr=2360170952  tcp.stream == 9
304  10.828037 72.247.238.35 -> 216.165.108.217 TCP 74 http > 34591 [SYN, ACK] Seq=0 Ack=1 Win=14480 Len=0 MSS=1460 SACK_PERM=1 TSval=2360170953 TSecr=44440858 WS=4  tcp.stream == 15
305  10.828057 216.165.108.217 -> 72.247.238.35 TCP 66 34591 > http [ACK] Seq=1 Ack=1 Win=14720 Len=0 TSval=44440879 TSecr=2360170953  tcp.stream == 15
306  10.829161 216.165.108.217 -> 72.247.238.35 HTTP 492 GET /www.adobe.com/include/script/adobe/SearchBuddy.js HTTP/1.1   tcp.stream == 14
307  10.830988 72.247.238.35 -> 216.165.108.217 TCP 1514 [TCP segment of a reassembled PDU]  tcp.stream == 7
308  10.831008 216.165.108.217 -> 72.247.238.35 TCP 66 34583 > http [ACK] Seq=435 Ack=18825 Win=52352 Len=0 TSval=44440879 TSecr=2360170955  tcp.stream == 7
309  10.831106 72.247.238.35 -> 216.165.108.217 TCP 1514 [TCP segment of a reassembled PDU]  tcp.stream == 7
310  10.831111 216.165.108.217 -> 72.247.238.35 TCP 66 34583 > http [ACK] Seq=435 Ack=20273 Win=55168 Len=0 TSval=44440879 TSecr=2360170955  tcp.stream == 7
311  10.831235 72.247.238.35 -> 216.165.108.217 TCP 1514 [TCP segment of a reassembled PDU]  tcp.stream == 7
312  10.831241 216.165.108.217 -> 72.247.238.35 TCP 66 34583 > http [ACK] Seq=435 Ack=21721 Win=58112 Len=0 TSval=44440879 TSecr=2360170956  tcp.stream == 7
313  10.831358 72.247.238.35 -> 216.165.108.217 TCP 1514 [TCP segment of a reassembled PDU]  tcp.stream == 7
314  10.831365 216.165.108.217 -> 72.247.238.35 TCP 66 34583 > http [ACK] Seq=435 Ack=23169 Win=61056 Len=0 TSval=44440879 TSecr=2360170956  tcp.stream == 7
315  10.831480 72.247.238.35 -> 216.165.108.217 TCP 1514 [TCP segment of a reassembled PDU]  tcp.stream == 7
316  10.831486 216.165.108.217 -> 72.247.238.35 TCP 66 34583 > http [ACK] Seq=435 Ack=24617 Win=61440 Len=0 TSval=44440879 TSecr=2360170956  tcp.stream == 7
317  10.831604 72.247.238.35 -> 216.165.108.217 TCP 1514 [TCP segment of a reassembled PDU]  tcp.stream == 7
318  10.831610 216.165.108.217 -> 72.247.238.35 TCP 66 34583 > http [ACK] Seq=435 Ack=26065 Win=60032 Len=0 TSval=44440879 TSecr=2360170956  tcp.stream == 7
319  10.831727 72.247.238.35 -> 216.165.108.217 TCP 1514 [TCP segment of a reassembled PDU]  tcp.stream == 7
320  10.831733 216.165.108.217 -> 72.247.238.35 TCP 66 34583 > http [ACK] Seq=435 Ack=27513 Win=58752 Len=0 TSval=44440879 TSecr=2360170956  tcp.stream == 7
321  10.831849 72.247.238.35 -> 216.165.108.217 TCP 1514 [TCP segment of a reassembled PDU]  tcp.stream == 7
322  10.831854 216.165.108.217 -> 72.247.238.35 TCP 66 34583 > http [ACK] Seq=435 Ack=28961 Win=57344 Len=0 TSval=44440880 TSecr=2360170956  tcp.stream == 7
323  10.831972 72.247.238.35 -> 216.165.108.217 TCP 1514 [TCP segment of a reassembled PDU]  tcp.stream == 7
324  10.831978 216.165.108.217 -> 72.247.238.35 TCP 66 34583 > http [ACK] Seq=435 Ack=30409 Win=55936 Len=0 TSval=44440880 TSecr=2360170956  tcp.stream == 7
325  10.832097 72.247.238.35 -> 216.165.108.217 TCP 1514 [TCP segment of a reassembled PDU]  tcp.stream == 7
326  10.832219 72.247.238.35 -> 216.165.108.217 TCP 1514 [TCP segment of a reassembled PDU]  tcp.stream == 7
328  10.832344 72.247.238.35 -> 216.165.108.217 TCP 1514 [TCP segment of a reassembled PDU]  tcp.stream == 7
329  10.832426 72.247.238.35 -> 216.165.108.217 HTTP 1046 HTTP/1.1 200 OK  (text/css)  tcp.stream == 7
330  10.832491 216.165.108.217 -> 72.247.238.35 TCP 66 34583 > http [ACK] Seq=435 Ack=35733 Win=55936 Len=0 TSval=44440880 TSecr=2360170956  tcp.stream == 7
331  10.834573 216.165.108.217 -> 72.247.238.35 HTTP 502 GET /www.adobe.com/homepage/include/script/adobe/GlobalFooter.js HTTP/1.1   tcp.stream == 15
332  10.854983 216.165.108.217 -> 72.247.238.35 TCP 66 34583 > http [FIN, ACK] Seq=435 Ack=35733 Win=63872 Len=0 TSval=44440885 TSecr=2360170956  tcp.stream == 7
333  10.864880 72.247.238.35 -> 216.165.108.217 TCP 66 http > 34584 [FIN, ACK] Seq=6696 Ack=459 Win=15552 Len=0 TSval=2360170993 TSecr=44440868  tcp.stream == 8
334  10.864904 216.165.108.217 -> 72.247.238.35 TCP 66 34584 > http [ACK] Seq=459 Ack=6697 Win=29184 Len=0 TSval=44440888 TSecr=2360170993  tcp.stream == 8
335  10.865913 72.247.238.35 -> 216.165.108.217 TCP 74 http > 34592 [SYN, ACK] Seq=0 Ack=1 Win=14480 Len=0 MSS=1460 SACK_PERM=1 TSval=2360170994 TSecr=44440868 WS=4  tcp.stream == 16
336  10.865937 216.165.108.217 -> 72.247.238.35 TCP 66 34592 > http [ACK] Seq=1 Ack=1 Win=14720 Len=0 TSval=44440888 TSecr=2360170994  tcp.stream == 16
337  10.867223 72.247.238.35 -> 216.165.108.217 TCP 66 http > 34589 [ACK] Seq=1 Ack=418 Win=15552 Len=0 TSval=2360170995 TSecr=44440868  tcp.stream == 13
338  10.868217 72.247.238.35 -> 216.165.108.217 TCP 66 http > 34588 [ACK] Seq=1 Ack=424 Win=15552 Len=0 TSval=2360170996 TSecr=44440869  tcp.stream == 12
339  10.868933 72.247.238.35 -> 216.165.108.217 HTTP 1715 HTTP/1.1 200 OK  (application/x-javascript)  tcp.stream == 12
340  10.868951 216.165.108.217 -> 72.247.238.35 TCP 66 34588 > http [ACK] Seq=424 Ack=1650 Win=17536 Len=0 TSval=44440889 TSecr=2360170996  tcp.stream == 12
341  10.869219 216.165.108.217 -> 72.247.238.35 HTTP 486 GET /www.adobe.com/js/foresee/foresee-trigger.js HTTP/1.1   tcp.stream == 16
342  10.875795 72.247.238.35 -> 216.165.108.217 TCP 1514 [TCP segment of a reassembled PDU]  tcp.stream == 13
343  10.875815 216.165.108.217 -> 72.247.238.35 TCP 66 34589 > http [ACK] Seq=418 Ack=1449 Win=17536 Len=0 TSval=44440890 TSecr=2360171005  tcp.stream == 13
344  10.875916 72.247.238.35 -> 216.165.108.217 TCP 1514 [TCP segment of a reassembled PDU]  tcp.stream == 13
345  10.875922 216.165.108.217 -> 72.247.238.35 TCP 66 34589 > http [ACK] Seq=418 Ack=2897 Win=20480 Len=0 TSval=44440891 TSecr=2360171005  tcp.stream == 13
346  10.876034 72.247.238.35 -> 216.165.108.217 TCP 1514 [TCP segment of a reassembled PDU]  tcp.stream == 13
347  10.876041 216.165.108.217 -> 72.247.238.35 TCP 66 34589 > http [ACK] Seq=418 Ack=4345 Win=23296 Len=0 TSval=44440891 TSecr=2360171005  tcp.stream == 13
348  10.876160 72.247.238.35 -> 216.165.108.217 TCP 1514 [TCP segment of a reassembled PDU]  tcp.stream == 13
349  10.876167 216.165.108.217 -> 72.247.238.35 TCP 66 34589 > http [ACK] Seq=418 Ack=5793 Win=26240 Len=0 TSval=44440891 TSecr=2360171005  tcp.stream == 13
350  10.877018 216.165.108.217 -> 72.247.238.35 TCP 66 34588 > http [FIN, ACK] Seq=424 Ack=1650 Win=17536 Len=0 TSval=44440891 TSecr=2360170996  tcp.stream == 12
351  10.909605 72.247.238.35 -> 216.165.108.217 TCP 66 http > 34590 [ACK] Seq=1 Ack=427 Win=15552 Len=0 TSval=2360171037 TSecr=44440879  tcp.stream == 14
352  10.910231 72.247.238.35 -> 216.165.108.217 TCP 1514 [TCP segment of a reassembled PDU]  tcp.stream == 14
353  10.910247 216.165.108.217 -> 72.247.238.35 TCP 66 34590 > http [ACK] Seq=427 Ack=1449 Win=17536 Len=0 TSval=44440899 TSecr=2360171037  tcp.stream == 14
354  10.910348 72.247.238.35 -> 216.165.108.217 TCP 1514 [TCP segment of a reassembled PDU]  tcp.stream == 14
355  10.910353 216.165.108.217 -> 72.247.238.35 TCP 66 34590 > http [ACK] Seq=427 Ack=2897 Win=20480 Len=0 TSval=44440899 TSecr=2360171037  tcp.stream == 14
356  10.910472 72.247.238.35 -> 216.165.108.217 TCP 1514 [TCP segment of a reassembled PDU]  tcp.stream == 14
357  10.910478 216.165.108.217 -> 72.247.238.35 TCP 66 34590 > http [ACK] Seq=427 Ack=4345 Win=23296 Len=0 TSval=44440899 TSecr=2360171037  tcp.stream == 14
358  10.910603 72.247.238.35 -> 216.165.108.217 TCP 1514 [TCP segment of a reassembled PDU]  tcp.stream == 14
359  10.910609 216.165.108.217 -> 72.247.238.35 TCP 66 34590 > http [ACK] Seq=427 Ack=5793 Win=26240 Len=0 TSval=44440899 TSecr=2360171037  tcp.stream == 14
360  10.914298 72.247.238.35 -> 216.165.108.217 TCP 66 http > 34591 [ACK] Seq=1 Ack=437 Win=15552 Len=0 TSval=2360171042 TSecr=44440880  tcp.stream == 15
361  10.914728 72.247.238.35 -> 216.165.108.217 HTTP 1468 HTTP/1.1 200 OK  (application/x-javascript)  tcp.stream == 15
362  10.914749 216.165.108.217 -> 72.247.238.35 TCP 66 34591 > http [ACK] Seq=437 Ack=1403 Win=17536 Len=0 TSval=44440900 TSecr=2360171043  tcp.stream == 15
363  10.922011 216.165.108.217 -> 72.247.238.35 TCP 66 34591 > http [FIN, ACK] Seq=437 Ack=1403 Win=17536 Len=0 TSval=44440902 TSecr=2360171043  tcp.stream == 15
364  10.936587 72.247.238.35 -> 216.165.108.217 TCP 66 http > 34583 [FIN, ACK] Seq=35733 Ack=436 Win=15552 Len=0 TSval=2360171063 TSecr=44440885  tcp.stream == 7
365  10.936611 216.165.108.217 -> 72.247.238.35 TCP 66 34583 > http [ACK] Seq=436 Ack=35734 Win=63872 Len=0 TSval=44440906 TSecr=2360171063  tcp.stream == 7
366  10.951017 72.247.238.35 -> 216.165.108.217 TCP 66 http > 34592 [ACK] Seq=1 Ack=421 Win=15552 Len=0 TSval=2360171077 TSecr=44440889  tcp.stream == 16
