 51   6.728233 216.165.108.217 -> 192.150.16.117 TCP 74 48336 > http [SYN] Seq=0 Win=14600 Len=0 MSS=1460 SACK_PERM=1 TSval=44448612 TSecr=0 WS=128  tcp.stream == 0
 52   6.729481 216.165.108.217 -> 107.22.189.186 TCP 66 44803 > http [FIN, ACK] Seq=1 Ack=1 Win=115 Len=0 TSval=44448612 TSecr=176629086  tcp.stream == 1
 53   6.729864 216.165.108.217 -> 72.247.238.35 TCP 66 34636 > http [FIN, ACK] Seq=1 Ack=1 Win=115 Len=0 TSval=44448612 TSecr=2360184793  tcp.stream == 2
 55   6.772848 192.150.16.117 -> 216.165.108.217 TCP 74 http > 48336 [SYN, ACK] Seq=0 Ack=1 Win=5792 Len=0 MSS=1460 SACK_PERM=1 TSval=468627184 TSecr=44448612 WS=128  tcp.stream == 0
 56   6.772871 216.165.108.217 -> 192.150.16.117 TCP 66 48336 > http [ACK] Seq=1 Ack=1 Win=14720 Len=0 TSval=44448623 TSecr=468627184  tcp.stream == 0
 57   6.772954 216.165.108.217 -> 192.150.16.117 HTTP 357 GET / HTTP/1.1   tcp.stream == 0
 58   6.806467 72.247.238.35 -> 216.165.108.217 TCP 66 http > 34636 [FIN, ACK] Seq=1 Ack=2 Win=3620 Len=0 TSval=2360201972 TSecr=44448612  tcp.stream == 2
 59   6.806490 216.165.108.217 -> 72.247.238.35 TCP 66 34636 > http [ACK] Seq=2 Ack=2 Win=115 Len=0 TSval=44448632 TSecr=2360201972  tcp.stream == 2
 60   6.814733 107.22.189.186 -> 216.165.108.217 TCP 66 http > 44803 [FIN, ACK] Seq=1 Ack=2 Win=23 Len=0 TSval=176633381 TSecr=44448612  tcp.stream == 1
 61   6.814759 216.165.108.217 -> 107.22.189.186 TCP 66 44803 > http [ACK] Seq=2 Ack=2 Win=115 Len=0 TSval=44448634 TSecr=176633381  tcp.stream == 1
 62   6.818643 192.150.16.117 -> 216.165.108.217 TCP 66 http > 48336 [ACK] Seq=1 Ack=292 Win=6912 Len=0 TSval=468627229 TSecr=44448623  tcp.stream == 0
 63   6.818677 192.150.16.117 -> 216.165.108.217 HTTP 537 HTTP/1.1 301 Moved Permanently  (text/html)  tcp.stream == 0
 64   6.818684 216.165.108.217 -> 192.150.16.117 TCP 66 48336 > http [ACK] Seq=292 Ack=472 Win=15744 Len=0 TSval=44448635 TSecr=468627230  tcp.stream == 0
 68   6.982780 216.165.108.217 -> 192.150.16.64 TCP 74 32849 > http [SYN] Seq=0 Win=14600 Len=0 MSS=1460 SACK_PERM=1 TSval=44448676 TSecr=0 WS=128  tcp.stream == 3
 69   7.029453 192.150.16.64 -> 216.165.108.217 TCP 78 http > 32849 [SYN, ACK] Seq=0 Ack=1 Win=4380 Len=0 MSS=1460 WS=2 TSval=2269235085 TSecr=44448676 SACK_PERM=1  tcp.stream == 3
 70   7.029476 216.165.108.217 -> 192.150.16.64 TCP 66 32849 > http [ACK] Seq=1 Ack=1 Win=14720 Len=0 TSval=44448687 TSecr=2269235085  tcp.stream == 3
 71   7.029543 216.165.108.217 -> 192.150.16.64 HTTP 361 GET / HTTP/1.1   tcp.stream == 3
 73   7.121002 192.150.16.64 -> 216.165.108.217 TCP 374 [TCP segment of a reassembled PDU]  tcp.stream == 3
 74   7.121027 216.165.108.217 -> 192.150.16.64 TCP 66 32849 > http [ACK] Seq=296 Ack=309 Win=15744 Len=0 TSval=44448710 TSecr=2269235177  tcp.stream == 3
 75   7.121196 192.150.16.64 -> 216.165.108.217 TCP 1514 [TCP segment of a reassembled PDU]  tcp.stream == 3
 76   7.121202 216.165.108.217 -> 192.150.16.64 TCP 66 32849 > http [ACK] Seq=296 Ack=1757 Win=18688 Len=0 TSval=44448710 TSecr=2269235177  tcp.stream == 3
 77   7.121317 192.150.16.64 -> 216.165.108.217 TCP 1514 [TCP segment of a reassembled PDU]  tcp.stream == 3
 78   7.121323 216.165.108.217 -> 192.150.16.64 TCP 66 32849 > http [ACK] Seq=296 Ack=3205 Win=21504 Len=0 TSval=44448710 TSecr=2269235177  tcp.stream == 3
 79   7.121439 192.150.16.64 -> 216.165.108.217 TCP 1514 [TCP segment of a reassembled PDU]  tcp.stream == 3
 80   7.121446 216.165.108.217 -> 192.150.16.64 TCP 66 32849 > http [ACK] Seq=296 Ack=4653 Win=24448 Len=0 TSval=44448710 TSecr=2269235177  tcp.stream == 3
 81   7.121563 192.150.16.64 -> 216.165.108.217 TCP 1514 [TCP segment of a reassembled PDU]  tcp.stream == 3
 82   7.121570 216.165.108.217 -> 192.150.16.64 TCP 66 32849 > http [ACK] Seq=296 Ack=6101 Win=27264 Len=0 TSval=44448710 TSecr=2269235177  tcp.stream == 3
 83   7.121671 192.150.16.64 -> 216.165.108.217 TCP 1514 [TCP segment of a reassembled PDU]  tcp.stream == 3
 84   7.121676 216.165.108.217 -> 192.150.16.64 TCP 66 32849 > http [ACK] Seq=296 Ack=7549 Win=30208 Len=0 TSval=44448710 TSecr=2269235177  tcp.stream == 3
 85   7.121809 192.150.16.64 -> 216.165.108.217 TCP 1514 [TCP segment of a reassembled PDU]  tcp.stream == 3
 86   7.121812 216.165.108.217 -> 192.150.16.64 TCP 66 32849 > http [ACK] Seq=296 Ack=8997 Win=33152 Len=0 TSval=44448710 TSecr=2269235177  tcp.stream == 3
 91   7.163059 216.165.108.217 -> 192.150.16.64 TCP 74 32850 > http [SYN] Seq=0 Win=14600 Len=0 MSS=1460 SACK_PERM=1 TSval=44448721 TSecr=0 WS=128  tcp.stream == 4
 92   7.163137 216.165.108.217 -> 72.247.238.35 TCP 74 34680 > http [SYN] Seq=0 Win=14600 Len=0 MSS=1460 SACK_PERM=1 TSval=44448721 TSecr=0 WS=128  tcp.stream == 5
 93   7.163211 216.165.108.217 -> 72.247.238.35 TCP 74 34681 > http [SYN] Seq=0 Win=14600 Len=0 MSS=1460 SACK_PERM=1 TSval=44448721 TSecr=0 WS=128  tcp.stream == 6
 94   7.163367 216.165.108.217 -> 72.247.238.35 TCP 74 34682 > http [SYN] Seq=0 Win=14600 Len=0 MSS=1460 SACK_PERM=1 TSval=44448721 TSecr=0 WS=128  tcp.stream == 7
 95   7.163457 216.165.108.217 -> 72.247.238.35 TCP 74 34683 > http [SYN] Seq=0 Win=14600 Len=0 MSS=1460 SACK_PERM=1 TSval=44448721 TSecr=0 WS=128  tcp.stream == 8
 96   7.163507 216.165.108.217 -> 72.247.238.35 TCP 74 34684 > http [SYN] Seq=0 Win=14600 Len=0 MSS=1460 SACK_PERM=1 TSval=44448721 TSecr=0 WS=128  tcp.stream == 9
 97   7.163547 216.165.108.217 -> 72.247.238.35 TCP 74 34685 > http [SYN] Seq=0 Win=14600 Len=0 MSS=1460 SACK_PERM=1 TSval=44448721 TSecr=0 WS=128  tcp.stream == 10
 98   7.163585 216.165.108.217 -> 192.150.16.64 TCP 74 32857 > http [SYN] Seq=0 Win=14600 Len=0 MSS=1460 SACK_PERM=1 TSval=44448721 TSecr=0 WS=128  tcp.stream == 11
 99   7.163614 216.165.108.217 -> 192.150.16.64 TCP 74 32858 > http [SYN] Seq=0 Win=14600 Len=0 MSS=1460 SACK_PERM=1 TSval=44448721 TSecr=0 WS=128  tcp.stream == 12
100   7.163638 216.165.108.217 -> 192.150.16.64 TCP 74 32859 > http [SYN] Seq=0 Win=14600 Len=0 MSS=1460 SACK_PERM=1 TSval=44448721 TSecr=0 WS=128  tcp.stream == 13
101   7.163659 216.165.108.217 -> 192.150.16.64 TCP 74 32860 > http [SYN] Seq=0 Win=14600 Len=0 MSS=1460 SACK_PERM=1 TSval=44448721 TSecr=0 WS=128  tcp.stream == 14
102   7.167610 192.150.16.64 -> 216.165.108.217 TCP 1514 [TCP segment of a reassembled PDU]  tcp.stream == 3
103   7.167631 216.165.108.217 -> 192.150.16.64 TCP 66 32849 > http [ACK] Seq=296 Ack=10445 Win=35968 Len=0 TSval=44448722 TSecr=2269235223  tcp.stream == 3
104   7.167733 192.150.16.64 -> 216.165.108.217 HTTP 2014 HTTP/1.1 200 OK  (text/html)  tcp.stream == 3
105   7.167739 216.165.108.217 -> 192.150.16.64 TCP 66 32849 > http [ACK] Seq=296 Ack=12393 Win=38912 Len=0 TSval=44448722 TSecr=2269235223  tcp.stream == 3
106   7.167742 192.150.16.64 -> 216.165.108.217 TCP 66 http > 32849 [FIN, ACK] Seq=12393 Ack=296 Win=4674 Len=0 TSval=2269235223 TSecr=44448710  tcp.stream == 3
107   7.168359 216.165.108.217 -> 192.150.16.64 TCP 66 32849 > http [FIN, ACK] Seq=296 Ack=12394 Win=38912 Len=0 TSval=44448722 TSecr=2269235223  tcp.stream == 3
108   7.168440 216.165.108.217 -> 192.150.16.64 TCP 74 32861 > http [SYN] Seq=0 Win=14600 Len=0 MSS=1460 SACK_PERM=1 TSval=44448722 TSecr=0 WS=128  tcp.stream == 15
109   7.208112 192.150.16.64 -> 216.165.108.217 TCP 78 http > 32858 [SYN, ACK] Seq=0 Ack=1 Win=4380 Len=0 MSS=1460 WS=2 TSval=2269235266 TSecr=44448721 SACK_PERM=1  tcp.stream == 12
110   7.208141 216.165.108.217 -> 192.150.16.64 TCP 66 32858 > http [ACK] Seq=1 Ack=1 Win=14720 Len=0 TSval=44448732 TSecr=2269235266  tcp.stream == 12
111   7.208188 192.150.16.64 -> 216.165.108.217 TCP 78 http > 32859 [SYN, ACK] Seq=0 Ack=1 Win=4380 Len=0 MSS=1460 WS=2 TSval=2269235266 TSecr=44448721 SACK_PERM=1  tcp.stream == 13
112   7.208195 216.165.108.217 -> 192.150.16.64 TCP 66 32859 > http [ACK] Seq=1 Ack=1 Win=14720 Len=0 TSval=44448732 TSecr=2269235266  tcp.stream == 13
113   7.208269 216.165.108.217 -> 192.150.16.64 HTTP 357 GET /uber/js/omniture/mbox.js HTTP/1.1   tcp.stream == 12
114   7.208300 216.165.108.217 -> 192.150.16.64 HTTP 418 GET /homepage/include/style/homepage/bg_120911_touchapps.jpg HTTP/1.1   tcp.stream == 13
115   7.208490 192.150.16.64 -> 216.165.108.217 TCP 78 http > 32850 [SYN, ACK] Seq=0 Ack=1 Win=4380 Len=0 MSS=1460 WS=2 TSval=2269235266 TSecr=44448721 SACK_PERM=1  tcp.stream == 4
116   7.208503 216.165.108.217 -> 192.150.16.64 TCP 66 32850 > http [ACK] Seq=1 Ack=1 Win=14720 Len=0 TSval=44448732 TSecr=2269235266  tcp.stream == 4
117   7.208789 192.150.16.64 -> 216.165.108.217 TCP 78 http > 32857 [SYN, ACK] Seq=0 Ack=1 Win=4380 Len=0 MSS=1460 WS=2 TSval=2269235266 TSecr=44448721 SACK_PERM=1  tcp.stream == 11
118   7.208809 216.165.108.217 -> 192.150.16.64 TCP 66 32857 > http [ACK] Seq=1 Ack=1 Win=14720 Len=0 TSval=44448732 TSecr=2269235266  tcp.stream == 11
119   7.208861 192.150.16.64 -> 216.165.108.217 TCP 78 http > 32860 [SYN, ACK] Seq=0 Ack=1 Win=4380 Len=0 MSS=1460 WS=2 TSval=2269235266 TSecr=44448721 SACK_PERM=1  tcp.stream == 14
120   7.208866 216.165.108.217 -> 192.150.16.64 TCP 66 32860 > http [ACK] Seq=1 Ack=1 Win=14720 Len=0 TSval=44448732 TSecr=2269235266  tcp.stream == 14
121   7.209074 216.165.108.217 -> 192.150.16.64 HTTP 415 GET /homepage/include/style/homepage/adobe_logo_45x45.jpg HTTP/1.1   tcp.stream == 14
122   7.209097 216.165.108.217 -> 192.150.16.64 HTTP 420 GET /homepage/include/style/homepage-120911-touch-challenger3-light-short.css HTTP/1.1   tcp.stream == 4
123   7.209106 216.165.108.217 -> 192.150.16.64 HTTP 384 GET /etc/pagetables/reflowtypes/adobe.css HTTP/1.1   tcp.stream == 11
124   7.214876 192.150.16.64 -> 216.165.108.217 TCP 66 http > 32849 [ACK] Seq=12394 Ack=297 Win=4674 Len=0 TSval=2269235271 TSecr=44448722  tcp.stream == 3
125   7.215061 192.150.16.64 -> 216.165.108.217 TCP 78 http > 32861 [SYN, ACK] Seq=0 Ack=1 Win=4380 Len=0 MSS=1460 WS=2 TSval=2269235271 TSecr=44448722 SACK_PERM=1  tcp.stream == 15
126   7.215076 216.165.108.217 -> 192.150.16.64 TCP 66 32861 > http [ACK] Seq=1 Ack=1 Win=14720 Len=0 TSval=44448734 TSecr=2269235271  tcp.stream == 15
127   7.215176 216.165.108.217 -> 192.150.16.64 HTTP 427 GET /homepage/include/style/homepage/pod_120911_education_306x180.jpg HTTP/1.1   tcp.stream == 15
128   7.252875 192.150.16.64 -> 216.165.108.217 TCP 414 [TCP segment of a reassembled PDU]  tcp.stream == 13
129   7.252899 216.165.108.217 -> 192.150.16.64 TCP 66 32859 > http [ACK] Seq=353 Ack=349 Win=15744 Len=0 TSval=44448743 TSecr=2269235311  tcp.stream == 13
130   7.253005 192.150.16.64 -> 216.165.108.217 TCP 1514 [TCP segment of a reassembled PDU]  tcp.stream == 13
131   7.253010 216.165.108.217 -> 192.150.16.64 TCP 66 32859 > http [ACK] Seq=353 Ack=1797 Win=18688 Len=0 TSval=44448743 TSecr=2269235311  tcp.stream == 13
132   7.253156 192.150.16.64 -> 216.165.108.217 TCP 1514 [TCP segment of a reassembled PDU]  tcp.stream == 13
133   7.253164 216.165.108.217 -> 192.150.16.64 TCP 66 32859 > http [ACK] Seq=353 Ack=3245 Win=21504 Len=0 TSval=44448743 TSecr=2269235311  tcp.stream == 13
134   7.253281 192.150.16.64 -> 216.165.108.217 TCP 1514 [TCP segment of a reassembled PDU]  tcp.stream == 13
135   7.253289 216.165.108.217 -> 192.150.16.64 TCP 66 32859 > http [ACK] Seq=353 Ack=4693 Win=24448 Len=0 TSval=44448743 TSecr=2269235311  tcp.stream == 13
136   7.253360 192.150.16.64 -> 216.165.108.217 TCP 1514 [TCP segment of a reassembled PDU]  tcp.stream == 13
137   7.253364 216.165.108.217 -> 192.150.16.64 TCP 66 32859 > http [ACK] Seq=353 Ack=6141 Win=27264 Len=0 TSval=44448743 TSecr=2269235311  tcp.stream == 13
138   7.253517 192.150.16.64 -> 216.165.108.217 TCP 1514 [TCP segment of a reassembled PDU]  tcp.stream == 13
139   7.253522 216.165.108.217 -> 192.150.16.64 TCP 66 32859 > http [ACK] Seq=353 Ack=7589 Win=30208 Len=0 TSval=44448743 TSecr=2269235311  tcp.stream == 13
140   7.253639 192.150.16.64 -> 216.165.108.217 TCP 1514 [TCP segment of a reassembled PDU]  tcp.stream == 13
141   7.253643 216.165.108.217 -> 192.150.16.64 TCP 66 32859 > http [ACK] Seq=353 Ack=9037 Win=33152 Len=0 TSval=44448743 TSecr=2269235311  tcp.stream == 13
142   7.253742 192.150.16.64 -> 216.165.108.217 TCP 1514 [TCP segment of a reassembled PDU]  tcp.stream == 13
143   7.253746 216.165.108.217 -> 192.150.16.64 TCP 66 32859 > http [ACK] Seq=353 Ack=10485 Win=35968 Len=0 TSval=44448743 TSecr=2269235311  tcp.stream == 13
144   7.253864 192.150.16.64 -> 216.165.108.217 TCP 1514 [TCP segment of a reassembled PDU]  tcp.stream == 13
145   7.253867 216.165.108.217 -> 192.150.16.64 TCP 66 32859 > http [ACK] Seq=353 Ack=11933 Win=38912 Len=0 TSval=44448743 TSecr=2269235311  tcp.stream == 13
146   7.253986 192.150.16.64 -> 216.165.108.217 TCP 1514 [TCP segment of a reassembled PDU]  tcp.stream == 13
147   7.253989 216.165.108.217 -> 192.150.16.64 TCP 66 32859 > http [ACK] Seq=353 Ack=13381 Win=41856 Len=0 TSval=44448743 TSecr=2269235311  tcp.stream == 13
148   7.254039 192.150.16.64 -> 216.165.108.217 HTTP 422 HTTP/1.1 200 OK  (text/css)  tcp.stream == 11
149   7.254047 216.165.108.217 -> 192.150.16.64 TCP 66 32857 > http [ACK] Seq=319 Ack=357 Win=15744 Len=0 TSval=44448743 TSecr=2269235311  tcp.stream == 11
150   7.254049 72.247.238.35 -> 216.165.108.217 TCP 74 http > 34680 [SYN, ACK] Seq=0 Ack=1 Win=14480 Len=0 MSS=1460 SACK_PERM=1 TSval=2360202405 TSecr=44448721 WS=4  tcp.stream == 5
151   7.254054 216.165.108.217 -> 72.247.238.35 TCP 66 34680 > http [ACK] Seq=1 Ack=1 Win=14720 Len=0 TSval=44448743 TSecr=2360202405  tcp.stream == 5
152   7.254056 72.247.238.35 -> 216.165.108.217 TCP 74 http > 34681 [SYN, ACK] Seq=0 Ack=1 Win=14480 Len=0 MSS=1460 SACK_PERM=1 TSval=2360202405 TSecr=44448721 WS=4  tcp.stream == 6
153   7.254059 216.165.108.217 -> 72.247.238.35 TCP 66 34681 > http [ACK] Seq=1 Ack=1 Win=14720 Len=0 TSval=44448743 TSecr=2360202405  tcp.stream == 6
154   7.254161 72.247.238.35 -> 216.165.108.217 TCP 74 http > 34682 [SYN, ACK] Seq=0 Ack=1 Win=14480 Len=0 MSS=1460 SACK_PERM=1 TSval=2360202405 TSecr=44448721 WS=4  tcp.stream == 7
155   7.254168 216.165.108.217 -> 72.247.238.35 TCP 66 34682 > http [ACK] Seq=1 Ack=1 Win=14720 Len=0 TSval=44448743 TSecr=2360202405  tcp.stream == 7
156   7.254171 72.247.238.35 -> 216.165.108.217 TCP 74 http > 34683 [SYN, ACK] Seq=0 Ack=1 Win=14480 Len=0 MSS=1460 SACK_PERM=1 TSval=2360202405 TSecr=44448721 WS=4  tcp.stream == 8
157   7.254178 216.165.108.217 -> 72.247.238.35 TCP 66 34683 > http [ACK] Seq=1 Ack=1 Win=14720 Len=0 TSval=44448743 TSecr=2360202405  tcp.stream == 8
158   7.254183 216.165.108.217 -> 192.150.16.64 HTTP 427 GET /homepage/include/style/homepage/pod_120911_solutions_306x180.jpg HTTP/1.1   tcp.stream == 11
159   7.254217 216.165.108.217 -> 72.247.238.35 HTTP 396 GET /www.adobe.com/include/style/compressed.css HTTP/1.1   tcp.stream == 5
160   7.254235 216.165.108.217 -> 72.247.238.35 HTTP 411 GET /www.adobe.com/homepage/include/style/default/Mnemonic.css HTTP/1.1   tcp.stream == 6
161   7.254267 72.247.238.35 -> 216.165.108.217 TCP 74 http > 34684 [SYN, ACK] Seq=0 Ack=1 Win=14480 Len=0 MSS=1460 SACK_PERM=1 TSval=2360202405 TSecr=44448721 WS=4  tcp.stream == 9
162   7.254276 216.165.108.217 -> 72.247.238.35 TCP 66 34684 > http [ACK] Seq=1 Ack=1 Win=14720 Len=0 TSval=44448744 TSecr=2360202405  tcp.stream == 9
163   7.254278 72.247.238.35 -> 216.165.108.217 TCP 74 http > 34685 [SYN, ACK] Seq=0 Ack=1 Win=14480 Len=0 MSS=1460 SACK_PERM=1 TSval=2360202405 TSecr=44448721 WS=4  tcp.stream == 10
164   7.254281 216.165.108.217 -> 72.247.238.35 TCP 66 34685 > http [ACK] Seq=1 Ack=1 Win=14720 Len=0 TSval=44448744 TSecr=2360202405  tcp.stream == 10
165   7.254283 192.150.16.64 -> 216.165.108.217 TCP 410 [TCP segment of a reassembled PDU]  tcp.stream == 14
166   7.254286 216.165.108.217 -> 192.150.16.64 TCP 66 32860 > http [ACK] Seq=350 Ack=345 Win=15744 Len=0 TSval=44448744 TSecr=2269235311  tcp.stream == 14
167   7.254294 216.165.108.217 -> 72.247.238.35 HTTP 410 GET /www.adobe.com/homepage/include/style/grid/LayoutGrid.css HTTP/1.1   tcp.stream == 7
168   7.254302 216.165.108.217 -> 72.247.238.35 HTTP 411 GET /www.adobe.com/homepage/include/style/grid/ThreeColumn.css HTTP/1.1   tcp.stream == 8
169   7.254363 216.165.108.217 -> 72.247.238.35 HTTP 405 GET /www.adobe.com/include/style/default/SearchBuddy.css HTTP/1.1   tcp.stream == 9
170   7.254372 216.165.108.217 -> 72.247.238.35 HTTP 419 GET /www.adobe.com/include/style/theme/adobe-light/jquery-ui-1.8.1.css HTTP/1.1   tcp.stream == 10
171   7.254462 192.150.16.64 -> 216.165.108.217 TCP 1514 [TCP segment of a reassembled PDU]  tcp.stream == 14
172   7.254469 216.165.108.217 -> 192.150.16.64 TCP 66 32860 > http [ACK] Seq=350 Ack=1793 Win=18688 Len=0 TSval=44448744 TSecr=2269235311  tcp.stream == 14
173   7.254519 192.150.16.64 -> 216.165.108.217 HTTP 1122 HTTP/1.1 200 OK  (JPEG JFIF image)  tcp.stream == 14
174   7.254521 216.165.108.217 -> 192.150.16.64 TCP 66 32860 > http [ACK] Seq=350 Ack=2849 Win=21504 Len=0 TSval=44448744 TSecr=2269235311  tcp.stream == 14
175   7.254971 216.165.108.217 -> 192.150.16.64 HTTP 427 GET /homepage/include/style/homepage/pod_120911_migration_306x180.jpg HTTP/1.1   tcp.stream == 14
176   7.259360 192.150.16.64 -> 216.165.108.217 TCP 375 [TCP segment of a reassembled PDU]  tcp.stream == 12
177   7.259382 216.165.108.217 -> 192.150.16.64 TCP 66 32858 > http [ACK] Seq=292 Ack=310 Win=15744 Len=0 TSval=44448745 TSecr=2269235317  tcp.stream == 12
178   7.259500 192.150.16.64 -> 216.165.108.217 TCP 1514 [TCP segment of a reassembled PDU]  tcp.stream == 12
179   7.259505 216.165.108.217 -> 192.150.16.64 TCP 66 32858 > http [ACK] Seq=292 Ack=1758 Win=18688 Len=0 TSval=44448745 TSecr=2269235317  tcp.stream == 12
180   7.259654 192.150.16.64 -> 216.165.108.217 TCP 1514 [TCP segment of a reassembled PDU]  tcp.stream == 12
181   7.259663 216.165.108.217 -> 192.150.16.64 TCP 66 32858 > http [ACK] Seq=292 Ack=3206 Win=21504 Len=0 TSval=44448745 TSecr=2269235317  tcp.stream == 12
182   7.259770 192.150.16.64 -> 216.165.108.217 TCP 1514 [TCP segment of a reassembled PDU]  tcp.stream == 12
183   7.259775 216.165.108.217 -> 192.150.16.64 TCP 66 32858 > http [ACK] Seq=292 Ack=4654 Win=24448 Len=0 TSval=44448745 TSecr=2269235317  tcp.stream == 12
184   7.259891 192.150.16.64 -> 216.165.108.217 TCP 1514 [TCP segment of a reassembled PDU]  tcp.stream == 12
185   7.259896 216.165.108.217 -> 192.150.16.64 TCP 66 32858 > http [ACK] Seq=292 Ack=6102 Win=27264 Len=0 TSval=44448745 TSecr=2269235317  tcp.stream == 12
186   7.261674 192.150.16.64 -> 216.165.108.217 TCP 411 [TCP segment of a reassembled PDU]  tcp.stream == 15
187   7.261697 216.165.108.217 -> 192.150.16.64 TCP 66 32861 > http [ACK] Seq=362 Ack=346 Win=15744 Len=0 TSval=44448745 TSecr=2269235317  tcp.stream == 15
188   7.261852 192.150.16.64 -> 216.165.108.217 TCP 1514 [TCP segment of a reassembled PDU]  tcp.stream == 15
189   7.261857 216.165.108.217 -> 192.150.16.64 TCP 66 32861 > http [ACK] Seq=362 Ack=1794 Win=18688 Len=0 TSval=44448745 TSecr=2269235317  tcp.stream == 15
190   7.261974 192.150.16.64 -> 216.165.108.217 TCP 1514 [TCP segment of a reassembled PDU]  tcp.stream == 15
191   7.261978 216.165.108.217 -> 192.150.16.64 TCP 66 32861 > http [ACK] Seq=362 Ack=3242 Win=21504 Len=0 TSval=44448745 TSecr=2269235317  tcp.stream == 15
192   7.262099 192.150.16.64 -> 216.165.108.217 TCP 1514 [TCP segment of a reassembled PDU]  tcp.stream == 15
193   7.262105 216.165.108.217 -> 192.150.16.64 TCP 66 32861 > http [ACK] Seq=362 Ack=4690 Win=24448 Len=0 TSval=44448745 TSecr=2269235317  tcp.stream == 15
194   7.262221 192.150.16.64 -> 216.165.108.217 TCP 1514 [TCP segment of a reassembled PDU]  tcp.stream == 15
195   7.262226 216.165.108.217 -> 192.150.16.64 TCP 66 32861 > http [ACK] Seq=362 Ack=6138 Win=27264 Len=0 TSval=44448746 TSecr=2269235317  tcp.stream == 15
196   7.262344 192.150.16.64 -> 216.165.108.217 TCP 1514 [TCP segment of a reassembled PDU]  tcp.stream == 15
197   7.262349 216.165.108.217 -> 192.150.16.64 TCP 66 32861 > http [ACK] Seq=362 Ack=7586 Win=30208 Len=0 TSval=44448746 TSecr=2269235317  tcp.stream == 15
198   7.297228 192.150.16.64 -> 216.165.108.217 TCP 1514 [TCP segment of a reassembled PDU]  tcp.stream == 13
199   7.297251 216.165.108.217 -> 192.150.16.64 TCP 66 32859 > http [ACK] Seq=353 Ack=14829 Win=44672 Len=0 TSval=44448754 TSecr=2269235355  tcp.stream == 13
200   7.297321 192.150.16.64 -> 216.165.108.217 TCP 1514 [TCP segment of a reassembled PDU]  tcp.stream == 13
201   7.297326 216.165.108.217 -> 192.150.16.64 TCP 66 32859 > http [ACK] Seq=353 Ack=16277 Win=47616 Len=0 TSval=44448754 TSecr=2269235355  tcp.stream == 13
202   7.297466 192.150.16.64 -> 216.165.108.217 TCP 1514 [TCP segment of a reassembled PDU]  tcp.stream == 13
203   7.297474 216.165.108.217 -> 192.150.16.64 TCP 66 32859 > http [ACK] Seq=353 Ack=17725 Win=50432 Len=0 TSval=44448754 TSecr=2269235355  tcp.stream == 13
204   7.297580 192.150.16.64 -> 216.165.108.217 TCP 1514 [TCP segment of a reassembled PDU]  tcp.stream == 13
205   7.297585 216.165.108.217 -> 192.150.16.64 TCP 66 32859 > http [ACK] Seq=353 Ack=19173 Win=53376 Len=0 TSval=44448754 TSecr=2269235355  tcp.stream == 13
206   7.297724 192.150.16.64 -> 216.165.108.217 TCP 1514 [TCP segment of a reassembled PDU]  tcp.stream == 13
207   7.297729 216.165.108.217 -> 192.150.16.64 TCP 66 32859 > http [ACK] Seq=353 Ack=20621 Win=56320 Len=0 TSval=44448754 TSecr=2269235355  tcp.stream == 13
208   7.297830 192.150.16.64 -> 216.165.108.217 TCP 1514 [TCP segment of a reassembled PDU]  tcp.stream == 13
209   7.297834 216.165.108.217 -> 192.150.16.64 TCP 66 32859 > http [ACK] Seq=353 Ack=22069 Win=59136 Len=0 TSval=44448754 TSecr=2269235355  tcp.stream == 13
210   7.297953 192.150.16.64 -> 216.165.108.217 TCP 1514 [TCP segment of a reassembled PDU]  tcp.stream == 13
211   7.297956 216.165.108.217 -> 192.150.16.64 TCP 66 32859 > http [ACK] Seq=353 Ack=23517 Win=62080 Len=0 TSval=44448754 TSecr=2269235355  tcp.stream == 13
212   7.298075 192.150.16.64 -> 216.165.108.217 TCP 1514 [TCP segment of a reassembled PDU]  tcp.stream == 13
213   7.298078 216.165.108.217 -> 192.150.16.64 TCP 66 32859 > http [ACK] Seq=353 Ack=24965 Win=64128 Len=0 TSval=44448754 TSecr=2269235355  tcp.stream == 13
214   7.298222 192.150.16.64 -> 216.165.108.217 TCP 1514 [TCP segment of a reassembled PDU]  tcp.stream == 13
215   7.298226 216.165.108.217 -> 192.150.16.64 TCP 66 32859 > http [ACK] Seq=353 Ack=26413 Win=64128 Len=0 TSval=44448755 TSecr=2269235355  tcp.stream == 13
216   7.298329 192.150.16.64 -> 216.165.108.217 TCP 1514 [TCP segment of a reassembled PDU]  tcp.stream == 13
217   7.298335 216.165.108.217 -> 192.150.16.64 TCP 66 32859 > http [ACK] Seq=353 Ack=27861 Win=64128 Len=0 TSval=44448755 TSecr=2269235355  tcp.stream == 13
218   7.298450 192.150.16.64 -> 216.165.108.217 TCP 1514 [TCP segment of a reassembled PDU]  tcp.stream == 13
219   7.298453 216.165.108.217 -> 192.150.16.64 TCP 66 32859 > http [ACK] Seq=353 Ack=29309 Win=64128 Len=0 TSval=44448755 TSecr=2269235355  tcp.stream == 13
220   7.298592 192.150.16.64 -> 216.165.108.217 TCP 1514 [TCP segment of a reassembled PDU]  tcp.stream == 13
221   7.298597 216.165.108.217 -> 192.150.16.64 TCP 66 32859 > http [ACK] Seq=353 Ack=30757 Win=64128 Len=0 TSval=44448755 TSecr=2269235356  tcp.stream == 13
222   7.298714 192.150.16.64 -> 216.165.108.217 TCP 1514 [TCP segment of a reassembled PDU]  tcp.stream == 13
223   7.298721 216.165.108.217 -> 192.150.16.64 TCP 66 32859 > http [ACK] Seq=353 Ack=32205 Win=64128 Len=0 TSval=44448755 TSecr=2269235356  tcp.stream == 13
224   7.298857 192.150.16.64 -> 216.165.108.217 TCP 1514 [TCP segment of a reassembled PDU]  tcp.stream == 13
225   7.298865 216.165.108.217 -> 192.150.16.64 TCP 66 32859 > http [ACK] Seq=353 Ack=33653 Win=64128 Len=0 TSval=44448755 TSecr=2269235356  tcp.stream == 13
226   7.298963 192.150.16.64 -> 216.165.108.217 TCP 1514 [TCP segment of a reassembled PDU]  tcp.stream == 13
227   7.298971 216.165.108.217 -> 192.150.16.64 TCP 66 32859 > http [ACK] Seq=353 Ack=35101 Win=64128 Len=0 TSval=44448755 TSecr=2269235356  tcp.stream == 13
228   7.299122 192.150.16.64 -> 216.165.108.217 TCP 1514 [TCP segment of a reassembled PDU]  tcp.stream == 13
229   7.299130 216.165.108.217 -> 192.150.16.64 TCP 66 32859 > http [ACK] Seq=353 Ack=36549 Win=64128 Len=0 TSval=44448755 TSecr=2269235356  tcp.stream == 13
230   7.299242 192.150.16.64 -> 216.165.108.217 TCP 1514 [TCP segment of a reassembled PDU]  tcp.stream == 13
231   7.299251 216.165.108.217 -> 192.150.16.64 TCP 66 32859 > http [ACK] Seq=353 Ack=37997 Win=64128 Len=0 TSval=44448755 TSecr=2269235356  tcp.stream == 13
232   7.299339 192.150.16.64 -> 216.165.108.217 TCP 1514 [TCP segment of a reassembled PDU]  tcp.stream == 13
233   7.299343 216.165.108.217 -> 192.150.16.64 TCP 66 32859 > http [ACK] Seq=353 Ack=39445 Win=64128 Len=0 TSval=44448755 TSecr=2269235356  tcp.stream == 13
234   7.299480 192.150.16.64 -> 216.165.108.217 TCP 1514 [TCP segment of a reassembled PDU]  tcp.stream == 13
235   7.299485 216.165.108.217 -> 192.150.16.64 TCP 66 32859 > http [ACK] Seq=353 Ack=40893 Win=64128 Len=0 TSval=44448755 TSecr=2269235356  tcp.stream == 13
236   7.299585 192.150.16.64 -> 216.165.108.217 TCP 1514 [TCP segment of a reassembled PDU]  tcp.stream == 13
237   7.299589 216.165.108.217 -> 192.150.16.64 TCP 66 32859 > http [ACK] Seq=353 Ack=42341 Win=64128 Len=0 TSval=44448755 TSecr=2269235356  tcp.stream == 13
238   7.299707 192.150.16.64 -> 216.165.108.217 TCP 1514 [TCP segment of a reassembled PDU]  tcp.stream == 13
239   7.299823 192.150.16.64 -> 216.165.108.217 TCP 412 [TCP segment of a reassembled PDU]  tcp.stream == 11
240   7.299980 192.150.16.64 -> 216.165.108.217 TCP 1514 [TCP segment of a reassembled PDU]  tcp.stream == 11
241   7.299984 216.165.108.217 -> 192.150.16.64 TCP 66 32857 > http [ACK] Seq=680 Ack=2151 Win=19712 Len=0 TSval=44448755 TSecr=2269235356  tcp.stream == 11
242   7.300103 192.150.16.64 -> 216.165.108.217 TCP 1514 [TCP segment of a reassembled PDU]  tcp.stream == 11
243   7.300226 192.150.16.64 -> 216.165.108.217 TCP 1514 [TCP segment of a reassembled PDU]  tcp.stream == 11
244   7.300229 216.165.108.217 -> 192.150.16.64 TCP 66 32857 > http [ACK] Seq=680 Ack=5047 Win=25472 Len=0 TSval=44448755 TSecr=2269235356  tcp.stream == 11
245   7.300409 192.150.16.64 -> 216.165.108.217 TCP 1514 [TCP segment of a reassembled PDU]  tcp.stream == 11
246   7.300529 192.150.16.64 -> 216.165.108.217 TCP 1514 [TCP segment of a reassembled PDU]  tcp.stream == 11
247   7.300537 216.165.108.217 -> 192.150.16.64 TCP 66 32857 > http [ACK] Seq=680 Ack=7943 Win=31232 Len=0 TSval=44448755 TSecr=2269235356  tcp.stream == 11
248   7.300653 192.150.16.64 -> 216.165.108.217 TCP 1514 [TCP segment of a reassembled PDU]  tcp.stream == 11
249   7.300726 192.150.16.64 -> 216.165.108.217 TCP 412 [TCP segment of a reassembled PDU]  tcp.stream == 14
250   7.300882 192.150.16.64 -> 216.165.108.217 TCP 1514 [TCP segment of a reassembled PDU]  tcp.stream == 14
251   7.300892 216.165.108.217 -> 192.150.16.64 TCP 66 32860 > http [ACK] Seq=711 Ack=4643 Win=27264 Len=0 TSval=44448755 TSecr=2269235357  tcp.stream == 14
252   7.301007 192.150.16.64 -> 216.165.108.217 TCP 1514 [TCP segment of a reassembled PDU]  tcp.stream == 14
253   7.301125 192.150.16.64 -> 216.165.108.217 TCP 1514 [TCP segment of a reassembled PDU]  tcp.stream == 14
254   7.301129 216.165.108.217 -> 192.150.16.64 TCP 66 32860 > http [ACK] Seq=711 Ack=7539 Win=33152 Len=0 TSval=44448755 TSecr=2269235357  tcp.stream == 14
255   7.301251 192.150.16.64 -> 216.165.108.217 TCP 1514 [TCP segment of a reassembled PDU]  tcp.stream == 14
256   7.301390 192.150.16.64 -> 216.165.108.217 TCP 1514 [TCP segment of a reassembled PDU]  tcp.stream == 14
257   7.301396 216.165.108.217 -> 192.150.16.64 TCP 66 32860 > http [ACK] Seq=711 Ack=10435 Win=38912 Len=0 TSval=44448755 TSecr=2269235357  tcp.stream == 14
258   7.301497 192.150.16.64 -> 216.165.108.217 TCP 1514 [TCP segment of a reassembled PDU]  tcp.stream == 14
259   7.301620 192.150.16.64 -> 216.165.108.217 TCP 1514 [TCP segment of a reassembled PDU]  tcp.stream == 14
260   7.301624 216.165.108.217 -> 192.150.16.64 TCP 66 32860 > http [ACK] Seq=711 Ack=13331 Win=44672 Len=0 TSval=44448755 TSecr=2269235357  tcp.stream == 14
261   7.301743 192.150.16.64 -> 216.165.108.217 TCP 1514 [TCP segment of a reassembled PDU]  tcp.stream == 14
262   7.301866 192.150.16.64 -> 216.165.108.217 TCP 1514 [TCP segment of a reassembled PDU]  tcp.stream == 14
263   7.301869 216.165.108.217 -> 192.150.16.64 TCP 66 32860 > http [ACK] Seq=711 Ack=16227 Win=50432 Len=0 TSval=44448755 TSecr=2269235357  tcp.stream == 14
264   7.301992 192.150.16.64 -> 216.165.108.217 TCP 1514 [TCP segment of a reassembled PDU]  tcp.stream == 14
265   7.302112 192.150.16.64 -> 216.165.108.217 TCP 1514 [TCP segment of a reassembled PDU]  tcp.stream == 14
266   7.302119 216.165.108.217 -> 192.150.16.64 TCP 66 32860 > http [ACK] Seq=711 Ack=19123 Win=56320 Len=0 TSval=44448755 TSecr=2269235357  tcp.stream == 14
267   7.302236 192.150.16.64 -> 216.165.108.217 TCP 1514 [TCP segment of a reassembled PDU]  tcp.stream == 14
268   7.302355 192.150.16.64 -> 216.165.108.217 TCP 1514 [TCP segment of a reassembled PDU]  tcp.stream == 14
269   7.302361 216.165.108.217 -> 192.150.16.64 TCP 66 32860 > http [ACK] Seq=711 Ack=22019 Win=62080 Len=0 TSval=44448756 TSecr=2269235357  tcp.stream == 14
270   7.303645 192.150.16.64 -> 216.165.108.217 TCP 1514 [TCP segment of a reassembled PDU]  tcp.stream == 12
271   7.303659 216.165.108.217 -> 192.150.16.64 TCP 66 32858 > http [ACK] Seq=292 Ack=7550 Win=30208 Len=0 TSval=44448756 TSecr=2269235361  tcp.stream == 12
272   7.303759 192.150.16.64 -> 216.165.108.217 TCP 1514 [TCP segment of a reassembled PDU]  tcp.stream == 12
273   7.303762 216.165.108.217 -> 192.150.16.64 TCP 66 32858 > http [ACK] Seq=292 Ack=8998 Win=33152 Len=0 TSval=44448756 TSecr=2269235361  tcp.stream == 12
274   7.303764 192.150.16.64 -> 216.165.108.217 HTTP 264 HTTP/1.1 200 OK  (application/x-javascript)  tcp.stream == 12
275   7.303767 216.165.108.217 -> 192.150.16.64 TCP 66 32858 > http [ACK] Seq=292 Ack=9196 Win=35968 Len=0 TSval=44448756 TSecr=2269235361  tcp.stream == 12
276   7.303768 192.150.16.64 -> 216.165.108.217 TCP 66 http > 32858 [FIN, ACK] Seq=9196 Ack=292 Win=4670 Len=0 TSval=2269235361 TSecr=44448745  tcp.stream == 12
277   7.303827 216.165.108.217 -> 192.150.16.64 TCP 66 32858 > http [FIN, ACK] Seq=292 Ack=9197 Win=35968 Len=0 TSval=44448756 TSecr=2269235361  tcp.stream == 12
278   7.303893 216.165.108.217 -> 192.150.16.64 TCP 74 32862 > http [SYN] Seq=0 Win=14600 Len=0 MSS=1460 SACK_PERM=1 TSval=44448756 TSecr=0 WS=128  tcp.stream == 16
279   7.308261 192.150.16.64 -> 216.165.108.217 TCP 1514 [TCP segment of a reassembled PDU]  tcp.stream == 15
280   7.308278 216.165.108.217 -> 192.150.16.64 TCP 66 32861 > http [ACK] Seq=362 Ack=9034 Win=33152 Len=0 TSval=44448757 TSecr=2269235364  tcp.stream == 15
281   7.308284 192.150.16.64 -> 216.165.108.217 HTTP 225 HTTP/1.1 200 OK  (JPEG JFIF image)  tcp.stream == 15
282   7.308287 216.165.108.217 -> 192.150.16.64 TCP 66 32861 > http [ACK] Seq=362 Ack=9193 Win=35968 Len=0 TSval=44448757 TSecr=2269235364  tcp.stream == 15
283   7.308450 216.165.108.217 -> 192.150.16.64 HTTP 424 GET /include/style/grid-narrow-compressed.css HTTP/1.1   tcp.stream == 15
284   7.309119 192.150.16.64 -> 216.165.108.217 TCP 358 [TCP segment of a reassembled PDU]  tcp.stream == 4
285   7.309139 216.165.108.217 -> 192.150.16.64 TCP 66 32850 > http [ACK] Seq=355 Ack=293 Win=15744 Len=0 TSval=44448757 TSecr=2269235366  tcp.stream == 4
286   7.309337 192.150.16.64 -> 216.165.108.217 TCP 1514 [TCP segment of a reassembled PDU]  tcp.stream == 4
287   7.309343 216.165.108.217 -> 192.150.16.64 TCP 66 32850 > http [ACK] Seq=355 Ack=1741 Win=18688 Len=0 TSval=44448757 TSecr=2269235366  tcp.stream == 4
288   7.309461 192.150.16.64 -> 216.165.108.217 TCP 1514 [TCP segment of a reassembled PDU]  tcp.stream == 4
289   7.309468 216.165.108.217 -> 192.150.16.64 TCP 66 32850 > http [ACK] Seq=355 Ack=3189 Win=21504 Len=0 TSval=44448757 TSecr=2269235366  tcp.stream == 4
290   7.309591 192.150.16.64 -> 216.165.108.217 TCP 1514 [TCP segment of a reassembled PDU]  tcp.stream == 4
291   7.309597 216.165.108.217 -> 192.150.16.64 TCP 66 32850 > http [ACK] Seq=355 Ack=4637 Win=24448 Len=0 TSval=44448757 TSecr=2269235366  tcp.stream == 4
292   7.309711 192.150.16.64 -> 216.165.108.217 TCP 1514 [TCP segment of a reassembled PDU]  tcp.stream == 4
293   7.309717 216.165.108.217 -> 192.150.16.64 TCP 66 32850 > http [ACK] Seq=355 Ack=6085 Win=27264 Len=0 TSval=44448757 TSecr=2269235366  tcp.stream == 4
295   7.338217 216.165.108.217 -> 192.150.16.64 TCP 66 32859 > http [ACK] Seq=353 Ack=43789 Win=64128 Len=0 TSval=44448765 TSecr=2269235356  tcp.stream == 13
296   7.338226 216.165.108.217 -> 192.150.16.64 TCP 66 32857 > http [ACK] Seq=680 Ack=9391 Win=34176 Len=0 TSval=44448765 TSecr=2269235356  tcp.stream == 11
297   7.341647 192.150.16.64 -> 216.165.108.217 TCP 1514 [TCP segment of a reassembled PDU]  tcp.stream == 13
298   7.341755 192.150.16.64 -> 216.165.108.217 TCP 1514 [TCP segment of a reassembled PDU]  tcp.stream == 13
299   7.341764 216.165.108.217 -> 192.150.16.64 TCP 66 32859 > http [ACK] Seq=353 Ack=46685 Win=64128 Len=0 TSval=44448765 TSecr=2269235399  tcp.stream == 13
300   7.341886 192.150.16.64 -> 216.165.108.217 TCP 1514 [TCP segment of a reassembled PDU]  tcp.stream == 13
301   7.341961 192.150.16.64 -> 216.165.108.217 TCP 1514 [TCP segment of a reassembled PDU]  tcp.stream == 13
302   7.341964 216.165.108.217 -> 192.150.16.64 TCP 66 32859 > http [ACK] Seq=353 Ack=49581 Win=64128 Len=0 TSval=44448765 TSecr=2269235399  tcp.stream == 13
303   7.342106 192.150.16.64 -> 216.165.108.217 TCP 1514 [TCP segment of a reassembled PDU]  tcp.stream == 13
304   7.342228 192.150.16.64 -> 216.165.108.217 TCP 1514 [TCP segment of a reassembled PDU]  tcp.stream == 13
305   7.342232 216.165.108.217 -> 192.150.16.64 TCP 66 32859 > http [ACK] Seq=353 Ack=52477 Win=64128 Len=0 TSval=44448766 TSecr=2269235400  tcp.stream == 13
306   7.342373 192.150.16.64 -> 216.165.108.217 TCP 1514 [TCP segment of a reassembled PDU]  tcp.stream == 13
307   7.342472 192.150.16.64 -> 216.165.108.217 TCP 1514 [TCP segment of a reassembled PDU]  tcp.stream == 13
308   7.342476 216.165.108.217 -> 192.150.16.64 TCP 66 32859 > http [ACK] Seq=353 Ack=55373 Win=64128 Len=0 TSval=44448766 TSecr=2269235400  tcp.stream == 13
309   7.342600 192.150.16.64 -> 216.165.108.217 TCP 1514 [TCP segment of a reassembled PDU]  tcp.stream == 13
310   7.342718 192.150.16.64 -> 216.165.108.217 TCP 1514 [TCP segment of a reassembled PDU]  tcp.stream == 13
311   7.342721 216.165.108.217 -> 192.150.16.64 TCP 66 32859 > http [ACK] Seq=353 Ack=58269 Win=64128 Len=0 TSval=44448766 TSecr=2269235400  tcp.stream == 13
312   7.342843 192.150.16.64 -> 216.165.108.217 TCP 1514 [TCP segment of a reassembled PDU]  tcp.stream == 13
313   7.342966 192.150.16.64 -> 216.165.108.217 TCP 1514 [TCP segment of a reassembled PDU]  tcp.stream == 13
314   7.342970 216.165.108.217 -> 192.150.16.64 TCP 66 32859 > http [ACK] Seq=353 Ack=61165 Win=64128 Len=0 TSval=44448766 TSecr=2269235400  tcp.stream == 13
315   7.343091 192.150.16.64 -> 216.165.108.217 TCP 1514 [TCP segment of a reassembled PDU]  tcp.stream == 13
316   7.343212 192.150.16.64 -> 216.165.108.217 TCP 1514 [TCP segment of a reassembled PDU]  tcp.stream == 13
317   7.343216 216.165.108.217 -> 192.150.16.64 TCP 66 32859 > http [ACK] Seq=353 Ack=64061 Win=64128 Len=0 TSval=44448766 TSecr=2269235400  tcp.stream == 13
318   7.343336 192.150.16.64 -> 216.165.108.217 TCP 1514 [TCP segment of a reassembled PDU]  tcp.stream == 13
319   7.343456 192.150.16.64 -> 216.165.108.217 TCP 1514 [TCP segment of a reassembled PDU]  tcp.stream == 13
320   7.343460 216.165.108.217 -> 192.150.16.64 TCP 66 32859 > http [ACK] Seq=353 Ack=66957 Win=64128 Len=0 TSval=44448766 TSecr=2269235400  tcp.stream == 13
321   7.343582 192.150.16.64 -> 216.165.108.217 TCP 1514 [TCP segment of a reassembled PDU]  tcp.stream == 13
322   7.343704 192.150.16.64 -> 216.165.108.217 TCP 1514 [TCP segment of a reassembled PDU]  tcp.stream == 13
323   7.343708 216.165.108.217 -> 192.150.16.64 TCP 66 32859 > http [ACK] Seq=353 Ack=69853 Win=64128 Len=0 TSval=44448766 TSecr=2269235400  tcp.stream == 13
324   7.343828 192.150.16.64 -> 216.165.108.217 TCP 1514 [TCP segment of a reassembled PDU]  tcp.stream == 13
325   7.343949 192.150.16.64 -> 216.165.108.217 TCP 1514 [TCP segment of a reassembled PDU]  tcp.stream == 13
326   7.343952 216.165.108.217 -> 192.150.16.64 TCP 66 32859 > http [ACK] Seq=353 Ack=72749 Win=64128 Len=0 TSval=44448766 TSecr=2269235400  tcp.stream == 13
327   7.344076 192.150.16.64 -> 216.165.108.217 TCP 1514 [TCP segment of a reassembled PDU]  tcp.stream == 13
328   7.344211 192.150.16.64 -> 216.165.108.217 TCP 1514 [TCP segment of a reassembled PDU]  tcp.stream == 13
329   7.344214 216.165.108.217 -> 192.150.16.64 TCP 66 32859 > http [ACK] Seq=353 Ack=75645 Win=64128 Len=0 TSval=44448766 TSecr=2269235400  tcp.stream == 13
330   7.344334 192.150.16.64 -> 216.165.108.217 TCP 1514 [TCP segment of a reassembled PDU]  tcp.stream == 13
331   7.344457 192.150.16.64 -> 216.165.108.217 TCP 1514 [TCP segment of a reassembled PDU]  tcp.stream == 13
332   7.344460 216.165.108.217 -> 192.150.16.64 TCP 66 32859 > http [ACK] Seq=353 Ack=78541 Win=64128 Len=0 TSval=44448766 TSecr=2269235401  tcp.stream == 13
333   7.344581 192.150.16.64 -> 216.165.108.217 TCP 1514 [TCP segment of a reassembled PDU]  tcp.stream == 13
334   7.344749 192.150.16.64 -> 216.165.108.217 TCP 1514 [TCP segment of a reassembled PDU]  tcp.stream == 13
335   7.344751 216.165.108.217 -> 192.150.16.64 TCP 66 32859 > http [ACK] Seq=353 Ack=81437 Win=64128 Len=0 TSval=44448766 TSecr=2269235401  tcp.stream == 13
336   7.344881 192.150.16.64 -> 216.165.108.217 TCP 1514 [TCP segment of a reassembled PDU]  tcp.stream == 13
337   7.345000 192.150.16.64 -> 216.165.108.217 TCP 1514 [TCP segment of a reassembled PDU]  tcp.stream == 13
338   7.345004 216.165.108.217 -> 192.150.16.64 TCP 66 32859 > http [ACK] Seq=353 Ack=84333 Win=64128 Len=0 TSval=44448766 TSecr=2269235401  tcp.stream == 13
339   7.345126 192.150.16.64 -> 216.165.108.217 TCP 1514 [TCP segment of a reassembled PDU]  tcp.stream == 13
340   7.345248 192.150.16.64 -> 216.165.108.217 TCP 1514 [TCP segment of a reassembled PDU]  tcp.stream == 13
341   7.345252 216.165.108.217 -> 192.150.16.64 TCP 66 32859 > http [ACK] Seq=353 Ack=87229 Win=64128 Len=0 TSval=44448766 TSecr=2269235401  tcp.stream == 13
342   7.345371 192.150.16.64 -> 216.165.108.217 TCP 1514 [TCP segment of a reassembled PDU]  tcp.stream == 13
343   7.345491 192.150.16.64 -> 216.165.108.217 TCP 1514 [TCP segment of a reassembled PDU]  tcp.stream == 13
344   7.345495 216.165.108.217 -> 192.150.16.64 TCP 66 32859 > http [ACK] Seq=353 Ack=90125 Win=64128 Len=0 TSval=44448766 TSecr=2269235401  tcp.stream == 13
345   7.345618 192.150.16.64 -> 216.165.108.217 TCP 1514 [TCP segment of a reassembled PDU]  tcp.stream == 13
346   7.345739 192.150.16.64 -> 216.165.108.217 TCP 1514 [TCP segment of a reassembled PDU]  tcp.stream == 13
347   7.345742 216.165.108.217 -> 192.150.16.64 TCP 66 32859 > http [ACK] Seq=353 Ack=93021 Win=64128 Len=0 TSval=44448766 TSecr=2269235401  tcp.stream == 13
348   7.345864 192.150.16.64 -> 216.165.108.217 TCP 1514 [TCP segment of a reassembled PDU]  tcp.stream == 13
349   7.345985 192.150.16.64 -> 216.165.108.217 TCP 1514 [TCP segment of a reassembled PDU]  tcp.stream == 13
350   7.345989 216.165.108.217 -> 192.150.16.64 TCP 66 32859 > http [ACK] Seq=353 Ack=95917 Win=64128 Len=0 TSval=44448766 TSecr=2269235401  tcp.stream == 13
351   7.346110 192.150.16.64 -> 216.165.108.217 TCP 1514 [TCP segment of a reassembled PDU]  tcp.stream == 13
