189   4.775758 58.76.144.193 -> 216.165.108.192 TCP 74 patrolview > telnet [SYN] Seq=0 Win=5840 Len=0 MSS=1460 SACK_PERM=1 TSval=46789966 TSecr=0 WS=2  tcp.stream == 0
190   4.775766 58.76.144.193 -> 216.165.108.193 TCP 74 asap-tcp-tls > telnet [SYN] Seq=0 Win=5840 Len=0 MSS=1460 SACK_PERM=1 TSval=46789966 TSecr=0 WS=2  tcp.stream == 1
191   4.778892 58.76.144.193 -> 216.165.108.195 TCP 74 4048 > telnet [SYN] Seq=0 Win=5840 Len=0 MSS=1460 SACK_PERM=1 TSval=46789966 TSecr=0 WS=2  tcp.stream == 2
192   4.778901 58.76.144.193 -> 216.165.108.198 TCP 74 notateit > telnet [SYN] Seq=0 Win=5840 Len=0 MSS=1460 SACK_PERM=1 TSval=46789966 TSecr=0 WS=2  tcp.stream == 3
211   4.796580 58.76.144.193 -> 216.165.108.213 TCP 74 4281 > telnet [SYN] Seq=0 Win=5840 Len=0 MSS=1460 SACK_PERM=1 TSval=46789968 TSecr=0 WS=2  tcp.stream == 4
216   4.800253 58.76.144.193 -> 216.165.108.217 TCP 74 serverview-asn > telnet [SYN] Seq=0 Win=5840 Len=0 MSS=1460 SACK_PERM=1 TSval=46789968 TSecr=0 WS=2  tcp.stream == 5
217   4.800278 216.165.108.217 -> 58.76.144.193 TCP 54 telnet > serverview-asn [RST, ACK] Seq=1 Ack=1 Win=0 Len=0  tcp.stream == 5
261   6.165019 216.165.108.217 -> 157.166.255.18 TCP 74 38977 > http [SYN] Seq=0 Win=14600 Len=0 MSS=1460 SACK_PERM=1 TSval=44251879 TSecr=0 WS=128  tcp.stream == 6
262   6.186143 157.166.255.18 -> 216.165.108.217 TCP 74 http > 38977 [SYN, ACK] Seq=0 Ack=1 Win=5792 Len=0 MSS=1460 SACK_PERM=1 TSval=173063349 TSecr=44251879 WS=128  tcp.stream == 6
263   6.186194 216.165.108.217 -> 157.166.255.18 TCP 66 38977 > http [ACK] Seq=1 Ack=1 Win=14720 Len=0 TSval=44251884 TSecr=173063349  tcp.stream == 6
264   6.186260 216.165.108.217 -> 157.166.255.18 HTTP 355 GET / HTTP/1.1   tcp.stream == 6
265   6.205558 157.166.255.18 -> 216.165.108.217 TCP 66 http > 38977 [ACK] Seq=1 Ack=290 Win=6912 Len=0 TSval=173063351 TSecr=44251884  tcp.stream == 6
266   6.205913 157.166.255.18 -> 216.165.108.217 HTTP 511 HTTP/1.1 301 Moved Permanently  (text/html)  tcp.stream == 6
267   6.205946 216.165.108.217 -> 157.166.255.18 TCP 66 38977 > http [ACK] Seq=290 Ack=446 Win=15744 Len=0 TSval=44251889 TSecr=173063351  tcp.stream == 6
273   6.297643 216.165.108.217 -> 157.166.255.19 TCP 74 45093 > http [SYN] Seq=0 Win=14600 Len=0 MSS=1460 SACK_PERM=1 TSval=44251912 TSecr=0 WS=128  tcp.stream == 7
274   6.318365 157.166.255.19 -> 216.165.108.217 TCP 74 http > 45093 [SYN, ACK] Seq=0 Ack=1 Win=5792 Len=0 MSS=1460 SACK_PERM=1 TSval=172048238 TSecr=44251912 WS=128  tcp.stream == 7
275   6.318391 216.165.108.217 -> 157.166.255.19 TCP 66 45093 > http [ACK] Seq=1 Ack=1 Win=14720 Len=0 TSval=44251917 TSecr=172048238  tcp.stream == 7
276   6.318495 216.165.108.217 -> 157.166.255.19 HTTP 359 GET / HTTP/1.1   tcp.stream == 7
277   6.337662 157.166.255.19 -> 216.165.108.217 TCP 66 http > 45093 [ACK] Seq=1 Ack=294 Win=6912 Len=0 TSval=172048240 TSecr=44251917  tcp.stream == 7
278   6.338319 157.166.255.19 -> 216.165.108.217 TCP 1514 [TCP segment of a reassembled PDU]  tcp.stream == 7
279   6.338339 216.165.108.217 -> 157.166.255.19 TCP 66 45093 > http [ACK] Seq=294 Ack=1449 Win=17536 Len=0 TSval=44251922 TSecr=172048240  tcp.stream == 7
280   6.338408 157.166.255.19 -> 216.165.108.217 TCP 1514 [TCP segment of a reassembled PDU]  tcp.stream == 7
281   6.338412 216.165.108.217 -> 157.166.255.19 TCP 66 45093 > http [ACK] Seq=294 Ack=2897 Win=20480 Len=0 TSval=44251922 TSecr=172048240  tcp.stream == 7
282   6.338512 157.166.255.19 -> 216.165.108.217 TCP 1514 [TCP segment of a reassembled PDU]  tcp.stream == 7
283   6.338518 216.165.108.217 -> 157.166.255.19 TCP 66 45093 > http [ACK] Seq=294 Ack=4345 Win=23296 Len=0 TSval=44251922 TSecr=172048240  tcp.stream == 7
287   6.357767 157.166.255.19 -> 216.165.108.217 TCP 1514 [TCP segment of a reassembled PDU]  tcp.stream == 7
288   6.357790 216.165.108.217 -> 157.166.255.19 TCP 66 45093 > http [ACK] Seq=294 Ack=5793 Win=26240 Len=0 TSval=44251927 TSecr=172048242  tcp.stream == 7
289   6.357888 157.166.255.19 -> 216.165.108.217 TCP 1514 [TCP segment of a reassembled PDU]  tcp.stream == 7
290   6.357893 216.165.108.217 -> 157.166.255.19 TCP 66 45093 > http [ACK] Seq=294 Ack=7241 Win=29184 Len=0 TSval=44251927 TSecr=172048242  tcp.stream == 7
291   6.358040 157.166.255.19 -> 216.165.108.217 TCP 1514 [TCP segment of a reassembled PDU]  tcp.stream == 7
292   6.358046 216.165.108.217 -> 157.166.255.19 TCP 66 45093 > http [ACK] Seq=294 Ack=8689 Win=32000 Len=0 TSval=44251927 TSecr=172048242  tcp.stream == 7
293   6.358163 157.166.255.19 -> 216.165.108.217 TCP 1514 [TCP segment of a reassembled PDU]  tcp.stream == 7
294   6.358169 216.165.108.217 -> 157.166.255.19 TCP 66 45093 > http [ACK] Seq=294 Ack=10137 Win=34944 Len=0 TSval=44251927 TSecr=172048242  tcp.stream == 7
295   6.358287 157.166.255.19 -> 216.165.108.217 TCP 1514 [TCP segment of a reassembled PDU]  tcp.stream == 7
296   6.358294 216.165.108.217 -> 157.166.255.19 TCP 66 45093 > http [ACK] Seq=294 Ack=11585 Win=37888 Len=0 TSval=44251927 TSecr=172048242  tcp.stream == 7
305   6.365556 216.165.108.217 -> 204.141.87.24 TCP 74 47646 > http [SYN] Seq=0 Win=14600 Len=0 MSS=1460 SACK_PERM=1 TSval=44251929 TSecr=0 WS=128  tcp.stream == 8
306   6.365677 216.165.108.217 -> 204.141.87.24 TCP 74 47647 > http [SYN] Seq=0 Win=14600 Len=0 MSS=1460 SACK_PERM=1 TSval=44251929 TSecr=0 WS=128  tcp.stream == 9
307   6.365787 216.165.108.217 -> 4.26.251.254 TCP 74 59121 > http [SYN] Seq=0 Win=14600 Len=0 MSS=1460 SACK_PERM=1 TSval=44251929 TSecr=0 WS=128  tcp.stream == 10
308   6.365890 216.165.108.217 -> 4.26.251.254 TCP 74 59122 > http [SYN] Seq=0 Win=14600 Len=0 MSS=1460 SACK_PERM=1 TSval=44251929 TSecr=0 WS=128  tcp.stream == 11
309   6.367661 4.26.251.254 -> 216.165.108.217 TCP 74 http > 59121 [SYN, ACK] Seq=0 Ack=1 Win=5792 Len=0 MSS=1460 SACK_PERM=1 TSval=3204712166 TSecr=44251929 WS=128  tcp.stream == 10
310   6.367689 216.165.108.217 -> 4.26.251.254 TCP 66 59121 > http [ACK] Seq=1 Ack=1 Win=14720 Len=0 TSval=44251929 TSecr=3204712166  tcp.stream == 10
311   6.367734 216.165.108.217 -> 4.26.251.254 HTTP 405 GET /cnn/.e/img/3.0/global/header/hdr-main.gif HTTP/1.1   tcp.stream == 10
312   6.367793 4.26.251.254 -> 216.165.108.217 TCP 74 http > 59122 [SYN, ACK] Seq=0 Ack=1 Win=5792 Len=0 MSS=1460 SACK_PERM=1 TSval=3364553044 TSecr=44251929 WS=128  tcp.stream == 11
313   6.367806 216.165.108.217 -> 4.26.251.254 TCP 66 59122 > http [ACK] Seq=1 Ack=1 Win=14720 Len=0 TSval=44251929 TSecr=3364553044  tcp.stream == 11
314   6.367864 216.165.108.217 -> 4.26.251.254 HTTP 406 GET /cnn/.e/img/3.0/global/header/nav-arrow.gif HTTP/1.1   tcp.stream == 11
315   6.369845 4.26.251.254 -> 216.165.108.217 TCP 66 http > 59122 [ACK] Seq=1 Ack=341 Win=6912 Len=0 TSval=3364553046 TSecr=44251929  tcp.stream == 11
316   6.370104 4.26.251.254 -> 216.165.108.217 HTTP 418 HTTP/1.1 200 OK  (GIF89a)  tcp.stream == 11
317   6.370113 216.165.108.217 -> 4.26.251.254 TCP 66 59122 > http [ACK] Seq=341 Ack=353 Win=15744 Len=0 TSval=44251930 TSecr=3364553046  tcp.stream == 11
318   6.370362 4.26.251.254 -> 216.165.108.217 TCP 66 http > 59121 [ACK] Seq=1 Ack=340 Win=6912 Len=0 TSval=3204712168 TSecr=44251929  tcp.stream == 10
319   6.370682 4.26.251.254 -> 216.165.108.217 TCP 1514 [TCP segment of a reassembled PDU]  tcp.stream == 10
320   6.370696 216.165.108.217 -> 4.26.251.254 TCP 66 59121 > http [ACK] Seq=340 Ack=1449 Win=17536 Len=0 TSval=44251930 TSecr=3204712168  tcp.stream == 10
321   6.370804 4.26.251.254 -> 216.165.108.217 TCP 1514 [TCP segment of a reassembled PDU]  tcp.stream == 10
322   6.370811 216.165.108.217 -> 4.26.251.254 TCP 66 59121 > http [ACK] Seq=340 Ack=2897 Win=20480 Len=0 TSval=44251930 TSecr=3204712168  tcp.stream == 10
323   6.370921 4.26.251.254 -> 216.165.108.217 TCP 1514 [TCP segment of a reassembled PDU]  tcp.stream == 10
324   6.370929 216.165.108.217 -> 4.26.251.254 TCP 66 59121 > http [ACK] Seq=340 Ack=4345 Win=23296 Len=0 TSval=44251930 TSecr=3204712168  tcp.stream == 10
325   6.373221 4.26.251.254 -> 216.165.108.217 TCP 1514 [TCP segment of a reassembled PDU]  tcp.stream == 10
326   6.373237 216.165.108.217 -> 4.26.251.254 TCP 66 59121 > http [ACK] Seq=340 Ack=5793 Win=26240 Len=0 TSval=44251931 TSecr=3204712171  tcp.stream == 10
327   6.373347 4.26.251.254 -> 216.165.108.217 TCP 1514 [TCP segment of a reassembled PDU]  tcp.stream == 10
328   6.373354 216.165.108.217 -> 4.26.251.254 TCP 66 59121 > http [ACK] Seq=340 Ack=7241 Win=29184 Len=0 TSval=44251931 TSecr=3204712171  tcp.stream == 10
329   6.373357 4.26.251.254 -> 216.165.108.217 HTTP 819 HTTP/1.1 200 OK  (GIF89a)  tcp.stream == 10
330   6.373359 216.165.108.217 -> 4.26.251.254 TCP 66 59121 > http [ACK] Seq=340 Ack=7994 Win=32000 Len=0 TSval=44251931 TSecr=3204712171  tcp.stream == 10
335   6.377438 157.166.255.19 -> 216.165.108.217 TCP 1514 [TCP segment of a reassembled PDU]  tcp.stream == 7
336   6.377453 216.165.108.217 -> 157.166.255.19 TCP 66 45093 > http [ACK] Seq=294 Ack=13033 Win=40704 Len=0 TSval=44251932 TSecr=172048244  tcp.stream == 7
337   6.377613 157.166.255.19 -> 216.165.108.217 TCP 1514 [TCP segment of a reassembled PDU]  tcp.stream == 7
338   6.377620 216.165.108.217 -> 157.166.255.19 TCP 66 45093 > http [ACK] Seq=294 Ack=14481 Win=43648 Len=0 TSval=44251932 TSecr=172048244  tcp.stream == 7
339   6.377735 157.166.255.19 -> 216.165.108.217 TCP 1514 [TCP segment of a reassembled PDU]  tcp.stream == 7
340   6.377742 216.165.108.217 -> 157.166.255.19 TCP 66 45093 > http [ACK] Seq=294 Ack=15929 Win=46464 Len=0 TSval=44251932 TSecr=172048244  tcp.stream == 7
341   6.377892 157.166.255.19 -> 216.165.108.217 TCP 1514 [TCP segment of a reassembled PDU]  tcp.stream == 7
342   6.377901 216.165.108.217 -> 157.166.255.19 TCP 66 45093 > http [ACK] Seq=294 Ack=17377 Win=49408 Len=0 TSval=44251932 TSecr=172048244  tcp.stream == 7
343   6.378018 157.166.255.19 -> 216.165.108.217 TCP 1514 [TCP segment of a reassembled PDU]  tcp.stream == 7
344   6.378025 216.165.108.217 -> 157.166.255.19 TCP 66 45093 > http [ACK] Seq=294 Ack=18825 Win=52352 Len=0 TSval=44251932 TSecr=172048244  tcp.stream == 7
345   6.378137 157.166.255.19 -> 216.165.108.217 TCP 1514 [TCP segment of a reassembled PDU]  tcp.stream == 7
346   6.378142 216.165.108.217 -> 157.166.255.19 TCP 66 45093 > http [ACK] Seq=294 Ack=20273 Win=55168 Len=0 TSval=44251932 TSecr=172048244  tcp.stream == 7
347   6.378263 157.166.255.19 -> 216.165.108.217 TCP 1514 [TCP segment of a reassembled PDU]  tcp.stream == 7
348   6.378270 216.165.108.217 -> 157.166.255.19 TCP 66 45093 > http [ACK] Seq=294 Ack=21721 Win=58112 Len=0 TSval=44251932 TSecr=172048244  tcp.stream == 7
349   6.378385 157.166.255.19 -> 216.165.108.217 TCP 1514 [TCP segment of a reassembled PDU]  tcp.stream == 7
350   6.378391 216.165.108.217 -> 157.166.255.19 TCP 66 45093 > http [ACK] Seq=294 Ack=23169 Win=61056 Len=0 TSval=44251932 TSecr=172048244  tcp.stream == 7
351   6.378510 157.166.255.19 -> 216.165.108.217 TCP 1514 [TCP segment of a reassembled PDU]  tcp.stream == 7
352   6.378514 216.165.108.217 -> 157.166.255.19 TCP 66 45093 > http [ACK] Seq=294 Ack=24617 Win=63872 Len=0 TSval=44251932 TSecr=172048244  tcp.stream == 7
353   6.378566 157.166.255.19 -> 216.165.108.217 HTTP 987 HTTP/1.1 200 OK  (text/html)  tcp.stream == 7
354   6.378571 216.165.108.217 -> 157.166.255.19 TCP 66 45093 > http [ACK] Seq=294 Ack=25538 Win=64128 Len=0 TSval=44251932 TSecr=172048244  tcp.stream == 7
355   6.384237 204.141.87.24 -> 216.165.108.217 TCP 74 http > 47646 [SYN, ACK] Seq=0 Ack=1 Win=14480 Len=0 MSS=1460 SACK_PERM=1 TSval=2003791312 TSecr=44251929 WS=4  tcp.stream == 8
356   6.384259 216.165.108.217 -> 204.141.87.24 TCP 66 47646 > http [ACK] Seq=1 Ack=1 Win=14720 Len=0 TSval=44251934 TSecr=2003791312  tcp.stream == 8
357   6.384305 216.165.108.217 -> 204.141.87.24 HTTP 406 GET /cnn/tmpl_asset/static/www_homepage/1064/css/hplib-min.css HTTP/1.1   tcp.stream == 8
358   6.384473 204.141.87.24 -> 216.165.108.217 TCP 74 http > 47647 [SYN, ACK] Seq=0 Ack=1 Win=14480 Len=0 MSS=1460 SACK_PERM=1 TSval=2003791312 TSecr=44251929 WS=4  tcp.stream == 9
359   6.384487 216.165.108.217 -> 204.141.87.24 TCP 66 47647 > http [ACK] Seq=1 Ack=1 Win=14720 Len=0 TSval=44251934 TSecr=2003791312  tcp.stream == 9
360   6.384529 216.165.108.217 -> 204.141.87.24 HTTP 389 GET /cnn/tmpl_asset/static/www_homepage/1064/js/hplib-min.js HTTP/1.1   tcp.stream == 9
361   6.386631 216.165.108.217 -> 157.166.255.19 HTTP 371 GET /favicon.ie9.ico HTTP/1.1   tcp.stream == 7
362   6.386818 216.165.108.217 -> 4.26.251.254 HTTP 406 GET /cnn/.e/img/3.0/global/icons/video_icon.gif HTTP/1.1   tcp.stream == 10
363   6.386866 216.165.108.217 -> 4.27.18.126  TCP 74 54795 > http [SYN] Seq=0 Win=14600 Len=0 MSS=1460 SACK_PERM=1 TSval=44251934 TSecr=0 WS=128  tcp.stream == 12
364   6.387761 216.165.108.217 -> 4.26.251.254 HTTP 386 GET /cnn/.e/img/3.0/1px.gif HTTP/1.1   tcp.stream == 11
365   6.387852 216.165.108.217 -> 4.27.18.126  TCP 74 54796 > http [SYN] Seq=0 Win=14600 Len=0 MSS=1460 SACK_PERM=1 TSval=44251934 TSecr=0 WS=128  tcp.stream == 13
366   6.388434 4.26.251.254 -> 216.165.108.217 HTTP 464 HTTP/1.1 200 OK  (GIF89a)  tcp.stream == 10
367   6.388617 216.165.108.217 -> 4.27.18.126  TCP 74 54797 > http [SYN] Seq=0 Win=14600 Len=0 MSS=1460 SACK_PERM=1 TSval=44251935 TSecr=0 WS=128  tcp.stream == 14
368   6.388741 216.165.108.217 -> 4.27.18.126  TCP 74 54798 > http [SYN] Seq=0 Win=14600 Len=0 MSS=1460 SACK_PERM=1 TSval=44251935 TSecr=0 WS=128  tcp.stream == 15
369   6.388851 216.165.108.217 -> 4.27.18.126  TCP 74 54799 > http [SYN] Seq=0 Win=14600 Len=0 MSS=1460 SACK_PERM=1 TSval=44251935 TSecr=0 WS=128  tcp.stream == 16
370   6.388961 216.165.108.217 -> 4.27.18.126  TCP 74 54800 > http [SYN] Seq=0 Win=14600 Len=0 MSS=1460 SACK_PERM=1 TSval=44251935 TSecr=0 WS=128  tcp.stream == 17
371   6.389256 216.165.108.217 -> 4.26.251.254 HTTP 408 GET /cnn/.e/img/3.0/global/misc/advertisement.gif HTTP/1.1   tcp.stream == 10
372   6.389367  4.27.18.126 -> 216.165.108.217 TCP 74 http > 54796 [SYN, ACK] Seq=0 Ack=1 Win=5792 Len=0 MSS=1460 SACK_PERM=1 TSval=2809399802 TSecr=44251934 WS=128  tcp.stream == 13
373   6.389382 216.165.108.217 -> 4.27.18.126  TCP 66 54796 > http [ACK] Seq=1 Ack=1 Win=14720 Len=0 TSval=44251935 TSecr=2809399802  tcp.stream == 13
374   6.389386  4.27.18.126 -> 216.165.108.217 TCP 74 http > 54795 [SYN, ACK] Seq=0 Ack=1 Win=5792 Len=0 MSS=1460 SACK_PERM=1 TSval=3518290933 TSecr=44251934 WS=128  tcp.stream == 12
375   6.389393 216.165.108.217 -> 4.27.18.126  TCP 66 54795 > http [ACK] Seq=1 Ack=1 Win=14720 Len=0 TSval=44251935 TSecr=3518290933  tcp.stream == 12
376   6.389541 216.165.108.217 -> 4.27.18.126  HTTP 460 GET /cnn/dam/assets/120104091455-airplane-airlines-china-european-union-carbon-emissions-c1-main.jpg HTTP/1.1   tcp.stream == 13
377   6.389555 216.165.108.217 -> 4.27.18.126  HTTP 424 GET /cnn/dam/assets/120216044609-honduras-body-count-t1-main.jpg HTTP/1.1   tcp.stream == 12
378   6.389598 216.165.108.217 -> 4.26.251.254 TCP 74 59129 > http [SYN] Seq=0 Win=14600 Len=0 MSS=1460 SACK_PERM=1 TSval=44251935 TSecr=0 WS=128  tcp.stream == 18
379   6.389746 216.165.108.217 -> 4.26.251.254 TCP 74 59130 > http [SYN] Seq=0 Win=14600 Len=0 MSS=1460 SACK_PERM=1 TSval=44251935 TSecr=0 WS=128  tcp.stream == 19
380   6.389796 4.26.251.254 -> 216.165.108.217 HTTP 368 HTTP/1.1 200 OK  (GIF89a)  tcp.stream == 11
381   6.389867  4.27.18.126 -> 216.165.108.217 TCP 74 http > 54797 [SYN, ACK] Seq=0 Ack=1 Win=5792 Len=0 MSS=1460 SACK_PERM=1 TSval=2809453346 TSecr=44251935 WS=128  tcp.stream == 14
382   6.389876 216.165.108.217 -> 4.27.18.126  TCP 66 54797 > http [ACK] Seq=1 Ack=1 Win=14720 Len=0 TSval=44251935 TSecr=2809453346  tcp.stream == 14
383   6.389894 216.165.108.217 -> 4.26.251.254 HTTP 419 GET /cnn/.e/img/3.0/personalization/35x35_generic_avatar.gif HTTP/1.1   tcp.stream == 11
384   6.390040 216.165.108.217 -> 4.27.18.126  HTTP 424 GET /cnn/dam/assets/120214010549-inside-syria-2-wall-4-tease.jpg HTTP/1.1   tcp.stream == 14
385   6.390046  4.27.18.126 -> 216.165.108.217 TCP 74 http > 54800 [SYN, ACK] Seq=0 Ack=1 Win=5792 Len=0 MSS=1460 SACK_PERM=1 TSval=2809453346 TSecr=44251935 WS=128  tcp.stream == 17
386   6.390053 216.165.108.217 -> 4.27.18.126  TCP 66 54800 > http [ACK] Seq=1 Ack=1 Win=14720 Len=0 TSval=44251935 TSecr=2809453346  tcp.stream == 17
387   6.390056  4.27.18.126 -> 216.165.108.217 TCP 74 http > 54799 [SYN, ACK] Seq=0 Ack=1 Win=5792 Len=0 MSS=1460 SACK_PERM=1 TSval=2472619013 TSecr=44251935 WS=128  tcp.stream == 16
388   6.390061 216.165.108.217 -> 4.27.18.126  TCP 66 54799 > http [ACK] Seq=1 Ack=1 Win=14720 Len=0 TSval=44251935 TSecr=2472619013  tcp.stream == 16
389   6.390102 216.165.108.217 -> 4.27.18.126  HTTP 447 GET /cnn/dam/assets/120216080144-bts-randy-travis-arrest-video-00001623-video-tease.jpg HTTP/1.1   tcp.stream == 16
390   6.390112 216.165.108.217 -> 4.27.18.126  HTTP 423 GET /cnn/dam/assets/120216041110-factory-worker-video-tease.jpg HTTP/1.1   tcp.stream == 17
391   6.390146  4.27.18.126 -> 216.165.108.217 TCP 74 http > 54798 [SYN, ACK] Seq=0 Ack=1 Win=5792 Len=0 MSS=1460 SACK_PERM=1 TSval=3086375609 TSecr=44251935 WS=128  tcp.stream == 15
392   6.390155 216.165.108.217 -> 4.27.18.126  TCP 66 54798 > http [ACK] Seq=1 Ack=1 Win=14720 Len=0 TSval=44251935 TSecr=3086375609  tcp.stream == 15
393   6.390191 216.165.108.217 -> 4.27.18.126  HTTP 422 GET /cnn/dam/assets/120216115334-jeremy-lin-05-video-tease.jpg HTTP/1.1   tcp.stream == 15
394   6.390347 4.26.251.254 -> 216.165.108.217 TCP 74 http > 59130 [SYN, ACK] Seq=0 Ack=1 Win=5792 Len=0 MSS=1460 SACK_PERM=1 TSval=3364555035 TSecr=44251935 WS=128  tcp.stream == 19
395   6.390358 216.165.108.217 -> 4.26.251.254 TCP 66 59130 > http [ACK] Seq=1 Ack=1 Win=14720 Len=0 TSval=44251935 TSecr=3364555035  tcp.stream == 19
396   6.390401 216.165.108.217 -> 4.26.251.254 HTTP 407 GET /cnn/.e/img/3.0/personalization/close_bt.gif HTTP/1.1   tcp.stream == 19
398   6.390644  4.27.18.126 -> 216.165.108.217 TCP 66 http > 54796 [ACK] Seq=1 Ack=395 Win=6912 Len=0 TSval=2809399804 TSecr=44251935  tcp.stream == 13
399   6.390652 4.26.251.254 -> 216.165.108.217 TCP 74 http > 59129 [SYN, ACK] Seq=0 Ack=1 Win=5792 Len=0 MSS=1460 SACK_PERM=1 TSval=3364554526 TSecr=44251935 WS=128  tcp.stream == 18
400   6.390660 216.165.108.217 -> 4.26.251.254 TCP 66 59129 > http [ACK] Seq=1 Ack=1 Win=14720 Len=0 TSval=44251935 TSecr=3364554526  tcp.stream == 18
401   6.390997  4.27.18.126 -> 216.165.108.217 TCP 1514 [TCP segment of a reassembled PDU]  tcp.stream == 13
402   6.391006 216.165.108.217 -> 4.27.18.126  TCP 66 54796 > http [ACK] Seq=395 Ack=1449 Win=17536 Len=0 TSval=44251935 TSecr=2809399804  tcp.stream == 13
403   6.391119  4.27.18.126 -> 216.165.108.217 TCP 1514 [TCP segment of a reassembled PDU]  tcp.stream == 13
404   6.391125 216.165.108.217 -> 4.27.18.126  TCP 66 54796 > http [ACK] Seq=395 Ack=2897 Win=20480 Len=0 TSval=44251935 TSecr=2809399804  tcp.stream == 13
405   6.391176 4.26.251.254 -> 216.165.108.217 TCP 66 http > 59130 [ACK] Seq=1 Ack=342 Win=6912 Len=0 TSval=3364555036 TSecr=44251935  tcp.stream == 19
406   6.391184  4.27.18.126 -> 216.165.108.217 TCP 66 http > 54800 [ACK] Seq=1 Ack=358 Win=6912 Len=0 TSval=2809453347 TSecr=44251935  tcp.stream == 17
407   6.391394  4.27.18.126 -> 216.165.108.217 TCP 66 http > 54797 [ACK] Seq=1 Ack=359 Win=6912 Len=0 TSval=2809453347 TSecr=44251935  tcp.stream == 14
408   6.391404  4.27.18.126 -> 216.165.108.217 TCP 66 http > 54799 [ACK] Seq=1 Ack=382 Win=6912 Len=0 TSval=2472619014 TSecr=44251935  tcp.stream == 16
409   6.391465 4.26.251.254 -> 216.165.108.217 HTTP 618 HTTP/1.1 200 OK  (GIF89a)  tcp.stream == 19
410   6.391472 216.165.108.217 -> 4.26.251.254 TCP 66 59130 > http [ACK] Seq=342 Ack=553 Win=15744 Len=0 TSval=44251935 TSecr=3364555036  tcp.stream == 19
411   6.391777  4.27.18.126 -> 216.165.108.217 TCP 1514 [TCP segment of a reassembled PDU]  tcp.stream == 14
412   6.391787 216.165.108.217 -> 4.27.18.126  TCP 66 54797 > http [ACK] Seq=359 Ack=1449 Win=17536 Len=0 TSval=44251935 TSecr=2809453348  tcp.stream == 14
413   6.391898  4.27.18.126 -> 216.165.108.217 TCP 1514 [TCP segment of a reassembled PDU]  tcp.stream == 14
414   6.391904 216.165.108.217 -> 4.27.18.126  TCP 66 54797 > http [ACK] Seq=359 Ack=2897 Win=20480 Len=0 TSval=44251935 TSecr=2809453348  tcp.stream == 14
415   6.392021  4.27.18.126 -> 216.165.108.217 TCP 1514 [TCP segment of a reassembled PDU]  tcp.stream == 17
416   6.392027 216.165.108.217 -> 4.27.18.126  TCP 66 54800 > http [ACK] Seq=358 Ack=1449 Win=17536 Len=0 TSval=44251935 TSecr=2809453348  tcp.stream == 17
417   6.392144  4.27.18.126 -> 216.165.108.217 TCP 1514 [TCP segment of a reassembled PDU]  tcp.stream == 17
418   6.392150 216.165.108.217 -> 4.27.18.126  TCP 66 54800 > http [ACK] Seq=358 Ack=2897 Win=20480 Len=0 TSval=44251935 TSecr=2809453348  tcp.stream == 17
419   6.392155 4.26.251.254 -> 216.165.108.217 HTTP 555 HTTP/1.1 200 OK  (GIF89a)  tcp.stream == 11
420   6.392398  4.27.18.126 -> 216.165.108.217 TCP 1514 [TCP segment of a reassembled PDU]  tcp.stream == 17
421   6.392405 216.165.108.217 -> 4.27.18.126  TCP 66 54800 > http [ACK] Seq=358 Ack=4345 Win=23296 Len=0 TSval=44251936 TSecr=2809453348  tcp.stream == 17
422   6.392516  4.27.18.126 -> 216.165.108.217 TCP 1514 [TCP segment of a reassembled PDU]  tcp.stream == 14
423   6.392521 216.165.108.217 -> 4.27.18.126  TCP 66 54797 > http [ACK] Seq=359 Ack=4345 Win=23296 Len=0 TSval=44251936 TSecr=2809453348  tcp.stream == 14
424   6.392679  4.27.18.126 -> 216.165.108.217 TCP 1514 [TCP segment of a reassembled PDU]  tcp.stream == 16
425   6.392685 216.165.108.217 -> 4.27.18.126  TCP 66 54799 > http [ACK] Seq=382 Ack=1449 Win=17536 Len=0 TSval=44251936 TSecr=2472619014  tcp.stream == 16
426   6.392802  4.27.18.126 -> 216.165.108.217 TCP 1514 [TCP segment of a reassembled PDU]  tcp.stream == 16
427   6.392809 216.165.108.217 -> 4.27.18.126  TCP 66 54799 > http [ACK] Seq=382 Ack=2897 Win=20480 Len=0 TSval=44251936 TSecr=2472619014  tcp.stream == 16
428   6.392813  4.27.18.126 -> 216.165.108.217 HTTP 582 HTTP/1.1 200 OK  (JPEG JFIF image)  tcp.stream == 16
429   6.392816 216.165.108.217 -> 4.27.18.126  TCP 66 54799 > http [ACK] Seq=382 Ack=3413 Win=23296 Len=0 TSval=44251936 TSecr=2472619014  tcp.stream == 16
430   6.392819  4.27.18.126 -> 216.165.108.217 TCP 66 http > 54798 [ACK] Seq=1 Ack=357 Win=6912 Len=0 TSval=3086375611 TSecr=44251935  tcp.stream == 15
431   6.392893 216.165.108.217 -> 4.27.18.126  HTTP 445 GET /cnn/dam/assets/120216023144-dnt-complicated-school-sign-00001006-video-tease.jpg HTTP/1.1   tcp.stream == 16
432   6.393039  4.27.18.126 -> 216.165.108.217 TCP 1514 [TCP segment of a reassembled PDU]  tcp.stream == 15
433   6.393046 216.165.108.217 -> 4.27.18.126  TCP 66 54798 > http [ACK] Seq=357 Ack=1449 Win=17536 Len=0 TSval=44251936 TSecr=3086375611  tcp.stream == 15
434   6.393162  4.27.18.126 -> 216.165.108.217 TCP 1514 [TCP segment of a reassembled PDU]  tcp.stream == 15
435   6.393168 216.165.108.217 -> 4.27.18.126  TCP 66 54798 > http [ACK] Seq=357 Ack=2897 Win=20480 Len=0 TSval=44251936 TSecr=3086375611  tcp.stream == 15
436   6.393172  4.27.18.126 -> 216.165.108.217 TCP 66 http > 54795 [ACK] Seq=1 Ack=359 Win=6912 Len=0 TSval=3518290936 TSecr=44251935  tcp.stream == 12
437   6.393219 4.26.251.254 -> 216.165.108.217 HTTP 419 HTTP/1.1 200 OK  (GIF89a)  tcp.stream == 10
438   6.393398  4.27.18.126 -> 216.165.108.217 TCP 1514 [TCP segment of a reassembled PDU]  tcp.stream == 13
439   6.393405 216.165.108.217 -> 4.27.18.126  TCP 66 54796 > http [ACK] Seq=395 Ack=4345 Win=23296 Len=0 TSval=44251936 TSecr=2809399805  tcp.stream == 13
440   6.393523  4.27.18.126 -> 216.165.108.217 TCP 1514 [TCP segment of a reassembled PDU]  tcp.stream == 13
441   6.393530 216.165.108.217 -> 4.27.18.126  TCP 66 54796 > http [ACK] Seq=395 Ack=5793 Win=26240 Len=0 TSval=44251936 TSecr=2809399805  tcp.stream == 13
442   6.393645  4.27.18.126 -> 216.165.108.217 TCP 1514 [TCP segment of a reassembled PDU]  tcp.stream == 13
443   6.393652 216.165.108.217 -> 4.27.18.126  TCP 66 54796 > http [ACK] Seq=395 Ack=7241 Win=29184 Len=0 TSval=44251936 TSecr=2809399805  tcp.stream == 13
444   6.393768  4.27.18.126 -> 216.165.108.217 TCP 1514 [TCP segment of a reassembled PDU]  tcp.stream == 13
445   6.393774 216.165.108.217 -> 4.27.18.126  TCP 66 54796 > http [ACK] Seq=395 Ack=8689 Win=32000 Len=0 TSval=44251936 TSecr=2809399805  tcp.stream == 13
446   6.393955  4.27.18.126 -> 216.165.108.217 TCP 1514 [TCP segment of a reassembled PDU]  tcp.stream == 14
447   6.393961 216.165.108.217 -> 4.27.18.126  TCP 66 54797 > http [ACK] Seq=359 Ack=5793 Win=26240 Len=0 TSval=44251936 TSecr=2809453349  tcp.stream == 14
448   6.394076  4.27.18.126 -> 216.165.108.217 TCP 1514 [TCP segment of a reassembled PDU]  tcp.stream == 14
449   6.394082 216.165.108.217 -> 4.27.18.126  TCP 66 54797 > http [ACK] Seq=359 Ack=7241 Win=29184 Len=0 TSval=44251936 TSecr=2809453349  tcp.stream == 14
450   6.394203  4.27.18.126 -> 216.165.108.217 TCP 1514 [TCP segment of a reassembled PDU]  tcp.stream == 17
451   6.394211 216.165.108.217 -> 4.27.18.126  TCP 66 54800 > http [ACK] Seq=358 Ack=5793 Win=26240 Len=0 TSval=44251936 TSecr=2809453349  tcp.stream == 17
452   6.394215  4.27.18.126 -> 216.165.108.217 HTTP 203 HTTP/1.1 200 OK  (JPEG JFIF image)  tcp.stream == 17
453   6.394218 216.165.108.217 -> 4.27.18.126  TCP 66 54800 > http [ACK] Seq=358 Ack=5930 Win=29184 Len=0 TSval=44251936 TSecr=2809453349  tcp.stream == 17
454   6.394260  4.27.18.126 -> 216.165.108.217 HTTP 875 HTTP/1.1 200 OK  (JPEG JFIF image)  tcp.stream == 14
455   6.394263 216.165.108.217 -> 4.27.18.126  TCP 66 54797 > http [ACK] Seq=359 Ack=8050 Win=32000 Len=0 TSval=44251936 TSecr=2809453349  tcp.stream == 14
456   6.394440 216.165.108.217 -> 4.27.18.126  HTTP 433 GET /cnn/dam/assets/120216040929-mit-folding-car-00013206-video-tease.jpg HTTP/1.1   tcp.stream == 14
457   6.394470 216.165.108.217 -> 4.27.18.126  HTTP 417 GET /cnn/dam/assets/120215062737-dog-face-video-tease.jpg HTTP/1.1   tcp.stream == 17
458   6.394565  4.27.18.126 -> 216.165.108.217 TCP 1514 [TCP segment of a reassembled PDU]  tcp.stream == 15
459   6.394573 216.165.108.217 -> 4.27.18.126  TCP 66 54798 > http [ACK] Seq=357 Ack=4345 Win=23296 Len=0 TSval=44251936 TSecr=3086375613  tcp.stream == 15
460   6.394685  4.27.18.126 -> 216.165.108.217 TCP 1514 [TCP segment of a reassembled PDU]  tcp.stream == 15
461   6.394691 216.165.108.217 -> 4.27.18.126  TCP 66 54798 > http [ACK] Seq=357 Ack=5793 Win=26240 Len=0 TSval=44251936 TSecr=3086375613  tcp.stream == 15
462   6.394895  4.27.18.126 -> 216.165.108.217 TCP 1514 [TCP segment of a reassembled PDU]  tcp.stream == 16
463   6.395014  4.27.18.126 -> 216.165.108.217 TCP 1514 [TCP segment of a reassembled PDU]  tcp.stream == 16
464   6.395022 216.165.108.217 -> 4.27.18.126  TCP 66 54799 > http [ACK] Seq=761 Ack=6309 Win=29184 Len=0 TSval=44251936 TSecr=2472619017  tcp.stream == 16
465   6.395122  4.27.18.126 -> 216.165.108.217 HTTP 1304 HTTP/1.1 200 OK  (JPEG JFIF image)  tcp.stream == 16
466   6.395247  4.27.18.126 -> 216.165.108.217 TCP 1514 [TCP segment of a reassembled PDU]  tcp.stream == 13
467   6.395254 216.165.108.217 -> 4.27.18.126  TCP 66 54796 > http [ACK] Seq=395 Ack=10137 Win=34944 Len=0 TSval=44251936 TSecr=2809399808  tcp.stream == 13
468   6.395427  4.27.18.126 -> 216.165.108.217 TCP 1514 [TCP segment of a reassembled PDU]  tcp.stream == 13
469   6.395433 216.165.108.217 -> 4.27.18.126  TCP 66 54796 > http [ACK] Seq=395 Ack=11585 Win=37888 Len=0 TSval=44251936 TSecr=2809399808  tcp.stream == 13
470   6.395548  4.27.18.126 -> 216.165.108.217 TCP 1514 [TCP segment of a reassembled PDU]  tcp.stream == 13
471   6.395553 216.165.108.217 -> 4.27.18.126  TCP 66 54796 > http [ACK] Seq=395 Ack=13033 Win=40704 Len=0 TSval=44251936 TSecr=2809399808  tcp.stream == 13
472   6.395674  4.27.18.126 -> 216.165.108.217 TCP 1514 [TCP segment of a reassembled PDU]  tcp.stream == 13
473   6.395680 216.165.108.217 -> 4.27.18.126  TCP 66 54796 > http [ACK] Seq=395 Ack=14481 Win=43648 Len=0 TSval=44251936 TSecr=2809399808  tcp.stream == 13
474   6.395791  4.27.18.126 -> 216.165.108.217 HTTP 1461 HTTP/1.1 200 OK  (JPEG JFIF image)  tcp.stream == 13
475   6.395797 216.165.108.217 -> 4.27.18.126  TCP 66 54796 > http [ACK] Seq=395 Ack=15876 Win=46464 Len=0 TSval=44251936 TSecr=2809399808  tcp.stream == 13
476   6.395916  4.27.18.126 -> 216.165.108.217 TCP 1514 [TCP segment of a reassembled PDU]  tcp.stream == 15
477   6.395923 216.165.108.217 -> 4.27.18.126  TCP 66 54798 > http [ACK] Seq=357 Ack=7241 Win=29184 Len=0 TSval=44251936 TSecr=3086375614  tcp.stream == 15
478   6.395927  4.27.18.126 -> 216.165.108.217 HTTP 622 HTTP/1.1 200 OK  (JPEG JFIF image)  tcp.stream == 15
479   6.395930 216.165.108.217 -> 4.27.18.126  TCP 66 54798 > http [ACK] Seq=357 Ack=7797 Win=32000 Len=0 TSval=44251936 TSecr=3086375614  tcp.stream == 15
480   6.396165  4.27.18.126 -> 216.165.108.217 TCP 1514 [TCP segment of a reassembled PDU]  tcp.stream == 17
481   6.396281  4.27.18.126 -> 216.165.108.217 TCP 1514 [TCP segment of a reassembled PDU]  tcp.stream == 17
482   6.396287 216.165.108.217 -> 4.27.18.126  TCP 66 54800 > http [ACK] Seq=709 Ack=8826 Win=34944 Len=0 TSval=44251937 TSecr=2809453352  tcp.stream == 17
483   6.396406  4.27.18.126 -> 216.165.108.217 TCP 1514 [TCP segment of a reassembled PDU]  tcp.stream == 17
484   6.396456  4.27.18.126 -> 216.165.108.217 HTTP 820 HTTP/1.1 200 OK  (JPEG JFIF image)  tcp.stream == 17
485   6.396461 216.165.108.217 -> 4.27.18.126  TCP 66 54800 > http [ACK] Seq=709 Ack=11028 Win=40704 Len=0 TSval=44251937 TSecr=2809453352  tcp.stream == 17
486   6.396597  4.27.18.126 -> 216.165.108.217 TCP 1514 [TCP segment of a reassembled PDU]  tcp.stream == 14
487   6.396721  4.27.18.126 -> 216.165.108.217 TCP 1514 [TCP segment of a reassembled PDU]  tcp.stream == 14
488   6.396727 216.165.108.217 -> 4.27.18.126  TCP 66 54797 > http [ACK] Seq=726 Ack=10946 Win=37888 Len=0 TSval=44251937 TSecr=2809453352  tcp.stream == 14
489   6.396852  4.27.18.126 -> 216.165.108.217 TCP 1514 [TCP segment of a reassembled PDU]  tcp.stream == 14
490   6.396909  4.27.18.126 -> 216.165.108.217 HTTP 945 HTTP/1.1 200 OK  (JPEG JFIF image)  tcp.stream == 14
491   6.396914 216.165.108.217 -> 4.27.18.126  TCP 66 54797 > http [ACK] Seq=726 Ack=13273 Win=43648 Len=0 TSval=44251937 TSecr=2809453352  tcp.stream == 14
495   6.402753 204.141.87.24 -> 216.165.108.217 TCP 66 http > 47646 [ACK] Seq=1 Ack=341 Win=15552 Len=0 TSval=2003791330 TSecr=44251934  tcp.stream == 8
497   6.403154 204.141.87.24 -> 216.165.108.217 TCP 66 http > 47647 [ACK] Seq=1 Ack=324 Win=15552 Len=0 TSval=2003791331 TSecr=44251934  tcp.stream == 9
499   6.403533 204.141.87.24 -> 216.165.108.217 TCP 1514 [TCP segment of a reassembled PDU]  tcp.stream == 8
500   6.403547 216.165.108.217 -> 204.141.87.24 TCP 66 47646 > http [ACK] Seq=341 Ack=1449 Win=17536 Len=0 TSval=44251938 TSecr=2003791331  tcp.stream == 8
502   6.403657 204.141.87.24 -> 216.165.108.217 TCP 1514 [TCP segment of a reassembled PDU]  tcp.stream == 8
503   6.403662 216.165.108.217 -> 204.141.87.24 TCP 66 47646 > http [ACK] Seq=341 Ack=2897 Win=20480 Len=0 TSval=44251938 TSecr=2003791331  tcp.stream == 8
505   6.403776 204.141.87.24 -> 216.165.108.217 TCP 1514 [TCP segment of a reassembled PDU]  tcp.stream == 8
506   6.403781 216.165.108.217 -> 204.141.87.24 TCP 66 47646 > http [ACK] Seq=341 Ack=4345 Win=23296 Len=0 TSval=44251938 TSecr=2003791331  tcp.stream == 8
508   6.403969 204.141.87.24 -> 216.165.108.217 TCP 1514 [TCP segment of a reassembled PDU]  tcp.stream == 8
509   6.403974 216.165.108.217 -> 204.141.87.24 TCP 66 47646 > http [ACK] Seq=341 Ack=5793 Win=26240 Len=0 TSval=44251938 TSecr=2003791331  tcp.stream == 8
510   6.404385 204.141.87.24 -> 216.165.108.217 TCP 1514 [TCP segment of a reassembled PDU]  tcp.stream == 9
511   6.404396 216.165.108.217 -> 204.141.87.24 TCP 66 47647 > http [ACK] Seq=324 Ack=1449 Win=17536 Len=0 TSval=44251939 TSecr=2003791332  tcp.stream == 9
512   6.404502 204.141.87.24 -> 216.165.108.217 TCP 1514 [TCP segment of a reassembled PDU]  tcp.stream == 9
513   6.404508 216.165.108.217 -> 204.141.87.24 TCP 66 47647 > http [ACK] Seq=324 Ack=2897 Win=20480 Len=0 TSval=44251939 TSecr=2003791332  tcp.stream == 9
514   6.404625 204.141.87.24 -> 216.165.108.217 TCP 1514 [TCP segment of a reassembled PDU]  tcp.stream == 9
515   6.404632 216.165.108.217 -> 204.141.87.24 TCP 66 47647 > http [ACK] Seq=324 Ack=4345 Win=23296 Len=0 TSval=44251939 TSecr=2003791332  tcp.stream == 9
516   6.404748 204.141.87.24 -> 216.165.108.217 TCP 1514 [TCP segment of a reassembled PDU]  tcp.stream == 9
517   6.404755 216.165.108.217 -> 204.141.87.24 TCP 66 47647 > http [ACK] Seq=324 Ack=5793 Win=26240 Len=0 TSval=44251939 TSecr=2003791332  tcp.stream == 9
521   6.406295 157.166.255.19 -> 216.165.108.217 TCP 1514 [TCP segment of a reassembled PDU]  tcp.stream == 7
522   6.406478 157.166.255.19 -> 216.165.108.217 TCP 1514 [TCP segment of a reassembled PDU]  tcp.stream == 7
523   6.406489 216.165.108.217 -> 157.166.255.19 TCP 66 45093 > http [ACK] Seq=599 Ack=28434 Win=64128 Len=0 TSval=44251939 TSecr=172048246  tcp.stream == 7
525   6.406602 157.166.255.19 -> 216.165.108.217 TCP 1514 [TCP segment of a reassembled PDU]  tcp.stream == 7
526   6.406714 157.166.255.19 -> 216.165.108.217 HTTP 1436 HTTP/1.1 200 OK  (image/x-icon)  tcp.stream == 7
527   6.406720 216.165.108.217 -> 157.166.255.19 TCP 66 45093 > http [ACK] Seq=599 Ack=31252 Win=64128 Len=0 TSval=44251939 TSecr=172048246  tcp.stream == 7
528   6.408796 216.165.108.217 -> 4.26.251.254 HTTP 412 GET /cnn/.element/img/3.0/global/icons/video_icon.gif HTTP/1.1   tcp.stream == 10
529   6.409588 216.165.108.217 -> 4.27.18.126  HTTP 409 GET /cnn/2011/images/03/27/drdrewtitle.120x68.jpg HTTP/1.1   tcp.stream == 13
530   6.409947 216.165.108.217 -> 4.27.18.126  HTTP 408 GET /cnn/2009/images/10/27/ngrace120x68.copy.jpg HTTP/1.1   tcp.stream == 14
531   6.410248 216.165.108.217 -> 4.27.18.126  HTTP 410 GET /cnn/2011/images/09/26/cnn_presents.120x68.jpg HTTP/1.1   tcp.stream == 15
532   6.410431 216.165.108.217 -> 4.26.251.254 HTTP 415 GET /cnn/.e/img/3.0/global/footer/pngs/footer_google.png HTTP/1.1   tcp.stream == 19
533   6.410516 216.165.108.217 -> 4.26.251.254 HTTP 417 GET /cnn/.e/img/3.0/global/footer/pngs/footer_cnn_logo.png HTTP/1.1   tcp.stream == 11
534   6.410594 216.165.108.217 -> 4.26.251.254 HTTP 417 GET /cnn/.e/img/3.0/global/misc/logo_ad_choices_footer.png HTTP/1.1   tcp.stream == 18
535   6.410744 216.165.108.217 -> 204.141.87.24 TCP 74 47658 > http [SYN] Seq=0 Win=14600 Len=0 MSS=1460 SACK_PERM=1 TSval=44251940 TSecr=0 WS=128  tcp.stream == 20
536   6.410889 216.165.108.217 -> 204.245.162.59 TCP 74 59292 > http [SYN] Seq=0 Win=14600 Len=0 MSS=1460 SACK_PERM=1 TSval=44251940 TSecr=0 WS=128  tcp.stream == 21
537   6.411133 216.165.108.217 -> 204.141.87.74 TCP 74 56083 > http [SYN] Seq=0 Win=14600 Len=0 MSS=1460 SACK_PERM=1 TSval=44251940 TSecr=0 WS=128  tcp.stream == 22
538   6.411188  4.27.18.126 -> 216.165.108.217 TCP 1514 [TCP segment of a reassembled PDU]  tcp.stream == 13
539   6.411357  4.27.18.126 -> 216.165.108.217 TCP 1514 [TCP segment of a reassembled PDU]  tcp.stream == 13
540   6.411364 216.165.108.217 -> 4.27.18.126  TCP 66 54796 > http [ACK] Seq=738 Ack=18772 Win=52352 Len=0 TSval=44251940 TSecr=2809399824  tcp.stream == 13
541   6.411482  4.27.18.126 -> 216.165.108.217 TCP 1514 [TCP segment of a reassembled PDU]  tcp.stream == 13
542   6.411605  4.27.18.126 -> 216.165.108.217 TCP 1514 [TCP segment of a reassembled PDU]  tcp.stream == 13
543   6.411612 216.165.108.217 -> 4.27.18.126  TCP 66 54796 > http [ACK] Seq=738 Ack=21668 Win=58112 Len=0 TSval=44251940 TSecr=2809399824  tcp.stream == 13
544   6.411729  4.27.18.126 -> 216.165.108.217 TCP 1514 [TCP segment of a reassembled PDU]  tcp.stream == 13
545   6.411737  4.27.18.126 -> 216.165.108.217 HTTP 364 HTTP/1.1 200 OK  (JPEG JFIF image)  tcp.stream == 13
546   6.411740 216.165.108.217 -> 4.27.18.126  TCP 66 54796 > http [ACK] Seq=738 Ack=23414 Win=62848 Len=0 TSval=44251940 TSecr=2809399824  tcp.stream == 13
547   6.411792 4.26.251.254 -> 216.165.108.217 HTTP 459 HTTP/1.1 200 OK  (GIF89a)  tcp.stream == 10
548   6.412032 4.26.251.254 -> 216.165.108.217 TCP 1514 [TCP segment of a reassembled PDU]  tcp.stream == 19
549   6.412153  4.27.18.126 -> 216.165.108.217 TCP 1514 [TCP segment of a reassembled PDU]  tcp.stream == 14
550   6.412162 4.26.251.254 -> 216.165.108.217 HTTP 306 HTTP/1.1 200 OK  (PNG)  tcp.stream == 19
551   6.412166 216.165.108.217 -> 4.26.251.254 TCP 66 59130 > http [ACK] Seq=691 Ack=2241 Win=21504 Len=0 TSval=44251940 TSecr=3364555056  tcp.stream == 19
552   6.412304  4.27.18.126 -> 216.165.108.217 TCP 1514 [TCP segment of a reassembled PDU]  tcp.stream == 14
553   6.412313 216.165.108.217 -> 4.27.18.126  TCP 66 54797 > http [ACK] Seq=1068 Ack=16169 Win=49408 Len=0 TSval=44251941 TSecr=2809453367  tcp.stream == 14
554   6.412426  4.27.18.126 -> 216.165.108.217 TCP 1514 [TCP segment of a reassembled PDU]  tcp.stream == 14
555   6.412549  4.27.18.126 -> 216.165.108.217 TCP 1514 [TCP segment of a reassembled PDU]  tcp.stream == 14
556   6.412556 216.165.108.217 -> 4.27.18.126  TCP 66 54797 > http [ACK] Seq=1068 Ack=19065 Win=55168 Len=0 TSval=44251941 TSecr=2809453367  tcp.stream == 14
557   6.412672  4.27.18.126 -> 216.165.108.217 TCP 1514 [TCP segment of a reassembled PDU]  tcp.stream == 14
558   6.412793  4.27.18.126 -> 216.165.108.217 TCP 1514 [TCP segment of a reassembled PDU]  tcp.stream == 14
559   6.412800 216.165.108.217 -> 4.27.18.126  TCP 66 54797 > http [ACK] Seq=1068 Ack=21961 Win=61056 Len=0 TSval=44251941 TSecr=2809453367  tcp.stream == 14
560   6.412920  4.27.18.126 -> 216.165.108.217 TCP 1514 [TCP segment of a reassembled PDU]  tcp.stream == 14
561   6.412926 4.26.251.254 -> 216.165.108.217 TCP 66 http > 59129 [ACK] Seq=1 Ack=352 Win=6912 Len=0 TSval=3364554547 TSecr=44251940  tcp.stream == 18
562   6.413029 216.165.108.217 -> 209.244.156.19 TCP 74 46852 > http [SYN] Seq=0 Win=14600 Len=0 MSS=1460 SACK_PERM=1 TSval=44251941 TSecr=0 WS=128  tcp.stream == 23
563   6.413048  4.27.18.126 -> 216.165.108.217 TCP 1514 [TCP segment of a reassembled PDU]  tcp.stream == 14
564   6.413053 216.165.108.217 -> 4.27.18.126  TCP 66 54797 > http [ACK] Seq=1068 Ack=24857 Win=64128 Len=0 TSval=44251941 TSecr=2809453367  tcp.stream == 14
565   6.413098 4.26.251.254 -> 216.165.108.217 HTTP 911 HTTP/1.1 200 OK  (PNG)  tcp.stream == 18
566   6.413102 216.165.108.217 -> 4.26.251.254 TCP 66 59129 > http [ACK] Seq=352 Ack=846 Win=16384 Len=0 TSval=44251941 TSecr=3364554547  tcp.stream == 18
567   6.413154 4.26.251.254 -> 216.165.108.217 HTTP 801 HTTP/1.1 200 OK  (PNG)  tcp.stream == 11
568   6.413328  4.27.18.126 -> 216.165.108.217 TCP 1514 [TCP segment of a reassembled PDU]  tcp.stream == 15
569   6.413351 216.165.108.217 -> 74.217.240.83 TCP 74 56827 > http [SYN] Seq=0 Win=14600 Len=0 MSS=1460 SACK_PERM=1 TSval=44251941 TSecr=0 WS=128  tcp.stream == 24
570   6.413449  4.27.18.126 -> 216.165.108.217 TCP 1514 [TCP segment of a reassembled PDU]  tcp.stream == 15
571   6.413455 216.165.108.217 -> 4.27.18.126  TCP 66 54798 > http [ACK] Seq=701 Ack=10693 Win=37888 Len=0 TSval=44251941 TSecr=3086375632  tcp.stream == 15
572   6.413572  4.27.18.126 -> 216.165.108.217 TCP 1514 [TCP segment of a reassembled PDU]  tcp.stream == 15
573   6.413694  4.27.18.126 -> 216.165.108.217 TCP 1514 [TCP segment of a reassembled PDU]  tcp.stream == 15
574   6.413702 216.165.108.217 -> 4.27.18.126  TCP 66 54798 > http [ACK] Seq=701 Ack=13589 Win=43648 Len=0 TSval=44251941 TSecr=3086375632  tcp.stream == 15
575   6.413819  4.27.18.126 -> 216.165.108.217 TCP 1514 [TCP segment of a reassembled PDU]  tcp.stream == 15
576   6.413826  4.27.18.126 -> 216.165.108.217 HTTP 556 HTTP/1.1 200 OK  (JPEG JFIF image)  tcp.stream == 15
