 34   6.116626 216.165.108.217 -> 64.12.89.186 TCP 74 49912 > http [SYN] Seq=0 Win=14600 Len=0 MSS=1460 SACK_PERM=1 TSval=44403641 TSecr=0 WS=128  tcp.stream == 0
 35   6.127698 64.12.89.186 -> 216.165.108.217 TCP 66 http > 49912 [SYN, ACK] Seq=0 Ack=1 Win=8190 Len=0 MSS=1460 WS=1 SACK_PERM=1  tcp.stream == 0
 36   6.127726 216.165.108.217 -> 64.12.89.186 TCP 54 49912 > http [ACK] Seq=1 Ack=1 Win=14720 Len=0  tcp.stream == 0
 37   6.127828 216.165.108.217 -> 64.12.89.186 HTTP 343 GET / HTTP/1.1   tcp.stream == 0
 38   6.139788 64.12.89.186 -> 216.165.108.217 HTTP 520 HTTP/1.1 301 Moved Permanently  (text/html)  tcp.stream == 0
 39   6.139815 216.165.108.217 -> 64.12.89.186 TCP 54 49912 > http [ACK] Seq=290 Ack=467 Win=15744 Len=0  tcp.stream == 0
 46   6.235113 216.165.108.217 -> 64.12.107.131 TCP 74 46044 > http [SYN] Seq=0 Win=14600 Len=0 MSS=1460 SACK_PERM=1 TSval=44403671 TSecr=0 WS=128  tcp.stream == 1
 47   6.246710 64.12.107.131 -> 216.165.108.217 TCP 66 http > 46044 [SYN, ACK] Seq=0 Ack=1 Win=8190 Len=0 MSS=1460 WS=1 SACK_PERM=1  tcp.stream == 1
 48   6.246731 216.165.108.217 -> 64.12.107.131 TCP 54 46044 > http [ACK] Seq=1 Ack=1 Win=14720 Len=0  tcp.stream == 1
 49   6.246824 216.165.108.217 -> 64.12.107.131 HTTP 347 GET / HTTP/1.1   tcp.stream == 1
 50   6.258488 64.12.107.131 -> 216.165.108.217 TCP 60 http > 46044 [ACK] Seq=1 Ack=294 Win=19968 Len=0  tcp.stream == 1
 51   6.344664 64.12.107.131 -> 216.165.108.217 TCP 1514 [TCP segment of a reassembled PDU]  tcp.stream == 1
 52   6.344687 216.165.108.217 -> 64.12.107.131 TCP 54 46044 > http [ACK] Seq=294 Ack=1461 Win=17536 Len=0  tcp.stream == 1
 53   6.344783 64.12.107.131 -> 216.165.108.217 TCP 1514 [TCP segment of a reassembled PDU]  tcp.stream == 1
 54   6.344789 216.165.108.217 -> 64.12.107.131 TCP 54 46044 > http [ACK] Seq=294 Ack=2921 Win=20480 Len=0  tcp.stream == 1
 55   6.344893 64.12.107.131 -> 216.165.108.217 TCP 1514 [TCP segment of a reassembled PDU]  tcp.stream == 1
 56   6.344898 216.165.108.217 -> 64.12.107.131 TCP 54 46044 > http [ACK] Seq=294 Ack=4381 Win=23424 Len=0  tcp.stream == 1
 57   6.345014 64.12.107.131 -> 216.165.108.217 TCP 1514 [TCP segment of a reassembled PDU]  tcp.stream == 1
 58   6.345020 216.165.108.217 -> 64.12.107.131 TCP 54 46044 > http [ACK] Seq=294 Ack=5841 Win=26368 Len=0  tcp.stream == 1
 59   6.345137 64.12.107.131 -> 216.165.108.217 TCP 1514 [TCP segment of a reassembled PDU]  tcp.stream == 1
 60   6.345143 216.165.108.217 -> 64.12.107.131 TCP 54 46044 > http [ACK] Seq=294 Ack=7301 Win=29312 Len=0  tcp.stream == 1
 61   6.345260 64.12.107.131 -> 216.165.108.217 TCP 1514 [TCP segment of a reassembled PDU]  tcp.stream == 1
 62   6.345266 216.165.108.217 -> 64.12.107.131 TCP 54 46044 > http [ACK] Seq=294 Ack=8761 Win=32128 Len=0  tcp.stream == 1
 63   6.355749 64.12.107.131 -> 216.165.108.217 TCP 1514 [TCP segment of a reassembled PDU]  tcp.stream == 1
 64   6.355766 216.165.108.217 -> 64.12.107.131 TCP 54 46044 > http [ACK] Seq=294 Ack=10221 Win=35072 Len=0  tcp.stream == 1
 65   6.355867 64.12.107.131 -> 216.165.108.217 TCP 1514 [TCP segment of a reassembled PDU]  tcp.stream == 1
 66   6.355870 216.165.108.217 -> 64.12.107.131 TCP 54 46044 > http [ACK] Seq=294 Ack=11681 Win=38016 Len=0  tcp.stream == 1
 67   6.356093 64.12.107.131 -> 216.165.108.217 TCP 1514 [TCP segment of a reassembled PDU]  tcp.stream == 1
 68   6.356096 216.165.108.217 -> 64.12.107.131 TCP 54 46044 > http [ACK] Seq=294 Ack=13141 Win=40960 Len=0  tcp.stream == 1
 69   6.356216 64.12.107.131 -> 216.165.108.217 TCP 1514 [TCP segment of a reassembled PDU]  tcp.stream == 1
 70   6.356219 216.165.108.217 -> 64.12.107.131 TCP 54 46044 > http [ACK] Seq=294 Ack=14601 Win=43904 Len=0  tcp.stream == 1
 71   6.356339 64.12.107.131 -> 216.165.108.217 TCP 1514 [TCP segment of a reassembled PDU]  tcp.stream == 1
 72   6.356342 216.165.108.217 -> 64.12.107.131 TCP 54 46044 > http [ACK] Seq=294 Ack=16061 Win=46720 Len=0  tcp.stream == 1
 73   6.356461 64.12.107.131 -> 216.165.108.217 TCP 1514 [TCP segment of a reassembled PDU]  tcp.stream == 1
 74   6.356465 216.165.108.217 -> 64.12.107.131 TCP 54 46044 > http [ACK] Seq=294 Ack=17521 Win=49664 Len=0  tcp.stream == 1
 75   6.356585 64.12.107.131 -> 216.165.108.217 TCP 1514 [TCP segment of a reassembled PDU]  tcp.stream == 1
 76   6.356589 216.165.108.217 -> 64.12.107.131 TCP 54 46044 > http [ACK] Seq=294 Ack=18981 Win=52608 Len=0  tcp.stream == 1
 77   6.356708 64.12.107.131 -> 216.165.108.217 TCP 1514 [TCP segment of a reassembled PDU]  tcp.stream == 1
 78   6.356711 216.165.108.217 -> 64.12.107.131 TCP 54 46044 > http [ACK] Seq=294 Ack=20441 Win=55552 Len=0  tcp.stream == 1
 79   6.356830 64.12.107.131 -> 216.165.108.217 TCP 1514 [TCP segment of a reassembled PDU]  tcp.stream == 1
 80   6.356834 216.165.108.217 -> 64.12.107.131 TCP 54 46044 > http [ACK] Seq=294 Ack=21901 Win=58496 Len=0  tcp.stream == 1
 81   6.356953 64.12.107.131 -> 216.165.108.217 TCP 1514 [TCP segment of a reassembled PDU]  tcp.stream == 1
 82   6.356957 216.165.108.217 -> 64.12.107.131 TCP 54 46044 > http [ACK] Seq=294 Ack=23361 Win=61440 Len=0  tcp.stream == 1
 83   6.357077 64.12.107.131 -> 216.165.108.217 TCP 1514 [TCP segment of a reassembled PDU]  tcp.stream == 1
 84   6.357081 216.165.108.217 -> 64.12.107.131 TCP 54 46044 > http [ACK] Seq=294 Ack=24821 Win=64128 Len=0  tcp.stream == 1
 85   6.357204 64.12.107.131 -> 216.165.108.217 TCP 1514 [TCP segment of a reassembled PDU]  tcp.stream == 1
 86   6.357215 216.165.108.217 -> 64.12.107.131 TCP 54 46044 > http [ACK] Seq=294 Ack=26281 Win=64128 Len=0  tcp.stream == 1
 87   6.357322 64.12.107.131 -> 216.165.108.217 TCP 1514 [TCP segment of a reassembled PDU]  tcp.stream == 1
 88   6.357330 216.165.108.217 -> 64.12.107.131 TCP 54 46044 > http [ACK] Seq=294 Ack=27741 Win=64128 Len=0  tcp.stream == 1
 89   6.357337 64.12.107.131 -> 216.165.108.217 HTTP 406 HTTP/1.1 200 OK  (text/html)  tcp.stream == 1
 90   6.357342 216.165.108.217 -> 64.12.107.131 TCP 54 46044 > http [ACK] Seq=294 Ack=28093 Win=63872 Len=0  tcp.stream == 1
119   6.419208 216.165.108.217 -> 72.247.238.19 TCP 74 41499 > http [SYN] Seq=0 Win=14600 Len=0 MSS=1460 SACK_PERM=1 TSval=44403717 TSecr=0 WS=128  tcp.stream == 2
120   6.419236 216.165.108.217 -> 72.247.238.19 TCP 74 41500 > http [SYN] Seq=0 Win=14600 Len=0 MSS=1460 SACK_PERM=1 TSval=44403717 TSecr=0 WS=128  tcp.stream == 3
121   6.420176 216.165.108.217 -> 72.247.238.59 TCP 74 60300 > http [SYN] Seq=0 Win=14600 Len=0 MSS=1460 SACK_PERM=1 TSval=44403717 TSecr=0 WS=128  tcp.stream == 4
122   6.420257 216.165.108.217 -> 72.247.238.59 TCP 74 60301 > http [SYN] Seq=0 Win=14600 Len=0 MSS=1460 SACK_PERM=1 TSval=44403717 TSecr=0 WS=128  tcp.stream == 5
123   6.420359 216.165.108.217 -> 72.247.238.19 TCP 74 41503 > http [SYN] Seq=0 Win=14600 Len=0 MSS=1460 SACK_PERM=1 TSval=44403717 TSecr=0 WS=128  tcp.stream == 6
124   6.420440 216.165.108.217 -> 72.247.238.19 TCP 74 41504 > http [SYN] Seq=0 Win=14600 Len=0 MSS=1460 SACK_PERM=1 TSval=44403717 TSecr=0 WS=128  tcp.stream == 7
125   6.420495 216.165.108.217 -> 72.247.238.19 TCP 74 41505 > http [SYN] Seq=0 Win=14600 Len=0 MSS=1460 SACK_PERM=1 TSval=44403717 TSecr=0 WS=128  tcp.stream == 8
126   6.420537 216.165.108.217 -> 72.247.238.66 TCP 74 33116 > http [SYN] Seq=0 Win=14600 Len=0 MSS=1460 SACK_PERM=1 TSval=44403717 TSecr=0 WS=128  tcp.stream == 9
127   6.420560 216.165.108.217 -> 72.247.238.19 TCP 74 41507 > http [SYN] Seq=0 Win=14600 Len=0 MSS=1460 SACK_PERM=1 TSval=44403717 TSecr=0 WS=128  tcp.stream == 10
128   6.420584 216.165.108.217 -> 72.247.238.66 TCP 74 33118 > http [SYN] Seq=0 Win=14600 Len=0 MSS=1460 SACK_PERM=1 TSval=44403717 TSecr=0 WS=128  tcp.stream == 11
129   6.420612 216.165.108.217 -> 72.247.238.66 TCP 74 33119 > http [SYN] Seq=0 Win=14600 Len=0 MSS=1460 SACK_PERM=1 TSval=44403717 TSecr=0 WS=128  tcp.stream == 12
130   6.420777 216.165.108.217 -> 72.247.238.66 TCP 74 33120 > http [SYN] Seq=0 Win=14600 Len=0 MSS=1460 SACK_PERM=1 TSval=44403717 TSecr=0 WS=128  tcp.stream == 13
131   6.420840 216.165.108.217 -> 72.247.238.59 TCP 74 60310 > http [SYN] Seq=0 Win=14600 Len=0 MSS=1460 SACK_PERM=1 TSval=44403717 TSecr=0 WS=128  tcp.stream == 14
132   6.420883 216.165.108.217 -> 72.247.238.66 TCP 74 33122 > http [SYN] Seq=0 Win=14600 Len=0 MSS=1460 SACK_PERM=1 TSval=44403717 TSecr=0 WS=128  tcp.stream == 15
133   6.420950 216.165.108.217 -> 72.247.238.25 TCP 74 54852 > http [SYN] Seq=0 Win=14600 Len=0 MSS=1460 SACK_PERM=1 TSval=44403717 TSecr=0 WS=128  tcp.stream == 16
134   6.421069 216.165.108.217 -> 72.247.238.66 TCP 74 33124 > http [SYN] Seq=0 Win=14600 Len=0 MSS=1460 SACK_PERM=1 TSval=44403717 TSecr=0 WS=128  tcp.stream == 17
135   6.421151 216.165.108.217 -> 72.247.238.25 TCP 74 54854 > http [SYN] Seq=0 Win=14600 Len=0 MSS=1460 SACK_PERM=1 TSval=44403717 TSecr=0 WS=128  tcp.stream == 18
136   6.421208 216.165.108.217 -> 72.247.238.25 TCP 74 54855 > http [SYN] Seq=0 Win=14600 Len=0 MSS=1460 SACK_PERM=1 TSval=44403717 TSecr=0 WS=128  tcp.stream == 19
137   6.421262 216.165.108.217 -> 72.247.238.64 TCP 74 35883 > http [SYN] Seq=0 Win=14600 Len=0 MSS=1460 SACK_PERM=1 TSval=44403717 TSecr=0 WS=128  tcp.stream == 20
138   6.421298 216.165.108.217 -> 72.247.238.64 TCP 74 35884 > http [SYN] Seq=0 Win=14600 Len=0 MSS=1460 SACK_PERM=1 TSval=44403717 TSecr=0 WS=128  tcp.stream == 21
139   6.421343 216.165.108.217 -> 64.236.116.18 TCP 74 49364 > http [SYN] Seq=0 Win=14600 Len=0 MSS=1460 SACK_PERM=1 TSval=44403717 TSecr=0 WS=128  tcp.stream == 22
140   6.421366 216.165.108.217 -> 72.247.238.72 TCP 74 58662 > http [SYN] Seq=0 Win=14600 Len=0 MSS=1460 SACK_PERM=1 TSval=44403717 TSecr=0 WS=128  tcp.stream == 23
141   6.421390 216.165.108.217 -> 72.247.238.72 TCP 74 58663 > http [SYN] Seq=0 Win=14600 Len=0 MSS=1460 SACK_PERM=1 TSval=44403717 TSecr=0 WS=128  tcp.stream == 24
142   6.421411 216.165.108.217 -> 72.247.238.72 TCP 74 58664 > http [SYN] Seq=0 Win=14600 Len=0 MSS=1460 SACK_PERM=1 TSval=44403717 TSecr=0 WS=128  tcp.stream == 25
143   6.421433 216.165.108.217 -> 72.247.238.72 TCP 74 58665 > http [SYN] Seq=0 Win=14600 Len=0 MSS=1460 SACK_PERM=1 TSval=44403717 TSecr=0 WS=128  tcp.stream == 26
144   6.422107 216.165.108.217 -> 64.12.107.131 HTTP 509 GET /ads/load_v7.html HTTP/1.1   tcp.stream == 1
145   6.432216 64.236.116.18 -> 216.165.108.217 TCP 66 http > 49364 [SYN, ACK] Seq=0 Ack=1 Win=8190 Len=0 MSS=1460 WS=1 SACK_PERM=1  tcp.stream == 22
146   6.432240 216.165.108.217 -> 64.236.116.18 TCP 54 49364 > http [ACK] Seq=1 Ack=1 Win=14720 Len=0  tcp.stream == 22
147   6.432320 216.165.108.217 -> 64.236.116.18 HTTP 424 GET /adcedge/lb?site=695501&srvc=1&betr=aolcom_cs=1&betq=13668=438747 HTTP/1.1   tcp.stream == 22
148   6.435186 64.12.107.131 -> 216.165.108.217 HTTP 960 HTTP/1.1 200 OK  (text/html)  tcp.stream == 1
149   6.435260 216.165.108.217 -> 64.12.107.131 TCP 54 46044 > http [ACK] Seq=749 Ack=28999 Win=64128 Len=0  tcp.stream == 1
150   6.444647 64.236.116.18 -> 216.165.108.217 HTTP 732 HTTP/1.1 200 OK  (GIF89a)  tcp.stream == 22
151   6.444672 216.165.108.217 -> 64.236.116.18 TCP 54 49364 > http [ACK] Seq=371 Ack=680 Win=16000 Len=0  tcp.stream == 22
152   6.444838 216.165.108.217 -> 64.236.116.18 TCP 54 49364 > http [FIN, ACK] Seq=371 Ack=680 Win=16000 Len=0  tcp.stream == 22
153   6.455712 64.236.116.18 -> 216.165.108.217 TCP 60 http > 49364 [ACK] Seq=680 Ack=372 Win=65098 Len=0  tcp.stream == 22
155   6.504582 72.247.238.19 -> 216.165.108.217 TCP 74 http > 41499 [SYN, ACK] Seq=0 Ack=1 Win=14480 Len=0 MSS=1460 SACK_PERM=1 TSval=2360146413 TSecr=44403717 WS=4  tcp.stream == 2
156   6.504607 216.165.108.217 -> 72.247.238.19 TCP 66 41499 > http [ACK] Seq=1 Ack=1 Win=14720 Len=0 TSval=44403738 TSecr=2360146413  tcp.stream == 2
157   6.504612 72.247.238.19 -> 216.165.108.217 TCP 74 http > 41500 [SYN, ACK] Seq=0 Ack=1 Win=14480 Len=0 MSS=1460 SACK_PERM=1 TSval=2360146413 TSecr=44403717 WS=4  tcp.stream == 3
158   6.504616 216.165.108.217 -> 72.247.238.19 TCP 66 41500 > http [ACK] Seq=1 Ack=1 Win=14720 Len=0 TSval=44403738 TSecr=2360146413  tcp.stream == 3
159   6.504751 216.165.108.217 -> 72.247.238.19 HTTP 373 GET /p5/_v65.9/css/maing.css HTTP/1.1   tcp.stream == 2
160   6.504769 216.165.108.217 -> 72.247.238.19 HTTP 378 GET /p5/skin/_v24/space_chase.css HTTP/1.1   tcp.stream == 3
161   6.506487 72.247.238.59 -> 216.165.108.217 TCP 74 http > 60300 [SYN, ACK] Seq=0 Ack=1 Win=14480 Len=0 MSS=1460 SACK_PERM=1 TSval=3054054280 TSecr=44403717 WS=4  tcp.stream == 4
162   6.506509 216.165.108.217 -> 72.247.238.59 TCP 66 60300 > http [ACK] Seq=1 Ack=1 Win=14720 Len=0 TSval=44403739 TSecr=3054054280  tcp.stream == 4
163   6.506616 216.165.108.217 -> 72.247.238.59 HTTP 347 GET /ads/adsWrapper.js HTTP/1.1   tcp.stream == 4
164   6.506635 72.247.238.59 -> 216.165.108.217 TCP 74 http > 60301 [SYN, ACK] Seq=0 Ack=1 Win=14480 Len=0 MSS=1460 SACK_PERM=1 TSval=3054054280 TSecr=44403717 WS=4  tcp.stream == 5
165   6.506641 216.165.108.217 -> 72.247.238.59 TCP 66 60301 > http [ACK] Seq=1 Ack=1 Win=14720 Len=0 TSval=44403739 TSecr=3054054280  tcp.stream == 5
166   6.506672 216.165.108.217 -> 72.247.238.59 HTTP 347 GET /omniunih.js?v=ptl HTTP/1.1   tcp.stream == 5
167   6.506686 72.247.238.19 -> 216.165.108.217 TCP 74 http > 41503 [SYN, ACK] Seq=0 Ack=1 Win=14480 Len=0 MSS=1460 SACK_PERM=1 TSval=2360146414 TSecr=44403717 WS=4  tcp.stream == 6
168   6.506690 216.165.108.217 -> 72.247.238.19 TCP 66 41503 > http [ACK] Seq=1 Ack=1 Win=14720 Len=0 TSval=44403739 TSecr=2360146414  tcp.stream == 6
169   6.506719 216.165.108.217 -> 72.247.238.19 HTTP 388 GET /p5/_v65.9/css/w/w12.png HTTP/1.1   tcp.stream == 6
170   6.506735 72.247.238.19 -> 216.165.108.217 TCP 74 http > 41504 [SYN, ACK] Seq=0 Ack=1 Win=14480 Len=0 MSS=1460 SACK_PERM=1 TSval=2360146414 TSecr=44403717 WS=4  tcp.stream == 7
171   6.506740 216.165.108.217 -> 72.247.238.19 TCP 66 41504 > http [ACK] Seq=1 Ack=1 Win=14720 Len=0 TSval=44403739 TSecr=2360146414  tcp.stream == 7
172   6.506778 216.165.108.217 -> 72.247.238.19 HTTP 418 GET /p5/forms/326/7116f573-7cda-4e8f-b2ec-b0d272075b69.png HTTP/1.1   tcp.stream == 7
173   6.506785 72.247.238.19 -> 216.165.108.217 TCP 74 http > 41505 [SYN, ACK] Seq=0 Ack=1 Win=14480 Len=0 MSS=1460 SACK_PERM=1 TSval=2360146415 TSecr=44403717 WS=4  tcp.stream == 8
174   6.506789 216.165.108.217 -> 72.247.238.19 TCP 66 41505 > http [ACK] Seq=1 Ack=1 Win=14720 Len=0 TSval=44403739 TSecr=2360146415  tcp.stream == 8
175   6.506791 72.247.238.19 -> 216.165.108.217 TCP 74 http > 41507 [SYN, ACK] Seq=0 Ack=1 Win=14480 Len=0 MSS=1460 SACK_PERM=1 TSval=2360146415 TSecr=44403717 WS=4  tcp.stream == 10
176   6.506794 216.165.108.217 -> 72.247.238.19 TCP 66 41507 > http [ACK] Seq=1 Ack=1 Win=14720 Len=0 TSval=44403739 TSecr=2360146415  tcp.stream == 10
177   6.506796 72.247.238.66 -> 216.165.108.217 TCP 74 http > 33116 [SYN, ACK] Seq=0 Ack=1 Win=14480 Len=0 MSS=1460 SACK_PERM=1 TSval=1509151345 TSecr=44403717 WS=4  tcp.stream == 9
178   6.506800 216.165.108.217 -> 72.247.238.66 TCP 66 33116 > http [ACK] Seq=1 Ack=1 Win=14720 Len=0 TSval=44403739 TSecr=1509151345  tcp.stream == 9
179   6.506802 72.247.238.66 -> 216.165.108.217 TCP 74 http > 33118 [SYN, ACK] Seq=0 Ack=1 Win=14480 Len=0 MSS=1460 SACK_PERM=1 TSval=1509151345 TSecr=44403717 WS=4  tcp.stream == 11
180   6.506806 216.165.108.217 -> 72.247.238.66 TCP 66 33118 > http [ACK] Seq=1 Ack=1 Win=14720 Len=0 TSval=44403739 TSecr=1509151345  tcp.stream == 11
181   6.506808 72.247.238.66 -> 216.165.108.217 TCP 74 http > 33119 [SYN, ACK] Seq=0 Ack=1 Win=14480 Len=0 MSS=1460 SACK_PERM=1 TSval=1509151345 TSecr=44403717 WS=4  tcp.stream == 12
182   6.506811 216.165.108.217 -> 72.247.238.66 TCP 66 33119 > http [ACK] Seq=1 Ack=1 Win=14720 Len=0 TSval=44403739 TSecr=1509151345  tcp.stream == 12
183   6.506865 216.165.108.217 -> 72.247.238.19 HTTP 419 GET /p5/forms/3619/3fd44455-fa76-46b0-8bcc-962ad8f7126f.png HTTP/1.1   tcp.stream == 8
184   6.506874 216.165.108.217 -> 72.247.238.66 HTTP 404 GET /gen/502649/thumbs/a-PRISONFIRE-386x217.jpg HTTP/1.1   tcp.stream == 9
185   6.506883 216.165.108.217 -> 72.247.238.19 HTTP 388 GET /p5/_v65.9/css/maing.png HTTP/1.1   tcp.stream == 10
186   6.506893 216.165.108.217 -> 72.247.238.66 HTTP 398 GET /gen/502685/thumbs/a-SIGN-233x155.jpg HTTP/1.1   tcp.stream == 11
187   6.506901 216.165.108.217 -> 72.247.238.66 HTTP 404 GET /gen/502478/thumbs/a-FRANK640AZ-233x155.jpg HTTP/1.1   tcp.stream == 12
188   6.507011 72.247.238.66 -> 216.165.108.217 TCP 74 http > 33120 [SYN, ACK] Seq=0 Ack=1 Win=14480 Len=0 MSS=1460 SACK_PERM=1 TSval=1509151346 TSecr=44403717 WS=4  tcp.stream == 13
189   6.507020 216.165.108.217 -> 72.247.238.66 TCP 66 33120 > http [ACK] Seq=1 Ack=1 Win=14720 Len=0 TSval=44403739 TSecr=1509151346  tcp.stream == 13
190   6.507062 216.165.108.217 -> 72.247.238.66 HTTP 414 GET /gen/502635/thumbs/s-AYAKA-NISHI-JEWELRY-large300.jpg HTTP/1.1   tcp.stream == 13
191   6.507069 72.247.238.66 -> 216.165.108.217 TCP 74 http > 33122 [SYN, ACK] Seq=0 Ack=1 Win=14480 Len=0 MSS=1460 SACK_PERM=1 TSval=1509151346 TSecr=44403717 WS=4  tcp.stream == 15
192   6.507073 216.165.108.217 -> 72.247.238.66 TCP 66 33122 > http [ACK] Seq=1 Ack=1 Win=14720 Len=0 TSval=44403739 TSecr=1509151346  tcp.stream == 15
193   6.507111 216.165.108.217 -> 72.247.238.66 HTTP 407 GET /gen/500905/thumbs/s-RIHANNA-WORKOUT-97x75.jpg HTTP/1.1   tcp.stream == 15
194   6.507313 72.247.238.25 -> 216.165.108.217 TCP 74 http > 54852 [SYN, ACK] Seq=0 Ack=1 Win=14480 Len=0 MSS=1460 SACK_PERM=1 TSval=2000954417 TSecr=44403717 WS=4  tcp.stream == 16
195   6.507321 216.165.108.217 -> 72.247.238.25 TCP 66 54852 > http [ACK] Seq=1 Ack=1 Win=14720 Len=0 TSval=44403739 TSecr=2000954417  tcp.stream == 16
196   6.507365 216.165.108.217 -> 72.247.238.25 HTTP 441 GET /www.dailyfinance.com/media/2012/02/gary-busey-240cs021412-1329256298_97x75.jpg HTTP/1.1   tcp.stream == 16
197   6.507421 72.247.238.59 -> 216.165.108.217 TCP 74 http > 60310 [SYN, ACK] Seq=0 Ack=1 Win=14480 Len=0 MSS=1460 SACK_PERM=1 TSval=3054054280 TSecr=44403717 WS=4  tcp.stream == 14
198   6.507428 216.165.108.217 -> 72.247.238.59 TCP 66 60310 > http [ACK] Seq=1 Ack=1 Win=14720 Len=0 TSval=44403739 TSecr=3054054280  tcp.stream == 14
199   6.507467 216.165.108.217 -> 72.247.238.59 HTTP 368 GET /js/x.gif HTTP/1.1   tcp.stream == 14
200   6.507478 72.247.238.66 -> 216.165.108.217 TCP 74 http > 33124 [SYN, ACK] Seq=0 Ack=1 Win=14480 Len=0 MSS=1460 SACK_PERM=1 TSval=1509151346 TSecr=44403717 WS=4  tcp.stream == 17
201   6.507482 216.165.108.217 -> 72.247.238.66 TCP 66 33124 > http [ACK] Seq=1 Ack=1 Win=14720 Len=0 TSval=44403739 TSecr=1509151346  tcp.stream == 17
202   6.507522 216.165.108.217 -> 72.247.238.66 HTTP 413 GET /gen/498580/thumbs/s-UNDERWATER-DOG-PHOTOS-97x75.jpg HTTP/1.1   tcp.stream == 17
203   6.507839 72.247.238.25 -> 216.165.108.217 TCP 74 http > 54854 [SYN, ACK] Seq=0 Ack=1 Win=14480 Len=0 MSS=1460 SACK_PERM=1 TSval=2000954417 TSecr=44403717 WS=4  tcp.stream == 18
204   6.507851 216.165.108.217 -> 72.247.238.25 TCP 66 54854 > http [ACK] Seq=1 Ack=1 Win=14720 Len=0 TSval=44403739 TSecr=2000954417  tcp.stream == 18
205   6.507854 72.247.238.25 -> 216.165.108.217 TCP 74 http > 54855 [SYN, ACK] Seq=0 Ack=1 Win=14480 Len=0 MSS=1460 SACK_PERM=1 TSval=2000954417 TSecr=44403717 WS=4  tcp.stream == 19
206   6.507857 216.165.108.217 -> 72.247.238.25 TCP 66 54855 > http [ACK] Seq=1 Ack=1 Win=14720 Len=0 TSval=44403739 TSecr=2000954417  tcp.stream == 19
207   6.507929 216.165.108.217 -> 72.247.238.25 HTTP 434 GET /jobs.aol.com/articles/media/2012/02/melissa-petro-293jt021512_97x75.jpg HTTP/1.1   tcp.stream == 18
208   6.507942 216.165.108.217 -> 72.247.238.25 HTTP 425 GET /www.engadget.com/media/2012/02/2012-02-1515-16-02600_97x75.jpg HTTP/1.1   tcp.stream == 19
209   6.507980 72.247.238.64 -> 216.165.108.217 TCP 74 http > 35883 [SYN, ACK] Seq=0 Ack=1 Win=14480 Len=0 MSS=1460 SACK_PERM=1 TSval=2966138391 TSecr=44403717 WS=4  tcp.stream == 20
210   6.507987 216.165.108.217 -> 72.247.238.64 TCP 66 35883 > http [ACK] Seq=1 Ack=1 Win=14720 Len=0 TSval=44403739 TSecr=2966138391  tcp.stream == 20
211   6.507990 72.247.238.64 -> 216.165.108.217 TCP 74 http > 35884 [SYN, ACK] Seq=0 Ack=1 Win=14480 Len=0 MSS=1460 SACK_PERM=1 TSval=2966138391 TSecr=44403717 WS=4  tcp.stream == 21
212   6.507994 216.165.108.217 -> 72.247.238.64 TCP 66 35884 > http [ACK] Seq=1 Ack=1 Win=14720 Len=0 TSval=44403739 TSecr=2966138391  tcp.stream == 21
213   6.508045 216.165.108.217 -> 72.247.238.64 HTTP 415 GET /contributors/jenni-chang-and-lisa-dazols/headshot.jpg HTTP/1.1   tcp.stream == 20
214   6.508060 216.165.108.217 -> 72.247.238.64 HTTP 401 GET /contributors/rebecca-myers/headshot.jpg HTTP/1.1   tcp.stream == 21
215   6.508226 72.247.238.72 -> 216.165.108.217 TCP 74 http > 58663 [SYN, ACK] Seq=0 Ack=1 Win=14480 Len=0 MSS=1460 SACK_PERM=1 TSval=2096139239 TSecr=44403717 WS=4  tcp.stream == 24
216   6.508234 216.165.108.217 -> 72.247.238.72 TCP 66 58663 > http [ACK] Seq=1 Ack=1 Win=14720 Len=0 TSval=44403739 TSecr=2096139239  tcp.stream == 24
217   6.508237 72.247.238.72 -> 216.165.108.217 TCP 74 http > 58662 [SYN, ACK] Seq=0 Ack=1 Win=14480 Len=0 MSS=1460 SACK_PERM=1 TSval=2096139239 TSecr=44403717 WS=4  tcp.stream == 23
218   6.508240 216.165.108.217 -> 72.247.238.72 TCP 66 58662 > http [ACK] Seq=1 Ack=1 Win=14720 Len=0 TSval=44403739 TSecr=2096139239  tcp.stream == 23
219   6.508290 216.165.108.217 -> 72.247.238.72 HTTP 400 GET /10345468/517273395_c_140_102.jpg HTTP/1.1   tcp.stream == 23
220   6.508304 216.165.108.217 -> 72.247.238.72 HTTP 400 GET /10345470/517273484_c_140_102.jpg HTTP/1.1   tcp.stream == 24
221   6.508587 72.247.238.72 -> 216.165.108.217 TCP 74 http > 58664 [SYN, ACK] Seq=0 Ack=1 Win=14480 Len=0 MSS=1460 SACK_PERM=1 TSval=2096139239 TSecr=44403717 WS=4  tcp.stream == 25
222   6.508595 216.165.108.217 -> 72.247.238.72 TCP 66 58664 > http [ACK] Seq=1 Ack=1 Win=14720 Len=0 TSval=44403739 TSecr=2096139239  tcp.stream == 25
223   6.508599 72.247.238.72 -> 216.165.108.217 TCP 74 http > 58665 [SYN, ACK] Seq=0 Ack=1 Win=14480 Len=0 MSS=1460 SACK_PERM=1 TSval=2096139239 TSecr=44403717 WS=4  tcp.stream == 26
224   6.508602 216.165.108.217 -> 72.247.238.72 TCP 66 58665 > http [ACK] Seq=1 Ack=1 Win=14720 Len=0 TSval=44403739 TSecr=2096139239  tcp.stream == 26
225   6.508664 216.165.108.217 -> 72.247.238.72 HTTP 400 GET /10345456/517272763_c_140_102.jpg HTTP/1.1   tcp.stream == 26
226   6.508681 216.165.108.217 -> 72.247.238.72 HTTP 400 GET /10345454/517272679_c_140_102.jpg HTTP/1.1   tcp.stream == 25
227   6.589543 72.247.238.19 -> 216.165.108.217 TCP 66 http > 41499 [ACK] Seq=1 Ack=308 Win=15552 Len=0 TSval=2360146499 TSecr=44403738  tcp.stream == 2
228   6.589559 72.247.238.19 -> 216.165.108.217 TCP 66 http > 41500 [ACK] Seq=1 Ack=313 Win=15552 Len=0 TSval=2360146499 TSecr=44403738  tcp.stream == 3
229   6.590029 72.247.238.19 -> 216.165.108.217 TCP 1514 [TCP segment of a reassembled PDU]  tcp.stream == 2
230   6.590041 216.165.108.217 -> 72.247.238.19 TCP 66 41499 > http [ACK] Seq=308 Ack=1449 Win=17536 Len=0 TSval=44403760 TSecr=2360146499  tcp.stream == 2
231   6.590167 72.247.238.19 -> 216.165.108.217 TCP 1514 [TCP segment of a reassembled PDU]  tcp.stream == 2
232   6.590173 216.165.108.217 -> 72.247.238.19 TCP 66 41499 > http [ACK] Seq=308 Ack=2897 Win=20480 Len=0 TSval=44403760 TSecr=2360146499  tcp.stream == 2
233   6.590277 72.247.238.19 -> 216.165.108.217 TCP 1514 [TCP segment of a reassembled PDU]  tcp.stream == 2
234   6.590282 216.165.108.217 -> 72.247.238.19 TCP 66 41499 > http [ACK] Seq=308 Ack=4345 Win=23296 Len=0 TSval=44403760 TSecr=2360146499  tcp.stream == 2
235   6.590402 72.247.238.19 -> 216.165.108.217 HTTP 580 HTTP/1.1 200 OK  (text/css)  tcp.stream == 3
236   6.590407 216.165.108.217 -> 72.247.238.19 TCP 66 41500 > http [ACK] Seq=313 Ack=515 Win=15744 Len=0 TSval=44403760 TSecr=2360146499  tcp.stream == 3
237   6.590411 72.247.238.19 -> 216.165.108.217 TCP 1514 [TCP segment of a reassembled PDU]  tcp.stream == 2
238   6.590413 216.165.108.217 -> 72.247.238.19 TCP 66 41499 > http [ACK] Seq=308 Ack=5793 Win=26240 Len=0 TSval=44403760 TSecr=2360146499  tcp.stream == 2
239   6.590502 216.165.108.217 -> 72.247.238.19 HTTP 355 GET /p5/_v65.9/js/main.js HTTP/1.1   tcp.stream == 3
240   6.591520 72.247.238.19 -> 216.165.108.217 TCP 66 http > 41503 [ACK] Seq=1 Ack=323 Win=15552 Len=0 TSval=2360146501 TSecr=44403739  tcp.stream == 6
241   6.591536 72.247.238.59 -> 216.165.108.217 TCP 66 http > 60300 [ACK] Seq=1 Ack=282 Win=15552 Len=0 TSval=3054054366 TSecr=44403739  tcp.stream == 4
242   6.591539 72.247.238.59 -> 216.165.108.217 TCP 66 http > 60301 [ACK] Seq=1 Ack=282 Win=15552 Len=0 TSval=3054054366 TSecr=44403739  tcp.stream == 5
243   6.591605 72.247.238.19 -> 216.165.108.217 TCP 66 http > 41504 [ACK] Seq=1 Ack=353 Win=15552 Len=0 TSval=2360146501 TSecr=44403739  tcp.stream == 7
244   6.591674 72.247.238.19 -> 216.165.108.217 TCP 66 http > 41505 [ACK] Seq=1 Ack=354 Win=15552 Len=0 TSval=2360146501 TSecr=44403739  tcp.stream == 8
245   6.591679 72.247.238.66 -> 216.165.108.217 TCP 66 http > 33116 [ACK] Seq=1 Ack=339 Win=15552 Len=0 TSval=1509151432 TSecr=44403739  tcp.stream == 9
246   6.591682 72.247.238.19 -> 216.165.108.217 TCP 66 http > 41507 [ACK] Seq=1 Ack=323 Win=15552 Len=0 TSval=2360146501 TSecr=44403739  tcp.stream == 10
247   6.591726 72.247.238.66 -> 216.165.108.217 TCP 66 http > 33118 [ACK] Seq=1 Ack=333 Win=15552 Len=0 TSval=1509151432 TSecr=44403739  tcp.stream == 11
248   6.591967 72.247.238.59 -> 216.165.108.217 TCP 1514 [TCP segment of a reassembled PDU]  tcp.stream == 4
249   6.591975 216.165.108.217 -> 72.247.238.59 TCP 66 60300 > http [ACK] Seq=282 Ack=1449 Win=17536 Len=0 TSval=44403760 TSecr=3054054366  tcp.stream == 4
250   6.592092 72.247.238.59 -> 216.165.108.217 TCP 1514 [TCP segment of a reassembled PDU]  tcp.stream == 4
251   6.592098 216.165.108.217 -> 72.247.238.59 TCP 66 60300 > http [ACK] Seq=282 Ack=2897 Win=20480 Len=0 TSval=44403760 TSecr=3054054366  tcp.stream == 4
252   6.592214 72.247.238.59 -> 216.165.108.217 TCP 1514 [TCP segment of a reassembled PDU]  tcp.stream == 4
253   6.592219 216.165.108.217 -> 72.247.238.59 TCP 66 60300 > http [ACK] Seq=282 Ack=4345 Win=23296 Len=0 TSval=44403760 TSecr=3054054366  tcp.stream == 4
254   6.592336 72.247.238.66 -> 216.165.108.217 TCP 66 http > 33119 [ACK] Seq=1 Ack=339 Win=15552 Len=0 TSval=1509151432 TSecr=44403739  tcp.stream == 12
255   6.592343 72.247.238.59 -> 216.165.108.217 TCP 1514 [TCP segment of a reassembled PDU]  tcp.stream == 4
256   6.592346 216.165.108.217 -> 72.247.238.59 TCP 66 60300 > http [ACK] Seq=282 Ack=5793 Win=26240 Len=0 TSval=44403760 TSecr=3054054366  tcp.stream == 4
257   6.592463 72.247.238.66 -> 216.165.108.217 TCP 66 http > 33120 [ACK] Seq=1 Ack=349 Win=15552 Len=0 TSval=1509151432 TSecr=44403739  tcp.stream == 13
258   6.592470 72.247.238.19 -> 216.165.108.217 HTTP 1639 HTTP/1.1 200 OK  (PNG)  tcp.stream == 6
259   6.592473 216.165.108.217 -> 72.247.238.19 TCP 66 41503 > http [ACK] Seq=323 Ack=1574 Win=17536 Len=0 TSval=44403760 TSecr=2360146501  tcp.stream == 6
260   6.592548 216.165.108.217 -> 72.247.238.19 HTTP 361 GET /p5/_v65.9/js/beacon.min.js HTTP/1.1   tcp.stream == 6
261   6.592600 72.247.238.66 -> 216.165.108.217 TCP 66 http > 33122 [ACK] Seq=1 Ack=342 Win=15552 Len=0 TSval=1509151432 TSecr=44403739  tcp.stream == 15
262   6.592606 72.247.238.19 -> 216.165.108.217 TCP 1514 [TCP segment of a reassembled PDU]  tcp.stream == 7
263   6.592609 216.165.108.217 -> 72.247.238.19 TCP 66 41504 > http [ACK] Seq=353 Ack=1449 Win=17536 Len=0 TSval=44403760 TSecr=2360146501  tcp.stream == 7
264   6.592711 72.247.238.19 -> 216.165.108.217 HTTP 671 HTTP/1.1 200 OK  (PNG)  tcp.stream == 7
265   6.592716 216.165.108.217 -> 72.247.238.19 TCP 66 41504 > http [ACK] Seq=353 Ack=2054 Win=20480 Len=0 TSval=44403760 TSecr=2360146501  tcp.stream == 7
266   6.592776 216.165.108.217 -> 72.247.238.19 HTTP 419 GET /p5/forms/4335/97221ba0-aab6-4fd6-b8db-aa2d22fbd728.png HTTP/1.1   tcp.stream == 7
267   6.592827 72.247.238.19 -> 216.165.108.217 TCP 1514 [TCP segment of a reassembled PDU]  tcp.stream == 10
268   6.592831 216.165.108.217 -> 72.247.238.19 TCP 66 41507 > http [ACK] Seq=323 Ack=1449 Win=17536 Len=0 TSval=44403760 TSecr=2360146501  tcp.stream == 10
269   6.592979 72.247.238.59 -> 216.165.108.217 TCP 1514 [TCP segment of a reassembled PDU]  tcp.stream == 5
270   6.592984 216.165.108.217 -> 72.247.238.59 TCP 66 60301 > http [ACK] Seq=282 Ack=1449 Win=17536 Len=0 TSval=44403760 TSecr=3054054367  tcp.stream == 5
271   6.593105 72.247.238.59 -> 216.165.108.217 TCP 1514 [TCP segment of a reassembled PDU]  tcp.stream == 5
272   6.593109 216.165.108.217 -> 72.247.238.59 TCP 66 60301 > http [ACK] Seq=282 Ack=2897 Win=20480 Len=0 TSval=44403760 TSecr=3054054367  tcp.stream == 5
273   6.593220 72.247.238.19 -> 216.165.108.217 TCP 1514 [TCP segment of a reassembled PDU]  tcp.stream == 10
274   6.593225 216.165.108.217 -> 72.247.238.19 TCP 66 41507 > http [ACK] Seq=323 Ack=2897 Win=20480 Len=0 TSval=44403760 TSecr=2360146501  tcp.stream == 10
275   6.593348 72.247.238.19 -> 216.165.108.217 TCP 1514 [TCP segment of a reassembled PDU]  tcp.stream == 10
276   6.593352 216.165.108.217 -> 72.247.238.19 TCP 66 41507 > http [ACK] Seq=323 Ack=4345 Win=23296 Len=0 TSval=44403760 TSecr=2360146501  tcp.stream == 10
277   6.593472 72.247.238.19 -> 216.165.108.217 TCP 1514 [TCP segment of a reassembled PDU]  tcp.stream == 10
278   6.593476 216.165.108.217 -> 72.247.238.19 TCP 66 41507 > http [ACK] Seq=323 Ack=5793 Win=26240 Len=0 TSval=44403760 TSecr=2360146501  tcp.stream == 10
279   6.593596 72.247.238.59 -> 216.165.108.217 TCP 1514 [TCP segment of a reassembled PDU]  tcp.stream == 5
280   6.593601 216.165.108.217 -> 72.247.238.59 TCP 66 60301 > http [ACK] Seq=282 Ack=4345 Win=23296 Len=0 TSval=44403761 TSecr=3054054367  tcp.stream == 5
281   6.593720 72.247.238.59 -> 216.165.108.217 TCP 1514 [TCP segment of a reassembled PDU]  tcp.stream == 5
282   6.593725 216.165.108.217 -> 72.247.238.59 TCP 66 60301 > http [ACK] Seq=282 Ack=5793 Win=26240 Len=0 TSval=44403761 TSecr=3054054367  tcp.stream == 5
283   6.593849 72.247.238.19 -> 216.165.108.217 TCP 1514 [TCP segment of a reassembled PDU]  tcp.stream == 8
284   6.593854 216.165.108.217 -> 72.247.238.19 TCP 66 41505 > http [ACK] Seq=354 Ack=1449 Win=17536 Len=0 TSval=44403761 TSecr=2360146501  tcp.stream == 8
285   6.593966 72.247.238.66 -> 216.165.108.217 TCP 1514 [TCP segment of a reassembled PDU]  tcp.stream == 9
286   6.593970 216.165.108.217 -> 72.247.238.66 TCP 66 33116 > http [ACK] Seq=339 Ack=1449 Win=17536 Len=0 TSval=44403761 TSecr=1509151432  tcp.stream == 9
287   6.594088 72.247.238.66 -> 216.165.108.217 TCP 1514 [TCP segment of a reassembled PDU]  tcp.stream == 9
288   6.594093 216.165.108.217 -> 72.247.238.66 TCP 66 33116 > http [ACK] Seq=339 Ack=2897 Win=20480 Len=0 TSval=44403761 TSecr=1509151432  tcp.stream == 9
289   6.594210 72.247.238.66 -> 216.165.108.217 TCP 1514 [TCP segment of a reassembled PDU]  tcp.stream == 9
290   6.594214 216.165.108.217 -> 72.247.238.66 TCP 66 33116 > http [ACK] Seq=339 Ack=4345 Win=23296 Len=0 TSval=44403761 TSecr=1509151432  tcp.stream == 9
291   6.594333 72.247.238.66 -> 216.165.108.217 TCP 1514 [TCP segment of a reassembled PDU]  tcp.stream == 9
292   6.594337 216.165.108.217 -> 72.247.238.66 TCP 66 33116 > http [ACK] Seq=339 Ack=5793 Win=26240 Len=0 TSval=44403761 TSecr=1509151432  tcp.stream == 9
293   6.594455 72.247.238.19 -> 216.165.108.217 TCP 1514 [TCP segment of a reassembled PDU]  tcp.stream == 8
294   6.594460 216.165.108.217 -> 72.247.238.19 TCP 66 41505 > http [ACK] Seq=354 Ack=2897 Win=20480 Len=0 TSval=44403761 TSecr=2360146501  tcp.stream == 8
295   6.594579 72.247.238.19 -> 216.165.108.217 TCP 1514 [TCP segment of a reassembled PDU]  tcp.stream == 8
296   6.594584 216.165.108.217 -> 72.247.238.19 TCP 66 41505 > http [ACK] Seq=354 Ack=4345 Win=23296 Len=0 TSval=44403761 TSecr=2360146501  tcp.stream == 8
297   6.594702 72.247.238.19 -> 216.165.108.217 TCP 1514 [TCP segment of a reassembled PDU]  tcp.stream == 8
298   6.594707 216.165.108.217 -> 72.247.238.19 TCP 66 41505 > http [ACK] Seq=354 Ack=5793 Win=26240 Len=0 TSval=44403761 TSecr=2360146501  tcp.stream == 8
299   6.594826 72.247.238.66 -> 216.165.108.217 TCP 1514 [TCP segment of a reassembled PDU]  tcp.stream == 11
300   6.594831 216.165.108.217 -> 72.247.238.66 TCP 66 33118 > http [ACK] Seq=333 Ack=1449 Win=17536 Len=0 TSval=44403761 TSecr=1509151432  tcp.stream == 11
301   6.594950 72.247.238.66 -> 216.165.108.217 TCP 1514 [TCP segment of a reassembled PDU]  tcp.stream == 11
302   6.594956 216.165.108.217 -> 72.247.238.66 TCP 66 33118 > http [ACK] Seq=333 Ack=2897 Win=20480 Len=0 TSval=44403761 TSecr=1509151432  tcp.stream == 11
303   6.595072 72.247.238.66 -> 216.165.108.217 TCP 1514 [TCP segment of a reassembled PDU]  tcp.stream == 11
304   6.595077 216.165.108.217 -> 72.247.238.66 TCP 66 33118 > http [ACK] Seq=333 Ack=4345 Win=23296 Len=0 TSval=44403761 TSecr=1509151432  tcp.stream == 11
305   6.595193 72.247.238.25 -> 216.165.108.217 TCP 66 http > 54852 [ACK] Seq=1 Ack=376 Win=15552 Len=0 TSval=2000954504 TSecr=44403739  tcp.stream == 16
306   6.595202 72.247.238.66 -> 216.165.108.217 TCP 1514 [TCP segment of a reassembled PDU]  tcp.stream == 11
307   6.595206 216.165.108.217 -> 72.247.238.66 TCP 66 33118 > http [ACK] Seq=333 Ack=5793 Win=26240 Len=0 TSval=44403761 TSecr=1509151432  tcp.stream == 11
308   6.595325 72.247.238.66 -> 216.165.108.217 TCP 1514 [TCP segment of a reassembled PDU]  tcp.stream == 12
309   6.595330 216.165.108.217 -> 72.247.238.66 TCP 66 33119 > http [ACK] Seq=339 Ack=1449 Win=17536 Len=0 TSval=44403761 TSecr=1509151432  tcp.stream == 12
310   6.595449 72.247.238.66 -> 216.165.108.217 TCP 1514 [TCP segment of a reassembled PDU]  tcp.stream == 12
311   6.595453 216.165.108.217 -> 72.247.238.66 TCP 66 33119 > http [ACK] Seq=339 Ack=2897 Win=20480 Len=0 TSval=44403761 TSecr=1509151432  tcp.stream == 12
312   6.595571 72.247.238.66 -> 216.165.108.217 TCP 1514 [TCP segment of a reassembled PDU]  tcp.stream == 12
313   6.595575 216.165.108.217 -> 72.247.238.66 TCP 66 33119 > http [ACK] Seq=339 Ack=4345 Win=23296 Len=0 TSval=44403761 TSecr=1509151432  tcp.stream == 12
314   6.595694 72.247.238.66 -> 216.165.108.217 TCP 1514 [TCP segment of a reassembled PDU]  tcp.stream == 12
315   6.595698 216.165.108.217 -> 72.247.238.66 TCP 66 33119 > http [ACK] Seq=339 Ack=5793 Win=26240 Len=0 TSval=44403761 TSecr=1509151432  tcp.stream == 12
316   6.595875 72.247.238.66 -> 216.165.108.217 TCP 1514 [TCP segment of a reassembled PDU]  tcp.stream == 13
317   6.595879 216.165.108.217 -> 72.247.238.66 TCP 66 33120 > http [ACK] Seq=349 Ack=1449 Win=17536 Len=0 TSval=44403761 TSecr=1509151432  tcp.stream == 13
318   6.595998 72.247.238.66 -> 216.165.108.217 TCP 1514 [TCP segment of a reassembled PDU]  tcp.stream == 13
319   6.596002 216.165.108.217 -> 72.247.238.66 TCP 66 33120 > http [ACK] Seq=349 Ack=2897 Win=20480 Len=0 TSval=44403761 TSecr=1509151432  tcp.stream == 13
320   6.596119 72.247.238.59 -> 216.165.108.217 TCP 66 http > 60310 [ACK] Seq=1 Ack=303 Win=15552 Len=0 TSval=3054054367 TSecr=44403739  tcp.stream == 14
321   6.596126 72.247.238.59 -> 216.165.108.217 HTTP 390 HTTP/1.1 200 OK  (GIF89a)  tcp.stream == 14
322   6.596129 216.165.108.217 -> 72.247.238.59 TCP 66 60310 > http [ACK] Seq=303 Ack=325 Win=15744 Len=0 TSval=44403761 TSecr=3054054367  tcp.stream == 14
323   6.596133 72.247.238.66 -> 216.165.108.217 TCP 1514 [TCP segment of a reassembled PDU]  tcp.stream == 13
324   6.596135 216.165.108.217 -> 72.247.238.66 TCP 66 33120 > http [ACK] Seq=349 Ack=4345 Win=23296 Len=0 TSval=44403761 TSecr=1509151432  tcp.stream == 13
325   6.596283 72.247.238.66 -> 216.165.108.217 TCP 66 http > 33124 [ACK] Seq=1 Ack=348 Win=15552 Len=0 TSval=1509151432 TSecr=44403739  tcp.stream == 17
326   6.596289 72.247.238.66 -> 216.165.108.217 TCP 1514 [TCP segment of a reassembled PDU]  tcp.stream == 13
327   6.596292 216.165.108.217 -> 72.247.238.66 TCP 66 33120 > http [ACK] Seq=349 Ack=5793 Win=26240 Len=0 TSval=44403761 TSecr=1509151432  tcp.stream == 13
328   6.596422 72.247.238.25 -> 216.165.108.217 TCP 1514 [TCP segment of a reassembled PDU]  tcp.stream == 16
329   6.596426 216.165.108.217 -> 72.247.238.25 TCP 66 54852 > http [ACK] Seq=376 Ack=1449 Win=17536 Len=0 TSval=44403761 TSecr=2000954504  tcp.stream == 16
330   6.596545 72.247.238.25 -> 216.165.108.217 HTTP 1958 HTTP/1.1 200 OK  (JPEG JFIF image)  tcp.stream == 16
331   6.596549 216.165.108.217 -> 72.247.238.25 TCP 66 54852 > http [ACK] Seq=376 Ack=3341 Win=20480 Len=0 TSval=44403761 TSecr=2000954504  tcp.stream == 16
332   6.596719 72.247.238.66 -> 216.165.108.217 TCP 1514 [TCP segment of a reassembled PDU]  tcp.stream == 17
333   6.596726 216.165.108.217 -> 72.247.238.66 TCP 66 33124 > http [ACK] Seq=348 Ack=1449 Win=17536 Len=0 TSval=44403761 TSecr=1509151433  tcp.stream == 17
334   6.596841 72.247.238.66 -> 216.165.108.217 TCP 1514 [TCP segment of a reassembled PDU]  tcp.stream == 17
335   6.596846 216.165.108.217 -> 72.247.238.66 TCP 66 33124 > http [ACK] Seq=348 Ack=2897 Win=20480 Len=0 TSval=44403761 TSecr=1509151433  tcp.stream == 17
336   6.596966 72.247.238.66 -> 216.165.108.217 TCP 1514 [TCP segment of a reassembled PDU]  tcp.stream == 17
337   6.596972 216.165.108.217 -> 72.247.238.66 TCP 66 33124 > http [ACK] Seq=348 Ack=4345 Win=23296 Len=0 TSval=44403761 TSecr=1509151433  tcp.stream == 17
338   6.597086 72.247.238.66 -> 216.165.108.217 TCP 1514 [TCP segment of a reassembled PDU]  tcp.stream == 17
339   6.597091 216.165.108.217 -> 72.247.238.66 TCP 66 33124 > http [ACK] Seq=348 Ack=5793 Win=26240 Len=0 TSval=44403761 TSecr=1509151433  tcp.stream == 17
340   6.597208 72.247.238.66 -> 216.165.108.217 TCP 1514 [TCP segment of a reassembled PDU]  tcp.stream == 15
341   6.597213 216.165.108.217 -> 72.247.238.66 TCP 66 33122 > http [ACK] Seq=342 Ack=1449 Win=17536 Len=0 TSval=44403761 TSecr=1509151433  tcp.stream == 15
342   6.597313 72.247.238.66 -> 216.165.108.217 HTTP 1196 HTTP/1.1 200 OK  (JPEG JFIF image)  tcp.stream == 15
343   6.597318 216.165.108.217 -> 72.247.238.66 TCP 66 33122 > http [ACK] Seq=342 Ack=2579 Win=20480 Len=0 TSval=44403761 TSecr=1509151433  tcp.stream == 15
344   6.597321 72.247.238.25 -> 216.165.108.217 TCP 66 http > 54854 [ACK] Seq=1 Ack=369 Win=15552 Len=0 TSval=2000954504 TSecr=44403739  tcp.stream == 18
345   6.597327 72.247.238.25 -> 216.165.108.217 TCP 66 http > 54855 [ACK] Seq=1 Ack=360 Win=15552 Len=0 TSval=2000954504 TSecr=44403739  tcp.stream == 19
346   6.597329 72.247.238.64 -> 216.165.108.217 TCP 66 http > 35883 [ACK] Seq=1 Ack=350 Win=15552 Len=0 TSval=2966138478 TSecr=44403739  tcp.stream == 20
347   6.597332 72.247.238.64 -> 216.165.108.217 TCP 66 http > 35884 [ACK] Seq=1 Ack=336 Win=15552 Len=0 TSval=2966138478 TSecr=44403739  tcp.stream == 21
348   6.597384 216.165.108.217 -> 72.247.238.66 HTTP 414 GET /gen/500913/thumbs/s-JON-STEWART-LIZ-TROTTA-97x75.jpg HTTP/1.1   tcp.stream == 15
349   6.597435 72.247.238.25 -> 216.165.108.217 TCP 1514 [TCP segment of a reassembled PDU]  tcp.stream == 18
350   6.597439 216.165.108.217 -> 72.247.238.25 TCP 66 54854 > http [ACK] Seq=369 Ack=1449 Win=17536 Len=0 TSval=44403761 TSecr=2000954504  tcp.stream == 18
351   6.597591 72.247.238.25 -> 216.165.108.217 HTTP 1854 HTTP/1.1 200 OK  (JPEG JFIF image)  tcp.stream == 18
352   6.597596 216.165.108.217 -> 72.247.238.25 TCP 66 54854 > http [ACK] Seq=369 Ack=3237 Win=20480 Len=0 TSval=44403762 TSecr=2000954504  tcp.stream == 18
353   6.597746 72.247.238.64 -> 216.165.108.217 TCP 1514 [TCP segment of a reassembled PDU]  tcp.stream == 20
354   6.597751 216.165.108.217 -> 72.247.238.64 TCP 66 35883 > http [ACK] Seq=350 Ack=1449 Win=17536 Len=0 TSval=44403762 TSecr=2966138478  tcp.stream == 20
