 36   5.320448 216.165.108.217 -> 203.190.63.115 TCP 66 34026 > http [FIN, ACK] Seq=1 Ack=1 Win=115 Len=0 TSval=44679165 TSecr=2190327235  tcp.stream == 0
 37   5.320812 216.165.108.217 -> 203.190.59.14 TCP 66 52894 > http [FIN, ACK] Seq=1 Ack=1 Win=115 Len=0 TSval=44679165 TSecr=3023012488  tcp.stream == 1
 38   5.321064 216.165.108.217 -> 203.190.58.20 TCP 66 51103 > http [FIN, ACK] Seq=1 Ack=1 Win=115 Len=0 TSval=44679165 TSecr=3862190369  tcp.stream == 2
 39   5.321276 216.165.108.217 -> 96.17.186.63 TCP 66 60737 > http [FIN, ACK] Seq=1 Ack=1 Win=115 Len=0 TSval=44679165 TSecr=2365229762  tcp.stream == 3
 40   5.321442 216.165.108.217 -> 96.17.186.63 TCP 66 60738 > http [FIN, ACK] Seq=1 Ack=1 Win=115 Len=0 TSval=44679165 TSecr=2106484787  tcp.stream == 4
 41   5.321922 96.17.186.63 -> 216.165.108.217 TCP 66 http > 60737 [FIN, ACK] Seq=1 Ack=2 Win=3620 Len=0 TSval=2365246343 TSecr=44679165  tcp.stream == 3
 42   5.321942 216.165.108.217 -> 96.17.186.63 TCP 66 60737 > http [ACK] Seq=2 Ack=2 Win=115 Len=0 TSval=44679165 TSecr=2365246343  tcp.stream == 3
 43   5.322073 96.17.186.63 -> 216.165.108.217 TCP 66 http > 60738 [FIN, ACK] Seq=1 Ack=2 Win=3620 Len=0 TSval=2106501359 TSecr=44679165  tcp.stream == 4
 44   5.322079 216.165.108.217 -> 96.17.186.63 TCP 66 60738 > http [ACK] Seq=2 Ack=2 Win=115 Len=0 TSval=44679165 TSecr=2106501359  tcp.stream == 4
 46   5.498310 203.190.63.115 -> 216.165.108.217 TCP 66 http > 34026 [FIN, ACK] Seq=1 Ack=2 Win=46 Len=0 TSval=2190329431 TSecr=44679165  tcp.stream == 0
 47   5.498336 216.165.108.217 -> 203.190.63.115 TCP 66 34026 > http [ACK] Seq=2 Ack=2 Win=115 Len=0 TSval=44679209 TSecr=2190329431  tcp.stream == 0
 48   5.506032 203.190.59.14 -> 216.165.108.217 TCP 66 http > 52894 [FIN, ACK] Seq=1 Ack=2 Win=46 Len=0 TSval=3023021703 TSecr=44679165  tcp.stream == 1
 49   5.506052 216.165.108.217 -> 203.190.59.14 TCP 66 52894 > http [ACK] Seq=2 Ack=2 Win=115 Len=0 TSval=44679211 TSecr=3023021703  tcp.stream == 1
 50   5.506670 203.190.58.20 -> 216.165.108.217 TCP 66 http > 51103 [FIN, ACK] Seq=1 Ack=2 Win=5792 Len=0 TSval=3862192353 TSecr=44679165  tcp.stream == 2
 51   5.506689 216.165.108.217 -> 203.190.58.20 TCP 66 51103 > http [ACK] Seq=2 Ack=2 Win=115 Len=0 TSval=44679211 TSecr=3862192353  tcp.stream == 2
 57   6.050175 216.165.108.217 -> 202.72.51.22 TCP 74 41079 > http [SYN] Seq=0 Win=14600 Len=0 MSS=1460 SACK_PERM=1 TSval=44679347 TSecr=0 WS=128  tcp.stream == 5
 60   6.227974 202.72.51.22 -> 216.165.108.217 TCP 60 http > 41079 [SYN, ACK] Seq=0 Ack=1 Win=18200 Len=0 MSS=1460  tcp.stream == 5
 61   6.227998 216.165.108.217 -> 202.72.51.22 TCP 54 41079 > http [ACK] Seq=1 Ack=1 Win=14600 Len=0  tcp.stream == 5
 62   6.228097 216.165.108.217 -> 202.72.51.22 HTTP 349 GET / HTTP/1.1   tcp.stream == 5
 65   6.403581 202.72.51.22 -> 216.165.108.217 TCP 60 http > 41079 [ACK] Seq=1 Ack=296 Win=24525 Len=0  tcp.stream == 5
 66   6.404410 202.72.51.22 -> 216.165.108.217 HTTP 491 HTTP/1.1 301 Moved Permanently  (text/html)  tcp.stream == 5
 67   6.404427 216.165.108.217 -> 202.72.51.22 TCP 54 41079 > http [ACK] Seq=296 Ack=438 Win=15544 Len=0  tcp.stream == 5
 68   6.404441 202.72.51.22 -> 216.165.108.217 TCP 60 http > 41079 [FIN, ACK] Seq=438 Ack=296 Win=24820 Len=0  tcp.stream == 5
 69   6.404551 216.165.108.217 -> 202.72.51.22 TCP 54 41079 > http [FIN, ACK] Seq=296 Ack=439 Win=15544 Len=0  tcp.stream == 5
 75   6.509333 216.165.108.217 -> 202.72.50.129 TCP 74 37410 > http [SYN] Seq=0 Win=14600 Len=0 MSS=1460 SACK_PERM=1 TSval=44679462 TSecr=0 WS=128  tcp.stream == 6
 76   6.580182 202.72.51.22 -> 216.165.108.217 TCP 60 http > 41079 [ACK] Seq=439 Ack=297 Win=24820 Len=0  tcp.stream == 5
 78   6.695255 202.72.50.129 -> 216.165.108.217 TCP 60 http > 37410 [SYN, ACK] Seq=0 Ack=1 Win=18200 Len=0 MSS=1460  tcp.stream == 6
 79   6.695284 216.165.108.217 -> 202.72.50.129 TCP 54 37410 > http [ACK] Seq=1 Ack=1 Win=14600 Len=0  tcp.stream == 6
 80   6.695386 216.165.108.217 -> 202.72.50.129 HTTP 353 GET / HTTP/1.1   tcp.stream == 6
 82   6.882083 202.72.50.129 -> 216.165.108.217 TCP 60 http > 37410 [ACK] Seq=1 Ack=300 Win=33281 Len=0  tcp.stream == 6
 83   6.982857 202.72.50.129 -> 216.165.108.217 TCP 1514 [TCP segment of a reassembled PDU]  tcp.stream == 6
 84   6.982877 216.165.108.217 -> 202.72.50.129 TCP 54 37410 > http [ACK] Seq=300 Ack=1461 Win=17520 Len=0  tcp.stream == 6
 85   6.983369 202.72.50.129 -> 216.165.108.217 TCP 1514 [TCP segment of a reassembled PDU]  tcp.stream == 6
 86   6.983383 216.165.108.217 -> 202.72.50.129 TCP 54 37410 > http [ACK] Seq=300 Ack=2921 Win=20440 Len=0  tcp.stream == 6
 87   6.983521 202.72.50.129 -> 216.165.108.217 TCP 1514 [TCP segment of a reassembled PDU]  tcp.stream == 6
 88   6.983526 216.165.108.217 -> 202.72.50.129 TCP 54 37410 > http [ACK] Seq=300 Ack=4381 Win=23360 Len=0  tcp.stream == 6
 91   7.010137 216.165.108.217 -> 202.72.50.129 TCP 74 37411 > http [SYN] Seq=0 Win=14600 Len=0 MSS=1460 SACK_PERM=1 TSval=44679587 TSecr=0 WS=128  tcp.stream == 7
 92   7.010210 216.165.108.217 -> 202.72.50.129 TCP 74 37412 > http [SYN] Seq=0 Win=14600 Len=0 MSS=1460 SACK_PERM=1 TSval=44679587 TSecr=0 WS=128  tcp.stream == 8
 93   7.010239 216.165.108.217 -> 202.72.50.129 TCP 74 37413 > http [SYN] Seq=0 Win=14600 Len=0 MSS=1460 SACK_PERM=1 TSval=44679587 TSecr=0 WS=128  tcp.stream == 9
 94   7.010306 216.165.108.217 -> 202.72.50.129 TCP 74 37414 > http [SYN] Seq=0 Win=14600 Len=0 MSS=1460 SACK_PERM=1 TSval=44679587 TSecr=0 WS=128  tcp.stream == 10
 95   7.010333 216.165.108.217 -> 202.72.50.129 TCP 74 37415 > http [SYN] Seq=0 Win=14600 Len=0 MSS=1460 SACK_PERM=1 TSval=44679587 TSecr=0 WS=128  tcp.stream == 11
 99   7.021644 216.165.108.217 -> 80.12.97.161 TCP 74 52640 > http [SYN] Seq=0 Win=14600 Len=0 MSS=1460 SACK_PERM=1 TSval=44679590 TSecr=0 WS=128  tcp.stream == 12
100   7.023206 80.12.97.161 -> 216.165.108.217 TCP 74 http > 52640 [SYN, ACK] Seq=0 Ack=1 Win=14480 Len=0 MSS=1460 SACK_PERM=1 TSval=3054236715 TSecr=44679590 WS=4  tcp.stream == 12
101   7.023233 216.165.108.217 -> 80.12.97.161 TCP 66 52640 > http [ACK] Seq=1 Ack=1 Win=14720 Len=0 TSval=44679590 TSecr=3054236715  tcp.stream == 12
102   7.025017 216.165.108.217 -> 80.12.97.161 HTTP 419 GET /com/js/d/common/jquery-1.4.2.min.js HTTP/1.1   tcp.stream == 12
103   7.026617 80.12.97.161 -> 216.165.108.217 TCP 66 http > 52640 [ACK] Seq=1 Ack=354 Win=15552 Len=0 TSval=3054236718 TSecr=44679591  tcp.stream == 12
104   7.089113 80.12.97.161 -> 216.165.108.217 TCP 1514 [TCP segment of a reassembled PDU]  tcp.stream == 12
105   7.089131 216.165.108.217 -> 80.12.97.161 TCP 66 52640 > http [ACK] Seq=354 Ack=1449 Win=17536 Len=0 TSval=44679607 TSecr=3054236781  tcp.stream == 12
106   7.089197 80.12.97.161 -> 216.165.108.217 TCP 1514 [TCP segment of a reassembled PDU]  tcp.stream == 12
107   7.089201 216.165.108.217 -> 80.12.97.161 TCP 66 52640 > http [ACK] Seq=354 Ack=2897 Win=20480 Len=0 TSval=44679607 TSecr=3054236781  tcp.stream == 12
108   7.089332 80.12.97.161 -> 216.165.108.217 TCP 1514 [TCP segment of a reassembled PDU]  tcp.stream == 12
109   7.089338 216.165.108.217 -> 80.12.97.161 TCP 66 52640 > http [ACK] Seq=354 Ack=4345 Win=23296 Len=0 TSval=44679607 TSecr=3054236781  tcp.stream == 12
110   7.089456 80.12.97.161 -> 216.165.108.217 TCP 1514 [TCP segment of a reassembled PDU]  tcp.stream == 12
111   7.089461 216.165.108.217 -> 80.12.97.161 TCP 66 52640 > http [ACK] Seq=354 Ack=5793 Win=26240 Len=0 TSval=44679607 TSecr=3054236781  tcp.stream == 12
112   7.090607 80.12.97.161 -> 216.165.108.217 TCP 1514 [TCP segment of a reassembled PDU]  tcp.stream == 12
113   7.090630 216.165.108.217 -> 80.12.97.161 TCP 66 52640 > http [ACK] Seq=354 Ack=7241 Win=29184 Len=0 TSval=44679607 TSecr=3054236782  tcp.stream == 12
114   7.090730 80.12.97.161 -> 216.165.108.217 TCP 1514 [TCP segment of a reassembled PDU]  tcp.stream == 12
115   7.090734 216.165.108.217 -> 80.12.97.161 TCP 66 52640 > http [ACK] Seq=354 Ack=8689 Win=32000 Len=0 TSval=44679607 TSecr=3054236782  tcp.stream == 12
116   7.090853 80.12.97.161 -> 216.165.108.217 TCP 1514 [TCP segment of a reassembled PDU]  tcp.stream == 12
117   7.090868 216.165.108.217 -> 80.12.97.161 TCP 66 52640 > http [ACK] Seq=354 Ack=10137 Win=34944 Len=0 TSval=44679607 TSecr=3054236782  tcp.stream == 12
118   7.090979 80.12.97.161 -> 216.165.108.217 TCP 1514 [TCP segment of a reassembled PDU]  tcp.stream == 12
119   7.090993 216.165.108.217 -> 80.12.97.161 TCP 66 52640 > http [ACK] Seq=354 Ack=11585 Win=37888 Len=0 TSval=44679607 TSecr=3054236782  tcp.stream == 12
120   7.091118 80.12.97.161 -> 216.165.108.217 TCP 1514 [TCP segment of a reassembled PDU]  tcp.stream == 12
121   7.091122 216.165.108.217 -> 80.12.97.161 TCP 66 52640 > http [ACK] Seq=354 Ack=13033 Win=40704 Len=0 TSval=44679607 TSecr=3054236783  tcp.stream == 12
122   7.091227 80.12.97.161 -> 216.165.108.217 TCP 1514 [TCP segment of a reassembled PDU]  tcp.stream == 12
123   7.091232 216.165.108.217 -> 80.12.97.161 TCP 66 52640 > http [ACK] Seq=354 Ack=14481 Win=43648 Len=0 TSval=44679607 TSecr=3054236783  tcp.stream == 12
124   7.091356 80.12.97.161 -> 216.165.108.217 TCP 1514 [TCP segment of a reassembled PDU]  tcp.stream == 12
125   7.091361 216.165.108.217 -> 80.12.97.161 TCP 66 52640 > http [ACK] Seq=354 Ack=15929 Win=46464 Len=0 TSval=44679607 TSecr=3054236783  tcp.stream == 12
126   7.091473 80.12.97.161 -> 216.165.108.217 TCP 1514 [TCP segment of a reassembled PDU]  tcp.stream == 12
127   7.091477 216.165.108.217 -> 80.12.97.161 TCP 66 52640 > http [ACK] Seq=354 Ack=17377 Win=49408 Len=0 TSval=44679608 TSecr=3054236783  tcp.stream == 12
128   7.092170 80.12.97.161 -> 216.165.108.217 TCP 2189 [TCP segment of a reassembled PDU]  tcp.stream == 12
129   7.092182 216.165.108.217 -> 80.12.97.161 TCP 66 52640 > http [ACK] Seq=354 Ack=19500 Win=52352 Len=0 TSval=44679608 TSecr=3054236784  tcp.stream == 12
130   7.098850 80.12.97.161 -> 216.165.108.217 TCP 1514 [TCP segment of a reassembled PDU]  tcp.stream == 12
131   7.098865 216.165.108.217 -> 80.12.97.161 TCP 66 52640 > http [ACK] Seq=354 Ack=20948 Win=55168 Len=0 TSval=44679609 TSecr=3054236791  tcp.stream == 12
132   7.098964 80.12.97.161 -> 216.165.108.217 TCP 1514 [TCP segment of a reassembled PDU]  tcp.stream == 12
133   7.098979 216.165.108.217 -> 80.12.97.161 TCP 66 52640 > http [ACK] Seq=354 Ack=22396 Win=58112 Len=0 TSval=44679609 TSecr=3054236791  tcp.stream == 12
134   7.099096 80.12.97.161 -> 216.165.108.217 TCP 1514 [TCP segment of a reassembled PDU]  tcp.stream == 12
135   7.099100 216.165.108.217 -> 80.12.97.161 TCP 66 52640 > http [ACK] Seq=354 Ack=23844 Win=61056 Len=0 TSval=44679609 TSecr=3054236791  tcp.stream == 12
136   7.099201 80.12.97.161 -> 216.165.108.217 TCP 1514 [TCP segment of a reassembled PDU]  tcp.stream == 12
137   7.099205 216.165.108.217 -> 80.12.97.161 TCP 66 52640 > http [ACK] Seq=354 Ack=25292 Win=63872 Len=0 TSval=44679609 TSecr=3054236791  tcp.stream == 12
138   7.099330 80.12.97.161 -> 216.165.108.217 TCP 1514 [TCP segment of a reassembled PDU]  tcp.stream == 12
139   7.099335 216.165.108.217 -> 80.12.97.161 TCP 66 52640 > http [ACK] Seq=354 Ack=26740 Win=64128 Len=0 TSval=44679609 TSecr=3054236791  tcp.stream == 12
140   7.099446 80.12.97.161 -> 216.165.108.217 TCP 1514 [TCP segment of a reassembled PDU]  tcp.stream == 12
141   7.099456 216.165.108.217 -> 80.12.97.161 TCP 66 52640 > http [ACK] Seq=354 Ack=28188 Win=64128 Len=0 TSval=44679609 TSecr=3054236791  tcp.stream == 12
142   7.099588 80.12.97.161 -> 216.165.108.217 TCP 1514 [TCP segment of a reassembled PDU]  tcp.stream == 12
143   7.099592 216.165.108.217 -> 80.12.97.161 TCP 66 52640 > http [ACK] Seq=354 Ack=29636 Win=64128 Len=0 TSval=44679610 TSecr=3054236791  tcp.stream == 12
144   7.099696 80.12.97.161 -> 216.165.108.217 TCP 1514 [TCP segment of a reassembled PDU]  tcp.stream == 12
145   7.099700 216.165.108.217 -> 80.12.97.161 TCP 66 52640 > http [ACK] Seq=354 Ack=31084 Win=64128 Len=0 TSval=44679610 TSecr=3054236791  tcp.stream == 12
146   7.099815 80.12.97.161 -> 216.165.108.217 TCP 1514 [TCP segment of a reassembled PDU]  tcp.stream == 12
147   7.099819 216.165.108.217 -> 80.12.97.161 TCP 66 52640 > http [ACK] Seq=354 Ack=32532 Win=64128 Len=0 TSval=44679610 TSecr=3054236791  tcp.stream == 12
148   7.099938 80.12.97.161 -> 216.165.108.217 TCP 1514 [TCP segment of a reassembled PDU]  tcp.stream == 12
149   7.100080 80.12.97.161 -> 216.165.108.217 TCP 1514 [TCP segment of a reassembled PDU]  tcp.stream == 12
150   7.100085 216.165.108.217 -> 80.12.97.161 TCP 66 52640 > http [ACK] Seq=354 Ack=35428 Win=64128 Len=0 TSval=44679610 TSecr=3054236791  tcp.stream == 12
151   7.100499 80.12.97.161 -> 216.165.108.217 TCP 1514 [TCP segment of a reassembled PDU]  tcp.stream == 12
152   7.100636 80.12.97.161 -> 216.165.108.217 TCP 1514 [TCP segment of a reassembled PDU]  tcp.stream == 12
153   7.100642 216.165.108.217 -> 80.12.97.161 TCP 66 52640 > http [ACK] Seq=354 Ack=38324 Win=64128 Len=0 TSval=44679610 TSecr=3054236792  tcp.stream == 12
154   7.100756 80.12.97.161 -> 216.165.108.217 TCP 1602 [TCP segment of a reassembled PDU]  tcp.stream == 12
155   7.100761 216.165.108.217 -> 80.12.97.161 TCP 66 52640 > http [ACK] Seq=354 Ack=39860 Win=64128 Len=0 TSval=44679610 TSecr=3054236792  tcp.stream == 12
156   7.117612 80.12.97.161 -> 216.165.108.217 TCP 1514 [TCP segment of a reassembled PDU]  tcp.stream == 12
157   7.117734 80.12.97.161 -> 216.165.108.217 TCP 1514 [TCP segment of a reassembled PDU]  tcp.stream == 12
158   7.117742 216.165.108.217 -> 80.12.97.161 TCP 66 52640 > http [ACK] Seq=354 Ack=42756 Win=64128 Len=0 TSval=44679614 TSecr=3054236809  tcp.stream == 12
159   7.117856 80.12.97.161 -> 216.165.108.217 TCP 1514 [TCP segment of a reassembled PDU]  tcp.stream == 12
160   7.117978 80.12.97.161 -> 216.165.108.217 TCP 1514 [TCP segment of a reassembled PDU]  tcp.stream == 12
161   7.117983 216.165.108.217 -> 80.12.97.161 TCP 66 52640 > http [ACK] Seq=354 Ack=45652 Win=64128 Len=0 TSval=44679614 TSecr=3054236809  tcp.stream == 12
162   7.118102 80.12.97.161 -> 216.165.108.217 TCP 1514 [TCP segment of a reassembled PDU]  tcp.stream == 12
163   7.118230 80.12.97.161 -> 216.165.108.217 TCP 1514 [TCP segment of a reassembled PDU]  tcp.stream == 12
164   7.118236 216.165.108.217 -> 80.12.97.161 TCP 66 52640 > http [ACK] Seq=354 Ack=48548 Win=64128 Len=0 TSval=44679614 TSecr=3054236809  tcp.stream == 12
165   7.118348 80.12.97.161 -> 216.165.108.217 TCP 1514 [TCP segment of a reassembled PDU]  tcp.stream == 12
166   7.118478 80.12.97.161 -> 216.165.108.217 TCP 1514 [TCP segment of a reassembled PDU]  tcp.stream == 12
167   7.118484 216.165.108.217 -> 80.12.97.161 TCP 66 52640 > http [ACK] Seq=354 Ack=51444 Win=64128 Len=0 TSval=44679614 TSecr=3054236809  tcp.stream == 12
168   7.118594 80.12.97.161 -> 216.165.108.217 TCP 1514 [TCP segment of a reassembled PDU]  tcp.stream == 12
169   7.118721 80.12.97.161 -> 216.165.108.217 TCP 1514 [TCP segment of a reassembled PDU]  tcp.stream == 12
170   7.118727 216.165.108.217 -> 80.12.97.161 TCP 66 52640 > http [ACK] Seq=354 Ack=54340 Win=64128 Len=0 TSval=44679614 TSecr=3054236809  tcp.stream == 12
171   7.118841 80.12.97.161 -> 216.165.108.217 TCP 1514 [TCP segment of a reassembled PDU]  tcp.stream == 12
172   7.118970 80.12.97.161 -> 216.165.108.217 TCP 1514 [TCP segment of a reassembled PDU]  tcp.stream == 12
173   7.118979 216.165.108.217 -> 80.12.97.161 TCP 66 52640 > http [ACK] Seq=354 Ack=57236 Win=64128 Len=0 TSval=44679614 TSecr=3054236809  tcp.stream == 12
174   7.119091 80.12.97.161 -> 216.165.108.217 TCP 1514 [TCP segment of a reassembled PDU]  tcp.stream == 12
175   7.119215 80.12.97.161 -> 216.165.108.217 TCP 1602 [TCP segment of a reassembled PDU]  tcp.stream == 12
176   7.119224 216.165.108.217 -> 80.12.97.161 TCP 66 52640 > http [ACK] Seq=354 Ack=60220 Win=64128 Len=0 TSval=44679614 TSecr=3054236809  tcp.stream == 12
177   7.123197 80.12.97.161 -> 216.165.108.217 TCP 1514 [TCP segment of a reassembled PDU]  tcp.stream == 12
178   7.123287 80.12.97.161 -> 216.165.108.217 TCP 1514 [TCP segment of a reassembled PDU]  tcp.stream == 12
179   7.123295 216.165.108.217 -> 80.12.97.161 TCP 66 52640 > http [ACK] Seq=354 Ack=63116 Win=64128 Len=0 TSval=44679615 TSecr=3054236815  tcp.stream == 12
180   7.123432 80.12.97.161 -> 216.165.108.217 TCP 1514 [TCP segment of a reassembled PDU]  tcp.stream == 12
181   7.123543 80.12.97.161 -> 216.165.108.217 TCP 1514 [TCP segment of a reassembled PDU]  tcp.stream == 12
182   7.123547 216.165.108.217 -> 80.12.97.161 TCP 66 52640 > http [ACK] Seq=354 Ack=66012 Win=64128 Len=0 TSval=44679616 TSecr=3054236815  tcp.stream == 12
183   7.123663 80.12.97.161 -> 216.165.108.217 TCP 1514 [TCP segment of a reassembled PDU]  tcp.stream == 12
184   7.123795 80.12.97.161 -> 216.165.108.217 TCP 1514 [TCP segment of a reassembled PDU]  tcp.stream == 12
185   7.123800 216.165.108.217 -> 80.12.97.161 TCP 66 52640 > http [ACK] Seq=354 Ack=68908 Win=64128 Len=0 TSval=44679616 TSecr=3054236815  tcp.stream == 12
186   7.123906 80.12.97.161 -> 216.165.108.217 TCP 1514 [TCP segment of a reassembled PDU]  tcp.stream == 12
187   7.124034 80.12.97.161 -> 216.165.108.217 TCP 1514 [TCP segment of a reassembled PDU]  tcp.stream == 12
188   7.124038 216.165.108.217 -> 80.12.97.161 TCP 66 52640 > http [ACK] Seq=354 Ack=71804 Win=64128 Len=0 TSval=44679616 TSecr=3054236815  tcp.stream == 12
189   7.124086 80.12.97.161 -> 216.165.108.217 HTTP 698 HTTP/1.1 200 OK  (application/javascript)  tcp.stream == 12
190   7.124145 216.165.108.217 -> 80.12.97.161 TCP 66 52640 > http [ACK] Seq=354 Ack=72436 Win=64128 Len=0 TSval=44679616 TSecr=3054236815  tcp.stream == 12
191   7.175265 202.72.50.129 -> 216.165.108.217 TCP 1597 [TCP segment of a reassembled PDU]  tcp.stream == 6
192   7.175279 216.165.108.217 -> 202.72.50.129 TCP 54 37410 > http [ACK] Seq=300 Ack=5924 Win=26280 Len=0  tcp.stream == 6
193   7.175867 202.72.50.129 -> 216.165.108.217 TCP 1514 [TCP segment of a reassembled PDU]  tcp.stream == 6
194   7.175882 216.165.108.217 -> 202.72.50.129 TCP 54 37410 > http [ACK] Seq=300 Ack=7384 Win=29200 Len=0  tcp.stream == 6
195   7.175989 202.72.50.129 -> 216.165.108.217 TCP 1514 [TCP segment of a reassembled PDU]  tcp.stream == 6
196   7.175993 216.165.108.217 -> 202.72.50.129 TCP 54 37410 > http [ACK] Seq=300 Ack=8844 Win=32120 Len=0  tcp.stream == 6
197   7.176210 202.72.50.129 -> 216.165.108.217 TCP 1514 [TCP segment of a reassembled PDU]  tcp.stream == 6
198   7.176217 216.165.108.217 -> 202.72.50.129 TCP 54 37410 > http [ACK] Seq=300 Ack=10304 Win=35040 Len=0  tcp.stream == 6
199   7.176413 202.72.50.129 -> 216.165.108.217 TCP 1514 [TCP segment of a reassembled PDU]  tcp.stream == 6
200   7.176418 216.165.108.217 -> 202.72.50.129 TCP 54 37410 > http [ACK] Seq=300 Ack=11764 Win=37960 Len=0  tcp.stream == 6
202   7.182756 216.165.108.217 -> 80.12.97.161 HTTP 431 GET /com/js/d/common/plugin/jquery.tmpl-1.0.0.min.js HTTP/1.1   tcp.stream == 12
203   7.182895 216.165.108.217 -> 80.12.97.161 TCP 74 52641 > http [SYN] Seq=0 Win=14600 Len=0 MSS=1460 SACK_PERM=1 TSval=44679630 TSecr=0 WS=128  tcp.stream == 13
204   7.184230 80.12.97.161 -> 216.165.108.217 TCP 74 http > 52641 [SYN, ACK] Seq=0 Ack=1 Win=14480 Len=0 MSS=1460 SACK_PERM=1 TSval=3054236876 TSecr=44679630 WS=4  tcp.stream == 13
205   7.184253 216.165.108.217 -> 80.12.97.161 TCP 66 52641 > http [ACK] Seq=1 Ack=1 Win=14720 Len=0 TSval=44679631 TSecr=3054236876  tcp.stream == 13
206   7.184301 80.12.97.161 -> 216.165.108.217 TCP 66 http > 52640 [ACK] Seq=72436 Ack=719 Win=16624 Len=0 TSval=3054236876 TSecr=44679630  tcp.stream == 12
207   7.184371 216.165.108.217 -> 80.12.97.161 HTTP 421 GET /com/inc/home/20080930/js/swfobject.js HTTP/1.1   tcp.stream == 13
208   7.184939 80.12.97.161 -> 216.165.108.217 TCP 1514 [TCP segment of a reassembled PDU]  tcp.stream == 12
209   7.185045 80.12.97.161 -> 216.165.108.217 TCP 1514 [TCP segment of a reassembled PDU]  tcp.stream == 12
210   7.185056 216.165.108.217 -> 80.12.97.161 TCP 66 52640 > http [ACK] Seq=719 Ack=75332 Win=64896 Len=0 TSval=44679631 TSecr=3054236877  tcp.stream == 12
211   7.185172 80.12.97.161 -> 216.165.108.217 TCP 1514 [TCP segment of a reassembled PDU]  tcp.stream == 12
212   7.185297 80.12.97.161 -> 216.165.108.217 HTTP 2097 HTTP/1.1 200 OK  (application/javascript)  tcp.stream == 12
213   7.185380 216.165.108.217 -> 80.12.97.161 TCP 66 52640 > http [ACK] Seq=719 Ack=78811 Win=65152 Len=0 TSval=44679631 TSecr=3054236877  tcp.stream == 12
214   7.185739 80.12.97.161 -> 216.165.108.217 TCP 66 http > 52641 [ACK] Seq=1 Ack=356 Win=15552 Len=0 TSval=3054236878 TSecr=44679631  tcp.stream == 13
215   7.186454 80.12.97.161 -> 216.165.108.217 TCP 1514 [TCP segment of a reassembled PDU]  tcp.stream == 13
216   7.186466 216.165.108.217 -> 80.12.97.161 TCP 66 52641 > http [ACK] Seq=356 Ack=1449 Win=17536 Len=0 TSval=44679631 TSecr=3054236878  tcp.stream == 13
217   7.186578 80.12.97.161 -> 216.165.108.217 TCP 1514 [TCP segment of a reassembled PDU]  tcp.stream == 13
218   7.186581 216.165.108.217 -> 80.12.97.161 TCP 66 52641 > http [ACK] Seq=356 Ack=2897 Win=20480 Len=0 TSval=44679631 TSecr=3054236878  tcp.stream == 13
219   7.186695 80.12.97.161 -> 216.165.108.217 TCP 1514 [TCP segment of a reassembled PDU]  tcp.stream == 13
220   7.186699 216.165.108.217 -> 80.12.97.161 TCP 66 52641 > http [ACK] Seq=356 Ack=4345 Win=23296 Len=0 TSval=44679631 TSecr=3054236878  tcp.stream == 13
221   7.186821 80.12.97.161 -> 216.165.108.217 TCP 1514 [TCP segment of a reassembled PDU]  tcp.stream == 13
222   7.186825 216.165.108.217 -> 80.12.97.161 TCP 66 52641 > http [ACK] Seq=356 Ack=5793 Win=26240 Len=0 TSval=44679631 TSecr=3054236878  tcp.stream == 13
223   7.187941 80.12.97.161 -> 216.165.108.217 TCP 1514 [TCP segment of a reassembled PDU]  tcp.stream == 13
224   7.187955 216.165.108.217 -> 80.12.97.161 TCP 66 52641 > http [ACK] Seq=356 Ack=7241 Win=29184 Len=0 TSval=44679632 TSecr=3054236880  tcp.stream == 13
225   7.188059 80.12.97.161 -> 216.165.108.217 TCP 1514 [TCP segment of a reassembled PDU]  tcp.stream == 13
226   7.188064 216.165.108.217 -> 80.12.97.161 TCP 66 52641 > http [ACK] Seq=356 Ack=8689 Win=32000 Len=0 TSval=44679632 TSecr=3054236880  tcp.stream == 13
227   7.188206 80.12.97.161 -> 216.165.108.217 HTTP 1403 HTTP/1.1 200 OK  (application/javascript)  tcp.stream == 13
228   7.188211 216.165.108.217 -> 80.12.97.161 TCP 66 52641 > http [ACK] Seq=356 Ack=10026 Win=34944 Len=0 TSval=44679632 TSecr=3054236880  tcp.stream == 13
229   7.203580 202.72.50.129 -> 216.165.108.217 TCP 60 http > 37411 [SYN, ACK] Seq=0 Ack=1 Win=18200 Len=0 MSS=1460  tcp.stream == 7
230   7.203601 216.165.108.217 -> 202.72.50.129 TCP 54 37411 > http [ACK] Seq=1 Ack=1 Win=14600 Len=0  tcp.stream == 7
231   7.203708 216.165.108.217 -> 202.72.50.129 HTTP 436 GET /com/inc/home/20080930/opt/css/normal/common.css?ud=1229 HTTP/1.1   tcp.stream == 7
232   7.204332 202.72.50.129 -> 216.165.108.217 TCP 60 http > 37414 [SYN, ACK] Seq=0 Ack=1 Win=18200 Len=0 MSS=1460  tcp.stream == 10
233   7.204349 216.165.108.217 -> 202.72.50.129 TCP 54 37414 > http [ACK] Seq=1 Ack=1 Win=14600 Len=0  tcp.stream == 10
234   7.204434 216.165.108.217 -> 202.72.50.129 HTTP 434 GET /com/inc/home/20080930/beta/css/liquid/api.css?ud=0226 HTTP/1.1   tcp.stream == 10
235   7.205076 202.72.50.129 -> 216.165.108.217 TCP 60 http > 37412 [SYN, ACK] Seq=0 Ack=1 Win=18200 Len=0 MSS=1460  tcp.stream == 8
236   7.205095 216.165.108.217 -> 202.72.50.129 TCP 54 37412 > http [ACK] Seq=1 Ack=1 Win=14600 Len=0  tcp.stream == 8
237   7.205185 216.165.108.217 -> 202.72.50.129 HTTP 436 GET /com/inc/home/20080930/opt/css/normal/layout.css?ud=0226 HTTP/1.1   tcp.stream == 8
238   7.205441 202.72.50.129 -> 216.165.108.217 TCP 60 http > 37413 [SYN, ACK] Seq=0 Ack=1 Win=18200 Len=0 MSS=1460  tcp.stream == 9
239   7.205452 216.165.108.217 -> 202.72.50.129 TCP 54 37413 > http [ACK] Seq=1 Ack=1 Win=14600 Len=0  tcp.stream == 9
240   7.205455 202.72.50.129 -> 216.165.108.217 TCP 60 http > 37415 [SYN, ACK] Seq=0 Ack=1 Win=18200 Len=0 MSS=1460  tcp.stream == 11
241   7.205458 216.165.108.217 -> 202.72.50.129 TCP 54 37415 > http [ACK] Seq=1 Ack=1 Win=14600 Len=0  tcp.stream == 11
242   7.205531 216.165.108.217 -> 202.72.50.129 HTTP 440 GET /com/inc/home/20080930/opt/css/normal/sidecolumn.css?ud=0226 HTTP/1.1   tcp.stream == 9
243   7.205553 216.165.108.217 -> 202.72.50.129 HTTP 440 GET /com/inc/home/20080930/beta/css/liquid/myrakuten.css?ud=0226 HTTP/1.1   tcp.stream == 11
244   7.365422 202.72.50.129 -> 216.165.108.217 TCP 68 [TCP segment of a reassembled PDU]  tcp.stream == 6
245   7.365444 216.165.108.217 -> 202.72.50.129 TCP 54 37410 > http [ACK] Seq=300 Ack=11778 Win=37960 Len=0  tcp.stream == 6
246   7.365924 202.72.50.129 -> 216.165.108.217 TCP 1514 [TCP segment of a reassembled PDU]  tcp.stream == 6
247   7.365943 216.165.108.217 -> 202.72.50.129 TCP 54 37410 > http [ACK] Seq=300 Ack=13238 Win=40880 Len=0  tcp.stream == 6
248   7.366049 202.72.50.129 -> 216.165.108.217 TCP 1514 [TCP segment of a reassembled PDU]  tcp.stream == 6
249   7.366053 216.165.108.217 -> 202.72.50.129 TCP 54 37410 > http [ACK] Seq=300 Ack=14698 Win=43800 Len=0  tcp.stream == 6
250   7.366354 202.72.50.129 -> 216.165.108.217 TCP 1514 [TCP segment of a reassembled PDU]  tcp.stream == 6
251   7.366365 216.165.108.217 -> 202.72.50.129 TCP 54 37410 > http [ACK] Seq=300 Ack=16158 Win=46720 Len=0  tcp.stream == 6
252   7.366487 202.72.50.129 -> 216.165.108.217 TCP 1528 [TCP segment of a reassembled PDU]  tcp.stream == 6
253   7.366492 216.165.108.217 -> 202.72.50.129 TCP 54 37410 > http [ACK] Seq=300 Ack=17632 Win=49640 Len=0  tcp.stream == 6
254   7.366609 202.72.50.129 -> 216.165.108.217 TCP 1514 [TCP segment of a reassembled PDU]  tcp.stream == 6
255   7.366614 216.165.108.217 -> 202.72.50.129 TCP 54 37410 > http [ACK] Seq=300 Ack=19092 Win=52560 Len=0  tcp.stream == 6
256   7.366761 202.72.50.129 -> 216.165.108.217 TCP 1514 [TCP segment of a reassembled PDU]  tcp.stream == 6
257   7.366767 216.165.108.217 -> 202.72.50.129 TCP 54 37410 > http [ACK] Seq=300 Ack=20552 Win=55480 Len=0  tcp.stream == 6
258   7.366900 202.72.50.129 -> 216.165.108.217 TCP 1514 [TCP segment of a reassembled PDU]  tcp.stream == 6
259   7.366906 216.165.108.217 -> 202.72.50.129 TCP 54 37410 > http [ACK] Seq=300 Ack=22012 Win=58400 Len=0  tcp.stream == 6
260   7.367014 202.72.50.129 -> 216.165.108.217 TCP 1528 [TCP segment of a reassembled PDU]  tcp.stream == 6
261   7.367020 216.165.108.217 -> 202.72.50.129 TCP 54 37410 > http [ACK] Seq=300 Ack=23486 Win=61320 Len=0  tcp.stream == 6
262   7.367136 202.72.50.129 -> 216.165.108.217 TCP 1514 [TCP segment of a reassembled PDU]  tcp.stream == 6
263   7.367141 216.165.108.217 -> 202.72.50.129 TCP 54 37410 > http [ACK] Seq=300 Ack=24946 Win=62780 Len=0  tcp.stream == 6
264   7.367260 202.72.50.129 -> 216.165.108.217 TCP 1514 [TCP segment of a reassembled PDU]  tcp.stream == 6
265   7.367265 216.165.108.217 -> 202.72.50.129 TCP 54 37410 > http [ACK] Seq=300 Ack=26406 Win=62780 Len=0  tcp.stream == 6
266   7.369076 216.165.108.217 -> 80.12.97.161 HTTP 465 GET /com/img/home/beta/201008_newtop/genre/bigtri_02.gif HTTP/1.1   tcp.stream == 12
267   7.369147 216.165.108.217 -> 80.12.97.161 HTTP 429 GET /com/js/d/svc_ashiato/svc_ashiato-1.0.0.min.js HTTP/1.1   tcp.stream == 13
268   7.371728 80.12.97.161 -> 216.165.108.217 TCP 1514 [TCP segment of a reassembled PDU]  tcp.stream == 13
269   7.371749 216.165.108.217 -> 80.12.97.161 TCP 66 52641 > http [ACK] Seq=719 Ack=11474 Win=37888 Len=0 TSval=44679678 TSecr=3054237063  tcp.stream == 13
270   7.371856 80.12.97.161 -> 216.165.108.217 TCP 1514 [TCP segment of a reassembled PDU]  tcp.stream == 13
271   7.371861 216.165.108.217 -> 80.12.97.161 TCP 66 52641 > http [ACK] Seq=719 Ack=12922 Win=40704 Len=0 TSval=44679678 TSecr=3054237063  tcp.stream == 13
272   7.371970 80.12.97.161 -> 216.165.108.217 TCP 1514 [TCP segment of a reassembled PDU]  tcp.stream == 13
273   7.371975 216.165.108.217 -> 80.12.97.161 TCP 66 52641 > http [ACK] Seq=719 Ack=14370 Win=43648 Len=0 TSval=44679678 TSecr=3054237063  tcp.stream == 13
274   7.372026 80.12.97.161 -> 216.165.108.217 HTTP 1213 HTTP/1.1 200 OK  (application/javascript)  tcp.stream == 13
275   7.372031 216.165.108.217 -> 80.12.97.161 TCP 66 52641 > http [ACK] Seq=719 Ack=15517 Win=46464 Len=0 TSval=44679678 TSecr=3054237063  tcp.stream == 13
276   7.373235 80.12.97.161 -> 216.165.108.217 HTTP 426 HTTP/1.1 200 OK  (GIF89a)  tcp.stream == 12
277   7.373296 216.165.108.217 -> 80.12.97.161 TCP 66 52640 > http [ACK] Seq=1118 Ack=79171 Win=65152 Len=0 TSval=44679678 TSecr=3054237065  tcp.stream == 12
278   7.373557 216.165.108.217 -> 80.12.97.161 HTTP 444 GET /com/img/home/beta/201105/t.gif HTTP/1.1   tcp.stream == 12
279   7.373754 216.165.108.217 -> 80.12.97.161 HTTP 479 GET /com/img/thumb/200309/logo/2012/20120216_jack_banners_70x60a_3.gif HTTP/1.1   tcp.stream == 13
280   7.373921 216.165.108.217 -> 80.12.97.161 TCP 74 52642 > http [SYN] Seq=0 Win=14600 Len=0 MSS=1460 SACK_PERM=1 TSval=44679678 TSecr=0 WS=128  tcp.stream == 14
281   7.375206 80.12.97.161 -> 216.165.108.217 TCP 74 http > 52642 [SYN, ACK] Seq=0 Ack=1 Win=14480 Len=0 MSS=1460 SACK_PERM=1 TSval=3054237067 TSecr=44679678 WS=4  tcp.stream == 14
282   7.375226 216.165.108.217 -> 80.12.97.161 TCP 66 52642 > http [ACK] Seq=1 Ack=1 Win=14720 Len=0 TSval=44679678 TSecr=3054237067  tcp.stream == 14
283   7.375387 216.165.108.217 -> 80.12.97.161 HTTP 420 GET /com/js/c/cartnumdisplay-1.0.0.min.js HTTP/1.1   tcp.stream == 14
284   7.376470 80.12.97.161 -> 216.165.108.217 TCP 1514 [TCP segment of a reassembled PDU]  tcp.stream == 13
285   7.376581 80.12.97.161 -> 216.165.108.217 TCP 1514 [TCP segment of a reassembled PDU]  tcp.stream == 13
286   7.376591 216.165.108.217 -> 80.12.97.161 TCP 66 52641 > http [ACK] Seq=1132 Ack=18413 Win=52352 Len=0 TSval=44679679 TSecr=3054237068  tcp.stream == 13
287   7.376708 80.12.97.161 -> 216.165.108.217 TCP 1514 [TCP segment of a reassembled PDU]  tcp.stream == 13
288   7.376840 80.12.97.161 -> 216.165.108.217 TCP 1514 [TCP segment of a reassembled PDU]  tcp.stream == 13
289   7.376845 216.165.108.217 -> 80.12.97.161 TCP 66 52641 > http [ACK] Seq=1132 Ack=21309 Win=58112 Len=0 TSval=44679679 TSecr=3054237068  tcp.stream == 13
290   7.376965 80.12.97.161 -> 216.165.108.217 TCP 1514 [TCP segment of a reassembled PDU]  tcp.stream == 13
291   7.377079 80.12.97.161 -> 216.165.108.217 TCP 1514 [TCP segment of a reassembled PDU]  tcp.stream == 13
292   7.377086 216.165.108.217 -> 80.12.97.161 TCP 66 52641 > http [ACK] Seq=1132 Ack=24205 Win=63872 Len=0 TSval=44679679 TSecr=3054237068  tcp.stream == 13
293   7.377198 80.12.97.161 -> 216.165.108.217 TCP 1514 [TCP segment of a reassembled PDU]  tcp.stream == 13
294   7.377323 80.12.97.161 -> 216.165.108.217 TCP 66 http > 52642 [ACK] Seq=1 Ack=355 Win=15552 Len=0 TSval=3054237069 TSecr=44679678  tcp.stream == 14
295   7.377336 80.12.97.161 -> 216.165.108.217 TCP 1514 [TCP segment of a reassembled PDU]  tcp.stream == 13
296   7.377339 216.165.108.217 -> 80.12.97.161 TCP 66 52641 > http [ACK] Seq=1132 Ack=27101 Win=64128 Len=0 TSval=44679679 TSecr=3054237068  tcp.stream == 13
297   7.378201 80.12.97.161 -> 216.165.108.217 TCP 1514 [TCP segment of a reassembled PDU]  tcp.stream == 13
298   7.378322 80.12.97.161 -> 216.165.108.217 TCP 1514 [TCP segment of a reassembled PDU]  tcp.stream == 13
299   7.378441 80.12.97.161 -> 216.165.108.217 TCP 1514 [TCP segment of a reassembled PDU]  tcp.stream == 13
300   7.378563 80.12.97.161 -> 216.165.108.217 TCP 1514 [TCP segment of a reassembled PDU]  tcp.stream == 13
301   7.378694 80.12.97.161 -> 216.165.108.217 TCP 1514 [TCP segment of a reassembled PDU]  tcp.stream == 13
302   7.378824 80.12.97.161 -> 216.165.108.217 TCP 1514 [TCP segment of a reassembled PDU]  tcp.stream == 13
303   7.378869 80.12.97.161 -> 216.165.108.217 HTTP 940 HTTP/1.1 200 OK  (application/javascript)  tcp.stream == 14
304   7.378876 216.165.108.217 -> 80.12.97.161 TCP 66 52642 > http [ACK] Seq=355 Ack=875 Win=16384 Len=0 TSval=44679679 TSecr=3054237070  tcp.stream == 14
305   7.379007 80.12.97.161 -> 216.165.108.217 TCP 1514 [TCP segment of a reassembled PDU]  tcp.stream == 13
306   7.379138 80.12.97.161 -> 216.165.108.217 TCP 1514 [TCP segment of a reassembled PDU]  tcp.stream == 13
307   7.379261 80.12.97.161 -> 216.165.108.217 HTTP 352 HTTP/1.1 200 OK  (GIF89a)  tcp.stream == 12
308   7.379272 80.12.97.161 -> 216.165.108.217 TCP 1514 [TCP segment of a reassembled PDU]  tcp.stream == 13
309   7.379438 80.12.97.161 -> 216.165.108.217 TCP 1514 [TCP segment of a reassembled PDU]  tcp.stream == 13
310   7.379548 80.12.97.161 -> 216.165.108.217 TCP 1514 [TCP segment of a reassembled PDU]  tcp.stream == 13
311   7.379668 80.12.97.161 -> 216.165.108.217 TCP 1514 [TCP segment of a reassembled PDU]  tcp.stream == 13
312   7.381277 216.165.108.217 -> 80.12.97.161 TCP 66 52641 > http [ACK] Seq=1132 Ack=44477 Win=64128 Len=0 TSval=44679680 TSecr=3054237070  tcp.stream == 13
313   7.382829 80.12.97.161 -> 216.165.108.217 TCP 1514 [TCP segment of a reassembled PDU]  tcp.stream == 13
314   7.382955 80.12.97.161 -> 216.165.108.217 TCP 1514 [TCP segment of a reassembled PDU]  tcp.stream == 13
315   7.382964 216.165.108.217 -> 80.12.97.161 TCP 66 52641 > http [ACK] Seq=1132 Ack=47373 Win=64128 Len=0 TSval=44679680 TSecr=3054237074  tcp.stream == 13
316   7.383067 80.12.97.161 -> 216.165.108.217 TCP 1514 [TCP segment of a reassembled PDU]  tcp.stream == 13
317   7.383199 80.12.97.161 -> 216.165.108.217 TCP 1514 [TCP segment of a reassembled PDU]  tcp.stream == 13
318   7.383205 216.165.108.217 -> 80.12.97.161 TCP 66 52641 > http [ACK] Seq=1132 Ack=50269 Win=64128 Len=0 TSval=44679680 TSecr=3054237074  tcp.stream == 13
319   7.383313 80.12.97.161 -> 216.165.108.217 TCP 1514 [TCP segment of a reassembled PDU]  tcp.stream == 13
320   7.383451 80.12.97.161 -> 216.165.108.217 TCP 1514 [TCP segment of a reassembled PDU]  tcp.stream == 13
321   7.383461 216.165.108.217 -> 80.12.97.161 TCP 66 52641 > http [ACK] Seq=1132 Ack=53165 Win=64128 Len=0 TSval=44679681 TSecr=3054237074  tcp.stream == 13
322   7.383564 80.12.97.161 -> 216.165.108.217 TCP 1514 [TCP segment of a reassembled PDU]  tcp.stream == 13
323   7.383685 80.12.97.161 -> 216.165.108.217 TCP 1514 [TCP segment of a reassembled PDU]  tcp.stream == 13
324   7.383690 216.165.108.217 -> 80.12.97.161 TCP 66 52641 > http [ACK] Seq=1132 Ack=56061 Win=64128 Len=0 TSval=44679681 TSecr=3054237074  tcp.stream == 13
325   7.383790 80.12.97.161 -> 216.165.108.217 HTTP 1199 HTTP/1.1 200 OK  (GIF89a)  tcp.stream == 13
326   7.394865 202.72.50.129 -> 216.165.108.217 TCP 60 http > 37411 [ACK] Seq=1 Ack=383 Win=33198 Len=0  tcp.stream == 7
327   7.396055 202.72.50.129 -> 216.165.108.217 TCP 60 http > 37414 [ACK] Seq=1 Ack=381 Win=33200 Len=0  tcp.stream == 10
328   7.398654 202.72.50.129 -> 216.165.108.217 TCP 60 http > 37412 [ACK] Seq=1 Ack=383 Win=33198 Len=0  tcp.stream == 8
329   7.398969 202.72.50.129 -> 216.165.108.217 TCP 60 http > 37413 [ACK] Seq=1 Ack=387 Win=33580 Len=0  tcp.stream == 9
330   7.399056 202.72.50.129 -> 216.165.108.217 TCP 60 http > 37415 [ACK] Seq=1 Ack=387 Win=33194 Len=0  tcp.stream == 11
331   7.403483 202.72.50.129 -> 216.165.108.217 TCP 1514 [TCP segment of a reassembled PDU]  tcp.stream == 7
332   7.403503 216.165.108.217 -> 202.72.50.129 TCP 54 37411 > http [ACK] Seq=383 Ack=1461 Win=17520 Len=0  tcp.stream == 7
333   7.403696 202.72.50.129 -> 216.165.108.217 TCP 1514 [TCP segment of a reassembled PDU]  tcp.stream == 7
334   7.403703 216.165.108.217 -> 202.72.50.129 TCP 54 37411 > http [ACK] Seq=383 Ack=2921 Win=20440 Len=0  tcp.stream == 7
335   7.403822 202.72.50.129 -> 216.165.108.217 TCP 1514 [TCP segment of a reassembled PDU]  tcp.stream == 7
336   7.403828 216.165.108.217 -> 202.72.50.129 TCP 54 37411 > http [ACK] Seq=383 Ack=4381 Win=23360 Len=0  tcp.stream == 7
337   7.404315 202.72.50.129 -> 216.165.108.217 TCP 1514 [TCP segment of a reassembled PDU]  tcp.stream == 10
338   7.404328 216.165.108.217 -> 202.72.50.129 TCP 54 37414 > http [ACK] Seq=381 Ack=1461 Win=17520 Len=0  tcp.stream == 10
339   7.404429 202.72.50.129 -> 216.165.108.217 TCP 1514 [TCP segment of a reassembled PDU]  tcp.stream == 10
340   7.404432 216.165.108.217 -> 202.72.50.129 TCP 54 37414 > http [ACK] Seq=381 Ack=2921 Win=20440 Len=0  tcp.stream == 10
341   7.404550 202.72.50.129 -> 216.165.108.217 TCP 1514 [TCP segment of a reassembled PDU]  tcp.stream == 10
342   7.404554 216.165.108.217 -> 202.72.50.129 TCP 54 37414 > http [ACK] Seq=381 Ack=4381 Win=23360 Len=0  tcp.stream == 10
343   7.404710 202.72.50.129 -> 216.165.108.217 TCP 1514 [TCP segment of a reassembled PDU]  tcp.stream == 9
344   7.404717 216.165.108.217 -> 202.72.50.129 TCP 54 37413 > http [ACK] Seq=387 Ack=1461 Win=17520 Len=0  tcp.stream == 9
345   7.404895 202.72.50.129 -> 216.165.108.217 TCP 1514 [TCP segment of a reassembled PDU]  tcp.stream == 9
346   7.404900 216.165.108.217 -> 202.72.50.129 TCP 54 37413 > http [ACK] Seq=387 Ack=2921 Win=20440 Len=0  tcp.stream == 9
347   7.405362 202.72.50.129 -> 216.165.108.217 TCP 1514 [TCP segment of a reassembled PDU]  tcp.stream == 9
348   7.405378 216.165.108.217 -> 202.72.50.129 TCP 54 37413 > http [ACK] Seq=387 Ack=4381 Win=23360 Len=0  tcp.stream == 9
349   7.406179 202.72.50.129 -> 216.165.108.217 TCP 1514 [TCP segment of a reassembled PDU]  tcp.stream == 8
350   7.406210 216.165.108.217 -> 202.72.50.129 TCP 54 37412 > http [ACK] Seq=383 Ack=1461 Win=17520 Len=0  tcp.stream == 8
351   7.406259 202.72.50.129 -> 216.165.108.217 TCP 1514 [TCP segment of a reassembled PDU]  tcp.stream == 8
352   7.406263 216.165.108.217 -> 202.72.50.129 TCP 54 37412 > http [ACK] Seq=383 Ack=2921 Win=20440 Len=0  tcp.stream == 8
353   7.406405 202.72.50.129 -> 216.165.108.217 TCP 1514 [TCP segment of a reassembled PDU]  tcp.stream == 8
354   7.406413 216.165.108.217 -> 202.72.50.129 TCP 54 37412 > http [ACK] Seq=383 Ack=4381 Win=23360 Len=0  tcp.stream == 8
355   7.407025 202.72.50.129 -> 216.165.108.217 TCP 1514 [TCP segment of a reassembled PDU]  tcp.stream == 11
356   7.407041 216.165.108.217 -> 202.72.50.129 TCP 54 37415 > http [ACK] Seq=387 Ack=1461 Win=17520 Len=0  tcp.stream == 11
357   7.407141 202.72.50.129 -> 216.165.108.217 TCP 1514 [TCP segment of a reassembled PDU]  tcp.stream == 11
358   7.407145 216.165.108.217 -> 202.72.50.129 TCP 54 37415 > http [ACK] Seq=387 Ack=2921 Win=20440 Len=0  tcp.stream == 11
359   7.407252 202.72.50.129 -> 216.165.108.217 TCP 1514 [TCP segment of a reassembled PDU]  tcp.stream == 11
360   7.407257 216.165.108.217 -> 202.72.50.129 TCP 54 37415 > http [ACK] Seq=387 Ack=4381 Win=23360 Len=0  tcp.stream == 11
362   7.415466 216.165.108.217 -> 80.12.97.161 TCP 66 52640 > http [ACK] Seq=1496 Ack=79457 Win=65152 Len=0 TSval=44679689 TSecr=3054237070  tcp.stream == 12
363   7.423469 216.165.108.217 -> 80.12.97.161 TCP 66 52641 > http [ACK] Seq=1132 Ack=57194 Win=64128 Len=0 TSval=44679691 TSecr=3054237074  tcp.stream == 13
364   7.554566 202.72.50.129 -> 216.165.108.217 TCP 1514 [TCP segment of a reassembled PDU]  tcp.stream == 6
365   7.554583 216.165.108.217 -> 202.72.50.129 TCP 54 37410 > http [ACK] Seq=300 Ack=27866 Win=62780 Len=0  tcp.stream == 6
366   7.555095 202.72.50.129 -> 216.165.108.217 TCP 1528 [TCP segment of a reassembled PDU]  tcp.stream == 6
367   7.555108 216.165.108.217 -> 202.72.50.129 TCP 54 37410 > http [ACK] Seq=300 Ack=29340 Win=62780 Len=0  tcp.stream == 6
368   7.555220 202.72.50.129 -> 216.165.108.217 TCP 1514 [TCP segment of a reassembled PDU]  tcp.stream == 6
369   7.555346 202.72.50.129 -> 216.165.108.217 TCP 1514 [TCP segment of a reassembled PDU]  tcp.stream == 6
370   7.555352 216.165.108.217 -> 202.72.50.129 TCP 54 37410 > http [ACK] Seq=300 Ack=32260 Win=62780 Len=0  tcp.stream == 6
